"Commander Chapel",0,4, 0,0,0,739,76,257,0,0,0,0,0,0,245,149,301,546,99,350,848,0,0,1367,774,817,605,520,117,0,1391,733,1272,522,470,966,0,0,910,577,912,657,249,121,0,925,581,706,380,109,1283,753,"Federation, Starfleet, Human, Physician, Veteran","female, organic, tos, chapel, crew_max_rarity_4","Doctor's Orders",2, 7, 8, 8, 16, 6, 0, , , , 1450, 75, 155, 400, false,"Chapel",crew_portraits_cm_chapel_commander_sm.png,chapel_commander_crew
"Leonardo da Vinci",0,5, 0,0,0,1229,80,228,0,0,0,1092,177,354,0,0,0,366,161,483,415,0,401,0,876,422,29,512,59,415,0,829,455,22,860,1012,0,480,0,217,979,134,1053,61,505,0,226,538,5,282,490,253,"Hologram, Prodigy, Inspiring, Innovator, Civilian, Human, Artist, Cultural Figure, Astrophysicist","male, organic, voy, davinci, crew_max_rarity_5","Poor is the Pupil",2, 6, 6, 8, 8, 6, 0, 2, , , 1815, 330, 83, 175, false,"Leonardo",crew_portraits_cm_davinci_sm.png,davinci_crew
"Mirror Reed",0,5, 983,151,362,0,0,0,1215,256,560,0,0,0,0,0,0,0,0,0,575,55,510,779,387,254,0,0,0,257,452,152,0,0,0,574,49,499,756,403,155,0,0,0,170,279,107,0,0,0,787,491,"Terran Empire, Human, Brutal, MACO, Marksman, Starfleet, Mirror Universe","male, organic, ent, reed, crew_max_rarity_5","Extreme Punishment",0, 9, 12, 5, 10, 1, 0, 2, , , 555, 210, 147, 350, false,"Reed",crew_portraits_cm_reed_mirror_sm.png,reed_mirror_crew
"Mirror Jean-Luc Picard",0,5, 1042,243,753,583,21,88,982,198,439,0,0,0,0,0,0,0,0,0,97,65,317,585,217,109,831,1112,680,447,713,323,0,0,0,36,11,53,177,37,210,1064,1370,880,333,513,223,0,0,0,355,92,"Human, Terran Empire, Starfleet, Brutal, Crafty, Maverick, Veteran, Resourceful, Duelist, Mirror Universe","male, organic, tng, picard, crew_max_rarity_5","Power Grab",1, 9, 8, 6, 12, 8, 4, , , , 750, 330, 120, 400, false,"Picard",crew_portraits_cm_picard_mirror_sm.png,picard_mirror_crew
"Mirror Jadzia Dax",0,4, 0,0,0,314,67,167,958,137,274,500,118,269,0,0,0,0,0,0,1340,775,997,0,0,294,535,1324,848,153,879,482,1020,590,0,1209,876,783,0,0,329,288,1189,724,185,1009,630,843,449,0,1161,1085,"Trill, Terran Rebellion, Casual, Desperate, Romantic, Mirror Universe","nonhuman, female, organic, ds9, dax, crew_max_rarity_4","It's about time you came back",1, 5, 8, 10, 12, 4, 0, , , , 800, 215, 150, 425, true,"J. Dax",crew_portraits_cm_jadzia_mirror_sm.png,dax_jadzia_mirror_crew
"Mirror Vic Fontaine",0,4, 0,0,0,0,0,0,845,142,312,0,0,0,483,180,379,0,0,0,0,848,0,1104,0,741,0,975,0,684,272,557,948,0,788,0,804,0,719,0,680,0,564,0,631,138,536,494,0,419,1405,1130,"Desperate, Human, Survivalist, Artist, Musician, Marksman, Mirror Universe, Terran Rebellion","male, nonhuman, artificial_life, ds9, vicfontaine, crew_max_rarity_4","I'll See You In Hell First!",2, 8, 8, 8, 10, , , , , , 605, 245, 167, 425, false,"Vic",crew_portraits_cm_vicfontaine_mirror_sm.png,vic_mirror_crew
"Mirror Data",0,5, 0,0,0,598,45,121,967,143,292,1141,163,367,0,0,0,0,0,0,1046,741,371,0,0,125,101,1047,610,57,843,441,427,161,0,1334,847,482,0,0,409,218,1316,850,85,969,600,539,238,0,657,890,"Mirror Universe, Android, Terran Empire, Starfleet, Resourceful, Saboteur","nonhuman, male, artificial_life, data, crew_max_rarity_5","Explosive Decompression Achieved",0, 8, 10, 10, 12, 5, 0, , , , 555, 100, 171, 400, false,"Data",crew_portraits_cm_data_mirror_sm.png,data_mirror_crew
"Temporal Agent Daniels",0,5, 508,39,117,1238,118,376,0,0,0,947,116,230,0,0,0,0,0,0,106,1180,199,1272,1010,388,47,471,213,666,0,0,727,352,0,345,1295,535,1391,1156,609,136,691,360,836,0,0,929,504,0,711,1169,"Human, Starfleet, Federation, Temporal Agent, Undercover Operative","male, organic, ent, daniels, crew_max_rarity_5","Protect the Timeline",2, 9, 12, 10, 14, 7, 4, , , , 500, 360, 140, 560, false,"Daniels",crew_portraits_cm_daniels_temporal_sm.png,daniels_temporal_crew
"Jannar",0,4, 0,0,0,743,40,109,0,0,0,372,72,212,799,171,340,0,0,0,907,0,1160,941,0,866,343,236,512,1094,989,0,340,743,632,1355,0,1025,767,0,1343,537,402,859,948,767,0,167,616,472,1078,1241,"Counselor, Diplomat, Xindi, Investigator","male, nonhuman, organic, ent, jannar, exclusive_voyage, crew_max_rarity_4","Better Their World Than Ours",2, 4, 6, 4, 18, 1, 0, , , , 450, 200, 55, 340, true,"Jannar",crew_portraits_cm_jannar_sm.png,jannar_crew
"The Clown",0,4, 0,0,0,0,0,0,909,58,139,716,27,99,452,59,129,0,0,0,0,878,885,1286,0,772,683,1220,0,172,526,593,471,516,1030,0,1252,1301,1362,0,1270,1055,1282,0,864,1047,1031,988,835,1091,1107,1538,"Brutal, Costumed, Desperate, Scoundrel, Villain","male, artificial_life, voy, nonhuman, clown, exclusive_voyage, crew_max_rarity_4","Why Talk, When We Can Dance?",1, 9, 4, 8, 10, 3, 0, 2, , , 400, 200, 130, 355, false,"Clown",crew_portraits_cm_clown_sm.png,clown_crew
"Thot Gor",0,4, 688,178,406,0,0,0,350,114,223,0,0,0,544,83,168,0,0,0,824,551,752,498,616,1215,0,1067,0,1083,865,970,1043,0,873,470,231,396,321,311,901,0,1156,0,841,656,752,1135,0,966,1269,828,"Breen, Diplomat, Dominion, Resourceful, Communicator","organic, nonhuman, evsuit, ds9, gor, exclusive_voyage, crew_max_rarity_4","Breen Dominance",0, 9, 10, 20, 10, , , 1, , , 775, 335, 65, 300, false,"Gor",crew_portraits_cm_thot_gor_sm.png,thot_gor_crew
"Lucien",0,4, 349,92,224,546,149,314,0,0,0,0,0,0,628,244,491,0,0,0,540,1212,1164,611,1042,912,684,280,545,0,1031,0,821,0,673,195,1024,930,149,812,675,459,27,397,0,364,0,230,0,193,1184,220,"Crafty, Cultural Figure, Explorer, Resourceful, Playful","male, organic, tas, nonhuman, lucien, exclusive_voyage, crew_max_rarity_4","Can't You Do Anything Right?",1, 7, 5, 8, 10, , , , , , 450, 285, 114, 590, false,"Lucien",crew_portraits_cm_lucien_sm.png,lucien_crew
"Mirror Beverly Crusher",0,5, 0,0,0,571,47,103,0,0,0,0,0,0,980,70,136,1067,225,603,1112,0,0,916,232,1091,816,284,58,0,955,250,739,141,39,1353,0,0,1329,85,1342,1032,950,56,0,1379,106,1240,43,69,695,833,"Human, Starfleet, Mirror Universe, Terran Empire, Physician, Caregiver, Neurologist, Geneticist","female, organic, tng, crusher, crew_max_rarity_5","Get Back In The Fight",1, 8, 20, 12, 10, 2, 0, 1, , , 300, 115, 242, 500, false,"Crusher",crew_portraits_cm_crusher_mirror_sm.png,crusher_mirror_crew
"Mirror Mayweather",0,4, 416,33,101,0,0,0,853,125,268,656,82,177,0,0,0,0,0,0,1265,531,483,1332,1072,752,678,0,0,161,975,568,933,514,0,1364,677,769,1412,1173,793,808,0,0,312,1037,656,1112,671,0,1128,1394,"Human, Starfleet, Mirror Universe, Terran Empire, MACO, Marksman, Brutal","male, organic, ent, mayweather, crew_max_rarity_4","Clean Up This Mess",0, 9, 10, 10, 8, , , , , , 400, 265, 267, 290, false,"Mayweather",crew_portraits_cm_mayweather_mirror_sm.png,mayweather_mirror_crew
"Ripper",0,5, 0,0,0,852,195,430,1332,182,366,0,0,0,0,0,0,0,0,0,691,471,0,0,0,27,498,733,381,273,459,163,0,0,0,393,649,0,0,0,28,284,454,223,471,707,361,0,0,0,808,840,"Brutal, Desperate, Explorer, Primal, Survivalist, Tardigrade","organic, dsc, nonhuman, ripper, crew_max_rarity_5","Mycelial Mastery",1, 9, 10, 12, 12, , , , , , 675, 250, 105, 325, false,"Ripper",crew_portraits_cm_tardigrade_sm.png,dsc_tardigrade_crew
"Satan's Robot",0,5, 0,0,0,571,59,123,852,134,273,1142,176,420,0,0,0,0,0,0,1088,857,360,0,0,156,99,1077,639,61,972,563,418,157,0,1317,883,390,0,0,444,167,1295,836,74,1017,634,429,168,0,720,823,"Hologram, Villain, Duelist","nonhuman, male, voy, artificial_life, satans_robot, crew_max_rarity_5","Citizen Of Earth, Surrender!",1, 8, 18, 8, 10, 2, 0, 2, , , 350, 100, 190, 100, false,"Satan's Robot",crew_portraits_cm_satans_robot_sm.png,satans_robot_crew
"Torchbearer Voq",0,4, 484,193,456,0,0,0,502,53,131,0,0,0,831,152,317,0,0,0,924,577,857,338,733,1162,0,816,0,1043,425,929,763,0,623,330,312,278,93,193,1297,0,730,0,1137,484,1043,643,0,548,995,570,"Klingon, Cultural Figure, Desperate, Inspiring","nonhuman, male, tyler, voq, organic, dsc, crew_max_rarity_4","Demonstration of Faith",2, 7, 12, 5, 12, 1, 0, , , , 935, 150, 214, 190, false,"Voq",crew_portraits_cm_voq_sm.png,dsc_voq_torchbearer_crew
"Florist Q",0,3, 0,0,0,293,71,221,0,0,0,0,0,0,536,88,198,0,0,0,1333,0,0,1173,0,1324,1029,778,845,0,1209,0,1026,0,859,1057,0,0,1177,0,1030,748,534,622,0,1224,0,1057,0,901,1541,1514,"Crafty, Scoundrel, Costumed, Romantic, Q Continuum, Playful","male, nonhuman, tng, q_jdl, crew_max_rarity_3","Special Delivery",2, 3, 8, 3, 8, 1, 1, , , , 855, 155, 125, 380, false,"Q",crew_portraits_cm_q_florist_sm.png,q_florist_crew
"Prisoner Michael Burnham",0,2, 0,0,0,380,30,142,262,20,53,0,0,0,121,42,104,0,0,0,1292,1325,0,1460,0,915,986,1088,825,1206,1361,1105,1392,0,1199,1327,1343,0,1405,0,1133,1013,1023,843,1219,1356,1121,1323,0,1139,1582,1599,"Federation, Starfleet, Prisoner, Xenoanthropology, Duelist, Human","female, organic, dsc, burnham, crew_max_rarity_2","Improvised Assault",2, 3, 6, 10, 10, , , , , , 190, 220, 93, 260, false,"Burnham",crew_portraits_cm_burnham_prisoner_sm.png,dsc_burnham_prisoner_crew
"Graduation Michael Burnham",0,4, 0,0,0,884,180,497,0,0,0,694,65,178,0,0,0,0,0,0,602,0,849,0,0,569,106,649,335,806,0,0,918,487,0,307,0,1129,0,0,292,90,383,188,1021,0,0,1146,701,0,1334,1279,"Federation, Civilian, Astrophysicist, Xenoanthropology, Human, Festive","female, organic, dsc, burnham, crew_max_rarity_4","Lofty Expectations",2, 9, 8, 8, 10, , , 2, , , 500, 100, 280, 200, false,"Burnham",crew_portraits_cm_burnham_vulcan_graduate_sm.png,dsc_burnham_graduation_crew
"Tourist Quark",0,4, 325,45,113,0,0,0,0,0,0,0,0,0,810,168,393,637,109,244,1357,1303,1287,610,408,0,0,794,518,0,958,686,741,477,98,1339,1291,1262,455,422,0,0,561,518,0,697,735,493,490,106,1144,995,"Ferengi, Scoundrel, Desperate, Romantic, Gambler, Communicator, Civilian","nonhuman, male, organic, ds9, quark, crew_max_rarity_4","Risan Rituals",0, 6, 12, 8, 20, 2, 0, , , , 400, 100, 165, 665, false,"Quark",crew_portraits_cm_quark_jamaharon_sm.png,quark_risa_crew
"Mariachi Q",0,5, 0,0,0,0,0,0,957,170,361,0,0,0,1110,257,537,0,0,0,0,693,0,604,0,547,0,463,0,505,52,374,381,0,327,0,671,0,371,0,525,0,235,0,503,33,392,169,0,161,822,522,"Crafty, Costumed, Scoundrel, Musician, Q Continuum, Playful, Festive","nonhuman, male, tng, q_jdl, crew_max_rarity_5","I Feel Like Celebrating!",1, 8, 8, 10, 10, 3, 0, 2, , , 450, 75, 105, 665, false,"Q",crew_portraits_cm_q_mariachi_sm.png,q_mariachi_crew
"Vengeful L'Rell",0,5, 0,0,0,0,0,0,1047,132,230,0,0,0,1118,190,380,0,0,0,0,686,0,652,0,534,0,504,0,494,69,365,421,0,355,0,948,0,707,0,841,0,547,0,788,182,698,479,0,406,843,1256,"Klingon, Brutal, Villain, Interrogator, Vengeful","nonhuman, organic, female, dsc, lrell, crew_max_rarity_5","Choose Your Pain",0, 10, 10, 14, 12, , , 2, , , 575, 225, 58, 525, false,"L'Rell",crew_portraits_cm_lrell_sm.png,dsc_lrell_mekleth_crew
"Gladiator McCoy",0,5, 0,0,0,0,0,0,1246,180,362,0,0,0,0,0,0,759,270,675,0,541,0,0,410,357,0,0,332,336,559,10,0,255,480,0,654,0,0,46,509,0,0,65,487,718,8,0,24,98,818,243,"Federation, Starfleet, Human, Physician, Desperate, Duelist, Athlete, Prisoner","male, organic, tos, mccoy, crew_max_rarity_5","Let The Games Begin!",0, 9, 6, 8, 12, , , , , , 615, 140, 100, 530, false,"McCoy",crew_portraits_cm_mccoy_gladiator_sm.png,mccoy_gladiator_crew
"Duelist Yar",0,4, 407,16,37,0,0,0,657,292,603,0,0,0,474,103,336,0,0,0,1329,536,1259,895,1142,721,0,1042,0,668,297,539,1011,0,842,1407,217,1348,801,1223,115,0,823,0,121,31,79,746,0,640,1222,379,"Human, Starfleet, Duelist, Federation, Tactician, Desperate, Survivalist, Athlete","female, organic, tng, yar, crew_max_rarity_4","Impressive Skill",1, 6, 10, 6, 12, 7, 1, , , , 580, 265, 187, 200, false,"Yar",crew_portraits_cm_yar_glavin_duel_sm.png,yar_glavin_crew
"Tsunkatse Seven",0,4, 679,124,299,282,92,230,850,150,301,0,0,0,0,0,0,0,0,0,472,271,780,988,640,365,1025,1317,843,681,957,551,0,0,0,218,274,704,941,606,191,675,1019,566,646,907,552,0,0,0,1041,794,"Human, Borg, Brutal, Duelist, Athlete, Federation, Civilian, Prisoner","nonhuman, female, organic, voy, seven, crew_max_rarity_4","Hunt It Down And Kill It",0, 8, 8, 6, 6, , , , , , 400, 200, 110, 525, false,"Seven",crew_portraits_cm_seven_tsunkatse_sm.png,seven_tsunkatse_crew
"EV Suit Archer",0,5, 1210,141,431,0,0,0,882,139,296,527,20,53,0,0,0,0,0,0,372,135,86,606,225,713,916,0,0,224,937,531,1208,731,0,492,181,286,695,333,742,1078,0,0,533,967,599,1392,857,0,715,965,"Human, Starfleet, Pilot, Explorer, Desperate, Jury Rigger, Hero","male, evsuit, organic, ent, archer, crew_max_rarity_5","Now You See Me...",0, 7, 8, 10, 10, , , , , , 575, 225, 189, 290, false,"Archer",crew_portraits_cm_archer_ev_suit_sm.png,archer_ev_suit_crew
"Dr. Gillian Taylor",0,4, 0,0,0,636,236,501,0,0,0,0,0,0,302,71,161,447,187,471,816,0,0,1398,776,789,588,500,103,0,1434,734,1325,523,529,237,0,0,1278,202,229,186,129,8,0,1328,206,1178,108,117,1261,162,"Federation, Starfleet, Human, Physician","female, organic, tos, gillian, crew_max_rarity_4","Sea Shepherd",1, 9, 6, 6, 12, , , 3, , , 650, 230, 95, 500, false,"Dr. Taylor",crew_portraits_cm_taylor_sm.png,gillian_taylor_crew
"Protomorphosis Barclay",0,5, 0,0,0,1169,233,453,488,101,203,1125,43,112,0,0,0,0,0,0,369,1132,562,0,0,71,35,461,211,160,1250,881,605,274,0,295,1049,1272,0,0,78,135,368,179,614,1177,821,1311,820,0,572,872,"Starfleet, Federation, Innovator, Astrophysicist, Desperate, Primal, Human, Compromised","male, organic, tng, barclay, crew_max_rarity_5","Viral Attack",0, 8, 10, 12, 10, , , , , , 575, 300, 70, 225, false,"Barclay",crew_portraits_cm_barclay_protomorphosis_sm.png,barclay_genesis_crew
"Captain Lorian",0,5, 835,157,390,0,0,0,450,136,284,1259,159,399,0,0,0,0,0,0,740,358,31,906,536,1059,288,0,0,91,1230,853,368,123,0,517,201,22,724,350,759,361,0,0,82,993,620,499,209,0,637,203,"Vulcan, Human, Jury Rigger, Desperate, Saboteur, Telepath","male, nonhuman, organic, ent, lorian, crew_max_rarity_5","There's Too Much At Stake",1, 10, 18, 6, 6, 4, 0, , , , 600, 245, 60, 300, false,"Lorian",crew_portraits_cm_lorian_sm.png,lorian_captain_crew
"Celebratory Ash Tyler",0,4, 649,99,164,0,0,0,484,23,45,0,0,0,814,155,322,0,0,0,944,646,875,358,761,1209,0,826,0,1079,519,965,774,0,634,1099,992,1057,434,933,1398,0,708,0,1220,717,1122,625,0,527,1094,1368,"Human, Federation, Starfleet, Tactician, Marksman, Pilot, Romantic, Klingon, Festive","male, organic, dsc, tyler, voq, crew_max_rarity_4","I'm not going anywhere",0, 7, 10, 10, 10, 4, 2, , , , 450, 50, 123, 540, false,"Tyler",crew_portraits_cm_dsc_tyler_celebration_sm.png,dsc_tyler_celebration_crew
"Dress Uniform Scotty",0,5, 852,199,458,0,0,0,0,0,0,1274,120,336,0,0,0,0,0,0,659,774,30,848,471,0,295,0,0,364,0,0,390,135,0,319,480,19,538,188,0,476,0,0,639,0,0,682,333,0,834,902,"Human, Starfleet, Federation, Jury Rigger, Communicator, Festive","male, organic, tos, scott, crew_max_rarity_5","Call me Scotty",1, 8, 15, 12, 20, 2, 0, , 2, 2, 425, 330, 315, 415, false,"Scotty",crew_portraits_cm_scott_dress_uniform_sm.png,scott_dress_uniform_crew
"Lieutenant Tarah",0,4, 0,0,0,0,0,0,885,133,310,0,0,0,439,219,445,0,0,0,0,827,0,1100,0,704,0,969,0,657,256,527,942,0,783,0,830,0,541,0,722,0,392,0,677,86,582,304,0,255,1390,930,"Andorian, Imperial Guard, Saboteur, Brutal, Marksman","nonhuman, female, organic, ent, tarah, crew_max_rarity_4","I'll See To It Myself",0, 8, 4, 8, 14, , , , 2, 2, 725, 200, 115, 445, false,"Tarah",crew_portraits_cm_tarah_lieutenant_sm.png,tarah_lieutenant_crew
"Prisoner Katrina Cornwell",0,5, 0,0,0,0,0,0,594,52,118,0,0,0,1049,129,286,1186,163,481,0,1074,0,765,221,1016,0,615,210,920,227,33,525,128,24,0,1283,0,961,219,1318,0,863,205,1151,662,110,796,118,59,398,755,"Starfleet, Federation, Counselor, Human, Desperate, Diplomat, Prisoner","female, organic, dsc, cornwell, crew_max_rarity_5","Why Should I Trust You?",2, 9, 8, 5, 14, 8, 4, , , , 525, 230, 165, 425, false,"Cornwell",crew_portraits_cm_dsc_cornwell_prisoner_sm.png,dsc_cornwell_prisoner_crew
"Away Team Saru",0,5, 543,30,110,1195,155,397,1087,74,149,0,0,0,0,0,0,0,0,0,104,330,1112,1258,989,32,301,476,221,520,796,389,0,0,0,287,942,1289,1406,1169,194,371,587,302,1063,1341,966,0,0,0,618,1280,"Kelpien, Federation, Starfleet, Exobiology, Explorer, Desperate, Communicator","male, nonhuman, organic, dsc, saru, crew_max_rarity_5","A Moment Without Fear",0, 9, 8, 8, 10, , , , , , 475, , 150, 600, false,"Saru",crew_portraits_cm_saru_away_team_sm.png,dsc_saru_away_team_crew
"Expedition Shran",0,3, 251,17,65,0,0,0,362,97,209,0,0,0,552,87,179,0,0,0,1392,962,1325,970,1204,1218,0,1043,0,1085,834,973,1016,0,845,1397,911,1336,1064,1214,971,0,1117,0,895,680,812,1091,0,926,1486,1473,"Andorian, Tactician, Survivalist, Explorer, Investigator, Imperial Guard","nonhuman, male, organic, ent, shran, crew_max_rarity_3","Ice Forges Real Strength",0, 4, 8, 8, 8, 4, 1, , , , 420, 240, 80, 470, false,"Shran",crew_portraits_cm_shran_subzero_sm.png,shran_expedition_crew
"Commander Thelin",0,4, 594,102,243,837,96,217,222,135,295,0,0,0,0,0,0,0,0,0,197,737,895,1098,779,415,587,865,461,1163,1420,1056,0,0,0,328,373,870,1065,751,215,696,1036,582,692,978,608,0,0,0,1246,960,"Andorian, Tactician, Explorer, Starfleet, Federation","nonhuman, male, organic, tas, thelin, crew_max_rarity_4","Target Acquired",2, 7, 10, 8, 12, 7, 0, , , , 500, 145, 70, 475, false,"Thelin",crew_portraits_cm_thelin_sm.png,thelin_crew
"Ambassador Shras",0,4, 638,76,189,0,0,0,372,52,110,0,0,0,929,55,112,0,0,0,953,697,888,395,769,1306,0,847,0,1139,590,1035,794,0,655,1093,855,1053,929,927,1329,0,1311,0,1159,1131,1065,1295,0,1116,1204,1506,"Andorian, Communicator, Federation, Diplomat, Civilian, Ambassador","nonhuman, male, organic, tos, shras, crew_max_rarity_4","We Are A Violent Race",0, 9, 8, 10, 10, , , , , , 650, 195, 140, 375, false,"Shras",crew_portraits_cm_shras_sm.png,shras_ambassador_crew
"Desert Michael Burnham",0,2, 0,0,0,355,78,204,0,0,0,0,0,0,275,24,77,0,0,0,1256,0,0,1425,0,1257,944,939,788,0,1450,0,1355,0,1166,1072,0,0,1443,0,1048,764,912,635,0,1469,0,1369,0,1176,1603,1602,"Federation, Starfleet, Explorer, Xenoanthropology, Human","female, organic, dsc, burnham, crew_max_rarity_2","A Storm is Coming",1, 4, 10, 10, 12, , , , , , 290, 150, 60, 165, false,"Burnham",crew_portraits_cm_burnham_desert_sm.png,dsc_burnham_desert_crew
"Prospect Michael Burnham",0,4, 0,0,0,839,137,382,0,0,0,661,50,143,334,86,174,0,0,0,755,0,906,1372,0,733,144,424,422,859,1393,0,574,529,1101,584,0,1231,1225,0,561,207,257,330,1130,1265,0,700,790,945,1145,1216,"Federation, Civilian, Astrophysicist, Xenoanthropology, Human","female, organic, dsc, burnham, crew_max_rarity_4","Respect Is Earned",1, 5, 8, 8, 10, 8, 4, , , , 500, 130, 150, 350, false,"Burnham",crew_portraits_cm_burnham_prospect_sm.png,dsc_burnham_prospect_crew
"Suus Mahna Sarek",0,5, 0,0,0,389,55,145,1092,246,525,0,0,0,917,155,306,0,0,0,1263,554,0,875,0,105,955,346,797,362,70,246,677,0,566,1291,377,0,868,0,83,965,400,805,200,48,129,666,0,568,735,307,"Vulcan, Diplomat, Desperate, Brutal, Cultural Figure, Communicator, Federation, Telepath, Ambassador","nonhuman, male, organic, sarek, dsc, crew_max_rarity_5","This Is My Mind",1, 7, 10, 8, 12, 1, 0, 2, , , 475, 255, 170, 250, false,"Sarek",crew_portraits_cm_sarek_suus_mahna_sm.png,dsc_sarek_suus_mahna_crew
"Tora Ziyal",0,5, 0,0,0,0,0,0,0,0,0,0,0,0,1147,197,429,849,192,505,0,0,0,632,447,0,0,484,353,0,604,454,407,276,35,0,0,0,606,170,0,0,445,173,0,541,179,363,89,13,841,556,"Cardassian, Bajoran, Romantic, Civilian, Artist","female, nonhuman, organic, ds9, tora, crew_max_rarity_5","Never Doubt",1, 8, 10, 10, 12, , , , , , 650, 170, 170, 490, false,"Ziyal",crew_portraits_cm_tora_ziyal_sm.png,ziyal_tora_crew
"Commander Ellen Landry",0,4, 534,69,238,347,57,111,600,254,669,0,0,0,0,0,0,0,0,0,728,367,986,1160,851,385,1031,1323,846,693,982,572,0,0,0,663,70,954,1124,836,41,1019,1314,848,104,185,66,0,0,0,1259,352,"Human, Starfleet, Federation, Tactician, Brutal, Marksman","female, organic, dsc, landry, crew_max_rarity_4","Stick to Logic",0, 8, 6, 4, 8, , , , , , 650, 345, 220, 300, false,"Landry",crew_portraits_cm_landry_sm.png,dsc_landry_commander_crew
"Lissan",0,5, 876,269,542,0,0,0,0,0,0,0,0,0,1144,267,541,0,0,0,538,663,466,73,350,0,0,435,0,0,551,0,356,0,296,161,337,129,8,86,0,0,223,0,0,302,0,156,0,151,797,155,"Andorian, Aenar, Diplomat, Telepath, Civilian, Communicator","nonhuman, female, organic, ent, lissan, crew_max_rarity_5","You Have An Interesting Mind",1, 7, 10, 12, 8, 6, 2, , , , 590, 225, 65, 540, false,"Lissan",crew_portraits_cm_lissan_sm.png,lissan_crew
"Time Loop Mudd",0,4, 0,0,0,0,0,0,708,31,62,711,158,379,315,125,257,0,0,0,0,1000,755,1312,0,913,594,1244,0,192,746,730,401,422,1054,0,1330,474,1003,0,1388,381,908,0,347,835,1110,88,233,724,1217,1142,"Human, Civilian, Scoundrel, Crafty, Smuggler, Resourceful, Survivalist, Federation, Playful","male, evsuit, organic, dsc, mudd, crew_max_rarity_4","All The Time In The World!",2, 6, 12, 10, 10, 4, 0, , , , 450, 185, 100, 475, false,"Mudd",crew_portraits_cm_harry_mudd_takeover_sm.png,dsc_mudd_takeover_crew
"Mirror Shukar",0,5, 0,0,0,439,102,278,1042,269,623,0,0,0,903,184,378,0,0,0,1159,552,0,844,0,75,866,261,710,356,61,242,631,0,532,871,259,0,715,0,22,590,145,491,122,12,81,488,0,414,626,76,"Andorian, Desperate, Veteran, Civilian, Mirror Universe","nonhuman, male, organic, dsc, shukar, crew_max_rarity_5","The Will Of Andoria",1, 7, 10, 8, 12, 7, 0, , , , 375, 195, 70, 430, false,"Shukar",crew_portraits_cm_shukar_sm.png,dsc_shukar_mirror_crew
"The Caretaker",0,5, 0,0,0,878,187,495,0,0,0,964,335,817,0,0,0,452,122,378,613,0,326,0,836,579,32,656,83,350,0,804,373,19,832,301,0,14,0,448,283,2,375,23,26,0,455,28,1,500,473,22,"Caregiver, Desperate, Explorer, Musician, Nacene, Cultural Figure, Theoretical Engineer","male, organic, voy, nonhuman, caretaker, gauntlet_jackpot, exclusive_gauntlet, crew_max_rarity_5","A Debt of Honor",1, 7, 6, 8, 14, 6, 0, , , , 425, 200, 113, 455, true,"The Caretaker",crew_portraits_cm_caretaker_sm.png,caretaker_crew
"Bajoran Dukat",0,4, 510,208,518,0,0,0,0,0,0,0,0,0,785,202,407,0,0,0,861,930,788,300,651,0,0,799,0,0,963,0,745,0,607,231,418,197,33,133,0,0,472,0,0,588,0,398,0,328,1359,481,"Cardassian, Bajoran, Brutal, Desperate, Veteran, Cultural Figure, Villain, Undercover Operative, Inspiring, Communicator, Spiritual, Vengeful","nonhuman, male, organic, ds9, dukat, crew_max_rarity_4","This Is My Destiny",0, 6, 10, 8, 10, 8, 4, , , , 580, 375, 52, 550, false,"Dukat",crew_portraits_cm_dukat_bajoran_sm.png,dukat_bajoran_crew
"Surgeon Pulaski",0,5, 0,0,0,837,190,545,0,0,0,0,0,0,0,0,0,1289,171,473,634,0,0,0,138,620,453,686,15,0,0,173,0,79,228,239,0,0,0,220,231,190,300,9,0,0,228,0,119,283,799,421,"Federation, Starfleet, Human, Physician","female, organic, tng, pulaski, crew_max_rarity_5","Emergency Procedure",1, 7, 12, 8, 12, 6, 0, , , , 700, 100, 180, 400, false,"Pulaski",crew_portraits_cm_pulaski_surgeon_sm.png,pulaski_surgeon_crew
"Away Team Neelix",0,2, 0,0,0,152,6,26,0,0,0,353,24,80,187,77,240,0,0,0,1408,0,1292,1413,0,1402,911,1235,896,1183,1446,0,963,824,1159,1410,0,1320,1113,0,1402,1045,971,896,1204,1156,0,783,846,822,1594,1565,"Talaxian, Mylean, Resourceful, Survivalist, Chef, Civilian, Communicator, Geologist, Ambassador","nonhuman, male, organic, voy, neelix, crew_max_rarity_2","Genuine Effort",2, 2, 8, 3, 8, 1, 0, , , , 230, 30, 20, 115, false,"Neelix",crew_portraits_cm_neelix_away_team_sm.png,neelix_away_crew
"Resistance Neelix",0,5, 0,0,0,0,0,0,1054,188,381,0,0,0,1154,230,570,0,0,0,0,609,0,574,0,442,0,429,0,411,23,296,350,0,292,0,627,0,361,0,469,0,229,0,442,26,339,162,0,155,782,408,"Civilian, Talaxian, Mylean, Crafty, Saboteur, Smuggler, Undercover Operative, Resourceful, Chef, Ambassador, Courier","nonhuman, male, organic, voy, neelix, crew_max_rarity_5","Vital Information",2, 8, 10, 8, 12, 4, 0, , , , 495, 195, 210, 430, false,"Neelix",crew_portraits_cm_neelix_resistance_sm.png,neelix_resistance_crew
"Victorian Pulaski",0,4, 0,0,0,0,0,0,0,0,0,0,0,0,986,46,111,614,138,321,0,0,0,929,678,0,0,812,500,0,967,671,757,462,95,0,0,0,1395,551,0,0,1325,410,0,1430,545,1309,334,323,1376,1501,"Human, Federation, Starfleet, Physician, Costumed, Crafty","female, organic, tng, pulaski, crew_max_rarity_4","I Give You Credit",1, 6, 12, 10, 18, 2, 0, , , , 600, 315, 127, 290, false,"Pulaski",crew_portraits_cm_pulaski_victorian_sm.png,pulaski_victorian_crew
"Captain Beverly Picard",0,5, 924,165,345,0,0,0,0,0,0,0,0,0,473,119,245,926,303,760,655,770,589,360,10,0,0,1092,228,0,1241,266,1076,152,73,577,692,500,271,1,0,0,933,39,0,1080,31,876,13,7,648,46,"Human, Starfleet, Federation, Physician, Cyberneticist","female, organic, tng, crusher, exclusive_honorhall, crew_max_rarity_5","Not On My Ship!",1, 6, 4, 6, 4, , , , , , 250, 100, 85, 500, true,"Crusher",crew_portraits_cm_crusher_captain_sm.png,crusher_captain_crew
"Xindi Insectoid Councilor",0,5, 0,0,0,1169,64,147,541,111,235,0,0,0,1252,162,332,0,0,0,536,1044,0,603,0,100,398,56,307,885,141,781,380,0,326,1258,972,0,799,0,484,936,338,769,831,262,740,601,0,502,340,1038,"Xindi, Brutal, Diplomat, Desperate","nonhuman, organic, ent, insectoid, crew_max_rarity_5","The Guardians Have Never Lied!",0, 9, 10, 10, 10, , , , 2, 2, 450, 200, 110, 625, false,"Insectoid",crew_portraits_cm_xindi_insectoid_sm.png,xindi_insectoid_counselor_crew
"Martian Quark",0,5, 880,167,369,0,0,0,0,0,0,0,0,0,1249,245,516,0,0,0,701,804,634,88,506,0,0,350,0,0,461,0,262,0,216,532,656,459,40,367,0,0,275,0,0,339,0,203,0,182,810,593,"Ferengi, Scoundrel, Merchant, Resourceful, Gambler, Communicator, Civilian, Smuggler, Desperate, Displaced","nonhuman, male, organic, ds9, quark, crew_max_rarity_5","Stupid Hew-mons",2, 9, 8, 8, 10, , , , , , 275, 140, 137, 650, false,"Quark",crew_portraits_cm_quark_martian_sm.png,quark_martian_crew
"Nurse Faith Garland",0,4, 0,0,0,353,39,113,0,0,0,0,0,0,605,147,315,484,324,747,1337,0,0,1040,603,1328,1032,610,235,0,1095,606,895,406,118,1349,0,0,866,26,1339,1030,468,17,0,876,27,665,12,5,1185,133,"Human, Nurse, Romantic, Communicator","female, organic, ds9, garland, crew_max_rarity_4","Imperative Translation",1, 6, 12, 12, 20, 2, 0, , , , 500, 260, 136, 350, false,"Garland",crew_portraits_cm_faith_garland_sm.png,garland_crew
