"Primal Peanut Hamper",0,5, 0,0,0,0,0,0,0,0,0,1104,150,274,541,48,148,1339,208,368,0,0,542,1389,180,0,447,1235,166,527,1425,185,190,2,67,0,0,850,1538,401,0,639,1419,325,814,1581,389,440,20,194,377,957,"Saboteur, Automated Unit, Casual, Survivalist, Primal, Physician, Federation","female, nonhuman, low, hamper, crew_max_rarity_5","I Didn't Want To Sound Robotic",1, 7, 10, 12, 8, 2, 0, 2, , , 725, 375, 251, 600, false,"Hamper",crew_portraits_cm_peanut_hamper_primal_sm.png,peanut_hamper_primal_crew, 91.3645, 48.6667, 48.4344, 86.1675, 6, 0, 0, 0
"Base Camp McCoy",0,5, 536,70,168,0,0,0,0,0,0,0,0,0,1388,200,376,1034,150,301,1262,1276,1219,212,57,0,0,375,366,0,442,408,290,282,13,1356,1328,1309,400,195,0,0,613,490,0,767,652,561,457,77,361,835,"Federation, Starfleet, Human, Physician, Casual, Caregiver, Communicator","male, organic, tos, mccoy, crew_max_rarity_5","You Call This Relaxing?",2, 9, 6, 14, 6, 2, 0, , , , 700, 425, 243, 500, false,"McCoy",crew_portraits_cm_mccoy_base_camp_sm.png,mccoy_base_camp_crew, 90.8636, 47.5556, 74.1436, 86.3006, 4, 0, 0, 0
"Fly-Fishing M'Benga",0,4, 0,0,0,674,97,201,0,0,0,0,0,0,386,50,152,860,150,296,1043,0,0,1510,652,978,745,676,96,0,1550,626,1409,437,320,1200,0,0,1528,691,1142,859,759,164,0,1568,670,1428,466,294,1258,1445,"Human, Starfleet, Federation, Physician, Caregiver, Casual, Athlete","male, organic, snw, mbenga, crew_max_rarity_4","What A Beautiful Day",2, 8, 8, 14, 8, 5, 0, , , , 475, 430, 220, 415, false,"M'Benga",crew_portraits_cm_mbenga_flyfishing_sm.png,mbenga_flyfishing_crew, 58.7858, 37.1111, 35.4072, 55.4084, 5, 0, 0, 21.441
"Pascal Fullerton",0,5, 0,0,0,1330,186,424,546,72,168,0,0,0,1061,158,309,0,0,0,335,1261,0,858,0,63,267,52,169,1097,235,943,609,0,496,522,1336,0,987,0,167,356,84,276,1176,435,1047,765,0,624,368,722,"Human, Federation, Politician, Saboteur, Desperate, Crafty, Civilian, Communicator","organic, male, ds9, fullerton, crew_max_rarity_5","Pampered, Spoiled Children",0, 10, 10, 10, 10, , , , , , 150, 300, 55, 175, false,"Pascal",crew_portraits_cm_pascal_fullerton_sm.png,pascal_fullerton_crew, 89.982, 34, 20.4383, 84.678, 3, 0, 0, 0
"Lady Audrey Chapel",0,5, 0,0,0,1070,142,309,0,0,0,0,0,0,536,87,183,1347,188,406,626,0,0,1351,172,583,468,247,7,0,1384,172,1194,85,63,880,0,0,1367,381,820,612,357,49,0,1412,367,1238,219,138,350,730,"Human, Physician, Empath, Resourceful, Caregiver, Spiritual","female, organic, snw, chapel, crew_max_rarity_5","So Much Pain",2, 7, 10, 8, 12, 2, 0, , , , 640, 500, 275, 300, false,"Chapel",crew_portraits_cm_chapel_lady_audrey_sm.png,chapel_lady_audrey_crew, 90.4027, 52, 67.2925, 87.1135, 5, 0, 1, 42.5781
"T'Pring as Spock",0,5, 550,80,178,1077,152,299,0,0,0,0,0,0,1364,201,401,0,0,0,166,1246,1176,211,1009,577,461,41,341,0,460,0,298,0,235,314,1281,1251,343,1098,821,613,107,500,0,706,0,503,0,400,280,727,"Vulcan, Telepath, Human, Starfleet, Federation, Spiritual, Communicator","tos, organic, nonhuman, tpring, spock, female, crew_max_rarity_5","Something Is Wrong",0, 10, 6, 8, 10, 5, 0, , , , 555, 200, 303, 600, false,"T'Pring",crew_portraits_cm_tpring_spock_sm.png,tpring_spock_crew, 91.645, 29.1111, 96.072, 86.1052, 2, 0, 0, 39.5399
"Paradise Spock",0,4, 0,0,0,926,174,317,684,104,201,0,0,0,382,60,167,0,0,0,791,1072,0,1503,0,109,575,393,435,903,786,755,1400,0,1204,750,1189,0,1473,0,198,490,366,417,1032,830,912,1364,0,1147,1136,1321,"Human, Vulcan, Starfleet, Federation, Telepath, Explorer, Romantic, Compromised","nonhuman, male, organic, tos, spock, crew_max_rarity_4","There's Belonging and Love",2, 7, 10, 8, 10, 0, 1, , , , 340, 250, 170, 365, false,"Spock",crew_portraits_cm_spock_paradise_sm.png,spock_paradise_crew, 60.9697, 20.6667, 25.1988, 55.4445, 3, 0, 0, 18.4028
"Luau Chakotay",0,5, 1099,124,297,0,0,0,0,0,0,0,0,0,1374,212,412,530,79,177,601,741,555,51,44,0,0,370,730,0,429,958,285,763,59,919,979,851,183,201,0,0,512,763,0,604,1021,446,815,131,257,735,"Human, Federation, Starfleet, Maquis, Casual, Tactician, Resourceful, Festive","organic, male, voy, chakotay, crew_max_rarity_5","Let's Mingle",1, 7, 10, 10, 14, 2, 0, , , , 450, 125, 135, 290, false,"Chakotay",crew_portraits_cm_chakotay_luau_sm.png,chakotay_luau_crew, 92.1058, 44.6667, 79.141, 88.6438, 4, 0, 0, 18.967
"M'Benga and Oriana",0,4, 0,0,0,0,0,0,674,127,250,0,0,0,392,93,185,914,147,309,0,1050,0,1469,607,944,0,1356,451,885,701,50,1376,395,237,0,1051,0,1357,662,918,0,1234,470,884,520,119,1223,433,213,1060,1079,"Human, Federation, Starfleet, Physician, Caregiver, Communicator, Survivalist, Tactician","male, organic, snw, mbenga, crew_max_rarity_4","Help Her See The Light",1, 5, 10, 10, 14, 2, 0, , , , 315, 250, 234, 175, false,"M'Benga",crew_portraits_cm_mbenga_oriana_sm.png,mbenga_oriana_crew, 60.7694, 55.1111, 71.2776, 68.7226, 5, 0, 0, 21.441
"Yeoman Barrows",0,4, 0,0,0,0,0,0,386,60,161,667,99,202,962,152,301,0,0,0,0,1391,986,971,0,1406,747,795,0,531,439,1113,161,569,615,0,1373,1134,1056,0,1337,830,896,0,595,495,1090,259,687,699,1115,1395,"Human, Starfleet, Federation, Romantic, Resourceful","female, organic, tos, barrows, crew_max_rarity_4","It Is Beautiful. So Lovely, And Restful",2, 8, 8, 8, 10, , , , 3, 800, 455, 275, 317, 215, false,"Barrows",crew_portraits_cm_barrows_yeoman_sm.png,barrows_yeoman_crew, 61.8313, 24.2222, 12.8455, 51.5442, 1, 0, 0, 0
"Rites of Separation Leeta",0,5, 0,0,0,535,74,162,0,0,0,0,0,0,1365,200,406,1043,154,307,1269,0,0,577,426,1218,958,124,92,0,456,402,295,273,12,1377,0,0,761,630,1318,1041,238,192,0,678,601,487,403,61,362,766,"Bajoran, Civilian, Spiritual, Romantic, Casual, Resourceful, Communicator, Playful","female, nonhuman, organic, ds9, leeta, crew_max_rarity_5","Our Paths Have Grown Apart",1, 8, 10, 12, 8, 0, 1, , , , 450, 400, 400, 300, false,"Leeta",crew_portraits_cm_leeta_separation_sm.png,leeta_separation_crew, 90.3827, 65.7778, 26.2977, 86.4372, 5, 0, 0, 21.1372
"Sir Adya Ortegas",0,4, 909,148,301,0,0,0,363,62,162,669,100,202,0,0,0,0,0,0,834,565,184,1034,615,1448,746,0,0,549,1565,1137,1045,566,0,848,537,234,1033,654,1329,831,0,0,590,1517,1079,1158,688,0,1226,1380,"Human, Communicator, Resourceful, Costumed, Duelist","female, organic, snw, ortegas, crew_max_rarity_4","My King, We Have Been Led Into A Trap",1, 7, 8, 10, 8, 1, 2, , , , 890, 210, 235, 390, false,"Ortegas",crew_portraits_cm_ortegas_adya_sm.png,ortegas_adya_crew, 59.1865, 64.4444, 17.3049, 59.8981, 4, 0, 1, 21.441
"Vox",0,5, 0,0,0,0,0,0,1351,200,396,1087,151,301,529,101,203,0,0,0,0,522,550,1335,0,247,449,1171,0,20,119,161,173,254,971,0,696,794,1308,0,472,566,1185,0,70,223,354,251,422,977,285,536,"Human, Survivalist, Borg, Desperate, Scoundrel, Saboteur","male, pic, jack, crew_max_rarity_5","The Time Of The Borg Is Over!",0, 10, 6, 10, 6, 5, 0, , , , 540, 300, 210, 540, false,"Vox",crew_portraits_cm_crusher_j_vox_sm.png,crusher_j_vox_crew, 90.8435, 25.3333, 99.5661, 88.2666, 3, 0, 0, 39.4314
"Luau Torres",0,4, 672,103,211,0,0,0,0,0,0,339,73,156,974,154,316,0,0,0,1031,1082,585,305,810,0,1176,757,0,1288,935,0,307,933,581,1135,1159,557,443,940,0,1046,819,0,1198,959,0,324,865,611,1141,1316,"Human, Klingon, Casual, Starfleet, Federation, Resourceful, Festive","female, nonhuman, organic, voy, torres, crew_max_rarity_4","Why Don't You Take a Break?",1, 5, 12, 10, 12, 2, 0, , , , 600, 575, 277, 200, false,"Torres",crew_portraits_cm_torres_luau_sm.png,torres_luau_crew, 60.8295, 52.8889, 76.0216, 64.5382, 5, 0, 0, 0
"Assimilated Esmar",0,5, 1379,205,423,0,0,0,1063,142,307,544,70,163,0,0,0,0,0,0,282,52,77,567,142,582,939,0,0,184,852,387,1233,762,0,420,151,136,671,259,800,1036,0,0,338,1061,648,1342,857,0,297,665,"Haliian, Borg, Federation, Starfleet, Tactician, Communicator, Villain, Compromised","organic, nonhuman, pic, esmar, crew_max_rarity_5","Eliminate All Unassimilated",0, 10, 12, 8, 12, 1, 0, 2, 2, 2, 525, 350, 115, 90, false,"Esmar",crew_portraits_cm_esmar_assimilated_sm.png,esmar_assimilated_crew, 91.1441, 33.3333, 61.4137, 85.3312, 3, 0, 0, 42.0356
"Rock'n'Roll Mariner",0,5, 1377,198,409,530,67,168,0,0,0,0,0,0,1062,158,313,0,0,0,90,493,283,54,151,1234,968,251,757,0,834,0,606,0,494,167,641,431,132,299,1321,1047,386,818,0,960,0,751,0,612,319,694,"Federation, Starfleet, Human, Inspiring, Musician, Desperate, Maverick, Playful","female, organic, low, mariner, crew_max_rarity_5","Two, Three, Four!",0, 9, 12, 8, 8, 1, 0, 2, , , 100, 300, , 190, false,"Mariner",crew_portraits_cm_mariner_rocknroll_sm.png,mariner_rocknroll_crew, 90.8435, 43.1111, 59.8231, 84.7572, 5, 0, 0, 0
"Bankrobber T'Ana",0,5, 1092,136,300,0,0,0,1354,177,365,0,0,0,0,0,0,521,77,188,598,61,553,848,47,288,0,0,739,336,529,28,0,773,1029,888,227,823,1074,186,570,0,0,734,572,810,132,0,779,1055,370,865,"Caitian, Federation, Starfleet, Romantic, Costumed, Desperate, Criminal, Thief","female, organic, nonhuman, low, tana, crew_max_rarity_5","Hands Up Where I Can See Them!",0, 7, 4, 10, 12, 0, 4, , , , 150, 325, 200, 650, false,"T'Ana",crew_portraits_cm_tana_bankrobber_sm.png,tana_bankrobber_crew, 90.7433, 32.8889, 25.9315, 84.9925, 4, 0, 0, 0
"Exoarchaeologist Mariner",0,5, 0,0,0,1326,196,394,0,0,0,1111,135,304,532,73,153,0,0,0,351,0,524,1382,0,323,11,152,187,512,1419,0,180,232,1038,576,0,824,1476,0,511,60,258,320,789,1518,0,359,467,1153,372,862,"Human, Federation, Exoarchaeology, Explorer, Resourceful, Desperate, Maverick, Playful","female, organic, low, mariner, crew_max_rarity_5","How Many Old Brown Pots Do We Really Need?",2, 9, 8, 8, 10, 5, 0, , , , 300, 500, , 15, false,"Mariner",crew_portraits_cm_mariner_exoarchaeologist_sm.png,mariner_exoarchaeologist_crew, 90.6432, 51.7778, 61.1418, 85.1836, 5, 0, 0, 0
"Caretaker Torres",0,5, 0,0,0,1327,202,401,0,0,0,1084,124,347,542,101,200,0,0,0,346,0,538,1312,0,313,13,133,182,525,1349,0,159,250,950,545,0,699,1316,0,475,46,187,291,677,1352,0,233,339,986,313,497,"Klingon, Human, Federation, Prisoner, Resourceful, Maquis, Desperate","nonhuman, female, organic, voy, torres, crew_max_rarity_5","I Don't Find This At All Amusing, Starfleet",0, 6, 8, 12, 10, 2, 0, , , , 775, 200, 323, 625, false,"Torres",crew_portraits_cm_torres_caretaker_sm.png,torres_caretaker_crew, 90.1623, 38, 83.1441, 87.3683, 3, 0, 0, 40.3646
"Bankrobber Shaxs",0,4, 378,75,176,0,0,0,953,149,311,0,0,0,668,102,253,0,0,0,1407,484,1341,811,1200,710,0,1030,0,665,206,519,1017,0,835,1311,502,1271,743,1124,744,0,1078,0,715,309,587,1041,0,877,1061,1158,"Bajoran, Federation, Starfleet, Costumed, Criminal, Thief, Romantic","nonhuman, male, organic, low, shaxs, crew_max_rarity_4","Everybody Down! This Is A Robbery!",2, 8, 4, 10, 14, 5, 4, , , , 325, 625, 145, 115, false,"Shaxs",crew_portraits_cm_shaxs_bankrobber_sm.png,shaxs_bankrobber_crew, 61.3504, 39.7778, 19.5349, 55.9867, 5, 0, 0, 0
"Mistress of the Winter Constellations",4,5, 1086,157,298,0,0,0,1356,209,400,548,81,183,0,0,0,0,0,0,593,54,158,844,390,224,889,0,0,96,485,134,1187,716,0,818,165,270,995,613,431,919,0,0,162,647,311,1249,774,0,270,598,"Orion, Desperate, Resourceful, Saboteur, Duelist, Brutal, Smuggler","female, nonhuman, organic, low, tendi, crew_max_rarity_5","Shut Up And Do Your Job!",0, 10, 6, 6, 12, , , , , , 450, 250, 40, 150, false,"Tendi",crew_portraits_cm_tendi_mistress_sm.png,tendi_mistress_crew, 91.3444, 51.1111, 19.7204, 85.5744, 5, 0, 0, 19.3576
"Colonel Kira Nerys",0,5, 1132,151,351,0,0,0,540,91,200,0,0,0,1399,212,435,0,0,0,494,269,466,5,326,1146,0,340,0,1059,100,916,254,0,184,691,417,636,86,490,1153,0,476,0,1070,200,952,399,0,296,27,329,"Bajoran, Federation, Resourceful, Tactician, Veteran, Communicator","nonhuman, organic, female, low, kira, crew_max_rarity_5","What Is Your Problem?",0, 8, 8, 8, 12, 1, 1, , , , 100, 560, , 105, false,"Kira",crew_portraits_cm_kira_colonel_sm.png,kira_colonel_crew, 94.1895, 71.1111, 40.8825, 90.9217, 5, 0, 0, 0
"Cadet Rutherford",0,4, 0,0,0,0,0,0,954,165,306,674,98,201,393,47,150,0,0,0,0,846,978,1505,0,692,743,1395,0,164,446,499,598,563,1206,0,867,1152,1539,0,713,839,1420,0,251,504,557,691,701,1221,1118,1408,"Human, Starfleet, Federation, Maverick, Scoundrel, Desperate, Criminal","male, organic, low, rutherford, crew_max_rarity_4","Here I Am, Baby!",0, 6, 8, 10, 16, 5, 0, , , , 550, 230, 210, 365, false,"Rutherford",crew_portraits_cm_rutherford_cadet_sm.png,rutherford_cadet_crew, 61.8914, 22.6667, 58.9661, 57.7857, 3, 0, 0, 17.73
"Kenneth EMH",0,5, 0,0,0,1333,200,406,0,0,0,0,0,0,1096,151,297,508,79,183,333,0,0,835,1093,292,265,46,45,0,799,995,579,801,95,532,0,0,1068,1107,468,364,108,105,0,1088,1009,851,801,229,369,731,"Hologram, Explorer, Federation, Starfleet, Romantic, Physician, Casual, Caregiver","nonhuman, male, artificial_life, voy, emh, crew_max_rarity_5","The Coffee Was Quite Good This Morning",2, 8, 8, 12, 8, 4, 0, , , , 500, 200, 210, 450, false,"Doctor",crew_portraits_cm_emh_kenneth_sm.png,emh_kenneth_crew, 89.982, 37.7778, 46.0342, 85.6683, 5, 0, 0, 41.9922
"EV Suit Sam Kirk",0,4, 370,53,151,948,174,301,0,0,0,0,0,0,684,101,249,0,0,0,309,1413,1384,827,1249,735,556,215,421,0,1232,0,1007,0,828,352,1405,1383,837,1243,716,511,249,428,0,1268,0,1056,0,892,1101,1300,"Human, Xenoanthropology, Explorer, Starfleet, Federation, Desperate, Resourceful","male, organic, snw, sam, evsuit, crew_max_rarity_4","You're Here For A Reason",2, 7, 10, 8, 12, 1, 0, , , , 650, 250, 225, 540, true,"Sam",crew_portraits_cm_sam_kirk_ev_suit_sm.png,sam_kirk_ev_suit_crew, 61.2302, 40.8889, 53.8773, 59.8883, 4, 0, 0, 39.9957
"One Way Ticket Chapel",0,5, 0,0,0,0,0,0,1062,150,350,0,0,0,541,102,248,1357,200,402,0,733,0,1292,165,553,0,1129,137,529,209,3,1115,68,54,0,812,0,1232,358,640,0,1090,283,636,269,23,1057,203,103,194,318,"Human, Starfleet, Federation, Nurse, Caregiver, Desperate, Romantic, Duelist","female, organic, snw, chapel, evsuit, exclusive_voyage, crew_max_rarity_5","I Can't Believe This Is How We're Gonna Die",0, 7, 10, 8, 16, 2, 0, , , , 640, 500, 275, 300, false,"Chapel",crew_portraits_cm_chapel_one_way_ticket_sm.png,chapel_one_way_ticket_crew, 90.8435, 20, 74.7917, 90.6907, 3, 0, 0, 21.441
"Nancy Hedford",0,5, 551,72,176,0,0,0,0,0,0,0,0,0,1094,151,297,1357,197,351,1220,1251,1182,344,21,0,0,652,159,0,804,179,582,92,10,1318,1300,1277,567,121,0,0,915,347,0,1089,426,852,265,84,305,872,"Human, Civilian, Casual, Survivalist, Desperate, Resourceful, Communicator, Romantic, Compromised","female, organic, tos, nancy_hedford, crew_max_rarity_5","Now We're Together",2, 9, 10, 8, 12, 3, 0, , , , 215, 400, 398, 230, false,"Nancy",crew_portraits_cm_nancy_hedford_sm.png,nancy_hedford_crew, 92.1459, 72.4444, 60.5515, 88.8201, 5, 0, 0, 0
"Charlene",0,4, 677,97,203,387,58,162,0,0,0,0,0,0,981,147,302,0,0,0,581,1085,970,309,813,1412,1102,368,878,0,945,0,709,0,589,658,1199,1135,489,982,1355,1084,442,843,0,1079,0,846,0,712,1069,1409,"Hologram, Human, Caregiver, Romantic, Casual, Civilian","voy, artificial_life, nonhuman, female, charlene, crew_max_rarity_4","Line Up Next To The Door, Children",2, 8, 6, 12, 12, 5, 0, , , , 850, 225, 240, 550, false,"Charlene",crew_portraits_cm_charlene_sm.png,charlene_crew, 62.6728, 23.3333, 54.5976, 56.099, 3, 0, 0, 41.9922
"Rogue Jack Crusher",0,5, 1104,165,302,0,0,0,1359,202,407,0,0,0,539,100,211,0,0,0,558,41,516,314,373,213,0,1145,0,270,111,127,1148,0,947,781,153,706,447,570,432,0,1165,0,452,210,312,1142,0,958,169,451,"Human, Villain, Scoundrel, Criminal, Desperate, Civilian, Crafty, Casual","male, organic, pic, jack, crew_max_rarity_5","I've Always Been Different",2, 8, 6, 10, 10, 5, 0, , , , 300, 515, 202, 250, false,"Jack",crew_portraits_cm_crusher_j_rogue_sm.png,crusher_j_rogue_crew, 91.9054, 14.4444, 63.9429, 84.0906, 2, 0, 0, 59.7656
"Valeo Beta V Spock",0,5, 561,60,162,1329,197,402,1069,150,301,0,0,0,0,0,0,0,0,0,97,327,1190,1358,1030,22,279,428,183,547,848,385,0,0,0,193,540,1351,1474,1205,66,380,586,303,772,1055,643,0,0,0,376,825,"Human, Vulcan, Federation, Starfleet, Tactician, Telepath, Marksman, Communicator, Desperate","snw, male, organic, nonhuman, spock, crew_max_rarity_5","Captain, There's More Blood Over Here",1, 9, 8, 8, 10, 1, 0, 2, , , 750, 325, 243, 590, false,"Spock",crew_portraits_cm_spock_valeo_beta_v_sm.png,spock_valeo_beta_v_crew, 90.3426, 34, 45.711, 88.4806, 3, 0, 0, 60.5035
"Night Terrors Troi",0,5, 0,0,0,1092,158,356,0,0,0,0,0,0,1397,193,420,506,77,208,551,0,0,536,1083,504,388,12,73,0,410,978,275,789,58,699,0,0,732,1035,628,454,58,131,0,648,968,466,737,120,162,435,"Human, Starfleet, Federation, Betazoid, Empath, Communicator, Counselor, Desperate","female, nonhuman, organic, tng, troi, crew_max_rarity_5","Where Are You? I'm Coming.",2, 8, 4, 12, 14, 5, 0, , , , 115, 150, 50, 100, false,"Troi",crew_portraits_cm_troi_night_terrors_sm.png,troi_night_terrors_crew, 91.8654, 30, 47.272, 87.7575, 3, 0, 0, 19.9436
"Assistant Kes",0,4, 365,62,163,684,118,216,0,0,0,0,0,0,982,179,296,0,0,0,580,1408,1372,554,1240,958,728,199,562,0,911,0,683,0,558,601,1357,1339,561,1192,1030,768,264,626,0,946,0,734,0,597,1044,1276,"Starfleet, Federation, Ocampa, Telepath, Caregiver, Prodigy, Communicator, Botanist, Physician","female, nonhuman, organic, voy, kes, crew_max_rarity_4","How's The Family?",0, 7, 6, 8, 10, 0, 1, , , , 815, 200, 210, 225, false,"Kes",crew_portraits_cm_kes_assistant_sm.png,kes_assistant_crew, 62.2521, 51.3333, 33.7791, 60.0883, 6, 0, 0, 18.4028
"Valeo Beta V La'an",0,5, 1107,147,325,0,0,0,1359,224,400,525,98,201,0,0,0,0,0,0,547,34,141,821,368,198,907,0,0,95,464,108,1206,736,0,764,139,218,948,556,398,840,0,0,131,593,274,1173,702,0,203,423,"Human, Federation, Tactician, Starfleet, Desperate, Marksman, Brutal, Resourceful, Duelist","female, organic, snw, laan, crew_max_rarity_5","Make It Angry!",0, 10, 8, 6, 10, 5, 0, , , , 650, 250, 225, 440, false,"La'an",crew_portraits_cm_laan_valeo_beta_v_sm.png,laan_valeo_beta_v_crew, 91.3645, 36.6667, 86.2637, 89.9361, 3, 0, 0, 42.1007
"Valeo Beta V Sam Kirk",0,4, 0,0,0,692,102,202,956,175,298,335,57,160,0,0,0,0,0,0,1021,838,1431,0,0,101,475,1035,566,327,981,491,1481,948,0,1185,861,1365,0,0,214,444,1193,676,329,944,555,1387,897,0,1176,1368,"Human, Xenoanthropology, Explorer, Starfleet, Federation, Desperate, Communicator","male, organic, snw, sam, crew_max_rarity_4","We Need To Alert The Rest Of The Crew",1, 9, 6, 10, 8, , , , 0, 3, 650, 250, 230, 440, false,"Sam",crew_portraits_cm_sam_kirk_valeobeta_sm.png,sam_kirk_valeobeta_crew, 60.5891, 31.3333, 18.0141, 56.8667, 3, 0, 0, 39.9957
"Brain Drain Crusher and Riker",0,5, 1392,201,400,0,0,0,1069,150,301,0,0,0,0,0,0,504,86,200,283,49,276,568,18,576,0,0,753,548,849,61,0,791,1046,496,180,459,733,68,793,0,0,707,773,1056,172,0,732,1026,307,568,"Human, Federation, Starfleet, Physician, Scoundrel, Maverick, Communicator, Desperate","female, male, organic, tng, crusher, riker, crew_max_rarity_5","Do You Want Some? It's Delicious.",0, 7, 8, 10, 10, 0, 1, , , , 550, 415, 207, 190, false,"Crusher",crew_portraits_cm_crusher_riker_brain_drain_sm.png,crusher_riker_brain_drain_crew, 90.6231, 38.6667, 41.3244, 88.6901, 3, 0, 0, 17.73
"Thalen",0,4, 689,97,200,395,49,152,0,0,0,911,175,302,0,0,0,0,0,0,566,1073,168,1192,796,1414,248,1398,879,714,0,0,810,380,0,720,1209,217,1311,996,1431,266,1412,905,669,0,0,721,335,0,1177,1383,"Xindi, Innovator, Resourceful, Tactician, Scoundrel, Prisoner","male, nonhuman, organic, ent, thalen, crew_max_rarity_4","I'm Losing Your Signal. Please Repeat.",2, 7, 8, 8, 14, 5, 0, 2, , , 490, 700, 290, 400, false,"Thalen",crew_portraits_cm_thalen_sm.png,thalen_crew, 60.7493, 38.8889, 37.9518, 58.1867, 3, 0, 1, 39.1276
"Machine Man Paris",0,5, 0,0,0,1095,125,287,0,0,0,1353,193,411,538,70,186,0,0,0,618,0,300,1363,0,579,10,246,343,300,1394,0,94,80,1004,951,0,466,1416,0,873,64,448,534,455,1449,0,149,180,1081,341,823,"Human, Starfleet, Federation, Maverick, Pilot, Desperate, Prisoner, Engineered, Compromised","male, voy, organic, paris, crew_max_rarity_5","Argh! What Are You Doing To Me?",0, 7, 6, 6, 10, 0, 1, , , , 200, 400, 180, 175, false,"Paris",crew_portraits_cm_paris_machine_man_sm.png,paris_machine_man_crew, 91.1641, 26.8889, 38.5313, 84.5308, 4, 0, 0, 41.1892
"Nightless Neelix",0,4, 0,0,0,941,143,318,389,66,157,0,0,0,681,121,261,0,0,0,790,1380,0,1140,0,225,574,217,434,1237,716,1104,986,0,803,849,1369,0,1161,0,305,567,239,462,1217,679,1083,980,0,829,1052,1186,"Talaxian, Mylean, Desperate, Civilian, Communicator, Counselor","male, nonhuman, organic, neelix, voy, crew_max_rarity_4","Bergamot Tea, Hot",0, 6, 6, 10, 10, 0, 1, , , , 240, 95, 70, 100, false,"Neelix",crew_portraits_cm_neelix_nightless_sm.png,neelix_nightless_crew, 61.5909, 26.4444, 30.9543, 56.0031, 2, 0, 0, 19.9436
"Phantasms Data",0,5, 0,0,0,1096,150,298,0,0,0,541,70,170,1377,199,399,0,0,0,592,0,1212,570,0,554,146,29,332,1111,443,0,91,760,227,889,0,1302,780,0,832,255,119,507,1166,722,0,166,838,413,261,807,"Android, Starfleet, Federation, Cyberneticist, Desperate, Prisoner, Communicator, Compromised","nonhuman, male, tng, artificial_life, data, crew_max_rarity_5","Have You Ever Had A Nightmare?",0, 10, 10, 10, 14, 5, 0, , , , 650, 300, 195, 750, false,"Data",crew_portraits_cm_data_phantasms_sm.png,data_phantasms_crew, 92.3462, 33.3333, 83.1335, 87.2465, 3, 0, 0, 62.8472
"Captain Rudolph Ransom",0,5, 1404,225,405,1093,141,333,0,0,0,0,0,0,541,68,165,0,0,0,6,450,249,204,105,538,424,237,316,0,1402,0,1226,0,1014,44,602,388,326,257,722,516,387,435,0,1503,0,1348,0,1130,165,585,"Human, Federation, Starfleet, Tactician, Brutal, Desperate, Exobiology","male, organic, voy, rudolph_ransom, crew_max_rarity_5","We'd Found Our Salvation",2, 9, 8, 6, 8, 5, 0, , , , 650, 470, 225, 525, true,"Rudolph",crew_portraits_cm_rudolph_ransom_captain_sm.png,rudolph_ransom_captain_crew, 92.7269, 20.6667, 63.4035, 87.2961, 3, 0, 0, 0
"Compromised Kamran Gant",0,5, 1089,149,302,0,0,0,1359,208,393,0,0,0,537,68,154,0,0,0,589,55,546,358,388,233,0,1224,0,279,123,144,1244,0,1031,831,183,777,599,631,459,0,1353,0,475,301,338,1383,0,1166,316,803,"Human, Starfleet, Federation, Section 31, Control, Duelist, Tactician, Saboteur, Compromised","male, organic, dsc, gant, evsuit, crew_max_rarity_5","To Achieve One Requires The Other",2, 10, 8, 10, 12, 0, 1, , , , 440, 350, 305, 500, false,"Gant",crew_portraits_cm_gant_compromised_sm.png,gant_compromised_crew, 91.3845, 28.2222, 30.6395, 80.7652, 4, 0, 0, 0
"Paranoid O'Brien",0,4, 672,100,217,0,0,0,953,170,305,334,62,160,0,0,0,0,0,0,1029,301,589,1204,807,686,1193,0,0,329,983,495,1479,947,0,1128,421,567,1272,930,703,1066,0,0,319,939,551,1374,887,0,1191,1304,"Human, Clone, Federation, Starfleet, Desperate, Duelist, Romantic","male, organic, ds9, obrien, crew_max_rarity_4","Tell Her I Love",0, 6, 8, 8, 10, 3, 0, 3, , , 550, 415, 107, 400, false,"O'Brien",crew_portraits_cm_obrien_paranoid_sm.png,obrien_paranoid_crew, 59.8477, 0, 39.7485, 50.314, 0, 0, 0, 0
"Ensign Rita Tannenbaum",0,4, 0,0,0,0,0,0,390,55,166,904,159,317,679,120,258,0,0,0,0,1381,789,1145,0,1392,603,1012,0,319,722,1105,164,400,813,0,1374,686,1169,0,1338,495,1029,0,316,712,1091,154,336,833,1111,1138,"Human, Federation, Starfleet, Communicator, Resourceful, Jury Rigger","female, organic, ds9, rita_tannenbaum, crew_max_rarity_4","A Good Engineer Is Ready For Anything",2, 8, 6, 12, 8, 5, 0, , , , 115, 210, , 100, false,"Rita",crew_portraits_cm_rita_tannenbaum_ensign_sm.png,rita_tannenbaum_ensign_crew, 60.4488, 52, 54.2794, 61.9929, 3, 0, 0, 0
"Abducted Travis",0,4, 0,0,0,422,72,140,777,158,312,651,104,209,0,0,0,0,0,0,1384,998,1002,0,0,401,405,1361,850,214,1155,673,1054,582,0,1442,870,1098,0,0,302,441,1382,865,242,950,561,1127,658,0,1305,1364,"Human, Starfleet, Desperate, Tactician, Explorer, Prisoner, Jury Rigger, Compromised","male, organic, ent, mayweather, crew_max_rarity_4","Captain? Hello? Hello?",0, 7, 8, 10, 10, 1, 1, , , , 565, 365, 279, 540, false,"Mayweather",crew_portraits_cm_mayweather_abducted_sm.png,mayweather_abducted_crew, 56.5017, 26.2222, 33.3418, 54.412, 4, 0, 0, 21.3976
"Pregnant Trip Tucker",0,5, 0,0,0,541,67,156,0,0,0,1337,201,406,1093,141,291,0,0,0,1270,0,314,839,0,1219,84,245,748,321,815,0,37,91,484,1414,0,446,1092,0,1344,154,466,838,441,1126,0,84,172,759,355,837,"Human, Starfleet, Desperate, Maverick, Explorer, Communicator","male, organic, ent, tucker, crew_max_rarity_5","Postnatal Responsibilities?!",2, 8, 10, 12, 16, 2, 0, , 0, 3, 650, 350, 200, 400, false,"Trip",crew_portraits_cm_tucker_pregnant_sm.png,tucker_pregnant_crew, 90.9036, 42.2222, 74.9599, 85.5274, 4, 0, 0, 0
"Metron",0,5, 553,78,178,1336,221,421,0,0,0,0,0,0,1099,173,301,0,0,0,89,1242,1169,324,998,258,239,34,142,0,760,0,556,0,445,126,1286,1262,516,1113,386,307,66,233,0,951,0,736,0,599,235,512,"Metron, Diplomat, Tactician, Communicator, Crafty, Civilian, Resourceful, Cosmic","male, organic, nonhuman, tos, metron, crew_max_rarity_5","You Surprise Me, Captain.",0, 10, 8, 10, 12, , , , 2, 2, 700, 375, 355, 455, false,"Metron",crew_portraits_cm_metron_sm.png,metron_crew, 91.4446, 60.8889, 20.1867, 86.4995, 4, 0, 0, 0
"Ilon Tandro",0,5, 1128,148,349,0,0,0,569,99,198,0,0,0,1459,153,350,0,0,0,503,261,471,9,332,1080,0,350,0,1002,94,868,264,0,199,707,415,649,210,503,1130,0,742,0,1059,337,942,680,0,535,14,736,"Communicator, Inspiring, Desperate, Tactician, Diplomat, Interrogator, Civilian, Klaestron","nonhuman, male, organic, ds9, ilon, crew_max_rarity_5","This Is Not At All Relevant.",0, 8, 6, 10, 12, 5, 0, , , , 550, 325, 235, 675, false,"Ilon",crew_portraits_cm_ilon_tandro_sm.png,ilon_tandro_crew, 96.8343, 43.3333, 81.9623, 90.236, 3, 0, 0, 20.3559
"People Person Quark",0,5, 1104,124,297,535,72,167,0,0,0,0,0,0,1394,228,405,0,0,0,168,730,543,46,387,1214,956,117,745,0,405,0,271,0,207,375,980,852,167,715,1307,1032,209,806,0,583,0,423,0,323,207,770,"Ferengi, Civilian, Bartender, Gambler, Merchant, Communicator, Crafty","nonhuman, organic, male, ds9, quark, crew_max_rarity_5","Too Quiet. Something Is Terribly Wrong.",2, 9, 12, 8, 10, 3, 0, , , , 490, 150, 135, 290, false,"Quark",crew_portraits_cm_quark_people_person_sm.png,quark_people_person_crew, 92.9273, 34.6667, 63.6931, 85.2122, 3, 0, 0, 19.6615
