"Insubordinate Mariner",0,5, 1044,171,283,0,0,0,0,0,0,566,79,184,1328,165,351,0,0,0,545,668,118,62,355,0,745,392,0,921,509,0,77,575,257,712,791,212,205,532,0,790,638,0,984,764,0,181,656,469,290,734,"Federation, Starfleet, Human, Desperate, Maverick, Smuggler, Scoundrel, Playful","female, organic, low, mariner, crew_max_rarity_5","Come On Check It Out",0, 9, 4, 8, 10, , , , 1, 2, 575, 165, 210, 675, false,"Mariner",crew_portraits_cm_insubordinate_mariner_sm.png,insubordinate_mariner_crew
"Cabaret Georgiou",0,5, 1360,177,454,0,0,0,1052,130,319,0,0,0,493,70,168,0,0,0,233,36,210,183,109,506,0,1171,0,466,243,335,1157,0,980,360,128,301,276,216,701,0,1182,0,657,440,562,1164,0,993,262,516,"Terran Empire, Mirror Universe, Human, Brutal, Desperate, Royalty, Bartender","female, organic, dsc, georgiou, crew_max_rarity_5","Ill Ask Again--What Do You Want?",0, 8, 10, 5, 8, 6, 0, , , , 300, 135, 277, 725, false,"Georgiou",crew_portraits_cm_georgiou_cabaret_sm.png,dsc_georgiou_cabaret_crew
"Data and Spot",0,5, 0,0,0,1065,100,250,0,0,0,1328,171,371,538,54,152,0,0,0,576,0,276,1216,0,540,19,230,318,321,1255,0,80,102,923,934,0,464,1330,0,887,104,577,523,495,1381,0,219,225,1058,390,958,"Android, Starfleet, Federation, Cyberneticist, Caregiver, Writer","nonhuman, male, tng, artificial_life, data, exclusive_collection, crew_max_rarity_5","Oh, Spot, The Complex Levels of Behavior You Display!",2, 10, 8, 8, 12, , , , 1, 2, 650, 200, 165, 675, false,"Data",crew_portraits_cm_data_spot_sm.png,data_spot_crew
"Tendi and The Dog",0,5, 0,0,0,1314,222,424,0,0,0,508,76,146,0,0,0,1000,127,333,264,0,1119,0,395,257,83,347,7,1032,0,375,1156,33,466,356,0,1180,0,552,339,118,423,33,1073,0,547,1204,96,586,365,546,"Orion, Starfleet, Federation, Geneticist, Engineered, Shapeshifter, Playful","female, organic, low, tendi, nonhuman, crew_max_rarity_5","Who Has Malleable Protein Bonds? You Do!",0, 6, 9, 7, 8, 6, 0, , , , 165, 100, 110, 325, false,"Tendi",crew_portraits_cm_tendi_dog_sm.png,tendi_dog_crew
"Ensign Mariner",0,2, 383,80,207,0,0,0,277,58,155,0,0,0,151,29,67,0,0,0,1218,916,1149,1128,1030,1357,0,1396,0,1188,1312,1087,1390,0,1196,1053,711,1013,997,887,1213,0,1381,0,1089,1169,990,1376,0,1180,1542,1505,"Federation, Starfleet, Human, Casual, Maverick, Playful","female, organic, low, mariner, crew_max_rarity_2","Boim us out of here!",2, 6, 4, 5, 10, 1, 1, , , , 500, 50, 40, 175, false,"Mariner",crew_portraits_cm_mariner_ensign_sm.png,mariner_ensign_crew
"Vindicta Mariner",0,4, 652,85,253,372,64,151,948,145,279,0,0,0,0,0,0,0,0,0,514,265,828,1052,705,231,966,1274,807,591,884,486,0,0,0,515,388,881,1082,766,342,927,1232,763,703,987,614,0,0,0,989,1183,"Starfleet, Human, Federation, Maverick, Brutal, Criminal, Costumed, Villain, Playful, Vengeful","female, organic, low, mariner, jan2024, crew_max_rarity_4","I Am Vindicta, Vengeance Personified!",0, 7, 10, 6, 8, 1, 0, , , , 400, 325, 170, 475, false,"Vindicta",crew_portraits_cm_mariner_vindicta_sm.png,mariner_vindicta_crew
"EV Suit Mariner",0,5, 1348,133,331,496,78,171,0,0,0,1079,92,236,0,0,0,0,0,0,92,501,17,537,163,1141,143,1156,716,511,0,0,550,244,0,256,767,150,843,504,1125,346,1163,688,857,0,0,957,524,0,439,1053,"Federation, Starfleet, Human, Desperate, Maverick, Resourceful, Playful","female, organic, low, mariner, evsuit, crew_max_rarity_5","Sorry! Uh, New Boots!",0, 9, 8, 6, 14, 8, 4, , , , 525, 95, 170, 475, false,"Mariner",crew_portraits_cm_mariner_evsuit_sm.png,mariner_evsuit_crew
"First Monarch Kaitaama",0,4, 663,92,235,0,0,0,0,0,0,0,0,0,950,121,312,380,67,148,900,954,826,285,317,0,0,722,795,0,891,1008,652,753,201,970,999,909,408,365,0,0,837,764,0,979,997,757,759,276,978,1197,"Kriosian, Royalty, Romantic, Ambassador, Desperate, Prisoner","nonhuman, female, organic, ent, kaitaama, crew_max_rarity_4","Is Your Entire Species So Ill Mannered?",1, 9, 3, 8, 9, , , , 2, 2, 100, 170, 120, 150, false,"Kaitaama",crew_portraits_cm_kaitaama_first_monarch_sm.png,kaitaama_crew
"Ensign Tendi",0,2, 0,0,0,258,27,86,0,0,0,154,15,41,0,0,0,403,44,161,1378,0,1348,0,1039,1375,943,1366,513,1220,0,988,1397,579,1050,1381,0,1347,0,1095,1373,1015,1366,577,1221,0,1022,1394,672,1060,1574,1604,"Orion, Starfleet, Federation, Nurse, Resourceful","female, organic, nonhuman, low, tendi, crew_max_rarity_2","Did That Full Molecular Engorgement Feel Amazing?!",2, 2, 6, 6, 8, 6, 0, , , , 215, 100, 175, 25, false,"Tendi",crew_portraits_cm_tendi_ensign_sm.png,tendi_ensign_crew
"Lt. Shaxs",0,5, 834,260,575,0,0,0,956,307,715,0,0,0,475,76,248,0,0,0,569,111,504,331,383,395,0,1130,0,374,167,253,1111,0,938,144,6,115,75,73,66,0,1015,0,64,30,36,966,0,815,566,30,"Bajoran, Federation, Starfleet, Brutal, Veteran, Desperate, Tactician","nonhuman, male, organic, low, shaxs, crew_max_rarity_5","Recommendation: Full Assault",0, 7, 8, 6, 12, 4, 0, , , , 350, 205, 108, 265, false,"Shaxs",crew_portraits_cm_shaxs_lt_sm.png,shaxs_lt_crew
"Captain Carol Freeman",0,4, 881,146,303,0,0,0,410,78,154,0,0,0,670,93,197,0,0,0,742,464,682,313,539,1207,0,944,0,1078,660,963,911,0,762,731,462,647,432,553,1170,0,1095,0,1051,752,954,1049,0,894,1012,1194,"Starfleet, Federation, Human, Diplomat, Resourceful, Communicator","female, organic, low, freeman, crew_max_rarity_4","Warp Me",0, 9, 10, 7, 7, , , , 1, 2, 425, 300, 121, 430, false,"Freeman",crew_portraits_cm_freeman_captain_sm.png,freeman_captain_crew
"Phased Boimler",0,4, 0,0,0,0,0,0,384,50,148,657,95,199,948,142,301,0,0,0,0,1229,868,857,0,1269,661,720,0,470,434,1009,139,498,546,0,1251,1003,922,0,1268,740,811,0,566,515,1030,227,605,628,1015,1253,"Federation, Starfleet, Human, Desperate, Inspiring","male, organic, low, boimler, crew_max_rarity_4","Its Gonna Be Great!",1, 7, 10, 10, 10, 4, 2, , , , 500, 265, 110, 675, false,"Boimler",crew_portraits_cm_phased_boimler_sm.png,phased_boimler_crew
"Ensign Boimler",0,2, 371,63,163,0,0,0,0,0,0,0,0,0,278,46,111,0,0,0,1266,1234,1190,1029,1073,0,0,1349,0,0,1444,0,1344,0,1157,1214,1190,1162,998,1034,0,0,1326,0,0,1431,0,1310,0,1128,1601,1601,"Federation, Starfleet, Human, Desperate","male, organic, low, boimler, crew_max_rarity_2","Evasive Maneuver Eighty... Eight?",1, 5, 8, 10, 8, , , , , , 450, 150, 115, 315, false,"Boimler",crew_portraits_cm_boimler_ensign_sm.png,boimler_ensign_crew
"All-in Owosekun",0,5, 1072,82,249,0,0,0,1352,112,315,0,0,0,513,83,181,0,0,0,574,68,509,328,386,314,0,1103,0,313,136,200,1090,0,918,959,394,899,668,783,753,0,1123,0,699,436,612,1098,0,931,371,1097,"Human, Federation, Starfleet, Athlete, Duelist, Gambler, Brutal, Crafty, Displaced","female, organic, dsc, owosekun, crew_max_rarity_5","I'm In. All The Way.",0, 10, 6, 8, 12, , , , , , 740, 600, 315, 540, false,"Owosekun",crew_portraits_cm_owosekun_allin_sm.png,dsc_owosekun_allin_crew
"Cowpoke Boimler",0,4, 654,102,206,0,0,0,920,209,356,0,0,0,409,73,112,0,0,0,917,253,847,713,727,573,0,1243,0,534,353,405,1226,0,1053,1000,277,948,795,832,473,0,1291,0,450,346,346,1274,0,1097,920,1011,"Federation, Starfleet, Human, Constable, Marksman, Costumed, Casual","male, organic, low, boimler, original, crew_max_rarity_4","This Holodeck Ain't Big Enough for the Both of Us",1, 5, 12, 9, 10, 4, 0, , , , 75, 100, 35, 75, false,"Boimler",crew_portraits_cm_boimler_cowpoke_sm.png,boimler_cowpoke_crew
"AGIMUS",0,5, 560,150,165,0,0,0,0,0,0,1354,300,356,1110,205,224,0,0,0,1006,1046,45,253,817,0,191,552,0,231,686,0,11,48,400,987,1025,60,429,813,0,256,845,0,311,985,0,42,106,660,81,357,"Sentient Computer, Brutal, Crafty, Desperate, Prisoner, Resourceful, Scoundrel, Villain","nonhuman, artificial_life, low, agimus, crew_max_rarity_5","You Are Too Late, AGIMUS Reigns!",0, 10, 8, 4, 12, 1, 4, , , , 300, 400, 180, 300, false,"AGIMUS",crew_portraits_cm_agimus_sm.png,agimus_crew
"Lt. Commander Ron Docent",0,4, 691,97,246,0,0,0,401,59,204,914,166,297,0,0,0,0,0,0,865,583,100,1005,654,1204,517,0,0,228,1330,961,700,333,0,935,569,141,1069,755,1082,455,0,0,238,1257,895,661,313,0,913,983,"Human, Starfleet, Federation, Desperate, Scoundrel","male, organic, low, docent, crew_max_rarity_4","Do I Need To Remind You Who My Grandmas Neighbor Was?",1, 8, 6, 10, 8, 5, 0, , , , 150, 115, 7, 1050, false,"Ron Docent",crew_portraits_cm_docent_lt_cmdr_sm.png,docent_lt_cmdr_crew
"Bullseye Kyle",0,5, 0,0,0,982,223,488,0,0,0,1310,212,410,0,0,0,567,21,91,471,0,258,0,965,462,7,549,74,300,0,900,291,16,951,272,0,333,0,1193,250,9,333,109,359,0,1099,376,70,1166,283,303,"Federation, Starfleet, Human, Marksman, Innovator, Resourceful","male, organic, tos, kyle, crew_max_rarity_5","Are you kidding?",2, 9, 6, 8, 12, 5, 0, , , , 50, , 218, 25, false,"Kyle",crew_portraits_cm_kyle_bullseye_sm.png,kyle_bullseye_crew
"Acting Captain Arex",0,5, 1337,241,501,571,102,243,1045,203,400,0,0,0,0,0,0,0,0,0,53,4,189,456,83,79,700,991,560,408,649,292,0,0,0,43,46,182,423,123,94,646,989,538,378,592,276,0,0,0,12,120,"Edosian, Starfleet, Federation, Musician, Astrophysicist, Explorer, Communicator, Merchant","male, nonhuman, organic, tas, arex, crew_max_rarity_5","We Didn't Cause This To Happen",2, 10, 6, 8, 12, , , , , , 200, 100, 90, 100, false,"Arex",crew_portraits_cm_arex_acting_captain_sm.png,arex_acting_captain_crew
"Kevin Mulkahey",0,2, 263,30,86,0,0,0,367,33,96,0,0,0,0,0,0,0,0,0,1374,1011,1310,1427,1188,1323,0,0,0,1156,1416,1053,0,0,0,1376,1146,1309,1429,1186,1360,0,0,0,1186,1449,1090,0,0,0,1617,1641,"Human, Brutal, Investigator","male, organic, ds9, weyoun, crew_max_rarity_2","Damn Shame",0, 4, 8, 8, 8, , , , , , 290, 135, 33, 375, false,"Mulkahey",crew_portraits_cm_weyoun_mulkahey_sm.png,weyoun_mulkahey_crew
"Tiron",0,4, 0,0,0,0,0,0,0,0,0,670,79,156,998,170,319,0,0,0,0,0,881,780,0,0,674,620,0,830,770,0,110,511,458,0,0,1154,809,0,0,875,696,0,1047,820,0,236,718,511,1335,1436,"Serilian, Civilian, Merchant, Desperate, Scoundrel","nonhuman, male, ds9, organic, tiron, crew_max_rarity_4","I Will Ruin You",2, 6, 12, 10, 12, 4, 0, , , , 340, 200, 80, 225, false,"Tiron",crew_portraits_cm_tiron_sm.png,tiron_crew
"Judoka Kirk",0,5, 0,0,0,0,0,0,1278,240,510,497,102,211,1059,86,212,0,0,0,0,436,1064,808,0,214,822,651,0,80,28,125,166,661,487,0,397,949,1156,0,204,692,1075,0,46,111,142,397,557,875,321,427,"Human, Federation, Starfleet, Duelist, Brutal, Athlete","male, organic, tos, kirk, crew_max_rarity_5","Lesson's Over For Today",2, 9, 8, 5, 10, , , , 0, 2, 425, 100, 75, 450, false,"Kirk",crew_portraits_cm_kirk_judoka_sm.png,kirk_judoka_crew
"Mourned Morn",0,5, 0,0,0,0,0,0,959,184,263,0,0,0,1353,113,343,562,84,230,0,745,0,540,816,609,0,398,574,557,44,55,310,545,55,0,822,0,891,837,709,0,771,586,663,201,140,685,564,179,341,777,"Lurian, Courier, Civilian, Smuggler, Inspiring, Criminal, Merchant, Crafty","morn, male, organic, ds9, nonhuman, crew_max_rarity_5","Keep It Warm, For Morn",1, 9, 8, 10, 12, 0, 2, , , , 425, 340, 102, 640, false,"Morn",crew_portraits_cm_morn_mourned_sm.png,morn_mourned_crew
"Pathfinder Uhura",0,5, 1294,271,523,533,115,230,0,0,0,0,0,0,1061,222,392,0,0,0,59,415,204,15,98,993,728,169,587,0,645,0,445,0,369,28,353,145,25,99,899,647,139,539,0,578,0,389,0,322,23,91,"Human, Federation, Starfleet, Communicator, Musician, Hero, Inspiring, Cultural Figure","female, organic, tos, uhura, original, evsuit, crew_max_rarity_5","Science Is Everyone's Game",0, 9, 8, 6, 12, 1, 4, , , , 415, 120, 60, 350, false,"Uhura",crew_portraits_cm_uhura_evsuit_sm.png,uhura_evsuit_crew
"Valeo Beta V Hemmer",0,5, 555,75,131,0,0,0,1343,177,315,1057,99,225,0,0,0,0,0,0,1091,189,146,1196,912,290,437,0,0,30,476,177,584,268,0,1261,447,479,1325,1078,593,670,0,0,175,808,458,967,531,0,367,1098,"Aenar, Andorian, Federation, Starfleet, Telepath, Jury Rigger, Hero","nonhuman, organic, male, snw, hemmer, exclusive_honorhall, crew_max_rarity_5","Do Not Weep For Me",0, 10, 7, 7, 7, , , , 1, 6, 200, 50, 205, 50, false,"Hemmer",crew_portraits_cm_hemmer_valeobeta_sm.png,hemmer_valeobeta_crew
"Esteemed Tom Paris",0,5, 1382,204,394,0,0,0,1013,124,349,0,0,0,524,74,146,0,0,0,229,40,206,179,102,523,0,1132,0,479,247,351,1114,0,943,433,136,368,332,281,635,0,1214,0,588,430,491,1210,0,1032,259,600,"Human, Federation, Starfleet, Inspiring, Hero, Cultural Figure, Pilot","male, organic, low, paris, crew_max_rarity_5","This Is How we kick A## In The Delta Quadrant",0, 8, 10, 3, 14, 1, 1, , , , 825, 70, 285, 265, false,"Paris",crew_portraits_cm_paris_esteemed_sm.png,paris_esteemed_crew
"First Officer Data",0,4, 897,144,346,678,89,239,0,0,0,360,62,148,0,0,0,0,0,0,130,810,257,880,514,855,385,918,502,1138,0,0,1277,781,0,162,722,228,796,446,933,382,1014,559,1102,0,0,1235,767,0,1022,1089,"Android, Federation, Starfleet, Cyberneticist, Musician, Tactician","nonhuman, male, artificial_life, data, tng, crew_max_rarity_4","Aye Sir",0, 8, 14, 12, 14, , , , , , 250, 100, 53, 50, false,"Data",crew_portraits_cm_data_first_officer_sm.png,data_first_officer_crew
"EV Suit Hemmer",0,5, 1082,175,236,538,118,200,0,0,0,1345,163,349,0,0,0,0,0,0,128,659,13,733,340,1005,73,1030,594,316,0,0,309,98,0,236,869,74,959,627,957,144,1030,578,535,0,0,564,253,0,275,723,"Aenar, Andorian, Starfleet, Federation, Telepath, Inspiring, Botanist","male, nonhuman, organic, snw, hemmer, evsuit, crew_max_rarity_5","I Commend You To The Cosmos",0, 8, 8, 4, 10, 1, 1, , , , 350, , 90, 450, false,"Hemmer",crew_portraits_cm_hemmer_evsuit_sm.png,hemmer_evsuit_crew
"Fanboy Boimler",0,4, 0,0,0,0,0,0,316,83,131,875,172,253,619,104,213,0,0,0,0,1293,698,1091,0,1331,554,960,0,352,833,1062,168,370,777,0,1220,716,1115,0,1214,544,1024,0,334,740,991,222,404,824,1168,1231,"Human, Kazon, Federation, Starfleet, Resourceful, Survivalist, Desperate, Hunter","male, organic, low, boimler, crew_max_rarity_4","Fine, You Want to Play It That Way?",0, 6, 10, 8, 12, 5, 4, , , , , 30, , , false,"Boimler",crew_portraits_cm_boimler_fanboy_sm.png,boimler_fanboy_crew
"Chancellor Azetbur",0,5, 1023,149,340,0,0,0,0,0,0,0,0,0,1353,212,420,554,82,156,552,671,477,42,39,0,0,323,621,0,421,833,229,599,52,628,725,552,92,139,0,0,438,714,0,530,951,356,716,125,225,435,"Klingon, Cultural Figure, Brutal, Diplomat, Politician, Prodigy","female, organic, tos, azetbur, nonhuman, crew_max_rarity_5","We Are a Proud Race",2, 7, 12, 10, 14, 7, 0, , , , 750, 130, 295, 250, false,"Azetbur",crew_portraits_cm_azetbur_sm.png,azetbur_crew
"EV Suit Boimler",0,5, 1363,203,409,0,0,0,1063,146,319,564,102,201,0,0,0,0,0,0,236,33,46,485,112,488,722,0,0,117,714,324,989,553,0,394,130,80,614,246,650,714,0,0,208,854,507,1020,582,0,108,382,"Human, Federation, Starfleet, Desperate, Explorer, Resourceful, Survivalist","male, organic, evsuit, low, boimler, crew_max_rarity_5","We're All In This Together",1, 9, 8, 6, 10, 1, 0, 2, 2, 2, 225, 250, 200, 240, false,"Boimler",crew_portraits_cm_boimler_evsuit_sm.png,boimler_evsuit_crew
"Master Surchid Falow",0,5, 1044,131,273,0,0,0,0,0,0,563,88,158,1368,164,314,0,0,0,567,683,133,64,379,0,759,366,0,943,484,0,76,596,234,819,885,283,266,643,0,848,710,0,1018,834,0,237,695,528,306,886,"Wadi, Gambler, Communicator, Ambassador, Diplomat, Playful","male, organic, nonhuman, ds9, falow, crew_max_rarity_5","Double The Peril, Double Your Winnings",2, 10, 10, 6, 8, 4, 0, , , , 425, 150, 113, 100, false,"Falow",crew_portraits_cm_falow_sm.png,falow_crew
"Spy Rumdar",0,5, 0,0,0,0,0,0,889,198,450,433,99,301,1208,348,499,0,0,0,0,703,1099,512,0,559,871,351,0,158,35,386,79,692,217,0,500,757,315,0,315,567,195,0,53,8,208,12,433,134,377,55,"Pakled, Prisoner, Criminal, Desperate, Hero, Undercover Operative","male, organic, low, rumdar, nonhuman, crew_max_rarity_5","Im A Good Spy",0, 9, 8, 10, 12, , , , 3, 800, 100, 150, 730, 50, false,"Rumdar",crew_portraits_cm_rumdar_spy_sm.png,rumdar_spy_crew
"Gathorel Labin",0,5, 1034,216,418,0,0,0,489,133,295,0,0,0,1334,198,505,0,0,0,444,234,394,23,292,985,0,310,0,901,98,793,226,0,188,355,141,296,35,213,754,0,342,0,700,77,613,267,0,225,38,88,"Sikarian, Caregiver, Romantic, Merchant, Politician, Civilian, Festive","male, organic, nonhuman, voy, labin, crew_max_rarity_5","My Pleasure Will Be Greater Than Yours",1, 10, 6, 8, 12, , , , , , 40, 275, 140, 50, false,"Labin",crew_portraits_cm_labin_magistrate_sm.png,labin_magistrate_crew
"Doopler Emissary",0,5, 1079,140,324,535,94,225,0,0,0,0,0,0,1374,234,413,0,0,0,120,642,423,30,321,1010,740,87,599,0,383,0,221,0,179,189,768,596,100,505,953,682,132,572,0,499,0,330,0,273,91,309,"Doopler, Federation, Desperate, Clone, Merchant, Communicator, Diplomat","nonhuman, organic, male, low, doopler_emissary, crew_max_rarity_5","Oh, I'm So Sorry!",1, 10, 6, 2, 10, 7, 0, , , , 490, 75, 140, 415, false,"Doopler",crew_portraits_cm_doopler_sm.png,doopler_crew
"Talosian Keeper",0,4, 344,76,167,0,0,0,0,0,0,0,0,0,663,96,234,859,135,355,1293,1258,1220,734,176,0,0,928,412,0,1100,538,897,357,90,1166,1152,1123,697,138,0,0,1004,365,0,1135,472,950,279,144,1058,1014,"Talosian, Crafty, Telepath, Explorer, Shapeshifter, Interrogator","male, organic, nonhuman, dsc, keeper, crew_max_rarity_4","Material Illusion Is Our Primary Form Of Defense",2, 9, 6, 8, 10, , , , , , 185, 250, 25, 40, false,"The Keeper",crew_portraits_cm_dsc_talosian_keeper_sm.png,dsc_talosian_keeper_crew
"Barclay and Neelix",0,5, 0,0,0,561,97,196,0,0,0,1353,181,402,1055,112,349,0,0,0,1019,0,239,741,0,990,62,192,585,274,737,0,25,73,433,1054,0,417,870,0,1026,113,286,621,423,877,0,61,189,570,219,505,"Human, Starfleet, Federation, Quantum Mechanics, Crafty, Desperate, Innovator","male, voy, organic, barclay, crew_max_rarity_5","Sorry, Hes Not Used To Company",1, 9, 4, 8, 8, 3, 0, , , , 350, 225, 110, 600, true,"Barclay",crew_portraits_cm_barclay_neelix_sm.png,barclay_neelix_crew
"Ensign Hoya",0,4, 0,0,0,0,0,0,941,178,301,535,72,172,667,97,194,0,0,0,0,755,1057,1069,0,626,812,946,0,159,202,461,405,649,764,0,743,1127,1170,0,621,857,1092,0,239,328,482,531,698,891,837,1125,"Benzite, Starfleet, Romantic, Resourceful, Federation","female, organic, nonhuman, ds9, hoya, crew_max_rarity_4","Shields Are Down! Engage Warp",1, 9, 8, 6, 8, , , , 2, 2, 15, , , 175, false,"Hoya",crew_portraits_cm_hoya_ensign_sm.png,hoya_ensign_crew
"Kiley Pike",0,4, 400,72,175,686,69,150,0,0,0,0,0,0,944,84,249,0,0,0,482,1201,1151,508,1031,879,660,222,527,0,936,0,723,0,591,692,1143,1110,689,981,1203,913,581,750,0,1129,0,946,0,803,1029,1385,"Human, Kiley, Federation, Starfleet, Inspiring, Undercover Operative, Desperate","male, organic, snw, pike, crew_max_rarity_4","Take Me To Your Leader",1, 6, 10, 12, 12, 7, 0, , , , 750, 300, 125, 375, false,"Pike",crew_portraits_cm_pike_kiley_sm.png,pike_kiley_crew
"Breakthrough Booker",0,5, 0,0,0,1052,74,190,506,97,221,0,0,0,1358,173,354,0,0,0,644,1102,0,514,0,128,461,47,359,955,120,838,267,0,219,1118,1026,0,750,0,455,796,239,658,879,258,795,545,0,462,362,932,"Kwejian, Federation, Desperate, Empath, Inspiring, Civilian, Communicator","male, nonhuman, organic, dsc, booker, crew_max_rarity_5","That Is The Start of Making Things Right",2, 10, 6, 6, 10, , , , , , 200, , 20, 125, false,"Booker",crew_portraits_cm_booker_breakthrough_sm.png,dsc_booker_breakthrough_crew
"Inspiring Captain Burnham",0,5, 1377,190,454,1060,129,342,0,0,0,0,0,0,682,93,210,0,0,0,11,402,193,137,90,503,390,152,294,0,1094,0,892,0,738,35,501,287,218,203,655,447,262,388,0,1188,0,1021,0,860,7,322,"Federation, Starfleet, Human, Resourceful, Inspiring, Xenoanthropology, Innovator, Displaced","female, organic, dsc, burnham, crew_max_rarity_5","Lets Get To It",2, 9, 10, 10, 6, 4, 0, , , , , , 25, 40, false,"Burnham",crew_portraits_cm_dsc_burnham_inspiring_sm.png,dsc_burnham_inspiring_crew
"Captain Vasso L'Gaelia",0,5, 1151,100,203,537,53,146,0,0,0,0,0,0,1384,100,246,0,0,0,141,648,434,59,328,1112,838,138,684,0,536,0,333,0,278,613,1045,963,566,844,1272,969,593,809,0,1118,0,930,0,788,331,1334,"R'ongovian, Ambassador, Communicator, Diplomat, Empath","nonhuman, male, organic, snw, vasso, crew_max_rarity_5","We Shall Sit and Talk",2, 7, 4, 5, 10, 7, 0, , , , 400, 75, 30, 775, true,"Vasso",crew_portraits_cm_vasso_captain_sm.png,vasso_captain_crew
"Ensign Jennifer Sh'reyan",0,4, 891,188,261,0,0,0,335,86,162,686,121,192,0,0,0,0,0,0,729,513,124,898,531,1301,637,0,0,464,1392,1033,893,467,0,732,446,174,892,554,1117,693,0,0,458,1291,919,993,558,0,1044,1126,"Federation, Starfleet, Andorian, Athlete, Artist, Resourceful, Playful","female, nonhuman, organic, low, jen, crew_max_rarity_4","Pff...I Don't Think About You At All",0, 5, 1, 12, 15, 2, 0, , , , 500, 380, 180, 340, true,"Jen",crew_portraits_cm_jen_shreyan_sm.png,jen_shreyan_crew
"Captain Clark Terrell",0,4, 883,174,292,396,68,148,621,93,231,0,0,0,0,0,0,0,0,0,279,290,676,899,532,505,936,1242,772,818,1118,705,0,0,0,292,359,589,834,498,518,922,1228,759,861,1144,777,0,0,0,1045,1139,"Federation, Starfleet, Human, Desperate, Hero, Undercover Operative, Compromised","male, organic, tos, terrell, crew_max_rarity_4","What Do You Want With Us?",2, 4, 6, 4, 18, 1, 0, , , , 440, 200, 207, 475, true,"Terrell",crew_portraits_cm_terrell_captain_sm.png,terrell_captain_crew
"Borg Queen Jurati",0,4, 905,93,280,610,81,232,0,0,0,385,60,152,0,0,0,0,0,0,173,842,279,913,549,919,410,968,548,1118,0,0,1242,756,0,289,931,402,1012,688,968,393,1037,587,1098,0,0,1230,763,0,1109,1295,"Human, Federation, Borg, Cultural Figure, Cyberneticist, Resourceful, Survivalist, Displaced","female, organic, pic, jurati, crew_max_rarity_4","We Are Out of Time",0, 8, 8, 8, 12, , , , 2, 1, 200, , , 100, false,"Jurati",crew_portraits_cm_jurati_borg_sm.png,jurati_borg_crew
"Ixtana'Rax",0,5, 1090,102,252,0,0,0,1351,147,349,510,78,181,0,0,0,0,0,0,548,54,138,752,357,283,849,0,0,89,470,170,1118,678,0,907,299,338,1041,723,582,810,0,0,215,793,445,1113,673,0,322,911,"Jem'hadar, Dominion, Brutal, Desperate, Maverick, Tactician, Veteran","nonhuman, male, ixtanarax, organic, ds9, crew_max_rarity_5","Obedience is Victory",0, 10, 8, 9, 12, , , , , , , 95, 47, 275, false,"Ixtana'Rax",crew_portraits_cm_ixtanarax_sm.png,ixtanarax_crew
"Wizard Pollux Spock",0,4, 0,0,0,411,99,229,0,0,0,667,109,251,967,143,312,0,0,0,1205,0,810,826,0,1190,314,275,752,792,854,0,106,465,518,974,0,836,897,0,934,225,252,560,808,911,0,148,476,592,858,874,"Human, Vulcan, Telepath, Costumed, Villain, Undercover Operative","male, nonhuman, organic, snw, spock, crew_max_rarity_4","Please, Point That Elsewhere",1, 9, 4, 6, 8, , , , 0, 3, 425, 400, 43, 225, false,"Spock",crew_portraits_cm_spock_pollux_sm.png,spock_pollux_crew
"Princess Thalia and Runa",0,5, 1349,151,356,0,0,0,0,0,0,0,0,0,1058,102,254,528,53,153,287,484,250,66,16,0,0,623,689,0,774,895,542,674,107,590,697,509,286,151,0,0,955,785,0,1101,1020,899,774,418,363,986,"Human, Costumed, Royalty, Caregiver, Desperate, Musician","female, organic, snw, laan, crew_max_rarity_5","My Princess Runa Applauds You!",1, 10, 4, 6, 12, , , , , , 650, 250, 225, 690, false,"Thalia",crew_portraits_cm_laan_princess_thalia_sm.png,laan_princess_thalia_crew
"Croden",0,4, 0,0,0,385,63,166,916,195,355,0,0,0,659,110,207,0,0,0,1244,735,0,1064,0,166,940,569,778,549,196,432,909,0,761,1215,646,0,1116,0,183,890,594,733,468,236,359,981,0,825,924,954,"Rakhari, Crafty, Desperate, Duelist, Prisoner, Scoundrel, Vengeful","nonhuman, male, organic, croden, ds9, crew_max_rarity_4","Sometimes I Do Tell The Truth",0, 9, 10, 10, 10, , , , , , 475, 295, 105, 240, false,"Croden",crew_portraits_cm_croden_sm.png,croden_crew
"Captain Sonya Gomez",0,5, 1379,98,298,0,0,0,0,0,0,509,80,181,1058,101,252,0,0,0,309,504,65,72,165,0,850,626,0,1014,776,0,163,679,463,835,898,275,419,655,0,797,963,0,987,1109,0,390,659,768,410,1133,"Human, Federation, Starfleet, Tactician, Communicator, Resourceful, Inspiring","female, low, sonya, organic, crew_max_rarity_5","Take Us In, Nice And Slow",1, 8, 8, 8, 10, 3, 0, 3, , , 200, 525, 177, 225, false,"Sonya",crew_portraits_cm_sonya_gomez_captain_sm.png,sonya_gomez_captain_crew
"Spock as T'Pring",0,5, 0,0,0,520,78,266,1009,123,262,0,0,0,1324,219,376,0,0,0,1041,710,0,515,0,121,747,105,605,525,38,393,268,0,220,945,916,0,674,0,232,649,149,542,759,155,672,436,0,371,318,529,"Human, Vulcan, Federation, Starfleet, Telepath, Interrogator, Spiritual","snw, organic, nonhuman, spock, tpring, crew_max_rarity_5","This Is Coming Dangerously Close To Antics",2, 9, 8, 6, 12, 8, 4, , , , 250, 210, 180, 500, false,"Spock",crew_portraits_cm_spock_tpring_sm.png,spock_tpring_crew
"Sela in Shadow",0,5, 1355,227,427,0,0,0,0,0,0,1107,119,311,505,58,206,0,0,0,230,422,7,178,103,0,372,1125,0,453,1262,0,146,203,936,326,484,25,232,191,0,539,1124,0,701,1258,0,278,394,932,202,447,"Romulan, Human, Brutal, Scoundrel, Tactician, Villain, Saboteur","female, organic, tng, sela, crew_max_rarity_5","With Our Cloaking Devices, We Can Slip By You At Will",0, 7, 10, 12, 8, 1, 2, , , , , 100, , , false,"Sela",crew_portraits_cm_sela_shadow_sm.png,sela_shadow_crew
"Melora Pazlar",0,4, 667,121,298,916,173,351,385,73,184,0,0,0,0,0,0,0,0,0,109,586,782,992,644,171,476,714,372,1086,1338,974,0,0,0,90,465,717,947,616,185,398,633,328,995,1268,904,0,0,0,879,798,"Elaysian, Starfleet, Federation, Resourceful, Astrophysicist, Inspiring, Romantic, Explorer","nonhuman, female, organic, ds9, melora, crew_max_rarity_4","Im Perfectly Capable",1, 5, 12, 12, 20, 2, 0, , , , 75, 100, 20, 280, false,"Melora",crew_portraits_cm_melora_wheelchair_sm.png,melora_wheelchair_crew
"Tallinn",0,4, 0,0,0,667,90,231,941,147,308,0,0,0,0,0,0,365,62,166,901,769,0,0,1079,99,642,933,287,584,873,134,0,759,1082,989,796,0,0,1040,190,680,1021,304,628,890,182,0,736,1014,970,1155,"Romulan, Caregiver, Linguist, Communicator, Undercover Operative, Civilian","female, nonhuman, organic, pic, tallinn, crew_max_rarity_4","A Leap of Faith? It's Kind Of How I Roll",0, 7, 10, 8, 10, 4, 0, , , , , 135, , 225, false,"Tallin",crew_portraits_cm_tallinn_sm.png,tallinn_crew
