"Nyota Uhura",9,5, 899,74,127,0,0,0,536,63,125,0,0,0,1050,240,468,0,0,0,786,450,716,148,585,1078,0,483,0,987,184,875,402,0,342,1248,889,1187,232,1069,1263,0,314,0,1109,212,1025,248,0,208,744,920,"Human, Federation, Starfleet, Communicator, Resourceful, Musician","female, organic, tos, uhura, crew_max_rarity_5","Alameda Express",1, 8, 4, 10, 10, , , , , , 115, 15, 167, 565, false,"Uhura",crew_portraits_cm_uhurastiv_sm.png,uhura_stiv_crew
"Katra McCoy",7,4, 0,0,0,325,76,166,0,0,0,0,0,0,458,170,347,790,121,352,1299,0,0,1112,579,1296,996,721,218,0,1152,589,961,386,147,1166,0,0,739,495,1129,841,270,166,0,743,497,536,296,80,1234,736,"Federation, Starfleet, Vulcan, Desperate, Human, Physician, Compromised","male, organic, tos, mccoy, crew_max_rarity_4","Steps of Mount Seleya",1, 6, 4, 8, 8, 6, 0, , , , 450, 190, 53, 280, true,"McCoy",crew_portraits_cm_mccoy_katra_sm.png,mccoy_katra_crew
"Katrine",7,5, 1050,271,589,525,36,110,867,200,373,0,0,0,0,0,0,0,0,0,104,123,330,604,229,147,869,1168,720,585,873,480,0,0,0,65,30,94,269,64,231,1012,1313,849,422,654,322,0,0,0,661,167,"Human, Federation, Starfleet, Crafty, Desperate, Gambler, Saboteur, Undercover Operative, Costumed","female, organic, voy, janeway, crew_max_rarity_5","Leave The War Outside",0, 7, 6, 8, 14, 4, 2, , , , 315, 385, 80, 650, false,"Janeway",crew_portraits_cm_janeway_tuxedo_sm.png,janeway_tuxedo_crew
"M-113 Creature",8,4, 0,0,0,382,126,262,665,45,92,0,0,0,797,102,202,0,0,0,1182,1002,0,950,0,470,889,437,740,845,369,739,814,0,665,840,1284,0,1106,0,539,570,350,478,1156,932,1070,990,0,833,1148,1331,"M-113 Creature, Desperate, Exobiology, Shapeshifter, Telepath, Crafty","nonhuman, female, tos, salt_vampire, organic, crew_max_rarity_4","I Hunger",0, 6, 8, 3, 10, 1, 0, , , , 240, 145, 93, 560, true,"M-113 Creature",crew_portraits_cm_m113_sm.png,salt_vampire_crew
"Lal",10,4, 0,0,0,0,0,0,0,0,0,879,63,134,507,140,325,0,0,0,0,0,734,1095,0,0,577,976,0,715,1139,0,198,407,792,0,0,1197,831,0,0,939,719,0,1102,846,0,292,764,542,1419,1440,"Android, Federation, Prodigy, Bartender, Romantic, Civilian","nonhuman, female, tng, artificial_life, lal, crew_max_rarity_4","Reason For Being",0, 8, 6, 4, 8, , , , , , 450, 215, 77, 575, false,"Lal",crew_portraits_cm_lal_sm.png,lal_crew
"Commander Nevesa",10,4, 660,134,471,0,0,0,0,0,0,0,0,0,586,92,237,0,0,0,811,886,737,438,611,0,0,957,0,0,1122,0,930,0,775,391,559,332,217,254,0,0,982,0,0,1111,0,926,0,787,1420,1212,"Crafty, Romantic, Romulan, Resourceful","female, nonhuman, organic, tos, nevesa, crew_max_rarity_4","Hidden in Plain Sight",1, 7, 10, 8, 14, 1, 2, , , , 290, 310, 70, 565, false,"Nevesa",crew_portraits_cm_romulancommander_sm.png,nevesa_crew
"Mirror Bashir",8,5, 0,0,0,0,0,0,1101,249,531,829,186,403,0,0,0,0,0,0,0,541,660,0,0,370,518,0,0,54,562,235,706,346,0,0,364,382,0,0,172,317,0,0,11,311,120,416,173,0,830,381,"Human, Scoundrel, Engineered, Desperate, Saboteur, Survivalist, Mirror Universe, Terran Rebellion","nonhuman, male, organic, ds9, bashir, crew_max_rarity_5","I Owed You That",0, 10, 10, 12, 10, , , , , , 415, 55, 345, 675, false,"Bashir",crew_portraits_cm_bashir_mirror_sm.png,bashir_mirror_crew
"The Keeper",8,5, 526,27,75,922,357,755,0,0,0,0,0,0,0,0,0,945,149,458,109,1159,1110,1252,51,400,298,471,24,0,0,363,0,235,449,16,1300,1294,1412,158,41,33,49,3,0,0,296,0,158,336,643,76,"Talosian, Crafty, Exobiology, Quantum Mechanics, Telepath, Explorer, Shapeshifter, Interrogator","nonhuman, organic, male, tos, keeper, crew_max_rarity_5","A Curious Species",1, 8, 4, 10, 16, 5, 0, , , , 350, , 63, 115, false,"The Keeper",crew_portraits_cm_talosian_keeper_sm.png,talosian_keeper_crew
"Kilana",9,4, 506,128,298,0,0,0,0,0,0,0,0,0,797,160,341,0,0,0,986,1028,924,403,805,0,0,810,0,0,967,0,757,0,619,763,837,679,222,592,0,0,644,0,0,771,0,564,0,471,1403,1232,"Vorta, Clone, Crafty, Dominion, Scoundrel","nonhuman, female, organic, ds9, kilana, crew_max_rarity_4","For The Founders!",1, 7, 10, 10, 16, 6, 0, , , , 215, 275, 128, 560, false,"Kilana",crew_portraits_cm_kilana_sm.png,kilana_crew
"Talos IV Spock",4,3, 413,37,141,178,29,103,514,97,197,0,0,0,0,0,0,0,0,0,959,761,1141,1282,1025,799,1044,1362,873,938,1197,829,0,0,0,980,737,1217,1340,1103,738,1023,1321,857,912,1173,833,0,0,0,1463,1473,"Federation, Starfleet, Exobiology, Astrophysicist, Human, Vulcan, Telepath, Musician","nonhuman, male, organic, tos, spock, crew_max_rarity_3","We've Lost The Captain",0, 5, 10, 8, 8, , , , , , 690, 10, 105, 450, false,"Spock",crew_portraits_cm_spock_pilot_sm.png,spock_pilot_crew
"Author Doctor",8,4, 0,0,0,0,0,0,0,0,0,0,0,0,729,159,394,625,86,287,0,0,0,942,718,0,0,838,514,0,999,683,790,482,124,0,0,0,708,690,0,0,555,489,0,691,683,484,456,100,1389,1240,"Hologram, Human, Federation, Musician, Starfleet, Diplomat, Physician, Writer","nonhuman, male, artificial_life, voy, emh, crew_max_rarity_4","A Single Proton Flares",2, 8, 4, 4, 8, 3, 0, 2, , , 555, 100, 60, 225, false,"Doctor",crew_portraits_cm_emh_writer_sm.png,emh_writer_crew
"Musketeer La Forge",7,5, 436,58,138,0,0,0,1116,313,633,1009,92,237,0,0,0,0,0,0,1187,207,183,1263,1009,291,475,0,0,40,484,178,636,297,0,1260,100,469,1317,1083,90,637,0,0,15,163,59,923,510,0,599,236,"Hologram, Human, Duelist, Hero, Inspiring, Cyberneticist, Maverick, Veteran, Tactician","male, nonhuman, artificial_life, tng, laforge, crew_max_rarity_5","All For One",2, 9, 6, 10, 10, 3, 0, , , , 165, 70, 237, 500, true,"La Forge",crew_portraits_cm_laforge_musketeer_sm.png,laforge_musketeer_crew
"Ilia Probe",10,5, 0,0,0,1211,198,426,0,0,0,0,0,0,1023,48,101,0,0,0,354,0,0,882,0,366,286,71,200,0,919,0,708,0,579,386,0,0,1372,0,377,285,259,222,0,1410,0,1288,0,1110,831,1385,"Deltan, Romantic, Communicator, Probe, Android","female, nonhuman, artificial_life, tos, ilia, crew_max_rarity_5","Oath Of Celibacy",1, 10, 12, 8, 8, , , , , , 600, 100, 140, 440, false,"Ilia",crew_portraits_cm_ilia_probe_sm.png,ilia_probe_crew
"Romulan Data",8,5, 0,0,0,478,77,141,0,0,0,1153,185,399,969,142,279,0,0,0,1174,0,342,819,0,1155,103,264,727,377,850,0,45,149,515,1220,0,395,926,0,1188,150,420,739,412,976,0,63,180,655,681,739,"Android, Starfleet, Federation, Cyberneticist, Undercover Operative, Musician, Romulan","nonhuman, male, tng, artificial_life, data, crew_max_rarity_5","No Regrets",2, 7, 6, 8, 14, 5, 2, , , , 500, 150, 40, 300, false,"Data",crew_portraits_cm_data_romulan_sm.png,data_romulan_crew
"Zhian'tara Odo",8,5, 899,184,356,0,0,0,535,72,148,0,0,0,1279,113,225,0,0,0,656,334,595,119,470,1047,0,465,0,964,160,850,389,0,330,516,384,438,256,357,1161,0,971,0,1050,679,965,915,0,776,620,906,"Changeling, Communicator, Bajoran, Trill, Constable, Investigator, Shapeshifter","nonhuman, male, organic, ds9, odo, dax, crew_max_rarity_5","It's Better This Way",0, 6, 6, 10, 12, 4, 0, , , , 580, 225, 5, 440, true,"Odo",crew_portraits_cm_odo_curzon_sm.png,odo_curzon_crew
"Gaia Odo",3,2, 0,0,0,0,0,0,260,24,83,0,0,0,384,54,134,0,0,0,0,1293,0,1314,0,1350,0,1242,0,1180,1088,1086,1222,0,1058,0,1295,0,1332,0,1353,0,1255,0,1178,1175,1088,1240,0,1066,1575,1604,"Changeling, Bajoran, Constable, Romantic, Communicator, Shapeshifter","nonhuman, male, organic, ds9, odo, crew_max_rarity_2","You Have To Go Home",2, 3, 10, 12, 10, 0, 2, , , , 630, 135, 58, 315, false,"Odo",crew_portraits_cm_odo_future_sm.png,odo_future_crew
"Prisoner O'Brien",6,4, 0,0,0,0,0,0,583,83,187,694,244,503,447,11,21,0,0,0,0,1020,686,1330,0,941,551,1257,0,175,829,761,351,368,1073,0,1082,174,1438,0,1036,170,1373,0,66,1154,866,168,62,1178,1173,1004,"Human, Starfleet, Federation, Prisoner, Desperate, Survivalist, Brutal, Jury Rigger","male, organic, ds9, obrien, crew_max_rarity_4","It's Real To Me",0, 7, 4, 14, 16, 5, 0, , , , 400, 80, 85, 525, false,"O'Brien",crew_portraits_cm_obrien_prisoner_sm.png,obrien_prisoner_crew
"Lieutenant Commander Saru",7,2, 274,21,92,349,62,179,0,0,0,0,0,0,0,0,0,0,0,0,912,1288,1277,1392,1160,1275,961,1263,809,0,0,0,0,0,0,902,1292,1282,1403,1166,1133,843,1156,696,0,0,0,0,0,0,1576,1583,"Kelpien, Federation, Starfleet, Exobiology, Survivalist","male, nonhuman, organic, dsc, saru, crew_max_rarity_2","Kelpien Instincts",2, 2, 6, 6, 12, 6, 0, , , , 77, 100, 75, 570, false,"Saru",crew_portraits_cm_dsc_saru_lieutenant_sm.png,dsc_saru_lieutenant_crew
"T'Mir",7,4, 686,184,403,0,0,0,0,0,0,0,0,0,557,137,298,0,0,0,808,880,733,411,606,0,0,942,0,0,1106,0,914,0,762,445,596,381,161,301,0,0,808,0,0,950,0,727,0,628,1406,1065,"Vulcan, Telepath, Survivalist, Resourceful, Civilian, High Command","nonhuman, female, organic, ent, tmir, crew_max_rarity_4","What if you lose?",0, 7, 4, 4, 16, 1, 0, , , , 440, 100, 130, 1815, false,"T'Mir",crew_portraits_cm_tmir_sm.png,tmir_crew
"Lieutenant Arex Na Eth",9,4, 631,183,415,572,85,202,0,0,0,0,0,0,322,105,207,0,0,0,250,895,749,635,620,959,700,681,571,0,1353,0,1228,0,1062,109,581,356,228,276,1020,737,488,616,0,1141,0,973,0,813,1263,776,"Edosian, Starfleet, Federation, Musician, Pilot, Explorer, Astrophysicist, Playful, Compromised","nonhuman, male, organic, tas, arex, crew_max_rarity_4","This Is No Joke",1, 9, 10, 10, 12, , , , , , 475, 155, 293, 615, false,"Arex",crew_portraits_cm_arex_animated_sm.png,arex_lute_crew
"Temporal Prisoner Chakotay",8,5, 0,0,0,0,0,0,1166,134,414,1041,68,201,0,0,0,610,10,52,0,553,586,0,921,398,468,0,655,53,591,39,629,35,903,0,637,1023,0,1197,481,753,0,882,165,686,261,1053,508,1171,633,1275,"Human, Desperate, Federation, Marksman, Saboteur, Resourceful, Prisoner, Displaced","male, organic, voy, chakotay, crew_max_rarity_5","Timeline Triage",2, 7, 8, 6, 12, 7, 0, , , , 780, 230, 80, 190, false,"Chakotay",crew_portraits_cm_chakotay_shattered_sm.png,chakotay_shattered_crew
"Laborer Spock",6,5, 0,0,0,1205,157,321,0,0,0,971,144,315,0,0,0,0,0,0,382,0,551,0,0,406,42,476,226,553,0,0,598,273,0,665,0,604,0,0,631,78,701,370,611,0,0,640,315,0,829,1230,"Federation, Starfleet, Exobiology, Astrophysicist, Human, Vulcan, Telepath, Jury Rigger, Communicator, Thief, Resourceful, Musician","nonhuman, male, organic, tos, spock, crew_max_rarity_5","Stone Knives and Bear Skins",1, 10, 4, 8, 8, 3, 0, , , , 540, 200, 80, 350, true,"Spock",crew_portraits_cm_spock_janitor_sm.png,spock_janitor_crew
"First Officer Burnham",7,5, 1359,88,294,944,207,478,667,50,101,0,0,0,0,0,0,0,0,0,24,180,283,545,180,90,393,586,301,838,1118,734,0,0,0,50,652,762,970,662,148,234,364,183,1146,1405,1063,0,0,0,244,754,"Federation, Starfleet, Astrophysicist, Human, Xenoanthropology, Resourceful","female, organic, dsc, burnham, crew_max_rarity_5","We Need To Strike First!",1, 8, 12, 5, 10, 1, 0, 2, , , 475, 70, 85, 740, false,"Burnham",crew_portraits_cm_dsc_burnham_first_officer_sm.png,dsc_burnham_first_officer_crew
"Rura Penthe Kirk",7,5, 0,0,0,0,0,0,1337,197,391,0,0,0,854,230,569,0,0,0,0,441,0,752,0,223,0,598,0,238,21,133,515,0,437,0,593,0,348,0,418,0,220,0,401,20,304,156,0,153,761,368,"Human, Federation, Starfleet, Romantic, Inspiring, Duelist, Desperate, Survivalist, Criminal, Prisoner","male, organic, tos, kirk, crew_max_rarity_5","Aim for the 'Knee'",2, 7, 6, 6, 12, 1, 2, , , , 550, 230, 50, 625, false,"Kirk",crew_portraits_cm_kirk_rura_penthe_sm.png,kirk_rura_penthe_crew
"Cadet Wesley Crusher",10,4, 0,0,0,745,160,385,0,0,0,682,85,188,0,0,0,0,0,0,789,0,818,0,0,767,146,843,447,783,0,0,891,467,0,528,0,1018,0,0,514,146,584,306,942,0,0,1047,620,0,1382,1338,"Human, Federation, Starfleet, Pilot, Prodigy","male, organic, tng, wesley, crew_max_rarity_4","Duty To The Truth",1, 6, 10, 10, 12, 4, 0, , , , 300, 200, 110, 100, false,"Wesley",crew_portraits_cm_wesley_crusher_cadet_sm.png,wesley_cadet_crew
"Smitten Jean-Luc Picard",8,5, 1059,98,163,0,0,0,0,0,0,0,0,0,1122,343,651,0,0,0,607,734,549,74,433,0,0,347,0,0,467,0,267,0,223,1080,1093,1040,49,920,0,0,108,0,0,145,0,68,0,78,778,679,"Federation, Starfleet, Human, Romantic, Inspiring, Communicator, Musician, Playful","male, organic, tng, picard, crew_max_rarity_5","My Love Is a Fever",0, 8, 9, 5, 16, 1, 1, , , , 575, 170, 190, 40, false,"Picard",crew_portraits_cm_picard_smitten_sm.png,picard_smitten_crew
"Trader Worf",8,5, 0,0,0,0,0,0,1012,242,574,0,0,0,1013,75,236,0,0,0,0,561,0,825,0,407,0,690,0,382,69,268,620,0,521,0,327,0,1096,0,149,0,1012,0,162,73,102,974,0,816,834,859,"Klingon, Tactician, Undercover Operative, Federation, Starfleet, Tribbled, Displaced","nonhuman, male, organic, ds9, worf, crew_max_rarity_5","Detestable Creatures!",0, 8, 6, 10, 12, 5, 0, , , , 640, 100, 230, 300, false,"Worf",crew_portraits_cm_worf_trader_sm.png,worf_trader_crew
"Miral Torres",10,4, 0,0,0,0,0,0,598,129,264,0,0,0,761,127,286,0,0,0,0,948,0,948,0,853,0,853,0,795,307,684,807,0,659,0,885,0,939,0,768,0,847,0,723,290,644,779,0,668,1400,1339,"Klingon, Civilian, Desperate","nonhuman, female, organic, voy, miral, crew_max_rarity_4","You Dishonor Me!",1, 7, 14, 12, 14, 5, 0, , , , 440, 275, 58, 625, false,"Miral",crew_portraits_cm_miral_sm.png,miral_crew
"Commander Barak",9,4, 899,69,187,0,0,0,627,85,190,0,0,0,0,0,0,0,0,0,774,341,699,928,571,884,0,0,0,821,1105,711,0,0,0,1095,658,1058,1196,937,1028,0,0,0,938,1208,860,0,0,0,1391,1501,"Klingon, Brutal, Tactician, Hero","nonhuman, male, organic, tos, barak, crew_max_rarity_4","Honor and Glory",0, 6, 10, 10, 20, 2, 0, , , , 600, 30, 105, 400, false,"Barak",crew_portraits_cm_barak_commander_sm.png,barak_commander_crew
"First Officer Saru",9,4, 597,74,239,816,195,414,0,0,0,0,0,0,0,0,0,0,0,0,164,996,886,1081,776,702,524,762,400,0,0,0,0,0,0,96,1009,912,1083,803,411,305,475,240,0,0,0,0,0,0,1370,1246,"Kelpien, Federation, Starfleet, Exobiology, Survivalist","male, nonhuman, organic, dsc, saru, crew_max_rarity_4","Vigilance Equals Survival",1, 9, 8, 8, 10, , , , 2, 3, 325, 300, 55, 690, false,"Saru",crew_portraits_cm_saru_science_officer_sm.png,dsc_saru_scanner_crew
"Desert Philippa Georgiou",9,5, 912,152,353,0,0,0,0,0,0,0,0,0,1242,146,284,0,0,0,662,769,597,118,476,0,0,461,0,0,586,0,386,0,328,579,690,500,218,414,0,0,820,0,0,959,0,739,0,639,827,1213,"Human, Federation, Starfleet, Inspiring, Diplomat, Veteran","female, organic, dsc, georgiou, crew_max_rarity_5","Prepared Surprise",0, 8, 6, 12, 14, 5, 0, , , , 300, 415, 125, 490, false,"Georgiou",crew_portraits_cm_dsc_georgiou_desert_sm.png,dsc_georgiou_desert_crew
"T'Kuvma",8,5, 1096,240,572,0,0,0,962,219,439,0,0,0,0,0,0,0,0,0,359,78,319,587,219,479,0,0,0,444,709,319,0,0,0,154,24,124,319,83,292,0,0,0,296,464,192,0,0,0,780,237,"Klingon, Brutal, Hero, Cultural Figure, Spiritual","male, nonhuman, organic, tkuvma, dsc, crew_max_rarity_5","Are You Worthy",0, 9, 10, 5, 12, 1, 0, 2, , , 475, 260, 133, 575, false,"T'Kuvma",crew_portraits_cm_tkuvma_sm.png,dsc_tkuvma_mekleth_crew
"Reinforcements Stamets",10,4, 0,0,0,853,87,228,614,58,183,0,0,0,0,0,0,0,0,0,788,1005,0,0,0,149,570,842,446,847,1131,742,0,0,0,981,1133,0,0,0,483,678,1013,573,997,1272,916,0,0,0,1407,1496,"Human, Starfleet, Federation, Exomycologist, Prodigy","male, organic, dsc, stamets, crew_max_rarity_4","Calling Reinforcements",1, 7, 16, 12, 10, 7, 0, , , , 400, 100, 100, 500, false,"Stamets",crew_portraits_cm_stamets_sm.png,dsc_stamets_callbackup_crew
"Captain Lorca",9,5, 1263,232,542,0,0,0,0,0,0,0,0,0,1014,131,260,0,0,0,237,443,213,60,116,0,0,626,0,0,784,0,555,0,470,184,366,153,72,106,0,0,874,0,0,1020,0,814,0,697,770,811,"Starfleet, Human, Tactician, Federation, Explorer, Mirror Universe","male, organic, dsc, lorca, crew_max_rarity_5","We Are A Long Way From Home",1, 9, 12, 3, 12, 4, 1, , , , 650, 75, 140, 240, false,"Lorca",crew_portraits_cm_lorca_sm.png,dsc_lorca_stance_crew
"Fierce Guinan",7,4, 0,0,0,0,0,0,637,104,217,0,0,0,703,244,533,0,0,0,0,945,0,896,0,850,0,779,0,790,245,677,726,0,591,0,992,0,382,0,911,0,242,0,851,85,771,176,0,168,1353,921,"Communicator, Counselor, Civilian, Survivalist, Empath, Bartender, El-Aurian, Brutal","nonhuman, female, organic, tng, guinan, exclusive_voyage, crew_max_rarity_4","We've Had Some Dealings",2, 8, 10, 10, 10, , , , 1, 2, 415, 355, 117, 565, false,"Guinan",crew_portraits_cm_guinan_fierce_sm.png,guinan_fierce_crew
"Cadet Sylvia Tilly",10,5, 0,0,0,970,88,231,0,0,0,1217,189,373,0,0,0,0,0,0,703,0,323,0,0,683,44,747,392,357,0,0,372,136,0,973,0,420,0,0,937,102,1006,564,446,0,0,464,202,0,833,1281,"Human, Theoretical Engineer, Federation, Starfleet","female, organic, dsc, tilly, crew_max_rarity_5","I Can Help You",1, 10, 8, 12, 12, , , , , , 590, 225, 160, 340, false,"Tilly",crew_portraits_cm_tilly_sm.png,dsc_tilly_cadet_crew
"Lt. Ash Tyler",7,4, 652,119,218,0,0,0,829,165,342,0,0,0,0,0,0,0,0,0,883,281,811,1031,692,711,0,0,0,658,930,535,0,0,0,923,301,862,1057,754,555,0,0,0,525,748,421,0,0,0,1345,1299,"Human, Federation, Starfleet, Survivalist, Tactician, Marksman, Pilot, Klingon","male, organic, dsc, tyler, voq, crew_max_rarity_4","Full Scale Attack",2, 7, 10, 10, 12, , , , , , 575, 225, 153, 450, false,"Tyler",crew_portraits_cm_tyler_sm.png,dsc_tyler_lt_crew
"Festive Jadzia Dax",5,2, 0,0,0,367,32,125,0,0,0,0,0,0,255,28,69,0,0,0,1297,0,0,1405,0,1295,994,963,827,0,1431,0,1337,0,1151,1320,0,0,1418,0,1314,1002,1127,842,0,1443,0,1344,0,1154,1589,1610,"Federation, Starfleet, Exobiology, Astrophysicist, Trill, Gambler, Pilot, Romantic","nonhuman, female, organic, ds9, dax, crew_max_rarity_2","Toruk-DOH!",0, 3, 8, 6, 10, 4, 2, , , , 260, 80, 25, 515, false,"J. Dax",crew_portraits_cm_jadzia_purple_sm.png,dax_jadzia_purple_crew
"Harcourt Fenton Mudd",8,5, 0,0,0,1065,81,189,0,0,0,0,0,0,1264,179,391,0,0,0,608,0,0,546,0,600,433,60,336,0,529,0,327,0,273,1077,0,0,687,0,1054,760,198,636,0,670,0,455,0,391,796,1319,"Human, Civilian, Scoundrel, Crafty, Smuggler, Resourceful, Survivalist, Federation, Playful","male, organic, dsc, mudd, crew_max_rarity_5","Choose Wisely",0, 10, 6, 6, 6, , , 2, , , 415, 340, 50, 500, false,"Mudd",crew_portraits_cm_harry_mudd_sm.png,dsc_mudd_harry_crew
"Sarek",6,4, 592,83,208,338,69,207,0,0,0,0,0,0,801,175,354,0,0,0,597,1011,902,374,790,1270,956,429,804,0,951,0,743,0,607,489,1053,976,320,857,1038,749,216,628,0,730,0,519,0,441,1143,933,"Vulcan, Diplomat, Cultural Figure, Communicator, Federation, Telepath, Ambassador","nonhuman, male, organic, sarek, dsc, crew_max_rarity_4","The Vulcan Hello",0, 9, 6, 8, 14, , , , , , 150, 245, 110, 315, false,"Sarek",crew_portraits_cm_sarek_sm.png,dsc_sarek_young_crew
"Gabriel Bell",4,4, 589,152,354,0,0,0,222,181,342,0,0,0,815,102,267,0,0,0,865,618,789,342,666,1259,0,839,0,1098,572,1007,792,0,650,573,162,494,260,409,525,0,907,0,500,213,394,849,0,723,1099,338,"Human, Federation, Starfleet, Bajoran, Cultural Figure, Hero, Costumed, Chef, Inspiring, Displaced","male, organic, ds9, sisko, crew_max_rarity_4","Think Again",2, 6, 10, 8, 12, 5, 1, , , , 395, 90, 50, 480, false,"Sisko",crew_portraits_cm_sisko_bell_sm.png,sisko_bell_crew
"Ruk",9,4, 0,0,0,342,74,160,857,102,215,614,82,249,0,0,0,0,0,0,1284,857,867,0,0,380,412,1278,819,165,973,578,912,505,0,1181,1000,881,0,0,491,347,1163,708,311,1126,781,919,506,0,1156,1278,"Android, Duelist, Cyberneticist, Hunter","male, tos, nonhuman, artificial_life, ruk, crew_max_rarity_4","Preternatural Hunt",0, 6, 8, 6, 12, 0, 1, , , , 50, 500, 170, 340, false,"Ruk",crew_portraits_cm_ruk_sm.png,ruk_crew
"Defensive Phlox",6,5, 0,0,0,765,174,461,403,147,297,0,0,0,0,0,0,934,261,913,751,1127,0,0,223,168,543,796,29,995,1249,37,0,134,318,373,811,0,0,12,49,273,432,1,654,907,4,0,6,36,688,27,"Denobulan, Civilian, Physician, Romantic, Exobiology","male, nonhuman, organic, ent, phlox, crew_max_rarity_5","Intimidating Prospect",1, 7, 4, 10, 10, 3, 0, 3, , , 450, 275, 142, 250, false,"Phlox",crew_portraits_cm_phlox_defensive_sm.png,phlox_defensive_crew
"C.O.P. Founder Archer",8,4, 653,52,100,0,0,0,0,0,0,0,0,0,790,161,309,0,0,0,972,1017,910,405,794,0,0,822,0,0,977,0,766,0,630,1321,1274,1248,592,1140,0,0,707,0,0,832,0,616,0,526,1405,1466,"Federation, Starfleet, Human, Inspiring, Cultural Figure, Communicator","male, organic, ent, archer, crew_max_rarity_4","To Boldly Go",2, 6, 12, 12, 12, 7, 0, , , , 315, 200, 145, 630, false,"Archer",crew_portraits_cm_archer_founder_sm.png,archer_founder_crew
"Colonel Worf",9,4, 601,83,224,0,0,0,0,0,0,0,0,0,848,129,286,0,0,0,946,995,884,367,775,0,0,803,0,0,959,0,749,0,611,982,1020,932,435,822,0,0,842,0,0,983,0,771,0,663,1383,1404,"Klingon, Communicator, Counselor, Inspiring","nonhuman, male, organic, tos, colonel_worf, exclusive_voyage, crew_max_rarity_4","Objection!",0, 8, 7, 8, 10, 3, 0, 3, , , 600, 150, 68, 365, false,"Worf",crew_portraits_cm_worf_colonel_sm.png,worf_colonel_crew
"Anbo-jyutsu Riker",6,4, 624,124,263,0,0,0,747,120,255,0,0,0,0,0,0,0,0,0,888,356,816,1040,698,784,0,0,0,721,1017,614,0,0,0,828,378,753,966,655,798,0,0,0,756,1033,671,0,0,0,1404,1375,"Human, Federation, Starfleet, Duelist, Pilot, Maverick, Romantic, Gambler, Athlete, Casual","male, organic, tng, riker, crew_max_rarity_4","The Ultimate Evolution",1, 7, 14, 12, 14, 5, 0, , , , 315, 230, 135, 415, false,"Riker",crew_portraits_cm_riker_anbo_sm.png,riker_anbo_crew
"Torchbearer Rejac",7,5, 959,146,363,0,0,0,1125,292,580,0,0,0,0,0,0,0,0,0,581,87,519,785,401,320,0,0,0,317,518,208,0,0,0,562,38,485,740,400,122,0,0,0,126,222,86,0,0,0,783,357,"Klingon, Cultural Figure, Brutal, Duelist, Inspiring","evsuit, nonhuman, male, organic, dsc, rejac, crew_max_rarity_5","Sacred Duty!",0, 10, 8, 8, 8, , , , 1, 4, 800, 250, 175, 240, false,"Rejac",crew_portraits_cm_torchbearer_sm.png,dsc_rejac_torchbearer_crew
"Klingon O'Brien",7,4, 0,0,0,0,0,0,432,28,60,589,104,229,746,167,372,0,0,0,0,1209,888,939,0,1253,677,833,0,491,566,1002,170,521,645,0,1308,875,721,0,1367,636,581,0,690,534,1099,105,504,427,1176,1190,"Starfleet, Federation, Klingon, Human, Jury Rigger, Undercover Operative, Duelist, Veteran, Saboteur","male, organic, ds9, obrien, crew_max_rarity_4","House of Konjah",2, 8, 6, 4, 10, 3, 0, 2, , , 1380, 240, 110, 690, false,"O'Brien",crew_portraits_cm_obrien_klingon_sm.png,obrien_klingon_crew
"Armed Philippa Georgiou",7,4, 512,157,351,0,0,0,355,84,170,0,0,0,904,109,159,0,0,0,938,667,877,373,768,1248,0,812,0,1092,550,1000,759,0,621,569,379,490,373,404,1075,0,1092,0,979,733,897,1062,0,903,1126,1038,"Human, Federation, Starfleet, Inspiring, Diplomat","female, organic, dsc, georgiou, crew_max_rarity_4","Starfleet Doesn't Fire First",1, 5, 4, 10, 8, , , , , , 550, 200, 100, 150, true,"Georgiou",crew_portraits_cm_georgiou_rifle_sm.png,dsc_georgiou_rifle_crew
"Admiral Nechayev",9,5, 888,266,706,0,0,0,498,82,202,0,0,0,784,188,411,0,0,0,416,251,373,144,275,1065,0,781,0,978,334,865,729,0,594,72,65,56,12,40,1012,0,479,0,928,220,848,405,0,347,724,63,"Human, Federation, Starfleet, Tactician, Veteran, Diplomat","female, organic, tng, necayev, crew_max_rarity_5","Stand Down",0, 8, 4, 10, 16, 5, 0, , , , 565, 100, 200, 400, false,"Nechayev",crew_portraits_cm_necayevadmiral_sm.png,necayev_admiral_crew
"Niners Sisko",6,5, 1150,143,317,0,0,0,1046,96,207,0,0,0,0,0,0,0,0,0,405,133,365,641,266,549,0,0,0,511,785,386,0,0,0,672,375,587,825,501,952,0,0,0,880,1147,806,0,0,0,839,1372,"Human, Federation, Bajoran, Cultural Figure, Starfleet, Athlete, Costumed, Inspiring, Desperate, Casual, Playful","male, organic, ds9, sisko, niners, crew_max_rarity_5","Hey Batter!",2, 8, 14, 10, 12, 4, 0, , , , 450, 245, 122, 480, false,"Sisko",crew_portraits_cm_sisko_niners_sm.png,sisko_niners_crew
"Tactical Michael Burnham",6,4, 669,62,171,0,0,0,756,196,397,338,47,131,0,0,0,0,0,0,917,313,521,1058,736,739,1007,0,0,361,957,560,1290,790,0,1169,318,709,1238,997,408,976,0,0,195,608,297,1254,782,0,1144,1102,"Federation, Starfleet, Astrophysicist, Xenoanthropology, Innovator, Human, Resourceful","female, organic, dsc, burnham, crew_max_rarity_4","I Am Trying To Save You",0, 8, 6, 10, 8, , , 2, , , 675, 100, 185, 490, false,"Burnham",crew_portraits_cm_burnham_tactical_sm.png,dsc_burnham_pistol_crew
"Buster Kincaid Kim",8,4, 0,0,0,371,65,143,769,171,356,551,104,245,0,0,0,0,0,0,1256,854,922,0,0,365,440,1258,802,179,969,573,956,534,0,1243,664,843,0,0,216,355,1217,765,124,721,391,882,482,0,1189,942,"Starfleet, Federation, Human, Hero, Costumed","male, organic, voy, kim, crew_max_rarity_4","We're Going Down!",1, 7, 14, 10, 18, 2, 0, , , , 550, 200, 60, 425, false,"Kim",crew_portraits_cm_buster_kinkaid_sm.png,kim_buster_crew
"Honey Bare Jadzia",9,5, 0,0,0,1147,203,483,0,0,0,916,149,360,641,33,73,0,0,0,372,0,602,1115,0,387,40,137,211,588,1160,0,154,301,808,291,0,501,1410,0,282,19,236,180,526,1438,0,369,251,1148,564,605,"Hologram, Geologist, Romantic, Desperate, Trill","nonhuman, artificial_life, female, ds9, dax, crew_max_rarity_5","I'm Sorry Doctor",2, 10, 12, 12, 12, , , , 1, 2, 500, 75, 180, 275, false,"J. Dax",crew_portraits_cm_jadzia_honey_bare_sm.png,dax_honey_bare_crew
"Dr. Hugh Culber",9,5, 0,0,0,1103,121,284,0,0,0,0,0,0,0,0,0,1371,156,390,498,0,0,0,122,483,371,569,2,0,0,149,0,66,199,817,0,0,0,365,769,552,863,61,0,0,377,0,225,421,756,1216,"Human, Physician, Romantic, Federation, Starfleet","male, organic, dsc, culber, crew_max_rarity_5","Surgical Precision",2, 10, 6, 6, 10, , , 2, , , 600, 240, 7, 425, false,"Culber",crew_portraits_cm_hugh_culber_sm.png,dsc_culber_doctor_crew
"Commander Chapel",9,4, 0,0,0,739,76,257,0,0,0,0,0,0,245,149,301,546,99,350,832,0,0,1339,771,806,594,505,117,0,1362,727,1245,514,463,950,0,0,888,567,908,644,243,121,0,908,575,689,370,108,1259,740,"Federation, Starfleet, Human, Physician, Veteran","female, organic, tos, chapel, crew_max_rarity_4","Doctor's Orders",2, 7, 8, 8, 16, 6, 0, , , , 1450, 75, 155, 400, false,"Chapel",crew_portraits_cm_chapel_commander_sm.png,chapel_commander_crew
"Leonardo da Vinci",6,5, 0,0,0,1229,80,228,0,0,0,1092,177,354,0,0,0,366,161,483,410,0,383,0,870,419,28,498,59,404,0,820,434,22,850,996,0,460,0,214,965,127,1034,60,495,0,225,509,5,278,476,250,"Hologram, Prodigy, Inspiring, Innovator, Civilian, Human, Artist, Cultural Figure, Astrophysicist","male, organic, voy, davinci, crew_max_rarity_5","Poor is the Pupil",2, 6, 6, 8, 8, 6, 0, 2, , , 1815, 330, 83, 175, false,"Leonardo",crew_portraits_cm_davinci_sm.png,davinci_crew
