"Aviator Yar",6,5, 515,95,229,0,0,0,1021,217,543,1095,73,186,0,0,0,0,0,0,632,116,47,682,530,221,224,0,0,24,348,147,258,140,0,585,86,205,647,494,121,444,0,0,32,207,97,655,382,0,248,284,"Human, Pilot, Maverick, Duelist, Hero, Survivalist, Costumed","female, organic, tng, lieutenant, bridge_crew, yar, original, crew_max_rarity_5","Danger Zone",0, 7, 6, 12, 12, 0, 1, , , , 240, , 47, 415, false,"Yar",crew_portraits_cm_yarwwii_sm.png,yar_pilot_crew
"Tuskegee Mayweather",7,4, 589,63,152,0,0,0,0,0,0,828,74,159,0,0,0,0,0,0,620,629,80,669,512,0,338,0,0,418,0,0,466,258,0,757,733,355,771,654,0,472,0,0,617,0,0,689,400,0,871,968,"Human, Pilot, Hero, Costumed","male, organic, ent, mayweather, original, crew_max_rarity_4","Unsung Hero",2, 6, 12, 12, 12, 7, 0, , , , 490, 220, 187, 355, false,"Mayweather",crew_portraits_cm_mayweatherwwii_sm.png,mayweather_tuskegee_crew
"GI Chakotay",8,4, 634,156,367,0,0,0,513,162,325,0,0,0,200,168,326,0,0,0,488,225,425,391,379,549,0,796,0,484,427,444,776,0,675,323,108,254,110,242,361,0,407,0,323,97,293,329,0,321,713,161,"Human, Starfleet, Federation, Hunter, Tactician, Survivalist, Costumed, Maquis","male, organic, voy, bridge_crew, commander, first_officer, chakotay, crew_max_rarity_4","Gung Ho",0, 6, 12, 12, 12, 7, 0, , , , 765, 185, 10, 850, false,"Chakotay",crew_portraits_cm_chakotaywwii_sm.png,chakotay_wwii_crew
"RAF Miles O'Brien",6,5, 1060,60,137,0,0,0,625,95,205,1121,176,346,0,0,0,0,0,0,354,137,17,465,266,528,196,0,0,40,644,432,217,105,0,780,430,115,795,673,599,248,0,0,92,695,525,304,168,0,226,616,"Human, Pilot, Jury Rigger, Hero, Costumed","male, organic, tng, obrien, ds9, crew_max_rarity_5","Per Ardua Ad Astra",0, 7, 16, 3, 16, 1, 2, , , , 700, , 182, 890, false,"O'Brien",crew_portraits_cm_obrienwwii_sm.png,obrien_wwii_crew
"RAF Julian Bashir",3,4, 0,0,0,0,0,0,583,112,241,0,0,0,0,0,0,830,57,144,0,595,0,0,369,547,0,0,290,483,653,43,0,256,401,0,575,0,0,671,524,0,0,469,466,639,221,0,418,635,854,922,"Human, Pilot, Hero, Costumed, Engineered, Physician","nonhuman, male, organic, ds9, bashir, crew_max_rarity_4","Hedge Hopping",1, 7, 3, 8, 12, , , , , , 830, 725, 104, 515, false,"Bashir",crew_portraits_cm_bashirwwii_sm.png,bashir_wwii_crew
"Command Hologram",8,4, 615,62,144,0,0,0,282,29,93,0,0,0,0,0,0,674,94,319,606,481,540,659,48,844,0,0,301,725,878,182,0,270,414,769,601,705,786,155,846,0,0,287,717,884,242,0,236,405,765,831,"Hologram, Human, Federation, Starfleet, Hero, Musician, Tactician","nonhuman, male, artificial_life, voy, ech, emh, crew_max_rarity_4","Activate the Photonic Cannon!",2, 9, 12, 10, 12, , , , 1, 2, 365, 150, 45, 375, false,"Doctor",crew_portraits_cm_ech_sm.png,emh_command_crew
"Hologram Barclay",9,4, 0,0,0,614,52,113,0,0,0,666,169,378,0,0,0,0,0,0,627,0,418,0,0,599,121,614,369,422,0,0,471,260,0,822,0,244,0,0,811,125,801,505,276,0,0,278,152,0,874,855,"Hologram, Human, Starfleet, Federation, Innovator, Astrophysicist","male, nonhuman, artificial_life, voy, barclay, crew_max_rarity_4","Problem Solver",2, 7, 12, 10, 12, , , , , , 590, 100, 135, 415, false,"Barclay",crew_portraits_cm_barclayhologram_sm.png,barclay_hologram_crew
"Antaak",5,4, 0,0,0,630,60,159,0,0,0,0,0,0,0,0,0,532,214,753,594,0,0,0,336,570,391,585,67,0,0,341,0,226,365,754,0,0,0,31,729,479,735,20,0,0,35,0,15,63,836,457,"Klingon, Physician, Desperate, Geneticist","nonhuman, male, organic, ent, crew_max_rarity_4","Klingon Mercy",2, 5, 12, 12, 20, 2, 0, , , , 425, 800, 245, , false,"Antaak",crew_portraits_cm_antaakent_sm.png,antaak_crew
"Koloth",3,3, 437,28,78,0,0,0,236,18,64,0,0,0,412,114,262,0,0,0,758,585,692,511,651,866,0,718,0,739,616,714,687,0,596,867,758,800,495,755,871,0,554,0,741,518,716,483,0,444,904,919,"Klingon, Diplomat, Tactician, Duelist","nonhuman, male, organic, tos, koloth, crew_max_rarity_3","I Am Koloth",0, 4, 8, 8, 10, 2, 2, , , , 525, 140, 243, 150, false,"Koloth",crew_portraits_cm_kolothtos_sm.png,koloth_crew
"Kurak",7,4, 0,0,0,819,66,127,0,0,0,565,74,183,265,127,261,0,0,0,486,0,574,821,0,481,130,279,298,529,836,0,330,340,664,791,0,645,592,0,772,280,308,480,583,611,0,171,385,436,736,774,"Klingon, Innovator, Astrophysicist, Warp Theorist","nonhuman, female, organic, tng, kurak, crew_max_rarity_4","Enough Accusations",2, 6, 6, 6, 6, , , , , , 543, , 93, 125, true,"Kurak",crew_portraits_cm_kuraktng_sm.png,kurak_crew
"23rd Century Martok",6,5, 468,138,283,0,0,0,1040,180,468,0,0,0,868,187,454,0,0,0,630,124,579,166,528,229,0,360,0,206,40,155,293,0,267,458,90,384,90,376,194,0,248,0,169,26,149,176,0,201,305,68,"Klingon, Duelist, Costumed, Veteran, Undercover Operative","nonhuman, male, organic, tos, ds9, martok, original, crew_max_rarity_5","Trapped Sabre Bear",2, 9, 12, 12, 12, , , , , , 350, 260, 340, , false,"Martok",crew_portraits_cm_martok_tos_sm.png,martok_tos_crew
"Mirror K'Ehleyr",4,4, 394,60,160,0,0,0,672,161,354,0,0,0,622,36,109,0,0,0,747,315,680,441,641,472,0,618,0,423,214,376,584,0,494,747,253,690,609,646,329,0,821,0,294,297,263,796,0,692,702,728,"Klingon, Brutal, Tactician, Duelist, Human, Klingon-Cardassian Alliance, Mirror Universe","nonhuman, female, organic, kehleyr, mirror, original, ds9, tng, crew_max_rarity_4","I Do Bite",0, 7, 12, 10, 14, 1, 2, , , , 150, 260, 308, 75, false,"K'Ehleyr",crew_portraits_cm_kehleyrmirror_sm.png,kehleyr_mirror_crew
"EV Suit Tucker",6,4, 444,149,555,0,0,0,0,0,0,708,121,356,0,0,0,0,0,0,536,561,68,612,435,0,337,0,0,417,0,0,465,257,0,163,273,5,282,107,0,263,0,0,339,0,0,346,192,0,842,461,"Human, Starfleet, Jury Rigger, Survivalist, Desperate","male, organic, evsuit, ent, commander, tucker, crew_max_rarity_4","Extravehicular Tactics",2, 7, 6, 8, 10, 3, 0, 3, , , 625, 95, 422, 600, false,"Trip",crew_portraits_cm_tuckerev_sm.png,tucker_evsuit_crew
"Gorn Captain",9,4, 402,139,478,0,0,0,659,223,424,0,0,0,0,0,0,0,0,0,611,218,547,664,504,459,0,0,0,404,586,362,0,0,0,230,39,163,372,153,196,0,0,0,171,308,150,0,0,0,855,362,"Brutal, Duelist, Gorn, Veteran, Desperate","male, organic, tos, captain, crew_max_rarity_4","Merciful and Quick",0, 7, 6, 6, 6, , , , , , 595, 300, 170, 365, true,"Gorn",crew_portraits_cm_gorncaptain_sm.png,gorn_captain_crew
"Young Khan",6,4, 328,77,164,0,0,0,0,0,0,631,42,117,777,87,165,0,0,0,804,765,320,390,696,0,405,527,0,519,607,0,82,331,409,709,700,412,480,611,0,546,703,0,695,770,0,441,450,576,735,881,"Human, Augments, Engineered, Romantic, Cultural Figure, Villain, Brutal, Tactician","nonhuman, male, organic, tos, khan, crew_max_rarity_4","This Grows Tiresome",0, 8, 6, 6, 10, , , , 2, 2, 590, 440, 15, 400, false,"Khan",crew_portraits_cm_khanyoung_sm.png,khan_young_crew
"Pah-wraith Cult Dukat",8,5, 1015,94,157,0,0,0,509,28,58,0,0,0,1069,212,398,0,0,0,371,216,326,66,282,728,0,280,0,621,116,593,220,0,215,691,593,644,187,599,870,0,277,0,740,271,715,207,0,225,369,677,"Cardassian, Bajoran, Inspiring, Communicator, Cultural Figure, Villain, Spiritual","nonhuman, male, organic, ds9, dukat, crew_max_rarity_5","Pah-wraith Vessel",2, 7, 10, 10, 14, 6, 0, , , , 700, 155, 10, 400, false,"Dukat",crew_portraits_cm_dukatcult_sm.png,dukat_cult_crew
"Dr. Tolian Soran",9,4, 0,0,0,717,175,348,0,0,0,544,100,243,0,0,0,0,0,0,466,0,552,0,0,462,105,509,283,517,0,0,570,330,0,331,0,510,0,0,326,76,373,215,489,0,0,528,302,0,863,748,"Civilian, Empath, Quantum Mechanics, Innovator, Desperate, El-Aurian, Villain","male, organic, tng, soran, crew_max_rarity_4","Appointment With Eternity",0, 6, 12, 12, 12, 7, 0, , , , 690, 325, 275, 250, false,"Soran",crew_portraits_cm_soran_sm.png,soran_longcoat_crew
"Romulan Kirk",6,4, 238,124,324,0,0,0,386,165,555,0,0,0,722,129,342,0,0,0,788,388,724,371,683,562,0,516,0,490,188,452,462,0,398,420,63,344,149,344,144,0,434,0,125,42,109,351,0,341,686,98,"Human, Federation, Starfleet, Undercover Operative, Romulan","male, organic, tos, captain, bridge_crew, kirk, crew_max_rarity_4","Masquerade",2, 8, 6, 6, 10, , , , 3, 800, 300, 200, 43, 390, false,"Kirk",crew_portraits_cm_kirkromulan_sm.png,kirk_romulan_crew
"Age of Sail Crusher",7,5, 409,87,309,0,0,0,0,0,0,0,0,0,822,135,456,1005,199,523,707,694,646,241,14,0,0,418,152,0,494,150,359,102,25,486,534,413,125,13,0,0,294,114,0,391,110,229,53,12,360,70,"Human, Starfleet, Federation, Physician, Costumed","ageofsail, female, organic, tng, commander, crusher, crew_max_rarity_5","Something Unexpected",0, 7, 12, 10, 14, 7, 0, , , , 525, 125, 65, 175, false,"Crusher",crew_portraits_cm_crushersail_sm.png,crusher_ageofsail_crew
"Suliban Reed",9,5, 925,262,605,0,0,0,452,100,219,0,0,0,897,178,312,0,0,0,225,131,182,70,143,683,0,398,0,592,180,559,339,0,296,75,59,47,21,46,571,0,410,0,510,183,494,333,0,324,353,83,"Starfleet, Human, Suliban, Tactician, Saboteur, Undercover Operative","male, organic, ent, lieutenant, reed, crew_max_rarity_5","Starting to Itch",1, 7, 6, 12, 12, 0, 1, , , , 65, 250, 40, 575, false,"Reed",crew_portraits_cm_reedsuliban_sm.png,reed_suliban_crew
"Cardassian Kira",8,4, 455,170,321,0,0,0,587,193,459,0,0,0,380,40,118,0,0,0,616,241,553,471,507,480,0,785,0,428,357,382,763,0,661,367,70,298,338,283,190,0,810,0,163,176,144,780,0,679,723,323,"Bajoran, Cardassian, Obsidian Order, Saboteur, Crafty, Prisoner","nonhuman, female, organic, ds9, kira, crew_max_rarity_4","Closest Thing to Family",2, 9, 12, 12, 12, , , , 1, 2, 250, 200, 180, 475, false,"Kira",crew_portraits_cm_kiracardassian_sm.png,kira_cardassian_crew
"Fesek",8,4, 0,0,0,0,0,0,0,0,0,715,115,342,555,80,188,0,0,0,0,0,416,681,0,0,339,625,0,419,701,0,76,259,499,0,0,347,711,0,0,273,679,0,363,748,0,117,207,556,875,847,"Malon, Romantic, Inspiring, Resourceful","nonhuman, male, evsuit, organic, voy, fesek, crew_max_rarity_4","Occupational Hazard",1, 9, 6, 10, 10, , , , 0, 2, 520, 200, 115, 415, false,"Fesek",crew_portraits_cm_fesekvoy_sm.png,fesek_crew
"Grand Proxy Neelix",6,4, 650,195,409,0,0,0,0,0,0,392,180,427,340,51,133,0,0,0,470,526,77,381,365,0,413,805,0,530,854,0,353,341,683,241,346,4,215,165,0,188,782,0,210,847,0,85,115,654,720,248,"Talaxian, Mylean, Ferengi, Crafty, Cultural Figure, Undercover Operative","nonhuman, male, organic, voy, neelix, nagus, crew_max_rarity_4","299th Rule of Acquisition",2, 6, 4, 8, 8, 6, 0, , , , 650, , 90, 50, true,"Neelix",crew_portraits_cm_neelixgrandproxy_sm.png,neelix_grand_proxy_crew
"Commander Kelby",9,4, 562,81,189,0,0,0,0,0,0,813,65,142,0,0,0,0,0,0,621,630,90,670,513,0,344,0,0,429,0,0,477,266,0,657,672,317,702,572,0,493,0,0,652,0,0,726,414,0,877,951,"Human, Starfleet, Jury Rigger, Explorer","male, organic, ent, commander, kelby, crew_max_rarity_4","Good to Go",2, 5, 1, 12, 20, 2, 0, , , , 365, 200, 134, 650, true,"Kelby",crew_portraits_cm_kelbyent_sm.png,kelby_commander_crew
"Orion Slaver",10,4, 240,123,277,0,0,0,677,166,456,0,0,0,528,102,247,0,0,0,814,317,745,487,705,458,0,613,0,403,196,360,580,0,490,480,105,406,256,398,215,0,592,0,190,100,163,521,0,469,703,260,"Orion, Brutal, Duelist, Merchant","male, organic, ent, nonhuman, crew_max_rarity_4","Slaver Tactics",0, 6, 6, 10, 10, 8, 4, , , , 430, 305, 150, 390, false,"Orion Slaver",crew_portraits_cm_orionslaver_sm.png,orion_slaver_crew
"Forra Gegen",10,4, 0,0,0,743,154,275,267,103,203,553,112,213,0,0,0,0,0,0,474,789,551,0,0,225,112,515,289,321,863,671,569,329,0,452,632,535,0,0,136,107,485,280,187,683,511,553,324,0,718,574,"Exoarchaeology, Exobiology, Voth, Resourceful, Maverick","male, organic, voy, crew_max_rarity_4","Hadrosaur Instincts",2, 5, 3, 10, 8, 4, 0, 2, , , 535, 545, 170, 100, false,"Gegen",crew_portraits_cm_forragegen_sm.png,forra_gegen_crew
"Automated Unit 3947",10,4, 0,0,0,607,52,117,263,115,318,717,128,305,0,0,0,0,0,0,628,741,421,0,0,338,125,619,375,196,819,629,473,261,0,817,500,377,0,0,239,194,797,500,74,542,359,403,225,0,716,605,"Automated Unit, Desperate, Quantum Mechanics","nonhuman, artificial_life, voy, crew_max_rarity_4","Terminate the Builders",1, 6, 12, 12, 12, 7, 0, , , , 685, 600, 143, 325, false,"APU 3947",crew_portraits_cm_automatedunit3947_sm.png,automatedunit3947_crew
"Ardra",1,4, 0,0,0,0,0,0,703,120,243,309,87,191,537,104,183,0,0,0,0,540,744,685,0,490,545,632,0,212,272,392,349,443,506,0,567,612,694,0,502,420,666,0,180,313,433,259,368,539,752,695,"Costumed, Crafty, Villain, Cultural Figure, Thief","female, organic, tng, ardra, crew_max_rarity_4","I Pity You",2, 7, 6, 12, 12, 5, 0, 2, , , 650, 325, 695, 425, false,"Ardra",crew_portraits_cm_arda_sm.png,ardra_crew
"Waitress Ezri",5,4, 0,0,0,0,0,0,287,47,135,0,0,0,652,193,390,450,162,497,0,800,0,568,453,838,0,519,328,717,371,254,468,300,85,0,762,0,416,126,784,0,307,138,672,213,67,245,77,21,715,226,"Trill, Federation, Starfleet, Costumed, Undercover Operative, Counselor, Resourceful","nonhuman, female, organic, ds9, dax, crew_max_rarity_4","Slip Him a Mickey",2, 7, 12, 5, 12, 1, 0, , , , 205, 145, 150, 575, false,"E. Dax",crew_portraits_cm_ezriwaitress_sm.png,ezri_waitress_crew
"Jazz Musician Odo",9,5, 0,0,0,0,0,0,754,185,597,0,0,0,1099,195,389,0,0,0,0,445,0,383,0,354,0,274,0,314,42,265,214,0,212,0,222,0,413,0,103,0,303,0,103,17,86,241,0,256,481,265,"Changeling, Bajoran, Constable, Costumed, Romantic, Musician","nonhuman, male, organic, ds9, odo, crew_max_rarity_5","Holosuite Romeo",1, 8, 12, 10, 14, 4, 0, , , , 245, 350, 110, 475, false,"Odo",crew_portraits_cm_odotux_sm.png,odo_tuxedo_crew
"Bridge Officer Troi",8,4, 597,76,197,0,0,0,0,0,0,0,0,0,304,93,195,616,169,514,590,608,528,457,32,0,0,795,284,0,841,368,775,250,204,649,667,606,427,32,0,0,665,128,0,724,128,614,68,64,691,395,"Federation, Starfleet, Human, Betazoid, Empath, Counselor, Caregiver","nonhuman, female, organic, tng, commander, bridge_crew, troi, crew_max_rarity_4","Sensing Anger",1, 6, 6, 8, 12, 3, 0, 3, , , 565, 360, 245, 450, true,"Troi",crew_portraits_cm_troicommander_sm.png,troi_commander_crew
"Lon Suder",10,4, 0,0,0,235,81,261,603,185,434,612,66,215,0,0,0,0,0,0,846,535,520,0,0,243,271,822,513,91,603,383,540,317,0,567,331,608,0,0,48,173,596,340,61,341,166,627,365,0,733,399,"Maquis, Federation, Starfleet, Betazoid, Brutal, Botanist, Saboteur, Telepath","male, organic, voy, nonhuman, crewman, suder, crew_max_rarity_4","Control the Violence",2, 6, 12, 12, 12, 4, 0, , , , 465, 220, 110, 480, false,"Suder",crew_portraits_cm_sudersabotuer_sm.png,suder_crew
"Detective Dixon Hill",7,4, 499,162,314,0,0,0,270,146,290,0,0,0,612,203,401,0,0,0,589,366,526,257,489,761,0,525,0,653,349,622,478,0,408,387,156,310,82,304,429,0,283,0,379,78,353,212,0,230,695,156,"Federation, Starfleet, Human, Costumed, Undercover Operative, Investigator, Romantic","male, organic, tng, captain, bridge_crew, picard, crew_max_rarity_4","Step On It",1, 7, 8, 10, 8, , , , , , 550, 25, 577, 340, false,"Picard",crew_portraits_cm_picarddixonhill_sm.png,picard_dixonhill_crew
"Mirror Spock",7,5, 752,153,361,1032,212,482,0,0,0,0,0,0,386,73,158,0,0,0,28,503,382,322,337,226,197,96,153,0,805,0,725,0,631,11,418,266,255,252,163,133,94,126,0,795,0,692,0,598,395,212,"Terran Empire, Starfleet, Exobiology, Astrophysicist, Human, Vulcan, Telepath, Mirror Universe, Royalty","nonhuman, male, organic, tos, commander, bridge_crew, first_officer, mirror, spock, spock_tos, crew_max_rarity_5","Empire's Logic",2, 9, 1, 10, 12, , , , , , 840, 245, 312, 725, false,"Spock",crew_portraits_cm_spockmirror_sm.png,spock_mirror_crew
"Subcommander T'Rul",6,4, 0,0,0,305,60,158,377,176,559,844,60,97,0,0,0,0,0,0,843,606,422,0,0,345,198,817,509,90,662,453,475,263,0,759,250,758,0,0,50,331,736,447,63,226,103,781,452,0,724,518,"Romulan, Veteran, Resourceful, Tactician","nonhuman, female, organic, trul, tng, commander, crew_max_rarity_4","Not Here To Make Friends",0, 7, 12, 10, 12, 0, 1, , 1, 3, 425, , 223, 340, false,"T'Rul",crew_portraits_cm_trulsubcommander_sm.png,trul_subcommander_crew
"Drone Seven of Nine",4,4, 0,0,0,432,165,349,239,150,308,725,142,339,0,0,0,0,0,0,631,753,411,0,0,348,117,626,381,190,830,639,459,252,0,352,465,323,0,0,47,45,381,224,47,502,321,343,186,0,709,204,"Human, Borg, Brutal","nonhuman, female, organic, voy, seven, crew_max_rarity_4","We Are Borg",0, 4, 1, 10, 10, 8, 4, , , , 475, 200, 170, 365, true,"Seven",crew_portraits_cm_sevenofninedrone_sm.png,seven_drone_crew
"Tash",8,4, 0,0,0,577,236,539,0,0,0,591,96,131,273,74,146,0,0,0,471,0,561,846,0,464,113,286,286,522,874,0,379,334,699,123,0,689,774,0,120,42,71,96,627,814,0,386,404,614,742,435,"Civilian, Innovator, Desperate, Maverick","male, organic, voy, tash, crew_max_rarity_4","Catapult a Vessel",2, 4, 4, 6, 6, 3, 0, 2, , , 290, 200, 60, 450, false,"Tash",crew_portraits_cm_tash_sm.png,tash_crew
"Blood Oath Jadzia Dax",6,4, 0,0,0,483,160,349,728,140,265,225,153,356,0,0,0,0,0,0,600,534,714,0,0,86,231,589,350,197,600,375,743,434,0,360,526,291,0,0,62,41,386,227,56,578,387,314,173,0,698,227,"Federation, Starfleet, Duelist, Gambler, Tactician, Trill, Pilot, Klingon","nonhuman, female, organic, ds9, lieutenant, bridge_crew, dax, crew_max_rarity_4","Who You've Been",1, 7, 8, 10, 8, , , , , , 400, 75, 405, 205, false,"J. Dax",crew_portraits_cm_jadziabloodoath_sm.png,dax_jadzia_blood_oath_crew
"Lily Sloane",8,4, 0,0,0,0,0,0,274,75,183,678,119,334,487,173,340,0,0,0,0,796,429,648,0,830,348,584,0,217,478,681,71,269,469,0,682,356,468,0,665,279,387,0,134,208,566,37,212,306,743,430,"Human, Civilian, Jury Rigger, Desperate, Communicator, Crafty, Resourceful","female, organic, tng, lily, crew_max_rarity_4","Broke Your Little Ships",1, 7, 6, 8, 10, 3, 0, 3, , , 600, 380, 15, 450, false,"Lily",crew_portraits_cm_lilysloane_sm.png,lily_sloane_crew
"Rogue Kai Winn",9,5, 1007,257,510,0,0,0,0,0,0,0,0,0,736,274,575,0,0,0,211,326,167,63,133,0,0,384,0,0,470,0,323,0,285,118,233,83,4,79,0,0,114,0,0,162,0,63,0,93,473,112,"Bajoran, Kai, Cultural Figure, Spiritual, Villain","nonhuman, female, organic, ds9, winn, crew_max_rarity_5","End of One Journey",0, 7, 10, 10, 14, 6, 0, , , , 315, 330, 110, 550, false,"Winn",crew_portraits_cm_winnevil_sm.png,winn_rogue_crew
"Sulan",7,5, 351,100,258,789,161,363,0,0,0,0,0,0,0,0,0,889,244,810,133,724,669,766,16,429,311,467,25,0,0,142,0,96,199,71,571,469,611,2,331,245,374,6,0,0,20,0,9,42,382,23,"Geneticist, Physician, Vidiian, Brutal, Survivalist","nonhuman, male, organic, voy, sulan, crew_max_rarity_5","Most Impressive Species",2, 10, 12, 12, 12, , , 2, , , 490, 25, 140, 190, false,"Sulan",crew_portraits_cm_sulan_sm.png,sulan_crew
"Lore",10,4, 0,0,0,447,32,92,0,0,0,597,202,427,508,99,180,0,0,0,749,0,426,701,0,749,188,385,461,432,729,0,131,267,527,860,0,168,699,0,847,108,521,529,195,735,0,49,94,548,737,614,"Android, Civilian, Villain, Cyberneticist","nonhuman, male, artificial_life, tng, lore, crew_max_rarity_4","Dear Brother",1, 7, 1, 10, 12, , , , , , 800, , 205, 450, false,"Lore",crew_portraits_cm_loreoriginal_sm.png,lore_original_crew
"Interfaced Barclay",7,5, 1047,236,645,541,98,211,0,0,0,981,77,144,0,0,0,0,0,0,39,301,15,328,101,600,88,615,370,354,0,0,374,200,0,13,169,10,165,43,593,242,636,365,632,0,0,707,405,0,267,228,"Innovator, Quantum Mechanics, Prodigy, Human, Federation, Resourceful","male, organic, tng, lieutenant, barclay, crew_max_rarity_5","Trust Me",1, 7, 4, 8, 12, 6, 0, , , , 340, , 20, 455, true,"Barclay",crew_portraits_cm_barclaydictator_sm.png,barclay_interfaced_crew
"Trelane",8,5, 0,0,0,944,247,677,862,183,389,0,0,0,476,35,94,0,0,0,216,443,0,765,0,14,190,86,150,312,197,264,718,0,619,61,371,0,856,0,9,60,49,57,229,250,206,806,0,697,366,104,"Romantic, Desperate, Musician, Scoundrel, Resourceful, Crafty, Costumed","nonhuman, male, organic, tos, trelane, crew_max_rarity_5","My Game, My Rules!",2, 7, 6, 12, 12, 0, 1, , , , 365, 70, 133, 350, false,"Trelane",crew_portraits_cm_trelane_sm.png,trelane_crew
"Enabran Tain",8,5, 919,264,754,0,0,0,905,128,284,0,0,0,378,123,299,0,0,0,198,77,157,132,123,386,0,727,0,338,192,285,698,0,604,36,16,24,14,27,445,0,500,0,398,165,377,424,0,403,347,35,"Cardassian, Obsidian Order, Interrogator, Undercover Operative, Desperate","nonhuman, male, organic, ds9, tain, crew_max_rarity_5","History Be My Judge",0, 7, 12, 10, 14, 8, 4, , , , 308, 235, 43, 475, false,"Tain",crew_portraits_cm_tain_sm.png,enabran_tain_crew
"Ambassador Soval",8,5, 982,112,261,0,0,0,0,0,0,0,0,0,1079,318,636,0,0,0,342,417,298,30,257,0,0,196,0,0,283,0,134,0,144,520,559,449,25,429,0,0,88,0,0,115,0,42,0,70,435,320,"Vulcan, Diplomat, Communicator, Telepath, Ambassador, High Command","nonhuman, male, organic, soval, ent, crew_max_rarity_5","No Stranger to Deception",1, 8, 1, 10, 12, , , , , , 775, 255, 150, 430, false,"Soval",crew_portraits_cm_soval_sm.png,soval_crew
"Temporal Shift Kes",2,3, 0,0,0,267,132,282,0,0,0,0,0,0,0,0,0,461,72,253,781,0,0,0,592,779,525,773,239,0,0,545,0,372,550,468,0,0,0,498,449,303,501,109,0,0,488,0,315,487,944,836,"Ocampa, Civilian, Botanist, Prodigy, Telepath, Nurse","nonhuman, female, organic, voy, kes, crew_max_rarity_3","Your Past, My Future",1, 4, 10, 12, 16, 5, 0, , , , 425, 100, 165, 370, false,"Kes",crew_portraits_cm_kesbotanist_sm.png,kes_longhair_crew
"Duelist Torres",7,5, 0,0,0,0,0,0,903,165,428,1067,208,464,0,0,0,0,0,0,0,402,174,0,0,298,191,0,0,27,424,214,208,99,0,0,354,135,0,0,243,146,0,0,9,371,189,147,76,0,466,376,"Athlete, Innovator, Jury Rigger, Human, Federation, Klingon, Maquis, Duelist, Cyberneticist","female, organic, voy, nonhuman, torres, crew_max_rarity_5","Empassioned Maneuver",1, 8, 10, 10, 12, 8, 4, , , , 800, 280, 20, 100, false,"Torres",crew_portraits_cm_torresduelist_sm.png,torres_duelist_crew
"Deanna Troi",2,3, 127,87,199,0,0,0,0,0,0,0,0,0,298,120,236,412,112,282,881,826,817,644,385,0,0,770,426,0,827,555,746,383,321,632,658,589,353,117,0,0,578,296,0,643,404,509,249,130,905,599,"Federation, Starfleet, Human, Betazoid, Empath, Counselor","nonhuman, female, organic, tng, lieutenant_commander, bridge_crew, troi, crew_max_rarity_3","Face My Other Half",1, 7, 8, 12, 12, , , , 0, 2, 650, 50, 265, 450, false,"Troi",crew_portraits_cm_troicivilian_sm.png,troi_casualblue_crew
"Delta Flyer Paris",6,5, 1013,224,512,0,0,0,0,0,0,897,92,309,0,0,0,508,105,232,218,329,19,379,13,0,296,0,383,352,0,492,370,23,500,136,249,6,260,18,0,312,0,342,420,0,470,455,49,475,331,179,"Gambler, Human, Romantic, Tactician, Federation, Starfleet, Pilot, Maverick, Athlete","male, organic, lieutenant, voy, paris, crew_max_rarity_5","Race Day",1, 10, 6, 12, 12, , , , , , 640, , 85, 480, false,"Paris",crew_portraits_cm_parisdeltaflier_sm.png,paris_delta_crew
"Dr. Richard Daystrom",9,5, 0,0,0,857,259,761,0,0,0,882,134,447,0,0,0,0,0,0,229,0,314,0,0,230,36,283,154,297,0,0,311,175,0,39,0,218,0,0,36,5,60,41,238,0,0,246,136,0,482,123,"Federation, Prodigy, Inspiring, Innovator, Civilian, Human, Cultural Figure","male, organic, tos, daystrom, crew_max_rarity_5","Achieve Greater Things",2, 8, 6, 8, 10, 3, 0, 2, , , 515, 160, 283, 650, false,"Daystrom",crew_portraits_cm_daystrom_sm.png,daystrom_crew
"Rura Penthe Reed",7,4, 497,121,372,0,0,0,624,163,548,0,0,0,0,0,0,0,0,0,581,213,515,639,481,460,0,0,0,406,589,364,0,0,0,366,55,295,475,281,149,0,0,0,128,240,114,0,0,0,847,424,"Starfleet, Human, Desperate, Survivalist, Criminal, Undercover Operative, Prisoner","male, organic, ent, reed, crew_max_rarity_4","As You Were",0, 9, 8, 12, 10, , , 2, , , 755, 235, 173, 400, false,"Reed",crew_portraits_cm_reedrurapenthe_sm.png,reed_rura_penthe_crew
"Ensign Robin Lefler",3,3, 270,81,259,0,0,0,0,0,0,544,88,202,0,0,0,0,0,0,813,773,335,826,704,0,420,0,0,534,0,0,590,346,0,561,588,156,628,468,0,410,0,0,557,0,0,612,358,0,939,894,"Human, Federation, Starfleet, Innovator, Resourceful","female, organic, tng, lefler, crew_max_rarity_3","Rely on Yourself",1, 4, 10, 6, 15, 2, 0, , 2, 2, 505, 260, 150, 415, false,"Lefler",crew_portraits_cm_robinlefler_sm.png,lefler_crew
"Racquetball Bashir",2,3, 175,48,144,411,23,77,0,0,0,0,0,0,0,0,0,345,120,414,599,825,815,884,384,787,531,782,251,0,0,554,0,381,571,626,752,717,800,99,861,588,855,156,0,0,248,0,154,285,907,771,"Human, Federation, Starfleet, Athlete, Prodigy, Engineered, Physician","nonhuman, male, organic, ds9, bashir, crew_max_rarity_3","Team Captain",1, 6, 8, 12, 12, , , , 0, 1, 560, 130, 158, 625, false,"Bashir",crew_portraits_cm_bashirracquetball_sm.png,bashir_racquetball_crew
"Disguised Tuvok",5,4, 293,68,194,691,146,408,419,202,399,0,0,0,0,0,0,0,0,0,219,442,762,836,720,81,335,511,285,509,683,472,0,0,0,100,180,628,709,583,22,229,331,198,206,364,183,0,0,0,707,222,"Vulcan, Human, Federation, Starfleet, Telepath, Resourceful, Costumed, Tactician","nonhuman, male, organic, voy, lieutenant_commander, bridge_crew, tuvok, crew_max_rarity_4","Ethics of Time Travel",0, 6, 12, 12, 16, 5, 0, , , , 565, 255, 90, 225, false,"Tuvok",crew_portraits_cm_tuvok20c_sm.png,tuvok_20c_disguise_crew
"Mirror T'Pol",7,5, 451,111,369,1018,184,560,0,0,0,0,0,0,704,213,421,0,0,0,50,633,564,244,517,222,193,38,151,0,562,0,424,0,370,10,449,309,70,301,133,110,9,107,0,339,0,182,0,205,363,39,"Vulcan, Terran Empire, Starfleet, Astrophysicist, Duelist, Saboteur, Telepath, Mirror Universe","nonhuman, female, organic, ent, first_officer, mirror, bridge_crew, tpol, crew_max_rarity_5","Pay for Your Arrogance",2, 7, 4, 10, 14, 4, 0, , , , 700, 255, 220, 325, true,"T'Pol",crew_portraits_cm_tpolmirrortos_sm.png,tpol_mirror_crew
"Chancellor Gowron",5,5, 439,149,309,0,0,0,759,220,451,0,0,0,794,287,867,0,0,0,643,201,586,130,539,400,0,284,0,349,48,295,222,0,217,413,75,334,5,326,173,0,25,0,149,2,132,15,0,34,351,11,"Klingon, Cultural Figure, Diplomat, Brutal, Politician","nonhuman, male, organic, tng, gowron, crew_max_rarity_5","It Will Be War!",0, 7, 6, 8, 14, 4, 2, , , , 350, 290, 195, 650, false,"Gowron",crew_portraits_cm_gowronchancellor_sm.png,gowron_chancellor_crew
"Lieutenant Valeris",5,4, 218,136,300,387,172,439,579,203,541,0,0,0,0,0,0,0,0,0,382,330,748,828,707,93,416,622,377,414,595,369,0,0,0,31,60,366,537,358,13,181,270,166,118,216,101,0,0,0,722,49,"Vulcan, Saboteur, Starfleet, Federation, Resourceful, Telepath","nonhuman, female, organic, valeris, tos, lieutenant, crew_max_rarity_4","Conspirator",2, 9, 4, 8, 8, , , 2, , , 225, 200, 150, 415, false,"Valeris",crew_portraits_cm_valeris_sm.png,valeris_lieutenant_crew
