crew, tier, rarity, CMD_core, CMD_min, CMD_max, SCI_core, SCI_min, SCI_max, SEC_core, SEC_min, SEC_max, ENG_core, ENG_min, ENG_max, DIP_core, DIP_min, DIP_max, MED_core, MED_min, MED_max, V_CMD_SCI, V_CMD_SEC, V_CMD_ENG, V_CMD_DIP, V_CMD_MED, V_SCI_SEC, V_SCI_ENG, V_SCI_DIP, V_SCI_MED, V_SEC_ENG, V_SEC_DIP, V_SEC_MED, V_ENG_DIP, V_ENG_MED, V_DIP_MED, G_CMD_SCI, G_CMD_SEC, G_CMD_ENG, G_CMD_DIP, G_CMD_MED, G_SCI_SEC, G_SCI_ENG, G_SCI_DIP, G_SCI_MED, G_SEC_ENG, G_SEC_DIP, G_SEC_MED, G_ENG_DIP, G_ENG_MED, G_DIP_MED, voyage_rank, gauntlet_rank, traits, hidden_traits, action_name, action_bonus_type, action_bonus_amount, action_initial_cooldown, action_duration, action_cooldown, bonus_ability, trigger, uses_per_battle, penalty_type, penalty_amount, accuracy, crit_bonus, crit_chance, evasion, charge_phases, short_name, image_name, symbol
"Investigator Odo",7,1, 0,0,0,0,0,0,217,37,171,0,0,0,0,0,0,0,0,0,0,1252,0,0,0,1308,0,0,0,1144,1377,1057,0,0,0,0,1162,0,0,0,1165,0,0,0,1044,1298,964,0,0,0,1583,1577,"Changeling, Cardassian, Investigator, Interrogator, Shapeshifter","nonhuman, male, organic, ds9, odo, crew_max_rarity_1","Collaboration",2, 1, 20, 14, 10, , , , , , 400, 115, 67, 265, false,"Odo",crew_portraits_cm_odooccupation_sm.png,odo_occupation_crew
"Constable Odo",5,3, 317,107,225,0,0,0,523,27,85,0,0,0,0,0,0,0,0,0,1200,802,1124,1266,1021,1116,0,0,0,999,1240,896,0,0,0,888,769,844,1028,737,1307,0,0,0,1135,1384,1055,0,0,0,1476,1489,"Changeling, Bajoran, Constable, Investigator, Interrogator, Shapeshifter","nonhuman, male, organic, ds9, odo, crew_max_rarity_3","Justice",0, 6, 10, 12, 16, , , , 3, 800, 520, 300, 75, , false,"Odo",crew_portraits_cm_odostandard_sm.png,odo_constable_crew
"Ensign Ro",10,2, 322,46,132,0,0,0,0,0,0,0,0,0,0,0,0,0,0,0,1285,1236,1215,1328,1111,0,0,0,0,0,0,0,0,0,0,1245,1210,1174,1295,1070,0,0,0,0,0,0,0,0,0,0,1578,1581,"Starfleet, Bajoran, Resourceful","nonhuman, female, organic, tng, ro, crew_max_rarity_2","Separate Ways",0, 4, 3, 10, 5, , , 2, , , 130, 210, 13, 200, false,"Ro",crew_portraits_cm_roensign_sm.png,ro_ensign_crew
"Shinzon",9,5, 819,94,241,0,0,0,938,183,435,0,0,0,546,176,390,0,0,0,766,184,699,356,572,489,0,884,0,454,164,326,852,0,712,885,200,839,231,733,343,0,508,0,339,59,235,447,0,384,706,202,"Human, Clone, Reman, Villain, Romulan, Brutal, Crafty, Politician, Veteran, Vengeful","male, organic, tng, shinzon, crew_max_rarity_5","Destiny Complete",0, 7, 14, 3, 14, 1, 2, , , , 1325, 545, 365, 1050, false,"Shinzon",crew_portraits_cm_shinzon_sm.png,shinzon_crew
"Will Riker",6,1, 251,42,110,0,0,0,125,22,74,0,0,0,0,0,0,0,0,0,1301,1156,1237,1350,1130,1337,0,0,0,1164,1406,1083,0,0,0,1275,1080,1205,1324,1107,1321,0,0,0,1150,1396,1066,0,0,0,1570,1561,"Human, Federation, Starfleet, Maverick, Gambler, Romantic","male, organic, tng, riker, crew_max_rarity_1","Poker Face",0, 1, 8, 10, 14, 4, 0, , , , 455, , 425, 340, false,"Riker",crew_portraits_cm_rikers1_sm.png,riker_s1_commander_crew
"Commander Riker",1,2, 279,78,191,0,0,0,124,29,89,0,0,0,290,22,64,0,0,0,1283,1113,1213,1051,1109,1333,0,1287,0,1160,1266,1079,1277,0,1103,1022,857,988,981,873,1304,0,1320,0,1134,1309,1053,1311,0,1130,1512,1474,"Human, Federation, Starfleet, Pilot, Maverick, Gambler, Romantic, Playful","male, organic, tng, riker, crew_max_rarity_2","Liase",0, 2, 8, 10, 14, 5, 0, , , , 645, 50, 295, 275, false,"Riker",crew_portraits_cm_rikerpoker_sm.png,riker_s2_commander_crew
"Edith Keeler",8,4, 0,0,0,0,0,0,0,0,0,0,0,0,453,166,339,591,187,590,0,0,0,1084,593,0,0,971,442,0,1122,592,944,405,184,0,0,0,736,113,0,0,608,124,0,740,131,539,55,16,1390,632,"Civilian, Caregiver, Inspiring, Cultural Figure, Romantic, Human","female, organic, tos, keeler, crew_max_rarity_4","A Life Worth Living",1, 7, 8, 10, 8, , , , , , 690, 25, 52, 440, false,"Keeler",crew_portraits_cm_edithkeeler_sm.png,keeler_crew
"Ensign Tuvok",7,1, 0,0,0,181,51,197,0,0,0,0,0,0,138,33,74,0,0,0,1319,0,0,1388,0,1317,991,1192,830,0,1403,0,1321,0,1143,1102,0,0,1364,0,1068,785,903,649,0,1390,0,1291,0,1112,1572,1535,"Vulcan, Federation, Starfleet, Telepath","nonhuman, male, organic, voy, tuvok, crew_max_rarity_1","Memory",0, 1, 1, 14, 10, , , , , , 103, 60, 135, 375, false,"Tuvok",crew_portraits_cm_tuvokensign_sm.png,tuvok_ensign_crew
"Security Chief Tuvok",4,3, 291,53,161,145,45,149,445,85,201,0,0,0,0,0,0,0,0,0,1073,840,1226,1330,1120,810,1001,1322,842,996,1236,892,0,0,0,760,672,1124,1236,1013,594,913,1210,773,893,1152,818,0,0,0,1452,1375,"Vulcan, Federation, Starfleet, Telepath, Tactician, Investigator","nonhuman, male, organic, voy, tuvok, crew_max_rarity_3","Contingency Plan",0, 4, 10, 12, 16, 5, 0, , , , 465, 50, , 300, false,"Tuvok",crew_portraits_cm_tuvokrifle_sm.png,tuvok_rifle_crew
"Major Kira",6,2, 273,37,126,0,0,0,304,60,176,0,0,0,0,0,0,0,0,0,1292,937,1229,1338,1122,1271,0,0,0,1113,1353,1024,0,0,0,1261,840,1188,1306,1088,1088,0,0,0,981,1242,901,0,0,0,1535,1515,"Bajoran, Veteran, Resourceful","nonhuman, female, organic, ds9, kira, crew_max_rarity_2","Obstinance",0, 2, 0, 10, 14, 6, 0, , , , 295, 150, 5, , true,"Kira",crew_portraits_cm_kirashorthair_sm.png,kira_major_shorthair_crew
"Mirror Intendant Kira",7,5, 512,183,363,0,0,0,1052,272,542,0,0,0,946,67,184,0,0,0,890,183,835,321,719,371,0,756,0,352,73,239,705,0,577,481,39,415,325,334,143,0,1094,0,163,93,102,1069,0,911,545,147,"Bajoran, Cardassian, Klingon, Villain, Klingon-Cardassian Alliance, Brutal, Mirror Universe, Crafty","nonhuman, female, organic, ds9, kira, crew_max_rarity_5","Instability",0, 6, 6, 10, 12, 4, 0, , , , 915, 225, 90, 1525, true,"Kira",crew_portraits_cm_kiraintendant_sm.png,kira_mirror_crew
"Security Chief Worf",8,2, 205,57,144,0,0,0,326,61,145,0,0,0,0,0,0,0,0,0,1316,978,1247,1363,1140,1261,0,0,0,1107,1347,1015,0,0,0,1203,829,1144,1260,1035,1169,0,0,0,1050,1302,967,0,0,0,1542,1510,"Klingon, Federation, Starfleet, Duelist, Investigator","nonhuman, male, organic, tng, worf, crew_max_rarity_2","They Have No Honor",2, 4, 8, 10, 12, , , , 1, 2, 165, 280, 95, 155, false,"Worf",crew_portraits_cm_worf_sm.png,worf_security_chief_crew
"Defiant Commander Worf",8,4, 364,241,488,0,0,0,609,179,394,0,0,0,0,0,0,0,0,0,946,444,891,1071,778,779,0,0,0,721,1001,613,0,0,0,213,53,179,410,124,432,0,0,0,408,633,310,0,0,0,1398,493,"Klingon, Federation, Starfleet, Duelist, Tactician, Veteran","nonhuman, male, organic, ds9, worf, crew_max_rarity_4","Good Day to Die",2, 6, 12, 12, 12, 4, 0, , 1, 2, 690, 645, 325, 205, false,"Worf",crew_portraits_cm_worfdefiant_sm.png,worf_defiant_commander_crew
"Mirror Regent Worf",8,5, 861,294,589,0,0,0,1062,175,357,0,0,0,0,0,0,0,0,0,476,121,418,682,310,426,0,0,0,398,637,282,0,0,0,99,31,78,241,52,490,0,0,0,472,690,365,0,0,0,797,292,"Klingon, Cardassian, Tactician, Villain, Brutal, Klingon-Cardassian Alliance, Mirror Universe","nonhuman, male, organic, ds9, worf, crew_max_rarity_5","Position of Strength",0, 9, 8, 8, 10, , , , , , 300, 980, 390, , false,"Worf",crew_portraits_cm_worfmirror_sm.png,worf_mirror_crew
"Yeoman Rand",9,1, 164,15,58,0,0,0,0,0,0,0,0,0,117,19,60,0,0,0,1334,1279,1274,1336,1167,0,0,1332,0,0,1408,0,1328,0,1146,1331,1277,1272,1325,1162,0,0,1322,0,0,1403,0,1317,0,1134,1580,1584,"Federation, Starfleet, Human","female, organic, tos, rand, crew_max_rarity_1","Signature Required",2, 2, 8, 10, 12, , , , 1, 1, 375, , , 180, false,"Rand",crew_portraits_cm_randyeoman_sm.png,rand_yeoman_crew
"The Duras Sisters",9,4, 311,83,205,0,0,0,658,150,385,0,0,0,464,170,341,0,0,0,1241,561,1170,807,1066,764,0,963,0,707,417,600,933,0,777,982,312,948,327,836,487,0,596,0,470,110,363,525,0,442,1222,454,"Klingon, Scoundrel, Villain, Vengeful","nonhuman, female, organic, tng, betor, lursa, exclusive_fusion, crew_max_rarity_4","The Power of Two",0, 9, 10, 20, 12, , , 1, , , 350, 110, 190, 500, false,"Duras Sisters",crew_portraits_cm_duras_sisters_sm.png,duras_sisters_crew
"Persis",8,2, 0,0,0,0,0,0,253,94,250,0,0,0,303,39,88,0,0,0,0,1231,0,1334,0,1270,0,1277,0,1111,1054,1023,1269,0,1095,0,920,0,1348,0,834,0,1283,0,792,793,707,1271,0,1095,1530,1477,"Human, Augments, Engineered, Survivalist, Tactician","nonhuman, female, organic, ent, persis, crew_max_rarity_2","Augmented Strength",0, 2, 6, 10, 6, 7, 0, 2, , , 240, 330, 300, , false,"Persis",crew_portraits_cm_persis_sm.png,persis_crew
"Telek R'Mor",7,2, 0,0,0,347,52,194,119,8,44,0,0,0,263,30,113,0,0,0,1218,1285,0,1346,0,1084,918,898,775,1165,1299,1084,1278,0,1104,1105,1280,0,1333,0,953,788,848,652,1163,1321,1082,1254,0,1085,1507,1498,"Romulan, Astrophysicist","nonhuman, male, organic, voy, rmor, crew_max_rarity_2","Solitary Survey",1, 3, 10, 12, 10, 0, 2, , , , 405, 50, 3, 180, false,"R'Mor",crew_portraits_cm_telekrmor_sm.png,rmor_voyager_crew
"KDF Gowron",9,4, 375,85,222,0,0,0,296,100,256,0,0,0,641,173,418,0,0,0,1154,833,1084,592,983,1228,0,834,0,1073,585,983,798,0,650,939,459,902,238,794,813,0,474,0,769,168,688,411,0,353,1290,639,"Klingon, Duelist, Diplomat, Politician","nonhuman, male, organic, tng, gowron, crew_max_rarity_4","What Can Be Done",1, 6, 14, 10, 14, 0, 2, , , , 625, 465, 85, 1000, false,"Gowron",crew_portraits_cm_gowronyoung_sm.png,gowron_kdf_crew
"Third Remata'Klan",7,3, 410,42,84,0,0,0,467,85,185,0,0,0,0,0,0,0,0,0,1208,795,1139,1276,1031,1100,0,0,0,985,1224,877,0,0,0,1298,846,1228,1343,1122,999,0,0,0,913,1176,839,0,0,0,1471,1518,"Jem'hadar, Dominion, Duelist, Tactician","nonhuman, male, organic, ds9, remataklan, crew_max_rarity_3","Victory is Life",0, 3, 0, 6, 8, 4, 4, , , , 690, 395, 597, 600, true,"Remata'Klan",crew_portraits_cm_remataklan_sm.png,remataklan_crew
"Ensign Chapel",10,1, 0,0,0,0,0,0,0,0,0,0,0,0,0,0,0,214,34,152,0,0,0,0,1145,0,0,0,832,0,0,1064,0,791,1122,0,0,0,0,1069,0,0,0,787,0,0,1005,0,750,1041,1589,1580,"Human, Federation, Starfleet, Nurse","female, organic, tos, chapel, crew_max_rarity_1","Administer Prescription",2, 1, 6, 10, 10, , , , , , 130, , 40, 100, false,"Chapel",crew_portraits_cm_chapelensign_sm.png,chapel_ensign_crew
"Ensign Ogawa",8,1, 0,0,0,0,0,0,0,0,0,0,0,0,0,0,0,213,34,166,0,0,0,0,1143,0,0,0,829,0,0,1061,0,789,1116,0,0,0,0,1053,0,0,0,766,0,0,992,0,739,1019,1588,1578,"Human, Federation, Starfleet, Nurse","female, organic, tng, ogawa, crew_max_rarity_1","Report to Sickbay",2, 1, 6, 1, 8, 2, 0, 1, , , 170, , 35, 105, false,"Ogawa",crew_portraits_cm_ogawaensign_sm.png,ogawa_ensign_crew
"Wesley Crusher",8,1, 0,0,0,218,43,149,0,0,0,174,32,78,0,0,0,0,0,0,1310,0,1269,0,0,1313,858,1301,827,1158,0,0,1313,801,0,1232,0,1244,0,0,1223,670,1212,776,1138,0,0,1285,790,0,1565,1553,"Human, Federation, Civilian, Prodigy","male, organic, tng, wesley, crew_max_rarity_1","Study",1, 2, 8, 10, 12, , , , 0, 1, 215, 125, 70, 55, false,"Wesley",crew_portraits_cm_wesleysweater_sm.png,wesley_sweater_crew
"Ensign Crusher",9,3, 176,11,31,426,83,229,0,0,0,347,34,78,0,0,0,0,0,0,894,1280,1060,1385,1168,1127,548,1151,704,1124,0,0,1260,770,0,868,1281,1201,1392,1170,918,506,987,553,1136,0,0,1282,788,0,1456,1481,"Human, Federation, Starfleet, Prodigy, Warp Theorist","male, organic, tng, wesley, crew_max_rarity_3","Rewire",2, 4, 6, 8, 10, 6, 0, , , , 290, , , 190, false,"Wesley",crew_portraits_cm_wesley_sm.png,wesley_full_ensign_crew
"Acting Ensign Crusher",9,2, 114,29,58,258,56,160,0,0,0,251,53,148,0,0,0,0,0,0,1156,1284,1098,1394,1172,1297,667,1279,819,1137,0,0,1273,779,0,961,1268,949,1378,1153,1155,508,1160,712,1060,0,0,1173,724,0,1519,1463,"Human, Federation, Starfleet, Prodigy, Resourceful","male, organic, tng, wesley, crew_max_rarity_2","Invention",1, 4, 3, 6, 6, , , 2, , , 205, 50, 25, 165, false,"Wesley",crew_portraits_cm_wesleyensign_sm.png,wesley_acting_ensign_crew
"Formal Dress Wesley Crusher",9,4, 0,0,0,662,173,422,0,0,0,270,108,230,481,160,342,0,0,0,779,0,1191,1068,0,754,299,281,439,1100,1107,0,619,758,773,439,0,829,740,0,416,78,53,252,795,745,0,116,479,455,1211,299,"Human, Federation, Starfleet, Prodigy, Warp Theorist","male, organic, tng, wesley, crew_max_rarity_4","Duty to the Truth",1, 9, 4, 10, 12, , , , , , 300, 500, 30, 450, false,"Wesley",crew_portraits_cm_wesleydressuniform_sm.png,wesley_formal_dress_crew
"Wrathful Khan",7,5, 1040,206,421,0,0,0,1145,72,143,376,140,288,0,0,0,0,0,0,404,123,117,635,269,482,838,0,0,140,697,317,1119,671,0,337,292,28,552,212,1138,491,0,0,302,1282,947,700,370,0,647,582,"Human, Augments, Engineered, Villain, Cultural Figure, Tactician, Resourceful, Survivalist, Brutal, Vengeful","nonhuman, male, organic, tos, khan, crew_max_rarity_5","I Stab at Thee",2, 9, 12, 5, 12, 1, 0, , , , 640, 595, 345, 850, false,"Khan",crew_portraits_cm_khan_sm.png,khan_wok_crew
"Tailor Garak",5,3, 0,0,0,0,0,0,502,44,126,161,22,44,395,83,219,0,0,0,0,1115,1276,1219,0,1107,1008,1160,0,779,866,890,913,804,976,0,1216,1274,1084,0,1250,1010,1005,0,978,797,1012,822,806,816,1430,1452,"Cardassian, Undercover Operative, Scoundrel, Interrogator, Civilian","nonhuman, male, organic, ds9, garak, crew_max_rarity_3","Cutting Cloth",1, 5, 8, 12, 12, , , , , , 125, 230, 20, 405, false,"Garak",crew_portraits_cm_garaktailor_sm.png,garak_tailor_crew
"Bartender Quark",4,1, 110,25,77,0,0,0,81,15,57,0,0,0,211,36,150,0,0,0,1339,1267,1280,1294,1170,1339,0,1304,0,1166,1355,1085,1297,0,1117,1315,1211,1251,1108,1142,1333,0,1219,0,1160,1201,1080,1202,0,1037,1558,1530,"Ferengi, Bartender, Civilian, Scoundrel, Gambler, Merchant","nonhuman, male, organic, ds9, quark, crew_max_rarity_1","Hospitality",1, 2, 8, 10, 12, , , , 2, 1, 165, 10, 10, 140, false,"Quark",crew_portraits_cm_quarkbartender_sm.png,quark_s1_bartender_crew
"Richard Castillo",8,3, 487,109,227,286,57,187,0,0,0,0,0,0,0,0,0,0,0,0,726,1060,992,1133,874,1284,974,1269,810,0,0,0,0,0,0,448,929,837,1023,731,1079,797,1110,661,0,0,0,0,0,0,1478,1433,"Human, Hero, Pilot, Starfleet, Federation, Displaced, Romantic","male, organic, castillo, tng, crew_max_rarity_3","Self Sacrifice",0, 5, 12, 12, 10, 7, 0, , 1, 2, 650, 265, 129, 585, false,"Castillo",crew_portraits_cm_richardcastillo_sm.png,castillo_lieutenant_crew
"Writer Jake Sisko",10,3, 0,0,0,0,0,0,0,0,0,0,0,0,451,70,198,0,0,0,0,0,0,1206,0,0,0,1143,0,0,1239,0,1122,0,958,0,0,0,1136,0,0,0,1055,0,0,1184,0,1030,0,874,1557,1559,"Human, Federation, Civilian, Writer, Gambler, Romantic","male, organic, ds9, jake, crew_max_rarity_3","Construct Story",2, 3, 0, 8, 10, 6, 0, , , , 995, 350, 47, 640, true,"Jake",crew_portraits_cm_jakewriter_sm.png,jake_writer_crew
"CMO Crusher",10,2, 0,0,0,0,0,0,0,0,0,0,0,0,0,0,0,290,52,174,0,0,0,0,1121,0,0,0,815,0,0,1042,0,774,1090,0,0,0,0,1001,0,0,0,696,0,0,935,0,696,966,1579,1573,"Human, Starfleet, Federation, Physician, Caregiver, Cyberneticist","female, organic, tng, crusher, crew_max_rarity_2","Doctor's Calluses",2, 3, 6, 10, 10, , , , , , 185, , 35, 155, false,"Crusher",crew_portraits_cm_crusherwithlabcoat_sm.png,crusher_labcoat_crew
"Commando Crusher",6,3, 0,0,0,182,76,200,308,93,193,0,0,0,0,0,0,510,44,132,1305,1205,0,0,968,864,986,1297,452,1085,1325,554,0,676,963,1023,1027,0,0,1081,452,715,1050,403,894,1153,504,0,757,1053,1429,1350,"Human, Starfleet, Federation, Physician, Cyberneticist, Undercover Operative","female, organic, tng, crusher, crew_max_rarity_3","Repel Disease",0, 3, 6, 3, 12, 1, 0, , , , 575, , 370, 500, false,"Crusher",crew_portraits_cm_crusherblackcommandouniform_sm.png,crusher_black_commando_uniform_crew
"Dr. Crusher",10,4, 275,38,110,0,0,0,437,90,201,0,0,0,0,0,0,736,123,300,1293,857,1230,1339,334,1117,0,0,448,1000,1241,221,0,416,652,1280,782,1211,1326,324,958,0,0,430,888,1144,158,0,397,641,1320,1247,"Human, Starfleet, Federation, Physician, Cyberneticist","female, organic, tng, crusher, crew_max_rarity_4","Neutralize Disease",1, 7, 12, 12, 12, 4, 4, , , , 740, 250, 370, 500, false,"Crusher",crew_portraits_cm_crusherfromfirstcontact_sm.png,crusher_first_contact_crew
"Holonovel Doctor",9,4, 0,0,0,512,50,137,0,0,0,0,0,0,0,0,0,799,69,244,1121,0,0,0,596,1093,826,1117,181,0,0,599,0,411,651,1238,0,0,0,807,1228,919,1220,330,0,0,780,0,545,799,1406,1470,"Hologram, Human, Federation, Starfleet, Physician, Musician, Scoundrel","nonhuman, male, artificial_life, voy, emh, crew_max_rarity_4","Suggested Treatment",0, 7, 12, 12, 12, , , , , , 365, 370, 205, 525, false,"Doctor",crew_portraits_cm_doctorgolfclub_sm.png,emh_authorauthor_crew
"Mobile Doctor",10,5, 0,0,0,809,106,209,0,0,0,0,0,0,393,137,435,1191,110,334,775,0,0,1120,257,753,552,306,33,0,1149,267,983,161,74,942,0,0,661,565,911,647,157,132,0,648,576,439,371,72,714,507,"Hologram, Human, Federation, Starfleet, Musician, Physician","nonhuman, male, artificial_life, voy, emh, crew_max_rarity_5","House Call",2, 9, 12, 12, 12, , , , , , 1825, 600, , 600, false,"Doctor",crew_portraits_cm_emhmobile_sm.png,emh_mobileholoemitter_crew
"Comm Officer Uhura",6,1, 0,0,0,0,0,0,0,0,0,0,0,0,258,28,89,0,0,0,0,0,0,1356,0,0,0,1296,0,0,1380,0,1288,0,1110,0,0,0,1356,0,0,0,1293,0,0,1382,0,1280,0,1102,1585,1589,"Federation, Starfleet, Human, Musician, Communicator","female, organic, tos, uhura, crew_max_rarity_1","Incoming Message",2, 2, 8, 10, 12, , , , 1, 1, 320, , , 495, false,"Uhura",crew_portraits_cm_uhurared_sm.png,uhura_red_crew
"Commander Uhura",10,4, 459,128,299,0,0,0,0,0,0,0,0,0,592,198,429,0,0,0,1014,1038,963,514,842,0,0,842,0,0,997,0,805,0,658,724,801,650,135,568,0,0,412,0,0,521,0,340,0,287,1403,960,"Federation, Starfleet, Human, Musician, Communicator","female, organic, tos, uhura, crew_max_rarity_4","Hailing Frequencies",0, 8, 12, 26, 12, , , 1, , , 1165, , 75, 790, false,"Uhura",crew_portraits_cm_uhurawrathofkhan_sm.png,uhura_wrathofkhan_crew
"Dancing Uhura",9,5, 1026,84,195,0,0,0,0,0,0,0,0,0,1185,193,393,0,0,0,628,731,572,104,446,0,0,435,0,0,555,0,361,0,312,1005,1032,973,271,857,0,0,478,0,0,624,0,418,0,358,786,1240,"Human, Federation, Starfleet, Communicator, Casual, Musician, Artist","female, organic, tos, uhura, original, crew_max_rarity_5","Take The Lead",0, 8, 10, 3, 14, 1, 1, , , , 465, 260, 60, 400, false,"Uhura",crew_portraits_cm_uhura_dancing_sm.png,uhura_dancing_crew
"First Maje Culluh",9,3, 466,93,223,0,0,0,307,42,138,0,0,0,0,0,0,0,0,0,1098,825,1036,1179,924,1288,0,0,0,1126,1363,1038,0,0,0,921,676,879,1047,770,1237,0,0,0,1086,1334,1006,0,0,0,1489,1464,"Kazon, Scoundrel, Vengeful","nonhuman, male, organic, voy, culluh, crew_max_rarity_3","Nistrim Supremacy",2, 3, 6, 10, 10, 8, 4, , , , 665, 325, 133, 390, false,"Culluh",crew_portraits_cm_jalculluh_sm.png,culluh_crew
"KDF Alexander",7,2, 137,19,79,0,0,0,331,64,148,145,16,72,0,0,0,0,0,0,1336,1093,1227,1389,1169,1255,1009,0,0,961,1336,1003,1322,805,0,1318,978,1164,1370,1145,1148,1004,0,0,869,1289,950,1307,800,0,1526,1516,"Human, Klingon","male, organic, ds9, alexander, nonhuman, crew_max_rarity_2","Beginner's Luck",1, 3, 10, 12, 10, 5, 2, , , , 130, 200, 62, 15, false,"Alexander",crew_portraits_cm_alexanderkdf_sm.png,alexander_kdf_crew
"Commando Shran",9,4, 673,114,239,0,0,0,592,89,182,0,0,0,318,144,282,0,0,0,824,471,753,626,636,902,0,1166,0,828,704,725,1149,0,981,850,514,792,358,687,1000,0,795,0,914,402,840,722,0,623,1218,965,"Andorian, Tactician, Inspiring, Imperial Guard","nonhuman, male, organic, ent, shran, crew_max_rarity_4","Debt Owed",0, 8, 6, 8, 10, , , 3, , , 390, 575, 288, 350, false,"Shran",crew_portraits_cm_shrancommando_sm.png,shran_commando_crew
"Ushaan Shran",10,5, 989,83,164,0,0,0,1076,170,348,0,0,0,424,134,288,0,0,0,681,143,630,398,496,422,0,1076,0,393,198,279,1060,0,887,1086,364,1043,495,931,515,0,802,0,491,169,388,734,0,630,695,750,"Andorian, Duelist, Romantic, Imperial Guard","nonhuman, male, organic, ent, shran, crew_max_rarity_5","Debt Owed",0, 9, 6, 8, 10, , , 3, , , 1440, 565, 483, 390, false,"Shran",crew_portraits_cm_shrandueling_sm.png,shran_dueling_crew
"Fencing Sulu",9,4, 444,99,249,385,36,92,609,203,448,0,0,0,0,0,0,0,0,0,721,494,1047,1189,936,396,940,1239,791,705,990,597,0,0,0,611,175,812,992,702,166,985,1284,829,290,457,191,0,0,0,1265,823,"Human, Federation, Starfleet, Pilot, Resourceful, Duelist, Athlete","male, organic, tos, sulu, crew_max_rarity_4","Parry Attack",0, 6, 12, 8, 12, 6, 4, , , , 415, , 225, 225, false,"Sulu",crew_portraits_cm_sulufencing_sm.png,sulu_fencing_crew
"Morn",9,3, 0,0,0,0,0,0,359,70,174,0,0,0,418,121,295,0,0,0,0,1170,0,1181,0,1216,0,1090,0,1061,889,974,1073,0,903,0,1086,0,904,0,1064,0,809,0,959,454,886,743,0,642,1465,1393,"Lurian, Courier, Duelist, Civilian, Gambler, Smuggler","nonhuman, male, organic, ds9, morn, crew_max_rarity_3","Drinking Spot",0, 3, 0, 8, 8, , , , 1, 2, 150, 285, 57, 655, true,"Morn",crew_portraits_cm_morn_sm.png,morn_crew
"Seven in Blue",9,2, 0,0,0,294,51,209,0,0,0,278,53,130,0,0,0,0,0,0,1278,0,1228,0,0,1274,621,1260,805,1134,0,0,1268,777,0,1071,0,1166,0,0,1043,484,1079,628,1078,0,0,1198,745,0,1531,1495,"Human, Borg, Civilian, Federation, Astrophysicist","nonhuman, female, organic, voy, seven, crew_max_rarity_2","Ignore Irrelevancies",1, 2, 8, 10, 14, 4, 0, , , , 75, 50, 310, 170, false,"Seven",crew_portraits_cm_seven_of_nine_sm.png,seven_allblue_crew
"Seven of Nine",7,5, 0,0,0,785,247,791,0,0,0,854,225,454,514,89,183,0,0,0,487,0,536,1136,0,473,51,186,276,529,1171,0,150,263,844,60,0,226,1127,0,57,3,13,42,259,1178,0,72,87,870,680,37,"Human, Borg, Civilian, Federation, Astrophysicist","nonhuman, female, organic, voy, seven, crew_max_rarity_5","New Collective",2, 7, 12, 10, 14, 4, 0, , , , 1750, , 705, 440, false,"Seven",crew_portraits_cm_sevenbluegreyshoulders_sm.png,seven_bluegreyshoulders_crew
"Donik",10,3, 0,0,0,0,0,0,0,0,0,476,79,199,303,31,79,0,0,0,0,0,1053,1335,0,0,817,1280,0,973,1368,0,779,650,1097,0,0,974,1363,0,0,704,1301,0,903,1388,0,785,586,1109,1502,1521,"Hirogen, Innovator","nonhuman, male, organic, voy, donik, crew_max_rarity_3","Hunting Program",2, 4, 12, 12, 10, 7, 0, , , , 870, 165, , 340, false,"Donik",crew_portraits_cm_donik_sm.png,donik_crew
"Commander Tucker",8,2, 252,28,82,0,0,0,0,0,0,305,53,185,0,0,0,0,0,0,1314,1256,884,1360,1138,0,966,0,0,1112,0,0,1250,764,0,1310,1254,813,1361,1138,0,794,0,0,968,0,0,1080,659,0,1543,1533,"Human, Starfleet, Jury Rigger, Pilot, Explorer","male, organic, ent, tucker, crew_max_rarity_2","Warp Engines Online",1, 2, 6, 3, 8, 2, 0, , , , 520, 35, 50, 165, false,"Trip",crew_portraits_cm_tucker_sm.png,tucker_commander_crew
"Counselor Troi",6,1, 0,0,0,0,0,0,0,0,0,0,0,0,261,42,108,147,49,131,0,0,0,1344,1163,0,0,1286,843,0,1372,1075,1276,802,971,0,0,0,1327,1074,0,0,1263,795,0,1362,1007,1242,752,769,1561,1546,"Federation, Starfleet, Human, Betazoid, Empath, Counselor","nonhuman, female, organic, tng, troi, crew_max_rarity_1","Counselling",2, 1, 6, 10, 10, , , , , , 265, , 80, 345, false,"Troi",crew_portraits_cm_troitng_sm.png,troi_casualgray_crew
"Rakal Troi",6,4, 521,163,354,0,0,0,525,128,331,0,0,0,0,0,0,407,163,440,895,511,839,1032,222,879,0,0,574,808,1080,248,0,554,801,519,185,453,705,16,632,0,0,244,585,817,28,0,165,344,1150,167,"Federation, Starfleet, Human, Betazoid, Romulan, Empath, Undercover Operative, Tal Shiar","nonhuman, female, organic, tng, troi, crew_max_rarity_4","Romulan Disguise",1, 7, 12, 10, 14, 1, 2, , , , 90, 400, 175, 2825, false,"Troi",crew_portraits_cm_troirakal_sm.png,troi_rakal_crew
"Commander Troi",10,5, 0,0,0,0,0,0,383,203,253,0,0,0,1060,211,421,827,142,281,0,1106,0,625,558,1091,0,476,424,979,194,139,405,377,44,0,748,0,567,596,638,0,405,431,595,86,86,332,398,58,716,216,"Federation, Starfleet, Human, Betazoid, Empath, Counselor, Playful","nonhuman, female, organic, tng, troi, crew_max_rarity_5","Empathic Sense",1, 8, 6, 6, 6, , , , , , 1375, 475, 135, 725, true,"Troi",crew_portraits_cm_troifirstcontact_sm.png,troi_firstcontact_crew
"Vedek Winn Adami",8,3, 307,97,207,0,0,0,0,0,0,0,0,0,410,92,214,0,0,0,1233,1199,1166,908,1060,0,0,1156,0,0,1251,0,1140,0,972,947,985,911,587,800,0,0,992,0,0,1116,0,954,0,803,1490,1421,"Bajoran, Vedek, Cultural Figure, Spiritual","nonhuman, female, organic, ds9, winn, crew_max_rarity_3","Will of the Prophets",1, 4, 8, 10, 10, 4, 0, , , , , 270, 85, 830, false,"Winn",crew_portraits_cm_winnvedek_sm.png,winn_vedek_crew
"Subcommander T'Pol",7,3, 273,71,211,520,21,77,165,35,77,0,0,0,0,0,0,0,0,0,768,1083,1212,1327,1108,829,846,1154,706,1159,1398,1076,0,0,0,800,847,967,1111,851,1166,1000,1311,841,1137,1385,1056,0,0,0,1454,1467,"Vulcan, High Command, Astrophysicist, Telepath, Starfleet","nonhuman, female, organic, ent, tpol, crew_max_rarity_3","Logic",2, 5, 6, 10, 10, , , , , , 175, 120, 3, 100, false,"T'Pol",crew_portraits_cm_tpol_sm.png,tpol_subcommander_crew
"Commander T'Pol",9,4, 512,112,307,692,56,171,320,91,227,0,0,0,0,0,0,0,0,0,327,688,892,1072,779,472,608,894,483,1068,1303,977,0,0,0,318,390,667,887,579,483,829,1136,692,833,1088,752,0,0,0,1262,1135,"Vulcan, Starfleet, Astrophysicist, Telepath","nonhuman, female, organic, ent, tpol, crew_max_rarity_4","Vessel's Information",0, 5, 12, 12, 20, 2, 0, , , , 1400, 200, 70, 1175, false,"T'Pol",crew_portraits_cm_tpolcommander_sm.png,tpol_commander_crew
"Chef Neelix",1,1, 0,0,0,0,0,0,0,0,0,0,0,0,201,51,189,0,0,0,0,0,0,1355,0,0,0,1294,0,0,1378,0,1286,0,1109,0,0,0,1191,0,0,0,1111,0,0,1238,0,1090,0,930,1584,1565,"Talaxian, Mylean, Resourceful, Survivalist, Chef, Civilian, Communicator","nonhuman, male, organic, voy, neelix, crew_max_rarity_1","Soup's On",1, 2, 12, 14, 10, 6, 0, , 2, 1, 305, , , 210, false,"Neelix",crew_portraits_cm_neelix_sm.png,neelix_chef_crew
"CMO 'Bones' McCoy",8,1, 0,0,0,0,0,0,0,0,0,0,0,0,0,0,0,213,48,196,0,0,0,0,1133,0,0,0,824,0,0,1056,0,784,1108,0,0,0,0,963,0,0,0,663,0,0,898,0,667,931,1582,1566,"Human, Federation, Starfleet, Physician, Exobiology","male, organic, tos, mccoy, crew_max_rarity_1","Country Doctor",2, 3, 8, 10, 12, , , , 0, 2, 245, 10, 8, 285, false,"McCoy",crew_portraits_cm_mccoy_sm.png,mccoy_chief_medical_officer_crew
