crew, tier, rarity, CMD_core, CMD_min, CMD_max, SCI_core, SCI_min, SCI_max, SEC_core, SEC_min, SEC_max, ENG_core, ENG_min, ENG_max, DIP_core, DIP_min, DIP_max, MED_core, MED_min, MED_max, V_CMD_SCI, V_CMD_SEC, V_CMD_ENG, V_CMD_DIP, V_CMD_MED, V_SCI_SEC, V_SCI_ENG, V_SCI_DIP, V_SCI_MED, V_SEC_ENG, V_SEC_DIP, V_SEC_MED, V_ENG_DIP, V_ENG_MED, V_DIP_MED, G_CMD_SCI, G_CMD_SEC, G_CMD_ENG, G_CMD_DIP, G_CMD_MED, G_SCI_SEC, G_SCI_ENG, G_SCI_DIP, G_SCI_MED, G_SEC_ENG, G_SEC_DIP, G_SEC_MED, G_ENG_DIP, G_ENG_MED, G_DIP_MED, voyage_rank, gauntlet_rank, traits, hidden_traits, action_name, action_bonus_type, action_bonus_amount, action_initial_cooldown, action_duration, action_cooldown, bonus_ability, trigger, uses_per_battle, penalty_type, penalty_amount, accuracy, crit_bonus, crit_chance, evasion, charge_phases, short_name, image_name, symbol
"Investigator Odo",7,1, 0,0,0,0,0,0,217,37,171,0,0,0,0,0,0,0,0,0,0,1290,0,0,0,1346,0,0,0,1177,1421,1084,0,0,0,0,1200,0,0,0,1204,0,0,0,1077,1341,991,0,0,0,1629,1623,"Changeling, Cardassian, Investigator, Interrogator, Shapeshifter","nonhuman, male, organic, ds9, odo, crew_max_rarity_1","Collaboration",2, 1, 20, 14, 10, , , , , , 400, 115, 67, 265, false,"Odo",crew_portraits_cm_odooccupation_sm.png,odo_occupation_crew
"Constable Odo",5,3, 317,107,225,0,0,0,523,27,85,0,0,0,0,0,0,0,0,0,1240,836,1163,1309,1054,1143,0,0,0,1029,1278,923,0,0,0,926,809,870,1062,761,1346,0,0,0,1169,1428,1082,0,0,0,1519,1537,"Changeling, Bajoran, Constable, Investigator, Interrogator, Shapeshifter","nonhuman, male, organic, ds9, odo, crew_max_rarity_3","Justice",0, 6, 10, 12, 16, , , , 3, 800, 520, 300, 75, , false,"Odo",crew_portraits_cm_odostandard_sm.png,odo_constable_crew
"Ensign Ro",10,2, 322,46,132,0,0,0,0,0,0,0,0,0,0,0,0,0,0,0,1324,1274,1254,1371,1142,0,0,0,0,0,0,0,0,0,0,1287,1248,1214,1338,1101,0,0,0,0,0,0,0,0,0,0,1624,1627,"Starfleet, Bajoran, Resourceful","nonhuman, female, organic, tng, ro, crew_max_rarity_2","Separate Ways",0, 4, 3, 10, 5, , , 2, , , 130, 210, 13, 200, false,"Ro",crew_portraits_cm_roensign_sm.png,ro_ensign_crew
"Shinzon",9,5, 819,94,241,0,0,0,938,183,435,0,0,0,546,176,390,0,0,0,799,190,726,368,599,511,0,914,0,467,168,343,878,0,733,923,205,864,237,757,357,0,529,0,346,59,243,462,0,397,734,205,"Human, Clone, Reman, Villain, Romulan, Brutal, Crafty, Politician, Veteran, Vengeful","male, organic, tng, shinzon, crew_max_rarity_5","Destiny Complete",0, 7, 14, 3, 14, 1, 2, , , , 1325, 545, 365, 1050, false,"Shinzon",crew_portraits_cm_shinzon_sm.png,shinzon_crew
"Will Riker",5,1, 251,42,110,0,0,0,125,22,74,0,0,0,0,0,0,0,0,0,1342,1193,1277,1394,1162,1376,0,0,0,1198,1450,1110,0,0,0,1317,1115,1245,1367,1138,1359,0,0,0,1184,1440,1093,0,0,0,1616,1607,"Human, Federation, Starfleet, Maverick, Gambler, Romantic","male, organic, tng, riker, crew_max_rarity_1","Poker Face",0, 1, 8, 10, 14, 4, 0, , , , 455, , 425, 340, false,"Riker",crew_portraits_cm_rikers1_sm.png,riker_s1_commander_crew
"Commander Riker",1,2, 279,78,191,0,0,0,124,29,89,0,0,0,290,22,64,0,0,0,1323,1149,1251,1083,1140,1372,0,1326,0,1194,1306,1106,1318,0,1137,1059,892,1018,1013,898,1343,0,1358,0,1168,1352,1080,1352,0,1163,1557,1519,"Human, Federation, Starfleet, Pilot, Maverick, Gambler, Romantic, Playful","male, organic, tng, riker, crew_max_rarity_2","Liase",0, 2, 8, 10, 14, 5, 0, , , , 645, 50, 295, 275, false,"Riker",crew_portraits_cm_rikerpoker_sm.png,riker_s2_commander_crew
"Edith Keeler",8,4, 0,0,0,0,0,0,0,0,0,0,0,0,453,166,339,591,187,590,0,0,0,1115,609,0,0,1000,458,0,1159,607,969,411,186,0,0,0,757,115,0,0,631,123,0,761,135,552,58,17,1431,645,"Civilian, Caregiver, Inspiring, Cultural Figure, Romantic, Human","female, organic, tos, keeler, crew_max_rarity_4","A Life Worth Living",1, 7, 8, 10, 8, , , , , , 690, 25, 52, 440, false,"Keeler",crew_portraits_cm_edithkeeler_sm.png,keeler_crew
"Ensign Tuvok",7,1, 0,0,0,181,51,197,0,0,0,0,0,0,138,33,74,0,0,0,1361,0,0,1431,0,1356,1033,1231,862,0,1447,0,1362,0,1176,1140,0,0,1407,0,1106,824,941,679,0,1434,0,1332,0,1145,1618,1579,"Vulcan, Federation, Starfleet, Telepath","nonhuman, male, organic, voy, tuvok, crew_max_rarity_1","Memory",0, 1, 1, 14, 10, , , , , , 103, 60, 135, 375, false,"Tuvok",crew_portraits_cm_tuvokensign_sm.png,tuvok_ensign_crew
"Security Chief Tuvok",4,3, 291,53,161,145,45,149,445,85,201,0,0,0,0,0,0,0,0,0,1110,871,1266,1373,1152,838,1043,1361,872,1025,1277,921,0,0,0,796,698,1163,1282,1045,612,955,1250,804,921,1186,841,0,0,0,1498,1421,"Vulcan, Federation, Starfleet, Telepath, Tactician, Investigator","nonhuman, male, organic, voy, tuvok, crew_max_rarity_3","Contingency Plan",0, 4, 10, 12, 16, 5, 0, , , , 465, 50, , 300, false,"Tuvok",crew_portraits_cm_tuvokrifle_sm.png,tuvok_rifle_crew
"Major Kira",6,2, 273,37,126,0,0,0,304,60,176,0,0,0,0,0,0,0,0,0,1334,973,1269,1381,1153,1306,0,0,0,1144,1397,1050,0,0,0,1302,873,1228,1349,1120,1121,0,0,0,1007,1278,925,0,0,0,1581,1561,"Bajoran, Veteran, Resourceful","nonhuman, female, organic, ds9, kira, crew_max_rarity_2","Obstinance",0, 2, 0, 10, 14, 6, 0, , , , 295, 150, 5, , true,"Kira",crew_portraits_cm_kirashorthair_sm.png,kira_major_shorthair_crew
"Mirror Intendant Kira",7,5, 512,183,363,0,0,0,1052,272,542,0,0,0,946,67,184,0,0,0,924,189,860,333,745,389,0,781,0,366,74,250,728,0,594,503,41,431,337,347,153,0,1122,0,166,94,105,1099,0,936,567,152,"Bajoran, Cardassian, Klingon, Villain, Klingon-Cardassian Alliance, Brutal, Mirror Universe, Crafty","nonhuman, female, organic, ds9, kira, crew_max_rarity_5","Instability",0, 6, 6, 10, 12, 4, 0, , , , 915, 225, 90, 1525, true,"Kira",crew_portraits_cm_kiraintendant_sm.png,kira_mirror_crew
"Security Chief Worf",8,2, 205,57,144,0,0,0,326,61,145,0,0,0,0,0,0,0,0,0,1359,1011,1288,1406,1173,1299,0,0,0,1140,1390,1043,0,0,0,1245,859,1184,1303,1067,1208,0,0,0,1081,1345,994,0,0,0,1588,1555,"Klingon, Federation, Starfleet, Duelist, Investigator","nonhuman, male, organic, tng, worf, crew_max_rarity_2","They Have No Honor",2, 4, 8, 10, 12, , , , 1, 2, 165, 280, 95, 155, false,"Worf",crew_portraits_cm_worf_sm.png,worf_security_chief_crew
"Defiant Commander Worf",8,4, 364,241,488,0,0,0,609,179,394,0,0,0,0,0,0,0,0,0,981,465,919,1105,799,804,0,0,0,742,1027,630,0,0,0,222,55,186,425,128,449,0,0,0,419,653,321,0,0,0,1444,522,"Klingon, Federation, Starfleet, Duelist, Tactician, Veteran","nonhuman, male, organic, ds9, worf, crew_max_rarity_4","Good Day to Die",2, 6, 12, 12, 12, 4, 0, , 1, 2, 690, 645, 325, 205, false,"Worf",crew_portraits_cm_worfdefiant_sm.png,worf_defiant_commander_crew
"Mirror Regent Worf",8,5, 861,294,589,0,0,0,1062,175,357,0,0,0,0,0,0,0,0,0,495,122,435,709,329,438,0,0,0,406,647,295,0,0,0,104,33,82,250,54,509,0,0,0,487,712,380,0,0,0,825,302,"Klingon, Cardassian, Tactician, Villain, Brutal, Klingon-Cardassian Alliance, Mirror Universe","nonhuman, male, organic, ds9, worf, crew_max_rarity_5","Position of Strength",0, 9, 8, 8, 10, , , , , , 300, 980, 390, , false,"Worf",crew_portraits_cm_worfmirror_sm.png,worf_mirror_crew
"Yeoman Rand",9,1, 164,15,58,0,0,0,0,0,0,0,0,0,117,19,60,0,0,0,1376,1317,1314,1379,1198,0,0,1371,0,0,1452,0,1369,0,1179,1373,1315,1312,1368,1193,0,0,1361,0,0,1447,0,1357,0,1167,1626,1630,"Federation, Starfleet, Human","female, organic, tos, rand, crew_max_rarity_1","Signature Required",2, 2, 8, 10, 12, , , , 1, 1, 375, , , 180, false,"Rand",crew_portraits_cm_randyeoman_sm.png,rand_yeoman_crew
"The Duras Sisters",9,4, 311,83,205,0,0,0,658,150,385,0,0,0,464,170,341,0,0,0,1281,582,1210,833,1101,788,0,993,0,727,430,618,958,0,801,1024,322,983,339,864,505,0,620,0,486,111,376,540,0,454,1265,463,"Klingon, Scoundrel, Villain, Vengeful","nonhuman, female, organic, tng, betor, lursa, exclusive_fusion, crew_max_rarity_4","The Power of Two",0, 9, 10, 20, 12, , , 1, , , 350, 110, 190, 500, false,"Duras Sisters",crew_portraits_cm_duras_sisters_sm.png,duras_sisters_crew
"Persis",8,2, 0,0,0,0,0,0,253,94,250,0,0,0,303,39,88,0,0,0,0,1268,0,1377,0,1307,0,1316,0,1145,1089,1051,1309,0,1128,0,953,0,1391,0,863,0,1322,0,814,817,730,1311,0,1128,1575,1521,"Human, Augments, Engineered, Survivalist, Tactician","nonhuman, female, organic, ent, persis, crew_max_rarity_2","Augmented Strength",0, 2, 6, 10, 6, 7, 0, 2, , , 240, 330, 300, , false,"Persis",crew_portraits_cm_persis_sm.png,persis_crew
"Telek R'Mor",7,2, 0,0,0,347,52,194,119,8,44,0,0,0,263,30,113,0,0,0,1264,1323,0,1388,0,1124,957,931,805,1199,1343,1111,1319,0,1138,1144,1318,0,1377,0,982,828,883,682,1197,1365,1109,1296,0,1119,1554,1544,"Romulan, Astrophysicist","nonhuman, male, organic, voy, rmor, crew_max_rarity_2","Solitary Survey",1, 3, 10, 12, 10, 0, 2, , , , 405, 50, 3, 180, false,"R'Mor",crew_portraits_cm_telekrmor_sm.png,rmor_voyager_crew
"KDF Gowron",10,4, 375,85,222,0,0,0,296,100,256,0,0,0,641,173,418,0,0,0,1187,869,1119,612,1010,1260,0,861,0,1103,603,1009,820,0,669,979,468,931,241,822,835,0,494,0,787,171,703,423,0,364,1337,666,"Klingon, Duelist, Diplomat, Politician","nonhuman, male, organic, tng, gowron, crew_max_rarity_4","What Can Be Done",1, 6, 14, 10, 14, 0, 2, , , , 625, 465, 85, 1000, false,"Gowron",crew_portraits_cm_gowronyoung_sm.png,gowron_kdf_crew
"Third Remata'Klan",7,3, 410,42,84,0,0,0,467,85,185,0,0,0,0,0,0,0,0,0,1245,830,1174,1318,1063,1127,0,0,0,1012,1261,903,0,0,0,1340,876,1268,1387,1154,1033,0,0,0,943,1212,864,0,0,0,1517,1563,"Jem'hadar, Dominion, Duelist, Tactician","nonhuman, male, organic, ds9, remataklan, crew_max_rarity_3","Victory is Life",0, 3, 0, 6, 8, 4, 4, , , , 690, 395, 597, 600, true,"Remata'Klan",crew_portraits_cm_remataklan_sm.png,remataklan_crew
"Ensign Chapel",10,1, 0,0,0,0,0,0,0,0,0,0,0,0,0,0,0,214,34,152,0,0,0,0,1175,0,0,0,861,0,0,1091,0,818,1152,0,0,0,0,1095,0,0,0,811,0,0,1029,0,774,1071,1635,1626,"Human, Federation, Starfleet, Nurse","female, organic, tos, chapel, crew_max_rarity_1","Administer Prescription",2, 1, 6, 10, 10, , , , , , 130, , 40, 100, false,"Chapel",crew_portraits_cm_chapelensign_sm.png,chapel_ensign_crew
"Ensign Ogawa",8,1, 0,0,0,0,0,0,0,0,0,0,0,0,0,0,0,213,34,166,0,0,0,0,1169,0,0,0,859,0,0,1088,0,816,1147,0,0,0,0,1084,0,0,0,788,0,0,1017,0,762,1051,1634,1624,"Human, Federation, Starfleet, Nurse","female, organic, tng, ogawa, crew_max_rarity_1","Report to Sickbay",2, 1, 6, 1, 8, 2, 0, 1, , , 170, , 35, 105, false,"Ogawa",crew_portraits_cm_ogawaensign_sm.png,ogawa_ensign_crew
"Wesley Crusher",8,1, 0,0,0,218,43,149,0,0,0,174,32,78,0,0,0,0,0,0,1354,0,1309,0,0,1354,896,1340,857,1192,0,0,1355,831,0,1275,0,1284,0,0,1263,698,1251,807,1172,0,0,1328,819,0,1612,1599,"Human, Federation, Civilian, Prodigy","male, organic, tng, wesley, crew_max_rarity_1","Study",1, 2, 8, 10, 12, , , , 0, 1, 215, 125, 70, 55, false,"Wesley",crew_portraits_cm_wesleysweater_sm.png,wesley_sweater_crew
"Ensign Crusher",10,3, 176,11,31,426,83,229,0,0,0,347,34,78,0,0,0,0,0,0,931,1318,1097,1428,1199,1162,577,1187,732,1159,0,0,1303,801,0,905,1319,1241,1435,1201,948,534,1018,574,1171,0,0,1325,817,0,1503,1527,"Human, Federation, Starfleet, Prodigy, Warp Theorist","male, organic, tng, wesley, crew_max_rarity_3","Rewire",2, 4, 6, 8, 10, 6, 0, , , , 290, , , 190, false,"Wesley",crew_portraits_cm_wesley_sm.png,wesley_full_ensign_crew
"Acting Ensign Crusher",9,2, 114,29,58,258,56,160,0,0,0,251,53,148,0,0,0,0,0,0,1195,1322,1134,1437,1203,1337,697,1319,849,1171,0,0,1314,808,0,1002,1308,986,1422,1187,1198,537,1200,744,1095,0,0,1215,755,0,1565,1509,"Human, Federation, Starfleet, Prodigy, Resourceful","male, organic, tng, wesley, crew_max_rarity_2","Invention",1, 4, 3, 6, 6, , , 2, , , 205, 50, 25, 165, false,"Wesley",crew_portraits_cm_wesleyensign_sm.png,wesley_acting_ensign_crew
"Formal Dress Wesley Crusher",9,4, 0,0,0,662,173,422,0,0,0,270,108,230,481,160,342,0,0,0,815,0,1234,1100,0,784,312,302,461,1141,1143,0,645,788,797,465,0,865,765,0,438,81,57,267,824,768,0,122,498,468,1264,316,"Human, Federation, Starfleet, Prodigy, Warp Theorist","male, organic, tng, wesley, crew_max_rarity_4","Duty to the Truth",1, 9, 4, 10, 12, , , , , , 300, 500, 30, 450, false,"Wesley",crew_portraits_cm_wesleydressuniform_sm.png,wesley_formal_dress_crew
"Wrathful Khan",7,5, 1040,206,421,0,0,0,1145,72,143,376,140,288,0,0,0,0,0,0,424,125,124,661,282,502,875,0,0,150,722,331,1165,699,0,355,303,31,575,223,1173,524,0,0,319,1327,974,734,385,0,672,629,"Human, Augments, Engineered, Villain, Cultural Figure, Tactician, Resourceful, Survivalist, Brutal, Vengeful","nonhuman, male, organic, tos, khan, crew_max_rarity_5","I Stab at Thee",2, 9, 12, 5, 12, 1, 0, , , , 640, 595, 345, 850, false,"Khan",crew_portraits_cm_khan_sm.png,khan_wok_crew
"Tailor Garak",5,3, 0,0,0,0,0,0,502,44,126,161,22,44,395,83,219,0,0,0,0,1150,1316,1259,0,1139,1050,1194,0,799,891,919,943,833,1008,0,1255,1314,1114,0,1290,1052,1037,0,1016,822,1040,846,835,841,1478,1497,"Cardassian, Undercover Operative, Scoundrel, Interrogator, Civilian","nonhuman, male, organic, ds9, garak, crew_max_rarity_3","Cutting Cloth",1, 5, 8, 12, 12, , , , , , 125, 230, 20, 405, false,"Garak",crew_portraits_cm_garaktailor_sm.png,garak_tailor_crew
"Bartender Quark",4,1, 110,25,77,0,0,0,81,15,57,0,0,0,211,36,150,0,0,0,1382,1307,1321,1338,1202,1378,0,1343,0,1200,1400,1112,1336,0,1151,1357,1250,1291,1143,1173,1372,0,1257,0,1194,1240,1107,1241,0,1070,1604,1577,"Ferengi, Bartender, Civilian, Scoundrel, Gambler, Merchant","nonhuman, male, organic, ds9, quark, crew_max_rarity_1","Hospitality",1, 2, 8, 10, 12, , , , 2, 1, 165, 10, 10, 140, false,"Quark",crew_portraits_cm_quarkbartender_sm.png,quark_s1_bartender_crew
"Richard Castillo",8,3, 487,109,227,286,57,187,0,0,0,0,0,0,0,0,0,0,0,0,760,1096,1023,1172,901,1326,1016,1311,842,0,0,0,0,0,0,474,963,860,1055,753,1122,835,1146,690,0,0,0,0,0,0,1526,1481,"Human, Hero, Pilot, Starfleet, Federation, Displaced, Romantic","male, organic, castillo, tng, crew_max_rarity_3","Self Sacrifice",0, 5, 12, 12, 10, 7, 0, , 1, 2, 650, 265, 129, 585, false,"Castillo",crew_portraits_cm_richardcastillo_sm.png,castillo_lieutenant_crew
"Writer Jake Sisko",9,3, 0,0,0,0,0,0,0,0,0,0,0,0,451,70,198,0,0,0,0,0,0,1246,0,0,0,1176,0,0,1282,0,1158,0,992,0,0,0,1172,0,0,0,1088,0,0,1220,0,1058,0,899,1603,1606,"Human, Federation, Civilian, Writer, Gambler, Romantic","male, organic, ds9, jake, crew_max_rarity_3","Construct Story",2, 3, 0, 8, 10, 6, 0, , , , 995, 350, 47, 640, true,"Jake",crew_portraits_cm_jakewriter_sm.png,jake_writer_crew
"CMO Crusher",10,2, 0,0,0,0,0,0,0,0,0,0,0,0,0,0,0,290,52,174,0,0,0,0,1151,0,0,0,843,0,0,1067,0,803,1123,0,0,0,0,1026,0,0,0,722,0,0,958,0,718,996,1625,1619,"Human, Starfleet, Federation, Physician, Caregiver, Cyberneticist","female, organic, tng, crusher, crew_max_rarity_2","Doctor's Calluses",2, 3, 6, 10, 10, , , , , , 185, , 35, 155, false,"Crusher",crew_portraits_cm_crusherwithlabcoat_sm.png,crusher_labcoat_crew
"Commando Crusher",6,3, 0,0,0,182,76,200,308,93,193,0,0,0,0,0,0,510,44,132,1348,1240,0,0,987,894,1028,1337,471,1117,1369,568,0,693,981,1061,1060,0,0,1110,472,746,1084,421,922,1188,513,0,784,1086,1474,1393,"Human, Starfleet, Federation, Physician, Cyberneticist, Undercover Operative","female, organic, tng, crusher, crew_max_rarity_3","Repel Disease",0, 3, 6, 3, 12, 1, 0, , , , 575, , 370, 500, false,"Crusher",crew_portraits_cm_crusherblackcommandouniform_sm.png,crusher_black_commando_uniform_crew
"Dr. Crusher",10,4, 275,38,110,0,0,0,437,90,201,0,0,0,0,0,0,736,123,300,1335,891,1270,1382,336,1146,0,0,464,1030,1280,227,0,420,668,1322,815,1251,1369,338,983,0,0,452,914,1179,165,0,402,656,1358,1289,"Human, Starfleet, Federation, Physician, Cyberneticist","female, organic, tng, crusher, crew_max_rarity_4","Neutralize Disease",1, 7, 12, 12, 12, 4, 4, , , , 740, 250, 370, 500, false,"Crusher",crew_portraits_cm_crusherfromfirstcontact_sm.png,crusher_first_contact_crew
"Holonovel Doctor",9,4, 0,0,0,512,50,137,0,0,0,0,0,0,0,0,0,799,69,244,1160,0,0,0,613,1135,864,1159,181,0,0,612,0,415,665,1281,0,0,0,823,1269,962,1259,337,0,0,798,0,551,816,1452,1516,"Hologram, Human, Federation, Starfleet, Physician, Musician, Scoundrel","nonhuman, male, artificial_life, voy, emh, crew_max_rarity_4","Suggested Treatment",0, 7, 12, 12, 12, , , , , , 365, 370, 205, 525, false,"Doctor",crew_portraits_cm_doctorgolfclub_sm.png,emh_authorauthor_crew
"Mobile Doctor",10,5, 0,0,0,809,106,209,0,0,0,0,0,0,393,137,435,1191,110,334,809,0,0,1157,254,779,580,329,32,0,1189,272,1014,155,74,980,0,0,683,579,943,676,163,136,0,665,586,452,377,73,744,513,"Hologram, Human, Federation, Starfleet, Musician, Physician","nonhuman, male, artificial_life, voy, emh, crew_max_rarity_5","House Call",2, 9, 12, 12, 12, , , , , , 1825, 600, , 600, false,"Doctor",crew_portraits_cm_emhmobile_sm.png,emh_mobileholoemitter_crew
"Comm Officer Uhura",6,1, 0,0,0,0,0,0,0,0,0,0,0,0,258,28,89,0,0,0,0,0,0,1399,0,0,0,1335,0,0,1424,0,1328,0,1143,0,0,0,1399,0,0,0,1332,0,0,1426,0,1321,0,1135,1631,1635,"Federation, Starfleet, Human, Musician, Communicator","female, organic, tos, uhura, crew_max_rarity_1","Incoming Message",2, 2, 8, 10, 12, , , , 1, 1, 320, , , 495, false,"Uhura",crew_portraits_cm_uhurared_sm.png,uhura_red_crew
"Commander Uhura",10,4, 459,128,299,0,0,0,0,0,0,0,0,0,592,198,429,0,0,0,1047,1078,999,534,875,0,0,871,0,0,1028,0,828,0,675,762,836,678,140,592,0,0,429,0,0,535,0,348,0,293,1449,998,"Federation, Starfleet, Human, Musician, Communicator","female, organic, tos, uhura, crew_max_rarity_4","Hailing Frequencies",0, 8, 12, 26, 12, , , 1, , , 1165, , 75, 790, false,"Uhura",crew_portraits_cm_uhurawrathofkhan_sm.png,uhura_wrathofkhan_crew
"Dancing Uhura",9,5, 1026,84,195,0,0,0,0,0,0,0,0,0,1185,193,393,0,0,0,647,762,590,109,467,0,0,454,0,0,573,0,373,0,322,1039,1069,1003,276,879,0,0,501,0,0,644,0,434,0,371,817,1284,"Human, Federation, Starfleet, Communicator, Casual, Musician, Artist","female, organic, tos, uhura, original, crew_max_rarity_5","Take The Lead",0, 8, 10, 3, 14, 1, 1, , , , 465, 260, 60, 400, false,"Uhura",crew_portraits_cm_uhura_dancing_sm.png,uhura_dancing_crew
"First Maje Culluh",9,3, 466,93,223,0,0,0,307,42,138,0,0,0,0,0,0,0,0,0,1131,860,1070,1219,954,1327,0,0,0,1160,1407,1066,0,0,0,958,700,903,1080,793,1275,0,0,0,1119,1376,1033,0,0,0,1534,1510,"Kazon, Scoundrel, Vengeful","nonhuman, male, organic, voy, culluh, crew_max_rarity_3","Nistrim Supremacy",2, 3, 6, 10, 10, 8, 4, , , , 665, 325, 133, 390, false,"Culluh",crew_portraits_cm_jalculluh_sm.png,culluh_crew
"KDF Alexander",7,2, 137,19,79,0,0,0,331,64,148,145,16,72,0,0,0,0,0,0,1378,1127,1267,1432,1200,1292,1051,0,0,992,1378,1033,1363,835,0,1360,1015,1205,1414,1176,1184,1046,0,0,894,1335,980,1349,829,0,1572,1562,"Human, Klingon","male, organic, ds9, alexander, nonhuman, crew_max_rarity_2","Beginner's Luck",1, 3, 10, 12, 10, 5, 2, , , , 130, 200, 62, 15, false,"Alexander",crew_portraits_cm_alexanderkdf_sm.png,alexander_kdf_crew
"Commando Shran",9,4, 673,114,239,0,0,0,592,89,182,0,0,0,318,144,282,0,0,0,858,491,776,646,656,926,0,1198,0,853,730,748,1188,0,1012,882,528,813,369,707,1031,0,826,0,941,415,863,744,0,646,1259,1002,"Andorian, Tactician, Inspiring, Imperial Guard","nonhuman, male, organic, ent, shran, crew_max_rarity_4","Debt Owed",0, 8, 6, 8, 10, , , 3, , , 390, 575, 288, 350, false,"Shran",crew_portraits_cm_shrancommando_sm.png,shran_commando_crew
"Ushaan Shran",10,5, 989,83,164,0,0,0,1076,170,348,0,0,0,424,134,288,0,0,0,708,145,655,410,517,435,0,1105,0,402,206,289,1094,0,923,1124,374,1081,511,960,531,0,832,0,507,172,404,751,0,649,720,782,"Andorian, Duelist, Romantic, Imperial Guard","nonhuman, male, organic, ent, shran, crew_max_rarity_5","Debt Owed",0, 9, 6, 8, 10, , , 3, , , 1440, 565, 483, 390, false,"Shran",crew_portraits_cm_shrandueling_sm.png,shran_dueling_crew
"Fencing Sulu",9,4, 444,99,249,385,36,92,609,203,448,0,0,0,0,0,0,0,0,0,755,513,1084,1230,967,416,982,1280,823,724,1017,616,0,0,0,643,180,837,1029,727,177,1025,1324,858,300,471,200,0,0,0,1311,855,"Human, Federation, Starfleet, Pilot, Resourceful, Duelist, Athlete, Compromised","male, organic, tos, sulu, crew_max_rarity_4","Parry Attack",0, 6, 12, 8, 12, 6, 4, , , , 415, , 225, 225, false,"Sulu",crew_portraits_cm_sulufencing_sm.png,sulu_fencing_crew
"Morn",9,3, 0,0,0,0,0,0,359,70,174,0,0,0,418,121,295,0,0,0,0,1205,0,1220,0,1247,0,1122,0,1092,918,1000,1109,0,937,0,1123,0,933,0,1097,0,840,0,992,469,912,765,0,660,1511,1437,"Lurian, Courier, Duelist, Civilian, Gambler, Smuggler","nonhuman, male, organic, ds9, morn, crew_max_rarity_3","Drinking Spot",0, 3, 0, 8, 8, , , , 1, 2, 150, 285, 57, 655, true,"Morn",crew_portraits_cm_morn_sm.png,morn_crew
"Seven in Blue",9,2, 0,0,0,294,51,209,0,0,0,278,53,130,0,0,0,0,0,0,1320,0,1268,0,0,1314,652,1300,835,1168,0,0,1311,806,0,1110,0,1206,0,0,1078,513,1115,655,1115,0,0,1242,775,0,1578,1541,"Human, Borg, Civilian, Federation, Astrophysicist","nonhuman, female, organic, voy, seven, crew_max_rarity_2","Ignore Irrelevancies",1, 2, 8, 10, 14, 4, 0, , , , 75, 50, 310, 170, false,"Seven",crew_portraits_cm_seven_of_nine_sm.png,seven_allblue_crew
"Seven of Nine",8,5, 0,0,0,785,247,791,0,0,0,854,225,454,514,89,183,0,0,0,521,0,570,1173,0,504,51,203,297,567,1214,0,160,283,878,64,0,238,1162,0,66,3,14,43,278,1214,0,79,94,896,718,41,"Human, Borg, Civilian, Federation, Astrophysicist","nonhuman, female, organic, voy, seven, crew_max_rarity_5","New Collective",2, 7, 12, 10, 14, 4, 0, , , , 1750, , 705, 440, false,"Seven",crew_portraits_cm_sevenbluegreyshoulders_sm.png,seven_bluegreyshoulders_crew
"Donik",10,3, 0,0,0,0,0,0,0,0,0,476,79,199,303,31,79,0,0,0,0,0,1092,1378,0,0,855,1318,0,1009,1412,0,804,681,1130,0,0,1007,1406,0,0,739,1340,0,935,1432,0,811,610,1142,1549,1567,"Hirogen, Innovator","nonhuman, male, organic, voy, donik, crew_max_rarity_3","Hunting Program",2, 4, 12, 12, 10, 7, 0, , , , 870, 165, , 340, false,"Donik",crew_portraits_cm_donik_sm.png,donik_crew
"Commander Tucker",8,2, 252,28,82,0,0,0,0,0,0,305,53,185,0,0,0,0,0,0,1356,1294,911,1403,1170,0,1008,0,0,1149,0,0,1292,793,0,1352,1292,841,1405,1169,0,836,0,0,1008,0,0,1125,688,0,1590,1581,"Human, Starfleet, Jury Rigger, Pilot, Explorer","male, organic, ent, tucker, crew_max_rarity_2","Warp Engines Online",1, 2, 6, 3, 8, 2, 0, , , , 520, 35, 50, 165, false,"Trip",crew_portraits_cm_tucker_sm.png,tucker_commander_crew
"Counselor Troi",6,1, 0,0,0,0,0,0,0,0,0,0,0,0,261,42,108,147,49,131,0,0,0,1386,1194,0,0,1325,873,0,1416,1102,1317,830,1001,0,0,0,1370,1105,0,0,1303,821,0,1406,1034,1284,780,790,1606,1592,"Federation, Starfleet, Human, Betazoid, Empath, Counselor","nonhuman, female, organic, tng, troi, crew_max_rarity_1","Counselling",2, 1, 6, 10, 10, , , , , , 265, , 80, 345, false,"Troi",crew_portraits_cm_troitng_sm.png,troi_casualgray_crew
"Rakal Troi",6,4, 521,163,354,0,0,0,525,128,331,0,0,0,0,0,0,407,163,440,928,534,865,1065,232,902,0,0,581,831,1114,258,0,559,816,548,191,474,730,16,646,0,0,244,595,842,28,0,160,346,1189,171,"Federation, Starfleet, Human, Betazoid, Romulan, Empath, Undercover Operative, Tal Shiar","nonhuman, female, organic, tng, troi, crew_max_rarity_4","Romulan Disguise",1, 7, 12, 10, 14, 1, 2, , , , 90, 400, 175, 2825, false,"Troi",crew_portraits_cm_troirakal_sm.png,troi_rakal_crew
"Commander Troi",9,5, 0,0,0,0,0,0,383,203,253,0,0,0,1060,211,421,827,142,281,0,1140,0,643,572,1121,0,495,437,1008,202,139,415,380,44,0,770,0,579,610,655,0,423,453,609,86,89,338,404,60,745,218,"Federation, Starfleet, Human, Betazoid, Empath, Counselor, Playful","nonhuman, female, organic, tng, troi, crew_max_rarity_5","Empathic Sense",1, 8, 6, 6, 6, , , , , , 1375, 475, 135, 725, true,"Troi",crew_portraits_cm_troifirstcontact_sm.png,troi_firstcontact_crew
"Vedek Winn Adami",8,3, 307,97,207,0,0,0,0,0,0,0,0,0,410,92,214,0,0,0,1272,1237,1201,936,1093,0,0,1191,0,0,1293,0,1179,0,1003,985,1024,936,607,826,0,0,1026,0,0,1150,0,982,0,826,1536,1468,"Bajoran, Vedek, Cultural Figure, Spiritual","nonhuman, female, organic, ds9, winn, crew_max_rarity_3","Will of the Prophets",1, 4, 8, 10, 10, 4, 0, , , , , 270, 85, 830, false,"Winn",crew_portraits_cm_winnvedek_sm.png,winn_vedek_crew
"Subcommander T'Pol",7,3, 273,71,211,520,21,77,165,35,77,0,0,0,0,0,0,0,0,0,805,1119,1253,1370,1141,862,885,1190,735,1193,1442,1103,0,0,0,837,884,997,1147,875,1205,1042,1351,871,1170,1429,1083,0,0,0,1500,1514,"Vulcan, High Command, Astrophysicist, Telepath, Starfleet","nonhuman, female, organic, ent, tpol, crew_max_rarity_3","Logic",2, 5, 6, 10, 10, , , , , , 175, 120, 3, 100, false,"T'Pol",crew_portraits_cm_tpol_sm.png,tpol_subcommander_crew
"Commander T'Pol",9,4, 512,112,307,692,56,171,320,91,227,0,0,0,0,0,0,0,0,0,348,720,922,1107,803,496,639,930,514,1096,1346,1005,0,0,0,334,399,696,921,605,503,870,1176,723,857,1121,775,0,0,0,1312,1180,"Vulcan, Starfleet, Astrophysicist, Telepath","nonhuman, female, organic, ent, tpol, crew_max_rarity_4","Vessel's Information",0, 5, 12, 12, 20, 2, 0, , , , 1400, 200, 70, 1175, false,"T'Pol",crew_portraits_cm_tpolcommander_sm.png,tpol_commander_crew
"Chef Neelix",1,1, 0,0,0,0,0,0,0,0,0,0,0,0,201,51,189,0,0,0,0,0,0,1398,0,0,0,1332,0,0,1422,0,1326,0,1142,0,0,0,1230,0,0,0,1147,0,0,1280,0,1126,0,964,1630,1612,"Talaxian, Mylean, Resourceful, Survivalist, Chef, Civilian, Communicator","nonhuman, male, organic, voy, neelix, crew_max_rarity_1","Soup's On",1, 2, 12, 14, 10, 6, 0, , 2, 1, 305, , , 210, false,"Neelix",crew_portraits_cm_neelix_sm.png,neelix_chef_crew
"CMO 'Bones' McCoy",8,1, 0,0,0,0,0,0,0,0,0,0,0,0,0,0,0,213,48,196,0,0,0,0,1160,0,0,0,854,0,0,1082,0,811,1140,0,0,0,0,979,0,0,0,683,0,0,918,0,683,957,1628,1611,"Human, Federation, Starfleet, Physician, Exobiology","male, organic, tos, mccoy, crew_max_rarity_1","Country Doctor",2, 3, 8, 10, 12, , , , 0, 2, 245, 10, 8, 285, false,"McCoy",crew_portraits_cm_mccoy_sm.png,mccoy_chief_medical_officer_crew
