"Klingon Bride Jadzia",6,5, 0,0,0,993,128,279,351,137,273,0,0,0,1014,323,585,0,0,0,541,1054,0,557,0,124,358,52,291,923,168,852,333,0,301,729,769,0,239,0,130,459,12,410,602,32,554,78,0,103,565,95,"Federation, Starfleet, Exobiology, Astrophysicist, Trill, Gambler, Romantic, Klingon, Pilot","nonhuman, female, organic, ds9, dax, crew_max_rarity_5","Lead With My Heart",0, 7, 6, 8, 14, 7, 2, , , , 750, 20, 455, 405, false,"J. Dax",crew_portraits_cm_jadzia_dax_bride_sm.png,dax_jadzia_bride_crew
"Martia",9,4, 0,0,0,0,0,0,632,100,203,0,0,0,719,175,358,0,0,0,0,868,0,853,0,770,0,763,0,695,281,610,703,0,592,0,932,0,663,0,850,0,529,0,774,233,726,448,0,400,1249,1168,"Chameloid, Shapeshifter, Crafty, Survivalist, Criminal, Scoundrel, Prisoner","nonhuman, female, organic, martia, tos, crew_max_rarity_4","That Was Not His Knee",1, 6, 14, 10, 14, 7, 1, , , , 475, 325, 235, 529, false,"Martia",crew_portraits_cm_martia_sm.png,martia_crew
"Captain Klaa",10,4, 744,160,341,0,0,0,517,100,251,0,0,0,0,0,0,0,0,0,712,353,630,852,538,881,0,0,0,788,1038,710,0,0,0,530,262,442,676,385,755,0,0,0,696,949,643,0,0,0,1275,1135,"Klingon, Hunter, Tactician, Duelist","nonhuman, male, organic, tos, klaa, crew_max_rarity_4","Warrior's Mettle",0, 6, 12, 8, 14, 0, 2, , , , 650, 250, 125, 525, false,"Klaa",crew_portraits_cm_klaa_sm.png,klaa_crew
"Mintakan Riker",8,5, 516,39,73,0,0,0,1036,259,543,0,0,0,925,154,314,0,0,0,1061,217,993,380,913,341,0,628,0,309,61,217,544,0,472,1220,215,1152,614,1063,133,0,641,0,145,40,95,545,0,485,590,337,"Human, Federation, Starfleet, Survivalist, Hunter, Costumed, Undercover Operative, Vulcan, Mintakan","male, organic, tng, riker, crew_max_rarity_5","Proto-Vulcan Instincts",2, 7, 10, 10, 14, 7, 0, , , , 530, 230, 250, 415, false,"Riker",crew_portraits_cm_riker_mintakan_sm.png,riker_mintakan_crew
"Vulcan Executioner",9,5, 0,0,0,0,0,0,1225,255,535,0,0,0,912,146,284,0,0,0,0,401,0,778,0,214,0,663,0,199,39,106,584,0,497,0,320,0,828,0,137,0,736,0,151,49,100,646,0,577,695,629,"Vulcan, Federation, Brutal, Duelist","male, organic, nonhuman, tos, vulcan_executioner, crew_max_rarity_5","Till Death",0, 9, 8, 5, 14, 1, 0, 2, , , 350, 240, 130, 275, false,"Vulcan Executioner",crew_portraits_cm_vulcan_executioner_sm.png,vulcan_executioner_crew
"Anastasia Komananov",5,4, 0,0,0,0,0,0,614,123,244,0,0,0,784,116,233,0,0,0,0,857,0,858,0,759,0,769,0,688,286,600,713,0,599,0,827,0,945,0,716,0,853,0,665,343,612,790,0,684,1253,1259,"Bajoran, Hologram, Undercover Operative, Costumed, Romantic, Crafty","nonhuman, artificial_life, female, ds9, kira, crew_max_rarity_4","You've Destroyed Ze World!",0, 8, 6, 6, 10, , , , 2, 2, 575, 310, 131, 365, false,"Anastasia",crew_portraits_cm_kira_anastasia_sm.png,kira_anastasia_crew
"Gangster Kirk",8,5, 1171,177,371,0,0,0,494,151,303,0,0,0,912,138,269,0,0,0,336,176,285,120,211,848,0,666,0,760,240,684,594,0,502,448,161,363,198,315,585,0,765,0,529,216,470,691,0,612,509,300,"Federation, Starfleet, Costumed, Civilian, Human, Marksman, Crafty, Criminal","male, organic, tos, kirk, crew_max_rarity_5","Piece of the Action",2, 8, 12, 10, 14, 4, 0, , , , 455, 105, 210, 1405, false,"Kirk",crew_portraits_cm_kirk_gangster_sm.png,kirk_gangster_crew
"Stargazer Picard",3,1, 175,29,67,143,14,56,0,0,0,0,0,0,236,41,107,0,0,0,1201,1193,1182,1136,1093,1245,923,1119,791,0,1281,0,1197,0,1038,1172,1180,1170,1092,1077,1246,921,1077,789,0,1266,0,1155,0,1005,1446,1446,"Federation, Starfleet, Human, Astrophysicist, Tactician","male, organic, tng, picard, exclusive_honorhall, crew_max_rarity_1","Picard Maneuver",0, 1, 1, 10, 12, , , , , , 195, 120, 20, 220, false,"Picard",crew_portraits_cm_picardstargazer_sm.png,picard_stargazer_crew
"Kahless the Unforgettable",4,5, 1007,270,852,0,0,0,825,205,563,0,0,0,472,102,310,0,0,0,275,77,226,168,141,484,0,933,0,425,222,321,891,0,755,29,2,13,15,14,162,0,761,0,167,60,114,688,0,608,281,16,"Klingon, Cultural Figure, Inspiring, Duelist, Hero, Clone, Royalty","nonhuman, male, organic, tng, kahless, exclusive_honorhall, crew_max_rarity_5","Sword of Honor",2, 7, 6, 8, 14, 5, 2, , , , 575, 250, 209, 15, false,"Kahless",crew_portraits_cm_kahless_sm.png,kahless_crew
"Kurros",8,4, 548,91,224,0,0,0,0,0,0,0,0,0,785,133,276,0,0,0,906,932,836,401,755,0,0,761,0,0,888,0,699,0,589,863,899,806,402,734,0,0,764,0,0,884,0,690,0,611,1272,1250,"Resourceful, Tactician, Communicator, Scoundrel, Thief, Prodigy, Innovator","nonhuman, male, organic, voy, kurros, crew_max_rarity_4","I Am The Solution.",1, 8, 8, 10, 14, , , , , , 400, 375, 173, 525, false,"Kurros",crew_portraits_cm_kurros_crew_sm.png,kurros_crew
"Duchamps",6,4, 390,61,150,0,0,0,507,130,267,0,0,0,697,197,398,0,0,0,1098,624,1025,539,937,864,0,762,0,777,324,698,700,0,590,1091,500,1034,312,947,670,0,433,0,614,133,570,353,0,325,1063,664,"Klingon, Hologram, Gambler, Villain, Crafty, Duelist","nonhuman, organic, male, ds9, worf, crew_max_rarity_4","Chemin De Fer",2, 5, 10, 10, 10, 8, 4, , , , 550, 40, 142, 575, false,"Duchamps",crew_portraits_cm_worf_duchamps_sm.png,worf_duchamps_crew
"Assimilated Torres",8,5, 0,0,0,0,0,0,851,124,323,1114,231,477,0,0,0,0,0,0,0,736,287,0,0,637,258,0,0,44,830,474,344,127,0,0,713,188,0,0,601,171,0,0,18,778,487,197,71,0,780,730,"Borg, Jury Rigger, Human, Federation, Klingon, Maquis, Undercover Operative, Cyberneticist","female, organic, voy, nonhuman, torres, crew_max_rarity_5","Modulated Shields",0, 8, 6, 10, 10, 3, 0, 3, , , 680, 125, 260, 400, false,"Torres",crew_portraits_cm_torres_assimilated_sm.png,torres_assimilated_crew
"Falcon O'Brien",7,5, 913,97,234,0,0,0,1353,80,168,486,89,191,0,0,0,0,0,0,660,123,149,806,498,319,733,0,0,76,508,198,998,576,0,830,536,285,955,701,980,635,0,0,430,1121,822,926,535,0,588,1134,"Human, Starfleet, Federation, Costumed, Villain, Hologram, Brutal, Scoundrel","male, organic, ds9, obrien, crew_max_rarity_5","I Expect You To Die",0, 9, 10, 14, 12, , , 2, , , , 25, 100, 450, false,"Falcon",crew_portraits_cm_obrien_falcon_sm.png,obrien_falcon_crew
"One",9,5, 0,0,0,0,0,0,1023,95,208,1016,233,519,0,0,0,0,0,0,0,670,319,0,0,536,271,0,0,43,742,386,372,147,0,0,933,155,0,0,851,145,0,0,36,1019,727,163,51,0,759,877,"Human, Borg, Resourceful, Tactician, Hero","male, nonhuman, organic, voy, one, crew_max_rarity_5","You must comply",1, 10, 8, 12, 10, , , , , , 225, 210, 275, 425, false,"One",crew_portraits_cm_one_sm.png,one_crew
"Borg Queen",4,5, 1234,227,505,0,0,0,0,0,0,660,28,82,892,104,187,0,0,0,239,407,43,105,108,0,603,728,0,770,851,0,134,473,557,202,361,87,149,120,0,903,968,0,1052,1062,0,699,717,788,427,742,"Borg, Brutal, Cultural Figure, Resourceful, Interrogator, Communicator, Survivalist, Temporal Agent","nonhuman, female, organic, borg_queen, tng, voy, pic, crew_max_rarity_5","We are Borg",0, 8, 10, 3, 14, 1, 1, , , , 515, 200, 157, 300, false,"Borg Queen",crew_portraits_cm_borg_queen_sm.png,borg_queen_crew
"Assimilated Tuvok",6,4, 544,139,318,279,113,277,834,107,218,0,0,0,0,0,0,0,0,0,488,313,771,963,692,326,829,1140,719,606,887,523,0,0,0,124,321,516,740,465,211,476,790,422,735,983,685,0,0,0,1023,698,"Vulcan, Borg, Telepath, Brutal, Tactician, Undercover Operative","nonhuman, male, organic, voy, tuvok, apr2023, crew_max_rarity_4","Resistance is Illogical!",0, 9, 14, 20, 12, , , 1, , , 650, 200, 135, 425, false,"Tuvok",crew_portraits_cm_tuvok_assimilated_sm.png,tuvok_assimilated_crew
"Doc Crusher",4,4, 0,0,0,561,51,122,0,0,0,0,0,0,384,110,216,473,310,732,969,0,0,1132,566,939,665,581,133,0,1162,540,1055,359,287,1169,0,0,975,33,1163,853,588,19,0,994,32,833,13,9,1087,202,"Human, Starfleet, Federation, Physician, Caregiver, Costumed","female, organic, tng, crusher, crew_max_rarity_4","This is Senseless!",1, 8, 10, 10, 12, , , , 2, 2, 755, 155, 140, 575, false,"Crusher",crew_portraits_cm_crusher_dixonhill_sm.png,crusher_dixonhill_crew
"Cyrus Redblock",7,4, 678,245,528,0,0,0,433,29,65,0,0,0,587,167,322,0,0,0,676,454,596,281,505,1127,0,814,0,969,592,906,768,0,652,166,245,128,43,99,1234,0,603,0,1064,577,1001,509,0,447,892,359,"Civilian, Human, Hologram, Crafty, Criminal, Villain","male, nonhuman, artificial_life, tng, redblock, crew_max_rarity_4","Tolerant Man",1, 6, 14, 10, 14, 0, 1, , , , 590, 185, 205, 555, false,"Cyrus",crew_portraits_cm_cyrus_redblock_sm.png,redblock_crew
"Arik Soong",10,4, 214,171,365,726,119,276,0,0,0,0,0,0,0,0,0,508,57,120,355,1088,1040,1179,508,697,498,780,178,0,0,841,0,605,899,83,576,379,643,142,693,472,784,255,0,0,943,0,679,977,1167,781,"Human, Thief, Geneticist, Maverick, Civilian","male, organic, ent, arik, crew_max_rarity_4","Genetic Tampering",1, 6, 12, 12, 12, 7, 0, , , , 575, 195, 283, 490, false,"Arik",crew_portraits_cm_ariksoong_sm.png,arik_jacket_crew
"Assimilated La Forge",6,5, 855,239,482,403,148,316,0,0,0,1140,235,493,0,0,0,0,0,0,150,606,19,694,357,988,80,1004,607,289,0,0,323,116,0,18,373,4,394,130,588,18,654,352,201,0,0,181,61,0,467,41,"Human, Borg, Brutal, Innovator, Quantum Mechanics, Warp Theorist","male, organic, tng, laforge, original, crew_max_rarity_5","Full Impulse",1, 10, 10, 12, 10, , , , , , 350, 155, 80, 525, false,"La Forge",crew_portraits_cm_laforge_assimilated_sm.png,laforge_assimilated_crew
"Icheb",8,4, 0,0,0,596,84,191,0,0,0,735,140,413,0,0,0,0,0,0,880,0,639,0,0,824,143,880,493,608,0,0,701,340,0,967,0,380,0,0,930,125,983,560,403,0,0,419,191,0,1261,1180,"Civilian, Brunali, Borg, Astrophysicist, Prodigy, Innovator","male, nonhuman, organic, voy, icheb, crew_max_rarity_4","In Position!",2, 6, 10, 8, 12, 1, 1, , , , 290, 225, 145, 505, false,"Icheb",crew_portraits_cm_icheb_sm.png,icheb_crew
"Assimilated Janeway",9,5, 945,107,196,1211,99,369,570,64,158,0,0,0,0,0,0,0,0,0,44,311,579,794,486,58,256,416,196,798,1047,718,0,0,0,182,594,838,989,765,229,380,642,347,924,1168,868,0,0,0,553,985,"Human, Federation, Starfleet, Borg, Undercover Operative, Resourceful","female, organic, voy, janeway, crew_max_rarity_5","I Don't Compromise",0, 10, 8, 8, 12, , , , , , 625, 200, 127, 415, false,"Janeway",crew_portraits_cm_janeway_assimilated_sm.png,janeway_assimilated_crew
"Admiral Picard",6,4, 477,203,378,340,57,165,0,0,0,0,0,0,686,233,436,0,0,0,514,879,777,358,701,1157,852,407,734,0,872,0,684,0,578,154,526,327,46,277,1051,754,142,652,0,428,0,240,0,234,1026,233,"Human, Hologram, Ambassador, Veteran, Explorer, Federation, Starfleet","male, tng, picard, nonhuman, artificial_life, crew_max_rarity_4","Strategic Importance",2, 9, 8, 8, 10, , , 2, , , 580, 225, 320, 450, false,"Picard",crew_portraits_cm_picard_admiral_sm.png,picard_admiral_crew
"Riley Frazier",9,4, 430,38,79,489,147,312,0,0,0,0,0,0,671,177,361,0,0,0,535,1084,1031,567,945,847,594,265,508,0,903,0,723,0,604,435,1168,1150,506,1060,594,396,95,361,0,645,0,440,0,394,1092,794,"Civilian, Human, Borg, Desperate, Romantic, Resourceful, Federation, Starfleet, Communicator","female, organic, voy, riley, crew_max_rarity_4","For The Cooperative!",0, 5, 10, 10, 20, 2, 0, , , , 550, 200, 172, 550, false,"Riley",crew_portraits_cm_riley_frazier_sm.png,riley_frazier_crew
"Yarnek",9,5, 896,191,440,1004,304,584,0,0,0,0,0,0,507,77,173,0,0,0,39,610,450,306,362,336,257,131,200,0,1101,0,957,0,817,6,460,241,241,196,107,93,36,82,0,1130,0,990,0,852,501,79,"Excalbian, Crafty, Exobiology, Quantum Mechanics, Telepath, Explorer, Shapeshifter","nonhuman, organic, male, tos, yarnek, crew_max_rarity_5","Good Versus Evil",2, 8, 6, 6, 6, , , , , , 265, , 130, 200, true,"Yarnek",crew_portraits_cm_yarnek_sm.png,yarnek_crew
"Bartender Guinan",6,5, 0,0,0,0,0,0,528,99,197,0,0,0,948,358,730,811,236,601,0,965,0,543,406,899,0,400,306,806,138,46,317,219,28,0,946,0,121,87,868,0,53,96,791,24,14,35,36,1,446,23,"Communicator, Civilian, Counselor, Marksman, Empath, Bartender, El-Aurian","nonhuman, female, organic, tng, guinan, gauntlet_jackpot, exclusive_gauntlet, crew_max_rarity_5","I Listen",1, 8, 12, 12, 20, 2, 0, , 2, 3, 515, 175, 80, 655, false,"Guinan",crew_portraits_cm_guinan_mixologist_sm.png,guinan_bartender_crew
"Galen",7,4, 0,0,0,777,70,180,571,84,199,0,0,0,215,169,339,0,0,0,748,929,0,1207,0,208,505,445,421,766,748,690,1116,0,973,1021,967,0,696,0,452,702,234,599,819,278,768,482,0,424,1122,914,"Human, Costumed, Brutal, Undercover Operative, Smuggler, Musician, Starfleet, Federation","male, organic, tng, picard, crew_max_rarity_4","Mutiny",0, 6, 12, 12, 12, 4, 0, , , , 350, 275, 140, 550, false,"Picard",crew_portraits_cm_picardgalen_sm.png,picard_galen_crew
"Maquis Tuvok",9,5, 493,88,296,826,163,415,1170,139,344,0,0,0,0,0,0,0,0,0,163,189,861,1026,776,22,436,676,350,319,533,224,0,0,0,77,249,664,869,604,41,289,454,249,482,707,411,0,0,0,571,256,"Vulcan, Maquis, Telepath, Costumed, Tactician, Undercover Operative","nonhuman, male, organic, voy, tuvok, crew_max_rarity_5","Et Tuvok",0, 8, 10, 3, 14, 4, 1, , , , 450, 100, 65, 375, false,"Tuvok",crew_portraits_cm_tuvok_maquis_sm.png,tuvok_maquis_crew
"Marla McGivers",10,4, 0,0,0,0,0,0,0,0,0,532,107,240,906,76,167,0,0,0,0,0,857,833,0,0,618,729,0,786,855,0,143,487,559,0,0,761,1100,0,0,521,1034,0,713,1137,0,357,426,859,1259,1329,"Human, Artist, Tactician, Communicator, Federation, Starfleet, Romantic","female, organic, tos, marla, crew_max_rarity_4","All For Love",1, 7, 6, 8, 8, , , , , , 450, 270, 40, 440, false,"Marla",crew_portraits_cm_marla_mcgivers_sm.png,marla_mcgivers_crew
"Benny Russell",9,5, 0,0,0,1134,160,528,351,77,159,0,0,0,802,218,582,0,0,0,329,1108,0,718,0,83,246,51,188,985,346,918,501,0,435,267,1035,0,332,0,83,192,7,168,890,117,842,125,0,146,601,99,"Human, Civilian, Writer, Veteran, Communicator, Desperate","male, organic, ds9, sisko, crew_max_rarity_5","Cannot Destroy an Idea!",2, 10, 12, 12, 12, , , 2, , , 520, 515, 33, 200, false,"Benny",crew_portraits_cm_sisko_benny_sm.png,sisko_benny_crew
"Vedek Bareil Antos",7,4, 414,218,437,0,0,0,0,0,0,0,0,0,735,181,382,375,92,190,874,904,805,371,338,0,0,751,684,0,873,887,685,630,275,283,430,218,56,44,0,0,479,556,0,608,781,409,539,131,1006,210,"Bajoran, Vedek, Cultural Figure, Spiritual, Survivalist, Gardener","nonhuman, male, organic, ds9, bareil, crew_max_rarity_4","An Opposing Viewpoint",1, 5, 3, 10, 8, 4, 0, 2, , , 315, 285, 110, 400, false,"Bareil",crew_portraits_cm_bariel_vedek_sm.png,bareil_vedek_crew
"Sheriff Worf",5,4, 803,105,246,0,0,0,607,106,217,0,0,0,412,31,95,0,0,0,722,321,643,555,550,788,0,1128,0,713,645,627,1091,0,954,800,416,726,714,659,807,0,1208,0,737,783,690,1180,0,1023,1032,1188,"Klingon, Starfleet, Federation, Costumed, Duelist, Constable","male, organic, tng, worf, nonhuman, crew_max_rarity_4","Sheriff of Deadwood",2, 6, 12, 12, 12, 7, 2, , , , 620, 390, 72, 600, false,"Worf",crew_portraits_cm_worf_cowboy_sm.png,worf_cowboy_crew
"Sheriff of Nottingham Q",9,5, 1077,299,641,0,0,0,952,94,188,0,0,0,0,0,0,0,0,0,288,108,239,497,159,621,0,0,0,552,812,459,0,0,0,78,66,52,197,40,910,0,0,0,821,1067,771,0,0,0,719,583,"Crafty, Costumed, Scoundrel, Constable, Romantic, Q Continuum","nonhuman, male, tng, q_jdl, crew_max_rarity_5","Gallant But Futile",2, 10, 12, 12, 12, , , , 0, 2, 600, 210, 63, 150, false,"Q",crew_portraits_cm_q_nottingham_sm.png,q_nottingham_crew
"Robin Hood",7,4, 699,39,94,0,0,0,942,68,139,0,0,0,217,137,275,0,0,0,843,293,774,729,694,653,0,1183,0,578,519,492,1158,0,1007,1206,862,1133,650,1047,1085,0,759,0,961,494,904,685,0,605,1028,1235,"Starfleet, Federation, Human, Costumed, Hero, Thief, Marksman","male, organic, tng, bridge_crew, crew_max_rarity_4","Quite Right",2, 8, 12, 10, 14, 7, 4, , , , 500, 70, 165, 780, false,"Picard",crew_portraits_cm_picard_robinhood_sm.png,picard_robinhood_crew
"North Star Archer",6,4, 634,122,253,0,0,0,835,106,237,316,66,134,0,0,0,0,0,0,793,285,430,922,631,674,884,0,0,317,884,518,1165,692,0,755,379,345,880,620,769,806,0,0,414,963,656,1089,654,0,1024,1077,"Human, Starfleet, Tactician, Duelist, Costumed, Hero, Explorer","male, organic, ent, archer, crew_max_rarity_4","High Noon",2, 8, 12, 5, 12, 2, 0, , , , 670, 45, 42, 315, false,"Archer",crew_portraits_cm_archer_cowboy_sm.png,archer_cowboy_crew
"Princess Jadzia",3,4, 0,0,0,882,75,158,0,0,0,310,132,294,577,143,292,0,0,0,709,0,1012,952,0,670,237,211,397,944,960,0,391,625,676,1062,0,610,817,0,1032,212,331,632,591,838,0,93,336,570,953,831,"Federation, Starfleet, Costumed, Gambler, Royalty, Astrophysicist, Trill, Pilot","nonhuman, female, organic, ds9, dax, crew_max_rarity_4","For Camelot!",2, 7, 6, 8, 10, 3, 0, 3, , , 330, 10, 45, 405, false,"J. Dax",crew_portraits_cm_jadzia_dax_camelot_sm.png,dax_jadzia_camelot_crew
"Commander Kira Nerys",7,5, 1239,206,406,0,0,0,418,130,262,0,0,0,809,207,448,0,0,0,286,178,237,97,155,1008,0,658,0,885,293,806,582,0,494,345,159,270,41,227,680,0,348,0,624,103,578,250,0,244,494,123,"Bajoran, Starfleet, Federation, Veteran, Survivalist, Tactician, Saboteur","nonhuman, female, organic, ds9, kira, crew_max_rarity_5","Guerrilla Warfare",2, 7, 16, 3, 16, 1, 2, , , , 315, 325, , 340, false,"Kira",crew_portraits_cm_kira_commander_sm.png,kira_commander_crew
"Captain T'Pol",6,4, 773,97,275,606,69,194,0,0,0,0,0,0,230,195,391,0,0,0,186,788,648,547,561,819,581,516,491,0,1171,0,1066,0,922,326,816,686,200,626,956,662,159,575,0,576,0,376,0,341,1041,632,"Vulcan, Starfleet, Astrophysicist, Tactician, Telepath","nonhuman, female, organic, ent, tpol, crew_max_rarity_4","Field Commission",1, 5, 12, 12, 20, 2, 0, , , , 975, 75, 3, 190, false,"T'Pol",crew_portraits_cm_tpol_captain_sm.png,tpol_captain_crew
"Admiral Kirk",9,5, 814,266,548,0,0,0,0,0,0,0,0,0,1273,148,289,0,0,0,505,599,438,89,351,0,0,393,0,0,494,0,310,0,286,136,289,102,45,74,0,0,721,0,0,831,0,630,0,562,700,556,"Gambler, Maverick, Human, Starfleet, Federation, Inspiring, Hero","male, organic, tos, kirk, crew_max_rarity_5","Kobayashi Maru",1, 8, 6, 8, 10, 3, 0, 2, , , 325, 505, 255, 315, false,"Kirk",crew_portraits_cm_kirk_admiral_sm.png,kirk_admiral_crew
"Dahar Master Kor",7,4, 618,57,184,0,0,0,299,96,232,0,0,0,806,181,358,0,0,0,873,621,802,330,731,1151,0,707,0,989,479,923,637,0,537,1018,543,976,351,883,791,0,520,0,727,213,674,439,0,390,983,782,"Klingon, Duelist, Cultural Figure, Romantic, Dahar Master, Communicator, Inspiring","nonhuman, male, organic, ds9, kor, crew_max_rarity_4","Long Live The Empire!",0, 5, 3, 10, 8, 4, 0, 2, , , 215, 190, 50, 290, false,"Kor",crew_portraits_cm_kor_daharmaster_sm.png,kor_daharmaster_crew
"Klingon Neelix",7,4, 0,0,0,0,0,0,878,85,252,0,0,0,613,72,187,0,0,0,0,755,0,981,0,654,0,866,0,580,265,493,829,0,705,0,869,0,1078,0,777,0,1010,0,719,540,664,973,0,838,1241,1326,"Talaxian, Mylean, Klingon, Brutal, Chef, Survivalist, Ambassador","nonhuman, male, organic, voy, neelix, crew_max_rarity_4","Hunger Is The Enemy",1, 5, 10, 10, 10, 8, 4, , , , 475, 295, 165, 315, false,"Neelix",crew_portraits_cm_neelix_klingon_sm.png,neelix_klingon_crew
"Grilka",10,5, 875,215,496,0,0,0,458,70,177,0,0,0,1031,125,297,0,0,0,495,297,428,132,343,1044,0,517,0,913,244,838,431,0,380,220,182,173,82,135,983,0,748,0,869,420,825,661,0,588,633,328,"Klingon, Romantic, Tactician, Resourceful","nonhuman, female, organic, ds9, grilka, crew_max_rarity_5","House of Grilka",0, 8, 6, 6, 6, , , , , , 775, 50, 83, 350, true,"Grilka",crew_portraits_cm_grilka_sm.png,grilka_crew
"Kortar",7,5, 921,186,430,0,0,0,1209,157,301,0,0,0,404,121,255,0,0,0,496,105,429,326,344,338,0,1061,0,307,163,213,1025,0,885,343,119,268,172,224,579,0,810,0,520,232,461,739,0,649,536,243,"Klingon, Cultural Figure, Brutal, Duelist, Hero, Veteran","nonhuman, male, organic, voy, kortar, crew_max_rarity_5","Gre'thor Awaits You",2, 7, 6, 8, 14, 7, 2, , , , 425, 300, 45, 315, false,"Kortar",crew_portraits_cm_kortar_sm.png,kortar_crew
"Protomorphosis Worf",8,5, 887,186,408,0,0,0,1270,145,307,0,0,0,0,0,0,0,0,0,559,101,485,727,399,309,0,0,0,276,499,191,0,0,0,380,136,305,568,259,590,0,0,0,537,763,475,0,0,0,709,859,"Klingon, Federation, Starfleet, Brutal, Primal, Hunter, Desperate","nonhuman, male, organic, tng, worf, crew_max_rarity_5","Protomorphosis",0, 10, 8, 10, 12, , , , 2, 2, 200, 195, 140, 375, false,"Worf",crew_portraits_cm_worf_genesis_sm.png,worf_genesis_crew
"Ambassador K'Ehleyr",7,4, 0,0,0,0,0,0,549,72,188,0,0,0,941,45,102,0,0,0,0,959,0,841,0,896,0,737,0,803,311,719,670,0,565,0,994,0,1238,0,952,0,1187,0,846,878,802,1156,0,1006,1270,1411,"Klingon, Human, Brutal, Ambassador, Communicator, Federation","nonhuman, female, organic, kehleyr, tng, crew_max_rarity_4","Trapped Between Cultures",1, 6, 6, 6, 6, , , , , , 325, 255, 168, 475, true,"K'Ehleyr",crew_portraits_cm_kehleyr_ambassador_sm.png,kehleyr_ambassador_crew
"Dahar Master Kang",7,5, 0,0,0,0,0,0,1006,106,285,0,0,0,1225,216,436,0,0,0,0,627,0,493,0,486,0,354,0,427,36,324,272,0,240,0,796,0,515,0,684,0,354,0,629,106,580,257,0,248,693,904,"Klingon, Brutal, Tactician, Cultural Figure, Dahar Master, Diplomat, Veteran","nonhuman, male, organic, ds9, kang, crew_max_rarity_5","Glorious Victory",0, 9, 12, 10, 14, 4, 4, , , , 865, 160, 100, 465, false,"Kang",crew_portraits_cm_kang_dahar_sm.png,kang_daharmaster_crew
"Klingon Torres",6,4, 0,0,0,0,0,0,895,81,230,625,75,208,0,0,0,0,0,0,0,752,790,0,0,648,572,0,0,123,846,485,821,449,0,0,918,903,0,0,835,632,0,0,330,1008,714,921,530,0,1233,1327,"Klingon, Civilian, Brutal, Duelist, Desperate, Prisoner","nonhuman, female, organic, voy, torres, crew_max_rarity_4","You Need Me",0, 5, 1, 12, 20, 2, 0, , , , 355, 275, 53, 405, true,"Torres",crew_portraits_cm_torres_klingon_sm.png,torres_klingon_crew
"Liaison Torres",9,4, 263,115,295,0,0,0,0,0,0,551,83,250,669,128,307,0,0,0,1133,1105,514,594,978,0,604,787,0,771,920,0,231,474,619,699,755,152,281,562,0,537,726,0,729,837,0,150,442,569,1134,699,"Federation, Human, Cyberneticist, Klingon, Civilian, Diplomat","nonhuman, female, organic, voy, torres, crew_max_rarity_4","Career Change",0, 5, 12, 12, 20, 2, 0, , , , , 345, , 750, false,"Torres",crew_portraits_cm_torres25c_sm.png,torres_liaison_crew
"Klingon Janeway",7,5, 563,27,71,877,180,379,1270,129,255,0,0,0,0,0,0,0,0,0,169,191,966,1106,879,20,407,634,328,299,520,204,0,0,0,308,649,1167,1278,1075,79,305,483,259,640,903,592,0,0,0,557,899,"Klingon, Human, Brutal, Duelist, Veteran, Survivalist","nonhuman, female, organic, voy, janeway, crew_max_rarity_5","Power Is Not Enough",2, 8, 4, 10, 16, 5, 0, , , , 425, 190, 190, 515, false,"Janeway",crew_portraits_cm_janeway_klingon_sm.png,janeway_klingon_crew
"Alidar Jarok",6,4, 546,254,581,0,0,0,325,170,400,0,0,0,604,64,189,0,0,0,728,435,649,402,562,1017,0,883,0,893,566,816,842,0,718,122,32,92,101,70,394,0,1021,0,362,244,285,983,0,846,964,117,"Romulan, Veteran, Desperate, Tactician","nonhuman, male, organic, jarok, tng, crew_max_rarity_4","I Am Not A Traitor",2, 7, 10, 10, 16, 6, 0, , , , 200, , 96, 315, false,"Jarok",crew_portraits_cm_jarok_sm.png,jarok_crew
"Advocate Kolos",6,4, 352,43,123,673,59,150,0,0,0,0,0,0,748,188,371,0,0,0,510,1134,1100,552,1016,768,555,210,466,0,862,0,671,0,566,770,1138,1098,406,1016,1098,790,226,680,0,613,0,413,0,371,1014,1081,"Klingon, Communicator, Diplomat, Interrogator, Investigator","nonhuman, male, organic, ent, kolos, crew_max_rarity_4","Be Silent",2, 7, 12, 10, 14, 4, 0, , , , 575, 120, 100, 400, false,"Kolos",crew_portraits_cm_kolos_sm.png,kolos_advocate_crew
"The President of Earth",4,4, 399,18,74,0,0,0,0,0,0,0,0,0,651,188,487,458,133,445,1162,1125,1090,566,431,0,0,764,504,0,891,681,704,470,141,1231,1182,1172,368,188,0,0,321,252,0,416,296,230,176,20,1088,434,"Hologram, Federation, Starfleet, Politician, Cultural Figure, Inspiring, Musician, Diplomat, Human","nonhuman, male, artificial_life, voy, emh, crew_max_rarity_4","Hail to the Chief",0, 8, 12, 12, 16, 5, 0, , , , 450, 15, 165, 475, false,"The President",crew_portraits_cm_emh_president_sm.png,emh_president_crew
"Nyota Uhura",9,5, 899,74,127,0,0,0,536,63,125,0,0,0,1050,240,468,0,0,0,710,389,624,138,535,990,0,431,0,870,158,792,350,0,313,1115,794,1056,226,966,1135,0,274,0,985,196,930,202,0,200,642,812,"Human, Federation, Starfleet, Communicator, Resourceful, Musician","female, organic, tos, uhura, crew_max_rarity_5","Alameda Express",1, 8, 4, 10, 10, , , , , , 115, 15, 167, 565, false,"Uhura",crew_portraits_cm_uhurastiv_sm.png,uhura_stiv_crew
"Katra McCoy",8,4, 0,0,0,325,76,166,0,0,0,0,0,0,458,170,347,790,121,352,1165,0,0,1008,545,1161,857,633,201,0,1021,524,855,338,139,1043,0,0,680,478,1008,717,233,155,0,668,453,470,268,78,1089,651,"Federation, Starfleet, Vulcan, Desperate, Human, Physician","male, organic, tos, mccoy, crew_max_rarity_4","Steps of Mount Seleya",1, 6, 4, 8, 8, 6, 0, , , , 450, 190, 53, 280, true,"McCoy",crew_portraits_cm_mccoy_katra_sm.png,mccoy_katra_crew
"Katrine",8,5, 1050,271,589,525,36,110,867,200,373,0,0,0,0,0,0,0,0,0,90,110,272,542,200,125,743,1047,639,500,768,413,0,0,0,57,27,80,253,62,205,879,1188,758,355,579,280,0,0,0,554,150,"Human, Federation, Starfleet, Crafty, Desperate, Gambler, Saboteur, Undercover Operative, Costumed","female, organic, voy, janeway, crew_max_rarity_5","Leave The War Outside",0, 7, 6, 8, 14, 4, 2, , , , 315, 385, 80, 650, false,"Janeway",crew_portraits_cm_janeway_tuxedo_sm.png,janeway_tuxedo_crew
"M-113 Creature",7,4, 0,0,0,382,126,262,665,45,92,0,0,0,797,102,202,0,0,0,1063,916,0,859,0,399,765,381,660,745,326,664,717,0,602,757,1161,0,1007,0,468,478,299,425,1033,819,975,884,0,754,1000,1179,"M-113 Creature, Desperate, Exobiology, Shapeshifter, Telepath, Crafty","nonhuman, female, tos, salt_vampire, organic, crew_max_rarity_4","I Hunger",0, 6, 8, 3, 10, 1, 0, , , , 240, 145, 93, 560, true,"M-113 Creature",crew_portraits_cm_m113_sm.png,salt_vampire_crew
"Lal",10,4, 0,0,0,0,0,0,0,0,0,879,63,134,507,140,325,0,0,0,0,0,650,991,0,0,493,878,0,619,1002,0,158,353,716,0,0,1068,766,0,0,808,647,0,978,752,0,245,658,491,1273,1293,"Android, Federation, Prodigy","nonhuman, female, tng, artificial_life, lal, crew_max_rarity_4","Reason For Being",0, 8, 6, 4, 8, , , , , , 450, 215, 77, 575, false,"Lal",crew_portraits_cm_lal_sm.png,lal_crew
