"Emergency Medical Holoprogram Mk.1",8,2, 0,0,0,257,31,112,0,0,0,0,0,0,0,0,0,400,23,71,859,0,0,0,697,849,573,836,330,0,0,646,0,441,665,845,0,0,0,765,829,556,820,431,0,0,710,0,480,725,1008,1037,"Hologram, Human, Federation, Starfleet, Physician","nonhuman, male, artificial_life, voy, emh, crew_max_rarity_2","Just Being Thorough",1, 4, 5, 8, 10, , , , , , 215, 150, 60, 590, false,"Doctor",crew_portraits_cm_emh_mk1_sm.png,emh_mk1_crew
"Mirror Zefram Cochrane",7,5, 0,0,0,1081,232,499,526,86,172,1029,86,169,0,0,0,0,0,0,201,661,328,0,0,40,34,254,141,66,719,515,322,180,0,151,681,648,0,0,42,47,173,113,303,753,565,661,386,0,295,403,"Human, Civilian, Warp Theorist, Innovator, Cultural Figure, Inspiring, Mirror Universe, Brutal, Terran Empire, Pilot, Thief","male, organic, ent, cochrane, crew_max_rarity_5","Raid The Ship!",0, 8, 12, 8, 12, 8, 4, , , , 415, 115, 167, 350, false,"Cochrane",crew_portraits_cm_cochrane_mirror_sm.png,cochrane_mirror_crew
"Amanda Grayson",10,4, 0,0,0,0,0,0,0,0,0,0,0,0,692,213,446,597,92,283,0,0,0,548,446,0,0,483,324,0,561,417,422,294,73,0,0,0,340,427,0,0,232,307,0,311,422,157,263,51,821,610,"Human, Federation, Caregiver, Civilian, Communicator","female, organic, amanda_grayson, tos, crew_max_rarity_4","How do you feel?",2, 8, 8, 8, 8, 3, 0, 3, , , 525, 165, 95, 600, false,"Amanda",crew_portraits_cm_amanda_greyson_sm.png,amanda_grayson_stiv_crew
"Kolinahr Spock",7,5, 884,107,300,560,31,115,0,0,0,0,0,0,1110,257,551,0,0,0,101,467,349,57,301,667,446,72,413,0,308,0,161,0,173,292,523,397,46,390,828,555,87,515,0,192,0,75,0,101,300,283,"Federation, Civilian, Exobiology, Musician, Astrophysicist, Human, Vulcan, Telepath, Spiritual","nonhuman, male, organic, tos, spock, spock_tos, crew_max_rarity_5","Infinite Diversity",1, 6, 5, 12, 8, 4, 0, 2, , , 400, 235, 127, 525, false,"Spock",crew_portraits_cm_spock_kolinahr_sm.png,spock_kolinahr_crew
"Surak",2,5, 403,161,459,1209,313,641,0,0,0,0,0,0,717,237,523,0,0,0,27,620,545,204,502,82,106,13,77,0,511,0,373,0,320,3,329,157,19,149,55,52,4,52,0,218,0,101,0,128,42,8,"Cultural Figure, Vulcan, Communicator, Desperate, Hero, Inspiring, Telepath","nonhuman, male, organic, ent, surak, crew_max_rarity_5","What Is, Is",2, 7, 12, 10, 12, 7, 0, , , , 500, 245, 150, 300, false,"Surak",crew_portraits_cm_surak_sm.png,surak_crew
"Annorax",8,5, 940,76,208,1204,243,569,386,140,296,0,0,0,0,0,0,0,0,0,17,217,354,507,302,29,129,160,84,597,765,565,0,0,0,27,264,594,689,554,17,95,121,87,378,536,352,0,0,0,250,144,"Krenim, Desperate, Romantic, Theoretical Engineer, Scoundrel, Brutal","male, organic, voy, annorax, crew_max_rarity_5","I'll Make The Time",2, 6, 12, 12, 20, 2, 0, , , , 600, 200, 195, 390, false,"Annorax",crew_portraits_cm_annorax_sm.png,annorax_crew
"Science Officer T'Pol",2,2, 0,0,0,382,39,147,0,0,0,0,0,0,246,32,93,0,0,0,778,0,0,875,0,776,521,559,473,0,891,0,829,0,720,799,0,0,866,0,783,516,632,487,0,885,0,815,0,705,1007,1022,"Vulcan, Starfleet, Astrophysicist, Telepath","nonhuman, female, organic, ent, first_officer, bridge_crew, tpol, crew_max_rarity_2","I'm Not Upset",1, 2, 5, 3, 10, 2, 0, , , , 265, 215, 101, 165, false,"T'Pol",crew_portraits_cm_tpol_jumpsuit_sm.png,tpol_redsuit_crew
"Warship Tuvok",6,5, 936,166,342,0,0,0,1281,112,276,0,0,0,0,0,0,0,0,0,310,59,261,437,231,197,0,0,0,176,322,125,0,0,0,341,162,271,461,256,475,0,0,0,422,603,409,0,0,0,445,713,"Vulcan, Hologram, Telepath, Brutal, Tactician, Starfleet, Federation","nonhuman, male, organic, voy, tuvok, crew_max_rarity_5","Fatality Rate Increasing!",0, 7, 10, 3, 15, 1, 1, , , , 425, 300, 195, 550, false,"Tuvok",crew_portraits_cm_tuvok_warship_sm.png,tuvok_warship_crew
"Vulcan Wedding T'Pol",4,4, 288,78,226,629,67,230,0,0,0,0,0,0,643,311,621,0,0,0,298,772,742,304,703,527,377,95,334,0,504,0,367,0,315,252,636,564,41,527,611,397,19,373,0,123,0,45,0,74,564,153,"Vulcan, Starfleet, Astrophysicist, Telepath","nonhuman, female, organic, ent, first_officer, bridge_crew, tpol, crew_max_rarity_4","Vulcans Appreciate Beauty",1, 8, 4, 14, 16, , , , , , 625, 175, 110, 440, false,"T'Pol",crew_portraits_cm_tpol_wedding_sm.png,tpol_wedding_crew
"Commander Keras",6,4, 795,90,299,0,0,0,0,0,0,0,0,0,556,111,288,0,0,0,454,511,395,237,351,0,0,574,0,0,660,0,539,0,458,494,541,420,226,407,0,0,527,0,0,602,0,457,0,430,840,808,"Inspiring, Desperate, Tactician, Romulan","male, nonhuman, tos, keras, commander, crew_max_rarity_4","Escape Maneuver One!",1, 7, 6, 8, 8, , , , , , 425, 310, 138, 565, false,"Keras",crew_portraits_cm_keras_sm.png,keras_crew
"Senator Vreenak",9,5, 984,121,320,0,0,0,0,0,0,0,0,0,1153,261,583,0,0,0,297,383,248,21,217,0,0,184,0,0,266,0,116,0,133,428,487,357,28,353,0,0,115,0,0,169,0,65,0,96,417,361,"Romulan, Diplomat, Politician, Investigator, Tal Shiar, Ambassador","nonhuman, male, organic, ds9, vreenak, crew_max_rarity_5","Somehow I thought You'd Be Taller",2, 7, 10, 6, 10, 7, 0, , , , 390, 250, 70, 690, false,"Vreenak",crew_portraits_cm_vreenak_senator_sm.png,vreenak_crew
"Portal 63",10,5, 0,0,0,0,0,0,478,103,233,998,69,143,1078,235,468,0,0,0,0,666,352,370,0,642,294,261,0,82,89,525,20,196,201,0,594,704,295,0,541,487,193,0,261,80,467,47,410,160,337,400,"Duelist, Tkon, Telepath","male, artificial_life, tng, tkon_guardian, crew_max_rarity_5","Shall I Destroy Them?",0, 8, 4, 8, 12, 5, 0, , , , 525, 75, 100, 305, false,"Portal 63",crew_portraits_cm_tkon_guardian_sm.png,tkon_guardian_crew
"Mintakan Troi",1,4, 0,0,0,307,69,219,0,0,0,0,0,0,947,159,328,604,101,249,810,0,0,461,452,797,541,144,178,0,445,420,288,297,45,637,0,0,491,457,628,408,149,151,0,491,452,335,283,95,495,517,"Federation, Starfleet, Human, Betazoid, Empath, Counselor, Caregiver, Undercover Operative, Prisoner, Merchant, Mintakan, Vulcan, Costumed","nonhuman, female, organic, tng, commander, bridge_crew, troi, crew_max_rarity_4","You Don't Want This",1, 7, 10, 10, 10, , , , , , 725, 100, 80, 500, false,"Troi",crew_portraits_cm_troi_mintakan_sm.png,troi_mintakan_crew
"Inglatu",10,5, 0,0,0,0,0,0,742,221,512,0,0,0,1241,217,439,0,0,0,0,463,0,297,0,389,0,186,0,342,22,289,118,0,135,0,254,0,345,0,132,0,234,0,120,12,105,158,0,184,447,251,"Dosi, Merchant, Brutal, Communicator","nonhuman, male, organic, ds9, inglatu, crew_max_rarity_5","You Are Starting To Annoy Me",0, 8, 10, 8, 12, 4, 0, , , , 390, 50, 125, 625, false,"Inglatu",crew_portraits_cm_inglatu_sm.png,inglatu_crew
"Profitable Ishka",6,4, 644,94,215,0,0,0,0,0,0,0,0,0,888,134,305,0,0,0,531,560,474,147,430,0,0,427,0,0,502,0,366,0,313,602,629,550,258,515,0,0,473,0,0,548,0,392,0,373,783,832,"Civilian, Ferengi, Merchant, Inspiring, Resourceful, Crafty","female, organic, ds9, ishka, crew_max_rarity_4","Society Could Use A Little Chaos",1, 7, 8, 8, 12, 4, 1, , , , 375, 100, 165, 350, false,"Moogie",crew_portraits_cm_ishka_latinum_sm.png,ishka_latinum_crew
"Prophet Sarah Sisko",3,5, 461,148,322,965,203,411,0,0,0,0,0,0,1249,202,414,0,0,0,55,631,560,86,515,256,208,3,171,0,282,0,130,0,141,28,458,321,80,312,234,179,18,163,0,365,0,203,0,220,27,77,"Human, Bajoran, Prophet, Cultural Figure, Inspiring","female, organic, ds9, sisko_sarah, crew_max_rarity_5","Don't Be Afraid",0, 8, 8, 8, 12, 4, 2, , , , 450, 330, 180, 400, false,"Sarah",crew_portraits_cm_sarah_sisko_sm.png,sisko_sarah_crew
"Alan-A-Dale",3,4, 0,0,0,0,0,0,593,104,222,433,40,118,810,159,329,0,0,0,0,597,681,537,0,554,503,465,0,224,154,446,124,417,350,0,605,757,492,0,559,547,413,0,327,177,481,170,451,326,570,663,"Human, Starfleet, Cyberneticist, Federation, Costumed, Musician, Innovator","male, nonhuman, tng, laforge, crew_max_rarity_4","A Mandolin's Melody",1, 6, 4, 8, 12, 7, 0, , , , 500, 100, 195, 565, true,"La Forge",crew_portraits_cm_laforge_alanadale_sm.png,laforge_alanadale_crew
"Virtuoso Doctor",6,5, 0,0,0,508,99,193,0,0,0,0,0,0,1157,236,601,772,123,338,658,0,0,292,341,636,430,54,78,0,263,345,115,230,22,631,0,0,197,332,622,405,33,104,0,173,324,68,196,13,306,126,"Hologram, Human, Federation, Starfleet, Musician, Physician, Desperate, Inspiring","nonhuman, male, artificial_life, voy, emh, crew_max_rarity_5","Pick Up The Tempo",1, 7, 8, 8, 12, 7, 0, , , , 400, 200, 100, 450, false,"Doctor",crew_portraits_cm_emh_virtuoso_sm.png,emh_virtuoso_crew
"Gunslinger Uhura",6,5, 531,55,119,0,0,0,1169,228,458,0,0,0,849,244,463,0,0,0,698,109,633,193,594,175,0,348,0,154,18,108,282,0,259,808,184,736,177,695,160,0,188,0,141,11,124,126,0,154,219,129,"Human, Federation, Starfleet, Communicator, Resourceful, Costumed, Marksman, Smuggler","bridge_crew, female, organic, tos, uhura, lieutenant_commander, original, crew_max_rarity_5","Reach For The Sky!",0, 7, 12, 3, 15, 1, 1, , , , 640, 220, 140, 350, false,"Uhura",crew_portraits_cm_uhura_six_shooter_sm.png,uhura_cowboy_crew
"Captain Killy",5,5, 1145,207,450,0,0,0,988,105,206,567,44,142,0,0,0,0,0,0,186,66,35,338,109,356,429,0,0,67,475,266,610,354,0,189,128,55,322,124,580,519,0,0,316,676,506,748,432,0,263,473,"Human, Brutal, Terran Empire, Mirror Universe, Starfleet, Veteran","female, organic, dsc, tilly, captain, crew_max_rarity_5","The Slayer of Sorna Prime",0, 10, 6, 6, 10, 1, 0, 2, 1, 3, 600, 225, 195, 350, false,"Killy",crew_portraits_cm_tilly_mirror_sm.png,dsc_tilly_mirror_crew
"Off-Duty Tilly",2,2, 0,0,0,0,0,0,0,0,0,297,25,68,391,73,183,0,0,0,0,0,789,772,0,0,569,750,0,726,799,0,491,466,625,0,0,815,725,0,0,591,695,0,739,762,0,518,481,572,993,1009,"Human, Theoretical Engineer, Federation, Starfleet, Romantic","female, organic, dsc, tilly, crew_max_rarity_2","Add Salsa!",1, 3, 4, 8, 8, 3, 0, , , , 390, 125, 145, 440, false,"Tilly",crew_portraits_cm_tilly_off_duty_sm.png,dsc_tilly_off_duty_crew
"Tieran Possessed Kes",3,4, 943,34,109,0,0,0,416,54,130,0,0,0,0,0,0,525,83,238,435,292,378,542,29,748,0,0,371,639,801,212,0,336,491,844,604,772,845,322,779,0,0,356,668,843,271,0,320,491,641,879,"Ocampa, Romantic, Civilian, Telepath, Interrogator, Brutal, Villain","nonhuman, female, organic, voy, kes, crew_max_rarity_4","Stronger Than Ever!",0, 7, 4, 8, 8, , , , , , 275, 100, 68, 450, false,"Kes",crew_portraits_cm_kes_tieran_sm.png,kes_tieran_crew
"Pah-wraith Keiko",4,5, 1416,48,108,0,0,0,964,137,290,0,0,0,509,67,152,0,0,0,176,57,133,117,99,330,0,693,0,290,159,244,668,0,572,829,361,754,603,717,437,0,737,0,385,315,365,711,0,616,247,795,"Human, Federation, Civilian, Scoundrel, Brutal, Villain","female, organic, ds9, keiko, crew_max_rarity_5","I'm In Charge Now",2, 7, 10, 8, 12, 8, 4, , , , 450, 250, 40, 675, false,"Keiko",crew_portraits_cm_keiko_pawraith_sm.png,keiko_pahwraith_crew
"War Correspondent Jake Sisko",8,5, 0,0,0,0,0,0,882,116,269,0,0,0,1216,149,293,503,100,232,0,476,0,366,540,413,0,258,386,362,45,36,200,347,40,0,545,0,539,487,480,0,471,345,427,172,112,390,306,119,329,480,"Human, Federation, Civilian, Writer, Gambler, Desperate, Inspiring","male, organic, ds9, jake, crew_max_rarity_5","Now We're Talking!",2, 8, 10, 8, 12, 4, 0, , , , 175, 200, 285, 400, false,"Jake",crew_portraits_cm_jake_warcorrespondent_sm.png,jake_correspondent_crew
"Xindi 'Prisoner' Archer",7,4, 406,161,344,0,0,0,367,79,157,0,0,0,842,112,229,0,0,0,648,441,591,252,548,765,0,493,0,654,313,624,433,0,379,355,245,281,190,267,704,0,599,0,604,406,593,530,0,477,690,548,"Human, Starfleet, Desperate, Crafty, Costumed, Hero, Explorer, Pilot, Interrogator","male, organic, ent, captain, archer, crew_max_rarity_4","Thanks For Your Help",2, 7, 10, 7, 10, 7, 0, , , , 550, 200, 100, 590, false,"Archer",crew_portraits_cm_archer_xindi_prisoner_sm.png,archer_prisoner_crew
"Captain Rachel Garrett",10,5, 1089,221,502,996,73,164,0,0,0,0,0,0,420,123,248,0,0,0,23,310,149,126,116,384,287,130,233,0,768,0,681,0,590,49,261,106,72,96,706,468,275,430,0,630,0,489,0,449,327,305,"Astrophysicist, Diplomat, Human, Desperate, Federation, Starfleet, Hero, Pilot","captain, female, organic, tng, garrett, crew_max_rarity_5","One For The History Books!",1, 9, 8, 10, 10, , , , , , 300, 235, 103, 650, false,"Garrett",crew_portraits_cm_rachel_garret_sm.png,garrett_captain_crew
"Starfleet Uniform Khan",6,3, 495,66,260,0,0,0,338,67,143,0,0,0,0,0,0,0,0,0,646,462,589,688,544,801,0,0,0,681,842,651,0,0,0,584,390,523,646,493,738,0,0,0,638,823,621,0,0,0,941,927,"Human, Augments, Engineered, Villain, Cultural Figure, Tactician, Resourceful, Survivalist, Brutal","nonhuman, male, organic, tos, khan, crew_max_rarity_3","Have any other questions?",0, 6, 10, 8, 8, , , , , , 490, 165, 113, 580, false,"Khan",crew_portraits_cm_khan_commander_sm.png,khan_command_crew
"Enemy Lines Sisko",5,5, 1124,196,514,0,0,0,909,166,328,0,0,0,596,11,31,0,0,0,184,62,140,121,105,347,0,696,0,303,167,258,670,0,573,160,54,114,250,104,348,0,873,0,313,442,280,860,0,743,279,378,"Human, Federation, Starfleet, Bajoran, Cultural Figure, Inspiring, Tactician, Desperate, Diplomat","male, organic, ds9, captain, bridge_crew, sisko, crew_max_rarity_5","Surrender!",1, 8, 8, 6, 12, 1, 0, 2, , , 550, 100, 148, 440, false,"Sisko",crew_portraits_cm_sisko_enemy_lines_sm.png,sisko_enemy_lines_crew
"Bell Riots Bashir",6,5, 0,0,0,0,0,0,585,8,18,0,0,0,847,242,487,1195,133,365,0,705,0,440,119,697,0,339,136,602,156,23,271,88,18,0,838,0,276,282,881,0,177,232,750,225,257,115,175,25,287,397,"Human, Starfleet, Federation, Desperate, Costumed, Physician, Engineered","nonhuman, male, organic, ds9, bashir, crew_max_rarity_5","Field Medicine",1, 7, 12, 8, 12, 2, 0, 2, , , 650, 250, 235, 350, false,"Bashir",crew_portraits_cm_bashir_bellriots_sm.png,bashir_bell_riots_crew
"Roga Danar",4,4, 337,90,216,0,0,0,769,183,376,532,95,265,0,0,0,0,0,0,759,285,263,781,652,428,406,0,0,77,546,326,574,332,0,607,179,134,661,521,277,346,0,0,53,413,216,503,279,0,615,412,"Angosian, Crafty, Desperate, Prisoner, Jury Rigger, Resourceful, Veteran","male, organic, tng, danar, crew_max_rarity_4","My Battle Is Never Over",0, 6, 10, 8, 12, 7, 0, , , , 350, 200, 100, 215, false,"Danar",crew_portraits_cm_roga_danar_sm.png,danar_crew
"Chancellor Gorkon",6,5, 864,157,369,0,0,0,383,191,385,0,0,0,1258,203,407,0,0,0,375,188,331,39,285,620,0,189,0,541,59,500,126,0,137,318,82,252,62,239,265,0,276,0,226,44,203,206,0,224,178,65,"Klingon, Diplomat, Politician, Cultural Figure","male, organic, tos, gorkon, crew_max_rarity_5","You Don't Trust Me, Do You?",0, 7, 10, 6, 10, 1, 2, , , , 500, 105, 240, 375, false,"Gorkon",crew_portraits_cm_gorkon_sm.png,gorkon_chancellor_crew
"Tosk",10,5, 0,0,0,0,0,0,937,164,351,1158,218,399,0,0,0,0,0,0,0,411,153,0,0,309,180,0,0,22,436,223,189,90,0,0,417,175,0,0,330,180,0,0,18,461,264,201,105,0,453,506,"Desperate, Explorer, Crafty, Athlete, Tosk, Prisoner","nonhuman, male, organic, tosk, ds9, crew_max_rarity_5","I am Tosk",1, 8, 12, 6, 10, 2, 0, 2, , , 600, 225, 285, 200, false,"Tosk",crew_portraits_cm_tosk_sm.png,tosk_crew
"Bell Riots Jadzia Dax",7,5, 0,0,0,471,87,185,0,0,0,968,73,258,1129,228,459,0,0,0,714,0,338,352,0,690,98,79,431,326,326,0,18,187,189,661,0,527,307,0,648,192,85,393,503,278,0,28,313,166,319,367,"Federation, Starfleet, Costumed, Desperate, Trill","nonhuman, female, organic, ds9, lieutenant, bridge_crew, dax, crew_max_rarity_5","We Have to Find My Friends",1, 8, 8, 10, 12, , , , , , 475, 200, 170, 390, false,"J. Dax",crew_portraits_cm_dax_jadzia_riots_sm.png,dax_jadzia_riots_crew
"Malik",9,4, 334,39,119,0,0,0,735,180,376,0,0,0,661,57,122,0,0,0,838,318,770,472,728,443,0,575,0,390,173,346,541,0,459,828,268,752,639,716,281,0,790,0,248,230,218,760,0,663,680,719,"Human, Augments, Engineered, Brutal, Civilian","male, organic, ent, malik, crew_max_rarity_4","This Is An Act Of Mercy",0, 7, 8, 6, 10, 8, 4, , , , 425, 140, 130, 400, false,"Malik",crew_portraits_cm_malik_sm.png,malik_crew
"Solar Sails Sisko",5,5, 539,72,150,903,155,378,0,0,0,1230,146,404,0,0,0,0,0,0,82,657,34,691,554,342,26,373,211,161,0,0,167,72,0,131,723,90,763,642,315,30,356,207,273,0,0,275,151,0,232,338,"Human, Federation, Starfleet, Bajoran, Cultural Figure, Inspiring, Caregiver, Chef, Diplomat, Resourceful, Explorer","male, organic, ds9, captain, bridge_crew, sisko, crew_max_rarity_5","Time For A Change",1, 10, 8, 10, 10, , , , , , 600, 300, 120, 300, false,"Sisko",crew_portraits_cm_sisko_solar_sm.png,sisko_solar_crew
"Species 8472 Invader",9,5, 0,0,0,1009,236,595,1021,345,698,0,0,0,0,0,0,0,0,0,208,287,0,0,0,2,187,262,148,143,284,102,0,0,0,94,96,0,0,0,2,89,118,84,25,67,22,0,0,0,388,32,"Hunter, Species 8472, Brutal, Resourceful, Telepath","organic, voy, nonhuman, species_8472, crew_max_rarity_5","The Weak Will Perish",0, 10, 8, 8, 10, , , , 1, 3, 365, 200, 153, 675, false,"Species 8472",crew_portraits_cm_species_8472_sm.png,species_8472_crew
"Sarina Douglas",4,4, 0,0,0,871,150,371,0,0,0,615,114,239,0,0,0,357,57,112,385,0,488,0,702,369,66,406,96,460,0,649,520,127,673,338,0,494,0,703,338,73,379,127,479,0,661,515,166,666,532,603,"Human, Federation, Engineered, Civilian, Romantic","female, organic, ds9, crew_max_rarity_4","I've Played Enough",1, 5, 10, 10, 8, , , , , , 450, , 150, 225, true,"Sarina",crew_portraits_cm_sarina_douglas_sm.png,sarina_crew
"Augment Commander O'Brien",6,5, 0,0,0,0,0,0,1139,311,671,965,175,366,0,0,0,0,0,0,0,239,237,0,0,98,220,0,0,3,212,53,250,132,0,0,124,249,0,0,39,237,0,0,1,90,30,283,157,0,405,150,"Human, Augments, Engineered, Tactician, Saboteur, Marksman, Brutal, Innovator","male, organic, obrien, tos, tng, ds9, original, crew_max_rarity_5","Take Aim!",0, 9, 8, 8, 12, 7, 4, , , , 540, 410, 45, 200, false,"O'Brien",crew_portraits_cm_obrien_augment_sm.png,obrien_augment_crew
"Mirror Leeta",7,4, 744,150,364,0,0,0,677,76,153,0,0,0,402,32,64,0,0,0,444,192,386,353,340,512,0,791,0,459,395,418,770,0,670,334,243,265,380,250,714,0,857,0,615,662,600,839,0,724,614,755,"Bajoran, Mirror Universe, Romantic, Terran Empire","female, nonhuman, organic, ds9, leeta, crew_max_rarity_4","I Don't Think So",2, 5, 4, 12, 10, 4, 0, 2, , , 575, 275, 148, 350, false,"Leeta",crew_portraits_cm_leeta_mirror_sm.png,leeta_mirror_crew
"Miranda Jones",9,5, 558,33,63,1069,46,105,0,0,0,0,0,0,1118,236,466,0,0,0,95,693,645,124,606,357,276,33,222,0,332,0,186,0,190,700,816,810,220,762,823,550,110,511,0,266,0,129,0,158,312,678,"Human, Communicator, Telepath, Vulcan","female, organic, tos, miranda_jones, crew_max_rarity_5","Violent Emotion is a Kind of Insanity",2, 10, 10, 10, 15, , , , , , 485, 330, 55, 525, false,"Miranda",crew_portraits_cm_miranda_jones_sm.png,miranda_jones_crew
"Dancing Chekov",8,5, 553,37,119,0,0,0,965,151,276,0,0,0,1208,198,395,0,0,0,678,185,618,115,576,329,0,230,0,289,21,243,169,0,178,831,362,756,262,720,438,0,291,0,386,84,366,225,0,243,241,468,"Federation, Starfleet, Human, Resourceful, Tactician","male, organic, tos, commander, bridge_crew, chekov, crew_max_rarity_5","We're In A Lot Of Trouble",1, 8, 8, 12, 10, 0, 1, , , , 500, 250, 150, 450, false,"Chekov",crew_portraits_cm_chekov_dancing_sm.png,chekov_dancing_crew
"Smuggler Kasidy Yates",8,4, 647,120,296,0,0,0,360,129,317,579,96,327,0,0,0,0,0,0,504,311,78,588,396,709,369,0,0,204,780,578,521,299,0,460,182,62,557,381,412,298,0,0,73,523,342,418,234,0,638,345,"Federation, Civilian, Human, Pilot, Smuggler, Jury Rigger","female, organic, ds9, yates, crew_max_rarity_4","I'll Be Back",1, 8, 8, 12, 17, , , , , , 575, 205, 65, 350, false,"Yates",crew_portraits_cm_yates_smuggler_sm.png,yates_smuggler_crew
"Queen Guinevere Kira",8,5, 1084,80,157,0,0,0,1096,323,666,0,0,0,0,0,0,0,0,0,299,20,251,429,219,118,0,0,0,122,242,73,0,0,0,713,48,664,739,616,38,0,0,0,38,88,27,0,0,0,414,402,"Bajoran, Costumed, Veteran, Desperate, Duelist, Royalty","nonhuman, female, organic, ds9, kira, crew_max_rarity_5","You Left Me No Choice",0, 8, 8, 4, 10, 1, 1, , , , 300, 110, 228, 615, false,"Kira",crew_portraits_cm_kira_camelot_sm.png,kira_camelot_crew
"Tourist Reed",10,4, 732,138,369,0,0,0,239,165,337,0,0,0,719,13,30,0,0,0,459,308,399,239,355,759,0,583,0,650,403,620,552,0,468,351,111,279,430,265,343,0,872,0,305,430,273,859,0,742,644,567,"Starfleet, Human, Romantic, Desperate, Resourceful","male, organic, ent, lieutenant, reed, crew_max_rarity_4","Follow Two Aliens into a Basement",2, 9, 11, 4, 10, , , , , , 190, 292, 120, 450, false,"Reed",crew_portraits_cm_reed_tourist_sm.png,reed_tourist_crew
"Mambo Picard",3,5, 396,201,354,1077,18,70,0,0,0,0,0,0,1099,394,747,0,0,0,88,642,583,76,535,376,280,11,228,0,203,0,64,0,91,202,381,221,1,214,869,592,20,539,0,56,0,17,0,35,75,54,"Federation, Starfleet, Human, Casual, Romantic, Musician","male, organic, tng, captain, bridge_crew, picard, crew_max_rarity_5","That's More Like It",1, 7, 10, 8, 10, 0, 1, , , , 750, 295, , 750, false,"Picard",crew_portraits_cm_picard_mambo_sm.png,picard_mambo_crew
"Interfaced La Forge",2,5, 0,0,0,444,100,236,0,0,0,906,182,516,1254,237,470,0,0,0,710,0,221,271,0,685,72,56,429,231,238,0,2,118,116,580,0,124,290,0,549,36,54,347,143,259,0,3,67,155,78,64,"Human, Starfleet, Federation, Cyberneticist, Innovator, Communicator, Hero","male, organic, tng, lieutenant, laforge, crew_max_rarity_5","How Is This Possible?",2, 10, 12, 10, 10, , , , , , 500, 100, 145, 150, false,"La Forge",crew_portraits_cm_laforge_interface_sm.png,laforge_interfaced_crew
"Geordi La Forge",9,2, 284,18,65,0,0,0,0,0,0,327,92,221,159,8,24,0,0,0,857,806,473,777,748,0,514,873,0,660,909,0,612,428,745,878,826,426,868,774,0,385,875,0,528,911,0,525,339,746,973,980,"Human, Starfleet, Pilot, Federation, Innovator, Cyberneticist","male, organic, tng, laforge, crew_max_rarity_2","None of it is familiar",2, 2, 5, 5, 10, 6, 0, , , , 450, 125, 145, 165, false,"La Forge",crew_portraits_cm_laforge_helmsman_sm.png,laforge_helmsman_crew
"Breen Disguise Dukat",5,4, 489,127,276,0,0,0,748,169,380,0,0,0,239,131,283,0,0,0,625,215,565,490,518,439,0,798,0,385,327,342,778,0,677,476,138,403,204,396,285,0,506,0,251,103,222,433,0,411,689,262,"Cardassian, Brutal, Desperate, Veteran, Cultural Figure, Villain, Undercover Operative, Breen","nonhuman, evsuit, male, organic, ds9, dukat, crew_max_rarity_4","This Isn't Funny",0, 6, 12, 10, 10, 6, 2, , , , 400, 170, 113, 550, false,"Dukat",crew_portraits_cm_dukat_breen_disquise_sm.png,dukat_breen_crew
"Niners Worf",7,5, 401,194,403,0,0,0,1185,184,384,0,0,0,812,52,99,0,0,0,619,106,556,273,511,200,0,529,0,177,50,129,483,0,416,249,64,179,252,170,271,0,815,0,237,238,212,786,0,684,375,309,"Klingon, Athlete, Costumed, Federation, Starfleet","nonhuman, male, organic, ds9, bridge_crew, worf, niners, crew_max_rarity_5","Find Him And Kill Him!",0, 6, 8, 6, 12, 4, 0, , , , 300, 105, 225, 490, false,"Worf",crew_portraits_cm_worf_niners_sm.png,worf_niners_crew
"Herbert Rossoff",6,4, 831,205,457,0,0,0,0,0,0,0,0,0,589,94,195,0,0,0,351,427,304,150,263,0,0,594,0,0,679,0,561,0,476,186,295,129,133,122,0,0,664,0,0,721,0,613,0,535,786,670,"Human, Crafty, Civilian, Veteran, Innovator, Writer, Resourceful, Communicator","male, organic, ds9, quark, crew_max_rarity_4","Would Someone Please Shoot Me?",1, 8, 4, 8, 8, , , , 0, 2, 400, 190, 197, 405, false,"Herbert",crew_portraits_cm_quark_rossoff_sm.png,quark_herbert_crew
"Satin Dress Lily Sloane",7,5, 0,0,0,0,0,0,934,123,262,416,146,293,1157,257,524,0,0,0,0,453,630,311,0,373,448,203,0,78,26,278,33,371,152,0,546,370,246,0,481,287,144,0,90,49,414,8,219,118,260,119,"Human, Civilian, Undercover Operative, Desperate, Communicator, Crafty, Resourceful, Costumed","female, organic, tng, lily, crew_max_rarity_5","You Never Quit",0, 8, 8, 8, 10, , , , 3, 800, 575, 380, 245, 225, false,"Lily",crew_portraits_cm_sloane_satin_sm.png,lily_sloane_satin_crew
"Rain Robinson",7,5, 0,0,0,1113,232,508,0,0,0,381,189,377,1006,116,271,0,0,0,190,0,596,453,0,195,51,25,129,550,437,0,44,353,261,143,0,224,593,0,137,8,32,110,250,612,0,43,140,437,223,86,"Human, Civilian, Desperate, Communicator, Resourceful, Astrophysicist","female, organic, voy, rain, crew_max_rarity_5","Anyone Up There?",2, 8, 12, 10, 12, 7, 0, , , , 300, 275, 207, 175, false,"Rain",crew_portraits_cm_rain_robinson_sm.png,rain_robinson_crew
"Emperor Philippa Georgiou",6,5, 1216,131,385,0,0,0,1019,128,264,0,0,0,371,155,317,0,0,0,185,54,142,122,108,286,0,711,0,254,149,202,679,0,588,329,157,260,124,245,468,0,431,0,417,153,401,348,0,337,244,255,"Terran Empire, Mirror Universe, Human, Brutal, Royalty","female, organic, dsc, georgiou, crew_max_rarity_5","Imperial Majesty",2, 7, 10, 15, 15, 8, 4, , , , 450, 335, 152, 100, false,"Georgiou",crew_portraits_cm_georgiou_empress_sm.png,dsc_georgiou_mirror_crew
"Festive Lwaxana Troi",9,4, 636,83,174,0,0,0,0,0,0,0,0,0,727,182,389,0,0,0,561,583,502,225,469,0,0,496,0,0,571,0,434,0,381,678,684,637,198,590,0,0,318,0,0,417,0,253,0,267,830,778,"Federation, Diplomat, Betazoid, Romantic, Civilian, Telepath, Ambassador","nonhuman, female, organic, ds9, lwaxana, crew_max_rarity_4","Dance With Me",1, 6, 8, 10, 16, 6, 0, , , , 400, 160, 115, 650, false,"Troi",crew_portraits_cm_troi_festivelwaxana_sm.png,troi_lwaxana_festive_crew
"Merry Men Crusher",7,5, 0,0,0,419,69,186,1160,195,257,0,0,0,0,0,0,1122,53,158,735,334,0,0,188,48,496,745,64,200,353,7,0,120,236,689,477,0,0,661,152,448,696,254,359,513,138,0,409,623,332,698,"Human, Starfleet, Federation, Physician, Costumed, Resourceful","female, organic, tng, commander, crusher, crew_max_rarity_5","I've Stopped The Bleed",1, 7, 8, 8, 12, 6, 0, , , , 525, 200, 140, 375, false,"Crusher",crew_portraits_cm_crusher_merrymen_sm.png,crusher_merrymen_crew
"Ahdar Ru'afo",6,5, 757,187,447,506,109,219,0,0,0,1362,69,227,0,0,0,0,0,0,96,470,16,516,307,622,46,638,389,156,0,0,159,68,0,50,317,38,354,140,563,172,606,351,547,0,0,604,353,0,289,379,"Son'a, Brutal, Villain, Survivalist, Resourceful","male, nonhuman, organic, tng, ruafo, crew_max_rarity_5","Not Joining Us For Dinner",0, 6, 10, 5, 14, 7, 0, , , , 585, 125, 160, 450, false,"Ru'afo",crew_portraits_cm_ruafo_sm.png,ruafo_crew
