"Pining Vina",9,5, 0,0,0,483,106,216,0,0,0,0,0,0,1287,225,456,831,183,413,1106,0,0,492,522,1085,810,111,102,0,442,517,245,344,25,969,0,0,500,308,932,663,105,70,0,444,312,273,176,18,497,170,"Human, Civilian, Romantic, Desperate, Diplomat","organic, female, dsc, vina, crew_max_rarity_5","Who Are You?",2, 7, 10, 5, 10, 7, 0, , , , 350, 210, 158, 425, false,"Vina",crew_portraits_cm_vina_sm.png,dsc_vina_crew
"Flotter",8,4, 0,0,0,848,177,367,0,0,0,0,0,0,619,121,261,302,82,220,721,0,0,1044,1112,699,523,211,179,0,1083,1030,893,777,433,531,0,0,978,850,518,373,145,100,0,1030,831,827,588,237,1060,752,"Hologram, Caregiver, Cultural Figure","voy, nonhuman, artificial_life, flotter, male, crew_max_rarity_4","No More Lying",2, 8, 8, 6, 10, , , , , , 375, 255, 125, 450, false,"Flotter",crew_portraits_cm_flotter_sm.png,flotter_crew
"Trevis",7,4, 0,0,0,319,70,201,861,157,318,0,0,0,582,138,273,0,0,0,1293,814,0,1059,0,330,983,610,824,647,242,525,906,0,755,1074,731,0,944,0,208,759,359,635,569,215,478,783,0,672,1076,835,"Hologram, Caregiver, Cultural Figure, Gardener","voy, nonhuman, artificial_life, trevis, male, crew_max_rarity_4","I'm Not A Monster!",0, 8, 8, 8, 10, , , , , , 540, 200, 112, 125, false,"Trevis",crew_portraits_cm_trevis_sm.png,trevis_crew
"Desert Archer",8,5, 852,149,341,567,69,177,0,0,0,0,0,0,1218,245,474,0,0,0,186,823,672,106,535,998,733,115,595,0,507,0,301,0,250,224,707,532,61,438,1115,831,123,686,0,377,0,233,0,199,528,270,"Human, Starfleet, Explorer, Telepath, Resourceful, Survivalist","male, organic, ent, archer, crew_max_rarity_5","You're Lying!",2, 10, 8, 8, 10, , , , , , 500, 100, 140, 365, false,"Archer",crew_portraits_cm_archer_desert_sm.png,archer_desert_crew
"Dark Empath Troi",8,5, 937,143,322,0,0,0,1300,178,445,0,0,0,0,0,0,473,101,246,649,77,592,833,52,251,0,0,658,266,443,23,0,648,911,666,121,578,816,93,347,0,0,524,343,523,52,0,496,771,409,284,"Starfleet, Federation, Human, Betazoid, Empath, Counselor, Brutal","nonhuman, female, organic, tng, troi, crew_max_rarity_5","Take Me With You!",0, 9, 8, 8, 8, , , , 1, 3, 450, 230, 100, 430, false,"Troi",crew_portraits_cm_troi_darkempath_sm.png,troi_darkempath_crew
"Torchbearer Tyler",7,4, 0,0,0,0,0,0,873,121,206,0,0,0,576,108,214,0,0,0,0,852,0,1093,0,744,0,973,0,680,297,567,946,0,789,0,982,0,1080,0,896,0,996,0,837,483,758,948,0,799,1395,1445,"Human, Federation, Starfleet, Cultural Figure, Tactician, Klingon","male, organic, dsc, tyler, voq, crew_max_rarity_4","That's a Torchbearer's Job",0, 9, 8, 10, 8, , , , , , 365, 250, 183, 425, false,"Tyler",crew_portraits_cm_tyler_torchbearer_sm.png,dsc_tyler_torchbearer_crew
"Safecracker Nog",8,4, 0,0,0,610,57,146,0,0,0,876,132,331,406,57,124,0,0,0,992,0,669,1287,0,962,148,643,572,652,1328,0,281,348,1036,1257,0,592,1343,0,1240,244,890,782,597,1386,0,318,305,1080,1111,1308,"Ferengi, Costumed, Federation, Starfleet, Criminal, Resourceful","nonhuman, male, organic, ds9, nog, crew_max_rarity_4","Piece of Cake",2, 7, 6, 8, 10, , , , , , 390, 200, 180, 375, false,"Nog",crew_portraits_cm_nog_safecracker_sm.png,nog_safecracker_crew
"Dress Uniform Bashir",8,4, 0,0,0,654,63,140,0,0,0,0,0,0,350,42,134,761,185,414,949,0,0,1357,564,916,676,670,94,0,1383,571,1280,372,320,1258,0,0,1347,302,1241,933,897,115,0,1389,308,1259,170,175,1183,1184,"Human, Starfleet, Federation, Cyberneticist, Physician, Engineered, Gambler, Undercover Operative","nonhuman, male, organic, ds9, bashir, crew_max_rarity_4","Pleasure to Meet You!",0, 8, 6, 6, 8, , , , , , 215, 230, 93, 425, false,"Bashir",crew_portraits_cm_bashir_dressuniform_sm.png,bashir_dress_uniform_crew
"Little John Riker",7,5, 1023,128,239,0,0,0,1309,192,354,0,0,0,422,113,245,0,0,0,587,69,529,372,411,288,0,1164,0,293,146,175,1146,0,976,863,233,792,432,688,486,0,922,0,470,193,361,865,0,732,451,630,"Human, Federation, Starfleet, Costumed, Thief, Maverick","male, organic, tng, riker, crew_max_rarity_5","We Need a Diversion",0, 6, 10, 8, 16, 2, 0, , , , 515, 200, 125, 425, false,"Riker",crew_portraits_cm_riker_littlejohn_sm.png,riker_littlejohn_crew
"Transporter Chief Rand",10,4, 0,0,0,0,0,0,0,0,0,859,113,241,628,92,204,0,0,0,0,0,700,1064,0,0,559,939,0,688,1100,0,163,380,758,0,0,822,1134,0,0,600,1052,0,801,1176,0,303,472,859,1386,1448,"Human, Federation, Starfleet, Desperate","female, organic, tos, rand, crew_max_rarity_4","Yank Them Back!",1, 8, 8, 8, 10, , , , , , 475, 275, 155, 242, false,"Rand",crew_portraits_cm_rand_transporter_sm.png,rand_transporter_crew
"Betrothed Kamala",3,2, 234,27,86,145,27,81,0,0,0,0,0,0,363,43,105,0,0,0,1237,1305,1300,1099,1184,1371,1050,1102,879,0,1384,0,1281,0,1103,1204,1293,1283,1184,1167,1355,1039,1119,868,0,1412,0,1290,0,1112,1562,1576,"Kriosian, Empath, Romantic","organic, tng, female, nonhuman, kamala, crew_max_rarity_2","I Am for You",1, 2, 6, 3, 10, 1, 0, , , , 390, 130, 115, 530, false,"Kamala",crew_portraits_cm_kamala_betrothed_sm.png,kamala_betrothed_crew
"Cadet First Class Locarno",10,5, 1284,180,408,0,0,0,0,0,0,0,0,0,1078,160,296,0,0,0,297,501,268,48,160,0,0,549,0,0,696,0,465,0,399,442,594,376,151,298,0,0,746,0,0,886,0,666,0,567,762,1012,"Human, Federation, Starfleet, Maverick, Pilot, Crafty, Desperate","tng, male, nicholas_locarno, organic, crew_max_rarity_5","Everything I Said Was The Truth!",1, 10, 4, 12, 8, , , , 2, 2, 390, 150, 175, 690, false,"Locarno",crew_portraits_cm_nicholas_locarno_sm.png,locarno_nicholas_crew
"Kamala",10,5, 967,131,227,546,92,174,0,0,0,0,0,0,1254,238,483,0,0,0,176,786,619,88,493,1014,747,103,608,0,459,0,259,0,212,375,935,808,119,703,1064,774,115,641,0,374,0,232,0,198,412,466,"Kriosian, Empath, Romantic, Exoarchaeology","nonhuman, female, organic, tng, kamala, crew_max_rarity_5","Who I Am Today, I Will Be Forever",1, 7, 4, 6, 8, , , , , , 315, 95, 167, 325, true,"Kamala",crew_portraits_cm_kamala_sm.png,kamala_crew
"Priestess Siranna",7,4, 529,112,242,0,0,0,0,0,0,0,0,0,883,138,286,382,78,211,994,1036,933,375,391,0,0,768,749,0,924,959,713,719,210,885,941,816,375,207,0,0,830,614,0,970,851,751,603,204,1098,978,"Gardener, Kelpien, Spiritual, Civilian, Ambassador, Cultural Figure","nonhuman, female, organic, dsc, siranna, crew_max_rarity_4","The Truth Has Survived",1, 7, 6, 8, 8, , , , , , 450, 200, 100, 475, false,"Siranna",crew_portraits_cm_siranna_priestess_sm.png,dsc_siranna_priestess_crew
"Scrooge Data",6,5, 969,171,330,508,73,173,0,0,0,0,0,0,1267,264,338,0,0,0,170,688,510,78,393,1108,839,130,687,0,515,0,308,0,254,211,695,514,99,423,1116,832,189,687,0,609,0,398,0,337,441,448,"Android, Starfleet, Federation, Cyberneticist, Costumed, Cultural Figure, Artist, Resourceful","nonhuman, male, tng, artificial_life, data, crew_max_rarity_5","Humbug",1, 9, 6, 8, 6, , , , , , 200, 305, 160, 475, false,"Data",crew_portraits_cm_data_scrooge_sm.png,data_scrooge_crew
"Chancellor Martok",8,5, 943,132,341,0,0,0,543,67,148,0,0,0,1262,161,372,0,0,0,634,320,573,98,455,1037,0,428,0,956,149,842,343,0,294,640,449,554,171,470,1177,0,596,0,1060,345,976,515,0,438,503,725,"Klingon, Duelist, Tactician, Diplomat, Veteran, Politician, Cultural Figure","nonhuman, male, organic, ds9, martok, crew_max_rarity_5","I will fight any battle. Anywhere",0, 9, 8, 8, 10, , , , 2, 2, 400, 125, 184, 450, false,"Martok",crew_portraits_cm_martok_chancellor_sm.png,martok_chancellor_crew
"Admiral Patrick",9,5, 1238,275,538,1023,124,239,0,0,0,0,0,0,495,76,143,0,0,0,22,451,216,184,118,592,431,252,334,0,1266,0,1139,0,965,20,331,123,155,82,849,601,514,503,0,1326,0,1185,0,1011,393,352,"Human, Engineered, Federation, Civilian, Costumed, Crafty","male, organic, ds9, patrick, crew_max_rarity_5","That's A Stupid Question",1, 9, 8, 10, 10, , , , , , 500, 100, 155, 375, false,"Patrick",crew_portraits_cm_patrick_admiral_sm.png,patrick_admiral_crew
"Christine Chapel",9,4, 0,0,0,559,70,170,0,0,0,0,0,0,349,103,201,790,127,280,1040,0,0,1286,601,1012,744,697,116,0,1326,602,1202,403,321,1170,0,0,1108,642,1135,845,579,202,0,1160,638,992,421,209,1243,1211,"Federation, Starfleet, Human, Physician, Veteran, Nurse, Romantic","female, organic, tos, chapel, crew_max_rarity_4","Don't You Recognise Me?",1, 7, 8, 12, 12, 5, 0, , , , 1400, 185, 120, 400, false,"Chapel",crew_portraits_cm_chapel_christine_sm.png,chapel_christine_crew
"Brainless Spock",6,2, 0,0,0,223,43,138,0,0,0,360,51,179,0,0,0,0,0,0,1357,0,1184,0,0,1357,657,1343,860,1108,0,0,1238,751,0,1293,0,1128,0,0,1281,541,1273,825,1032,0,0,1155,706,0,1582,1560,"Federation, Starfleet, Exobiology, Astrophysicist, Human, Musician, Vulcan, Telepath, Compromised","nonhuman, male, organic, tos, spock, crew_max_rarity_2","A Practical Idea",2, 3, 8, 10, 8, , , , , , 460, 150, 163, 390, false,"Spock",crew_portraits_cm_spock_brainless_sm.png,spock_brainless_crew
"Garth of Izar",6,5, 1214,226,444,0,0,0,989,156,344,0,0,0,487,83,142,0,0,0,326,76,287,219,188,516,0,1159,0,471,263,345,1144,0,974,288,86,245,239,179,565,0,1174,0,535,361,430,1169,0,992,464,339,"Prisoner, Desperate, Human, Brutal, Resourceful, Villain, Shapeshifter, Veteran, Explorer, Innovator, Federation","organic, male, tos, garth_izar, crew_max_rarity_5","I'm Afraid of No One",0, 8, 6, 8, 10, 1, 0, 2, , , 300, 200, 185, 225, false,"Garth",crew_portraits_cm_garth_izar_sm.png,garth_izar_crew
"Seeking Spock",8,5, 0,0,0,1257,183,448,0,0,0,0,0,0,430,132,295,931,170,326,319,0,0,1193,473,331,262,132,22,0,1232,477,1077,298,121,378,0,0,920,451,363,275,79,29,0,967,462,745,270,102,519,197,"Vulcan, Human, Telepath, Spiritual, Starfleet, Federation, Resourceful, Explorer","nonhuman, male, organic, tos, spock, crew_max_rarity_5","Recommend We Proceed",1, 9, 10, 12, 12, , , , , , 550, 200, 175, 225, false,"Spock",crew_portraits_cm_spock_seeking_sm.png,spock_seeking_crew
"Compromised Airiam",8,5, 0,0,0,940,178,397,1254,198,420,0,0,0,0,0,0,0,0,0,582,500,0,0,0,24,424,633,321,314,506,204,0,0,0,490,538,0,0,0,25,345,528,282,349,536,244,0,0,0,782,792,"Control, Federation, Starfleet, Brutal, Undercover Operative, Human, Engineered, Astrophysicist, Compromised","evsuit, female, organic, dsc, airiam, crew_max_rarity_5","Open The Airlock",0, 9, 8, 8, 10, , , , 2, 2, 555, 125, 285, 400, false,"Airiam",crew_portraits_cm_airiam_compromised_sm.png,dsc_airiam_compromised_crew
"Lt. Uhura",6,3, 384,51,129,0,0,0,0,0,0,0,0,0,539,76,178,0,0,0,1248,1217,1177,856,1064,0,0,1043,0,0,1195,0,1025,0,859,1287,1248,1212,904,1100,0,0,1120,0,0,1251,0,1096,0,934,1508,1548,"Human, Starfleet, Federation, Musician, Communicator","female, organic, tos, uhura, crew_max_rarity_3","Hailing Frequencies Open",1, 5, 6, 10, 12, , , , , , 300, 50, 71, 190, false,"Uhura",crew_portraits_cm_uhura_lt_yellow_sm.png,uhura_lt_yellow_crew
"Rescue Team Uhura",7,5, 984,179,361,0,0,0,1313,166,410,0,0,0,456,113,208,0,0,0,545,53,480,326,362,261,0,1137,0,281,131,162,1126,0,953,517,109,439,277,358,446,0,997,0,418,201,319,951,0,800,322,276,"Human, Federation, Starfleet, Communicator, Resourceful, Musician, Marksman","female, organic, tos, tas, uhura, crew_max_rarity_5","Phasers on Setting One. Fire.",2, 7, 6, 3, 8, 7, 0, , , , 540, 225, 68, 150, false,"Uhura",crew_portraits_cm_uhura_rescue_sm.png,uhura_rescue_crew
"Sulu of the Body",8,4, 612,111,266,0,0,0,0,0,0,0,0,0,910,153,301,0,0,0,904,952,842,293,723,0,0,734,0,0,895,0,674,0,558,842,905,775,312,670,0,0,753,0,0,891,0,674,0,572,1335,1318,"Human, Federation, Starfleet, Diplomat, Pilot, Archon, Compromised","male, organic, tos, sulu, crew_max_rarity_4","Paradise, My Friend, Paradise",1, 6, 8, 8, 12, 6, 0, , , , 615, 270, 168, 475, false,"Sulu",crew_portraits_cm_sulu_archon_sm.png,sulu_archon_crew
"Lenara Kahn",10,5, 0,0,0,1246,187,421,0,0,0,0,0,0,997,144,301,0,0,0,343,0,0,775,0,349,274,55,191,0,775,0,545,0,459,437,0,0,895,0,413,309,83,244,0,928,0,707,0,606,793,1033,"Trill, Astrophysicist, Romantic","nonhuman, female, organic, ds9, lenara, crew_max_rarity_5","I'm Not Like You",1, 10, 8, 8, 8, , , , , , 315, 200, 150, 490, false,"Lenara",crew_portraits_cm_lenara_kahn_sm.png,lenara_kahn_crew
"Torpedo Surgeon McCoy",9,5, 0,0,0,893,148,332,0,0,0,593,29,70,0,0,0,1254,142,484,705,0,1042,0,185,686,160,749,25,984,0,214,1073,19,278,660,0,1298,0,242,627,340,696,32,1184,0,252,1343,73,302,580,790,"Federation, Starfleet, Human, Physician, Exobiology, Desperate, Jury Rigger","male, organic, tos, mccoy, crew_max_rarity_5","Lock and Load",2, 8, 4, 6, 8, 1, 0, , , , 300, 230, 86, 250, true,"McCoy",crew_portraits_cm_mccoy_torpedo_sm.png,mccoy_torpedo_crew
"Scared Scotty",9,4, 0,0,0,0,0,0,381,89,175,871,114,238,639,59,128,0,0,0,0,1182,693,1094,0,1194,556,974,0,320,742,962,166,375,790,0,1086,834,1335,0,1048,605,1257,0,356,892,878,500,477,1069,1123,1347,"Human, Starfleet, Federation, Jury Rigger, Desperate","male, organic, tos, scott, crew_max_rarity_4","I Don't Remember",1, 5, 12, 10, 12, 0, 1, , , , 370, 145, 17, 250, false,"Scotty",crew_portraits_cm_scotty_scared_sm.png,scott_scared_crew
"Talas",9,5, 510,73,159,0,0,0,958,151,327,1273,208,375,0,0,0,0,0,0,1128,322,68,1216,948,562,263,0,0,42,796,398,328,108,0,1171,429,126,1241,998,608,326,0,0,46,804,472,432,182,0,481,561,"Andorian, Imperial Guard, Saboteur, Romantic, Tactician, Crafty","nonhuman, female, organic, ent, talas, crew_max_rarity_5","It's Not The Weapon, It's The Soldier",2, 6, 10, 10, 18, 2, 0, , , , 1475, 200, 115, 415, false,"Talas",crew_portraits_cm_talas_sm.png,talas_crew
"EV Suit Chekov",7,4, 379,58,169,661,62,141,0,0,0,0,0,0,925,129,248,0,0,0,549,1201,1153,504,1037,908,670,221,541,0,907,0,694,0,568,768,1164,1132,625,1013,1242,934,513,783,0,1039,0,833,0,712,1052,1348,"Federation, Starfleet, Human, Resourceful, Tactician","male, evsuit, organic, tos, chekov, crew_max_rarity_4","We've Got To Get Out Of Here",1, 7, 14, 12, 14, 5, 0, , , , 380, 50, 70, 400, false,"Chekov",crew_portraits_cm_chekov_evsuit_sm.png,chekov_evsuit_crew
"Laborer Kirk",7,5, 1013,107,294,0,0,0,0,0,0,1292,210,476,496,65,151,0,0,0,577,694,13,354,399,0,213,1154,0,274,1267,0,73,72,966,802,873,24,594,637,0,213,1192,0,267,1333,0,92,90,1017,388,549,"Human, Federation, Starfleet, Jury Rigger, Resourceful, Romantic, Thief, Desperate","male, organic, tos, kirk, crew_max_rarity_5","How Are The Stone Knives And Bearskins?",2, 7, 8, 8, 12, 2, 0, , , , 200, 200, 147, 375, false,"Kirk",crew_portraits_cm_kirk_laborer_sm.png,kirk_laborer_crew
"Dress Uniform Beverly Crusher",10,4, 0,0,0,0,0,0,0,0,0,0,0,0,611,73,245,810,172,428,0,0,0,1068,536,0,0,944,405,0,1108,533,916,351,104,0,0,0,1084,303,0,0,998,249,0,1131,309,954,171,103,1364,1251,"Human, Starfleet, Federation, Physician, Caregiver, Cyberneticist","female, organic, tng, crusher, crew_max_rarity_4","The Bride and Groom",2, 8, 10, 6, 12, , , , , , 400, 195, 217, 415, false,"Crusher",crew_portraits_cm_crusher_dress_uniform_sm.png,crusher_dress_uniform_crew
"Ishan Chaye Sisko",7,5, 0,0,0,0,0,0,496,93,293,1284,247,490,987,120,226,0,0,0,0,1047,218,836,0,983,200,703,0,77,258,795,30,61,532,0,894,183,1048,0,785,175,959,0,31,356,658,41,65,768,314,246,"Bajoran, Resourceful, Desperate, Undercover Operative, Civilian, Investigator","male, organic, ds9, sisko, crew_max_rarity_5","We're Not Who We Seem To Be",1, 9, 6, 10, 10, , , , , , 200, 220, 160, 380, false,"Sisko",crew_portraits_cm_sisko_ishan_chaye_sm.png,sisko_ishan_chaye_crew
"Saowin",10,4, 0,0,0,874,171,371,0,0,0,671,94,219,0,0,0,0,0,0,697,0,809,0,0,674,122,743,387,782,0,0,883,462,0,535,0,920,0,0,520,121,593,309,871,0,0,963,545,0,1328,1305,"Desperate, Resourceful, Ambassador, Civilian","male, organic, nonhuman, voy, saowin, crew_max_rarity_4","I Have Some Bad News",1, 7, 6, 8, 10, 3, 0, 2, , , 400, 50, 96, 474, false,"Saowin",crew_portraits_cm_saowin_sm.png,saowin_crew
"Dejaren",5,4, 566,157,355,380,54,148,877,159,388,0,0,0,0,0,0,0,0,0,500,264,814,1035,694,240,941,1246,790,591,878,484,0,0,0,247,142,483,736,398,205,937,1233,786,471,689,362,0,0,0,984,651,"Brutal, Hologram, Crafty, Desperate, Saboteur","male, artificial_life, nonhuman, voy, dejaren, crew_max_rarity_4","You're Getting Blood Everywhere",0, 7, 6, 8, 12, 1, 0, , , , 140, 125, 137, 300, false,"Dejaren",crew_portraits_cm_dejaren_sm.png,dejaren_crew
"Dr. 'Bones' McCoy",7,5, 0,0,0,0,0,0,0,0,0,0,0,0,0,0,0,1641,98,360,0,0,0,0,46,0,0,0,85,0,0,57,0,29,107,0,0,0,0,551,0,0,0,400,0,0,554,0,345,573,1369,1534,"Federation, Starfleet, Human, Physician, Resourceful, Exobiology","male, organic, tos, mccoy, crew_max_rarity_5","I'm A Doctor!",2, 8, 6, 10, 14, 3, 0, 3, , , 700, 325, 291, 325, false,"McCoy",crew_portraits_cm_mccoy_doctor_sm.png,mccoy_doctor_crew
"Arandis",9,4, 649,82,207,0,0,0,0,0,0,0,0,0,936,85,208,0,0,0,913,957,849,319,730,0,0,773,0,0,932,0,719,0,587,1022,1056,979,664,860,0,0,1060,0,0,1185,0,1015,0,867,1356,1481,"Resourceful, Inspiring, Communicator, Civilian, Romantic, Risian, Playful","female, nonhuman, organic, ds9, arandis, crew_max_rarity_4","Risa Will Be Waiting",1, 5, 4, 8, 12, 3, 0, 3, , , 405, 50, 33, 440, true,"Arandis",crew_portraits_cm_arandis_sm.png,arandis_crew
"Captain Lucero",7,4, 661,108,235,858,172,324,0,0,0,0,0,0,352,80,162,0,0,0,142,927,796,702,673,712,531,400,406,0,1354,0,1235,0,1070,146,955,850,659,738,596,408,288,348,0,1278,0,1124,0,961,1022,958,"Human, Federation, Starfleet, Tribbled, Survivalist, Explorer, Resourceful","female, organic, dsc, lucero, crew_max_rarity_4","He's an Idiot",2, 8, 6, 8, 10, 5, 0, , , , 525, 200, 110, 390, false,"Lucero",crew_portraits_cm_lucero_captain_sm.png,dsc_lucero_captain_crew
"Admiral Maxwell Forrest",9,5, 1256,220,470,0,0,0,0,0,0,430,102,236,1002,151,312,0,0,0,278,478,67,65,139,0,872,606,0,1028,759,0,161,696,445,266,444,43,77,162,0,630,730,0,826,855,0,151,500,548,423,225,"Human, Diplomat, Starfleet, Ambassador","male, organic, ent, forrest, crew_max_rarity_5","It's Time to Swim",1, 7, 8, 8, 14, 2, 0, , , , 405, 320, 100, 425, false,"Forrest",crew_portraits_cm_forrest_admiral_sm.png,forrest_admiral_crew
"Belle Q",9,5, 982,98,243,452,75,166,0,0,0,0,0,0,1286,210,438,0,0,0,201,777,607,86,484,1167,888,135,738,0,465,0,266,0,221,472,960,855,192,745,1136,846,160,698,0,494,0,313,0,268,562,726,"Q Continuum, Costumed, Romantic, Resourceful, Crafty","female, organic, tng, nonhuman, miss_q, crew_max_rarity_5","They're Using Our Weapons",0, 9, 8, 8, 10, , , , , , 400, 320, 211, 390, false,"Q",crew_portraits_cm_miss_q_civil_war_sm.png,miss_q_civil_war_crew
"Mycelial Culber",7,5, 449,93,303,869,198,423,0,0,0,0,0,0,0,0,0,1291,237,550,177,1109,1039,1188,12,643,480,710,9,0,0,123,0,46,182,66,879,735,952,9,385,287,453,7,0,0,127,0,56,165,350,81,"Human, Physician, Romantic, Federation, Starfleet, Desperate, Displaced","male, organic, dsc, culber, crew_max_rarity_5","You Have to Let Me Go",0, 9, 6, 6, 6, , , , 1, 3, 400, 200, 148, 500, false,"Culber",crew_portraits_cm_culber_mycelial_sm.png,dsc_culber_mycelial_crew
"Commander Shelby",9,4, 855,128,259,0,0,0,643,80,169,0,0,0,0,0,0,0,0,0,764,330,689,919,560,880,0,0,0,814,1101,704,0,0,0,829,510,754,967,656,1086,0,0,0,983,1254,903,0,0,0,1377,1455,"Gambler, Starfleet, Federation, Human, Tactician, Desperate, Maverick, Resourceful, Saboteur","female, organic, tng, shelby, crew_max_rarity_4","Impossible!",1, 7, 8, 10, 8, , , , , , 475, 200, 153, 325, false,"Shelby",crew_portraits_cm_shelby_commander_sm.png,shelby_commander_crew
"Tourist Worf",3,3, 533,62,160,0,0,0,386,56,160,0,0,0,0,0,0,0,0,0,1086,789,1038,1186,916,1222,0,0,0,1075,1327,986,0,0,0,1194,819,1146,1261,1025,1169,0,0,0,1056,1327,972,0,0,0,1507,1542,"Federation, Starfleet, Klingon, Saboteur, Romantic","male, nonhuman, organic, ds9, worf, crew_max_rarity_3","I Didn't Bring A Bathing Suit",1, 4, 10, 8, 10, 1, 2, , , , 25, 100, 173, 90, false,"Worf",crew_portraits_cm_worf_tourist_sm.png,worf_tourist_crew
"Control Leland",8,5, 1254,233,394,0,0,0,1067,103,198,0,0,0,658,49,86,0,0,0,307,74,277,171,170,529,0,982,0,488,213,360,952,0,797,357,224,300,387,225,962,0,1318,0,893,943,816,1304,0,1124,284,960,"Section 31, Undercover Operative, Crafty, Control, Brutal, Human, Federation, Starfleet, Compromised","nonhuman, male, organic, dsc, leland, crew_max_rarity_5","Get Me That Data",0, 8, 6, 8, 10, , , , 2, 3, 265, 210, 153, 475, false,"Leland",crew_portraits_cm_leland_control_sm.png,dsc_leland_control_crew
"Leucon",8,5, 0,0,0,974,210,435,490,96,200,1268,295,448,0,0,0,0,0,0,518,1110,233,0,0,113,11,578,292,86,1227,869,252,69,0,358,1043,178,0,0,100,7,421,204,57,1166,824,210,64,0,268,127,"Civilian, Brunali, Botanist, Desperate, Jury Rigger, Geneticist","male, nonhuman, organic, voy, leucon, crew_max_rarity_5","You Can Make A Difference Here",1, 9, 8, 10, 12, , , , , , 445, 100, 140, 365, false,"Leucon",crew_portraits_cm_leucon_sm.png,leucon_crew
"Annika Hansen Seven",9,5, 565,38,88,1021,107,251,0,0,0,1303,161,317,0,0,0,0,0,0,175,1125,73,1206,939,613,27,669,340,332,0,0,344,115,0,641,1289,344,1391,1158,859,131,937,508,570,0,0,597,281,0,534,1194,"Human, Civilian, Federation, Astrophysicist, Romantic","female, organic, voy, seven, apr2023, crew_max_rarity_5","I'm Sure You'll Adapt",0, 9, 6, 6, 10, , , , , , 375, 200, 250, 400, false,"Seven",crew_portraits_cm_seven_annika_sm.png,seven_annika_crew
"Twilight T'Pol",7,5, 0,0,0,951,90,222,403,186,378,0,0,0,0,0,0,1034,240,792,727,1057,0,0,211,144,527,766,28,912,1179,30,0,120,300,987,622,0,0,35,127,682,1022,11,440,666,6,0,18,70,590,53,"Vulcan, Astrophysicist, Telepath, Caregiver, Civilian","nonhuman, female, organic, ent, tpol, crew_max_rarity_5","Target Their Engines",2, 10, 12, 10, 10, , , , 0, 2, 225, 125, 120, 250, false,"T'Pol",crew_portraits_cm_tpol_twilight_sm.png,tpol_twilight_crew
"Picard and Number One",7,5, 527,79,177,1328,234,497,0,0,0,0,0,0,967,154,330,0,0,0,71,1095,1022,327,898,200,176,34,111,0,793,0,563,0,477,77,1106,1061,422,941,237,190,24,158,0,806,0,594,0,500,279,265,"Human, Astrophysicist, Inspiring, Civilian, Cultural Figure, Federation, Gardener, Veteran","male, organic, pic, picard, crew_max_rarity_5","Old Dogs",1, 8, 6, 8, 10, 6, 0, , , , 300, 235, 130, 300, false,"Picard",crew_portraits_cm_picard_numberone_sm.png,picard_numberone_crew
"Doctor Paul Stubbs",10,4, 0,0,0,856,150,370,0,0,0,659,118,275,0,0,0,0,0,0,725,0,780,0,0,703,123,764,401,764,0,0,861,446,0,581,0,748,0,0,557,94,620,326,731,0,0,808,431,0,1330,1260,"Astrophysicist, Human, Federation, Innovator, Civilian, Prodigy","male, organic, tng, stubbs, crew_max_rarity_4","I Would Rather Die Than Leave",2, 8, 6, 8, 8, , , , 1, 2, 600, 170, 170, 225, false,"Stubbs",crew_portraits_cm_stubbs_sm.png,stubbs_crew
"Mission Specialist Lefler",9,4, 0,0,0,661,96,192,0,0,0,858,86,214,390,73,145,0,0,0,906,0,717,1285,0,857,149,566,517,703,1325,0,364,393,1035,1044,0,962,1280,0,1022,329,640,617,901,1331,0,533,578,1015,1119,1352,"Human, Federation, Starfleet, Romantic, Innovator, Resourceful, Tactician","female, organic, tng, lefler, crew_max_rarity_4","Always Watch Your Back",1, 6, 5, 8, 10, 3, 0, 3, , , 200, 50, 141, 325, false,"Lefler",crew_portraits_cm_lefler_robin_sm.png,lefler_robin_crew
"Mirror Burnham",4,4, 355,36,112,0,0,0,642,121,232,0,0,0,892,166,328,0,0,0,1310,659,1239,534,1127,843,0,732,0,778,214,664,669,0,557,1326,696,1254,565,1145,847,0,664,0,796,246,714,579,0,488,1021,1133,"Mirror Universe, Undercover Operative, Federation, Starfleet, Civilian, Astrophysicist, Xenoanthropology, Human","female, organic, dsc, burnham, crew_max_rarity_4","The Old Michael Burnham is Dead",0, 9, 6, 10, 10, , , , , , 495, 200, 145, 440, false,"Burnham",crew_portraits_cm_burnham_mirror_sm.png,dsc_burnham_mirror_crew
"Lt. Ilia",10,4, 664,106,231,864,156,339,0,0,0,0,0,0,0,0,0,0,0,0,140,928,797,1015,674,707,529,769,404,0,0,0,0,0,0,151,968,863,1058,755,600,411,674,352,0,0,0,0,0,0,1341,1325,"Deltan, Federation, Starfleet, Romantic","female, nonhuman, organic, tos, ilia, crew_max_rarity_4","Navigational Deflectors Online",1, 8, 8, 6, 8, , , , , , 475, 200, 191, 415, false,"Ilia",crew_portraits_cm_ilia_lt_sm.png,ilia_lt_crew
"Age of Sail Worf",7,5, 962,139,356,0,0,0,1334,161,358,0,0,0,503,87,189,0,0,0,585,67,526,338,408,276,0,1081,0,285,125,169,1069,0,897,600,171,525,383,432,530,0,1083,0,506,302,402,1046,0,894,355,575,"Klingon, Tactician, Federation, Starfleet, Costumed","ageofsail, nonhuman, male, organic, tng, worf, crew_max_rarity_5","I am Prepared",1, 7, 8, 8, 10, 4, 1, , , , 380, 170, 200, 475, false,"Worf",crew_portraits_cm_worf_ageofsail_sm.png,worf_ageofsail_crew
"Arjin",9,4, 597,101,222,836,177,394,0,0,0,0,0,0,379,65,135,0,0,0,161,992,883,761,774,698,522,372,399,0,1350,0,1220,0,1057,108,989,890,728,782,471,348,263,284,0,1362,0,1226,0,1048,1075,944,"Civilian, Pilot, Astrophysicist, Trill","male, organic, ds9, nonhuman, arjin, feb2023, crew_max_rarity_4","It's... Interesting",2, 9, 8, 6, 8, , , 2, , , 350, 200, 125, 430, false,"Arjin",crew_portraits_cm_arjin_sm.png,arjin_crew
"Lt. Commander Icheb",8,5, 0,0,0,1272,207,433,471,101,151,980,141,310,0,0,0,0,0,0,300,1148,544,0,0,68,21,386,164,167,1272,912,585,263,0,368,1112,639,0,0,120,36,426,210,248,1249,899,675,346,0,501,475,"Civilian, Brunali, Borg, Astrophysicist, Prodigy, Innovator, Federation, Starfleet","male, nonhuman, organic, voy, icheb, crew_max_rarity_5","I Never Told",1, 10, 6, 10, 10, , , , , , 500, 150, 138, 415, false,"Icheb",crew_portraits_cm_icheb_lt_commander_sm.png,icheb_lt_commander_crew
"Tau",8,4, 0,0,0,342,72,156,894,130,308,0,0,0,651,109,220,0,0,0,1288,806,0,1036,0,317,980,588,822,632,224,510,888,0,743,1195,820,0,1072,0,291,867,551,719,663,324,578,928,0,789,1028,1138,"Crafty, Saboteur, Criminal, Scoundrel, Resourceful","male, organic, nonhuman, voy, tau, crew_max_rarity_4","I'd Hate to Make Your Life Difficult",0, 6, 8, 10, 10, 4, 1, , , , 315, 200, 90, 300, false,"Tau",crew_portraits_cm_tau_sm.png,tau_crew
