"Little John Riker",5,5, 1023,128,239,0,0,0,1309,192,354,0,0,0,422,113,245,0,0,0,310,22,271,215,233,128,0,758,0,137,78,82,727,0,631,560,163,489,288,460,300,0,616,0,275,138,234,547,0,491,155,384,"Human, Federation, Starfleet, Costumed, Thief","male, organic, tng, bridge_crew, riker, crew_max_rarity_5","We Need a Diversion",0, 6, 10, 8, 16, 2, 0, , , , 515, 200, 125, 425, false,"Riker",crew_portraits_cm_riker_littlejohn_sm.png,riker_littlejohn_crew
"Transporter Chief Rand",10,4, 0,0,0,0,0,0,0,0,0,859,113,241,628,92,204,0,0,0,0,0,399,666,0,0,333,597,0,405,683,0,55,233,477,0,0,525,724,0,0,373,701,0,511,758,0,180,310,561,875,944,"Human, Federation, Starfleet, Desperate","female, organic, tos, rand, crew_max_rarity_4","Yank Them Back!",1, 8, 8, 8, 10, , , , , , 475, 275, 155, 242, false,"Rand",crew_portraits_cm_rand_transporter_sm.png,rand_transporter_crew
"Betrothed Kamala",2,2, 234,27,86,145,27,81,0,0,0,0,0,0,363,43,105,0,0,0,806,866,860,697,805,924,633,706,569,0,904,0,835,0,724,788,856,843,761,789,909,620,741,559,0,928,0,839,0,729,1044,1056,"Kriosian, Empath, Romantic","organic, tng, female, nonhuman, kamala, crew_max_rarity_2","I Am for You",1, 2, 6, 3, 10, 1, 0, , , , 390, 130, 115, 530, false,"Kamala",crew_portraits_cm_kamala_betrothed_sm.png,kamala_betrothed_crew
"Cadet First Class Locarno",9,5, 1284,180,408,0,0,0,0,0,0,0,0,0,1078,160,296,0,0,0,130,273,107,3,58,0,0,309,0,0,398,0,250,0,236,279,381,206,108,195,0,0,486,0,0,559,0,405,0,386,426,634,"Human, Federation, Starfleet, Maverick, Pilot, Crafty, Desperate","tng, male, nicholas_locarno, organic, crew_max_rarity_5","Everything I Said Was The Truth!",1, 10, 4, 12, 8, , , , 2, 2, 390, 150, 175, 690, false,"Locarno",crew_portraits_cm_nicholas_locarno_sm.png,locarno_nicholas_crew
"Kamala",5,5, 967,131,227,546,92,174,0,0,0,0,0,0,1254,238,483,0,0,0,84,470,349,29,296,660,455,44,409,0,242,0,96,0,113,241,603,498,90,469,708,461,75,423,0,271,0,132,0,151,114,322,"Kriosian, Empath, Romantic, Exoarchaeology","nonhuman, female, organic, tng, kamala, crew_max_rarity_5","Who I Am Today, I Will Be Forever",1, 7, 4, 6, 8, , , , , , 315, 95, 167, 325, true,"Kamala",crew_portraits_cm_kamala_sm.png,kamala_crew
"Priestess Siranna",8,4, 529,112,242,0,0,0,0,0,0,0,0,0,883,138,286,382,78,211,648,663,589,223,201,0,0,459,482,0,544,639,403,439,106,573,607,503,254,144,0,0,533,401,0,605,573,454,379,154,585,609,"Gardener, Kelpien, Spiritual, Civilian, Ambassador, Cultural Figure","nonhuman, female, organic, dsc, siranna, crew_max_rarity_4","The Truth Has Survived",1, 7, 6, 8, 8, , , , , , 450, 200, 100, 475, false,"Siranna",crew_portraits_cm_siranna_priestess_sm.png,dsc_siranna_priestess_crew
"Scrooge Data",4,5, 969,171,330,508,73,173,0,0,0,0,0,0,1267,264,338,0,0,0,81,401,254,21,214,719,487,64,442,0,288,0,137,0,146,141,453,306,76,288,742,493,121,447,0,408,0,234,0,248,130,312,"Android, Starfleet, Federation, Cyberneticist, Costumed, Cultural Figure","nonhuman, male, tng, lieutenant_commander, bridge_crew, artificial_life, data, crew_max_rarity_5","Humbug",1, 9, 6, 8, 6, , , , , , 200, 305, 160, 475, false,"Data",crew_portraits_cm_data_scrooge_sm.png,data_scrooge_crew
"Chancellor Martok",5,5, 943,132,341,0,0,0,543,67,148,0,0,0,1262,161,372,0,0,0,344,184,310,39,266,680,0,226,0,601,80,557,168,0,177,415,297,334,124,324,777,0,393,0,672,243,658,322,0,320,188,442,"Klingon, Duelist, Tactician, Diplomat, Veteran, Politician, Cultural Figure","nonhuman, male, organic, ds9, martok, crew_max_rarity_5","I will fight any battle. Anywhere",0, 9, 8, 8, 10, , , , 2, 2, 400, 125, 184, 450, false,"Martok",crew_portraits_cm_martok_chancellor_sm.png,martok_chancellor_crew
"Admiral Patrick",5,5, 1238,275,538,1023,124,239,0,0,0,0,0,0,495,76,143,0,0,0,4,248,82,90,40,333,254,128,205,0,811,0,720,0,621,16,224,72,111,63,558,363,323,340,0,871,0,756,0,655,95,254,"Human, Engineered, Federation, Civilian, Costumed, Crafty","male, organic, ds9, patrick, crew_max_rarity_5","That's A Stupid Question",1, 9, 8, 10, 10, , , , , , 500, 100, 155, 375, false,"Patrick",crew_portraits_cm_patrick_admiral_sm.png,patrick_admiral_crew
"Christine Chapel",6,4, 0,0,0,559,70,170,0,0,0,0,0,0,349,103,201,790,127,280,680,0,0,829,367,659,454,397,77,0,858,374,774,251,192,762,0,0,715,421,755,498,372,151,0,745,413,632,258,153,736,729,"Federation, Starfleet, Human, Physician, Veteran, Nurse, Romantic","female, organic, tos, chapel, crew_max_rarity_4","Don't You Recognise Me?",1, 7, 8, 12, 12, 5, 0, , , , 1400, 185, 120, 400, false,"Chapel",crew_portraits_cm_chapel_christine_sm.png,chapel_christine_crew
"Brainless Spock",8,2, 0,0,0,223,43,138,0,0,0,360,51,179,0,0,0,0,0,0,913,0,757,0,0,908,395,897,554,714,0,0,793,462,0,852,0,722,0,0,840,328,834,520,662,0,0,738,430,0,1062,1047,"Federation, Starfleet, Exobiology, Astrophysicist, Human, Musician, Vulcan, Telepath","nonhuman, male, organic, tos, bridge_crew, first_officer, spock, spock_tos, crew_max_rarity_2","A Practical Idea",2, 3, 8, 10, 8, , , , , , 460, 150, 163, 390, false,"Spock",crew_portraits_cm_spock_brainless_sm.png,spock_brainless_crew
"Garth of Izar",5,5, 1214,226,444,0,0,0,989,156,344,0,0,0,487,83,142,0,0,0,152,21,122,122,81,278,0,757,0,253,156,187,726,0,630,192,67,138,165,129,361,0,777,0,329,253,283,746,0,644,151,246,"Prisoner, Desperate, Human, Brutal, Resourceful, Villain, Shapeshifter, Veteran","organic, male, tos, garth_izar, crew_max_rarity_5","I'm Afraid of No One",0, 8, 6, 8, 10, 1, 0, 2, , , 300, 200, 185, 225, false,"Garth",crew_portraits_cm_garth_izar_sm.png,garth_izar_crew
"Seeking Spock",4,5, 0,0,0,1257,183,448,0,0,0,0,0,0,430,132,295,931,170,326,166,0,0,749,262,163,163,66,17,0,778,238,670,170,74,244,0,0,594,304,234,179,49,26,0,600,308,448,188,78,182,148,"Vulcan, Human, Telepath, Spiritual, Starfleet, Federation, Resourceful, Explorer","nonhuman, male, organic, tos, spock, spock_tos, crew_max_rarity_5","Recommend We Proceed",1, 9, 10, 12, 12, , , , , , 550, 200, 175, 225, false,"Spock",crew_portraits_cm_spock_seeking_sm.png,spock_seeking_crew
"Compromised Airiam",8,5, 0,0,0,940,178,397,1254,198,420,0,0,0,0,0,0,0,0,0,322,290,0,0,0,4,241,356,199,149,294,101,0,0,0,306,350,0,0,0,19,227,332,196,208,358,172,0,0,0,452,475,"Control, Federation, Starfleet, Brutal, Undercover Operative, Human, Engineered, Astrophysicist","evsuit, female, organic, dsc, bridge_crew, airiam, crew_max_rarity_5","Open The Airlock",0, 9, 8, 8, 10, , , , 2, 2, 555, 125, 285, 400, false,"Airiam",crew_portraits_cm_airiam_compromised_sm.png,dsc_airiam_compromised_crew
"Lt. Uhura",4,3, 384,51,129,0,0,0,0,0,0,0,0,0,539,76,178,0,0,0,813,786,749,521,700,0,0,679,0,0,756,0,645,0,547,846,812,772,577,725,0,0,744,0,0,814,0,703,0,608,995,1035,"Human, Starfleet, Federation, Musician, Communicator","bridge_crew, female, organic, tos, uhura, lieutenant, crew_max_rarity_3","Hailing Frequencies Open",1, 5, 6, 10, 12, , , , , , 300, 50, 71, 190, false,"Uhura",crew_portraits_cm_uhura_lt_yellow_sm.png,uhura_lt_yellow_crew
"Rescue Team Uhura",4,5, 984,179,361,0,0,0,1313,166,410,0,0,0,456,113,208,0,0,0,279,8,232,173,189,114,0,739,0,127,70,69,714,0,612,323,84,252,197,238,271,0,664,0,242,141,204,601,0,530,48,214,"Human, Federation, Starfleet, Communicator, Resourceful, Musician, Marksman","bridge_crew, female, organic, tos, uhura, lieutenant_commander, crew_max_rarity_5","Phasers on Setting One. Fire.",2, 7, 6, 3, 8, 7, 0, , , , 540, 225, 68, 150, false,"Uhura",crew_portraits_cm_uhura_rescue_sm.png,uhura_rescue_crew
"Sulu of the Body",8,4, 612,111,266,0,0,0,0,0,0,0,0,0,910,153,301,0,0,0,562,592,506,152,455,0,0,428,0,0,516,0,371,0,323,544,584,471,211,449,0,0,488,0,0,560,0,408,0,387,827,822,"Human, Federation, Starfleet, Diplomat, Pilot, Archon","male, organic, tos, bridge_crew, sulu, crew_max_rarity_4","Paradise, My Friend, Paradise",1, 6, 8, 8, 12, 6, 0, , , , 615, 270, 168, 475, false,"Sulu",crew_portraits_cm_sulu_archon_sm.png,sulu_archon_crew
"Lenara Kahn",10,5, 0,0,0,1246,187,421,0,0,0,0,0,0,997,144,301,0,0,0,176,0,0,458,0,173,171,16,116,0,438,0,283,0,263,270,0,0,574,0,257,197,51,176,0,576,0,424,0,397,462,640,"Trill, Astrophysicist, Romantic","nonhuman, female, organic, ds9, lenara, crew_max_rarity_5","I'm Not Like You",1, 10, 8, 8, 8, , , , , , 315, 200, 150, 490, false,"Lenara",crew_portraits_cm_lenara_kahn_sm.png,lenara_kahn_crew
"Torpedo Surgeon McCoy",4,5, 0,0,0,893,148,332,0,0,0,593,29,70,0,0,0,1254,142,484,415,0,647,0,62,403,99,447,20,608,0,84,662,10,139,422,0,859,0,165,405,223,445,29,783,0,177,889,52,216,231,481,"Federation, Starfleet, Human, Physician, Exobiology, Desperate, Jury Rigger","male, organic, tos, lieutenant_commander, mccoy, crew_max_rarity_5","Lock and Load",2, 8, 4, 6, 8, 1, 0, , , , 300, 230, 86, 250, true,"McCoy",crew_portraits_cm_mccoy_torpedo_sm.png,mccoy_torpedo_crew
"Scared Scotty",4,4, 0,0,0,0,0,0,381,89,175,871,114,238,639,59,128,0,0,0,0,772,394,695,0,791,330,630,0,151,418,649,57,228,507,0,712,531,858,0,696,380,826,0,221,549,593,313,317,691,622,851,"Human, Starfleet, Federation, Jury Rigger, Desperate","male, organic, tos, scott, crew_max_rarity_4","I Don't Remember",1, 5, 12, 10, 12, 0, 1, , , , 370, 145, 17, 250, false,"Scotty",crew_portraits_cm_scotty_scared_sm.png,scott_scared_crew
"Talas",6,5, 510,73,159,0,0,0,958,151,327,1273,208,375,0,0,0,0,0,0,723,190,34,764,616,318,151,0,0,17,462,231,139,59,0,764,285,82,790,656,391,221,0,0,27,517,316,265,141,0,161,357,"Andorian, Imperial Guard, Saboteur, Romantic, Tactician, Crafty","nonhuman, female, organic, ent, talas, lieutenant, crew_max_rarity_5","It's Not The Weapon, It's The Soldier",2, 6, 10, 10, 18, 2, 0, , , , 1475, 200, 115, 415, false,"Talas",crew_portraits_cm_talas_sm.png,talas_crew
"EV Suit Chekov",7,4, 379,58,169,661,62,141,0,0,0,0,0,0,925,129,248,0,0,0,288,779,735,284,685,591,415,103,364,0,527,0,390,0,334,481,763,720,423,669,812,531,328,493,0,661,0,520,0,473,563,850,"Federation, Starfleet, Human, Resourceful, Tactician","male, evsuit, organic, tos, lieutenant, bridge_crew, chekov, crew_max_rarity_4","We've Got To Get Out Of Here",1, 7, 14, 12, 14, 5, 0, , , , 380, 50, 70, 400, false,"Chekov",crew_portraits_cm_chekov_evsuit_sm.png,chekov_evsuit_crew
"Laborer Kirk",3,5, 1013,107,294,0,0,0,0,0,0,1292,210,476,496,65,151,0,0,0,304,407,2,200,222,0,125,752,0,111,812,0,29,33,624,508,560,14,401,423,0,151,792,0,172,879,0,55,71,661,70,366,"Human, Federation, Starfleet, Jury Rigger, Resourceful, Romantic, Thief, Desperate","male, organic, tos, captain, bridge_crew, kirk, crew_max_rarity_5","How Are The Stone Knives And Bearskins?",2, 7, 8, 8, 12, 2, 0, , , , 200, 200, 147, 375, false,"Kirk",crew_portraits_cm_kirk_laborer_sm.png,kirk_laborer_crew
"Dress Uniform Beverly Crusher",8,4, 0,0,0,0,0,0,0,0,0,0,0,0,611,73,245,810,172,428,0,0,0,671,312,0,0,601,243,0,687,297,566,206,59,0,0,0,698,190,0,0,667,179,0,723,197,605,116,79,846,762,"Human, Starfleet, Federation, Physician, Caregiver, Cyberneticist","female, organic, tng, commander, crusher, crew_max_rarity_4","The Bride and Groom",2, 8, 10, 6, 12, , , , , , 400, 195, 217, 415, false,"Crusher",crew_portraits_cm_crusher_dress_uniform_sm.png,crusher_dress_uniform_crew
"Ishan Chaye Sisko",2,5, 0,0,0,0,0,0,496,93,293,1284,247,490,987,120,226,0,0,0,0,674,84,506,0,640,121,400,0,37,149,517,6,28,300,0,572,118,675,0,505,123,635,0,20,251,431,26,51,503,38,207,"Bajoran, Resourceful, Desperate, Undercover Operative, Civilian, Investigator","male, organic, ds9, captain, bridge_crew, sisko, crew_max_rarity_5","We're Not Who We Seem To Be",1, 9, 6, 10, 10, , , , , , 200, 220, 160, 380, false,"Sisko",crew_portraits_cm_sisko_ishan_chaye_sm.png,sisko_ishan_chaye_crew
"Saowin",10,4, 0,0,0,874,171,371,0,0,0,671,94,219,0,0,0,0,0,0,403,0,485,0,0,395,68,438,240,477,0,0,535,297,0,338,0,597,0,0,329,84,373,217,567,0,0,615,359,0,824,810,"Desperate, Resourceful, Ambassador, Civilian","male, organic, nonhuman, voy, saowin, crew_max_rarity_4","I Have Some Bad News",1, 7, 6, 8, 10, 3, 0, 2, , , 400, 50, 96, 474, false,"Saowin",crew_portraits_cm_saowin_sm.png,saowin_crew
"Dejaren",4,4, 566,157,355,380,54,148,877,159,388,0,0,0,0,0,0,0,0,0,256,142,486,635,434,108,552,815,495,335,502,277,0,0,0,168,98,289,490,269,131,530,808,491,276,449,235,0,0,0,524,386,"Brutal, Hologram, Crafty, Desperate, Saboteur","male, artificial_life, nonhuman, voy, dejaren, crew_max_rarity_4","You're Getting Blood Everywhere",0, 7, 6, 8, 12, 1, 0, , , , 140, 125, 137, 300, false,"Dejaren",crew_portraits_cm_dejaren_sm.png,dejaren_crew
"Dr. 'Bones' McCoy",5,5, 0,0,0,0,0,0,0,0,0,0,0,0,0,0,0,1641,98,360,0,0,0,0,21,0,0,0,50,0,0,32,0,15,57,0,0,0,0,356,0,0,0,272,0,0,353,0,212,373,844,1016,"Federation, Starfleet, Human, Physician, Resourceful, Exobiology","male, organic, tos, lieutenant_commander, mccoy, crew_max_rarity_5","I'm A Doctor!",2, 8, 6, 10, 14, 3, 0, 3, , , 700, 325, 291, 325, false,"McCoy",crew_portraits_cm_mccoy_doctor_sm.png,mccoy_doctor_crew
"Arandis",9,4, 649,82,207,0,0,0,0,0,0,0,0,0,936,85,208,0,0,0,570,599,513,169,466,0,0,469,0,0,554,0,412,0,351,666,693,623,440,578,0,0,706,0,0,765,0,649,0,567,847,970,"Resourceful, Inspiring, Communicator, Civilian, Romantic, Risian","female, nonhuman, organic, ds9, arandis, crew_max_rarity_4","Risa Will Be Waiting",1, 5, 4, 8, 12, 3, 0, 3, , , 405, 50, 33, 440, true,"Arandis",crew_portraits_cm_arandis_sm.png,arandis_crew
"Captain Lucero",7,4, 661,108,235,858,172,324,0,0,0,0,0,0,352,80,162,0,0,0,65,582,480,422,430,429,314,205,259,0,879,0,800,0,692,96,616,527,433,491,386,270,182,247,0,836,0,718,0,623,538,600,"Human, Federation, Starfleet, Tribbled, Survivalist, Explorer, Resourceful","female, organic, dsc, lucero, crew_max_rarity_4","He's an Idiot",2, 8, 6, 8, 10, 5, 0, , , , 525, 200, 110, 390, false,"Lucero",crew_portraits_cm_lucero_captain_sm.png,dsc_lucero_captain_crew
"Admiral Maxwell Forrest",5,5, 1256,220,470,0,0,0,0,0,0,430,102,236,1002,151,312,0,0,0,125,264,32,11,49,0,502,336,0,646,429,0,54,419,257,178,299,26,60,121,0,387,478,0,534,551,0,89,328,376,98,184,"Human, Diplomat, Starfleet, Ambassador","male, organic, ent, forrest, admiral, crew_max_rarity_5","It's Time to Swim",1, 7, 8, 8, 14, 2, 0, , , , 405, 320, 100, 425, false,"Forrest",crew_portraits_cm_forrest_admiral_sm.png,forrest_admiral_crew
"Belle Q",8,5, 982,98,243,452,75,166,0,0,0,0,0,0,1286,210,438,0,0,0,105,464,341,27,289,770,523,70,477,0,247,0,105,0,119,293,620,532,136,494,756,500,108,453,0,354,0,185,0,205,242,444,"Q Continuum, Costumed, Romantic, Resourceful, Crafty","female, organic, tng, nonhuman, miss_q, crew_max_rarity_5","They're Using Our Weapons",0, 9, 8, 8, 10, , , , , , 400, 320, 211, 390, false,"Q",crew_portraits_cm_miss_q_civil_war_sm.png,miss_q_civil_war_crew
"Mycelial Culber",2,5, 449,93,303,869,198,423,0,0,0,0,0,0,0,0,0,1291,237,550,87,701,639,737,6,362,280,407,3,0,0,46,0,25,92,40,567,443,612,7,244,185,279,7,0,0,96,0,37,117,35,53,"Human, Physician, Romantic, Federation, Starfleet, Desperate","male, organic, dsc, culber, crew_max_rarity_5","You Have to Let Me Go",0, 9, 6, 6, 6, , , , 1, 3, 400, 200, 148, 500, false,"Culber",crew_portraits_cm_culber_mycelial_sm.png,dsc_culber_mycelial_crew
"Commander Shelby",10,4, 855,128,259,0,0,0,643,80,169,0,0,0,0,0,0,0,0,0,451,194,390,566,337,566,0,0,0,508,689,460,0,0,0,532,335,457,624,437,721,0,0,0,620,807,612,0,0,0,865,940,"Gambler, Starfleet, Federation, Human, Tactician, Desperate","female, organic, tng, shelby, crew_max_rarity_4","Impossible!",1, 7, 8, 10, 8, , , , , , 475, 200, 153, 325, false,"Shelby",crew_portraits_cm_shelby_commander_sm.png,shelby_commander_crew
"Tourist Worf",3,3, 533,62,160,0,0,0,386,56,160,0,0,0,0,0,0,0,0,0,694,475,642,741,594,800,0,0,0,691,863,655,0,0,0,782,519,725,805,673,773,0,0,0,670,858,655,0,0,0,993,1026,"Federation, Starfleet, Klingon, Saboteur, Romantic","male, nonhuman, organic, ds9, bridge_crew, worf, crew_max_rarity_3","I Didn't Bring A Bathing Suit",1, 4, 10, 8, 10, 1, 2, , , , 25, 100, 173, 90, false,"Worf",crew_portraits_cm_worf_tourist_sm.png,worf_tourist_crew
"Control Leland",3,5, 1254,233,394,0,0,0,1067,103,198,0,0,0,658,49,86,0,0,0,137,25,114,84,65,293,0,633,0,273,119,207,600,0,510,229,157,162,263,153,632,0,876,0,565,569,549,851,0,739,25,596,"Section 31, Undercover Operative, Crafty, Control, Brutal, Human","nonhuman, male, organic, dsc, leland, crew_max_rarity_5","Get Me That Data",0, 8, 6, 8, 10, , , , 2, 3, 265, 210, 153, 475, false,"Leland",crew_portraits_cm_leland_control_sm.png,dsc_leland_control_crew
"Leucon",2,5, 0,0,0,974,210,435,490,96,200,1268,295,448,0,0,0,0,0,0,273,711,90,0,0,50,2,317,172,39,780,574,85,32,0,227,682,115,0,0,60,6,258,156,33,740,560,121,50,0,17,93,"Civilian, Brunali, Botanist, Desperate, Jury Rigger, Geneticist","male, organic, voy, leucon, crew_max_rarity_5","You Can Make A Difference Here",1, 9, 8, 10, 12, , , , , , 445, 100, 140, 365, false,"Leucon",crew_portraits_cm_leucon_sm.png,leucon_crew
"Annika Hansen Seven",5,5, 565,38,88,1021,107,251,0,0,0,1303,161,317,0,0,0,0,0,0,86,720,37,760,612,340,19,386,208,159,0,0,161,65,0,411,851,204,908,780,563,94,611,344,365,0,0,374,204,0,210,721,"Human, Civilian, Federation, Astrophysicist, Romantic","female, organic, voy, bridge_crew, seven, crew_max_rarity_5","I'm Sure You'll Adapt",0, 9, 6, 6, 10, , , , , , 375, 200, 250, 400, false,"Seven",crew_portraits_cm_seven_annika_sm.png,seven_annika_crew
"Twilight T'Pol",4,5, 0,0,0,951,90,222,403,186,378,0,0,0,0,0,0,1034,240,792,429,676,0,0,80,71,313,465,23,570,743,14,0,60,153,647,401,0,0,28,80,411,673,11,258,428,4,0,12,51,240,31,"Vulcan, Astrophysicist, Telepath, Caregiver, Civilian","nonhuman, female, organic, ent, first_officer, bridge_crew, tpol, crew_max_rarity_5","Target Their Engines",2, 10, 12, 10, 10, , , , 0, 2, 225, 125, 120, 250, false,"T'Pol",crew_portraits_cm_tpol_twilight_sm.png,tpol_twilight_crew
"Picard and Number One",2,5, 527,79,177,1328,234,497,0,0,0,0,0,0,967,154,330,0,0,0,34,695,634,177,582,89,115,2,79,0,449,0,292,0,271,50,723,677,285,624,158,124,21,118,0,524,0,367,0,350,24,208,"Human, Astrophysicist, Inspiring, Civilian, Cultural Figure, Federation, Gardener, Veteran","male, organic, pic, admiral, bridge_crew, picard, crew_max_rarity_5","Old Dogs",1, 8, 6, 8, 10, 6, 0, , , , 300, 235, 130, 300, false,"Picard",crew_portraits_cm_picard_numberone_sm.png,picard_numberone_crew
"Doctor Paul Stubbs",9,4, 0,0,0,856,150,370,0,0,0,659,118,275,0,0,0,0,0,0,423,0,472,0,0,422,69,458,254,470,0,0,530,293,0,367,0,465,0,0,357,71,406,231,461,0,0,503,274,0,825,770,"Astrophysicist, Human, Federation, Innovator, Civilian","male, organic, tng, stubbs, crew_max_rarity_4","I Would Rather Die Than Leave",2, 8, 6, 8, 8, , , , 1, 2, 600, 170, 170, 225, false,"Stubbs",crew_portraits_cm_stubbs_sm.png,stubbs_crew
"Mission Specialist Lefler",7,4, 0,0,0,661,96,192,0,0,0,858,86,214,390,73,145,0,0,0,576,0,416,830,0,546,87,311,344,421,859,0,184,249,673,679,0,622,827,0,675,217,419,404,586,874,0,333,376,659,618,855,"Human, Federation, Starfleet, Romantic, Innovator, Resourceful, Tactician","female, organic, tng, lefler, crew_max_rarity_4","Always Watch Your Back",1, 6, 5, 8, 10, 3, 0, 3, , , 200, 50, 141, 325, false,"Lefler",crew_portraits_cm_lefler_robin_sm.png,lefler_robin_crew
"Mirror Burnham",2,4, 355,36,112,0,0,0,642,121,232,0,0,0,892,166,328,0,0,0,867,385,801,308,751,533,0,427,0,480,114,424,369,0,322,885,450,814,382,769,553,0,436,0,491,171,472,358,0,344,544,686,"Mirror Universe, Undercover Operative, Federation, Starfleet, Civilian, Astrophysicist, Xenoanthropology, Human","female, organic, dsc, burnham, crew_max_rarity_4","The Old Michael Burnham is Dead",0, 9, 6, 10, 10, , , , , , 495, 200, 145, 440, false,"Burnham",crew_portraits_cm_burnham_mirror_sm.png,dsc_burnham_mirror_crew
"Lt. Ilia",10,4, 664,106,231,864,156,339,0,0,0,0,0,0,0,0,0,0,0,0,64,581,479,631,429,426,311,462,257,0,0,0,0,0,0,98,629,541,674,503,388,272,429,249,0,0,0,0,0,0,832,821,"Deltan, Federation, Starfleet, Romantic","female, nonhuman, organic, tos, ilia, crew_max_rarity_4","Navigational Deflectors Online",1, 8, 8, 6, 8, , , , , , 475, 200, 191, 415, false,"Ilia",crew_portraits_cm_ilia_lt_sm.png,ilia_lt_crew
"Age of Sail Worf",3,5, 962,139,356,0,0,0,1334,161,358,0,0,0,503,87,189,0,0,0,307,16,266,185,227,118,0,695,0,131,66,74,666,0,568,389,114,312,257,294,334,0,719,0,308,202,266,672,0,585,81,352,"Klingon, Tactician, Federation, Starfleet, Costumed","ageofsail, nonhuman, male, organic, tng, bridge_crew, worf, crew_max_rarity_5","I am Prepared",1, 7, 8, 8, 10, 4, 1, , , , 380, 170, 200, 475, false,"Worf",crew_portraits_cm_worf_ageofsail_sm.png,worf_ageofsail_crew
"Arjin",8,4, 597,101,222,836,177,394,0,0,0,0,0,0,379,65,135,0,0,0,73,626,542,447,503,413,304,189,247,0,875,0,787,0,683,72,646,558,486,523,293,228,162,198,0,889,0,780,0,680,576,586,"Civilian, Pilot, Astrophysicist, Trill","male, organic, ds9, nonhuman, arjin, crew_max_rarity_4","It's... Interesting",2, 9, 8, 6, 8, , , 2, , , 350, 200, 125, 430, false,"Arjin",crew_portraits_cm_arjin_sm.png,arjin_crew
"Lt. Commander Icheb",4,5, 0,0,0,1272,207,433,471,101,151,980,141,310,0,0,0,0,0,0,147,744,282,0,0,33,10,199,97,75,820,608,296,159,0,235,727,385,0,0,79,30,260,159,153,801,606,414,230,0,193,323,"Civilian, Brunali, Borg, Astrophysicist, Prodigy, Innovator, Federation","male, organic, voy, icheb, crew_max_rarity_5","I Never Told",1, 10, 6, 10, 10, , , , , , 500, 150, 138, 415, false,"Icheb",crew_portraits_cm_icheb_lt_commander_sm.png,icheb_lt_commander_crew
"Tau",7,4, 0,0,0,342,72,156,894,130,308,0,0,0,651,109,220,0,0,0,850,488,0,646,0,149,574,321,517,359,125,299,546,0,468,783,517,0,690,0,191,509,357,468,394,223,367,583,0,521,553,683,"Crafty, Saboteur, Criminal, Scoundrel, Resourceful","male, organic, nonhuman, voy, tau, crew_max_rarity_4","I'd Hate to Make Your Life Difficult",0, 6, 8, 10, 10, 4, 1, , , , 315, 200, 90, 300, false,"Tau",crew_portraits_cm_tau_sm.png,tau_crew
"Age of Sail Troi",3,4, 353,76,161,0,0,0,0,0,0,0,0,0,596,150,298,776,208,426,818,790,756,429,68,0,0,584,248,0,666,310,543,211,52,757,749,706,325,51,0,0,500,161,0,573,170,420,93,41,540,344,"Human, Betazoid, Costumed, Empath, Counselor, Starfleet, Federation","ageofsail, nonhuman, female, organic, tng, troi, crew_max_rarity_4","Answer Him!",0, 9, 8, 6, 10, , , , , , 400, 230, 115, 450, false,"Troi",crew_portraits_cm_troi_ageofsail_sm.png,troi_ageofsail_crew
"North Star T'Pol",4,5, 1281,187,412,972,120,248,0,0,0,0,0,0,524,99,196,0,0,0,15,271,106,89,56,384,292,124,235,0,754,0,641,0,543,53,374,192,168,178,546,360,242,336,0,760,0,643,0,563,153,401,"Vulcan, Starfleet, Astrophysicist, Telepath, Costumed","nonhuman, female, organic, ent, first_officer, bridge_crew, tpol, crew_max_rarity_5","I've Confirmed They Are Human",1, 9, 4, 8, 8, , , , , , 465, 100, 90, 470, false,"T'Pol",crew_portraits_cm_tpol_north_star_sm.png,tpol_north_star_crew
"Riker Odan",4,5, 510,88,190,1290,189,408,0,0,0,0,0,0,998,92,252,0,0,0,37,699,636,201,586,151,155,21,99,0,489,0,334,0,293,82,701,637,400,592,267,210,96,183,0,691,0,565,0,506,168,459,"Human, Trill, Federation, Starfleet, Ambassador, Maverick, Gambler, Romantic","male, organic, tng, nonhuman, riker, crew_max_rarity_5","For the Greater Good",2, 10, 10, 8, 10, , , , , , 600, 115, 142, 350, false,"Riker",crew_portraits_cm_riker_odan_sm.png,riker_odan_crew
"Relaxed Number One",7,4, 339,52,129,673,73,166,0,0,0,0,0,0,914,136,356,0,0,0,316,827,800,293,750,558,398,89,348,0,496,0,348,0,304,493,810,770,340,723,759,501,189,454,0,519,0,360,0,345,556,766,"Federation, Starfleet, Human, Resourceful, Explorer, Musician, Casual","female, organic, dsc, bridge_crew, lieutenant, number_one, crew_max_rarity_4","I Am The Very Model Of A Modern Major General",0, 8, 8, 8, 10, , , , , , 450, 175, 150, 450, false,"Number One",crew_portraits_cm_number_one_relaxed_sm.png,dsc_number_one_relaxed_crew
"Claymore Scotty",5,5, 0,0,0,0,0,0,1006,106,234,1307,195,387,516,72,136,0,0,0,0,449,103,779,0,344,138,727,0,12,176,256,32,48,603,0,615,236,839,0,571,225,807,0,62,460,488,96,142,673,158,549,"Human, Starfleet, Federation, Jury Rigger, Duelist","male, organic, tos, scott, crew_max_rarity_5","This is War",0, 9, 8, 6, 8, , , , , , 375, 270, 275, 450, false,"Scotty",crew_portraits_cm_scotty_claymore_sm.png,scott_claymore_crew
"1701 Bashir",3,4, 0,0,0,364,57,135,595,123,240,0,0,0,0,0,0,814,174,316,844,613,0,0,333,285,571,839,119,502,681,33,0,219,366,835,599,0,0,316,296,545,819,137,477,663,67,0,194,339,620,624,"Human, Starfleet, Federation, Undercover Operative, Cyberneticist, Physician, Engineered, Tribbled","nonhuman, male, organic, ds9, bashir, crew_max_rarity_4","I'm a Doctor, Not a Historian",2, 8, 8, 6, 10, , , , , , 400, 100, 160, 475, false,"Bashir",crew_portraits_cm_bashir_1701_sm.png,bashir_1701_crew
"Seamus",10,4, 0,0,0,0,0,0,872,171,395,0,0,0,579,148,299,0,0,0,0,466,0,653,0,364,0,590,0,328,115,273,553,0,470,0,400,0,573,0,286,0,501,0,257,94,219,422,0,394,817,665,"Human, Hologram, Civilian, Romantic, Interrogator","organic, voy, male, seamus, artificial_life, crew_max_rarity_4","Saints Preserve Us",1, 7, 6, 6, 6, , , , 0, 2, 315, 165, 147, 450, false,"Seamus",crew_portraits_cm_seamus_sm.png,seamus_crew
"Mirror Keyla Detmer",7,5, 1029,154,348,0,0,0,1308,222,451,0,0,0,0,0,0,0,0,0,260,4,215,430,177,94,0,0,0,105,227,53,0,0,0,379,66,303,496,285,175,0,0,0,158,291,133,0,0,0,422,479,"Mirror Universe, Human, Terran Empire, Brutal","female, organic, dsc, detmer, crew_max_rarity_5","Terran Law Is Binding",0, 8, 8, 6, 12, 1, 0, 2, , , 400, 240, 105, 525, false,"Detmer",crew_portraits_cm_detmer_mirror_sm.png,dsc_detmer_mirror_crew
"Tee Time Doctor",2,4, 0,0,0,0,0,0,344,74,158,0,0,0,920,186,387,658,67,176,0,802,0,468,475,834,0,357,345,719,220,185,298,317,46,0,755,0,453,643,757,0,337,443,649,205,324,272,416,106,523,635,"Hologram, Federation, Musician, Starfleet, Costumed, Athlete, Physician, Human","nonhuman, male, artificial_life, voy, emh, crew_max_rarity_4","The Back Nine at Gedi Prime?",2, 9, 6, 10, 10, , , , , , 500, 200, 40, 305, false,"Doctor",crew_portraits_cm_emh_caddy_sm.png,emh_caddy_crew
