"Ahdar Ru'afo",6,5, 757,187,447,506,109,219,0,0,0,1362,69,227,0,0,0,0,0,0,101,505,18,555,329,675,49,684,415,170,0,0,178,73,0,55,340,43,374,147,612,183,652,371,592,0,0,646,379,0,323,406,"Son'a, Brutal, Villain, Survivalist, Resourceful","male, nonhuman, organic, tng, ruafo, crew_max_rarity_5","Not Joining Us For Dinner",0, 6, 10, 5, 14, 7, 0, , , , 585, 125, 160, 450, false,"Ru'afo",crew_portraits_cm_ruafo_sm.png,ruafo_crew
"Irumodic Syndrome Picard",3,4, 310,144,287,886,74,219,0,0,0,0,0,0,684,100,211,0,0,0,170,771,717,416,672,473,341,110,287,0,661,0,532,0,453,158,536,401,279,386,668,435,304,399,0,738,0,625,0,543,550,651,"Human, Civilian, Veteran, Cultural Figure, Federation, Gardener","male, tng, picard, organic, crew_max_rarity_4","Not an Invalid",2, 8, 12, 4, 12, , , , , , 230, 125, 145, 450, false,"Picard",crew_portraits_cm_picard_irumodic_sm.png,picard_irumodic_crew
"Diseased Changeling Founder",6,4, 751,148,310,0,0,0,0,0,0,0,0,0,458,239,483,248,88,214,494,551,433,230,153,0,0,588,539,0,668,728,550,493,267,445,504,364,54,90,0,0,195,390,0,271,559,132,370,56,714,194,"Changeling, Dominion, Desperate, Brutal","nonhuman, female, organic, ds9, femalechangeling, crew_max_rarity_4","I Wish You Hadn't Done That",0, 8, 6, 8, 12, , , , , , 300, 255, 140, 600, false,"Founder",crew_portraits_cm_changeling_diseased_sm.png,femalechangeling_diseased_crew
"Alternate Future Jadzia Dax",5,5, 0,0,0,1291,125,313,0,0,0,1002,118,267,419,83,187,0,0,0,200,0,296,811,0,200,26,85,132,298,845,0,65,167,657,480,0,481,754,0,465,98,200,292,471,794,0,177,283,590,331,601,"Federation, Starfleet, Exobiology, Astrophysicist, Trill, Pilot","nonhuman, female, organic, ds9, lieutenant_commander, bridge_crew, dax, crew_max_rarity_5","We're Losing Him!",1, 10, 8, 12, 10, , , , , , 200, 225, 155, 100, false,"J. Dax",crew_portraits_cm_jadzia_alternate_future_sm.png,dax_jadzia_future_crew
"Tourist Jadzia Dax",1,3, 526,86,206,210,29,101,0,0,0,0,0,0,346,55,154,0,0,0,505,686,625,531,569,920,627,638,562,0,895,0,826,0,717,492,689,617,507,572,897,609,643,552,0,886,0,773,0,672,954,951,"Federation, Starfleet, Trill, Casual, Romantic","nonhuman, female, organic, ds9, lieutenant, bridge_crew, dax, crew_max_rarity_3","Take It Easy",1, 6, 8, 4, 10, 1, 1, , , , 350, 220, 160, 190, false,"J. Dax",crew_portraits_cm_jadzia_tourist_sm.png,dax_jadzia_tourist_crew
"Amelia Earhart",3,5, 949,124,313,0,0,0,0,0,0,1327,145,467,351,108,511,0,0,0,365,456,5,200,280,0,126,687,0,112,766,0,28,34,553,461,526,21,99,376,0,198,287,0,229,389,0,9,113,231,68,103,"Human, Pilot, Explorer, Cultural Figure, Inspiring, Undercover Operative, Prisoner","female, organic, voy, earhart, crew_max_rarity_5","Take Her Out For a Spin",1, 8, 8, 8, 16, , , , , , 400, 100, 120, 1392, false,"Earhart",crew_portraits_cm_earhart_sm.png,amelia_earhart_crew
"Admiral Ross",8,4, 612,103,258,0,0,0,205,117,252,0,0,0,855,107,222,0,0,0,573,442,517,212,469,888,0,518,0,762,370,733,457,0,395,572,273,498,318,470,520,0,656,0,472,279,448,588,0,524,708,608,"Federation, Starfleet, Human, Communicator, Diplomat, Cultural Figure","male, organic, ds9, admiral, ross, crew_max_rarity_4","You're Dismissed",0, 7, 6, 5, 8, , , , , , 580, 250, 130, 240, true,"Ross",crew_portraits_cm_ross_admiral_sm.png,ross_admiral_crew
"Polywater Yar",8,5, 1134,155,377,0,0,0,381,109,217,0,0,0,955,183,367,0,0,0,227,147,183,58,145,779,0,340,0,670,188,634,276,0,259,336,199,266,86,251,593,0,368,0,534,162,512,302,0,299,359,247,"Human, Federation, Starfleet, Romantic, Desperate, Survivalist","female, organic, tng, bridge_crew, yar, crew_max_rarity_5","You Are Fully Functional, Aren't You?",0, 9, 2, 8, 12, 1, 0, , 1, 2, 335, 100, 70, 550, true,"Yar",crew_portraits_cm_yar_intoxicated_sm.png,yar_intoxicated_crew
"Gary Seven",1,5, 361,187,380,1275,217,685,737,333,712,0,0,0,0,0,0,0,0,0,33,157,647,745,598,1,108,142,76,244,409,177,0,0,0,5,6,235,445,225,1,72,101,70,25,75,20,0,0,0,6,4,"Human, Hero, Resourceful, Undercover Operative","organic, male, tos, gary_seven, crew_max_rarity_5","Interesting Experiences",1, 7, 15, 8, 10, 0, 1, , , , 375, 200, 200, 300, false,"Mr. Seven",crew_portraits_cm_gary_seven_sm.png,gary_seven_crew
"Reverend Phlox",4,5, 984,145,314,0,0,0,0,0,0,0,0,0,598,53,111,1058,236,615,305,408,263,163,3,0,0,666,128,0,749,120,633,83,38,441,499,360,395,4,0,0,860,81,0,917,70,824,26,55,159,190,"Denobulan, Civilian, Physician, Exobiology","male, organic, ent, phlox, crew_max_rarity_5","Rest In Peace",1, 10, 6, 10, 12, , , , , , 200, 205, 170, 100, false,"Phlox",crew_portraits_cm_phlox_reverend_sm.png,phlox_reverend_crew
"Yelgrun",7,4, 572,101,216,405,85,247,0,0,0,0,0,0,638,203,466,0,0,0,259,652,571,263,524,772,525,230,478,0,633,0,494,0,421,216,658,569,140,535,605,390,70,370,0,329,0,165,0,188,650,352,"Dominion, Vorta, Clone, Diplomat, Musician","male, ds9, yelgrun, nonhuman, crew_max_rarity_4","I Was Cloned",1, 5, 3, 6, 6, , , , , , 400, 265, 98, 275, true,"Yelgrun",crew_portraits_cm_yelgrun_sm.png,yelgrun_crew
"Alternate Future T'Pol",6,5, 1119,260,585,943,153,343,0,0,0,0,0,0,485,92,188,0,0,0,17,303,131,116,91,354,277,127,217,0,798,0,700,0,596,7,208,59,68,54,385,270,155,246,0,780,0,666,0,580,229,116,"Vulcan, Starfleet, Astrophysicist, Telepath","nonhuman, female, organic, ent, first_officer, bridge_crew, tpol, crew_max_rarity_5","You'll Never Fully Recover",1, 7, 10, 6, 12, 6, 0, , , , 600, 105, 120, 175, false,"T'Pol",crew_portraits_cm_tpol_alternate_future_sm.png,tpol_alternate_future_crew
"Ikat'ika",8,4, 656,53,124,0,0,0,758,199,388,0,0,0,0,0,0,0,0,0,612,208,553,685,511,450,0,0,0,399,579,341,0,0,0,853,249,778,865,731,260,0,0,0,232,399,197,0,0,0,880,869,"Jem'hadar, Dominion, Brutal, Veteran","nonhuman, male, organic, ds9, ikatika, crew_max_rarity_4","Victory is Life!",2, 9, 5, 8, 12, 5, 0, , , , 495, 105, 175, 575, false,"Ikat'ika",crew_portraits_cm_ikatika_sm.png,ikatika_crew
"Changeling Martok",7,5, 506,78,158,0,0,0,877,218,453,0,0,0,1062,249,546,0,0,0,731,179,670,135,623,298,0,266,0,276,31,212,213,0,207,758,168,707,118,652,180,0,144,0,162,6,137,92,0,121,283,75,"Klingon, Changeling, Veteran, Undercover Operative, Brutal, Dominion","nonhuman, male, organic, ds9, martok, crew_max_rarity_5","Sohk-vad",0, 9, 6, 6, 12, 7, 2, , , , 650, 15, 220, 250, false,"Martok",crew_portraits_cm_martok_changeling_sm.png,martok_changeling_crew
"Fleet Commander Martok",5,2, 296,64,200,0,0,0,270,38,135,0,0,0,148,29,71,0,0,0,872,608,805,772,756,896,0,926,0,770,843,739,908,0,787,707,523,663,648,612,842,0,907,0,723,779,698,887,0,767,1031,987,"Klingon, Duelist, Veteran","nonhuman, male, organic, ds9, martok, crew_max_rarity_2","Surprise Attack!",0, 3, 8, 8, 12, 0, 2, , , , 340, 140, 70, 125, false,"Martok",crew_portraits_cm_martok_fleet_commander_sm.png,martok_commander_crew
"Mirror Keiko",7,4, 670,212,435,567,92,234,0,0,0,0,0,0,385,76,146,0,0,0,108,545,424,367,372,622,431,349,380,0,864,0,778,0,679,52,329,153,191,140,614,395,366,373,0,863,0,753,0,651,705,485,"Human, Botanist, Saboteur, Undercover Operative, Mirror Universe, Terran Rebellion","female, organic, ds9, mirror, keiko, original, crew_max_rarity_4","Terrible Beauty",2, 7, 10, 10, 10, 4, 2, , , , 450, 230, 275, 125, false,"Keiko",crew_portraits_cm_keiko_mirror_sm.png,keiko_mirror_crew
"Professor Sato",3,5, 950,93,201,431,101,209,0,0,0,0,0,0,1517,61,123,0,0,0,112,498,378,36,320,763,516,63,469,0,240,0,94,0,110,267,687,614,528,570,637,413,432,384,0,901,0,799,0,698,284,866,"Human, Civilian, Starfleet, Prodigy, Communicator, Linguist","female, organic, ensign, bridge_crew, ent, sato, crew_max_rarity_5","Turn It Up",2, 10, 8, 8, 10, , , 2, , , 415, 300, 45, 280, false,"Sato",crew_portraits_cm_sato_professor_sm.png,sato_professor_crew
"EV Suit Burnham",5,5, 1324,89,299,369,115,391,877,169,472,0,0,0,0,0,0,0,0,0,48,51,147,347,106,64,496,745,448,294,460,230,0,0,0,71,108,457,622,437,23,265,417,240,191,333,158,0,0,0,236,147,"Federation, Starfleet, Astrophysicist, Human, Xenoanthropology, Resourceful, Duelist","female, evsuit, organic, dsc, bridge_crew, first_officer, commander, burnham, crew_max_rarity_5","Vulcan Hello",2, 7, 10, 10, 14, 6, 0, , , , 575, , 295, 100, false,"Burnham",crew_portraits_cm_burnham_evsuit_sm.png,dsc_burnham_ev_suit_crew
"Army Chaplain Odo",7,4, 342,69,173,0,0,0,628,77,162,0,0,0,764,172,363,0,0,0,826,414,766,365,717,593,0,514,0,525,184,479,449,0,390,742,474,694,261,638,737,0,385,0,635,225,622,317,0,314,675,668,"Changeling, Spiritual, Bajoran, Communicator, Constable, Undercover Operative","nonhuman, organic, ds9, odo, original, crew_max_rarity_4","Mysterious Ways",1, 6, 8, 8, 8, 3, 0, 3, , , 625, 105, 10, 440, false,"Odo",crew_portraits_cm_odo_chaplain_sm.png,odo_chaplain_crew
"Dr. Leonard McCoy",8,4, 0,0,0,562,96,254,0,0,0,0,0,0,0,0,0,746,141,392,638,0,0,0,356,616,427,635,70,0,0,361,0,240,396,595,0,0,0,256,575,377,626,75,0,0,265,0,162,303,900,788,"Human, Federation, Starfleet, Physician, Resourceful","male, organic, tos, lieutenant_commander, mccoy, crew_max_rarity_4","He's Dead, Jim",0, 4, 8, 10, 14, 4, 0, , , , 440, 60, 130, 1355, false,"McCoy",crew_portraits_cm_mccoy_leonard_sm.png,mccoy_leonard_crew
"Ensign Picard",7,4, 849,81,201,0,0,0,503,136,328,0,0,0,287,115,231,0,0,0,483,231,426,390,374,607,0,832,0,537,470,491,815,0,706,680,259,638,396,590,408,0,637,0,362,194,328,564,0,505,718,576,"Federation, Starfleet, Human, Desperate, Crafty","male, organic, tng, ensign, bridge_crew, picard, crew_max_rarity_4","Life Worth Living",1, 6, 12, 12, 12, 7, 0, , , , 580, 85, 20, 505, false,"Picard",crew_portraits_cm_ensign_picard_sm.png,picard_ensign_crew
"Elizabeth Dehner",9,5, 0,0,0,441,145,345,0,0,0,0,0,0,886,54,106,1152,158,446,677,0,0,599,128,656,454,149,37,0,632,133,492,90,27,410,0,0,884,188,400,276,254,32,0,920,194,828,112,132,387,424,"Human, Starfleet, Federation, Physician, Telekinetic","female, organic, tos, dehner, crew_max_rarity_5","Almost a God",2, 6, 12, 12, 20, 2, 0, , , , 400, , 110, 350, false,"Dehner",crew_portraits_cm_elizabeth_dehner_sm.png,dehner_elizabeth_crew
"Astrosciences Sulu",8,5, 969,84,207,1014,271,623,0,0,0,0,0,0,423,72,136,0,0,0,26,487,366,276,310,222,193,88,147,0,848,0,769,0,664,17,691,618,509,573,82,74,38,72,0,887,0,774,0,673,397,272,"Human, Federation, Starfleet, Pilot, Resourceful, Astrophysicist","male, organic, tos, lieutenant, bridge_crew, sulu, crew_max_rarity_5","Astrosciences Standing By",0, 7, 12, 12, 12, 4, 0, , , , 490, 80, 100, 340, false,"Sulu",crew_portraits_cm_sulu_astrosciences_sm.png,sulu_astrosciences_crew
"Commanding Officer Sisko",1,3, 433,11,23,0,0,0,487,28,78,0,0,0,234,12,34,0,0,0,843,548,780,710,733,780,0,914,0,671,671,635,898,0,779,940,845,882,949,828,908,0,926,0,774,925,748,912,0,787,984,1109,"Human, Federation, Starfleet, Bajoran, Cultural Figure, Inspiring, Chef","male, organic, ds9, captain, bridge_crew, sisko, crew_max_rarity_3","Surprise for the Dominion",2, 5, 3, 8, 11, , , , , , 215, 85, 135, 100, false,"Sisko",crew_portraits_cm_sisko_sm.png,sisko_captain_crew
"Age of Sail Data",6,5, 1171,186,446,0,0,0,0,0,0,844,125,269,527,127,243,0,0,0,194,326,21,106,114,0,333,647,0,406,730,0,64,232,516,226,344,28,126,153,0,341,602,0,462,672,0,110,274,484,324,267,"Android, Federation, Starfleet, Cyberneticist, Costumed, Explorer, Musician","ageofsail, nonhuman, male, tng, lieutenant_commander, bridge_crew, artificial_life, data, crew_max_rarity_5","Fun? Got it!",1, 8, 8, 5, 11, 1, 1, , , , 125, 200, 70, 500, false,"Data",crew_portraits_cm_data_ageofsail_sm.png,data_ageofsail_crew
"Commander Donatra",5,4, 580,238,631,0,0,0,434,191,463,0,0,0,318,60,178,0,0,0,469,216,414,389,357,579,0,853,0,515,462,468,840,0,727,77,11,52,74,48,198,0,764,0,176,143,148,727,0,629,700,56,"Romulan, Veteran, Crafty, Tactician, Resourceful","nonhuman, female, organic, donatra, tng, commander, crew_max_rarity_4","Let's Get To Work",0, 5, 3, 6, 6, , , , , , 450, 200, 143, 450, true,"Donatra",crew_portraits_cm_donatra_commander_sm.png,donatra_commander_crew
"Maid Marian",9,5, 0,0,0,0,0,0,904,152,302,0,0,0,1193,172,338,0,0,0,0,483,0,391,0,388,0,271,0,351,43,291,217,0,211,0,503,0,506,0,428,0,416,0,377,117,348,339,0,330,504,717,"Human, Scoundrel, Costumed, Exoarchaeology, Smuggler, Civilian, Prisoner","female, organic, tng, vash, crew_max_rarity_5","Can't Change Who I Am",0, 7, 6, 8, 14, 7, 2, , , , 350, 305, 88, 705, false,"Vash",crew_portraits_cm_vash_qpid_sm.png,vash_qpid_crew
"Tyler, Son of None",8,5, 489,58,198,0,0,0,1129,218,428,0,0,0,1009,171,229,0,0,0,740,132,681,198,634,215,0,351,0,198,32,142,290,0,269,720,170,677,360,624,208,0,564,0,186,79,155,493,0,459,292,345,"Human, Klingon, Federation, Starfleet, Gambler, Desperate, Tactician, Survivalist","male, organic, dsc, bridge_crew, tyler, voq, crew_max_rarity_5","War Within",1, 7, 12, 10, 14, 8, 4, , , , 500, 25, 128, 690, false,"Tyler",crew_portraits_cm_voq_as_ash_sm.png,dsc_tyler_voq_crew
"The Prophet",6,5, 388,148,324,0,0,0,995,127,251,0,0,0,1230,146,294,0,0,0,734,204,673,136,626,332,0,268,0,311,36,247,215,0,209,422,202,342,165,331,512,0,507,0,461,191,437,431,0,402,313,362,"Vulcan, Mirror Universe, Desperate, Terran Rebellion, Telepath, Interrogator","nonhuman, male, organic, sarek, dsc, crew_max_rarity_5","My Mind to Your Mind",1, 5, 0, 8, 8, , , , , , 375, 255, 68, 675, true,"Sarek",crew_portraits_cm_sarek_mirror_sm.png,dsc_sarek_mirror_crew
"EV Suit Seven of Nine",7,5, 489,108,272,950,307,664,800,149,338,0,0,0,0,0,0,0,0,0,51,235,619,725,562,18,198,281,154,404,588,349,0,0,0,6,191,468,631,445,10,52,80,50,345,507,303,0,0,0,378,48,"Borg, Human, Starfleet, Federation, Hunter, Astrophysicist","evsuit, female, organic, voy, seven, crew_max_rarity_5","This Lesson Is Terminated",2, 10, 10, 10, 12, , , , 1, 1, 565, 200, 195, 100, false,"Seven",crew_portraits_cm_seven_of_nine_ev_sm.png,seven_ev_suit_crew
"Tucker On-The-Ropes",7,5, 363,84,170,0,0,0,962,134,270,1179,197,429,0,0,0,0,0,0,802,248,46,837,689,358,183,0,0,25,491,267,196,86,0,727,318,55,765,629,477,184,0,0,35,613,407,207,101,0,372,381,"Human, Starfleet, Jury Rigger, Athlete, Gambler, Desperate","male, organic, ent, commander, tucker, original, crew_max_rarity_5","Rope-a-Dope",0, 7, 12, 10, 14, 4, 0, , , , 650, 305, 110, 375, false,"Trip",crew_portraits_cm_tucker_ropes_sm.png,tucker_boxing_crew
"Pugilist Q",6,4, 362,96,190,0,0,0,788,139,291,0,0,0,547,97,202,0,0,0,790,322,726,473,677,479,0,652,0,426,210,373,620,0,524,673,284,630,436,584,460,0,695,0,409,253,379,641,0,558,709,659,"Desperate, Crafty, Scoundrel, Athlete, Duelist, Costumed, Q Continuum","nonhuman, male, ds9, q_jdl, crew_max_rarity_4","Wonderfully Barbaric",0, 6, 6, 8, 10, 0, 1, , , , 450, 125, 50, 305, false,"Q",crew_portraits_cm_pugilist_q_sm.png,q_boxing_crew
"Mugato",10,5, 823,189,405,0,0,0,1033,224,688,0,0,0,436,122,226,0,0,0,404,70,365,258,309,196,0,748,0,183,91,122,721,0,620,271,12,201,152,187,63,0,635,0,57,34,49,562,0,503,336,38,"Mugato, Brutal, Hunter, Primal","nonhuman, male, tos, mugato, crew_max_rarity_5","Private Little War",2, 7, 4, 5, 10, 7, 0, , , , 465, 325, 63, 500, true,"Mugato",crew_portraits_cm_mugato_sm.png,mugato_crew
"Gloria",7,5, 879,205,396,0,0,0,0,0,0,0,0,0,1065,278,536,470,99,221,348,445,313,52,29,0,0,260,424,0,352,579,205,394,44,259,373,193,19,41,0,0,133,374,0,205,531,82,341,37,289,67,"Communicator, Civilian, Counselor, Bartender, Empath, Costumed, El-Aurian","nonhuman, female, organic, tng, guinan, crew_max_rarity_5","Gloria From Cleveland",0, 7, 6, 12, 12, 0, 1, , , , 1540, 160, 110, 450, false,"Guinan",crew_portraits_cm_guinan_gloria_sm.png,guinan_gloria_crew
"Minuet",9,5, 911,162,353,0,0,0,0,0,0,0,0,0,952,292,766,0,0,0,363,452,330,55,278,0,0,259,0,0,348,0,204,0,201,356,443,282,10,265,0,0,52,0,0,86,0,28,0,48,488,143,"Hologram, Saboteur, Communicator, Resourceful, Human, Romantic, Desperate, Crafty","female, minuet, tng, crew_max_rarity_5","As Real As You Need",1, 9, 4, 8, 8, 3, 0, , , , 550, 225, 100, 390, true,"Minuet",crew_portraits_cm_minuet_sm.png,minuet_crew
"Lady Beverly",9,4, 350,91,152,0,0,0,0,0,0,0,0,0,787,168,267,595,90,167,819,791,757,377,245,0,0,531,370,0,616,496,477,349,88,746,738,696,334,295,0,0,519,431,0,594,608,441,407,173,707,743,"Human, Caregiver, Hologram, Romantic","female, organic, tng, commander, crusher, crew_max_rarity_4","Manners, Manners!",2, 8, 10, 6, 10, , , , , , 500, 200, 180, 425, false,"Crusher",crew_portraits_cm_lady_beverly_sm.png,crusher_lady_crew
"Tuxedo Nog",6,5, 966,153,284,0,0,0,0,0,0,481,65,198,1098,260,551,0,0,0,338,437,70,45,259,0,494,248,0,636,336,0,38,413,195,463,530,130,43,378,0,471,135,0,618,210,0,27,405,107,279,180,"Ferengi, Costumed, Federation, Starfleet, Inspiring, Hero, Desperate, Veteran","nonhuman, male, organic, ds9, nog, crew_max_rarity_5","Welcome To Las Vegas",1, 8, 8, 8, 10, 0, 1, , , , 540, 255, 210, 325, false,"Nog",crew_portraits_cm_nog_nines_sm.png,nog_tuxedo_crew
"Tarquin",10,4, 420,184,409,377,40,126,0,0,0,0,0,0,823,119,244,0,0,0,372,658,583,259,532,844,571,265,513,0,615,0,475,0,410,135,379,202,144,191,867,579,397,531,0,680,0,543,0,488,734,554,"Telepath, Desperate, Resourceful, Communicator","organic, ent, nonhuman, tarquin, crew_max_rarity_4","Exile",1, 7, 8, 10, 12, 5, 0, , , , 580, 250, 110, 540, false,"Tarquin",crew_portraits_cm_tarquins_species_sm.png,tarquin_crew
"Losira",10,2, 256,23,88,0,0,0,313,68,187,155,11,29,0,0,0,0,0,0,910,635,743,923,793,852,639,0,0,629,901,697,914,523,0,913,595,811,926,795,711,639,0,0,578,800,602,915,522,0,1045,1044,"Hologram, Kalandan, Brutal","nonhuman, female, tos, losira, crew_max_rarity_2","I Am For You",0, 2, 8, 10, 10, 4, 0, , , , 300, 200, 100, 375, false,"Losira",crew_portraits_cm_losira_sm.png,losira_crew
"Commander Barclay",5,4, 748,130,322,357,65,143,0,0,0,604,82,271,0,0,0,0,0,0,217,556,73,597,384,842,228,836,511,503,0,0,562,327,0,205,509,85,551,356,807,237,802,485,514,0,0,555,315,0,704,675,"Starfleet, Innovator, Communicator, Quantum Mechanics, Human, Federation","male, organic, voy, commander, barclay, crew_max_rarity_4","To The Journey",1, 6, 4, 8, 10, 2, 0, , , , 465, 200, 210, 375, true,"Barclay",crew_portraits_cm_barclay_commander_sm.png,barclay_commander_crew
"Data V",6,5, 0,0,0,976,142,307,0,0,0,1144,195,401,528,77,141,0,0,0,359,0,173,753,0,344,31,120,211,201,783,0,41,99,577,460,0,224,830,0,454,36,239,285,249,877,0,83,127,662,322,425,"Android, Federation, Starfleet, Cyberneticist, Musician, Costumed, Royalty","nonhuman, male, tng, lieutenant_commander, bridge_crew, artificial_life, data, crew_max_rarity_5","He Appears But A Man",1, 7, 6, 6, 6, , , , , , 590, 200, 60, 265, true,"Data",crew_portraits_cm_data_henry_sm.png,data_henry_crew
"Phlox, Au Naturel",6,5, 0,0,0,1173,186,510,0,0,0,454,83,279,0,0,0,884,160,398,196,0,665,0,282,194,55,251,22,621,0,263,686,21,292,186,0,516,0,232,175,34,209,15,503,0,240,541,19,287,282,125,"Denobulan, Civilian, Physician, Exobiology, Resourceful, Casual","male, organic, ent, phlox, crew_max_rarity_5","I'm A Physician, Not An Engineer!",1, 7, 12, 6, 12, 2, 0, 2, , , 515, 195, 140, 450, false,"Phlox",crew_portraits_cm_phlox_natural_sm.png,phlox_natural_crew
"Lt. Commander Jack Crusher",5,3, 486,91,207,335,24,78,0,0,0,0,0,0,0,0,0,0,0,0,470,711,654,752,606,890,606,877,542,0,0,0,0,0,0,515,683,610,714,564,913,625,905,562,0,0,0,0,0,0,1027,1052,"Starfleet, Federation, Hologram, Human, Romantic, Inspiring","lieutenant_commander, male, tng, jack, crew_max_rarity_3","Duty and Honor",0, 6, 8, 10, 16, , , , 1, 2, 550, 100, 125, 505, false,"Jack",crew_portraits_cm_jackcrusher_sm.png,jack_crusher_crew
"Wedding Day Quark",7,4, 584,104,246,0,0,0,278,83,181,0,0,0,661,228,469,0,0,0,602,457,543,247,504,877,0,530,0,754,367,722,476,0,411,585,358,513,111,480,696,0,212,0,609,119,593,150,0,171,731,347,"Ferengi, Klingon, Scoundrel, Desperate, Romantic, Gambler","nonhuman, male, organic, ds9, quark, crew_max_rarity_4","Quark, Slayer of Klingons!",0, 7, 12, 10, 14, 4, 2, , , , 150, 75, 70, 575, false,"Quark",crew_portraits_cm_quark_wedding_day_sm.png,quark_wedding_day_crew
"Fennim",7,5, 0,0,0,817,251,462,0,0,0,0,0,0,1125,225,461,406,100,369,391,0,0,380,600,372,284,32,63,0,354,567,207,391,43,179,0,0,333,341,167,128,8,21,0,304,336,154,204,33,321,45,"Communicator, Scoundrel, Prodigy, Innovator, Thief","nonhuman, male, organic, voy, fennim, crew_max_rarity_5","We Are Already Proceeding",1, 7, 8, 8, 12, 6, 0, , , , 400, 100, 120, 415, false,"Fennim",crew_portraits_cm_fennim_sm.png,fennim_crew
"Lucille Davenport",6,5, 991,98,213,448,121,258,0,0,0,0,0,0,1179,219,430,0,0,0,96,470,350,50,297,711,479,76,432,0,334,0,189,0,190,183,667,585,149,544,522,350,60,323,0,352,0,184,0,203,295,333,"Starfleet, Federation, Costumed, Resourceful, Romantic, Human","female, organic, voy, captain, bridge_crew, janeway, crew_max_rarity_5","Walking On Your Grave",1, 10, 8, 10, 10, , , , , , 575, 200, 110, 300, false,"Janeway",crew_portraits_cm_janeway_davenport_sm.png,janeway_davenport_crew
"Captain Silva La Forge",10,5, 1059,259,606,0,0,0,408,149,309,0,0,0,1026,68,156,0,0,0,193,117,154,56,113,697,0,423,0,617,182,574,366,0,317,81,38,54,78,50,417,0,781,0,370,294,339,752,0,650,297,139,"Human, Federation, Starfleet, Explorer, Tactician","female, organic, tng, silva, captain, bridge_crew, crew_max_rarity_5","There's No Time To Explain",0, 8, 10, 8, 14, 8, 4, , , , 335, 100, 128, 450, false,"Silva",crew_portraits_cm_silva_captain_sm.png,silva_captain_crew
"Michael Sullivan",10,4, 0,0,0,0,0,0,0,0,0,0,0,0,505,146,319,743,167,351,0,0,0,696,366,0,0,629,288,0,718,370,598,249,87,0,0,0,553,274,0,0,473,230,0,544,280,391,172,64,898,709,"Bartender, Hologram, Human, Communicator, Civilian, Romantic","nonhuman, male, sullivan_michael, voy, crew_max_rarity_4","An Optimist Are You?",0, 6, 8, 8, 12, 7, 0, , , , 565, 220, 163, 390, false,"Sullivan",crew_portraits_cm_sullivan_michael_sm.png,sullivan_michael_crew
"Mother Horta",8,4, 0,0,0,0,0,0,697,271,557,0,0,0,561,159,310,0,0,0,0,492,0,658,0,402,0,594,0,363,130,301,557,0,473,0,214,0,550,0,91,0,466,0,89,29,71,386,0,367,842,353,"Caregiver, Primal, Silicon Lifeform, Saboteur, Desperate","nonhuman, organic, tos, horta, crew_max_rarity_4","NO KILL I",0, 7, 8, 5, 14, 1, 0, , , , 670, 200, 100, 300, false,"Horta",crew_portraits_cm_horta_sm.png,horta_crew
"Musketeer Picard",6,5, 485,74,148,0,0,0,1111,248,540,0,0,0,815,231,455,0,0,0,756,125,694,252,648,186,0,411,0,175,34,117,354,0,308,786,116,728,169,678,104,0,222,0,106,5,86,155,0,177,319,77,"Hologram, Human, Duelist, Hero, Inspiring, Tactician","male, nonhuman, tng, picard, crew_max_rarity_5","En Garde",2, 7, 4, 6, 10, 5, 0, , , , 550, 200, 103, 365, true,"Picard",crew_portraits_cm_picard_musketeer_sm.png,picard_musketeer_crew
"Covert Operative Leland",7,5, 369,163,346,0,0,0,1061,279,572,0,0,0,880,209,376,0,0,0,735,124,674,231,627,197,0,395,0,185,35,126,339,0,295,365,30,293,80,273,84,0,320,0,81,10,65,258,0,266,291,24,"Section 31, Undercover Operative, Crafty, Resourceful, Human","male, organic, dsc, leland, crew_max_rarity_5","Welcome To Section 31",0, 8, 8, 5, 12, 1, 0, 2, , , 250, 230, 163, 390, false,"Leland",crew_portraits_cm_dsc_leland_sec31_sm.png,dsc_leland_sec31_crew
"H.M.S. Pinafore Data",6,5, 1022,101,247,440,98,198,0,0,0,1180,172,449,0,0,0,0,0,0,95,425,14,472,247,762,61,781,468,186,0,0,198,87,0,224,614,38,661,488,662,69,697,397,225,0,0,218,107,0,308,413,"Android, Starfleet, Federation, Cyberneticist, Resourceful, Musician","nonhuman, male, tng, lieutenant_commander, bridge_crew, artificial_life, data, crew_max_rarity_5","A British Tar",2, 8, 12, 10, 14, 4, 0, , , , 300, 200, 100, 325, false,"Data",crew_portraits_cm_data_insurrection_sm.png,data_insurrection_crew
"Commodore Robert April",10,5, 1099,233,504,0,0,0,447,125,261,0,0,0,866,185,377,0,0,0,206,123,164,62,126,692,0,420,0,612,180,568,364,0,316,143,84,103,29,92,505,0,350,0,452,120,431,287,0,290,316,84,"Veteran, Human, Starfleet, Maverick, Explorer","male, organic, tos, april_robert, captain, crew_max_rarity_5","Into The Heart Of The Nova",0, 9, 10, 8, 10, , , , 2, 2, 450, 100, 80, 490, false,"April",crew_portraits_cm_april_commodore_sm.png,april_commodore_crew
"Lt. Commander Airiam",8,4, 586,102,207,738,168,356,0,0,0,0,0,0,399,37,71,0,0,0,104,642,559,477,515,492,353,275,299,0,890,0,817,0,709,99,670,587,597,546,351,259,272,226,0,954,0,882,0,762,725,736,"Federation, Starfleet, Astrophysicist, Resourceful, Prodigy, Human, Engineered","female, organic, dsc, bridge_crew, lieutenant_commander, airiam, crew_max_rarity_4","Engaging Spore Drive",0, 8, 4, 8, 14, , , , 1, 2, 525, 105, 125, 490, false,"Airiam",crew_portraits_cm_dsc_airiam_ltcmdr_sm.png,dsc_airiam_ltcmdr_crew
"Joseph Sisko",10,5, 0,0,0,988,133,272,0,0,0,0,0,0,1006,317,644,0,0,0,376,0,0,376,0,353,276,28,216,0,344,0,200,0,198,518,0,0,154,0,490,332,10,309,0,123,0,43,0,71,487,310,"Human, Resourceful, Caregiver, Chef, Federation, Civilian, Communicator","male, organic, ds9, joseph, crew_max_rarity_5","Life Is Full Of Choices",1, 8, 8, 8, 8, 3, 0, 3, , , 425, 280, 118, 215, false,"Joseph",crew_portraits_cm_joseph_chef_sm.png,joseph_chef_crew
"Prince Bashir",6,5, 1018,267,646,0,0,0,0,0,0,0,0,0,923,175,328,492,78,193,204,332,162,51,14,0,0,393,425,0,488,580,334,396,80,63,167,45,18,6,0,0,426,417,0,515,592,351,397,128,287,85,"Human, Starfleet, Federation, Royalty, Costumed, Physician, Engineered","nonhuman, male, organic, ds9, bashir, original, crew_max_rarity_5","This Is Where Heroes Are Made",0, 8, 6, 6, 14, 7, 2, , , , 300, 225, 210, 350, false,"Bashir",crew_portraits_cm_bashir_prince_sm.png,bashir_prince_crew
"Captain Spock",6,5, 1058,253,578,1025,101,226,0,0,0,0,0,0,479,103,211,0,0,0,23,333,163,132,123,356,278,125,218,0,787,0,682,0,580,18,217,67,61,59,613,394,261,372,0,733,0,616,0,537,293,193,"Starfleet, Federation, Exobiology, Musician, Astrophysicist, Human, Vulcan, Telepath","nonhuman, male, organic, tos, spock, captain, spock_tos, crew_max_rarity_5","Logic Is The Beginning Of Wisdom",1, 7, 8, 10, 12, 0, 1, , , , 415, 150, 127, 300, false,"Spock",crew_portraits_cm_spock_captain_sm.png,spock_captain_crew
