"Nyota Uhura",9,5, 899,74,127,0,0,0,536,63,125,0,0,0,1050,240,468,0,0,0,785,450,715,148,585,1076,0,482,0,986,184,874,401,0,342,1247,888,1185,232,1068,1260,0,313,0,1108,212,1024,248,0,209,743,920,"Human, Federation, Starfleet, Communicator, Resourceful, Musician","female, organic, tos, uhura, crew_max_rarity_5","Alameda Express",1, 8, 4, 10, 10, , , , , , 115, 15, 167, 565, false,"Uhura",crew_portraits_cm_uhurastiv_sm.png,uhura_stiv_crew
"Katra McCoy",7,4, 0,0,0,325,76,166,0,0,0,0,0,0,458,170,347,790,121,352,1297,0,0,1111,579,1294,994,720,218,0,1150,588,959,385,147,1164,0,0,738,495,1128,839,268,166,0,743,497,535,296,81,1232,735,"Federation, Starfleet, Vulcan, Desperate, Human, Physician, Compromised","male, organic, tos, mccoy, crew_max_rarity_4","Steps of Mount Seleya",1, 6, 4, 8, 8, 6, 0, , , , 450, 190, 53, 280, true,"McCoy",crew_portraits_cm_mccoy_katra_sm.png,mccoy_katra_crew
"Katrine",7,5, 1050,271,589,525,36,110,867,200,373,0,0,0,0,0,0,0,0,0,104,123,329,603,229,147,867,1165,718,584,870,479,0,0,0,65,30,95,269,64,231,1009,1311,847,420,655,322,0,0,0,660,167,"Human, Federation, Starfleet, Crafty, Desperate, Gambler, Saboteur, Undercover Operative, Costumed","female, organic, voy, janeway, crew_max_rarity_5","Leave The War Outside",0, 7, 6, 8, 14, 4, 2, , , , 315, 385, 80, 650, false,"Janeway",crew_portraits_cm_janeway_tuxedo_sm.png,janeway_tuxedo_crew
"M-113 Creature",8,4, 0,0,0,382,126,262,665,45,92,0,0,0,797,102,202,0,0,0,1180,1000,0,949,0,469,887,436,738,844,368,738,812,0,664,840,1281,0,1107,0,538,569,348,479,1155,930,1069,991,0,832,1146,1328,"M-113 Creature, Desperate, Exobiology, Shapeshifter, Telepath, Crafty","nonhuman, female, tos, salt_vampire, organic, crew_max_rarity_4","I Hunger",0, 6, 8, 3, 10, 1, 0, , , , 240, 145, 93, 560, true,"M-113 Creature",crew_portraits_cm_m113_sm.png,salt_vampire_crew
"Lal",10,4, 0,0,0,0,0,0,0,0,0,879,63,134,507,140,325,0,0,0,0,0,733,1094,0,0,576,975,0,713,1137,0,198,405,791,0,0,1195,830,0,0,937,719,0,1100,846,0,293,763,542,1417,1436,"Android, Federation, Prodigy, Bartender, Romantic, Civilian","nonhuman, female, tng, artificial_life, lal, crew_max_rarity_4","Reason For Being",0, 8, 6, 4, 8, , , , , , 450, 215, 77, 575, false,"Lal",crew_portraits_cm_lal_sm.png,lal_crew
"Commander Nevesa",10,4, 660,134,471,0,0,0,0,0,0,0,0,0,586,92,237,0,0,0,810,885,736,438,611,0,0,957,0,0,1120,0,928,0,774,391,560,331,218,254,0,0,982,0,0,1110,0,925,0,787,1418,1212,"Crafty, Romantic, Romulan, Resourceful","female, nonhuman, organic, tos, nevesa, crew_max_rarity_4","Hidden in Plain Sight",1, 7, 10, 8, 14, 1, 2, , , , 290, 310, 70, 565, false,"Nevesa",crew_portraits_cm_romulancommander_sm.png,nevesa_crew
"Mirror Bashir",8,5, 0,0,0,0,0,0,1101,249,531,829,186,403,0,0,0,0,0,0,0,541,659,0,0,369,517,0,0,53,562,235,704,345,0,0,364,381,0,0,172,317,0,0,11,311,120,417,172,0,830,382,"Human, Scoundrel, Engineered, Desperate, Saboteur, Survivalist, Mirror Universe, Terran Rebellion","nonhuman, male, organic, ds9, bashir, crew_max_rarity_5","I Owed You That",0, 10, 10, 12, 10, , , , , , 415, 55, 345, 675, false,"Bashir",crew_portraits_cm_bashir_mirror_sm.png,bashir_mirror_crew
"The Keeper",8,5, 526,27,75,922,357,755,0,0,0,0,0,0,0,0,0,945,149,458,109,1158,1109,1251,51,399,298,471,24,0,0,364,0,235,449,16,1298,1292,1411,159,41,33,49,3,0,0,297,0,157,336,642,78,"Talosian, Crafty, Exobiology, Quantum Mechanics, Telepath, Explorer, Shapeshifter, Interrogator","nonhuman, organic, male, tos, keeper, crew_max_rarity_5","A Curious Species",1, 8, 4, 10, 16, 5, 0, , , , 350, , 63, 115, false,"The Keeper",crew_portraits_cm_talosian_keeper_sm.png,talosian_keeper_crew
"Kilana",9,4, 506,128,298,0,0,0,0,0,0,0,0,0,797,160,341,0,0,0,985,1027,923,403,805,0,0,809,0,0,965,0,755,0,618,761,835,677,221,591,0,0,643,0,0,771,0,563,0,471,1401,1229,"Vorta, Clone, Crafty, Dominion, Scoundrel","nonhuman, female, organic, ds9, kilana, crew_max_rarity_4","For The Founders!",1, 7, 10, 10, 16, 6, 0, , , , 215, 275, 128, 560, false,"Kilana",crew_portraits_cm_kilana_sm.png,kilana_crew
"Talos IV Spock",4,3, 413,37,141,178,29,103,514,97,197,0,0,0,0,0,0,0,0,0,958,759,1140,1281,1025,798,1042,1360,871,937,1195,828,0,0,0,981,737,1215,1340,1102,738,1021,1319,855,911,1170,831,0,0,0,1461,1470,"Federation, Starfleet, Exobiology, Astrophysicist, Human, Vulcan, Telepath, Musician","nonhuman, male, organic, tos, spock, crew_max_rarity_3","We've Lost The Captain",0, 5, 10, 8, 8, , , , , , 690, 10, 105, 450, false,"Spock",crew_portraits_cm_spock_pilot_sm.png,spock_pilot_crew
"Author Doctor",8,4, 0,0,0,0,0,0,0,0,0,0,0,0,729,159,394,625,86,287,0,0,0,941,718,0,0,837,513,0,997,682,788,481,124,0,0,0,707,690,0,0,554,488,0,691,682,483,453,100,1388,1237,"Hologram, Human, Federation, Musician, Starfleet, Diplomat, Physician, Writer","nonhuman, male, artificial_life, voy, emh, crew_max_rarity_4","A Single Proton Flares",2, 8, 4, 4, 8, 3, 0, 2, , , 555, 100, 60, 225, false,"Doctor",crew_portraits_cm_emh_writer_sm.png,emh_writer_crew
"Musketeer La Forge",7,5, 436,58,138,0,0,0,1116,313,633,1009,92,237,0,0,0,0,0,0,1185,207,183,1262,1009,290,474,0,0,40,484,178,635,296,0,1259,101,468,1316,1080,90,635,0,0,15,163,59,921,509,0,599,236,"Hologram, Human, Duelist, Hero, Inspiring, Cyberneticist, Maverick, Veteran, Tactician","male, nonhuman, artificial_life, tng, laforge, crew_max_rarity_5","All For One",2, 9, 6, 10, 10, 3, 0, , , , 165, 70, 237, 500, true,"La Forge",crew_portraits_cm_laforge_musketeer_sm.png,laforge_musketeer_crew
"Ilia Probe",10,5, 0,0,0,1211,198,426,0,0,0,0,0,0,1023,48,101,0,0,0,354,0,0,881,0,366,285,71,200,0,917,0,706,0,578,386,0,0,1371,0,377,285,257,222,0,1410,0,1288,0,1111,829,1383,"Deltan, Romantic, Communicator, Probe, Android","female, nonhuman, artificial_life, tos, ilia, crew_max_rarity_5","Oath Of Celibacy",1, 10, 12, 8, 8, , , , , , 600, 100, 140, 440, false,"Ilia",crew_portraits_cm_ilia_probe_sm.png,ilia_probe_crew
"Romulan Data",8,5, 0,0,0,478,77,141,0,0,0,1153,185,399,969,142,279,0,0,0,1173,0,341,819,0,1154,102,263,725,376,848,0,45,148,514,1218,0,394,927,0,1188,149,420,737,411,974,0,64,181,655,680,739,"Android, Starfleet, Federation, Cyberneticist, Undercover Operative, Musician, Romulan","nonhuman, male, tng, artificial_life, data, crew_max_rarity_5","No Regrets",2, 7, 6, 8, 14, 5, 2, , , , 500, 150, 40, 300, false,"Data",crew_portraits_cm_data_romulan_sm.png,data_romulan_crew
"Zhian'tara Odo",7,5, 899,184,356,0,0,0,535,72,148,0,0,0,1279,113,225,0,0,0,655,334,594,119,470,1044,0,463,0,962,160,848,388,0,330,514,384,437,256,357,1159,0,970,0,1048,679,964,913,0,775,619,902,"Changeling, Communicator, Bajoran, Trill, Constable, Investigator, Shapeshifter","nonhuman, male, organic, ds9, odo, dax, crew_max_rarity_5","It's Better This Way",0, 6, 6, 10, 12, 4, 0, , , , 580, 225, 5, 440, true,"Odo",crew_portraits_cm_odo_curzon_sm.png,odo_curzon_crew
"Gaia Odo",3,2, 0,0,0,0,0,0,260,24,83,0,0,0,384,54,134,0,0,0,0,1291,0,1313,0,1348,0,1240,0,1179,1085,1085,1220,0,1057,0,1293,0,1331,0,1350,0,1253,0,1176,1172,1086,1238,0,1065,1573,1601,"Changeling, Bajoran, Constable, Romantic, Communicator, Shapeshifter","nonhuman, male, organic, ds9, odo, crew_max_rarity_2","You Have To Go Home",2, 3, 10, 12, 10, 0, 2, , , , 630, 135, 58, 315, false,"Odo",crew_portraits_cm_odo_future_sm.png,odo_future_crew
"Prisoner O'Brien",6,4, 0,0,0,0,0,0,583,83,187,694,244,503,447,11,21,0,0,0,0,1019,685,1330,0,938,550,1256,0,174,828,760,350,367,1072,0,1080,174,1437,0,1035,169,1371,0,65,1152,865,168,62,1177,1171,1003,"Human, Starfleet, Federation, Prisoner, Desperate, Survivalist, Brutal, Jury Rigger","male, organic, ds9, obrien, crew_max_rarity_4","It's Real To Me",0, 7, 4, 14, 16, 5, 0, , , , 400, 80, 85, 525, false,"O'Brien",crew_portraits_cm_obrien_prisoner_sm.png,obrien_prisoner_crew
"Lieutenant Commander Saru",7,2, 274,21,92,349,62,179,0,0,0,0,0,0,0,0,0,0,0,0,911,1286,1275,1391,1159,1273,959,1261,807,0,0,0,0,0,0,901,1290,1280,1401,1164,1129,841,1154,694,0,0,0,0,0,0,1574,1580,"Kelpien, Federation, Starfleet, Exobiology, Survivalist","male, nonhuman, organic, dsc, saru, crew_max_rarity_2","Kelpien Instincts",2, 2, 6, 6, 12, 6, 0, , , , 77, 100, 75, 570, false,"Saru",crew_portraits_cm_dsc_saru_lieutenant_sm.png,dsc_saru_lieutenant_crew
"T'Mir",7,4, 686,184,403,0,0,0,0,0,0,0,0,0,557,137,298,0,0,0,807,879,732,409,606,0,0,941,0,0,1104,0,912,0,761,444,595,379,161,300,0,0,806,0,0,946,0,724,0,625,1404,1064,"Vulcan, Telepath, Survivalist, Resourceful, Civilian, High Command","nonhuman, female, organic, ent, tmir, crew_max_rarity_4","What if you lose?",0, 7, 4, 4, 16, 1, 0, , , , 440, 100, 130, 1815, false,"T'Mir",crew_portraits_cm_tmir_sm.png,tmir_crew
"Lieutenant Arex Na Eth",9,4, 631,183,415,572,85,202,0,0,0,0,0,0,322,105,207,0,0,0,250,894,747,634,619,957,698,680,570,0,1351,0,1226,0,1061,109,581,355,228,276,1019,735,485,615,0,1139,0,970,0,811,1261,775,"Edosian, Starfleet, Federation, Musician, Pilot, Explorer, Astrophysicist, Playful, Compromised","nonhuman, male, organic, tas, arex, crew_max_rarity_4","This Is No Joke",1, 9, 10, 10, 12, , , , , , 475, 155, 293, 615, false,"Arex",crew_portraits_cm_arex_animated_sm.png,arex_lute_crew
"Temporal Prisoner Chakotay",8,5, 0,0,0,0,0,0,1166,134,414,1041,68,201,0,0,0,610,10,52,0,553,585,0,921,396,467,0,653,52,591,39,627,35,902,0,637,1022,0,1196,480,751,0,879,164,686,262,1051,507,1170,632,1273,"Human, Desperate, Federation, Marksman, Saboteur, Resourceful, Prisoner, Displaced","male, organic, voy, chakotay, crew_max_rarity_5","Timeline Triage",2, 7, 8, 6, 12, 7, 0, , , , 780, 230, 80, 190, false,"Chakotay",crew_portraits_cm_chakotay_shattered_sm.png,chakotay_shattered_crew
"Laborer Spock",6,5, 0,0,0,1205,157,321,0,0,0,971,144,315,0,0,0,0,0,0,382,0,550,0,0,405,42,475,226,552,0,0,596,272,0,665,0,604,0,0,629,78,698,369,611,0,0,639,314,0,828,1227,"Federation, Starfleet, Exobiology, Astrophysicist, Human, Vulcan, Telepath, Jury Rigger, Communicator, Thief, Resourceful, Musician","nonhuman, male, organic, tos, spock, crew_max_rarity_5","Stone Knives and Bear Skins",1, 10, 4, 8, 8, 3, 0, , , , 540, 200, 80, 350, true,"Spock",crew_portraits_cm_spock_janitor_sm.png,spock_janitor_crew
"First Officer Burnham",7,5, 1359,88,294,944,207,478,667,50,101,0,0,0,0,0,0,0,0,0,24,180,283,545,181,90,392,587,301,837,1118,733,0,0,0,50,655,761,968,662,150,233,364,183,1145,1404,1062,0,0,0,243,753,"Federation, Starfleet, Astrophysicist, Human, Xenoanthropology, Resourceful","female, organic, dsc, burnham, crew_max_rarity_5","We Need To Strike First!",1, 8, 12, 5, 10, 1, 0, 2, , , 475, 70, 85, 740, false,"Burnham",crew_portraits_cm_dsc_burnham_first_officer_sm.png,dsc_burnham_first_officer_crew
"Rura Penthe Kirk",7,5, 0,0,0,0,0,0,1337,197,391,0,0,0,854,230,569,0,0,0,0,441,0,751,0,222,0,597,0,237,21,133,515,0,437,0,593,0,351,0,417,0,220,0,400,20,304,157,0,154,760,368,"Human, Federation, Starfleet, Romantic, Inspiring, Duelist, Desperate, Survivalist, Criminal, Prisoner","male, organic, tos, kirk, crew_max_rarity_5","Aim for the 'Knee'",2, 7, 6, 6, 12, 1, 2, , , , 550, 230, 50, 625, false,"Kirk",crew_portraits_cm_kirk_rura_penthe_sm.png,kirk_rura_penthe_crew
"Cadet Wesley Crusher",10,4, 0,0,0,745,160,385,0,0,0,682,85,188,0,0,0,0,0,0,788,0,817,0,0,766,145,842,447,782,0,0,889,466,0,527,0,1014,0,0,513,145,584,306,940,0,0,1045,619,0,1380,1336,"Human, Federation, Starfleet, Pilot, Prodigy","male, organic, tng, wesley, crew_max_rarity_4","Duty To The Truth",1, 6, 10, 10, 12, 4, 0, , , , 300, 200, 110, 100, false,"Wesley",crew_portraits_cm_wesley_crusher_cadet_sm.png,wesley_cadet_crew
"Smitten Jean-Luc Picard",8,5, 1059,98,163,0,0,0,0,0,0,0,0,0,1122,343,651,0,0,0,606,733,548,74,433,0,0,346,0,0,467,0,266,0,223,1079,1091,1039,49,920,0,0,109,0,0,145,0,68,0,78,777,679,"Federation, Starfleet, Human, Romantic, Inspiring, Communicator, Musician, Playful","male, organic, tng, picard, crew_max_rarity_5","My Love Is a Fever",0, 8, 9, 5, 16, 1, 1, , , , 575, 170, 190, 40, false,"Picard",crew_portraits_cm_picard_smitten_sm.png,picard_smitten_crew
"Trader Worf",8,5, 0,0,0,0,0,0,1012,242,574,0,0,0,1013,75,236,0,0,0,0,561,0,824,0,406,0,689,0,381,69,268,618,0,520,0,327,0,1095,0,148,0,1011,0,161,73,102,972,0,814,833,857,"Klingon, Tactician, Undercover Operative, Federation, Starfleet, Tribbled, Displaced","nonhuman, male, organic, ds9, worf, crew_max_rarity_5","Detestable Creatures!",0, 8, 6, 10, 12, 5, 0, , , , 640, 100, 230, 300, false,"Worf",crew_portraits_cm_worf_trader_sm.png,worf_trader_crew
"Miral Torres",10,4, 0,0,0,0,0,0,598,129,264,0,0,0,761,127,286,0,0,0,0,948,0,947,0,851,0,852,0,794,307,683,805,0,658,0,883,0,938,0,769,0,844,0,721,290,642,775,0,665,1398,1337,"Klingon, Civilian, Desperate","nonhuman, female, organic, voy, miral, crew_max_rarity_4","You Dishonor Me!",1, 7, 14, 12, 14, 5, 0, , , , 440, 275, 58, 625, false,"Miral",crew_portraits_cm_miral_sm.png,miral_crew
"Commander Barak",9,4, 899,69,187,0,0,0,627,85,190,0,0,0,0,0,0,0,0,0,773,341,699,927,571,882,0,0,0,820,1103,710,0,0,0,1098,660,1060,1196,941,1026,0,0,0,937,1206,859,0,0,0,1389,1500,"Klingon, Brutal, Tactician, Hero","nonhuman, male, organic, tos, barak, crew_max_rarity_4","Honor and Glory",0, 6, 10, 10, 20, 2, 0, , , , 600, 30, 105, 400, false,"Barak",crew_portraits_cm_barak_commander_sm.png,barak_commander_crew
"First Officer Saru",9,4, 597,74,239,816,195,414,0,0,0,0,0,0,0,0,0,0,0,0,164,995,885,1080,776,701,523,761,400,0,0,0,0,0,0,96,1007,911,1082,803,409,304,474,240,0,0,0,0,0,0,1368,1243,"Kelpien, Federation, Starfleet, Exobiology, Survivalist","male, nonhuman, organic, dsc, saru, crew_max_rarity_4","Vigilance Equals Survival",1, 9, 8, 8, 10, , , , 2, 3, 325, 300, 55, 690, false,"Saru",crew_portraits_cm_saru_science_officer_sm.png,dsc_saru_scanner_crew
"Desert Philippa Georgiou",9,5, 912,152,353,0,0,0,0,0,0,0,0,0,1242,146,284,0,0,0,661,768,596,118,475,0,0,460,0,0,586,0,385,0,328,577,690,497,217,413,0,0,818,0,0,958,0,737,0,637,826,1211,"Human, Federation, Starfleet, Inspiring, Diplomat, Veteran","female, organic, dsc, georgiou, crew_max_rarity_5","Prepared Surprise",0, 8, 6, 12, 14, 5, 0, , , , 300, 415, 125, 490, false,"Georgiou",crew_portraits_cm_dsc_georgiou_desert_sm.png,dsc_georgiou_desert_crew
"T'Kuvma",8,5, 1096,240,572,0,0,0,962,219,439,0,0,0,0,0,0,0,0,0,360,79,318,586,219,478,0,0,0,443,708,318,0,0,0,154,24,124,321,83,294,0,0,0,296,466,193,0,0,0,779,237,"Klingon, Brutal, Hero, Cultural Figure, Spiritual","male, nonhuman, organic, tkuvma, dsc, crew_max_rarity_5","Are You Worthy",0, 9, 10, 5, 12, 1, 0, 2, , , 475, 260, 133, 575, false,"T'Kuvma",crew_portraits_cm_tkuvma_sm.png,dsc_tkuvma_mekleth_crew
"Reinforcements Stamets",10,4, 0,0,0,853,87,228,614,58,183,0,0,0,0,0,0,0,0,0,787,1004,0,0,0,148,568,840,446,846,1129,741,0,0,0,982,1132,0,0,0,486,677,1013,572,998,1272,915,0,0,0,1405,1494,"Human, Starfleet, Federation, Exomycologist, Prodigy","male, organic, dsc, stamets, crew_max_rarity_4","Calling Reinforcements",1, 7, 16, 12, 10, 7, 0, , , , 400, 100, 100, 500, false,"Stamets",crew_portraits_cm_stamets_sm.png,dsc_stamets_callbackup_crew
"Captain Lorca",9,5, 1263,232,542,0,0,0,0,0,0,0,0,0,1014,131,260,0,0,0,237,443,212,60,116,0,0,625,0,0,784,0,554,0,470,185,366,153,72,106,0,0,874,0,0,1018,0,812,0,696,769,812,"Starfleet, Human, Tactician, Federation, Explorer, Mirror Universe","male, organic, dsc, lorca, crew_max_rarity_5","We Are A Long Way From Home",1, 9, 12, 3, 12, 4, 1, , , , 650, 75, 140, 240, false,"Lorca",crew_portraits_cm_lorca_sm.png,dsc_lorca_stance_crew
"Fierce Guinan",7,4, 0,0,0,0,0,0,637,104,217,0,0,0,703,244,533,0,0,0,0,944,0,895,0,848,0,777,0,789,244,676,724,0,590,0,991,0,381,0,909,0,240,0,849,85,770,175,0,167,1351,919,"Communicator, Counselor, Civilian, Survivalist, Empath, Bartender, El-Aurian, Brutal","nonhuman, female, organic, tng, guinan, exclusive_voyage, crew_max_rarity_4","We've Had Some Dealings",2, 8, 10, 10, 10, , , , 1, 2, 415, 355, 117, 565, false,"Guinan",crew_portraits_cm_guinan_fierce_sm.png,guinan_fierce_crew
"Cadet Sylvia Tilly",10,5, 0,0,0,970,88,231,0,0,0,1217,189,373,0,0,0,0,0,0,702,0,322,0,0,682,44,746,392,356,0,0,371,135,0,973,0,418,0,0,935,101,1005,563,445,0,0,463,201,0,832,1279,"Human, Theoretical Engineer, Federation, Starfleet","female, organic, dsc, tilly, crew_max_rarity_5","I Can Help You",1, 10, 8, 12, 12, , , , , , 590, 225, 160, 340, false,"Tilly",crew_portraits_cm_tilly_sm.png,dsc_tilly_cadet_crew
"Lt. Ash Tyler",7,4, 652,119,218,0,0,0,829,165,342,0,0,0,0,0,0,0,0,0,882,281,810,1029,692,710,0,0,0,657,928,534,0,0,0,922,301,861,1056,754,554,0,0,0,524,748,422,0,0,0,1343,1297,"Human, Federation, Starfleet, Survivalist, Tactician, Marksman, Pilot, Klingon","male, organic, dsc, tyler, voq, crew_max_rarity_4","Full Scale Attack",2, 7, 10, 10, 12, , , , , , 575, 225, 153, 450, false,"Tyler",crew_portraits_cm_tyler_sm.png,dsc_tyler_lt_crew
"Festive Jadzia Dax",5,2, 0,0,0,367,32,125,0,0,0,0,0,0,255,28,69,0,0,0,1295,0,0,1404,0,1293,992,962,825,0,1429,0,1335,0,1150,1319,0,0,1417,0,1312,1000,1126,840,0,1441,0,1343,0,1154,1587,1608,"Federation, Starfleet, Exobiology, Astrophysicist, Trill, Gambler, Pilot, Romantic","nonhuman, female, organic, ds9, dax, crew_max_rarity_2","Toruk-DOH!",0, 3, 8, 6, 10, 4, 2, , , , 260, 80, 25, 515, false,"J. Dax",crew_portraits_cm_jadzia_purple_sm.png,dax_jadzia_purple_crew
"Harcourt Fenton Mudd",8,5, 0,0,0,1065,81,189,0,0,0,0,0,0,1264,179,391,0,0,0,607,0,0,544,0,600,432,60,336,0,529,0,327,0,273,1076,0,0,686,0,1052,758,198,635,0,669,0,455,0,392,795,1317,"Human, Civilian, Scoundrel, Crafty, Smuggler, Resourceful, Survivalist, Federation, Playful","male, organic, dsc, mudd, crew_max_rarity_5","Choose Wisely",0, 10, 6, 6, 6, , , 2, , , 415, 340, 50, 500, false,"Mudd",crew_portraits_cm_harry_mudd_sm.png,dsc_mudd_harry_crew
"Sarek",6,4, 592,83,208,338,69,207,0,0,0,0,0,0,801,175,354,0,0,0,598,1010,901,376,790,1268,954,428,802,0,949,0,741,0,606,489,1054,976,320,858,1037,749,217,628,0,731,0,518,0,442,1141,932,"Vulcan, Diplomat, Cultural Figure, Communicator, Federation, Telepath, Ambassador","nonhuman, male, organic, sarek, dsc, crew_max_rarity_4","The Vulcan Hello",0, 9, 6, 8, 14, , , , , , 150, 245, 110, 315, false,"Sarek",crew_portraits_cm_sarek_sm.png,dsc_sarek_young_crew
"Gabriel Bell",4,4, 589,152,354,0,0,0,222,181,342,0,0,0,815,102,267,0,0,0,864,617,788,342,666,1257,0,839,0,1097,572,1006,791,0,650,572,162,492,261,409,523,0,907,0,498,213,393,847,0,722,1097,338,"Human, Federation, Starfleet, Bajoran, Cultural Figure, Hero, Costumed, Chef, Inspiring, Displaced","male, organic, ds9, sisko, crew_max_rarity_4","Think Again",2, 6, 10, 8, 12, 5, 1, , , , 395, 90, 50, 480, false,"Sisko",crew_portraits_cm_sisko_bell_sm.png,sisko_bell_crew
"Ruk",9,4, 0,0,0,342,74,160,857,102,215,614,82,249,0,0,0,0,0,0,1283,856,866,0,0,379,413,1277,817,164,972,578,910,505,0,1182,1002,883,0,0,490,346,1162,709,310,1125,783,917,506,0,1157,1276,"Android, Duelist, Cyberneticist, Hunter","male, tos, nonhuman, artificial_life, ruk, crew_max_rarity_4","Preternatural Hunt",0, 6, 8, 6, 12, 0, 1, , , , 50, 500, 170, 340, false,"Ruk",crew_portraits_cm_ruk_sm.png,ruk_crew
"Defensive Phlox",6,5, 0,0,0,765,174,461,403,147,297,0,0,0,0,0,0,934,261,913,751,1126,0,0,223,167,543,795,29,994,1247,37,0,132,318,373,811,0,0,12,49,273,431,1,655,906,4,0,6,36,687,27,"Denobulan, Civilian, Physician, Romantic, Exobiology","male, nonhuman, organic, ent, phlox, crew_max_rarity_5","Intimidating Prospect",1, 7, 4, 10, 10, 3, 0, 3, , , 450, 275, 142, 250, false,"Phlox",crew_portraits_cm_phlox_defensive_sm.png,phlox_defensive_crew
"C.O.P. Founder Archer",8,4, 653,52,100,0,0,0,0,0,0,0,0,0,790,161,309,0,0,0,971,1016,909,405,794,0,0,821,0,0,974,0,763,0,628,1318,1272,1246,591,1140,0,0,705,0,0,832,0,614,0,525,1403,1464,"Federation, Starfleet, Human, Inspiring, Cultural Figure, Communicator","male, organic, ent, archer, crew_max_rarity_4","To Boldly Go",2, 6, 12, 12, 12, 7, 0, , , , 315, 200, 145, 630, false,"Archer",crew_portraits_cm_archer_founder_sm.png,archer_founder_crew
"Colonel Worf",9,4, 601,83,224,0,0,0,0,0,0,0,0,0,848,129,286,0,0,0,945,994,883,367,775,0,0,802,0,0,957,0,747,0,610,977,1018,930,434,820,0,0,841,0,0,981,0,769,0,662,1381,1402,"Klingon, Communicator, Counselor, Inspiring","nonhuman, male, organic, tos, colonel_worf, exclusive_voyage, crew_max_rarity_4","Objection!",0, 8, 7, 8, 10, 3, 0, 3, , , 600, 150, 68, 365, false,"Worf",crew_portraits_cm_worf_colonel_sm.png,worf_colonel_crew
"Anbo-jyutsu Riker",6,4, 624,124,263,0,0,0,747,120,255,0,0,0,0,0,0,0,0,0,887,356,815,1039,698,783,0,0,0,720,1015,613,0,0,0,827,378,752,965,655,796,0,0,0,754,1029,668,0,0,0,1402,1373,"Human, Federation, Starfleet, Duelist, Pilot, Maverick, Romantic, Gambler, Athlete, Casual","male, organic, tng, riker, crew_max_rarity_4","The Ultimate Evolution",1, 7, 14, 12, 14, 5, 0, , , , 315, 230, 135, 415, false,"Riker",crew_portraits_cm_riker_anbo_sm.png,riker_anbo_crew
"Torchbearer Rejac",7,5, 959,146,363,0,0,0,1125,292,580,0,0,0,0,0,0,0,0,0,580,87,518,783,401,319,0,0,0,316,518,208,0,0,0,563,38,485,739,401,122,0,0,0,125,221,86,0,0,0,782,358,"Klingon, Cultural Figure, Brutal, Duelist, Inspiring","evsuit, nonhuman, male, organic, dsc, rejac, crew_max_rarity_5","Sacred Duty!",0, 10, 8, 8, 8, , , , 1, 4, 800, 250, 175, 240, false,"Rejac",crew_portraits_cm_torchbearer_sm.png,dsc_rejac_torchbearer_crew
"Klingon O'Brien",6,4, 0,0,0,0,0,0,432,28,60,589,104,229,746,167,372,0,0,0,0,1207,887,938,0,1251,675,831,0,491,566,1001,170,520,644,0,1306,874,721,0,1365,634,582,0,690,533,1099,106,504,428,1174,1188,"Starfleet, Federation, Klingon, Human, Jury Rigger, Undercover Operative, Duelist, Veteran, Saboteur","male, organic, ds9, obrien, crew_max_rarity_4","House of Konjah",2, 8, 6, 4, 10, 3, 0, 2, , , 1380, 240, 110, 690, false,"O'Brien",crew_portraits_cm_obrien_klingon_sm.png,obrien_klingon_crew
"Armed Philippa Georgiou",8,4, 512,157,351,0,0,0,355,84,170,0,0,0,904,109,159,0,0,0,937,666,875,373,766,1246,0,811,0,1091,550,999,757,0,620,568,379,488,373,404,1072,0,1091,0,977,733,895,1059,0,902,1124,1037,"Human, Federation, Starfleet, Inspiring, Diplomat","female, organic, dsc, georgiou, crew_max_rarity_4","Starfleet Doesn't Fire First",1, 5, 4, 10, 8, , , , , , 550, 200, 100, 150, true,"Georgiou",crew_portraits_cm_georgiou_rifle_sm.png,dsc_georgiou_rifle_crew
"Admiral Nechayev",9,5, 888,266,706,0,0,0,498,82,202,0,0,0,784,188,411,0,0,0,416,251,372,144,275,1065,0,780,0,978,334,865,727,0,593,72,65,56,12,40,1011,0,478,0,926,220,846,405,0,347,723,62,"Human, Federation, Starfleet, Tactician, Veteran, Diplomat","female, organic, tng, necayev, crew_max_rarity_5","Stand Down",0, 8, 4, 10, 16, 5, 0, , , , 565, 100, 200, 400, false,"Nechayev",crew_portraits_cm_necayevadmiral_sm.png,necayev_admiral_crew
"Niners Sisko",6,5, 1150,143,317,0,0,0,1046,96,207,0,0,0,0,0,0,0,0,0,405,133,364,640,266,548,0,0,0,510,783,385,0,0,0,671,376,586,824,501,950,0,0,0,880,1147,807,0,0,0,838,1372,"Human, Federation, Bajoran, Cultural Figure, Starfleet, Athlete, Costumed, Inspiring, Desperate, Casual, Playful","male, organic, ds9, sisko, niners, crew_max_rarity_5","Hey Batter!",2, 8, 14, 10, 12, 4, 0, , , , 450, 245, 122, 480, false,"Sisko",crew_portraits_cm_sisko_niners_sm.png,sisko_niners_crew
"Tactical Michael Burnham",6,4, 669,62,171,0,0,0,756,196,397,338,47,131,0,0,0,0,0,0,916,313,521,1057,736,738,1005,0,0,360,956,560,1288,789,0,1168,318,708,1237,997,407,975,0,0,195,610,296,1253,781,0,1142,1102,"Federation, Starfleet, Astrophysicist, Xenoanthropology, Innovator, Human, Resourceful","female, organic, dsc, burnham, crew_max_rarity_4","I Am Trying To Save You",0, 8, 6, 10, 8, , , 2, , , 675, 100, 185, 490, false,"Burnham",crew_portraits_cm_burnham_tactical_sm.png,dsc_burnham_pistol_crew
"Buster Kincaid Kim",8,4, 0,0,0,371,65,143,769,171,356,551,104,245,0,0,0,0,0,0,1254,853,921,0,0,364,439,1255,800,178,967,573,954,532,0,1241,663,842,0,0,215,354,1217,764,123,722,391,880,482,0,1187,942,"Starfleet, Federation, Human, Hero, Costumed","male, organic, voy, kim, crew_max_rarity_4","We're Going Down!",1, 7, 14, 10, 18, 2, 0, , , , 550, 200, 60, 425, false,"Kim",crew_portraits_cm_buster_kinkaid_sm.png,kim_buster_crew
"Honey Bare Jadzia",9,5, 0,0,0,1147,203,483,0,0,0,916,149,360,641,33,73,0,0,0,372,0,601,1114,0,386,40,138,211,587,1158,0,154,300,807,292,0,501,1409,0,283,19,235,182,525,1436,0,368,250,1148,563,604,"Hologram, Geologist, Romantic, Desperate, Trill","nonhuman, artificial_life, female, ds9, dax, crew_max_rarity_5","I'm Sorry Doctor",2, 10, 12, 12, 12, , , , 1, 2, 500, 75, 180, 275, false,"J. Dax",crew_portraits_cm_jadzia_honey_bare_sm.png,dax_honey_bare_crew
"Dr. Hugh Culber",9,5, 0,0,0,1103,121,284,0,0,0,0,0,0,0,0,0,1371,156,390,497,0,0,0,122,482,370,568,2,0,0,149,0,65,200,817,0,0,0,365,770,552,864,61,0,0,378,0,225,421,755,1214,"Human, Physician, Romantic, Federation, Starfleet","male, organic, dsc, culber, crew_max_rarity_5","Surgical Precision",2, 10, 6, 6, 10, , , 2, , , 600, 240, 7, 425, false,"Culber",crew_portraits_cm_hugh_culber_sm.png,dsc_culber_doctor_crew
"Commander Chapel",9,4, 0,0,0,739,76,257,0,0,0,0,0,0,245,149,301,546,99,350,830,0,0,1337,771,805,592,504,117,0,1360,726,1243,513,463,948,0,0,887,567,906,641,241,121,0,905,574,688,369,108,1257,738,"Federation, Starfleet, Human, Physician, Veteran","female, organic, tos, chapel, crew_max_rarity_4","Doctor's Orders",2, 7, 8, 8, 16, 6, 0, , , , 1450, 75, 155, 400, false,"Chapel",crew_portraits_cm_chapel_commander_sm.png,chapel_commander_crew
"Leonardo da Vinci",6,5, 0,0,0,1229,80,228,0,0,0,1092,177,354,0,0,0,366,161,483,410,0,382,0,872,418,28,497,59,403,0,821,433,22,850,995,0,459,0,214,962,126,1033,60,493,0,225,507,5,278,476,249,"Hologram, Prodigy, Inspiring, Innovator, Civilian, Human, Artist, Cultural Figure, Astrophysicist","male, organic, voy, davinci, crew_max_rarity_5","Poor is the Pupil",2, 6, 6, 8, 8, 6, 0, 2, , , 1815, 330, 83, 175, false,"Leonardo",crew_portraits_cm_davinci_sm.png,davinci_crew
