"Mint Julep McCoy",6,4, 0,0,0,259,106,230,0,0,0,0,0,0,763,209,414,571,129,359,1167,0,0,793,659,1154,851,383,273,0,804,589,616,408,87,836,0,0,538,435,777,526,114,102,0,477,417,296,249,42,945,287,"Human, Federation, Starfleet, Physician, Explorer, Casual","male, organic, tos, mccoy, crew_max_rarity_4","Just Relax, Doctor's Orders",1, 8, 8, 8, 10, , , , , , 450, 175, 163, 550, false,"McCoy",crew_portraits_cm_mccoy_julepmint_sm.png,mccoy_julepmint_crew
"Captain Burnham",7,5, 1301,177,406,0,0,0,576,93,203,0,0,0,821,164,319,0,0,0,235,143,183,92,110,825,0,696,0,740,257,664,622,0,527,385,235,309,118,264,860,0,597,0,783,279,736,503,0,448,349,347,"Federation, Starfleet, Human, Resourceful, Inspiring, Xenoanthropology, Explorer, Displaced","female, organic, dsc, burnham, crew_max_rarity_5","Lets Fly",2, 10, 8, 10, 8, , , , , , 500, 200, 70, 290, false,"Burnham",crew_portraits_cm_captain_burnham_sm.png,burnham_captain_crew
"Borg Queen Seven",7,5, 1318,156,369,0,0,0,521,118,240,952,138,319,0,0,0,0,0,0,241,154,13,447,114,857,396,0,0,101,1010,689,538,243,0,462,232,46,634,333,723,384,0,0,137,918,615,549,279,0,288,381,"Human, Borg, Civilian, Federation, Resourceful, Pilot, Veteran","nonhuman, female, organic, pic, seven, exclusive_honorhall, crew_max_rarity_5","We are Borg",2, 8, 6, 6, 12, 7, 2, , , , 395, 30, 85, 490, false,"Seven",crew_portraits_cm_seven_borg_queen_sm.png,seven_borg_queen_crew
"Steward Kyheem",6,4, 557,161,358,0,0,0,375,74,164,0,0,0,937,177,353,0,0,0,784,530,705,224,628,1084,0,551,0,935,301,876,461,0,409,472,338,390,132,338,985,0,521,0,869,290,820,440,0,398,748,472,"Desperate, Empath, Duelist, Spiritual, Kwejian","male, nonhuman, organic, dsc, kyheem, crew_max_rarity_4","We Don't Need Another Savior",0, 8, 6, 5, 8, , , , , , 500, 270, 100, 490, false,"Kyheem",crew_portraits_cm_kyheem_steward_sm.png,kyheem_steward_crew
"EV Suit Picard",6,5, 1046,237,756,0,0,0,439,79,200,864,213,456,0,0,0,0,0,0,281,178,16,488,158,1026,380,0,0,135,1126,826,521,234,0,56,54,2,155,34,899,201,0,0,71,1049,758,231,90,0,488,34,"Human, Federation, Starfleet, Astrophysicist, Inspiring, Tactician","male, organic, tng, picard, evsuit, crew_max_rarity_5","Make Every Shot Count",2, 10, 6, 6, 10, , , , , , 1495, 200, 162, 300, false,"Picard",crew_portraits_cm_picard_evsuit_sm.png,picard_evsuit_crew
"Siege Nog",8,4, 0,0,0,0,0,0,909,55,201,606,97,207,277,49,109,0,0,0,0,737,789,1217,0,643,569,1173,0,123,522,485,596,448,1001,0,973,842,1203,0,946,575,1149,0,370,843,792,539,487,972,1071,1230,"Ferengi, Starfleet, Federation, Survivalist, Tactician","male, organic, nonhuman, ds9, nog, crew_max_rarity_4","You Can Count On Me, Sir",2, 7, 8, 10, 10, 0, 2, , , , 615, 400, 360, 365, false,"Nog",crew_portraits_cm_nog_siege_sm.png,nog_siege_crew
"Lt. Commander Mitchell",9,5, 1210,12,704,0,0,0,959,18,477,0,0,0,487,71,151,0,0,0,256,68,207,182,129,469,0,1024,0,407,250,309,986,0,851,206,70,161,198,131,493,0,1043,0,453,329,379,1017,0,876,368,253,"Human, Federation, Starfleet, Brutal, Pilot, Telekinetic, Telepath","organic, male, tos, mitchell, crew_max_rarity_5","I'll Squash You Like Insects!",0, 10, 6, 6, 12, 5, 1, , 2, 2, , 405, 50, 25, false,"Mitchell",crew_portraits_cm_mitchell_sm.png,mitchell_crew
"Nemesis Sacrifice Data",4,4, 0,0,0,297,61,147,619,77,162,886,144,361,0,0,0,0,0,0,1181,885,554,0,0,557,236,1166,738,102,982,648,586,276,0,1098,1006,457,0,0,600,166,1077,668,179,1116,821,469,229,0,988,1031,"Android, Federation, Starfleet, Hero, Inspiring, Cyberneticist, Resourceful","nonhuman, male, tng, artificial_life, data, crew_max_rarity_4","Goodbye...",0, 4, 12, 12, 12, 1, 0, 1, 1, 6, 475, 200, 150, 400, false,"Data",crew_portraits_cm_data_sacrifice_sm.png,data_sacrifice_crew
"Sutra",9,4, 671,54,144,302,20,78,890,56,367,0,0,0,0,0,0,0,0,0,609,260,750,940,676,323,866,1174,745,533,791,441,0,0,0,892,478,1035,1144,953,460,889,1203,767,573,823,524,0,0,0,1011,1223,"Telepath, Android, Brutal, Desperate, Survivalist","female, pic, nonhuman, artificial_life, sutra, crew_max_rarity_4","My people will survive",2, 8, 8, 5, 8, , , , , , 400, 210, 125, 365, false,"Sutra",crew_portraits_cm_sutra_sm.png,sutra_crew
"Straal",8,5, 1032,158,248,1280,300,451,0,0,0,472,55,158,0,0,0,0,0,0,11,564,113,656,323,156,67,253,108,901,0,0,1023,598,0,24,742,266,816,559,181,66,237,133,929,0,0,1038,616,0,240,357,"Starfleet, Federation, Exomycologist, Explorer, Human, Innovator","dsc, male, straal, organic, crew_max_rarity_5","Right now, we have to finish getting ready.",1, 9, 8, 8, 10, , , , , , 100, , 90, 50, false,"Straal",crew_portraits_cm_straal_sm.png,dsc_straal_crew
"Tam Elbrun",9,4, 0,0,0,0,0,0,0,0,0,0,0,0,684,156,550,549,45,454,0,0,0,814,677,0,0,715,464,0,834,604,641,420,102,0,0,0,420,409,0,0,271,307,0,362,398,197,236,29,1202,663,"Betazoid, Federation, Desperate, Maverick, Prodigy, Telepath","male, nonhuman, organic, tng, tam_elbrun, crew_max_rarity_4","Make Them Understand",1, 7, 10, 10, 10, 4, 2, , , , 475, 250, 270, 590, false,"Elbrun",crew_portraits_cm_tam_elbrun_sm.png,tam_elbrun_crew
"Fifth Dimension Invader",7,4, 0,0,0,894,81,202,689,59,151,0,0,0,477,46,95,0,0,0,673,833,0,1104,0,103,456,308,379,674,543,588,1025,0,885,939,1056,0,1218,0,513,621,730,549,930,932,878,1139,0,990,853,1284,"Photonic, Explorer, Desperate, Shapeshifter, Survivalist, Costumed","nonhuman, male, voy, photonic_alien, crew_max_rarity_4","Identify Yourself",0, 9, 8, 8, 10, , , , 1, 3, 390, 80, 190, 200, false,"Invader",crew_portraits_cm_photonic_alien_sm.png,photonic_alien_crew
"Kal'Hyah Sisko",7,5, 532,51,155,0,0,0,0,0,0,0,0,0,1006,140,285,1275,184,390,975,973,901,288,19,0,0,521,168,0,640,174,433,94,19,1080,1052,1019,521,107,0,0,724,250,0,831,293,629,178,73,350,656,"Human, Spiritual, Inspiring, Federation, Starfleet, Bajoran, Klingon","male, organic, ds9, sisko, crew_max_rarity_5","I Grew Up.",2, 10, 8, 6, 8, , , , , , 550, 100, 210, 300, false,"Sisko",crew_portraits_cm_sisko_kalhyah_sm.png,sisko_kalhyah_crew
"Luau Q",6,5, 1054,125,302,0,0,0,545,67,154,0,0,0,1299,212,413,0,0,0,446,233,369,37,296,918,0,275,0,816,97,741,187,0,176,656,438,570,135,524,1022,0,375,0,909,221,857,289,0,277,136,513,"Casual, Resourceful, Desperate, Romantic, Scoundrel, Q Continuum","nonhuman, male, voy, q_jdl, crew_max_rarity_5","I've Tried Everything!",1, 10, 10, 12, 10, , , , 2, 2, 650, 125, 300, 515, false,"Q",crew_portraits_cm_q_luau_sm.png,q_luau_crew
"Ephraim and Dot",8,5, 0,0,0,0,0,0,987,162,332,1302,199,442,494,73,149,0,0,0,0,573,199,1086,0,437,203,1017,0,14,232,284,56,64,840,0,624,256,1114,0,499,224,1044,0,21,330,386,89,104,877,307,384,"Federation, Starfleet, Caregiver, Resourceful, Automated Unit, Tardigrade","female, nonhuman, organic, artificial_life, dsc, ephraim_dot, crew_max_rarity_5","Live long and prosper",1, 8, 8, 8, 10, 3, 0, 3, , , 325, 230, 40, 575, false,"Ephraim and Dot",crew_portraits_cm_ephraim_dot_sm.png,ephraim_dot_crew
"Iden",6,4, 843,136,300,0,0,0,658,93,266,0,0,0,360,44,144,0,0,0,661,244,579,502,492,719,0,1128,0,648,585,565,1097,0,956,635,306,548,518,503,724,0,1108,0,665,606,616,1080,0,938,884,961,"Hologram, Bajoran, Desperate, Brutal, Villain, Maverick, Duelist, Tactician","voy, artificial_life, nonhuman, male, iden, crew_max_rarity_4","Darkness Will Become Light",0, 5, 6, 10, 10, 8, 4, , , , 400, 25, 140, 300, true,"Iden",crew_portraits_cm_iden_sm.png,iden_crew
"Holo-Engineer Zimmerman",7,5, 0,0,0,1281,206,454,0,0,0,1111,136,313,487,98,198,0,0,0,220,0,345,1047,0,202,6,91,125,336,1071,0,90,156,793,305,0,562,1005,0,278,31,118,181,547,1027,0,167,306,763,135,333,"Human, Federation, Starfleet, Innovator, Resourceful, Romantic, Crafty","male, organic, ds9, zimmerman, crew_max_rarity_5","I'm Here To Make You Immortal",0, 10, 8, 12, 10, , , , 1, 3, 525, 200, 73, 115, false,"Zimmerman",crew_portraits_cm_zimmerman_ds9_sm.png,zimmerman_ds9_crew
"Tevrin Krit",9,4, 0,0,0,0,0,0,899,152,328,220,42,112,586,123,215,0,0,0,0,679,1144,947,0,561,882,836,0,299,205,411,635,704,677,0,643,1097,941,0,527,846,855,0,272,241,412,493,678,683,1041,1000,"Tellarite, Hunter, Merchant, Pilot","male, organic, nonhuman, dsc, tevrin_krit, crew_max_rarity_4","Bounty Is All Mine",0, 8, 6, 10, 8, 4, 4, , , , 555, 750, 239, 290, true,"Krit",crew_portraits_cm_tevrin_krit_sm.png,tevrin_krit_crew
"First Contact Barclay",9,4, 0,0,0,0,0,0,0,0,0,604,117,552,403,108,352,0,0,0,0,0,646,1059,0,0,492,979,0,621,1081,0,270,363,805,0,0,221,755,0,0,202,644,0,240,743,0,28,91,489,1273,754,"Human, Starfleet, Federation, Innovator, Quantum Mechanics, Jury Rigger, Desperate","male, organic, tng, barclay, crew_max_rarity_4","Meeting Your Hero",1, 5, 8, 6, 8, 3, 0, 3, , , 675, 360, 170, 505, false,"Barclay",crew_portraits_cm_barclay_firstcontact_sm.png,barclay_firstcontact_crew
"Rurigan",7,5, 548,45,154,1041,109,265,0,0,0,1319,252,398,0,0,0,0,0,0,130,961,43,1033,806,429,13,518,264,192,0,0,209,51,0,422,1070,92,1141,949,706,49,797,430,262,0,0,253,99,0,201,617,"Yaderan, Caregiver, Romantic, Survivalist, Communicator, Innovator","male, organic, nonhuman, ds9, rurigan, crew_max_rarity_5","And How Do You Plan To Do That?",1, 8, 8, 8, 6, , , , , , 600, 300, 120, 300, false,"Rurigan",crew_portraits_cm_rurigan_sm.png,rurigan_crew
"Transporter Chief Kyle",8,4, 0,0,0,0,0,0,323,77,147,893,158,348,577,127,280,0,0,0,0,1110,549,931,0,1146,420,817,0,243,656,924,102,270,661,0,1034,454,835,0,1017,337,747,0,189,463,846,71,227,596,902,738,"Human, Federation, Starfleet, Communicator, Resourceful","male, organic, tos, kyle, crew_max_rarity_4","You Hungry?",1, 8, 10, 6, 10, , , , , , 475, 165, 110, 425, false,"Kyle",crew_portraits_cm_kyle_transporter_chief_sm.png,kyle_transporter_chief_crew
"Brother Rom",5,4, 353,48,156,0,0,0,0,0,0,664,104,199,923,153,300,0,0,0,1127,1089,394,431,974,0,534,617,0,670,733,0,86,404,461,1085,1058,434,478,936,0,577,661,0,773,769,0,159,490,506,832,1017,"Ferengi, Caregiver, Bartender, Resourceful, Civilian","nonhuman, male, organic, ds9, rom, crew_max_rarity_4","Yes, Brother!",0, 8, 6, 5, 8, , , , , , 375, 155, 195, 375, false,"Rom",crew_portraits_cm_assistant_rom_sm.png,brother_rom_crew
"Lara",6,5, 764,256,550,0,0,0,854,354,706,0,0,0,405,157,401,0,0,0,571,122,494,297,416,348,0,909,0,315,149,229,861,0,734,137,3,104,28,81,38,0,471,0,29,5,19,402,0,366,545,11,"Human, Resourceful, Hunter, Survivalist, Romantic","female, organic, tas, lara, crew_max_rarity_5","I Can Tell The Way",2, 9, 10, 12, 12, 0, 2, , , , 475, 355, 133, 165, false,"Lara",crew_portraits_cm_lara_sm.png,lara_crew
"DaiMon Solok",9,5, 1214,220,481,0,0,0,0,0,0,451,106,210,922,151,289,0,0,0,260,418,55,85,131,0,728,625,0,885,744,0,130,581,469,226,384,37,80,144,0,556,692,0,751,805,0,160,469,538,454,235,"Ferengi, Smuggler, Explorer, Criminal, Crafty","male, nonhuman, organic, tng, daimon_solok, crew_max_rarity_5","When do you want to leave?",1, 7, 8, 8, 12, 7, 2, , , , 353, 280, 190, 300, false,"DaiMon Solok",crew_portraits_cm_daimon_solok_sm.png,daimon_solok_crew
"Jhet'leya",5,4, 0,0,0,0,0,0,303,119,253,510,120,331,613,252,612,0,0,0,0,1059,811,813,0,1093,583,713,0,410,469,881,126,461,543,0,803,555,269,0,694,404,151,0,129,46,593,7,300,117,993,118,"Kobali, Engineered, Desperate, Resourceful, Romantic, Prisoner","nonhuman, female, organic, voy, jhetleya, crew_max_rarity_4","There Is A First Time For Everything",1, 8, 8, 8, 6, , , , 0, 2, 650, 325, 110, 265, false,"Jhet'leya",crew_portraits_cm_jhetleya_sm.png,jhetleya_crew
"Li Nalas",7,5, 511,53,150,0,0,0,1331,260,508,0,0,0,936,151,295,0,0,0,1013,144,942,348,865,128,0,607,0,146,12,59,514,0,454,1086,177,1021,496,937,160,0,683,0,162,51,116,588,0,526,198,295,"Bajoran, Hero, Inspiring, Politician, Survivalist","male, organic, ds9, nonhuman, li, crew_max_rarity_5","Is there Any Way I Can Help?",0, 10, 8, 6, 10, , , , , , 635, 250, 70, 250, false,"Li",crew_portraits_cm_li_nalas_sm.png,li_nalas_crew
"Profiteer Vash",8,4, 325,54,100,591,117,257,0,0,0,0,0,0,883,140,323,0,0,0,557,1129,1105,498,1024,758,551,167,463,0,769,0,571,0,491,488,1123,1085,542,1013,707,483,167,431,0,736,0,535,0,483,930,975,"Human, Exoarchaeology, Federation, Smuggler, Civilian, Merchant, Explorer","female, organic, ds9, vash, crew_max_rarity_4","A Friend Dropped Me Off",1, 8, 8, 8, 12, , , , , , 400, 130, 205, 250, false,"Vash",crew_portraits_cm_vash_profiteer_sm.png,vash_profiteer_crew
"Beowulf EMH",8,5, 453,58,143,0,0,0,1003,91,255,0,0,0,1219,292,500,0,0,0,1044,324,973,181,898,521,0,278,0,455,27,374,190,0,180,1094,553,1030,178,946,750,0,191,0,694,64,637,128,0,152,409,411,"Hologram, Federation, Starfleet, Duelist, Communicator, Physician, Romantic","nonhuman, artificial_life, male, voy, emh, crew_max_rarity_5","Emergency! Get Me Out of Here!",0, 10, 6, 6, 6, , , , 1, 3, 340, 100, 225, 375, false,"EMH",crew_portraits_cm_beowulf_emh_sm.png,beowulf_emh_crew
"Lt. JG Sam Lavelle",9,4, 0,0,0,0,0,0,645,51,199,357,53,150,949,102,255,0,0,0,0,856,1066,749,0,771,832,635,0,396,200,610,227,651,476,0,983,1039,901,0,961,776,816,0,529,502,804,397,633,649,888,1165,"Human, Starfleet, Federation, Desperate, Gambler","male, organic, tng, sam, crew_max_rarity_4","Think Promotion",2, 8, 8, 5, 10, , , , , , 400, 100, 270, 915, false,"Sam",crew_portraits_cm_sam_lavelle_sm.png,sam_lavelle_crew
"Racquetball O'Brien",6,5, 0,0,0,0,0,0,491,96,259,1266,253,450,1012,186,356,0,0,0,0,944,208,617,0,891,207,480,0,57,181,718,12,66,349,0,824,188,636,0,735,174,499,0,32,182,625,11,75,378,156,157,"Human, Federation, Starfleet, Athlete, Desperate, Duelist","male, organic, ds9, obrien, crew_max_rarity_5","I Can Play Any Style You Like",1, 8, 4, 6, 10, , , , , , 100, 180, 90, 100, true,"O'Brien",crew_portraits_cm_obrien_racquetball_sm.png,obrien_racquetball_crew
"Wonderland Tilly",8,5, 1318,230,493,0,0,0,0,0,0,945,166,338,454,87,177,0,0,0,184,342,7,148,70,0,379,1039,0,462,1113,0,125,232,868,202,365,7,169,125,0,338,975,0,452,1077,0,148,230,808,269,209,"Human, Theoretical Engineer, Federation, Starfleet, Casual","female, organic, dsc, tilly, crew_max_rarity_5","Im gonna be a captain someday",2, 7, 6, 8, 10, 3, 0, , , , 425, 180, 140, 440, false,"Tilly",crew_portraits_cm_tilly_wonderland_sm.png,dsc_tilly_wonderland_crew
"Prophet Kira",6,5, 977,160,468,0,0,0,1029,298,701,0,0,0,461,146,304,0,0,0,421,52,349,238,280,290,0,903,0,253,120,176,855,0,725,307,9,238,109,199,50,0,667,0,53,12,33,573,0,516,189,28,"Bajoran, Prophet, Duelist, Spiritual, Maverick","female, organic, nonhuman, ds9, kira, crew_max_rarity_5","I'll Try Not To Disappoint You",2, 9, 8, 12, 8, , , , , , 575, 160, , 200, false,"Kira",crew_portraits_cm_kira_prophet_sm.png,kira_prophet_crew
"Science Officer Tilly",7,4, 666,101,221,901,129,250,0,0,0,0,0,0,372,70,151,0,0,0,116,806,689,593,612,603,434,328,357,0,1169,0,1054,0,926,238,861,779,625,708,696,476,415,423,0,1156,0,1023,0,883,833,1056,"Human, Federation, Starfleet, Theoretical Engineer, Explorer, Displaced","female, organic, dsc, tilly, crew_max_rarity_4","The Best Theoretical Engineer",1, 6, 6, 10, 10, 6, 0, , , , 425, 200, 185, 390, true,"Tilly",crew_portraits_cm_tilly_science_sm.png,dsc_tilly_science_crew
"Fencing Picard",4,5, 974,219,406,0,0,0,1255,227,502,0,0,0,613,114,238,0,0,0,427,32,352,207,284,205,0,815,0,185,79,102,769,0,658,315,39,242,179,206,189,0,828,0,184,82,136,756,0,660,35,89,"Human, Starfleet, Federation, Tactician, Resourceful, Duelist, Astrophysicist, Athlete","male, organic, tng, picard, crew_max_rarity_5","Nothing Works Just as You Hoped",1, 10, 8, 6, 6, , , , , , 550, 170, 110, 300, false,"Picard",crew_portraits_cm_picard_fencing_sm.png,picard_fencing_crew
"Resistance Burnham",7,5, 1275,221,425,0,0,0,470,73,192,0,0,0,1027,102,239,0,0,0,228,168,178,60,104,998,0,546,0,876,246,803,456,0,404,287,210,219,171,182,921,0,850,0,824,508,778,781,0,680,310,533,"Federation, Starfleet, Xenoanthropology, Human, Duelist, Resourceful, Displaced","female, organic, dsc, burnham, crew_max_rarity_5","I Never Quit",0, 10, 8, 8, 10, , , , 2, 2, 300, 200, 143, 525, false,"Burnham",crew_portraits_cm_burnham_resistance_sm.png,burnham_resistance_crew
"Ancient Humanoid",5,5, 626,50,146,1330,251,447,0,0,0,0,0,0,1006,152,252,0,0,0,47,894,800,248,727,135,148,17,101,0,646,0,445,0,391,104,1075,1038,566,958,224,183,48,160,0,864,0,669,0,599,66,499,"Communicator, Geneticist, Hologram, Survivalist, Cultural Figure","organic, tng, nonhuman, humanoid, crew_max_rarity_5","If You Can See and Hear me, Our Hope has been Fulfilled",1, 8, 8, 8, 6, , , , , , 625, 100, 145, 300, false,"Humanoid",crew_portraits_cm_ancient_humanoid_sm.png,ancient_humanoid_crew
"Lieutenant Sahil",5,5, 944,182,386,0,0,0,621,104,204,0,0,0,1272,259,510,0,0,0,481,213,411,36,335,766,0,247,0,690,74,608,162,0,152,413,238,330,34,286,827,0,219,0,755,84,704,149,0,166,42,133,"Human, Inspiring, Federation, Starfleet, Resourceful, Communicator","male, organic, dsc, sahil, crew_max_rarity_5","You found your real home",1, 7, 8, 8, 12, 6, 0, , , , 515, 270, 175, 525, false,"Sahil",crew_portraits_cm_sahil_lieutenant_sm.png,sahil_lieutenant_crew
"Quarren of the Kyrian",8,4, 0,0,0,946,175,352,0,0,0,610,109,250,343,75,147,0,0,0,513,0,759,1185,0,457,92,248,275,692,1197,0,438,426,961,506,0,722,1115,0,465,94,238,281,676,1151,0,370,401,878,813,795,"Kyrian, Casual, Exoarchaeology, Linguist, Historian","male, voy, quarren, nonhuman, organic, crew_max_rarity_4","Trying to get home, to Mars",1, 7, 8, 10, 10, 6, 2, , , , 400, 285, 157, 550, false,"Quarren",crew_portraits_cm_quarren_kyrian_sm.png,quarren_kyrian_crew
"Admiral Mark Jameson",7,5, 1149,98,252,0,0,0,540,95,276,0,0,0,1264,212,413,0,0,0,381,197,320,30,250,824,0,316,0,739,89,663,222,0,207,787,372,715,184,649,697,0,376,0,645,123,594,290,0,278,59,382,"Human, Federation, Starfleet, Diplomat, Desperate, Resourceful","male, organic, tng, mark_jameson, crew_max_rarity_5","I'm Strong, I'm Alert, I'm Fit!",2, 8, 6, 6, 8, 3, 0, 3, , , 300, 75, 130, 350, false,"Jameson",crew_portraits_cm_mark_jameson_sm.png,mark_jameson_crew
"Patar",6,4, 561,115,259,0,0,0,0,0,0,410,48,117,939,147,336,0,0,0,844,871,413,250,703,0,793,580,0,947,692,0,157,624,436,741,791,372,262,610,0,838,598,0,992,699,0,258,669,449,822,905,"Vulcan, Tactician, Federation, Starfleet, Section 31, Telepath","nonhuman, female, organic, dsc, patar, crew_max_rarity_4","It is Critical",2, 8, 8, 6, 8, , , , , , 490, 200, 125, 475, false,"Patar",crew_portraits_cm_patar_sm.png,patar_crew
"Chancellor K'mpec",6,5, 1253,239,493,0,0,0,953,176,374,0,0,0,451,88,178,0,0,0,212,42,163,169,91,442,0,1042,0,387,248,288,1004,0,871,193,53,146,158,118,405,0,971,0,376,243,304,931,0,805,287,171,"Klingon, Politician, Duelist, Brutal, Veteran, Cultural Figure","nonhuman, male, organic, tng, kmpec, crew_max_rarity_5","The Empire Will Not Be Destroyed",1, 10, 6, 8, 8, , , , , , 550, 115, 195, 375, false,"K'mpec",crew_portraits_cm_kmpec_sm.png,kmpec_crew
"Flint",5,5, 0,0,0,1287,213,411,829,234,554,503,103,203,0,0,0,0,0,0,232,593,902,0,0,9,65,303,132,100,664,299,927,524,0,364,321,839,0,0,14,77,386,206,25,267,103,855,485,0,254,96,"Human, Artist, Caregiver, Romantic, Cultural Figure, Cyberneticist, Duelist, Musician, Resourceful","male, organic, tos, flint, crew_max_rarity_5","The Test of Power",2, 6, 4, 8, 14, 7, 0, , , , 150, , 40, 200, true,"Flint",crew_portraits_cm_flint_sm.png,flint_crew
"Su'Kal",9,4, 0,0,0,0,0,0,565,60,203,0,0,0,955,143,298,0,0,0,0,917,0,712,0,862,0,586,0,767,214,690,495,0,439,0,966,0,788,0,930,0,693,0,830,358,784,599,0,539,1179,1241,"Kelpien, Survivalist, Civilian, Telekinetic","male, organic, nonhuman, dsc, sukal, crew_max_rarity_4","I Am No Longer Alone",1, 8, 8, 6, 10, , , , , , 625, 220, 150, 450, false,"Su'Kal",crew_portraits_cm_sukal_sm.png,dsc_sukal_crew
"Syrran",6,5, 1212,158,513,907,202,612,0,0,0,0,0,0,384,100,302,0,0,0,15,434,224,195,146,382,283,174,229,0,1119,0,1009,0,874,7,411,192,113,160,132,131,24,106,0,868,0,674,0,602,262,48,"Vulcan, Civilian, Cultural Figure, Spiritual, Survivalist, Telepath","nonhuman, male, organic, ent, syrran, crew_max_rarity_5","Tuluk To Vokau",0, 8, 10, 6, 12, 1, 2, , , , 150, 10, 155, 650, false,"Syrran",crew_portraits_cm_syrran_sm.png,syrran_crew
"Angela Martine",8,4, 0,0,0,366,98,202,919,150,255,0,0,0,655,104,202,0,0,0,1059,689,0,913,0,183,763,453,658,516,192,429,759,0,650,907,761,0,980,0,211,593,404,522,594,341,547,856,0,735,808,946,"Human, Starfleet, Federation, Survivalist, Romantic, Explorer","female, organic, tos, angela, crew_max_rarity_4","All Weapons Energizing to Full",2, 7, 8, 10, 10, 6, 2, , , , 415, 405, 180, 290, false,"Angela",crew_portraits_cm_angela_martine_sm.png,angela_martine_crew
"Skorr Tchar",4,4, 644,254,604,0,0,0,520,198,403,237,47,198,0,0,0,0,0,0,654,252,283,795,488,730,867,0,0,466,931,576,1153,687,0,107,22,17,248,61,335,690,0,0,115,509,237,968,576,0,994,87,"Desperate, Maverick, Royalty, Thief","organic, nonhuman, tas, male, tchar, crew_max_rarity_4","A Noble Death to Win a Great Dream",0, 7, 10, 6, 8, 1, 1, , , , 690, 200, 170, 465, false,"Tchar",crew_portraits_cm_skorr_tchar_sm.png,skorr_tchar_crew
"Mirror Marlena Moreau",7,4, 0,0,0,866,172,376,0,0,0,0,0,0,350,55,177,606,145,309,597,0,0,1171,637,553,407,295,62,0,1188,578,1080,393,356,463,0,0,1096,509,432,311,208,51,0,1135,488,1000,301,221,826,624,"Terran Empire, Starfleet, Human, Romantic, Mirror Universe","female, organic, tos, marlena_moreau, crew_max_rarity_4","I Fell Asleep",1, 8, 4, 8, 12, , , , 0, 1, 225, 425, 140, 300, false,"Marlena",crew_portraits_cm_marlena_moreau_mirror_sm.png,marlena_moreau_mirror_crew
"Badge-Challenged Linus",6,4, 0,0,0,830,141,415,0,0,0,623,90,306,337,102,202,0,0,0,628,0,726,1141,0,590,100,309,348,665,1164,0,384,398,922,455,0,652,984,0,423,70,153,262,617,1011,0,206,366,738,846,578,"Saurian, Federation, Starfleet, Desperate, Resourceful, Displaced","male, organic, nonhuman, dsc, linus, crew_max_rarity_4","Sorry, New Badge",1, 8, 10, 8, 10, , , , 2, 1, 300, 200, 155, 250, false,"Linus",crew_portraits_cm_linus_challenged_sm.png,dsc_linus_challenged_crew
"Tawi'Yan Alexander",7,5, 0,0,0,0,0,0,528,80,156,812,185,491,1254,189,419,0,0,0,0,967,546,463,0,932,419,336,0,130,114,750,32,266,226,0,1015,213,564,0,995,198,396,0,88,224,831,9,88,297,435,207,"Human, Klingon, Spiritual, Resourceful, Jury Rigger","male, organic, ds9, alexander, nonhuman, crew_max_rarity_5","Me? Really?",0, 9, 8, 8, 10, , , , , , 350, 225, 160, 380, false,"Alexander",crew_portraits_cm_alexander_kalhyah_sm.png,alexander_kalhyah_crew
"Returning Saru",3,5, 1072,79,182,0,0,0,407,195,350,0,0,0,1491,154,250,0,0,0,514,256,445,29,364,884,0,226,0,790,82,708,142,0,131,954,302,907,461,831,419,0,749,0,390,148,316,670,0,600,101,618,"Kelpien, Federation, Starfleet, Exobiology, Communicator, Linguist, Displaced","male, nonhuman, organic, dsc, saru, crew_max_rarity_5","A Choice is Always Necessary.",2, 8, 12, 10, 14, 4, 0, , , , 300, 425, 145, 475, false,"Saru",crew_portraits_cm_saru_returning_sm.png,dsc_saru_returning_crew
"Commander Demos",7,5, 1342,147,362,0,0,0,544,96,201,0,0,0,1043,154,333,0,0,0,229,150,179,34,105,866,0,474,0,769,171,694,377,0,347,492,299,413,167,356,854,0,594,0,776,277,729,498,0,444,106,463,"Brutal, Desperate, Dramen, Constable, Interrogator","male, organic, tas, demos, nonhuman, crew_max_rarity_5","Ready A Patrol Ship",0, 10, 8, 8, 10, , , , 2, 2, 450, 100, 80, 425, false,"Demos",crew_portraits_cm_commander_demos_sm.png,commander_demos_crew
"Lieutenant Ogawa",7,5, 549,80,181,0,0,0,1028,150,278,0,0,0,0,0,0,1313,252,380,908,236,843,1006,12,426,0,0,140,374,633,5,0,63,214,955,403,908,1035,59,625,0,0,202,564,816,25,0,116,275,185,433,"Human, Federation, Starfleet, Physician, Tactician, Desperate, Resourceful","female, organic, tng, ogawa, crew_max_rarity_5","It Should Be, Sir",2, 9, 8, 8, 10, , , , , , , 100, 130, 425, false,"Ogawa",crew_portraits_cm_ogawa_lieutenant_sm.png,ogawa_lieutenant_crew
"Kov",6,4, 0,0,0,367,95,202,0,0,0,871,200,353,656,100,255,0,0,0,1060,0,547,882,0,1057,173,443,659,514,917,0,84,268,628,909,0,373,905,0,870,110,346,528,391,933,0,75,188,652,788,662,"Vulcan, Maverick, Civilian, Desperate, Telepath","nonhuman, organic, male, ent, kov, crew_max_rarity_4","Is There a Problem?",2, 7, 8, 10, 10, 0, 2, , , , 365, 265, 85, 200, false,"Kov",crew_portraits_cm_kov_sm.png,kov_crew
"Explorer Cutler",4,4, 0,0,0,664,76,182,946,197,320,0,0,0,394,50,152,0,0,0,805,608,0,1131,0,74,530,477,448,412,309,313,1048,0,915,988,599,0,1149,0,155,674,646,582,429,326,356,1057,0,913,768,995,"Explorer, Starfleet, Desperate, Resourceful, Survivalist, Exobiology, Human","female, organic, ent, cutler, crew_max_rarity_4","Thanks For Choosing Me For This Mission",1, 6, 10, 4, 12, 1, 2, , , , 425, 125, 175, 350, false,"Cutler",crew_portraits_cm_cutler_explorer_sm.png,cutler_explorer_crew
"Union Q",5,5, 0,0,0,0,0,0,1034,317,709,0,0,0,958,190,407,422,128,363,0,448,0,639,813,282,0,498,561,246,26,24,402,515,80,0,150,0,577,428,44,0,416,323,41,4,5,336,245,44,270,27,"Q Continuum, Crafty, Scoundrel, Veteran, Romantic, Desperate, Costumed","nonhuman, male, voy, q_jdl, crew_max_rarity_5","I'll Never Surrender!",0, 10, 10, 6, 14, 7, 4, , , , 775, 10, 218, 615, false,"Q",crew_portraits_cm_q_union_sm.png,q_union_crew
"Orion Captain",7,5, 1094,242,564,0,0,0,716,296,605,0,0,0,420,121,264,0,0,0,307,104,249,200,184,541,0,1012,0,476,271,394,975,0,836,138,7,105,61,82,85,0,776,0,89,36,62,698,0,619,503,26,"Orion, Criminal, Duelist, Scoundrel, Tactician, Thief","organic, nonhuman, male, tas, orion_captain, crew_max_rarity_5","Surrender Your Cargo Or Be Destroyed",0, 10, 12, 8, 10, 1, 0, 2, , , 250, 125, 228, 50, false,"Orion Captain",crew_portraits_cm_orion_captain_sm.png,orion_captain_crew
