"Quinn",8,5, 513,91,197,0,0,0,1055,115,240,0,0,0,1288,202,405,0,0,0,957,253,896,164,810,448,0,313,0,396,25,293,222,0,203,924,455,882,240,802,749,0,413,0,690,147,639,333,0,303,218,574,"Q Continuum, Writer, Prisoner, Desperate, Explorer","nonhuman, male, organic, voy, quinn, crew_max_rarity_5","I Die Not For Myself But For You",1, 7, 8, 8, 14, 7, 1, , , , 300, 200, 200, 150, false,"Quinn",crew_portraits_cm_quinn_sm.png,quinn_crew
"Wrathful Kirk",7,5, 884,147,308,0,0,0,1350,248,499,501,83,183,0,0,0,0,0,0,638,50,131,788,475,130,723,0,0,50,306,57,987,566,0,614,76,172,745,468,176,653,0,0,51,303,127,951,556,0,267,223,"Human, Federation, Starfleet, Inspiring, Desperate, Marksman, Explorer","male, organic, tos, kirk, crew_max_rarity_5","KHAAAAAAAAAN!!!",2, 8, 6, 3, 10, 7, 0, , , , 190, 200, 100, 75, false,"Kirk",crew_portraits_cm_kirk_wrathful_sm.png,kirk_wrathful_crew
"Lt. JG Palmer",10,5, 0,0,0,1109,124,287,0,0,0,1317,193,392,0,0,0,0,0,0,403,0,212,0,0,385,10,469,226,229,0,0,243,67,0,721,0,346,0,0,662,57,762,406,347,0,0,367,159,0,659,1000,"Human, Starfleet, Federation, Explorer","female, organic, tng, palmer, crew_max_rarity_5","Phase Distortion Is Dropping!",2, 7, 10, 6, 16, 2, 0, , , , 450, 100, 135, 400, false,"Palmer",crew_portraits_cm_palmer_sm.png,palmer_crew
"Aleek-Om",9,4, 0,0,0,855,135,310,0,0,0,0,0,0,397,45,97,633,69,225,662,0,0,1194,715,628,453,358,79,0,1213,640,1105,446,397,671,0,0,1242,811,631,426,441,145,0,1268,764,1163,522,565,958,1136,"Aurelian, Federation, Innovator, Starfleet","male, organic, nonhuman, tas, aleek_om, crew_max_rarity_4","The Date Was...",2, 5, 4, 4, 6, , , , , , 100, 200, 30, 605, true,"Aleek-Om",crew_portraits_cm_aleek_om_sm.png,aleek_om_crew
"Dr. Pollard",9,5, 911,101,199,528,103,192,0,0,0,0,0,0,0,0,0,1325,181,429,175,741,594,820,8,895,636,931,36,0,0,138,0,72,220,399,928,850,995,52,891,615,960,78,0,0,254,0,137,304,471,676,"Physician, Starfleet, Federation, Veteran, Human","female, organic, dsc, pollard, crew_max_rarity_5","Call The Doctor!",1, 7, 8, 6, 10, 6, 0, , , , 300, 200, 100, 240, false,"Pollard",crew_portraits_cm_pollard_tracy_sm.png,pollard_tracy_crew
"Lt. Commander Uhura",8,5, 1295,142,345,0,0,0,579,55,111,0,0,0,1054,146,289,0,0,0,292,169,242,63,162,916,0,502,0,821,198,738,412,0,367,554,433,467,215,404,1168,0,725,0,1007,536,950,635,0,567,221,808,"Human, Federation, Starfleet, Communicator, Resourceful","female, organic, tos, uhura, crew_max_rarity_5","Wormhole Effect!",2, 7, 10, 6, 8, 7, 4, , , , 375, 25, 158, 175, false,"Uhura",crew_portraits_cm_uhura_lt_sm.png,uhura_lt_crew
"Zahl Ambassador",9,4, 581,141,330,0,0,0,0,0,0,0,0,0,846,181,353,0,0,0,801,840,722,264,642,0,0,677,0,0,795,0,606,0,512,579,658,485,166,431,0,0,530,0,0,649,0,449,0,401,1187,962,"Ambassador, Survivalist, Tactician, Diplomat, Zahl","nonhuman, male, organic, voy, zahl_ambassador, crew_max_rarity_4","Leave This Space!",1, 9, 10, 6, 14, 1, 0, , , , 425, 100, 5, 390, false,"Ambassador",crew_portraits_cm_zahl_ambassador_sm.png,zahl_ambassador_crew
"Young T'Pau",7,4, 888,91,344,682,74,233,0,0,0,0,0,0,426,7,21,0,0,0,117,713,573,490,478,732,521,498,439,0,1230,0,1138,0,990,204,727,576,731,519,861,586,878,521,0,1308,0,1235,0,1072,874,1218,"Vulcan, Spiritual, Telepath, Syrrannite","nonhuman, female, organic, ent, tpau, crew_max_rarity_4","The Risks Are Acceptable",0, 7, 8, 8, 8, 0, 1, , , , 250, 100, 210, 475, false,"T'Pau",crew_portraits_cm_tpau_young_sm.png,tpau_young_crew
"Indulgent Seven",7,5, 0,0,0,986,151,300,0,0,0,434,176,357,0,0,0,1311,157,329,518,0,865,0,189,462,104,550,20,791,0,184,879,14,282,654,0,407,0,451,616,60,686,66,426,0,432,442,16,461,347,258,"Human, Borg, Civilian, Federation, Astrophysicist, Physician, Starfleet, Prisoner, Crafty","nonhuman, female, organic, voy, seven, male, artificial_life, emh, exclusive_fusion, crew_max_rarity_5","To Shared Experiences",0, 7, 6, 8, 14, 7, 2, , , , 480, 125, 120, 500, false,"Seven",crew_portraits_cm_sevencheesecake_sm.png,seven_cheesecake_crew
"Indignant Seven",7,4, 0,0,0,835,126,322,0,0,0,657,205,418,0,0,0,0,0,0,679,0,652,0,0,640,89,715,379,621,0,0,718,360,0,661,0,279,0,0,624,39,698,384,297,0,0,295,117,0,1157,865,"Human, Borg, Civilian, Federation, Astrophysicist","nonhuman, female, organic, voy, seven, crew_max_rarity_4","There Won't Be A Next Time",2, 8, 8, 8, 10, , , , , , 375, 200, 250, 475, false,"Seven",crew_portraits_cm_seven_indignant_sm.png,seven_purple_crew
"Galaxy Gallivanting Vash",10,5, 503,74,168,1264,166,367,0,0,0,0,0,0,984,138,273,0,0,0,85,1017,945,325,860,286,229,45,164,0,703,0,502,0,436,180,1015,972,498,881,462,326,122,282,0,882,0,684,0,604,418,700,"Human, Scoundrel, Federation, Exoarchaeology, Smuggler, Explorer, Civilian","female, organic, ds9, vash, crew_max_rarity_5","I'll Choose Profit Every Time",1, 9, 8, 10, 8, , , , , , 200, 300, 75, 680, false,"Vash",crew_portraits_cm_vash_qless_sm.png,vash_qless_crew
"Loken",9,5, 0,0,0,1005,129,306,0,0,0,1311,152,313,0,0,0,553,26,64,503,0,257,0,910,450,23,535,85,265,0,837,296,19,897,688,0,531,0,1084,644,87,722,287,516,0,1004,546,187,1052,465,1009,"Innovator, Undercover Operative, Kraylor, Desperate, Crafty, Resourceful","male, nonhuman, organic, voy, loken, crew_max_rarity_5","It's Perfect",2, 7, 8, 4, 12, 1, 2, , , , 200, 240, 150, 100, false,"Loken",crew_portraits_cm_loken_sm.png,loken_crew
"Queen Po",5,5, 546,65,166,0,0,0,0,0,0,1312,184,427,952,134,269,0,0,0,950,970,48,322,802,0,203,632,0,223,756,0,23,62,476,1048,1039,98,525,905,0,247,772,0,313,889,0,50,126,618,335,593,"Jury Rigger, Prodigy, Cultural Figure, Xahean, Innovator, Royalty, Resourceful, Spiritual","nonhuman, organic, female, dsc, po, crew_max_rarity_5","Is That Spumoni?",1, 8, 10, 10, 12, 7, 0, , , , 240, 50, 112, 625, false,"Po",crew_portraits_cm_po_sm.png,dsc_po_crew
"Riker Q",3,4, 443,14,44,0,0,0,690,42,87,0,0,0,973,46,106,0,0,0,1119,591,1045,510,962,805,0,717,0,724,250,642,650,0,545,1246,1118,1187,1160,1095,1206,0,1182,0,1038,1073,981,1149,0,1000,971,1437,"Q Continuum, Human, Federation, Starfleet, Pilot, Maverick, Gambler, Romantic","male, organic, tng, riker, crew_max_rarity_4","And That's Not All",2, 7, 8, 10, 10, , , , , , 580, 225, 130, 415, false,"Riker",crew_portraits_cm_riker_q_sm.png,riker_q_crew
"Q as God",9,5, 0,0,0,943,179,395,0,0,0,0,0,0,559,30,70,1327,176,319,500,0,0,1108,183,446,335,198,18,0,1120,175,996,93,62,440,0,0,1280,429,399,294,325,36,0,1295,417,1206,245,332,399,736,"Q Continuum, Scoundrel, Crafty, Costumed","nonhuman, male, tng, q_jdl, crew_max_rarity_5","Welcome to the Afterlife",0, 7, 12, 5, 10, 4, 1, , , , 375, 240, 20, 115, false,"Q",crew_portraits_cm_q_god_sm.png,q_god_crew
"Fungal Entity May",9,5, 0,0,0,1005,134,261,1286,175,391,0,0,0,0,0,0,0,0,0,533,440,0,0,0,12,349,561,282,243,451,150,0,0,0,749,550,0,0,0,68,473,785,417,366,588,289,0,0,0,686,1041,"jahSepp, Desperate, Survivalist, Mirror Universe, Resourceful","female, nonhuman, organic, dsc, may_fungus, crew_max_rarity_5","What A Team We Are!",2, 6, 8, 6, 16, 2, 0, , , , 150, 100, 185, 25, false,"May",crew_portraits_cm_may_fungus_sm.png,dsc_may_fungus_crew
"Data Q",3,4, 0,0,0,858,148,345,337,53,135,0,0,0,622,73,163,0,0,0,646,1141,0,984,0,288,441,195,355,1015,740,946,830,0,707,573,1120,0,1115,0,247,356,254,325,987,850,932,1016,0,872,980,1103,"Q Continuum, Android, Scoundrel, Crafty, Brutal, Costumed","nonhuman, male, tng, q_jdl, data, crew_max_rarity_4","Use Your Power",0, 8, 5, 8, 10, , , , , , 400, 240, 155, 350, false,"Q",crew_portraits_cm_q_data_sm.png,q_data_crew
"Amanda Rogers",9,5, 0,0,0,1282,180,391,0,0,0,501,63,121,0,0,0,970,125,276,269,0,989,0,465,251,72,338,23,911,0,426,1035,37,496,441,0,1084,0,605,402,148,463,57,994,0,585,1109,168,627,506,748,"Q Continuum, Exobiology, Starfleet, Federation, Prodigy, Romantic","female, organic, tng, rogers_amanda, crew_max_rarity_5","It's My Choice",1, 10, 6, 6, 10, , , , , , 250, 100, 130, 425, false,"Amanda",crew_portraits_cm_rogers_amanda_sm.png,rogers_amanda_crew
"Q2",8,5, 0,0,0,0,0,0,826,186,392,0,0,0,1263,281,503,349,150,341,0,716,0,420,914,602,0,264,661,538,34,62,177,610,55,0,539,0,356,437,378,0,202,328,345,27,21,137,247,18,450,64,"Brutal, Interrogator, Q Continuum","nonhuman, male, tng, q2, crew_max_rarity_5","Not Bad",0, 9, 10, 10, 10, , , , , , 490, 200, 118, 475, false,"Q2",crew_portraits_cm_q2_sm.png,q2_crew
"Acting Captain Jellico",9,5, 1241,216,515,0,0,0,941,159,316,0,0,0,426,100,211,0,0,0,232,66,184,185,103,532,0,1075,0,469,288,380,1036,0,895,201,72,153,135,119,544,0,919,0,489,280,423,869,0,740,407,185,"Diplomat, Maverick, Federation, Starfleet, Tactician, Human","male, organic, tng, jellico, crew_max_rarity_5","The Enterprise is Mine Now",2, 6, 12, 4, 12, 1, 1, , , , 500, 315, 129, 250, false,"Jellico",crew_portraits_cm_jellico_acting_sm.png,jellico_acting_crew
"Colonel Q",8,5, 1058,88,199,0,0,0,1278,179,367,0,0,0,526,46,68,0,0,0,532,84,464,348,377,284,0,1060,0,254,139,167,1024,0,884,923,278,881,852,801,422,0,1217,0,396,423,319,1190,0,1031,437,1046,"Brutal, Veteran, Interrogator, Costumed, Q Continuum","nonhuman, organic, male, voy, colonel_q, crew_max_rarity_5","The Time For Diplomacy Is Past",2, 10, 3, 6, 12, , , 2, , , 350, 270, 58, 125, false,"Colonel Q",crew_portraits_cm_colonel_q_sm.png,colonel_q_crew
"Q Junior",9,4, 876,123,287,0,0,0,0,0,0,0,0,0,583,100,205,0,0,0,659,731,588,323,497,0,0,877,0,0,1001,0,838,0,715,701,756,615,408,563,0,0,935,0,0,1034,0,885,0,755,1224,1254,"Q Continuum, Civilian, Crafty, Resourceful, Scoundrel","nonhuman, male, voy, q_junior, organic, crew_max_rarity_4","When Are You Going To Do Something Interesting?",0, 9, 10, 15, 12, , , 2, , , 365, 310, 83, 375, false,"Q",crew_portraits_cm_q_junior_sm.png,q_junior_crew
"Grateful Lwaxana Troi",9,5, 1244,182,415,0,0,0,1006,89,206,0,0,0,640,70,143,0,0,0,289,96,240,153,160,558,0,863,0,494,208,410,823,0,700,377,229,298,300,254,875,0,1091,0,799,671,749,1065,0,920,270,771,"Diplomat, Betazoid, Federation, Civilian, Telepath, Romantic, Ambassador","nonhuman, female, organic, ds9, lwaxana, crew_max_rarity_5","Alone At Last",2, 7, 10, 10, 14, 8, 4, , , , 390, 225, 150, 515, false,"Troi",crew_portraits_cm_lwaxana_grateful_sm.png,troi_lwaxana_grateful_crew
"Miss Q",8,4, 621,103,228,876,154,302,0,0,0,353,72,186,0,0,0,0,0,0,133,861,398,954,674,605,212,680,354,979,0,0,1103,646,0,170,872,329,958,706,607,168,673,368,861,0,0,969,573,0,898,888,"Astrophysicist, Romantic, Resourceful, Crafty, Q Continuum","nonhuman, organic, female, voy, miss_q, crew_max_rarity_4","I'm Stuck Here With You Mortals",0, 6, 8, 10, 10, 3, 0, 2, , , 200, 200, 235, 390, false,"Q",crew_portraits_cm_q_miss_sm.png,miss_q_crew
"Redjac Jaris",9,5, 1016,98,301,0,0,0,1298,157,375,0,0,0,529,50,121,0,0,0,506,67,440,310,352,270,0,1025,0,247,132,154,992,0,846,714,205,634,611,583,445,0,1159,0,420,354,334,1126,0,981,352,777,"Argelian, Brutal, Villain, Diplomat","male, organic, nonhuman, tos, jaric, redjac, crew_max_rarity_5","Die! Make You Suffer!",2, 8, 6, 8, 14, 1, 0, 2, 1, 3, 120, 100, 125, 615, false,"Jaris",crew_portraits_cm_jaris_redjac_sm.png,jaris_redjac_crew
"Nexus Guinan",9,4, 0,0,0,446,48,94,0,0,0,0,0,0,637,85,140,838,82,241,1078,0,0,975,558,1073,784,503,183,0,988,534,819,350,130,1201,0,0,1132,749,1197,882,821,357,0,1173,707,1038,470,383,1015,1284,"Communicator, Counselor, Civilian, Spiritual, Empath, El-Aurian","nonhuman, female, organic, tng, guinan, crew_max_rarity_4","You Can Go Anywhere, Anytime",1, 9, 8, 8, 10, , , , 2, 3, 305, 165, 168, 450, false,"Guinan",crew_portraits_cm_guinan_nexus_sm.png,guinan_nexus_crew
"Vice Admiral Janeway",7,5, 1331,82,293,520,103,246,0,0,0,1031,83,160,0,0,0,0,0,0,75,467,23,514,180,875,118,914,528,510,0,0,581,267,0,219,811,273,882,621,774,277,857,462,883,0,0,994,594,0,421,1028,"Veteran, Starfleet, Federation, Human, Resourceful, Survivalist, Gambler, Tactician, Maverick","female, organic, voy, janeway, crew_max_rarity_5","Let's Get Started",0, 9, 10, 6, 6, , , , , , 525, 350, 115, 425, false,"Janeway",crew_portraits_cm_janeway_viceadmiral_sm.png,janeway_viceadmiral_crew
"Mirror Geordi La Forge",4,4, 0,0,0,534,138,336,401,106,210,614,245,537,0,0,0,0,0,0,845,1052,646,0,0,382,138,848,475,258,1156,848,705,344,0,612,913,137,0,0,147,13,629,341,27,1001,706,134,45,0,959,174,"Human, Starfleet, Terran Empire, Mirror Universe, Saboteur, Smuggler, Innovator","male, organic, tng, laforge, crew_max_rarity_4","Perceived Opportunity",0, 6, 6, 6, 6, , , , , , 385, 200, 172, 525, true,"La Forge",crew_portraits_cm_laforge_mirror_sm.png,laforge_mirror_crew
"Zora",6,4, 0,0,0,392,100,192,0,0,0,0,0,0,883,72,167,549,122,381,1068,0,0,849,695,1062,778,362,233,0,875,620,686,434,116,936,0,0,1110,417,902,623,536,112,0,1151,406,1007,237,183,948,950,"Hologram, Human, Costumed, Federation, Starfleet, Romantic, Communicator","female, nonhuman, artificial_life, zora, dsc, crew_max_rarity_4","I'm Sorry It's So Synthesized",1, 6, 4, 8, 12, 3, 0, 3, , , 280, 100, 123, 200, false,"Zora",crew_portraits_cm_zora_sm.png,dsc_zora_crew
"Commander Ari bn Bem",5,5, 0,0,0,1043,390,748,702,214,482,0,0,0,0,0,0,288,189,427,247,756,0,0,915,19,197,311,46,581,853,102,0,612,902,35,401,0,0,263,3,27,37,2,214,362,8,0,129,296,569,13,"Pandronian, Resourceful, Crafty, Diplomat, Explorer, Investigator","male, organic, nonhuman, tas, ari_bn_bem, crew_max_rarity_5","Assistance is Offered",1, 6, 3, 5, 4, , , , , , 435, 200, 255, 350, true,"Bem",crew_portraits_cm_ari_bn_bem_sm.png,ari_bn_bem_crew
"Navaar",9,5, 1281,155,348,1042,116,257,0,0,0,0,0,0,530,53,140,0,0,0,25,458,249,194,171,439,332,189,266,0,1104,0,966,0,824,108,617,438,423,379,720,494,470,437,0,1226,0,1099,0,954,341,843,"Romantic, Scoundrel, Orion, Casual, Civilian, Crafty","nonhuman, organic, female, ent, navaar, crew_max_rarity_5","You're Just Jealous",1, 10, 8, 6, 10, , , , , , 500, 80, 85, 575, false,"Navaar",crew_portraits_cm_navaar_sm.png,navaar_crew
"Roman Captive Kirk",2,4, 661,90,177,0,0,0,460,60,126,0,0,0,930,163,267,0,0,0,818,523,751,257,664,1057,0,641,0,922,312,851,564,0,484,962,696,917,429,835,1138,0,735,0,989,504,933,645,0,576,786,1123,"Human, Federation, Starfleet, Desperate, Romantic, Prisoner","male, organic, tos, kirk, crew_max_rarity_4","All Men are Brothers",2, 8, 8, 6, 10, 5, 0, , , , 450, 100, 147, 350, false,"Kirk",crew_portraits_cm_kirk_romancaptive_sm.png,kirk_romancaptive_crew
"Helmsman Wyatt",10,5, 1269,326,436,0,0,0,1072,119,242,0,0,0,0,0,0,0,0,0,208,31,161,419,88,429,0,0,0,378,634,279,0,0,0,176,100,131,347,105,729,0,0,0,673,936,622,0,0,0,656,741,"Pilot, Federation, Starfleet, Desperate","male, organic, tng, defiant_helmsman, crew_max_rarity_5","Ramming Speed",0, 6, 8, 5, 10, 1, 1, , , , 540, 200, 152, 400, false,"Wyatt",crew_portraits_cm_defiant_helmsman_sm.png,defiant_helmsman_crew
"Returning Craft",8,5, 1246,211,449,0,0,0,972,97,212,0,0,0,531,57,172,0,0,0,258,95,211,173,128,586,0,964,0,521,274,433,927,0,785,274,177,211,234,174,839,0,1058,0,766,634,716,1032,0,884,428,645,"Romantic, Human, Crafty, Resourceful, Pilot, Veteran, Displaced","male, organic, craft, dsc, crew_max_rarity_5","Then I'll Just Say Goodbye",1, 9, 4, 10, 8, , , , , , 440, 270, 10, 200, false,"Craft",crew_portraits_cm_craft_shuttle_sm.png,dsc_craft_shuttle_crew
"Solbor",9,4, 0,0,0,689,58,142,0,0,0,0,0,0,918,135,305,0,0,0,826,0,0,769,0,756,548,163,456,0,773,0,571,0,488,1137,0,0,809,0,1119,810,367,701,0,826,0,621,0,553,1186,1311,"Bajoran, Exobiology, Spiritual","nonhuman, male, organic, ds9, solbor, crew_max_rarity_4","How May I Serve You",1, 6, 10, 8, 12, 6, 0, , , , 390, 320, 76, 275, false,"Solbor",crew_portraits_cm_solbor_sm.png,solbor_crew
"Acting Captain Pike",5,3, 499,86,266,0,0,0,197,56,126,0,0,0,323,53,141,0,0,0,937,789,879,798,785,1232,0,1181,0,1061,1025,1002,1155,0,1006,798,580,722,642,655,1145,0,1127,0,992,919,935,1096,0,952,1317,1243,"Starfleet, Human, Federation, Inspiring, Explorer, Tactician","male, organic, dsc, pike, crew_max_rarity_3","Intercept Course",1, 6, 10, 12, 10, , , , 2, 3, 500, 100, 140, 405, false,"Pike",crew_portraits_cm_pike_acting_sm.png,dsc_pike_acting_crew
"Timekeeper Tenavik",6,5, 1306,149,344,1116,99,236,0,0,0,0,0,0,568,44,104,0,0,0,17,441,230,178,144,407,305,162,246,0,1078,0,930,0,788,131,627,453,500,395,792,536,612,478,0,1264,0,1153,0,1003,205,1008,"Klingon, Cultural Figure, Spiritual, Communicator","nonhuman, male, organic, dsc, tenavik, crew_max_rarity_5","Lift The Veil",2, 8, 5, 12, 8, 7, 0, , , , 325, 50, 207, 250, false,"Tenavik",crew_portraits_cm_tenavik_timekeeper_sm.png,dsc_tenavik_timekeeper_crew
"New Eden Pike",8,5, 978,126,282,504,113,236,0,0,0,0,0,0,1277,216,433,0,0,0,146,641,486,72,400,893,632,86,539,0,397,0,219,0,198,187,759,618,130,566,773,525,94,459,0,456,0,261,0,251,234,318,"Starfleet, Human, Federation, Resourceful, Explorer, Tactician","male, organic, dsc, pike, crew_max_rarity_5","You Were Right About Us",0, 8, 6, 8, 8, , , , , , 290, 100, 77, 540, false,"Pike",crew_portraits_cm_pike_neweden_sm.png,dsc_pike_neweden_crew
"New Eden Owosekun",6,4, 415,43,85,612,94,146,908,148,257,0,0,0,0,0,0,0,0,0,515,415,1038,1174,955,105,584,879,492,540,802,447,0,0,0,783,587,1138,1248,1050,290,721,1038,616,607,873,559,0,0,0,942,1220,"Starfleet, Federation, Resourceful, Human, Survivalist, Innovator","female, organic, dsc, owosekun, crew_max_rarity_4","Isolating the Source",2, 8, 8, 8, 10, 5, 0, , , , 550, 210, 120, 390, false,"Owosekun",crew_portraits_cm_owosekun_neweden_sm.png,dsc_owosekun_neweden_crew
"Tribble Herder Scotty",7,5, 531,56,128,0,0,0,970,152,333,1331,211,464,0,0,0,0,0,0,1017,276,47,1091,861,475,175,0,0,12,685,312,186,40,0,1147,422,88,1194,992,524,200,0,0,17,706,408,226,87,0,237,398,"Human, Starfleet, Federation, Tribbled, Jury Rigger, Tactician","male, organic, tos, scott, crew_max_rarity_5","They're In The Machinery",1, 6, 6, 10, 16, 2, 0, , , , 295, 100, 110, 400, false,"Scotty",crew_portraits_cm_scotty_tribbles_sm.png,scott_tribbles_crew
"Stranded Craft",3,3, 337,48,130,0,0,0,526,63,171,223,29,79,0,0,0,0,0,0,1184,737,844,1227,1029,960,910,0,0,636,1086,771,1211,723,0,1157,760,890,1204,1000,1017,905,0,0,714,1148,851,1195,719,0,1326,1353,"Romantic, Human, Crafty, Resourceful, Pilot, Veteran","male, organic, craft, dsc, crew_max_rarity_3","Anyone Else On This Ship?",2, 5, 4, 8, 12, , , , , , 540, , 40, 150, false,"Craft",crew_portraits_cm_craft_sm.png,dsc_craft_crew
"Bounty Hunter Mudd",8,5, 0,0,0,486,88,176,1300,174,348,1039,92,178,0,0,0,0,0,0,1028,446,532,0,0,54,129,1023,618,34,459,160,555,255,0,991,603,928,0,0,148,324,998,576,154,652,353,940,547,0,458,876,"Human, Civilian, Costumed, Courier, Cyberneticist, Scoundrel, Smuggler, Thief","male, organic, dsc, mudd, crew_max_rarity_5","How Dare You!",0, 7, 8, 8, 10, 4, 2, , , , 325, 200, 179, 442, false,"Mudd",crew_portraits_cm_mudd_bounty_sm.png,dsc_mudd_bounty_crew
"Runaway Po",5,4, 0,0,0,367,95,207,0,0,0,821,130,291,678,142,291,0,0,0,1080,0,622,871,0,1075,234,428,671,594,915,0,106,327,618,914,0,619,819,0,873,164,250,526,598,840,0,96,344,572,849,743,"Jury Rigger, Prodigy, Cultural Figure, Xahean, Innovator, Resourceful","nonhuman, organic, female, dsc, po, crew_max_rarity_4","Be Extraordinary",1, 8, 8, 6, 8, , , , , , 290, 295, 105, 300, false,"Po",crew_portraits_cm_po_runaway_sm.png,dsc_po_runaway_crew
"Maras",9,5, 973,156,329,0,0,0,0,0,0,0,0,0,1268,257,505,0,0,0,508,603,441,51,353,0,0,266,0,0,360,0,179,0,162,558,641,470,51,409,0,0,229,0,0,304,0,156,0,172,666,585,"Romantic, Scoundrel, Orion, Casual, Civilian, Crafty","nonhuman, organic, female, maras, ent, crew_max_rarity_5","How Many Levels Are There?",1, 7, 8, 8, 14, 8, 4, , , , 250, 85, 94, 550, false,"Maras",crew_portraits_cm_maras_sm.png,maras_crew
"Fugitive Burnham",5,4, 0,0,0,0,0,0,654,81,161,0,0,0,928,129,269,421,29,101,0,873,0,776,974,779,0,661,716,706,207,285,583,647,200,0,1020,0,872,1056,993,0,781,769,878,463,611,711,708,411,890,1230,"Federation, Starfleet, Astrophysicist, Xenoanthropology, Human, Resourceful, Desperate","female, organic, dsc, burnham, crew_max_rarity_4","Are You Real?",0, 6, 4, 5, 8, , , , , , 265, 225, 80, 300, true,"Burnham",crew_portraits_cm_burnham_fugitive_sm.png,dsc_burnham_fugitive_crew
"Rigel VII Vina",9,4, 0,0,0,0,0,0,646,150,307,0,0,0,929,148,307,0,0,0,0,810,0,756,0,718,0,631,0,652,160,571,546,0,475,0,695,0,784,0,577,0,671,0,518,173,459,579,0,510,1147,1102,"Human, Costumed, Desperate, Romantic","female, organic, tos, vina, crew_max_rarity_4","We Must Hide Ourselves",1, 7, 8, 8, 12, , , , , , 415, 115, 275, 325, false,"Vina",crew_portraits_cm_vina_rigel_sm.png,vina_rigel_crew
"Protomorphosis Riker",6,4, 665,57,159,0,0,0,892,157,331,0,0,0,0,0,0,0,0,0,839,244,765,961,687,581,0,0,0,513,782,429,0,0,0,1082,393,1026,1134,937,516,0,0,0,477,698,400,0,0,0,1195,1260,"Human, Federation, Starfleet, Brutal, Gambler, Primal, Desperate","male, organic, tng, riker, crew_max_rarity_4","Devolution",0, 7, 6, 8, 14, 1, 0, , 2, 3, 350, 125, 132, 125, false,"Riker",crew_portraits_cm_riker_caveman_sm.png,riker_caveman_crew
"Kaminar Saru",6,4, 0,0,0,578,104,257,0,0,0,844,132,277,402,53,107,0,0,0,857,0,612,1171,0,800,128,523,483,585,1194,0,299,318,948,804,0,640,1225,0,752,140,548,450,610,1253,0,390,360,992,986,1088,"Kelpien, Civilian, Resourceful, Jury Rigger, Innovator, Survivalist","male, nonhuman, organic, dsc, saru, crew_max_rarity_4","I Saw Hope In The Stars",1, 8, 4, 6, 8, , , , 0, 3, 365, 200, 20, 140, false,"Saru",crew_portraits_cm_saru_kelpien_sm.png,dsc_saru_kelpien_crew
"Pining Vina",9,5, 0,0,0,483,106,216,0,0,0,0,0,0,1287,225,456,831,183,413,980,0,0,433,494,952,682,89,96,0,372,461,190,295,22,874,0,0,466,294,827,560,91,71,0,406,271,224,157,17,412,166,"Human, Civilian, Romantic, Desperate, Diplomat","organic, female, dsc, vina, crew_max_rarity_5","Who Are You?",2, 7, 10, 5, 10, 7, 0, , , , 350, 210, 158, 425, false,"Vina",crew_portraits_cm_vina_sm.png,dsc_vina_crew
"Flotter",7,4, 0,0,0,848,177,367,0,0,0,0,0,0,619,121,261,302,82,220,631,0,0,940,1018,595,430,165,158,0,955,936,785,677,382,478,0,0,888,796,446,319,128,94,0,917,751,726,514,225,900,658,"Hologram, Caregiver, Cultural Figure","voy, nonhuman, artificial_life, flotter, male, crew_max_rarity_4","No More Lying",2, 8, 8, 6, 10, , , , , , 375, 255, 125, 450, false,"Flotter",crew_portraits_cm_flotter_sm.png,flotter_crew
"Trevis",7,4, 0,0,0,319,70,201,861,157,318,0,0,0,582,138,273,0,0,0,1156,726,0,955,0,283,848,527,732,550,219,457,799,0,679,974,663,0,853,0,181,648,316,565,490,197,424,687,0,607,930,734,"Hologram, Caregiver, Cultural Figure, Gardener","voy, nonhuman, artificial_life, trevis, male, crew_max_rarity_4","I'm Not A Monster!",0, 8, 8, 8, 10, , , , , , 540, 200, 112, 125, false,"Trevis",crew_portraits_cm_trevis_sm.png,trevis_crew
"Desert Archer",8,5, 852,149,341,567,69,177,0,0,0,0,0,0,1218,245,474,0,0,0,164,719,580,98,487,877,616,91,529,0,429,0,246,0,216,207,632,461,60,398,995,711,109,608,0,349,0,190,0,192,392,254,"Human, Starfleet, Explorer, Telepath, Resourceful, Survivalist","male, organic, ent, archer, crew_max_rarity_5","You're Lying!",2, 10, 8, 8, 10, , , , , , 500, 100, 140, 365, false,"Archer",crew_portraits_cm_archer_desert_sm.png,archer_desert_crew
"Dark Empath Troi",8,5, 937,143,322,0,0,0,1300,178,445,0,0,0,0,0,0,473,101,246,579,68,508,742,46,216,0,0,612,206,398,18,0,562,833,596,111,501,725,90,310,0,0,465,289,476,47,0,435,695,349,267,"Starfleet, Federation, Human, Betazoid, Empath, Counselor, Brutal","nonhuman, female, organic, tng, troi, crew_max_rarity_5","Take Me With You!",0, 9, 8, 8, 8, , , , 1, 3, 450, 230, 100, 430, false,"Troi",crew_portraits_cm_troi_darkempath_sm.png,troi_darkempath_crew
"Torchbearer Tyler",7,4, 0,0,0,0,0,0,873,121,206,0,0,0,576,108,214,0,0,0,0,759,0,987,0,658,0,872,0,584,273,499,835,0,711,0,883,0,978,0,793,0,898,0,728,443,675,845,0,724,1245,1298,"Human, Federation, Starfleet, Cultural Figure, Tactician, Klingon","male, organic, dsc, tyler, voq, crew_max_rarity_4","That's a Torchbearer's Job",0, 9, 8, 10, 8, , , , , , 365, 250, 183, 425, false,"Tyler",crew_portraits_cm_tyler_torchbearer_sm.png,dsc_tyler_torchbearer_crew
"Safecracker Nog",7,4, 0,0,0,610,57,146,0,0,0,876,132,331,406,57,124,0,0,0,898,0,587,1154,0,845,125,555,507,555,1182,0,237,297,932,1129,0,536,1207,0,1113,208,796,694,524,1236,0,265,274,970,963,1162,"Ferengi, Costumed, Federation, Starfleet, Criminal, Resourceful","nonhuman, male, organic, ds9, nog, crew_max_rarity_4","Piece of Cake",2, 7, 6, 8, 10, , , , , , 390, 200, 180, 375, false,"Nog",crew_portraits_cm_nog_safecracker_sm.png,nog_safecracker_crew
"Dress Uniform Bashir",8,4, 0,0,0,654,63,140,0,0,0,0,0,0,350,42,134,761,185,414,855,0,0,1221,525,796,571,576,88,0,1236,506,1144,323,300,1130,0,0,1210,289,1114,803,806,109,0,1243,267,1124,152,168,1039,1042,"Human, Starfleet, Federation, Cyberneticist, Physician, Engineered, Gambler","nonhuman, male, organic, ds9, bashir, crew_max_rarity_4","Pleasure to Meet You!",0, 8, 6, 6, 8, , , , , , 215, 230, 93, 425, false,"Bashir",crew_portraits_cm_bashir_dressuniform_sm.png,bashir_dress_uniform_crew
"Little John Riker",7,5, 1023,128,239,0,0,0,1309,192,354,0,0,0,422,113,245,0,0,0,524,60,455,338,368,248,0,1054,0,234,133,137,1017,0,874,768,213,696,398,632,421,0,831,0,395,177,318,766,0,662,369,529,"Human, Federation, Starfleet, Costumed, Thief","male, organic, tng, riker, crew_max_rarity_5","We Need a Diversion",0, 6, 10, 8, 16, 2, 0, , , , 515, 200, 125, 425, false,"Riker",crew_portraits_cm_riker_littlejohn_sm.png,riker_littlejohn_crew
"Transporter Chief Rand",10,4, 0,0,0,0,0,0,0,0,0,859,113,241,628,92,204,0,0,0,0,0,619,960,0,0,477,841,0,592,967,0,124,326,682,0,0,747,1025,0,0,515,957,0,703,1049,0,255,416,778,1237,1302,"Human, Federation, Starfleet, Desperate","female, organic, tos, rand, crew_max_rarity_4","Yank Them Back!",1, 8, 8, 8, 10, , , , , , 475, 275, 155, 242, false,"Rand",crew_portraits_cm_rand_transporter_sm.png,rand_transporter_crew
