"Botanist Sulu",5,4, 0,0,0,873,144,350,502,96,206,0,0,0,646,121,261,0,0,0,688,1066,0,986,0,139,503,188,384,937,558,824,848,0,703,609,1008,0,959,0,161,401,166,349,871,428,797,810,0,696,813,792,"Human, Federation, Starfleet, Pilot, Botanist, Casual","male, organic, sulu, tos, crew_max_rarity_4","Plants Can Be Very Sensitive",2, 7, 6, 6, 12, 0, 1, , , , 240, 95, 70, 100, false,"Sulu",crew_portraits_cm_sulu_botanist_sm.png,sulu_botanist_crew
"Hippie O'Brien",4,4, 654,81,198,0,0,0,0,0,0,340,66,146,950,152,353,0,0,0,893,938,483,266,716,0,964,635,0,1105,795,0,227,761,479,1020,1049,519,360,867,0,868,618,0,1049,748,0,228,721,455,966,1102,"Human, Starfleet, Federation, Resourceful, Communicator, Displaced, Costumed","male, organic, ds9, obrien, crew_max_rarity_4","I Think I Know What Happened",1, 5, 8, 10, 16, 2, 0, , , , 500, 200, 141, 325, false,"O'Brien",crew_portraits_cm_obrien_hippie_sm.png,obrien_hippie_crew
"Dr. T'Ana",8,5, 1026,154,303,510,81,180,0,0,0,0,0,0,0,0,0,1318,258,308,144,643,462,734,3,1063,788,1079,46,0,0,198,0,96,244,240,755,593,819,33,1053,770,1091,104,0,0,341,0,204,394,338,618,"Federation, Starfleet, Caitian, Physician, Brutal, Exobiology","female, nonhuman, organic, low, tana, crew_max_rarity_5","Nobody's Authorized to Pass Out!",1, 7, 2, 15, 30, , , , , , 300, 200, 155, 50, false,"T'Ana",crew_portraits_cm_dr_tana_sm.png,dr_tana_crew
"EV Suit Reed",7,5, 1057,100,250,526,80,181,0,0,0,1324,199,372,0,0,0,0,0,0,146,660,13,755,371,1028,75,1044,617,284,0,0,268,84,0,386,923,67,1003,706,1054,128,1092,637,419,0,0,434,188,0,308,775,"Starfleet, Human, Artist, Explorer, Resourceful, Hero","male, organic, ent, evsuit, reed, crew_max_rarity_5","Charges Are Set",0, 7, 6, 8, 14, 7, 2, , , , 200, 275, 40, 300, false,"Reed",crew_portraits_cm_reed_ev_suit_sm.png,reed_ev_suit_crew
"Badgey",5,3, 0,0,0,479,93,220,0,0,0,346,70,168,202,41,102,0,0,0,1095,0,1171,1388,0,1078,517,854,660,1093,1407,0,928,742,1141,962,0,1082,1352,0,926,349,744,561,988,1386,0,806,674,1100,1444,1400,"Hologram, Federation, Starfleet, Resourceful, Communicator, Playful","male, nonhuman, artificial_life, low, badgey, crew_max_rarity_3","Hi, Can I Teach You A Lesson?",2, 6, 4, 8, 10, , , , , , 115, 85, 30, 100, false,"Badgey",crew_portraits_cm_badgey_sm.png,badgey_crew
"USS Titan Bradward Boimler",7,4, 873,150,252,0,0,0,683,100,202,325,50,150,0,0,0,0,0,0,731,272,309,889,533,810,980,0,0,448,1043,640,1265,774,0,777,427,338,925,620,938,902,0,0,518,1132,798,1196,739,0,1054,1219,"Federation, Starfleet, Human, Desperate, Resourceful, Pilot","male, organic, low, boimler, crew_max_rarity_4","I Dont Have To Write That Down",2, 9, 8, 8, 8, , , , 1, 2, 475, 265, 360, 425, false,"Boimler",crew_portraits_cm_boimler_uss_titan_sm.png,boimler_uss_titan_crew
"Bat'leth Mariner",1,4, 552,250,451,0,0,0,693,298,600,0,0,0,0,0,0,294,50,152,812,234,738,945,328,651,0,0,828,594,872,218,0,787,1104,251,14,212,449,49,101,0,0,763,110,189,20,0,742,1025,972,72,"Federation, Starfleet, Human, Maverick, Resourceful, Brutal, Scoundrel, Duelist, Playful","female, organic, low, mariner, crew_max_rarity_4","I Demand Honor",0, 7, 8, 6, 10, 1, 1, , , , 425, 365, 170, 425, false,"Mariner",crew_portraits_cm_mariner_batleth_sm.png,mariner_batleth_crew
"Roy Ritterhouse",7,4, 0,0,0,920,101,250,0,0,0,659,80,180,381,47,152,0,0,0,712,0,835,1281,0,700,128,377,398,787,1317,0,489,478,1034,891,0,1026,1290,0,851,288,552,500,946,1335,0,629,632,1029,1030,1319,"Human, Civilian, Artist, Inspiring, Scoundrel","male, organic, ds9, martok, crew_max_rarity_4","Okay, Friends and Neighbours",0, 5, 8, 6, 8, 5, 2, , , , 390, 75, 25, 340, false,"Ritterhouse",crew_portraits_cm_martok_ritterhouse_sm.png,martok_ritterhouse_crew
"Mok'bara Worf",7,5, 0,0,0,516,50,158,1351,155,368,0,0,0,1046,76,276,0,0,0,1115,441,0,752,0,51,826,225,678,252,29,140,522,0,441,1218,654,0,1011,0,214,895,532,748,490,218,389,863,0,735,310,926,"Klingon, Federation, Starfleet, Brutal, Duelist, Athlete, Spiritual","male, nonhuman, organic, tng, worf, crew_max_rarity_5","Defend Yourself",0, 10, 6, 4, 8, , , , , , 375, 200, 300, 425, false,"Worf",crew_portraits_cm_worf_mokbara_sm.png,worf_mokbara_crew
"Admiral Vance",6,5, 1424,151,302,528,53,153,0,0,0,0,0,0,1058,102,249,0,0,0,76,429,201,43,106,1081,808,219,663,0,739,0,511,0,432,309,771,605,326,513,1204,897,537,751,0,1062,0,867,0,740,281,1080,"Federation, Starfleet, Human, Cultural Figure, Inspiring, Brutal, Desperate, Ambassador","male, organic, dsc, vance, crew_max_rarity_5","The Past Is The Only Light With Which We Can See The Future.",2, 10, 8, 10, 12, , , , 1, 2, 500, 215, 252, 740, false,"Vance",crew_portraits_cm_vance_admiral_sm.png,dsc_vance_admiral_crew
"Mok'bara Sito Jaxa",6,4, 0,0,0,0,0,0,953,135,311,318,94,194,668,89,209,0,0,0,0,721,1178,1009,0,601,944,900,0,229,189,444,481,746,725,0,786,967,1106,0,678,699,1029,0,215,338,551,419,583,838,937,1011,"Bajoran, Federation, Starfleet, Duelist, Athlete, Pilot, Desperate, Prodigy, Maverick","nonhuman, female, organic, sito, tng, crew_max_rarity_4","It's Not A Fair Test",1, 7, 8, 10, 10, 0, 2, , , , 575, 160, 185, 140, false,"Sito",crew_portraits_cm_sito_jaxa_mokbara_sm.png,sito_jaxa_mokbara_crew
"Orbital Skydiving Torres",6,5, 0,0,0,0,0,0,1316,165,424,1107,107,266,0,0,0,480,100,215,0,444,426,0,924,244,368,0,669,16,435,25,473,25,914,0,579,762,0,801,404,553,0,554,79,612,70,816,89,798,250,606,"Klingon, Human, Maquis, Federation, Starfleet, Desperate, Athlete","evsuit, nonhuman, female, organic, voy, torres, crew_max_rarity_5","Disengage Safety Protocols",1, 8, 8, 10, 8, 0, 1, , , , 490, 100, 125, 200, false,"Torres",crew_portraits_cm_torres_orbital_sm.png,torres_orbital_crew
"Qalankhkai Elnor",6,5, 503,92,240,0,0,0,1010,186,416,0,0,0,1273,262,521,0,0,0,1032,254,981,159,864,441,0,296,0,409,9,293,210,0,175,909,217,861,96,752,378,0,227,0,371,21,267,165,0,162,125,94,"Romulan, Duelist, Qowat Milat, Spiritual, Hero, Desperate","nonhuman, organic, male, pic, elnor, crew_max_rarity_5","I Have Bound Myself",2, 8, 8, 8, 12, 1, 1, , , , 450, 270, 140, 525, false,"Elnor",crew_portraits_cm_elnor_qalankhkai_sm.png,elnor_qalankhkai_crew
"Shroomies",1,4, 0,0,0,841,219,543,508,208,502,308,150,304,0,0,0,0,0,0,574,887,1096,0,0,79,164,633,316,378,1030,633,1163,702,0,205,421,603,0,0,12,16,267,135,20,366,156,642,323,0,820,45,"Brutal, Crafty, Hunter, Innovator, Resourceful, Saboteur, Tactician, Villain","nonhuman, organic, ent, shroomies, crew_max_rarity_4","You Are Defenseless",0, 9, 8, 6, 14, 1, 0, , , , 325, 200, 48, 150, false,"Shroomies",crew_portraits_cm_shroomies_sm.png,shroomies_crew
"Tribbled Koloth and Korax",3,5, 817,279,609,0,0,0,931,302,752,441,142,381,0,0,0,0,0,0,529,106,115,736,352,383,697,0,0,91,578,247,959,546,0,97,1,5,242,52,49,367,0,0,4,97,26,510,231,0,441,11,"Klingon, Duelist, Tribbled, Tactician, Brutal, Desperate, Diplomat","nonhuman, male, organic, tas, koloth, korax, gauntlet_jackpot, exclusive_gauntlet, crew_max_rarity_5","Dont Do That Again!",0, 10, 8, 6, 10, 1, 0, 2, 1, 4, 425, 435, 88, 150, false,"Koloth and Korax",crew_portraits_cm_koloth_korax_tribbled_sm.png,koloth_korax_tribbled_crew
"Captain Robert DeSoto",7,5, 1344,136,370,1063,142,336,0,0,0,0,0,0,661,62,151,0,0,0,15,469,242,154,133,472,361,155,274,0,1084,0,894,0,749,72,675,489,430,403,623,421,343,364,0,1314,0,1176,0,1004,120,764,"Human, Federation, Starfleet, Exobiology, Courier, Resourceful","male, organic, tng, desoto, crew_max_rarity_5","This Is Top Priority",2, 9, 6, 8, 12, 5, 0, , , , 450, 230, 35, 250, false,"DeSoto",crew_portraits_cm_desoto_captain_sm.png,desoto_captain_crew
"Professor Data",4,5, 1096,146,269,1325,244,462,0,0,0,0,0,0,0,0,0,560,97,195,11,616,415,692,26,199,179,295,32,0,0,773,0,545,798,37,824,687,909,153,247,206,328,52,0,0,828,0,586,857,117,341,"Android, Starfleet, Federation, Cyberneticist, Casual, Civilian","nonhuman, male, tng, artificial_life, data, crew_max_rarity_5","We Will Get To The Bottom Of This",2, 8, 4, 8, 10, 2, 0, , , , 650, 200, 165, 675, true,"Data",crew_portraits_cm_data_professor_sm.png,data_professor_crew
"Meditative T'Pol",5,4, 0,0,0,405,53,197,0,0,0,0,0,0,654,151,303,827,100,399,1166,0,0,948,540,1163,877,471,160,0,1018,548,820,354,87,1111,0,0,856,433,1079,796,321,140,0,879,447,669,261,93,943,769,"Vulcan, Starfleet, Romantic, Telepath, Counselor, Casual","nonhuman, female, organic, ent, tpol, crew_max_rarity_4","The Risk of Paralysis is Minimal",2, 9, 8, 6, 8, , , , , , 950, 145, 95, 150, false,"T'Pol",crew_portraits_cm_tpol_meditative_sm.png,tpol_meditative_crew
"Enterprise Pike",6,5, 1069,173,311,0,0,0,520,128,258,0,0,0,1362,246,444,0,0,0,465,240,407,23,305,930,0,271,0,853,86,754,191,0,155,604,270,531,68,444,770,0,333,0,723,92,645,260,0,229,28,178,"Starfleet, Federation, Human, Inspiring, Explorer, Tactician","male, organic, snw, pike, crew_max_rarity_5","The Future Is What We Make It",2, 7, 6, 8, 12, 4, 1, , , , 550, 80, 100, 475, false,"Pike",crew_portraits_cm_pike_snw_sm.png,pike_snw_crew
"Lt. Commander Spock",2,5, 1332,248,480,575,103,210,0,0,0,0,0,0,1049,229,422,0,0,0,52,397,181,10,83,921,669,145,543,0,611,0,412,0,346,55,403,184,27,129,927,663,123,562,0,480,0,304,0,259,12,119,"Human, Starfleet, Federation, Vulcan, Telepath, Astrophysicist, Exobiology","male, nonhuman, organic, snw, spock, crew_max_rarity_5","Hypotheticals Are Irrelevant",2, 9, 6, 8, 14, 1, 0, 2, , , 265, 225, 25, 75, false,"Spock",crew_portraits_cm_spock_lt_cmdr_sm.png,spock_lt_cmdr_crew
"Lt. Commander MacDougal",6,4, 369,73,147,0,0,0,689,110,217,913,192,349,0,0,0,0,0,0,1217,589,199,1288,1036,802,449,0,0,100,1031,634,607,280,0,1175,626,163,1240,1011,872,354,0,0,129,1083,739,481,217,0,882,895,"Human, Federation, Starfleet, Desperate, Jury Rigger, Resourceful","female, organic, tng, macdougal, crew_max_rarity_4","This Is The Wrong Chip",2, 8, 6, 10, 12, 5, 0, , , , 865, 225, 280, 465, false,"MacDougal",crew_portraits_cm_macdougal_lt_sm.png,macdougal_lt_crew
"Infected Tryla Scott",7,5, 1235,248,550,0,0,0,934,205,437,0,0,0,429,136,304,0,0,0,250,49,219,170,115,492,0,1055,0,449,228,327,1042,0,873,164,26,134,53,94,307,0,782,0,308,90,204,702,0,609,269,54,"Human, Federation, Starfleet, Prodigy, Resourceful, Desperate, Inspiring, Undercover Operative","organic, female, tng, tryla_scott, crew_max_rarity_5","Keep Your Eyes Open",2, 10, 6, 6, 10, , , , , , 400, 205, 120, 300, false,"Tryla",crew_portraits_cm_tryla_scott_infected_sm.png,tryla_scott_infected_crew
"Ruon Tarka",7,5, 592,42,148,1295,192,393,0,0,0,1049,157,257,0,0,0,0,0,0,77,1030,118,1112,816,305,16,371,163,461,0,0,499,217,0,194,1210,333,1299,1070,449,59,499,270,682,0,0,748,397,0,282,778,"Risian, Federation, Civilian, Thief, Desperate, Innovator, Prodigy, Scoundrel, Quantum Mechanics","male, nonhuman, organic, dsc, ruon, crew_max_rarity_5","Let's Get Our Hands Dirty",1, 8, 7, 5, 10, 4, 2, , , , 335, 200, 60, 340, false,"Ruon",crew_portraits_cm_ruon_tarka_sm.png,dsc_ruon_tarka_crew
"Lt. JG Picard",6,4, 0,0,0,914,98,212,0,0,0,605,98,224,408,50,152,0,0,0,733,0,858,1250,0,715,141,374,417,810,1291,0,485,500,1007,968,0,882,1281,0,939,261,612,567,836,1328,0,515,515,1021,1051,1290,"Human, Starfleet, Federation, Astrophysicist, Desperate","organic, male, tng, picard, crew_max_rarity_4","I Believe That I Can Do More",2, 7, 8, 3, 8, 1, 0, , , , 690, 170, 200, 450, true,"Picard",crew_portraits_cm_picard_ltjg_sm.png,picard_ltjg_crew
"Willie Hawkins",2,4, 412,67,151,0,0,0,911,191,385,0,0,0,656,145,289,0,0,0,1171,360,1103,623,996,551,0,861,0,508,162,391,824,0,676,1179,340,1129,537,1014,435,0,795,0,408,133,312,716,0,623,818,693,"Human, Civilian, Athlete, Romantic, Casual, Inspiring","nonhuman, male, organic, worf, ds9, crew_max_rarity_4","Suit Yourself",0, 8, 8, 6, 8, , , , , , 325, 170, 98, 315, false,"Worf",crew_portraits_cm_hawkins_sm.png,worf_hawkins_crew
"Surata IV La Forge",5,4, 0,0,0,384,82,179,0,0,0,900,155,343,0,0,0,647,107,252,1177,0,603,0,681,1182,188,1187,248,595,0,654,652,24,730,1083,0,509,0,700,1055,161,1093,223,525,0,704,545,36,725,942,867,"Human, Starfleet, Federation, Cyberneticist, Gambler, Maverick, Exobiology","male, organic, tng, laforge, crew_max_rarity_4","Let's Try Something",1, 6, 4, 8, 12, 6, 0, , , , 240, 200, 175, 300, false,"La Forge",crew_portraits_cm_laforge_surata_sm.png,laforge_surata_crew
"Hollow Data",6,5, 0,0,0,1316,245,451,0,0,0,1047,126,258,578,102,206,0,0,0,224,0,478,1077,0,213,13,80,117,479,1120,0,126,226,781,277,0,743,1081,0,258,39,108,172,731,1128,0,257,432,813,174,379,"Android, Federation, Starfleet, Cyberneticist, Musician, Spiritual, Exobiology","nonhuman, male, artificial_life, data, tng, crew_max_rarity_5","This Is Where I Belong",2, 9, 6, 6, 10, 5, 0, , , , 900, 200, 240, 200, true,"Data",crew_portraits_cm_data_hollow_sm.png,data_hollow_crew
"Temporarily Detained Jett Reno",6,5, 0,0,0,538,108,216,0,0,0,1314,183,406,1027,149,311,0,0,0,983,0,233,725,0,961,66,186,567,285,714,0,24,85,418,939,0,368,831,0,906,88,234,542,391,847,0,52,164,546,240,386,"Starfleet, Federation, Human, Jury Rigger, Resourceful, Veteran, Crafty, Tactician, Prisoner, Displaced","female, organic, dsc, jett_reno, crew_max_rarity_5","I Have Something That Can Help",2, 8, 4, 8, 12, 2, 4, , , , 450, 255, 260, 555, true,"Reno",crew_portraits_cm_dsc_reno_detained_sm.png,dsc_jett_reno_detained_crew
"Brunt, F.C.A.",7,5, 1334,172,347,0,0,0,578,77,196,0,0,0,1073,132,307,0,0,0,278,176,250,44,143,927,0,548,0,847,185,747,467,0,399,529,344,460,199,377,1010,0,786,0,921,374,846,706,0,612,186,686,"Ferengi, Civilian, Crafty, Interrogator, Cultural Figure, Constable","nonhuman, male, organic, ds9, brunt, crew_max_rarity_5","Brunt, F.C.A.",1, 7, 4, 8, 14, 4, 1, , , , 300, 75, 50, 225, false,"Brunt",crew_portraits_cm_brunt_fca_sm.png,brunt_fca_crew
"Disorderly Icheb",7,4, 888,80,178,653,48,101,0,0,0,0,0,0,0,0,0,0,0,0,186,841,687,921,562,920,668,966,542,0,0,0,0,0,0,778,1075,1032,1166,913,1293,980,1284,826,0,0,0,0,0,0,1377,1531,"Civilian, Brunali, Federation, Borg, Desperate, Maverick, Engineered, Astrophysicist, Prodigy","male, nonhuman, organic, voy, icheb, crew_max_rarity_4","No, I Wont",0, 7, 10, 10, 10, , , , , , 415, 325, 393, 800, false,"Icheb",crew_portraits_cm_icheb_disorderly_sm.png,icheb_disorderly_crew
"Ryn",4,5, 0,0,0,0,0,0,584,69,170,1332,254,452,1042,150,302,0,0,0,0,1005,188,713,0,934,175,568,0,62,198,758,18,43,412,0,1109,209,863,0,1090,191,745,0,86,421,900,24,77,576,115,337,"Andorian, Civilian, Communicator, Inspiring, Hero, Desperate, Prisoner, Survivalist","male, organic, nonhuman, dsc, ryn, crew_max_rarity_5","Who's Ready To Get Out Of Here?",2, 9, 5, 8, 8, , , , , , 575, 300, 160, 625, false,"Ryn",crew_portraits_cm_ryn_sm.png,dsc_ryn_crew
"Paul Mayweather",8,4, 814,197,350,0,0,0,0,0,0,639,153,299,342,51,146,0,0,0,720,808,117,558,528,0,584,1259,0,741,1351,0,465,432,1077,489,627,47,403,339,0,448,1216,0,615,1340,0,292,325,1034,1010,744,"Human, Civilian, Courier, Desperate, Resourceful, Jury Rigger","male, organic, ent, paul, crew_max_rarity_4","You Do Remember How To Fly This Ship?",1, 9, 4, 8, 7, , , , 2, 2, 325, 170, 155, 300, false,"Paul",crew_portraits_cm_mayweather_paul_sm.png,mayweather_paul_crew
"Barge of the Dead Torres",4,5, 0,0,0,0,0,0,1350,217,398,1069,154,304,588,99,203,0,0,0,0,405,423,1068,0,184,364,950,0,13,89,107,97,201,772,0,534,588,1096,0,350,432,1022,0,38,181,242,186,309,830,52,369,"Klingon, Human, Federation, Starfleet, Survivalist, Spiritual, Desperate","nonhuman, female, organic, voy, torres, crew_max_rarity_5","This Should Be Interesting",2, 10, 6, 8, 12, 1, 0, 2, 1, 3, 325, 200, 141, 175, false,"Torres",crew_portraits_cm_torres_bargeofdead_sm.png,torres_bargeofdead_crew
"Civilian Exchange Chapel",8,5, 0,0,0,538,50,102,0,0,0,1010,173,327,0,0,0,1319,233,393,1122,0,459,0,125,1097,132,1120,44,459,0,167,497,3,219,1300,0,505,0,240,1289,244,1280,124,522,0,248,541,10,301,321,624,"Federation, Human, Civilian, Resourceful, Nurse, Geneticist","female, organic, snw, chapel, crew_max_rarity_5","Maybe I Wasn't Clear",2, 10, 5, 5, 8, , , , 0, 3, 300, 150, 230, 365, false,"Chapel",crew_portraits_cm_chapel_civilian_exchange_sm.png,chapel_civilian_exchange_crew
"O'Brien at the Conn",4,4, 890,109,303,0,0,0,0,0,0,331,76,155,676,99,200,0,0,0,715,800,285,294,523,0,963,894,0,1103,1052,0,487,760,716,762,826,273,437,598,0,826,1030,0,1006,1149,0,505,687,839,1025,1176,"Human, Federation, Starfleet, Resourceful, Pilot, Tactician, Veteran","male, tng, obrien, organic, crew_max_rarity_4","All Forward Motion Stopped, Sir",2, 8, 8, 12, 12, 5, 0, , , , 415, 225, 73, 225, false,"O'Brien",crew_portraits_cm_obrien_conn_sm.png,obrien_conn_crew
"Doctor M'Benga",9,5, 1056,87,280,523,86,188,0,0,0,0,0,0,0,0,0,1323,161,298,142,653,477,744,4,1022,749,1040,49,0,0,216,0,111,288,335,897,774,973,79,1023,734,1068,152,0,0,532,0,344,558,412,909,"Human, Starfleet, Federation, Physician, Caregiver, Desperate, Jury Rigger","male, organic, snw, mbenga, crew_max_rarity_5","Somewhere Out There is the Discovery I Need",2, 6, 8, 6, 10, 6, 0, , , , 325, 400, 243, 415, false,"M'Benga",crew_portraits_cm_mbenga_doctor_sm.png,mbenga_doctor_crew
"Pirate Tendi",6,4, 390,52,187,0,0,0,685,113,203,0,0,0,0,0,0,939,147,309,1180,577,1109,1251,103,806,0,0,368,743,1041,42,0,302,537,1123,616,1078,1199,164,903,0,0,395,846,1105,129,0,350,569,889,1077,"Orion, Federation, Starfleet, Costumed, Criminal","female, organic, nonhuman, low, tendi, crew_max_rarity_4","Nice Shot Da Vinci!",0, 7, 8, 6, 10, 8, 4, , , , 415, 120, 267, 450, false,"Tendi",crew_portraits_cm_tendi_pirate_sm.png,tendi_pirate_crew
"Chief Engineer Hemmer",8,4, 679,71,154,401,52,102,0,0,0,906,123,204,0,0,0,0,0,0,514,939,136,1035,717,1235,267,1222,773,653,0,0,728,350,0,822,1141,416,1228,995,1287,405,1278,823,817,0,0,904,501,0,1059,1386,"Aenar, Andorian, Starfleet, Federation, Telepath, Resourceful","male, nonhuman, organic, snw, hemmer, crew_max_rarity_4","Pacifism Is Not Passivity",1, 5, 10, 12, 19, 2, 0, , , , 615, 200, 250, 625, false,"Hemmer",crew_portraits_cm_hemmer_chief_sm.png,hemmer_chief_crew
"First Officer Una",6,5, 1288,250,399,0,0,0,0,0,0,522,99,175,1051,202,300,0,0,0,262,459,58,38,128,0,752,542,0,942,685,0,129,604,392,315,476,65,79,190,0,724,627,0,919,758,0,170,602,462,234,296,"Federation, Starfleet, Human, Resourceful, Explorer, Inspiring, Pilot, Engineered, Illyrian","female, nonhuman, organic, snw, number_one, crew_max_rarity_5","Can You Not Jinx It?",2, 10, 6, 6, 10, 1, 0, 3, , , 465, 200, 222, 215, false,"Una",crew_portraits_cm_una_firstofficer_sm.png,number_one_una_firstofficer_crew
"Puppy-Placated Janeway",7,5, 0,0,0,0,0,0,0,0,0,503,74,176,1116,110,237,1311,111,435,0,0,1043,689,159,0,818,549,169,976,694,204,140,19,15,0,0,1053,1025,360,0,782,938,295,964,1069,371,395,48,113,304,834,"Starfleet, Federation, Human, Resourceful, Gambler, Counselor","female, organic, voy, janeway, crew_max_rarity_5","I'm Not Buying It",1, 9, 6, 10, 10, 3, 0, 3, , , 500, 115, 110, 457, false,"Janeway",crew_portraits_cm_janeway_puppy_sm.png,janeway_puppy_crew
"Outpost Vina",7,4, 0,0,0,449,61,167,666,76,192,0,0,0,973,77,196,0,0,0,1159,917,0,858,0,413,866,287,723,768,223,655,681,0,560,1171,1059,0,1139,0,570,846,639,705,927,694,851,1029,0,879,914,1351,"Human, Civilian, Desperate, Prisoner, Romantic","female, organic, tos, vina, crew_max_rarity_4","A Prime Specimen",2, 9, 4, 10, 10, , , , , , 455, 280, 130, 275, false,"Vina",crew_portraits_cm_vina_outpost_sm.png,vina_outpost_crew
"Frantic McCoy",1,5, 906,243,651,0,0,0,0,0,0,0,0,0,1015,364,777,356,154,455,424,588,372,37,28,0,0,378,634,0,500,851,296,625,62,96,248,77,1,2,0,0,33,231,0,72,283,30,153,3,243,6,"Human, Federation, Starfleet, Physician, Exobiology, Resourceful, Desperate, Maverick","male, organic, tos, mccoy, exclusive_bridge, crew_max_rarity_5","Spock, Do Something!",0, 7, 8, 10, 10, 0, 1, , , , 800, 270, 532, 500, false,"McCoy",crew_portraits_cm_mccoy_frantic_sm.png,mccoy_frantic_crew
"Demo Man Scotty",7,5, 0,0,0,0,0,0,0,0,0,1647,100,365,0,0,0,0,0,0,0,0,133,0,0,0,131,0,0,138,0,0,147,27,0,0,0,567,0,0,0,419,0,0,573,0,0,602,291,0,1329,1497,"Federation, Starfleet, Human, Resourceful, Jury Rigger","male, organic, tos, scott, exclusive_bridge, crew_max_rarity_5","Once It's Activated, There's No Way To Stop It",0, 10, 6, 10, 12, 5, 0, , , , 790, 575, 240, 640, false,"Scotty",crew_portraits_cm_scott_demo_man_sm.png,scott_demo_man_crew
"Lt. Commander Ortegas",7,4, 830,230,456,0,0,0,579,102,184,0,0,0,393,92,149,0,0,0,641,283,580,453,459,919,0,1184,0,841,732,741,1169,0,1002,264,189,226,217,165,986,0,1124,0,906,715,829,1102,0,943,984,718,"Human, Federation, Starfleet, Pilot, Resourceful, Maverick","female, organic, snw, bridge_crew, ortegas, crew_max_rarity_4","Evasive Maneuvers",1, 8, 10, 10, 15, 0, 1, , , , 1030, 275, 198, 630, false,"Ortegas",crew_portraits_cm_ortegas_lt_sm.png,ortegas_lt_crew
"Vedala Elder",3,5, 1325,235,502,0,0,0,0,0,0,0,0,0,544,148,294,1061,208,405,209,402,184,140,1,0,0,928,237,0,1090,285,898,166,69,208,393,176,65,5,0,0,777,226,0,917,276,698,148,61,11,77,"Vedala, Ambassador, Diplomat, Cultural Figure, Resourceful, Tactician","nonhuman, female, organic, tas, vedala_elder, crew_max_rarity_5","We Give You Thanks",2, 9, 6, 10, 10, 3, 0, 3, , , 325, 205, 110, 280, false,"Vedala",crew_portraits_cm_vedala_elder_sm.png,vedala_elder_crew
"Bionic 5 Rutherford",8,5, 0,0,0,0,0,0,579,73,139,1000,126,365,1250,145,350,0,0,0,0,1018,472,568,0,962,389,433,0,127,142,775,38,222,308,0,1169,520,760,0,1164,391,640,0,241,384,963,68,258,475,381,748,"Human, Engineered, Starfleet, Federation, Criminal, Costumed","male, organic, low, rutherford, crew_max_rarity_5","Tremble At The Sight Of The Great Vindicta!",0, 8, 10, 10, 16, 8, 4, , , , 375, 300, 60, 175, false,"Rutherford",crew_portraits_cm_rutherford_pirate_sm.png,rutherford_pirate_crew
"Commander Ransom",8,5, 1313,354,502,0,0,0,1060,149,285,0,0,0,446,47,99,0,0,0,190,12,160,172,58,473,0,1181,0,435,277,313,1165,0,997,121,54,95,166,67,707,0,1285,0,653,633,577,1268,0,1096,251,270,"Human, Starfleet, Federation, Duelist, Brutal, Hero","male, organic, low, ransom, crew_max_rarity_5","Here We Go, Showtime",0, 7, 15, 8, 5, 4, 0, , , , 765, 125, 320, 1475, false,"Ransom",crew_portraits_cm_ransom_commander_sm.png,ransom_commander_crew
"Lt. JG Kayshon",9,5, 1067,137,301,0,0,0,1342,165,348,0,0,0,507,68,139,0,0,0,498,45,433,302,327,266,0,1121,0,272,128,158,1106,0,936,711,204,643,543,554,529,0,1191,0,504,354,405,1187,0,1013,283,796,"Tamarian, Federation, Communicator, Starfleet, Resourceful","nonhuman, male, organic, kayshon, low, crew_max_rarity_5","Bazminti When He Pulled Back The Veil Vibes",0, 10, 7, 6, 11, , , , , , 300, 140, 93, 90, false,"Kayshon",crew_portraits_cm_kayshon_ltjg_sm.png,kayshon_ltjg_crew
"Corrupted Badgey",4,5, 1080,150,303,0,0,0,1349,239,451,0,0,0,0,0,0,511,105,208,474,16,411,686,31,153,0,0,612,182,345,15,0,602,854,675,95,606,836,116,242,0,0,559,252,409,40,0,544,808,107,252,"Hologram, Federation, Starfleet, Communicator, Duelist, Brutal, Saboteur, Playful","male, nonhuman, artificial_life, low, badgey, crew_max_rarity_5","Can I Teach You A Lesson?",1, 9, 10, 6, 8, 1, 0, 2, , , 600, 500, 200, 680, false,"Badgey",crew_portraits_cm_badgey_corrupted_sm.png,badgey_corrupted_crew
"Ensign Rutherford",4,2, 0,0,0,262,21,83,0,0,0,377,55,145,153,22,67,0,0,0,1323,0,1149,1401,0,1323,631,1185,837,1083,1417,0,991,731,1153,1333,0,1165,1396,0,1330,671,1225,849,1077,1417,0,1000,740,1141,1516,1537,"Human, Engineered, Starfleet, Federation, Resourceful, Romantic","male, organic, low, rutherford, crew_max_rarity_2","Okeydokey!",2, 2, 5, 3, 8, 2, 0, , , , 205, 270, 60, 90, false,"Rutherford",crew_portraits_cm_rutherford_ensign_sm.png,rutherford_ensign_crew
"EV Suit Rutherford",5,4, 375,46,146,689,102,197,0,0,0,891,194,366,0,0,0,0,0,0,468,1195,215,1301,1050,819,111,886,481,574,0,0,628,293,0,606,1207,165,1297,1068,970,112,1038,584,435,0,0,452,198,0,940,983,"Human, Engineered, Starfleet, Federation, Romantic, Resourceful","male, organic, low, rutherford, evsuit, apr2023, crew_max_rarity_4","Run Training Beta 2.5",2, 7, 8, 8, 8, 3, 0, 2, , , 550, 75, 215, 450, false,"Rutherford",crew_portraits_cm_rutherford_ev_sm.png,rutherford_ev_crew
"Insubordinate Mariner",7,5, 1044,171,283,0,0,0,0,0,0,566,79,184,1328,165,351,0,0,0,517,634,108,55,338,0,698,355,0,877,479,0,67,547,231,674,764,195,197,511,0,740,599,0,938,732,0,166,624,442,245,687,"Federation, Starfleet, Human, Desperate, Maverick, Smuggler, Scoundrel, Playful","female, organic, low, mariner, crew_max_rarity_5","Come On Check It Out",0, 9, 4, 8, 10, , , , 1, 2, 575, 165, 210, 675, false,"Mariner",crew_portraits_cm_insubordinate_mariner_sm.png,insubordinate_mariner_crew
"Cabaret Georgiou",7,5, 1360,177,454,0,0,0,1052,130,319,0,0,0,493,70,168,0,0,0,216,34,192,168,96,474,0,1122,0,436,231,314,1107,0,937,340,122,287,262,211,661,0,1130,0,628,422,533,1113,0,949,227,483,"Terran Empire, Mirror Universe, Human, Brutal, Desperate, Royalty, Bartender","female, organic, dsc, georgiou, crew_max_rarity_5","Ill Ask Again--What Do You Want?",0, 8, 10, 5, 8, 6, 0, , , , 300, 135, 277, 725, false,"Georgiou",crew_portraits_cm_georgiou_cabaret_sm.png,dsc_georgiou_cabaret_crew
"Data and Spot",8,5, 0,0,0,1065,100,250,0,0,0,1328,171,371,538,54,152,0,0,0,538,0,241,1160,0,513,17,211,299,294,1200,0,70,88,874,892,0,425,1273,0,852,97,543,501,466,1324,0,202,212,1014,322,903,"Android, Starfleet, Federation, Cyberneticist, Caregiver, Writer","nonhuman, male, tng, artificial_life, data, exclusive_collection, crew_max_rarity_5","Oh, Spot, The Complex Levels of Behavior You Display!",2, 10, 8, 8, 12, , , , 1, 2, 650, 200, 165, 675, false,"Data",crew_portraits_cm_data_spot_sm.png,data_spot_crew
