crew, tier, rarity, CMD_core, CMD_min, CMD_max, SCI_core, SCI_min, SCI_max, SEC_core, SEC_min, SEC_max, ENG_core, ENG_min, ENG_max, DIP_core, DIP_min, DIP_max, MED_core, MED_min, MED_max, V_CMD_SCI, V_CMD_SEC, V_CMD_ENG, V_CMD_DIP, V_CMD_MED, V_SCI_SEC, V_SCI_ENG, V_SCI_DIP, V_SCI_MED, V_SEC_ENG, V_SEC_DIP, V_SEC_MED, V_ENG_DIP, V_ENG_MED, V_DIP_MED, G_CMD_SCI, G_CMD_SEC, G_CMD_ENG, G_CMD_DIP, G_CMD_MED, G_SCI_SEC, G_SCI_ENG, G_SCI_DIP, G_SCI_MED, G_SEC_ENG, G_SEC_DIP, G_SEC_MED, G_ENG_DIP, G_ENG_MED, G_DIP_MED, voyage_rank, gauntlet_rank, traits, hidden_traits, action_name, action_bonus_type, action_bonus_amount, action_initial_cooldown, action_duration, action_cooldown, bonus_ability, trigger, uses_per_battle, penalty_type, penalty_amount, accuracy, crit_bonus, crit_chance, evasion, charge_phases, short_name, image_name, symbol
"Investigator Odo",8,1, 0,0,0,0,0,0,217,37,171,0,0,0,0,0,0,0,0,0,0,1169,0,0,0,1219,0,0,0,1055,1277,990,0,0,0,0,1084,0,0,0,1079,0,0,0,950,1198,897,0,0,0,1480,1474,"Changeling, Cardassian, Investigator, Interrogator","nonhuman, male, organic, ds9, odo, crew_max_rarity_1","Collaboration",2, 1, 20, 14, 10, , , , , , 400, 115, 67, 265, false,"Odo",crew_portraits_cm_odooccupation_sm.png,odo_occupation_crew
"Constable Odo",6,3, 317,107,225,0,0,0,523,27,85,0,0,0,0,0,0,0,0,0,1113,745,1036,1172,953,1046,0,0,0,915,1148,840,0,0,0,829,710,772,954,699,1218,0,0,0,1047,1284,988,0,0,0,1375,1381,"Changeling, Bajoran, Constable, Investigator, Interrogator","nonhuman, male, organic, ds9, odo, crew_max_rarity_3","Justice",0, 6, 10, 12, 16, , , , 3, 800, 520, 300, 75, , false,"Odo",crew_portraits_cm_odostandard_sm.png,odo_constable_crew
"Ensign Ro",9,2, 322,46,132,0,0,0,0,0,0,0,0,0,0,0,0,0,0,0,1197,1153,1125,1235,1040,0,0,0,0,0,0,0,0,0,0,1155,1124,1082,1202,998,0,0,0,0,0,0,0,0,0,0,1475,1477,"Starfleet, Bajoran, Resourceful","nonhuman, female, organic, tng, ro, crew_max_rarity_2","Separate Ways",0, 4, 3, 10, 5, , , 2, , , 130, 210, 13, 200, false,"Ro",crew_portraits_cm_roensign_sm.png,ro_ensign_crew
"Shinzon",10,5, 819,94,241,0,0,0,938,183,435,0,0,0,546,176,390,0,0,0,717,164,636,333,544,437,0,819,0,385,152,286,775,0,658,827,187,768,232,695,314,0,471,0,294,59,213,401,0,363,636,192,"Human, Clone, Reman, Villain, Romulan","male, organic, tng, shinzon, crew_max_rarity_5","Destiny Complete",0, 7, 14, 3, 14, 1, 2, , , , 1325, 545, 365, 1050, false,"Shinzon",crew_portraits_cm_shinzon_sm.png,shinzon_crew
"Will Riker",6,1, 251,42,110,0,0,0,125,22,74,0,0,0,0,0,0,0,0,0,1213,1075,1149,1256,1059,1248,0,0,0,1076,1306,1016,0,0,0,1187,1007,1114,1228,1035,1232,0,0,0,1062,1296,999,0,0,0,1467,1458,"Human, Federation, Starfleet, Maverick, Gambler, Romantic","male, organic, tng, riker, crew_max_rarity_1","Poker Face",0, 1, 8, 10, 14, 4, 0, , , , 455, , 425, 340, false,"Riker",crew_portraits_cm_rikers1_sm.png,riker_s1_commander_crew
"Commander Riker",1,2, 279,78,191,0,0,0,124,29,89,0,0,0,290,22,64,0,0,0,1195,1038,1124,977,1039,1244,0,1206,0,1072,1169,1012,1184,0,1029,960,795,915,910,833,1215,0,1239,0,1046,1208,986,1217,0,1055,1407,1369,"Human, Federation, Starfleet, Pilot, Maverick, Gambler, Romantic","male, organic, tng, riker, crew_max_rarity_2","Liase",0, 2, 8, 10, 14, 5, 0, , , , 645, 50, 295, 275, false,"Riker",crew_portraits_cm_rikerpoker_sm.png,riker_s2_commander_crew
"Edith Keeler",8,4, 0,0,0,0,0,0,0,0,0,0,0,0,453,166,339,591,187,590,0,0,0,1013,569,0,0,905,413,0,1028,543,865,362,168,0,0,0,697,113,0,0,574,120,0,681,122,486,49,16,1286,565,"Civilian, Caregiver, Inspiring, Cultural Figure, Romantic, Human","female, organic, tos, keeler, crew_max_rarity_4","A Life Worth Living",1, 7, 8, 10, 8, , , , , , 690, 25, 52, 440, false,"Keeler",crew_portraits_cm_edithkeeler_sm.png,keeler_crew
"Ensign Tuvok",7,1, 0,0,0,181,51,197,0,0,0,0,0,0,138,33,74,0,0,0,1231,0,0,1295,0,1228,901,1113,770,0,1302,0,1228,0,1069,1024,0,0,1271,0,991,704,840,602,0,1289,0,1196,0,1036,1468,1431,"Vulcan, Federation, Starfleet, Telepath","nonhuman, male, organic, voy, tuvok, crew_max_rarity_1","Memory",0, 1, 1, 14, 10, , , , , , 103, 60, 135, 375, false,"Tuvok",crew_portraits_cm_tuvokensign_sm.png,tuvok_ensign_crew
"Security Chief Tuvok",4,3, 291,53,161,145,45,149,445,85,201,0,0,0,0,0,0,0,0,0,989,780,1134,1237,1046,741,913,1241,783,910,1143,835,0,0,0,712,624,1031,1138,944,543,823,1126,715,812,1056,763,0,0,0,1349,1271,"Vulcan, Federation, Starfleet, Telepath, Tactician, Investigator","nonhuman, male, organic, voy, tuvok, crew_max_rarity_3","Contingency Plan",0, 4, 10, 12, 16, 5, 0, , , , 465, 50, , 300, false,"Tuvok",crew_portraits_cm_tuvokrifle_sm.png,tuvok_rifle_crew
"Major Kira",5,2, 273,37,126,0,0,0,304,60,176,0,0,0,0,0,0,0,0,0,1204,872,1141,1245,1051,1186,0,0,0,1023,1253,957,0,0,0,1174,785,1099,1214,1018,1007,0,0,0,889,1140,840,0,0,0,1432,1413,"Bajoran, Veteran, Resourceful","nonhuman, female, organic, ds9, kira, crew_max_rarity_2","Obstinance",0, 2, 0, 10, 14, 6, 0, , , , 295, 150, 5, , true,"Kira",crew_portraits_cm_kirashorthair_sm.png,kira_major_shorthair_crew
"Mirror Intendant Kira",6,5, 512,183,363,0,0,0,1052,272,542,0,0,0,946,67,184,0,0,0,831,163,759,297,679,332,0,699,0,302,68,207,632,0,533,449,38,365,309,316,127,0,1025,0,136,88,93,987,0,849,475,143,"Bajoran, Cardassian, Klingon, Villain, Klingon-Cardassian Alliance, Brutal, Mirror Universe","nonhuman, female, organic, ds9, kira, crew_max_rarity_5","Instability",0, 6, 6, 10, 12, 4, 0, , , , 915, 225, 90, 1525, true,"Kira",crew_portraits_cm_kiraintendant_sm.png,kira_mirror_crew
"Security Chief Worf",7,2, 205,57,144,0,0,0,326,61,145,0,0,0,0,0,0,0,0,0,1228,915,1159,1269,1069,1175,0,0,0,1019,1248,949,0,0,0,1113,766,1054,1164,965,1083,0,0,0,958,1203,901,0,0,0,1439,1406,"Klingon, Federation, Starfleet, Duelist, Investigator","nonhuman, male, organic, tng, worf, crew_max_rarity_2","They Have No Honor",2, 4, 8, 10, 12, , , , 1, 2, 165, 280, 95, 155, false,"Worf",crew_portraits_cm_worf_sm.png,worf_security_chief_crew
"Defiant Commander Worf",8,4, 364,241,488,0,0,0,609,179,394,0,0,0,0,0,0,0,0,0,889,398,820,997,744,713,0,0,0,647,918,563,0,0,0,205,52,156,384,122,386,0,0,0,353,573,278,0,0,0,1291,435,"Klingon, Federation, Starfleet, Duelist, Tactician","nonhuman, male, organic, ds9, worf, crew_max_rarity_4","Good Day to Die",2, 6, 12, 12, 12, 4, 0, , 1, 2, 690, 645, 325, 205, false,"Worf",crew_portraits_cm_worfdefiant_sm.png,worf_defiant_commander_crew
"Mirror Regent Worf",7,5, 861,294,589,0,0,0,1062,175,357,0,0,0,0,0,0,0,0,0,427,111,359,622,283,383,0,0,0,341,580,249,0,0,0,94,30,70,225,51,443,0,0,0,419,636,333,0,0,0,727,270,"Klingon, Cardassian, Tactician, Villain, Brutal, Klingon-Cardassian Alliance, Mirror Universe","nonhuman, male, organic, ds9, worf, crew_max_rarity_5","Position of Strength",0, 9, 8, 8, 10, , , , , , 300, 980, 390, , false,"Worf",crew_portraits_cm_worfmirror_sm.png,worf_mirror_crew
"Yeoman Rand",9,1, 164,15,58,0,0,0,0,0,0,0,0,0,117,19,60,0,0,0,1246,1196,1186,1243,1096,0,0,1251,0,0,1308,0,1235,0,1072,1243,1194,1183,1232,1091,0,0,1242,0,0,1303,0,1223,0,1060,1477,1481,"Federation, Starfleet, Human","female, organic, tos, rand, crew_max_rarity_1","Signature Required",2, 2, 8, 10, 12, , , , 1, 1, 375, , , 180, false,"Rand",crew_portraits_cm_randyeoman_sm.png,rand_yeoman_crew
"The Duras Sisters",9,4, 311,83,205,0,0,0,658,150,385,0,0,0,464,170,341,0,0,0,1149,516,1075,745,994,701,0,896,0,632,369,552,853,0,725,922,286,880,315,800,439,0,561,0,416,100,331,475,0,418,1118,421,"Klingon, Scoundrel, Villain","nonhuman, female, organic, tng, betor, lursa, exclusive_fusion, crew_max_rarity_4","The Power of Two",0, 9, 10, 20, 12, , , 1, , , 350, 110, 190, 500, false,"Duras Sisters",crew_portraits_cm_duras_sisters_sm.png,duras_sisters_crew
"Persis",7,2, 0,0,0,0,0,0,253,94,250,0,0,0,303,39,88,0,0,0,0,1147,0,1241,0,1182,0,1196,0,1022,962,954,1175,0,1021,0,858,0,1256,0,767,0,1202,0,711,725,654,1176,0,1020,1427,1375,"Human, Augments, Engineered, Survivalist, Tactician","nonhuman, female, organic, ent, persis, crew_max_rarity_2","Augmented Strength",0, 2, 6, 10, 6, 7, 0, 2, , , 240, 330, 300, , false,"Persis",crew_portraits_cm_persis_sm.png,persis_crew
"Telek R'Mor",7,2, 0,0,0,347,52,194,119,8,44,0,0,0,263,30,113,0,0,0,1131,1202,0,1254,0,1003,831,832,721,1077,1203,1017,1185,0,1030,1027,1197,0,1241,0,879,708,792,605,1075,1223,1015,1162,0,1012,1404,1395,"Romulan, Astrophysicist","nonhuman, male, organic, voy, rmor, crew_max_rarity_2","Solitary Survey",1, 3, 10, 12, 10, 0, 2, , , , 405, 50, 3, 180, false,"R'Mor",crew_portraits_cm_telekrmor_sm.png,rmor_voyager_crew
"KDF Gowron",9,4, 375,85,222,0,0,0,296,100,256,0,0,0,641,173,418,0,0,0,1071,772,1001,556,921,1140,0,777,0,982,535,917,725,0,606,882,427,830,237,758,746,0,437,0,685,157,636,361,0,330,1188,567,"Klingon, Duelist, Diplomat, Politician","nonhuman, male, organic, tng, gowron, crew_max_rarity_4","What Can Be Done",1, 6, 14, 10, 14, 0, 2, , , , 625, 465, 85, 1000, false,"Gowron",crew_portraits_cm_gowronyoung_sm.png,gowron_kdf_crew
"Third Remata'Klan",7,3, 410,42,84,0,0,0,467,85,185,0,0,0,0,0,0,0,0,0,1120,734,1046,1183,963,1021,0,0,0,897,1130,820,0,0,0,1210,787,1139,1249,1051,927,0,0,0,832,1083,784,0,0,0,1368,1414,"Jem'hadar, Dominion, Duelist, Tactician","nonhuman, male, organic, ds9, remataklan, crew_max_rarity_3","Victory is Life",0, 3, 0, 6, 8, 4, 4, , , , 690, 395, 597, 600, true,"Remata'Klan",crew_portraits_cm_remataklan_sm.png,remataklan_crew
"Ensign Chapel",10,1, 0,0,0,0,0,0,0,0,0,0,0,0,0,0,0,214,34,152,0,0,0,0,1076,0,0,0,773,0,0,997,0,717,1048,0,0,0,0,1002,0,0,0,728,0,0,938,0,671,966,1486,1478,"Human, Federation, Starfleet, Nurse","female, organic, tos, chapel, crew_max_rarity_1","Administer Prescription",2, 1, 6, 10, 10, , , , , , 130, , 40, 100, false,"Chapel",crew_portraits_cm_chapelensign_sm.png,chapel_ensign_crew
"Ensign Ogawa",7,1, 0,0,0,0,0,0,0,0,0,0,0,0,0,0,0,213,34,166,0,0,0,0,1072,0,0,0,771,0,0,994,0,713,1044,0,0,0,0,987,0,0,0,708,0,0,925,0,661,947,1485,1475,"Human, Federation, Starfleet, Nurse","female, organic, tng, ogawa, crew_max_rarity_1","Report to Sickbay",2, 1, 6, 1, 8, 2, 0, 1, , , 170, , 35, 105, false,"Ogawa",crew_portraits_cm_ogawaensign_sm.png,ogawa_ensign_crew
"Wesley Crusher",8,1, 0,0,0,218,43,149,0,0,0,174,32,78,0,0,0,0,0,0,1223,0,1181,0,0,1224,777,1220,768,1070,0,0,1221,728,0,1146,0,1156,0,0,1134,595,1132,718,1051,0,0,1194,716,0,1463,1450,"Human, Federation, Civilian, Prodigy","male, organic, tng, wesley, crew_max_rarity_1","Study",1, 2, 8, 10, 12, , , , 0, 1, 215, 125, 70, 55, false,"Wesley",crew_portraits_cm_wesleysweater_sm.png,wesley_sweater_crew
"Ensign Crusher",9,3, 176,11,31,426,83,229,0,0,0,347,34,78,0,0,0,0,0,0,838,1197,981,1292,1097,1042,489,1076,655,1036,0,0,1170,698,0,814,1198,1116,1299,1099,848,445,915,514,1049,0,0,1191,714,0,1353,1377,"Human, Federation, Starfleet, Prodigy, Warp Theorist","male, organic, tng, wesley, crew_max_rarity_3","Rewire",2, 4, 6, 8, 10, 6, 0, , , , 290, , , 190, false,"Wesley",crew_portraits_cm_wesley_sm.png,wesley_full_ensign_crew
"Acting Ensign Crusher",9,2, 114,29,58,258,56,160,0,0,0,251,53,148,0,0,0,0,0,0,1076,1201,1021,1301,1101,1208,600,1198,760,1049,0,0,1180,705,0,906,1186,893,1284,1081,1073,450,1081,661,976,0,0,1081,652,0,1416,1361,"Human, Federation, Starfleet, Prodigy","male, organic, tng, wesley, crew_max_rarity_2","Invention",1, 4, 3, 6, 6, , , 2, , , 205, 50, 25, 165, false,"Wesley",crew_portraits_cm_wesleyensign_sm.png,wesley_acting_ensign_crew
"Formal Dress Wesley Crusher",9,4, 0,0,0,662,173,422,0,0,0,270,108,230,481,160,342,0,0,0,730,0,1111,996,0,688,268,245,409,1016,1013,0,553,685,721,417,0,782,700,0,370,75,51,236,723,690,0,103,438,430,1111,302,"Human, Federation, Starfleet, Prodigy, Warp Theorist","male, organic, tng, wesley, crew_max_rarity_4","Duty to the Truth",1, 9, 4, 10, 12, , , , , , 300, 500, 30, 450, false,"Wesley",crew_portraits_cm_wesleydressuniform_sm.png,wesley_formal_dress_crew
"Wrathful Khan",7,5, 1040,206,421,0,0,0,1145,72,143,376,140,288,0,0,0,0,0,0,374,114,91,591,249,427,762,0,0,116,629,277,1042,607,0,323,269,26,517,206,1053,438,0,0,272,1179,881,640,334,0,582,522,"Human, Augments, Engineered, Villain, Cultural Figure, Tactician, Resourceful, Survivalist, Brutal","nonhuman, male, organic, tos, khan, crew_max_rarity_5","I Stab at Thee",2, 9, 12, 5, 12, 1, 0, , , , 640, 595, 345, 850, false,"Khan",crew_portraits_cm_khan_sm.png,khan_wok_crew
"Tailor Garak",5,3, 0,0,0,0,0,0,502,44,126,161,22,44,395,83,219,0,0,0,0,1045,1188,1133,0,1036,920,1085,0,698,783,834,839,730,909,0,1135,1186,1014,0,1162,922,941,0,895,731,946,751,732,764,1330,1350,"Cardassian, Undercover Operative, Scoundrel, Interrogator, Civilian","nonhuman, male, organic, ds9, garak, crew_max_rarity_3","Cutting Cloth",1, 5, 8, 12, 12, , , , , , 125, 230, 20, 405, false,"Garak",crew_portraits_cm_garaktailor_sm.png,garak_tailor_crew
"Bartender Quark",4,1, 110,25,77,0,0,0,81,15,57,0,0,0,211,36,150,0,0,0,1251,1184,1191,1204,1099,1250,0,1223,0,1078,1254,1018,1202,0,1042,1227,1130,1162,1033,1071,1243,0,1142,0,1071,1108,1011,1108,0,964,1455,1427,"Ferengi, Bartender, Civilian, Scoundrel, Gambler, Merchant","nonhuman, male, organic, ds9, quark, crew_max_rarity_1","Hospitality",1, 2, 8, 10, 12, , , , 2, 1, 165, 10, 10, 140, false,"Quark",crew_portraits_cm_quarkbartender_sm.png,quark_s1_bartender_crew
"Richard Castillo",8,3, 487,109,227,286,57,187,0,0,0,0,0,0,0,0,0,0,0,0,678,979,901,1048,815,1194,885,1189,751,0,0,0,0,0,0,422,864,766,946,693,1004,716,1033,611,0,0,0,0,0,0,1374,1328,"Human, Hero, Pilot, Starfleet, Federation, Displaced","male, organic, castillo, tng, crew_max_rarity_3","Self Sacrifice",0, 5, 12, 12, 10, 7, 0, , 1, 2, 650, 265, 129, 585, false,"Castillo",crew_portraits_cm_richardcastillo_sm.png,castillo_lieutenant_crew
"Writer Jake Sisko",10,3, 0,0,0,0,0,0,0,0,0,0,0,0,451,70,198,0,0,0,0,0,0,1119,0,0,0,1068,0,0,1142,0,1030,0,891,0,0,0,1063,0,0,0,987,0,0,1095,0,948,0,817,1454,1457,"Human, Federation, Civilian, Writer, Gambler, Romantic","male, organic, ds9, jake, crew_max_rarity_3","Construct Story",2, 3, 0, 8, 10, 6, 0, , , , 995, 350, 47, 640, true,"Jake",crew_portraits_cm_jakewriter_sm.png,jake_writer_crew
"CMO Crusher",10,2, 0,0,0,0,0,0,0,0,0,0,0,0,0,0,0,290,52,174,0,0,0,0,1050,0,0,0,756,0,0,975,0,700,1016,0,0,0,0,939,0,0,0,646,0,0,878,0,622,895,1476,1471,"Human, Starfleet, Federation, Physician, Caregiver, Cyberneticist","female, organic, tng, crusher, crew_max_rarity_2","Doctor's Calluses",2, 3, 6, 10, 10, , , , , , 185, , 35, 155, false,"Crusher",crew_portraits_cm_crusherwithlabcoat_sm.png,crusher_labcoat_crew
"Commando Crusher",6,3, 0,0,0,182,76,200,308,93,193,0,0,0,0,0,0,510,44,132,1217,1126,0,0,912,791,898,1216,423,995,1227,504,0,603,898,964,962,0,0,1010,404,640,982,377,814,1058,455,0,681,980,1325,1245,"Human, Starfleet, Federation, Physician, Cyberneticist, Undercover Operative","female, organic, tng, crusher, crew_max_rarity_3","Repel Disease",0, 3, 6, 3, 12, 1, 0, , , , 575, , 370, 500, false,"Crusher",crew_portraits_cm_crusherblackcommandouniform_sm.png,crusher_black_commando_uniform_crew
"Dr. Crusher",10,4, 275,38,110,0,0,0,437,90,201,0,0,0,0,0,0,736,123,300,1205,797,1142,1246,313,1043,0,0,419,912,1147,189,0,372,608,1192,725,1122,1233,308,883,0,0,399,806,1047,148,0,351,593,1218,1141,"Human, Starfleet, Federation, Physician, Cyberneticist","female, organic, tng, crusher, crew_max_rarity_4","Neutralize Disease",1, 7, 12, 12, 12, 4, 4, , , , 740, 250, 370, 500, false,"Crusher",crew_portraits_cm_crusherfromfirstcontact_sm.png,crusher_first_contact_crew
"Holonovel Doctor",9,4, 0,0,0,512,50,137,0,0,0,0,0,0,0,0,0,799,69,244,1040,0,0,0,573,1009,736,1042,167,0,0,549,0,368,607,1153,0,0,0,776,1144,835,1140,311,0,0,729,0,490,741,1303,1367,"Hologram, Human, Federation, Starfleet, Physician, Musician, Scoundrel","nonhuman, male, artificial_life, voy, emh, crew_max_rarity_4","Suggested Treatment",0, 7, 12, 12, 12, , , , , , 365, 370, 205, 525, false,"Doctor",crew_portraits_cm_doctorgolfclub_sm.png,emh_authorauthor_crew
"Mobile Doctor",10,5, 0,0,0,809,106,209,0,0,0,0,0,0,393,137,435,1191,110,334,726,0,0,1040,244,686,490,270,33,0,1054,234,898,146,71,887,0,0,622,541,841,570,144,128,0,594,527,391,326,70,645,458,"Hologram, Human, Federation, Starfleet, Musician, Physician","nonhuman, male, artificial_life, voy, emh, crew_max_rarity_5","House Call",2, 9, 12, 12, 12, , , , , , 1825, 600, , 600, false,"Doctor",crew_portraits_cm_emhmobile_sm.png,emh_mobileholoemitter_crew
"Comm Officer Uhura",6,1, 0,0,0,0,0,0,0,0,0,0,0,0,258,28,89,0,0,0,0,0,0,1263,0,0,0,1215,0,0,1280,0,1193,0,1036,0,0,0,1266,0,0,0,1213,0,0,1282,0,1187,0,1028,1482,1486,"Federation, Starfleet, Human, Musician, Communicator","female, organic, tos, uhura, crew_max_rarity_1","Incoming Message",2, 2, 8, 10, 12, , , , 1, 1, 320, , , 495, false,"Uhura",crew_portraits_cm_uhurared_sm.png,uhura_red_crew
"Commander Uhura",10,4, 459,128,299,0,0,0,0,0,0,0,0,0,592,198,429,0,0,0,941,962,884,472,791,0,0,785,0,0,912,0,735,0,614,673,738,586,134,536,0,0,384,0,0,489,0,299,0,278,1300,871,"Federation, Starfleet, Human, Musician, Communicator","female, organic, tos, uhura, crew_max_rarity_4","Hailing Frequencies",0, 8, 12, 26, 12, , , 1, , , 1165, , 75, 790, false,"Uhura",crew_portraits_cm_uhurawrathofkhan_sm.png,uhura_wrathofkhan_crew
"Dancing Uhura",9,5, 1026,84,195,0,0,0,0,0,0,0,0,0,1185,193,393,0,0,0,585,669,513,101,424,0,0,399,0,0,503,0,315,0,291,941,966,900,269,819,0,0,443,0,0,574,0,374,0,339,715,1138,"Human, Federation, Starfleet, Communicator, Casual, Musician, Artist","female, organic, tos, uhura, original, crew_max_rarity_5","Take The Lead",0, 8, 10, 3, 14, 1, 1, , , , 465, 260, 60, 400, false,"Uhura",crew_portraits_cm_uhura_dancing_sm.png,uhura_dancing_crew
"First Maje Culluh",9,3, 466,93,223,0,0,0,307,42,138,0,0,0,0,0,0,0,0,0,1018,765,946,1092,863,1199,0,0,0,1038,1263,972,0,0,0,861,628,805,971,733,1148,0,0,0,996,1232,939,0,0,0,1386,1360,"Kazon, Scoundrel","nonhuman, male, organic, voy, culluh, crew_max_rarity_3","Nistrim Supremacy",2, 3, 6, 10, 10, 8, 4, , , , 665, 325, 133, 390, false,"Culluh",crew_portraits_cm_jalculluh_sm.png,culluh_crew
"KDF Alexander",8,2, 137,19,79,0,0,0,331,64,148,145,16,72,0,0,0,0,0,0,1248,1021,1139,1296,1098,1168,921,0,0,875,1239,939,1229,732,0,1230,917,1076,1277,1074,1064,916,0,0,786,1188,886,1215,726,0,1423,1415,"Human, Klingon","male, organic, ds9, alexander, nonhuman, crew_max_rarity_2","Beginner's Luck",1, 3, 10, 12, 10, 5, 2, , , , 130, 200, 62, 15, false,"Alexander",crew_portraits_cm_alexanderkdf_sm.png,alexander_kdf_crew
"Commando Shran",9,4, 673,114,239,0,0,0,592,89,182,0,0,0,318,144,282,0,0,0,769,423,687,585,605,835,0,1091,0,751,631,673,1060,0,914,789,476,715,345,648,924,0,741,0,830,382,783,650,0,581,1115,875,"Andorian, Tactician, Inspiring, Imperial Guard","nonhuman, male, organic, ent, shran, crew_max_rarity_4","Debt Owed",0, 8, 6, 8, 10, , , 3, , , 390, 575, 288, 350, false,"Shran",crew_portraits_cm_shrancommando_sm.png,shran_commando_crew
"Ushaan Shran",10,5, 989,83,164,0,0,0,1076,170,348,0,0,0,424,134,288,0,0,0,633,133,564,374,472,378,0,1002,0,338,186,247,963,0,820,1008,334,962,470,873,465,0,747,0,435,159,356,659,0,587,627,679,"Andorian, Duelist, Romantic, Imperial Guard","nonhuman, male, organic, ent, shran, crew_max_rarity_5","Debt Owed",0, 9, 6, 8, 10, , , 3, , , 1440, 565, 483, 390, false,"Shran",crew_portraits_cm_shrandueling_sm.png,shran_dueling_crew
"Fencing Sulu",9,4, 444,99,249,385,36,92,609,203,448,0,0,0,0,0,0,0,0,0,673,452,957,1100,873,352,850,1160,733,629,905,547,0,0,0,580,162,737,918,667,150,897,1204,771,256,430,182,0,0,0,1161,747,"Human, Federation, Starfleet, Pilot, Resourceful, Duelist","male, organic, tos, sulu, crew_max_rarity_4","Parry Attack",0, 6, 12, 8, 12, 6, 4, , , , 415, , 225, 225, false,"Sulu",crew_portraits_cm_sulufencing_sm.png,sulu_fencing_crew
"Morn",9,3, 0,0,0,0,0,0,359,70,174,0,0,0,418,121,295,0,0,0,0,1091,0,1095,0,1131,0,1015,0,972,804,908,981,0,836,0,1018,0,844,0,988,0,752,0,873,432,829,672,0,596,1363,1291,"Lurian, Courier, Duelist, Civilian, Gambler, Smuggler","nonhuman, male, organic, ds9, morn, crew_max_rarity_3","Drinking Spot",0, 3, 0, 8, 8, , , , 1, 2, 150, 285, 57, 655, true,"Morn",crew_portraits_cm_morn_sm.png,morn_crew
"Seven in Blue",9,2, 0,0,0,294,51,209,0,0,0,278,53,130,0,0,0,0,0,0,1190,0,1140,0,0,1180,552,1180,746,1046,0,0,1177,703,0,996,0,1086,0,0,964,427,1005,583,997,0,0,1111,672,0,1429,1393,"Human, Borg, Civilian, Federation","nonhuman, female, organic, voy, seven, crew_max_rarity_2","Ignore Irrelevancies",1, 2, 8, 10, 14, 4, 0, , , , 75, 50, 310, 170, false,"Seven",crew_portraits_cm_seven_of_nine_sm.png,seven_allblue_crew
"Seven of Nine",8,5, 0,0,0,785,247,791,0,0,0,854,225,454,514,89,183,0,0,0,444,0,519,1052,0,409,49,160,249,475,1073,0,122,239,781,58,0,210,1052,0,47,3,13,42,238,1086,0,66,84,813,616,35,"Human, Borg, Civilian, Federation","nonhuman, female, organic, voy, seven, crew_max_rarity_5","New Collective",2, 7, 12, 10, 14, 4, 0, , , , 1750, , 705, 440, false,"Seven",crew_portraits_cm_sevenbluegreyshoulders_sm.png,seven_bluegreyshoulders_crew
"Donik",10,3, 0,0,0,0,0,0,0,0,0,476,79,199,303,31,79,0,0,0,0,0,976,1242,0,0,742,1199,0,892,1267,0,711,588,1023,0,0,912,1270,0,0,637,1220,0,828,1288,0,717,536,1034,1400,1420,"Hirogen, Innovator","nonhuman, male, organic, voy, donik, crew_max_rarity_3","Hunting Program",2, 4, 12, 12, 10, 7, 0, , , , 870, 165, , 340, false,"Donik",crew_portraits_cm_donik_sm.png,donik_crew
"Commander Tucker",8,2, 252,28,82,0,0,0,0,0,0,305,53,185,0,0,0,0,0,0,1226,1172,823,1267,1067,0,881,0,0,1027,0,0,1163,690,0,1222,1171,755,1268,1067,0,720,0,0,897,0,0,1002,600,0,1441,1432,"Human, Starfleet, Jury Rigger, Pilot, Explorer","male, organic, ent, tucker, crew_max_rarity_2","Warp Engines Online",1, 2, 6, 3, 8, 2, 0, , , , 520, 35, 50, 165, false,"Trip",crew_portraits_cm_tucker_sm.png,tucker_commander_crew
"Counselor Troi",6,1, 0,0,0,0,0,0,0,0,0,0,0,0,261,42,108,147,49,131,0,0,0,1251,1092,0,0,1205,784,0,1272,1008,1183,727,904,0,0,0,1234,1007,0,0,1185,736,0,1262,940,1151,678,712,1458,1443,"Federation, Starfleet, Human, Betazoid, Empath, Counselor","nonhuman, female, organic, tng, troi, crew_max_rarity_1","Counselling",2, 1, 6, 10, 10, , , , , , 265, , 80, 345, false,"Troi",crew_portraits_cm_troitng_sm.png,troi_casualgray_crew
"Rakal Troi",6,4, 521,163,354,0,0,0,525,128,331,0,0,0,0,0,0,407,163,440,837,466,764,956,208,810,0,0,537,729,995,216,0,496,748,489,170,408,660,16,573,0,0,233,515,740,24,0,147,322,1048,162,"Federation, Starfleet, Human, Betazoid, Romulan, Empath, Undercover Operative, Tal Shiar","nonhuman, female, organic, tng, troi, crew_max_rarity_4","Romulan Disguise",1, 7, 12, 10, 14, 1, 2, , , , 90, 400, 175, 2825, false,"Troi",crew_portraits_cm_troirakal_sm.png,troi_rakal_crew
"Commander Troi",10,5, 0,0,0,0,0,0,383,203,253,0,0,0,1060,211,421,827,142,281,0,1032,0,586,537,1015,0,441,398,891,178,107,360,331,41,0,698,0,544,574,580,0,378,400,522,81,78,290,352,57,648,214,"Federation, Starfleet, Human, Betazoid, Empath, Counselor","nonhuman, female, organic, tng, troi, crew_max_rarity_5","Empathic Sense",1, 8, 6, 6, 6, , , , , , 1375, 475, 135, 725, true,"Troi",crew_portraits_cm_troifirstcontact_sm.png,troi_firstcontact_crew
"Vedek Winn Adami",8,3, 307,97,207,0,0,0,0,0,0,0,0,0,410,92,214,0,0,0,1145,1114,1073,845,990,0,0,1081,0,0,1155,0,1049,0,905,888,921,836,558,763,0,0,932,0,0,1030,0,879,0,750,1385,1318,"Bajoran, Vedek, Cultural Figure, Spiritual","nonhuman, female, organic, ds9, winn, crew_max_rarity_3","Will of the Prophets",1, 4, 8, 10, 10, 4, 0, , , , , 270, 85, 830, false,"Winn",crew_portraits_cm_winnvedek_sm.png,winn_vedek_crew
"Subcommander T'Pol",7,3, 273,71,211,520,21,77,165,35,77,0,0,0,0,0,0,0,0,0,719,1008,1121,1234,1036,758,763,1079,657,1071,1298,1009,0,0,0,754,788,894,1034,812,1080,912,1230,782,1048,1285,989,0,0,0,1351,1363,"Vulcan, High Command, Astrophysicist, Telepath","nonhuman, female, organic, ent, tpol, crew_max_rarity_3","Logic",2, 5, 6, 10, 10, , , , , , 175, 120, 3, 100, false,"T'Pol",crew_portraits_cm_tpol_sm.png,tpol_subcommander_crew
"Commander T'Pol",9,4, 512,112,307,692,56,171,320,91,227,0,0,0,0,0,0,0,0,0,305,625,824,1001,746,412,532,828,447,976,1205,912,0,0,0,306,360,604,816,552,436,745,1060,642,748,995,696,0,0,0,1156,1021,"Vulcan, Starfleet, Astrophysicist, Telepath","nonhuman, female, organic, ent, tpol, crew_max_rarity_4","Vessel's Information",0, 5, 12, 12, 20, 2, 0, , , , 1400, 200, 70, 1175, false,"T'Pol",crew_portraits_cm_tpolcommander_sm.png,tpol_commander_crew
"Chef Neelix",1,1, 0,0,0,0,0,0,0,0,0,0,0,0,201,51,189,0,0,0,0,0,0,1262,0,0,0,1213,0,0,1278,0,1191,0,1035,0,0,0,1105,0,0,0,1037,0,0,1146,0,1003,0,864,1481,1464,"Talaxian, Mylean, Resourceful, Survivalist, Chef, Civilian, Communicator","nonhuman, male, organic, voy, neelix, crew_max_rarity_1","Soup's On",1, 2, 12, 14, 10, 6, 0, , 2, 1, 305, , , 210, false,"Neelix",crew_portraits_cm_neelix_sm.png,neelix_chef_crew
"CMO 'Bones' McCoy",8,1, 0,0,0,0,0,0,0,0,0,0,0,0,0,0,0,213,48,196,0,0,0,0,1062,0,0,0,765,0,0,988,0,709,1034,0,0,0,0,899,0,0,0,613,0,0,841,0,596,861,1479,1462,"Human, Federation, Starfleet, Physician, Exobiology","male, organic, tos, mccoy, crew_max_rarity_1","Country Doctor",2, 3, 8, 10, 12, , , , 0, 2, 245, 10, 8, 285, false,"McCoy",crew_portraits_cm_mccoy_sm.png,mccoy_chief_medical_officer_crew
"Prisoner 'Bones' McCoy",8,3, 0,0,0,0,0,0,0,0,0,0,0,0,271,112,252,444,90,278,0,0,0,1217,886,0,0,1162,636,0,1226,811,1136,586,551,0,0,0,914,656,0,0,826,446,0,944,631,756,406,188,1376,1256,"Federation, Starfleet, Physician, Survivalist, Human, Desperate, Prisoner","male, organic, tos, mccoy, crew_max_rarity_3","Field Medicine",1, 5, 4, 4, 8, 3, 0, 2, , , 235, , 48, 517, false,"McCoy",crew_portraits_cm_mccoyrura_sm.png,mccoy_rura_pethe_prisoner_crew
