"Lieutenant Valeris",5,4, 218,136,300,387,172,439,579,203,541,0,0,0,0,0,0,0,0,0,413,356,797,884,747,101,451,670,403,443,635,390,0,0,0,35,66,388,572,379,13,195,290,174,128,234,105,0,0,0,780,53,"Vulcan, Saboteur, Starfleet, Federation, Resourceful, Telepath","nonhuman, female, organic, valeris, tos, lieutenant, crew_max_rarity_4","Conspirator",2, 9, 4, 8, 8, , , 2, , , 225, 200, 150, 415, false,"Valeris",crew_portraits_cm_valeris_sm.png,valeris_lieutenant_crew
"Dr. David Marcus",8,4, 0,0,0,782,152,299,0,0,0,443,168,385,0,0,0,0,0,0,491,0,587,0,0,487,107,540,296,553,0,0,607,354,0,457,0,260,0,0,448,45,487,282,296,0,0,297,154,0,910,692,"Gambler, Innovator, Jury Rigger, Human, Civilian","male, organic, tos, davidmarcus, crew_max_rarity_4","Experimental Maneuver",0, 7, 10, 14, 12, , , , , , 342, 355, 30, 450, false,"David",crew_portraits_cm_davidmarcus_sm.png,david_marcus_crew
"Undercover Sulu",8,5, 584,31,69,0,0,0,840,159,341,0,0,0,966,222,662,0,0,0,709,233,657,140,607,426,0,286,0,381,50,316,227,0,222,918,371,856,141,799,361,0,111,0,329,19,282,62,0,92,380,189,"Human, Federation, Starfleet, Pilot, Resourceful, Tactician, Undercover Operative, Maverick, Hero","male, organic, tos, lieutenant, bridge_crew, sulu, crew_max_rarity_5","Don't Call Me Tiny",1, 7, 16, 3, 16, 1, 2, , , , 600, 85, 200, 350, false,"Sulu",crew_portraits_cm_sulusfs_sm.png,sulu_sfs_crew
"North Star Tucker",7,5, 0,0,0,0,0,0,470,93,181,799,181,587,1049,161,315,0,0,0,0,741,327,433,0,733,270,312,0,83,134,601,25,183,238,0,705,101,539,0,681,110,456,0,31,242,581,8,43,359,402,173,"Human, Starfleet, Jury Rigger, Marksman, Costumed, Romantic, Gambler","male, organic, ent, commander, tucker, crew_max_rarity_5","Quick Draw",0, 7, 10, 10, 14, 6, 0, , , , 390, 330, 47, 1450, false,"Trip",crew_portraits_cm_tuckercowboy_sm.png,tucker_cowboy_crew
"Danara Pel",10,4, 0,0,0,618,48,125,0,0,0,0,0,0,0,0,0,646,151,430,662,0,0,0,392,638,442,653,82,0,0,392,0,273,428,860,0,0,0,219,854,570,845,107,0,0,217,0,132,261,929,885,"Hologram, Physician, Vidiian, Desperate, Geneticist","female, nonhuman, voy, danara, crew_max_rarity_4","Just A Disease",0, 8, 16, 12, 10, , , , , , 750, 210, 175, 340, false,"Danara",crew_portraits_cm_danarapel_sm.png,danara_pel_crew
"Warship Chakotay",9,4, 404,172,414,0,0,0,727,172,350,0,0,0,0,0,0,0,0,0,659,242,601,717,546,486,0,0,0,432,622,381,0,0,0,283,87,210,428,200,334,0,0,0,308,478,262,0,0,0,918,546,"Human, Starfleet, Federation, Hunter, Veteran, Brutal, Villain, Hologram, Maquis","male, organic, voy, bridge_crew, commander, first_officer, chakotay, crew_max_rarity_4","All Out War",0, 7, 6, 8, 12, , , , , , 640, 195, 60, 500, false,"Chakotay",crew_portraits_cm_chakotaylivingwitness_sm.png,chakotay_warship_crew
"Captain Pike",9,5, 1099,189,388,0,0,0,0,0,0,0,0,0,860,180,405,0,0,0,231,353,190,72,149,0,0,413,0,0,505,0,356,0,310,294,395,222,58,212,0,0,322,0,0,434,0,260,0,268,509,516,"Starfleet, Human, Federation, Romantic, Inspiring, Hero","captain, male, organic, tos, pike, crew_max_rarity_5","Fire All Weapons",0, 10, 4, 8, 8, , , 2, , , 525, 185, 130, 640, false,"Pike",crew_portraits_cm_pike_captain_sm.png,pike_captain_crew
"Will Scarlett",6,5, 0,0,0,0,0,0,983,289,597,0,0,0,850,172,355,0,0,0,0,345,0,538,0,225,0,448,0,207,45,147,394,0,336,0,179,0,493,0,73,0,401,0,72,12,58,329,0,324,510,240,"Klingon, Tactician, Duelist, Costumed, Hero","nonhuman, male, organic, tng, bridge_crew, worf, crew_max_rarity_5","Beg For Mercy",2, 8, 4, 10, 16, 5, 0, , , , 575, 225, 247, 375, false,"Worf",crew_portraits_cm_willscarletworf_sm.png,worf_merry_crew
"Boxer Chakotay",4,3, 272,24,58,0,0,0,558,65,105,0,0,0,332,18,46,0,0,0,908,561,847,726,792,688,0,879,0,611,610,565,864,0,747,929,728,870,895,817,851,0,922,0,726,841,704,910,0,783,970,1078,"Human, Starfleet, Federation, Hunter, Duelist, Athlete, Costumed, Maquis","male, organic, voy, bridge_crew, commander, first_officer, chakotay, crew_max_rarity_3","The Maquis Mauler",0, 4, 14, 10, 14, 0, 1, , 2, 2, 90, 265, 97, 575, false,"Chakotay",crew_portraits_cm_chakotayboxing_sm.png,chakotay_boxing_crew
"Beowulf Kim",9,5, 388,108,153,0,0,0,985,239,494,951,147,307,0,0,0,0,0,0,784,169,79,822,673,243,266,0,0,33,387,163,329,180,0,712,125,128,756,617,137,298,0,0,12,237,109,411,227,0,409,206,"Federation, Human, Costumed, Brutal, Duelist, Musician","male, organic, voy, kim, crew_max_rarity_5","By Hell-Forged Hands",0, 6, 4, 8, 8, 6, 0, 2, , , 300, 230, 150, 355, false,"Kim",crew_portraits_cm_kimbeowulf_sm.png,kim_beowulf_crew
"Jazz Musician Riker",5,3, 448,114,254,0,0,0,0,0,0,0,0,0,288,67,190,0,0,0,714,719,659,574,609,0,0,866,0,0,924,0,850,0,736,558,594,487,393,459,0,0,740,0,0,810,0,700,0,608,1018,954,"Federation, Human, Musician, Starfleet, Pilot, Maverick, Gambler, Romantic","male, organic, tng, bridge_crew, riker, crew_max_rarity_3","Calculated Risk",0, 7, 8, 10, 12, , , , 1, 2, 320, 270, 280, 215, false,"Riker",crew_portraits_cm_rikertrombone_sm.png,riker_trombone_crew
"Klingon Quark",7,4, 363,49,110,0,0,0,369,148,329,0,0,0,637,209,444,0,0,0,855,523,789,405,740,731,0,550,0,638,290,599,498,0,424,873,335,796,225,753,394,0,256,0,352,63,318,179,0,200,802,371,"Ferengi, Klingon, Scoundrel, Duelist, Desperate, Romantic, Gambler","nonhuman, male, organic, ds9, quark, crew_max_rarity_4","House of Quark",0, 8, 6, 6, 10, , , , 2, 2, 100, 435, 75, 640, false,"Quark",crew_portraits_cm_quarkklingon_sm.png,quark_klingon_armor_crew
"Commander Chakotay",8,2, 281,63,183,0,0,0,244,58,137,0,0,0,166,41,87,0,0,0,892,638,825,755,774,898,0,922,0,774,836,741,904,0,784,738,517,691,641,636,816,0,887,0,701,708,683,863,0,746,1033,973,"Human, Starfleet, Federation, Hunter, Tactician, Survivalist, Maquis","male, organic, voy, bridge_crew, commander, first_officer, chakotay, crew_max_rarity_2","Ancient Traditions",2, 4, 3, 10, 5, , , 2, , , 180, 115, 177, 115, false,"Chakotay",crew_portraits_cm_chakotaystarfleet_sm.png,chakotay_starfleet_crew
"Captain Kirk",6,2, 317,71,156,0,0,0,128,24,74,0,0,0,259,39,127,0,0,0,868,740,801,670,751,930,0,884,0,796,850,769,866,0,752,779,646,723,623,672,914,0,858,0,781,799,752,823,0,717,1036,1005,"Human, Federation, Starfleet, Inspiring, Romantic, Explorer","male, organic, tos, captain, bridge_crew, kirk, crew_max_rarity_2","Boldly Go",0, 3, 6, 10, 10, , , , , , 320, 135, , 215, false,"Kirk",crew_portraits_cm_kirktosyellow_sm.png,kirk_tos_yellow_crew
"Orion Vina",10,5, 0,0,0,866,109,268,0,0,0,0,0,0,1126,218,426,0,0,0,464,0,0,393,0,465,336,37,281,0,362,0,218,0,212,560,0,0,386,0,524,353,64,326,0,357,0,190,0,208,522,679,"Costumed, Orion, Human, Romantic, Desperate","nonhuman, female, tos, vina, crew_max_rarity_5","Distracting Dance",0, 7, 4, 10, 8, 8, 4, 2, , , 605, 165, 255, 515, false,"Vina",crew_portraits_cm_vinaorion_sm.png,vina_orion_crew
"Vic Fontaine",9,4, 0,0,0,0,0,0,0,0,0,0,0,0,681,170,524,576,35,130,0,0,0,586,575,0,0,517,410,0,599,538,456,375,93,0,0,0,325,749,0,0,215,530,0,299,716,153,476,95,919,808,"Gambler, Romantic, Merchant, Human, Artist, Musician, Hologram, Crafty, Communicator","male, ds9, vicfontaine, crew_max_rarity_4","The Best Is Yet To Come",1, 6, 8, 10, 16, 6, 0, , , , 150, 165, 742, 275, false,"Vic",crew_portraits_cm_vicfontaine_sm.png,vic_fontaine_crew
"Trader Odo",7,4, 0,0,0,0,0,0,636,73,144,0,0,0,868,109,248,0,0,0,0,640,0,575,0,599,0,502,0,531,178,484,442,0,380,0,772,0,662,0,773,0,616,0,670,439,655,548,0,491,884,974,"Changeling, Costumed, Merchant, Shapeshifter, Tribbled","nonhuman, organic, ds9, odo, crew_max_rarity_4","Tribble Trouble",0, 7, 10, 10, 10, 4, 4, , , , 455, 60, 155, 440, false,"Odo",crew_portraits_cm_odo_tos_sm.png,odo_tos_crew
"Obsidian Order Garak",7,5, 421,152,344,0,0,0,1040,174,492,0,0,0,985,144,350,0,0,0,678,137,626,162,572,236,0,338,0,219,39,158,272,0,258,387,71,310,135,294,184,0,434,0,167,54,140,356,0,340,299,96,"Cardassian, Obsidian Order, Crafty, Scoundrel, Interrogator, Resourceful, Undercover Operative, Brutal, Romantic, Saboteur","male, organic, ds9, nonhuman, garak, crew_max_rarity_5","For Cardassia!",0, 9, 8, 10, 12, , , , , , 550, 75, 5, 350, false,"Garak",crew_portraits_cm_garakobsidian_sm.png,garak_obsidian_crew
"Friar Tuck Data",3,4, 0,0,0,0,0,0,798,157,324,290,117,265,607,141,292,0,0,0,0,529,752,645,0,460,551,583,0,169,147,351,252,461,466,0,473,486,590,0,388,352,525,0,84,135,314,81,287,421,581,369,"Android, Federation, Starfleet, Counselor, Costumed, Cyberneticist, Cultural Figure, Duelist, Musician","nonhuman, male, tng, lieutenant_commander, bridge_crew, artificial_life, data, crew_max_rarity_4","Divine Protection",2, 7, 12, 12, 20, 2, 0, , , , 475, 200, 120, 600, false,"Friar Tuck",crew_portraits_cm_data_friartuck_sm.png,data_friar_tuck_crew
"Convergence Day Quark",8,5, 995,182,438,0,0,0,0,0,0,0,0,0,1043,217,498,0,0,0,253,373,212,42,171,0,0,291,0,0,374,0,231,0,224,240,355,173,27,162,0,0,196,0,0,277,0,136,0,155,475,330,"Ferengi, Costumed, Merchant, Romantic, Gambler, Bartender, Communicator, Civilian","nonhuman, male, organic, ds9, quark, original, crew_max_rarity_5","Grand Celebration",1, 9, 10, 10, 10, , , , , , 175, 85, 87, 480, false,"Quark",crew_portraits_cm_quarkfestive_sm.png,quark_convergence_crew
"Human Q",7,4, 0,0,0,546,150,297,0,0,0,816,93,314,294,69,151,0,0,0,608,0,412,896,0,590,94,405,362,416,927,0,222,242,741,462,0,448,824,0,456,86,238,286,448,875,0,206,267,659,732,618,"Desperate, Crafty, Scoundrel, Astrophysicist, Human","male, tng, q_jdl, crew_max_rarity_4","Q the Ordinary",1, 6, 12, 12, 20, 2, 0, , , , 190, , 30, 80, false,"Q",crew_portraits_cm_qhuman_sm.png,q_human_crew
"C.O.P. Founder Picard",7,5, 1144,84,164,0,0,0,0,0,0,0,0,0,1026,221,460,0,0,0,271,382,220,57,183,0,0,300,0,0,386,0,243,0,232,736,734,687,161,634,0,0,228,0,0,313,0,158,0,181,489,754,"Federation, Starfleet, Human, Inspiring, Cultural Figure, Musician, Communicator","male, organic, tng, ent, pic, captain, bridge_crew, picard, original, crew_max_rarity_5","Starfleet Maneuvers",2, 8, 6, 6, 6, , , , , , 450, , 150, 640, true,"Picard",crew_portraits_cm_picard_formal_sm.png,picard_founder_crew
"Pel",6,4, 638,48,139,0,0,0,0,0,0,0,0,0,840,133,314,0,0,0,628,651,570,227,523,0,0,487,0,0,570,0,430,0,368,839,808,766,388,720,0,0,499,0,0,571,0,419,0,394,881,952,"Civilian, Ferengi, Costumed, Undercover Operative, Romantic, Gambler","female, organic, ds9, pel, crew_max_rarity_4","Profit in the Wind",2, 9, 6, 12, 14, 5, 0, , , , 240, 100, 165, 350, false,"Pel",crew_portraits_cm_pel_sm.png,pel_crew
"Captain Nog",8,5, 1040,244,540,0,0,0,455,110,250,0,0,0,979,144,281,0,0,0,212,131,175,59,135,699,0,370,0,619,163,578,312,0,281,116,77,88,49,75,539,0,531,0,485,218,462,453,0,427,309,134,"Ferengi, Federation, Starfleet, Inspiring","nonhuman, male, organic, ds9, captain, nog, crew_max_rarity_5","Weapons Free",0, 9, 10, 10, 10, , , , , , 500, 250, 100, 300, false,"Nog",crew_portraits_cm_nogcaptain_sm.png,nog_captain_crew
"The Traveler",9,5, 0,0,0,411,99,279,0,0,0,1176,176,376,874,100,197,0,0,0,764,0,171,584,0,747,63,164,460,199,595,0,24,97,392,559,0,261,724,0,523,63,231,324,297,756,0,71,155,560,406,466,"Explorer, Quantum Mechanics, Warp Theorist, Prodigy, Civilian, Communicator, Inspiring","nonhuman, male, organic, tng, traveler, crew_max_rarity_5","See Past the Numbers",0, 8, 6, 6, 6, , , , , , 355, , 15, 575, true,"The Traveler",crew_portraits_cm_traveler_sm.png,traveler_crew
"Lieutenant Wesley Crusher",8,5, 0,0,0,465,148,378,884,121,254,1084,173,461,0,0,0,0,0,0,645,512,188,0,0,67,58,643,381,35,561,331,229,106,0,359,584,183,0,0,75,18,395,223,42,648,441,199,97,0,358,161,"Human, Federation, Starfleet, Prodigy, Warp Theorist, Tactician","male, organic, tng, lieutenant, bridge_crew, wesley, crew_max_rarity_5","Precise Maneuvers",1, 9, 6, 10, 12, , , , , , 300, 400, , 375, false,"Wesley",crew_portraits_cm_wesleylieutenant_sm.png,wesley_lieutenant_crew
"Captain Q",8,4, 372,189,389,536,69,129,0,0,0,0,0,0,606,181,411,0,0,0,263,694,630,319,578,716,482,237,435,0,650,0,518,0,439,124,393,221,56,210,820,539,150,500,0,421,0,247,0,259,722,291,"Starfleet, Crafty, Scoundrel, Q Continuum","nonhuman, male, tng, q_jdl, crew_max_rarity_4","Judgment",1, 8, 4, 14, 16, , , , , , 90, 555, , 290, false,"Q",crew_portraits_cm_qstarfleet_sm.png,q_starfleet_crew
"Locutus of Borg",1,5, 0,0,0,351,242,610,874,247,492,0,0,0,847,399,783,0,0,0,603,390,0,399,0,42,412,65,360,252,29,187,221,0,214,92,261,0,57,0,7,85,1,84,130,1,107,12,0,31,117,1,"Borg, Human, Diplomat, Cyberneticist, Brutal, Duelist, Cultural Figure","male, organic, tng, picard, gauntlet_jackpot, crew_max_rarity_5","Resistance is Futile",0, 9, 1, 10, 12, , , , , , 325, 100, 5, 490, false,"Locutus",crew_portraits_cm_locutus_sm.png,locutus_crew
"Bestselling Author Jake Sisko",9,4, 0,0,0,648,162,393,0,0,0,0,0,0,682,73,146,0,0,0,518,0,0,657,0,511,367,139,316,0,673,0,556,0,472,323,0,0,822,0,316,243,157,209,0,871,0,757,0,655,912,880,"Human, Federation, Civilian, Writer, Gambler, Romantic, Cultural Figure, Inspiring","male, organic, ds9, jake, crew_max_rarity_4","You Should Read More",1, 6, 12, 8, 14, 0, 2, , , , 525, 250, 170, 550, false,"Jake",crew_portraits_cm_jake_old_author_sm.png,jake_author_crew
"Prospero Data",5,4, 252,120,263,0,0,0,0,0,0,595,66,127,881,90,172,0,0,0,856,817,359,386,741,0,441,523,0,567,608,0,72,364,405,537,580,231,372,442,0,548,735,0,711,804,0,407,459,603,745,819,"Android, Federation, Starfleet, Cyberneticist, Costumed, Cultural Figure, Musician","nonhuman, male, tng, lieutenant_commander, bridge_crew, artificial_life, data, crew_max_rarity_4","Be Collected",1, 5, 4, 6, 6, , , , , , , 200, 240, 490, true,"Prospero",crew_portraits_cm_data_prospero_sm.png,data_prospero_crew
"Captain Morgan Bateson",10,5, 1074,218,498,0,0,0,986,117,244,0,0,0,447,94,186,0,0,0,211,74,174,143,134,355,0,772,0,323,196,265,742,0,643,160,94,117,128,107,537,0,716,0,481,344,458,665,0,579,352,283,"Federation, Starfleet, Human, Casual","male, organic, tng, captain, bridge_crew, bateson, crew_max_rarity_5","Surprise Attack",0, 8, 12, 10, 14, 8, 4, , , , 150, 30, 190, 590, false,"Bateson",crew_portraits_cm_bateson_sm.png,bateson_captain_crew
"Captain John Harriman",10,4, 589,83,188,0,0,0,0,0,0,0,0,0,778,132,255,0,0,0,632,656,576,264,528,0,0,546,0,0,631,0,491,0,419,693,708,648,354,599,0,0,579,0,0,652,0,508,0,466,913,933,"Federation, Starfleet, Human, Communicator","male, organic, tng, captain, bridge_crew, harriman, crew_max_rarity_4","Evasive Maneuvers",1, 7, 6, 10, 10, , , , , , 615, 30, 10, 500, false,"Harriman",crew_portraits_cm_harriman_sm.png,harriman_captain_crew
"Captain Sulu",9,4, 738,113,249,0,0,0,330,92,206,0,0,0,502,106,206,0,0,0,515,350,454,304,398,820,0,685,0,710,516,672,651,0,551,568,316,495,335,467,638,0,675,0,571,382,555,620,0,540,788,704,"Human, Federation, Starfleet, Veteran, Tactician, Pilot","male, organic, tos, captain, bridge_crew, sulu, crew_max_rarity_4","Outstanding!",1, 6, 14, 10, 14, 0, 1, , , , 115, , 50, 375, false,"Sulu",crew_portraits_cm_sulucaptain_sm.png,sulu_captain_crew
"Umpire Odo",8,5, 1165,165,351,0,0,0,0,0,0,0,0,0,944,138,302,0,0,0,216,340,178,65,138,0,0,399,0,0,494,0,342,0,299,353,442,279,145,261,0,0,509,0,0,585,0,432,0,404,499,721,"Changeling, Bajoran, Constable, Costumed","nonhuman, male, organic, ds9, odo, niners, crew_max_rarity_5","STRIKE THREE!",0, 8, 6, 8, 10, 3, 0, 2, , , 365, 250, 535, 375, false,"Odo",crew_portraits_cm_odoumpire_sm.png,odo_umpire_crew
"Niners Kira Nerys",4,4, 753,169,365,0,0,0,674,53,90,0,0,0,308,109,227,0,0,0,467,219,408,361,355,597,0,815,0,528,444,483,796,0,690,329,309,259,194,246,880,0,647,0,750,524,727,576,0,514,671,663,"Bajoran, Athlete, Costumed, Veteran","nonhuman, female, organic, ds9, kira, niners, crew_max_rarity_4","Double Play",2, 5, 12, 12, 20, 2, 0, , , , 150, 245, 122, 580, false,"Kira",crew_portraits_cm_kira_niners_sm.png,kira_niners_crew
"Niners Rom",3,4, 0,0,0,0,0,0,544,144,297,853,102,239,0,0,0,0,0,0,0,627,410,0,0,569,338,0,0,81,691,463,453,239,0,0,516,552,0,0,443,383,0,0,118,557,364,570,326,0,885,864,"Ferengi, Bajoran, Desperate, Resourceful, Jury Rigger, Athlete, Saboteur, Hero, Costumed","nonhuman, male, organic, ds9, rom, niners, crew_max_rarity_4","Bunt",0, 8, 6, 6, 10, , , , 2, 2, 865, 300, 185, 80, false,"Rom",crew_portraits_cm_rom_niners_sm.png,rom_niners_crew
"Goddess of Empathy Troi",7,5, 0,0,0,0,0,0,0,0,0,0,0,0,1101,74,155,992,234,676,0,0,0,461,131,0,0,345,140,0,440,141,285,96,18,0,0,0,808,44,0,0,773,63,0,854,56,742,20,35,480,542,"Human, Betazoid, Empath, Cultural Figure, Hologram, Inspiring","female, nonhuman, artificial_life, tng, commander, bridge_crew, troi, crew_max_rarity_5","Discard Your Facades",0, 7, 10, 10, 14, 6, 0, , , , 750, 70, 50, 1125, false,"Troi",crew_portraits_cm_troi_goddess_sm.png,troi_goddess_crew
"Apollo",7,4, 303,96,196,0,0,0,0,0,0,0,0,0,590,74,170,582,236,586,848,813,782,505,133,0,0,644,292,0,728,378,609,256,91,663,688,616,479,15,0,0,758,88,0,831,80,716,31,43,742,298,"Inspiring, Caregiver, Musician, Cultural Figure, Spiritual, Brutal","male, organic, tos, nonhuman, crew_max_rarity_4","I am Apollo!",2, 9, 12, 10, 12, , , , 1, 2, 500, 100, 83, 515, false,"Apollo",crew_portraits_cm_apollo_sm.png,apollo_crew
"Platonian Kirk",6,4, 626,138,268,0,0,0,689,191,390,0,0,0,217,122,265,0,0,0,545,203,485,451,433,493,0,871,0,437,378,385,854,0,739,503,129,432,234,418,266,0,580,0,240,111,203,510,0,467,697,271,"Human, Federation, Starfleet, Inspiring, Romantic, Explorer, Telekinetic","male, organic, tos, captain, bridge_crew, kirk, crew_max_rarity_4","Telekinetic Barrage",2, 9, 6, 12, 14, 5, 0, , , , 150, 735, 10, 425, false,"Kirk",crew_portraits_cm_kirk_platonian_sm.png,kirk_platonian_crew
"Ba'ku Worf",4,4, 547,119,272,0,0,0,902,118,299,0,0,0,0,0,0,0,0,0,615,172,555,687,513,403,0,0,0,364,530,302,0,0,0,525,227,452,618,434,471,0,0,0,420,592,393,0,0,0,857,830,"Klingon, Federation, Starfleet, Tactician, Desperate","nonhuman, male, organic, tng, lieutenant_commander, bridge_crew, worf, crew_max_rarity_4","Aggressive Tendencies",0, 6, 8, 5, 14, 1, 0, , , , 550, 325, 60, 305, false,"Worf",crew_portraits_cm_worf_insurrection_sm.png,worf_insurrection_crew
"Combat Medic Paris",4,4, 330,76,160,0,0,0,590,90,207,0,0,0,0,0,0,843,92,255,849,438,783,876,125,606,0,0,285,535,710,36,0,238,391,763,425,710,788,213,643,0,0,355,574,739,161,0,317,498,701,782,"Human, Starfleet, Federation, Tactician, Costumed","organic, voy, lieutenant, bridge_crew, paris, crew_max_rarity_4","Time's up!",0, 7, 10, 10, 16, 6, 0, , , , 575, 70, 30, 515, false,"Paris",crew_portraits_cm_paris_wwii_sm.png,paris_wwii_crew
"Maquis Ro Laren",9,4, 560,102,264,0,0,0,756,139,372,0,0,0,274,132,241,0,0,0,614,222,554,469,512,475,0,831,0,421,349,367,814,0,705,564,184,493,285,466,348,0,598,0,317,152,276,527,0,480,699,404,"Maquis, Bajoran, Survivalist, Saboteur, Desperate","nonhuman, female, organic, tng, ro, crew_max_rarity_4","Not Sure Where I Stand",1, 6, 12, 12, 16, 5, 0, , , , 280, 95, 20, 515, false,"Ro",crew_portraits_cm_ro_maquis_sm.png,ro_maquis_crew
"Dr. Hippocrates Noah",4,4, 0,0,0,675,155,333,0,0,0,0,0,0,353,82,174,571,104,349,520,0,0,847,462,514,371,295,75,0,876,431,788,311,239,411,0,0,774,367,401,277,180,57,0,815,362,703,218,156,721,491,"Hologram, Human, Villain, Crafty, Communicator, Prodigy, Resourceful","male, ds9, noah, sisko, crew_max_rarity_4","Demolish the House",2, 5, 3, 4, 16, 1, 0, , , , 300, 90, 103, 365, true,"Hippocrates",crew_portraits_cm_sisko_noah_sm.png,sisko_noah_crew
"Agent Janeway",8,5, 0,0,0,441,174,384,1013,63,144,0,0,0,1018,209,489,0,0,0,652,488,0,417,0,60,436,82,385,359,51,299,242,0,231,321,785,0,323,0,130,238,13,205,686,147,669,151,0,172,357,219,"Human, Federation, Starfleet, Costumed, Undercover Operative, Crafty","female, organic, voy, captain, bridge_crew, janeway, crew_max_rarity_5","Let's End This",0, 8, 10, 3, 14, 5, 1, , , , 465, 105, 125, 675, false,"Janeway",crew_portraits_cm_janeway_wwii_sm.png,janeway_wwii_crew
"Revolutionary Damar",7,5, 895,336,692,0,0,0,391,124,400,0,0,0,869,133,328,0,0,0,224,133,180,76,142,677,0,456,0,598,197,553,400,0,343,36,9,22,13,23,331,0,480,0,306,106,260,397,0,380,364,20,"Cardassian, Cultural Figure, Inspiring, Hero, Desperate","nonhuman, male, organic, ds9, damar, crew_max_rarity_5","For Cardassia!",2, 7, 12, 10, 14, 7, 0, , , , 450, 395, 100, 465, false,"Damar",crew_portraits_cm_damarrevolution_sm.png,damar_revolutionary_crew
"Emotion Chip Data",7,5, 0,0,0,518,108,231,0,0,0,819,182,396,1027,224,578,0,0,0,675,0,375,400,0,654,92,80,406,372,365,0,23,210,215,612,0,240,238,0,585,68,31,362,269,216,0,4,144,114,346,86,"Android, Starfleet, Federation, Cyberneticist, Resourceful, Musician","nonhuman, male, tng, lieutenant_commander, bridge_crew, artificial_life, data, crew_max_rarity_5","Humor, I love it!",0, 7, 6, 8, 12, 3, 0, 3, , , 575, 300, 10, 300, true,"Data",crew_portraits_cm_datagenerations_sm.png,data_generations_crew
"Augment Riker",5,4, 332,63,129,0,0,0,566,106,218,579,204,499,0,0,0,0,0,0,870,465,203,886,754,610,365,0,0,104,723,498,512,280,0,832,440,50,849,715,597,137,0,0,37,701,514,145,66,0,773,451,"Human, Augments, Engineered, Gambler, Desperate, Maverick, Jury Rigger, Survivalist","male, organic, tng, ent, pic, riker, original, crew_max_rarity_4","Last Chance",2, 7, 10, 10, 12, , , , , , 375, 305, 217, 330, false,"Riker",crew_portraits_cm_riker_augment_sm.png,riker_augment_crew
"Garak, Elim Garak",7,5, 1000,229,493,0,0,0,565,66,138,0,0,0,937,179,362,0,0,0,242,139,198,67,156,659,0,355,0,582,143,536,295,0,272,155,160,115,34,103,801,0,376,0,693,249,675,307,0,306,325,196,"Cardassian, Crafty, Resourceful, Undercover Operative, Costumed, Romantic, Hero","male, organic, ds9, nonhuman, garak, crew_max_rarity_5","There's Hope For You Yet",1, 7, 12, 12, 12, 6, 2, , , , 650, 200, 20, 700, false,"Garak",crew_portraits_cm_garak_secretagent_sm.png,garak_secretagent_crew
"Stranded Odo",9,4, 722,188,409,0,0,0,539,54,109,0,0,0,402,50,120,0,0,0,466,256,407,354,354,719,0,808,0,628,534,589,782,0,681,263,255,195,257,181,861,0,846,0,734,697,711,814,0,710,751,734,"Changeling, Desperate, Bajoran, Survivalist","nonhuman, organic, ds9, odo, crew_max_rarity_4","Not Without a Fight",0, 6, 8, 10, 10, 4, 2, , , , 275, 70, 130, 465, false,"Odo",crew_portraits_cm_odo_cold_weather_sm.png,odo_cold_weather_crew
"Age of Sail Riker",6,5, 1034,248,518,0,0,0,897,208,400,572,78,158,0,0,0,0,0,0,220,68,43,398,141,310,446,0,0,55,452,222,624,367,0,128,27,32,254,84,240,505,0,0,88,369,184,730,427,0,257,112,"Human, Federation, Starfleet, Explorer, Maverick, Gambler, Costumed","ageofsail, male, organic, tng, bridge_crew, riker, crew_max_rarity_5","Battle Stations!",0, 10, 8, 10, 12, , , , 1, 2, 350, , 195, 415, false,"Riker",crew_portraits_cm_riker_age_of_sail_sm.png,riker_ageofsail_crew
"Laas",9,4, 0,0,0,773,139,332,448,58,124,0,0,0,661,28,55,0,0,0,490,766,0,711,0,171,350,141,295,672,421,636,613,0,518,439,809,0,947,0,212,283,359,265,716,791,694,904,0,780,680,893,"Explorer, Changeling, Civilian, Prodigy, Hunter, Survivalist","nonhuman, male, organic, ds9, laas, crew_max_rarity_4","A Pale Shadow",2, 8, 8, 8, 10, , , , 0, 2, 580, 200, 242, 300, false,"Laas",crew_portraits_cm_laas_sm.png,laas_crew
"Age of Sail La Forge",4,4, 404,167,367,0,0,0,408,50,102,794,105,262,0,0,0,0,0,0,676,467,84,730,571,816,355,0,0,196,870,668,489,262,0,331,303,48,475,248,872,363,0,0,325,922,723,535,294,0,749,619,"Human, Starfleet, Federation, Cyberneticist, Explorer, Costumed, Innovator","ageofsail, male, organic, tng, lieutenant_commander, laforge, crew_max_rarity_4","Hard to Port!",1, 8, 10, 10, 12, , , , 0, 2, 1250, 130, 222, 550, false,"La Forge",crew_portraits_cm_laforge_age_of_sail_sm.png,laforge_ageofsail_crew
"Joachim",8,5, 957,117,254,0,0,0,1251,103,225,0,0,0,0,0,0,0,0,0,395,78,354,518,303,229,0,0,0,210,366,151,0,0,0,555,293,483,639,458,590,0,0,0,530,696,506,0,0,0,505,908,"Human, Augments, Engineered, Villain, Tactician, Pilot","nonhuman, male, organic, tos, joachim, crew_max_rarity_5","For Khan!",0, 6, 6, 10, 10, 8, 4, , , , 565, 505, 150, 350, false,"Joachim",crew_portraits_cm_joachim2_sm.png,joachim_wok_crew
"Durango Troi",6,5, 840,116,391,0,0,0,1349,52,114,0,0,0,381,207,417,0,0,0,422,83,380,238,322,223,0,659,0,206,89,145,628,0,529,370,311,296,69,277,859,0,282,0,732,220,708,212,0,224,339,360,"Empath, Constable, Scoundrel, Costumed, Federation, Starfleet, Betazoid, Human","female, nonhuman, tng, commander, bridge_crew, troi, crew_max_rarity_5","Call Me Durango",2, 10, 12, 12, 12, , , , 0, 2, 525, 375, 20, 725, false,"Troi",crew_portraits_cm_troi_cowboy_sm.png,troi_cowboy_crew
"Sybok",6,4, 0,0,0,670,51,126,0,0,0,0,0,0,827,117,238,215,141,461,617,0,0,593,674,601,417,136,178,0,614,649,474,444,183,856,0,0,664,190,847,565,390,97,0,687,195,552,115,68,649,548,"Vulcan, Inspiring, Spiritual, Explorer, Counselor, Telepath","nonhuman, male, organic, sybok, tos, crew_max_rarity_4","Share Your Pain",1, 7, 6, 8, 10, 3, 0, 3, , , 575, 390, 43, 390, false,"Sybok",crew_portraits_cm_sybok_sm.png,sybok_crew
"Augment Picard",7,5, 938,115,206,0,0,0,1163,221,447,0,0,0,438,108,184,0,0,0,421,76,374,267,318,189,0,779,0,180,95,118,749,0,649,625,128,565,408,529,183,0,706,0,166,114,139,650,0,567,356,365,"Human, Augments, Engineered, Villain, Brutal, Desperate, Survivalist, Hunter, Duelist","male, organic, tng, tos, picard, original, crew_max_rarity_5","Negotiate Surrender",0, 9, 12, 12, 12, , , , , , 600, 215, 110, 500, false,"Picard",crew_portraits_cm_picard_augment_sm.png,picard_augment_crew
"Luther Sloan",10,4, 230,47,86,0,0,0,492,210,485,0,0,0,696,113,217,0,0,0,921,479,858,510,805,527,0,573,0,476,208,419,529,0,451,899,216,827,552,778,165,0,653,0,148,89,123,582,0,521,806,508,"Human, Starfleet, Federation, Undercover Operative, Interrogator, Section 31, Villain","male, organic, ds9, sloan, crew_max_rarity_4","Clandestine Meeting",1, 7, 8, 6, 10, 5, 0, , , , 425, 530, 183, 600, true,"Sloan",crew_portraits_cm_luthersloan_sm.png,sloan_spy_crew
