"Klingon Bride Jadzia",6,5, 0,0,0,993,128,279,351,137,273,0,0,0,1014,323,585,0,0,0,526,1027,0,534,0,120,350,50,286,904,159,835,311,0,291,717,750,0,231,0,127,448,12,402,586,32,539,73,0,100,543,94,"Federation, Starfleet, Exobiology, Astrophysicist, Trill, Gambler, Romantic, Klingon, Pilot","nonhuman, female, organic, ds9, dax, crew_max_rarity_5","Lead With My Heart",0, 7, 6, 8, 14, 7, 2, , , , 750, 20, 455, 405, false,"J. Dax",crew_portraits_cm_jadzia_dax_bride_sm.png,dax_jadzia_bride_crew
"Martia",9,4, 0,0,0,0,0,0,632,100,203,0,0,0,719,175,358,0,0,0,0,843,0,831,0,755,0,745,0,680,270,596,677,0,576,0,911,0,643,0,835,0,516,0,760,228,712,432,0,392,1219,1138,"Chameloid, Shapeshifter, Crafty, Survivalist, Criminal, Scoundrel, Prisoner","nonhuman, female, organic, martia, tos, crew_max_rarity_4","That Was Not His Knee",1, 6, 14, 10, 14, 7, 1, , , , 475, 325, 235, 529, false,"Martia",crew_portraits_cm_martia_sm.png,martia_crew
"Captain Klaa",10,4, 744,160,341,0,0,0,517,100,251,0,0,0,0,0,0,0,0,0,696,343,610,830,525,867,0,0,0,770,1018,695,0,0,0,513,258,430,655,374,741,0,0,0,683,928,630,0,0,0,1246,1104,"Klingon, Hunter, Tactician, Duelist","nonhuman, male, organic, tos, klaa, crew_max_rarity_4","Warrior's Mettle",0, 6, 12, 8, 14, 0, 2, , , , 650, 250, 125, 525, false,"Klaa",crew_portraits_cm_klaa_sm.png,klaa_crew
"Mintakan Riker",7,5, 516,39,73,0,0,0,1036,259,543,0,0,0,925,154,314,0,0,0,1039,214,969,365,894,334,0,608,0,298,57,214,515,0,455,1198,216,1126,595,1042,130,0,625,0,139,40,95,528,0,474,569,332,"Human, Federation, Starfleet, Survivalist, Hunter, Costumed, Undercover Operative, Vulcan, Mintakan","male, organic, tng, riker, crew_max_rarity_5","Proto-Vulcan Instincts",2, 7, 10, 10, 14, 7, 0, , , , 530, 230, 250, 415, false,"Riker",crew_portraits_cm_riker_mintakan_sm.png,riker_mintakan_crew
"Vulcan Executioner",9,5, 0,0,0,0,0,0,1225,255,535,0,0,0,912,146,284,0,0,0,0,390,0,752,0,207,0,640,0,187,35,105,556,0,480,0,319,0,804,0,134,0,713,0,145,49,99,616,0,558,671,609,"Vulcan, Federation, Brutal, Duelist","male, organic, nonhuman, tos, vulcan_executioner, crew_max_rarity_5","Till Death",0, 9, 8, 5, 14, 1, 0, 2, , , 350, 240, 130, 275, false,"Vulcan Executioner",crew_portraits_cm_vulcan_executioner_sm.png,vulcan_executioner_crew
"Anastasia Komananov",5,4, 0,0,0,0,0,0,614,123,244,0,0,0,784,116,233,0,0,0,0,832,0,836,0,744,0,750,0,673,275,586,686,0,582,0,806,0,923,0,702,0,832,0,649,332,598,764,0,668,1222,1229,"Bajoran, Hologram, Undercover Operative, Costumed, Romantic, Crafty","nonhuman, artificial_life, female, ds9, kira, crew_max_rarity_4","You've Destroyed Ze World!",0, 8, 6, 6, 10, , , , 2, 2, 575, 310, 131, 365, false,"Anastasia",crew_portraits_cm_kira_anastasia_sm.png,kira_anastasia_crew
"Gangster Kirk",8,5, 1171,177,371,0,0,0,494,151,303,0,0,0,912,138,269,0,0,0,323,173,273,113,202,831,0,647,0,744,230,668,564,0,485,432,158,348,190,305,573,0,746,0,516,211,458,666,0,595,478,292,"Federation, Starfleet, Costumed, Civilian, Human, Marksman, Crafty, Criminal","male, organic, tos, kirk, crew_max_rarity_5","Piece of the Action",2, 8, 12, 10, 14, 4, 0, , , , 455, 105, 210, 1405, false,"Kirk",crew_portraits_cm_kirk_gangster_sm.png,kirk_gangster_crew
"Stargazer Picard",4,1, 175,29,67,143,14,56,0,0,0,0,0,0,236,41,107,0,0,0,1179,1166,1155,1109,1072,1221,899,1091,775,0,1255,0,1170,0,1014,1152,1152,1142,1066,1055,1221,897,1050,773,0,1238,0,1127,0,979,1417,1417,"Federation, Starfleet, Human, Astrophysicist, Tactician","male, organic, tng, picard, exclusive_honorhall, crew_max_rarity_1","Picard Maneuver",0, 1, 1, 10, 12, , , , , , 195, 120, 20, 220, false,"Picard",crew_portraits_cm_picardstargazer_sm.png,picard_stargazer_crew
"Kahless the Unforgettable",4,5, 1007,270,852,0,0,0,825,205,563,0,0,0,472,102,310,0,0,0,259,72,209,157,130,473,0,910,0,411,215,311,862,0,735,28,2,13,15,14,158,0,741,0,159,59,115,659,0,586,256,15,"Klingon, Cultural Figure, Inspiring, Duelist, Hero, Clone, Royalty","nonhuman, male, organic, tng, kahless, exclusive_honorhall, crew_max_rarity_5","Sword of Honor",2, 7, 6, 8, 14, 5, 2, , , , 575, 250, 209, 15, false,"Kahless",crew_portraits_cm_kahless_sm.png,kahless_crew
"Kurros",8,4, 548,91,224,0,0,0,0,0,0,0,0,0,785,133,276,0,0,0,886,904,816,380,739,0,0,741,0,0,865,0,673,0,572,845,872,786,389,718,0,0,743,0,0,859,0,665,0,594,1242,1217,"Resourceful, Tactician, Communicator, Scoundrel, Thief, Prodigy, Innovator","nonhuman, male, organic, voy, kurros, crew_max_rarity_4","I Am The Solution.",1, 8, 8, 10, 14, , , , , , 400, 375, 173, 525, false,"Kurros",crew_portraits_cm_kurros_crew_sm.png,kurros_crew
"Duchamps",6,4, 390,61,150,0,0,0,507,130,267,0,0,0,697,197,398,0,0,0,1076,606,1002,519,918,849,0,743,0,756,308,684,674,0,573,1070,494,1009,301,927,655,0,420,0,600,125,556,341,0,320,1032,642,"Klingon, Hologram, Gambler, Villain, Crafty, Duelist","nonhuman, organic, male, ds9, worf, crew_max_rarity_4","Chemin De Fer",2, 5, 10, 10, 10, 8, 4, , , , 550, 40, 142, 575, false,"Duchamps",crew_portraits_cm_worf_duchamps_sm.png,worf_duchamps_crew
"Assimilated Torres",8,5, 0,0,0,0,0,0,851,124,323,1114,231,477,0,0,0,0,0,0,0,714,281,0,0,623,255,0,0,42,813,461,331,127,0,0,694,185,0,0,589,167,0,0,18,763,480,194,71,0,765,715,"Borg, Jury Rigger, Human, Federation, Klingon, Maquis, Undercover Operative, Cyberneticist","female, organic, voy, nonhuman, torres, crew_max_rarity_5","Modulated Shields",0, 8, 6, 10, 10, 3, 0, 3, , , 680, 125, 260, 400, false,"Torres",crew_portraits_cm_torres_assimilated_sm.png,torres_assimilated_crew
"Falcon O'Brien",7,5, 913,97,234,0,0,0,1353,80,168,486,89,191,0,0,0,0,0,0,644,121,142,788,484,312,712,0,0,73,499,194,979,566,0,815,523,275,932,687,965,619,0,0,417,1104,808,903,522,0,570,1106,"Human, Starfleet, Federation, Costumed, Villain, Hologram, Brutal, Scoundrel","male, organic, ds9, obrien, crew_max_rarity_5","I Expect You To Die",0, 9, 10, 14, 12, , , 2, , , , 25, 100, 450, false,"Falcon",crew_portraits_cm_obrien_falcon_sm.png,obrien_falcon_crew
"One",9,5, 0,0,0,0,0,0,1023,95,208,1016,233,519,0,0,0,0,0,0,0,648,311,0,0,522,268,0,0,41,725,376,359,146,0,0,912,155,0,0,836,145,0,0,33,998,713,163,53,0,746,857,"Human, Borg, Resourceful, Tactician, Hero","male, nonhuman, organic, voy, one, crew_max_rarity_5","You must comply",1, 10, 8, 12, 10, , , , , , 225, 210, 275, 425, false,"One",crew_portraits_cm_one_sm.png,one_crew
"Borg Queen",4,5, 1234,227,505,0,0,0,0,0,0,660,28,82,892,104,187,0,0,0,226,392,39,98,101,0,594,708,0,759,821,0,128,466,540,190,356,83,142,116,0,880,945,0,1034,1037,0,678,701,769,402,716,"Borg, Brutal, Cultural Figure, Resourceful, Interrogator, Communicator, Survivalist, Temporal Agent","nonhuman, female, organic, borg_queen, tng, voy, pic, crew_max_rarity_5","We are Borg",0, 8, 10, 3, 14, 1, 1, , , , 515, 200, 157, 300, false,"Borg Queen",crew_portraits_cm_borg_queen_sm.png,borg_queen_crew
"Assimilated Tuvok",5,4, 544,139,318,279,113,277,834,107,218,0,0,0,0,0,0,0,0,0,472,311,748,939,674,319,807,1113,704,591,867,510,0,0,0,121,317,503,718,453,208,465,775,415,716,959,665,0,0,0,995,677,"Vulcan, Borg, Telepath, Brutal, Tactician, Undercover Operative","nonhuman, male, organic, voy, tuvok, apr2023, crew_max_rarity_4","Resistance is Illogical!",0, 9, 14, 20, 12, , , 1, , , 650, 200, 135, 425, false,"Tuvok",crew_portraits_cm_tuvok_assimilated_sm.png,tuvok_assimilated_crew
"Doc Crusher",4,4, 0,0,0,561,51,122,0,0,0,0,0,0,384,110,216,473,310,732,948,0,0,1106,551,919,643,567,129,0,1136,526,1028,346,279,1148,0,0,950,32,1141,830,576,18,0,970,31,807,13,9,1059,200,"Human, Starfleet, Federation, Physician, Caregiver, Costumed","female, organic, tng, crusher, crew_max_rarity_4","This is Senseless!",1, 8, 10, 10, 12, , , , 2, 2, 755, 155, 140, 575, false,"Crusher",crew_portraits_cm_crusher_dixonhill_sm.png,crusher_dixonhill_crew
"Cyrus Redblock",7,4, 678,245,528,0,0,0,433,29,65,0,0,0,587,167,322,0,0,0,659,441,576,268,491,1104,0,793,0,949,572,888,742,0,633,156,241,123,42,97,1210,0,589,0,1045,560,983,495,0,439,860,348,"Civilian, Human, Hologram, Crafty, Criminal, Villain","male, nonhuman, artificial_life, tng, redblock, crew_max_rarity_4","Tolerant Man",1, 6, 14, 10, 14, 0, 1, , , , 590, 185, 205, 555, false,"Cyrus",crew_portraits_cm_cyrus_redblock_sm.png,redblock_crew
"Arik Soong",10,4, 214,171,365,726,119,276,0,0,0,0,0,0,0,0,0,508,57,120,343,1060,1014,1153,493,683,486,762,175,0,0,821,0,589,877,81,558,364,623,138,677,461,765,251,0,0,924,0,662,953,1137,759,"Human, Thief, Geneticist, Maverick, Civilian","male, organic, ent, arik, crew_max_rarity_4","Genetic Tampering",1, 6, 12, 12, 12, 7, 0, , , , 575, 195, 283, 490, false,"Arik",crew_portraits_cm_ariksoong_sm.png,arik_jacket_crew
"Assimilated La Forge",6,5, 855,239,482,403,148,316,0,0,0,1140,235,493,0,0,0,0,0,0,142,584,18,675,342,967,79,983,594,282,0,0,320,118,0,17,367,4,382,127,574,18,641,347,194,0,0,178,63,0,460,40,"Human, Borg, Brutal, Innovator, Quantum Mechanics, Warp Theorist","male, organic, tng, laforge, original, crew_max_rarity_5","Full Impulse",1, 10, 10, 12, 10, , , , , , 350, 155, 80, 525, false,"La Forge",crew_portraits_cm_laforge_assimilated_sm.png,laforge_assimilated_crew
"Icheb",8,4, 0,0,0,596,84,191,0,0,0,735,140,413,0,0,0,0,0,0,864,0,622,0,0,809,142,863,486,593,0,0,680,332,0,949,0,371,0,0,914,125,963,553,388,0,0,404,187,0,1235,1154,"Civilian, Brunali, Borg, Astrophysicist, Prodigy, Innovator","male, nonhuman, organic, voy, icheb, crew_max_rarity_4","In Position!",2, 6, 10, 8, 12, 1, 1, , , , 290, 225, 145, 505, false,"Icheb",crew_portraits_cm_icheb_sm.png,icheb_crew
"Assimilated Janeway",9,5, 945,107,196,1211,99,369,570,64,158,0,0,0,0,0,0,0,0,0,43,308,560,775,471,57,252,406,194,778,1024,704,0,0,0,177,577,816,965,748,231,374,629,342,905,1146,850,0,0,0,533,963,"Human, Federation, Starfleet, Borg, Undercover Operative, Resourceful","female, organic, voy, janeway, crew_max_rarity_5","I Don't Compromise",0, 10, 8, 8, 12, , , , , , 625, 200, 127, 415, false,"Janeway",crew_portraits_cm_janeway_assimilated_sm.png,janeway_assimilated_crew
"Admiral Picard",7,4, 477,203,378,340,57,165,0,0,0,0,0,0,686,233,436,0,0,0,493,852,755,344,684,1133,827,395,718,0,849,0,658,0,561,147,512,313,46,268,1028,733,139,638,0,412,0,229,0,230,991,229,"Human, Hologram, Ambassador, Veteran, Explorer, Federation, Starfleet","male, tng, picard, nonhuman, artificial_life, crew_max_rarity_4","Strategic Importance",2, 9, 8, 8, 10, , , 2, , , 580, 225, 320, 450, false,"Picard",crew_portraits_cm_picard_admiral_sm.png,picard_admiral_crew
"Riley Frazier",8,4, 430,38,79,489,147,312,0,0,0,0,0,0,671,177,361,0,0,0,519,1057,1008,550,928,832,582,252,502,0,880,0,696,0,587,423,1141,1124,491,1039,584,387,94,355,0,623,0,426,0,385,1064,771,"Civilian, Human, Borg, Desperate, Romantic, Resourceful, Federation, Starfleet, Communicator","female, organic, voy, riley, crew_max_rarity_4","For The Cooperative!",0, 5, 10, 10, 20, 2, 0, , , , 550, 200, 172, 550, false,"Riley",crew_portraits_cm_riley_frazier_sm.png,riley_frazier_crew
"Yarnek",9,5, 896,191,440,1004,304,584,0,0,0,0,0,0,507,77,173,0,0,0,38,587,428,294,348,329,254,128,198,0,1073,0,928,0,795,6,455,235,234,192,104,92,36,82,0,1106,0,965,0,832,476,78,"Excalbian, Crafty, Exobiology, Quantum Mechanics, Telepath, Explorer, Shapeshifter","nonhuman, organic, male, tos, yarnek, crew_max_rarity_5","Good Versus Evil",2, 8, 6, 6, 6, , , , , , 265, , 130, 200, true,"Yarnek",crew_portraits_cm_yarnek_sm.png,yarnek_crew
"Bartender Guinan",5,5, 0,0,0,0,0,0,528,99,197,0,0,0,948,358,730,811,236,601,0,938,0,524,383,883,0,388,295,789,132,46,298,206,26,0,925,0,117,85,857,0,51,96,780,24,14,32,36,1,410,22,"Communicator, Civilian, Counselor, Marksman, Empath, Bartender, El-Aurian","nonhuman, female, organic, tng, guinan, gauntlet_jackpot, exclusive_gauntlet, crew_max_rarity_5","I Listen",1, 8, 12, 12, 20, 2, 0, , 2, 3, 515, 175, 80, 655, false,"Guinan",crew_portraits_cm_guinan_mixologist_sm.png,guinan_bartender_crew
"Galen",7,4, 0,0,0,777,70,180,571,84,199,0,0,0,215,169,339,0,0,0,732,905,0,1181,0,201,494,435,415,750,723,676,1087,0,949,1001,942,0,674,0,445,682,229,588,803,270,752,463,0,415,1092,891,"Human, Costumed, Brutal, Undercover Operative, Smuggler, Musician, Starfleet, Federation","male, organic, tng, picard, crew_max_rarity_4","Mutiny",0, 6, 12, 12, 12, 4, 0, , , , 350, 275, 140, 550, false,"Picard",crew_portraits_cm_picardgalen_sm.png,picard_galen_crew
"Maquis Tuvok",9,5, 493,88,296,826,163,415,1170,139,344,0,0,0,0,0,0,0,0,0,155,186,837,1001,758,22,425,660,343,306,519,222,0,0,0,76,247,642,847,591,40,285,445,245,471,693,406,0,0,0,553,257,"Vulcan, Maquis, Telepath, Costumed, Tactician, Undercover Operative","nonhuman, male, organic, voy, tuvok, crew_max_rarity_5","Et Tuvok",0, 8, 10, 3, 14, 4, 1, , , , 450, 100, 65, 375, false,"Tuvok",crew_portraits_cm_tuvok_maquis_sm.png,tuvok_maquis_crew
"Marla McGivers",10,4, 0,0,0,0,0,0,0,0,0,532,107,240,906,76,167,0,0,0,0,0,840,811,0,0,608,711,0,773,830,0,137,477,542,0,0,751,1075,0,0,511,1009,0,697,1112,0,352,418,837,1230,1301,"Human, Artist, Tactician, Communicator, Federation, Starfleet, Romantic","female, organic, tos, marla, crew_max_rarity_4","All For Love",1, 7, 6, 8, 8, , , , , , 450, 270, 40, 440, false,"Marla",crew_portraits_cm_marla_mcgivers_sm.png,marla_mcgivers_crew
"Benny Russell",9,5, 0,0,0,1134,160,528,351,77,159,0,0,0,802,218,582,0,0,0,318,1081,0,695,0,80,243,49,185,964,332,900,475,0,418,261,1012,0,321,0,82,190,7,166,875,113,826,121,0,142,578,99,"Human, Civilian, Writer, Veteran, Communicator, Desperate","male, organic, ds9, sisko, crew_max_rarity_5","Cannot Destroy an Idea!",2, 10, 12, 12, 12, , , 2, , , 520, 515, 33, 200, false,"Benny",crew_portraits_cm_sisko_benny_sm.png,sisko_benny_crew
"Vedek Bareil Antos",6,4, 414,218,437,0,0,0,0,0,0,0,0,0,735,181,382,375,92,190,854,877,781,357,322,0,0,729,667,0,850,865,660,613,266,268,424,206,56,43,0,0,459,546,0,587,762,389,523,126,968,205,"Bajoran, Vedek, Cultural Figure, Spiritual, Survivalist, Gardener","nonhuman, male, organic, ds9, bareil, crew_max_rarity_4","An Opposing Viewpoint",1, 5, 3, 10, 8, 4, 0, 2, , , 315, 285, 110, 400, false,"Bareil",crew_portraits_cm_bariel_vedek_sm.png,bareil_vedek_crew
"Sheriff Worf",4,4, 803,105,246,0,0,0,607,106,217,0,0,0,412,31,95,0,0,0,706,318,624,538,536,774,0,1097,0,697,625,613,1063,0,931,782,415,707,692,644,792,0,1180,0,723,764,675,1155,0,1000,1000,1157,"Klingon, Starfleet, Federation, Costumed, Duelist, Constable","male, organic, tng, worf, nonhuman, crew_max_rarity_4","Sheriff of Deadwood",2, 6, 12, 12, 12, 7, 2, , , , 620, 390, 72, 600, false,"Worf",crew_portraits_cm_worf_cowboy_sm.png,worf_cowboy_crew
"Sheriff of Nottingham Q",9,5, 1077,299,641,0,0,0,952,94,188,0,0,0,0,0,0,0,0,0,274,106,225,482,148,607,0,0,0,538,795,446,0,0,0,75,65,51,191,39,892,0,0,0,806,1045,755,0,0,0,699,561,"Crafty, Costumed, Scoundrel, Constable, Romantic, Q Continuum","nonhuman, male, tng, q_jdl, crew_max_rarity_5","Gallant But Futile",2, 10, 12, 12, 12, , , , 0, 2, 600, 210, 63, 150, false,"Q",crew_portraits_cm_q_nottingham_sm.png,q_nottingham_crew
"Robin Hood",7,4, 699,39,94,0,0,0,942,68,139,0,0,0,217,137,275,0,0,0,825,290,752,708,682,638,0,1155,0,562,503,479,1131,0,983,1184,839,1108,630,1027,1061,0,742,0,940,479,884,660,0,587,996,1206,"Starfleet, Federation, Human, Costumed, Hero, Thief, Marksman","male, organic, tng, bridge_crew, crew_max_rarity_4","Quite Right",2, 8, 12, 10, 14, 7, 4, , , , 500, 70, 165, 780, false,"Picard",crew_portraits_cm_picard_robinhood_sm.png,picard_robinhood_crew
"North Star Archer",6,4, 634,122,253,0,0,0,835,106,237,316,66,134,0,0,0,0,0,0,775,282,414,901,616,660,861,0,0,305,862,506,1142,675,0,740,373,331,858,607,753,783,0,0,398,940,641,1063,639,0,997,1049,"Human, Starfleet, Tactician, Duelist, Costumed, Hero, Explorer","male, organic, ent, archer, crew_max_rarity_4","High Noon",2, 8, 12, 5, 12, 2, 0, , , , 670, 45, 42, 315, false,"Archer",crew_portraits_cm_archer_cowboy_sm.png,archer_cowboy_crew
"Princess Jadzia",3,4, 0,0,0,882,75,158,0,0,0,310,132,294,577,143,292,0,0,0,693,0,990,923,0,656,233,204,391,926,936,0,376,611,656,1043,0,595,794,0,1013,208,323,621,576,811,0,91,328,547,927,809,"Federation, Starfleet, Costumed, Gambler, Royalty, Astrophysicist, Trill, Pilot","nonhuman, female, organic, ds9, dax, crew_max_rarity_4","For Camelot!",2, 7, 6, 8, 10, 3, 0, 3, , , 330, 10, 45, 405, false,"J. Dax",crew_portraits_cm_jadzia_dax_camelot_sm.png,dax_jadzia_camelot_crew
"Commander Kira Nerys",7,5, 1239,206,406,0,0,0,418,130,262,0,0,0,809,207,448,0,0,0,275,175,226,90,149,988,0,636,0,866,283,792,553,0,477,332,157,262,43,222,665,0,339,0,610,100,564,242,0,240,467,119,"Bajoran, Starfleet, Federation, Veteran, Survivalist, Tactician, Saboteur","nonhuman, female, organic, ds9, kira, crew_max_rarity_5","Guerrilla Warfare",2, 7, 16, 3, 16, 1, 2, , , , 315, 325, , 340, false,"Kira",crew_portraits_cm_kira_commander_sm.png,kira_commander_crew
"Captain T'Pol",6,4, 773,97,275,606,69,194,0,0,0,0,0,0,230,195,391,0,0,0,176,766,632,531,549,804,568,500,484,0,1146,0,1040,0,900,318,794,669,194,614,943,652,157,571,0,558,0,359,0,333,1013,606,"Vulcan, Starfleet, Astrophysicist, Tactician, Telepath","nonhuman, female, organic, ent, tpol, crew_max_rarity_4","Field Commission",1, 5, 12, 12, 20, 2, 0, , , , 975, 75, 3, 190, false,"T'Pol",crew_portraits_cm_tpol_captain_sm.png,tpol_captain_crew
"Admiral Kirk",9,5, 814,266,548,0,0,0,0,0,0,0,0,0,1273,148,289,0,0,0,489,577,420,80,338,0,0,380,0,0,476,0,290,0,277,127,280,96,45,72,0,0,700,0,0,808,0,604,0,544,674,528,"Gambler, Maverick, Human, Starfleet, Federation, Inspiring, Hero","male, organic, tos, kirk, crew_max_rarity_5","Kobayashi Maru",1, 8, 6, 8, 10, 3, 0, 2, , , 325, 505, 255, 315, false,"Kirk",crew_portraits_cm_kirk_admiral_sm.png,kirk_admiral_crew
"Dahar Master Kor",7,4, 618,57,184,0,0,0,299,96,232,0,0,0,806,181,358,0,0,0,855,601,782,318,713,1127,0,685,0,970,461,905,611,0,519,998,532,951,341,866,773,0,504,0,711,207,659,424,0,382,951,760,"Klingon, Duelist, Cultural Figure, Romantic, Dahar Master, Communicator, Inspiring","nonhuman, male, organic, ds9, kor, crew_max_rarity_4","Long Live The Empire!",0, 5, 3, 10, 8, 4, 0, 2, , , 215, 190, 50, 290, false,"Kor",crew_portraits_cm_kor_daharmaster_sm.png,kor_daharmaster_crew
"Klingon Neelix",7,4, 0,0,0,0,0,0,878,85,252,0,0,0,613,72,187,0,0,0,0,733,0,955,0,640,0,846,0,565,256,481,803,0,686,0,846,0,1053,0,762,0,983,0,703,534,648,944,0,819,1211,1297,"Talaxian, Mylean, Klingon, Brutal, Chef, Survivalist, Ambassador","nonhuman, male, organic, voy, neelix, crew_max_rarity_4","Hunger Is The Enemy",1, 5, 10, 10, 10, 8, 4, , , , 475, 295, 165, 315, false,"Neelix",crew_portraits_cm_neelix_klingon_sm.png,neelix_klingon_crew
"Grilka",10,5, 875,215,496,0,0,0,458,70,177,0,0,0,1031,125,297,0,0,0,478,291,408,125,332,1023,0,501,0,895,235,823,406,0,365,208,178,163,82,132,966,0,729,0,852,408,809,637,0,572,609,319,"Klingon, Romantic, Tactician, Resourceful","nonhuman, female, organic, ds9, grilka, crew_max_rarity_5","House of Grilka",0, 8, 6, 6, 6, , , , , , 775, 50, 83, 350, true,"Grilka",crew_portraits_cm_grilka_sm.png,grilka_crew
"Kortar",7,5, 921,186,430,0,0,0,1209,157,301,0,0,0,404,121,255,0,0,0,480,102,410,316,334,331,0,1034,0,296,157,211,997,0,862,329,118,257,165,215,565,0,790,0,503,229,449,713,0,631,514,240,"Klingon, Cultural Figure, Brutal, Duelist, Hero, Veteran","nonhuman, male, organic, voy, kortar, crew_max_rarity_5","Gre'thor Awaits You",2, 7, 6, 8, 14, 7, 2, , , , 425, 300, 45, 315, false,"Kortar",crew_portraits_cm_kortar_sm.png,kortar_crew
"Protomorphosis Worf",8,5, 887,186,408,0,0,0,1270,145,307,0,0,0,0,0,0,0,0,0,543,99,467,710,387,302,0,0,0,266,486,188,0,0,0,367,133,292,551,250,579,0,0,0,524,749,466,0,0,0,688,834,"Klingon, Federation, Starfleet, Brutal, Primal, Hunter, Desperate","nonhuman, male, organic, tng, worf, crew_max_rarity_5","Protomorphosis",0, 10, 8, 10, 12, , , , 2, 2, 200, 195, 140, 375, false,"Worf",crew_portraits_cm_worf_genesis_sm.png,worf_genesis_crew
"Ambassador K'Ehleyr",7,4, 0,0,0,0,0,0,549,72,188,0,0,0,941,45,102,0,0,0,0,932,0,818,0,879,0,717,0,784,297,705,644,0,547,0,968,0,1211,0,937,0,1158,0,832,852,787,1128,0,980,1241,1381,"Klingon, Human, Brutal, Ambassador, Communicator, Federation","nonhuman, female, organic, kehleyr, tng, crew_max_rarity_4","Trapped Between Cultures",1, 6, 6, 6, 6, , , , , , 325, 255, 168, 475, true,"K'Ehleyr",crew_portraits_cm_kehleyr_ambassador_sm.png,kehleyr_ambassador_crew
"Dahar Master Kang",7,5, 0,0,0,0,0,0,1006,106,285,0,0,0,1225,216,436,0,0,0,0,609,0,469,0,474,0,338,0,413,32,314,252,0,232,0,776,0,500,0,666,0,343,0,611,103,565,247,0,244,669,877,"Klingon, Brutal, Tactician, Cultural Figure, Dahar Master, Diplomat, Veteran","nonhuman, male, organic, ds9, kang, crew_max_rarity_5","Glorious Victory",0, 9, 12, 10, 14, 4, 4, , , , 865, 160, 100, 465, false,"Kang",crew_portraits_cm_kang_dahar_sm.png,kang_daharmaster_crew
"Klingon Torres",6,4, 0,0,0,0,0,0,895,81,230,625,75,208,0,0,0,0,0,0,0,730,775,0,0,635,562,0,0,117,826,475,806,444,0,0,895,881,0,0,819,615,0,0,320,985,701,898,517,0,1210,1298,"Klingon, Civilian, Brutal, Duelist, Desperate, Prisoner","nonhuman, female, organic, voy, torres, crew_max_rarity_4","You Need Me",0, 5, 1, 12, 20, 2, 0, , , , 355, 275, 53, 405, true,"Torres",crew_portraits_cm_torres_klingon_sm.png,torres_klingon_crew
"Liaison Torres",9,4, 263,115,295,0,0,0,0,0,0,551,83,250,669,128,307,0,0,0,1110,1078,498,574,958,0,595,769,0,760,894,0,223,467,602,683,733,148,270,548,0,524,702,0,712,812,0,146,433,548,1105,675,"Federation, Human, Cyberneticist, Klingon, Civilian, Diplomat","nonhuman, female, organic, voy, torres, crew_max_rarity_4","Career Change",0, 5, 12, 12, 20, 2, 0, , , , , 345, , 750, false,"Torres",crew_portraits_cm_torres25c_sm.png,torres_liaison_crew
"Klingon Janeway",7,5, 563,27,71,877,180,379,1270,129,255,0,0,0,0,0,0,0,0,0,161,188,941,1083,864,20,390,622,323,287,507,200,0,0,0,301,634,1141,1251,1054,78,300,475,255,628,884,582,0,0,0,537,886,"Klingon, Human, Brutal, Duelist, Veteran, Survivalist","nonhuman, female, organic, voy, janeway, crew_max_rarity_5","Power Is Not Enough",2, 8, 4, 10, 16, 5, 0, , , , 425, 190, 190, 515, false,"Janeway",crew_portraits_cm_janeway_klingon_sm.png,janeway_klingon_crew
"Alidar Jarok",6,4, 546,254,581,0,0,0,325,170,400,0,0,0,604,64,189,0,0,0,712,421,631,384,548,995,0,859,0,874,548,800,813,0,699,115,31,85,100,67,382,0,996,0,347,238,276,958,0,826,931,116,"Romulan, Veteran, Desperate, Tactician","nonhuman, male, organic, jarok, tng, crew_max_rarity_4","I Am Not A Traitor",2, 7, 10, 10, 16, 6, 0, , , , 200, , 96, 315, false,"Jarok",crew_portraits_cm_jarok_sm.png,jarok_crew
"Advocate Kolos",6,4, 352,43,123,673,59,150,0,0,0,0,0,0,748,188,371,0,0,0,496,1107,1072,536,996,752,543,202,458,0,838,0,645,0,548,753,1110,1072,394,995,1073,767,222,663,0,594,0,395,0,362,981,1050,"Klingon, Communicator, Diplomat, Interrogator, Investigator","nonhuman, male, organic, ent, kolos, crew_max_rarity_4","Be Silent",2, 7, 12, 10, 14, 4, 0, , , , 575, 120, 100, 400, false,"Kolos",crew_portraits_cm_kolos_sm.png,kolos_advocate_crew
"The President of Earth",4,4, 399,18,74,0,0,0,0,0,0,0,0,0,651,188,487,458,133,445,1139,1098,1064,549,415,0,0,746,494,0,868,660,678,458,136,1209,1155,1146,356,184,0,0,310,246,0,400,287,221,173,20,1057,420,"Hologram, Federation, Starfleet, Politician, Cultural Figure, Inspiring, Musician, Diplomat, Human","nonhuman, male, artificial_life, voy, emh, crew_max_rarity_4","Hail to the Chief",0, 8, 12, 12, 16, 5, 0, , , , 450, 15, 165, 475, false,"The President",crew_portraits_cm_emh_president_sm.png,emh_president_crew
"Nyota Uhura",9,5, 899,74,127,0,0,0,536,63,125,0,0,0,1050,240,468,0,0,0,694,377,606,130,522,969,0,419,0,851,152,777,334,0,305,1092,773,1029,219,945,1109,0,268,0,966,190,912,195,0,196,620,788,"Human, Federation, Starfleet, Communicator, Resourceful, Musician","female, organic, tos, uhura, crew_max_rarity_5","Alameda Express",1, 8, 4, 10, 10, , , , , , 115, 15, 167, 565, false,"Uhura",crew_portraits_cm_uhurastiv_sm.png,uhura_stiv_crew
"Katra McCoy",8,4, 0,0,0,325,76,166,0,0,0,0,0,0,458,170,347,790,121,352,1144,0,0,982,526,1137,834,615,197,0,996,508,831,325,134,1024,0,0,659,466,987,698,230,154,0,649,438,454,258,75,1060,621,"Federation, Starfleet, Vulcan, Desperate, Human, Physician","male, organic, tos, mccoy, crew_max_rarity_4","Steps of Mount Seleya",1, 6, 4, 8, 8, 6, 0, , , , 450, 190, 53, 280, true,"McCoy",crew_portraits_cm_mccoy_katra_sm.png,mccoy_katra_crew
"Katrine",7,5, 1050,271,589,525,36,110,867,200,373,0,0,0,0,0,0,0,0,0,85,108,258,527,191,121,718,1028,625,485,750,400,0,0,0,55,27,74,245,60,202,855,1163,742,343,563,273,0,0,0,532,149,"Human, Federation, Starfleet, Crafty, Desperate, Gambler, Saboteur, Undercover Operative, Costumed","female, organic, voy, janeway, crew_max_rarity_5","Leave The War Outside",0, 7, 6, 8, 14, 4, 2, , , , 315, 385, 80, 650, false,"Janeway",crew_portraits_cm_janeway_tuxedo_sm.png,janeway_tuxedo_crew
"M-113 Creature",7,4, 0,0,0,382,126,262,665,45,92,0,0,0,797,102,202,0,0,0,1041,891,0,837,0,388,743,369,647,729,315,651,691,0,585,745,1132,0,981,0,461,467,293,416,1013,792,956,858,0,736,969,1151,"M-113 Creature, Desperate, Exobiology, Shapeshifter, Telepath, Crafty","nonhuman, female, tos, salt_vampire, organic, crew_max_rarity_4","I Hunger",0, 6, 8, 3, 10, 1, 0, , , , 240, 145, 93, 560, true,"M-113 Creature",crew_portraits_cm_m113_sm.png,salt_vampire_crew
"Lal",10,4, 0,0,0,0,0,0,0,0,0,879,63,134,507,140,325,0,0,0,0,0,633,965,0,0,483,857,0,606,976,0,150,348,697,0,0,1045,744,0,0,786,630,0,960,728,0,239,643,478,1245,1263,"Android, Federation, Prodigy","nonhuman, female, tng, artificial_life, lal, crew_max_rarity_4","Reason For Being",0, 8, 6, 4, 8, , , , , , 450, 215, 77, 575, false,"Lal",crew_portraits_cm_lal_sm.png,lal_crew
