"Farragut Kirk",0,4, 668,85,212,390,50,156,953,146,304,0,0,0,0,0,0,0,0,0,604,315,981,1220,826,204,1102,1401,882,673,1008,539,0,0,0,700,461,1147,1308,994,338,1122,1394,883,768,1053,642,0,0,0,1159,1423,"Human, Federation, Starfleet, Tactician, Crafty, Desperate","male, organic, snw, kirk, crew_max_rarity_4","Quite The Ship You Got Here",0, 9, 6, 10, 12, , , , 1, 2, 240, 225, 55, 140, false,"Kirk",crew_portraits_cm_kirk_farragut_sm.png,kirk_farragut_crew, 61.4306, 4.8889, 17.108, 50.8726, 1, 0, 0, 21.41
"Primal Peanut Hamper",0,5, 0,0,0,0,0,0,0,0,0,1104,150,274,541,48,148,1339,208,368,0,0,540,1386,180,0,445,1232,166,524,1422,185,188,2,67,0,0,848,1535,401,0,636,1416,324,811,1577,389,438,20,194,375,955,"Saboteur, Automated Unit, Casual, Survivalist, Primal, Physician, Federation","female, nonhuman, low, hamper, crew_max_rarity_5","I Didn't Want To Sound Robotic",1, 7, 10, 12, 8, 2, 0, 2, , , 725, 375, 251, 600, false,"Hamper",crew_portraits_cm_peanut_hamper_primal_sm.png,peanut_hamper_primal_crew, 91.3645, 48.6667, 48.0074, 86.6085, 6, 0, 0, 0
"Base Camp McCoy",0,5, 536,70,168,0,0,0,0,0,0,0,0,0,1388,200,376,1034,150,301,1259,1273,1215,212,57,0,0,374,365,0,442,408,288,280,13,1353,1325,1305,400,195,0,0,611,488,0,767,652,559,455,77,359,833,"Federation, Starfleet, Human, Physician, Casual, Caregiver, Communicator","male, organic, tos, mccoy, crew_max_rarity_5","You Call This Relaxing?",2, 9, 6, 14, 6, 2, 0, , , , 700, 425, 243, 500, false,"McCoy",crew_portraits_cm_mccoy_base_camp_sm.png,mccoy_base_camp_crew, 90.8636, 47.5556, 72.522, 86.7667, 4, 0, 0, 0
"Fly-Fishing M'Benga",0,4, 0,0,0,674,97,201,0,0,0,0,0,0,386,50,152,860,150,296,1041,0,0,1507,652,975,741,673,96,0,1546,626,1405,435,320,1198,0,0,1525,691,1139,855,757,164,0,1564,670,1424,464,294,1255,1442,"Human, Starfleet, Federation, Physician, Caregiver, Casual, Athlete","male, organic, snw, mbenga, crew_max_rarity_4","What A Beautiful Day",2, 8, 8, 14, 8, 5, 0, , , , 475, 430, 220, 415, false,"M'Benga",crew_portraits_cm_mbenga_flyfishing_sm.png,mbenga_flyfishing_crew, 58.7858, 37.1111, 35.4734, 55.7333, 5, 0, 0, 21.41
"Pascal Fullerton",0,5, 0,0,0,1330,186,424,546,72,168,0,0,0,1061,158,309,0,0,0,334,1258,0,856,0,63,265,52,169,1094,235,942,606,0,495,521,1332,0,985,0,167,354,84,276,1173,435,1045,762,0,623,366,720,"Human, Federation, Politician, Saboteur, Desperate, Crafty, Civilian, Communicator","organic, male, ds9, fullerton, crew_max_rarity_5","Pampered, Spoiled Children",0, 10, 10, 10, 10, , , , , , 150, 300, 55, 175, false,"Pascal",crew_portraits_cm_pascal_fullerton_sm.png,pascal_fullerton_crew, 89.982, 34, 20.0539, 85.1636, 3, 0, 0, 0
"Lady Audrey Chapel",0,5, 0,0,0,1070,142,309,0,0,0,0,0,0,536,87,183,1347,188,406,624,0,0,1348,172,582,466,246,7,0,1381,172,1191,84,63,878,0,0,1365,381,818,609,356,49,0,1410,367,1235,218,138,348,728,"Human, Physician, Empath, Resourceful, Caregiver, Spiritual","female, organic, snw, chapel, crew_max_rarity_5","So Much Pain",2, 7, 10, 8, 12, 2, 0, , , , 640, 500, 275, 300, false,"Chapel",crew_portraits_cm_chapel_lady_audrey_sm.png,chapel_lady_audrey_crew, 90.4027, 52, 66.1195, 87.5652, 5, 0, 1, 42.5597
"T'Pring as Spock",0,5, 550,80,178,1077,152,299,0,0,0,0,0,0,1364,201,401,0,0,0,165,1243,1172,211,1007,576,459,41,340,0,460,0,296,0,235,313,1278,1247,343,1096,819,610,107,498,0,706,0,501,0,400,278,725,"Vulcan, Telepath, Human, Starfleet, Federation, Spiritual, Communicator","tos, organic, nonhuman, tpring, spock, female, crew_max_rarity_5","Something Is Wrong",0, 10, 6, 8, 10, 5, 0, , , , 555, 200, 303, 600, false,"T'Pring",crew_portraits_cm_tpring_spock_sm.png,tpring_spock_crew, 91.645, 29.1111, 93.6217, 86.5639, 2, 0, 0, 39.5228
"Paradise Spock",0,4, 0,0,0,926,174,317,684,104,201,0,0,0,382,60,167,0,0,0,789,1070,0,1500,0,109,572,391,433,900,785,754,1396,0,1201,748,1188,0,1470,0,198,488,365,416,1029,830,912,1360,0,1144,1133,1318,"Human, Vulcan, Starfleet, Federation, Telepath, Explorer, Romantic, Compromised","nonhuman, male, organic, tos, spock, crew_max_rarity_4","There's Belonging and Love",2, 7, 10, 8, 10, 0, 1, , , , 340, 250, 170, 365, false,"Spock",crew_portraits_cm_spock_paradise_sm.png,spock_paradise_crew, 60.9697, 20.6667, 25.097, 55.774, 3, 0, 0, 18.3731
"Luau Chakotay",0,5, 1099,124,297,0,0,0,0,0,0,0,0,0,1374,212,412,530,79,177,599,741,553,51,44,0,0,369,728,0,429,957,283,760,59,917,979,849,183,201,0,0,510,761,0,604,1020,444,812,131,256,733,"Human, Federation, Starfleet, Maquis, Casual, Tactician, Resourceful, Festive","organic, male, voy, chakotay, crew_max_rarity_5","Let's Mingle",1, 7, 10, 10, 14, 2, 0, , , , 450, 125, 135, 290, false,"Chakotay",crew_portraits_cm_chakotay_luau_sm.png,chakotay_luau_crew, 92.1058, 44.6667, 77.4144, 89.1107, 4, 0, 0, 18.9588
"M'Benga and Oriana",0,4, 0,0,0,0,0,0,674,127,250,0,0,0,392,93,185,914,147,309,0,1049,0,1466,607,941,0,1353,449,882,701,50,1373,393,237,0,1051,0,1355,662,916,0,1231,469,881,520,119,1220,431,213,1057,1077,"Human, Federation, Starfleet, Physician, Caregiver, Communicator, Survivalist, Tactician","male, organic, snw, mbenga, crew_max_rarity_4","Help Her See The Light",1, 5, 10, 10, 14, 2, 0, , , , 315, 250, 234, 175, false,"M'Benga",crew_portraits_cm_mbenga_oriana_sm.png,mbenga_oriana_crew, 60.7694, 55.1111, 70.0509, 69.0171, 5, 0, 0, 21.41
"Yeoman Barrows",0,4, 0,0,0,0,0,0,386,60,161,667,99,202,962,152,301,0,0,0,0,1388,982,969,0,1403,743,792,0,528,439,1112,159,566,614,0,1370,1130,1054,0,1334,826,893,0,593,495,1089,258,684,698,1112,1392,"Human, Starfleet, Federation, Romantic, Resourceful","female, organic, tos, barrows, crew_max_rarity_4","It Is Beautiful. So Lovely, And Restful",2, 8, 8, 8, 10, , , , 3, 800, 455, 275, 317, 215, false,"Barrows",crew_portraits_cm_barrows_yeoman_sm.png,barrows_yeoman_crew, 61.8313, 24.2222, 12.828, 51.8443, 1, 0, 0, 0
"Rites of Separation Leeta",0,5, 0,0,0,535,74,162,0,0,0,0,0,0,1365,200,406,1043,154,307,1266,0,0,576,426,1215,954,124,92,0,456,402,293,271,12,1374,0,0,760,630,1315,1037,237,192,0,678,601,485,402,61,360,764,"Bajoran, Civilian, Spiritual, Romantic, Casual, Resourceful, Communicator, Playful","female, nonhuman, organic, ds9, leeta, crew_max_rarity_5","Our Paths Have Grown Apart",1, 8, 10, 12, 8, 0, 1, , , , 450, 400, 400, 300, false,"Leeta",crew_portraits_cm_leeta_separation_sm.png,leeta_separation_crew, 90.3827, 65.7778, 22.8783, 86.8152, 5, 0, 0, 21.1497
"Sir Adya Ortegas",0,4, 909,148,301,0,0,0,363,62,162,669,100,202,0,0,0,0,0,0,832,565,183,1032,615,1445,742,0,0,546,1561,1136,1042,563,0,846,537,233,1031,654,1326,827,0,0,588,1513,1078,1155,685,0,1223,1377,"Human, Communicator, Resourceful, Costumed, Duelist","female, organic, snw, ortegas, crew_max_rarity_4","My King, We Have Been Led Into A Trap",1, 7, 8, 10, 8, 1, 2, , , , 890, 210, 235, 390, false,"Ortegas",crew_portraits_cm_ortegas_adya_sm.png,ortegas_adya_crew, 59.1865, 64.4444, 17.2705, 60.2355, 4, 0, 1, 21.41
"Vox",0,5, 0,0,0,0,0,0,1351,200,396,1087,151,301,529,101,203,0,0,0,0,522,548,1332,0,247,447,1168,0,20,119,161,171,252,969,0,696,792,1306,0,471,564,1182,0,70,223,354,250,420,976,283,536,"Human, Survivalist, Borg, Desperate, Scoundrel, Saboteur","male, pic, jack, crew_max_rarity_5","The Time Of The Borg Is Over!",0, 10, 6, 10, 6, 5, 0, , , , 540, 300, 210, 540, false,"Vox",crew_portraits_cm_crusher_j_vox_sm.png,crusher_j_vox_crew, 90.8435, 25.3333, 99.3571, 88.7569, 3, 0, 0, 39.4143
"Luau Torres",0,4, 672,103,211,0,0,0,0,0,0,339,73,156,974,154,316,0,0,0,1029,1080,583,305,809,0,1172,754,0,1285,933,0,305,930,580,1133,1158,556,443,939,0,1042,817,0,1195,959,0,322,862,611,1138,1313,"Human, Klingon, Casual, Starfleet, Federation, Resourceful, Festive","female, nonhuman, organic, voy, torres, crew_max_rarity_4","Why Don't You Take a Break?",1, 5, 12, 10, 12, 2, 0, , , , 600, 575, 277, 200, false,"Torres",crew_portraits_cm_torres_luau_sm.png,torres_luau_crew, 60.8295, 52.8889, 73.9058, 64.7208, 5, 0, 0, 0
"Assimilated Esmar",0,5, 1379,205,423,0,0,0,1063,142,307,544,70,163,0,0,0,0,0,0,281,52,77,566,142,581,935,0,0,183,851,387,1230,759,0,419,151,135,670,259,799,1032,0,0,337,1060,648,1339,854,0,295,663,"Haliian, Borg, Federation, Starfleet, Tactician, Communicator, Villain, Compromised","organic, nonhuman, pic, esmar, crew_max_rarity_5","Eliminate All Unassimilated",0, 10, 12, 8, 12, 1, 0, 2, 2, 2, 525, 350, 115, 90, false,"Esmar",crew_portraits_cm_esmar_assimilated_sm.png,esmar_assimilated_crew, 91.1441, 33.3333, 61.8905, 85.8275, 3, 0, 0, 42.0174
"Rock'n'Roll Mariner",0,5, 1377,198,409,530,67,168,0,0,0,0,0,0,1062,158,313,0,0,0,90,493,282,54,151,1231,964,250,755,0,833,0,603,0,493,167,641,430,132,299,1318,1043,385,816,0,960,0,748,0,612,317,692,"Federation, Starfleet, Human, Inspiring, Musician, Desperate, Maverick, Playful","female, organic, low, mariner, crew_max_rarity_5","Two, Three, Four!",0, 9, 12, 8, 8, 1, 0, 2, , , 100, 300, , 190, false,"Mariner",crew_portraits_cm_mariner_rocknroll_sm.png,mariner_rocknroll_crew, 90.8435, 43.1111, 60.2687, 85.2608, 5, 0, 0, 0
"Bankrobber T'Ana",0,5, 1092,136,300,0,0,0,1354,177,365,0,0,0,0,0,0,521,77,188,596,61,551,846,47,288,0,0,737,334,529,28,0,770,1027,886,227,821,1072,186,569,0,0,732,570,810,132,0,776,1053,368,863,"Caitian, Federation, Starfleet, Romantic, Costumed, Desperate, Criminal, Thief","female, organic, nonhuman, low, tana, crew_max_rarity_5","Hands Up Where I Can See Them!",0, 7, 4, 10, 12, 0, 4, , , , 150, 325, 200, 650, false,"T'Ana",crew_portraits_cm_tana_bankrobber_sm.png,tana_bankrobber_crew, 90.7433, 32.8889, 25.5904, 85.4688, 4, 0, 0, 0
"Exoarchaeologist Mariner",0,5, 0,0,0,1326,196,394,0,0,0,1111,135,304,532,73,153,0,0,0,349,0,522,1379,0,322,10,151,186,509,1416,0,178,230,1036,574,0,822,1473,0,510,59,257,319,786,1514,0,357,465,1150,370,860,"Human, Federation, Exoarchaeology, Explorer, Resourceful, Desperate, Maverick, Playful","female, organic, low, mariner, crew_max_rarity_5","How Many Old Brown Pots Do We Really Need?",2, 9, 8, 8, 10, 5, 0, , , , 300, 500, , 15, false,"Mariner",crew_portraits_cm_mariner_exoarchaeologist_sm.png,mariner_exoarchaeologist_crew, 90.6432, 51.7778, 61.0223, 85.7335, 5, 0, 0, 0
"Caretaker Torres",0,5, 0,0,0,1327,202,401,0,0,0,1084,124,347,542,101,200,0,0,0,344,0,536,1310,0,312,12,133,181,522,1347,0,157,248,949,543,0,698,1314,0,474,46,187,290,675,1350,0,232,338,985,311,497,"Klingon, Human, Federation, Prisoner, Resourceful, Maquis, Desperate","nonhuman, female, organic, voy, torres, crew_max_rarity_5","I Don't Find This At All Amusing, Starfleet",0, 6, 8, 12, 10, 2, 0, , , , 775, 200, 323, 625, false,"Torres",crew_portraits_cm_torres_caretaker_sm.png,torres_caretaker_crew, 90.1623, 38, 82.1404, 87.9131, 3, 0, 0, 40.3471
"Bankrobber Shaxs",0,4, 378,75,176,0,0,0,953,149,311,0,0,0,668,102,253,0,0,0,1404,484,1337,809,1198,709,0,1027,0,662,206,519,1014,0,834,1308,502,1267,742,1122,743,0,1075,0,713,309,587,1038,0,876,1058,1156,"Bajoran, Federation, Starfleet, Costumed, Criminal, Thief, Romantic","nonhuman, male, organic, low, shaxs, crew_max_rarity_4","Everybody Down! This Is A Robbery!",2, 8, 4, 10, 14, 5, 4, , , , 325, 625, 145, 115, false,"Shaxs",crew_portraits_cm_shaxs_bankrobber_sm.png,shaxs_bankrobber_crew, 61.3504, 39.7778, 19.4952, 56.3016, 5, 0, 0, 0
"Mistress of the Winter Constellations",4,5, 1086,157,298,0,0,0,1356,209,400,548,81,183,0,0,0,0,0,0,591,54,157,842,390,224,885,0,0,96,485,134,1184,713,0,816,165,269,993,613,431,915,0,0,162,647,311,1246,771,0,269,597,"Orion, Desperate, Resourceful, Saboteur, Duelist, Brutal, Smuggler","female, nonhuman, organic, low, tendi, crew_max_rarity_5","Shut Up And Do Your Job!",0, 10, 6, 6, 12, , , , , , 450, 250, 40, 150, false,"Tendi",crew_portraits_cm_tendi_mistress_sm.png,tendi_mistress_crew, 91.3444, 51.1111, 19.4997, 86.0505, 5, 0, 0, 19.3492
"Colonel Kira Nerys",0,5, 1132,151,351,0,0,0,540,91,200,0,0,0,1399,212,435,0,0,0,492,269,465,5,326,1143,0,339,0,1056,100,915,252,0,184,689,417,634,86,490,1150,0,474,0,1067,200,951,397,0,296,27,329,"Bajoran, Federation, Resourceful, Tactician, Veteran, Communicator","nonhuman, organic, female, low, kira, crew_max_rarity_5","What Is Your Problem?",0, 8, 8, 8, 12, 1, 1, , , , 100, 560, , 105, false,"Kira",crew_portraits_cm_kira_colonel_sm.png,kira_colonel_crew, 94.1895, 71.1111, 40.1162, 91.4315, 5, 0, 0, 0
"Cadet Rutherford",0,4, 0,0,0,0,0,0,954,165,306,674,98,201,393,47,150,0,0,0,0,846,974,1502,0,691,739,1392,0,163,446,499,595,560,1203,0,867,1148,1536,0,712,835,1417,0,251,504,557,688,698,1218,1115,1405,"Human, Starfleet, Federation, Maverick, Scoundrel, Desperate, Criminal","male, organic, low, rutherford, crew_max_rarity_4","Here I Am, Baby!",0, 6, 8, 10, 16, 5, 0, , , , 550, 230, 210, 365, false,"Rutherford",crew_portraits_cm_rutherford_cadet_sm.png,rutherford_cadet_crew, 61.8914, 22.6667, 58.406, 58.1785, 3, 0, 0, 17.7223
"Kenneth EMH",0,5, 0,0,0,1333,200,406,0,0,0,0,0,0,1096,151,297,508,79,183,332,0,0,833,1091,292,263,46,45,0,798,994,576,798,95,531,0,0,1066,1105,468,362,108,105,0,1087,1008,848,798,229,367,729,"Hologram, Explorer, Federation, Starfleet, Romantic, Physician, Casual, Caregiver","nonhuman, male, artificial_life, voy, emh, crew_max_rarity_5","The Coffee Was Quite Good This Morning",2, 8, 8, 12, 8, 4, 0, , , , 500, 200, 210, 450, false,"Doctor",crew_portraits_cm_emh_kenneth_sm.png,emh_kenneth_crew, 89.982, 37.7778, 46.158, 86.1678, 5, 0, 0, 41.974
"EV Suit Sam Kirk",0,4, 370,53,151,948,174,301,0,0,0,0,0,0,684,101,249,0,0,0,308,1410,1380,825,1247,734,554,214,420,0,1230,0,1004,0,827,351,1402,1379,835,1241,715,509,248,427,0,1266,0,1053,0,891,1098,1297,"Human, Xenoanthropology, Explorer, Starfleet, Federation, Desperate, Resourceful","male, organic, snw, sam, evsuit, crew_max_rarity_4","You're Here For A Reason",2, 7, 10, 8, 12, 1, 0, , , , 650, 250, 225, 540, true,"Sam",crew_portraits_cm_sam_kirk_ev_suit_sm.png,sam_kirk_ev_suit_crew, 61.2302, 40.8889, 53.7621, 60.2187, 4, 0, 0, 39.9783
"One Way Ticket Chapel",0,5, 0,0,0,0,0,0,1062,150,350,0,0,0,541,102,248,1357,200,402,0,733,0,1290,165,552,0,1126,137,526,209,3,1112,68,54,0,812,0,1230,358,639,0,1087,283,634,269,23,1054,202,103,193,318,"Human, Starfleet, Federation, Nurse, Caregiver, Desperate, Romantic, Duelist","female, organic, snw, chapel, evsuit, exclusive_voyage, crew_max_rarity_5","I Can't Believe This Is How We're Gonna Die",0, 7, 10, 8, 16, 2, 0, , , , 640, 500, 275, 300, false,"Chapel",crew_portraits_cm_chapel_one_way_ticket_sm.png,chapel_one_way_ticket_crew, 90.8435, 20, 70.0729, 90.3517, 3, 0, 0, 21.41
"Nancy Hedford",0,5, 551,72,176,0,0,0,0,0,0,0,0,0,1094,151,297,1357,197,351,1217,1248,1178,343,21,0,0,649,159,0,803,179,579,91,10,1315,1297,1273,566,121,0,0,912,346,0,1088,426,849,264,84,303,870,"Human, Civilian, Casual, Survivalist, Desperate, Resourceful, Communicator, Romantic, Compromised","female, organic, tos, nancy_hedford, crew_max_rarity_5","Now We're Together",2, 9, 10, 8, 12, 3, 0, , , , 215, 400, 398, 230, false,"Nancy",crew_portraits_cm_nancy_hedford_sm.png,nancy_hedford_crew, 92.1459, 72.4444, 59.9966, 89.3063, 5, 0, 0, 0
"Charlene",0,4, 677,97,203,387,58,162,0,0,0,0,0,0,981,147,302,0,0,0,579,1083,966,309,812,1409,1098,367,876,0,943,0,706,0,588,656,1198,1131,489,981,1352,1080,440,841,0,1078,0,843,0,711,1066,1406,"Hologram, Human, Caregiver, Romantic, Casual, Civilian","voy, artificial_life, nonhuman, female, charlene, crew_max_rarity_4","Line Up Next To The Door, Children",2, 8, 6, 12, 12, 5, 0, , , , 850, 225, 240, 550, false,"Charlene",crew_portraits_cm_charlene_sm.png,charlene_crew, 62.6728, 23.3333, 54.5198, 56.3987, 3, 0, 0, 41.974
"Rogue Jack Crusher",0,5, 1104,165,302,0,0,0,1359,202,407,0,0,0,539,100,211,0,0,0,556,41,514,313,373,213,0,1142,0,269,111,127,1145,0,946,779,153,705,447,570,432,0,1162,0,450,210,312,1139,0,957,169,451,"Human, Villain, Scoundrel, Criminal, Desperate, Civilian, Crafty, Casual","male, organic, pic, jack, crew_max_rarity_5","I've Always Been Different",2, 8, 6, 10, 10, 5, 0, , , , 300, 515, 202, 250, false,"Jack",crew_portraits_cm_crusher_j_rogue_sm.png,crusher_j_rogue_crew, 91.9054, 14.4444, 63.8779, 84.5803, 2, 0, 0, 59.7397
"Valeo Beta V Spock",0,5, 561,60,162,1329,197,402,1069,150,301,0,0,0,0,0,0,0,0,0,97,327,1186,1355,1028,22,277,426,182,544,847,385,0,0,0,192,540,1347,1471,1203,66,378,584,302,769,1054,643,0,0,0,374,823,"Human, Vulcan, Federation, Starfleet, Tactician, Telepath, Marksman, Communicator, Desperate","snw, male, organic, nonhuman, spock, crew_max_rarity_5","Captain, There's More Blood Over Here",1, 9, 8, 8, 10, 1, 0, 2, , , 750, 325, 243, 590, false,"Spock",crew_portraits_cm_spock_valeo_beta_v_sm.png,spock_valeo_beta_v_crew, 90.3426, 34, 45.795, 89.0261, 3, 0, 0, 60.4338
"Night Terrors Troi",0,5, 0,0,0,1092,158,356,0,0,0,0,0,0,1397,193,420,506,77,208,549,0,0,535,1081,503,386,12,73,0,410,977,273,786,58,697,0,0,731,1034,627,452,58,131,0,648,967,464,734,120,162,435,"Human, Starfleet, Federation, Betazoid, Empath, Communicator, Counselor, Desperate","female, nonhuman, organic, tng, troi, crew_max_rarity_5","Where Are You? I'm Coming.",2, 8, 4, 12, 14, 5, 0, , , , 115, 150, 50, 100, false,"Troi",crew_portraits_cm_troi_night_terrors_sm.png,troi_night_terrors_crew, 91.8654, 30, 47.5066, 88.2498, 3, 0, 0, 19.9566
"Assistant Kes",0,4, 365,62,163,684,118,216,0,0,0,0,0,0,982,179,296,0,0,0,578,1405,1368,553,1238,955,724,198,560,0,909,0,680,0,557,599,1354,1335,560,1190,1028,764,263,624,0,946,0,731,0,597,1042,1273,"Starfleet, Federation, Ocampa, Telepath, Caregiver, Prodigy, Communicator, Botanist, Physician","female, nonhuman, organic, voy, kes, crew_max_rarity_4","How's The Family?",0, 7, 6, 8, 10, 0, 1, , , , 815, 200, 210, 225, false,"Kes",crew_portraits_cm_kes_assistant_sm.png,kes_assistant_crew, 62.2521, 51.3333, 32.9203, 60.3491, 6, 0, 0, 18.3731
"Valeo Beta V La'an",0,5, 1107,147,325,0,0,0,1359,224,400,525,98,201,0,0,0,0,0,0,545,34,140,819,368,198,903,0,0,95,464,108,1203,733,0,762,139,217,946,556,398,836,0,0,131,593,274,1170,699,0,202,423,"Human, Federation, Tactician, Starfleet, Desperate, Marksman, Brutal, Resourceful, Duelist","female, organic, snw, laan, crew_max_rarity_5","Make It Angry!",0, 10, 8, 6, 10, 5, 0, , , , 650, 250, 225, 440, false,"La'an",crew_portraits_cm_laan_valeo_beta_v_sm.png,laan_valeo_beta_v_crew, 91.3645, 36.6667, 86.0013, 90.4859, 3, 0, 0, 42.0607
"Valeo Beta V Sam Kirk",0,4, 0,0,0,692,102,202,956,175,298,335,57,160,0,0,0,0,0,0,1019,838,1427,0,0,101,473,1032,564,325,979,491,1477,945,0,1183,861,1361,0,0,214,442,1190,674,328,944,555,1383,894,0,1173,1365,"Human, Xenoanthropology, Explorer, Starfleet, Federation, Desperate, Communicator","male, organic, snw, sam, crew_max_rarity_4","We Need To Alert The Rest Of The Crew",1, 9, 6, 10, 8, , , , 0, 3, 650, 250, 230, 440, false,"Sam",crew_portraits_cm_sam_kirk_valeobeta_sm.png,sam_kirk_valeobeta_crew, 60.5891, 31.3333, 17.6315, 57.1661, 3, 0, 0, 39.9783
"Brain Drain Crusher and Riker",0,5, 1392,201,400,0,0,0,1069,150,301,0,0,0,0,0,0,504,86,200,282,49,275,567,18,575,0,0,751,545,848,61,0,788,1044,495,180,458,732,68,792,0,0,705,770,1055,172,0,729,1025,305,567,"Human, Federation, Starfleet, Physician, Scoundrel, Maverick, Communicator, Desperate","female, male, organic, tng, crusher, riker, crew_max_rarity_5","Do You Want Some? It's Delicious.",0, 7, 8, 10, 10, 0, 1, , , , 550, 415, 207, 190, false,"Crusher",crew_portraits_cm_crusher_riker_brain_drain_sm.png,crusher_riker_brain_drain_crew, 90.6231, 38.6667, 40.783, 89.2011, 3, 0, 0, 17.7223
"Thalen",0,4, 689,97,200,395,49,152,0,0,0,911,175,302,0,0,0,0,0,0,564,1071,167,1190,795,1411,246,1395,877,711,0,0,807,378,0,718,1208,216,1309,995,1428,265,1409,903,667,0,0,718,334,0,1174,1380,"Xindi, Innovator, Resourceful, Tactician, Scoundrel, Prisoner","male, nonhuman, organic, ent, thalen, crew_max_rarity_4","I'm Losing Your Signal. Please Repeat.",2, 7, 8, 8, 14, 5, 0, 2, , , 490, 700, 290, 400, false,"Thalen",crew_portraits_cm_thalen_sm.png,thalen_crew, 60.7493, 38.8889, 38.0374, 58.5061, 3, 0, 1, 39.1106
"Machine Man Paris",0,5, 0,0,0,1095,125,287,0,0,0,1353,193,411,538,70,186,0,0,0,616,0,299,1360,0,578,9,245,342,298,1391,0,93,79,1002,949,0,465,1413,0,871,63,446,532,453,1446,0,148,179,1079,339,821,"Human, Starfleet, Federation, Maverick, Pilot, Desperate, Prisoner, Engineered, Compromised","male, voy, organic, paris, crew_max_rarity_5","Argh! What Are You Doing To Me?",0, 7, 6, 6, 10, 0, 1, , , , 200, 400, 180, 175, false,"Paris",crew_portraits_cm_paris_machine_man_sm.png,paris_machine_man_crew, 91.1641, 26.8889, 37.9618, 85.0522, 4, 0, 0, 41.1714
"Nightless Neelix",0,4, 0,0,0,941,143,318,389,66,157,0,0,0,681,121,261,0,0,0,788,1377,0,1138,0,225,571,216,432,1234,716,1103,983,0,802,847,1366,0,1159,0,305,565,238,461,1214,679,1082,977,0,828,1049,1184,"Talaxian, Mylean, Desperate, Civilian, Communicator, Counselor","male, nonhuman, organic, neelix, voy, crew_max_rarity_4","Bergamot Tea, Hot",0, 6, 6, 10, 10, 0, 1, , , , 240, 95, 70, 100, false,"Neelix",crew_portraits_cm_neelix_nightless_sm.png,neelix_nightless_crew, 61.5909, 26.4444, 30.5728, 56.2677, 2, 0, 0, 19.9566
"Phantasms Data",0,5, 0,0,0,1096,150,298,0,0,0,541,70,170,1377,199,399,0,0,0,590,0,1208,569,0,553,145,29,331,1108,443,0,90,757,227,887,0,1298,778,0,830,254,119,505,1163,722,0,165,835,413,260,805,"Android, Starfleet, Federation, Cyberneticist, Desperate, Prisoner, Communicator, Compromised","nonhuman, male, tng, artificial_life, data, crew_max_rarity_5","Have You Ever Had A Nightmare?",0, 10, 10, 10, 14, 5, 0, , , , 650, 300, 195, 750, false,"Data",crew_portraits_cm_data_phantasms_sm.png,data_phantasms_crew, 92.3462, 33.3333, 82.804, 87.7276, 3, 0, 0, 62.7983
"Captain Rudolph Ransom",0,5, 1404,225,405,1093,141,333,0,0,0,0,0,0,541,68,165,0,0,0,6,450,248,204,105,537,422,236,315,0,1399,0,1223,0,1012,44,602,387,326,257,721,514,386,434,0,1499,0,1344,0,1127,165,584,"Human, Federation, Starfleet, Tactician, Brutal, Desperate, Exobiology","male, organic, voy, rudolph_ransom, crew_max_rarity_5","We'd Found Our Salvation",2, 9, 8, 6, 8, 5, 0, , , , 650, 470, 225, 525, true,"Rudolph",crew_portraits_cm_rudolph_ransom_captain_sm.png,rudolph_ransom_captain_crew, 92.7269, 20.6667, 63.3559, 87.8133, 3, 0, 0, 0
"Compromised Kamran Gant",0,5, 1089,149,302,0,0,0,1359,208,393,0,0,0,537,68,154,0,0,0,587,55,544,357,388,233,0,1221,0,278,123,144,1241,0,1029,829,183,776,598,631,459,0,1350,0,473,301,338,1379,0,1163,314,801,"Human, Starfleet, Federation, Section 31, Control, Duelist, Tactician, Saboteur, Compromised","male, organic, dsc, gant, evsuit, crew_max_rarity_5","To Achieve One Requires The Other",2, 10, 8, 10, 12, 0, 1, , , , 440, 350, 305, 500, false,"Gant",crew_portraits_cm_gant_compromised_sm.png,gant_compromised_crew, 91.3845, 28.2222, 30.4834, 81.2314, 4, 0, 0, 0
"Paranoid O'Brien",0,4, 672,100,217,0,0,0,953,170,305,334,62,160,0,0,0,0,0,0,1027,301,587,1202,806,685,1189,0,0,327,981,495,1475,944,0,1126,421,566,1270,929,702,1062,0,0,319,939,551,1370,884,0,1188,1301,"Human, Clone, Federation, Starfleet, Desperate, Duelist, Romantic","male, organic, ds9, obrien, crew_max_rarity_4","Tell Her I Love",0, 6, 8, 8, 10, 3, 0, 3, , , 550, 415, 107, 400, false,"O'Brien",crew_portraits_cm_obrien_paranoid_sm.png,obrien_paranoid_crew, 59.8477, 0, 39.442, 50.5511, 0, 0, 0, 0
"Ensign Rita Tannenbaum",0,4, 0,0,0,0,0,0,390,55,166,904,159,317,679,120,258,0,0,0,0,1378,787,1143,0,1389,600,1009,0,317,722,1104,162,398,812,0,1371,685,1167,0,1335,493,1026,0,316,712,1090,153,335,832,1108,1136,"Human, Federation, Starfleet, Communicator, Resourceful, Jury Rigger","female, organic, ds9, rita_tannenbaum, crew_max_rarity_4","A Good Engineer Is Ready For Anything",2, 8, 6, 12, 8, 5, 0, , , , 115, 210, , 100, false,"Rita",crew_portraits_cm_rita_tannenbaum_ensign_sm.png,rita_tannenbaum_ensign_crew, 60.4488, 52, 54.1513, 62.3264, 3, 0, 0, 0
"Abducted Travis",0,4, 0,0,0,422,72,140,777,158,312,651,104,209,0,0,0,0,0,0,1381,998,998,0,0,400,403,1358,848,213,1153,673,1051,579,0,1439,870,1094,0,0,302,439,1379,863,242,950,561,1124,655,0,1301,1361,"Human, Starfleet, Desperate, Tactician, Explorer, Prisoner, Jury Rigger, Compromised","male, organic, ent, mayweather, crew_max_rarity_4","Captain? Hello? Hello?",0, 7, 8, 10, 10, 1, 1, , , , 565, 365, 279, 540, false,"Mayweather",crew_portraits_cm_mayweather_abducted_sm.png,mayweather_abducted_crew, 56.5017, 26.2222, 32.9181, 54.695, 4, 0, 0, 21.3883
"Pregnant Trip Tucker",0,5, 0,0,0,541,67,156,0,0,0,1337,201,406,1093,141,291,0,0,0,1267,0,313,837,0,1216,83,244,746,319,814,0,36,90,483,1411,0,445,1090,0,1341,153,464,836,439,1125,0,83,171,758,353,835,"Human, Starfleet, Desperate, Maverick, Explorer, Communicator","male, organic, ent, tucker, crew_max_rarity_5","Postnatal Responsibilities?!",2, 8, 10, 12, 16, 2, 0, , 0, 3, 650, 350, 200, 400, false,"Trip",crew_portraits_cm_tucker_pregnant_sm.png,tucker_pregnant_crew, 90.9036, 42.2222, 73.7192, 85.983, 4, 0, 0, 0
"Metron",0,5, 553,78,178,1336,221,421,0,0,0,0,0,0,1099,173,301,0,0,0,89,1239,1165,323,996,258,237,34,142,0,760,0,553,0,445,126,1283,1258,515,1111,386,306,66,233,0,951,0,733,0,599,234,512,"Metron, Diplomat, Tactician, Communicator, Crafty, Civilian, Resourceful, Cosmic","male, organic, nonhuman, tos, metron, crew_max_rarity_5","You Surprise Me, Captain.",0, 10, 8, 10, 12, , , , 2, 2, 700, 375, 355, 455, false,"Metron",crew_portraits_cm_metron_sm.png,metron_crew, 91.4446, 60.8889, 19.7051, 86.974, 4, 0, 0, 0
"Ilon Tandro",0,5, 1128,148,349,0,0,0,569,99,198,0,0,0,1459,153,350,0,0,0,501,261,470,9,332,1077,0,349,0,999,94,867,262,0,199,705,415,648,210,503,1128,0,740,0,1056,337,942,677,0,535,14,734,"Communicator, Inspiring, Desperate, Tactician, Diplomat, Interrogator, Civilian, Klaestron","nonhuman, male, organic, ds9, ilon, crew_max_rarity_5","This Is Not At All Relevant.",0, 8, 6, 10, 12, 5, 0, , , , 550, 325, 235, 675, false,"Ilon",crew_portraits_cm_ilon_tandro_sm.png,ilon_tandro_crew, 96.8343, 43.3333, 80.8058, 90.7406, 3, 0, 0, 20.3471
