"Lt. Commander Icheb",0,5, 0,0,0,1272,207,433,471,101,151,980,141,310,0,0,0,0,0,0,310,1183,573,0,0,68,22,395,169,178,1311,934,621,279,0,377,1149,675,0,0,122,38,437,211,259,1292,919,717,361,0,528,503,"Civilian, Brunali, Borg, Astrophysicist, Prodigy, Innovator, Federation, Starfleet","male, nonhuman, organic, voy, icheb, crew_max_rarity_5","I Never Told",1, 10, 6, 10, 10, , , , , , 500, 150, 138, 415, false,"Icheb",crew_portraits_cm_icheb_lt_commander_sm.png,icheb_lt_commander_crew
"Tau",0,4, 0,0,0,342,72,156,894,130,308,0,0,0,651,109,220,0,0,0,1323,833,0,1076,0,327,1011,612,842,649,232,525,925,0,771,1227,851,0,1112,0,299,904,579,738,686,334,598,968,0,819,1075,1179,"Crafty, Saboteur, Criminal, Scoundrel, Resourceful","male, organic, nonhuman, voy, tau, crew_max_rarity_4","I'd Hate to Make Your Life Difficult",0, 6, 8, 10, 10, 4, 1, , , , 315, 200, 90, 300, false,"Tau",crew_portraits_cm_tau_sm.png,tau_crew
"Age of Sail Troi",0,4, 353,76,161,0,0,0,0,0,0,0,0,0,596,150,298,776,208,426,1292,1260,1222,747,188,0,0,950,425,0,1118,551,923,365,97,1195,1179,1148,511,66,0,0,810,220,0,952,239,733,132,52,1092,561,"Human, Betazoid, Costumed, Empath, Counselor, Starfleet, Federation","ageofsail, nonhuman, female, organic, tng, troi, crew_max_rarity_4","Answer Him!",0, 9, 8, 6, 10, , , , , , 400, 230, 115, 450, false,"Troi",crew_portraits_cm_troi_ageofsail_sm.png,troi_ageofsail_crew
"North Star T'Pol",0,5, 1281,187,412,972,120,248,0,0,0,0,0,0,524,99,196,0,0,0,36,511,280,192,170,669,504,256,386,0,1228,0,1053,0,880,82,588,368,256,281,849,613,404,508,0,1218,0,1052,0,894,489,688,"Vulcan, Starfleet, Astrophysicist, Telepath, Costumed","nonhuman, female, organic, ent, tpol, crew_max_rarity_5","I've Confirmed They Are Human",1, 9, 4, 8, 8, , , , , , 465, 100, 90, 470, false,"T'Pol",crew_portraits_cm_tpol_north_star_sm.png,tpol_north_star_crew
"Riker Odan",0,5, 510,88,190,1290,189,408,0,0,0,0,0,0,998,92,252,0,0,0,89,1138,1067,371,940,320,257,63,171,0,897,0,653,0,548,125,1104,1041,615,909,440,335,150,268,0,1130,0,944,0,800,492,781,"Human, Trill, Federation, Starfleet, Ambassador, Maverick, Gambler, Romantic","male, organic, tng, nonhuman, riker, crew_max_rarity_5","For the Greater Good",2, 10, 10, 8, 10, , , , , , 600, 115, 142, 350, false,"Riker",crew_portraits_cm_riker_odan_sm.png,riker_odan_crew
"Relaxed Number One",0,4, 339,52,129,673,73,166,0,0,0,0,0,0,914,136,356,0,0,0,597,1301,1279,540,1160,891,670,209,532,0,912,0,677,0,565,808,1285,1251,531,1132,1163,878,302,714,0,819,0,612,0,509,1088,1296,"Federation, Starfleet, Human, Resourceful, Explorer, Musician, Casual, Engineered, Playful, Illyrian","female, nonhuman, organic, dsc, number_one, crew_max_rarity_4","I Am The Very Model Of A Modern Major General",0, 8, 8, 8, 10, , , , , , 450, 175, 150, 450, false,"Number One",crew_portraits_cm_number_one_relaxed_sm.png,dsc_number_one_relaxed_crew
"Claymore Scotty",0,5, 0,0,0,0,0,0,1006,106,234,1307,195,387,516,72,136,0,0,0,0,761,283,1259,0,629,258,1161,0,37,292,462,85,103,973,0,993,428,1340,0,903,347,1251,0,107,715,754,175,193,1064,511,897,"Human, Starfleet, Federation, Jury Rigger, Duelist","male, organic, tos, scott, crew_max_rarity_5","This is War",0, 9, 8, 6, 8, , , , , , 375, 270, 275, 450, false,"Scotty",crew_portraits_cm_scotty_claymore_sm.png,scott_claymore_crew
"1701 Bashir",0,4, 0,0,0,364,57,135,595,123,240,0,0,0,0,0,0,814,174,316,1312,1000,0,0,574,541,1005,1307,208,829,1135,59,0,376,633,1314,959,0,0,473,489,998,1291,186,794,1087,98,0,282,517,1163,1070,"Human, Starfleet, Federation, Undercover Operative, Cyberneticist, Physician, Engineered, Tribbled, Displaced","nonhuman, male, organic, ds9, bashir, june2024, crew_max_rarity_4","I'm a Doctor, Not a Historian",2, 8, 8, 6, 10, , , , , , 400, 100, 160, 475, false,"Bashir",crew_portraits_cm_bashir_1701_sm.png,bashir_1701_crew
"Seamus",0,4, 0,0,0,0,0,0,872,171,395,0,0,0,579,148,299,0,0,0,0,794,0,1086,0,663,0,961,0,606,224,493,935,0,776,0,636,0,925,0,475,0,811,0,453,141,344,734,0,626,1368,1145,"Human, Hologram, Civilian, Romantic, Interrogator, Playful, Festive","nonhuman, voy, male, seamus, artificial_life, crew_max_rarity_4","Saints Preserve Us",1, 7, 6, 6, 6, , , , 0, 2, 315, 165, 147, 450, false,"Seamus",crew_portraits_cm_seamus_sm.png,seamus_crew
"Mirror Keyla Detmer",0,5, 1029,154,348,0,0,0,1308,222,451,0,0,0,0,0,0,0,0,0,541,42,472,750,351,219,0,0,0,234,435,131,0,0,0,612,87,534,781,432,285,0,0,0,292,456,188,0,0,0,785,830,"Mirror Universe, Human, Terran Empire, Brutal, Pilot","female, organic, dsc, detmer, crew_max_rarity_5","Terran Law Is Binding",0, 8, 8, 6, 12, 1, 0, 2, , , 400, 240, 105, 525, false,"Detmer",crew_portraits_cm_detmer_mirror_sm.png,dsc_detmer_mirror_crew
"Tee Time Doctor",0,4, 0,0,0,0,0,0,344,74,158,0,0,0,920,186,387,658,67,176,0,1272,0,824,764,1308,0,677,539,1144,428,364,603,511,82,0,1195,0,712,1011,1176,0,544,709,1057,308,496,479,712,147,1030,1057,"Hologram, Federation, Musician, Starfleet, Costumed, Athlete, Physician, Human, Casual, Playful","nonhuman, male, artificial_life, voy, emh, crew_max_rarity_4","The Back Nine at Gedi Prime?",2, 9, 6, 10, 10, , , , , , 500, 200, 40, 305, false,"Doctor",crew_portraits_cm_emh_caddy_sm.png,emh_caddy_crew
"Logician Solok",0,4, 903,88,202,646,87,180,0,0,0,0,0,0,0,0,0,0,0,0,182,877,715,950,579,907,684,965,542,0,0,0,0,0,0,516,1088,1012,1176,884,1083,793,1129,653,0,0,0,0,0,0,1419,1533,"Vulcan, Starfleet, Athlete, Costumed, Federation, Telepath, Casual, Playful","male, nonhuman, organic, ds9, solok, crew_max_rarity_4","I Fail to See Why You Are Celebrating",1, 9, 10, 10, 10, , , , , , 430, 215, 77, 440, false,"Solok",crew_portraits_cm_solok_logician_sm.png,solok_logician_crew
"Riva",0,4, 0,0,0,687,59,134,0,0,0,0,0,0,954,73,198,0,0,0,950,0,0,925,0,900,676,236,537,0,962,0,748,0,609,1312,0,0,1203,0,1295,997,759,826,0,1253,0,1090,0,927,1405,1573,"Ramatis III Native, Diplomat, Linguist, Telepath, Cultural Figure, Royalty, Communicator, Romantic","male, organic, nonhuman, tng, riva, crew_max_rarity_4","Be At Ease",1, 7, 8, 10, 10, , , , , , 475, 180, 220, 470, false,"Riva",crew_portraits_cm_riva_sm.png,riva_crew
"Niners Ezri",0,5, 0,0,0,0,0,0,1294,249,477,0,0,0,954,162,314,566,65,168,0,437,0,839,860,206,0,698,609,226,31,16,623,588,106,0,425,0,836,1036,231,0,719,728,236,56,54,635,730,217,297,304,"Federation, Starfleet, Athlete, Resourceful, Trill, Counselor, Costumed, Casual, Playful","nonhuman, female, organic, ds9, dax, niners, crew_max_rarity_5","Fancy Dan",0, 9, 6, 8, 10, , , , , , 375, 210, 120, 475, false,"E. Dax",crew_portraits_cm_ezri_niners_sm.png,ezri_niners_crew
"Android Kirk",0,4, 345,64,148,545,135,342,875,156,352,0,0,0,0,0,0,0,0,0,595,500,1254,1394,1141,117,688,967,545,631,924,516,0,0,0,291,429,1205,1329,1080,81,439,726,378,537,773,427,0,0,0,1101,811,"Android, Undercover Operative, Explorer, Starfleet, Federation","male, nonhuman, artificial_life, tos, kirk, crew_max_rarity_4","It is Illogical",2, 9, 6, 8, 10, , , , 1, 2, 200, 200, 187, 450, false,"Kirk",crew_portraits_cm_kirk_android_sm.png,kirk_android_crew
"EV Suit Nhan",0,5, 548,62,98,0,0,0,1344,150,303,1054,109,210,0,0,0,0,0,0,1158,198,160,1245,971,308,445,0,0,34,507,194,604,272,0,1348,556,577,1398,1158,695,686,0,0,205,911,549,991,552,0,460,1264,"Barzan, Starfleet, Federation, Brutal","evsuit, nonhuman, organic, female, dsc, nhan, crew_max_rarity_5","Stand Down",0, 9, 6, 5, 8, , , , , , 500, 150, 95, 450, false,"Nhan",crew_portraits_cm_nhan_evsuit_sm.png,dsc_nhan_evsuit_crew
"Picard at El-Adrel",0,3, 0,0,0,0,0,0,215,38,100,0,0,0,571,71,167,335,62,178,0,1343,0,1166,1134,1396,0,1046,841,1218,1044,761,1020,793,574,0,1320,0,1279,1026,1363,0,1191,715,1189,1073,686,1175,718,533,1503,1512,"Federation, Starfleet, Human, Survivalist, Communicator, Diplomat, Cultural Figure","male, organic, tng, picard, crew_max_rarity_3","Darmok And Jalad On The Ocean",0, 4, 8, 8, 10, 6, 2, , , , 240, 100, 75, 165, false,"Picard",crew_portraits_cm_picard_stranded_sm.png,picard_stranded_crew
"Medic Jett Reno",0,5, 0,0,0,489,71,174,0,0,0,1050,138,312,0,0,0,1231,220,490,1188,0,495,0,165,1159,138,1183,51,485,0,203,531,4,257,1185,0,676,0,161,1146,221,1180,60,665,0,170,718,7,220,402,371,"Starfleet, Federation, Human, Jury Rigger, Resourceful, Veteran, Survivalist, Desperate, Playful","female, organic, dsc, jett_reno, crew_max_rarity_5","Body's Just A Machine...",0, 7, 6, 10, 12, 3, 0, 3, , , 595, 225, 110, 215, false,"Reno",crew_portraits_cm_reno_medic_sm.png,dsc_jett_reno_medic_crew
"Soji Asha",0,5, 0,0,0,498,82,182,0,0,0,0,0,0,1022,136,294,1297,192,423,1162,0,0,793,145,1139,871,243,48,0,783,180,552,84,19,1125,0,0,949,269,1094,800,358,92,0,992,272,773,148,68,378,605,"Android, Counselor, Xenoanthropology, Romantic, Human, Civilian","artificial_life, nonhuman, pic, female, soji, crew_max_rarity_5","Everyone Has Secrets",1, 9, 8, 6, 8, 4, 0, , , , 265, 220, 105, 475, false,"Soji",crew_portraits_cm_soji_asha_sm.png,soji_asha_crew_crew
"Elnor",0,5, 1054,72,186,0,0,0,1330,158,384,0,0,0,0,0,0,0,0,0,650,73,580,843,458,281,0,0,0,283,470,165,0,0,0,1126,353,1087,1228,958,514,0,0,0,493,724,376,0,0,0,805,1389,"Romulan, Duelist, Qowat Milat, Survivalist, Spiritual","nonhuman, organic, male, pic, elnor, crew_max_rarity_5","I Regret Your Choice",0, 10, 8, 6, 10, , , , , , 565, 250, 135, 400, false,"Elnor",crew_portraits_cm_elnor_sm.png,elnor_crew
"Human Airiam",0,3, 343,49,122,505,46,137,0,0,0,0,0,0,157,40,85,0,0,0,801,1302,1280,1217,1161,1172,904,951,738,0,1486,0,1401,0,1204,927,1291,1262,1164,1145,1312,1012,1059,841,0,1466,0,1363,0,1168,1541,1564,"Federation, Starfleet, Casual, Human","female, organic, dsc, airiam, crew_max_rarity_3","We're Coming Home",2, 5, 6, 8, 8, , , , , , 325, 160, 130, 400, false,"Airiam",crew_portraits_cm_airiam_human_sm.png,airiam_human_crew
"Raffi Musiker",0,4, 617,69,173,360,54,144,0,0,0,0,0,0,905,137,299,0,0,0,635,1038,930,348,808,1318,1006,406,836,0,935,0,720,0,589,776,1163,1132,521,1000,1287,988,441,819,0,981,0,761,0,652,1147,1324,"Human, Civilian, Federation, Desperate, Communicator, Gambler, Veteran","female, organic, pic, raffi, crew_max_rarity_4","You've Got Some Nerve!",0, 8, 8, 5, 10, 1, 0, , , , 350, 145, 193, 500, false,"Raffi",crew_portraits_cm_raffi_musiker_sm.png,raffi_musiker_crew
"Narek",0,5, 987,139,305,0,0,0,531,44,112,0,0,0,1289,212,425,0,0,0,612,336,548,77,428,1150,0,377,0,1034,140,917,292,0,244,753,589,677,121,578,1344,0,435,0,1175,316,1077,349,0,286,443,729,"Romulan, Undercover Operative, Crafty, Resourceful, Investigator, Scoundrel","nonhuman, organic, male, pic, narek, crew_max_rarity_5","Everyone Is Hiding Something",2, 7, 8, 8, 12, 7, 2, , , , 465, 250, 153, 325, false,"Narek",crew_portraits_cm_narek_sm.png,narek_crew
"Admiral Kirsten Clancy",0,5, 1092,321,706,0,0,0,917,172,374,0,0,0,466,32,53,0,0,0,301,82,267,240,156,605,0,1241,0,556,361,438,1236,0,1055,60,16,43,94,30,508,0,1399,0,488,526,371,1399,0,1200,616,135,"Human, Federation, Starfleet, Brutal, Investigator","female, organic, pic, clancy, crew_max_rarity_5","The Hubris",2, 8, 4, 4, 12, 7, 0, , , , 200, 175, 80, 300, false,"Admiral Clancy",crew_portraits_cm_clancy_admiral_sm.png,clancy_admiral_crew
"Vahar'ai Saru",0,5, 0,0,0,476,66,156,0,0,0,0,0,0,1280,234,464,932,130,404,1205,0,0,517,447,1185,910,135,101,0,464,439,265,274,21,1245,0,0,500,391,1203,916,155,139,0,428,401,277,240,28,484,286,"Kelpien, Federation, Starfleet, Exobiology, Linguist, Desperate","male, nonhuman, organic, dsc, saru, crew_max_rarity_5","The Light, It Is Almost Like Music",0, 10, 10, 8, 12, , , , , , 500, 150, 180, 375, false,"Saru",crew_portraits_cm_saru_vaharai_sm.png,dsc_saru_vaharai_crew
"Fenris Ranger Seven",0,4, 649,74,189,0,0,0,906,140,322,0,0,0,337,43,91,0,0,0,953,283,885,846,768,679,0,1349,0,619,547,507,1345,0,1154,1109,422,1067,990,941,662,0,1356,0,605,638,515,1348,0,1159,1131,1331,"Human, Borg, Civilian, Federation, Maverick, Brutal, Marksman, Pilot, Vengeful","nonhuman, female, organic, pic, seven, crew_max_rarity_4","I Didn't Want to Disillusion Him",2, 6, 8, 6, 12, 7, 0, , , , 430, 210, 62, 390, false,"Seven",crew_portraits_cm_seven_fenris_sm.png,seven_fenris_crew
"Dr. Agnes Jurati",0,4, 0,0,0,606,129,277,0,0,0,358,63,184,0,0,0,825,143,311,929,0,1214,0,578,880,404,959,87,1133,0,580,1268,121,638,839,0,1127,0,579,784,261,887,96,1022,0,574,1152,89,614,1134,952,"Physician, Starfleet, Federation, Human, Innovator, Undercover Operative, Cyberneticist","female, organic, pic, jurati, crew_max_rarity_4","Not a Conversation Killer at All",1, 8, 6, 6, 12, , , , 2, 2, 410, 100, 118, 315, false,"Jurati",crew_portraits_cm_jurati_doctor_sm.png,jurati_doctor_crew
"Executive Director Hugh",0,5, 978,42,113,1203,257,658,0,0,0,645,54,142,0,0,0,0,0,0,39,871,168,947,572,239,54,339,130,879,0,0,980,544,0,51,1308,864,1408,1168,108,34,157,74,1136,0,0,1273,797,0,423,701,"Civilian, Federation, Cyberneticist, Caregiver, Borg, Cultural Figure","nonhuman, male, organic, pic, hugh, crew_max_rarity_5","Hopeful Fool",1, 7, 6, 8, 10, 3, 0, 2, , , 165, 50, 100, 425, false,"Hugh",crew_portraits_cm_hugh_executive_sm.png,hugh_director_crew
"EV Suit Tuvok",0,3, 357,55,160,225,22,105,524,85,183,0,0,0,0,0,0,0,0,0,981,830,1232,1377,1119,803,1077,1387,887,971,1239,852,0,0,0,950,738,1201,1324,1075,799,1069,1368,882,974,1255,886,0,0,0,1504,1513,"Vulcan, Federation, Starfleet, Telepath, Tactician, Hunter, Marksman","nonhuman, male, organic, evsuit, voy, tuvok, crew_max_rarity_3","You Missed!",2, 3, 6, 8, 8, 1, 0, , , , 365, 100, 170, 375, false,"Tuvok",crew_portraits_cm_tuvok_ev_suit_sm.png,tuvok_ev_suit_crew
"Cristbal Rios",0,4, 840,118,271,0,0,0,330,111,211,0,0,0,567,129,255,0,0,0,799,550,724,400,587,1268,0,981,0,1111,772,1008,960,0,795,852,434,779,401,671,945,0,915,0,873,400,786,855,0,730,1178,950,"Human, Pilot, Survivalist, Resourceful, Casual, Federation, Civilian, Scoundrel","male, organic, pic, rios, crew_max_rarity_4","If You Say So",1, 8, 4, 5, 8, , , , , , 400, 145, 137, 250, false,"Rios",crew_portraits_cm_rios_cristobal_sm.png,rios_cristobal_crew
"Commodore Oh",0,5, 1028,86,195,516,72,157,1331,207,332,0,0,0,0,0,0,0,0,0,187,85,609,862,483,57,867,1147,704,287,472,168,0,0,0,602,333,1035,1191,904,199,899,1208,735,497,728,381,0,0,0,463,1042,"Vulcan, Romulan, Starfleet, Federation, Undercover Operative, Zhat Vash, Tal Shiar, Telepath, Vengeful","female, nonhuman, organic, pic, oh, crew_max_rarity_5","Let Me Show You What Will Happen",0, 10, 8, 6, 8, , , , , , 475, 200, 210, 390, false,"Oh",crew_portraits_cm_oh_commodore_sm.png,oh_commodore_crew
"Displaced Gabrielle Burnham",0,5, 0,0,0,1033,190,335,0,0,0,1316,202,440,0,0,0,0,0,0,527,0,251,0,0,510,10,596,299,292,0,0,278,77,0,578,0,303,0,0,550,21,634,323,336,0,0,344,116,0,787,857,"Jury Rigger, Survivalist, Astrophysicist, Human, Section 31, Undercover Operative, Federation, Desperate, Caregiver, Displaced","female, organic, dsc, gburnham, crew_max_rarity_5","I Was There",1, 6, 8, 10, 12, 2, 0, , , , 500, 110, 230, 350, false,"Burnham",crew_portraits_cm_gburnham_displaced_sm.png,dsc_gburnham_displaced_crew
"Dereth",0,5, 0,0,0,512,73,183,962,121,259,0,0,0,0,0,0,1247,210,527,1135,792,0,0,140,138,843,1127,43,603,900,9,0,78,227,1151,932,0,0,141,351,835,1155,56,774,1064,19,0,72,196,469,428,"Vidiian, Survivalist, Brutal, Physician, Thief, Geneticist, Desperate","male, nonhuman, organic, voy, dereth, crew_max_rarity_5","Your Surgical Knowledge is Inferior",0, 6, 10, 8, 12, 2, 0, , , , 515, 135, 105, 450, false,"Dereth",crew_portraits_cm_dereth_sm.png,dereth_crew
"Delta Flyer Kim",0,4, 861,147,295,0,0,0,392,66,132,618,109,277,0,0,0,0,0,0,768,516,148,931,562,1259,666,0,0,466,1370,1007,934,498,0,755,513,125,923,581,1277,588,0,0,425,1403,1035,853,452,0,1089,1098,"Federation, Human, Starfleet, Musician, Romantic, Pilot","male, organic, voy, kim, crew_max_rarity_4","Timing is Everything",1, 7, 6, 8, 8, , , , , , 550, 160, 184, 400, false,"Kim",crew_portraits_cm_kim_delta_flyer_sm.png,kim_delta_flyer_crew
"Bridal Keiko",0,5, 0,0,0,1035,77,148,0,0,0,0,0,0,1279,223,444,0,0,0,706,0,0,527,0,673,507,59,390,0,487,0,286,0,235,1236,0,0,541,0,1189,908,167,743,0,473,0,306,0,252,821,1314,"Human, Federation, Starfleet, Romantic, Botanist, Festive","female, organic, ds9, keiko, crew_max_rarity_5","I Do!",1, 7, 8, 6, 10, 1, 0, 2, , , 500, 150, 254, 265, false,"Keiko",crew_portraits_cm_keiko_bride_sm.png,keiko_bride_crew
"Sinister Picard",0,5, 1030,152,317,0,0,0,1281,298,601,0,0,0,467,64,151,0,0,0,561,24,487,360,367,153,0,1224,0,194,116,67,1213,0,1031,680,41,590,510,495,113,0,1238,0,118,82,74,1235,0,1053,262,171,"Human, Brutal, Undercover Operative, Civilian, Costumed, Scoundrel, Federation","male, organic, pic, picard, crew_max_rarity_5","Appropriately Sinister",2, 8, 6, 8, 8, 7, 1, , , , 400, 235, 232, 375, false,"Picard",crew_portraits_cm_picard_sinister_sm.png,picard_sinister_crew
"Vagrant Braxton",0,4, 668,74,188,884,107,286,0,0,0,0,0,0,0,0,0,0,0,0,164,981,870,1083,742,749,556,810,431,0,0,0,0,0,0,338,1121,1071,1216,944,810,584,907,483,0,0,0,0,0,0,1402,1488,"Human, Desperate, Starfleet, Federation, Temporal Agent, Survivalist, Displaced","male, organic, voy, braxton, crew_max_rarity_4","TRAITORS!",1, 5, 8, 8, 14, 4, 0, , , , 300, 120, 178, 575, false,"Braxton",crew_portraits_cm_braxton_vagrant_sm.png,braxton_vagrant_crew
"Determined Paris",0,5, 497,86,266,0,0,0,1319,190,421,0,0,0,991,145,308,0,0,0,1077,183,1033,333,897,249,0,652,0,253,33,145,580,0,489,923,203,852,353,736,383,0,788,0,373,102,261,710,0,603,317,322,"Romantic, Human, Costumed, Federation, Starfleet, Diplomat, Maverick, Duelist, Klingon, Pilot","male, organic, voy, paris, crew_max_rarity_5","I Can't Lose",0, 9, 6, 5, 8, , , , , , 700, 280, 172, 390, false,"Paris",crew_portraits_cm_paris_determined_sm.png,paris_determined_crew
"Archer and Porthos",0,5, 997,137,332,0,0,0,509,69,143,0,0,0,1289,196,407,0,0,0,586,312,523,74,400,1144,0,393,0,1030,145,913,309,0,254,681,464,591,131,496,1231,0,492,0,1101,289,1002,416,0,344,427,640,"Human, Starfleet, Casual, Pilot, Inspiring, Playful","male, organic, ent, archer, crew_max_rarity_5","What Do You Think, Porthos?",1, 9, 10, 8, 10, , , , , , 400, 130, 170, 500, false,"Archer",crew_portraits_cm_archer_risa_sm.png,archer_risa_crew
"Kay Eaton",0,5, 456,91,181,1282,203,388,0,0,0,0,0,0,985,151,331,0,0,0,100,1189,1139,377,1016,331,265,50,178,0,800,0,566,0,479,132,1111,1049,421,919,452,345,71,277,0,835,0,627,0,525,514,488,"Human, Civilian, Writer, Communicator, Resourceful","female, organic, ds9, kira, crew_max_rarity_5","She's A Tough Cookie",1, 7, 10, 8, 12, 7, 1, , , , 375, 175, 152, 565, false,"Kira",crew_portraits_cm_kira_eaton_sm.png,kira_eaton_crew
"Grebnedlog",0,4, 0,0,0,0,0,0,673,51,159,188,6,12,925,91,210,0,0,0,0,993,1356,934,0,896,1090,812,0,733,263,711,522,864,619,0,1236,1362,1155,0,1236,1096,1073,0,1065,771,1007,992,870,873,1328,1546,"Criminal, Thief, Villain, Civilian, Pakled","nonhuman, male, organic, tng, grebnedlog, crew_max_rarity_4","We Are Smart",0, 9, 6, 6, 8, , , , 1, 2, 475, 140, 108, 450, false,"Grebnedlog",crew_portraits_cm_grebnedlog_sm.png,grebnedlog_crew
"Age of Sail Picard",0,5, 987,155,304,515,79,177,0,0,0,0,0,0,1291,216,415,0,0,0,173,712,538,73,415,1109,838,127,678,0,493,0,293,0,245,256,781,613,110,518,1113,836,169,679,0,536,0,362,0,295,391,466,"Human, Astrophysicist, Inspiring, Tactician, Federation, Costumed, Starfleet","male, ageofsail, organic, tng, picard, crew_max_rarity_5","Extend The Plank!",2, 9, 10, 8, 12, 4, 0, , , , 525, 150, 170, 500, false,"Picard",crew_portraits_cm_picard_age_of_sail_sm.png,picard_age_of_sail_crew
"Linnis Paris",0,5, 0,0,0,974,116,295,0,0,0,0,0,0,0,0,0,1219,194,545,669,0,0,0,164,653,476,715,21,0,0,199,0,97,255,830,0,0,0,134,777,565,882,27,0,0,154,0,70,195,818,880,"Human, Ocampa, Physician, Federation, Starfleet, Romantic, Caregiver, Telepath","female, organic, voy, linnis_paris, crew_max_rarity_5","Do You Remember Anything At All?",1, 7, 8, 8, 14, 3, 0, , , , 550, 100, 190, 150, false,"Linnis",crew_portraits_cm_linnis_sm.png,linnis_paris_crew
"Lt. JG Martinez",0,4, 0,0,0,620,110,271,0,0,0,0,0,0,0,0,0,785,175,344,927,0,0,0,584,875,660,957,90,0,0,588,0,384,646,878,0,0,0,413,823,594,925,83,0,0,421,0,251,469,1415,1312,"Physician, Federation, Starfleet, Human","male, organic, tng, martinez, crew_max_rarity_4","Yes, Doctor!",1, 7, 10, 10, 12, 5, 0, , , , 425, 125, 205, 475, false,"Martinez",crew_portraits_cm_martinez_ltjg_sm.png,martinez_ltjg_crew
"Suspiria",0,5, 1289,141,346,0,0,0,989,151,310,0,0,0,477,99,231,0,0,0,357,97,318,220,214,551,0,1125,0,510,260,377,1110,0,935,638,214,562,342,457,666,0,1012,0,609,317,519,962,0,815,488,648,"Nacene, Desperate, Brutal, Telepath, Cultural Figure, Telekinetic, Caregiver","female, nonhuman, organic, voy, suspiria, crew_max_rarity_5","What Small, Frail Creatures You Are",2, 8, 8, 8, 12, 8, 4, , , , 610, 245, 60, 225, false,"Suspiria",crew_portraits_cm_suspiria_sm.png,suspiria_crew
"Grandmother Kes",0,4, 0,0,0,0,0,0,0,0,0,620,65,150,839,177,385,278,77,207,0,0,952,910,1170,0,718,779,858,892,939,1075,174,326,310,0,0,1206,725,910,0,932,565,631,1096,701,870,187,269,138,1206,1034,"Ocampa, Desperate, Civilian, Botanist, Prodigy, Telepath, Displaced, Telekinetic, Physician","nonhuman, female, organic, voy, kes, crew_max_rarity_4","I'm Cold",0, 8, 8, 6, 8, , , , , , 600, 175, 133, 415, false,"Kes",crew_portraits_cm_kes_grandmother_sm.png,kes_grandmother_crew
"Activated Dahj",0,5, 543,93,207,939,148,412,1334,174,365,0,0,0,0,0,0,0,0,0,154,182,986,1160,850,22,437,657,337,279,467,164,0,0,0,137,312,984,1147,860,40,367,577,293,498,729,382,0,0,0,319,364,"Human, Desperate, Botanist, Brutal, Civilian, Android","female, nonhuman, artificial_life, pic, dahj, crew_max_rarity_5","Am I Real?",2, 6, 10, 4, 12, 1, 1, , , , 250, 205, 105, 525, false,"Dahj",crew_portraits_cm_dahj_activated_sm.png,dahj_activated_crew
"Mirror Chekov",0,4, 612,129,331,0,0,0,880,184,496,0,0,0,0,0,0,0,0,0,894,230,816,1038,686,559,0,0,0,519,796,383,0,0,0,705,105,614,860,519,273,0,0,0,283,451,182,0,0,0,1325,873,"Mirror Universe, Starfleet, Terran Empire, Human, Brutal","male, organic, tos, chekov, crew_max_rarity_4","So You Die, Captain",0, 8, 6, 6, 8, , , , , , 450, 225, 127, 300, false,"Chekov",crew_portraits_cm_chekov_mirror_sm.png,chekov_mirror_crew
"Nepenthe Riker",0,3, 190,60,113,384,41,107,0,0,0,0,0,0,518,61,183,0,0,0,1001,1347,1341,993,1219,1319,1007,797,837,0,1269,0,1111,0,936,988,1290,1260,967,1143,1355,1047,908,867,0,1311,0,1155,0,986,1514,1531,"Human, Chef, Romantic, Caregiver, Gambler, Civilian, Federation, Maverick, Starfleet","male, organic, pic, riker, crew_max_rarity_3","Cancel Red Alert!",1, 4, 12, 6, 10, 2, 0, , , , 384, 180, 130, 500, false,"Riker",crew_portraits_cm_riker_nepenthe_sm.png,riker_nepenthe_crew
"Doctor Van Gogh",0,5, 0,0,0,971,82,199,0,0,0,1309,219,448,0,0,0,596,47,109,743,0,245,0,878,715,27,782,99,282,0,828,270,11,863,1084,0,277,0,1171,1055,78,1113,455,304,0,1079,307,44,1140,480,953,"Federation, Starfleet, Hologram, Physician, Innovator, Musician, Resourceful, Human","nonhuman, male, artificial_life, voy, emh, crew_max_rarity_5","It's Highly Experimental",1, 7, 8, 8, 8, 6, 0, , , , 450, 125, 75, 425, false,"Doctor",crew_portraits_cm_emh_gogh_sm.png,emh_gogh_crew
"Kestra Troi-Riker",0,4, 0,0,0,0,0,0,906,155,311,0,0,0,640,131,244,0,0,0,0,810,0,1059,0,676,0,942,0,618,215,504,914,0,759,0,776,0,1028,0,654,0,929,0,599,263,508,871,0,742,1363,1352,"Human, Betazoid, Costumed, Civilian, Linguist","female, nonhuman, organic, pic, kestra, crew_max_rarity_4","My Arrows Are Real",2, 9, 8, 6, 10, , , , , , 355, 250, 177, 425, false,"Kestra",crew_portraits_cm_kestra_wild_sm.png,kestra_wild_crew
"Homesteader Janeway",0,5, 0,0,0,1283,183,431,0,0,0,0,0,0,454,88,169,1038,112,299,312,0,0,1288,381,319,256,149,13,0,1328,360,1205,233,118,427,0,0,1242,652,397,301,183,48,0,1284,642,1132,429,257,478,675,"Starfleet, Federation, Human, Resourceful, Survivalist, Exobiology, Gardener","female, organic, voy, janeway, crew_max_rarity_5","We Have Plenty Of Time",1, 10, 8, 8, 10, , , , , , 350, 250, 185, 375, false,"Janeway",crew_portraits_cm_janeway_homesteader_sm.png,janeway_homesteader_crew
"Krenim Guest Chakotay",0,5, 498,95,241,1281,194,460,0,0,0,0,0,0,1003,120,291,0,0,0,87,1119,1045,341,912,297,244,46,164,0,824,0,590,0,498,72,997,896,432,778,324,263,79,198,0,1023,0,819,0,700,374,366,"Human, Maquis, Federation, Starfleet, Diplomat, Prisoner, Displaced","male, organic, voy, chakotay, crew_max_rarity_5","I Have A Lot To Learn",1, 7, 8, 6, 10, 7, 1, , , , 525, 200, 113, 475, false,"Chakotay",crew_portraits_cm_chakotay_krenim_guest_sm.png,chakotay_krenim_guest_crew
"Karyn Archer",0,4, 419,51,160,604,77,198,0,0,0,0,0,0,872,130,286,0,0,0,562,1212,1159,532,1038,952,706,258,561,0,974,0,760,0,617,653,1234,1208,607,1083,1064,779,364,642,0,1014,0,802,0,688,1119,1305,"Ikaaran, Human, Desperate, Survivalist","female, organic, ent, karyn, crew_max_rarity_4","Direct Hit",2, 7, 10, 8, 12, 1, 2, , , , 455, 75, 70, 325, false,"Karyn",crew_portraits_cm_karyn_archer_sm.png,karyn_archer_crew
"1701 O'Brien",0,5, 0,0,0,0,0,0,1289,188,418,1055,83,184,0,0,0,0,0,0,0,485,603,0,0,292,474,0,0,35,484,178,646,294,0,0,578,1068,0,0,392,787,0,0,134,590,273,1099,651,0,813,1326,"Human, Federation, Starfleet, Tribbled, Veteran, Undercover Operative, Duelist, Jury Rigger, Displaced","male, organic, obrien, ds9, crew_max_rarity_5","Don't Take It Personally",0, 8, 10, 6, 10, 7, 4, , , , 350, 225, 90, 275, false,"O'Brien",crew_portraits_cm_obrien_1701_sm.png,obrien_1701_crew
"Tanis",0,4, 0,0,0,0,0,0,372,63,109,0,0,0,660,94,213,903,56,177,0,1273,0,1077,591,1309,0,953,449,1145,747,245,926,393,114,0,1292,0,1141,1037,1323,0,1060,729,1157,837,647,1020,731,446,1159,1457,"Brutal, Ocampa, Telepath, Diplomat, Civilian","nonhuman, male, organic, voy, tanis, crew_max_rarity_4","Give Life, Kill, It Is All The Same",1, 9, 6, 10, 12, 3, 0, 2, , , 455, 200, 138, 315, false,"Tanis",crew_portraits_cm_tanis_sm.png,tanis_crew
