"Dr. Katherine Pulaski",10,5, 0,0,0,879,173,371,451,125,269,0,0,0,0,0,0,1301,108,350,588,968,0,0,190,109,395,627,27,832,1064,28,0,107,284,467,770,0,0,498,80,316,506,50,605,871,82,0,289,500,495,340,"Federation, Starfleet, Human, Physician, Caregiver","female, organic, ds9, pulaski, crew_max_rarity_5","Why Won't You Tell Me?",0, 6, 10, 6, 14, 7, 0, , , , 290, 100, 75, 375, false,"Pulaski",crew_portraits_cm_pulaski_katherine_sm.png,pulaski_katherine_crew
"Vosk",7,4, 806,215,462,0,0,0,324,119,237,679,38,123,0,0,0,0,0,0,592,362,97,745,439,1074,567,0,0,373,1160,870,810,446,0,243,137,91,427,157,732,841,0,0,431,922,622,1114,673,0,854,625,"Villain, Tactician, Temporal Agent, Na'kuhl, Brutal","nonhuman, male, organic, ent, vosk, crew_max_rarity_4","History Will Belong To Us",2, 6, 12, 10, 14, 4, 0, , , , 475, 100, 95, 400, false,"Vosk",crew_portraits_cm_vosk_sm.png,vosk_crew
"Mirror Ellen Landry",9,5, 969,132,281,0,0,0,1206,214,501,0,0,0,0,0,0,0,0,0,556,85,478,716,398,268,0,0,0,241,455,160,0,0,0,677,101,593,809,543,203,0,0,0,195,328,141,0,0,0,675,722,"Human, Terran Empire, Starfleet, Mirror Universe, Tactician, Brutal, Villain","female, organic, dsc, landry, crew_max_rarity_5","We Can Kill Him Now",2, 10, 8, 8, 10, , , 2, , , 315, 130, 124, 250, false,"Landry",crew_portraits_cm_landry_mirror_sm.png,dsc_landry_mirror_crew
"Human Torres",10,5, 0,0,0,0,0,0,0,0,0,992,107,262,1270,182,357,0,0,0,0,0,527,478,0,0,403,346,0,483,446,0,31,248,240,0,0,696,639,0,0,486,507,0,653,622,0,74,392,384,683,1085,"Jury Rigger, Human, Federation, Starfleet, Maquis, Prisoner, Cyberneticist","female, organic, voy, torres, crew_max_rarity_5","Brute Force Isn't Going To Do It",2, 10, 12, 10, 10, , , , , , 350, 200, 100, 150, false,"Torres",crew_portraits_cm_torres_human_sm.png,torres_human_crew
"Captain Harry Kim",9,5, 1224,203,416,0,0,0,443,129,273,972,113,285,0,0,0,0,0,0,286,170,19,493,166,944,405,0,0,122,1072,760,550,252,0,324,146,38,512,212,646,454,0,0,143,860,549,685,362,0,447,275,"Federation, Human, Starfleet, Explorer, Musician","male, organic, voy, kim, crew_max_rarity_5","It's The Journey",1, 8, 8, 10, 12, 5, 0, , , , 240, 50, 137, 350, false,"Kim",crew_portraits_cm_kim_captain_sm.png,kim_captain_crew
"Test Pilot Archer",8,4, 0,0,0,882,67,176,0,0,0,588,97,221,415,66,122,0,0,0,688,0,802,1119,0,653,138,371,388,734,1147,0,421,456,901,1025,0,812,1172,0,988,297,715,602,747,1203,0,467,463,937,979,1212,"Human, Starfleet, Pilot, Explorer, Inspiring","male, organic, ent, archer, crew_max_rarity_4","Luck Had Nothing To Do With It",1, 5, 6, 8, 6, , , , , , 415, 75, 100, 405, true,"Archer",crew_portraits_cm_archer_testpilot_sm.png,archer_testpilot_crew
"Evolved Janeway",8,5, 0,0,0,971,147,314,478,100,217,0,0,0,1250,209,416,0,0,0,521,984,0,460,0,102,344,38,283,846,117,772,240,0,223,627,890,0,536,0,159,383,53,353,740,155,690,288,0,276,313,326,"Starfleet, Federation, Primal, Desperate, Romantic, Human","nonhuman, female, organic, voy, janeway, exclusive_fusion, crew_max_rarity_5","The First Transwarp Flight",0, 8, 8, 8, 12, 4, 2, , , , 100, 100, 128, 300, false,"Janeway",crew_portraits_cm_janeway_evolved_sm.png,janeway_evolved_crew
"Usurper Lorca",9,5, 905,151,424,0,0,0,1199,254,511,0,0,0,381,47,91,0,0,0,529,74,453,409,372,245,0,1131,0,223,155,137,1102,0,962,400,42,324,391,275,162,0,1165,0,164,170,117,1140,0,991,541,214,"Terran Empire, Mirror Universe, Human, Brutal, Villain","male, organic, dsc, lorca, crew_max_rarity_5","Fate is Real",0, 8, 13, 10, 20, 8, 4, , , , 225, 280, 172, 175, false,"Lorca",crew_portraits_cm_lorca_mirror_sm.png,dsc_lorca_usurping_crew
"Evil Kirk",6,4, 631,100,231,0,0,0,848,156,338,0,0,0,0,0,0,0,0,0,798,249,724,922,647,608,0,0,0,539,796,447,0,0,0,816,281,757,933,688,498,0,0,0,458,670,385,0,0,0,1174,1133,"Human, Federation, Starfleet, Brutal, Villain, Survivalist","male, organic, tos, kirk, crew_max_rarity_4","I'm Captain Kirk!",0, 6, 10, 8, 12, 7, 0, , , , 400, 70, 150, 375, false,"Kirk",crew_portraits_cm_kirk_evil_sm.png,kirk_evil_crew
"UFP President Ra-ghoratreii",9,5, 1021,98,231,0,0,0,558,43,118,0,0,0,1256,181,356,0,0,0,537,281,461,82,380,952,0,364,0,839,127,766,272,0,256,822,619,766,259,698,1154,0,511,0,995,372,940,428,0,388,380,894,"Efrosian, Cultural Figure, Federation, Politician, Diplomat","nonhuman, male, organic, tos, federation_president, crew_max_rarity_5","This President Is Not Above The Law",2, 9, 12, 3, 12, 4, 1, , , , 410, 100, 70, 340, false,"Ra-ghoratreii",crew_portraits_cm_federation_president_sm.png,federation_president_crew
"Tourist Tucker",9,5, 0,0,0,0,0,0,0,0,0,1019,118,269,1230,203,410,0,0,0,0,0,479,484,0,0,368,358,0,436,457,0,27,212,249,0,0,666,558,0,0,466,391,0,630,500,0,54,373,291,677,968,"Human, Starfleet, Romantic, Resourceful, Casual","male, organic, ent, tucker, crew_max_rarity_5","Another Round Please!",2, 10, 8, 10, 10, , , , 1, 2, 410, 75, 85, 325, false,"Trip",crew_portraits_cm_tucker_tourist_sm.png,tucker_tourist_crew
"Natima Lang",9,5, 1006,81,225,0,0,0,479,91,228,0,0,0,1251,192,385,0,0,0,577,300,502,86,422,958,0,352,0,842,124,770,265,0,244,866,469,813,241,745,805,0,443,0,734,186,682,371,0,345,406,640,"Cardassian, Communicator, Romantic, Desperate, Cultural Figure, Inspiring","female, nonhuman, organic, ds9, natima, crew_max_rarity_5","We Take Our Politics Very Seriously",0, 9, 10, 10, 10, , , , 2, 2, 475, 100, 33, 475, false,"Natima",crew_portraits_cm_natima_sm.png,lang_natima_crew
"Thrax",9,5, 1012,156,311,0,0,0,1134,268,603,0,0,0,436,38,75,0,0,0,464,53,392,363,315,262,0,1082,0,236,147,153,1047,0,914,580,43,481,575,433,103,0,1187,0,102,127,75,1163,0,1006,463,236,"Cardassian, Constable, Veteran, Desperate, Investigator, Changeling, Interrogator","nonhuman, male, organic, ds9, thrax, crew_max_rarity_5","It's Out Of My Hands",0, 7, 10, 8, 12, 8, 4, , , , 585, 110, 203, 425, false,"Thrax",crew_portraits_cm_thrax_sm.png,thrax_crew
"Krenim Guest Paris",6,5, 1004,96,224,0,0,0,0,0,0,561,60,122,1212,217,440,0,0,0,570,649,112,84,414,0,677,355,0,840,456,0,57,529,248,838,863,438,183,709,0,815,338,0,979,429,0,101,657,239,398,700,"Prisoner, Human, Resourceful, Federation, Starfleet, Diplomat, Pilot, Displaced","male, organic, voy, paris, crew_max_rarity_5","Is This What You Call Enlightened?",0, 8, 6, 12, 14, 5, 0, , , , 350, 30, 93, 215, false,"Paris",crew_portraits_cm_paris_krenim_guest_sm.png,paris_krenim_guest_crew
"Prison Break Lorca",6,4, 783,179,395,0,0,0,499,188,383,0,0,0,0,0,0,0,0,0,656,264,574,796,489,759,0,0,0,682,948,599,0,0,0,401,89,325,580,276,384,0,0,0,349,568,277,0,0,0,1187,695,"Prisoner, Starfleet, Human, Brutal, Desperate, Tactician, Mirror Universe, Federation","male, organic, dsc, lorca, crew_max_rarity_4","Starfleet Didn't Start This War",1, 9, 6, 10, 15, , , 2, , , 200, 100, 175, 450, false,"Lorca",crew_portraits_cm_lorca_prisoner_sm.png,dsc_lorca_prisoner_crew
"Diversion Yates",9,5, 471,91,217,0,0,0,1052,70,172,0,0,0,1240,191,372,0,0,0,992,301,919,189,841,523,0,367,0,459,41,377,275,0,258,859,547,806,254,736,977,0,461,0,862,261,816,393,0,359,433,753,"Human, Federation, Pilot, Civilian, Costumed","female, organic, ds9, yates, crew_max_rarity_5","Let's See If You Can Beat That",1, 8, 8, 10, 12, 5, 0, , , , 390, 185, 150, 300, false,"Yates",crew_portraits_cm_yates_victim_sm.png,yates_diversion_crew
"Gladiator Spock",6,5, 0,0,0,1099,44,97,1276,189,388,0,0,0,505,84,168,0,0,0,555,431,0,1051,0,16,367,200,302,239,122,156,930,0,796,1182,529,0,1061,0,204,860,767,744,337,232,269,959,0,827,372,1002,"Starfleet, Federation, Exobiology, Musician, Astrophysicist, Human, Vulcan, Telepath, Prisoner, Duelist, Athlete","nonhuman, male, organic, tos, spock, crew_max_rarity_5","I Am Well Able To Defeat You",2, 8, 10, 10, 14, 4, 0, , , , 440, 320, 5, 300, false,"Spock",crew_portraits_cm_spock_gladiator_sm.png,spock_gladiator_crew
"Captive Bashir",5,4, 0,0,0,0,0,0,617,86,224,0,0,0,304,123,237,818,187,466,0,855,0,1150,468,767,0,1094,346,693,616,43,1058,275,205,0,897,0,898,207,821,0,809,184,750,404,49,739,100,71,881,447,"Human, Starfleet, Federation, Desperate, Prisoner, Physician, Engineered, Counselor","nonhuman, male, organic, ds9, bashir, crew_max_rarity_4","Run Like Hell",1, 6, 8, 8, 6, 6, 0, , , , 435, 225, 165, 150, true,"Bashir",crew_portraits_cm_bashir_prisoner_sm.png,bashir_prisoner_crew
"Rura Penthe Commandant",6,5, 1237,190,413,0,0,0,981,148,343,0,0,0,486,81,183,0,0,0,282,77,232,187,159,444,0,993,0,388,229,290,958,0,822,341,108,273,249,230,502,0,973,0,461,294,389,932,0,806,355,346,"Klingon, Interrogator, Veteran, Brutal, Survivalist, Villain, Hunter","nonhuman, male, organic, tos, commandant_klingon, crew_max_rarity_5","Punishment Means Exile",0, 10, 6, 6, 10, 1, 0, 2, 1, 3, 400, 50, 108, 325, false,"Commandant",crew_portraits_cm_comm_rura_penthe_sm.png,commandant_klingon_crew
"White Rabbit",10,5, 0,0,0,518,60,146,0,0,0,1294,149,298,0,0,0,962,132,297,1000,0,262,0,445,973,78,994,88,268,0,401,302,5,474,1104,0,566,0,549,1080,212,1080,197,549,0,529,586,29,568,524,832,"Crafty, Automated Unit, Costumed","male, tos, white_rabbit, nonhuman, artificial_life, crew_max_rarity_5","My Paws And Whiskers, I'll Be Late!",1, 6, 4, 8, 6, , , , , , 365, 100, 148, 100, true,"White Rabbit",crew_portraits_cm_white_rabbit_sm.png,white_rabbit_crew
"Conditioned La Forge",8,5, 0,0,0,0,0,0,954,140,312,1269,218,439,458,114,232,0,0,0,0,642,221,1054,0,514,218,976,0,21,249,365,58,81,803,0,692,234,927,0,581,209,844,0,24,263,467,53,94,673,390,261,"Human, Starfleet, Federation, Cyberneticist, Prisoner, Saboteur","male, organic, tng, laforge, crew_max_rarity_5","Just Not Sure About Anything",2, 8, 4, 10, 16, 5, 0, , , , 450, 70, 100, 225, false,"La Forge",crew_portraits_cm_laforge_conditioned_sm.png,laforge_conditioned_crew
"Tholian Prisoner",7,4, 0,0,0,841,159,343,394,48,114,622,97,216,0,0,0,0,0,0,639,1072,770,0,0,252,108,674,358,379,1186,897,796,438,0,549,1116,819,0,0,263,130,570,303,486,1226,941,834,471,0,915,1007,"Prisoner, Tholian, Mirror Universe, Pilot","nonhuman, female, male, organic, ent, tholian, crew_max_rarity_4","My People Will Find Your Ship",0, 6, 8, 8, 12, 7, 0, , , , 500, 270, 75, 340, false,"Tholian",crew_portraits_cm_tholian_prisoner_sm.png,tholian_prisoner_crew
"Buck Bokai",6,4, 620,98,221,0,0,0,866,137,302,0,0,0,369,68,142,0,0,0,816,262,742,644,669,613,0,1102,0,543,445,451,1067,0,934,842,343,782,637,712,609,0,1066,0,550,433,497,1043,0,900,894,986,"Athlete, Cultural Figure, Casual, Inspiring, Explorer","nonhuman, male, organic, ds9, buck_bokai, crew_max_rarity_4","It Ain't Over Til It's Over",2, 9, 5, 8, 12, 5, 0, , , , 495, 115, 132, 340, false,"Buck",crew_portraits_cm_buck_bokai_sm.png,buck_bokai_crew
"Doctor Ann Mulhall",9,5, 1032,76,245,1301,151,322,0,0,0,0,0,0,484,90,186,0,0,0,30,603,451,317,369,275,224,112,159,0,1084,0,948,0,812,158,860,777,561,707,554,365,236,338,0,1058,0,911,0,791,377,828,"Starfleet, Federation, Exobiology, Explorer, Human","female, organic, tos, ann_mulhall, crew_max_rarity_5","It Is Scientifically Fascinating",2, 7, 10, 10, 14, 6, 0, , , , 425, 100, 98, 200, false,"Mulhall",crew_portraits_cm_mulhall_doctor_sm.png,mulhall_doctor_crew
"Taresian Kim",8,4, 307,79,222,0,0,0,548,112,278,0,0,0,775,159,323,0,0,0,1124,611,1049,529,972,806,0,727,0,723,276,644,656,0,558,875,399,826,332,753,672,0,600,0,616,202,569,505,0,450,1012,683,"Federation, Human, Starfleet, Musician, Taresian, Prisoner, Romantic","male, organic, voy, kim, crew_max_rarity_4","Stay Out Of My Way!",1, 9, 8, 8, 6, , , , , , 475, 50, 70, 565, false,"Kim",crew_portraits_cm_kim_taresian_sm.png,kim_taresian_crew
"Fury Kes",5,5, 0,0,0,466,122,248,1037,319,717,0,0,0,0,0,0,861,133,445,952,444,0,0,461,50,649,942,89,245,462,10,0,267,499,773,147,0,0,299,13,489,801,62,38,101,2,0,174,346,464,33,"Ocampa, Civilian, Telepath, Botanist, Telekinetic, Prodigy, Brutal","nonhuman, female, organic, voy, kes, crew_max_rarity_5","You Abandoned Me",0, 10, 6, 6, 10, 1, 0, 2, 1, 3, 200, 200, 118, 515, false,"Kes",crew_portraits_cm_kes_fury_sm.png,kes_fury_crew
"Delta Flyer Torres",8,5, 554,60,132,0,0,0,1021,79,246,1278,190,397,0,0,0,0,0,0,947,273,52,1026,802,507,228,0,0,30,711,354,277,90,0,1115,591,129,1157,964,787,276,0,0,87,960,669,356,159,0,391,768,"Human, Federation, Starfleet, Romantic, Pilot, Athlete, Klingon","nonhuman, female, organic, voy, torres, crew_max_rarity_5","You Know How Much I Hate To Lose",0, 9, 8, 10, 12, , , , 2, 3, 400, 100, 108, 300, false,"Torres",crew_portraits_cm_torres_deltaflyer_sm.png,torres_deltaflyer_crew
"Imprinted Archer",9,5, 0,0,0,511,71,181,0,0,0,939,127,289,0,0,0,1126,117,340,970,0,545,0,258,945,133,969,60,513,0,247,580,6,336,1000,0,617,0,499,969,203,1003,155,587,0,481,646,30,501,608,766,"Human, Starfleet, Explorer, Desperate, Caregiver","male, organic, ent, archer, crew_max_rarity_5","We Can't Abandon Them",2, 7, 10, 6, 16, 2, 0, , , , 200, 100, 100, 515, false,"Archer",crew_portraits_cm_archer_imprinted_sm.png,archer_imprinted_crew
"Decoy Kira",7,5, 544,62,160,0,0,0,1006,93,235,0,0,0,1273,192,381,0,0,0,939,283,876,164,798,531,0,332,0,461,36,383,241,0,224,1046,550,991,312,907,775,0,446,0,713,179,660,373,0,347,337,745,"Bajoran, Costumed, Romantic, Crafty","nonhuman, female, organic, ds9, kira, crew_max_rarity_5","I Never Kiss And Tell",0, 7, 12, 10, 14, 4, 0, , , , 215, 270, 140, 365, false,"Kira",crew_portraits_cm_kira_decoy_sm.png,kira_decoy_crew
"Keyla Detmer",6,4, 864,105,261,0,0,0,341,98,190,602,100,211,0,0,0,0,0,0,670,446,116,807,499,1098,570,0,0,389,1177,886,816,449,0,755,433,197,873,622,878,566,0,0,317,1031,745,845,479,0,962,993,"Starfleet, Federation, Pilot, Human, Explorer, Engineered","female, organic, dsc, detmer, apr2023, crew_max_rarity_4","Fly Good",0, 5, 10, 10, 12, 4, 0, , , , 365, 200, 60, 300, false,"Detmer",crew_portraits_cm_detmer_keyla_sm.png,dsc_detmer_keyla_crew
"Chef Riker",8,5, 0,0,0,832,142,304,0,0,0,0,0,0,1276,205,411,529,90,208,667,0,0,442,797,630,454,51,97,0,393,725,213,500,50,659,0,0,552,789,617,414,61,140,0,494,740,307,506,98,458,407,"Human, Federation, Starfleet, Costumed, Chef","male, organic, tng, ent, riker, crew_max_rarity_5","You've Always Got A Choice",2, 8, 8, 8, 12, 4, 2, , , , 200, 215, 77, 475, false,"Riker",crew_portraits_cm_riker_chef_sm.png,riker_chef_crew
"Grathon Tolar",9,4, 417,28,73,579,111,255,0,0,0,900,115,230,0,0,0,0,0,0,483,1076,243,1170,956,777,121,835,474,561,0,0,636,301,0,611,1151,558,1249,1051,727,170,807,439,701,0,0,775,424,0,953,1166,"Criminal, Desperate, Crafty, Prisoner","male, nonhuman, organic, ds9, tolar, crew_max_rarity_4","It Will Pass. You'll See. It Will Pass.",2, 9, 8, 8, 10, , , 2, , , 340, , 158, 300, false,"Tolar",crew_portraits_cm_grathon_tolar_sm.png,grathon_tolar_crew
"Vargas",10,5, 1151,124,291,0,0,0,1161,275,572,0,0,0,0,0,0,0,0,0,359,24,305,571,238,242,0,0,0,222,428,136,0,0,0,675,62,591,801,542,109,0,0,0,113,214,80,0,0,0,632,515,"Human, Federation, Starfleet, Brutal, Veteran, Hero","male, organic, ds9, vargas, crew_max_rarity_5","HOLD POSITIONS!",0, 10, 8, 10, 10, , , , 1, 3, 650, 240, 235, 500, false,"Vargas",crew_portraits_cm_vargas_sm.png,vargas_crew
"Desert T'Pol",4,4, 0,0,0,778,184,418,683,84,173,0,0,0,409,72,142,0,0,0,653,818,0,1117,0,95,447,310,368,662,560,579,1036,0,897,396,972,0,1131,0,111,264,175,223,836,710,790,1033,0,893,838,839,"Vulcan, Starfleet, Astrophysicist, Telepath, Survivalist","nonhuman, female, organic, ent, tpol, crew_max_rarity_4","Awakening",1, 8, 10, 5, 6, 4, 0, , , , 425, 145, 75, 350, false,"T'Pol",crew_portraits_cm_tpol_desert_sm.png,tpol_desert_crew
"Saboteur Garak",8,5, 0,0,0,0,0,0,1325,151,336,1019,108,217,523,49,128,0,0,0,0,424,515,1077,0,255,393,1001,0,28,125,146,121,240,827,0,631,793,1182,0,512,539,1128,0,138,411,402,475,448,954,434,973,"Cardassian, Saboteur, Undercover Operative, Scoundrel, Civilian, Brutal, Hero","nonhuman, male, organic, ds9, garak, crew_max_rarity_5","You May Have Just Saved The Entire Alpha Quadrant",1, 7, 8, 6, 10, 1, 0, 2, , , 375, 270, 114, 225, false,"Garak",crew_portraits_cm_garak_saboteur_sm.png,garak_saboteur_crew
"Ishara Yar",10,5, 559,49,125,0,0,0,1311,163,352,1079,66,131,0,0,0,0,0,0,951,164,114,1035,809,258,397,0,0,29,440,147,539,244,0,1140,406,684,1179,983,464,788,0,0,200,644,359,1067,644,0,396,1090,"Human, Scoundrel, Veteran, Saboteur, Desperate","female, organic, tng, yar_ishara, crew_max_rarity_5","I Did What I Had To",1, 10, 6, 10, 10, , , , , , 410, 200, 45, 215, false,"Ishara",crew_portraits_cm_yar_ishara_sm.png,yar_ishara_crew
"Science Officer Spock",6,5, 1029,114,235,1291,187,390,0,0,0,0,0,0,477,95,193,0,0,0,20,595,444,306,363,228,199,104,141,0,1086,0,953,0,818,85,818,713,505,648,390,286,152,247,0,1041,0,892,0,774,304,629,"Starfleet, Federation, Exobiology, Artist, Astrophysicist, Human, Vulcan, Telepath","nonhuman, male, organic, dsc, spock, crew_max_rarity_5","Let Us See What The Future Holds",0, 7, 8, 8, 10, 3, 0, 3, , , 320, 120, 103, 475, false,"Spock",crew_portraits_cm_spock_science_sm.png,dsc_spock_science_crew
"Merry Men Troi",7,5, 556,37,109,0,0,0,0,0,0,0,0,0,1277,254,505,971,141,332,986,983,915,144,43,0,0,246,308,0,333,361,161,221,12,1172,1126,1099,229,240,0,0,227,339,0,298,439,154,259,24,217,356,"Starfleet, Federation, Human, Betazoid, Empath, Counselor, Costumed","nonhuman, female, organic, tng, troi, crew_max_rarity_5","Right On Target!",0, 6, 8, 6, 10, 4, 0, , , , 200, 130, 145, 390, false,"Troi",crew_portraits_cm_troi_merrymen_sm.png,troi_merrymen_crew
"Determined Janeway",6,5, 496,106,174,0,0,0,992,125,248,1321,171,370,0,0,0,0,0,0,971,294,51,1048,821,515,221,0,0,24,722,366,267,83,0,916,437,107,1012,797,691,313,0,0,86,898,590,420,202,0,392,651,"Starfleet, Survivalist, Federation, Jury Rigger, Resourceful, Tactician, Veteran, Desperate, Human, Displaced","female, organic, voy, janeway, crew_max_rarity_5","I Don't Respond Well To Threats",0, 6, 10, 8, 16, 2, 0, , , , 230, 235, 125, 300, false,"Janeway",crew_portraits_cm_janeway_determined_sm.png,janeway_determined_crew
"Resilient Tuvok",8,5, 0,0,0,571,16,63,1006,105,259,1302,187,378,0,0,0,0,0,0,1010,628,236,0,0,108,70,1006,608,23,706,340,269,86,0,1220,810,353,0,0,603,222,1214,772,77,908,601,387,180,0,419,949,"Vulcan, Telepath, Tactician, Starfleet, Federation, Hero, Survivalist, Displaced","nonhuman, male, organic, voy, tuvok, crew_max_rarity_5","The Captain Is Always Right",2, 8, 10, 10, 12, 7, 0, , , , 275, 100, 113, 300, false,"Tuvok",crew_portraits_cm_tuvok_blind_sm.png,tuvok_resilient_crew
"Obrist",8,4, 685,55,156,837,140,362,0,0,0,444,39,61,0,0,0,0,0,0,131,830,365,927,655,609,210,679,360,944,0,0,1062,622,0,233,1047,814,1122,928,503,265,571,304,1041,0,0,1179,705,0,873,1160,"Krenim, Desperate, Theoretical Engineer, Saboteur, Crafty, Survivalist, Displaced","nonhuman, organic, male, voy, obrist, crew_max_rarity_4","We Have Accomplished The Impossible",2, 9, 10, 6, 10, , , , , , 25, 100, 115, 270, false,"Obrist",crew_portraits_cm_obrist_sm.png,obrist_crew
"The Bashirs",10,5, 0,0,0,871,177,358,0,0,0,0,0,0,1211,260,457,588,41,84,599,0,0,455,828,554,408,45,87,0,421,769,234,532,57,486,0,0,409,1037,452,321,15,180,0,340,967,188,695,129,407,368,"Human, Caregiver, Civilian, Criminal","male, female, organic, ds9, bashirs, crew_max_rarity_5","We're A Little Beyond Worrying",1, 9, 4, 6, 12, , , , , , 150, 75, 40, 457, false,"Bashirs",crew_portraits_cm_bashirs_parents_sm.png,bashirs_parents_crew
"Desperate Riker",5,4, 898,81,215,0,0,0,386,59,153,505,150,319,0,0,0,0,0,0,671,443,123,809,500,1086,580,0,0,405,1165,877,829,460,0,881,601,136,975,762,1050,366,0,0,224,1170,872,527,260,0,975,981,"Human, Federation, Starfleet, Desperate, Brutal, Survivalist, Veteran, Crafty, Displaced","male, organic, tng, riker, crew_max_rarity_4","We've Encountered A Quantum Anomaly",0, 6, 6, 8, 10, 0, 1, , , , 400, 170, 60, 530, false,"Riker",crew_portraits_cm_riker_desperate_sm.png,riker_desperate_crew
"Beloved Annorax",9,5, 539,36,117,1262,176,389,0,0,0,1024,131,282,0,0,0,0,0,0,79,996,110,1079,858,272,21,359,157,408,0,0,479,198,0,230,1122,345,1199,1012,400,62,467,253,591,0,0,656,346,0,385,749,"Krenim, Desperate, Theoretical Engineer, Casual, Survivalist","male, nonhuman, organic, voy, annorax, crew_max_rarity_5","Time Is Patient",2, 7, 10, 5, 12, 7, 0, , , , 300, 100, 100, 315, false,"Annorax",crew_portraits_cm_annorax_beloved_sm.png,annorax_beloved_crew
"Tactical Officer Neelix",7,5, 0,0,0,0,0,0,1311,208,443,0,0,0,526,57,159,1024,140,313,0,379,0,1045,347,187,0,964,271,169,99,4,923,185,91,0,446,0,1127,512,268,0,1054,368,248,204,17,1031,304,235,203,446,"Starfleet, Civilian, Talaxian, Mylean, Resourceful, Chef, Survivalist, Ambassador, Displaced","nonhuman, male, organic, voy, neelix, crew_max_rarity_5","Intruders Among Us! Danger! Danger!",1, 8, 8, 8, 8, 3, 0, 3, , , 250, 100, 128, 125, false,"Neelix",crew_portraits_cm_neelix_tactical_sm.png,neelix_tactical_crew
"Mountain Climber Mayweather",8,5, 1238,182,458,0,0,0,0,0,0,970,139,292,0,0,0,434,89,297,266,423,14,467,18,0,391,0,622,474,0,794,532,32,844,290,441,23,477,30,0,424,0,418,570,0,585,615,41,622,440,241,"Human, Starfleet, Athlete, Pilot","male, organic, ent, mayweather, crew_max_rarity_5","If It's Easy What's The Point?",2, 8, 8, 6, 12, 6, 0, , , , 200, 155, 126, 400, false,"Mayweather",crew_portraits_cm_mayweather_risa_sm.png,mayweather_risa_crew
"Injured Torres",3,2, 259,48,109,0,0,0,0,0,0,369,62,197,0,0,0,0,0,0,1186,1137,697,1223,1033,0,786,0,0,940,0,0,1055,619,0,1163,1119,605,1195,1009,0,662,0,0,842,0,0,946,559,0,1392,1376,"Starfleet, Klingon, Human, Maquis, Survivalist, Innovator, Jury Rigger, Cyberneticist, Federation, Desperate","nonhuman, organic, female, voy, torres, crew_max_rarity_2","I'm Going To Get This One",1, 4, 6, 6, 8, 3, 0, , , , 253, 200, 105, 225, false,"Torres",crew_portraits_cm_torre_injured_sm.png,torres_injured_crew
"Jett Reno",8,5, 0,0,0,907,245,544,0,0,0,1301,158,341,0,0,0,0,0,0,422,0,245,0,0,393,16,478,238,254,0,0,289,98,0,172,0,464,0,0,152,11,198,114,462,0,0,481,233,0,655,529,"Starfleet, Federation, Human, Jury Rigger, Resourceful, Veteran","female, organic, dsc, jett_reno, crew_max_rarity_5","I Can Fix Stuff With Duct Tape",0, 10, 4, 8, 16, 5, 0, , , , 170, 100, 225, 25, false,"Reno",crew_portraits_cm_jett_reno_sm.png,dsc_jett_reno_crew
"Leah Brahms",10,5, 0,0,0,990,125,263,0,0,0,1291,158,327,596,30,81,0,0,0,541,0,254,1020,0,492,34,189,297,263,1036,0,63,104,751,746,0,482,1243,0,686,99,577,417,477,1262,0,339,248,1010,416,996,"Federation, Starfleet, Warp Theorist, Human, Cyberneticist, Civilian","female, organic, tng, brahms, crew_max_rarity_5","I Know What's Involved",1, 9, 8, 8, 10, 0, 1, , , , 50, 50, 310, 292, false,"Brahms",crew_portraits_cm_brahms_leah_sm.png,brahms_leah_crew
"Frederick La Rouque",10,5, 1010,145,341,0,0,0,0,0,0,0,0,0,1271,222,481,0,0,0,459,555,386,38,312,0,0,266,0,0,356,0,180,0,169,542,620,456,63,395,0,0,277,0,0,368,0,201,0,209,638,657,"Human, Gambler, Scoundrel, Linguist, Civilian","male, organic, tng, larouque, crew_max_rarity_5","A Poker Face Carved In Marble",2, 8, 10, 10, 14, 4, 0, , , , 495, 140, 137, 415, false,"La Rouque",crew_portraits_cm_larouque_sm.png,larouque_crew
"Resolute Chakotay",8,4, 624,72,201,0,0,0,372,89,189,0,0,0,877,106,226,0,0,0,834,550,763,324,690,1064,0,705,0,927,437,859,631,0,537,930,548,882,553,804,900,0,859,0,810,496,760,791,0,689,910,1092,"Human, Starfleet, Federation, Survivalist, Hunter, Maquis","male, organic, voy, chakotay, crew_max_rarity_4","Increasing Our Chances of Survival",2, 7, 8, 8, 10, , , , , , 500, 200, 50, 325, false,"Chakotay",crew_portraits_cm_chakotay_mustache_sm.png,chakotay_mustache_crew
"Commodore Matt Decker",9,5, 1241,291,379,494,68,143,787,254,544,0,0,0,0,0,0,0,0,0,77,79,195,452,120,114,720,1030,626,448,720,362,0,0,0,95,21,194,436,161,48,759,1067,656,141,258,98,0,0,0,399,109,"Starfleet, Federation, Human, Desperate, Veteran","male, organic, tos, matt_decker, crew_max_rarity_5","We've Got To Destroy It!",0, 8, 8, 6, 12, 1, 0, 2, , , 200, 100, 215, 25, false,"Decker",crew_portraits_cm_matt_decker_sm.png,matt_decker_crew
"Nomad",9,5, 0,0,0,1281,182,365,556,91,145,988,115,218,0,0,0,0,0,0,268,939,536,0,0,40,32,342,153,116,1032,710,565,260,0,465,1013,778,0,0,153,96,497,269,358,1122,828,788,435,0,403,772,"Brutal, Telepath, Exobiology, Explorer, Probe, Resourceful","nonhuman, tos, artificial_life, nomad, crew_max_rarity_5","That Which Is Imperfect Must Be Sterilized",0, 8, 8, 10, 10, , , , , , 100, 505, 150, 50, false,"Nomad",crew_portraits_cm_nomad_sm.png,nomad_crew
"Sous-chef Sisko",3,3, 0,0,0,0,0,0,0,0,0,0,0,0,544,47,133,323,85,187,0,0,0,1044,988,0,0,959,720,0,1065,913,920,653,515,0,0,0,1181,832,0,0,1123,558,0,1214,776,1093,535,515,1338,1360,"Human, Diplomat, Musician, Bajoran, Cultural Figure, Inspiring, Chef","male, organic, ds9, sisko, crew_max_rarity_3","Let's Go Home!",2, 5, 5, 8, 11, , , , , , 100, 185, 162, 380, false,"Sisko",crew_portraits_cm_sisko_chef_sm.png,sisko_chef_crew
"Jodmos",3,4, 351,91,181,0,0,0,915,92,234,0,0,0,579,105,275,0,0,0,1088,425,1010,641,931,619,0,826,0,549,226,456,781,0,667,934,505,887,484,809,788,0,784,0,720,348,670,710,0,627,897,978,"Klingon, Undercover Operative, Human, Federation, Starfleet, Bajoran, Cultural Figure, Inspiring, Diplomat, Crafty","male, organic, ds9, sisko, crew_max_rarity_4","Now We Celebrate!",1, 8, 10, 10, 12, , , , , , 195, 225, 90, 455, false,"Sisko",crew_portraits_cm_sisko_jodmos_sm.png,sisko_jodmos_crew
"Honored Owosekun",8,5, 947,153,330,1284,224,453,0,0,0,572,54,108,0,0,0,0,0,0,18,613,108,700,377,190,60,279,122,837,0,0,931,526,0,22,623,227,681,402,255,117,316,175,998,0,0,1113,672,0,249,428,"Starfleet, Federation, Veteran, Resourceful, Human, Explorer","dsc, female, owosekun, organic, crew_max_rarity_5","This Is Strange",1, 8, 6, 10, 6, , , , , , 195, 100, 90, 50, false,"Owosekun",crew_portraits_cm_owosekun_honored_sm.png,dsc_owosekun_honored_crew
