"Nyota Uhura",9,5, 899,74,127,0,0,0,536,63,125,0,0,0,1050,240,468,0,0,0,773,438,699,144,572,1057,0,474,0,966,178,855,393,0,334,1221,867,1161,229,1048,1235,0,304,0,1088,207,1004,243,0,208,724,898,"Human, Federation, Starfleet, Communicator, Resourceful, Musician","female, organic, tos, uhura, crew_max_rarity_5","Alameda Express",1, 8, 4, 10, 10, , , , , , 115, 15, 167, 565, false,"Uhura",crew_portraits_cm_uhurastiv_sm.png,uhura_stiv_crew
"Katra McCoy",8,4, 0,0,0,325,76,166,0,0,0,0,0,0,458,170,347,790,121,352,1270,0,0,1090,566,1267,967,702,216,0,1129,577,942,379,146,1139,0,0,723,486,1102,815,263,163,0,729,490,525,294,79,1204,719,"Federation, Starfleet, Vulcan, Desperate, Human, Physician","male, organic, tos, mccoy, crew_max_rarity_4","Steps of Mount Seleya",1, 6, 4, 8, 8, 6, 0, , , , 450, 190, 53, 280, true,"McCoy",crew_portraits_cm_mccoy_katra_sm.png,mccoy_katra_crew
"Katrine",7,5, 1050,271,589,525,36,110,867,200,373,0,0,0,0,0,0,0,0,0,100,122,317,593,221,141,843,1144,700,572,854,466,0,0,0,63,28,92,266,63,223,983,1287,828,411,641,314,0,0,0,643,163,"Human, Federation, Starfleet, Crafty, Desperate, Gambler, Saboteur, Undercover Operative, Costumed","female, organic, voy, janeway, crew_max_rarity_5","Leave The War Outside",0, 7, 6, 8, 14, 4, 2, , , , 315, 385, 80, 650, false,"Janeway",crew_portraits_cm_janeway_tuxedo_sm.png,janeway_tuxedo_crew
"M-113 Creature",7,4, 0,0,0,382,126,262,665,45,92,0,0,0,797,102,202,0,0,0,1157,977,0,933,0,455,863,424,721,826,361,723,797,0,653,818,1254,0,1084,0,525,551,335,465,1133,911,1048,970,0,818,1116,1300,"M-113 Creature, Desperate, Exobiology, Shapeshifter, Telepath, Crafty","nonhuman, female, tos, salt_vampire, organic, crew_max_rarity_4","I Hunger",0, 6, 8, 3, 10, 1, 0, , , , 240, 145, 93, 560, true,"M-113 Creature",crew_portraits_cm_m113_sm.png,salt_vampire_crew
"Lal",10,4, 0,0,0,0,0,0,0,0,0,879,63,134,507,140,325,0,0,0,0,0,711,1075,0,0,560,958,0,698,1116,0,190,396,778,0,0,1169,812,0,0,908,702,0,1079,830,0,284,744,532,1388,1407,"Android, Federation, Prodigy, Bartender, Romantic, Civilian","nonhuman, female, tng, artificial_life, lal, crew_max_rarity_4","Reason For Being",0, 8, 6, 4, 8, , , , , , 450, 215, 77, 575, false,"Lal",crew_portraits_cm_lal_sm.png,lal_crew
"Commander Nevesa",10,4, 660,134,471,0,0,0,0,0,0,0,0,0,586,92,237,0,0,0,790,863,720,427,598,0,0,939,0,0,1099,0,909,0,761,381,551,328,214,251,0,0,964,0,0,1090,0,911,0,775,1391,1182,"Crafty, Romantic, Romulan, Resourceful","female, nonhuman, organic, tos, nevesa, crew_max_rarity_4","Hidden in Plain Sight",1, 7, 10, 8, 14, 1, 2, , , , 290, 310, 70, 565, false,"Nevesa",crew_portraits_cm_romulancommander_sm.png,nevesa_crew
"Mirror Bashir",8,5, 0,0,0,0,0,0,1101,249,531,829,186,403,0,0,0,0,0,0,0,526,636,0,0,361,501,0,0,50,551,229,687,336,0,0,356,365,0,0,163,303,0,0,9,301,115,399,163,0,812,372,"Human, Scoundrel, Engineered, Desperate, Saboteur, Survivalist, Mirror Universe, Terran Rebellion","nonhuman, male, organic, ds9, bashir, crew_max_rarity_5","I Owed You That",0, 10, 10, 12, 10, , , , , , 415, 55, 345, 675, false,"Bashir",crew_portraits_cm_bashir_mirror_sm.png,bashir_mirror_crew
"The Keeper",8,5, 526,27,75,922,357,755,0,0,0,0,0,0,0,0,0,945,149,458,104,1135,1088,1226,50,388,292,456,24,0,0,358,0,231,445,16,1273,1269,1384,157,39,34,49,3,0,0,289,0,156,331,624,74,"Talosian, Crafty, Exobiology, Quantum Mechanics, Telepath, Explorer, Shapeshifter, Interrogator","nonhuman, organic, male, tos, keeper, crew_max_rarity_5","A Curious Species",1, 8, 4, 10, 16, 5, 0, , , , 350, , 63, 115, false,"The Keeper",crew_portraits_cm_talosian_keeper_sm.png,talosian_keeper_crew
"Kilana",9,4, 506,128,298,0,0,0,0,0,0,0,0,0,797,160,341,0,0,0,967,1004,905,396,791,0,0,794,0,0,947,0,741,0,607,740,814,662,218,577,0,0,623,0,0,754,0,549,0,460,1372,1200,"Vorta, Clone, Crafty, Dominion, Scoundrel","nonhuman, female, organic, ds9, kilana, crew_max_rarity_4","For The Founders!",1, 7, 10, 10, 16, 6, 0, , , , 215, 275, 128, 560, false,"Kilana",crew_portraits_cm_kilana_sm.png,kilana_crew
"Talos IV Spock",4,3, 413,37,141,178,29,103,514,97,197,0,0,0,0,0,0,0,0,0,936,739,1118,1256,1005,782,1015,1335,852,919,1172,808,0,0,0,957,718,1191,1312,1082,720,994,1294,836,892,1148,815,0,0,0,1431,1442,"Federation, Starfleet, Exobiology, Astrophysicist, Human, Vulcan, Telepath, Musician","nonhuman, male, organic, tos, spock, crew_max_rarity_3","We've Lost The Captain",0, 5, 10, 8, 8, , , , , , 690, 10, 105, 450, false,"Spock",crew_portraits_cm_spock_pilot_sm.png,spock_pilot_crew
"Author Doctor",8,4, 0,0,0,0,0,0,0,0,0,0,0,0,729,159,394,625,86,287,0,0,0,925,705,0,0,824,502,0,979,669,773,474,121,0,0,0,693,675,0,0,538,476,0,678,669,473,448,99,1358,1209,"Hologram, Human, Federation, Musician, Starfleet, Diplomat, Physician, Writer","nonhuman, male, artificial_life, voy, emh, crew_max_rarity_4","A Single Proton Flares",2, 8, 4, 4, 8, 3, 0, 2, , , 555, 100, 60, 225, false,"Doctor",crew_portraits_cm_emh_writer_sm.png,emh_writer_crew
"Musketeer La Forge",7,5, 436,58,138,0,0,0,1116,313,633,1009,92,237,0,0,0,0,0,0,1163,202,170,1238,990,284,459,0,0,36,474,173,619,289,0,1233,97,454,1289,1062,84,616,0,0,13,160,58,899,498,0,581,230,"Hologram, Human, Duelist, Hero, Inspiring, Cyberneticist, Maverick, Veteran, Tactician","male, nonhuman, artificial_life, tng, laforge, crew_max_rarity_5","All For One",2, 9, 6, 10, 10, 3, 0, , , , 165, 70, 237, 500, true,"La Forge",crew_portraits_cm_laforge_musketeer_sm.png,laforge_musketeer_crew
"Ilia Probe",10,5, 0,0,0,1211,198,426,0,0,0,0,0,0,1023,48,101,0,0,0,338,0,0,861,0,351,280,69,195,0,899,0,692,0,567,375,0,0,1344,0,367,278,252,218,0,1380,0,1260,0,1088,809,1354,"Deltan, Romantic, Communicator, Probe, Android","female, nonhuman, artificial_life, tos, ilia, crew_max_rarity_5","Oath Of Celibacy",1, 10, 12, 8, 8, , , , , , 600, 100, 140, 440, false,"Ilia",crew_portraits_cm_ilia_probe_sm.png,ilia_probe_crew
"Romulan Data",8,5, 0,0,0,478,77,141,0,0,0,1153,185,399,969,142,279,0,0,0,1146,0,330,796,0,1128,102,255,707,366,831,0,44,145,502,1193,0,376,906,0,1161,147,406,719,397,955,0,62,173,644,658,713,"Android, Starfleet, Federation, Cyberneticist, Undercover Operative, Musician, Romulan","nonhuman, male, tng, artificial_life, data, crew_max_rarity_5","No Regrets",2, 7, 6, 8, 14, 5, 2, , , , 500, 150, 40, 300, false,"Data",crew_portraits_cm_data_romulan_sm.png,data_romulan_crew
"Zhian'tara Odo",7,5, 899,184,356,0,0,0,535,72,148,0,0,0,1279,113,225,0,0,0,643,328,581,116,461,1025,0,452,0,943,155,829,380,0,323,497,376,427,253,346,1134,0,951,0,1029,668,944,894,0,762,605,888,"Changeling, Communicator, Bajoran, Trill, Constable, Investigator, Shapeshifter","nonhuman, male, organic, ds9, odo, dax, crew_max_rarity_5","It's Better This Way",0, 6, 6, 10, 12, 4, 0, , , , 580, 225, 5, 440, true,"Odo",crew_portraits_cm_odo_curzon_sm.png,odo_curzon_crew
"Gaia Odo",3,2, 0,0,0,0,0,0,260,24,83,0,0,0,384,54,134,0,0,0,0,1266,0,1284,0,1322,0,1217,0,1158,1065,1065,1196,0,1036,0,1268,0,1304,0,1325,0,1229,0,1156,1152,1067,1214,0,1045,1544,1572,"Changeling, Bajoran, Constable, Romantic, Communicator, Shapeshifter","nonhuman, male, organic, ds9, odo, crew_max_rarity_2","You Have To Go Home",2, 3, 10, 12, 10, 0, 2, , , , 630, 135, 58, 315, false,"Odo",crew_portraits_cm_odo_future_sm.png,odo_future_crew
"Prisoner O'Brien",6,4, 0,0,0,0,0,0,583,83,187,694,244,503,447,11,21,0,0,0,0,995,665,1298,0,922,533,1234,0,167,811,744,342,356,1052,0,1057,168,1410,0,1014,165,1347,0,62,1131,849,162,57,1157,1132,969,"Human, Starfleet, Federation, Prisoner, Desperate, Survivalist, Brutal, Jury Rigger","male, organic, ds9, obrien, crew_max_rarity_4","It's Real To Me",0, 7, 4, 14, 16, 5, 0, , , , 400, 80, 85, 525, false,"O'Brien",crew_portraits_cm_obrien_prisoner_sm.png,obrien_prisoner_crew
"Lieutenant Commander Saru",7,2, 274,21,92,349,62,179,0,0,0,0,0,0,0,0,0,0,0,0,886,1261,1251,1364,1139,1244,933,1236,788,0,0,0,0,0,0,878,1265,1256,1375,1145,1106,817,1132,677,0,0,0,0,0,0,1545,1551,"Kelpien, Federation, Starfleet, Exobiology, Survivalist","male, nonhuman, organic, dsc, saru, crew_max_rarity_2","Kelpien Instincts",2, 2, 6, 6, 12, 6, 0, , , , 77, 100, 75, 570, false,"Saru",crew_portraits_cm_dsc_saru_lieutenant_sm.png,dsc_saru_lieutenant_crew
"T'Mir",7,4, 686,184,403,0,0,0,0,0,0,0,0,0,557,137,298,0,0,0,787,857,716,402,593,0,0,924,0,0,1083,0,893,0,748,430,583,372,158,293,0,0,792,0,0,930,0,713,0,618,1376,1041,"Vulcan, Telepath, Survivalist, Resourceful, Civilian, High Command","nonhuman, female, organic, ent, tmir, crew_max_rarity_4","What if you lose?",0, 7, 4, 4, 16, 1, 0, , , , 440, 100, 130, 1815, false,"T'Mir",crew_portraits_cm_tmir_sm.png,tmir_crew
"Lieutenant Arex Na Eth",9,4, 631,183,415,572,85,202,0,0,0,0,0,0,322,105,207,0,0,0,238,872,730,621,605,935,675,664,555,0,1324,0,1202,0,1041,105,569,348,225,269,1000,719,472,603,0,1118,0,952,0,800,1233,754,"Edosian, Starfleet, Federation, Musician, Pilot, Explorer, Astrophysicist, Playful","nonhuman, male, organic, tas, arex, crew_max_rarity_4","This Is No Joke",1, 9, 10, 10, 12, , , , , , 475, 155, 293, 615, false,"Arex",crew_portraits_cm_arex_animated_sm.png,arex_lute_crew
"Temporal Prisoner Chakotay",8,5, 0,0,0,0,0,0,1166,134,414,1041,68,201,0,0,0,610,10,52,0,539,562,0,903,386,455,0,647,49,580,38,613,34,895,0,623,1001,0,1176,469,728,0,860,157,673,255,1031,497,1150,611,1244,"Human, Desperate, Federation, Marksman, Saboteur, Resourceful, Prisoner, Displaced","male, organic, voy, chakotay, crew_max_rarity_5","Timeline Triage",2, 7, 8, 6, 12, 7, 0, , , , 780, 230, 80, 190, false,"Chakotay",crew_portraits_cm_chakotay_shattered_sm.png,chakotay_shattered_crew
"Laborer Spock",6,5, 0,0,0,1205,157,321,0,0,0,971,144,315,0,0,0,0,0,0,367,0,531,0,0,391,41,462,220,535,0,0,580,260,0,649,0,579,0,0,621,78,689,363,586,0,0,617,305,0,804,1196,"Federation, Starfleet, Exobiology, Astrophysicist, Human, Vulcan, Telepath, Jury Rigger, Communicator, Thief, Resourceful, Musician","nonhuman, male, organic, tos, spock, crew_max_rarity_5","Stone Knives and Bear Skins",1, 10, 4, 8, 8, 3, 0, , , , 540, 200, 80, 350, true,"Spock",crew_portraits_cm_spock_janitor_sm.png,spock_janitor_crew
"First Officer Burnham",7,5, 1359,88,294,944,207,478,667,50,101,0,0,0,0,0,0,0,0,0,22,177,272,538,174,85,378,565,289,818,1095,717,0,0,0,49,639,747,950,647,141,232,352,179,1125,1377,1042,0,0,0,225,732,"Federation, Starfleet, Astrophysicist, Human, Xenoanthropology, Resourceful","female, organic, dsc, burnham, crew_max_rarity_5","We Need To Strike First!",1, 8, 12, 5, 10, 1, 0, 2, , , 475, 70, 85, 740, false,"Burnham",crew_portraits_cm_dsc_burnham_first_officer_sm.png,dsc_burnham_first_officer_crew
"Rura Penthe Kirk",7,5, 0,0,0,0,0,0,1337,197,391,0,0,0,854,230,569,0,0,0,0,424,0,735,0,216,0,582,0,228,20,128,503,0,427,0,580,0,341,0,406,0,213,0,392,20,296,153,0,152,741,363,"Human, Federation, Starfleet, Romantic, Inspiring, Duelist, Desperate, Survivalist, Criminal, Prisoner","male, organic, tos, kirk, crew_max_rarity_5","Aim for the 'Knee'",2, 7, 6, 6, 12, 1, 2, , , , 550, 230, 50, 625, false,"Kirk",crew_portraits_cm_kirk_rura_penthe_sm.png,kirk_rura_penthe_crew
"Cadet Wesley Crusher",10,4, 0,0,0,745,160,385,0,0,0,682,85,188,0,0,0,0,0,0,763,0,795,0,0,750,143,822,434,765,0,0,870,455,0,513,0,991,0,0,503,143,568,300,920,0,0,1023,603,0,1346,1307,"Human, Federation, Starfleet, Pilot, Prodigy","male, organic, tng, wesley, crew_max_rarity_4","Duty To The Truth",1, 6, 10, 10, 12, 4, 0, , , , 300, 200, 110, 100, false,"Wesley",crew_portraits_cm_wesley_crusher_cadet_sm.png,wesley_cadet_crew
"Smitten Jean-Luc Picard",8,5, 1059,98,163,0,0,0,0,0,0,0,0,0,1122,343,651,0,0,0,602,723,538,71,424,0,0,334,0,0,457,0,258,0,212,1055,1066,1021,49,902,0,0,106,0,0,143,0,67,0,77,758,658,"Federation, Starfleet, Human, Romantic, Inspiring, Communicator, Musician, Playful","male, organic, tng, picard, crew_max_rarity_5","My Love Is a Fever",0, 8, 9, 5, 16, 1, 1, , , , 575, 170, 190, 40, false,"Picard",crew_portraits_cm_picard_smitten_sm.png,picard_smitten_crew
"Trader Worf",8,5, 0,0,0,0,0,0,1012,242,574,0,0,0,1013,75,236,0,0,0,0,547,0,807,0,396,0,674,0,371,68,260,603,0,509,0,320,0,1074,0,142,0,992,0,158,73,99,953,0,801,816,836,"Klingon, Tactician, Undercover Operative, Federation, Starfleet, Tribbled, Displaced","nonhuman, male, organic, ds9, worf, crew_max_rarity_5","Detestable Creatures!",0, 8, 6, 10, 12, 5, 0, , , , 640, 100, 230, 300, false,"Worf",crew_portraits_cm_worf_trader_sm.png,worf_trader_crew
"Miral Torres",10,4, 0,0,0,0,0,0,598,129,264,0,0,0,761,127,286,0,0,0,0,925,0,930,0,835,0,836,0,776,301,665,790,0,648,0,862,0,919,0,751,0,829,0,708,281,630,761,0,657,1369,1309,"Klingon, Civilian, Desperate","nonhuman, female, organic, voy, miral, crew_max_rarity_4","You Dishonor Me!",1, 7, 14, 12, 14, 5, 0, , , , 440, 275, 58, 625, false,"Miral",crew_portraits_cm_miral_sm.png,miral_crew
"Commander Barak",9,4, 899,69,187,0,0,0,627,85,190,0,0,0,0,0,0,0,0,0,754,334,682,914,558,867,0,0,0,802,1082,692,0,0,0,1076,643,1041,1174,924,1005,0,0,0,918,1182,842,0,0,0,1360,1470,"Klingon, Brutal, Tactician, Hero","nonhuman, male, organic, tos, barak, crew_max_rarity_4","Honor and Glory",0, 6, 10, 10, 20, 2, 0, , , , 600, 30, 105, 400, false,"Barak",crew_portraits_cm_barak_commander_sm.png,barak_commander_crew
"First Officer Saru",9,4, 597,74,239,816,195,414,0,0,0,0,0,0,0,0,0,0,0,0,157,974,869,1063,762,683,506,745,388,0,0,0,0,0,0,93,986,894,1063,789,399,298,461,235,0,0,0,0,0,0,1337,1218,"Kelpien, Federation, Starfleet, Exobiology, Survivalist","male, nonhuman, organic, dsc, saru, crew_max_rarity_4","Vigilance Equals Survival",1, 9, 8, 8, 10, , , , 2, 3, 325, 300, 55, 690, false,"Saru",crew_portraits_cm_saru_science_officer_sm.png,dsc_saru_scanner_crew
"Desert Philippa Georgiou",9,5, 912,152,353,0,0,0,0,0,0,0,0,0,1242,146,284,0,0,0,647,751,583,115,466,0,0,448,0,0,575,0,377,0,321,563,677,491,215,405,0,0,802,0,0,937,0,722,0,628,810,1183,"Human, Federation, Starfleet, Inspiring, Diplomat, Veteran","female, organic, dsc, georgiou, crew_max_rarity_5","Prepared Surprise",0, 8, 6, 12, 14, 5, 0, , , , 300, 415, 125, 490, false,"Georgiou",crew_portraits_cm_dsc_georgiou_desert_sm.png,dsc_georgiou_desert_crew
"T'Kuvma",8,5, 1096,240,572,0,0,0,962,219,439,0,0,0,0,0,0,0,0,0,348,77,310,575,212,466,0,0,0,431,691,309,0,0,0,149,22,121,313,82,282,0,0,0,287,455,187,0,0,0,762,232,"Klingon, Brutal, Hero, Cultural Figure, Spiritual","male, nonhuman, organic, tkuvma, dsc, crew_max_rarity_5","Are You Worthy",0, 9, 10, 5, 12, 1, 0, 2, , , 475, 260, 133, 575, false,"T'Kuvma",crew_portraits_cm_tkuvma_sm.png,dsc_tkuvma_mekleth_crew
"Reinforcements Stamets",10,4, 0,0,0,853,87,228,614,58,183,0,0,0,0,0,0,0,0,0,762,980,0,0,0,142,550,820,432,828,1108,724,0,0,0,958,1106,0,0,0,470,659,997,558,977,1246,896,0,0,0,1375,1464,"Human, Starfleet, Federation, Exomycologist, Prodigy","male, organic, dsc, stamets, crew_max_rarity_4","Calling Reinforcements",1, 7, 16, 12, 10, 7, 0, , , , 400, 100, 100, 500, false,"Stamets",crew_portraits_cm_stamets_sm.png,dsc_stamets_callbackup_crew
"Captain Lorca",9,5, 1263,232,542,0,0,0,0,0,0,0,0,0,1014,131,260,0,0,0,233,434,205,57,108,0,0,612,0,0,766,0,540,0,457,179,359,150,72,105,0,0,856,0,0,999,0,798,0,686,750,789,"Starfleet, Human, Tactician, Federation, Explorer, Mirror Universe","male, organic, dsc, lorca, crew_max_rarity_5","We Are A Long Way From Home",1, 9, 12, 3, 12, 4, 1, , , , 650, 75, 140, 240, false,"Lorca",crew_portraits_cm_lorca_sm.png,dsc_lorca_stance_crew
"Fierce Guinan",7,4, 0,0,0,0,0,0,637,104,217,0,0,0,703,244,533,0,0,0,0,921,0,878,0,830,0,762,0,771,238,660,710,0,580,0,966,0,376,0,888,0,237,0,833,85,752,176,0,167,1322,899,"Communicator, Counselor, Civilian, Survivalist, Empath, Bartender, El-Aurian, Brutal","nonhuman, female, organic, tng, guinan, exclusive_voyage, crew_max_rarity_4","We've Had Some Dealings",2, 8, 10, 10, 10, , , , 1, 2, 415, 355, 117, 565, false,"Guinan",crew_portraits_cm_guinan_fierce_sm.png,guinan_fierce_crew
"Cadet Sylvia Tilly",10,5, 0,0,0,970,88,231,0,0,0,1217,189,373,0,0,0,0,0,0,677,0,308,0,0,663,44,729,378,346,0,0,363,130,0,948,0,407,0,0,914,100,985,547,432,0,0,447,195,0,811,1250,"Human, Theoretical Engineer, Federation, Starfleet","female, organic, dsc, tilly, crew_max_rarity_5","I Can Help You",1, 10, 8, 12, 12, , , , , , 590, 225, 160, 340, false,"Tilly",crew_portraits_cm_tilly_sm.png,dsc_tilly_cadet_crew
"Lt. Ash Tyler",7,4, 652,119,218,0,0,0,829,165,342,0,0,0,0,0,0,0,0,0,865,274,792,1013,677,699,0,0,0,642,910,521,0,0,0,898,295,843,1033,736,543,0,0,0,513,734,412,0,0,0,1314,1269,"Human, Federation, Starfleet, Survivalist, Tactician, Marksman, Pilot, Klingon","male, organic, dsc, tyler, voq, crew_max_rarity_4","Full Scale Attack",2, 7, 10, 10, 12, , , , , , 575, 225, 153, 450, false,"Tyler",crew_portraits_cm_tyler_sm.png,dsc_tyler_lt_crew
"Festive Jadzia Dax",5,2, 0,0,0,367,32,125,0,0,0,0,0,0,255,28,69,0,0,0,1268,0,0,1377,0,1264,962,943,806,0,1402,0,1310,0,1129,1293,0,0,1390,0,1286,974,1103,821,0,1414,0,1317,0,1133,1558,1579,"Federation, Starfleet, Exobiology, Astrophysicist, Trill, Gambler, Pilot, Romantic","nonhuman, female, organic, ds9, dax, crew_max_rarity_2","Toruk-DOH!",0, 3, 8, 6, 10, 4, 2, , , , 260, 80, 25, 515, false,"J. Dax",crew_portraits_cm_jadzia_purple_sm.png,dax_jadzia_purple_crew
"Harcourt Fenton Mudd",8,5, 0,0,0,1065,81,189,0,0,0,0,0,0,1264,179,391,0,0,0,584,0,0,529,0,570,414,58,321,0,518,0,321,0,264,1049,0,0,673,0,1030,736,191,620,0,660,0,448,0,384,775,1288,"Human, Civilian, Scoundrel, Crafty, Smuggler, Resourceful, Survivalist, Federation, Playful","male, organic, dsc, mudd, crew_max_rarity_5","Choose Wisely",0, 10, 6, 6, 6, , , 2, , , 415, 340, 50, 500, false,"Mudd",crew_portraits_cm_harry_mudd_sm.png,dsc_mudd_harry_crew
"Sarek",6,4, 592,83,208,338,69,207,0,0,0,0,0,0,801,175,354,0,0,0,575,989,884,368,776,1241,929,415,783,0,931,0,727,0,594,473,1028,954,314,838,1015,729,210,612,0,717,0,514,0,434,1115,912,"Vulcan, Diplomat, Cultural Figure, Communicator, Federation, Telepath, Ambassador","nonhuman, male, organic, sarek, dsc, crew_max_rarity_4","The Vulcan Hello",0, 9, 6, 8, 14, , , , , , 150, 245, 110, 315, false,"Sarek",crew_portraits_cm_sarek_sm.png,dsc_sarek_young_crew
"Gabriel Bell",3,4, 589,152,354,0,0,0,222,181,342,0,0,0,815,102,267,0,0,0,846,603,772,334,653,1232,0,825,0,1076,561,986,776,0,638,559,158,487,257,402,513,0,890,0,489,203,387,832,0,712,1071,333,"Human, Federation, Starfleet, Bajoran, Cultural Figure, Hero, Costumed, Chef, Inspiring, Displaced","male, organic, ds9, sisko, crew_max_rarity_4","Think Again",2, 6, 10, 8, 12, 5, 1, , , , 395, 90, 50, 480, false,"Sisko",crew_portraits_cm_sisko_bell_sm.png,sisko_bell_crew
"Ruk",9,4, 0,0,0,342,74,160,857,102,215,614,82,249,0,0,0,0,0,0,1251,833,845,0,0,369,397,1251,799,157,953,562,891,490,0,1158,976,857,0,0,479,336,1139,693,300,1103,764,898,495,0,1119,1246,"Android, Duelist, Cyberneticist, Hunter","male, tos, nonhuman, artificial_life, ruk, crew_max_rarity_4","Preternatural Hunt",0, 6, 8, 6, 12, 0, 1, , , , 50, 500, 170, 340, false,"Ruk",crew_portraits_cm_ruk_sm.png,ruk_crew
"Defensive Phlox",6,5, 0,0,0,765,174,461,403,147,297,0,0,0,0,0,0,934,261,913,729,1102,0,0,215,159,527,777,29,975,1223,37,0,134,312,363,788,0,0,12,46,266,418,1,640,885,4,0,6,35,670,25,"Denobulan, Civilian, Physician, Romantic, Exobiology","male, nonhuman, organic, ent, phlox, crew_max_rarity_5","Intimidating Prospect",1, 7, 4, 10, 10, 3, 0, 3, , , 450, 275, 142, 250, false,"Phlox",crew_portraits_cm_phlox_defensive_sm.png,phlox_defensive_crew
"C.O.P. Founder Archer",8,4, 653,52,100,0,0,0,0,0,0,0,0,0,790,161,309,0,0,0,954,994,892,398,780,0,0,805,0,0,956,0,748,0,617,1294,1247,1222,582,1120,0,0,691,0,0,819,0,610,0,520,1374,1435,"Federation, Starfleet, Human, Inspiring, Cultural Figure, Communicator","male, organic, ent, archer, crew_max_rarity_4","To Boldly Go",2, 6, 12, 12, 12, 7, 0, , , , 315, 200, 145, 630, false,"Archer",crew_portraits_cm_archer_founder_sm.png,archer_founder_crew
"Colonel Worf",9,4, 601,83,224,0,0,0,0,0,0,0,0,0,848,129,286,0,0,0,929,973,868,361,761,0,0,786,0,0,939,0,732,0,600,954,995,913,428,804,0,0,824,0,0,961,0,753,0,651,1354,1374,"Klingon, Communicator, Counselor, Inspiring","nonhuman, male, organic, tos, colonel_worf, exclusive_voyage, crew_max_rarity_4","Objection!",0, 8, 7, 8, 10, 3, 0, 3, , , 600, 150, 68, 365, false,"Worf",crew_portraits_cm_worf_colonel_sm.png,worf_colonel_crew
"Anbo-jyutsu Riker",6,4, 624,124,263,0,0,0,747,120,255,0,0,0,0,0,0,0,0,0,869,349,802,1021,684,769,0,0,0,705,997,599,0,0,0,805,371,736,946,640,781,0,0,0,739,1012,657,0,0,0,1373,1345,"Human, Federation, Starfleet, Duelist, Pilot, Maverick, Romantic, Gambler, Athlete, Casual","male, organic, tng, riker, crew_max_rarity_4","The Ultimate Evolution",1, 7, 14, 12, 14, 5, 0, , , , 315, 230, 135, 415, false,"Riker",crew_portraits_cm_riker_anbo_sm.png,riker_anbo_crew
"Torchbearer Rejac",7,5, 959,146,363,0,0,0,1125,292,580,0,0,0,0,0,0,0,0,0,570,85,507,773,393,311,0,0,0,306,508,201,0,0,0,549,36,475,725,392,115,0,0,0,121,216,83,0,0,0,765,352,"Klingon, Cultural Figure, Brutal, Duelist, Inspiring","evsuit, nonhuman, male, organic, dsc, rejac, crew_max_rarity_5","Sacred Duty!",0, 10, 8, 8, 8, , , , 1, 4, 800, 250, 175, 240, false,"Rejac",crew_portraits_cm_torchbearer_sm.png,dsc_rejac_torchbearer_crew
"Klingon O'Brien",6,4, 0,0,0,0,0,0,432,28,60,589,104,229,746,167,372,0,0,0,0,1182,867,920,0,1228,656,817,0,476,555,982,166,509,632,0,1281,851,705,0,1339,615,564,0,673,524,1078,104,492,418,1136,1159,"Starfleet, Federation, Klingon, Human, Jury Rigger, Undercover Operative, Duelist, Veteran, Saboteur","male, organic, ds9, obrien, crew_max_rarity_4","House of Konjah",2, 8, 6, 4, 10, 3, 0, 2, , , 1380, 240, 110, 690, false,"O'Brien",crew_portraits_cm_obrien_klingon_sm.png,obrien_klingon_crew
"Armed Philippa Georgiou",7,4, 512,157,351,0,0,0,355,84,170,0,0,0,904,109,159,0,0,0,920,649,860,364,754,1225,0,795,0,1071,539,980,742,0,608,550,372,476,367,393,1050,0,1071,0,958,719,878,1040,0,886,1096,1014,"Human, Federation, Starfleet, Inspiring, Diplomat","female, organic, dsc, georgiou, crew_max_rarity_4","Starfleet Doesn't Fire First",1, 5, 4, 10, 8, , , , , , 550, 200, 100, 150, true,"Georgiou",crew_portraits_cm_georgiou_rifle_sm.png,dsc_georgiou_rifle_crew
"Admiral Nechayev",9,5, 888,266,706,0,0,0,498,82,202,0,0,0,784,188,411,0,0,0,404,245,359,141,267,1046,0,765,0,957,326,843,712,0,583,70,64,53,12,39,987,0,462,0,907,214,830,397,0,339,706,59,"Human, Federation, Starfleet, Tactician, Veteran, Diplomat","female, organic, tng, necayev, crew_max_rarity_5","Stand Down",0, 8, 4, 10, 16, 5, 0, , , , 565, 100, 200, 400, false,"Nechayev",crew_portraits_cm_necayevadmiral_sm.png,necayev_admiral_crew
"Niners Sisko",6,5, 1150,143,317,0,0,0,1046,96,207,0,0,0,0,0,0,0,0,0,396,132,356,630,260,536,0,0,0,498,767,372,0,0,0,654,368,580,807,490,933,0,0,0,865,1126,791,0,0,0,824,1342,"Human, Federation, Bajoran, Cultural Figure, Starfleet, Athlete, Costumed, Inspiring, Desperate, Casual, Playful","male, organic, ds9, sisko, niners, crew_max_rarity_5","Hey Batter!",2, 8, 14, 10, 12, 4, 0, , , , 450, 245, 122, 480, false,"Sisko",crew_portraits_cm_sisko_niners_sm.png,sisko_niners_crew
"Tactical Michael Burnham",6,4, 669,62,171,0,0,0,756,196,397,338,47,131,0,0,0,0,0,0,899,305,504,1039,722,722,978,0,0,350,936,544,1263,771,0,1142,312,690,1212,977,397,946,0,0,189,596,290,1226,762,0,1117,1074,"Federation, Starfleet, Astrophysicist, Xenoanthropology, Innovator, Human, Resourceful","female, organic, dsc, burnham, crew_max_rarity_4","I Am Trying To Save You",0, 8, 6, 10, 8, , , 2, , , 675, 100, 185, 490, false,"Burnham",crew_portraits_cm_burnham_tactical_sm.png,dsc_burnham_pistol_crew
"Buster Kincaid Kim",8,4, 0,0,0,371,65,143,769,171,356,551,104,245,0,0,0,0,0,0,1221,831,900,0,0,352,426,1231,782,171,949,558,935,521,0,1216,650,819,0,0,208,344,1192,744,119,708,382,860,471,0,1154,916,"Starfleet, Federation, Human, Hero, Costumed","male, organic, voy, kim, crew_max_rarity_4","We're Going Down!",1, 7, 14, 10, 18, 2, 0, , , , 550, 200, 60, 425, false,"Kim",crew_portraits_cm_buster_kinkaid_sm.png,kim_buster_crew
"Honey Bare Jadzia",9,5, 0,0,0,1147,203,483,0,0,0,916,149,360,641,33,73,0,0,0,353,0,577,1094,0,371,40,133,207,573,1137,0,150,292,794,283,0,477,1383,0,271,18,229,177,509,1409,0,356,243,1127,529,575,"Hologram, Geologist, Romantic, Desperate, Trill","nonhuman, artificial_life, female, ds9, dax, crew_max_rarity_5","I'm Sorry Doctor",2, 10, 12, 12, 12, , , , 1, 2, 500, 75, 180, 275, false,"J. Dax",crew_portraits_cm_jadzia_honey_bare_sm.png,dax_honey_bare_crew
"Dr. Hugh Culber",9,5, 0,0,0,1103,121,284,0,0,0,0,0,0,0,0,0,1371,156,390,470,0,0,0,117,465,355,545,2,0,0,151,0,69,200,794,0,0,0,358,752,535,844,60,0,0,369,0,221,413,736,1186,"Human, Physician, Romantic, Federation, Starfleet","male, organic, dsc, culber, crew_max_rarity_5","Surgical Precision",2, 10, 6, 6, 10, , , 2, , , 600, 240, 7, 425, false,"Culber",crew_portraits_cm_hugh_culber_sm.png,dsc_culber_doctor_crew
"Commander Chapel",9,4, 0,0,0,739,76,257,0,0,0,0,0,0,245,149,301,546,99,350,810,0,0,1308,757,787,574,490,115,0,1333,714,1220,503,454,925,0,0,867,552,886,626,233,119,0,886,561,673,360,107,1226,720,"Federation, Starfleet, Human, Physician, Veteran","female, organic, tos, chapel, crew_max_rarity_4","Doctor's Orders",2, 7, 8, 8, 16, 6, 0, , , , 1450, 75, 155, 400, false,"Chapel",crew_portraits_cm_chapel_commander_sm.png,chapel_commander_crew
"Leonardo da Vinci",6,5, 0,0,0,1229,80,228,0,0,0,1092,177,354,0,0,0,366,161,483,389,0,367,0,846,406,28,482,58,393,0,803,425,22,833,972,0,444,0,212,944,123,1016,59,478,0,221,492,5,275,442,243,"Hologram, Prodigy, Inspiring, Innovator, Civilian, Human, Artist, Cultural Figure, Astrophysicist","male, organic, voy, davinci, crew_max_rarity_5","Poor is the Pupil",2, 6, 6, 8, 8, 6, 0, 2, , , 1815, 330, 83, 175, false,"Leonardo",crew_portraits_cm_davinci_sm.png,davinci_crew
