crew, tier, rarity, CMD_core, CMD_min, CMD_max, SCI_core, SCI_min, SCI_max, SEC_core, SEC_min, SEC_max, ENG_core, ENG_min, ENG_max, DIP_core, DIP_min, DIP_max, MED_core, MED_min, MED_max, V_CMD_SCI, V_CMD_SEC, V_CMD_ENG, V_CMD_DIP, V_CMD_MED, V_SCI_SEC, V_SCI_ENG, V_SCI_DIP, V_SCI_MED, V_SEC_ENG, V_SEC_DIP, V_SEC_MED, V_ENG_DIP, V_ENG_MED, V_DIP_MED, G_CMD_SCI, G_CMD_SEC, G_CMD_ENG, G_CMD_DIP, G_CMD_MED, G_SCI_SEC, G_SCI_ENG, G_SCI_DIP, G_SCI_MED, G_SEC_ENG, G_SEC_DIP, G_SEC_MED, G_ENG_DIP, G_ENG_MED, G_DIP_MED, voyage_rank, gauntlet_rank, traits, hidden_traits, action_name, action_bonus_type, action_bonus_amount, action_initial_cooldown, action_duration, action_cooldown, bonus_ability, trigger, uses_per_battle, penalty_type, penalty_amount, accuracy, crit_bonus, crit_chance, evasion, charge_phases, short_name, image_name, symbol
"Investigator Odo",7,1, 0,0,0,0,0,0,217,37,171,0,0,0,0,0,0,0,0,0,0,1265,0,0,0,1320,0,0,0,1156,1394,1064,0,0,0,0,1175,0,0,0,1178,0,0,0,1057,1315,971,0,0,0,1600,1594,"Changeling, Cardassian, Investigator, Interrogator, Shapeshifter","nonhuman, male, organic, ds9, odo, crew_max_rarity_1","Collaboration",2, 1, 20, 14, 10, , , , , , 400, 115, 67, 265, false,"Odo",crew_portraits_cm_odooccupation_sm.png,odo_occupation_crew
"Constable Odo",5,3, 317,107,225,0,0,0,523,27,85,0,0,0,0,0,0,0,0,0,1216,814,1140,1286,1033,1122,0,0,0,1009,1253,904,0,0,0,902,787,854,1041,745,1320,0,0,0,1148,1401,1062,0,0,0,1491,1508,"Changeling, Bajoran, Constable, Investigator, Interrogator, Shapeshifter","nonhuman, male, organic, ds9, odo, crew_max_rarity_3","Justice",0, 6, 10, 12, 16, , , , 3, 800, 520, 300, 75, , false,"Odo",crew_portraits_cm_odostandard_sm.png,odo_constable_crew
"Ensign Ro",10,2, 322,46,132,0,0,0,0,0,0,0,0,0,0,0,0,0,0,0,1302,1250,1231,1344,1123,0,0,0,0,0,0,0,0,0,0,1262,1223,1190,1311,1081,0,0,0,0,0,0,0,0,0,0,1595,1598,"Starfleet, Bajoran, Resourceful","nonhuman, female, organic, tng, ro, crew_max_rarity_2","Separate Ways",0, 4, 3, 10, 5, , , 2, , , 130, 210, 13, 200, false,"Ro",crew_portraits_cm_roensign_sm.png,ro_ensign_crew
"Shinzon",9,5, 819,94,241,0,0,0,938,183,435,0,0,0,546,176,390,0,0,0,780,186,708,362,586,497,0,896,0,453,163,331,861,0,721,899,201,849,235,742,347,0,513,0,341,59,238,453,0,389,716,200,"Human, Clone, Reman, Villain, Romulan, Brutal, Crafty, Politician, Veteran, Vengeful","male, organic, tng, shinzon, crew_max_rarity_5","Destiny Complete",0, 7, 14, 3, 14, 1, 2, , , , 1325, 545, 365, 1050, false,"Shinzon",crew_portraits_cm_shinzon_sm.png,shinzon_crew
"Will Riker",5,1, 251,42,110,0,0,0,125,22,74,0,0,0,0,0,0,0,0,0,1318,1170,1253,1367,1142,1350,0,0,0,1177,1423,1090,0,0,0,1292,1090,1221,1340,1119,1335,0,0,0,1164,1413,1074,0,0,0,1587,1578,"Human, Federation, Starfleet, Maverick, Gambler, Romantic","male, organic, tng, riker, crew_max_rarity_1","Poker Face",0, 1, 8, 10, 14, 4, 0, , , , 455, , 425, 340, false,"Riker",crew_portraits_cm_rikers1_sm.png,riker_s1_commander_crew
"Commander Riker",1,2, 279,78,191,0,0,0,124,29,89,0,0,0,290,22,64,0,0,0,1300,1127,1229,1065,1121,1346,0,1302,0,1173,1281,1086,1293,0,1117,1036,870,1000,995,882,1317,0,1335,0,1147,1326,1060,1327,0,1143,1529,1490,"Human, Federation, Starfleet, Pilot, Maverick, Gambler, Romantic, Playful","male, organic, tng, riker, crew_max_rarity_2","Liase",0, 2, 8, 10, 14, 5, 0, , , , 645, 50, 295, 275, false,"Riker",crew_portraits_cm_rikerpoker_sm.png,riker_s2_commander_crew
"Edith Keeler",8,4, 0,0,0,0,0,0,0,0,0,0,0,0,453,166,339,591,187,590,0,0,0,1095,596,0,0,983,447,0,1138,595,952,404,182,0,0,0,744,113,0,0,616,121,0,747,130,546,54,16,1404,627,"Civilian, Caregiver, Inspiring, Cultural Figure, Romantic, Human","female, organic, tos, keeler, crew_max_rarity_4","A Life Worth Living",1, 7, 8, 10, 8, , , , , , 690, 25, 52, 440, false,"Keeler",crew_portraits_cm_edithkeeler_sm.png,keeler_crew
"Ensign Tuvok",7,1, 0,0,0,181,51,197,0,0,0,0,0,0,138,33,74,0,0,0,1336,0,0,1404,0,1330,1006,1205,843,0,1420,0,1337,0,1156,1116,0,0,1380,0,1082,800,922,661,0,1406,0,1305,0,1123,1589,1552,"Vulcan, Federation, Starfleet, Telepath","nonhuman, male, organic, voy, tuvok, crew_max_rarity_1","Memory",0, 1, 1, 14, 10, , , , , , 103, 60, 135, 375, false,"Tuvok",crew_portraits_cm_tuvokensign_sm.png,tuvok_ensign_crew
"Security Chief Tuvok",4,3, 291,53,161,145,45,149,445,85,201,0,0,0,0,0,0,0,0,0,1087,849,1242,1346,1132,821,1016,1337,853,1007,1252,902,0,0,0,774,683,1140,1255,1025,604,928,1226,785,903,1167,826,0,0,0,1469,1392,"Vulcan, Federation, Starfleet, Telepath, Tactician, Investigator","nonhuman, male, organic, voy, tuvok, crew_max_rarity_3","Contingency Plan",0, 4, 10, 12, 16, 5, 0, , , , 465, 50, , 300, false,"Tuvok",crew_portraits_cm_tuvokrifle_sm.png,tuvok_rifle_crew
"Major Kira",6,2, 273,37,126,0,0,0,304,60,176,0,0,0,0,0,0,0,0,0,1309,952,1245,1354,1133,1282,0,0,0,1123,1370,1030,0,0,0,1278,851,1204,1322,1100,1096,0,0,0,991,1254,906,0,0,0,1552,1532,"Bajoran, Veteran, Resourceful","nonhuman, female, organic, ds9, kira, crew_max_rarity_2","Obstinance",0, 2, 0, 10, 14, 6, 0, , , , 295, 150, 5, , true,"Kira",crew_portraits_cm_kirashorthair_sm.png,kira_major_shorthair_crew
"Mirror Intendant Kira",7,5, 512,183,363,0,0,0,1052,272,542,0,0,0,946,67,184,0,0,0,904,184,844,324,731,377,0,766,0,355,73,243,713,0,584,492,39,422,330,340,145,0,1108,0,164,93,102,1081,0,923,549,148,"Bajoran, Cardassian, Klingon, Villain, Klingon-Cardassian Alliance, Brutal, Mirror Universe, Crafty","nonhuman, female, organic, ds9, kira, crew_max_rarity_5","Instability",0, 6, 6, 10, 12, 4, 0, , , , 915, 225, 90, 1525, true,"Kira",crew_portraits_cm_kiraintendant_sm.png,kira_mirror_crew
"Security Chief Worf",7,2, 205,57,144,0,0,0,326,61,145,0,0,0,0,0,0,0,0,0,1333,987,1263,1379,1152,1273,0,0,0,1120,1363,1023,0,0,0,1220,837,1160,1276,1047,1181,0,0,0,1060,1319,974,0,0,0,1559,1526,"Klingon, Federation, Starfleet, Duelist, Investigator","nonhuman, male, organic, tng, worf, crew_max_rarity_2","They Have No Honor",2, 4, 8, 10, 12, , , , 1, 2, 165, 280, 95, 155, false,"Worf",crew_portraits_cm_worf_sm.png,worf_security_chief_crew
"Defiant Commander Worf",8,4, 364,241,488,0,0,0,609,179,394,0,0,0,0,0,0,0,0,0,960,452,901,1085,785,789,0,0,0,727,1009,617,0,0,0,217,53,182,418,126,437,0,0,0,410,640,313,0,0,0,1415,511,"Klingon, Federation, Starfleet, Duelist, Tactician, Veteran","nonhuman, male, organic, ds9, worf, crew_max_rarity_4","Good Day to Die",2, 6, 12, 12, 12, 4, 0, , 1, 2, 690, 645, 325, 205, false,"Worf",crew_portraits_cm_worfdefiant_sm.png,worf_defiant_commander_crew
"Mirror Regent Worf",8,5, 861,294,589,0,0,0,1062,175,357,0,0,0,0,0,0,0,0,0,488,121,425,699,320,428,0,0,0,396,634,286,0,0,0,101,31,80,247,53,498,0,0,0,476,699,372,0,0,0,805,299,"Klingon, Cardassian, Tactician, Villain, Brutal, Klingon-Cardassian Alliance, Mirror Universe","nonhuman, male, organic, ds9, worf, crew_max_rarity_5","Position of Strength",0, 9, 8, 8, 10, , , , , , 300, 980, 390, , false,"Worf",crew_portraits_cm_worfmirror_sm.png,worf_mirror_crew
"Yeoman Rand",9,1, 164,15,58,0,0,0,0,0,0,0,0,0,117,19,60,0,0,0,1351,1292,1290,1353,1178,0,0,1347,0,0,1425,0,1344,0,1159,1348,1290,1288,1341,1173,0,0,1337,0,0,1420,0,1332,0,1147,1597,1601,"Federation, Starfleet, Human","female, organic, tos, rand, crew_max_rarity_1","Signature Required",2, 2, 8, 10, 12, , , , 1, 1, 375, , , 180, false,"Rand",crew_portraits_cm_randyeoman_sm.png,rand_yeoman_crew
"The Duras Sisters",9,4, 311,83,205,0,0,0,658,150,385,0,0,0,464,170,341,0,0,0,1258,567,1186,819,1080,773,0,976,0,711,421,605,939,0,788,996,315,960,331,844,494,0,603,0,474,110,368,529,0,446,1238,452,"Klingon, Scoundrel, Villain, Vengeful","nonhuman, female, organic, tng, betor, lursa, exclusive_fusion, crew_max_rarity_4","The Power of Two",0, 9, 10, 20, 12, , , 1, , , 350, 110, 190, 500, false,"Duras Sisters",crew_portraits_cm_duras_sisters_sm.png,duras_sisters_crew
"Persis",8,2, 0,0,0,0,0,0,253,94,250,0,0,0,303,39,88,0,0,0,0,1242,0,1350,0,1283,0,1292,0,1124,1068,1031,1284,0,1108,0,930,0,1364,0,844,0,1298,0,798,800,714,1287,0,1108,1546,1492,"Human, Augments, Engineered, Survivalist, Tactician","nonhuman, female, organic, ent, persis, crew_max_rarity_2","Augmented Strength",0, 2, 6, 10, 6, 7, 0, 2, , , 240, 330, 300, , false,"Persis",crew_portraits_cm_persis_sm.png,persis_crew
"Telek R'Mor",7,2, 0,0,0,347,52,194,119,8,44,0,0,0,263,30,113,0,0,0,1235,1298,0,1360,0,1099,932,912,787,1178,1315,1091,1294,0,1118,1119,1293,0,1349,0,962,803,864,664,1176,1338,1089,1271,0,1099,1524,1515,"Romulan, Astrophysicist","nonhuman, male, organic, voy, rmor, crew_max_rarity_2","Solitary Survey",1, 3, 10, 12, 10, 0, 2, , , , 405, 50, 3, 180, false,"R'Mor",crew_portraits_cm_telekrmor_sm.png,rmor_voyager_crew
"KDF Gowron",10,4, 375,85,222,0,0,0,296,100,256,0,0,0,641,173,418,0,0,0,1168,847,1098,599,991,1237,0,846,0,1082,592,990,805,0,658,953,460,912,238,803,821,0,479,0,774,168,693,416,0,357,1307,648,"Klingon, Duelist, Diplomat, Politician","nonhuman, male, organic, tng, gowron, crew_max_rarity_4","What Can Be Done",1, 6, 14, 10, 14, 0, 2, , , , 625, 465, 85, 1000, false,"Gowron",crew_portraits_cm_gowronyoung_sm.png,gowron_kdf_crew
"Third Remata'Klan",7,3, 410,42,84,0,0,0,467,85,185,0,0,0,0,0,0,0,0,0,1224,807,1155,1294,1044,1104,0,0,0,993,1236,884,0,0,0,1315,853,1244,1360,1134,1013,0,0,0,925,1191,848,0,0,0,1488,1534,"Jem'hadar, Dominion, Duelist, Tactician","nonhuman, male, organic, ds9, remataklan, crew_max_rarity_3","Victory is Life",0, 3, 0, 6, 8, 4, 4, , , , 690, 395, 597, 600, true,"Remata'Klan",crew_portraits_cm_remataklan_sm.png,remataklan_crew
"Ensign Chapel",10,1, 0,0,0,0,0,0,0,0,0,0,0,0,0,0,0,214,34,152,0,0,0,0,1155,0,0,0,842,0,0,1071,0,802,1133,0,0,0,0,1075,0,0,0,791,0,0,1009,0,757,1051,1606,1597,"Human, Federation, Starfleet, Nurse","female, organic, tos, chapel, crew_max_rarity_1","Administer Prescription",2, 1, 6, 10, 10, , , , , , 130, , 40, 100, false,"Chapel",crew_portraits_cm_chapelensign_sm.png,chapel_ensign_crew
"Ensign Ogawa",8,1, 0,0,0,0,0,0,0,0,0,0,0,0,0,0,0,213,34,166,0,0,0,0,1149,0,0,0,840,0,0,1068,0,798,1127,0,0,0,0,1064,0,0,0,769,0,0,997,0,747,1031,1605,1595,"Human, Federation, Starfleet, Nurse","female, organic, tng, ogawa, crew_max_rarity_1","Report to Sickbay",2, 1, 6, 1, 8, 2, 0, 1, , , 170, , 35, 105, false,"Ogawa",crew_portraits_cm_ogawaensign_sm.png,ogawa_ensign_crew
"Wesley Crusher",8,1, 0,0,0,218,43,149,0,0,0,174,32,78,0,0,0,0,0,0,1327,0,1285,0,0,1328,872,1316,838,1171,0,0,1330,813,0,1249,0,1260,0,0,1237,682,1227,788,1151,0,0,1302,801,0,1583,1570,"Human, Federation, Civilian, Prodigy","male, organic, tng, wesley, crew_max_rarity_1","Study",1, 2, 8, 10, 12, , , , 0, 1, 215, 125, 70, 55, false,"Wesley",crew_portraits_cm_wesleysweater_sm.png,wesley_sweater_crew
"Ensign Crusher",9,3, 176,11,31,426,83,229,0,0,0,347,34,78,0,0,0,0,0,0,908,1293,1074,1402,1179,1139,559,1166,715,1138,0,0,1278,783,0,882,1294,1217,1408,1181,930,517,1003,565,1149,0,0,1299,799,0,1474,1498,"Human, Federation, Starfleet, Prodigy, Warp Theorist","male, organic, tng, wesley, crew_max_rarity_3","Rewire",2, 4, 6, 8, 10, 6, 0, , , , 290, , , 190, false,"Wesley",crew_portraits_cm_wesley_sm.png,wesley_full_ensign_crew
"Acting Ensign Crusher",9,2, 114,29,58,258,56,160,0,0,0,251,53,148,0,0,0,0,0,0,1170,1297,1112,1410,1183,1311,678,1294,830,1150,0,0,1289,790,0,975,1282,961,1394,1166,1171,519,1176,724,1073,0,0,1189,737,0,1536,1480,"Human, Federation, Starfleet, Prodigy, Resourceful","male, organic, tng, wesley, crew_max_rarity_2","Invention",1, 4, 3, 6, 6, , , 2, , , 205, 50, 25, 165, false,"Wesley",crew_portraits_cm_wesleyensign_sm.png,wesley_acting_ensign_crew
"Formal Dress Wesley Crusher",9,4, 0,0,0,662,173,422,0,0,0,270,108,230,481,160,342,0,0,0,793,0,1207,1079,0,767,306,290,449,1119,1122,0,631,770,784,450,0,839,749,0,427,80,54,261,803,753,0,118,488,459,1232,307,"Human, Federation, Starfleet, Prodigy, Warp Theorist","male, organic, tng, wesley, crew_max_rarity_4","Duty to the Truth",1, 9, 4, 10, 12, , , , , , 300, 500, 30, 450, false,"Wesley",crew_portraits_cm_wesleydressuniform_sm.png,wesley_formal_dress_crew
"Wrathful Khan",7,5, 1040,206,421,0,0,0,1145,72,143,376,140,288,0,0,0,0,0,0,416,124,120,652,275,489,852,0,0,142,705,321,1140,684,0,345,297,29,566,219,1147,502,0,0,305,1301,954,712,374,0,660,605,"Human, Augments, Engineered, Villain, Cultural Figure, Tactician, Resourceful, Survivalist, Brutal, Vengeful","nonhuman, male, organic, tos, khan, crew_max_rarity_5","I Stab at Thee",2, 9, 12, 5, 12, 1, 0, , , , 640, 595, 345, 850, false,"Khan",crew_portraits_cm_khan_sm.png,khan_wok_crew
"Tailor Garak",5,3, 0,0,0,0,0,0,502,44,126,161,22,44,395,83,219,0,0,0,0,1125,1292,1234,0,1116,1023,1173,0,781,874,898,924,815,990,0,1228,1290,1094,0,1262,1025,1019,0,992,804,1020,831,817,827,1447,1469,"Cardassian, Undercover Operative, Scoundrel, Interrogator, Civilian","nonhuman, male, organic, ds9, garak, crew_max_rarity_3","Cutting Cloth",1, 5, 8, 12, 12, , , , , , 125, 230, 20, 405, false,"Garak",crew_portraits_cm_garaktailor_sm.png,garak_tailor_crew
"Bartender Quark",4,1, 110,25,77,0,0,0,81,15,57,0,0,0,211,36,150,0,0,0,1356,1282,1296,1310,1181,1352,0,1319,0,1179,1373,1092,1311,0,1131,1332,1224,1267,1121,1153,1345,0,1233,0,1172,1219,1085,1216,0,1050,1575,1548,"Ferengi, Bartender, Civilian, Scoundrel, Gambler, Merchant","nonhuman, male, organic, ds9, quark, crew_max_rarity_1","Hospitality",1, 2, 8, 10, 12, , , , 2, 1, 165, 10, 10, 140, false,"Quark",crew_portraits_cm_quarkbartender_sm.png,quark_s1_bartender_crew
"Richard Castillo",8,3, 487,109,227,286,57,187,0,0,0,0,0,0,0,0,0,0,0,0,740,1075,1006,1150,885,1299,989,1287,823,0,0,0,0,0,0,459,945,847,1036,739,1097,812,1125,673,0,0,0,0,0,0,1497,1452,"Human, Hero, Pilot, Starfleet, Federation, Displaced, Romantic","male, organic, castillo, tng, crew_max_rarity_3","Self Sacrifice",0, 5, 12, 12, 10, 7, 0, , 1, 2, 650, 265, 129, 585, false,"Castillo",crew_portraits_cm_richardcastillo_sm.png,castillo_lieutenant_crew
"Writer Jake Sisko",10,3, 0,0,0,0,0,0,0,0,0,0,0,0,451,70,198,0,0,0,0,0,0,1220,0,0,0,1155,0,0,1257,0,1134,0,974,0,0,0,1148,0,0,0,1069,0,0,1199,0,1039,0,884,1574,1576,"Human, Federation, Civilian, Writer, Gambler, Romantic","male, organic, ds9, jake, crew_max_rarity_3","Construct Story",2, 3, 0, 8, 10, 6, 0, , , , 995, 350, 47, 640, true,"Jake",crew_portraits_cm_jakewriter_sm.png,jake_writer_crew
"CMO Crusher",10,2, 0,0,0,0,0,0,0,0,0,0,0,0,0,0,0,290,52,174,0,0,0,0,1130,0,0,0,826,0,0,1048,0,785,1103,0,0,0,0,1006,0,0,0,702,0,0,938,0,704,978,1596,1590,"Human, Starfleet, Federation, Physician, Caregiver, Cyberneticist","female, organic, tng, crusher, crew_max_rarity_2","Doctor's Calluses",2, 3, 6, 10, 10, , , , , , 185, , 35, 155, false,"Crusher",crew_portraits_cm_crusherwithlabcoat_sm.png,crusher_labcoat_crew
"Commando Crusher",6,3, 0,0,0,182,76,200,308,93,193,0,0,0,0,0,0,510,44,132,1322,1213,0,0,969,878,1001,1313,460,1096,1342,557,0,680,966,1037,1037,0,0,1090,458,727,1064,413,904,1168,503,0,767,1066,1445,1366,"Human, Starfleet, Federation, Physician, Cyberneticist, Undercover Operative","female, organic, tng, crusher, crew_max_rarity_3","Repel Disease",0, 3, 6, 3, 12, 1, 0, , , , 575, , 370, 500, false,"Crusher",crew_portraits_cm_crusherblackcommandouniform_sm.png,crusher_black_commando_uniform_crew
"Dr. Crusher",10,4, 275,38,110,0,0,0,437,90,201,0,0,0,0,0,0,736,123,300,1310,868,1246,1355,329,1123,0,0,454,1010,1255,222,0,412,659,1297,793,1227,1342,329,963,0,0,439,895,1154,160,0,394,646,1331,1261,"Human, Starfleet, Federation, Physician, Cyberneticist","female, organic, tng, crusher, crew_max_rarity_4","Neutralize Disease",1, 7, 12, 12, 12, 4, 4, , , , 740, 250, 370, 500, false,"Crusher",crew_portraits_cm_crusherfromfirstcontact_sm.png,crusher_first_contact_crew
"Holonovel Doctor",9,4, 0,0,0,512,50,137,0,0,0,0,0,0,0,0,0,799,69,244,1135,0,0,0,600,1111,840,1135,182,0,0,600,0,407,655,1255,0,0,0,807,1243,934,1235,330,0,0,781,0,541,807,1422,1485,"Hologram, Human, Federation, Starfleet, Physician, Musician, Scoundrel","nonhuman, male, artificial_life, voy, emh, crew_max_rarity_4","Suggested Treatment",0, 7, 12, 12, 12, , , , , , 365, 370, 205, 525, false,"Doctor",crew_portraits_cm_doctorgolfclub_sm.png,emh_authorauthor_crew
"Mobile Doctor",10,5, 0,0,0,809,106,209,0,0,0,0,0,0,393,137,435,1191,110,334,789,0,0,1130,247,763,563,315,33,0,1166,267,993,156,74,956,0,0,669,565,923,658,161,134,0,652,576,444,369,72,725,503,"Hologram, Human, Federation, Starfleet, Musician, Physician","nonhuman, male, artificial_life, voy, emh, crew_max_rarity_5","House Call",2, 9, 12, 12, 12, , , , , , 1825, 600, , 600, false,"Doctor",crew_portraits_cm_emhmobile_sm.png,emh_mobileholoemitter_crew
"Comm Officer Uhura",6,1, 0,0,0,0,0,0,0,0,0,0,0,0,258,28,89,0,0,0,0,0,0,1372,0,0,0,1311,0,0,1397,0,1303,0,1123,0,0,0,1371,0,0,0,1308,0,0,1399,0,1296,0,1115,1602,1606,"Federation, Starfleet, Human, Musician, Communicator","female, organic, tos, uhura, crew_max_rarity_1","Incoming Message",2, 2, 8, 10, 12, , , , 1, 1, 320, , , 495, false,"Uhura",crew_portraits_cm_uhurared_sm.png,uhura_red_crew
"Commander Uhura",10,4, 459,128,299,0,0,0,0,0,0,0,0,0,592,198,429,0,0,0,1028,1056,977,522,859,0,0,855,0,0,1010,0,814,0,665,738,813,660,138,576,0,0,416,0,0,526,0,344,0,290,1420,975,"Federation, Starfleet, Human, Musician, Communicator","female, organic, tos, uhura, crew_max_rarity_4","Hailing Frequencies",0, 8, 12, 26, 12, , , 1, , , 1165, , 75, 790, false,"Uhura",crew_portraits_cm_uhurawrathofkhan_sm.png,uhura_wrathofkhan_crew
"Dancing Uhura",9,5, 1026,84,195,0,0,0,0,0,0,0,0,0,1185,193,393,0,0,0,640,745,579,106,458,0,0,441,0,0,562,0,366,0,313,1019,1046,985,271,864,0,0,486,0,0,631,0,424,0,363,798,1256,"Human, Federation, Starfleet, Communicator, Casual, Musician, Artist","female, organic, tos, uhura, original, crew_max_rarity_5","Take The Lead",0, 8, 10, 3, 14, 1, 1, , , , 465, 260, 60, 400, false,"Uhura",crew_portraits_cm_uhura_dancing_sm.png,uhura_dancing_crew
"First Maje Culluh",9,3, 466,93,223,0,0,0,307,42,138,0,0,0,0,0,0,0,0,0,1112,839,1050,1198,937,1301,0,0,0,1139,1380,1046,0,0,0,935,687,889,1060,779,1249,0,0,0,1099,1351,1013,0,0,0,1505,1481,"Kazon, Scoundrel, Vengeful","nonhuman, male, organic, voy, culluh, crew_max_rarity_3","Nistrim Supremacy",2, 3, 6, 10, 10, 8, 4, , , , 665, 325, 133, 390, false,"Culluh",crew_portraits_cm_jalculluh_sm.png,culluh_crew
"KDF Alexander",7,2, 137,19,79,0,0,0,331,64,148,145,16,72,0,0,0,0,0,0,1353,1103,1243,1405,1180,1268,1024,0,0,973,1352,1013,1338,817,0,1335,991,1180,1387,1156,1158,1019,0,0,877,1307,959,1324,811,0,1543,1533,"Human, Klingon","male, organic, ds9, alexander, nonhuman, crew_max_rarity_2","Beginner's Luck",1, 3, 10, 12, 10, 5, 2, , , , 130, 200, 62, 15, false,"Alexander",crew_portraits_cm_alexanderkdf_sm.png,alexander_kdf_crew
"Commando Shran",9,4, 673,114,239,0,0,0,592,89,182,0,0,0,318,144,282,0,0,0,838,479,762,631,643,910,0,1178,0,835,713,733,1164,0,994,864,520,802,362,694,1011,0,809,0,922,404,847,730,0,634,1234,981,"Andorian, Tactician, Inspiring, Imperial Guard","nonhuman, male, organic, ent, shran, crew_max_rarity_4","Debt Owed",0, 8, 6, 8, 10, , , 3, , , 390, 575, 288, 350, false,"Shran",crew_portraits_cm_shrancommando_sm.png,shran_commando_crew
"Ushaan Shran",10,5, 989,83,164,0,0,0,1076,170,348,0,0,0,424,134,288,0,0,0,694,144,639,403,505,424,0,1086,0,392,200,282,1071,0,903,1100,367,1057,504,940,517,0,814,0,493,169,395,736,0,639,702,762,"Andorian, Duelist, Romantic, Imperial Guard","nonhuman, male, organic, ent, shran, crew_max_rarity_5","Debt Owed",0, 9, 6, 8, 10, , , 3, , , 1440, 565, 483, 390, false,"Shran",crew_portraits_cm_shrandueling_sm.png,shran_dueling_crew
"Fencing Sulu",9,4, 444,99,249,385,36,92,609,203,448,0,0,0,0,0,0,0,0,0,735,498,1061,1208,948,403,954,1255,803,708,1000,602,0,0,0,623,176,822,1009,711,170,1000,1299,840,293,462,195,0,0,0,1283,835,"Human, Federation, Starfleet, Pilot, Resourceful, Duelist, Athlete","male, organic, tos, sulu, crew_max_rarity_4","Parry Attack",0, 6, 12, 8, 12, 6, 4, , , , 415, , 225, 225, false,"Sulu",crew_portraits_cm_sulufencing_sm.png,sulu_fencing_crew
"Morn",9,3, 0,0,0,0,0,0,359,70,174,0,0,0,418,121,295,0,0,0,0,1181,0,1191,0,1226,0,1101,0,1072,900,981,1085,0,917,0,1097,0,915,0,1075,0,823,0,972,459,893,752,0,650,1481,1408,"Lurian, Courier, Duelist, Civilian, Gambler, Smuggler","nonhuman, male, organic, ds9, morn, crew_max_rarity_3","Drinking Spot",0, 3, 0, 8, 8, , , , 1, 2, 150, 285, 57, 655, true,"Morn",crew_portraits_cm_morn_sm.png,morn_crew
"Seven in Blue",9,2, 0,0,0,294,51,209,0,0,0,278,53,130,0,0,0,0,0,0,1295,0,1244,0,0,1288,632,1276,816,1147,0,0,1286,788,0,1085,0,1182,0,0,1058,494,1094,639,1091,0,0,1217,756,0,1549,1513,"Human, Borg, Civilian, Federation, Astrophysicist","nonhuman, female, organic, voy, seven, crew_max_rarity_2","Ignore Irrelevancies",1, 2, 8, 10, 14, 4, 0, , , , 75, 50, 310, 170, false,"Seven",crew_portraits_cm_seven_of_nine_sm.png,seven_allblue_crew
"Seven of Nine",7,5, 0,0,0,785,247,791,0,0,0,854,225,454,514,89,183,0,0,0,499,0,543,1149,0,488,51,193,286,551,1188,0,156,274,859,62,0,230,1140,0,60,3,14,42,266,1192,0,74,90,881,696,39,"Human, Borg, Civilian, Federation, Astrophysicist","nonhuman, female, organic, voy, seven, crew_max_rarity_5","New Collective",2, 7, 12, 10, 14, 4, 0, , , , 1750, , 705, 440, false,"Seven",crew_portraits_cm_sevenbluegreyshoulders_sm.png,seven_bluegreyshoulders_crew
"Donik",10,3, 0,0,0,0,0,0,0,0,0,476,79,199,303,31,79,0,0,0,0,0,1067,1351,0,0,831,1295,0,989,1385,0,789,666,1110,0,0,986,1379,0,0,716,1316,0,914,1405,0,795,595,1122,1520,1538,"Hirogen, Innovator","nonhuman, male, organic, voy, donik, crew_max_rarity_3","Hunting Program",2, 4, 12, 12, 10, 7, 0, , , , 870, 165, , 340, false,"Donik",crew_portraits_cm_donik_sm.png,donik_crew
"Commander Tucker",8,2, 252,28,82,0,0,0,0,0,0,305,53,185,0,0,0,0,0,0,1331,1269,893,1376,1150,0,981,0,0,1128,0,0,1266,775,0,1327,1267,823,1377,1149,0,809,0,0,985,0,0,1099,671,0,1561,1550,"Human, Starfleet, Jury Rigger, Pilot, Explorer","male, organic, ent, tucker, crew_max_rarity_2","Warp Engines Online",1, 2, 6, 3, 8, 2, 0, , , , 520, 35, 50, 165, false,"Trip",crew_portraits_cm_tucker_sm.png,tucker_commander_crew
"Counselor Troi",6,1, 0,0,0,0,0,0,0,0,0,0,0,0,261,42,108,147,49,131,0,0,0,1358,1174,0,0,1301,854,0,1389,1082,1292,812,983,0,0,0,1343,1085,0,0,1279,802,0,1379,1014,1259,763,774,1577,1563,"Federation, Starfleet, Human, Betazoid, Empath, Counselor","nonhuman, female, organic, tng, troi, crew_max_rarity_1","Counselling",2, 1, 6, 10, 10, , , , , , 265, , 80, 345, false,"Troi",crew_portraits_cm_troitng_sm.png,troi_casualgray_crew
"Rakal Troi",6,4, 521,163,354,0,0,0,525,128,331,0,0,0,0,0,0,407,163,440,909,516,848,1045,224,887,0,0,573,813,1093,252,0,552,805,530,187,461,716,16,634,0,0,237,585,823,27,0,159,338,1162,167,"Federation, Starfleet, Human, Betazoid, Romulan, Empath, Undercover Operative, Tal Shiar","nonhuman, female, organic, tng, troi, crew_max_rarity_4","Romulan Disguise",1, 7, 12, 10, 14, 1, 2, , , , 90, 400, 175, 2825, false,"Troi",crew_portraits_cm_troirakal_sm.png,troi_rakal_crew
"Commander Troi",9,5, 0,0,0,0,0,0,383,203,253,0,0,0,1060,211,421,827,142,281,0,1115,0,627,559,1100,0,483,427,988,196,138,408,372,44,0,756,0,570,595,647,0,410,440,597,88,86,335,395,59,726,213,"Federation, Starfleet, Human, Betazoid, Empath, Counselor, Playful","nonhuman, female, organic, tng, troi, crew_max_rarity_5","Empathic Sense",1, 8, 6, 6, 6, , , , , , 1375, 475, 135, 725, true,"Troi",crew_portraits_cm_troifirstcontact_sm.png,troi_firstcontact_crew
"Vedek Winn Adami",9,3, 307,97,207,0,0,0,0,0,0,0,0,0,410,92,214,0,0,0,1250,1212,1182,918,1074,0,0,1170,0,0,1268,0,1155,0,985,961,998,922,597,810,0,0,1008,0,0,1129,0,965,0,814,1507,1439,"Bajoran, Vedek, Cultural Figure, Spiritual","nonhuman, female, organic, ds9, winn, crew_max_rarity_3","Will of the Prophets",1, 4, 8, 10, 10, 4, 0, , , , , 270, 85, 830, false,"Winn",crew_portraits_cm_winnvedek_sm.png,winn_vedek_crew
"Subcommander T'Pol",7,3, 273,71,211,520,21,77,165,35,77,0,0,0,0,0,0,0,0,0,782,1090,1228,1343,1120,842,860,1168,717,1172,1415,1083,0,0,0,814,861,979,1125,858,1182,1015,1326,852,1150,1402,1063,0,0,0,1471,1486,"Vulcan, High Command, Astrophysicist, Telepath, Starfleet","nonhuman, female, organic, ent, tpol, crew_max_rarity_3","Logic",2, 5, 6, 10, 10, , , , , , 175, 120, 3, 100, false,"T'Pol",crew_portraits_cm_tpol_sm.png,tpol_subcommander_crew
"Commander T'Pol",9,4, 512,112,307,692,56,171,320,91,227,0,0,0,0,0,0,0,0,0,337,708,902,1087,788,481,619,909,494,1075,1318,984,0,0,0,325,392,677,901,587,491,844,1154,703,838,1099,757,0,0,0,1282,1152,"Vulcan, Starfleet, Astrophysicist, Telepath","nonhuman, female, organic, ent, tpol, crew_max_rarity_4","Vessel's Information",0, 5, 12, 12, 20, 2, 0, , , , 1400, 200, 70, 1175, false,"T'Pol",crew_portraits_cm_tpolcommander_sm.png,tpol_commander_crew
"Chef Neelix",1,1, 0,0,0,0,0,0,0,0,0,0,0,0,201,51,189,0,0,0,0,0,0,1371,0,0,0,1309,0,0,1395,0,1301,0,1122,0,0,0,1203,0,0,0,1126,0,0,1255,0,1104,0,945,1601,1583,"Talaxian, Mylean, Resourceful, Survivalist, Chef, Civilian, Communicator","nonhuman, male, organic, voy, neelix, crew_max_rarity_1","Soup's On",1, 2, 12, 14, 10, 6, 0, , 2, 1, 305, , , 210, false,"Neelix",crew_portraits_cm_neelix_sm.png,neelix_chef_crew
"CMO 'Bones' McCoy",8,1, 0,0,0,0,0,0,0,0,0,0,0,0,0,0,0,213,48,196,0,0,0,0,1140,0,0,0,835,0,0,1062,0,793,1120,0,0,0,0,961,0,0,0,670,0,0,904,0,672,941,1599,1582,"Human, Federation, Starfleet, Physician, Exobiology","male, organic, tos, mccoy, crew_max_rarity_1","Country Doctor",2, 3, 8, 10, 12, , , , 0, 2, 245, 10, 8, 285, false,"McCoy",crew_portraits_cm_mccoy_sm.png,mccoy_chief_medical_officer_crew
