crew, tier, rarity, CMD_core, CMD_min, CMD_max, SCI_core, SCI_min, SCI_max, SEC_core, SEC_min, SEC_max, ENG_core, ENG_min, ENG_max, DIP_core, DIP_min, DIP_max, MED_core, MED_min, MED_max, V_CMD_SCI, V_CMD_SEC, V_CMD_ENG, V_CMD_DIP, V_CMD_MED, V_SCI_SEC, V_SCI_ENG, V_SCI_DIP, V_SCI_MED, V_SEC_ENG, V_SEC_DIP, V_SEC_MED, V_ENG_DIP, V_ENG_MED, V_DIP_MED, G_CMD_SCI, G_CMD_SEC, G_CMD_ENG, G_CMD_DIP, G_CMD_MED, G_SCI_SEC, G_SCI_ENG, G_SCI_DIP, G_SCI_MED, G_SEC_ENG, G_SEC_DIP, G_SEC_MED, G_ENG_DIP, G_ENG_MED, G_DIP_MED, voyage_rank, gauntlet_rank, traits, hidden_traits, action_name, action_bonus_type, action_bonus_amount, action_initial_cooldown, action_duration, action_cooldown, bonus_ability, trigger, uses_per_battle, penalty_type, penalty_amount, accuracy, crit_bonus, crit_chance, evasion, charge_phases, short_name, image_name, symbol, shuttle_rank, collections_rank, ship_rank, overall_rank, stat_collections, crew_collections, vanity_collections, potential_collections
"Investigator Odo",0,1, 0,0,0,0,0,0,217,37,171,0,0,0,0,0,0,0,0,0,0,1488,0,0,0,1534,0,0,0,1352,1636,1215,0,0,0,0,1400,0,0,0,1390,0,0,0,1254,1554,1120,0,0,0,1858,1852,"Changeling, Cardassian, Investigator, Interrogator, Shapeshifter","nonhuman, male, organic, ds9, odo, crew_max_rarity_1","Collaboration",2, 1, 20, 14, 10, , , , , , 400, 115, 67, 265, false,"Odo",crew_portraits_cm_odooccupation_sm.png,odo_occupation_crew, 6.652, 20.4444, 8.5905, 26.893, 3, 1, 0, 59.1146
"Constable Odo",0,3, 317,107,225,0,0,0,523,27,85,0,0,0,0,0,0,0,0,0,1446,970,1366,1527,1233,1316,0,0,0,1194,1486,1047,0,0,0,1095,938,1044,1254,897,1533,0,0,0,1344,1643,1213,0,0,0,1751,1767,"Changeling, Bajoran, Constable, Investigator, Interrogator, Shapeshifter","nonhuman, male, organic, ds9, odo, crew_max_rarity_3","Justice",0, 6, 10, 12, 16, , , , 3, 800, 520, 300, 75, , false,"Odo",crew_portraits_cm_odostandard_sm.png,odo_constable_crew, 25.6862, 25.1111, 11.924, 24.3102, 3, 1, 0, 59.1146
"Ensign Ro",0,2, 322,46,132,0,0,0,0,0,0,0,0,0,0,0,0,0,0,0,1534,1472,1459,1587,1325,0,0,0,0,0,0,0,0,0,0,1496,1445,1419,1554,1283,0,0,0,0,0,0,0,0,0,0,1853,1856,"Starfleet, Bajoran, Resourceful","nonhuman, female, organic, tng, ro, crew_max_rarity_2","Separate Ways",0, 4, 3, 10, 5, , , 2, , , 130, 210, 13, 200, false,"Ro",crew_portraits_cm_roensign_sm.png,ro_ensign_crew, 9.7976, 47.3333, 6.804, 32.5497, 4, 0, 0, 0
"Shinzon",0,5, 819,94,241,0,0,0,938,183,435,0,0,0,546,176,390,0,0,0,941,233,882,443,711,612,0,1050,0,581,190,418,1038,0,863,1092,244,1040,283,894,407,0,630,0,427,66,284,577,0,462,896,232,"Human, Clone, Reman, Villain, Romulan, Brutal, Crafty, Politician, Veteran, Vengeful","male, organic, tng, shinzon, crew_max_rarity_5","Destiny Complete",0, 7, 14, 3, 14, 1, 2, , , , 1325, 545, 365, 1050, false,"Shinzon",crew_portraits_cm_shinzon_sm.png,shinzon_crew, 70.547, 45.7778, 20.0911, 69.9857, 6, 0, 0, 20.3342
"Will Riker",0,1, 251,42,110,0,0,0,125,22,74,0,0,0,0,0,0,0,0,0,1551,1384,1482,1610,1344,1563,0,0,0,1372,1665,1241,0,0,0,1527,1303,1450,1583,1321,1547,0,0,0,1358,1655,1224,0,0,0,1845,1836,"Human, Federation, Starfleet, Maverick, Gambler, Romantic","male, organic, tng, riker, crew_max_rarity_1","Poker Face",0, 1, 8, 10, 14, 4, 0, , , , 455, , 425, 340, false,"Riker",crew_portraits_cm_rikers1_sm.png,riker_s1_commander_crew, 11.4807, 34, 38.7185, 42.3299, 4, 0, 0, 0
"Commander Riker",0,2, 279,78,191,0,0,0,124,29,89,0,0,0,290,22,64,0,0,0,1532,1336,1457,1268,1323,1559,0,1504,0,1368,1513,1237,1525,0,1303,1243,1028,1208,1200,1054,1529,0,1538,0,1342,1563,1210,1559,0,1330,1785,1749,"Human, Federation, Starfleet, Pilot, Maverick, Gambler, Romantic, Playful","male, organic, tng, riker, crew_max_rarity_2","Liase",0, 2, 8, 10, 14, 5, 0, , , , 645, 50, 295, 275, false,"Riker",crew_portraits_cm_rikerpoker_sm.png,riker_s2_commander_crew, 21.2583, 39.5556, 42.0658, 45.8303, 5, 0, 0, 19.7917
"Edith Keeler",0,4, 0,0,0,0,0,0,0,0,0,0,0,0,453,166,339,591,187,590,0,0,0,1302,719,0,0,1143,526,0,1343,697,1137,495,240,0,0,0,906,137,0,0,731,139,0,869,154,675,65,20,1659,810,"Civilian, Caregiver, Inspiring, Cultural Figure, Romantic, Human","female, organic, tos, keeler, crew_max_rarity_4","A Life Worth Living",1, 7, 8, 10, 8, , , , , , 690, 25, 52, 440, false,"Keeler",crew_portraits_cm_edithkeeler_sm.png,keeler_crew, 32.0978, 48.6667, 5.2607, 43.1384, 4, 0, 0, 0
"Ensign Tuvok",0,1, 0,0,0,181,51,197,0,0,0,0,0,0,138,33,74,0,0,0,1570,0,0,1648,0,1543,1233,1402,974,0,1661,0,1569,0,1343,1337,0,0,1624,0,1271,1001,1081,780,0,1649,0,1539,0,1312,1847,1809,"Vulcan, Federation, Starfleet, Telepath","nonhuman, male, organic, voy, tuvok, crew_max_rarity_1","Memory",0, 1, 1, 14, 10, , , , , , 103, 60, 135, 375, false,"Tuvok",crew_portraits_cm_tuvokensign_sm.png,tuvok_ensign_crew, 9.7776, 29.3333, 5.3158, 34.7804, 4, 0, 0, 18.4028
"Security Chief Tuvok",0,3, 291,53,161,145,45,149,445,85,201,0,0,0,0,0,0,0,0,0,1301,1009,1471,1589,1334,975,1243,1540,984,1192,1483,1046,0,0,0,945,808,1366,1492,1223,699,1155,1424,916,1074,1383,960,0,0,0,1728,1651,"Vulcan, Federation, Starfleet, Telepath, Tactician, Investigator","nonhuman, male, organic, voy, tuvok, crew_max_rarity_3","Contingency Plan",0, 4, 10, 12, 16, 5, 0, , , , 465, 50, , 300, false,"Tuvok",crew_portraits_cm_tuvokrifle_sm.png,tuvok_rifle_crew, 26.9084, 31.3333, 48.1931, 38.5197, 4, 0, 0, 37.8472
"Major Kira",0,2, 273,37,126,0,0,0,304,60,176,0,0,0,0,0,0,0,0,0,1543,1124,1474,1597,1335,1496,0,0,0,1320,1612,1181,0,0,0,1514,1018,1433,1566,1303,1302,0,0,0,1183,1493,1054,0,0,0,1811,1791,"Bajoran, Veteran, Resourceful","nonhuman, female, organic, ds9, kira, crew_max_rarity_2","Obstinance",0, 2, 0, 10, 14, 6, 0, , , , 295, 150, 5, , true,"Kira",crew_portraits_cm_kirashorthair_sm.png,kira_major_shorthair_crew, 17.6317, 58.2222, 42.0922, 44.417, 5, 0, 0, 0
"Mirror Intendant Kira",0,5, 512,183,363,0,0,0,1052,272,542,0,0,0,946,67,184,0,0,0,1083,232,1031,403,878,446,0,908,0,445,83,297,873,0,704,609,49,553,413,414,180,0,1289,0,214,106,128,1295,0,1092,735,178,"Bajoran, Cardassian, Klingon, Villain, Klingon-Cardassian Alliance, Brutal, Mirror Universe, Crafty","nonhuman, female, organic, ds9, kira, crew_max_rarity_5","Instability",0, 6, 6, 10, 12, 4, 0, , , , 915, 225, 90, 1525, true,"Kira",crew_portraits_cm_kiraintendant_sm.png,kira_mirror_crew, 77.0387, 47.1111, 65.883, 82.1703, 6, 0, 0, 20.3342
"Security Chief Worf",0,2, 205,57,144,0,0,0,326,61,145,0,0,0,0,0,0,0,0,0,1566,1170,1491,1622,1354,1487,0,0,0,1315,1606,1174,0,0,0,1454,997,1389,1519,1249,1399,0,0,0,1260,1558,1126,0,0,0,1818,1784,"Klingon, Federation, Starfleet, Duelist, Investigator","nonhuman, male, organic, tng, worf, crew_max_rarity_2","They Have No Honor",2, 4, 8, 10, 12, , , , 1, 2, 165, 280, 95, 155, false,"Worf",crew_portraits_cm_worf_sm.png,worf_security_chief_crew, 16.2492, 24.4444, 11.2084, 22.5035, 3, 0, 0, 19.4444
"Defiant Commander Worf",0,4, 364,241,488,0,0,0,609,179,394,0,0,0,0,0,0,0,0,0,1139,563,1091,1288,929,922,0,0,0,867,1195,722,0,0,0,264,63,251,502,151,520,0,0,0,514,762,384,0,0,0,1674,702,"Klingon, Federation, Starfleet, Duelist, Tactician, Veteran","nonhuman, male, organic, ds9, worf, crew_max_rarity_4","Good Day to Die",2, 6, 12, 12, 12, 4, 0, , 1, 2, 690, 645, 325, 205, false,"Worf",crew_portraits_cm_worfdefiant_sm.png,worf_defiant_commander_crew, 29.7536, 31.7778, 50.2636, 42.7404, 3, 0, 0, 0
"Mirror Regent Worf",0,5, 861,294,589,0,0,0,1062,175,357,0,0,0,0,0,0,0,0,0,621,152,575,866,412,520,0,0,0,510,801,351,0,0,0,123,38,109,295,66,581,0,0,0,582,821,440,0,0,0,986,373,"Klingon, Cardassian, Tactician, Villain, Brutal, Klingon-Cardassian Alliance, Mirror Universe","nonhuman, male, organic, ds9, worf, crew_max_rarity_5","Position of Strength",0, 9, 8, 8, 10, , , , , , 300, 980, 390, , false,"Worf",crew_portraits_cm_worfmirror_sm.png,worf_mirror_crew, 58.7858, 40.2222, 19.7795, 63.9379, 5, 0, 0, 20.3342
"Yeoman Rand",0,1, 164,15,58,0,0,0,0,0,0,0,0,0,117,19,60,0,0,0,1585,1515,1519,1595,1380,0,0,1550,0,0,1667,0,1576,0,1346,1582,1512,1516,1584,1375,0,0,1540,0,0,1662,0,1564,0,1334,1855,1859,"Federation, Starfleet, Human","female, organic, tos, rand, crew_max_rarity_1","Signature Required",2, 2, 8, 10, 12, , , , 1, 1, 375, , , 180, false,"Rand",crew_portraits_cm_randyeoman_sm.png,rand_yeoman_crew, 8.5955, 15.5556, 10.6392, 21.0256, 2, 0, 0, 0
"The Duras Sisters",0,4, 311,83,205,0,0,0,658,150,385,0,0,0,464,170,341,0,0,0,1491,691,1415,1001,1285,905,0,1132,0,852,520,709,1116,0,929,1201,382,1165,416,1011,579,0,719,0,580,125,439,656,0,522,1497,609,"Klingon, Scoundrel, Villain, Vengeful","nonhuman, female, organic, tng, betor, lursa, exclusive_fusion, crew_max_rarity_4","The Power of Two",0, 9, 10, 20, 12, , , 1, , , 350, 110, 190, 500, false,"Duras Sisters",crew_portraits_cm_duras_sisters_sm.png,duras_sisters_crew, 43.9792, 26.4444, 11.7823, 47.0149, 3, 0, 0, 38.0642
"Persis",0,2, 0,0,0,0,0,0,253,94,250,0,0,0,303,39,88,0,0,0,0,1469,0,1593,0,1498,0,1494,0,1322,1270,1183,1516,0,1294,0,1114,0,1608,0,1008,0,1501,0,959,947,840,1519,0,1295,1805,1753,"Human, Augments, Engineered, Survivalist, Tactician","nonhuman, female, organic, ent, persis, crew_max_rarity_2","Augmented Strength",0, 2, 6, 10, 6, 7, 0, 2, , , 240, 330, 300, , false,"Persis",crew_portraits_cm_persis_sm.png,persis_crew, 17.1108, 40.2222, 27.0655, 40.1843, 5, 0, 0, 0
"Telek R'Mor",0,2, 0,0,0,347,52,194,119,8,44,0,0,0,263,30,113,0,0,0,1470,1521,0,1603,0,1287,1148,1068,919,1373,1559,1242,1526,0,1304,1346,1516,0,1592,0,1135,1010,1014,789,1371,1582,1240,1502,0,1284,1783,1773,"Romulan, Astrophysicist","nonhuman, male, organic, voy, rmor, crew_max_rarity_2","Solitary Survey",1, 3, 10, 12, 10, 0, 2, , , , 405, 50, 3, 180, false,"R'Mor",crew_portraits_cm_telekrmor_sm.png,rmor_voyager_crew, 22.3202, 26, 12.0047, 29.4487, 4, 0, 0, 21.0938
"KDF Gowron",0,4, 375,85,222,0,0,0,296,100,256,0,0,0,641,173,418,0,0,0,1379,1004,1317,733,1178,1451,0,990,0,1272,697,1139,966,0,783,1145,548,1102,292,952,973,0,590,0,930,194,808,534,0,430,1567,848,"Klingon, Duelist, Diplomat, Politician","nonhuman, male, organic, tng, gowron, crew_max_rarity_4","What Can Be Done",1, 6, 14, 10, 14, 0, 2, , , , 625, 465, 85, 1000, false,"Gowron",crew_portraits_cm_gowronyoung_sm.png,gowron_kdf_crew, 40.2725, 34.6667, 13.9034, 42.4135, 4, 0, 0, 0
"Third Remata'Klan",0,3, 410,42,84,0,0,0,467,85,185,0,0,0,0,0,0,0,0,0,1452,963,1378,1534,1244,1300,0,0,0,1180,1471,1034,0,0,0,1550,1020,1473,1603,1336,1196,0,0,0,1101,1408,984,0,0,0,1747,1793,"Jem'hadar, Dominion, Duelist, Tactician","nonhuman, male, organic, ds9, remataklan, crew_max_rarity_3","Victory is Life",0, 3, 0, 6, 8, 4, 4, , , , 690, 395, 597, 600, true,"Remata'Klan",crew_portraits_cm_remataklan_sm.png,remataklan_crew, 26.8083, 20.4444, 15.933, 21.4199, 3, 0, 0, 0
"Ensign Chapel",0,1, 0,0,0,0,0,0,0,0,0,0,0,0,0,0,0,214,34,152,0,0,0,0,1353,0,0,0,973,0,0,1221,0,983,1318,0,0,0,0,1277,0,0,0,928,0,0,1158,0,940,1236,1864,1855,"Human, Federation, Starfleet, Nurse","female, organic, tos, chapel, crew_max_rarity_1","Administer Prescription",2, 1, 6, 10, 10, , , , , , 130, , 40, 100, false,"Chapel",crew_portraits_cm_chapelensign_sm.png,chapel_ensign_crew, 6.5518, 15.5556, 1.6378, 4.3621, 2, 0, 0, 0
"Ensign Ogawa",0,1, 0,0,0,0,0,0,0,0,0,0,0,0,0,0,0,213,34,166,0,0,0,0,1350,0,0,0,969,0,0,1217,0,981,1313,0,0,0,0,1266,0,0,0,901,0,0,1144,0,928,1214,1862,1853,"Human, Federation, Starfleet, Nurse","female, organic, tng, ogawa, crew_max_rarity_1","Report to Sickbay",2, 1, 6, 1, 8, 2, 0, 1, , , 170, , 35, 105, false,"Ogawa",crew_portraits_cm_ogawaensign_sm.png,ogawa_ensign_crew, 6.5318, 15.5556, 1.3897, 3.8975, 2, 0, 0, 0
"Wesley Crusher",0,1, 0,0,0,218,43,149,0,0,0,174,32,78,0,0,0,0,0,0,1562,0,1514,0,0,1539,1069,1519,970,1366,0,0,1562,996,0,1483,0,1489,0,0,1448,835,1428,920,1346,0,0,1535,984,0,1841,1828,"Human, Federation, Civilian, Prodigy","male, organic, tng, wesley, crew_max_rarity_1","Study",1, 2, 8, 10, 12, , , , 0, 1, 215, 125, 70, 55, false,"Wesley",crew_portraits_cm_wesleysweater_sm.png,wesley_sweater_crew, 11.9215, 19.7778, 8.6888, 23.4198, 3, 0, 0, 0
"Ensign Crusher",0,3, 176,11,31,426,83,229,0,0,0,347,34,78,0,0,0,0,0,0,1089,1516,1294,1646,1381,1329,679,1345,835,1332,0,0,1510,966,0,1070,1517,1448,1652,1383,1089,645,1167,663,1343,0,0,1530,982,0,1731,1756,"Human, Federation, Starfleet, Prodigy, Warp Theorist","male, organic, tng, wesley, crew_max_rarity_3","Rewire",2, 4, 6, 8, 10, 6, 0, , , , 290, , , 190, false,"Wesley",crew_portraits_cm_wesley_sm.png,wesley_full_ensign_crew, 28.912, 21.7778, 47.2396, 29.5906, 3, 0, 0, 0
"Acting Ensign Crusher",0,2, 114,29,58,258,56,160,0,0,0,251,53,148,0,0,0,0,0,0,1386,1520,1332,1654,1385,1523,818,1496,961,1345,0,0,1521,973,0,1177,1504,1171,1638,1368,1370,648,1370,852,1268,0,0,1419,921,0,1794,1738,"Human, Federation, Starfleet, Prodigy, Resourceful","male, organic, tng, wesley, crew_max_rarity_2","Invention",1, 4, 3, 6, 6, , , 2, , , 205, 50, 25, 165, false,"Wesley",crew_portraits_cm_wesleyensign_sm.png,wesley_acting_ensign_crew, 18.9742, 44.6667, 8.3466, 38.9136, 4, 0, 0, 0
"Formal Dress Wesley Crusher",0,4, 0,0,0,662,173,422,0,0,0,270,108,230,481,160,342,0,0,0,955,0,1439,1284,0,897,359,383,530,1307,1323,0,789,953,925,563,0,1036,914,0,497,96,75,312,962,882,0,162,605,539,1489,378,"Human, Federation, Starfleet, Prodigy, Warp Theorist, Festive","male, organic, tng, wesley, crew_max_rarity_4","Duty to the Truth",1, 9, 4, 10, 12, , , , , , 300, 500, 30, 450, false,"Wesley",crew_portraits_cm_wesleydressuniform_sm.png,wesley_formal_dress_crew, 43.2178, 23.5556, 14.6663, 46.6205, 3, 1, 0, 0
"Wrathful Khan",0,5, 1040,206,421,0,0,0,1145,72,143,376,140,288,0,0,0,0,0,0,531,154,191,814,361,603,1048,0,0,205,870,407,1356,849,0,422,355,44,675,261,1362,635,0,0,380,1541,1103,884,477,0,837,791,"Human, Augments, Engineered, Villain, Cultural Figure, Tactician, Resourceful, Survivalist, Brutal, Vengeful","nonhuman, male, organic, tos, khan, crew_max_rarity_5","I Stab at Thee",2, 9, 12, 5, 12, 1, 0, , , , 640, 595, 345, 850, false,"Khan",crew_portraits_cm_khan_sm.png,khan_wok_crew, 78.2408, 80.6667, 64.0577, 78.4934, 7, 0, 0, 20.3342
"Tailor Garak",0,3, 0,0,0,0,0,0,502,44,126,161,22,44,395,83,219,0,0,0,0,1338,1521,1465,0,1309,1250,1352,0,940,1057,1044,1102,998,1158,0,1451,1519,1313,0,1475,1252,1187,0,1180,948,1170,1003,1000,982,1707,1727,"Cardassian, Undercover Operative, Scoundrel, Interrogator, Civilian","nonhuman, male, organic, ds9, garak, crew_max_rarity_3","Cutting Cloth",1, 5, 8, 12, 12, , , , , , 125, 230, 20, 405, false,"Garak",crew_portraits_cm_garaktailor_sm.png,garak_tailor_crew, 32.4785, 26.6667, 12.9379, 32.151, 4, 0, 0, 38.0859
"Bartender Quark",0,1, 110,25,77,0,0,0,81,15,57,0,0,0,211,36,150,0,0,0,1591,1503,1526,1552,1384,1565,0,1522,0,1374,1614,1243,1543,0,1319,1566,1447,1496,1341,1355,1559,0,1437,0,1368,1442,1238,1448,0,1237,1833,1806,"Ferengi, Bartender, Civilian, Scoundrel, Gambler, Merchant","nonhuman, male, organic, ds9, quark, crew_max_rarity_1","Hospitality",1, 2, 8, 10, 12, , , , 2, 1, 165, 10, 10, 140, false,"Quark",crew_portraits_cm_quarkbartender_sm.png,quark_s1_bartender_crew, 12.3422, 29.3333, 11.6861, 37.9222, 4, 0, 0, 37.3915
"Richard Castillo",0,3, 487,109,227,286,57,187,0,0,0,0,0,0,0,0,0,0,0,0,903,1280,1223,1377,1071,1511,1216,1489,954,0,0,0,0,0,0,574,1120,1037,1248,891,1286,1016,1306,795,0,0,0,0,0,0,1754,1709,"Human, Hero, Pilot, Starfleet, Federation, Displaced, Romantic","male, organic, castillo, tng, crew_max_rarity_3","Self Sacrifice",0, 5, 12, 12, 10, 7, 0, , 1, 2, 650, 265, 129, 585, false,"Castillo",crew_portraits_cm_richardcastillo_sm.png,castillo_lieutenant_crew, 23.5424, 25.1111, 50.1314, 33.954, 3, 0, 0, 40.8854
"Writer Jake Sisko",0,3, 0,0,0,0,0,0,0,0,0,0,0,0,451,70,198,0,0,0,0,0,0,1450,0,0,0,1334,0,0,1484,0,1350,0,1141,0,0,0,1376,0,0,0,1242,0,0,1416,0,1246,0,1044,1832,1835,"Human, Federation, Civilian, Writer, Gambler, Romantic","male, organic, ds9, jake, crew_max_rarity_3","Construct Story",2, 3, 0, 8, 10, 6, 0, , , , 995, 350, 47, 640, true,"Jake",crew_portraits_cm_jakewriter_sm.png,jake_writer_crew, 13.9251, 30, 9.7493, 19.5144, 4, 0, 0, 0
"CMO Crusher",0,2, 0,0,0,0,0,0,0,0,0,0,0,0,0,0,0,290,52,174,0,0,0,0,1332,0,0,0,955,0,0,1195,0,967,1289,0,0,0,0,1206,0,0,0,828,0,0,1077,0,879,1148,1854,1847,"Human, Starfleet, Federation, Physician, Caregiver, Cyberneticist","female, organic, tng, crusher, crew_max_rarity_2","Doctor's Calluses",2, 3, 6, 10, 10, , , , , , 185, , 35, 155, false,"Crusher",crew_portraits_cm_crusherwithlabcoat_sm.png,crusher_labcoat_crew, 8.896, 34, 1.6525, 27.2343, 4, 0, 0, 20.7031
"Commando Crusher",0,3, 0,0,0,182,76,200,308,93,193,0,0,0,0,0,0,510,44,132,1557,1441,0,0,1153,1028,1228,1516,539,1292,1585,650,0,841,1127,1245,1235,0,0,1292,537,898,1236,493,1075,1384,583,0,950,1250,1703,1624,"Human, Starfleet, Federation, Physician, Cyberneticist, Undercover Operative","female, organic, tng, crusher, crew_max_rarity_3","Repel Disease",0, 3, 6, 3, 12, 1, 0, , , , 575, , 370, 500, false,"Crusher",crew_portraits_cm_crusherblackcommandouniform_sm.png,crusher_black_commando_uniform_crew, 30.6151, 31.3333, 45.422, 42.6339, 4, 0, 0, 20.7031
"Dr. Crusher",0,4, 275,38,110,0,0,0,437,90,201,0,0,0,0,0,0,736,123,300,1544,1027,1475,1598,411,1318,0,0,531,1196,1487,266,0,501,779,1529,955,1453,1585,402,1151,0,0,526,1069,1374,187,0,493,771,1589,1517,"Human, Starfleet, Federation, Physician, Cyberneticist","female, organic, tng, crusher, crew_max_rarity_4","Neutralize Disease",1, 7, 12, 12, 12, 4, 4, , , , 740, 250, 370, 500, false,"Crusher",crew_portraits_cm_crusherfromfirstcontact_sm.png,crusher_first_contact_crew, 44.3398, 21.5556, 19.9979, 41.6455, 2, 0, 0, 20.7031
"Holonovel Doctor",0,4, 0,0,0,512,50,137,0,0,0,0,0,0,0,0,0,799,69,244,1349,0,0,0,720,1295,1036,1314,217,0,0,699,0,498,777,1491,0,0,0,960,1456,1165,1438,386,0,0,900,0,661,950,1679,1742,"Hologram, Human, Federation, Starfleet, Physician, Musician, Scoundrel","nonhuman, male, artificial_life, voy, emh, crew_max_rarity_4","Suggested Treatment",0, 7, 12, 12, 12, , , , , , 365, 370, 205, 525, false,"Doctor",crew_portraits_cm_doctorgolfclub_sm.png,emh_authorauthor_crew, 40.0721, 34.6667, 7.7902, 36.5049, 4, 0, 0, 59.7222
"Mobile Doctor",0,5, 0,0,0,809,106,209,0,0,0,0,0,0,393,137,435,1191,110,334,951,0,0,1357,307,894,682,411,37,0,1390,313,1205,179,86,1151,0,0,817,692,1081,807,198,151,0,770,672,568,469,79,897,661,"Hologram, Human, Federation, Starfleet, Musician, Physician","nonhuman, male, artificial_life, voy, emh, crew_max_rarity_5","House Call",2, 9, 12, 12, 12, , , , , , 1825, 600, , 600, false,"Doctor",crew_portraits_cm_emhmobile_sm.png,emh_mobileholoemitter_crew, 73.2719, 34.6667, 11.3201, 71.468, 4, 0, 0, 41.9922
"Comm Officer Uhura",0,1, 0,0,0,0,0,0,0,0,0,0,0,0,258,28,89,0,0,0,0,0,0,1616,0,0,0,1513,0,0,1638,0,1534,0,1310,0,0,0,1616,0,0,0,1511,0,0,1641,0,1528,0,1302,1860,1864,"Federation, Starfleet, Human, Musician, Communicator","female, organic, tos, uhura, crew_max_rarity_1","Incoming Message",2, 2, 8, 10, 12, , , , 1, 1, 320, , , 495, false,"Uhura",crew_portraits_cm_uhurared_sm.png,uhura_red_crew, 7.9543, 44, 3.0167, 29.7299, 4, 0, 0, 0
"Commander Uhura",0,4, 459,128,299,0,0,0,0,0,0,0,0,0,592,198,429,0,0,0,1237,1260,1196,655,1041,0,0,999,0,0,1189,0,975,0,789,908,969,837,165,705,0,0,506,0,0,595,0,436,0,330,1678,1182,"Federation, Starfleet, Human, Musician, Communicator","female, organic, tos, uhura, crew_max_rarity_4","Hailing Frequencies",0, 8, 12, 26, 12, , , 1, , , 1165, , 75, 790, false,"Uhura",crew_portraits_cm_uhurawrathofkhan_sm.png,uhura_wrathofkhan_crew, 32.2581, 41.1111, 11.4414, 36.5668, 3, 0, 0, 0
"Dancing Uhura",0,5, 1026,84,195,0,0,0,0,0,0,0,0,0,1185,193,393,0,0,0,782,886,732,134,562,0,0,539,0,0,665,0,471,0,378,1224,1238,1191,335,1032,0,0,596,0,0,749,0,545,0,436,975,1513,"Human, Federation, Starfleet, Communicator, Casual, Musician, Artist","female, organic, tos, uhura, original, crew_max_rarity_5","Take The Lead",0, 8, 10, 3, 14, 1, 1, , , , 465, 260, 60, 400, false,"Uhura",crew_portraits_cm_uhura_dancing_sm.png,uhura_dancing_crew, 67.8221, 55.1111, 36.1741, 59.728, 5, 0, 1, 0
"First Maje Culluh",0,3, 466,93,223,0,0,0,307,42,138,0,0,0,0,0,0,0,0,0,1324,994,1269,1427,1125,1514,0,0,0,1334,1622,1198,0,0,0,1129,811,1079,1273,931,1463,0,0,0,1294,1594,1163,0,0,0,1765,1739,"Kazon, Scoundrel, Vengeful","nonhuman, male, organic, voy, culluh, crew_max_rarity_3","Nistrim Supremacy",2, 3, 6, 10, 10, 8, 4, , , , 665, 325, 133, 390, false,"Culluh",crew_portraits_cm_jalculluh_sm.png,culluh_crew, 23.6025, 28.6667, 17.4481, 24.1094, 4, 0, 0, 17.73
"KDF Alexander",0,2, 137,19,79,0,0,0,331,64,148,145,16,72,0,0,0,0,0,0,1587,1315,1472,1649,1382,1481,1251,0,0,1157,1598,1165,1570,1000,0,1569,1174,1410,1631,1358,1376,1246,0,0,1048,1547,1109,1556,994,0,1801,1792,"Human, Klingon","male, organic, ds9, alexander, nonhuman, crew_max_rarity_2","Beginner's Luck",1, 3, 10, 12, 10, 5, 2, , , , 130, 200, 62, 15, false,"Alexander",crew_portraits_cm_alexanderkdf_sm.png,alexander_kdf_crew, 18.7137, 24.4444, 16.2884, 29.0462, 3, 0, 0, 0
"Commando Shran",0,4, 673,114,239,0,0,0,592,89,182,0,0,0,318,144,282,0,0,0,1017,590,949,777,784,1066,0,1357,0,992,874,854,1379,0,1164,1046,615,984,448,840,1192,0,960,0,1097,458,983,899,0,769,1494,1198,"Andorian, Tactician, Inspiring, Imperial Guard","nonhuman, male, organic, ent, shran, crew_max_rarity_4","Debt Owed",0, 8, 6, 8, 10, , , 3, , , 390, 575, 288, 350, false,"Shran",crew_portraits_cm_shrancommando_sm.png,shran_commando_crew, 48.4672, 36, 11.881, 43.1311, 4, 0, 0, 0
"Ushaan Shran",0,5, 989,83,164,0,0,0,1076,170,348,0,0,0,424,134,288,0,0,0,850,174,811,489,625,508,0,1265,0,502,237,344,1287,0,1074,1324,443,1279,607,1133,605,0,967,0,603,198,464,908,0,773,882,963,"Andorian, Duelist, Romantic, Imperial Guard","nonhuman, male, organic, ent, shran, crew_max_rarity_5","Debt Owed",0, 9, 6, 8, 10, , , 3, , , 1440, 565, 483, 390, false,"Shran",crew_portraits_cm_shrandueling_sm.png,shran_dueling_crew, 76.1771, 22.4444, 15.2671, 63.9551, 3, 0, 0, 0
"Fencing Sulu",0,4, 444,99,249,385,36,92,609,203,448,0,0,0,0,0,0,0,0,0,899,616,1283,1436,1138,474,1181,1457,935,850,1182,707,0,0,0,760,218,1004,1212,858,207,1227,1502,971,371,523,229,0,0,0,1543,1034,"Human, Federation, Starfleet, Pilot, Resourceful, Duelist, Athlete, Compromised","male, organic, tos, sulu, crew_max_rarity_4","Parry Attack",0, 6, 12, 8, 12, 6, 4, , , , 415, , 225, 225, false,"Sulu",crew_portraits_cm_sulufencing_sm.png,sulu_fencing_crew, 43.9191, 49.3333, 15.0156, 49.7762, 4, 0, 0, 19.7917
"Morn",0,3, 0,0,0,0,0,0,359,70,174,0,0,0,418,121,295,0,0,0,0,1404,0,1423,0,1441,0,1281,0,1260,1078,1130,1301,0,1088,0,1316,0,1112,0,1276,0,974,0,1163,514,1038,921,0,783,1740,1669,"Lurian, Courier, Duelist, Civilian, Gambler, Smuggler","nonhuman, male, organic, ds9, morn, crew_max_rarity_3","Drinking Spot",0, 3, 0, 8, 8, , , , 1, 2, 150, 285, 57, 655, true,"Morn",crew_portraits_cm_morn_sm.png,morn_crew, 23.903, 27.1111, 9.3479, 27.4951, 3, 0, 0, 19.3576
"Seven in Blue",0,2, 0,0,0,294,51,209,0,0,0,278,53,130,0,0,0,0,0,0,1529,0,1473,0,0,1500,770,1478,947,1342,0,0,1518,971,0,1302,0,1412,0,0,1241,622,1272,755,1287,0,0,1449,941,0,1807,1769,"Human, Borg, Civilian, Federation, Astrophysicist","nonhuman, female, organic, voy, seven, crew_max_rarity_2","Ignore Irrelevancies",1, 2, 8, 10, 14, 4, 0, , , , 75, 50, 310, 170, false,"Seven",crew_portraits_cm_seven_of_nine_sm.png,seven_allblue_crew, 17.4314, 27.3333, 35.8562, 36.8509, 4, 0, 0, 21.0938
"Seven of Nine",0,5, 0,0,0,785,247,791,0,0,0,854,225,454,514,89,183,0,0,0,641,0,700,1376,0,597,59,256,360,662,1413,0,216,347,1027,72,0,321,1362,0,72,5,20,51,335,1409,0,104,103,1041,869,59,"Human, Borg, Civilian, Federation, Astrophysicist","nonhuman, female, organic, voy, seven, crew_max_rarity_5","New Collective",2, 7, 12, 10, 14, 4, 0, , , , 1750, , 705, 440, false,"Seven",crew_portraits_cm_sevenbluegreyshoulders_sm.png,seven_bluegreyshoulders_crew, 65.7784, 23.7778, 58.7175, 75.6416, 3, 0, 0, 21.0938
"Donik",0,3, 0,0,0,0,0,0,0,0,0,476,79,199,303,31,79,0,0,0,0,0,1288,1594,0,0,1028,1497,0,1169,1626,0,950,830,1296,0,0,1194,1623,0,0,888,1519,0,1086,1647,0,963,741,1309,1777,1796,"Hirogen, Innovator","nonhuman, male, organic, voy, donik, crew_max_rarity_3","Hunting Program",2, 4, 12, 12, 10, 7, 0, , , , 870, 165, , 340, false,"Donik",crew_portraits_cm_donik_sm.png,donik_crew, 23.863, 30.6667, 37.9155, 26.9738, 4, 0, 0, 0
"Commander Tucker",0,2, 252,28,82,0,0,0,0,0,0,305,53,185,0,0,0,0,0,0,1565,1492,1084,1620,1352,0,1208,0,0,1319,0,0,1498,958,0,1561,1490,1018,1621,1351,0,1018,0,0,1170,0,0,1317,842,0,1819,1810,"Human, Starfleet, Jury Rigger, Pilot, Explorer","male, organic, ent, tucker, crew_max_rarity_2","Warp Engines Online",1, 2, 6, 3, 8, 2, 0, , , , 520, 35, 50, 165, false,"Trip",crew_portraits_cm_tucker_sm.png,tucker_commander_crew, 16.9705, 35.5556, 71.2329, 46.924, 5, 0, 0, 19.7917
"Counselor Troi",0,1, 0,0,0,0,0,0,0,0,0,0,0,0,261,42,108,147,49,131,0,0,0,1601,1376,0,0,1503,985,0,1631,1232,1524,995,1150,0,0,0,1586,1287,0,0,1479,935,0,1621,1164,1489,947,922,1835,1821,"Federation, Starfleet, Human, Betazoid, Empath, Counselor","nonhuman, female, organic, tng, troi, crew_max_rarity_1","Counselling",2, 1, 6, 10, 10, , , , , , 265, , 80, 345, false,"Troi",crew_portraits_cm_troitng_sm.png,troi_casualgray_crew, 12.5626, 24.6667, 4.427, 31.3174, 4, 0, 0, 19.9436
"Rakal Troi",0,4, 521,163,354,0,0,0,525,128,331,0,0,0,0,0,0,407,163,440,1086,631,1035,1247,286,1045,0,0,658,972,1302,302,0,672,945,648,228,595,863,18,749,0,0,280,720,996,32,0,198,390,1420,193,"Federation, Starfleet, Human, Betazoid, Romulan, Empath, Undercover Operative, Tal Shiar","nonhuman, female, organic, tng, troi, crew_max_rarity_4","Romulan Disguise",1, 7, 12, 10, 14, 1, 2, , , , 90, 400, 175, 2825, false,"Troi",crew_portraits_cm_troirakal_sm.png,troi_rakal_crew, 44.44, 30.8889, 16.9973, 53.4456, 5, 0, 0, 0
