"Anij",10,4, 0,0,0,0,0,0,0,0,0,0,0,0,718,204,436,402,177,546,0,0,0,555,489,0,0,492,352,0,562,441,420,316,78,0,0,0,372,105,0,0,259,119,0,344,115,180,54,8,846,287,"Romantic, Civilian, Ba'ku, Caregiver","nonhuman, female, organic, tng, anij, crew_max_rarity_4","What's The Rush?",1, 7, 5, 8, 10, , , , , , 525, 190, 145, 365, false,"Anij",crew_portraits_cm_anij_sm.png,anij_crew
"Emergency Medical Holoprogram Mk.1",8,2, 0,0,0,257,31,112,0,0,0,0,0,0,0,0,0,400,23,71,879,0,0,0,716,870,587,856,344,0,0,662,0,449,685,865,0,0,0,782,853,572,841,444,0,0,727,0,489,740,1030,1061,"Hologram, Human, Federation, Starfleet, Physician","nonhuman, male, artificial_life, voy, emh, crew_max_rarity_2","Just Being Thorough",1, 4, 5, 8, 10, , , , , , 215, 150, 60, 590, false,"Doctor",crew_portraits_cm_emh_mk1_sm.png,emh_mk1_crew
"Mirror Zefram Cochrane",7,5, 0,0,0,1081,232,499,526,86,172,1029,86,169,0,0,0,0,0,0,210,675,336,0,0,41,34,268,148,66,733,527,333,183,0,159,696,663,0,0,43,47,179,116,309,765,577,672,394,0,310,412,"Human, Civilian, Warp Theorist, Innovator, Cultural Figure, Inspiring, Mirror Universe, Brutal, Terran Empire, Pilot, Thief","male, organic, ent, cochrane, crew_max_rarity_5","Raid The Ship!",0, 8, 12, 8, 12, 8, 4, , , , 415, 115, 167, 350, false,"Cochrane",crew_portraits_cm_cochrane_mirror_sm.png,cochrane_mirror_crew
"Amanda Grayson",10,4, 0,0,0,0,0,0,0,0,0,0,0,0,692,213,446,597,92,283,0,0,0,562,462,0,0,501,337,0,572,423,429,300,76,0,0,0,355,441,0,0,241,317,0,323,433,160,272,52,843,630,"Human, Federation, Caregiver, Civilian, Communicator","female, organic, amanda_grayson, tos, crew_max_rarity_4","How do you feel?",2, 8, 8, 8, 8, 3, 0, 3, , , 525, 165, 95, 600, false,"Amanda",crew_portraits_cm_amanda_greyson_sm.png,amanda_grayson_stiv_crew
"Kolinahr Spock",7,5, 884,107,300,560,31,115,0,0,0,0,0,0,1110,257,551,0,0,0,105,477,357,61,310,686,458,74,423,0,314,0,161,0,179,300,535,400,49,397,850,570,88,530,0,199,0,79,0,105,307,288,"Federation, Civilian, Exobiology, Musician, Astrophysicist, Human, Vulcan, Telepath, Spiritual","nonhuman, male, organic, tos, spock, spock_tos, crew_max_rarity_5","Infinite Diversity",1, 6, 5, 12, 8, 4, 0, 2, , , 400, 235, 127, 525, false,"Spock",crew_portraits_cm_spock_kolinahr_sm.png,spock_kolinahr_crew
"Surak",2,5, 403,161,459,1209,313,641,0,0,0,0,0,0,717,237,523,0,0,0,30,633,556,213,516,84,109,14,78,0,520,0,379,0,331,3,336,161,21,154,56,53,4,55,0,227,0,105,0,132,39,10,"Cultural Figure, Vulcan, Communicator, Desperate, Hero, Inspiring, Telepath","nonhuman, male, organic, ent, surak, crew_max_rarity_5","What Is, Is",2, 7, 12, 10, 12, 7, 0, , , , 500, 245, 150, 300, false,"Surak",crew_portraits_cm_surak_sm.png,surak_crew
"Annorax",8,5, 940,76,208,1204,243,569,386,140,296,0,0,0,0,0,0,0,0,0,20,224,358,518,311,30,130,168,88,610,778,576,0,0,0,29,269,605,699,567,17,97,126,90,381,544,362,0,0,0,254,145,"Krenim, Desperate, Romantic, Theoretical Engineer, Scoundrel, Brutal","male, organic, voy, annorax, crew_max_rarity_5","I'll Make The Time",2, 6, 12, 12, 20, 2, 0, , , , 600, 200, 195, 390, false,"Annorax",crew_portraits_cm_annorax_sm.png,annorax_crew
"Science Officer T'Pol",2,2, 0,0,0,382,39,147,0,0,0,0,0,0,246,32,93,0,0,0,800,0,0,893,0,798,536,576,490,0,910,0,847,0,736,819,0,0,883,0,805,531,650,501,0,905,0,832,0,721,1026,1044,"Vulcan, Starfleet, Astrophysicist, Telepath","nonhuman, female, organic, ent, first_officer, bridge_crew, tpol, crew_max_rarity_2","I'm Not Upset",1, 2, 5, 3, 10, 2, 0, , , , 265, 215, 101, 165, false,"T'Pol",crew_portraits_cm_tpol_jumpsuit_sm.png,tpol_redsuit_crew
"Warship Tuvok",6,5, 936,166,342,0,0,0,1281,112,276,0,0,0,0,0,0,0,0,0,320,59,268,448,236,203,0,0,0,178,332,127,0,0,0,354,166,280,471,266,489,0,0,0,430,613,418,0,0,0,457,732,"Vulcan, Hologram, Telepath, Brutal, Tactician, Starfleet, Federation","nonhuman, male, organic, voy, tuvok, crew_max_rarity_5","Fatality Rate Increasing!",0, 7, 10, 3, 15, 1, 1, , , , 425, 300, 195, 550, false,"Tuvok",crew_portraits_cm_tuvok_warship_sm.png,tuvok_warship_crew
"Vulcan Wedding T'Pol",4,4, 288,78,226,629,67,230,0,0,0,0,0,0,643,311,621,0,0,0,308,788,758,316,721,544,391,101,347,0,512,0,373,0,325,260,649,573,44,539,632,409,19,387,0,126,0,45,0,74,574,158,"Vulcan, Starfleet, Astrophysicist, Telepath","nonhuman, female, organic, ent, first_officer, bridge_crew, tpol, crew_max_rarity_4","Vulcans Appreciate Beauty",1, 8, 4, 14, 16, , , , , , 625, 175, 110, 440, false,"T'Pol",crew_portraits_cm_tpol_wedding_sm.png,tpol_wedding_crew
"Commander Keras",6,4, 795,90,299,0,0,0,0,0,0,0,0,0,556,111,288,0,0,0,468,520,402,242,359,0,0,592,0,0,671,0,548,0,469,509,552,428,229,417,0,0,544,0,0,615,0,467,0,442,858,826,"Inspiring, Desperate, Tactician, Romulan","male, nonhuman, tos, keras, commander, crew_max_rarity_4","Escape Maneuver One!",1, 7, 6, 8, 8, , , , , , 425, 310, 138, 565, false,"Keras",crew_portraits_cm_keras_sm.png,keras_crew
"Senator Vreenak",9,5, 984,121,320,0,0,0,0,0,0,0,0,0,1153,261,583,0,0,0,305,392,253,23,220,0,0,194,0,0,266,0,118,0,136,438,498,359,30,358,0,0,120,0,0,174,0,68,0,97,428,369,"Romulan, Diplomat, Politician, Investigator, Tal Shiar, Ambassador","nonhuman, male, organic, ds9, vreenak, crew_max_rarity_5","Somehow I thought You'd Be Taller",2, 7, 10, 6, 10, 7, 0, , , , 390, 250, 70, 690, false,"Vreenak",crew_portraits_cm_vreenak_senator_sm.png,vreenak_crew
"Portal 63",10,5, 0,0,0,0,0,0,478,103,233,998,69,143,1078,235,468,0,0,0,0,683,362,380,0,663,304,273,0,82,92,536,21,199,207,0,605,721,303,0,558,500,199,0,266,82,476,47,418,162,348,408,"Duelist, Tkon, Telepath","male, artificial_life, tng, tkon_guardian, crew_max_rarity_5","Shall I Destroy Them?",0, 8, 4, 8, 12, 5, 0, , , , 525, 75, 100, 305, false,"Portal 63",crew_portraits_cm_tkon_guardian_sm.png,tkon_guardian_crew
"Mintakan Troi",1,4, 0,0,0,307,69,219,0,0,0,0,0,0,947,159,328,604,101,249,831,0,0,472,469,818,557,151,186,0,450,429,293,303,46,658,0,0,502,472,649,421,155,154,0,501,465,342,291,98,509,534,"Federation, Starfleet, Human, Betazoid, Empath, Counselor, Caregiver, Undercover Operative, Prisoner, Merchant, Mintakan, Vulcan, Costumed","nonhuman, female, organic, tng, commander, bridge_crew, troi, crew_max_rarity_4","You Don't Want This",1, 7, 10, 10, 10, , , , , , 725, 100, 80, 500, false,"Troi",crew_portraits_cm_troi_mintakan_sm.png,troi_mintakan_crew
"Inglatu",10,5, 0,0,0,0,0,0,742,221,512,0,0,0,1241,217,439,0,0,0,0,476,0,308,0,402,0,196,0,344,23,291,120,0,138,0,259,0,357,0,135,0,243,0,121,13,106,161,0,188,458,255,"Dosi, Merchant, Brutal, Communicator","nonhuman, male, organic, ds9, inglatu, crew_max_rarity_5","You Are Starting To Annoy Me",0, 8, 10, 8, 12, 4, 0, , , , 390, 50, 125, 625, false,"Inglatu",crew_portraits_cm_inglatu_sm.png,inglatu_crew
"Profitable Ishka",6,4, 644,94,215,0,0,0,0,0,0,0,0,0,888,134,305,0,0,0,547,571,483,153,442,0,0,443,0,0,509,0,372,0,324,618,643,560,265,527,0,0,490,0,0,559,0,402,0,385,802,853,"Civilian, Ferengi, Merchant, Inspiring, Resourceful, Crafty","female, organic, ds9, ishka, crew_max_rarity_4","Society Could Use A Little Chaos",1, 7, 8, 8, 12, 4, 1, , , , 375, 100, 165, 350, false,"Moogie",crew_portraits_cm_ishka_latinum_sm.png,ishka_latinum_crew
"Prophet Sarah Sisko",3,5, 461,148,322,965,203,411,0,0,0,0,0,0,1249,202,414,0,0,0,59,644,572,90,528,261,213,3,176,0,288,0,132,0,147,30,468,323,82,317,242,182,18,169,0,372,0,205,0,226,22,83,"Human, Bajoran, Prophet, Cultural Figure, Inspiring","female, organic, ds9, sisko_sarah, crew_max_rarity_5","Don't Be Afraid",0, 8, 8, 8, 12, 4, 2, , , , 450, 330, 180, 400, false,"Sarah",crew_portraits_cm_sarah_sisko_sm.png,sisko_sarah_crew
"Alan-A-Dale",3,4, 0,0,0,0,0,0,593,104,222,433,40,118,810,159,329,0,0,0,0,610,699,549,0,571,518,482,0,226,158,454,128,424,361,0,618,772,503,0,572,563,428,0,332,183,487,173,459,337,586,683,"Human, Starfleet, Cyberneticist, Federation, Costumed, Musician, Innovator","male, nonhuman, tng, laforge, crew_max_rarity_4","A Mandolin's Melody",1, 6, 4, 8, 12, 7, 0, , , , 500, 100, 195, 565, true,"La Forge",crew_portraits_cm_laforge_alanadale_sm.png,laforge_alanadale_crew
"Virtuoso Doctor",6,5, 0,0,0,508,99,193,0,0,0,0,0,0,1157,236,601,772,123,338,677,0,0,303,353,655,443,55,81,0,267,353,119,233,22,654,0,0,203,340,646,418,33,107,0,178,335,72,197,13,318,130,"Hologram, Human, Federation, Starfleet, Musician, Physician, Desperate, Inspiring","nonhuman, male, artificial_life, voy, emh, crew_max_rarity_5","Pick Up The Tempo",1, 7, 8, 8, 12, 7, 0, , , , 400, 200, 100, 450, false,"Doctor",crew_portraits_cm_emh_virtuoso_sm.png,emh_virtuoso_crew
"Gunslinger Uhura",6,5, 531,55,119,0,0,0,1169,228,458,0,0,0,849,244,463,0,0,0,717,112,644,199,609,182,0,362,0,156,18,110,282,0,269,827,187,749,184,710,164,0,197,0,141,12,125,130,0,158,231,132,"Human, Federation, Starfleet, Communicator, Resourceful, Costumed, Marksman, Smuggler","bridge_crew, female, organic, tos, uhura, lieutenant_commander, original, crew_max_rarity_5","Reach For The Sky!",0, 7, 12, 3, 15, 1, 1, , , , 640, 220, 140, 350, false,"Uhura",crew_portraits_cm_uhura_six_shooter_sm.png,uhura_cowboy_crew
"Captain Killy",5,5, 1145,207,450,0,0,0,988,105,206,567,44,142,0,0,0,0,0,0,193,66,34,346,111,370,442,0,0,67,486,270,621,361,0,197,131,56,326,129,599,533,0,0,321,691,518,763,440,0,275,482,"Human, Brutal, Terran Empire, Mirror Universe, Starfleet, Veteran","female, organic, dsc, tilly, captain, crew_max_rarity_5","The Slayer of Sorna Prime",0, 10, 6, 6, 10, 1, 0, 2, 1, 3, 600, 225, 195, 350, false,"Killy",crew_portraits_cm_tilly_mirror_sm.png,dsc_tilly_mirror_crew
"Off-Duty Tilly",2,2, 0,0,0,0,0,0,0,0,0,297,25,68,391,73,183,0,0,0,0,0,805,789,0,0,584,769,0,740,816,0,501,474,640,0,0,831,742,0,0,606,714,0,753,778,0,530,490,584,1015,1032,"Human, Theoretical Engineer, Federation, Starfleet, Romantic","female, organic, dsc, tilly, crew_max_rarity_2","Add Salsa!",1, 3, 4, 8, 8, 3, 0, , , , 390, 125, 145, 440, false,"Tilly",crew_portraits_cm_tilly_off_duty_sm.png,dsc_tilly_off_duty_crew
"Tieran Possessed Kes",3,4, 943,34,109,0,0,0,416,54,130,0,0,0,0,0,0,525,83,238,450,300,386,554,29,770,0,0,388,652,819,219,0,343,506,864,615,787,862,332,798,0,0,366,680,860,280,0,327,504,663,899,"Ocampa, Romantic, Civilian, Telepath, Interrogator, Brutal, Villain","nonhuman, female, organic, voy, kes, crew_max_rarity_4","Stronger Than Ever!",0, 7, 4, 8, 8, , , , , , 275, 100, 68, 450, false,"Kes",crew_portraits_cm_kes_tieran_sm.png,kes_tieran_crew
"Pah-wraith Keiko",4,5, 1416,48,108,0,0,0,964,137,290,0,0,0,509,67,152,0,0,0,181,55,135,123,102,341,0,710,0,293,164,247,678,0,583,848,370,768,615,735,448,0,757,0,390,319,372,725,0,631,252,811,"Human, Federation, Civilian, Scoundrel, Brutal, Villain","female, organic, ds9, keiko, crew_max_rarity_5","I'm In Charge Now",2, 7, 10, 8, 12, 8, 4, , , , 450, 250, 40, 675, false,"Keiko",crew_portraits_cm_keiko_pawraith_sm.png,keiko_pahwraith_crew
"War Correspondent Jake Sisko",8,5, 0,0,0,0,0,0,882,116,269,0,0,0,1216,149,293,503,100,232,0,492,0,376,555,428,0,269,400,368,46,37,203,354,41,0,556,0,553,503,493,0,487,357,433,177,112,399,313,123,341,491,"Human, Federation, Civilian, Writer, Gambler, Desperate, Inspiring","male, organic, ds9, jake, crew_max_rarity_5","Now We're Talking!",2, 8, 10, 8, 12, 4, 0, , , , 175, 200, 285, 400, false,"Jake",crew_portraits_cm_jake_warcorrespondent_sm.png,jake_correspondent_crew
"Xindi 'Prisoner' Archer",7,4, 406,161,344,0,0,0,367,79,157,0,0,0,842,112,229,0,0,0,664,450,602,259,558,786,0,511,0,668,320,637,440,0,391,363,249,286,194,273,721,0,617,0,613,413,603,540,0,488,709,561,"Human, Starfleet, Desperate, Crafty, Costumed, Hero, Explorer, Pilot, Interrogator","male, organic, ent, captain, archer, crew_max_rarity_4","Thanks For Your Help",2, 7, 10, 7, 10, 7, 0, , , , 550, 200, 100, 590, false,"Archer",crew_portraits_cm_archer_xindi_prisoner_sm.png,archer_prisoner_crew
"Captain Rachel Garrett",10,5, 1089,221,502,996,73,164,0,0,0,0,0,0,420,123,248,0,0,0,26,319,152,132,118,392,294,137,243,0,780,0,692,0,601,52,266,106,75,97,730,481,288,445,0,641,0,499,0,462,334,309,"Astrophysicist, Diplomat, Human, Desperate, Federation, Starfleet, Hero, Pilot","captain, female, organic, tng, garrett, crew_max_rarity_5","One For The History Books!",1, 9, 8, 10, 10, , , , , , 300, 235, 103, 650, false,"Garrett",crew_portraits_cm_rachel_garret_sm.png,garrett_captain_crew
"Starfleet Uniform Khan",6,3, 495,66,260,0,0,0,338,67,143,0,0,0,0,0,0,0,0,0,665,472,603,702,559,823,0,0,0,696,863,667,0,0,0,601,402,534,659,504,760,0,0,0,649,839,636,0,0,0,962,948,"Human, Augments, Engineered, Villain, Cultural Figure, Tactician, Resourceful, Survivalist, Brutal","nonhuman, male, organic, tos, khan, crew_max_rarity_3","Have any other questions?",0, 6, 10, 8, 8, , , , , , 490, 165, 113, 580, false,"Khan",crew_portraits_cm_khan_commander_sm.png,khan_command_crew
"Enemy Lines Sisko",5,5, 1124,196,514,0,0,0,909,166,328,0,0,0,596,11,31,0,0,0,190,62,142,127,108,360,0,711,0,307,171,262,679,0,584,162,56,114,256,106,357,0,894,0,315,450,283,878,0,759,288,379,"Human, Federation, Starfleet, Bajoran, Cultural Figure, Inspiring, Tactician, Desperate, Diplomat","male, organic, ds9, captain, bridge_crew, sisko, crew_max_rarity_5","Surrender!",1, 8, 8, 6, 12, 1, 0, 2, , , 550, 100, 148, 440, false,"Sisko",crew_portraits_cm_sisko_enemy_lines_sm.png,sisko_enemy_lines_crew
"Bell Riots Bashir",6,5, 0,0,0,0,0,0,585,8,18,0,0,0,847,242,487,1195,133,365,0,721,0,454,125,720,0,351,143,615,161,24,275,89,19,0,855,0,284,289,902,0,184,238,764,233,267,118,177,25,301,409,"Human, Starfleet, Federation, Desperate, Costumed, Physician, Engineered","nonhuman, male, organic, ds9, bashir, crew_max_rarity_5","Field Medicine",1, 7, 12, 8, 12, 2, 0, 2, , , 650, 250, 235, 350, false,"Bashir",crew_portraits_cm_bashir_bellriots_sm.png,bashir_bell_riots_crew
"Roga Danar",4,4, 337,90,216,0,0,0,769,183,376,532,95,265,0,0,0,0,0,0,779,297,277,797,666,444,420,0,0,77,558,332,585,339,0,626,182,138,677,536,282,356,0,0,53,422,220,513,286,0,640,416,"Angosian, Crafty, Desperate, Prisoner, Jury Rigger, Resourceful, Veteran","male, organic, tng, danar, crew_max_rarity_4","My Battle Is Never Over",0, 6, 10, 8, 12, 7, 0, , , , 350, 200, 100, 215, false,"Danar",crew_portraits_cm_roga_danar_sm.png,danar_crew
"Chancellor Gorkon",6,5, 864,157,369,0,0,0,383,191,385,0,0,0,1258,203,407,0,0,0,387,191,337,42,293,639,0,199,0,552,60,510,126,0,140,329,83,255,65,243,267,0,289,0,226,45,200,211,0,232,178,65,"Klingon, Diplomat, Politician, Cultural Figure","male, organic, tos, gorkon, crew_max_rarity_5","You Don't Trust Me, Do You?",0, 7, 10, 6, 10, 1, 2, , , , 500, 105, 240, 375, false,"Gorkon",crew_portraits_cm_gorkon_sm.png,gorkon_chancellor_crew
"Tosk",10,5, 0,0,0,0,0,0,937,164,351,1158,218,399,0,0,0,0,0,0,0,425,159,0,0,318,186,0,0,22,446,226,197,91,0,0,425,183,0,0,336,184,0,0,18,467,268,203,104,0,468,516,"Desperate, Explorer, Crafty, Athlete, Tosk, Prisoner","nonhuman, male, organic, tosk, ds9, crew_max_rarity_5","I am Tosk",1, 8, 12, 6, 10, 2, 0, 2, , , 600, 225, 285, 200, false,"Tosk",crew_portraits_cm_tosk_sm.png,tosk_crew
"Bell Riots Jadzia Dax",7,5, 0,0,0,471,87,185,0,0,0,968,73,258,1129,228,459,0,0,0,735,0,349,362,0,712,101,82,446,331,333,0,19,190,195,682,0,541,316,0,669,196,86,407,516,285,0,28,321,170,330,375,"Federation, Starfleet, Costumed, Desperate, Trill","nonhuman, female, organic, ds9, lieutenant, bridge_crew, dax, crew_max_rarity_5","We Have to Find My Friends",1, 8, 8, 10, 12, , , , , , 475, 200, 170, 390, false,"J. Dax",crew_portraits_cm_dax_jadzia_riots_sm.png,dax_jadzia_riots_crew
"Malik",9,4, 334,39,119,0,0,0,735,180,376,0,0,0,661,57,122,0,0,0,858,327,784,483,745,458,0,593,0,395,178,351,549,0,471,847,273,766,655,731,283,0,809,0,249,235,221,774,0,678,698,735,"Human, Augments, Engineered, Brutal, Civilian","male, organic, ent, malik, crew_max_rarity_4","This Is An Act Of Mercy",0, 7, 8, 6, 10, 8, 4, , , , 425, 140, 130, 400, false,"Malik",crew_portraits_cm_malik_sm.png,malik_crew
"Solar Sails Sisko",5,5, 539,72,150,903,155,378,0,0,0,1230,146,404,0,0,0,0,0,0,86,669,35,704,566,349,26,388,219,164,0,0,175,73,0,137,740,92,778,657,328,30,370,214,281,0,0,281,152,0,244,343,"Human, Federation, Starfleet, Bajoran, Cultural Figure, Inspiring, Caregiver, Chef, Diplomat, Resourceful, Explorer","male, organic, ds9, captain, bridge_crew, sisko, crew_max_rarity_5","Time For A Change",1, 10, 8, 10, 10, , , , , , 600, 300, 120, 300, false,"Sisko",crew_portraits_cm_sisko_solar_sm.png,sisko_solar_crew
"Species 8472 Invader",9,5, 0,0,0,1009,236,595,1021,345,698,0,0,0,0,0,0,0,0,0,218,299,0,0,0,2,192,274,153,144,294,104,0,0,0,101,98,0,0,0,2,91,123,87,24,69,21,0,0,0,400,32,"Hunter, Species 8472, Brutal, Resourceful, Telepath","organic, voy, nonhuman, species_8472, crew_max_rarity_5","The Weak Will Perish",0, 10, 8, 8, 10, , , , 1, 3, 365, 200, 153, 675, false,"Species 8472",crew_portraits_cm_species_8472_sm.png,species_8472_crew
"Sarina Douglas",4,4, 0,0,0,871,150,371,0,0,0,615,114,239,0,0,0,357,57,112,402,0,504,0,722,379,67,423,99,470,0,663,530,129,689,355,0,505,0,723,348,75,391,131,487,0,677,524,167,681,548,623,"Human, Federation, Engineered, Civilian, Romantic","female, organic, ds9, crew_max_rarity_4","I've Played Enough",1, 5, 10, 10, 8, , , , , , 450, , 150, 225, true,"Sarina",crew_portraits_cm_sarina_douglas_sm.png,sarina_crew
"Augment Commander O'Brien",6,5, 0,0,0,0,0,0,1139,311,671,965,175,366,0,0,0,0,0,0,0,246,255,0,0,102,228,0,0,3,218,54,259,134,0,0,127,257,0,0,39,242,0,0,1,92,30,287,156,0,417,151,"Human, Augments, Engineered, Tactician, Saboteur, Marksman, Brutal, Innovator","male, organic, obrien, tos, tng, ds9, original, crew_max_rarity_5","Take Aim!",0, 9, 8, 8, 12, 7, 4, , , , 540, 410, 45, 200, false,"O'Brien",crew_portraits_cm_obrien_augment_sm.png,obrien_augment_crew
"Mirror Leeta",7,4, 744,150,364,0,0,0,677,76,153,0,0,0,402,32,64,0,0,0,459,198,393,363,350,531,0,811,0,466,405,424,787,0,686,342,248,269,386,254,734,0,877,0,626,674,612,857,0,741,633,772,"Bajoran, Mirror Universe, Romantic, Terran Empire","female, nonhuman, organic, ds9, leeta, crew_max_rarity_4","I Don't Think So",2, 5, 4, 12, 10, 4, 0, 2, , , 575, 275, 148, 350, false,"Leeta",crew_portraits_cm_leeta_mirror_sm.png,leeta_mirror_crew
"Miranda Jones",9,5, 558,33,63,1069,46,105,0,0,0,0,0,0,1118,236,466,0,0,0,99,707,659,131,621,365,284,33,231,0,337,0,190,0,196,718,834,827,230,780,845,567,114,526,0,273,0,133,0,163,320,703,"Human, Communicator, Telepath, Vulcan","female, organic, tos, miranda_jones, crew_max_rarity_5","Violent Emotion is a Kind of Insanity",2, 10, 10, 10, 15, , , , , , 485, 330, 55, 525, false,"Miranda",crew_portraits_cm_miranda_jones_sm.png,miranda_jones_crew
"Dancing Chekov",8,5, 553,37,119,0,0,0,965,151,276,0,0,0,1208,198,395,0,0,0,695,193,629,120,589,338,0,241,0,290,22,245,166,0,183,849,371,769,269,736,449,0,303,0,391,86,373,230,0,251,246,475,"Federation, Starfleet, Human, Resourceful, Tactician","male, organic, tos, commander, bridge_crew, chekov, crew_max_rarity_5","We're In A Lot Of Trouble",1, 8, 8, 12, 10, 0, 1, , , , 500, 250, 150, 450, false,"Chekov",crew_portraits_cm_chekov_dancing_sm.png,chekov_dancing_crew
"Smuggler Kasidy Yates",8,4, 647,120,296,0,0,0,360,129,317,579,96,327,0,0,0,0,0,0,519,320,78,601,406,732,384,0,0,206,794,589,532,306,0,474,185,63,566,388,424,305,0,0,73,529,347,427,236,0,658,350,"Federation, Civilian, Human, Pilot, Smuggler, Jury Rigger","female, organic, ds9, yates, crew_max_rarity_4","I'll Be Back",1, 8, 8, 12, 17, , , , , , 575, 205, 65, 350, false,"Yates",crew_portraits_cm_yates_smuggler_sm.png,yates_smuggler_crew
"Queen Guinevere Kira",8,5, 1084,80,157,0,0,0,1096,323,666,0,0,0,0,0,0,0,0,0,309,20,256,440,223,120,0,0,0,119,250,72,0,0,0,733,49,679,756,634,38,0,0,0,37,90,27,0,0,0,426,400,"Bajoran, Costumed, Veteran, Desperate, Duelist, Royalty","nonhuman, female, organic, ds9, kira, crew_max_rarity_5","You Left Me No Choice",0, 8, 8, 4, 10, 1, 1, , , , 300, 110, 228, 615, false,"Kira",crew_portraits_cm_kira_camelot_sm.png,kira_camelot_crew
"Tourist Reed",10,4, 732,138,369,0,0,0,239,165,337,0,0,0,719,13,30,0,0,0,473,315,406,246,362,777,0,599,0,659,409,630,559,0,476,356,114,281,439,267,351,0,893,0,310,437,277,877,0,758,656,578,"Starfleet, Human, Romantic, Desperate, Resourceful","male, organic, ent, lieutenant, reed, crew_max_rarity_4","Follow Two Aliens into a Basement",2, 9, 11, 4, 10, , , , , , 190, 292, 120, 450, false,"Reed",crew_portraits_cm_reed_tourist_sm.png,reed_tourist_crew
"Mambo Picard",3,5, 396,201,354,1077,18,70,0,0,0,0,0,0,1099,394,747,0,0,0,92,654,596,80,546,383,289,11,238,0,209,0,64,0,92,208,390,224,3,217,891,607,20,554,0,58,0,17,0,35,69,55,"Federation, Starfleet, Human, Casual, Romantic, Musician","male, organic, tng, captain, bridge_crew, picard, crew_max_rarity_5","That's More Like It",1, 7, 10, 8, 10, 0, 1, , , , 750, 295, , 750, false,"Picard",crew_portraits_cm_picard_mambo_sm.png,picard_mambo_crew
"Interfaced La Forge",2,5, 0,0,0,444,100,236,0,0,0,906,182,516,1254,237,470,0,0,0,729,0,233,280,0,705,74,58,442,234,236,0,2,120,116,598,0,127,296,0,567,36,55,358,145,267,0,3,67,159,81,67,"Human, Starfleet, Federation, Cyberneticist, Innovator, Communicator, Hero","male, organic, tng, lieutenant, laforge, crew_max_rarity_5","How Is This Possible?",2, 10, 12, 10, 10, , , , , , 500, 100, 145, 150, false,"La Forge",crew_portraits_cm_laforge_interface_sm.png,laforge_interfaced_crew
"Geordi La Forge",9,2, 284,18,65,0,0,0,0,0,0,327,92,221,159,8,24,0,0,0,877,822,486,794,765,0,529,894,0,675,930,0,622,435,761,901,843,435,887,793,0,396,896,0,540,932,0,534,343,762,995,1002,"Human, Starfleet, Pilot, Federation, Innovator, Cyberneticist","male, organic, tng, laforge, crew_max_rarity_2","None of it is familiar",2, 2, 5, 5, 10, 6, 0, , , , 450, 125, 145, 165, false,"La Forge",crew_portraits_cm_laforge_helmsman_sm.png,laforge_helmsman_crew
"Breen Disguise Dukat",5,4, 489,127,276,0,0,0,748,169,380,0,0,0,239,131,283,0,0,0,642,222,576,501,532,453,0,818,0,391,338,346,795,0,693,489,141,410,208,404,293,0,523,0,256,106,228,442,0,423,707,265,"Cardassian, Brutal, Desperate, Veteran, Cultural Figure, Villain, Undercover Operative, Breen","nonhuman, evsuit, male, organic, ds9, dukat, crew_max_rarity_4","This Isn't Funny",0, 6, 12, 10, 10, 6, 2, , , , 400, 170, 113, 550, false,"Dukat",crew_portraits_cm_dukat_breen_disquise_sm.png,dukat_breen_crew
"Niners Worf",7,5, 401,194,403,0,0,0,1185,184,384,0,0,0,812,52,99,0,0,0,637,108,567,281,523,205,0,546,0,179,51,129,492,0,426,254,65,184,258,174,278,0,834,0,239,244,215,801,0,698,385,311,"Klingon, Athlete, Costumed, Federation, Starfleet","nonhuman, male, organic, ds9, bridge_crew, worf, niners, crew_max_rarity_5","Find Him And Kill Him!",0, 6, 8, 6, 12, 4, 0, , , , 300, 105, 225, 490, false,"Worf",crew_portraits_cm_worf_niners_sm.png,worf_niners_crew
"Herbert Rossoff",6,4, 831,205,457,0,0,0,0,0,0,0,0,0,589,94,195,0,0,0,364,437,309,156,272,0,0,612,0,0,691,0,570,0,488,191,301,132,137,125,0,0,682,0,0,736,0,623,0,547,805,690,"Human, Crafty, Civilian, Veteran, Innovator, Writer, Resourceful, Communicator","male, organic, ds9, quark, crew_max_rarity_4","Would Someone Please Shoot Me?",1, 8, 4, 8, 8, , , , 0, 2, 400, 190, 197, 405, false,"Herbert",crew_portraits_cm_quark_rossoff_sm.png,quark_herbert_crew
"Satin Dress Lily Sloane",7,5, 0,0,0,0,0,0,934,123,262,416,146,293,1157,257,524,0,0,0,0,465,647,321,0,384,466,214,0,78,27,282,34,377,157,0,557,382,254,0,494,295,149,0,90,50,422,8,222,121,276,122,"Human, Civilian, Undercover Operative, Desperate, Communicator, Crafty, Resourceful, Costumed","female, organic, tng, lily, crew_max_rarity_5","You Never Quit",0, 8, 8, 8, 10, , , , 3, 800, 575, 380, 245, 225, false,"Lily",crew_portraits_cm_sloane_satin_sm.png,lily_sloane_satin_crew
"Rain Robinson",7,5, 0,0,0,1113,232,508,0,0,0,381,189,377,1006,116,271,0,0,0,197,0,613,463,0,197,51,25,133,564,437,0,45,360,267,151,0,231,608,0,143,8,32,114,258,626,0,43,139,449,233,90,"Human, Civilian, Desperate, Communicator, Resourceful, Astrophysicist","female, organic, voy, rain, crew_max_rarity_5","Anyone Up There?",2, 8, 12, 10, 12, 7, 0, , , , 300, 275, 207, 175, false,"Rain",crew_portraits_cm_rain_robinson_sm.png,rain_robinson_crew
"Emperor Philippa Georgiou",6,5, 1216,131,385,0,0,0,1019,128,264,0,0,0,371,155,317,0,0,0,192,54,143,128,110,294,0,730,0,257,154,204,693,0,602,339,160,263,127,250,481,0,447,0,424,158,411,356,0,350,253,258,"Terran Empire, Mirror Universe, Human, Brutal, Royalty","female, organic, dsc, georgiou, crew_max_rarity_5","Imperial Majesty",2, 7, 10, 15, 15, 8, 4, , , , 450, 335, 152, 100, false,"Georgiou",crew_portraits_cm_georgiou_empress_sm.png,dsc_georgiou_mirror_crew
"Festive Lwaxana Troi",9,4, 636,83,174,0,0,0,0,0,0,0,0,0,727,182,389,0,0,0,578,594,510,232,480,0,0,513,0,0,581,0,442,0,392,697,697,650,204,606,0,0,330,0,0,428,0,259,0,277,848,799,"Federation, Diplomat, Betazoid, Romantic, Civilian, Telepath, Ambassador","nonhuman, female, organic, ds9, lwaxana, crew_max_rarity_4","Dance With Me",1, 6, 8, 10, 16, 6, 0, , , , 400, 160, 115, 650, false,"Troi",crew_portraits_cm_troi_festivelwaxana_sm.png,troi_lwaxana_festive_crew
"Merry Men Crusher",7,5, 0,0,0,419,69,186,1160,195,257,0,0,0,0,0,0,1122,53,158,755,346,0,0,199,50,509,764,67,202,363,8,0,122,244,712,487,0,0,678,156,461,715,262,363,521,140,0,417,637,347,718,"Human, Starfleet, Federation, Physician, Costumed, Resourceful","female, organic, tng, commander, crusher, crew_max_rarity_5","I've Stopped The Bleed",1, 7, 8, 8, 12, 6, 0, , , , 525, 200, 140, 375, false,"Crusher",crew_portraits_cm_crusher_merrymen_sm.png,crusher_merrymen_crew
"Ahdar Ru'afo",6,5, 757,187,447,506,109,219,0,0,0,1362,69,227,0,0,0,0,0,0,100,482,16,528,315,640,46,656,402,159,0,0,167,69,0,53,323,39,358,143,584,175,624,363,562,0,0,613,360,0,298,383,"Son'a, Brutal, Villain, Survivalist, Resourceful","male, nonhuman, organic, tng, ruafo, crew_max_rarity_5","Not Joining Us For Dinner",0, 6, 10, 5, 14, 7, 0, , , , 585, 125, 160, 450, false,"Ru'afo",crew_portraits_cm_ruafo_sm.png,ruafo_crew
