"Data and Spot",8,5, 0,0,0,1065,100,250,0,0,0,1328,171,371,538,54,152,0,0,0,563,0,260,1186,0,534,18,222,312,304,1224,0,72,92,894,917,0,442,1300,0,873,98,559,525,483,1350,0,208,217,1033,356,933,"Android, Starfleet, Federation, Cyberneticist, Caregiver, Writer","nonhuman, male, tng, artificial_life, data, exclusive_collection, crew_max_rarity_5","Oh, Spot, The Complex Levels of Behavior You Display!",2, 10, 8, 8, 12, , , , 1, 2, 650, 200, 165, 675, false,"Data",crew_portraits_cm_data_spot_sm.png,data_spot_crew
"Tendi and The Dog",8,5, 0,0,0,1314,222,424,0,0,0,508,76,146,0,0,0,1000,127,333,255,0,1089,0,394,263,78,336,7,1007,0,377,1127,34,467,352,0,1148,0,536,343,114,418,33,1045,0,539,1171,98,563,375,540,"Orion, Starfleet, Federation, Geneticist, Engineered, Shapeshifter, Playful","female, organic, low, tendi, nonhuman, crew_max_rarity_5","Who Has Malleable Protein Bonds? You Do!",0, 6, 9, 7, 8, 6, 0, , , , 165, 100, 110, 325, false,"Tendi",crew_portraits_cm_tendi_dog_sm.png,tendi_dog_crew
"Ensign Mariner",1,2, 383,80,207,0,0,0,277,58,155,0,0,0,151,29,67,0,0,0,1188,897,1121,1102,1011,1331,0,1367,0,1163,1283,1073,1358,0,1171,1031,699,991,971,871,1180,0,1353,0,1064,1140,976,1344,0,1155,1510,1473,"Federation, Starfleet, Human, Casual, Maverick, Playful","female, organic, low, mariner, crew_max_rarity_2","Boim us out of here!",2, 6, 4, 5, 10, 1, 1, , , , 500, 50, 40, 175, false,"Mariner",crew_portraits_cm_mariner_ensign_sm.png,mariner_ensign_crew
"Vindicta Mariner",1,4, 652,85,253,372,64,151,948,145,279,0,0,0,0,0,0,0,0,0,498,259,809,1028,691,225,944,1249,792,575,863,472,0,0,0,506,380,859,1054,752,337,900,1202,745,686,960,605,0,0,0,964,1155,"Starfleet, Human, Federation, Maverick, Brutal, Criminal, Costumed, Villain, Playful, Vengeful","female, organic, low, mariner, jan2024, crew_max_rarity_4","I Am Vindicta, Vengeance Personified!",0, 7, 10, 6, 8, 1, 0, , , , 400, 325, 170, 475, false,"Vindicta",crew_portraits_cm_mariner_vindicta_sm.png,mariner_vindicta_crew
"EV Suit Mariner",8,5, 1348,133,331,496,78,171,0,0,0,1079,92,236,0,0,0,0,0,0,90,495,15,522,155,1119,135,1140,701,485,0,0,527,231,0,250,754,145,818,496,1104,337,1139,675,840,0,0,930,513,0,415,1021,"Federation, Starfleet, Human, Desperate, Maverick, Resourceful, Playful","female, organic, low, mariner, evsuit, crew_max_rarity_5","Sorry! Uh, New Boots!",0, 9, 8, 6, 14, 8, 4, , , , 525, 95, 170, 475, false,"Mariner",crew_portraits_cm_mariner_evsuit_sm.png,mariner_evsuit_crew
"First Monarch Kaitaama",7,4, 663,92,235,0,0,0,0,0,0,0,0,0,950,121,312,380,67,148,878,935,806,274,314,0,0,697,783,0,865,1002,628,737,193,945,983,886,394,361,0,0,817,742,0,954,986,733,739,269,949,1171,"Kriosian, Royalty, Romantic, Ambassador, Desperate, Prisoner","nonhuman, female, organic, ent, kaitaama, crew_max_rarity_4","Is Your Entire Species So Ill Mannered?",1, 9, 3, 8, 9, , , , 2, 2, 100, 170, 120, 150, false,"Kaitaama",crew_portraits_cm_kaitaama_first_monarch_sm.png,kaitaama_crew
"Ensign Tendi",7,2, 0,0,0,258,27,86,0,0,0,154,15,41,0,0,0,403,44,161,1351,0,1318,0,1028,1352,916,1338,504,1195,0,984,1365,575,1033,1354,0,1317,0,1071,1349,988,1339,561,1196,0,1009,1362,655,1035,1543,1571,"Orion, Starfleet, Federation, Nurse, Resourceful","female, organic, nonhuman, low, tendi, crew_max_rarity_2","Did That Full Molecular Engorgement Feel Amazing?!",2, 2, 6, 6, 8, 6, 0, , , , 215, 100, 175, 25, false,"Tendi",crew_portraits_cm_tendi_ensign_sm.png,tendi_ensign_crew
"Lt. Shaxs",7,5, 834,260,575,0,0,0,956,307,715,0,0,0,475,76,248,0,0,0,552,106,485,321,369,385,0,1098,0,364,162,248,1084,0,914,139,5,113,74,72,65,0,992,0,61,29,35,944,0,795,537,29,"Bajoran, Federation, Starfleet, Brutal, Veteran, Desperate, Tactician","nonhuman, male, organic, low, shaxs, crew_max_rarity_5","Recommendation: Full Assault",0, 7, 8, 6, 12, 4, 0, , , , 350, 205, 108, 265, false,"Shaxs",crew_portraits_cm_shaxs_lt_sm.png,shaxs_lt_crew
"Captain Carol Freeman",7,4, 881,146,303,0,0,0,410,78,154,0,0,0,670,93,197,0,0,0,719,454,661,302,527,1181,0,919,0,1053,641,950,885,0,741,705,455,632,418,544,1139,0,1067,0,1024,734,940,1021,0,872,981,1162,"Starfleet, Federation, Human, Diplomat, Resourceful, Communicator","female, organic, low, freeman, crew_max_rarity_4","Warp Me",0, 9, 10, 7, 7, , , , 1, 2, 425, 300, 121, 430, false,"Freeman",crew_portraits_cm_freeman_captain_sm.png,freeman_captain_crew
"Phased Boimler",7,4, 0,0,0,0,0,0,384,50,148,657,95,199,948,142,301,0,0,0,0,1204,843,828,0,1240,641,694,0,452,419,996,127,484,525,0,1221,974,898,0,1242,708,788,0,551,507,1015,217,591,609,975,1218,"Federation, Starfleet, Human, Desperate, Inspiring","male, organic, low, boimler, crew_max_rarity_4","Its Gonna Be Great!",1, 7, 10, 10, 10, 4, 2, , , , 500, 265, 110, 675, false,"Boimler",crew_portraits_cm_phased_boimler_sm.png,phased_boimler_crew
"Ensign Boimler",6,2, 371,63,163,0,0,0,0,0,0,0,0,0,278,46,111,0,0,0,1239,1208,1161,1003,1051,0,0,1321,0,0,1413,0,1312,0,1132,1185,1165,1133,972,1014,0,0,1298,0,0,1400,0,1278,0,1103,1569,1569,"Federation, Starfleet, Human, Desperate","male, organic, low, boimler, crew_max_rarity_2","Evasive Maneuver Eighty... Eight?",1, 5, 8, 10, 8, , , , , , 450, 150, 115, 315, false,"Boimler",crew_portraits_cm_boimler_ensign_sm.png,boimler_ensign_crew
"All-in Owosekun",8,5, 1072,82,249,0,0,0,1352,112,315,0,0,0,513,83,181,0,0,0,555,65,491,316,374,304,0,1072,0,307,132,193,1061,0,889,934,386,879,649,770,734,0,1098,0,681,425,602,1070,0,910,345,1059,"Human, Federation, Starfleet, Athlete, Duelist, Gambler, Brutal, Crafty, Displaced","female, organic, dsc, owosekun, crew_max_rarity_5","I'm In. All The Way.",0, 10, 6, 8, 12, , , , , , 740, 600, 315, 540, false,"Owosekun",crew_portraits_cm_owosekun_allin_sm.png,dsc_owosekun_allin_crew
"Cowpoke Boimler",4,4, 654,102,206,0,0,0,920,209,356,0,0,0,409,73,112,0,0,0,896,247,831,690,709,554,0,1212,0,516,346,390,1197,0,1028,976,273,929,771,818,462,0,1262,0,438,335,338,1244,0,1072,890,978,"Federation, Starfleet, Human, Constable, Marksman, Costumed, Casual","male, organic, low, boimler, original, crew_max_rarity_4","This Holodeck Ain't Big Enough for the Both of Us",1, 5, 12, 9, 10, 4, 0, , , , 75, 100, 35, 75, false,"Boimler",crew_portraits_cm_boimler_cowpoke_sm.png,boimler_cowpoke_crew
"AGIMUS",3,5, 560,150,165,0,0,0,0,0,0,1354,300,356,1110,205,224,0,0,0,984,1026,41,242,804,0,178,528,0,222,665,0,9,45,382,963,1006,57,415,799,0,247,822,0,303,961,0,39,106,640,47,342,"Sentient Computer, Brutal, Crafty, Desperate, Prisoner, Resourceful, Scoundrel, Villain","nonhuman, artificial_life, low, agimus, crew_max_rarity_5","You Are Too Late, AGIMUS Reigns!",0, 10, 8, 4, 12, 1, 4, , , , 300, 400, 180, 300, false,"AGIMUS",crew_portraits_cm_agimus_sm.png,agimus_crew
"Lt. Commander Ron Docent",6,4, 691,97,246,0,0,0,401,59,204,914,166,297,0,0,0,0,0,0,845,574,94,980,643,1179,498,0,0,216,1300,948,674,318,0,908,554,135,1041,741,1048,442,0,0,230,1224,879,631,306,0,879,955,"Human, Starfleet, Federation, Desperate, Scoundrel","male, organic, low, docent, crew_max_rarity_4","Do I Need To Remind You Who My Grandmas Neighbor Was?",1, 8, 6, 10, 8, 5, 0, , , , 150, 115, 7, 1050, false,"Ron Docent",crew_portraits_cm_docent_lt_cmdr_sm.png,docent_lt_cmdr_crew
"Bullseye Kyle",7,5, 0,0,0,982,223,488,0,0,0,1310,212,410,0,0,0,567,21,91,460,0,239,0,956,455,6,541,74,288,0,891,269,16,945,269,0,312,0,1170,252,9,331,110,349,0,1085,350,69,1141,268,298,"Federation, Starfleet, Human, Marksman, Innovator, Resourceful","male, organic, tos, kyle, crew_max_rarity_5","Are you kidding?",2, 9, 6, 8, 12, 5, 0, , , , 50, , 218, 25, false,"Kyle",crew_portraits_cm_kyle_bullseye_sm.png,kyle_bullseye_crew
"Acting Captain Arex",3,5, 1337,241,501,571,102,243,1045,203,400,0,0,0,0,0,0,0,0,0,53,3,180,444,80,78,681,980,551,398,633,285,0,0,0,43,45,175,408,122,95,630,969,530,368,575,269,0,0,0,12,114,"Edosian, Starfleet, Federation, Musician, Astrophysicist, Explorer, Communicator, Merchant","male, nonhuman, organic, tas, arex, crew_max_rarity_5","We Didn't Cause This To Happen",2, 10, 6, 8, 12, , , , , , 200, 100, 90, 100, false,"Arex",crew_portraits_cm_arex_acting_captain_sm.png,arex_acting_captain_crew
"Kevin Mulkahey",8,2, 263,30,86,0,0,0,367,33,96,0,0,0,0,0,0,0,0,0,1346,990,1281,1397,1165,1297,0,0,0,1133,1386,1039,0,0,0,1348,1121,1279,1398,1163,1335,0,0,0,1161,1418,1076,0,0,0,1585,1609,"Human, Brutal, Investigator","male, organic, ds9, weyoun, crew_max_rarity_2","Damn Shame",0, 4, 8, 8, 8, , , , , , 290, 135, 33, 375, false,"Mulkahey",crew_portraits_cm_weyoun_mulkahey_sm.png,weyoun_mulkahey_crew
"Tiron",10,4, 0,0,0,0,0,0,0,0,0,670,79,156,998,170,319,0,0,0,0,0,856,753,0,0,651,599,0,810,745,0,101,494,438,0,0,1121,785,0,0,845,669,0,1022,801,0,225,697,492,1298,1404,"Serilian, Civilian, Merchant, Desperate, Scoundrel","nonhuman, male, ds9, organic, tiron, crew_max_rarity_4","I Will Ruin You",2, 6, 12, 10, 12, 4, 0, , , , 340, 200, 80, 225, false,"Tiron",crew_portraits_cm_tiron_sm.png,tiron_crew
"Judoka Kirk",7,5, 0,0,0,0,0,0,1278,240,510,497,102,211,1059,86,212,0,0,0,0,427,1033,779,0,203,784,624,0,78,24,118,153,631,469,0,390,920,1128,0,197,665,1050,0,43,106,139,375,545,855,289,396,"Human, Federation, Starfleet, Duelist, Brutal, Athlete","male, organic, tos, kirk, crew_max_rarity_5","Lesson's Over For Today",2, 9, 8, 5, 10, , , , 0, 2, 425, 100, 75, 450, false,"Kirk",crew_portraits_cm_kirk_judoka_sm.png,kirk_judoka_crew
"Mourned Morn",8,5, 0,0,0,0,0,0,959,184,263,0,0,0,1353,113,343,562,84,230,0,726,0,516,807,587,0,366,568,540,40,53,290,537,53,0,804,0,868,819,691,0,748,571,650,196,138,666,550,177,316,749,"Lurian, Courier, Civilian, Smuggler, Inspiring, Criminal, Merchant, Crafty","morn, male, organic, ds9, nonhuman, crew_max_rarity_5","Keep It Warm, For Morn",1, 9, 8, 10, 12, 0, 2, , , , 425, 340, 102, 640, false,"Morn",crew_portraits_cm_morn_mourned_sm.png,morn_mourned_crew
"Pathfinder Uhura",2,5, 1294,271,523,533,115,230,0,0,0,0,0,0,1061,222,392,0,0,0,59,408,195,12,94,976,715,157,578,0,627,0,424,0,356,28,348,141,24,98,881,631,134,531,0,572,0,376,0,312,19,90,"Human, Federation, Starfleet, Communicator, Musician, Hero, Inspiring, Cultural Figure","female, organic, tos, uhura, original, evsuit, crew_max_rarity_5","Science Is Everyone's Game",0, 9, 8, 6, 12, 1, 4, , , , 415, 120, 60, 350, false,"Uhura",crew_portraits_cm_uhura_evsuit_sm.png,uhura_evsuit_crew
"Valeo Beta V Hemmer",9,5, 555,75,131,0,0,0,1343,177,315,1057,99,225,0,0,0,0,0,0,1061,186,138,1168,892,278,422,0,0,28,472,172,560,248,0,1231,439,460,1295,1055,578,646,0,0,168,780,445,937,518,0,326,1057,"Aenar, Andorian, Federation, Starfleet, Telepath, Jury Rigger, Hero","nonhuman, organic, male, snw, hemmer, exclusive_honorhall, crew_max_rarity_5","Do Not Weep For Me",0, 10, 7, 7, 7, , , , 1, 6, 200, 50, 205, 50, false,"Hemmer",crew_portraits_cm_hemmer_valeobeta_sm.png,hemmer_valeobeta_crew
"Esteemed Tom Paris",6,5, 1382,204,394,0,0,0,1013,124,349,0,0,0,524,74,146,0,0,0,221,39,198,169,96,507,0,1095,0,463,241,339,1082,0,912,416,133,358,318,277,618,0,1186,0,571,420,482,1184,0,1011,235,568,"Human, Federation, Starfleet, Inspiring, Hero, Cultural Figure, Pilot","male, organic, low, paris, crew_max_rarity_5","This Is How we kick A## In The Delta Quadrant",0, 8, 10, 3, 14, 1, 1, , , , 825, 70, 285, 265, false,"Paris",crew_portraits_cm_paris_esteemed_sm.png,paris_esteemed_crew
"First Officer Data",3,4, 897,144,346,678,89,239,0,0,0,360,62,148,0,0,0,0,0,0,125,792,244,857,501,835,371,903,492,1114,0,0,1246,760,0,158,708,221,774,439,917,373,993,549,1080,0,0,1201,744,0,993,1066,"Android, Federation, Starfleet, Cyberneticist, Musician, Tactician","nonhuman, male, artificial_life, data, tng, crew_max_rarity_4","Aye Sir",0, 8, 14, 12, 14, , , , , , 250, 100, 53, 50, false,"Data",crew_portraits_cm_data_first_officer_sm.png,data_first_officer_crew
"EV Suit Hemmer",6,5, 1082,175,236,538,118,200,0,0,0,1345,163,349,0,0,0,0,0,0,123,642,11,715,331,987,68,1012,585,301,0,0,287,90,0,231,851,69,934,616,939,136,1007,565,523,0,0,538,247,0,248,701,"Aenar, Andorian, Starfleet, Federation, Telepath, Inspiring, Botanist","male, nonhuman, organic, snw, hemmer, evsuit, crew_max_rarity_5","I Commend You To The Cosmos",0, 8, 8, 4, 10, 1, 1, , , , 350, , 90, 450, false,"Hemmer",crew_portraits_cm_hemmer_evsuit_sm.png,hemmer_evsuit_crew
"Fanboy Boimler",8,4, 0,0,0,0,0,0,316,83,131,875,172,253,619,104,213,0,0,0,0,1265,677,1061,0,1304,536,937,0,342,806,1048,155,355,756,0,1192,688,1087,0,1181,527,1001,0,325,724,977,212,390,806,1133,1193,"Human, Kazon, Federation, Starfleet, Resourceful, Survivalist, Desperate, Hunter","male, organic, low, boimler, crew_max_rarity_4","Fine, You Want to Play It That Way?",0, 6, 10, 8, 12, 5, 4, , , , , 30, , , false,"Boimler",crew_portraits_cm_boimler_fanboy_sm.png,boimler_fanboy_crew
"Chancellor Azetbur",6,5, 1023,149,340,0,0,0,0,0,0,0,0,0,1353,212,420,554,82,156,534,653,460,38,40,0,0,298,612,0,406,832,212,597,51,608,710,534,90,138,0,0,424,697,0,524,938,339,698,123,203,420,"Klingon, Cultural Figure, Brutal, Diplomat, Politician, Prodigy","female, organic, tos, azetbur, nonhuman, crew_max_rarity_5","We Are a Proud Race",2, 7, 12, 10, 14, 7, 0, , , , 750, 130, 295, 250, false,"Azetbur",crew_portraits_cm_azetbur_sm.png,azetbur_crew
"EV Suit Boimler",5,5, 1363,203,409,0,0,0,1063,146,319,564,102,201,0,0,0,0,0,0,227,32,43,469,106,468,695,0,0,113,697,313,961,539,0,382,127,76,596,244,633,690,0,0,200,829,495,987,566,0,87,364,"Human, Federation, Starfleet, Desperate, Explorer, Resourceful, Survivalist","male, organic, evsuit, low, boimler, crew_max_rarity_5","We're All In This Together",1, 9, 8, 6, 10, 1, 0, 2, 2, 2, 225, 250, 200, 240, false,"Boimler",crew_portraits_cm_boimler_evsuit_sm.png,boimler_evsuit_crew
"Master Surchid Falow",8,5, 1044,131,273,0,0,0,0,0,0,563,88,158,1368,164,314,0,0,0,549,665,125,59,365,0,732,341,0,917,462,0,68,574,215,795,869,270,255,632,0,817,689,0,993,814,0,226,676,511,270,864,"Wadi, Gambler, Communicator, Ambassador, Diplomat, Playful","male, organic, nonhuman, ds9, falow, crew_max_rarity_5","Double The Peril, Double Your Winnings",2, 10, 10, 6, 8, 4, 0, , , , 425, 150, 113, 100, false,"Falow",crew_portraits_cm_falow_sm.png,falow_crew
"Spy Rumdar",7,5, 0,0,0,0,0,0,889,198,450,433,99,301,1208,348,499,0,0,0,0,684,1064,492,0,541,836,327,0,151,31,373,71,668,201,0,489,736,302,0,308,548,186,0,51,7,204,13,422,132,339,52,"Pakled, Prisoner, Criminal, Desperate, Hero, Undercover Operative","male, organic, low, rumdar, nonhuman, crew_max_rarity_5","Im A Good Spy",0, 9, 8, 10, 12, , , , 3, 800, 100, 150, 730, 50, false,"Rumdar",crew_portraits_cm_rumdar_spy_sm.png,rumdar_spy_crew
"Gathorel Labin",6,5, 1034,216,418,0,0,0,489,133,295,0,0,0,1334,198,505,0,0,0,426,230,381,19,284,958,0,291,0,884,94,779,209,0,172,345,140,287,34,211,731,0,323,0,677,76,599,253,0,221,25,85,"Sikarian, Caregiver, Romantic, Merchant, Politician, Civilian","male, organic, nonhuman, voy, labin, crew_max_rarity_5","My Pleasure Will Be Greater Than Yours",1, 10, 6, 8, 12, , , , , , 40, 275, 140, 50, false,"Labin",crew_portraits_cm_labin_magistrate_sm.png,labin_magistrate_crew
"Doopler Emissary",6,5, 1079,140,324,535,94,225,0,0,0,0,0,0,1374,234,413,0,0,0,115,624,414,26,311,990,726,81,590,0,361,0,204,0,167,187,755,579,98,497,940,671,124,566,0,499,0,320,0,270,73,308,"Doopler, Federation, Desperate, Clone, Merchant, Communicator, Diplomat","nonhuman, organic, male, low, doopler_emissary, crew_max_rarity_5","Oh, I'm So Sorry!",1, 10, 6, 2, 10, 7, 0, , , , 490, 75, 140, 415, false,"Doopler",crew_portraits_cm_doopler_sm.png,doopler_crew
"Talosian Keeper",8,4, 344,76,167,0,0,0,0,0,0,0,0,0,663,96,234,859,135,355,1262,1231,1192,710,179,0,0,906,408,0,1071,535,871,351,89,1131,1124,1089,680,137,0,0,985,360,0,1112,470,931,275,142,1031,991,"Talosian, Crafty, Telepath, Explorer, Shapeshifter, Interrogator","male, organic, nonhuman, dsc, keeper, crew_max_rarity_4","Material Illusion Is Our Primary Form Of Defense",2, 9, 6, 8, 10, , , , , , 185, 250, 25, 40, false,"The Keeper",crew_portraits_cm_dsc_talosian_keeper_sm.png,dsc_talosian_keeper_crew
"Barclay and Neelix",6,5, 0,0,0,561,97,196,0,0,0,1353,181,402,1055,112,349,0,0,0,1000,0,221,714,0,973,58,180,576,257,714,0,22,63,416,1032,0,395,847,0,1008,105,276,610,412,861,0,55,182,553,185,484,"Human, Starfleet, Federation, Quantum Mechanics, Crafty, Desperate, Innovator","male, voy, organic, barclay, crew_max_rarity_5","Sorry, Hes Not Used To Company",1, 9, 4, 8, 8, 3, 0, , , , 350, 225, 110, 600, true,"Barclay",crew_portraits_cm_barclay_neelix_sm.png,barclay_neelix_crew
"Ensign Hoya",6,4, 0,0,0,0,0,0,941,178,301,535,72,172,667,97,194,0,0,0,0,736,1026,1040,0,601,774,922,0,153,196,443,384,622,744,0,728,1096,1142,0,605,821,1068,0,232,319,471,505,677,873,813,1085,"Benzite, Starfleet, Romantic, Resourceful, Federation","female, organic, nonhuman, ds9, hoya, crew_max_rarity_4","Shields Are Down! Engage Warp",1, 9, 8, 6, 8, , , , 2, 2, 15, , , 175, false,"Hoya",crew_portraits_cm_hoya_ensign_sm.png,hoya_ensign_crew
"Kiley Pike",7,4, 400,72,175,686,69,150,0,0,0,0,0,0,944,84,249,0,0,0,468,1177,1123,488,1013,864,643,212,518,0,908,0,698,0,572,678,1120,1083,669,962,1189,893,564,738,0,1102,0,920,0,783,996,1356,"Human, Kiley, Federation, Starfleet, Inspiring, Undercover Operative, Desperate","male, organic, snw, pike, crew_max_rarity_4","Take Me To Your Leader",1, 6, 10, 12, 12, 7, 0, , , , 750, 300, 125, 375, false,"Pike",crew_portraits_cm_pike_kiley_sm.png,pike_kiley_crew
"Breakthrough Booker",8,5, 0,0,0,1052,74,190,506,97,221,0,0,0,1358,173,354,0,0,0,637,1075,0,494,0,127,458,41,353,932,115,822,246,0,203,1101,996,0,729,0,447,781,230,646,858,248,777,526,0,447,335,909,"Kwejian, Federation, Desperate, Empath, Inspiring, Civilian, Communicator","male, nonhuman, organic, dsc, booker, crew_max_rarity_5","That Is The Start of Making Things Right",2, 10, 6, 6, 10, , , , , , 200, , 20, 125, false,"Booker",crew_portraits_cm_booker_breakthrough_sm.png,dsc_booker_breakthrough_crew
"Inspiring Captain Burnham",2,5, 1377,190,454,1060,129,342,0,0,0,0,0,0,682,93,210,0,0,0,11,396,187,133,85,494,382,145,288,0,1066,0,867,0,718,36,499,276,211,202,653,444,255,384,0,1161,0,993,0,837,6,328,"Federation, Starfleet, Human, Resourceful, Inspiring, Xenoanthropology, Innovator, Displaced","female, organic, dsc, burnham, crew_max_rarity_5","Lets Get To It",2, 9, 10, 10, 6, 4, 0, , , , , , 25, 40, false,"Burnham",crew_portraits_cm_dsc_burnham_inspiring_sm.png,dsc_burnham_inspiring_crew
"Captain Vasso L'Gaelia",9,5, 1151,100,203,537,53,146,0,0,0,0,0,0,1384,100,246,0,0,0,137,630,425,55,317,1091,820,129,669,0,521,0,312,0,259,594,1027,941,549,829,1251,942,573,793,0,1092,0,904,0,768,305,1304,"R'ongovian, Ambassador, Communicator, Diplomat, Empath","nonhuman, male, organic, snw, vasso, crew_max_rarity_5","We Shall Sit and Talk",2, 7, 4, 5, 10, 7, 0, , , , 400, 75, 30, 775, true,"Vasso",crew_portraits_cm_vasso_captain_sm.png,vasso_captain_crew
"Ensign Jennifer Sh'reyan",5,4, 891,188,261,0,0,0,335,86,162,686,121,192,0,0,0,0,0,0,710,505,116,875,518,1274,613,0,0,445,1362,1017,866,453,0,706,441,167,869,545,1091,666,0,0,444,1257,906,962,546,0,1005,1086,"Federation, Starfleet, Andorian, Athlete, Artist, Resourceful, Playful","female, nonhuman, organic, low, jen, crew_max_rarity_4","Pff...I Don't Think About You At All",0, 5, 1, 12, 15, 2, 0, , , , 500, 380, 180, 340, true,"Jen",crew_portraits_cm_jen_shreyan_sm.png,jen_shreyan_crew
"Captain Clark Terrell",8,4, 883,174,292,396,68,148,621,93,231,0,0,0,0,0,0,0,0,0,267,284,656,876,519,492,910,1216,757,798,1091,689,0,0,0,284,354,572,811,490,508,901,1203,746,843,1115,767,0,0,0,1014,1109,"Federation, Starfleet, Human, Desperate, Hero, Undercover Operative, Compromised","male, organic, tos, terrell, crew_max_rarity_4","What Do You Want With Us?",2, 4, 6, 4, 18, 1, 0, , , , 440, 200, 207, 475, true,"Terrell",crew_portraits_cm_terrell_captain_sm.png,terrell_captain_crew
"Borg Queen Jurati",5,4, 905,93,280,610,81,232,0,0,0,385,60,152,0,0,0,0,0,0,169,823,266,890,537,904,401,950,538,1089,0,0,1211,734,0,285,912,386,985,677,954,383,1023,578,1072,0,0,1196,740,0,1079,1265,"Human, Federation, Borg, Cultural Figure, Cyberneticist, Resourceful, Survivalist, Displaced","female, organic, pic, jurati, crew_max_rarity_4","We Are Out of Time",0, 8, 8, 8, 12, , , , 2, 1, 200, , , 100, false,"Jurati",crew_portraits_cm_jurati_borg_sm.png,jurati_borg_crew
"Ixtana'Rax",8,5, 1090,102,252,0,0,0,1351,147,349,510,78,181,0,0,0,0,0,0,527,51,130,735,348,261,810,0,0,86,458,163,1088,652,0,888,294,324,1014,712,568,775,0,0,206,765,434,1077,649,0,295,878,"Jem'hadar, Dominion, Brutal, Desperate, Maverick, Tactician, Veteran","nonhuman, male, ixtanarax, organic, ds9, crew_max_rarity_5","Obedience is Victory",0, 10, 8, 9, 12, , , , , , , 95, 47, 275, false,"Ixtana'Rax",crew_portraits_cm_ixtanarax_sm.png,ixtanarax_crew
"Wizard Pollux Spock",2,4, 0,0,0,411,99,229,0,0,0,667,109,251,967,143,312,0,0,0,1179,0,785,799,0,1166,305,265,737,770,824,0,97,450,499,955,0,809,874,0,918,218,244,550,786,894,0,141,463,575,834,853,"Human, Vulcan, Telepath, Costumed, Villain, Undercover Operative","male, nonhuman, organic, snw, spock, crew_max_rarity_4","Please, Point That Elsewhere",1, 9, 4, 6, 8, , , , 0, 3, 425, 400, 43, 225, false,"Spock",crew_portraits_cm_spock_pollux_sm.png,spock_pollux_crew
"Princess Thalia and Runa",7,5, 1349,151,356,0,0,0,0,0,0,0,0,0,1058,102,254,528,53,153,274,475,242,62,16,0,0,602,682,0,750,886,521,665,103,575,689,496,274,149,0,0,930,768,0,1074,1007,873,753,403,346,964,"Human, Costumed, Royalty, Caregiver, Desperate, Musician","female, organic, snw, laan, crew_max_rarity_5","My Princess Runa Applauds You!",1, 10, 4, 6, 12, , , , , , 650, 250, 225, 690, false,"Thalia",crew_portraits_cm_laan_princess_thalia_sm.png,laan_princess_thalia_crew
"Croden",6,4, 0,0,0,385,63,166,916,195,355,0,0,0,659,110,207,0,0,0,1219,716,0,1032,0,165,917,545,763,531,190,417,883,0,739,1195,635,0,1088,0,179,868,574,720,460,229,354,958,0,807,899,924,"Rakhari, Crafty, Desperate, Duelist, Prisoner, Scoundrel, Vengeful","nonhuman, male, organic, croden, ds9, crew_max_rarity_4","Sometimes I Do Tell The Truth",0, 9, 10, 10, 10, , , , , , 475, 295, 105, 240, false,"Croden",crew_portraits_cm_croden_sm.png,croden_crew
"Captain Sonya Gomez",8,5, 1379,98,298,0,0,0,0,0,0,509,80,181,1058,101,252,0,0,0,295,497,63,68,158,0,811,604,0,988,754,0,150,653,442,811,880,264,405,644,0,768,938,0,964,1081,0,374,641,746,366,1099,"Human, Federation, Starfleet, Tactician, Communicator, Resourceful, Inspiring","female, low, sonya, organic, crew_max_rarity_5","Take Us In, Nice And Slow",1, 8, 8, 8, 10, 3, 0, 3, , , 200, 525, 177, 225, false,"Sonya",crew_portraits_cm_sonya_gomez_captain_sm.png,sonya_gomez_captain_crew
"Spock as T'Pring",7,5, 0,0,0,520,78,266,1009,123,262,0,0,0,1324,219,376,0,0,0,1021,690,0,495,0,118,733,96,595,507,34,383,248,0,205,925,896,0,655,0,228,632,142,533,739,150,661,414,0,357,294,514,"Human, Vulcan, Federation, Starfleet, Telepath, Interrogator, Spiritual","snw, organic, nonhuman, spock, tpring, crew_max_rarity_5","This Is Coming Dangerously Close To Antics",2, 9, 8, 6, 12, 8, 4, , , , 250, 210, 180, 500, false,"Spock",crew_portraits_cm_spock_tpring_sm.png,spock_tpring_crew
"Sela in Shadow",6,5, 1355,227,427,0,0,0,0,0,0,1107,119,311,505,58,206,0,0,0,222,415,6,168,97,0,348,1089,0,430,1232,0,134,193,909,316,480,25,224,190,0,523,1099,0,682,1230,0,261,384,911,175,429,"Romulan, Human, Brutal, Scoundrel, Tactician, Villain, Saboteur","female, organic, tng, sela, crew_max_rarity_5","With Our Cloaking Devices, We Can Slip By You At Will",0, 7, 10, 12, 8, 1, 2, , , , , 100, , , false,"Sela",crew_portraits_cm_sela_shadow_sm.png,sela_shadow_crew
"Melora Pazlar",6,4, 667,121,298,916,173,351,385,73,184,0,0,0,0,0,0,0,0,0,107,575,761,967,632,178,478,706,365,1061,1308,960,0,0,0,90,458,697,922,606,187,388,613,320,971,1237,891,0,0,0,859,776,"Elaysian, Starfleet, Federation, Resourceful, Astrophysicist, Inspiring, Romantic, Explorer","nonhuman, female, organic, ds9, melora, crew_max_rarity_4","Im Perfectly Capable",1, 5, 12, 12, 20, 2, 0, , , , 75, 100, 20, 280, false,"Melora",crew_portraits_cm_melora_wheelchair_sm.png,melora_wheelchair_crew
"Tallinn",6,4, 0,0,0,667,90,231,941,147,308,0,0,0,0,0,0,365,62,166,884,751,0,0,1065,98,624,918,281,566,851,130,0,747,1067,970,775,0,0,1018,188,663,1002,302,614,862,179,0,715,986,958,1128,"Romulan, Caregiver, Linguist, Communicator, Undercover Operative, Civilian","female, nonhuman, organic, pic, tallinn, crew_max_rarity_4","A Leap of Faith? It's Kind Of How I Roll",0, 7, 10, 8, 10, 4, 0, , , , , 135, , 225, false,"Tallin",crew_portraits_cm_tallinn_sm.png,tallinn_crew
"Adult Rukiya",9,5, 0,0,0,511,87,175,0,0,0,0,0,0,1057,128,302,1337,175,365,1106,0,0,725,151,1084,812,211,44,0,720,185,492,89,14,1104,0,0,917,376,1071,787,346,116,0,962,389,740,229,88,308,740,"Human, Federation, Civilian, Explorer, Writer, Spiritual","organic, snw, female, rukiya, crew_max_rarity_5","I'm Happy, I'm Safe",2, 9, 8, 10, 12, 3, 0, , , , , , 25, , false,"Rukiya",crew_portraits_cm_rukiya_adult_sm.png,rukiya_adult_crew
"Dread Pirate Q",4,5, 1080,150,350,518,106,213,1349,219,411,0,0,0,0,0,0,0,0,0,114,20,393,680,296,46,750,1040,610,203,388,93,0,0,0,159,104,515,755,424,94,672,1008,567,331,512,227,0,0,0,102,269,"Q Continuum, Scoundrel, Costumed, Crafty, Brutal, Smuggler","male, nonhuman, pic, voy, q_jdl, original, crew_max_rarity_5","Dead Men Tell No Tales",0, 10, 6, 6, 10, 1, 4, , , , 525, 700, 143, 465, false,"Q",crew_portraits_cm_q_dread_pirate_sm.png,q_dread_pirate_crew
