"Nyota Uhura",9,5, 899,74,127,0,0,0,536,63,125,0,0,0,1050,240,468,0,0,0,759,431,690,142,562,1060,0,467,0,957,175,847,389,0,334,1204,855,1145,226,1036,1225,0,300,0,1075,205,998,236,0,204,712,887,"Human, Federation, Starfleet, Communicator, Resourceful, Musician","female, organic, tos, uhura, crew_max_rarity_5","Alameda Express",1, 8, 4, 10, 10, , , , , , 115, 15, 167, 565, false,"Uhura",crew_portraits_cm_uhurastiv_sm.png,uhura_stiv_crew
"Katra McCoy",8,4, 0,0,0,325,76,166,0,0,0,0,0,0,458,170,347,790,121,352,1253,0,0,1079,565,1252,952,690,215,0,1114,573,935,382,154,1124,0,0,718,493,1086,800,258,161,0,723,497,521,308,80,1193,712,"Federation, Starfleet, Vulcan, Desperate, Human, Physician","male, organic, tos, mccoy, crew_max_rarity_4","Steps of Mount Seleya",1, 6, 4, 8, 8, 6, 0, , , , 450, 190, 53, 280, true,"McCoy",crew_portraits_cm_mccoy_katra_sm.png,mccoy_katra_crew
"Katrine",7,5, 1050,271,589,525,36,110,867,200,373,0,0,0,0,0,0,0,0,0,98,120,311,582,215,138,829,1123,687,574,847,461,0,0,0,61,28,89,262,62,220,968,1272,817,409,635,311,0,0,0,626,161,"Human, Federation, Starfleet, Crafty, Desperate, Gambler, Saboteur, Undercover Operative, Costumed","female, organic, voy, janeway, crew_max_rarity_5","Leave The War Outside",0, 7, 6, 8, 14, 4, 2, , , , 315, 385, 80, 650, false,"Janeway",crew_portraits_cm_janeway_tuxedo_sm.png,janeway_tuxedo_crew
"M-113 Creature",7,4, 0,0,0,382,126,262,665,45,92,0,0,0,797,102,202,0,0,0,1143,968,0,921,0,447,849,417,710,822,359,716,788,0,646,804,1244,0,1076,0,516,540,330,455,1121,898,1042,965,0,809,1101,1283,"M-113 Creature, Desperate, Exobiology, Shapeshifter, Telepath, Crafty","nonhuman, female, tos, salt_vampire, organic, crew_max_rarity_4","I Hunger",0, 6, 8, 3, 10, 1, 0, , , , 240, 145, 93, 560, true,"M-113 Creature",crew_portraits_cm_m113_sm.png,salt_vampire_crew
"Lal",10,4, 0,0,0,0,0,0,0,0,0,879,63,134,507,140,325,0,0,0,0,0,702,1062,0,0,549,944,0,689,1101,0,183,387,768,0,0,1153,807,0,0,893,690,0,1066,820,0,275,730,524,1368,1390,"Android, Federation, Prodigy, Bartender, Romantic, Civilian","nonhuman, female, tng, artificial_life, lal, crew_max_rarity_4","Reason For Being",0, 8, 6, 4, 8, , , , , , 450, 215, 77, 575, false,"Lal",crew_portraits_cm_lal_sm.png,lal_crew
"Commander Nevesa",9,4, 660,134,471,0,0,0,0,0,0,0,0,0,586,92,237,0,0,0,776,851,711,421,589,0,0,927,0,0,1084,0,900,0,751,372,540,323,211,243,0,0,950,0,0,1079,0,906,0,765,1372,1164,"Crafty, Romantic, Romulan, Resourceful","female, nonhuman, organic, tos, nevesa, crew_max_rarity_4","Hidden in Plain Sight",1, 7, 10, 8, 14, 1, 2, , , , 290, 310, 70, 565, false,"Nevesa",crew_portraits_cm_romulancommander_sm.png,nevesa_crew
"Mirror Bashir",8,5, 0,0,0,0,0,0,1101,249,531,829,186,403,0,0,0,0,0,0,0,522,627,0,0,352,490,0,0,50,550,225,669,330,0,0,354,358,0,0,161,297,0,0,8,299,115,385,154,0,802,365,"Human, Scoundrel, Engineered, Desperate, Saboteur, Survivalist, Mirror Universe, Terran Rebellion","nonhuman, male, organic, ds9, bashir, crew_max_rarity_5","I Owed You That",0, 10, 10, 12, 10, , , , , , 415, 55, 345, 675, false,"Bashir",crew_portraits_cm_bashir_mirror_sm.png,bashir_mirror_crew
"The Keeper",8,5, 526,27,75,922,357,755,0,0,0,0,0,0,0,0,0,945,149,458,102,1122,1074,1211,50,374,285,445,24,0,0,360,0,239,454,16,1260,1253,1368,158,36,33,46,3,0,0,289,0,160,339,617,73,"Talosian, Crafty, Exobiology, Quantum Mechanics, Telepath, Explorer, Shapeshifter, Interrogator","nonhuman, organic, male, tos, keeper, crew_max_rarity_5","A Curious Species",1, 8, 4, 10, 16, 5, 0, , , , 350, , 63, 115, false,"The Keeper",crew_portraits_cm_talosian_keeper_sm.png,talosian_keeper_crew
"Kilana",9,4, 506,128,298,0,0,0,0,0,0,0,0,0,797,160,341,0,0,0,953,988,895,391,782,0,0,783,0,0,936,0,732,0,600,726,802,652,215,569,0,0,621,0,0,748,0,545,0,458,1353,1184,"Vorta, Clone, Crafty, Dominion, Scoundrel","nonhuman, female, organic, ds9, kilana, crew_max_rarity_4","For The Founders!",1, 7, 10, 10, 16, 6, 0, , , , 215, 275, 128, 560, false,"Kilana",crew_portraits_cm_kilana_sm.png,kilana_crew
"Talos IV Spock",4,3, 413,37,141,178,29,103,514,97,197,0,0,0,0,0,0,0,0,0,922,736,1104,1239,996,773,1000,1320,841,914,1156,796,0,0,0,943,713,1175,1296,1071,712,979,1279,825,883,1136,807,0,0,0,1415,1425,"Federation, Starfleet, Exobiology, Astrophysicist, Human, Vulcan, Telepath, Musician","nonhuman, male, organic, tos, spock, crew_max_rarity_3","We've Lost The Captain",0, 5, 10, 8, 8, , , , , , 690, 10, 105, 450, false,"Spock",crew_portraits_cm_spock_pilot_sm.png,spock_pilot_crew
"Author Doctor",8,4, 0,0,0,0,0,0,0,0,0,0,0,0,729,159,394,625,86,287,0,0,0,913,713,0,0,813,498,0,969,664,765,477,122,0,0,0,684,679,0,0,533,473,0,669,670,466,450,99,1346,1200,"Hologram, Human, Federation, Musician, Starfleet, Diplomat, Physician, Writer","nonhuman, male, artificial_life, voy, emh, crew_max_rarity_4","A Single Proton Flares",2, 8, 4, 4, 8, 3, 0, 2, , , 555, 100, 60, 225, false,"Doctor",crew_portraits_cm_emh_writer_sm.png,emh_writer_crew
"Musketeer La Forge",7,5, 436,58,138,0,0,0,1116,313,633,1009,92,237,0,0,0,0,0,0,1149,200,166,1222,982,283,449,0,0,37,473,165,604,282,0,1216,98,446,1272,1049,82,605,0,0,13,160,55,889,492,0,564,227,"Hologram, Human, Duelist, Hero, Inspiring, Cyberneticist, Maverick, Veteran, Tactician","male, nonhuman, artificial_life, tng, laforge, crew_max_rarity_5","All For One",2, 9, 6, 10, 10, 3, 0, , , , 165, 70, 237, 500, true,"La Forge",crew_portraits_cm_laforge_musketeer_sm.png,laforge_musketeer_crew
"Ilia Probe",10,5, 0,0,0,1211,198,426,0,0,0,0,0,0,1023,48,101,0,0,0,328,0,0,853,0,337,273,66,185,0,886,0,683,0,560,367,0,0,1328,0,353,273,244,216,0,1363,0,1244,0,1075,796,1335,"Deltan, Romantic, Communicator, Probe, Android","female, nonhuman, artificial_life, tos, ilia, crew_max_rarity_5","Oath Of Celibacy",1, 10, 12, 8, 8, , , , , , 600, 100, 140, 440, false,"Ilia",crew_portraits_cm_ilia_probe_sm.png,ilia_probe_crew
"Romulan Data",8,5, 0,0,0,478,77,141,0,0,0,1153,185,399,969,142,279,0,0,0,1132,0,324,792,0,1112,98,247,697,359,815,0,44,142,494,1176,0,369,898,0,1143,144,398,708,389,943,0,61,162,635,636,699,"Android, Starfleet, Federation, Cyberneticist, Undercover Operative, Musician, Romulan","nonhuman, male, tng, artificial_life, data, crew_max_rarity_5","No Regrets",2, 7, 6, 8, 14, 5, 2, , , , 500, 150, 40, 300, false,"Data",crew_portraits_cm_data_romulan_sm.png,data_romulan_crew
"Zhian'tara Odo",7,5, 899,184,356,0,0,0,535,72,148,0,0,0,1279,113,225,0,0,0,631,324,574,114,449,1026,0,447,0,940,155,824,376,0,323,486,369,420,248,338,1122,0,939,0,1017,662,936,886,0,752,595,874,"Changeling, Communicator, Bajoran, Trill, Constable, Investigator, Shapeshifter","nonhuman, male, organic, ds9, odo, dax, crew_max_rarity_5","It's Better This Way",0, 6, 6, 10, 12, 4, 0, , , , 580, 225, 5, 440, true,"Odo",crew_portraits_cm_odo_curzon_sm.png,odo_curzon_crew
"Gaia Odo",3,2, 0,0,0,0,0,0,260,24,83,0,0,0,384,54,134,0,0,0,0,1253,0,1272,0,1309,0,1205,0,1145,1051,1058,1183,0,1024,0,1255,0,1288,0,1312,0,1215,0,1143,1138,1060,1199,0,1032,1529,1556,"Changeling, Bajoran, Constable, Romantic, Communicator, Shapeshifter","nonhuman, male, organic, ds9, odo, crew_max_rarity_2","You Have To Go Home",2, 3, 10, 12, 10, 0, 2, , , , 630, 135, 58, 315, false,"Odo",crew_portraits_cm_odo_future_sm.png,odo_future_crew
"Prisoner O'Brien",6,4, 0,0,0,0,0,0,583,83,187,694,244,503,447,11,21,0,0,0,0,986,656,1288,0,912,522,1219,0,163,804,736,333,349,1037,0,1045,165,1394,0,1001,161,1332,0,58,1119,841,156,57,1144,1111,949,"Human, Starfleet, Federation, Prisoner, Desperate, Survivalist, Brutal, Jury Rigger","male, organic, ds9, obrien, crew_max_rarity_4","It's Real To Me",0, 7, 4, 14, 16, 5, 0, , , , 400, 80, 85, 525, false,"O'Brien",crew_portraits_cm_obrien_prisoner_sm.png,obrien_prisoner_crew
"Lieutenant Commander Saru",6,2, 274,21,92,349,62,179,0,0,0,0,0,0,0,0,0,0,0,0,872,1248,1235,1348,1128,1230,919,1220,776,0,0,0,0,0,0,864,1252,1240,1359,1134,1089,802,1114,664,0,0,0,0,0,0,1527,1534,"Kelpien, Federation, Starfleet, Exobiology, Survivalist","male, nonhuman, organic, dsc, saru, crew_max_rarity_2","Kelpien Instincts",2, 2, 6, 6, 12, 6, 0, , , , 77, 100, 75, 570, false,"Saru",crew_portraits_cm_dsc_saru_lieutenant_sm.png,dsc_saru_lieutenant_crew
"T'Mir",7,4, 686,184,403,0,0,0,0,0,0,0,0,0,557,137,298,0,0,0,773,845,707,397,579,0,0,910,0,0,1068,0,883,0,736,420,572,365,156,283,0,0,778,0,0,919,0,705,0,610,1360,1024,"Vulcan, Telepath, Survivalist, Resourceful, Civilian, High Command","nonhuman, female, organic, ent, tmir, crew_max_rarity_4","What if you lose?",0, 7, 4, 4, 16, 1, 0, , , , 440, 100, 130, 1815, false,"T'Mir",crew_portraits_cm_tmir_sm.png,tmir_crew
"Lieutenant Arex Na Eth",9,4, 631,183,415,572,85,202,0,0,0,0,0,0,322,105,207,0,0,0,229,859,721,613,598,920,664,644,542,0,1307,0,1187,0,1027,103,556,342,222,261,987,707,463,591,0,1106,0,943,0,790,1209,741,"Edosian, Starfleet, Federation, Musician, Pilot, Explorer, Astrophysicist, Playful","nonhuman, male, organic, tas, arex, crew_max_rarity_4","This Is No Joke",1, 9, 10, 10, 12, , , , , , 475, 155, 293, 615, false,"Arex",crew_portraits_cm_arex_animated_sm.png,arex_lute_crew
"Temporal Prisoner Chakotay",8,5, 0,0,0,0,0,0,1166,134,414,1041,68,201,0,0,0,610,10,52,0,534,555,0,914,382,445,0,656,49,577,38,599,34,895,0,616,989,0,1165,461,716,0,850,155,666,255,1018,493,1137,614,1226,"Human, Desperate, Federation, Marksman, Saboteur, Resourceful, Prisoner, Displaced","male, organic, voy, chakotay, crew_max_rarity_5","Timeline Triage",2, 7, 8, 6, 12, 7, 0, , , , 780, 230, 80, 190, false,"Chakotay",crew_portraits_cm_chakotay_shattered_sm.png,chakotay_shattered_crew
"Laborer Spock",6,5, 0,0,0,1205,157,321,0,0,0,971,144,315,0,0,0,0,0,0,357,0,524,0,0,381,41,454,213,511,0,0,561,251,0,636,0,570,0,0,609,76,672,356,574,0,0,605,300,0,787,1168,"Federation, Starfleet, Exobiology, Astrophysicist, Human, Vulcan, Telepath, Jury Rigger, Communicator, Thief, Resourceful, Musician","nonhuman, male, organic, tos, spock, crew_max_rarity_5","Stone Knives and Bear Skins",1, 10, 4, 8, 8, 3, 0, , , , 540, 200, 80, 350, true,"Spock",crew_portraits_cm_spock_janitor_sm.png,spock_janitor_crew
"First Officer Burnham",7,5, 1359,88,294,944,207,478,667,50,101,0,0,0,0,0,0,0,0,0,20,175,267,523,163,82,369,552,280,815,1085,709,0,0,0,47,630,737,937,639,137,227,341,177,1112,1359,1034,0,0,0,196,709,"Federation, Starfleet, Astrophysicist, Human, Xenoanthropology, Resourceful","female, organic, dsc, burnham, crew_max_rarity_5","We Need To Strike First!",1, 8, 12, 5, 10, 1, 0, 2, , , 475, 70, 85, 740, false,"Burnham",crew_portraits_cm_dsc_burnham_first_officer_sm.png,dsc_burnham_first_officer_crew
"Rura Penthe Kirk",7,5, 0,0,0,0,0,0,1337,197,391,0,0,0,854,230,569,0,0,0,0,430,0,726,0,225,0,571,0,239,20,123,497,0,418,0,575,0,340,0,403,0,207,0,390,20,290,152,0,150,732,361,"Human, Federation, Starfleet, Romantic, Inspiring, Duelist, Desperate, Survivalist, Criminal, Prisoner","male, organic, tos, kirk, crew_max_rarity_5","Aim for the 'Knee'",2, 7, 6, 6, 12, 1, 2, , , , 550, 230, 50, 625, false,"Kirk",crew_portraits_cm_kirk_rura_penthe_sm.png,kirk_rura_penthe_crew
"Cadet Wesley Crusher",10,4, 0,0,0,745,160,385,0,0,0,682,85,188,0,0,0,0,0,0,749,0,786,0,0,736,139,807,422,756,0,0,855,449,0,502,0,979,0,0,491,140,555,291,909,0,0,1009,593,0,1325,1289,"Human, Federation, Starfleet, Pilot, Prodigy","male, organic, tng, wesley, crew_max_rarity_4","Duty To The Truth",1, 6, 10, 10, 12, 4, 0, , , , 300, 200, 110, 100, false,"Wesley",crew_portraits_cm_wesley_crusher_cadet_sm.png,wesley_cadet_crew
"Smitten Jean-Luc Picard",8,5, 1059,98,163,0,0,0,0,0,0,0,0,0,1122,343,651,0,0,0,590,697,531,69,409,0,0,331,0,0,446,0,257,0,210,1041,1052,1008,49,895,0,0,107,0,0,144,0,67,0,76,745,649,"Federation, Starfleet, Human, Romantic, Inspiring, Communicator, Musician, Playful","male, organic, tng, picard, crew_max_rarity_5","My Love Is a Fever",0, 8, 9, 5, 16, 1, 1, , , , 575, 170, 190, 40, false,"Picard",crew_portraits_cm_picard_smitten_sm.png,picard_smitten_crew
"Trader Worf",8,5, 0,0,0,0,0,0,1012,242,574,0,0,0,1013,75,236,0,0,0,0,545,0,800,0,390,0,665,0,367,68,255,606,0,502,0,320,0,1064,0,138,0,979,0,159,73,99,946,0,791,807,830,"Klingon, Tactician, Undercover Operative, Federation, Starfleet, Tribbled, Displaced","nonhuman, male, organic, ds9, worf, crew_max_rarity_5","Detestable Creatures!",0, 8, 6, 10, 12, 5, 0, , , , 640, 100, 230, 300, false,"Worf",crew_portraits_cm_worf_trader_sm.png,worf_trader_crew
"Miral Torres",10,4, 0,0,0,0,0,0,598,129,264,0,0,0,761,127,286,0,0,0,0,918,0,919,0,826,0,824,0,769,300,657,781,0,641,0,851,0,909,0,744,0,815,0,703,279,626,753,0,648,1352,1298,"Klingon, Civilian, Desperate","nonhuman, female, organic, voy, miral, crew_max_rarity_4","You Dishonor Me!",1, 7, 14, 12, 14, 5, 0, , , , 440, 275, 58, 625, false,"Miral",crew_portraits_cm_miral_sm.png,miral_crew
"Commander Barak",9,4, 899,69,187,0,0,0,627,85,190,0,0,0,0,0,0,0,0,0,740,331,673,898,546,858,0,0,0,795,1071,684,0,0,0,1062,635,1027,1154,913,996,0,0,0,910,1171,835,0,0,0,1340,1453,"Klingon, Brutal, Tactician, Hero","nonhuman, male, organic, tos, barak, crew_max_rarity_4","Honor and Glory",0, 6, 10, 10, 20, 2, 0, , , , 600, 30, 105, 400, false,"Barak",crew_portraits_cm_barak_commander_sm.png,barak_commander_crew
"First Officer Saru",9,4, 597,74,239,816,195,414,0,0,0,0,0,0,0,0,0,0,0,0,154,959,860,1046,751,666,495,727,376,0,0,0,0,0,0,91,974,884,1050,779,388,292,444,228,0,0,0,0,0,0,1314,1195,"Kelpien, Federation, Starfleet, Exobiology, Survivalist","male, nonhuman, organic, dsc, saru, crew_max_rarity_4","Vigilance Equals Survival",1, 9, 8, 8, 10, , , , 2, 3, 325, 300, 55, 690, false,"Saru",crew_portraits_cm_saru_science_officer_sm.png,dsc_saru_scanner_crew
"Desert Philippa Georgiou",9,5, 912,152,353,0,0,0,0,0,0,0,0,0,1242,146,284,0,0,0,635,737,576,113,455,0,0,442,0,0,568,0,373,0,319,552,666,483,212,396,0,0,789,0,0,926,0,715,0,620,798,1165,"Human, Federation, Starfleet, Inspiring, Diplomat, Veteran","female, organic, dsc, georgiou, crew_max_rarity_5","Prepared Surprise",0, 8, 6, 12, 14, 5, 0, , , , 300, 415, 125, 490, false,"Georgiou",crew_portraits_cm_dsc_georgiou_desert_sm.png,dsc_georgiou_desert_crew
"T'Kuvma",7,5, 1096,240,572,0,0,0,962,219,439,0,0,0,0,0,0,0,0,0,338,75,304,566,205,465,0,0,0,428,685,305,0,0,0,145,22,118,309,78,282,0,0,0,286,449,187,0,0,0,750,226,"Klingon, Brutal, Hero, Cultural Figure, Spiritual","male, nonhuman, organic, tkuvma, dsc, crew_max_rarity_5","Are You Worthy",0, 9, 10, 5, 12, 1, 0, 2, , , 475, 260, 133, 575, false,"T'Kuvma",crew_portraits_cm_tkuvma_sm.png,dsc_tkuvma_mekleth_crew
"Reinforcements Stamets",10,4, 0,0,0,853,87,228,614,58,183,0,0,0,0,0,0,0,0,0,748,971,0,0,0,140,539,804,420,825,1095,718,0,0,0,944,1094,0,0,0,462,648,978,546,963,1229,888,0,0,0,1357,1447,"Human, Starfleet, Federation, Exomycologist, Prodigy","male, organic, dsc, stamets, crew_max_rarity_4","Calling Reinforcements",1, 7, 16, 12, 10, 7, 0, , , , 400, 100, 100, 500, false,"Stamets",crew_portraits_cm_stamets_sm.png,dsc_stamets_callbackup_crew
"Captain Lorca",9,5, 1263,232,542,0,0,0,0,0,0,0,0,0,1014,131,260,0,0,0,225,421,201,54,100,0,0,604,0,0,752,0,535,0,446,175,355,147,71,101,0,0,845,0,0,988,0,790,0,678,740,776,"Starfleet, Human, Tactician, Federation, Explorer, Mirror Universe","male, organic, dsc, lorca, crew_max_rarity_5","We Are A Long Way From Home",1, 9, 12, 3, 12, 4, 1, , , , 650, 75, 140, 240, false,"Lorca",crew_portraits_cm_lorca_sm.png,dsc_lorca_stance_crew
"Fierce Guinan",8,4, 0,0,0,0,0,0,637,104,217,0,0,0,703,244,533,0,0,0,0,911,0,867,0,822,0,752,0,765,236,652,702,0,572,0,959,0,372,0,879,0,232,0,829,85,747,173,0,165,1308,891,"Communicator, Counselor, Civilian, Survivalist, Empath, Bartender, El-Aurian, Brutal","nonhuman, female, organic, tng, guinan, exclusive_voyage, crew_max_rarity_4","We've Had Some Dealings",2, 8, 10, 10, 10, , , , 1, 2, 415, 355, 117, 565, false,"Guinan",crew_portraits_cm_guinan_fierce_sm.png,guinan_fierce_crew
"Cadet Sylvia Tilly",10,5, 0,0,0,970,88,231,0,0,0,1217,189,373,0,0,0,0,0,0,664,0,302,0,0,647,44,711,366,337,0,0,357,126,0,934,0,400,0,0,899,98,967,533,422,0,0,434,191,0,795,1229,"Human, Theoretical Engineer, Federation, Starfleet","female, organic, dsc, tilly, crew_max_rarity_5","I Can Help You",1, 10, 8, 12, 12, , , , , , 590, 225, 160, 340, false,"Tilly",crew_portraits_cm_tilly_sm.png,dsc_tilly_cadet_crew
"Lt. Ash Tyler",6,4, 652,119,218,0,0,0,829,165,342,0,0,0,0,0,0,0,0,0,851,272,783,996,666,693,0,0,0,636,904,516,0,0,0,884,293,833,1020,727,538,0,0,0,509,728,409,0,0,0,1299,1250,"Human, Federation, Starfleet, Survivalist, Tactician, Marksman, Pilot, Klingon","male, organic, dsc, tyler, voq, crew_max_rarity_4","Full Scale Attack",2, 7, 10, 10, 12, , , , , , 575, 225, 153, 450, false,"Tyler",crew_portraits_cm_tyler_sm.png,dsc_tyler_lt_crew
"Festive Jadzia Dax",5,2, 0,0,0,367,32,125,0,0,0,0,0,0,255,28,69,0,0,0,1251,0,0,1362,0,1250,947,928,793,0,1385,0,1294,0,1115,1276,0,0,1374,0,1271,959,1091,810,0,1397,0,1301,0,1120,1540,1562,"Federation, Starfleet, Exobiology, Astrophysicist, Trill, Gambler, Pilot, Romantic","nonhuman, female, organic, ds9, dax, crew_max_rarity_2","Toruk-DOH!",0, 3, 8, 6, 10, 4, 2, , , , 260, 80, 25, 515, false,"J. Dax",crew_portraits_cm_jadzia_purple_sm.png,dax_jadzia_purple_crew
"Harcourt Fenton Mudd",8,5, 0,0,0,1065,81,189,0,0,0,0,0,0,1264,179,391,0,0,0,572,0,0,525,0,535,405,55,309,0,511,0,315,0,261,1035,0,0,664,0,1011,724,187,607,0,653,0,443,0,380,762,1275,"Human, Civilian, Scoundrel, Crafty, Smuggler, Resourceful, Survivalist, Federation, Playful","male, organic, dsc, mudd, crew_max_rarity_5","Choose Wisely",0, 10, 6, 6, 6, , , 2, , , 415, 340, 50, 500, false,"Mudd",crew_portraits_cm_harry_mudd_sm.png,dsc_mudd_harry_crew
"Sarek",5,4, 592,83,208,338,69,207,0,0,0,0,0,0,801,175,354,0,0,0,563,973,875,364,767,1226,915,409,769,0,918,0,719,0,586,462,1014,942,311,830,1002,717,205,600,0,711,0,508,0,430,1094,895,"Vulcan, Diplomat, Cultural Figure, Communicator, Federation, Telepath, Ambassador","nonhuman, male, organic, sarek, dsc, crew_max_rarity_4","The Vulcan Hello",0, 9, 6, 8, 14, , , , , , 150, 245, 110, 315, false,"Sarek",crew_portraits_cm_sarek_sm.png,dsc_sarek_young_crew
"Gabriel Bell",3,4, 589,152,354,0,0,0,222,181,342,0,0,0,815,102,267,0,0,0,832,589,763,330,644,1222,0,814,0,1069,556,979,767,0,629,548,158,479,253,393,507,0,877,0,486,206,384,827,0,704,1056,329,"Human, Federation, Starfleet, Bajoran, Cultural Figure, Hero, Costumed, Chef, Inspiring, Displaced","male, organic, ds9, sisko, crew_max_rarity_4","Think Again",2, 6, 10, 8, 12, 5, 1, , , , 395, 90, 50, 480, false,"Sisko",crew_portraits_cm_sisko_bell_sm.png,sisko_bell_crew
"Ruk",9,4, 0,0,0,342,74,160,857,102,215,614,82,249,0,0,0,0,0,0,1234,824,836,0,0,362,388,1230,786,155,947,558,880,483,0,1143,968,847,0,0,469,329,1124,681,293,1091,757,885,490,0,1107,1227,"Android, Duelist, Cyberneticist, Hunter","male, tos, nonhuman, artificial_life, ruk, crew_max_rarity_4","Preternatural Hunt",0, 6, 8, 6, 12, 0, 1, , , , 50, 500, 170, 340, false,"Ruk",crew_portraits_cm_ruk_sm.png,ruk_crew
"Defensive Phlox",6,5, 0,0,0,765,174,461,403,147,297,0,0,0,0,0,0,934,261,913,715,1095,0,0,219,151,516,760,29,965,1208,37,0,139,318,355,776,0,0,12,44,261,408,1,634,875,5,0,7,35,664,24,"Denobulan, Civilian, Physician, Romantic, Exobiology","male, nonhuman, organic, ent, phlox, crew_max_rarity_5","Intimidating Prospect",1, 7, 4, 10, 10, 3, 0, 3, , , 450, 275, 142, 250, false,"Phlox",crew_portraits_cm_phlox_defensive_sm.png,phlox_defensive_crew
"C.O.P. Founder Archer",8,4, 653,52,100,0,0,0,0,0,0,0,0,0,790,161,309,0,0,0,940,982,883,393,772,0,0,792,0,0,945,0,742,0,609,1277,1234,1206,573,1108,0,0,680,0,0,810,0,606,0,514,1355,1418,"Federation, Starfleet, Human, Inspiring, Cultural Figure, Communicator","male, organic, ent, archer, crew_max_rarity_4","To Boldly Go",2, 6, 12, 12, 12, 7, 0, , , , 315, 200, 145, 630, false,"Archer",crew_portraits_cm_archer_founder_sm.png,archer_founder_crew
"Colonel Worf",9,4, 601,83,224,0,0,0,0,0,0,0,0,0,848,129,286,0,0,0,915,958,859,355,750,0,0,775,0,0,925,0,724,0,591,940,982,903,422,795,0,0,810,0,0,950,0,744,0,643,1336,1355,"Klingon, Communicator, Counselor, Inspiring","nonhuman, male, organic, tos, colonel_worf, exclusive_voyage, crew_max_rarity_4","Objection!",0, 8, 7, 8, 10, 3, 0, 3, , , 600, 150, 68, 365, false,"Worf",crew_portraits_cm_worf_colonel_sm.png,worf_colonel_crew
"Anbo-jyutsu Riker",6,4, 624,124,263,0,0,0,747,120,255,0,0,0,0,0,0,0,0,0,855,347,793,1005,673,761,0,0,0,702,987,594,0,0,0,791,370,726,934,631,771,0,0,0,735,1002,651,0,0,0,1356,1329,"Human, Federation, Starfleet, Duelist, Pilot, Maverick, Romantic, Gambler, Athlete, Casual","male, organic, tng, riker, crew_max_rarity_4","The Ultimate Evolution",1, 7, 14, 12, 14, 5, 0, , , , 315, 230, 135, 415, false,"Riker",crew_portraits_cm_riker_anbo_sm.png,riker_anbo_crew
"Torchbearer Rejac",7,5, 959,146,363,0,0,0,1125,292,580,0,0,0,0,0,0,0,0,0,558,85,500,756,382,314,0,0,0,304,507,195,0,0,0,538,36,467,714,383,114,0,0,0,125,216,83,0,0,0,755,346,"Klingon, Cultural Figure, Brutal, Duelist, Inspiring","evsuit, nonhuman, male, organic, dsc, rejac, crew_max_rarity_5","Sacred Duty!",0, 10, 8, 8, 8, , , , 1, 4, 800, 250, 175, 240, false,"Rejac",crew_portraits_cm_torchbearer_sm.png,dsc_rejac_torchbearer_crew
"Klingon O'Brien",6,4, 0,0,0,0,0,0,432,28,60,589,104,229,746,167,372,0,0,0,0,1171,858,910,0,1217,645,808,0,468,548,975,159,502,623,0,1270,841,697,0,1326,604,559,0,663,518,1071,102,488,414,1121,1142,"Starfleet, Federation, Klingon, Human, Jury Rigger, Undercover Operative, Duelist, Veteran, Saboteur","male, organic, ds9, obrien, crew_max_rarity_4","House of Konjah",2, 8, 6, 4, 10, 3, 0, 2, , , 1380, 240, 110, 690, false,"O'Brien",crew_portraits_cm_obrien_klingon_sm.png,obrien_klingon_crew
"Armed Philippa Georgiou",7,4, 512,157,351,0,0,0,355,84,170,0,0,0,904,109,159,0,0,0,906,637,851,360,739,1214,0,784,0,1059,532,973,733,0,601,539,365,468,360,384,1045,0,1057,0,946,713,868,1031,0,876,1081,1001,"Human, Federation, Starfleet, Inspiring, Diplomat","female, organic, dsc, georgiou, crew_max_rarity_4","Starfleet Doesn't Fire First",1, 5, 4, 10, 8, , , , , , 550, 200, 100, 150, true,"Georgiou",crew_portraits_cm_georgiou_rifle_sm.png,dsc_georgiou_rifle_crew
"Admiral Nechayev",9,5, 888,266,706,0,0,0,498,82,202,0,0,0,784,188,411,0,0,0,393,242,352,139,260,1041,0,755,0,949,326,834,704,0,576,68,63,52,11,39,981,0,458,0,899,214,823,391,0,336,694,57,"Human, Federation, Starfleet, Tactician, Veteran, Diplomat","female, organic, tng, necayev, crew_max_rarity_5","Stand Down",0, 8, 4, 10, 16, 5, 0, , , , 565, 100, 200, 400, false,"Nechayev",crew_portraits_cm_necayevadmiral_sm.png,necayev_admiral_crew
"Niners Sisko",6,5, 1150,143,317,0,0,0,1046,96,207,0,0,0,0,0,0,0,0,0,386,131,349,621,254,536,0,0,0,498,767,367,0,0,0,641,366,571,796,482,922,0,0,0,856,1112,783,0,0,0,813,1326,"Human, Federation, Bajoran, Cultural Figure, Starfleet, Athlete, Costumed, Inspiring, Desperate, Casual, Playful","male, organic, ds9, sisko, niners, crew_max_rarity_5","Hey Batter!",2, 8, 14, 10, 12, 4, 0, , , , 450, 245, 122, 480, false,"Sisko",crew_portraits_cm_sisko_niners_sm.png,sisko_niners_crew
"Tactical Michael Burnham",6,4, 669,62,171,0,0,0,756,196,397,338,47,131,0,0,0,0,0,0,885,302,497,1025,711,717,963,0,0,345,930,539,1247,760,0,1127,309,680,1195,966,394,931,0,0,188,589,283,1207,751,0,1098,1058,"Federation, Starfleet, Astrophysicist, Xenoanthropology, Innovator, Human, Resourceful","female, organic, dsc, burnham, crew_max_rarity_4","I Am Trying To Save You",0, 8, 6, 10, 8, , , 2, , , 675, 100, 185, 490, false,"Burnham",crew_portraits_cm_burnham_tactical_sm.png,dsc_burnham_pistol_crew
"Buster Kincaid Kim",8,4, 0,0,0,371,65,143,769,171,356,551,104,245,0,0,0,0,0,0,1205,820,890,0,0,346,417,1212,768,168,940,552,924,516,0,1199,644,809,0,0,205,337,1175,732,118,701,376,845,467,0,1135,904,"Starfleet, Federation, Human, Hero, Costumed","male, organic, voy, kim, crew_max_rarity_4","We're Going Down!",1, 7, 14, 10, 18, 2, 0, , , , 550, 200, 60, 425, false,"Kim",crew_portraits_cm_buster_kinkaid_sm.png,kim_buster_crew
"Honey Bare Jadzia",9,5, 0,0,0,1147,203,483,0,0,0,916,149,360,641,33,73,0,0,0,343,0,570,1082,0,356,40,126,199,559,1121,0,143,288,784,277,0,469,1367,0,262,17,219,175,501,1392,0,341,239,1114,499,555,"Hologram, Geologist, Romantic, Desperate, Trill","nonhuman, artificial_life, female, ds9, dax, crew_max_rarity_5","I'm Sorry Doctor",2, 10, 12, 12, 12, , , , 1, 2, 500, 75, 180, 275, false,"J. Dax",crew_portraits_cm_jadzia_honey_bare_sm.png,dax_honey_bare_crew
"Dr. Hugh Culber",9,5, 0,0,0,1103,121,284,0,0,0,0,0,0,0,0,0,1371,156,390,458,0,0,0,128,449,346,529,2,0,0,158,0,83,221,780,0,0,0,360,738,524,829,60,0,0,372,0,222,417,728,1174,"Human, Physician, Romantic, Federation, Starfleet","male, organic, dsc, culber, crew_max_rarity_5","Surgical Precision",2, 10, 6, 6, 10, , , 2, , , 600, 240, 7, 425, false,"Culber",crew_portraits_cm_hugh_culber_sm.png,dsc_culber_doctor_crew
"Commander Chapel",9,4, 0,0,0,739,76,257,0,0,0,0,0,0,245,149,301,546,99,350,796,0,0,1295,758,772,563,481,119,0,1316,711,1205,509,461,911,0,0,859,555,868,615,229,118,0,878,562,665,361,109,1212,713,"Federation, Starfleet, Human, Physician, Veteran","female, organic, tos, chapel, crew_max_rarity_4","Doctor's Orders",2, 7, 8, 8, 16, 6, 0, , , , 1450, 75, 155, 400, false,"Chapel",crew_portraits_cm_chapel_commander_sm.png,chapel_commander_crew
"Leonardo da Vinci",6,5, 0,0,0,1229,80,228,0,0,0,1092,177,354,0,0,0,366,161,483,379,0,360,0,859,393,28,474,58,385,0,803,417,22,830,958,0,437,0,220,931,120,999,61,471,0,223,482,5,278,419,242,"Hologram, Prodigy, Inspiring, Innovator, Civilian, Human, Artist, Cultural Figure, Astrophysicist","male, organic, voy, davinci, crew_max_rarity_5","Poor is the Pupil",2, 6, 6, 8, 8, 6, 0, 2, , , 1815, 330, 83, 175, false,"Leonardo",crew_portraits_cm_davinci_sm.png,davinci_crew
