"Lt. Commander Icheb",0,5, 0,0,0,1272,207,433,471,101,151,980,141,310,0,0,0,0,0,0,304,1171,565,0,0,68,22,390,167,174,1299,928,610,277,0,372,1136,668,0,0,121,38,433,210,255,1280,914,708,359,0,522,499,"Civilian, Brunali, Borg, Astrophysicist, Prodigy, Innovator, Federation, Starfleet","male, nonhuman, organic, voy, icheb, crew_max_rarity_5","I Never Told",1, 10, 6, 10, 10, , , , , , 500, 150, 138, 415, false,"Icheb",crew_portraits_cm_icheb_lt_commander_sm.png,icheb_lt_commander_crew
"Tau",0,4, 0,0,0,342,72,156,894,130,308,0,0,0,651,109,220,0,0,0,1312,824,0,1066,0,325,999,605,836,645,230,522,912,0,763,1216,842,0,1099,0,297,894,573,735,682,331,594,952,0,808,1061,1166,"Crafty, Saboteur, Criminal, Scoundrel, Resourceful","male, organic, nonhuman, voy, tau, crew_max_rarity_4","I'd Hate to Make Your Life Difficult",0, 6, 8, 10, 10, 4, 1, , , , 315, 200, 90, 300, false,"Tau",crew_portraits_cm_tau_sm.png,tau_crew
"Age of Sail Troi",0,4, 353,76,161,0,0,0,0,0,0,0,0,0,596,150,298,776,208,426,1280,1247,1209,739,185,0,0,942,423,0,1107,548,910,363,96,1183,1166,1136,504,66,0,0,802,217,0,942,238,723,130,51,1079,554,"Human, Betazoid, Costumed, Empath, Counselor, Starfleet, Federation","ageofsail, nonhuman, female, organic, tng, troi, crew_max_rarity_4","Answer Him!",0, 9, 8, 6, 10, , , , , , 400, 230, 115, 450, false,"Troi",crew_portraits_cm_troi_ageofsail_sm.png,troi_ageofsail_crew
"North Star T'Pol",0,5, 1281,187,412,972,120,248,0,0,0,0,0,0,524,99,196,0,0,0,36,505,275,190,166,664,500,253,383,0,1216,0,1040,0,871,82,583,362,252,278,843,609,399,506,0,1207,0,1038,0,885,483,680,"Vulcan, Starfleet, Astrophysicist, Telepath, Costumed","nonhuman, female, organic, ent, tpol, crew_max_rarity_5","I've Confirmed They Are Human",1, 9, 4, 8, 8, , , , , , 465, 100, 90, 470, false,"T'Pol",crew_portraits_cm_tpol_north_star_sm.png,tpol_north_star_crew
"Riker Odan",0,5, 510,88,190,1290,189,408,0,0,0,0,0,0,998,92,252,0,0,0,87,1126,1055,365,929,318,256,62,169,0,886,0,641,0,541,124,1093,1030,605,901,436,331,148,266,0,1119,0,931,0,789,486,773,"Human, Trill, Federation, Starfleet, Ambassador, Maverick, Gambler, Romantic","male, organic, tng, nonhuman, riker, crew_max_rarity_5","For the Greater Good",2, 10, 10, 8, 10, , , , , , 600, 115, 142, 350, false,"Riker",crew_portraits_cm_riker_odan_sm.png,riker_odan_crew
"Relaxed Number One",0,4, 339,52,129,673,73,166,0,0,0,0,0,0,914,136,356,0,0,0,590,1289,1266,533,1148,885,663,206,530,0,902,0,667,0,558,800,1271,1240,524,1122,1155,868,299,712,0,814,0,605,0,506,1075,1283,"Federation, Starfleet, Human, Resourceful, Explorer, Musician, Casual, Engineered, Playful, Illyrian","female, nonhuman, organic, dsc, number_one, crew_max_rarity_4","I Am The Very Model Of A Modern Major General",0, 8, 8, 8, 10, , , , , , 450, 175, 150, 450, false,"Number One",crew_portraits_cm_number_one_relaxed_sm.png,dsc_number_one_relaxed_crew
"Claymore Scotty",0,5, 0,0,0,0,0,0,1006,106,234,1307,195,387,516,72,136,0,0,0,0,754,278,1248,0,624,257,1152,0,36,290,459,84,103,964,0,982,420,1327,0,898,343,1240,0,106,711,750,173,191,1054,505,889,"Human, Starfleet, Federation, Jury Rigger, Duelist","male, organic, tos, scott, crew_max_rarity_5","This is War",0, 9, 8, 6, 8, , , , , , 375, 270, 275, 450, false,"Scotty",crew_portraits_cm_scotty_claymore_sm.png,scott_claymore_crew
"1701 Bashir",0,4, 0,0,0,364,57,135,595,123,240,0,0,0,0,0,0,814,174,316,1301,990,0,0,568,539,993,1296,206,823,1124,59,0,374,626,1303,950,0,0,470,485,986,1280,185,791,1077,96,0,280,514,1150,1058,"Human, Starfleet, Federation, Undercover Operative, Cyberneticist, Physician, Engineered, Tribbled, Displaced","nonhuman, male, organic, ds9, bashir, june2024, crew_max_rarity_4","I'm a Doctor, Not a Historian",2, 8, 8, 6, 10, , , , , , 400, 100, 160, 475, false,"Bashir",crew_portraits_cm_bashir_1701_sm.png,bashir_1701_crew
"Seamus",0,4, 0,0,0,0,0,0,872,171,395,0,0,0,579,148,299,0,0,0,0,787,0,1076,0,658,0,953,0,602,222,490,922,0,768,0,631,0,916,0,472,0,805,0,449,139,343,725,0,619,1355,1132,"Human, Hologram, Civilian, Romantic, Interrogator, Playful, Festive","nonhuman, voy, male, seamus, artificial_life, crew_max_rarity_4","Saints Preserve Us",1, 7, 6, 6, 6, , , , 0, 2, 315, 165, 147, 450, false,"Seamus",crew_portraits_cm_seamus_sm.png,seamus_crew
"Mirror Keyla Detmer",0,5, 1029,154,348,0,0,0,1308,222,451,0,0,0,0,0,0,0,0,0,534,42,464,742,347,219,0,0,0,230,431,131,0,0,0,603,87,521,771,426,280,0,0,0,287,451,186,0,0,0,778,822,"Mirror Universe, Human, Terran Empire, Brutal, Pilot","female, organic, dsc, detmer, crew_max_rarity_5","Terran Law Is Binding",0, 8, 8, 6, 12, 1, 0, 2, , , 400, 240, 105, 525, false,"Detmer",crew_portraits_cm_detmer_mirror_sm.png,dsc_detmer_mirror_crew
"Tee Time Doctor",0,4, 0,0,0,0,0,0,344,74,158,0,0,0,920,186,387,658,67,176,0,1260,0,815,756,1298,0,669,536,1136,424,363,593,505,81,0,1183,0,704,1000,1168,0,539,704,1048,304,493,473,703,146,1017,1047,"Hologram, Federation, Musician, Starfleet, Costumed, Athlete, Physician, Human, Casual, Playful","nonhuman, male, artificial_life, voy, emh, crew_max_rarity_4","The Back Nine at Gedi Prime?",2, 9, 6, 10, 10, , , , , , 500, 200, 40, 305, false,"Doctor",crew_portraits_cm_emh_caddy_sm.png,emh_caddy_crew
"Logician Solok",0,4, 903,88,202,646,87,180,0,0,0,0,0,0,0,0,0,0,0,0,180,868,706,940,573,900,676,957,539,0,0,0,0,0,0,509,1077,1002,1164,876,1078,786,1121,652,0,0,0,0,0,0,1406,1520,"Vulcan, Starfleet, Athlete, Costumed, Federation, Telepath, Casual, Playful","male, nonhuman, organic, ds9, solok, crew_max_rarity_4","I Fail to See Why You Are Celebrating",1, 9, 10, 10, 10, , , , , , 430, 215, 77, 440, false,"Solok",crew_portraits_cm_solok_logician_sm.png,solok_logician_crew
"Riva",0,4, 0,0,0,687,59,134,0,0,0,0,0,0,954,73,198,0,0,0,941,0,0,915,0,893,669,232,535,0,952,0,738,0,602,1300,0,0,1192,0,1284,983,749,819,0,1242,0,1077,0,918,1392,1560,"Ramatis III Native, Diplomat, Linguist, Telepath, Cultural Figure, Royalty, Communicator, Romantic","male, organic, nonhuman, tng, riva, crew_max_rarity_4","Be At Ease",1, 7, 8, 10, 10, , , , , , 475, 180, 220, 470, false,"Riva",crew_portraits_cm_riva_sm.png,riva_crew
"Niners Ezri",0,5, 0,0,0,0,0,0,1294,249,477,0,0,0,954,162,314,566,65,168,0,433,0,830,852,206,0,690,607,222,31,16,615,582,105,0,423,0,828,1029,230,0,715,725,234,55,54,628,723,216,291,302,"Federation, Starfleet, Athlete, Resourceful, Trill, Counselor, Costumed, Casual, Playful","nonhuman, female, organic, ds9, dax, niners, crew_max_rarity_5","Fancy Dan",0, 9, 6, 8, 10, , , , , , 375, 210, 120, 475, false,"E. Dax",crew_portraits_cm_ezri_niners_sm.png,ezri_niners_crew
"Android Kirk",0,4, 345,64,148,545,135,342,875,156,352,0,0,0,0,0,0,0,0,0,588,496,1243,1381,1131,117,681,959,543,627,914,513,0,0,0,288,427,1195,1316,1070,81,435,720,376,534,768,425,0,0,0,1088,804,"Android, Undercover Operative, Explorer, Starfleet, Federation","male, nonhuman, artificial_life, tos, kirk, crew_max_rarity_4","It is Illogical",2, 9, 6, 8, 10, , , , 1, 2, 200, 200, 187, 450, false,"Kirk",crew_portraits_cm_kirk_android_sm.png,kirk_android_crew
"EV Suit Nhan",0,5, 548,62,98,0,0,0,1344,150,303,1054,109,210,0,0,0,0,0,0,1149,197,156,1233,962,308,441,0,0,33,504,193,594,270,0,1337,552,569,1385,1148,688,679,0,0,201,900,544,979,545,0,455,1252,"Barzan, Starfleet, Federation, Brutal","evsuit, nonhuman, organic, female, dsc, nhan, crew_max_rarity_5","Stand Down",0, 9, 6, 5, 8, , , , , , 500, 150, 95, 450, false,"Nhan",crew_portraits_cm_nhan_evsuit_sm.png,dsc_nhan_evsuit_crew
"Picard at El-Adrel",0,3, 0,0,0,0,0,0,215,38,100,0,0,0,571,71,167,335,62,178,0,1331,0,1156,1124,1386,0,1038,835,1209,1034,757,1007,785,568,0,1308,0,1266,1016,1353,0,1180,710,1180,1063,682,1162,710,530,1489,1499,"Federation, Starfleet, Human, Survivalist, Communicator, Diplomat, Cultural Figure","male, organic, tng, picard, crew_max_rarity_3","Darmok And Jalad On The Ocean",0, 4, 8, 8, 10, 6, 2, , , , 240, 100, 75, 165, false,"Picard",crew_portraits_cm_picard_stranded_sm.png,picard_stranded_crew
"Medic Jett Reno",0,5, 0,0,0,489,71,174,0,0,0,1050,138,312,0,0,0,1231,220,490,1179,0,488,0,162,1151,138,1174,51,481,0,201,522,4,255,1175,0,667,0,160,1137,219,1171,59,662,0,169,707,7,219,396,369,"Starfleet, Federation, Human, Jury Rigger, Resourceful, Veteran, Survivalist, Desperate, Playful","female, organic, dsc, jett_reno, crew_max_rarity_5","Body's Just A Machine...",0, 7, 6, 10, 12, 3, 0, 3, , , 595, 225, 110, 215, false,"Reno",crew_portraits_cm_reno_medic_sm.png,dsc_jett_reno_medic_crew
"Soji Asha",0,5, 0,0,0,498,82,182,0,0,0,0,0,0,1022,136,294,1297,192,423,1153,0,0,786,142,1131,861,240,48,0,775,180,545,84,19,1115,0,0,937,266,1086,793,355,91,0,981,271,759,147,67,372,598,"Android, Counselor, Xenoanthropology, Romantic, Human, Civilian","artificial_life, nonhuman, pic, female, soji, crew_max_rarity_5","Everyone Has Secrets",1, 9, 8, 6, 8, 4, 0, , , , 265, 220, 105, 475, false,"Soji",crew_portraits_cm_soji_asha_sm.png,soji_asha_crew_crew
"Elnor",0,5, 1054,72,186,0,0,0,1330,158,384,0,0,0,0,0,0,0,0,0,643,73,574,835,455,281,0,0,0,279,466,165,0,0,0,1116,351,1077,1217,950,511,0,0,0,488,719,374,0,0,0,798,1376,"Romulan, Duelist, Qowat Milat, Survivalist, Spiritual","nonhuman, organic, male, pic, elnor, crew_max_rarity_5","I Regret Your Choice",0, 10, 8, 6, 10, , , , , , 565, 250, 135, 400, false,"Elnor",crew_portraits_cm_elnor_sm.png,elnor_crew
"Human Airiam",0,3, 343,49,122,505,46,137,0,0,0,0,0,0,157,40,85,0,0,0,793,1290,1269,1206,1151,1164,894,943,735,0,1474,0,1388,0,1194,918,1280,1251,1153,1135,1301,999,1051,834,0,1455,0,1350,0,1158,1528,1550,"Federation, Starfleet, Casual, Human","female, organic, dsc, airiam, crew_max_rarity_3","We're Coming Home",2, 5, 6, 8, 8, , , , , , 325, 160, 130, 400, false,"Airiam",crew_portraits_cm_airiam_human_sm.png,airiam_human_crew
"Raffi Musiker",0,4, 617,69,173,360,54,144,0,0,0,0,0,0,905,137,299,0,0,0,628,1027,920,342,801,1308,995,403,831,0,925,0,710,0,582,768,1151,1122,515,991,1277,975,437,813,0,971,0,751,0,644,1135,1311,"Human, Civilian, Federation, Desperate, Communicator, Gambler, Veteran","female, organic, pic, raffi, crew_max_rarity_4","You've Got Some Nerve!",0, 8, 8, 5, 10, 1, 0, , , , 350, 145, 193, 500, false,"Raffi",crew_portraits_cm_raffi_musiker_sm.png,raffi_musiker_crew
"Narek",0,5, 987,139,305,0,0,0,531,44,112,0,0,0,1289,212,425,0,0,0,606,335,541,74,426,1142,0,372,0,1026,139,911,288,0,242,746,584,669,119,573,1334,0,431,0,1166,314,1071,346,0,286,438,722,"Romulan, Undercover Operative, Crafty, Resourceful, Investigator, Scoundrel","nonhuman, organic, male, pic, narek, crew_max_rarity_5","Everyone Is Hiding Something",2, 7, 8, 8, 12, 7, 2, , , , 465, 250, 153, 325, false,"Narek",crew_portraits_cm_narek_sm.png,narek_crew
"Admiral Kirsten Clancy",0,5, 1092,321,706,0,0,0,917,172,374,0,0,0,466,32,53,0,0,0,295,81,263,237,154,602,0,1232,0,552,358,436,1223,0,1046,60,16,42,94,30,504,0,1388,0,484,522,369,1385,0,1190,610,132,"Human, Federation, Starfleet, Brutal, Investigator","female, organic, pic, clancy, crew_max_rarity_5","The Hubris",2, 8, 4, 4, 12, 7, 0, , , , 200, 175, 80, 300, false,"Admiral Clancy",crew_portraits_cm_clancy_admiral_sm.png,clancy_admiral_crew
"Vahar'ai Saru",0,5, 0,0,0,476,66,156,0,0,0,0,0,0,1280,234,464,932,130,404,1195,0,0,510,442,1176,900,132,100,0,460,437,261,272,21,1233,0,0,492,385,1193,904,153,138,0,423,397,272,235,26,478,283,"Kelpien, Federation, Starfleet, Exobiology, Linguist, Desperate","male, nonhuman, organic, dsc, saru, crew_max_rarity_5","The Light, It Is Almost Like Music",0, 10, 10, 8, 12, , , , , , 500, 150, 180, 375, false,"Saru",crew_portraits_cm_saru_vaharai_sm.png,dsc_saru_vaharai_crew
"Fenris Ranger Seven",0,4, 649,74,189,0,0,0,906,140,322,0,0,0,337,43,91,0,0,0,943,282,874,837,760,674,0,1337,0,615,543,504,1331,0,1143,1098,420,1056,979,932,657,0,1345,0,602,633,512,1335,0,1149,1118,1317,"Human, Borg, Civilian, Federation, Maverick, Brutal, Marksman, Pilot, Vengeful","nonhuman, female, organic, pic, seven, crew_max_rarity_4","I Didn't Want to Disillusion Him",2, 6, 8, 6, 12, 7, 0, , , , 430, 210, 62, 390, false,"Seven",crew_portraits_cm_seven_fenris_sm.png,seven_fenris_crew
"Dr. Agnes Jurati",0,4, 0,0,0,606,129,277,0,0,0,358,63,184,0,0,0,825,143,311,920,0,1203,0,572,874,400,951,87,1124,0,577,1254,121,631,829,0,1115,0,570,777,259,877,95,1012,0,568,1140,88,605,1121,946,"Physician, Starfleet, Federation, Human, Innovator, Undercover Operative, Cyberneticist","female, organic, pic, jurati, crew_max_rarity_4","Not a Conversation Killer at All",1, 8, 6, 6, 12, , , , 2, 2, 410, 100, 118, 315, false,"Jurati",crew_portraits_cm_jurati_doctor_sm.png,jurati_doctor_crew
"Executive Director Hugh",0,5, 978,42,113,1203,257,658,0,0,0,645,54,142,0,0,0,0,0,0,39,862,164,937,566,239,54,334,129,873,0,0,967,539,0,51,1296,855,1394,1158,107,33,155,73,1127,0,0,1259,787,0,415,694,"Civilian, Federation, Cyberneticist, Caregiver, Borg, Cultural Figure","nonhuman, male, organic, pic, hugh, crew_max_rarity_5","Hopeful Fool",1, 7, 6, 8, 10, 3, 0, 2, , , 165, 50, 100, 425, false,"Hugh",crew_portraits_cm_hugh_executive_sm.png,hugh_director_crew
"EV Suit Tuvok",0,3, 357,55,160,225,22,105,524,85,183,0,0,0,0,0,0,0,0,0,972,821,1221,1363,1108,797,1064,1376,881,963,1227,846,0,0,0,941,733,1189,1308,1064,791,1054,1355,876,968,1243,880,0,0,0,1491,1500,"Vulcan, Federation, Starfleet, Telepath, Tactician, Hunter, Marksman","nonhuman, male, organic, evsuit, voy, tuvok, crew_max_rarity_3","You Missed!",2, 3, 6, 8, 8, 1, 0, , , , 365, 100, 170, 375, false,"Tuvok",crew_portraits_cm_tuvok_ev_suit_sm.png,tuvok_ev_suit_crew
"Cristbal Rios",0,4, 840,118,271,0,0,0,330,111,211,0,0,0,567,129,255,0,0,0,791,545,715,394,581,1258,0,974,0,1103,764,1002,947,0,787,844,433,771,395,664,940,0,906,0,867,397,782,845,0,722,1165,943,"Human, Pilot, Survivalist, Resourceful, Casual, Federation, Civilian, Scoundrel","male, organic, pic, rios, crew_max_rarity_4","If You Say So",1, 8, 4, 5, 8, , , , , , 400, 145, 137, 250, false,"Rios",crew_portraits_cm_rios_cristobal_sm.png,rios_cristobal_crew
"Commodore Oh",0,5, 1028,86,195,516,72,157,1331,207,332,0,0,0,0,0,0,0,0,0,185,85,601,853,479,57,856,1137,700,283,468,168,0,0,0,591,331,1024,1178,894,197,889,1197,732,492,722,377,0,0,0,456,1033,"Vulcan, Romulan, Starfleet, Federation, Undercover Operative, Zhat Vash, Tal Shiar, Telepath, Vengeful","female, nonhuman, organic, pic, oh, crew_max_rarity_5","Let Me Show You What Will Happen",0, 10, 8, 6, 8, , , , , , 475, 200, 210, 390, false,"Oh",crew_portraits_cm_oh_commodore_sm.png,oh_commodore_crew
"Displaced Gabrielle Burnham",0,5, 0,0,0,1033,190,335,0,0,0,1316,202,440,0,0,0,0,0,0,520,0,245,0,0,507,10,589,297,288,0,0,273,76,0,571,0,298,0,0,546,21,628,321,330,0,0,339,114,0,780,849,"Jury Rigger, Survivalist, Astrophysicist, Human, Section 31, Undercover Operative, Federation, Desperate, Caregiver, Displaced","female, organic, dsc, gburnham, crew_max_rarity_5","I Was There",1, 6, 8, 10, 12, 2, 0, , , , 500, 110, 230, 350, false,"Burnham",crew_portraits_cm_gburnham_displaced_sm.png,dsc_gburnham_displaced_crew
"Dereth",0,5, 0,0,0,512,73,183,962,121,259,0,0,0,0,0,0,1247,210,527,1126,785,0,0,137,138,833,1118,43,599,890,9,0,78,225,1140,923,0,0,140,349,827,1144,55,768,1051,19,0,71,195,463,424,"Vidiian, Survivalist, Brutal, Physician, Thief, Geneticist, Desperate","male, nonhuman, organic, voy, dereth, crew_max_rarity_5","Your Surgical Knowledge is Inferior",0, 6, 10, 8, 12, 2, 0, , , , 515, 135, 105, 450, false,"Dereth",crew_portraits_cm_dereth_sm.png,dereth_crew
"Delta Flyer Kim",0,4, 861,147,295,0,0,0,392,66,132,618,109,277,0,0,0,0,0,0,759,511,144,921,555,1250,659,0,0,462,1357,1001,921,493,0,748,509,123,913,575,1267,583,0,0,419,1390,1029,841,447,0,1076,1084,"Federation, Human, Starfleet, Musician, Romantic, Pilot","male, organic, voy, kim, crew_max_rarity_4","Timing is Everything",1, 7, 6, 8, 8, , , , , , 550, 160, 184, 400, false,"Kim",crew_portraits_cm_kim_delta_flyer_sm.png,kim_delta_flyer_crew
"Bridal Keiko",0,5, 0,0,0,1035,77,148,0,0,0,0,0,0,1279,223,444,0,0,0,699,0,0,520,0,668,503,59,388,0,483,0,282,0,233,1225,0,0,534,0,1180,898,164,740,0,469,0,302,0,251,814,1301,"Human, Federation, Starfleet, Romantic, Botanist, Festive","female, organic, ds9, keiko, crew_max_rarity_5","I Do!",1, 7, 8, 6, 10, 1, 0, 2, , , 500, 150, 254, 265, false,"Keiko",crew_portraits_cm_keiko_bride_sm.png,keiko_bride_crew
"Sinister Picard",0,5, 1030,152,317,0,0,0,1281,298,601,0,0,0,467,64,151,0,0,0,554,24,479,354,363,153,0,1215,0,190,116,67,1200,0,1022,673,41,583,503,491,112,0,1226,0,117,81,73,1222,0,1043,257,169,"Human, Brutal, Undercover Operative, Civilian, Costumed, Scoundrel, Federation","male, organic, pic, picard, crew_max_rarity_5","Appropriately Sinister",2, 8, 6, 8, 8, 7, 1, , , , 400, 235, 232, 375, false,"Picard",crew_portraits_cm_picard_sinister_sm.png,picard_sinister_crew
"Vagrant Braxton",0,4, 668,74,188,884,107,286,0,0,0,0,0,0,0,0,0,0,0,0,162,970,860,1073,735,743,551,802,429,0,0,0,0,0,0,333,1109,1061,1205,936,803,579,898,480,0,0,0,0,0,0,1388,1475,"Human, Desperate, Starfleet, Federation, Temporal Agent, Survivalist, Displaced","male, organic, voy, braxton, crew_max_rarity_4","TRAITORS!",1, 5, 8, 8, 14, 4, 0, , , , 300, 120, 178, 575, false,"Braxton",crew_portraits_cm_braxton_vagrant_sm.png,braxton_vagrant_crew
"Determined Paris",0,5, 497,86,266,0,0,0,1319,190,421,0,0,0,991,145,308,0,0,0,1068,182,1021,327,887,248,0,645,0,249,33,145,570,0,483,915,203,843,347,729,379,0,779,0,369,100,259,699,0,595,311,320,"Romantic, Human, Costumed, Federation, Starfleet, Diplomat, Maverick, Duelist, Klingon, Pilot","male, organic, voy, paris, crew_max_rarity_5","I Can't Lose",0, 9, 6, 5, 8, , , , , , 700, 280, 172, 390, false,"Paris",crew_portraits_cm_paris_determined_sm.png,paris_determined_crew
"Archer and Porthos",0,5, 997,137,332,0,0,0,509,69,143,0,0,0,1289,196,407,0,0,0,579,311,515,71,396,1136,0,389,0,1022,144,907,306,0,253,674,460,584,128,492,1222,0,487,0,1092,286,996,411,0,342,423,633,"Human, Starfleet, Casual, Pilot, Inspiring, Playful","male, organic, ent, archer, crew_max_rarity_5","What Do You Think, Porthos?",1, 9, 10, 8, 10, , , , , , 400, 130, 170, 500, false,"Archer",crew_portraits_cm_archer_risa_sm.png,archer_risa_crew
"Kay Eaton",0,5, 456,91,181,1282,203,388,0,0,0,0,0,0,985,151,331,0,0,0,98,1177,1128,370,1007,329,263,49,176,0,792,0,557,0,474,130,1099,1038,415,910,448,339,69,275,0,829,0,618,0,521,508,482,"Human, Civilian, Writer, Communicator, Resourceful","female, organic, ds9, kira, crew_max_rarity_5","She's A Tough Cookie",1, 7, 10, 8, 12, 7, 1, , , , 375, 175, 152, 565, false,"Kira",crew_portraits_cm_kira_eaton_sm.png,kira_eaton_crew
"Grebnedlog",0,4, 0,0,0,0,0,0,673,51,159,188,6,12,925,91,210,0,0,0,0,982,1345,924,0,890,1077,803,0,728,261,706,513,855,611,0,1224,1350,1144,0,1225,1082,1063,0,1057,766,1000,978,860,863,1314,1533,"Criminal, Thief, Villain, Civilian, Pakled","nonhuman, male, organic, tng, grebnedlog, crew_max_rarity_4","We Are Smart",0, 9, 6, 6, 8, , , , 1, 2, 475, 140, 108, 450, false,"Grebnedlog",crew_portraits_cm_grebnedlog_sm.png,grebnedlog_crew
"Age of Sail Picard",0,5, 987,155,304,515,79,177,0,0,0,0,0,0,1291,216,415,0,0,0,171,706,530,70,411,1102,828,125,677,0,489,0,289,0,243,253,774,606,110,514,1106,829,168,677,0,532,0,357,0,294,387,463,"Human, Astrophysicist, Inspiring, Tactician, Federation, Costumed, Starfleet","male, ageofsail, organic, tng, picard, crew_max_rarity_5","Extend The Plank!",2, 9, 10, 8, 12, 4, 0, , , , 525, 150, 170, 500, false,"Picard",crew_portraits_cm_picard_age_of_sail_sm.png,picard_age_of_sail_crew
"Linnis Paris",0,5, 0,0,0,974,116,295,0,0,0,0,0,0,0,0,0,1219,194,545,662,0,0,0,161,648,472,707,21,0,0,199,0,97,254,822,0,0,0,134,771,560,873,26,0,0,153,0,69,194,811,873,"Human, Ocampa, Physician, Federation, Starfleet, Romantic, Caregiver, Telepath","female, organic, voy, linnis_paris, crew_max_rarity_5","Do You Remember Anything At All?",1, 7, 8, 8, 14, 3, 0, , , , 550, 100, 190, 150, false,"Linnis",crew_portraits_cm_linnis_sm.png,linnis_paris_crew
"Lt. JG Martinez",0,4, 0,0,0,620,110,271,0,0,0,0,0,0,0,0,0,785,175,344,918,0,0,0,578,869,653,949,90,0,0,585,0,382,639,869,0,0,0,408,817,589,915,82,0,0,419,0,249,468,1402,1299,"Physician, Federation, Starfleet, Human","male, organic, tng, martinez, crew_max_rarity_4","Yes, Doctor!",1, 7, 10, 10, 12, 5, 0, , , , 425, 125, 205, 475, false,"Martinez",crew_portraits_cm_martinez_ltjg_sm.png,martinez_ltjg_crew
"Suspiria",0,5, 1289,141,346,0,0,0,989,151,310,0,0,0,477,99,231,0,0,0,351,97,313,217,211,548,0,1116,0,506,258,376,1098,0,927,629,213,553,334,451,661,0,1002,0,605,312,516,948,0,805,482,639,"Nacene, Desperate, Brutal, Telepath, Cultural Figure, Telekinetic, Caregiver","female, nonhuman, organic, voy, suspiria, crew_max_rarity_5","What Small, Frail Creatures You Are",2, 8, 8, 8, 12, 8, 4, , , , 610, 245, 60, 225, false,"Suspiria",crew_portraits_cm_suspiria_sm.png,suspiria_crew
"Grandmother Kes",0,4, 0,0,0,0,0,0,0,0,0,620,65,150,839,177,385,278,77,207,0,0,942,900,1160,0,711,771,852,886,929,1069,171,324,308,0,0,1194,716,902,0,921,558,630,1087,695,865,184,267,136,1194,1025,"Ocampa, Desperate, Civilian, Botanist, Prodigy, Telepath, Displaced, Telekinetic","nonhuman, female, organic, voy, kes, crew_max_rarity_4","I'm Cold",0, 8, 8, 6, 8, , , , , , 600, 175, 133, 415, false,"Kes",crew_portraits_cm_kes_grandmother_sm.png,kes_grandmother_crew
"Activated Dahj",0,5, 543,93,207,939,148,412,1334,174,365,0,0,0,0,0,0,0,0,0,152,181,976,1150,843,22,433,648,334,275,463,164,0,0,0,135,310,974,1136,851,40,363,571,291,493,723,380,0,0,0,313,361,"Human, Desperate, Botanist, Brutal, Civilian, Android","female, nonhuman, artificial_life, pic, dahj, crew_max_rarity_5","Am I Real?",2, 6, 10, 4, 12, 1, 1, , , , 250, 205, 105, 525, false,"Dahj",crew_portraits_cm_dahj_activated_sm.png,dahj_activated_crew
"Mirror Chekov",0,4, 612,129,331,0,0,0,880,184,496,0,0,0,0,0,0,0,0,0,885,228,806,1028,679,556,0,0,0,515,789,382,0,0,0,698,104,605,851,513,271,0,0,0,279,447,181,0,0,0,1312,867,"Mirror Universe, Starfleet, Terran Empire, Human, Brutal","male, organic, tos, chekov, crew_max_rarity_4","So You Die, Captain",0, 8, 6, 6, 8, , , , , , 450, 225, 127, 300, false,"Chekov",crew_portraits_cm_chekov_mirror_sm.png,chekov_mirror_crew
"Nepenthe Riker",0,3, 190,60,113,384,41,107,0,0,0,0,0,0,518,61,183,0,0,0,991,1335,1329,983,1209,1307,994,788,830,0,1257,0,1097,0,926,979,1278,1249,955,1132,1345,1034,897,861,0,1298,0,1141,0,976,1501,1517,"Human, Chef, Romantic, Caregiver, Gambler, Civilian, Federation, Maverick, Starfleet","male, organic, pic, riker, crew_max_rarity_3","Cancel Red Alert!",1, 4, 12, 6, 10, 2, 0, , , , 384, 180, 130, 500, false,"Riker",crew_portraits_cm_riker_nepenthe_sm.png,riker_nepenthe_crew
"Doctor Van Gogh",0,5, 0,0,0,971,82,199,0,0,0,1309,219,448,0,0,0,596,47,109,735,0,240,0,869,709,27,774,98,278,0,822,266,11,855,1074,0,272,0,1160,1049,78,1104,452,300,0,1072,301,44,1129,474,944,"Federation, Starfleet, Hologram, Physician, Innovator, Musician, Resourceful, Human","nonhuman, male, artificial_life, voy, emh, crew_max_rarity_5","It's Highly Experimental",1, 7, 8, 8, 8, 6, 0, , , , 450, 125, 75, 425, false,"Doctor",crew_portraits_cm_emh_gogh_sm.png,emh_gogh_crew
"Kestra Troi-Riker",0,4, 0,0,0,0,0,0,906,155,311,0,0,0,640,131,244,0,0,0,0,800,0,1049,0,671,0,934,0,614,213,500,901,0,751,0,769,0,1017,0,649,0,920,0,595,260,504,861,0,734,1350,1339,"Human, Betazoid, Costumed, Civilian, Linguist","female, nonhuman, organic, pic, kestra, crew_max_rarity_4","My Arrows Are Real",2, 9, 8, 6, 10, , , , , , 355, 250, 177, 425, false,"Kestra",crew_portraits_cm_kestra_wild_sm.png,kestra_wild_crew
"Homesteader Janeway",0,5, 0,0,0,1283,183,431,0,0,0,0,0,0,454,88,169,1038,112,299,306,0,0,1277,377,316,255,147,13,0,1316,358,1192,231,117,419,0,0,1231,645,393,297,181,47,0,1272,636,1118,426,256,471,668,"Starfleet, Federation, Human, Resourceful, Survivalist, Exobiology, Gardener","female, organic, voy, janeway, crew_max_rarity_5","We Have Plenty Of Time",1, 10, 8, 8, 10, , , , , , 350, 250, 185, 375, false,"Janeway",crew_portraits_cm_janeway_homesteader_sm.png,janeway_homesteader_crew
"Krenim Guest Chakotay",0,5, 498,95,241,1281,194,460,0,0,0,0,0,0,1003,120,291,0,0,0,85,1107,1034,335,903,296,243,45,162,0,813,0,580,0,491,72,984,884,424,769,323,262,75,195,0,1013,0,806,0,689,368,364,"Human, Maquis, Federation, Starfleet, Diplomat, Prisoner, Displaced","male, organic, voy, chakotay, crew_max_rarity_5","I Have A Lot To Learn",1, 7, 8, 6, 10, 7, 1, , , , 525, 200, 113, 475, false,"Chakotay",crew_portraits_cm_chakotay_krenim_guest_sm.png,chakotay_krenim_guest_crew
"Karyn Archer",0,4, 419,51,160,604,77,198,0,0,0,0,0,0,872,130,286,0,0,0,555,1200,1148,525,1029,946,699,255,559,0,964,0,750,0,610,645,1221,1197,599,1072,1057,772,361,639,0,1004,0,792,0,680,1106,1293,"Ikaaran, Human, Desperate, Survivalist","female, organic, ent, karyn, crew_max_rarity_4","Direct Hit",2, 7, 10, 8, 12, 1, 2, , , , 455, 75, 70, 325, false,"Karyn",crew_portraits_cm_karyn_archer_sm.png,karyn_archer_crew
"1701 O'Brien",0,5, 0,0,0,0,0,0,1289,188,418,1055,83,184,0,0,0,0,0,0,0,482,594,0,0,291,471,0,0,34,481,178,636,292,0,0,573,1058,0,0,389,779,0,0,133,585,272,1085,645,0,806,1313,"Human, Federation, Starfleet, Tribbled, Veteran, Undercover Operative, Duelist, Jury Rigger, Displaced","male, organic, obrien, ds9, crew_max_rarity_5","Don't Take It Personally",0, 8, 10, 6, 10, 7, 4, , , , 350, 225, 90, 275, false,"O'Brien",crew_portraits_cm_obrien_1701_sm.png,obrien_1701_crew
"Tanis",0,4, 0,0,0,0,0,0,372,63,109,0,0,0,660,94,213,903,56,177,0,1261,0,1067,585,1299,0,945,447,1137,739,244,913,391,113,0,1279,0,1130,1027,1313,0,1050,722,1147,831,643,1007,722,441,1146,1444,"Brutal, Ocampa, Telepath, Diplomat, Civilian","nonhuman, male, organic, voy, tanis, crew_max_rarity_4","Give Life, Kill, It Is All The Same",1, 9, 6, 10, 12, 3, 0, 2, , , 455, 200, 138, 315, false,"Tanis",crew_portraits_cm_tanis_sm.png,tanis_crew
