"Transporter Chief Rand",10,4, 0,0,0,0,0,0,0,0,0,859,113,241,628,92,204,0,0,0,0,0,389,644,0,0,326,579,0,388,655,0,49,224,459,0,0,507,697,0,0,361,678,0,489,727,0,167,301,540,845,909,"Human, Federation, Starfleet, Desperate","female, organic, tos, rand, crew_max_rarity_4","Yank Them Back!",1, 8, 8, 8, 10, , , , , , 475, 275, 155, 242, false,"Rand",crew_portraits_cm_rand_transporter_sm.png,rand_transporter_crew
"Betrothed Kamala",2,2, 234,27,86,145,27,81,0,0,0,0,0,0,363,43,105,0,0,0,784,834,827,671,783,893,608,686,556,0,870,0,802,0,697,766,824,812,733,769,878,598,716,548,0,895,0,807,0,703,1008,1021,"Kriosian, Empath, Romantic","organic, tng, female, nonhuman, kamala, crew_max_rarity_2","I Am for You",1, 2, 6, 3, 10, 1, 0, , , , 390, 130, 115, 530, false,"Kamala",crew_portraits_cm_kamala_betrothed_sm.png,kamala_betrothed_crew
"Cadet First Class Locarno",9,5, 1284,180,408,0,0,0,0,0,0,0,0,0,1078,160,296,0,0,0,127,255,92,3,51,0,0,302,0,0,382,0,235,0,230,269,367,192,102,187,0,0,469,0,0,537,0,376,0,370,406,605,"Human, Federation, Starfleet, Maverick, Pilot, Crafty, Desperate","tng, male, nicholas_locarno, organic, crew_max_rarity_5","Everything I Said Was The Truth!",1, 10, 4, 12, 8, , , , 2, 2, 390, 150, 175, 690, false,"Locarno",crew_portraits_cm_nicholas_locarno_sm.png,locarno_nicholas_crew
"Kamala",5,5, 967,131,227,546,92,174,0,0,0,0,0,0,1254,238,483,0,0,0,83,445,325,29,284,628,436,44,398,0,229,0,85,0,109,235,582,475,88,453,679,440,74,410,0,255,0,122,0,146,84,304,"Kriosian, Empath, Romantic, Exoarchaeology","nonhuman, female, organic, tng, kamala, crew_max_rarity_5","Who I Am Today, I Will Be Forever",1, 7, 4, 6, 8, , , , , , 315, 95, 167, 325, true,"Kamala",crew_portraits_cm_kamala_sm.png,kamala_crew
"Priestess Siranna",8,4, 529,112,242,0,0,0,0,0,0,0,0,0,883,138,286,382,78,211,631,636,562,215,193,0,0,450,471,0,518,612,378,418,103,558,586,481,244,138,0,0,512,394,0,578,552,423,361,148,556,582,"Gardener, Kelpien, Spiritual, Civilian, Ambassador, Cultural Figure","nonhuman, female, organic, dsc, siranna, crew_max_rarity_4","The Truth Has Survived",1, 7, 6, 8, 8, , , , , , 450, 200, 100, 475, false,"Siranna",crew_portraits_cm_siranna_priestess_sm.png,dsc_siranna_priestess_crew
"Scrooge Data",4,5, 969,171,330,508,73,173,0,0,0,0,0,0,1267,264,338,0,0,0,79,376,235,20,198,689,460,66,429,0,273,0,122,0,139,138,437,290,74,277,712,470,117,433,0,388,0,217,0,239,109,294,"Android, Starfleet, Federation, Cyberneticist, Costumed, Cultural Figure","nonhuman, male, tng, lieutenant_commander, bridge_crew, artificial_life, data, crew_max_rarity_5","Humbug",1, 9, 6, 8, 6, , , , , , 200, 305, 160, 475, false,"Data",crew_portraits_cm_data_scrooge_sm.png,data_scrooge_crew
"Chancellor Martok",5,5, 943,132,341,0,0,0,543,67,148,0,0,0,1262,161,372,0,0,0,339,167,281,38,254,658,0,229,0,571,75,533,152,0,171,400,289,315,119,311,747,0,381,0,641,234,628,304,0,310,183,423,"Klingon, Duelist, Tactician, Diplomat, Veteran, Politician, Cultural Figure","nonhuman, male, organic, ds9, martok, crew_max_rarity_5","I will fight any battle. Anywhere",0, 9, 8, 8, 10, , , , 2, 2, 400, 125, 184, 450, false,"Martok",crew_portraits_cm_martok_chancellor_sm.png,martok_chancellor_crew
"Admiral Patrick",5,5, 1238,275,538,1023,124,239,0,0,0,0,0,0,495,76,143,0,0,0,3,231,75,87,37,301,236,125,199,0,779,0,691,0,599,16,216,69,104,63,534,349,313,332,0,837,0,726,0,632,54,243,"Human, Engineered, Federation, Civilian, Costumed, Crafty","male, organic, ds9, patrick, crew_max_rarity_5","That's A Stupid Question",1, 9, 8, 10, 10, , , , , , 500, 100, 155, 375, false,"Patrick",crew_portraits_cm_patrick_admiral_sm.png,patrick_admiral_crew
"Christine Chapel",6,4, 0,0,0,559,70,170,0,0,0,0,0,0,349,103,201,790,127,280,661,0,0,799,363,627,435,380,80,0,824,358,742,239,185,742,0,0,688,406,727,479,361,149,0,714,399,603,244,149,701,696,"Federation, Starfleet, Human, Physician, Veteran, Nurse, Romantic","female, organic, tos, chapel, crew_max_rarity_4","Don't You Recognise Me?",1, 7, 8, 12, 12, 5, 0, , , , 1400, 185, 120, 400, false,"Chapel",crew_portraits_cm_chapel_christine_sm.png,chapel_christine_crew
"Brainless Spock",8,2, 0,0,0,223,43,138,0,0,0,360,51,179,0,0,0,0,0,0,886,0,737,0,0,876,383,865,539,683,0,0,766,442,0,826,0,701,0,0,810,315,805,509,634,0,0,711,411,0,1025,1011,"Federation, Starfleet, Exobiology, Astrophysicist, Human, Musician, Vulcan, Telepath","nonhuman, male, organic, tos, bridge_crew, first_officer, spock, spock_tos, crew_max_rarity_2","A Practical Idea",2, 3, 8, 10, 8, , , , , , 460, 150, 163, 390, false,"Spock",crew_portraits_cm_spock_brainless_sm.png,spock_brainless_crew
"Garth of Izar",5,5, 1214,226,444,0,0,0,989,156,344,0,0,0,487,83,142,0,0,0,146,21,109,116,72,271,0,735,0,236,148,183,696,0,607,187,63,129,156,123,353,0,752,0,311,241,278,719,0,624,142,236,"Prisoner, Desperate, Human, Brutal, Resourceful, Villain, Shapeshifter, Veteran","organic, male, tos, garth_izar, crew_max_rarity_5","I'm Afraid of No One",0, 8, 6, 8, 10, 1, 0, 2, , , 300, 200, 185, 225, false,"Garth",crew_portraits_cm_garth_izar_sm.png,garth_izar_crew
"Seeking Spock",4,5, 0,0,0,1257,183,448,0,0,0,0,0,0,430,132,295,931,170,326,150,0,0,724,266,139,153,59,17,0,747,229,638,161,71,238,0,0,572,294,224,170,48,26,0,576,299,421,179,75,154,143,"Vulcan, Human, Telepath, Spiritual, Starfleet, Federation, Resourceful, Explorer","nonhuman, male, organic, tos, spock, spock_tos, crew_max_rarity_5","Recommend We Proceed",1, 9, 10, 12, 12, , , , , , 550, 200, 175, 225, false,"Spock",crew_portraits_cm_spock_seeking_sm.png,spock_seeking_crew
"Compromised Airiam",8,5, 0,0,0,940,178,397,1254,198,420,0,0,0,0,0,0,0,0,0,306,287,0,0,0,4,227,333,190,138,283,99,0,0,0,294,340,0,0,0,19,217,322,192,194,345,169,0,0,0,431,455,"Control, Federation, Starfleet, Brutal, Undercover Operative, Human, Engineered, Astrophysicist","evsuit, female, organic, dsc, bridge_crew, airiam, crew_max_rarity_5","Open The Airlock",0, 9, 8, 8, 10, , , , 2, 2, 555, 125, 285, 400, false,"Airiam",crew_portraits_cm_airiam_compromised_sm.png,dsc_airiam_compromised_crew
"Lt. Uhura",4,3, 384,51,129,0,0,0,0,0,0,0,0,0,539,76,178,0,0,0,790,754,717,497,680,0,0,661,0,0,725,0,618,0,528,821,781,742,555,704,0,0,720,0,0,782,0,674,0,586,958,999,"Human, Starfleet, Federation, Musician, Communicator","bridge_crew, female, organic, tos, uhura, lieutenant, crew_max_rarity_3","Hailing Frequencies Open",1, 5, 6, 10, 12, , , , , , 300, 50, 71, 190, false,"Uhura",crew_portraits_cm_uhura_lt_yellow_sm.png,uhura_lt_yellow_crew
"Rescue Team Uhura",4,5, 984,179,361,0,0,0,1313,166,410,0,0,0,456,113,208,0,0,0,269,8,211,163,178,117,0,716,0,115,64,69,683,0,589,312,80,237,188,229,268,0,639,0,229,134,202,571,0,509,46,208,"Human, Federation, Starfleet, Communicator, Resourceful, Musician, Marksman","bridge_crew, female, organic, tos, uhura, lieutenant_commander, crew_max_rarity_5","Phasers on Setting One. Fire.",2, 7, 6, 3, 8, 7, 0, , , , 540, 225, 68, 150, false,"Uhura",crew_portraits_cm_uhura_rescue_sm.png,uhura_rescue_crew
"Sulu of the Body",8,4, 612,111,266,0,0,0,0,0,0,0,0,0,910,153,301,0,0,0,546,569,480,146,440,0,0,417,0,0,492,0,349,0,310,527,564,449,201,433,0,0,476,0,0,539,0,384,0,373,793,791,"Human, Federation, Starfleet, Diplomat, Pilot, Archon","male, organic, tos, bridge_crew, sulu, crew_max_rarity_4","Paradise, My Friend, Paradise",1, 6, 8, 8, 12, 6, 0, , , , 615, 270, 168, 475, false,"Sulu",crew_portraits_cm_sulu_archon_sm.png,sulu_archon_crew
"Lenara Kahn",10,5, 0,0,0,1246,187,421,0,0,0,0,0,0,997,144,301,0,0,0,166,0,0,443,0,163,161,15,111,0,421,0,265,0,255,265,0,0,550,0,250,189,51,175,0,554,0,396,0,379,435,611,"Trill, Astrophysicist, Romantic","nonhuman, female, organic, ds9, lenara, crew_max_rarity_5","I'm Not Like You",1, 10, 8, 8, 8, , , , , , 315, 200, 150, 490, false,"Lenara",crew_portraits_cm_lenara_kahn_sm.png,lenara_kahn_crew
"Torpedo Surgeon McCoy",4,5, 0,0,0,893,148,332,0,0,0,593,29,70,0,0,0,1254,142,484,394,0,634,0,67,376,94,418,20,583,0,81,642,10,132,410,0,828,0,160,391,212,432,29,751,0,171,855,51,209,215,456,"Federation, Starfleet, Human, Physician, Exobiology, Desperate, Jury Rigger","male, organic, tos, lieutenant_commander, mccoy, crew_max_rarity_5","Lock and Load",2, 8, 4, 6, 8, 1, 0, , , , 300, 230, 86, 250, true,"McCoy",crew_portraits_cm_mccoy_torpedo_sm.png,mccoy_torpedo_crew
"Scared Scotty",4,4, 0,0,0,0,0,0,381,89,175,871,114,238,639,59,128,0,0,0,0,745,384,672,0,766,323,614,0,141,400,623,51,219,489,0,689,510,827,0,671,366,798,0,205,532,570,294,303,667,609,818,"Human, Starfleet, Federation, Jury Rigger, Desperate","male, organic, tos, scott, crew_max_rarity_4","I Don't Remember",1, 5, 12, 10, 12, 0, 1, , , , 370, 145, 17, 250, false,"Scotty",crew_portraits_cm_scotty_scared_sm.png,scott_scared_crew
"Talas",6,5, 510,73,159,0,0,0,958,151,327,1273,208,375,0,0,0,0,0,0,707,184,32,728,598,316,160,0,0,15,442,223,134,56,0,743,275,77,762,640,384,215,0,0,25,498,308,250,134,0,173,344,"Andorian, Imperial Guard, Saboteur, Romantic, Tactician, Crafty","nonhuman, female, organic, ent, talas, lieutenant, crew_max_rarity_5","It's Not The Weapon, It's The Soldier",2, 6, 10, 10, 18, 2, 0, , , , 1475, 200, 115, 415, false,"Talas",crew_portraits_cm_talas_sm.png,talas_crew
"EV Suit Chekov",7,4, 379,58,169,661,62,141,0,0,0,0,0,0,925,129,248,0,0,0,276,751,706,272,664,558,395,102,353,0,503,0,367,0,319,463,736,695,402,654,782,510,320,482,0,635,0,491,0,454,540,816,"Federation, Starfleet, Human, Resourceful, Tactician","male, evsuit, organic, tos, lieutenant, bridge_crew, chekov, crew_max_rarity_4","We've Got To Get Out Of Here",1, 7, 14, 12, 14, 5, 0, , , , 380, 50, 70, 400, false,"Chekov",crew_portraits_cm_chekov_evsuit_sm.png,chekov_evsuit_crew
"Laborer Kirk",3,5, 1013,107,294,0,0,0,0,0,0,1292,210,476,496,65,151,0,0,0,294,383,2,191,207,0,127,731,0,102,781,0,27,34,603,493,540,13,383,407,0,145,764,0,158,842,0,51,70,636,79,345,"Human, Federation, Starfleet, Jury Rigger, Resourceful, Romantic, Thief, Desperate","male, organic, tos, captain, bridge_crew, kirk, crew_max_rarity_5","How Are The Stone Knives And Bearskins?",2, 7, 8, 8, 12, 2, 0, , , , 200, 200, 147, 375, false,"Kirk",crew_portraits_cm_kirk_laborer_sm.png,kirk_laborer_crew
"Dress Uniform Beverly Crusher",8,4, 0,0,0,0,0,0,0,0,0,0,0,0,611,73,245,810,172,428,0,0,0,645,305,0,0,583,242,0,660,286,539,192,57,0,0,0,675,185,0,0,643,176,0,693,194,577,114,76,814,729,"Human, Starfleet, Federation, Physician, Caregiver, Cyberneticist","female, organic, tng, commander, crusher, crew_max_rarity_4","The Bride and Groom",2, 8, 10, 6, 12, , , , , , 400, 195, 217, 415, false,"Crusher",crew_portraits_cm_crusher_dress_uniform_sm.png,crusher_dress_uniform_crew
"Ishan Chaye Sisko",2,5, 0,0,0,0,0,0,496,93,293,1284,247,490,987,120,226,0,0,0,0,651,82,493,0,623,123,394,0,35,140,496,5,29,290,0,555,112,649,0,492,119,613,0,19,239,420,23,52,485,49,203,"Bajoran, Resourceful, Desperate, Undercover Operative, Civilian, Investigator","male, organic, ds9, captain, bridge_crew, sisko, crew_max_rarity_5","We're Not Who We Seem To Be",1, 9, 6, 10, 10, , , , , , 200, 220, 160, 380, false,"Sisko",crew_portraits_cm_sisko_ishan_chaye_sm.png,sisko_ishan_chaye_crew
"Saowin",10,4, 0,0,0,874,171,371,0,0,0,671,94,219,0,0,0,0,0,0,388,0,476,0,0,367,64,408,232,455,0,0,513,285,0,327,0,577,0,0,320,80,362,213,541,0,0,589,345,0,784,775,"Desperate, Resourceful, Ambassador, Civilian","male, organic, nonhuman, voy, saowin, crew_max_rarity_4","I Have Some Bad News",1, 7, 6, 8, 10, 3, 0, 2, , , 400, 50, 96, 474, false,"Saowin",crew_portraits_cm_saowin_sm.png,saowin_crew
"Dejaren",4,4, 566,157,355,380,54,148,877,159,388,0,0,0,0,0,0,0,0,0,246,135,464,608,422,101,528,782,484,313,480,267,0,0,0,164,94,273,467,258,130,511,779,483,262,433,234,0,0,0,502,370,"Brutal, Hologram, Crafty, Desperate, Saboteur","male, artificial_life, nonhuman, voy, dejaren, crew_max_rarity_4","You're Getting Blood Everywhere",0, 7, 6, 8, 12, 1, 0, , , , 140, 125, 137, 300, false,"Dejaren",crew_portraits_cm_dejaren_sm.png,dejaren_crew
"Dr. 'Bones' McCoy",5,5, 0,0,0,0,0,0,0,0,0,0,0,0,0,0,0,1641,98,360,0,0,0,0,19,0,0,0,51,0,0,32,0,15,56,0,0,0,0,345,0,0,0,270,0,0,344,0,202,362,813,980,"Federation, Starfleet, Human, Physician, Resourceful, Exobiology","male, organic, tos, lieutenant_commander, mccoy, crew_max_rarity_5","I'm A Doctor!",2, 8, 6, 10, 14, 3, 0, 3, , , 700, 325, 291, 325, false,"McCoy",crew_portraits_cm_mccoy_doctor_sm.png,mccoy_doctor_crew
"Arandis",9,4, 649,82,207,0,0,0,0,0,0,0,0,0,936,85,208,0,0,0,553,575,490,165,448,0,0,458,0,0,527,0,389,0,338,646,667,596,415,559,0,0,680,0,0,733,0,619,0,545,812,932,"Resourceful, Inspiring, Communicator, Civilian, Romantic, Risian","female, nonhuman, organic, ds9, arandis, crew_max_rarity_4","Risa Will Be Waiting",1, 5, 4, 8, 12, 3, 0, 3, , , 405, 50, 33, 440, true,"Arandis",crew_portraits_cm_arandis_sm.png,arandis_crew
"Captain Lucero",7,4, 661,108,235,858,172,324,0,0,0,0,0,0,352,80,162,0,0,0,64,559,457,406,417,406,301,191,249,0,845,0,765,0,665,93,593,500,410,474,373,260,176,242,0,802,0,688,0,600,508,568,"Human, Federation, Starfleet, Tribbled, Survivalist, Explorer, Resourceful","female, organic, dsc, lucero, crew_max_rarity_4","He's an Idiot",2, 8, 6, 8, 10, 5, 0, , , , 525, 200, 110, 390, false,"Lucero",crew_portraits_cm_lucero_captain_sm.png,dsc_lucero_captain_crew
"Admiral Maxwell Forrest",5,5, 1256,220,470,0,0,0,0,0,0,430,102,236,1002,151,312,0,0,0,123,247,28,10,42,0,489,330,0,617,410,0,48,401,249,173,285,25,59,116,0,371,462,0,506,526,0,83,314,363,88,176,"Human, Diplomat, Starfleet, Ambassador","male, organic, ent, forrest, admiral, crew_max_rarity_5","It's Time to Swim",1, 7, 8, 8, 14, 2, 0, , , , 405, 320, 100, 425, false,"Forrest",crew_portraits_cm_forrest_admiral_sm.png,forrest_admiral_crew
"Belle Q",8,5, 982,98,243,452,75,166,0,0,0,0,0,0,1286,210,438,0,0,0,103,439,314,27,277,741,500,69,465,0,234,0,90,0,113,283,595,508,129,477,722,477,104,440,0,335,0,171,0,199,213,425,"Q Continuum, Costumed, Romantic, Resourceful, Crafty","female, organic, tng, nonhuman, miss_q, crew_max_rarity_5","They're Using Our Weapons",0, 9, 8, 8, 10, , , , , , 400, 320, 211, 390, false,"Q",crew_portraits_cm_miss_q_civil_war_sm.png,miss_q_civil_war_crew
"Mycelial Culber",2,5, 449,93,303,869,198,423,0,0,0,0,0,0,0,0,0,1291,237,550,85,672,611,707,5,336,258,381,5,0,0,44,0,25,89,40,546,420,587,7,235,177,272,7,0,0,90,0,37,113,21,50,"Human, Physician, Romantic, Federation, Starfleet, Desperate","male, organic, dsc, culber, crew_max_rarity_5","You Have to Let Me Go",0, 9, 6, 6, 6, , , , 1, 3, 400, 200, 148, 500, false,"Culber",crew_portraits_cm_culber_mycelial_sm.png,dsc_culber_mycelial_crew
"Commander Shelby",10,4, 855,128,259,0,0,0,643,80,169,0,0,0,0,0,0,0,0,0,436,181,369,540,323,553,0,0,0,483,661,442,0,0,0,514,322,434,598,421,698,0,0,0,596,779,589,0,0,0,830,905,"Gambler, Starfleet, Federation, Human, Tactician, Desperate","female, organic, tng, shelby, crew_max_rarity_4","Impossible!",1, 7, 8, 10, 8, , , , , , 475, 200, 153, 325, false,"Shelby",crew_portraits_cm_shelby_commander_sm.png,shelby_commander_crew
"Tourist Worf",3,3, 533,62,160,0,0,0,386,56,160,0,0,0,0,0,0,0,0,0,675,454,614,708,573,776,0,0,0,658,829,629,0,0,0,763,500,702,779,661,748,0,0,0,642,827,629,0,0,0,957,991,"Federation, Starfleet, Klingon, Saboteur, Romantic","male, nonhuman, organic, ds9, bridge_crew, worf, crew_max_rarity_3","I Didn't Bring A Bathing Suit",1, 4, 10, 8, 10, 1, 2, , , , 25, 100, 173, 90, false,"Worf",crew_portraits_cm_worf_tourist_sm.png,worf_tourist_crew
"Control Leland",3,5, 1254,233,394,0,0,0,1067,103,198,0,0,0,658,49,86,0,0,0,132,23,100,81,59,293,0,617,0,255,113,203,573,0,492,226,151,152,253,150,615,0,845,0,543,550,534,818,0,711,18,573,"Section 31, Undercover Operative, Crafty, Control, Brutal, Human","nonhuman, male, organic, dsc, leland, crew_max_rarity_5","Get Me That Data",0, 8, 6, 8, 10, , , , 2, 3, 265, 210, 153, 475, false,"Leland",crew_portraits_cm_leland_control_sm.png,dsc_leland_control_crew
"Leucon",2,5, 0,0,0,974,210,435,490,96,200,1268,295,448,0,0,0,0,0,0,259,692,88,0,0,49,1,305,169,36,750,548,78,31,0,220,659,109,0,0,59,6,250,152,29,711,539,111,50,0,13,91,"Civilian, Brunali, Botanist, Desperate, Jury Rigger, Geneticist","male, organic, voy, leucon, crew_max_rarity_5","You Can Make A Difference Here",1, 9, 8, 10, 12, , , , , , 445, 100, 140, 365, false,"Leucon",crew_portraits_cm_leucon_sm.png,leucon_crew
"Annika Hansen Seven",5,5, 565,38,88,1021,107,251,0,0,0,1303,161,317,0,0,0,0,0,0,84,689,33,725,594,308,19,359,204,148,0,0,150,61,0,398,820,193,876,760,542,90,587,336,344,0,0,351,192,0,190,691,"Human, Civilian, Federation, Astrophysicist, Romantic","female, organic, voy, bridge_crew, seven, crew_max_rarity_5","I'm Sure You'll Adapt",0, 9, 6, 6, 10, , , , , , 375, 200, 250, 400, false,"Seven",crew_portraits_cm_seven_annika_sm.png,seven_annika_crew
"Twilight T'Pol",4,5, 0,0,0,951,90,222,403,186,378,0,0,0,0,0,0,1034,240,792,412,652,0,0,91,67,300,442,23,543,713,14,0,53,143,629,387,0,0,28,79,394,648,11,244,416,4,0,12,49,214,28,"Vulcan, Astrophysicist, Telepath, Caregiver, Civilian","nonhuman, female, organic, ent, first_officer, bridge_crew, tpol, crew_max_rarity_5","Target Their Engines",2, 10, 12, 10, 10, , , , 0, 2, 225, 125, 120, 250, false,"T'Pol",crew_portraits_cm_tpol_twilight_sm.png,tpol_twilight_crew
"Picard and Number One",2,5, 527,79,177,1328,234,497,0,0,0,0,0,0,967,154,330,0,0,0,33,666,606,174,562,82,106,2,77,0,429,0,274,0,263,48,699,652,275,608,152,120,21,117,0,504,0,344,0,339,11,199,"Human, Astrophysicist, Inspiring, Civilian, Cultural Figure, Federation, Gardener, Veteran","male, organic, pic, admiral, bridge_crew, picard, crew_max_rarity_5","Old Dogs",1, 8, 6, 8, 10, 6, 0, , , , 300, 235, 130, 300, false,"Picard",crew_portraits_cm_picard_numberone_sm.png,picard_numberone_crew
"Doctor Paul Stubbs",9,4, 0,0,0,856,150,370,0,0,0,659,118,275,0,0,0,0,0,0,407,0,458,0,0,393,65,432,244,448,0,0,503,283,0,357,0,443,0,0,349,67,393,227,438,0,0,474,260,0,786,736,"Astrophysicist, Human, Federation, Innovator, Civilian","male, organic, tng, stubbs, crew_max_rarity_4","I Would Rather Die Than Leave",2, 8, 6, 8, 8, , , , 1, 2, 600, 170, 170, 225, false,"Stubbs",crew_portraits_cm_stubbs_sm.png,stubbs_crew
"Mission Specialist Lefler",7,4, 0,0,0,661,96,192,0,0,0,858,86,214,390,73,145,0,0,0,557,0,408,800,0,519,84,303,332,403,825,0,170,240,648,659,0,594,797,0,650,208,407,395,556,841,0,312,356,634,593,822,"Human, Federation, Starfleet, Romantic, Innovator, Resourceful, Tactician","female, organic, tng, lefler, crew_max_rarity_4","Always Watch Your Back",1, 6, 5, 8, 10, 3, 0, 3, , , 200, 50, 141, 325, false,"Lefler",crew_portraits_cm_lefler_robin_sm.png,lefler_robin_crew
"Mirror Burnham",2,4, 355,36,112,0,0,0,642,121,232,0,0,0,892,166,328,0,0,0,844,370,768,301,730,515,0,416,0,456,108,409,348,0,309,859,438,782,367,747,535,0,423,0,471,163,456,337,0,333,526,658,"Mirror Universe, Undercover Operative, Federation, Starfleet, Civilian, Astrophysicist, Xenoanthropology, Human","female, organic, dsc, burnham, crew_max_rarity_4","The Old Michael Burnham is Dead",0, 9, 6, 10, 10, , , , , , 495, 200, 145, 440, false,"Burnham",crew_portraits_cm_burnham_mirror_sm.png,dsc_burnham_mirror_crew
"Lt. Ilia",10,4, 664,106,231,864,156,339,0,0,0,0,0,0,0,0,0,0,0,0,63,560,459,606,418,399,299,440,247,0,0,0,0,0,0,97,603,515,646,484,374,261,416,244,0,0,0,0,0,0,790,787,"Deltan, Federation, Starfleet, Romantic","female, nonhuman, organic, tos, ilia, crew_max_rarity_4","Navigational Deflectors Online",1, 8, 8, 6, 8, , , , , , 475, 200, 191, 415, false,"Ilia",crew_portraits_cm_ilia_lt_sm.png,ilia_lt_crew
"Age of Sail Worf",3,5, 962,139,356,0,0,0,1334,161,358,0,0,0,503,87,189,0,0,0,297,17,246,176,212,121,0,676,0,121,61,73,640,0,550,375,110,295,248,284,332,0,694,0,294,194,263,643,0,563,78,336,"Klingon, Tactician, Federation, Starfleet, Costumed","ageofsail, nonhuman, male, organic, tng, bridge_crew, worf, crew_max_rarity_5","I am Prepared",1, 7, 8, 8, 10, 4, 1, , , , 380, 170, 200, 475, false,"Worf",crew_portraits_cm_worf_ageofsail_sm.png,worf_ageofsail_crew
"Arjin",8,4, 597,101,222,836,177,394,0,0,0,0,0,0,379,65,135,0,0,0,73,599,519,427,486,388,290,174,239,0,841,0,752,0,657,70,622,535,462,507,286,219,157,194,0,855,0,749,0,655,543,558,"Civilian, Pilot, Astrophysicist, Trill","male, organic, ds9, nonhuman, arjin, crew_max_rarity_4","It's... Interesting",2, 9, 8, 6, 8, , , 2, , , 350, 200, 125, 430, false,"Arjin",crew_portraits_cm_arjin_sm.png,arjin_crew
"Lt. Commander Icheb",4,5, 0,0,0,1272,207,433,471,101,151,980,141,310,0,0,0,0,0,0,136,720,292,0,0,32,8,180,90,68,788,583,284,154,0,229,703,365,0,0,74,29,252,156,140,772,584,386,217,0,176,310,"Civilian, Brunali, Borg, Astrophysicist, Prodigy, Innovator, Federation","male, organic, voy, icheb, crew_max_rarity_5","I Never Told",1, 10, 6, 10, 10, , , , , , 500, 150, 138, 415, false,"Icheb",crew_portraits_cm_icheb_lt_commander_sm.png,icheb_lt_commander_crew
"Tau",7,4, 0,0,0,342,72,156,894,130,308,0,0,0,651,109,220,0,0,0,825,474,0,621,0,144,553,313,506,341,118,289,517,0,451,764,501,0,662,0,189,488,349,457,378,213,356,555,0,501,537,659,"Crafty, Saboteur, Criminal, Scoundrel, Resourceful","male, organic, nonhuman, voy, tau, crew_max_rarity_4","I'd Hate to Make Your Life Difficult",0, 6, 8, 10, 10, 4, 1, , , , 315, 200, 90, 300, false,"Tau",crew_portraits_cm_tau_sm.png,tau_crew
"Age of Sail Troi",3,4, 353,76,161,0,0,0,0,0,0,0,0,0,596,150,298,776,208,426,795,759,724,412,68,0,0,566,252,0,638,297,515,196,50,735,720,680,312,50,0,0,481,157,0,547,164,390,89,39,522,326,"Human, Betazoid, Costumed, Empath, Counselor, Starfleet, Federation","ageofsail, nonhuman, female, organic, tng, troi, crew_max_rarity_4","Answer Him!",0, 9, 8, 6, 10, , , , , , 400, 230, 115, 450, false,"Troi",crew_portraits_cm_troi_ageofsail_sm.png,troi_ageofsail_crew
"North Star T'Pol",4,5, 1281,187,412,972,120,248,0,0,0,0,0,0,524,99,196,0,0,0,15,253,91,85,49,357,278,119,226,0,724,0,613,0,524,51,359,180,159,171,523,344,233,327,0,728,0,614,0,541,111,381,"Vulcan, Starfleet, Astrophysicist, Telepath, Costumed","nonhuman, female, organic, ent, first_officer, bridge_crew, tpol, crew_max_rarity_5","I've Confirmed They Are Human",1, 9, 4, 8, 8, , , , , , 465, 100, 90, 470, false,"T'Pol",crew_portraits_cm_tpol_north_star_sm.png,tpol_north_star_crew
"Riker Odan",4,5, 510,88,190,1290,189,408,0,0,0,0,0,0,998,92,252,0,0,0,35,671,608,197,568,124,141,20,91,0,467,0,311,0,284,80,679,614,384,577,259,201,92,181,0,663,0,538,0,487,131,437,"Human, Trill, Federation, Starfleet, Ambassador, Maverick, Gambler, Romantic","male, organic, tng, nonhuman, riker, crew_max_rarity_5","For the Greater Good",2, 10, 10, 8, 10, , , , , , 600, 115, 142, 350, false,"Riker",crew_portraits_cm_riker_odan_sm.png,riker_odan_crew
"Relaxed Number One",7,4, 339,52,129,673,73,166,0,0,0,0,0,0,914,136,356,0,0,0,301,794,767,282,729,528,378,87,335,0,474,0,324,0,292,476,780,741,327,703,728,480,182,443,0,500,0,339,0,334,530,734,"Federation, Starfleet, Human, Resourceful, Explorer, Musician, Casual","female, organic, dsc, bridge_crew, lieutenant, number_one, crew_max_rarity_4","I Am The Very Model Of A Modern Major General",0, 8, 8, 8, 10, , , , , , 450, 175, 150, 450, false,"Number One",crew_portraits_cm_number_one_relaxed_sm.png,dsc_number_one_relaxed_crew
"Claymore Scotty",5,5, 0,0,0,0,0,0,1006,106,234,1307,195,387,516,72,136,0,0,0,0,440,104,753,0,345,142,708,0,11,165,249,29,47,581,0,600,221,809,0,553,216,776,0,55,442,471,89,135,647,181,526,"Human, Starfleet, Federation, Jury Rigger, Duelist","male, organic, tos, scott, crew_max_rarity_5","This is War",0, 9, 8, 6, 8, , , , , , 375, 270, 275, 450, false,"Scotty",crew_portraits_cm_scotty_claymore_sm.png,scott_claymore_crew
"1701 Bashir",3,4, 0,0,0,364,57,135,595,123,240,0,0,0,0,0,0,814,174,316,817,596,0,0,324,273,548,804,118,475,653,33,0,207,349,810,578,0,0,304,290,521,789,136,454,637,65,0,184,328,594,599,"Human, Starfleet, Federation, Undercover Operative, Cyberneticist, Physician, Engineered, Tribbled","nonhuman, male, organic, ds9, bashir, crew_max_rarity_4","I'm a Doctor, Not a Historian",2, 8, 8, 6, 10, , , , , , 400, 100, 160, 475, false,"Bashir",crew_portraits_cm_bashir_1701_sm.png,bashir_1701_crew
"Seamus",10,4, 0,0,0,0,0,0,872,171,395,0,0,0,579,148,299,0,0,0,0,451,0,630,0,361,0,574,0,308,109,263,525,0,452,0,386,0,549,0,279,0,484,0,242,88,217,395,0,378,791,642,"Human, Hologram, Civilian, Romantic, Interrogator","organic, voy, male, seamus, artificial_life, crew_max_rarity_4","Saints Preserve Us",1, 7, 6, 6, 6, , , , 0, 2, 315, 165, 147, 450, false,"Seamus",crew_portraits_cm_seamus_sm.png,seamus_crew
"Mirror Keyla Detmer",7,5, 1029,154,348,0,0,0,1308,222,451,0,0,0,0,0,0,0,0,0,253,4,202,410,169,97,0,0,0,95,215,52,0,0,0,366,62,288,473,275,173,0,0,0,148,281,131,0,0,0,402,459,"Mirror Universe, Human, Terran Empire, Brutal","female, organic, dsc, detmer, crew_max_rarity_5","Terran Law Is Binding",0, 8, 8, 6, 12, 1, 0, 2, , , 400, 240, 105, 525, false,"Detmer",crew_portraits_cm_detmer_mirror_sm.png,dsc_detmer_mirror_crew
"Tee Time Doctor",2,4, 0,0,0,0,0,0,344,74,158,0,0,0,920,186,387,658,67,176,0,775,0,458,465,810,0,356,339,687,208,180,278,302,45,0,729,0,431,629,731,0,326,437,622,195,313,254,397,102,504,609,"Hologram, Federation, Musician, Starfleet, Costumed, Athlete, Physician, Human","nonhuman, male, artificial_life, voy, emh, crew_max_rarity_4","The Back Nine at Gedi Prime?",2, 9, 6, 10, 10, , , , , , 500, 200, 40, 305, false,"Doctor",crew_portraits_cm_emh_caddy_sm.png,emh_caddy_crew
"Logician Solok",8,4, 903,88,202,646,87,180,0,0,0,0,0,0,0,0,0,0,0,0,81,496,370,541,325,541,388,578,345,0,0,0,0,0,0,301,668,597,693,560,680,441,699,411,0,0,0,0,0,0,826,943,"Vulcan, Starfleet, Athlete, Costumed, Federation, Telepath","male, organic, ds9, solok, crew_max_rarity_4","I Fail to See Why You Are Celebrating",1, 9, 10, 10, 10, , , , , , 430, 215, 77, 440, false,"Solok",crew_portraits_cm_solok_logician_sm.png,solok_logician_crew
