"Groom Worf",0,4, 0,0,0,0,0,0,650,84,139,0,0,0,942,97,151,0,0,0,0,1129,0,1070,0,1021,0,912,0,955,293,817,875,0,708,0,1365,0,1424,0,1329,0,1294,0,1210,953,1080,1300,0,1098,1595,1750,"Klingon, Romantic, Federation, Starfleet, Festive","nonhuman, male, organic, worf, ds9, crew_max_rarity_4","How Comforting",0, 9, 8, 5, 8, , , , , , 375, 135, 216, 415, false,"Worf",crew_portraits_cm_worf_groom_sm.png,worf_groom_crew, 49.0082, 14.4444, 14.3788, 35.4451, 2, 0, 1, 0
"Dr. Edward La Forge",0,5, 481,80,181,1279,214,439,0,0,0,0,0,0,0,0,0,994,150,319,108,1322,1286,1439,62,339,287,452,18,0,0,433,0,304,552,115,1268,1231,1383,164,355,295,471,35,0,0,569,0,361,617,570,479,"Human, Starfleet, Federation, Exobiology","male, organic, tng, elaforge, crew_max_rarity_5","She's Gone",1, 10, 8, 8, 10, , , , , , 495, 200, 125, 425, false,"E. La Forge",crew_portraits_cm_elaforge_sm.png,elaforge_crew, 84.0713, 7.5556, 17.4909, 78.1575, 1, 0, 0, 0
"Nepenthe Troi",0,5, 473,72,228,0,0,0,0,0,0,0,0,0,1008,99,230,1106,310,572,1323,1314,1267,448,30,0,0,810,231,0,1000,262,755,139,32,1167,1193,1127,683,11,0,0,1125,98,0,1289,104,1089,33,32,706,242,"Human, Starfleet, Federation, Civilian, Caregiver, Inspiring, Empath, Counselor, Betazoid","female, organic, nonhuman, pic, troi, crew_max_rarity_5","We'll Find A Way Forward",2, 7, 6, 5, 10, 7, 2, , , , 400, 70, 15, 325, false,"Troi",crew_portraits_cm_troi_nepenthe_sm.png,troi_nepenthe_crew, 79.4029, 31.5556, 17.8984, 79.9865, 4, 0, 0, 41.6486
"Edward Larkin",0,4, 0,0,0,866,152,339,0,0,0,0,0,0,158,6,12,644,127,300,864,0,0,1648,774,811,627,700,83,0,1662,745,1571,534,747,747,0,0,1651,720,683,487,730,83,0,1664,700,1573,487,725,1478,1458,"Human, Starfleet, Federation, Geneticist, Exobiology, Maverick, Tribbled, Crafty","male, organic, dsc, larkin, crew_max_rarity_4","I'm Not The Dumb One!",1, 6, 8, 8, 12, 4, 4, , , , 280, 200, 65, 450, false,"Larkin",crew_portraits_cm_larkin_sm.png,dsc_larkin_crew, 50.9717, 26.8889, 15.5137, 45.3159, 4, 0, 0, 0
"Technician Fisher",0,5, 500,75,163,1271,212,416,0,0,0,1002,121,277,0,0,0,0,0,0,111,1316,218,1427,1129,363,29,476,207,632,0,0,729,331,0,151,1322,378,1437,1158,406,61,512,252,840,0,0,944,516,0,632,832,"Geologist, Starfleet, Federation, Resourceful, Explorer, Human","male, organic, tos, fisher, crew_max_rarity_5","Rock Solid",1, 8, 10, 10, 10, 5, 0, , , , 485, 265, 135, 400, false,"Fisher",crew_portraits_cm_fisher_technician_sm.png,fisher_technician_crew, 84.452, 29.7778, 68.2466, 80.0777, 2, 0, 0, 0
"Fisticuffs Sisko",0,5, 982,108,303,0,0,0,1304,162,375,0,0,0,499,61,133,0,0,0,746,118,697,463,531,360,0,1317,0,380,168,239,1332,0,1124,929,250,866,727,728,575,0,1420,0,577,397,437,1434,0,1221,665,1011,"Human, Federation, Starfleet, Bajoran, Duelist, Brutal, Athlete","male, organic, ds9, sisko, crew_max_rarity_5","I Am Not Picard",2, 8, 8, 6, 12, 1, 0, , , , 475, 145, 100, 400, false,"Sisko",crew_portraits_cm_sisko_fisticuffs_sm.png,sisko_fisticuffs_crew, 85.2735, 20, 64.7156, 75.7778, 3, 0, 0, 0
"Nanoprobe Phlox",0,5, 0,0,0,411,157,377,0,0,0,1314,120,260,0,0,0,982,126,405,1241,0,413,0,456,1182,100,1201,94,419,0,417,460,5,533,641,0,934,0,449,589,107,693,45,876,0,452,969,29,507,599,351,"Denobulan, Civilian, Physician, Romantic, Exobiology, Borg, Compromised","male, organic, nonhuman, ent, phlox, exclusive_honorhall, crew_max_rarity_5","A Cure of Sorts",2, 10, 15, 8, 5, 4, 0, , , , 200, 245, 137, 100, false,"Phlox",crew_portraits_cm_phlox_nanoprobe_sm.png,phlox_nanoprobe_crew, 82.6287, 35.7778, 57.3721, 82.1058, 5, 0, 0, 0
"EV Suit T'Pol",0,5, 1257,242,442,514,54,154,1032,84,137,0,0,0,0,0,0,0,0,0,106,127,355,629,205,162,1023,1295,802,706,1039,567,0,0,0,120,280,311,570,193,858,1115,1387,873,1216,1518,1084,0,0,0,673,1045,"Vulcan, Starfleet, Astrophysicist, Telepath, High Command","nonhuman, female, organic, evsuit, ent, tpol, crew_max_rarity_5","You Can't Deny Your Nature",0, 9, 6, 6, 10, , , , , , 500, 225, 120, 250, false,"T'Pol",crew_portraits_cm_tpol_ev_suit_sm.png,tpol_ev_suit_crew, 85.574, 21.3333, 18.8958, 75.9337, 3, 0, 0, 39.436
"Marine Q",0,5, 1011,104,227,0,0,0,559,66,133,0,0,0,1272,216,422,0,0,0,762,373,714,110,549,1188,0,447,0,1107,138,952,379,0,295,1098,765,1045,231,900,1424,0,484,0,1269,285,1141,412,0,311,563,983,"Crafty, Costumed, Brutal, Q Continuum, Cosmic","nonhuman, male, tng, q_jdl, crew_max_rarity_5","All It Takes Are A Few Good Men!",0, 10, 8, 8, 10, , , , , , 490, 110, 205, 450, false,"Q",crew_portraits_cm_q_marine_sm.png,q_marine_crew, 87.1769, 34.2222, 19.7661, 77.2759, 4, 0, 0, 0
"Restless Trip Tucker",0,3, 0,0,0,0,0,0,0,0,0,342,36,108,487,73,177,0,0,0,0,0,1450,1435,0,0,1209,1294,0,1322,1459,0,907,958,1103,0,0,1457,1421,0,0,1203,1290,0,1320,1460,0,957,964,1095,1758,1790,"Human, Starfleet, Romantic, Resourceful, Jury Rigger","male, organic, ent, tucker, crew_max_rarity_3","Reluctant Patient",1, 6, 6, 8, 14, , , , 0, 1, 185, 20, 55, 325, false,"Trip",crew_portraits_cm_tucker_offduty_sm.png,tucker_offduty_crew, 25.4458, 42.8889, 9.448, 30.6537, 4, 0, 0, 0
"EV Suit Phlox",0,4, 347,62,170,918,94,206,0,0,0,0,0,0,0,0,0,705,76,259,427,1427,1398,1555,374,843,645,925,89,0,0,731,0,521,808,637,1336,1318,1451,404,1124,848,1193,245,0,0,853,0,610,916,1243,1513,"Denobulan, Civilian, Physician, Exobiology, Resourceful","male, evsuit, organic, nonhuman, ent, phlox, crew_max_rarity_4","Try Not To Sneeze",1, 8, 8, 4, 12, , , , , , 500, 230, 87, 250, false,"Phlox",crew_portraits_cm_phlox_ev_suit_sm.png,phlox_ev_suit_crew, 60.1282, 53.7778, 13.2681, 57.1798, 5, 0, 0, 0
"Humanoid Figure",0,5, 984,95,285,526,64,128,0,0,0,0,0,0,1273,206,415,0,0,0,221,880,723,114,554,1274,1017,163,798,0,576,0,387,0,301,579,1037,927,211,782,1446,1153,256,919,0,611,0,449,0,340,644,958,"Hologram, Temporal Agent, Villain, Tactician, Geneticist, Cosmic","male, ent, humanoid_figure, crew_max_rarity_5","You Have No Choice",0, 7, 6, 6, 10, 4, 2, , , , 465, 200, 90, 300, false,"Figure",crew_portraits_cm_humanoid_figure_sm.png,humanoid_figure_crew, 85.2735, 16.6667, 21.0361, 74.9826, 3, 0, 0, 41.5835
"Alicia Travers",0,5, 0,0,0,0,0,0,514,91,195,0,0,0,1008,121,240,1199,220,496,0,1270,0,961,239,1194,0,784,223,1111,287,38,730,135,31,0,1234,0,1195,177,1164,0,1051,184,1074,538,51,1016,90,57,609,531,"Human, Saboteur, Resourceful, Caregiver, Civilian","female, organic, ent, travers, crew_max_rarity_5","I'm Not Leaving",1, 10, 6, 6, 10, , , , , , 550, 70, 135, 400, false,"Travers",crew_portraits_cm_travers_sm.png,travers_crew, 83.5905, 48.2222, 15.771, 80.2998, 4, 0, 0, 0
"B.G. Robinson",0,4, 0,0,0,873,148,345,0,0,0,600,105,261,355,68,164,0,0,0,854,0,1026,1533,0,801,154,466,462,939,1566,0,644,600,1232,741,0,955,1460,0,677,136,352,408,895,1500,0,491,550,1128,1284,1118,"Human, Starfleet, Federation, Romantic, Casual, Playful","organic, female, tng, robinson_bg, crew_max_rarity_4","Hello There",2, 9, 10, 8, 12, , , , , , 375, 70, 100, 450, false,"Robinson",crew_portraits_cm_robinson_bg_sm.png,robinson_bg_crew, 55.8205, 13.7778, 11.3604, 45.2569, 2, 0, 0, 0
"Jhamel",0,5, 0,0,0,0,0,0,0,0,0,0,0,0,1276,220,454,1004,116,306,0,0,0,615,487,0,0,425,385,0,536,446,355,313,24,0,0,0,607,726,0,0,432,526,0,497,706,351,495,51,927,1111,"Andorian, Aenar, Telepath, Communicator, Desperate, Civilian, Inspiring, Romantic","nonhuman, female, organic, ent, jhamel, crew_max_rarity_5","I Won't Abandon My Brother",1, 10, 6, 8, 10, , , , , , 1345, 200, 175, 330, false,"Jhamel",crew_portraits_cm_jhamel_sm.png,jhamel_crew, 70.1463, 44.2222, 7.451, 66.2771, 4, 0, 0, 18.3731
"Brigitte Torres",0,4, 297,78,178,0,0,0,634,106,223,0,0,0,949,137,284,0,0,0,1522,803,1446,637,1313,983,0,830,0,923,238,781,780,0,642,1291,703,1253,597,1108,1032,0,966,0,972,380,857,908,0,774,1257,1337,"Human, Costumed, Undercover Operative, Caregiver, Romantic, Civilian, Klingon","nonhuman, female, organic, voy, torres, crew_max_rarity_4","Here's to English Precision",1, 7, 8, 6, 10, , , , , , 465, 50, 118, 350, false,"Torres",crew_portraits_cm_torres_brigitte_sm.png,torres_brigitte_crew, 57.7439, 41.7778, 13.7709, 54.6865, 5, 0, 0, 0
"Lieutenant Georgiou",0,4, 665,81,208,397,48,132,0,0,0,0,0,0,909,50,120,0,0,0,620,1092,995,435,841,1425,1111,534,893,0,1157,0,931,0,761,783,1226,1162,990,1013,1464,1173,1090,935,0,1600,0,1464,0,1251,1345,1679,"Human, Federation, Starfleet, Inspiring, Diplomat","female, organic, dsc, georgiou, crew_max_rarity_4","You Caused Quite a Stir",2, 8, 8, 8, 12, , , , , , 300, 55, 40, 250, false,"Georgiou",crew_portraits_cm_georgiou_lt_sm.png,dsc_georgiou_lt_crew, 60.3887, 29.3333, 12.5836, 45.3436, 3, 0, 0, 0
"Ransom Shran",0,4, 624,63,166,0,0,0,387,74,161,0,0,0,905,108,247,0,0,0,1119,786,1065,422,914,1378,0,899,0,1230,572,1097,864,0,696,1372,872,1322,790,1177,1300,0,1073,0,1181,734,1054,1035,0,871,1309,1557,"Andorian, Tactician, Caregiver, Desperate","nonhuman, male, organic, ent, shran, crew_max_rarity_4","You Have To Help Me",0, 7, 10, 8, 10, 4, 2, , , , 500, 175, 210, 475, false,"Shran",crew_portraits_cm_shran_ransom_sm.png,shran_ransom_crew, 58.7858, 18.6667, 18.5887, 44.5208, 3, 0, 0, 0
"Captain Erika Hernandez",0,5, 1204,194,419,0,0,0,0,0,0,993,129,294,0,0,0,0,0,0,436,637,32,700,272,0,518,0,0,624,0,0,719,326,0,457,628,54,697,285,0,638,0,0,812,0,0,892,483,0,960,1208,"Starfleet, Human, Resourceful, Romantic, Athlete","female, organic, ent, captain, hernandez, crew_max_rarity_5","Able To Hang In A Firefight A Little Longer",2, 9, 8, 6, 14, 8, 4, , , , 395, 200, 70, 550, false,"Hernandez",crew_portraits_cm_hernandez_captain_sm.png,hernandez_captain_crew, 66.9004, 36.6667, 19.9894, 63.1405, 3, 0, 0, 0
"Prisoner Kim",0,5, 0,0,0,0,0,0,1002,157,336,1261,231,469,0,0,0,556,98,196,0,781,340,0,952,610,284,0,651,37,879,60,372,12,940,0,825,298,0,1012,658,238,0,691,26,911,145,311,21,1008,405,254,"Federation, Human, Starfleet, Prisoner, Desperate, Survivalist, Caregiver","male, organic, voy, kim, crew_max_rarity_5","He's Dead!",0, 9, 6, 6, 8, , , , , , 530, 150, 250, 350, false,"Kim",crew_portraits_cm_kim_prisoner_sm.png,kim_prisoner_crew, 86.1751, 26, 18.9772, 85.445, 3, 0, 0, 21.3883
"Reclamation Narissa",0,4, 854,125,297,0,0,0,683,50,111,0,0,0,320,68,172,0,0,0,895,379,833,703,662,1017,0,1459,0,952,949,813,1479,0,1265,915,704,843,613,711,1491,0,1312,0,1310,1174,1184,1321,0,1117,1368,1548,"Zhat Vash, Tal Shiar, Romulan, Brutal, Villain, Crafty, Duelist, Vengeful","pic, nonhuman, organic, narissa, female, crew_max_rarity_4","Something Far Worse Is Coming",0, 7, 10, 8, 12, 1, 2, , , , 550, 175, 180, 325, false,"Narissa",crew_portraits_cm_narissa_reclamation_crew_sm.png,narissa_reclamation_crew, 56.8223, 17.3333, 18.8376, 45.8955, 3, 0, 0, 42.0174
"U.S.S. Zheng He Riker",0,5, 1276,199,453,0,0,0,967,183,357,0,0,0,518,90,174,0,0,0,360,87,349,231,197,617,0,1219,0,589,269,426,1237,0,1025,379,91,352,269,217,572,0,1249,0,571,326,431,1254,0,1055,476,282,"Human, Federation, Starfleet, Pilot, Maverick, Gambler","male, organic, pic, riker, crew_max_rarity_5","I Learned From The Best",2, 10, 6, 6, 8, , , , 1, 2, 500, 300, 195, 300, false,"Riker",crew_portraits_cm_riker_zhenghe_sm.png,riker_zhenghe_crew, 84.5121, 18.4444, 14.6062, 77.2298, 2, 0, 0, 41.4751
"Nona",0,5, 521,62,166,0,0,0,0,0,0,0,0,0,964,118,209,1252,172,436,1295,1298,1242,475,28,0,0,861,219,0,1052,259,820,134,35,1377,1346,1326,831,92,0,0,1131,270,0,1300,326,1101,188,107,720,996,"Caregiver, Botanist, Spiritual, Neural, Crafty, Civilian, Desperate","nonhuman, organic, female, tos, nona, crew_max_rarity_5","Don't Touch Me!",1, 10, 8, 5, 8, , , , , , 305, 185, 140, 490, false,"Nona",crew_portraits_cm_nona_sm.png,nona_crew, 84.0112, 11.7778, 16.4558, 75.4484, 2, 0, 0, 21.1497
"Camp Nurse Janeway",0,4, 356,59,137,0,0,0,0,0,0,0,0,0,589,118,255,824,162,350,1486,1435,1409,927,268,0,0,1074,487,0,1277,631,1064,438,124,1463,1415,1393,814,182,0,0,1034,374,0,1211,477,992,292,128,1339,1130,"Human, Starfleet, Federation, Resourceful, Costumed, Nurse, Civilian","female, organic, voy, janeway, crew_max_rarity_4","You're Bleeding!",2, 5, 14, 10, 16, 2, 0, , , , 500, 270, 125, 250, false,"Janeway",crew_portraits_cm_janeway_civil_war_sm.png,janeway_civil_war_crew, 54.2777, 44, 65.8369, 60.5071, 3, 0, 0, 0
"Kivas Fajo",0,4, 0,0,0,619,77,170,850,139,294,0,0,0,360,66,124,0,0,0,1117,969,0,1557,0,151,792,789,623,788,642,638,1452,0,1243,1340,971,0,1543,0,303,1005,942,786,798,598,688,1439,0,1227,1373,1512,"Crafty, Scoundrel, Zibelian, Brutal, Criminal, Thief, Civilian, Explorer, Merchant, Saboteur","nonhuman, male, organic, tng, kivas, crew_max_rarity_4","Accept Your Fate",2, 8, 8, 8, 10, , , , , , 433, 135, 93, 417, false,"Kivas",crew_portraits_cm_fajo_kivas_sm.png,fajo_kivas_crew, 56.0208, 31.7778, 12.3886, 51.0679, 5, 0, 0, 37.3753
"Emory Erickson",0,5, 0,0,0,1025,194,451,0,0,0,1144,232,484,474,80,166,0,0,0,558,0,419,1443,0,511,26,252,297,427,1471,0,114,158,1127,425,0,277,1427,0,379,11,197,228,293,1468,0,96,82,1102,576,184,"Human, Civilian, Caregiver, Innovator, Desperate","male, organic, ent, erickson, crew_max_rarity_5","You'll Be Able To Leave The Lights On",0, 8, 6, 10, 10, 4, 0, , , , 300, 50, 130, 450, true,"Emory",crew_portraits_cm_emory_erickson_sm.png,emory_erickson_crew, 80.6852, 23.3333, 74.9567, 81.4883, 3, 0, 0, 0
"Ambassador V'Lar",0,5, 997,138,268,0,0,0,0,0,0,0,0,0,1269,234,439,0,0,0,729,829,682,99,520,0,0,433,0,0,552,0,365,0,285,937,994,877,135,741,0,0,433,0,0,498,0,352,0,263,930,1126,"Vulcan, Ambassador, Diplomat, Telepath, Investigator, High Command","female, nonhuman, organic, ent, vlar, crew_max_rarity_5","We've Kept Many Things From Them",2, 8, 6, 8, 12, 5, 0, , , , 390, 195, 153, 475, false,"V'lar",crew_portraits_cm_vlar_ambassador_sm.png,vlar_ambassador_crew, 69.5051, 24, 57.1784, 62.6126, 3, 0, 0, 57.744
"Altan Inigo Soong",0,4, 484,179,392,993,122,283,0,0,0,409,91,199,0,0,0,0,0,0,170,1132,543,1253,895,694,190,799,409,1203,0,0,1370,862,0,87,714,133,801,394,882,245,990,536,1063,0,0,1185,717,0,1121,814,"Human, Civilian, Cyberneticist, Innovator, Federation, Caregiver","male, organic, pic, altan, crew_max_rarity_4","I Suppose That's What Mothers Do",1, 6, 6, 6, 12, 6, 0, , , , 250, 315, 213, 125, false,"Altan",crew_portraits_cm_altan_sm.png,altan_crew, 57.4434, 16.4444, 54.1793, 57.626, 2, 0, 0, 42.3861
"Dr. Roger Korby",0,5, 493,84,162,1271,230,424,0,0,0,0,0,0,0,0,0,957,181,393,109,1319,1279,1433,61,345,292,459,16,0,0,421,0,295,538,124,1304,1278,1420,104,353,292,468,19,0,0,390,0,236,453,550,280,"Android, Exoarchaeology, Physician, Starfleet, Federation, Undercover Operative","male, nonhuman, artificial_life, tos, korby, crew_max_rarity_5","Now, Strike Him!",0, 10, 8, 6, 8, , , , , , 465, 200, 177, 225, false,"Korby",crew_portraits_cm_korby_roger_sm.png,korby_roger_crew, 83.0495, 19.3333, 19.8085, 80.8315, 3, 0, 0, 20.7158
"Breen Disguise Kira",0,5, 581,106,206,0,0,0,1221,287,685,0,0,0,1064,61,164,0,0,0,1122,178,1070,372,918,179,0,795,0,244,28,83,742,0,617,1137,66,1086,849,945,91,0,1340,0,101,61,63,1365,0,1151,320,239,"Bajoran, Breen, Starfleet, Saboteur, Undercover Operative, Resourceful, Veteran","nonhuman, female, organic, evsuit, ds9, kira, crew_max_rarity_5","Make the Right Choice",1, 7, 8, 4, 10, 1, 1, , , , 450, 100, 40, 400, false,"Kira",crew_portraits_cm_kira_breen_sm.png,kira_breen_crew, 87.9583, 61.3333, 32.8542, 87.5957, 6, 0, 0, 0
"Awaiting Amanda Grayson",0,5, 446,119,259,0,0,0,0,0,0,0,0,0,1286,205,416,859,205,430,1305,1303,1250,237,69,0,0,439,426,0,562,553,371,359,27,985,1041,933,212,42,0,0,513,236,0,610,266,448,145,23,611,171,"Human, Federation, Caregiver, Civilian, Communicator, Desperate","female, amanda_grayson, organic, tos, crew_max_rarity_5","Your Duty Is To Your Father",2, 10, 8, 6, 8, , , , , , 400, 125, 150, 525, false,"Amanda",crew_portraits_cm_amanda_grayson_awaiting_sm.png,amanda_grayson_awaiting_crew, 79.5832, 29.7778, 14.3065, 81.6455, 2, 0, 0, 0
"Em/3/Green",0,4, 0,0,0,648,45,157,396,67,153,868,108,262,0,0,0,0,0,0,1109,1368,840,0,0,606,176,1100,621,393,1522,1093,898,451,0,1466,1375,947,0,0,862,398,1405,896,487,1522,1093,989,543,0,1341,1583,"Nasat, Crafty, Federation, Desperate, Resourceful, Jury Rigger","em_three, male, organic, nonhuman, tas, crew_max_rarity_4","I Am Not Afraid, Just Very Tired",1, 6, 8, 10, 20, 2, 0, , , , 325, 200, 163, 225, false,"Em",crew_portraits_cm_em_sm.png,em_three_green_crew, 58.3049, 39.3333, 65.112, 56.486, 3, 0, 0, 0
"EV Suit Spock",0,5, 0,0,0,1270,178,365,613,37,101,843,221,514,0,0,0,0,0,0,421,1225,680,0,0,72,36,515,233,190,1369,913,723,329,0,631,1473,251,0,0,312,16,679,354,158,1625,1197,270,73,0,591,401,"Vulcan, Human, Telepath, Spiritual, Starfleet, Federation, Explorer, Crafty, Thief, Exobiology","evsuit, nonhuman, male, organic, tos, spock, crew_max_rarity_5","Facilitate A Better View",2, 9, 8, 8, 12, 0, 1, , , , 500, 125, 100, 150, false,"Spock",crew_portraits_cm_spock_evsuit_sm.png,spock_evsuit_crew, 83.1296, 32.4444, 30.1355, 83.9993, 5, 0, 0, 39.5228
"Dignitary Sarek",0,4, 0,0,0,649,84,173,0,0,0,0,0,0,918,146,257,378,55,121,1086,0,0,1037,1261,1010,775,266,371,0,1060,1141,831,904,300,1309,0,0,1127,1291,1247,970,458,518,0,1171,1166,943,948,450,1280,1547,"Vulcan, Diplomat, Cultural Figure, Communicator, Federation, Telepath, Ambassador","nonhuman, male, organic, sarek, tos, crew_max_rarity_4","Threats Are Illogical",1, 8, 6, 6, 8, , , , , , 455, 145, 195, 415, false,"Sarek",crew_portraits_cm_sarek_dignitary_sm.png,sarek_dignitary_crew, 59.6674, 51.5556, 8.5877, 55.4365, 4, 0, 0, 38.2863
"Captain Solok",0,5, 1004,95,266,1283,199,400,475,88,162,0,0,0,0,0,0,0,0,0,35,411,701,978,535,81,300,478,208,1180,1470,1036,0,0,0,96,640,960,1183,818,166,377,583,301,1146,1452,1025,0,0,0,679,930,"Vulcan, Starfleet, Writer, Federation, Telepath","male, nonhuman, organic, ds9, solok, crew_max_rarity_5","Your Welcome Is Acknowledged",1, 6, 10, 10, 14, 2, 0, , , , 400, 170, 155, 365, false,"Solok",crew_portraits_cm_solok_captain_sm.png,solok_captain_crew, 84.2116, 11.1111, 85.4063, 78.9628, 2, 0, 0, 18.3731
"D'Nesh",0,5, 0,0,0,0,0,0,0,0,0,1022,140,310,1247,222,505,0,0,0,0,0,623,619,0,0,492,430,0,581,543,0,44,291,279,0,0,796,524,0,0,573,349,0,747,404,0,25,426,216,923,975,"Romantic, Scoundrel, Orion, Casual, Civilian, Crafty, Saboteur","female, nonhuman, organic, ent, dnesh, crew_max_rarity_5","I Thought You Were Different",1, 7, 6, 8, 8, , , , , , 350, 165, 135, 465, true,"D'Nesh",crew_portraits_cm_dnesh_sm.png,dnesh_crew, 69.5853, 26.8889, 14.6715, 65.6249, 4, 0, 0, 17.7223
"T'Pring",0,5, 0,0,0,0,0,0,1071,74,157,0,0,0,1292,172,285,0,0,0,0,835,0,684,0,677,0,514,0,639,56,486,441,0,356,0,1345,0,1037,0,1316,0,868,0,1193,476,1066,805,0,670,956,1655,"Vulcan, Telepath, Romantic, Brutal, Civilian","tos, organic, nonhuman, tpring, female, crew_max_rarity_5","Flawlessly Logical",2, 9, 8, 5, 8, , , , , , 390, 200, 213, 650, false,"T'Pring",crew_portraits_cm_tpring_sm.png,tpring_crew, 72.7109, 15.7778, 12.8941, 59.2153, 2, 0, 0, 18.3731
"Boreth Pike",0,4, 873,86,227,385,55,133,0,0,0,0,0,0,591,97,199,0,0,0,437,990,851,474,681,1441,1123,748,899,0,1305,0,1096,0,911,712,1160,1083,722,941,1449,1158,785,922,0,1366,0,1184,0,1003,1389,1578,"Starfleet, Human, Federation, Inspiring, Explorer, Tactician, Desperate, Diplomat","male, organic, dsc, pike, crew_max_rarity_4","I'm Not Leaving Here",0, 9, 8, 8, 10, , , , 1, 2, 450, 200, 175, 375, false,"Pike",crew_portraits_cm_pike_boreth_sm.png,dsc_pike_boreth_crew, 56.5418, 34.8889, 16.6713, 50.2037, 4, 0, 0, 0
"Mok'bara Crusher",0,5, 0,0,0,0,0,0,475,88,191,0,0,0,1253,205,458,1079,150,373,0,1320,0,636,370,1280,0,455,291,1164,156,59,388,212,14,0,1246,0,625,464,1176,0,447,363,1085,198,136,366,283,36,418,291,"Human, Starfleet, Federation, Caregiver, Physician, Counselor, Athlete","female, organic, tng, crusher, crew_max_rarity_5","And Then What Happened?",2, 7, 10, 8, 12, 2, 0, , , , 550, 170, 65, 100, false,"Crusher",crew_portraits_cm_crusher_mok_bara_sm.png,crusher_mok_bara_crew, 86.3154, 23.3333, 83.1454, 85.271, 3, 0, 0, 19.9566
"Leila Kalomi",0,5, 0,0,0,1273,210,375,0,0,0,0,0,0,982,164,354,451,98,210,401,0,0,908,1150,384,308,66,58,0,885,1029,653,836,125,577,0,0,874,972,514,392,70,95,0,846,906,648,667,156,615,439,"Human, Civilian, Botanist, Romantic, Desperate, Crafty, Compromised","female, organic, tos, leila_kalomi, crew_max_rarity_5","You Can Belong Again",1, 7, 6, 8, 12, 4, 1, , , , 495, 170, 133, 325, false,"Leila",crew_portraits_cm_leila_kalomi_sm.png,leila_kalomi_crew, 82.8892, 9.7778, 28.4361, 78.8909, 2, 0, 0, 0
"EV Suit McCoy",0,4, 364,45,111,614,49,130,0,0,0,0,0,0,0,0,0,815,137,301,820,1445,1426,1567,282,1102,830,1138,120,0,0,664,0,461,738,1103,1461,1438,1573,369,1463,1172,1445,259,0,0,679,0,471,742,1454,1598,"Human, Federation, Starfleet, Desperate, Exobiology, Resourceful, Physician","evsuit, male, organic, tos, mccoy, crew_max_rarity_4","He Was A Hero",1, 8, 8, 8, 10, , , , , , 440, 160, 204, 500, false,"McCoy",crew_portraits_cm_mccoy_evsuit_sm.png,mccoy_evsuit_crew, 54.7586, 46.8889, 14.4242, 52.6032, 4, 0, 0, 0
"Fair Haven Harry Kim",0,4, 0,0,0,696,101,222,0,0,0,0,0,0,881,180,354,0,0,0,1008,0,0,1016,0,953,718,229,558,0,1040,0,799,0,658,1129,0,0,859,0,1060,781,222,636,0,827,0,626,0,504,1533,1525,"Federation, Human, Starfleet, Costumed, Romantic, Musician","male, organic, voy, kim, crew_max_rarity_4","Late For A Midnight Stroll",2, 7, 6, 8, 10, 3, 0, 2, , , 450, 315, 121, 515, false,"Kim",crew_portraits_cm_kim_fairhaven_sm.png,kim_fairhaven_crew, 48.3871, 27.3333, 18.3516, 44.5374, 3, 0, 0, 0
"Zarabeth",0,4, 0,0,0,0,0,0,0,0,0,0,0,0,869,123,258,612,126,342,0,0,0,1076,790,0,0,922,561,0,1109,752,887,547,110,0,0,0,1160,597,0,0,1020,439,0,1199,574,978,364,146,1570,1531,"Sarpeidon, Survivalist, Desperate, Resourceful, Romantic, Crafty, Civilian, Caregiver, Displaced, Chef","organic, female, nonhuman, tos, zarabeth, crew_max_rarity_4","You're Safe Here",1, 7, 6, 6, 6, , , , , , 375, 175, 83, 440, false,"Zarabeth",crew_portraits_cm_zarabeth_sm.png,zarabeth_crew, 45.562, 55.1111, 5.1535, 46.8244, 5, 0, 0, 0
"Facer Rios",0,5, 526,78,141,0,0,0,0,0,0,962,130,280,1259,236,440,0,0,0,1292,1296,225,236,1096,0,570,440,0,692,566,0,51,365,290,1406,1369,393,300,1211,0,646,429,0,827,494,0,55,500,262,618,716,"Human, Civilian, Undercover Operative, Scoundrel, Crafty, Costumed, Playful","male, organic, pic, rios, crew_max_rarity_5","Indulge Me",1, 10, 6, 8, 10, , , , , , 440, 200, 170, 450, false,"Rios",crew_portraits_cm_rios_facer_sm.png,rios_facer_crew, 84.1715, 24, 17.5667, 79.8051, 3, 0, 0, 39.4143
"Kelis",0,5, 1283,243,418,0,0,0,0,0,0,0,0,0,1012,116,244,475,90,188,351,560,338,98,26,0,0,779,804,0,959,1021,721,827,137,358,546,344,191,53,0,0,1053,716,0,1235,974,1019,743,310,584,724,"Communicator, Civilian, Resourceful, Writer, Desperate, Maverick, Costumed","male, nonhuman, organic, voy, kelis, crew_max_rarity_5","You're Not Doing So Well",1, 8, 8, 8, 8, , , , , , 415, 150, 120, 475, true,"Kelis",crew_portraits_cm_kelis_sm.png,kelis_crew, 84.8527, 76.6667, 16.8855, 83.4773, 6, 0, 0, 0
"A.G. Robinson",0,5, 486,46,143,792,212,493,0,0,0,1299,121,295,0,0,0,0,0,0,269,1340,112,1451,1164,784,48,869,455,417,0,0,459,150,0,133,1429,451,1540,1271,282,34,396,190,819,0,0,905,494,0,823,714,"Human, Starfleet, Pilot, Explorer, Inspiring, Maverick","evsuit, male, organic, ent, robinson_ag, crew_max_rarity_5","You Tried Too Hard",1, 10, 6, 6, 12, 7, 0, , , , 225, 185, 235, 750, true,"A.G.",crew_portraits_cm_robinson_ag_sm.png,robinson_ag_crew, 78.4813, 41.1111, 66.1935, 77.4051, 5, 0, 0, 19.7831
"Cyrano de Barclay",0,4, 845,99,221,0,0,0,0,0,0,371,72,145,582,107,218,0,0,0,925,1000,424,482,694,0,1120,1099,0,1262,1304,0,682,890,908,1119,1148,571,658,923,0,1074,1134,0,1225,1303,0,607,892,930,1409,1508,"Starfleet, Costumed, Communicator, Human, Innovator, Federation","male, organic, tng, barclay, crew_max_rarity_4","The Moon...Yes, That Will Be My Home",1, 8, 5, 6, 10, , , , , , 400, 200, 130, 460, false,"Barclay",crew_portraits_cm_cyrano_barclay_sm.png,barclay_cyrano_crew, 54.979, 42.6667, 14.6275, 50.5669, 3, 0, 0, 0
"Maquis Takeover Seska",0,5, 1300,173,343,0,0,0,523,126,220,967,158,267,0,0,0,0,0,0,399,230,30,660,235,1116,556,0,0,196,1346,894,767,353,0,651,331,85,863,455,997,634,0,0,247,1268,836,885,477,0,575,747,"Bajoran, Cardassian, Maquis, Hologram, Obsidian Order, Crafty, Villain, Undercover Operative, Vengeful","nonhuman, female, organic, voy, seska, crew_max_rarity_5","Authorization Zeta 1",0, 8, 10, 8, 10, 1, 1, , , , 400, 105, 177, 500, false,"Seska",crew_portraits_cm_seska_maquis_sm.png,seska_maquis_crew, 85.0731, 27.1111, 40.6534, 80.7476, 5, 0, 0, 60.5423
"Flustered Jett Reno",0,4, 0,0,0,865,160,319,0,0,0,320,57,181,0,0,0,588,116,284,871,0,1431,0,868,820,322,896,98,1303,0,794,1486,308,883,778,0,1310,0,765,706,228,799,103,1169,0,733,1315,139,808,1329,1066,"Starfleet, Federation, Human, Jury Rigger, Resourceful, Desperate, Veteran, Playful","female, organic, dsc, jett_reno, crew_max_rarity_4","I'm Going, I'm Going",1, 6, 10, 10, 15, 2, 0, , , , 400, 185, 155, 475, false,"Reno",crew_portraits_cm_reno_flustered_sm.png,dsc_jett_reno_flustered_crew, 54.1174, 53.7778, 57.8616, 61.6817, 5, 0, 0, 0
"Maquis Takeover Paris",0,4, 381,65,150,0,0,0,554,80,185,836,122,244,0,0,0,0,0,0,1435,878,414,1510,1222,1137,660,0,0,243,1368,910,920,468,0,1418,838,514,1492,1223,1205,696,0,0,402,1418,993,997,551,0,1439,1520,"Human, Starfleet, Federation, Maquis, Undercover Operative, Costumed, Pilot","organic, male, voy, paris, crew_max_rarity_4","Remember The Good Old Days",2, 6, 10, 8, 12, 1, 1, , , , 525, 175, 170, 515, false,"Paris",crew_portraits_cm_paris_maquis_sm.png,paris_maquis_crew, 54.0573, 24.6667, 26.7737, 49.3201, 3, 0, 0, 38.7419
