"Mirror Vic Fontaine",9,4, 0,0,0,0,0,0,845,142,312,0,0,0,483,180,379,0,0,0,845,479,841,604,830,449,787,584,770,388,244,351,567,775,486,0,421,0,378,0,355,0,280,0,319,76,291,233,0,234,692,545,"Desperate, Human, Survivalist, Artist, Musician, Marksman, Mirror Universe, Terran Rebellion","male, ds9, vicfontaine, mirror, crew_max_rarity_4","I'll See You In Hell First!",2, 8, 8, 8, 10, , , , , , 605, 245, 167, 425, false,"Vic",crew_portraits_cm_vicfontaine_mirror_sm.png
"Miral Torres",10,4, 0,0,0,0,0,0,598,129,264,0,0,0,761,127,286,0,0,0,860,578,857,541,843,571,809,522,791,505,284,463,497,794,432,0,475,0,490,0,412,0,432,0,371,168,351,381,0,356,718,691,"Klingon, Civilian, Desperate","nonhuman, female, organic, voy, miral, crew_max_rarity_4","You Dishonor Me!",1, 7, 14, 12, 14, 5, 0, , , , 440, 275, 58, 625, false,"Miral",crew_portraits_cm_miral_sm.png
"Juliana Tainer",2,5, 0,0,0,1256,272,575,0,0,0,0,0,0,435,127,276,812,240,554,70,635,605,444,118,55,70,29,1,569,454,134,342,95,39,79,0,0,496,61,74,80,16,4,0,514,69,396,32,23,13,17,"Android, Musician, Caregiver, Civilian, Cyberneticist, Federation","female, nonhuman, artificial_life, tng, juliana, crew_max_rarity_5","Do You Know Who I Am?",1, 7, 10, 6, 12, 6, 0, , , , 525, 200, 20, 465, false,"Juliana",crew_portraits_cm_tainer_juliana_sm.png
"General Martok",7,4, 489,129,294,0,0,0,721,123,334,0,0,0,0,0,0,0,0,0,615,318,573,642,531,529,832,860,814,459,581,423,854,814,838,400,152,333,479,324,349,0,0,0,311,446,284,0,0,0,752,641,"Klingon, Duelist, Tactician, Diplomat, Veteran","nonhuman, male, organic, ds9, martok, crew_max_rarity_4","Trial of Blood",0, 6, 14, 10, 14, 0, 1, , , , 840, 555, 25, , false,"Martok",crew_portraits_cm_martokgeneral_sm.png
"23rd Century Martok",8,5, 468,138,283,0,0,0,1040,180,468,0,0,0,868,187,454,0,0,0,409,103,355,134,323,156,522,259,501,152,30,115,231,465,208,403,80,336,80,329,174,0,205,0,148,26,126,153,0,170,240,63,"Klingon, Duelist, Costumed, Veteran, Undercover Operative","nonhuman, male, organic, tos, ds9, martok, original, crew_max_rarity_5","Trapped Sabre Bear",2, 9, 12, 12, 12, , , , , , 350, 260, 340, , false,"Martok",crew_portraits_cm_martok_tos_sm.png
"Changeling Martok",7,5, 506,78,158,0,0,0,877,218,453,0,0,0,1062,249,546,0,0,0,431,130,378,100,349,216,499,148,479,192,17,166,114,439,101,630,143,593,94,543,155,0,111,0,135,4,115,71,0,97,194,65,"Klingon, Changeling, Veteran, Undercover Operative, Brutal, Dominion","nonhuman, male, organic, ds9, martok, crew_max_rarity_5","Sohk-vad",0, 9, 6, 6, 12, 7, 2, , , , 650, 15, 220, 250, false,"Martok",crew_portraits_cm_martok_changeling_sm.png
"Fleet Commander Martok",8,2, 296,64,200,0,0,0,270,38,135,0,0,0,148,29,71,0,0,0,794,675,781,755,756,812,899,873,892,796,780,782,865,894,854,586,439,551,529,503,706,0,751,0,604,641,579,730,0,626,856,814,"Klingon, Duelist, Veteran","nonhuman, male, organic, ds9, martok, crew_max_rarity_2","Surprise Attack!",0, 3, 8, 8, 12, 0, 2, , , , 340, 140, 70, 125, false,"Martok",crew_portraits_cm_martok_fleet_commander_sm.png
"Chancellor Martok",6,5, 943,132,341,0,0,0,543,67,148,0,0,0,1262,161,372,0,0,0,210,128,188,17,155,392,473,125,446,347,62,298,88,409,80,345,254,281,99,273,644,0,309,0,562,204,540,260,0,255,126,366,"Klingon, Duelist, Tactician, Diplomat, Veteran, Chancellor, Cultural Figure","nonhuman, male, organic, ds9, martok, crew_max_rarity_5","I will fight any battle. Anywhere",0, 9, 8, 8, 10, , , , 2, 2, 400, 125, 184, 450, false,"Martok",crew_portraits_cm_martok_chancellor_sm.png
"Commander Maddox",5,3, 0,0,0,478,56,166,0,0,0,343,40,110,190,26,60,0,0,0,713,892,746,845,888,705,381,623,546,719,840,874,679,604,791,650,0,678,786,0,631,289,550,379,625,793,0,597,394,634,810,841,"Federation, Starfleet, Human, Cyberneticist","male, organic, tng, crew_max_rarity_3","Facing the Opposition",0, 4, 3, 6, 6, 2, 0, 2, , , 90, , 70, 165, false,"Maddox",crew_portraits_cm_brucemaddox_sm.png
"Captain Pike",9,5, 1099,189,388,0,0,0,0,0,0,0,0,0,860,180,405,0,0,0,245,305,219,78,186,762,635,336,624,711,395,704,295,598,253,242,329,186,47,181,0,0,252,0,0,347,0,207,0,214,411,411,"Starfleet, Human, Federation, Romantic, Inspiring, Hero","captain, male, organic, tos, pike, crew_max_rarity_5","Fire All Weapons",0, 10, 4, 8, 8, , , 2, , , 525, 185, 130, 640, false,"Pike",crew_portraits_cm_pike_captain_sm.png
"Christopher Pike",6,5, 1229,166,450,0,0,0,947,154,340,0,0,0,541,50,113,0,0,0,112,31,91,89,55,214,478,437,452,191,109,164,398,415,342,201,71,150,210,142,308,0,708,0,279,272,247,674,0,582,139,311,"Starfleet, Human, Federation, Inspiring, Explorer, Tactician","male, organic, dsc, bridge_crew, captain, pike, crew_max_rarity_5","Nobody Gets Left Behind",0, 7, 6, 10, 14, 4, 0, , , , 290, 100, 133, 375, true,"Pike",crew_portraits_cm_pike_christopher_sm.png
"Tribunal Pike",5,3, 355,54,138,0,0,0,0,0,0,0,0,0,521,71,159,0,0,0,771,761,748,573,721,896,883,705,875,889,743,882,695,875,639,689,667,636,480,593,0,0,633,0,0,690,0,603,0,517,829,862,"Starfleet, Human, Federation, Inspiring, Explorer, Desperate","captain, male, organic, tos, pike, crew_max_rarity_3","This Isn't The Only Life Available",2, 5, 6, 10, 10, , , , , , 205, 100, 70, 265, false,"Pike",crew_portraits_cm_pike_disfigured_sm.png
"New Eden Pike",3,5, 978,126,282,504,113,236,0,0,0,0,0,0,1277,216,433,0,0,0,51,254,166,6,135,360,266,33,219,579,146,548,55,373,51,114,462,353,83,342,468,303,58,285,0,280,0,144,0,162,42,204,"Starfleet, Human, Federation, Resourceful, Explorer, Tactician","male, organic, dsc, bridge_crew, captain, pike, crew_max_rarity_5","You Were Right About Us",0, 8, 6, 8, 8, , , , , , 290, 100, 77, 540, false,"Pike",crew_portraits_cm_pike_neweden_sm.png
"Acting Captain Pike",2,3, 499,86,266,0,0,0,197,56,126,0,0,0,323,53,141,0,0,0,676,563,631,540,583,786,857,750,844,762,683,752,741,841,691,487,355,426,386,393,694,0,671,0,598,538,572,641,0,553,783,734,"Starfleet, Human, Federation, Inspiring, Explorer, Tactician","captain, male, organic, dsc, pike, crew_max_rarity_3","Intercept Course",1, 6, 10, 12, 10, , , , 2, 3, 500, 100, 140, 405, false,"Pike",crew_portraits_cm_pike_acting_sm.png
"Seven in Blue",3,2, 0,0,0,294,51,209,0,0,0,278,53,130,0,0,0,0,0,0,817,911,830,918,912,811,532,805,727,817,915,912,815,760,910,597,0,643,0,0,588,247,600,347,594,0,0,650,372,0,881,850,"Human, Borg, Civilian, Federation","nonhuman, female, organic, voy, bridge_crew, seven, crew_max_rarity_2","Ignore Irrelevancies",1, 2, 8, 10, 14, 4, 0, , , , 75, 50, 310, 170, false,"Seven",crew_portraits_cm_seven_of_nine_sm.png
"Temporal Agent Seven",7,4, 0,0,0,599,166,327,586,31,72,512,35,76,0,0,0,0,0,0,513,593,572,830,797,278,232,535,313,302,630,484,599,343,768,320,718,709,0,0,210,168,351,204,564,785,624,722,410,0,636,745,"Human, Borg, Civilian, Federation, Undercover Operative, Temporal Agent","nonhuman, female, organic, voy, bridge_crew, seven, crew_max_rarity_4","Scientific Investigation",2, 7, 12, 12, 12, , , , , , 815, , 125, 850, false,"Seven",crew_portraits_cm_seventemporalagent_sm.png
"Seven of Nine",7,5, 0,0,0,785,247,791,0,0,0,854,225,454,514,89,183,0,0,0,191,698,216,492,629,195,33,65,128,222,522,624,36,136,376,31,0,115,611,0,29,3,12,32,130,642,0,37,66,475,278,19,"Human, Borg, Civilian, Federation","nonhuman, female, organic, voy, bridge_crew, seven, crew_max_rarity_5","New Collective",2, 7, 12, 10, 14, 4, 0, , , , 1750, , 705, 440, false,"Seven",crew_portraits_cm_sevenbluegreyshoulders_sm.png
"Mademoiselle de Neuf",8,5, 0,0,0,777,166,441,954,254,516,441,182,358,0,0,0,0,0,0,289,238,356,726,630,16,75,304,176,42,268,135,387,210,633,210,204,210,0,0,11,19,235,147,5,187,79,247,140,0,286,25,"Human, Borg, Civilian, Federation, Costumed, Saboteur, Musician","nonhuman, female, organic, voy, bridge_crew, seven, crew_max_rarity_5","Discontinue Activity",2, 8, 4, 14, 16, 5, 0, , , , , 485, 405, 890, false,"Seven",crew_portraits_cm_sevenwwii_sm.png
"Drone Seven of Nine",4,4, 0,0,0,432,165,349,239,150,308,725,142,339,0,0,0,0,0,0,570,637,403,822,785,352,159,576,354,249,681,537,440,234,757,292,417,276,0,0,39,43,325,189,41,447,285,302,170,0,604,173,"Human, Borg, Brutal","nonhuman, female, organic, voy, seven, crew_max_rarity_4","We Are Borg",0, 4, 1, 10, 10, 8, 4, , , , 475, 200, 170, 365, true,"Seven",crew_portraits_cm_sevenofninedrone_sm.png
"Tsunkatse Seven",3,4, 679,124,299,282,92,230,850,150,301,0,0,0,0,0,0,0,0,0,281,153,393,494,366,208,418,621,381,305,434,254,756,612,711,119,157,334,481,325,99,324,535,306,326,456,300,0,0,0,428,383,"Human, Borg, Brutal, Duelist, Athlete, Federation, Civilian, Prisoner","nonhuman, female, organic, voy, seven, crew_max_rarity_4","Hunt It Down And Kill It",0, 8, 8, 6, 6, , , , , , 400, 200, 110, 525, false,"Seven",crew_portraits_cm_seven_tsunkatse_sm.png
"EV Suit Seven of Nine",6,5, 489,108,272,950,307,664,800,149,338,0,0,0,0,0,0,0,0,0,41,151,369,480,338,14,133,169,100,264,369,223,684,485,627,6,159,390,516,365,9,48,64,41,287,423,257,0,0,0,273,40,"Borg, Human, Starfleet, Federation, Hunter, Astrophysicist","female, organic, voy, seven, crew_max_rarity_5","This Lesson Is Terminated",2, 10, 10, 10, 12, , , , 1, 1, 565, 200, 195, 100, false,"Seven",crew_portraits_cm_seven_of_nine_ev_sm.png
"Seven in Silver",7,5, 0,0,0,1031,150,365,0,0,0,1249,230,480,0,0,0,0,0,0,237,719,106,747,660,252,16,263,155,111,757,649,111,61,655,293,0,106,0,0,294,12,326,190,115,0,0,105,55,0,329,361,"Human, Borg, Civilian, Federation, Astrophysicist","nonhuman, female, organic, voy, bridge_crew, seven, crew_max_rarity_5","Think Quickly",1, 10, 10, 8, 8, , , , , , 275, 200, 140, 175, false,"Seven",crew_portraits_cm_seven_silver_sm.png
"Indulgent Seven",1,5, 0,0,0,986,151,300,0,0,0,434,176,357,0,0,0,1311,157,329,181,647,312,676,38,176,58,207,8,314,687,44,325,7,63,370,0,219,0,262,363,46,393,49,246,0,260,261,11,283,39,161,"Human, Borg, Civilian, Federation, Astrophysicist, Physician, Starfleet, Prisoner","nonhuman, female, organic, voy, bridge_crew, seven, male, artificial_life, emh, crew_max_rarity_5","To Shared Experiences",0, 7, 6, 8, 14, 7, 2, , , , 480, 125, 120, 500, false,"Seven",crew_portraits_cm_sevencheesecake_sm.png
"Indignant Seven",2,4, 0,0,0,835,126,322,0,0,0,657,205,418,0,0,0,0,0,0,418,825,409,834,802,419,101,443,254,400,828,786,454,241,774,371,0,145,0,0,364,30,396,233,165,0,0,172,90,0,643,494,"Human, Borg, Civilian, Federation, Astrophysicist","nonhuman, female, organic, voy, bridge_crew, seven, crew_max_rarity_4","There Won't Be A Next Time",2, 8, 8, 8, 10, , , , , , 375, 200, 250, 475, false,"Seven",crew_portraits_cm_seven_indignant_sm.png
"Annika Hansen Seven",4,5, 565,38,88,1021,107,251,0,0,0,1303,161,317,0,0,0,0,0,0,56,452,29,468,321,204,15,220,136,86,707,576,83,41,582,336,711,156,755,650,457,85,493,281,295,0,0,303,171,0,115,585,"Human, Civilian, Federation, Astrophysicist","female, organic, voy, bridge_crew, seven, crew_max_rarity_5","I'm Sure You'll Adapt",0, 9, 6, 6, 10, , , , , , 375, 200, 250, 400, false,"Seven",crew_portraits_cm_seven_annika_sm.png
"Amanda Grayson",10,4, 0,0,0,0,0,0,0,0,0,0,0,0,692,213,446,597,92,283,851,848,846,512,493,842,795,498,356,836,545,460,467,319,151,0,0,0,289,370,0,0,194,271,0,269,373,137,234,46,705,529,"Human, Caregiver, Civilian, Communicator","female, organic, tos, crew_max_rarity_4","How do you feel?",2, 8, 8, 8, 8, 3, 0, 3, , , 525, 165, 95, 600, false,"Amanda",crew_portraits_cm_amanda_greyson_sm.png
"Lt. Ash Tyler",6,4, 652,119,218,0,0,0,829,165,342,0,0,0,0,0,0,0,0,0,545,201,497,569,470,435,771,825,758,377,514,341,814,759,794,498,174,445,550,407,300,0,0,0,272,409,237,0,0,0,672,661,"Human, Federation, Starfleet, Survivalist, Tactician, Marksman, Pilot, Klingon","male, organic, dsc, bridge_crew, tyler, voq, crew_max_rarity_4","Full Scale Attack",2, 7, 10, 10, 12, , , , , , 575, 225, 153, 450, false,"Tyler",crew_portraits_cm_tyler_sm.png
"Celebratory Ash Tyler",4,4, 649,99,164,0,0,0,484,23,45,0,0,0,814,155,322,0,0,0,495,358,440,193,418,603,659,378,643,527,282,488,331,630,280,592,528,557,235,509,780,0,365,0,671,379,642,304,0,290,457,690,"Human, Federation, Starfleet, Tactician, Marksman, Pilot, Romantic, Klingon","male, organic, dsc, bridge_crew, tyler, voq, crew_max_rarity_4","I'm not going anywhere",0, 7, 10, 10, 10, 4, 2, , , , 450, 50, 123, 540, false,"Tyler",crew_portraits_cm_dsc_tyler_celebration_sm.png
"Tyler, Son of None",8,5, 489,58,198,0,0,0,1129,218,428,0,0,0,1009,171,229,0,0,0,440,99,386,143,361,130,503,230,484,119,18,84,201,446,185,602,145,567,293,518,176,0,451,0,152,64,129,399,0,370,205,286,"Human, Klingon, Federation, Starfleet, Gambler, Desperate, Tactician, Survivalist","male, organic, dsc, bridge_crew, tyler, voq, crew_max_rarity_5","War Within",1, 7, 12, 10, 14, 8, 4, , , , 500, 25, 128, 690, false,"Tyler",crew_portraits_cm_voq_as_ash_sm.png
"Torchbearer Tyler",6,4, 0,0,0,0,0,0,873,121,206,0,0,0,576,108,214,0,0,0,857,498,854,614,841,469,804,595,787,404,273,368,578,789,497,0,535,0,568,0,492,0,536,0,444,281,419,491,0,427,715,770,"Human, Federation, Starfleet, Torchbearer, Tactician, Klingon","male, organic, dsc, tyler, voq, crew_max_rarity_4","That's a Torchbearer's Job",0, 9, 8, 10, 8, , , , , , 365, 250, 183, 425, false,"Tyler",crew_portraits_cm_tyler_torchbearer_sm.png
"B-4",7,4, 0,0,0,733,211,452,0,0,0,302,135,276,593,160,323,0,0,0,355,767,546,507,729,351,154,103,211,525,540,722,270,328,401,163,0,348,427,0,162,29,26,119,357,429,0,46,213,285,433,117,"Android, Federation, Casual, Civilian","nonhuman, male, tng, artificial_life, b4, crew_max_rarity_4","I Do Not Understand",1, 6, 12, 12, 20, 2, 0, , , , 565, 200, 205, 425, false,"B-4",crew_portraits_cm_b4_sm.png
"Silik",10,4, 752,105,270,0,0,0,630,99,214,0,0,0,0,0,0,0,0,0,523,267,465,556,444,584,816,848,799,513,618,472,842,801,825,459,255,396,518,371,513,0,0,0,464,593,445,0,0,0,731,754,"Suliban, Shapeshifter, Temporal Agent, Saboteur","male, organic, ent, nonhuman, crew_max_rarity_4","Enhanced Reactions",2, 7, 12, 10, 12, , , , , , 875, 400, 325, 715, false,"Silik",crew_portraits_cm_silik_sm.png
"Laas",9,4, 0,0,0,773,139,332,448,58,124,0,0,0,661,28,55,0,0,0,403,603,786,570,762,225,286,174,240,530,397,491,541,664,463,349,675,0,788,0,170,232,285,218,599,650,573,745,0,636,523,731,"Explorer, Changeling, Civilian, Prodigy, Hunter, Survivalist","nonhuman, male, organic, ds9, laas, crew_max_rarity_4","A Pale Shadow",2, 8, 8, 8, 10, , , , 0, 2, 580, 200, 242, 300, false,"Laas",crew_portraits_cm_laas_sm.png
"Captain Braxton",2,5, 1228,271,584,0,0,0,541,131,275,950,191,433,0,0,0,0,0,0,67,58,1,149,21,328,134,631,390,39,409,242,136,79,526,75,34,1,163,45,398,153,0,0,28,508,340,169,88,0,1,29,"Saboteur, Human, Pilot, Federation, Starfleet, Crafty, Temporal Agent","captain, male, organic, voy, braxton, crew_max_rarity_5","Temporal Transport In Progress",0, 6, 10, 5, 12, 7, 0, , , , 500, 270, 190, 350, false,"Braxton",crew_portraits_cm_braxton_captain_sm.png
"Lt. Commander Jack Crusher",5,3, 486,91,207,335,24,78,0,0,0,0,0,0,0,0,0,0,0,0,580,718,692,743,655,797,714,796,700,899,907,894,908,888,899,431,571,506,588,464,763,507,750,464,0,0,0,0,0,0,848,871,"Starfleet, Federation, Hologram, Romantic, Inspiring","lieutenant_commander, male, tng, jack, crew_max_rarity_3","Duty and Honor",0, 6, 8, 10, 16, , , , 1, 2, 550, 100, 125, 505, false,"Jack",crew_portraits_cm_jackcrusher_sm.png
"Donik",6,3, 0,0,0,0,0,0,0,0,0,476,79,199,303,31,79,0,0,0,908,906,704,831,903,910,583,808,895,669,825,900,585,543,769,0,0,534,767,0,0,360,745,0,501,779,0,409,314,618,858,876,"Hirogen, Innovator","nonhuman, male, organic, voy, donik, crew_max_rarity_3","Hunting Program",2, 4, 12, 12, 10, 7, 0, , , , 870, 165, , 340, false,"Donik",crew_portraits_cm_donik_sm.png
"Commander Tucker",8,2, 252,28,82,0,0,0,0,0,0,305,53,185,0,0,0,0,0,0,875,869,693,878,858,916,751,916,912,804,920,917,801,737,916,759,716,436,768,661,0,398,0,0,537,0,0,593,338,0,895,889,"Human, Starfleet, Jury Rigger, Pilot, Explorer","male, organic, ent, commander, tucker, crew_max_rarity_2","Warp Engines Online",1, 2, 6, 3, 8, 2, 0, , , , 520, 35, 50, 165, false,"Trip",crew_portraits_cm_tucker_sm.png
"Rescuer Tucker",7,3, 197,28,60,0,0,0,400,42,88,424,72,226,0,0,0,0,0,0,828,662,576,837,807,745,566,886,853,474,779,686,696,519,869,767,645,379,784,676,742,345,0,0,344,767,611,524,302,0,799,821,"Human, Starfleet, Jury Rigger, Tactician, Explorer","male, organic, ent, commander, tucker, crew_max_rarity_3","Bank's Closed",1, 3, 6, 10, 10, 8, 4, , , , 315, 160, , 75, false,"Trip",crew_portraits_cm_tuckerunderpants_sm.png
"Mirror Tucker",6,4, 0,0,0,0,0,0,555,106,211,698,125,292,0,0,0,0,0,0,880,613,501,886,866,620,373,866,819,244,654,506,544,306,847,0,545,343,0,0,509,261,0,0,105,582,436,376,210,0,759,732,"Human, Starfleet, Terran Empire, Jury Rigger, Brutal, Explorer, Mirror Universe","male, organic, ent, commander, tucker, mirror, crew_max_rarity_4","Bank's Closed",1, 4, 6, 10, 10, 8, 4, , , , 165, 100, 386, 500, false,"Trip",crew_portraits_cm_tuckermirror_sm.png
"EV Suit Tucker",7,4, 444,149,555,0,0,0,0,0,0,708,121,356,0,0,0,0,0,0,578,582,173,603,499,852,350,847,797,444,859,829,510,276,823,144,247,5,257,99,0,229,0,0,297,0,0,305,172,0,728,397,"Human, Starfleet, Jury Rigger, Survivalist, Desperate","male, organic, ent, commander, tucker, crew_max_rarity_4","Extravehicular Tactics",2, 7, 6, 8, 10, 3, 0, 3, , , 625, 95, 422, 600, false,"Trip",crew_portraits_cm_tuckerev_sm.png
"North Star Tucker",7,5, 0,0,0,0,0,0,470,93,181,799,181,587,1049,161,315,0,0,0,708,496,227,296,639,466,204,227,533,60,113,367,17,138,180,0,592,80,434,0,570,98,367,0,25,202,486,6,38,291,305,134,"Human, Starfleet, Jury Rigger, Marksman, Costumed, Romantic, Gambler","male, organic, ent, commander, tucker, crew_max_rarity_5","Quick Draw",0, 7, 10, 10, 14, 6, 0, , , , 390, 330, 47, 1450, false,"Trip",crew_portraits_cm_tuckercowboy_sm.png
"Tucker On-The-Ropes",7,5, 363,84,170,0,0,0,962,134,270,1179,197,429,0,0,0,0,0,0,507,164,36,546,430,268,125,696,518,20,343,203,120,67,629,606,271,42,635,522,402,151,0,0,29,511,342,166,87,0,275,303,"Human, Starfleet, Jury Rigger, Athlete, Gambler, Desperate","male, organic, ent, commander, tucker, original, crew_max_rarity_5","Rope-a-Dope",0, 7, 12, 10, 14, 4, 0, , , , 650, 305, 110, 375, false,"Trip",crew_portraits_cm_tucker_ropes_sm.png
"Tourist Tucker",9,5, 0,0,0,0,0,0,0,0,0,1019,118,269,1230,203,410,0,0,0,736,735,263,243,685,733,220,177,584,253,240,674,11,150,132,0,0,380,333,0,0,278,227,0,383,317,0,28,225,188,364,557,"Human, Starfleet, Romantic, Resourceful, Casual","male, organic, ent, commander, tucker, crew_max_rarity_5","Another Round Please!",2, 10, 8, 10, 10, , , , 1, 2, 410, 75, 85, 325, false,"Trip",crew_portraits_cm_tucker_tourist_sm.png
"Counselor Troi",9,1, 0,0,0,0,0,0,0,0,0,0,0,0,261,42,108,147,49,131,923,924,925,887,883,924,920,871,854,922,876,868,863,852,732,0,0,0,738,602,0,0,716,426,0,760,576,688,375,417,910,898,"Federation, Starfleet, Human, Betazoid, Empath, Counselor","nonhuman, female, organic, tng, lieutenant_commander, bridge_crew, troi, crew_max_rarity_1","Counselling",2, 1, 6, 10, 10, , , , , , 265, , 80, 345, false,"Troi",crew_portraits_cm_troitng_sm.png
"Rakal Troi",6,4, 521,163,354,0,0,0,525,128,331,0,0,0,0,0,0,407,163,440,518,289,461,552,188,527,691,788,342,458,580,205,776,305,465,288,113,228,398,11,347,0,0,148,307,445,17,0,103,197,537,107,"Federation, Starfleet, Human, Betazoid, Romulan, Empath, Undercover Operative, Tal Shiar","nonhuman, female, organic, tng, lieutenant_commander, bridge_crew, troi, crew_max_rarity_4","Romulan Disguise",1, 7, 12, 10, 14, 1, 2, , , , 90, 400, 175, 2825, false,"Troi",crew_portraits_cm_troirakal_sm.png
"Commander Troi",8,5, 0,0,0,0,0,0,383,203,253,0,0,0,1060,211,421,827,142,281,711,501,682,269,246,474,563,200,189,408,99,60,165,163,23,0,420,0,317,326,353,0,215,245,315,55,48,161,205,39,316,138,"Federation, Starfleet, Human, Betazoid, Empath, Counselor","nonhuman, female, organic, tng, commander, bridge_crew, troi, crew_max_rarity_5","Empathic Sense",1, 8, 6, 6, 6, , , , , , 1375, 475, 135, 725, true,"Troi",crew_portraits_cm_troifirstcontact_sm.png
"Bridge Officer Troi",7,4, 597,76,197,0,0,0,0,0,0,0,0,0,304,93,195,616,169,514,550,553,502,423,110,801,730,654,279,786,685,355,641,235,241,575,593,539,376,29,0,0,577,115,0,625,107,536,65,56,593,343,"Federation, Starfleet, Human, Betazoid, Empath, Counselor, Caregiver","nonhuman, female, organic, tng, commander, bridge_crew, troi, crew_max_rarity_4","Sensing Anger",1, 6, 6, 8, 12, 3, 0, 3, , , 565, 360, 245, 450, true,"Troi",crew_portraits_cm_troicommander_sm.png
"Deanna Troi",2,3, 127,87,199,0,0,0,0,0,0,0,0,0,298,120,236,412,112,282,810,810,805,664,506,884,860,736,511,872,767,620,726,477,438,560,585,522,308,106,0,0,497,258,0,555,352,446,222,113,788,526,"Federation, Starfleet, Human, Betazoid, Empath, Counselor","nonhuman, female, organic, tng, lieutenant_commander, bridge_crew, troi, crew_max_rarity_3","Face My Other Half",1, 7, 8, 12, 12, , , , 0, 2, 650, 50, 265, 450, false,"Troi",crew_portraits_cm_troicivilian_sm.png
"Goddess of Empathy Troi",7,5, 0,0,0,0,0,0,0,0,0,0,0,0,1101,74,155,992,234,676,743,744,724,379,138,746,611,309,133,693,366,153,278,109,16,0,0,0,662,36,0,0,634,55,0,691,41,604,18,30,381,428,"Empath, Cultural Figure, Hologram, Inspiring","female, nonhuman, artificial_life, tng, commander, bridge_crew, troi, crew_max_rarity_5","Discard Your Facades",0, 7, 10, 10, 14, 6, 0, , , , 750, 70, 50, 1125, false,"Troi",crew_portraits_cm_troi_goddess_sm.png
"Durango Troi",5,5, 840,116,391,0,0,0,1349,52,114,0,0,0,381,207,417,0,0,0,265,59,245,152,207,142,524,417,503,133,70,97,372,469,316,308,265,246,56,233,714,0,222,0,610,178,586,170,0,180,246,290,"Empath, Constable, Scoundrel, Costumed, Federation, Starfleet, Betazoid, Human","female, nonhuman, tng, commander, bridge_crew, troi, crew_max_rarity_5","Call Me Durango",2, 10, 12, 12, 12, , , , 0, 2, 525, 375, 20, 725, false,"Troi",crew_portraits_cm_troi_cowboy_sm.png
"Mirror Inquisitor Troi",4,5, 0,0,0,0,0,0,376,178,392,0,0,0,819,248,489,1035,248,600,691,448,653,304,73,399,494,243,86,350,108,15,212,63,12,0,334,0,238,46,233,0,143,69,206,24,6,94,24,2,182,14,"Starfleet, Human, Betazoid, Empath, Interrogator, Mirror Universe, Terran Empire","nonhuman, female, organic, tng, bridge_crew, troi, mirror, crew_max_rarity_5","Don't Get Too Comfortable",0, 9, 12, 3, 12, 5, 1, , , , 550, 305, 165, 440, false,"Troi",crew_portraits_cm_troi_mirror_sm.png
"Mintakan Troi",1,4, 0,0,0,307,69,219,0,0,0,0,0,0,947,159,328,604,101,249,610,766,752,407,405,616,414,180,190,725,396,387,296,255,46,556,0,0,422,397,557,355,125,132,0,424,400,294,252,84,426,442,"Federation, Starfleet, Human, Betazoid, Empath, Counselor, Caregiver, Undercover Operative, Prisoner, Merchant, Mintakan, Vulcan, Costumed","nonhuman, female, organic, tng, commander, bridge_crew, troi, crew_max_rarity_4","You Don't Want This",1, 7, 10, 10, 10, , , , , , 725, 100, 80, 500, false,"Troi",crew_portraits_cm_troi_mintakan_sm.png
"Assimilated Troi",1,4, 0,0,0,369,77,207,637,131,290,0,0,0,0,0,0,771,175,413,593,485,753,797,269,280,401,600,118,392,531,40,754,176,273,562,453,0,0,168,134,356,580,65,350,495,23,0,112,210,425,294,"Human, Betazoid, Borg, Brutal, Empath, Counselor","nonhuman, female, organic, tng, troi, original, crew_max_rarity_4","I Sense Resistance",2, 7, 6, 8, 10, 3, 0, 3, , , 450, 100, 175, 525, false,"Troi",crew_portraits_cm_troi_assimilated_sm.png
"Merry Men Troi",2,5, 556,37,109,0,0,0,0,0,0,0,0,0,1277,254,505,971,141,332,376,433,333,64,13,660,439,81,119,572,127,138,44,99,1,740,700,683,137,140,0,0,134,215,0,197,272,89,173,18,22,227,"Starfleet, Federation, Human, Betazoid, Empath, Counselor, Costumed","nonhuman, female, organic, tng, bridge_crew, troi, crew_max_rarity_5","Right On Target!",0, 6, 8, 6, 10, 4, 0, , , , 200, 130, 145, 390, false,"Troi",crew_portraits_cm_troi_merrymen_sm.png
"Dark Empath Troi",4,5, 937,143,322,0,0,0,1300,178,445,0,0,0,0,0,0,473,101,246,205,10,177,297,17,71,459,663,229,72,147,9,653,193,303,358,75,291,444,57,187,0,0,289,166,305,29,0,254,401,71,188,"Starfleet, Federation, Human, Betazoid, Empath, Counselor, Brutal","nonhuman, female, organic, tng, bridge_crew, troi, crew_max_rarity_5","Take Me With You!",0, 9, 8, 8, 8, , , , 1, 3, 450, 230, 100, 430, false,"Troi",crew_portraits_cm_troi_darkempath_sm.png
"Age of Sail Troi",3,4, 353,76,161,0,0,0,0,0,0,0,0,0,596,150,298,776,208,426,605,608,561,384,126,774,653,499,206,733,546,251,471,173,67,631,630,594,271,40,0,0,397,134,0,460,138,336,84,34,445,276,"Human, Betazoid, Costumed, Empath, Counselor, Starfleet, Federation","ageofsail, nonhuman, female, organic, tng, troi, crew_max_rarity_4","Answer Him!",0, 9, 8, 6, 10, , , , , , 400, 230, 115, 450, false,"Troi",crew_portraits_cm_troi_ageofsail_sm.png
"Xindi Insectoid Councilor",3,5, 0,0,0,1169,64,147,541,111,235,0,0,0,1252,162,332,0,0,0,157,407,609,184,568,34,142,8,107,306,51,255,84,360,75,668,512,0,417,0,244,413,160,388,426,147,403,287,0,274,23,513,"Xindi, Brutal, Diplomat, Desperate","nonhuman, organic, ent, insectoid, crew_max_rarity_5","The Guardians Have Never Lied!",0, 9, 10, 10, 10, , , , 2, 2, 450, 200, 110, 625, false,"Insectoid",crew_portraits_cm_xindi_insectoid_sm.png
"Vedek Winn Adami",7,3, 307,97,207,0,0,0,0,0,0,0,0,0,410,92,214,0,0,0,778,769,760,608,731,907,896,744,889,900,774,895,736,889,684,541,565,498,337,457,0,0,557,0,0,599,0,516,0,443,850,787,"Bajoran, Vedek, Cultural Figure, Spiritual","nonhuman, female, organic, ds9, winn, crew_max_rarity_3","Will of the Prophets",1, 4, 8, 10, 10, 4, 0, , , , , 270, 85, 830, false,"Winn",crew_portraits_cm_winnvedek_sm.png
"Rogue Kai Winn",9,5, 1007,257,510,0,0,0,0,0,0,0,0,0,736,274,575,0,0,0,244,303,218,73,185,758,633,332,620,709,393,701,292,596,252,108,208,81,4,70,0,0,92,0,0,140,0,52,0,79,408,96,"Bajoran, Kai, Cultural Figure, Spiritual, Villain","nonhuman, female, organic, ds9, winn, crew_max_rarity_5","End of One Journey",0, 7, 10, 10, 14, 6, 0, , , , 315, 330, 110, 550, false,"Winn",crew_portraits_cm_winnevil_sm.png
