"Young Anya",6,5, 0,0,0,0,0,0,1315,174,309,1061,52,128,536,47,111,0,0,0,0,326,405,857,0,172,331,820,0,27,99,113,76,217,678,0,515,868,979,0,425,637,952,0,195,383,343,649,528,810,286,924,"Caregiver, Diplomat, Shapeshifter, Allasomorph","female, organic, tng, nonhuman, anya, crew_max_rarity_5","You Underestimated Me",0, 9, 8, 8, 10, 1, 0, 2, , , 450, 200, 173, 490, false,"Anya",crew_portraits_cm_anya_young_sm.png,anya_young_crew
"Groom Worf",6,4, 0,0,0,0,0,0,650,84,139,0,0,0,942,97,151,0,0,0,0,690,0,618,0,632,0,549,0,569,191,511,482,0,412,0,842,0,860,0,852,0,839,0,733,589,709,794,0,690,961,1114,"Klingon, Romantic, Federation, Starfleet","nonhuman, male, organic, worf, ds9, crew_max_rarity_4","How Comforting",0, 9, 8, 5, 8, , , , , , 375, 135, 216, 415, false,"Worf",crew_portraits_cm_worf_groom_sm.png,worf_groom_crew
"Dr. Edward La Forge",8,5, 481,80,181,1279,214,439,0,0,0,0,0,0,0,0,0,994,150,319,50,823,766,877,28,166,159,220,10,0,0,248,0,150,309,74,795,738,840,115,244,185,284,27,0,0,382,0,228,402,181,305,"Human, Starfleet, Federation, Exobiology","male, organic, tng, elaforge, crew_max_rarity_5","She's Gone",1, 10, 8, 8, 10, , , , , , 495, 200, 125, 425, false,"E. La Forge",crew_portraits_cm_elaforge_sm.png,elaforge_crew
"Nepenthe Troi",6,5, 473,72,228,0,0,0,0,0,0,0,0,0,1008,99,230,1106,310,572,810,814,747,254,16,0,0,452,135,0,552,135,372,73,17,719,748,670,431,8,0,0,726,78,0,782,71,655,25,27,298,194,"Human, Starfleet, Federation, Civilian, Caregiver, Inspiring, Empath, Counselor, Betazoid","female, organic, nonhuman, pic, troi, crew_max_rarity_5","We'll Find A Way Forward",2, 7, 6, 5, 10, 7, 2, , , , 400, 70, 15, 325, false,"Troi",crew_portraits_cm_troi_nepenthe_sm.png,troi_nepenthe_crew
"Edward Larkin",8,4, 0,0,0,866,152,339,0,0,0,0,0,0,158,6,12,644,127,300,477,0,0,1050,467,479,349,379,51,0,1063,461,1009,318,457,450,0,0,1053,439,440,307,463,64,0,1065,435,1011,270,437,855,836,"Human, Starfleet, Federation, Geneticist, Exobiology, Maverick, Tribbled, Crafty","male, dsc, larkin, crew_max_rarity_4","I'm Not The Dumb One!",1, 6, 8, 8, 12, 4, 4, , , , 280, 200, 65, 450, false,"Larkin",crew_portraits_cm_larkin_sm.png,dsc_larkin_crew
"Technician Fisher",9,5, 500,75,163,1271,212,416,0,0,0,1002,121,277,0,0,0,0,0,0,52,817,72,868,695,180,13,246,111,352,0,0,383,182,0,94,830,189,873,714,267,42,310,181,509,0,0,567,303,0,255,463,"Geologist, Starfleet, Federation, Resourceful, Explorer, Human","male, organic, tos, fisher, crew_max_rarity_5","Rock Solid",1, 8, 10, 10, 10, 5, 0, , , , 485, 265, 135, 400, false,"Fisher",crew_portraits_cm_fisher_technician_sm.png,fisher_technician_crew
"Fisticuffs Sisko",7,5, 982,108,303,0,0,0,1304,162,375,0,0,0,499,61,133,0,0,0,399,42,346,271,294,156,0,848,0,156,102,95,811,0,704,545,160,470,456,447,353,0,905,0,323,279,275,877,0,769,231,580,"Human, Federation, Starfleet, Bajoran, Duelist, Brutal","male, organic, ds9, captain, bridge_crew, sisko, crew_max_rarity_5","I Am Not Picard",2, 8, 8, 6, 12, 1, 0, , , , 475, 145, 100, 400, false,"Sisko",crew_portraits_cm_sisko_fisticuffs_sm.png,sisko_fisticuffs_crew
"Nanoprobe Phlox",6,5, 0,0,0,411,157,377,0,0,0,1314,120,260,0,0,0,982,126,405,747,0,181,0,228,747,57,761,56,211,0,225,228,3,294,382,0,542,0,285,376,73,431,34,533,0,305,595,23,346,232,259,"Denobulan, Civilian, Physician, Romantic, Exobiology, Borg","male, organic, ent, phlox, crew_max_rarity_5","A Cure of Sorts",2, 10, 15, 8, 5, 4, 0, , , , 200, 245, 137, 100, false,"Phlox",crew_portraits_cm_phlox_nanoprobe_sm.png,phlox_nanoprobe_crew
"EV Suit T'Pol",7,5, 1257,242,442,514,54,154,1032,84,137,0,0,0,0,0,0,0,0,0,48,52,114,337,64,85,550,832,496,372,573,311,0,0,0,76,184,145,357,140,511,591,889,536,735,937,711,0,0,0,256,615,"Vulcan, Starfleet, Astrophysicist, Telepath, High Command","nonhuman, female, organic, evsuit, ent, first_officer, bridge_crew, tpol, crew_max_rarity_5","You Can't Deny Your Nature",0, 9, 6, 6, 10, , , , , , 500, 225, 120, 250, false,"T'Pol",crew_portraits_cm_tpol_ev_suit_sm.png,tpol_ev_suit_crew
"Marine Q",7,5, 1011,104,227,0,0,0,559,66,133,0,0,0,1272,216,422,0,0,0,414,210,367,41,309,739,0,208,0,655,77,603,132,0,144,671,473,611,158,562,896,0,292,0,778,205,746,215,0,224,129,559,"Crafty, Costumed, Brutal, Q Continuum","nonhuman, male, tng, q_jdl, crew_max_rarity_5","All It Takes Are A Few Good Men!",0, 10, 8, 8, 10, , , , , , 490, 110, 205, 450, false,"Q",crew_portraits_cm_q_marine_sm.png,q_marine_crew
"Restless Trip Tucker",5,3, 0,0,0,0,0,0,0,0,0,342,36,108,487,73,177,0,0,0,0,0,905,866,0,0,673,826,0,839,892,0,524,543,683,0,0,908,859,0,0,669,836,0,835,904,0,561,548,688,1124,1157,"Human, Starfleet, Romantic, Resourceful, Jury Rigger","male, organic, ent, commander, tucker, crew_max_rarity_3","Reluctant Patient",1, 6, 6, 8, 14, , , , 0, 1, 185, 20, 55, 325, false,"Trip",crew_portraits_cm_tucker_offduty_sm.png,tucker_offduty_crew
"EV Suit Phlox",5,4, 347,62,170,918,94,206,0,0,0,0,0,0,0,0,0,705,76,259,212,891,851,962,189,511,367,568,54,0,0,459,0,316,503,378,837,790,882,249,721,473,773,176,0,0,563,0,360,573,639,891,"Denobulan, Civilian, Physician, Exobiology, Resourceful","male, evsuit, organic, ent, phlox, crew_max_rarity_4","Try Not To Sneeze",1, 8, 8, 4, 12, , , , , , 500, 230, 87, 250, false,"Phlox",crew_portraits_cm_phlox_ev_suit_sm.png,phlox_ev_suit_crew
"Humanoid Figure",8,5, 984,95,285,526,64,128,0,0,0,0,0,0,1273,206,415,0,0,0,108,515,371,45,312,813,546,68,494,0,317,0,139,0,148,335,642,520,137,487,916,614,144,560,0,420,0,234,0,240,227,539,"Hologram, Temporal Agent, Villain, Tactician, Geneticist","male, organic, ent, humanoid_figure, crew_max_rarity_5","You Have No Choice",0, 7, 6, 6, 10, 4, 2, , , , 465, 200, 90, 300, false,"Figure",crew_portraits_cm_humanoid_figure_sm.png,humanoid_figure_crew
"Alicia Travers",7,5, 0,0,0,0,0,0,514,91,195,0,0,0,1008,121,240,1199,220,496,0,770,0,536,101,749,0,432,130,661,184,21,356,70,15,0,762,0,719,126,734,0,678,136,652,381,37,605,62,45,191,321,"Human, Saboteur, Resourceful, Caregiver, Civilian","female, organic, ent, travers, crew_max_rarity_5","I'm Not Leaving",1, 10, 6, 6, 10, , , , , , 550, 70, 135, 400, false,"Travers",crew_portraits_cm_travers_sm.png,travers_crew
"B.G. Robinson",9,4, 0,0,0,873,148,345,0,0,0,600,105,261,355,68,164,0,0,0,468,0,594,942,0,468,83,232,278,577,973,0,315,359,780,440,0,557,885,0,434,91,211,276,551,927,0,274,329,705,669,671,"Human, Starfleet, Federation, Romantic","organic, female, tng, robinson_bg, crew_max_rarity_4","Hello There",2, 9, 10, 8, 12, , , , , , 375, 70, 100, 450, false,"Robinson",crew_portraits_cm_robinson_bg_sm.png,robinson_bg_crew
"Jhamel",9,5, 0,0,0,0,0,0,0,0,0,0,0,0,1276,220,454,1004,116,306,0,0,0,320,258,0,0,191,225,0,286,263,113,161,8,0,0,0,376,443,0,0,253,331,0,356,443,177,275,41,503,658,"Andorian, Aenar, Telepath, Communicator, Desperate, Civilian, Inspiring, Romantic","nonhuman, female, organic, ent, jhamel, crew_max_rarity_5","I Won't Abandon My Brother",1, 10, 6, 8, 10, , , , , , 1345, 200, 175, 330, false,"Jhamel",crew_portraits_cm_jhamel_sm.png,jhamel_crew
"Brigitte Torres",3,4, 297,78,178,0,0,0,634,106,223,0,0,0,949,137,284,0,0,0,962,449,892,335,831,597,0,469,0,538,140,475,390,0,347,799,421,751,366,686,643,0,600,0,582,266,552,512,0,473,627,749,"Human, Costumed, Undercover Operative, Caregiver, Romantic, Civilian, Klingon","nonhuman, female, organic, voy, torres, crew_max_rarity_4","Here's to English Precision",1, 7, 8, 6, 10, , , , , , 465, 50, 118, 350, false,"Torres",crew_portraits_cm_torres_brigitte_sm.png,torres_brigitte_crew
"Lieutenant Georgiou",6,4, 665,81,208,397,48,132,0,0,0,0,0,0,909,50,120,0,0,0,295,663,558,248,499,916,613,299,548,0,691,0,539,0,461,475,765,689,602,633,934,631,697,577,0,1005,0,907,0,798,718,1049,"Human, Federation, Starfleet, Inspiring, Diplomat","female, organic, dsc, georgiou, crew_max_rarity_4","You Caused Quite a Stir",2, 8, 8, 8, 12, , , , , , 300, 55, 40, 250, false,"Georgiou",crew_portraits_cm_georgiou_lt_sm.png,dsc_georgiou_lt_crew
"Ransom Shran",6,4, 624,63,166,0,0,0,387,74,161,0,0,0,905,108,247,0,0,0,690,438,626,233,573,885,0,535,0,762,311,721,471,0,399,848,539,794,477,726,830,0,684,0,712,459,693,613,0,543,676,925,"Andorian, Tactician, Caregiver, Desperate","nonhuman, male, organic, ent, captain, shran, crew_max_rarity_4","You Have To Help Me",0, 7, 10, 8, 10, 4, 2, , , , 500, 175, 210, 475, false,"Shran",crew_portraits_cm_shran_ransom_sm.png,shran_ransom_crew
"Captain Erika Hernandez",10,5, 1204,194,419,0,0,0,0,0,0,993,129,294,0,0,0,0,0,0,220,367,11,399,130,0,290,0,0,348,0,0,378,177,0,278,403,26,446,191,0,356,0,0,473,0,0,528,280,0,541,727,"Starfleet, Human, Resourceful, Romantic, Athlete","female, organic, ent, captain, hernandez, crew_max_rarity_5","Able To Hang In A Firefight A Little Longer",2, 9, 8, 6, 14, 8, 4, , , , 395, 200, 70, 550, false,"Hernandez",crew_portraits_cm_hernandez_captain_sm.png,hernandez_captain_crew
"Prisoner Kim",3,5, 0,0,0,0,0,0,1002,157,336,1261,231,469,0,0,0,556,98,196,0,428,123,0,595,307,166,0,430,8,472,32,163,8,590,0,503,148,0,632,410,163,0,445,14,558,97,172,16,636,46,210,"Federation, Human, Starfleet, Prisoner, Desperate, Survivalist, Caregiver","male, organic, voy, kim, crew_max_rarity_5","He's Dead!",0, 9, 6, 6, 8, , , , , , 530, 150, 250, 350, false,"Kim",crew_portraits_cm_kim_prisoner_sm.png,kim_prisoner_crew
"Reclamation Narissa",7,4, 854,125,297,0,0,0,683,50,111,0,0,0,320,68,172,0,0,0,509,214,442,400,376,630,0,943,0,564,515,508,924,0,810,535,427,459,384,436,957,0,847,0,818,697,785,803,0,700,733,921,"Zhat Vash, Tal Shiar, Romulan, Brutal, Villain, Crafty, Duelist","pic, nonhuman, narissa, female, crew_max_rarity_4","Something Far Worse Is Coming",0, 7, 10, 8, 12, 1, 2, , , , 550, 175, 180, 325, false,"Narissa",crew_portraits_cm_narissa_reclamation_crew_sm.png,narissa_reclamation_crew
"U.S.S. Zheng He Riker",6,5, 1276,199,453,0,0,0,967,183,357,0,0,0,518,90,174,0,0,0,148,17,111,111,58,314,0,767,0,279,166,209,727,0,622,230,71,165,179,152,347,0,811,0,315,220,271,762,0,668,68,215,"Human, Federation, Starfleet, Pilot, Maverick, Gambler","male, organic, pic, riker, crew_max_rarity_5","I Learned From The Best",2, 10, 6, 6, 8, , , , 1, 2, 500, 300, 195, 300, false,"Riker",crew_portraits_cm_riker_zhenghe_sm.png,riker_zhenghe_crew
"Nona",9,5, 521,62,166,0,0,0,0,0,0,0,0,0,964,118,209,1252,172,436,787,800,728,278,14,0,0,500,128,0,592,130,428,69,20,856,840,798,511,66,0,0,729,195,0,786,214,660,117,81,319,576,"Caregiver, Botanist, Spiritual, Neural, Crafty, Civilian, Desperate","nonhuman, tos, nona, crew_max_rarity_5","Don't Touch Me!",1, 10, 8, 5, 8, , , , , , 305, 185, 140, 490, false,"Nona",crew_portraits_cm_nona_sm.png,nona_crew
"Camp Nurse Janeway",6,4, 356,59,137,0,0,0,0,0,0,0,0,0,589,118,255,824,162,350,927,896,860,512,126,0,0,674,302,0,765,377,629,239,72,911,880,841,501,131,0,0,663,261,0,735,318,591,193,98,712,672,"Human, Starfleet, Federation, Resourceful, Costumed, Nurse, Civilian","female, organic, voy, captain, bridge_crew, janeway, crew_max_rarity_4","You're Bleeding!",2, 5, 14, 10, 16, 2, 0, , , , 500, 270, 125, 250, false,"Janeway",crew_portraits_cm_janeway_civil_war_sm.png,janeway_civil_war_crew
"Kivas Fajo",9,4, 0,0,0,619,77,170,850,139,294,0,0,0,360,66,124,0,0,0,687,568,0,961,0,76,466,441,406,438,370,369,903,0,791,824,579,0,947,0,202,552,579,493,445,407,417,882,0,774,732,882,"Crafty, Scoundrel, Zibelian, Brutal, Criminal, Thief","nonhuman, male, organic, tng, kivas, crew_max_rarity_4","Accept Your Fate",2, 8, 8, 8, 10, , , , , , 433, 135, 93, 417, false,"Kivas",crew_portraits_cm_fajo_kivas_sm.png,fajo_kivas_crew
"Emory Erickson",7,5, 0,0,0,1025,194,451,0,0,0,1144,232,484,474,80,166,0,0,0,282,0,183,879,0,284,10,104,183,220,907,0,47,94,705,251,0,140,863,0,250,7,118,168,173,906,0,50,63,691,196,150,"Human, Civilian, Caregiver, Innovator, Desperate","male, organic, ent, erickson, crew_max_rarity_5","You'll Be Able To Leave The Lights On",0, 8, 6, 10, 10, 4, 0, , , , 300, 50, 130, 450, true,"Emory",crew_portraits_cm_emory_erickson_sm.png,emory_erickson_crew
"Ambassador V'Lar",9,5, 997,138,268,0,0,0,0,0,0,0,0,0,1269,234,439,0,0,0,383,494,332,28,280,0,0,199,0,0,300,0,121,0,132,555,615,480,99,457,0,0,255,0,0,359,0,178,0,195,506,667,"Vulcan, Ambassador, Diplomat, Telepath, Investigator, High Command","female, nonhuman, organic, ent, vlar, crew_max_rarity_5","We've Kept Many Things From Them",2, 8, 6, 8, 12, 5, 0, , , , 390, 195, 153, 475, false,"V'lar",crew_portraits_cm_vlar_ambassador_sm.png,vlar_ambassador_crew
"Altan Inigo Soong",4,4, 484,179,392,993,122,283,0,0,0,409,91,199,0,0,0,0,0,0,71,702,238,755,548,396,117,457,240,751,0,0,851,487,0,57,441,63,492,242,537,160,621,340,664,0,0,737,423,0,592,444,"Human, Civilian, Cyberneticist, Innovator, Federation, Caregiver","male, organic, pic, altan, crew_max_rarity_4","I Suppose That's What Mothers Do",1, 6, 6, 6, 12, 6, 0, , , , 250, 315, 213, 125, false,"Altan",crew_portraits_cm_altan_sm.png,altan_crew
"Dr. Roger Korby",6,5, 493,84,162,1271,230,424,0,0,0,0,0,0,0,0,0,957,181,393,51,819,758,873,27,171,164,233,8,0,0,230,0,143,298,75,811,765,861,73,242,183,281,16,0,0,248,0,147,300,163,224,"Android, Exoarchaeology, Physician, Starfleet, Federation, Undercover Operative","artificial_life, tos, korby, crew_max_rarity_5","Now, Strike Him!",0, 10, 8, 6, 8, , , , , , 465, 200, 177, 225, false,"Korby",crew_portraits_cm_korby_roger_sm.png,korby_roger_crew
"Breen Disguise Kira",2,5, 581,106,206,0,0,0,1221,287,685,0,0,0,1064,61,164,0,0,0,693,97,631,188,576,96,0,440,0,109,4,50,365,0,328,698,47,642,524,594,49,0,863,0,50,48,38,832,0,718,9,174,"Bajoran, Breen, Starfleet, Saboteur, Undercover Operative, Resourceful","nonhuman, female, organic, evsuit, ds9, kira, commander, crew_max_rarity_5","Make the Right Choice",1, 7, 8, 4, 10, 1, 1, , , , 450, 100, 40, 400, false,"Kira",crew_portraits_cm_kira_breen_sm.png,kira_breen_crew
"Awaiting Amanda Grayson",6,5, 446,119,259,0,0,0,0,0,0,0,0,0,1286,205,416,859,205,430,791,804,733,114,34,0,0,202,253,0,306,313,126,195,11,593,643,522,141,30,0,0,311,175,0,419,191,233,97,18,198,129,"Human, Federation, Caregiver, Civilian, Communicator, Desperate","female, amanda_grayson, organic, tos, crew_max_rarity_5","Your Duty Is To Your Father",2, 10, 8, 6, 8, , , , , , 400, 125, 150, 525, false,"Amanda",crew_portraits_cm_amanda_grayson_awaiting_sm.png,amanda_grayson_awaiting_crew
"Em/3/Green",9,4, 0,0,0,648,45,157,396,67,153,868,108,262,0,0,0,0,0,0,679,859,450,0,0,313,104,703,405,180,943,720,514,251,0,908,848,555,0,0,517,255,900,548,274,943,718,607,326,0,724,961,"Nasat, Crafty, Federation, Desperate, Resourceful, Jury Rigger","em_three, male, organic, nonhuman, tas, crew_max_rarity_4","I Am Not Afraid, Just Very Tired",1, 6, 8, 10, 20, 2, 0, , , , 325, 200, 163, 225, false,"Em",crew_portraits_cm_em_sm.png,em_three_green_crew
"EV Suit Spock",5,5, 0,0,0,1270,178,365,613,37,101,843,221,514,0,0,0,0,0,0,204,748,342,0,0,36,19,282,134,70,826,579,382,179,0,373,933,132,0,0,210,11,421,239,102,1028,801,145,58,0,202,288,"Vulcan, Human, Telepath, Spiritual, Starfleet, Federation, Explorer, Crafty, Thief, Exobiology","evsuit, nonhuman, male, organic, tos, spock, spock_tos, crew_max_rarity_5","Facilitate A Better View",2, 9, 8, 8, 12, 0, 1, , , , 500, 125, 100, 150, false,"Spock",crew_portraits_cm_spock_evsuit_sm.png,spock_evsuit_crew
"Dignitary Sarek",3,4, 0,0,0,649,84,173,0,0,0,0,0,0,918,146,257,378,55,121,656,0,0,593,784,637,452,111,207,0,594,754,438,517,153,803,0,0,675,810,803,531,275,325,0,705,772,549,529,292,658,918,"Vulcan, Diplomat, Cultural Figure, Communicator, Federation, Telepath, Ambassador","nonhuman, male, organic, sarek, tos, crew_max_rarity_4","Threats Are Illogical",1, 8, 6, 6, 8, , , , , , 455, 145, 195, 415, false,"Sarek",crew_portraits_cm_sarek_dignitary_sm.png,sarek_dignitary_crew
"Captain Solok",9,5, 1004,95,266,1283,199,400,475,88,162,0,0,0,0,0,0,0,0,0,16,242,350,555,296,41,172,247,113,717,903,669,0,0,0,64,401,549,718,510,99,229,346,201,691,895,674,0,0,0,273,505,"Vulcan, Starfleet, Writer, Federation, Telepath","male, organic, ds9, solok, crew_max_rarity_5","Your Welcome Is Acknowledged",1, 6, 10, 10, 14, 2, 0, , , , 400, 170, 155, 365, false,"Solok",crew_portraits_cm_solok_captain_sm.png,solok_captain_crew
"D'Nesh",10,5, 0,0,0,0,0,0,0,0,0,1022,140,310,1247,222,505,0,0,0,0,0,290,322,0,0,258,197,0,304,296,0,7,146,127,0,0,430,321,0,0,340,208,0,450,292,0,16,258,159,501,573,"Romantic, Scoundrel, Orion, Casual, Civilian, Crafty, Saboteur","female, organic, ent, dnesh, crew_max_rarity_5","I Thought You Were Different",1, 7, 6, 8, 8, , , , , , 350, 165, 135, 465, true,"D'Nesh",crew_portraits_cm_dnesh_sm.png,dnesh_crew
"T'Pring",9,5, 0,0,0,0,0,0,1071,74,157,0,0,0,1292,172,285,0,0,0,0,467,0,376,0,363,0,274,0,328,27,259,194,0,201,0,835,0,613,0,843,0,533,0,725,331,703,440,0,411,530,1020,"Vulcan, Telepath, Romantic, Brutal, Civilian","tos, nonhuman, tpring, female, crew_max_rarity_5","Flawlessly Logical",2, 9, 8, 5, 8, , , , , , 390, 200, 213, 650, false,"T'Pring",crew_portraits_cm_tpring_sm.png,tpring_crew
"Boreth Pike",7,4, 873,86,227,385,55,133,0,0,0,0,0,0,591,97,199,0,0,0,222,598,457,279,392,918,616,410,552,0,793,0,658,0,561,428,732,641,453,593,923,620,491,564,0,836,0,717,0,629,767,950,"Starfleet, Human, Federation, Inspiring, Explorer, Tactician, Desperate, Diplomat","male, organic, dsc, pike, crew_max_rarity_4","I'm Not Leaving Here",0, 9, 8, 8, 10, , , , 1, 2, 450, 200, 175, 375, false,"Pike",crew_portraits_cm_pike_boreth_sm.png,dsc_pike_boreth_crew
"Mok'bara Crusher",4,5, 0,0,0,0,0,0,475,88,191,0,0,0,1253,205,458,1079,150,373,0,810,0,333,187,807,0,212,184,700,94,33,138,126,1,0,771,0,386,292,744,0,266,251,660,141,94,185,185,30,37,220,"Human, Starfleet, Federation, Caregiver, Physician, Counselor, Athlete","female, organic, tng, commander, crusher, crew_max_rarity_5","And Then What Happened?",2, 7, 10, 8, 12, 2, 0, , , , 550, 170, 65, 100, false,"Crusher",crew_portraits_cm_crusher_mok_bara_sm.png,crusher_mok_bara_crew
"Leila Kalomi",9,5, 0,0,0,1273,210,375,0,0,0,0,0,0,982,164,354,451,98,210,185,0,0,497,712,193,183,11,41,0,484,679,308,462,71,330,0,0,540,608,316,242,41,74,0,546,609,366,399,110,203,282,"Human, Civilian, Botanist, Romantic, Desperate, Crafty","female, organic, tos, leila_kalomi, crew_max_rarity_5","You Can Belong Again",1, 7, 6, 8, 12, 4, 1, , , , 495, 170, 133, 325, false,"Leila",crew_portraits_cm_leila_kalomi_sm.png,leila_kalomi_crew
"EV Suit McCoy",6,4, 364,45,111,614,49,130,0,0,0,0,0,0,0,0,0,815,137,301,446,909,873,974,145,711,489,732,80,0,0,405,0,258,453,667,921,885,977,220,932,629,928,187,0,0,425,0,262,453,835,974,"Human, Federation, Starfleet, Desperate, Exobiology, Resourceful, Physician","evsuit, male, organic, tos, mccoy, crew_max_rarity_4","He Was A Hero",1, 8, 8, 8, 10, , , , , , 440, 160, 204, 500, false,"McCoy",crew_portraits_cm_mccoy_evsuit_sm.png,mccoy_evsuit_crew
"Fair Haven Harry Kim",8,4, 0,0,0,696,101,222,0,0,0,0,0,0,881,180,354,0,0,0,598,0,0,576,0,583,418,98,357,0,578,0,408,0,360,692,0,0,530,0,679,446,130,414,0,536,0,348,0,337,904,899,"Federation, Human, Starfleet, Costumed, Romantic, Musician","male, organic, voy, kim, crew_max_rarity_4","Late For A Midnight Stroll",2, 7, 6, 8, 10, 3, 0, 2, , , 450, 315, 121, 515, false,"Kim",crew_portraits_cm_kim_fairhaven_sm.png,kim_fairhaven_crew
"Zarabeth",7,4, 0,0,0,0,0,0,0,0,0,0,0,0,869,123,258,612,126,342,0,0,0,625,471,0,0,556,360,0,642,466,493,323,59,0,0,0,697,377,0,0,650,296,0,727,386,575,229,104,942,904,"Sarpeidon, Survivalist, Desperate, Resourceful, Romantic, Crafty, Civilian, Caregiver, Displaced","organic, female, nonhuman, tos, zarabeth, crew_max_rarity_4","You're Safe Here",1, 7, 6, 6, 6, , , , , , 375, 175, 83, 440, false,"Zarabeth",crew_portraits_cm_zarabeth_sm.png,zarabeth_crew
"Facer Rios",8,5, 526,78,141,0,0,0,0,0,0,962,130,280,1259,236,440,0,0,0,785,798,77,113,666,0,324,203,0,388,307,0,14,210,140,872,853,202,197,746,0,369,251,0,492,352,0,29,295,194,222,398,"Human, Civilian, Undercover Operative, Scoundrel, Crafty","male, organic, pic, rios, crew_max_rarity_5","Indulge Me",1, 10, 6, 8, 10, , , , , , 440, 200, 170, 450, false,"Rios",crew_portraits_cm_rios_facer_sm.png,rios_facer_crew
"Kelis",7,5, 1283,243,418,0,0,0,0,0,0,0,0,0,1012,116,244,475,90,188,143,305,107,29,10,0,0,424,503,0,532,670,351,454,82,222,348,157,128,38,0,0,677,459,0,751,649,604,432,225,173,388,"Communicator, Civilian, Resourceful, Writer, Desperate, Maverick","nonhuman, organic, voy, kelis, crew_max_rarity_5","You're Not Doing So Well",1, 8, 8, 8, 8, , , , , , 415, 150, 120, 475, true,"Kelis",crew_portraits_cm_kelis_sm.png,kelis_crew
"A.G. Robinson",9,5, 486,46,143,792,212,493,0,0,0,1299,121,295,0,0,0,0,0,0,127,839,46,887,727,447,32,508,270,210,0,0,224,90,0,80,891,227,945,790,189,26,231,139,478,0,0,540,287,0,421,400,"Human, Starfleet, Pilot, Explorer, Inspiring","evsuit, male, organic, ent, robinson_ag, crew_max_rarity_5","You Tried Too Hard",1, 10, 6, 6, 12, 7, 0, , , , 225, 185, 235, 750, true,"A.G.",crew_portraits_cm_robinson_ag_sm.png,robinson_ag_crew
"Cyrano de Barclay",7,4, 845,99,221,0,0,0,0,0,0,371,72,145,582,107,218,0,0,0,538,606,185,286,406,0,622,694,0,797,788,0,338,511,558,688,722,299,411,582,0,582,732,0,762,789,0,343,489,585,793,896,"Starfleet, Costumed, Communicator, Human, Innovator, Federation","male, organic, tng, barclay, crew_max_rarity_4","The Moon...Yes, That Will Be My Home",1, 8, 5, 6, 10, , , , , , 400, 200, 130, 460, false,"Barclay",crew_portraits_cm_cyrano_barclay_sm.png,barclay_cyrano_crew
"Maquis Takeover Seska",7,5, 1300,173,343,0,0,0,523,126,220,967,158,267,0,0,0,0,0,0,186,114,9,367,93,704,311,0,0,74,817,572,409,199,0,396,212,44,539,290,622,354,0,0,140,759,529,522,278,0,186,414,"Bajoran, Cardassian, Maquis, Hologram, Obsidian Order, Crafty, Villain, Undercover Operative","nonhuman, female, organic, voy, ensign, seska, crew_max_rarity_5","Authorization Zeta 1",0, 8, 10, 8, 10, 1, 1, , , , 400, 105, 177, 500, false,"Seska",crew_portraits_cm_seska_maquis_sm.png,seska_maquis_crew
"Flustered Jett Reno",7,4, 0,0,0,865,160,319,0,0,0,320,57,181,0,0,0,588,116,284,483,0,884,0,529,486,196,539,58,825,0,505,932,157,539,468,0,795,0,472,449,143,504,81,731,0,477,819,101,509,714,644,"Starfleet, Federation, Human, Jury Rigger, Resourceful, Desperate, Veteran","female, organic, dsc, jett_reno, crew_max_rarity_4","I'm Going, I'm Going",1, 6, 10, 10, 15, 2, 0, , , , 400, 185, 155, 475, false,"Reno",crew_portraits_cm_reno_flustered_sm.png,dsc_jett_reno_flustered_crew
"Maquis Takeover Paris",6,4, 381,65,150,0,0,0,554,80,185,836,122,244,0,0,0,0,0,0,891,499,177,928,762,713,389,0,0,111,824,578,542,267,0,880,524,258,911,753,767,408,0,0,235,872,650,612,330,0,818,905,"Human, Starfleet, Federation, Maquis, Undercover Operative, Costumed","organic, voy, lieutenant, bridge_crew, paris, crew_max_rarity_4","Remember The Good Old Days",2, 6, 10, 8, 12, 1, 1, , , , 525, 175, 170, 515, false,"Paris",crew_portraits_cm_paris_maquis_sm.png,paris_maquis_crew
"Carlos Data",4,5, 0,0,0,1247,286,455,0,0,0,552,75,151,0,0,0,948,164,420,145,0,702,0,234,155,47,213,6,674,0,232,731,18,300,169,0,811,0,238,169,56,203,12,749,0,242,840,38,291,87,176,"Android, Starfleet, Federation, Investigator, Costumed","nonhuman, male, tng, lieutenant_commander, bridge_crew, artificial_life, data, crew_max_rarity_5","Hiya, Doc. What's Cookin'?",2, 10, 4, 6, 10, , , 2, , , 340, 200, 200, 375, false,"Data",crew_portraits_cm_data_carlos_sm.png,data_carlos_crew
"Booker and Grudge",8,5, 1309,147,332,0,0,0,520,82,180,998,96,194,0,0,0,0,0,0,192,123,14,377,102,755,335,0,0,93,847,616,449,220,0,454,287,103,580,356,776,493,0,0,320,878,658,738,424,0,306,722,"Empath, Pilot, Smuggler, Courier, Resourceful, Kwejian","male, nonhuman, organic, dsc, booker, crew_max_rarity_5","She's A Queen",1, 7, 14, 4, 14, 1, 2, , , , 650, 100, 175, 485, false,"Booker",crew_portraits_cm_booker_grudge_sm.png,dsc_booker_grudge_crew
"General Oh",5,5, 1161,293,514,0,0,0,1021,73,262,0,0,0,523,69,145,0,0,0,182,50,140,132,90,362,0,790,0,325,197,258,761,0,651,118,86,84,125,77,637,0,880,0,574,509,546,847,0,741,207,315,"Vulcan, Romulan, Zhat Vash, Tal Shiar, Brutal, Villain","female, organic, pic, oh, crew_max_rarity_5","Our Great Work Is Nearly At An End",0, 10, 8, 6, 12, 1, 0, 2, 1, 2, 590, 400, 90, 250, false,"Oh",crew_portraits_cm_oh_general_sm.png,oh_general_crew
"Linus",9,4, 314,48,120,873,129,327,0,0,0,0,0,0,649,69,145,0,0,0,228,936,914,572,850,491,354,128,291,0,775,0,639,0,544,272,911,874,696,814,485,326,262,309,0,966,0,849,0,743,761,914,"Saurian, Resourceful, Federation, Starfleet, Communicator","male, organic, dsc, linus, crew_max_rarity_4","Apologies!",2, 8, 10, 8, 10, , , , , , 450, 150, 165, 490, false,"Linus",crew_portraits_cm_linus_sm.png,dsc_linus_crew
"Lt. Booker",6,3, 0,0,0,0,0,0,325,62,132,235,29,94,535,64,153,0,0,0,0,919,945,822,0,959,692,773,0,613,638,783,568,569,630,0,879,926,912,0,907,688,874,0,609,685,753,646,562,738,1064,1092,"Federation, Starfleet, Undercover Operative, Courier, Smuggler, Empath, Kwejian","male, nonhuman, organic, dsc, booker, crew_max_rarity_3","I've Never Been to Earth",0, 6, 8, 6, 8, , , , , , 440, 200, 133, 409, false,"Booker",crew_portraits_cm_booker_lt_sm.png,dsc_booker_lt_crew
"Sahil",9,5, 1303,144,328,519,49,119,0,0,0,0,0,0,1039,88,179,0,0,0,60,356,153,52,111,833,562,150,510,0,551,0,370,0,334,249,537,380,310,364,953,647,582,585,0,879,0,758,0,664,312,858,"Human, Starfleet, Federation, Communicator, Ambassador, Desperate","male, organic, dsc, sahil, crew_max_rarity_5","It Would Be My Honor to Assist You",1, 10, 6, 6, 8, , , , , , 400, 140, 150, 450, false,"Sahil",crew_portraits_cm_sahil_sm.png,dsc_sahil_crew
