"Commander Chapel",0,4, 0,0,0,739,76,257,0,0,0,0,0,0,245,149,301,546,99,350,856,0,0,1382,781,824,610,525,118,0,1403,736,1285,527,476,976,0,0,921,584,919,665,251,122,0,937,585,716,383,110,1296,763,"Federation, Starfleet, Human, Physician, Veteran","female, organic, tos, chapel, crew_max_rarity_4","Doctor's Orders",2, 7, 8, 8, 16, 6, 0, , , , 1450, 75, 155, 400, false,"Chapel",crew_portraits_cm_chapel_commander_sm.png,chapel_commander_crew
"Leonardo da Vinci",0,5, 0,0,0,1229,80,228,0,0,0,1092,177,354,0,0,0,366,161,483,421,0,407,0,886,424,29,517,59,419,0,835,462,22,868,1021,0,488,0,217,986,134,1063,62,510,0,227,544,5,283,495,255,"Hologram, Prodigy, Inspiring, Innovator, Civilian, Human, Artist, Cultural Figure, Astrophysicist","male, organic, voy, davinci, crew_max_rarity_5","Poor is the Pupil",2, 6, 6, 8, 8, 6, 0, 2, , , 1815, 330, 83, 175, false,"Leonardo",crew_portraits_cm_davinci_sm.png,davinci_crew
"Mirror Reed",0,5, 983,151,362,0,0,0,1215,256,560,0,0,0,0,0,0,0,0,0,582,55,518,787,391,255,0,0,0,261,456,152,0,0,0,581,49,506,763,405,156,0,0,0,173,282,107,0,0,0,794,495,"Terran Empire, Human, Brutal, MACO, Marksman, Starfleet, Mirror Universe","male, organic, ent, reed, crew_max_rarity_5","Extreme Punishment",0, 9, 12, 5, 10, 1, 0, 2, , , 555, 210, 147, 350, false,"Reed",crew_portraits_cm_reed_mirror_sm.png,reed_mirror_crew
"Mirror Jean-Luc Picard",0,5, 1042,243,753,583,21,88,982,198,439,0,0,0,0,0,0,0,0,0,99,65,321,591,219,109,841,1120,683,451,721,324,0,0,0,36,11,54,181,37,211,1076,1381,886,335,517,224,0,0,0,360,94,"Human, Terran Empire, Starfleet, Brutal, Crafty, Maverick, Veteran, Resourceful, Duelist, Mirror Universe","male, organic, tng, picard, crew_max_rarity_5","Power Grab",1, 9, 8, 6, 12, 8, 4, , , , 750, 330, 120, 400, false,"Picard",crew_portraits_cm_picard_mirror_sm.png,picard_mirror_crew
"Mirror Jadzia Dax",0,4, 0,0,0,314,67,167,958,137,274,500,118,269,0,0,0,0,0,0,1350,782,1008,0,0,295,539,1335,853,157,889,485,1033,595,0,1217,883,791,0,0,329,290,1200,727,188,1018,634,852,450,0,1174,1096,"Trill, Terran Rebellion, Casual, Desperate, Romantic, Mirror Universe","nonhuman, female, organic, ds9, dax, crew_max_rarity_4","It's about time you came back",1, 5, 8, 10, 12, 4, 0, , , , 800, 215, 150, 425, true,"J. Dax",crew_portraits_cm_jadzia_mirror_sm.png,dax_jadzia_mirror_crew
"Mirror Vic Fontaine",0,4, 0,0,0,0,0,0,845,142,312,0,0,0,483,180,379,0,0,0,0,857,0,1114,0,747,0,983,0,688,274,560,961,0,796,0,812,0,727,0,688,0,570,0,636,140,540,501,0,422,1418,1144,"Desperate, Human, Survivalist, Artist, Musician, Marksman, Mirror Universe, Terran Rebellion","male, nonhuman, artificial_life, ds9, vicfontaine, crew_max_rarity_4","I'll See You In Hell First!",2, 8, 8, 8, 10, , , , , , 605, 245, 167, 425, false,"Vic",crew_portraits_cm_vicfontaine_mirror_sm.png,vic_mirror_crew
"Mirror Data",0,5, 0,0,0,598,45,121,967,143,292,1141,163,367,0,0,0,0,0,0,1055,748,376,0,0,125,101,1055,612,58,851,443,432,161,0,1345,854,490,0,0,411,218,1327,855,86,977,602,545,238,0,663,896,"Mirror Universe, Android, Terran Empire, Starfleet, Resourceful, Saboteur","nonhuman, male, artificial_life, data, crew_max_rarity_5","Explosive Decompression Achieved",0, 8, 10, 10, 12, 5, 0, , , , 555, 100, 171, 400, false,"Data",crew_portraits_cm_data_mirror_sm.png,data_mirror_crew
"Temporal Agent Daniels",0,5, 508,39,117,1238,118,376,0,0,0,947,116,230,0,0,0,0,0,0,108,1192,204,1283,1019,390,47,476,215,670,0,0,737,354,0,349,1306,542,1403,1164,611,135,697,360,841,0,0,939,509,0,719,1182,"Human, Starfleet, Federation, Temporal Agent, Undercover Operative","male, organic, ent, daniels, crew_max_rarity_5","Protect the Timeline",2, 9, 12, 10, 14, 7, 4, , , , 500, 360, 140, 560, false,"Daniels",crew_portraits_cm_daniels_temporal_sm.png,daniels_temporal_crew
"Jannar",0,4, 0,0,0,743,40,109,0,0,0,372,72,212,799,171,340,0,0,0,916,0,1171,951,0,872,345,239,514,1102,999,0,344,751,639,1366,0,1034,775,0,1353,542,406,865,956,772,0,170,622,474,1091,1256,"Counselor, Diplomat, Xindi, Investigator","male, nonhuman, organic, ent, jannar, exclusive_voyage, crew_max_rarity_4","Better Their World Than Ours",2, 4, 6, 4, 18, 1, 0, , , , 450, 200, 55, 340, true,"Jannar",crew_portraits_cm_jannar_sm.png,jannar_crew
"The Clown",0,4, 0,0,0,0,0,0,909,58,139,716,27,99,452,59,129,0,0,0,0,887,895,1297,0,778,690,1229,0,176,530,596,480,521,1039,0,1264,1312,1375,0,1280,1068,1294,0,872,1059,1037,1000,845,1101,1120,1551,"Brutal, Costumed, Desperate, Scoundrel, Villain","male, artificial_life, voy, nonhuman, clown, exclusive_voyage, crew_max_rarity_4","Why Talk, When We Can Dance?",1, 9, 4, 8, 10, 3, 0, 2, , , 400, 200, 130, 355, false,"Clown",crew_portraits_cm_clown_sm.png,clown_crew
"Thot Gor",0,4, 688,178,406,0,0,0,350,114,223,0,0,0,544,83,168,0,0,0,832,556,761,505,622,1223,0,1075,0,1091,874,976,1055,0,881,477,232,403,325,314,907,0,1164,0,847,659,757,1148,0,974,1282,835,"Breen, Diplomat, Dominion, Resourceful, Communicator","organic, nonhuman, evsuit, ds9, gor, exclusive_voyage, crew_max_rarity_4","Breen Dominance",0, 9, 10, 20, 10, , , 1, , , 775, 335, 65, 300, false,"Gor",crew_portraits_cm_thot_gor_sm.png,thot_gor_crew
"Lucien",0,4, 349,92,224,546,149,314,0,0,0,0,0,0,628,244,491,0,0,0,547,1224,1175,618,1051,918,691,283,547,0,1041,0,830,0,680,197,1034,939,153,820,679,464,28,398,0,366,0,232,0,194,1196,222,"Crafty, Cultural Figure, Explorer, Resourceful, Playful","male, organic, tas, nonhuman, lucien, exclusive_voyage, crew_max_rarity_4","Can't You Do Anything Right?",1, 7, 5, 8, 10, , , , , , 450, 285, 114, 590, false,"Lucien",crew_portraits_cm_lucien_sm.png,lucien_crew
"Mirror Beverly Crusher",0,5, 0,0,0,571,47,103,0,0,0,0,0,0,980,70,136,1067,225,603,1121,0,0,927,235,1099,826,287,58,0,965,251,749,141,39,1364,0,0,1342,85,1351,1044,960,57,0,1391,108,1254,43,70,702,841,"Human, Starfleet, Mirror Universe, Terran Empire, Physician, Caregiver, Neurologist, Geneticist","female, organic, tng, crusher, crew_max_rarity_5","Get Back In The Fight",1, 8, 20, 12, 10, 2, 0, 1, , , 300, 115, 242, 500, false,"Crusher",crew_portraits_cm_crusher_mirror_sm.png,crusher_mirror_crew
"Mirror Mayweather",0,4, 416,33,101,0,0,0,853,125,268,656,82,177,0,0,0,0,0,0,1276,535,491,1345,1082,758,685,0,0,165,985,571,946,519,0,1376,682,777,1425,1184,798,814,0,0,316,1047,660,1124,676,0,1141,1407,"Human, Starfleet, Mirror Universe, Terran Empire, MACO, Marksman, Brutal","male, organic, ent, mayweather, crew_max_rarity_4","Clean Up This Mess",0, 9, 10, 10, 8, , , , , , 400, 265, 267, 290, false,"Mayweather",crew_portraits_cm_mayweather_mirror_sm.png,mayweather_mirror_crew
"Ripper",0,5, 0,0,0,852,195,430,1332,182,366,0,0,0,0,0,0,0,0,0,698,475,0,0,0,27,502,742,383,277,463,163,0,0,0,400,654,0,0,0,28,288,457,225,477,711,363,0,0,0,815,847,"Brutal, Desperate, Explorer, Primal, Survivalist, Tardigrade","organic, dsc, nonhuman, ripper, crew_max_rarity_5","Mycelial Mastery",1, 9, 10, 12, 12, , , , , , 675, 250, 105, 325, false,"Ripper",crew_portraits_cm_tardigrade_sm.png,dsc_tardigrade_crew
"Satan's Robot",0,5, 0,0,0,571,59,123,852,134,273,1142,176,420,0,0,0,0,0,0,1096,866,365,0,0,156,99,1086,642,62,982,566,423,157,0,1327,892,395,0,0,444,168,1306,842,75,1027,637,432,169,0,727,829,"Hologram, Villain, Duelist","nonhuman, male, voy, artificial_life, satans_robot, crew_max_rarity_5","Citizen Of Earth, Surrender!",1, 8, 18, 8, 10, 2, 0, 2, , , 350, 100, 190, 100, false,"Satan's Robot",crew_portraits_cm_satans_robot_sm.png,satans_robot_crew
"Torchbearer Voq",0,4, 484,193,456,0,0,0,502,53,131,0,0,0,831,152,317,0,0,0,932,582,866,344,739,1170,0,824,0,1051,430,935,773,0,629,334,314,283,93,193,1306,0,737,0,1146,488,1049,651,0,553,1008,576,"Klingon, Cultural Figure, Desperate, Inspiring","nonhuman, male, tyler, voq, organic, dsc, crew_max_rarity_4","Demonstration of Faith",2, 7, 12, 5, 12, 1, 0, , , , 935, 150, 214, 190, false,"Voq",crew_portraits_cm_voq_sm.png,dsc_voq_torchbearer_crew
"Florist Q",0,3, 0,0,0,293,71,221,0,0,0,0,0,0,536,88,198,0,0,0,1344,0,0,1182,0,1334,1042,786,851,0,1221,0,1039,0,867,1065,0,0,1188,0,1034,755,539,624,0,1235,0,1070,0,910,1554,1527,"Crafty, Scoundrel, Costumed, Romantic, Q Continuum, Playful","male, nonhuman, tng, q_jdl, crew_max_rarity_3","Special Delivery",2, 3, 8, 3, 8, 1, 1, , , , 855, 155, 125, 380, false,"Q",crew_portraits_cm_q_florist_sm.png,q_florist_crew
"Prisoner Michael Burnham",0,2, 0,0,0,380,30,142,262,20,53,0,0,0,121,42,104,0,0,0,1303,1337,0,1473,0,921,998,1097,831,1215,1372,1111,1405,0,1209,1339,1355,0,1417,0,1139,1026,1032,849,1228,1366,1127,1337,0,1150,1595,1612,"Federation, Starfleet, Prisoner, Xenoanthropology, Duelist, Human","female, organic, dsc, burnham, crew_max_rarity_2","Improvised Assault",2, 3, 6, 10, 10, , , , , , 190, 220, 93, 260, false,"Burnham",crew_portraits_cm_burnham_prisoner_sm.png,dsc_burnham_prisoner_crew
"Graduation Michael Burnham",0,4, 0,0,0,884,180,497,0,0,0,694,65,178,0,0,0,0,0,0,608,0,859,0,0,573,106,656,336,812,0,0,929,492,0,310,0,1140,0,0,292,90,386,188,1028,0,0,1158,708,0,1347,1291,"Federation, Civilian, Astrophysicist, Xenoanthropology, Human, Festive","female, organic, dsc, burnham, crew_max_rarity_4","Lofty Expectations",2, 9, 8, 8, 10, , , 2, , , 500, 100, 280, 200, false,"Burnham",crew_portraits_cm_burnham_vulcan_graduate_sm.png,dsc_burnham_graduation_crew
"Tourist Quark",0,4, 325,45,113,0,0,0,0,0,0,0,0,0,810,168,393,637,109,244,1368,1315,1298,619,412,0,0,802,520,0,969,690,751,482,99,1350,1304,1274,462,426,0,0,568,521,0,702,740,499,494,106,1157,1004,"Ferengi, Scoundrel, Desperate, Romantic, Gambler, Communicator, Civilian","nonhuman, male, organic, ds9, quark, crew_max_rarity_4","Risan Rituals",0, 6, 12, 8, 20, 2, 0, , , , 400, 100, 165, 665, false,"Quark",crew_portraits_cm_quark_jamaharon_sm.png,quark_risa_crew
"Mariachi Q",0,5, 0,0,0,0,0,0,957,170,361,0,0,0,1110,257,537,0,0,0,0,699,0,611,0,550,0,468,0,509,52,375,384,0,328,0,675,0,377,0,528,0,237,0,505,34,392,172,0,162,828,526,"Crafty, Costumed, Scoundrel, Musician, Q Continuum, Playful, Festive","nonhuman, male, tng, q_jdl, crew_max_rarity_5","I Feel Like Celebrating!",1, 8, 8, 10, 10, 3, 0, 2, , , 450, 75, 105, 665, false,"Q",crew_portraits_cm_q_mariachi_sm.png,q_mariachi_crew
"Vengeful L'Rell",0,5, 0,0,0,0,0,0,1047,132,230,0,0,0,1118,190,380,0,0,0,0,692,0,661,0,537,0,509,0,498,69,366,426,0,357,0,958,0,718,0,848,0,554,0,793,184,705,486,0,411,850,1270,"Klingon, Brutal, Villain, Interrogator, Vengeful","nonhuman, organic, female, dsc, lrell, crew_max_rarity_5","Choose Your Pain",0, 10, 10, 14, 12, , , 2, , , 575, 225, 58, 525, false,"L'Rell",crew_portraits_cm_lrell_sm.png,dsc_lrell_mekleth_crew
"Gladiator McCoy",0,5, 0,0,0,0,0,0,1246,180,362,0,0,0,0,0,0,759,270,675,0,546,0,0,413,359,0,0,334,340,563,10,0,257,484,0,659,0,0,46,513,0,0,66,492,722,8,0,24,99,825,245,"Federation, Starfleet, Human, Physician, Desperate, Duelist, Athlete, Prisoner","male, organic, tos, mccoy, crew_max_rarity_5","Let The Games Begin!",0, 9, 6, 8, 12, , , , , , 615, 140, 100, 530, false,"McCoy",crew_portraits_cm_mccoy_gladiator_sm.png,mccoy_gladiator_crew
"Duelist Yar",0,4, 407,16,37,0,0,0,657,292,603,0,0,0,474,103,336,0,0,0,1340,540,1270,905,1152,727,0,1050,0,672,299,542,1024,0,850,1418,217,1359,809,1233,116,0,831,0,122,32,80,755,0,647,1235,380,"Human, Starfleet, Duelist, Federation, Tactician, Desperate, Survivalist, Athlete","female, organic, tng, yar, crew_max_rarity_4","Impressive Skill",1, 6, 10, 6, 12, 7, 1, , , , 580, 265, 187, 200, false,"Yar",crew_portraits_cm_yar_glavin_duel_sm.png,yar_glavin_crew
"Tsunkatse Seven",0,4, 679,124,299,282,92,230,850,150,301,0,0,0,0,0,0,0,0,0,479,272,789,998,646,367,1038,1328,849,685,967,554,0,0,0,220,276,713,952,613,193,681,1028,568,648,916,556,0,0,0,1054,801,"Human, Borg, Brutal, Duelist, Athlete, Federation, Civilian, Prisoner","nonhuman, female, organic, voy, seven, crew_max_rarity_4","Hunt It Down And Kill It",0, 8, 8, 6, 6, , , , , , 400, 200, 110, 525, false,"Seven",crew_portraits_cm_seven_tsunkatse_sm.png,seven_tsunkatse_crew
"EV Suit Archer",0,5, 1210,141,431,0,0,0,882,139,296,527,20,53,0,0,0,0,0,0,378,135,88,613,228,717,926,0,0,228,947,532,1221,739,0,499,181,291,702,334,749,1091,0,0,536,978,603,1405,866,0,722,972,"Human, Starfleet, Pilot, Explorer, Desperate, Jury Rigger, Hero","male, evsuit, organic, ent, archer, crew_max_rarity_5","Now You See Me...",0, 7, 8, 10, 10, , , , , , 575, 225, 189, 290, false,"Archer",crew_portraits_cm_archer_ev_suit_sm.png,archer_ev_suit_crew
"Dr. Gillian Taylor",0,4, 0,0,0,636,236,501,0,0,0,0,0,0,302,71,161,447,187,471,824,0,0,1411,783,796,593,506,104,0,1446,738,1339,528,536,240,0,0,1291,202,230,188,131,8,0,1339,207,1191,109,118,1275,164,"Federation, Starfleet, Human, Physician","female, organic, tos, gillian, crew_max_rarity_4","Sea Shepherd",1, 9, 6, 6, 12, , , 3, , , 650, 230, 95, 500, false,"Dr. Taylor",crew_portraits_cm_taylor_sm.png,gillian_taylor_crew
"Protomorphosis Barclay",0,5, 0,0,0,1169,233,453,488,101,203,1125,43,112,0,0,0,0,0,0,375,1143,570,0,0,71,35,466,213,164,1262,887,614,276,0,300,1060,1283,0,0,78,136,373,181,619,1188,825,1324,829,0,578,879,"Starfleet, Federation, Innovator, Astrophysicist, Desperate, Primal, Human, Compromised","male, organic, tng, barclay, crew_max_rarity_5","Viral Attack",0, 8, 10, 12, 10, , , , , , 575, 300, 70, 225, false,"Barclay",crew_portraits_cm_barclay_protomorphosis_sm.png,barclay_genesis_crew
"Captain Lorian",0,5, 835,157,390,0,0,0,450,136,284,1259,159,399,0,0,0,0,0,0,747,359,32,916,542,1067,289,0,0,92,1242,859,372,123,0,525,201,22,732,355,765,365,0,0,83,1003,624,506,211,0,644,204,"Vulcan, Human, Jury Rigger, Desperate, Saboteur, Telepath","male, nonhuman, organic, ent, lorian, crew_max_rarity_5","There's Too Much At Stake",1, 10, 18, 6, 6, 4, 0, , , , 600, 245, 60, 300, false,"Lorian",crew_portraits_cm_lorian_sm.png,lorian_captain_crew
"Celebratory Ash Tyler",0,4, 649,99,164,0,0,0,484,23,45,0,0,0,814,155,322,0,0,0,952,652,884,364,766,1217,0,834,0,1087,523,971,783,0,641,1107,1003,1065,442,939,1409,0,714,0,1229,723,1128,632,0,530,1107,1381,"Human, Federation, Starfleet, Tactician, Marksman, Pilot, Romantic, Klingon, Festive","male, organic, dsc, tyler, voq, crew_max_rarity_4","I'm not going anywhere",0, 7, 10, 10, 10, 4, 2, , , , 450, 50, 123, 540, false,"Tyler",crew_portraits_cm_dsc_tyler_celebration_sm.png,dsc_tyler_celebration_crew
"Dress Uniform Scotty",0,5, 852,199,458,0,0,0,0,0,0,1274,120,336,0,0,0,0,0,0,664,780,31,856,475,0,296,0,0,368,0,0,395,135,0,323,483,19,544,187,0,482,0,0,643,0,0,692,336,0,841,908,"Human, Starfleet, Federation, Jury Rigger, Communicator, Festive","male, organic, tos, scott, crew_max_rarity_5","Call me Scotty",1, 8, 15, 12, 20, 2, 0, , 2, 2, 425, 330, 315, 415, false,"Scotty",crew_portraits_cm_scott_dress_uniform_sm.png,scott_dress_uniform_crew
"Lieutenant Tarah",0,4, 0,0,0,0,0,0,885,133,310,0,0,0,439,219,445,0,0,0,0,836,0,1110,0,710,0,977,0,661,258,530,955,0,791,0,840,0,547,0,728,0,397,0,681,87,586,309,0,256,1403,937,"Andorian, Imperial Guard, Saboteur, Brutal, Marksman","nonhuman, female, organic, ent, tarah, crew_max_rarity_4","I'll See To It Myself",0, 8, 4, 8, 14, , , , 2, 2, 725, 200, 115, 445, false,"Tarah",crew_portraits_cm_tarah_lieutenant_sm.png,tarah_lieutenant_crew
"Prisoner Katrina Cornwell",0,5, 0,0,0,0,0,0,594,52,118,0,0,0,1049,129,286,1186,163,481,0,1085,0,773,224,1022,0,622,211,926,229,33,534,128,24,0,1294,0,971,218,1328,0,872,205,1160,667,111,805,118,60,404,764,"Starfleet, Federation, Counselor, Human, Desperate, Diplomat, Prisoner","female, organic, dsc, cornwell, crew_max_rarity_5","Why Should I Trust You?",2, 9, 8, 5, 14, 8, 4, , , , 525, 230, 165, 425, false,"Cornwell",crew_portraits_cm_dsc_cornwell_prisoner_sm.png,dsc_cornwell_prisoner_crew
"Away Team Saru",0,5, 543,30,110,1195,155,397,1087,74,149,0,0,0,0,0,0,0,0,0,106,331,1124,1269,999,32,302,481,223,524,803,390,0,0,0,290,950,1300,1420,1179,195,375,592,304,1070,1352,971,0,0,0,625,1293,"Kelpien, Federation, Starfleet, Exobiology, Explorer, Desperate, Communicator","male, nonhuman, organic, dsc, saru, crew_max_rarity_5","A Moment Without Fear",0, 9, 8, 8, 10, , , , , , 475, , 150, 600, false,"Saru",crew_portraits_cm_saru_away_team_sm.png,dsc_saru_away_team_crew
"Expedition Shran",0,3, 251,17,65,0,0,0,362,97,209,0,0,0,552,87,179,0,0,0,1403,973,1336,980,1214,1225,0,1051,0,1093,843,979,1029,0,853,1409,920,1348,1075,1225,978,0,1126,0,901,685,818,1104,0,935,1499,1486,"Andorian, Tactician, Survivalist, Explorer, Investigator, Imperial Guard","nonhuman, male, organic, ent, shran, crew_max_rarity_3","Ice Forges Real Strength",0, 4, 8, 8, 8, 4, 1, , , , 420, 240, 80, 470, false,"Shran",crew_portraits_cm_shran_subzero_sm.png,shran_expedition_crew
"Commander Thelin",0,4, 594,102,243,837,96,217,222,135,295,0,0,0,0,0,0,0,0,0,199,744,903,1107,784,417,591,873,462,1171,1431,1062,0,0,0,333,375,879,1076,759,217,702,1044,584,695,986,610,0,0,0,1258,966,"Andorian, Tactician, Explorer, Starfleet, Federation","nonhuman, male, organic, tas, thelin, crew_max_rarity_4","Target Acquired",2, 7, 10, 8, 12, 7, 0, , , , 500, 145, 70, 475, false,"Thelin",crew_portraits_cm_thelin_sm.png,thelin_crew
"Ambassador Shras",0,4, 638,76,189,0,0,0,372,52,110,0,0,0,929,55,112,0,0,0,962,703,897,401,776,1316,0,855,0,1147,595,1041,804,0,662,1101,864,1062,939,934,1340,0,1324,0,1169,1144,1071,1311,0,1128,1217,1519,"Andorian, Communicator, Federation, Diplomat, Civilian, Ambassador","nonhuman, male, organic, tos, shras, crew_max_rarity_4","We Are A Violent Race",0, 9, 8, 10, 10, , , , , , 650, 195, 140, 375, false,"Shras",crew_portraits_cm_shras_sm.png,shras_ambassador_crew
"Desert Michael Burnham",0,2, 0,0,0,355,78,204,0,0,0,0,0,0,275,24,77,0,0,0,1265,0,0,1438,0,1267,955,947,793,0,1462,0,1368,0,1176,1081,0,0,1456,0,1053,771,919,637,0,1481,0,1382,0,1186,1616,1615,"Federation, Starfleet, Explorer, Xenoanthropology, Human","female, organic, dsc, burnham, crew_max_rarity_2","A Storm is Coming",1, 4, 10, 10, 12, , , , , , 290, 150, 60, 165, false,"Burnham",crew_portraits_cm_burnham_desert_sm.png,dsc_burnham_desert_crew
"Prospect Michael Burnham",0,4, 0,0,0,839,137,382,0,0,0,661,50,143,334,86,174,0,0,0,763,0,916,1385,0,738,144,429,424,865,1405,0,584,534,1111,589,0,1242,1235,0,563,207,259,331,1139,1275,0,709,800,952,1158,1229,"Federation, Civilian, Astrophysicist, Xenoanthropology, Human","female, organic, dsc, burnham, crew_max_rarity_4","Respect Is Earned",1, 5, 8, 8, 10, 8, 4, , , , 500, 130, 150, 350, false,"Burnham",crew_portraits_cm_burnham_prospect_sm.png,dsc_burnham_prospect_crew
"Suus Mahna Sarek",0,5, 0,0,0,389,55,145,1092,246,525,0,0,0,917,155,306,0,0,0,1274,559,0,886,0,105,967,351,803,366,70,247,686,0,573,1301,378,0,875,0,83,977,403,810,203,49,130,672,0,574,742,309,"Vulcan, Diplomat, Desperate, Brutal, Cultural Figure, Communicator, Federation, Telepath, Ambassador","nonhuman, male, organic, sarek, dsc, crew_max_rarity_5","This Is My Mind",1, 7, 10, 8, 12, 1, 0, 2, , , 475, 255, 170, 250, false,"Sarek",crew_portraits_cm_sarek_suus_mahna_sm.png,dsc_sarek_suus_mahna_crew
"Tora Ziyal",0,5, 0,0,0,0,0,0,0,0,0,0,0,0,1147,197,429,849,192,505,0,0,0,641,451,0,0,489,355,0,609,457,413,278,35,0,0,0,614,170,0,0,449,173,0,544,179,367,90,14,848,559,"Cardassian, Bajoran, Romantic, Civilian, Artist","female, nonhuman, organic, ds9, tora, crew_max_rarity_5","Never Doubt",1, 8, 10, 10, 12, , , , , , 650, 170, 170, 490, false,"Ziyal",crew_portraits_cm_tora_ziyal_sm.png,ziyal_tora_crew
"Commander Ellen Landry",0,4, 534,69,238,347,57,111,600,254,669,0,0,0,0,0,0,0,0,0,736,368,996,1170,858,387,1044,1334,852,696,991,574,0,0,0,669,70,964,1135,844,41,1031,1325,853,104,187,67,0,0,0,1272,352,"Human, Starfleet, Federation, Tactician, Brutal, Marksman","female, organic, dsc, landry, crew_max_rarity_4","Stick to Logic",0, 8, 6, 4, 8, , , , , , 650, 345, 220, 300, false,"Landry",crew_portraits_cm_landry_sm.png,dsc_landry_commander_crew
"Lissan",0,5, 876,269,542,0,0,0,0,0,0,0,0,0,1144,267,541,0,0,0,545,669,474,76,354,0,0,440,0,0,555,0,360,0,298,163,339,132,8,86,0,0,224,0,0,303,0,157,0,150,804,157,"Andorian, Aenar, Diplomat, Telepath, Civilian, Communicator","nonhuman, female, organic, ent, lissan, crew_max_rarity_5","You Have An Interesting Mind",1, 7, 10, 12, 8, 6, 2, , , , 590, 225, 65, 540, false,"Lissan",crew_portraits_cm_lissan_sm.png,lissan_crew
"Time Loop Mudd",0,4, 0,0,0,0,0,0,708,31,62,711,158,379,315,125,257,0,0,0,0,1011,764,1324,0,919,599,1254,0,196,754,734,406,424,1064,0,1342,481,1013,0,1398,385,917,0,351,841,1116,90,235,732,1229,1154,"Human, Civilian, Scoundrel, Crafty, Smuggler, Resourceful, Survivalist, Federation, Playful","male, evsuit, organic, dsc, mudd, crew_max_rarity_4","All The Time In The World!",2, 6, 12, 10, 10, 4, 0, , , , 450, 185, 100, 475, false,"Mudd",crew_portraits_cm_harry_mudd_takeover_sm.png,dsc_mudd_takeover_crew
"Mirror Shukar",0,5, 0,0,0,439,102,278,1042,269,623,0,0,0,903,184,378,0,0,0,1169,557,0,853,0,75,876,264,713,360,61,243,641,0,539,880,260,0,724,0,22,595,147,493,123,12,82,496,0,416,633,78,"Andorian, Desperate, Veteran, Civilian, Mirror Universe","nonhuman, male, organic, dsc, shukar, crew_max_rarity_5","The Will Of Andoria",1, 7, 10, 8, 12, 7, 0, , , , 375, 195, 70, 430, false,"Shukar",crew_portraits_cm_shukar_sm.png,dsc_shukar_mirror_crew
"The Caretaker",0,5, 0,0,0,878,187,495,0,0,0,964,335,817,0,0,0,452,122,378,620,0,331,0,843,581,32,663,83,354,0,808,377,19,840,306,0,14,0,452,283,2,378,23,27,0,457,29,1,503,479,23,"Caregiver, Desperate, Explorer, Musician, Nacene, Cultural Figure, Theoretical Engineer","male, organic, voy, nonhuman, caretaker, gauntlet_jackpot, exclusive_gauntlet, crew_max_rarity_5","A Debt of Honor",1, 7, 6, 8, 14, 6, 0, , , , 425, 200, 113, 455, true,"The Caretaker",crew_portraits_cm_caretaker_sm.png,caretaker_crew
"Bajoran Dukat",0,4, 510,208,518,0,0,0,0,0,0,0,0,0,785,202,407,0,0,0,869,940,797,306,657,0,0,805,0,0,973,0,754,0,613,234,420,200,33,133,0,0,476,0,0,592,0,403,0,330,1372,485,"Cardassian, Bajoran, Brutal, Desperate, Veteran, Cultural Figure, Villain, Undercover Operative, Inspiring, Communicator, Spiritual, Vengeful","nonhuman, male, organic, ds9, dukat, crew_max_rarity_4","This Is My Destiny",0, 6, 10, 8, 10, 8, 4, , , , 580, 375, 52, 550, false,"Dukat",crew_portraits_cm_dukat_bajoran_sm.png,dukat_bajoran_crew
"Surgeon Pulaski",0,5, 0,0,0,837,190,545,0,0,0,0,0,0,0,0,0,1289,171,473,641,0,0,0,141,624,457,693,15,0,0,173,0,79,230,242,0,0,0,219,233,192,301,9,0,0,228,0,119,284,806,422,"Federation, Starfleet, Human, Physician","female, organic, tng, pulaski, crew_max_rarity_5","Emergency Procedure",1, 7, 12, 8, 12, 6, 0, , , , 700, 100, 180, 400, false,"Pulaski",crew_portraits_cm_pulaski_surgeon_sm.png,pulaski_surgeon_crew
"Away Team Neelix",0,2, 0,0,0,152,6,26,0,0,0,353,24,80,187,77,240,0,0,0,1419,0,1303,1426,0,1412,921,1244,902,1192,1458,0,976,833,1170,1421,0,1331,1125,0,1412,1059,980,902,1213,1168,0,793,855,832,1607,1578,"Talaxian, Mylean, Resourceful, Survivalist, Chef, Civilian, Communicator, Geologist, Ambassador","nonhuman, male, organic, voy, neelix, crew_max_rarity_2","Genuine Effort",2, 2, 8, 3, 8, 1, 0, , , , 230, 30, 20, 115, false,"Neelix",crew_portraits_cm_neelix_away_team_sm.png,neelix_away_crew
"Resistance Neelix",0,5, 0,0,0,0,0,0,1054,188,381,0,0,0,1154,230,570,0,0,0,0,614,0,581,0,445,0,434,0,415,23,297,354,0,294,0,632,0,369,0,471,0,232,0,445,27,340,166,0,157,789,411,"Civilian, Talaxian, Mylean, Crafty, Saboteur, Smuggler, Undercover Operative, Resourceful, Chef, Ambassador, Courier","nonhuman, male, organic, voy, neelix, crew_max_rarity_5","Vital Information",2, 8, 10, 8, 12, 4, 0, , , , 495, 195, 210, 430, false,"Neelix",crew_portraits_cm_neelix_resistance_sm.png,neelix_resistance_crew
"Victorian Pulaski",0,4, 0,0,0,0,0,0,0,0,0,0,0,0,986,46,111,614,138,321,0,0,0,939,685,0,0,820,502,0,975,674,766,467,96,0,0,0,1407,556,0,0,1336,412,0,1442,548,1322,337,325,1389,1514,"Human, Federation, Starfleet, Physician, Costumed, Crafty","female, organic, tng, pulaski, crew_max_rarity_4","I Give You Credit",1, 6, 12, 10, 18, 2, 0, , , , 600, 315, 127, 290, false,"Pulaski",crew_portraits_cm_pulaski_victorian_sm.png,pulaski_victorian_crew
"Captain Beverly Picard",0,5, 924,165,345,0,0,0,0,0,0,0,0,0,473,119,245,926,303,760,662,777,597,366,10,0,0,1101,230,0,1253,267,1089,152,74,584,699,508,276,1,0,0,943,40,0,1090,31,888,13,8,656,48,"Human, Starfleet, Federation, Physician, Cyberneticist","female, organic, tng, crusher, exclusive_honorhall, crew_max_rarity_5","Not On My Ship!",1, 6, 4, 6, 4, , , , , , 250, 100, 85, 500, true,"Crusher",crew_portraits_cm_crusher_captain_sm.png,crusher_captain_crew
"Xindi Insectoid Councilor",0,5, 0,0,0,1169,64,147,541,111,235,0,0,0,1252,162,332,0,0,0,543,1055,0,612,0,100,402,57,309,891,142,785,385,0,329,1270,983,0,807,0,488,948,341,774,837,264,744,609,0,506,346,1048,"Xindi, Brutal, Diplomat, Desperate","nonhuman, organic, ent, insectoid, crew_max_rarity_5","The Guardians Have Never Lied!",0, 9, 10, 10, 10, , , , 2, 2, 450, 200, 110, 625, false,"Insectoid",crew_portraits_cm_xindi_insectoid_sm.png,xindi_insectoid_counselor_crew
"Martian Quark",0,5, 880,167,369,0,0,0,0,0,0,0,0,0,1249,245,516,0,0,0,708,813,643,91,512,0,0,355,0,0,465,0,266,0,218,539,661,466,40,370,0,0,277,0,0,342,0,206,0,183,817,600,"Ferengi, Scoundrel, Merchant, Resourceful, Gambler, Communicator, Civilian, Smuggler, Desperate, Displaced","nonhuman, male, organic, ds9, quark, crew_max_rarity_5","Stupid Hew-mons",2, 9, 8, 8, 10, , , , , , 275, 140, 137, 650, false,"Quark",crew_portraits_cm_quark_martian_sm.png,quark_martian_crew
"Nurse Faith Garland",0,4, 0,0,0,353,39,113,0,0,0,0,0,0,605,147,315,484,324,747,1348,0,0,1050,609,1338,1045,617,237,0,1106,609,908,408,117,1361,0,0,876,26,1349,1043,471,18,0,884,27,673,12,6,1198,134,"Human, Nurse, Romantic, Communicator","female, organic, ds9, garland, crew_max_rarity_4","Imperative Translation",1, 6, 12, 12, 20, 2, 0, , , , 500, 260, 136, 350, false,"Garland",crew_portraits_cm_faith_garland_sm.png,garland_crew
