crew, tier, rarity, CMD_core, CMD_min, CMD_max, SCI_core, SCI_min, SCI_max, SEC_core, SEC_min, SEC_max, ENG_core, ENG_min, ENG_max, DIP_core, DIP_min, DIP_max, MED_core, MED_min, MED_max, V_CMD_SCI, V_CMD_SEC, V_CMD_ENG, V_CMD_DIP, V_CMD_MED, V_SCI_SEC, V_SCI_ENG, V_SCI_DIP, V_SCI_MED, V_SEC_ENG, V_SEC_DIP, V_SEC_MED, V_ENG_DIP, V_ENG_MED, V_DIP_MED, G_CMD_SCI, G_CMD_SEC, G_CMD_ENG, G_CMD_DIP, G_CMD_MED, G_SCI_SEC, G_SCI_ENG, G_SCI_DIP, G_SCI_MED, G_SEC_ENG, G_SEC_DIP, G_SEC_MED, G_ENG_DIP, G_ENG_MED, G_DIP_MED, voyage_rank, gauntlet_rank, traits, hidden_traits, action_name, action_bonus_type, action_bonus_amount, action_initial_cooldown, action_duration, action_cooldown, bonus_ability, trigger, uses_per_battle, penalty_type, penalty_amount, accuracy, crit_bonus, crit_chance, evasion, charge_phases, short_name, image_name
"UFP President Ra-ghoratreii",8,5, 1021,98,231,0,0,0,558,43,118,0,0,0,1256,181,356,0,0,0,213,130,188,17,155,410,491,136,465,359,70,311,94,427,87,519,395,469,160,431,732,0,311,0,624,242,604,258,0,256,148,545,"Efrosian, Cultural Figure, Federation, President, Diplomat","nonhuman, male, organic, tos, federation_president, crew_max_rarity_5","This President Is Not Above The Law",2, 9, 12, 3, 12, 4, 1, , , , 410, 100, 70, 340, false,"Ra-ghoratreii",crew_portraits_cm_federation_president_sm.png
"Investigator Odo",8,1, 0,0,0,0,0,0,217,37,171,0,0,0,0,0,0,0,0,0,950,906,951,952,952,903,950,951,951,894,904,883,952,952,953,0,664,0,0,0,666,0,0,0,577,733,558,0,0,0,949,943,"Changeling, Cardassian, Investigator, Interrogator","nonhuman, male, organic, ds9, odo, crew_max_rarity_1","Collaboration",2, 1, 20, 14, 10, , , , , , 400, 115, 67, 265, false,"Odo",crew_portraits_cm_odooccupation_sm.png
"Constable Odo",4,3, 317,107,225,0,0,0,523,27,85,0,0,0,0,0,0,0,0,0,781,575,756,804,731,741,905,916,896,685,781,680,917,896,909,514,432,462,569,421,765,0,0,0,653,791,630,0,0,0,852,865,"Changeling, Bajoran, Constable, Investigator, Interrogator","nonhuman, male, organic, ds9, odo, crew_max_rarity_3","Justice",0, 6, 10, 12, 16, , , , 3, 800, 520, 300, 75, , false,"Odo",crew_portraits_cm_odostandard_sm.png
"Jazz Musician Odo",9,5, 0,0,0,0,0,0,754,185,597,0,0,0,1099,195,389,0,0,0,778,391,753,341,728,329,652,283,642,293,52,242,252,614,229,0,199,0,357,0,94,0,261,0,95,18,76,214,0,222,424,242,"Changeling, Bajoran, Constable, Costumed, Romantic, Musician","nonhuman, male, organic, ds9, odo, crew_max_rarity_5","Holosuite Romeo",1, 8, 12, 10, 14, 4, 0, , , , 245, 350, 110, 475, false,"Odo",crew_portraits_cm_odotux_sm.png
"Trader Odo",8,4, 0,0,0,0,0,0,636,73,144,0,0,0,868,109,248,0,0,0,869,598,865,516,852,599,815,501,799,525,267,488,464,801,408,0,656,0,547,0,648,0,507,0,568,359,547,457,0,407,726,817,"Changeling, Costumed, Merchant, Shapeshifter","nonhuman, organic, ds9, odo, crew_max_rarity_4","Tribble Trouble",0, 7, 10, 10, 10, 4, 4, , , , 455, 60, 155, 440, false,"Odo",crew_portraits_cm_odo_tos_sm.png
"Umpire Odo",8,5, 1165,165,351,0,0,0,0,0,0,0,0,0,944,138,302,0,0,0,219,284,197,64,164,770,641,336,628,715,395,710,297,601,259,293,375,232,120,223,0,0,414,0,0,478,0,352,0,331,408,597,"Changeling, Bajoran, Constable, Costumed","nonhuman, male, organic, ds9, odo, niners, crew_max_rarity_5","STRIKE THREE!",0, 8, 6, 8, 10, 3, 0, 2, , , 365, 250, 535, 375, false,"Odo",crew_portraits_cm_odoumpire_sm.png
"Stranded Odo",9,4, 722,188,409,0,0,0,539,54,109,0,0,0,402,50,120,0,0,0,432,250,379,345,349,602,747,655,729,527,461,491,630,725,549,221,215,164,222,160,728,0,712,0,619,577,598,679,0,588,612,616,"Changeling, Desperate, Bajoran, Survivalist","nonhuman, organic, ds9, odo, crew_max_rarity_4","Not Without a Fight",0, 6, 8, 10, 10, 4, 2, , , , 275, 70, 130, 465, false,"Odo",crew_portraits_cm_odo_cold_weather_sm.png
"Zhian'tara Odo",6,5, 899,184,356,0,0,0,535,72,148,0,0,0,1279,113,225,0,0,0,238,138,210,37,179,427,522,164,503,377,75,333,126,464,116,271,216,211,154,204,645,0,532,0,564,375,544,478,0,420,223,474,"Changeling, Communicator, Bajoran, Trill, Constable, Zhian'tara, Investigator","nonhuman, organic, ds9, odo, dax, crew_max_rarity_5","It's Better This Way",0, 6, 6, 10, 12, 4, 0, , , , 580, 225, 5, 440, true,"Odo",crew_portraits_cm_odo_curzon_sm.png
"Gaia Odo",4,2, 0,0,0,0,0,0,260,24,83,0,0,0,384,54,134,0,0,0,928,874,930,832,930,870,921,805,922,866,748,846,792,924,758,0,728,0,716,0,769,0,690,0,660,625,633,661,0,570,898,923,"Changeling, Bajoran, Constable, Romantic, Communicator","nonhuman, male, organic, ds9, odo, crew_max_rarity_2","You Have To Go Home",2, 3, 10, 12, 10, 0, 2, , , , 630, 135, 58, 315, false,"Odo",crew_portraits_cm_odo_future_sm.png
"Army Chaplain Odo",7,4, 342,69,173,0,0,0,628,77,162,0,0,0,764,172,363,0,0,0,648,397,596,337,562,540,701,416,688,469,221,434,370,680,317,632,406,594,214,541,623,0,313,0,542,187,524,260,0,258,544,551,"Changeling, Spiritual, Bajoran, Communicator, Constable, Undercover Operative","nonhuman, organic, ds9, odo, original, crew_max_rarity_4","Mysterious Ways",1, 6, 8, 8, 8, 3, 0, 3, , , 625, 105, 10, 440, false,"Odo",crew_portraits_cm_odo_chaplain_sm.png
"Douglas Pabst",7,4, 761,166,371,365,63,184,0,0,0,0,0,0,594,99,204,0,0,0,226,447,346,228,310,640,428,352,394,772,592,763,532,675,459,98,353,215,172,206,608,395,297,363,0,612,0,531,0,458,530,488,"Writer, Human, Civilian, Communicator, Resourceful","male, organic, ds9, odo, crew_max_rarity_4","Anybody Got Any Ideas?",2, 8, 8, 10, 10, , , , 1, 1, 500, 205, 70, 440, false,"Douglas",crew_portraits_cm_odo_pabst_sm.png
"Helmsman Wyatt",10,5, 1269,326,436,0,0,0,1072,119,242,0,0,0,0,0,0,0,0,0,121,28,99,196,64,267,586,732,569,231,348,204,724,541,668,112,69,84,225,75,457,0,0,0,413,564,392,0,0,0,336,453,"Pilot, Federation, Starfleet, Desperate","male, organic, defiant_helmsman, crew_max_rarity_5","Ramming Speed",0, 6, 8, 5, 10, 1, 1, , , , 540, 200, 152, 400, false,"Wyatt",crew_portraits_cm_defiant_helmsman_sm.png
"Mirror Shukar",6,5, 0,0,0,439,102,278,1042,269,623,0,0,0,903,184,378,0,0,0,434,190,667,316,620,32,308,79,268,107,17,73,224,447,204,455,150,0,380,0,13,290,74,273,56,6,45,234,0,240,194,41,"Andorian, Desperate, Veteran, Civilian, Mirror Universe","nonhuman, male, organic, dsc, mirror, shukar, crew_max_rarity_5","The Will Of Andoria",1, 7, 10, 8, 12, 7, 0, , , , 375, 195, 70, 430, false,"Shukar",crew_portraits_cm_shukar_sm.png
"Dabo Girl Leeta",5,2, 260,24,63,0,0,0,0,0,0,0,0,0,325,38,142,0,0,0,894,891,890,766,879,935,930,834,930,934,853,935,822,932,801,778,739,735,632,685,0,0,703,0,0,754,0,669,0,580,914,927,"Bajoran, Civilian, Bartender, Romantic","female, nonhuman, organic, ds9, leeta, crew_max_rarity_2","Dabo!",2, 2, 0, 10, 14, 4, 0, , , , 95, 250, 41, 220, true,"Leeta",crew_portraits_cm_leetadabo_sm.png
"Mirror Leeta",7,4, 744,150,364,0,0,0,677,76,153,0,0,0,402,32,64,0,0,0,419,202,367,353,332,516,702,653,689,448,406,413,629,681,548,295,219,234,341,225,637,0,770,0,555,587,537,748,0,640,543,674,"Bajoran, Mirror Universe, Romantic, Terran Empire","female, nonhuman, organic, ds9, leeta, crew_max_rarity_4","I Don't Think So",2, 5, 4, 12, 10, 4, 0, 2, , , 575, 275, 148, 350, false,"Leeta",crew_portraits_cm_leeta_mirror_sm.png
"Bartender Guinan",3,5, 0,0,0,0,0,0,528,99,197,0,0,0,948,358,730,811,236,601,692,432,648,197,128,377,479,142,131,336,66,22,101,103,10,0,577,0,69,50,543,0,37,72,485,14,11,19,26,1,111,13,"Communicator, Civilian, Counselor, Marksman, Empath, Bartender, El-Aurian","nonhuman, female, organic, tng, guinan, gauntlet_jackpot, crew_max_rarity_5","I Listen",1, 8, 12, 12, 20, 2, 0, , 2, 3, 515, 175, 80, 655, false,"Guinan",crew_portraits_cm_guinan_mixologist_sm.png
"Fierce Guinan",10,4, 0,0,0,0,0,0,637,104,217,0,0,0,703,244,533,0,0,0,853,568,849,496,837,568,793,469,779,494,225,461,429,781,377,0,545,0,215,0,508,0,123,0,460,54,434,80,0,105,692,475,"Communicator, Counselor, Civilian, Survivalist, Empath, Bartender, El-Aurian, Brutal","nonhuman, female, organic, tng, guinan, crew_max_rarity_4","We've Had Some Dealings",2, 8, 10, 10, 10, , , , 1, 2, 415, 355, 117, 565, false,"Guinan",crew_portraits_cm_guinan_fierce_sm.png
"Gloria",7,5, 879,205,396,0,0,0,0,0,0,0,0,0,1065,278,536,470,99,221,227,295,202,32,22,698,516,155,271,637,202,342,116,230,34,219,312,162,16,36,0,0,102,317,0,162,436,63,291,33,212,57,"Communicator, Civilian, Counselor, Bartender, Empath, Costumed, El-Aurian","nonhuman, female, organic, tng, guinan, crew_max_rarity_5","Gloria From Cleveland",0, 7, 6, 12, 12, 0, 1, , , , 1540, 160, 110, 450, false,"Guinan",crew_portraits_cm_guinan_gloria_sm.png
"Nexus Guinan",7,4, 0,0,0,446,48,94,0,0,0,0,0,0,637,85,140,838,82,241,613,805,793,572,324,622,418,338,156,770,591,312,531,211,122,754,0,0,677,437,744,492,497,228,0,705,432,621,286,247,526,768,"Communicator, Counselor, Civilian, Spiritual, Empath, El-Aurian","nonhuman, female, organic, tng, guinan, crew_max_rarity_4","You Can Go Anywhere, Anytime",1, 9, 8, 8, 10, , , , 2, 3, 305, 165, 168, 450, false,"Guinan",crew_portraits_cm_guinan_nexus_sm.png
"Danara Pel",10,4, 0,0,0,618,48,125,0,0,0,0,0,0,0,0,0,646,151,430,625,888,889,897,469,629,424,635,172,874,886,441,872,304,467,722,0,0,0,179,715,469,711,90,0,0,174,0,122,225,770,736,"Hologram, Physician, Vidiian, Desperate, Geneticist","female, nonhuman, voy, danara, crew_max_rarity_4","Just A Disease",0, 8, 16, 12, 10, , , , , , 750, 210, 175, 340, false,"Danara",crew_portraits_cm_danarapel_sm.png
"Miranda Jones",9,5, 558,33,63,1069,46,105,0,0,0,0,0,0,1118,236,466,0,0,0,76,489,408,106,381,268,207,22,166,644,209,626,123,479,113,624,733,730,194,680,736,482,93,453,0,240,0,115,0,141,250,601,"Human, Communicator, Telepath, Vulcan","female, organic, tos, miranda_jones, crew_max_rarity_5","Violent Emotion is a Kind of Insanity",2, 10, 10, 10, 15, , , , , , 485, 330, 55, 525, false,"Miranda",crew_portraits_cm_miranda_jones_sm.png
"Keyla Detmer",5,4, 864,105,261,0,0,0,341,98,190,602,100,211,0,0,0,0,0,0,378,277,107,455,296,635,361,795,675,286,671,521,525,286,747,476,276,118,537,388,560,341,0,0,184,635,481,520,300,0,508,591,"Starfleet, Federation, Pilot, Human, Explorer, Engineered","female, organic, dsc, bridge_crew, lieutenant, detmer, crew_max_rarity_4","Fly Good",0, 5, 10, 10, 12, 4, 0, , , , 365, 200, 60, 300, false,"Detmer",crew_portraits_cm_detmer_keyla_sm.png
"Navaar",6,5, 1281,155,348,1042,116,257,0,0,0,0,0,0,530,53,140,0,0,0,6,177,88,89,53,186,161,67,129,612,492,582,390,409,335,68,385,257,267,246,443,294,278,280,0,743,0,653,0,564,112,505,"Romantic, Scoundrel, Orion, Casual, Civilian, Crafty","nonhuman, female, ent, navaar, crew_max_rarity_5","You're Just Jealous",1, 10, 8, 6, 10, , , , , , 500, 80, 85, 575, false,"Navaar",crew_portraits_cm_navaar_sm.png
"Rianna Mayweather",5,4, 0,0,0,0,0,0,0,0,0,561,84,177,476,81,164,635,110,251,827,830,528,633,451,820,396,623,330,506,653,422,308,141,249,0,0,569,653,391,0,384,632,287,520,685,393,284,91,200,623,657,"Human, Civilian, Resourceful, Boomer, Communicator, Nurse, Jury Rigger","female, organic, ent, crew_max_rarity_4","Whatever it Takes",1, 5, 12, 12, 20, 2, 0, , , , 400, 575, 345, 1250, false,"Rianna",crew_portraits_cm_riannamayweather_sm.png
"Martia",10,4, 0,0,0,0,0,0,632,100,203,0,0,0,719,175,358,0,0,0,874,590,871,545,858,590,822,533,805,517,288,479,503,807,438,0,568,0,399,0,531,0,316,0,477,150,461,263,0,261,732,679,"Chameloid, Shapeshifter, Crafty, Survivalist, Criminal, Scoundrel, Prisoner","nonhuman, female, organic, martia, tos, crew_max_rarity_4","That Was Not His Knee",1, 6, 14, 10, 14, 7, 1, , , , 475, 325, 235, 529, false,"Martia",crew_portraits_cm_martia_sm.png
"Captain Klaa",9,4, 744,160,341,0,0,0,517,100,251,0,0,0,0,0,0,0,0,0,509,302,455,552,431,628,841,871,826,554,668,516,865,826,847,319,169,258,420,248,471,0,0,0,427,571,403,0,0,0,760,667,"Klingon, Hunter, Tactician, Duelist","nonhuman, male, organic, captain, tos, klaa, crew_max_rarity_4","Warrior's Mettle",0, 6, 12, 8, 14, 0, 2, , , , 650, 250, 125, 525, false,"Klaa",crew_portraits_cm_klaa_sm.png
"Dr. Toby Russell",9,4, 325,130,266,462,108,249,0,0,0,0,0,0,0,0,0,571,204,467,367,636,597,671,235,603,405,610,164,808,840,394,810,261,432,117,474,369,511,18,465,304,508,33,0,0,115,0,70,153,643,194,"Federation, Civilian, Human, Neurologist, Geneticist, Maverick, Physician","female, organic, tng, crew_max_rarity_4","Questionable Ethics",2, 9, 12, 10, 12, , , , 0, 2, 350, 940, 264, 175, false,"Dr. Russell",crew_portraits_cm_tobyrussellscrubs_sm.png
"Talas",5,5, 510,73,159,0,0,0,958,151,327,1273,208,375,0,0,0,0,0,0,415,127,27,478,325,206,105,686,452,11,301,156,76,39,592,647,244,63,669,554,337,186,0,0,21,439,270,215,120,0,113,300,"Andorian, Imperial Guard, Saboteur, Romantic, Tactician, Crafty","nonhuman, female, organic, ent, talas, lieutenant, crew_max_rarity_5","It's Not The Weapon, It's The Soldier",2, 6, 10, 10, 18, 2, 0, , , , 1475, 200, 115, 415, false,"Talas",crew_portraits_cm_talas_sm.png
"Lenara Kahn",10,5, 0,0,0,1246,187,421,0,0,0,0,0,0,997,144,301,0,0,0,154,741,723,376,691,154,140,21,106,689,364,683,278,570,245,211,0,0,473,0,203,167,47,148,0,471,0,349,0,328,365,518,"Trill, Astrophysicist, Romantic","nonhuman, female, organic, ds9, lenara, crew_max_rarity_5","I'm Not Like You",1, 10, 8, 8, 8, , , , , , 315, 200, 150, 490, false,"Lenara",crew_portraits_cm_lenara_kahn_sm.png
"Subcommander T'Rul",6,4, 0,0,0,305,60,158,377,176,559,844,60,97,0,0,0,0,0,0,702,565,430,843,807,363,247,695,478,179,609,456,483,255,779,667,224,678,0,0,46,293,656,391,57,211,91,695,401,0,633,462,"Romulan, Veteran, Resourceful, Tactician","nonhuman, female, organic, trul, tng, commander, crew_max_rarity_4","Not Here To Make Friends",0, 7, 12, 10, 12, 0, 1, , 1, 3, 425, , 223, 340, false,"T'Rul",crew_portraits_cm_trulsubcommander_sm.png
"Ensign Ro",4,2, 322,46,132,0,0,0,0,0,0,0,0,0,0,0,0,0,0,0,893,886,888,896,876,946,946,948,949,946,948,949,948,949,951,716,689,659,724,613,0,0,0,0,0,0,0,0,0,0,944,947,"Starfleet, Bajoran, Resourceful","nonhuman, female, organic, tng, ensign, bridge_crew, ro, crew_max_rarity_2","Separate Ways",0, 4, 3, 10, 5, , , 2, , , 130, 210, 13, 200, false,"Ro",crew_portraits_cm_roensign_sm.png
"Maquis Ro Laren",9,4, 560,102,264,0,0,0,756,139,372,0,0,0,274,132,241,0,0,0,553,220,500,425,471,418,715,656,704,367,354,321,631,698,550,477,156,414,240,389,303,0,492,0,271,128,238,437,0,399,566,339,"Maquis, Bajoran, Survivalist, Saboteur, Desperate","nonhuman, female, organic, tng, ro, crew_max_rarity_4","Not Sure Where I Stand",1, 6, 12, 12, 16, 5, 0, , , , 280, 95, 20, 515, false,"Ro",crew_portraits_cm_ro_maquis_sm.png
"Shinzon",10,5, 819,94,241,0,0,0,938,183,435,0,0,0,546,176,390,0,0,0,329,89,294,161,255,250,568,389,550,220,85,192,336,521,289,509,124,457,140,417,194,0,279,0,171,41,146,229,0,238,316,133,"Human, Clone, Reman, Villain","male, organic, tng, shinzon, crew_max_rarity_5","Destiny Complete",0, 7, 14, 3, 14, 1, 2, , , , 1325, 545, 365, 1050, false,"Shinzon",crew_portraits_cm_shinzon_sm.png
"Will Riker",10,1, 251,42,110,0,0,0,125,22,74,0,0,0,0,0,0,0,0,0,898,844,895,907,886,924,941,943,944,917,924,912,945,945,947,743,622,685,750,645,777,0,0,0,668,803,639,0,0,0,936,929,"Human, Federation, Starfleet, Maverick, Gambler, Romantic, Trill, Ambassador","male, organic, nonhuman, tng, commander, bridge_crew, first_officer, riker, crew_max_rarity_1","Poker Face",0, 1, 8, 10, 14, 4, 0, , , , 455, , 425, 340, false,"Riker",crew_portraits_cm_rikers1_sm.png
"Lt. Thomas Riker",9,1, 0,0,0,0,0,0,250,18,56,198,15,59,0,0,0,0,0,0,942,899,910,945,945,897,888,942,943,807,899,876,905,877,945,0,747,744,0,0,787,526,0,0,634,810,650,763,434,0,934,951,"Human, Federation, Starfleet, Survivalist, Resourceful, Desperate, Romantic","male, organic, tng, lieutenant, riker, crew_max_rarity_1","Wait a Little Longer",1, 1, 0, 10, 14, 6, 0, , , , 230, 100, 120, 95, true,"Riker",crew_portraits_cm_rikerdirty_sm.png
"Commander Riker",7,2, 279,78,191,0,0,0,124,29,89,0,0,0,290,22,64,0,0,0,823,753,817,735,794,891,918,839,913,879,810,867,826,917,808,593,485,556,548,510,762,0,774,0,652,739,628,756,0,646,880,851,"Human, Federation, Starfleet, Pilot, Maverick, Gambler, Romantic","male, organic, tng, commander, bridge_crew, first_officer, riker, crew_max_rarity_2","Liase",0, 2, 8, 10, 14, 5, 0, , , , 645, 50, 295, 275, false,"Riker",crew_portraits_cm_rikerpoker_sm.png
"Admiral Riker",9,5, 947,256,540,0,0,0,827,207,408,0,0,0,351,181,484,0,0,0,178,67,144,111,115,277,548,457,529,238,124,209,417,496,360,94,15,70,13,62,195,0,193,0,175,27,149,137,0,160,279,16,"Human, Federation, Starfleet, Pilot, Maverick, Gambler","male, organic, tng, admiral, bridge_crew, riker, crew_max_rarity_5","Liase",0, 5, 8, 10, 14, 5, 0, , , , 820, 615, 245, 265, false,"Riker",crew_portraits_cm_rikeradmiral_sm.png
"Angel I Riker",9,4, 720,131,304,0,0,0,0,0,0,0,0,0,562,189,430,0,0,0,516,535,461,267,438,857,810,570,796,851,602,837,548,798,472,395,444,327,86,319,0,0,232,0,0,315,0,180,0,190,720,516,"Human, Federation, Starfleet, Pilot, Maverick, Romantic, Gambler","male, organic, tng, commander, bridge_crew, riker, crew_max_rarity_4","Stay Execution",0, 7, 6, 12, 12, 5, 0, 2, , , 150, 75, 200, 265, false,"Riker",crew_portraits_cm_riker_angel_one_sm.png
"Jazz Musician Riker",5,3, 448,114,254,0,0,0,0,0,0,0,0,0,288,67,190,0,0,0,730,726,702,604,663,918,908,794,900,911,827,906,785,901,746,472,500,409,328,383,0,0,616,0,0,668,0,583,0,503,858,798,"Federation, Human, Musician, Starfleet, Pilot, Maverick, Gambler, Romantic","male, organic, tng, bridge_crew, riker, crew_max_rarity_3","Calculated Risk",0, 7, 8, 10, 12, , , , 1, 2, 320, 270, 280, 215, false,"Riker",crew_portraits_cm_rikertrombone_sm.png
"Augment Riker",5,4, 332,63,129,0,0,0,566,106,218,579,204,499,0,0,0,0,0,0,695,420,284,710,606,570,330,820,737,185,617,463,477,252,778,699,376,40,711,602,503,122,0,0,30,588,428,113,59,0,631,376,"Human, Augments, Engineered, Gambler, Desperate, Maverick, Jury Rigger, Survivalist","male, organic, tng, ent, pic, riker, original, crew_max_rarity_4","Last Chance",2, 7, 10, 10, 12, , , , , , 375, 305, 217, 330, false,"Riker",crew_portraits_cm_riker_augment_sm.png
"Age of Sail Riker",6,5, 1034,248,518,0,0,0,897,208,400,572,78,158,0,0,0,0,0,0,145,45,33,233,85,225,281,697,483,46,316,174,362,197,613,110,18,27,224,73,204,407,0,0,73,329,157,609,349,0,186,100,"Human, Federation, Starfleet, Explorer, Maverick, Gambler, Costumed","ageofsail, male, organic, tng, bridge_crew, riker, crew_max_rarity_5","Battle Stations!",0, 10, 8, 10, 12, , , , 1, 2, 350, , 195, 415, false,"Riker",crew_portraits_cm_riker_age_of_sail_sm.png
"First Officer Riker",8,5, 969,106,241,0,0,0,1039,254,588,0,0,0,466,111,211,0,0,0,255,50,226,157,194,138,535,477,514,125,78,90,437,477,384,498,51,441,288,405,77,0,546,0,74,44,57,501,0,436,247,138,"Human, Federation, Starfleet, Desperate, Marksman, Gambler","male, organic, tng, bridge_crew, riker, crew_max_rarity_5","Can't Get Any Worse",2, 9, 6, 6, 6, , , , , , 400, 200, , 515, true,"Riker",crew_portraits_cm_riker_nemesis_sm.png
"Mintakan Riker",8,5, 516,39,73,0,0,0,1036,259,543,0,0,0,925,154,314,0,0,0,477,111,425,164,396,150,547,291,527,141,28,105,259,494,234,769,138,715,364,669,85,0,385,0,87,30,67,318,0,306,274,227,"Human, Federation, Starfleet, Survivalist, Hunter, Costumed, Undercover Operative, Vulcan, Mintakan","male, organic, tng, bridge_crew, riker, crew_max_rarity_5","Proto-Vulcan Instincts",2, 7, 10, 10, 14, 7, 0, , , , 530, 230, 250, 415, false,"Riker",crew_portraits_cm_riker_mintakan_sm.png
"Anbo-jyutsu Riker",9,4, 624,124,263,0,0,0,747,120,255,0,0,0,0,0,0,0,0,0,579,258,526,602,498,529,828,860,810,455,588,421,853,813,834,449,213,382,520,365,440,0,0,0,399,550,376,0,0,0,737,733,"Human, Federation, Starfleet, Duelist, Pilot, Maverick, Romantic, Gambler","male, organic, tng, commander, bridge_crew, first_officer, riker, crew_max_rarity_4","The Ultimate Evolution",1, 7, 14, 12, 14, 5, 0, , , , 315, 230, 135, 415, false,"Riker",crew_portraits_cm_riker_anbo_sm.png
"Chef Riker",5,5, 0,0,0,832,142,304,0,0,0,0,0,0,1276,205,411,529,90,208,272,690,664,183,309,286,219,17,49,629,173,297,79,201,26,381,0,0,335,472,372,250,43,93,0,320,471,182,310,72,180,249,"Human, Federation, Starfleet, Costumed, Chef","male, organic, tng, ent, bridge_crew, riker, crew_max_rarity_5","You've Always Got A Choice",2, 8, 8, 8, 12, 4, 2, , , , 200, 215, 77, 475, false,"Riker",crew_portraits_cm_riker_chef_sm.png
"Desperate Riker",4,4, 898,81,215,0,0,0,386,59,153,505,150,319,0,0,0,0,0,0,379,273,114,458,298,631,367,799,680,291,670,519,534,294,750,554,383,82,602,474,654,237,0,0,129,726,551,319,178,0,516,578,"Human, Federation, Starfleet, Desperate, Brutal, Survivalist, Veteran, Crafty","male, organic, tng, bridge_crew, riker, crew_max_rarity_4","We've Encountered A Quantum Anomaly",0, 6, 6, 8, 10, 0, 1, , , , 400, 170, 60, 530, false,"Riker",crew_portraits_cm_riker_desperate_sm.png
"Riker Q",3,4, 443,14,44,0,0,0,690,42,87,0,0,0,973,46,106,0,0,0,636,390,588,315,552,530,695,402,679,457,200,423,353,666,307,791,681,748,698,698,756,0,730,0,645,647,624,699,0,604,514,908,"Q Continuum, Human, Federation, Starfleet, Pilot, Maverick, Gambler, Romantic","male, organic, tng, bridge_crew, riker, crew_max_rarity_4","And That's Not All",2, 7, 8, 10, 10, , , , , , 580, 225, 130, 415, false,"Riker",crew_portraits_cm_riker_q_sm.png
"Protomorphosis Riker",7,4, 665,57,159,0,0,0,892,157,331,0,0,0,0,0,0,0,0,0,573,200,522,600,493,396,782,840,772,352,481,300,829,772,809,671,247,622,688,576,325,0,0,0,289,430,258,0,0,0,684,761,"Human, Federation, Starfleet, Brutal, Gambler, Primal, Desperate","male, organic, tng, bridge_crew, riker, crew_max_rarity_4","Devolution",0, 7, 6, 8, 14, 1, 0, , 2, 3, 350, 125, 132, 125, false,"Riker",crew_portraits_cm_riker_caveman_sm.png
"Little John Riker",3,5, 1023,128,239,0,0,0,1309,192,354,0,0,0,422,113,245,0,0,0,200,12,168,141,137,86,480,461,451,80,62,45,421,410,365,473,140,410,248,384,259,0,505,0,236,116,201,456,0,406,110,319,"Human, Federation, Starfleet, Costumed, Thief","male, organic, tng, bridge_crew, riker, crew_max_rarity_5","We Need a Diversion",0, 6, 10, 8, 16, 2, 0, , , , 515, 200, 125, 425, false,"Riker",crew_portraits_cm_riker_littlejohn_sm.png
"Captain Morgan Bateson",10,5, 1074,218,498,0,0,0,986,117,244,0,0,0,447,94,186,0,0,0,150,53,124,110,91,265,541,500,521,229,133,202,463,488,407,138,79,104,106,93,458,0,595,0,414,296,394,557,0,481,268,253,"Federation, Starfleet, Human, Casual","male, organic, tng, captain, bridge_crew, bateson, crew_max_rarity_5","Surprise Attack",0, 8, 12, 10, 14, 8, 4, , , , 150, 30, 190, 590, false,"Bateson",crew_portraits_cm_bateson_sm.png
"Loken",6,5, 0,0,0,1005,129,306,0,0,0,1311,152,313,0,0,0,553,26,64,196,678,85,711,357,200,14,224,38,87,727,345,86,10,376,396,0,293,0,684,386,66,420,187,305,0,644,323,134,644,129,574,"Innovator, Undercover Operative, Kraylor","nonhuman, organic, voy, loken, crew_max_rarity_5","It's Perfect",2, 7, 8, 4, 12, 1, 2, , , , 200, 240, 150, 100, false,"Loken",crew_portraits_cm_loken_sm.png
"Edith Keeler",9,4, 0,0,0,0,0,0,0,0,0,0,0,0,453,166,339,591,187,590,888,881,885,645,440,878,843,631,317,872,663,414,609,279,228,0,0,0,418,67,0,0,345,82,0,418,78,285,35,12,763,312,"Civilian, Caregiver, Inspiring, Cultural Figure, Romantic, Human","female, organic, tos, keeler, crew_max_rarity_4","A Life Worth Living",1, 7, 8, 10, 8, , , , , , 690, 25, 52, 440, false,"Keeler",crew_portraits_cm_edithkeeler_sm.png
"Ensign Tuvok",8,1, 0,0,0,181,51,197,0,0,0,0,0,0,138,33,74,0,0,0,905,944,944,927,947,896,870,831,857,942,917,946,915,946,907,621,0,0,784,0,605,394,511,362,0,797,0,740,0,634,938,900,"Vulcan, Federation, Starfleet, Telepath","nonhuman, male, organic, voy, ensign, bridge_crew, tuvok, crew_max_rarity_1","Memory",0, 1, 1, 14, 10, , , , , , 103, 60, 135, 375, false,"Tuvok",crew_portraits_cm_tuvokensign_sm.png
"Security Chief Tuvok",5,3, 291,53,161,145,45,149,445,85,201,0,0,0,0,0,0,0,0,0,718,583,767,813,741,642,775,836,766,660,760,650,906,878,895,422,389,627,693,581,333,441,684,420,499,641,483,0,0,0,827,764,"Vulcan, Federation, Starfleet, Telepath, Tactician, Investigator","nonhuman, male, organic, voy, lieutenant_commander, bridge_crew, tuvok, crew_max_rarity_3","Contingency Plan",0, 4, 10, 12, 16, 5, 0, , , , 465, 50, , 300, false,"Tuvok",crew_portraits_cm_tuvokrifle_sm.png
"Disguised Tuvok",6,4, 293,68,194,691,146,408,419,202,399,0,0,0,0,0,0,0,0,0,300,421,651,707,602,173,325,492,285,496,618,464,808,733,775,89,163,565,634,517,20,205,292,175,183,334,163,0,0,0,620,199,"Vulcan, Federation, Starfleet, Telepath, Resourceful, Costumed, Tactician","nonhuman, male, organic, voy, lieutenant_commander, bridge_crew, tuvok, crew_max_rarity_4","Ethics of Time Travel",0, 6, 12, 12, 16, 5, 0, , , , 565, 255, 90, 225, false,"Tuvok",crew_portraits_cm_tuvok20c_sm.png
"Assimilated Tuvok",3,4, 544,139,318,279,113,277,834,107,218,0,0,0,0,0,0,0,0,0,333,212,472,567,450,271,436,646,401,369,505,323,788,683,755,79,200,303,463,297,131,282,473,268,454,589,429,0,0,0,545,411,"Vulcan, Borg, Telepath, Brutal, Tactician, Undercover Operative","nonhuman, male, organic, voy, tuvok, crew_max_rarity_4","Resistance is Illogical!",0, 9, 14, 20, 12, , , 1, , , 650, 200, 135, 425, false,"Tuvok",crew_portraits_cm_tuvok_assimilated_sm.png
"Maquis Tuvok",7,5, 493,88,296,826,163,415,1170,139,344,0,0,0,0,0,0,0,0,0,69,98,361,479,328,12,214,298,174,144,236,110,693,485,631,48,159,389,523,367,27,189,268,165,295,436,266,0,0,0,261,182,"Vulcan, Maquis, Telepath, Costumed, Tactician, Undercover Operative","nonhuman, male, organic, voy, tuvok, crew_max_rarity_5","Et Tuvok",0, 8, 10, 3, 14, 4, 1, , , , 450, 100, 65, 375, false,"Tuvok",crew_portraits_cm_tuvok_maquis_sm.png
"Warship Tuvok",6,5, 936,166,342,0,0,0,1281,112,276,0,0,0,0,0,0,0,0,0,304,66,278,397,240,181,625,764,614,176,279,142,754,587,703,306,147,242,415,232,425,0,0,0,384,534,365,0,0,0,390,640,"Vulcan, Hologram, Telepath, Brutal, Tactician, Starfleet, Federation","nonhuman, male, organic, voy, tuvok, crew_max_rarity_5","Fatality Rate Increasing!",0, 7, 10, 3, 15, 1, 1, , , , 425, 300, 195, 550, false,"Tuvok",crew_portraits_cm_tuvok_warship_sm.png
