crew, tier, rarity, CMD_core, CMD_min, CMD_max, SCI_core, SCI_min, SCI_max, SEC_core, SEC_min, SEC_max, ENG_core, ENG_min, ENG_max, DIP_core, DIP_min, DIP_max, MED_core, MED_min, MED_max, V_CMD_SCI, V_CMD_SEC, V_CMD_ENG, V_CMD_DIP, V_CMD_MED, V_SCI_SEC, V_SCI_ENG, V_SCI_DIP, V_SCI_MED, V_SEC_ENG, V_SEC_DIP, V_SEC_MED, V_ENG_DIP, V_ENG_MED, V_DIP_MED, G_CMD_SCI, G_CMD_SEC, G_CMD_ENG, G_CMD_DIP, G_CMD_MED, G_SCI_SEC, G_SCI_ENG, G_SCI_DIP, G_SCI_MED, G_SEC_ENG, G_SEC_DIP, G_SEC_MED, G_ENG_DIP, G_ENG_MED, G_DIP_MED, voyage_rank, gauntlet_rank, traits, hidden_traits, action_name, action_bonus_type, action_bonus_amount, action_initial_cooldown, action_duration, action_cooldown, bonus_ability, trigger, uses_per_battle, penalty_type, penalty_amount, accuracy, crit_bonus, crit_chance, evasion, charge_phases, short_name, image_name
"UFP President Ra-ghoratreii",8,5, 1021,98,231,0,0,0,558,43,118,0,0,0,1256,181,356,0,0,0,209,129,184,16,151,403,477,128,451,352,67,305,90,414,82,512,392,462,157,425,721,0,302,0,616,239,593,253,0,248,140,536,"Efrosian, Cultural Figure, Federation, President, Diplomat","nonhuman, male, organic, tos, federation_president, crew_max_rarity_5","This President Is Not Above The Law",2, 9, 12, 3, 12, 4, 1, , , , 410, 100, 70, 340, false,"Ra-ghoratreii",crew_portraits_cm_federation_president_sm.png
"Investigator Odo",8,1, 0,0,0,0,0,0,217,37,171,0,0,0,0,0,0,0,0,0,934,890,935,936,936,887,934,935,935,878,888,867,936,936,937,0,655,0,0,0,657,0,0,0,569,719,548,0,0,0,933,927,"Changeling, Cardassian, Investigator, Interrogator","nonhuman, male, organic, ds9, odo, crew_max_rarity_1","Collaboration",2, 1, 20, 14, 10, , , , , , 400, 115, 67, 265, false,"Odo",crew_portraits_cm_odooccupation_sm.png
"Constable Odo",4,3, 317,107,225,0,0,0,523,27,85,0,0,0,0,0,0,0,0,0,766,566,743,789,717,726,889,900,880,674,766,666,901,880,893,507,429,455,556,415,754,0,0,0,645,776,618,0,0,0,836,849,"Changeling, Bajoran, Constable, Investigator, Interrogator","nonhuman, male, organic, ds9, odo, crew_max_rarity_3","Justice",0, 6, 10, 12, 16, , , , 3, 800, 520, 300, 75, , false,"Odo",crew_portraits_cm_odostandard_sm.png
"Jazz Musician Odo",9,5, 0,0,0,0,0,0,754,185,597,0,0,0,1099,195,389,0,0,0,763,387,740,331,714,323,637,271,626,287,49,238,243,600,219,0,198,0,351,0,92,0,253,0,93,18,74,209,0,215,414,237,"Changeling, Bajoran, Constable, Costumed, Romantic, Musician","nonhuman, male, organic, ds9, odo, crew_max_rarity_5","Holosuite Romeo",1, 8, 12, 10, 14, 4, 0, , , , 245, 350, 110, 475, false,"Odo",crew_portraits_cm_odotux_sm.png
"Trader Odo",8,4, 0,0,0,0,0,0,636,73,144,0,0,0,868,109,248,0,0,0,853,589,849,503,836,589,799,487,783,517,261,478,451,785,396,0,647,0,534,0,639,0,494,0,560,353,537,445,0,396,710,801,"Changeling, Costumed, Merchant, Shapeshifter","nonhuman, organic, ds9, odo, crew_max_rarity_4","Tribble Trouble",0, 7, 10, 10, 10, 4, 4, , , , 455, 60, 155, 440, false,"Odo",crew_portraits_cm_odo_tos_sm.png
"Umpire Odo",8,5, 1165,165,351,0,0,0,0,0,0,0,0,0,944,138,302,0,0,0,215,281,193,63,160,755,626,324,612,704,387,696,288,587,249,289,372,229,118,219,0,0,403,0,0,470,0,344,0,321,398,588,"Changeling, Bajoran, Constable, Costumed","nonhuman, male, organic, ds9, odo, niners, crew_max_rarity_5","STRIKE THREE!",0, 8, 6, 8, 10, 3, 0, 2, , , 365, 250, 535, 375, false,"Odo",crew_portraits_cm_odoumpire_sm.png
"Stranded Odo",9,4, 722,188,409,0,0,0,539,54,109,0,0,0,402,50,120,0,0,0,423,247,370,335,340,592,732,639,713,519,451,481,616,710,536,219,214,161,219,158,717,0,696,0,611,566,587,665,0,575,598,607,"Changeling, Desperate, Bajoran, Survivalist","nonhuman, organic, ds9, odo, crew_max_rarity_4","Not Without a Fight",0, 6, 8, 10, 10, 4, 2, , , , 275, 70, 130, 465, false,"Odo",crew_portraits_cm_odo_cold_weather_sm.png
"Zhian’tara Odo",4,5, 899,184,356,0,0,0,535,72,148,0,0,0,1279,113,225,0,0,0,233,136,206,36,175,420,508,155,489,370,72,325,122,451,109,267,215,208,151,201,636,0,519,0,556,369,535,466,0,409,215,465,"Changeling, Communicator, Bajoran, Trill, Constable, Zhian'tara, Investigator","nonhuman, organic, ds9, odo, dax, crew_max_rarity_5","It's Better This Way",0, 6, 6, 10, 12, 4, 0, , , , 580, 225, 5, 440, true,"Odo",crew_portraits_cm_odo_curzon_sm.png
"Gaia Odo",4,2, 0,0,0,0,0,0,260,24,83,0,0,0,384,54,134,0,0,0,912,858,914,816,914,854,905,789,906,850,733,830,777,908,742,0,717,0,703,0,758,0,675,0,652,613,621,647,0,557,882,907,"Changeling, Bajoran, Constable, Romantic, Communicator","nonhuman, male, organic, ds9, odo, crew_max_rarity_2","You Have To Go Home",2, 3, 10, 12, 10, 0, 2, , , , 630, 135, 58, 315, false,"Odo",crew_portraits_cm_odo_future_sm.png
"Army Chaplain Odo",7,4, 342,69,173,0,0,0,628,77,162,0,0,0,764,172,363,0,0,0,636,393,587,327,551,531,686,403,672,461,215,425,358,665,306,622,403,585,211,532,615,0,304,0,535,185,516,255,0,250,531,542,"Changeling, Spiritual, Bajoran, Communicator, Constable, Undercover Operative","nonhuman, organic, ds9, odo, original, crew_max_rarity_4","Mysterious Ways",1, 6, 8, 8, 8, 3, 0, 3, , , 625, 105, 10, 440, false,"Odo",crew_portraits_cm_odo_chaplain_sm.png
"Douglas Pabst",7,4, 761,166,371,365,63,184,0,0,0,0,0,0,594,99,204,0,0,0,222,441,339,222,304,630,419,340,383,760,579,749,519,661,447,97,350,212,169,203,600,387,289,353,0,601,0,519,0,447,518,479,"Writer, Human, Civilian, Communicator, Resourceful","male, organic, ds9, odo, crew_max_rarity_4","Anybody Got Any Ideas?",2, 8, 8, 10, 10, , , , 1, 1, 500, 205, 70, 440, false,"Douglas",crew_portraits_cm_odo_pabst_sm.png
"Helmsman Wyatt",10,5, 1269,326,436,0,0,0,1072,119,242,0,0,0,0,0,0,0,0,0,117,28,97,191,62,263,572,716,555,227,340,201,709,528,653,111,68,84,222,73,452,0,0,0,408,554,387,0,0,0,328,444,"Pilot, Federation, Starfleet, Desperate","male, organic, defiant_helmsman, crew_max_rarity_5","Ramming Speed",0, 6, 8, 5, 10, 1, 1, , , , 540, 200, 152, 400, false,"Wyatt",crew_portraits_cm_defiant_helmsman_sm.png
"Mirror Shukar",6,5, 0,0,0,439,102,278,1042,269,623,0,0,0,903,184,378,0,0,0,425,187,655,306,608,30,302,78,260,105,16,71,215,434,194,450,149,0,374,0,13,284,73,265,55,6,44,229,0,232,186,41,"Andorian, Desperate, Veteran, Civilian, Mirror Universe","nonhuman, male, organic, dsc, mirror, shukar, crew_max_rarity_5","The Will Of Andoria",1, 7, 10, 8, 12, 7, 0, , , , 375, 195, 70, 430, false,"Shukar",crew_portraits_cm_shukar_sm.png
"Dabo Girl Leeta",5,2, 260,24,63,0,0,0,0,0,0,0,0,0,325,38,142,0,0,0,878,875,874,751,863,919,914,818,914,918,837,919,806,916,785,766,728,725,619,674,0,0,688,0,0,740,0,655,0,567,898,911,"Bajoran, Civilian, Bartender, Romantic","female, nonhuman, organic, ds9, leeta, crew_max_rarity_2","Dabo!",2, 2, 0, 10, 14, 4, 0, , , , 95, 250, 41, 220, true,"Leeta",crew_portraits_cm_leetadabo_sm.png
"Mirror Leeta",9,4, 744,150,364,0,0,0,677,76,153,0,0,0,402,32,64,0,0,0,410,199,358,343,324,508,687,637,673,440,398,404,615,666,535,291,218,231,336,221,628,0,754,0,547,576,528,734,0,627,530,663,"Bajoran, Mirror Universe, Romantic, Terran Empire","female, nonhuman, organic, ds9, leeta, crew_max_rarity_4","I Don't Think So",2, 5, 4, 12, 10, 4, 0, 2, , , 575, 275, 148, 350, false,"Leeta",crew_portraits_cm_leeta_mirror_sm.png
"Bartender Guinan",4,5, 0,0,0,0,0,0,528,99,197,0,0,0,948,358,730,811,236,601,679,427,636,192,125,371,465,134,126,330,63,21,97,102,8,0,572,0,69,48,537,0,36,71,480,14,11,18,26,1,104,13,"Communicator, Civilian, Counselor, Marksman, Empath, Bartender, El-Aurian","nonhuman, female, organic, tng, guinan, gauntlet_jackpot, crew_max_rarity_5","I Listen",1, 8, 12, 12, 20, 2, 0, , 2, 3, 515, 175, 80, 655, false,"Guinan",crew_portraits_cm_guinan_mixologist_sm.png
"Fierce Guinan",10,4, 0,0,0,0,0,0,637,104,217,0,0,0,703,244,533,0,0,0,837,559,833,484,821,558,777,456,763,486,219,451,417,765,365,0,541,0,212,0,502,0,121,0,455,53,429,78,0,101,676,466,"Communicator, Counselor, Civilian, Survivalist, Empath, Bartender, El-Aurian, Brutal","nonhuman, female, organic, tng, guinan, crew_max_rarity_4","We've Had Some Dealings",2, 8, 10, 10, 10, , , , 1, 2, 415, 355, 117, 565, false,"Guinan",crew_portraits_cm_guinan_fierce_sm.png
"Gloria",6,5, 879,205,396,0,0,0,0,0,0,0,0,0,1065,278,536,470,99,221,223,292,198,31,20,684,502,147,263,626,197,334,112,221,32,217,309,159,16,34,0,0,100,308,0,160,431,61,283,31,204,57,"Communicator, Civilian, Counselor, Bartender, Empath, Costumed, El-Aurian","nonhuman, female, organic, tng, guinan, crew_max_rarity_5","Gloria From Cleveland",0, 7, 6, 12, 12, 0, 1, , , , 1540, 160, 110, 450, false,"Guinan",crew_portraits_cm_guinan_gloria_sm.png
"Nexus Guinan",7,4, 0,0,0,446,48,94,0,0,0,0,0,0,637,85,140,838,82,241,601,791,779,559,316,612,409,326,150,758,578,306,518,204,115,742,0,0,664,431,733,482,485,221,0,692,427,608,278,239,514,753,"Communicator, Counselor, Civilian, Spiritual, Empath, El-Aurian","nonhuman, female, organic, tng, guinan, crew_max_rarity_4","You Can Go Anywhere, Anytime",1, 9, 8, 8, 10, , , , 2, 3, 305, 165, 168, 450, false,"Guinan",crew_portraits_cm_guinan_nexus_sm.png
"Danara Pel",10,4, 0,0,0,618,48,125,0,0,0,0,0,0,0,0,0,646,151,430,613,872,873,881,460,619,415,619,166,858,870,432,856,295,454,710,0,0,0,176,704,459,695,89,0,0,171,0,120,218,754,721,"Hologram, Physician, Vidiian, Desperate, Geneticist","female, nonhuman, voy, danara, crew_max_rarity_4","Just A Disease",0, 8, 16, 12, 10, , , , , , 750, 210, 175, 340, false,"Danara",crew_portraits_cm_danarapel_sm.png
"Miranda Jones",9,5, 558,33,63,1069,46,105,0,0,0,0,0,0,1118,236,466,0,0,0,75,480,399,103,372,264,202,21,160,633,203,613,119,466,107,614,722,720,191,669,725,472,91,441,0,237,0,112,0,136,242,592,"Human, Communicator, Telepath, Vulcan","female, organic, tos, miranda_jones, crew_max_rarity_5","Violent Emotion is a Kind of Insanity",2, 10, 10, 10, 15, , , , , , 485, 330, 55, 525, false,"Miranda",crew_portraits_cm_miranda_jones_sm.png
"Keyla Detmer",5,4, 864,105,261,0,0,0,341,98,190,602,100,211,0,0,0,0,0,0,371,274,105,443,290,625,353,779,659,280,656,509,512,277,731,470,274,117,525,383,554,334,0,0,182,623,475,508,292,0,496,582,"Starfleet, Federation, Pilot, Human, Explorer, Engineered","female, organic, dsc, bridge_crew, lieutenant, detmer, crew_max_rarity_4","Fly Good",0, 5, 10, 10, 12, 4, 0, , , , 365, 200, 60, 300, false,"Detmer",crew_portraits_cm_detmer_keyla_sm.png
"Navaar",6,5, 1281,155,348,1042,116,257,0,0,0,0,0,0,530,53,140,0,0,0,6,174,86,86,51,182,157,66,124,601,481,569,378,397,323,67,382,254,263,242,438,288,270,272,0,729,0,639,0,551,105,496,"Romantic, Scoundrel, Orion, Casual, Civilian, Crafty","nonhuman, female, ent, navaar, crew_max_rarity_5","You're Just Jealous",1, 10, 8, 6, 10, , , , , , 500, 80, 85, 575, false,"Navaar",crew_portraits_cm_navaar_sm.png
"Rianna Mayweather",5,4, 0,0,0,0,0,0,0,0,0,561,84,177,476,81,164,635,110,251,812,816,519,620,442,805,387,607,320,498,639,413,299,137,239,0,0,560,640,386,0,377,619,279,514,672,388,277,89,193,609,648,"Human, Civilian, Resourceful, Boomer, Communicator, Nurse, Jury Rigger","female, organic, ent, crew_max_rarity_4","Whatever it Takes",1, 5, 12, 12, 20, 2, 0, , , , 400, 575, 345, 1250, false,"Rianna",crew_portraits_cm_riannamayweather_sm.png
"Martia",10,4, 0,0,0,0,0,0,632,100,203,0,0,0,719,175,358,0,0,0,858,581,855,532,842,580,806,519,789,509,281,469,490,791,426,0,563,0,392,0,525,0,307,0,472,148,455,258,0,253,716,668,"Chameloid, Shapeshifter, Crafty, Survivalist, Criminal, Scoundrel, Prisoner","nonhuman, female, organic, martia, tos, crew_max_rarity_4","That Was Not His Knee",1, 6, 14, 10, 14, 7, 1, , , , 475, 325, 235, 529, false,"Martia",crew_portraits_cm_martia_sm.png
"Captain Klaa",9,4, 744,160,341,0,0,0,517,100,251,0,0,0,0,0,0,0,0,0,499,299,446,539,422,618,825,855,810,546,653,505,849,810,831,315,168,255,411,244,466,0,0,0,422,560,398,0,0,0,744,657,"Klingon, Hunter, Tactician, Duelist","nonhuman, male, organic, captain, tos, klaa, crew_max_rarity_4","Warrior's Mettle",0, 6, 12, 8, 14, 0, 2, , , , 650, 250, 125, 525, false,"Klaa",crew_portraits_cm_klaa_sm.png
"Dr. Toby Russell",9,4, 325,130,266,462,108,249,0,0,0,0,0,0,0,0,0,571,204,467,360,626,588,658,230,593,396,594,158,794,824,385,794,252,420,116,471,365,500,18,460,298,495,33,0,0,113,0,69,147,629,191,"Federation, Civilian, Human, Neurologist, Geneticist, Maverick, Physician","female, organic, tng, crew_max_rarity_4","Questionable Ethics",2, 9, 12, 10, 12, , , , 0, 2, 350, 940, 264, 175, false,"Dr. Russell",crew_portraits_cm_tobyrussellscrubs_sm.png
"Talas",5,5, 510,73,159,0,0,0,958,151,327,1273,208,375,0,0,0,0,0,0,406,126,27,466,317,202,102,670,438,11,293,154,72,39,578,637,243,63,656,545,333,183,0,0,21,431,267,210,118,0,106,293,"Andorian, Imperial Guard, Saboteur, Romantic, Tactician, Crafty","nonhuman, female, organic, ent, talas, lieutenant, crew_max_rarity_5","It's Not The Weapon, It's The Soldier",2, 6, 10, 10, 18, 2, 0, , , , 1475, 200, 115, 415, false,"Talas",crew_portraits_cm_talas_sm.png
"Lenara Kahn",10,5, 0,0,0,1246,187,421,0,0,0,0,0,0,997,144,301,0,0,0,150,728,711,366,678,150,136,20,102,678,356,669,269,557,235,209,0,0,463,0,200,166,46,145,0,463,0,341,0,318,356,509,"Trill, Astrophysicist, Romantic","nonhuman, female, organic, ds9, lenara, crew_max_rarity_5","I'm Not Like You",1, 10, 8, 8, 8, , , , , , 315, 200, 150, 490, false,"Lenara",crew_portraits_cm_lenara_kahn_sm.png
"Subcommander T'Rul",6,4, 0,0,0,305,60,158,377,176,559,844,60,97,0,0,0,0,0,0,689,556,421,827,792,357,241,679,464,177,595,446,470,246,763,657,223,669,0,0,45,287,642,381,56,209,89,681,390,0,619,453,"Romulan, Veteran, Resourceful, Tactician","nonhuman, female, organic, trul, tng, commander, crew_max_rarity_4","Not Here To Make Friends",0, 7, 12, 10, 12, 0, 1, , 1, 3, 425, , 223, 340, false,"T'Rul",crew_portraits_cm_trulsubcommander_sm.png
"Ensign Ro",4,2, 322,46,132,0,0,0,0,0,0,0,0,0,0,0,0,0,0,0,877,870,872,880,860,930,930,932,933,930,932,933,932,933,935,704,680,650,711,603,0,0,0,0,0,0,0,0,0,0,928,931,"Starfleet, Bajoran, Resourceful","nonhuman, female, organic, tng, ensign, bridge_crew, ro, crew_max_rarity_2","Separate Ways",0, 4, 3, 10, 5, , , 2, , , 130, 210, 13, 200, false,"Ro",crew_portraits_cm_roensign_sm.png
"Maquis Ro Laren",9,4, 560,102,264,0,0,0,756,139,372,0,0,0,274,132,241,0,0,0,541,217,491,415,462,411,700,640,688,360,346,314,617,683,537,471,155,408,237,384,299,0,480,0,268,126,235,427,0,388,553,332,"Maquis, Bajoran, Survivalist, Saboteur, Desperate","nonhuman, female, organic, tng, ro, crew_max_rarity_4","Not Sure Where I Stand",1, 6, 12, 12, 16, 5, 0, , , , 280, 95, 20, 515, false,"Ro",crew_portraits_cm_ro_maquis_sm.png
"Shinzon",10,5, 819,94,241,0,0,0,938,183,435,0,0,0,546,176,390,0,0,0,324,88,289,157,250,246,554,376,536,216,82,189,326,508,279,503,123,450,138,411,191,0,271,0,169,40,143,224,0,230,308,132,"Human, Clone, Reman, Villain","male, organic, tng, shinzon, crew_max_rarity_5","Destiny Complete",0, 7, 14, 3, 14, 1, 2, , , , 1325, 545, 365, 1050, false,"Shinzon",crew_portraits_cm_shinzon_sm.png
"Will Riker",10,1, 251,42,110,0,0,0,125,22,74,0,0,0,0,0,0,0,0,0,882,829,879,891,870,908,925,927,928,901,908,896,929,929,931,731,616,675,736,634,766,0,0,0,660,788,627,0,0,0,920,913,"Human, Federation, Starfleet, Maverick, Gambler, Romantic, Trill, Ambassador","male, organic, nonhuman, tng, commander, bridge_crew, first_officer, riker, crew_max_rarity_1","Poker Face",0, 1, 8, 10, 14, 4, 0, , , , 455, , 425, 340, false,"Riker",crew_portraits_cm_rikers1_sm.png
"Lt. Thomas Riker",9,1, 0,0,0,0,0,0,250,18,56,198,15,59,0,0,0,0,0,0,926,883,894,929,929,881,872,926,927,793,883,860,889,861,929,0,736,734,0,0,776,516,0,0,626,795,638,749,423,0,918,935,"Human, Federation, Starfleet, Survivalist, Resourceful, Desperate, Romantic","male, organic, tng, lieutenant, riker, crew_max_rarity_1","Wait a Little Longer",1, 1, 0, 10, 14, 6, 0, , , , 230, 100, 120, 95, true,"Riker",crew_portraits_cm_rikerdirty_sm.png
"Commander Riker",7,2, 279,78,191,0,0,0,124,29,89,0,0,0,290,22,64,0,0,0,808,740,803,720,779,875,902,823,897,863,795,851,810,901,792,584,482,547,535,501,751,0,758,0,644,725,616,742,0,633,864,835,"Human, Federation, Starfleet, Pilot, Maverick, Gambler, Romantic","male, organic, tng, commander, bridge_crew, first_officer, riker, crew_max_rarity_2","Liase",0, 2, 8, 10, 14, 5, 0, , , , 645, 50, 295, 275, false,"Riker",crew_portraits_cm_rikerpoker_sm.png
"Admiral Riker",9,5, 947,256,540,0,0,0,827,207,408,0,0,0,351,181,484,0,0,0,174,66,142,107,112,273,534,444,515,233,121,206,405,483,348,93,15,70,13,60,192,0,189,0,173,27,146,134,0,154,271,16,"Human, Federation, Starfleet, Pilot, Maverick, Gambler","male, organic, tng, admiral, bridge_crew, riker, crew_max_rarity_5","Liase",0, 5, 8, 10, 14, 5, 0, , , , 820, 615, 245, 265, false,"Riker",crew_portraits_cm_rikeradmiral_sm.png
"Angel I Riker",9,4, 720,131,304,0,0,0,0,0,0,0,0,0,562,189,430,0,0,0,506,526,452,259,429,841,794,555,780,835,588,821,534,782,459,390,441,323,86,314,0,0,225,0,0,309,0,175,0,183,704,507,"Human, Federation, Starfleet, Pilot, Maverick, Romantic, Gambler","male, organic, tng, commander, bridge_crew, riker, crew_max_rarity_4","Stay Execution",0, 7, 6, 12, 12, 5, 0, 2, , , 150, 75, 200, 265, false,"Riker",crew_portraits_cm_riker_angel_one_sm.png
"Jazz Musician Riker",5,3, 448,114,254,0,0,0,0,0,0,0,0,0,288,67,190,0,0,0,717,714,690,591,651,902,892,778,884,895,812,890,770,885,730,466,496,403,323,378,0,0,603,0,0,656,0,570,0,491,842,782,"Federation, Human, Musician, Starfleet, Pilot, Maverick, Gambler, Romantic","male, organic, tng, bridge_crew, riker, crew_max_rarity_3","Calculated Risk",0, 7, 8, 10, 12, , , , 1, 2, 320, 270, 280, 215, false,"Riker",crew_portraits_cm_rikertrombone_sm.png
"Augment Riker",5,4, 332,63,129,0,0,0,566,106,218,579,204,499,0,0,0,0,0,0,682,416,279,695,594,560,324,804,721,183,603,453,464,243,762,687,373,40,698,592,498,121,0,0,30,577,423,110,58,0,617,369,"Human, Augments, Engineered, Gambler, Desperate, Maverick, Jury Rigger, Survivalist","male, organic, tng, ent, pic, riker, original, crew_max_rarity_4","Last Chance",2, 7, 10, 10, 12, , , , , , 375, 305, 217, 330, false,"Riker",crew_portraits_cm_riker_augment_sm.png
"Age of Sail Riker",6,5, 1034,248,518,0,0,0,897,208,400,572,78,158,0,0,0,0,0,0,141,45,33,226,82,221,275,681,469,45,308,171,350,191,598,109,18,27,221,71,201,399,0,0,71,323,154,596,339,0,178,99,"Human, Federation, Starfleet, Explorer, Maverick, Gambler, Costumed","ageofsail, male, organic, tng, bridge_crew, riker, crew_max_rarity_5","Battle Stations!",0, 10, 8, 10, 12, , , , 1, 2, 350, , 195, 415, false,"Riker",crew_portraits_cm_riker_age_of_sail_sm.png
"First Officer Riker",8,5, 969,106,241,0,0,0,1039,254,588,0,0,0,466,111,211,0,0,0,250,50,222,153,190,134,521,464,500,123,75,88,425,464,372,492,50,434,284,399,75,0,533,0,72,43,56,489,0,425,239,137,"Human, Federation, Starfleet, Desperate, Marksman, Gambler","male, organic, tng, bridge_crew, riker, crew_max_rarity_5","Can't Get Any Worse",2, 9, 6, 6, 6, , , , , , 400, 200, , 515, true,"Riker",crew_portraits_cm_riker_nemesis_sm.png
"Mintakan Riker",8,5, 516,39,73,0,0,0,1036,259,543,0,0,0,925,154,314,0,0,0,468,110,416,160,387,146,533,279,513,139,27,103,250,481,224,757,137,705,358,658,83,0,375,0,85,30,66,311,0,297,266,222,"Human, Federation, Starfleet, Survivalist, Hunter, Costumed, Undercover Operative, Vulcan, Mintakan","male, organic, tng, bridge_crew, riker, crew_max_rarity_5","Proto-Vulcan Instincts",2, 7, 10, 10, 14, 7, 0, , , , 530, 230, 250, 415, false,"Riker",crew_portraits_cm_riker_mintakan_sm.png
"Anbo-jyutsu Riker",9,4, 624,124,263,0,0,0,747,120,255,0,0,0,0,0,0,0,0,0,567,255,517,589,488,520,812,844,794,447,575,412,837,797,818,444,212,378,509,360,435,0,0,0,394,540,371,0,0,0,721,718,"Human, Federation, Starfleet, Duelist, Pilot, Maverick, Romantic, Gambler","male, organic, tng, commander, bridge_crew, first_officer, riker, crew_max_rarity_4","The Ultimate Evolution",1, 7, 14, 12, 14, 5, 0, , , , 315, 230, 135, 415, false,"Riker",crew_portraits_cm_riker_anbo_sm.png
"Chef Riker",4,5, 0,0,0,832,142,304,0,0,0,0,0,0,1276,205,411,529,90,208,267,678,652,178,303,282,213,16,48,618,168,292,75,195,24,376,0,0,330,463,368,245,42,92,0,314,465,177,301,70,172,244,"Human, Federation, Starfleet, Costumed, Chef","male, organic, tng, ent, bridge_crew, riker, crew_max_rarity_5","You've Always Got A Choice",2, 8, 8, 8, 12, 4, 2, , , , 200, 215, 77, 475, false,"Riker",crew_portraits_cm_riker_chef_sm.png
"Desperate Riker",4,4, 898,81,215,0,0,0,386,59,153,505,150,319,0,0,0,0,0,0,372,270,112,446,292,621,359,783,664,285,655,507,521,285,734,545,380,82,589,465,645,233,0,0,127,712,541,312,175,0,504,569,"Human, Federation, Starfleet, Desperate, Brutal, Survivalist, Veteran, Crafty","male, organic, tng, bridge_crew, riker, crew_max_rarity_4","We've Encountered A Quantum Anomaly",0, 6, 6, 8, 10, 0, 1, , , , 400, 170, 60, 530, false,"Riker",crew_portraits_cm_riker_desperate_sm.png
"Riker Q",3,4, 443,14,44,0,0,0,690,42,87,0,0,0,973,46,106,0,0,0,624,386,579,305,541,521,680,389,663,449,195,414,341,652,296,779,672,738,685,687,745,0,714,0,637,635,612,685,0,591,502,892,"Q Continuum, Human, Federation, Starfleet, Pilot, Maverick, Gambler, Romantic","male, organic, tng, bridge_crew, riker, crew_max_rarity_4","And That's Not All",2, 7, 8, 10, 10, , , , , , 580, 225, 130, 415, false,"Riker",crew_portraits_cm_riker_q_sm.png
"Protomorphosis Riker",7,4, 665,57,159,0,0,0,892,157,331,0,0,0,0,0,0,0,0,0,561,197,513,587,483,389,767,824,756,345,470,295,813,756,793,660,246,613,675,566,321,0,0,0,286,422,255,0,0,0,669,746,"Human, Federation, Starfleet, Brutal, Gambler, Primal, Desperate","male, organic, tng, bridge_crew, riker, crew_max_rarity_4","Devolution",0, 7, 6, 8, 14, 1, 0, , 2, 3, 350, 125, 132, 125, false,"Riker",crew_portraits_cm_riker_caveman_sm.png
"Little John Riker",4,5, 1023,128,239,0,0,0,1309,192,354,0,0,0,422,113,245,0,0,0,196,12,165,137,134,83,466,448,437,78,59,43,409,398,353,467,139,404,244,379,255,0,492,0,233,114,198,444,0,395,103,312,"Human, Federation, Starfleet, Costumed, Thief","male, organic, tng, bridge_crew, riker, crew_max_rarity_5","We Need a Diversion",0, 6, 10, 8, 16, 2, 0, , , , 515, 200, 125, 425, false,"Riker",crew_portraits_cm_riker_littlejohn_sm.png
"Captain Morgan Bateson",10,5, 1074,218,498,0,0,0,986,117,244,0,0,0,447,94,186,0,0,0,146,53,122,106,88,261,527,486,507,225,130,199,450,475,395,137,78,103,104,91,453,0,582,0,409,291,389,544,0,469,260,248,"Federation, Starfleet, Human, Casual","male, organic, tng, captain, bridge_crew, bateson, crew_max_rarity_5","Surprise Attack",0, 8, 12, 10, 14, 8, 4, , , , 150, 30, 190, 590, false,"Bateson",crew_portraits_cm_bateson_sm.png
"Loken",5,5, 0,0,0,1005,129,306,0,0,0,1311,152,313,0,0,0,553,26,64,192,666,83,696,348,196,13,213,37,85,712,336,82,10,364,391,0,290,0,673,382,65,409,182,302,0,632,316,132,631,121,565,"Innovator, Undercover Operative, Kraylor","nonhuman, organic, voy, loken, crew_max_rarity_5","It's Perfect",2, 7, 8, 4, 12, 1, 2, , , , 200, 240, 150, 100, false,"Loken",crew_portraits_cm_loken_sm.png
"Edith Keeler",9,4, 0,0,0,0,0,0,0,0,0,0,0,0,453,166,339,591,187,590,872,865,869,632,431,862,827,615,309,856,648,405,595,270,218,0,0,0,409,65,0,0,336,81,0,410,76,278,35,12,747,305,"Civilian, Caregiver, Inspiring, Cultural Figure, Romantic, Human","female, organic, tos, keeler, crew_max_rarity_4","A Life Worth Living",1, 7, 8, 10, 8, , , , , , 690, 25, 52, 440, false,"Keeler",crew_portraits_cm_edithkeeler_sm.png
"Ensign Tuvok",8,1, 0,0,0,181,51,197,0,0,0,0,0,0,138,33,74,0,0,0,889,928,928,911,931,880,854,815,841,926,901,930,899,930,891,611,0,0,770,0,597,386,498,352,0,782,0,726,0,621,922,884,"Vulcan, Federation, Starfleet, Telepath","nonhuman, male, organic, voy, ensign, bridge_crew, tuvok, crew_max_rarity_1","Memory",0, 1, 1, 14, 10, , , , , , 103, 60, 135, 375, false,"Tuvok",crew_portraits_cm_tuvokensign_sm.png
"Security Chief Tuvok",5,3, 291,53,161,145,45,149,445,85,201,0,0,0,0,0,0,0,0,0,705,574,754,798,727,632,760,820,750,649,745,637,890,862,879,417,386,618,680,571,329,433,669,409,494,629,477,0,0,0,811,749,"Vulcan, Federation, Starfleet, Telepath, Tactician, Investigator","nonhuman, male, organic, voy, lieutenant_commander, bridge_crew, tuvok, crew_max_rarity_3","Contingency Plan",0, 4, 10, 12, 16, 5, 0, , , , 465, 50, , 300, false,"Tuvok",crew_portraits_cm_tuvokrifle_sm.png
"Disguised Tuvok",6,4, 293,68,194,691,146,408,419,202,399,0,0,0,0,0,0,0,0,0,295,417,639,692,590,169,319,478,277,488,604,454,792,718,759,88,162,556,621,508,20,201,284,171,181,328,160,0,0,0,606,196,"Vulcan, Federation, Starfleet, Telepath, Resourceful, Costumed, Tactician","nonhuman, male, organic, voy, lieutenant_commander, bridge_crew, tuvok, crew_max_rarity_4","Ethics of Time Travel",0, 6, 12, 12, 16, 5, 0, , , , 565, 255, 90, 225, false,"Tuvok",crew_portraits_cm_tuvok20c_sm.png
"Assimilated Tuvok",3,4, 544,139,318,279,113,277,834,107,218,0,0,0,0,0,0,0,0,0,328,209,463,554,441,267,426,630,389,362,494,316,773,668,739,78,199,300,454,292,129,276,462,260,449,578,424,0,0,0,532,402,"Vulcan, Borg, Telepath, Brutal, Tactician, Undercover Operative","nonhuman, male, organic, voy, tuvok, crew_max_rarity_4","Resistance is Illogical!",0, 9, 14, 20, 12, , , 1, , , 650, 200, 135, 425, false,"Tuvok",crew_portraits_cm_tuvok_assimilated_sm.png
"Maquis Tuvok",7,5, 493,88,296,826,163,415,1170,139,344,0,0,0,0,0,0,0,0,0,68,97,352,467,320,12,208,286,168,142,230,108,678,472,616,48,158,385,512,362,27,186,260,161,292,428,263,0,0,0,253,179,"Vulcan, Maquis, Telepath, Costumed, Tactician, Undercover Operative","nonhuman, male, organic, voy, tuvok, crew_max_rarity_5","Et Tuvok",0, 8, 10, 3, 14, 4, 1, , , , 450, 100, 65, 375, false,"Tuvok",crew_portraits_cm_tuvok_maquis_sm.png
"Warship Tuvok",6,5, 936,166,342,0,0,0,1281,112,276,0,0,0,0,0,0,0,0,0,299,65,273,387,235,177,610,748,598,174,272,140,739,573,688,302,146,239,406,228,420,0,0,0,379,525,360,0,0,0,380,631,"Vulcan, Hologram, Telepath, Brutal, Tactician, Starfleet, Federation","nonhuman, male, organic, voy, tuvok, crew_max_rarity_5","Fatality Rate Increasing!",0, 7, 10, 3, 15, 1, 1, , , , 425, 300, 195, 550, false,"Tuvok",crew_portraits_cm_tuvok_warship_sm.png
