"Ambassador K'Ehleyr",8,4, 0,0,0,0,0,0,549,72,188,0,0,0,941,45,102,0,0,0,885,625,882,541,869,637,837,528,823,557,335,523,498,823,434,0,612,0,755,0,596,0,733,0,522,517,504,707,0,610,755,885,"Klingon, Human, Brutal, Ambassador, Communicator, Federation","nonhuman, female, organic, kehleyr, tng, crew_max_rarity_4","Trapped Between Cultures",1, 6, 6, 6, 6, , , , , , 325, 255, 168, 475, true,"K'Ehleyr",crew_portraits_cm_kehleyr_ambassador_sm.png
"Resistance Shakaar",9,4, 782,49,120,0,0,0,483,127,261,0,0,0,0,0,0,0,0,0,586,374,535,610,504,665,856,890,843,571,689,541,883,839,871,727,345,668,731,624,428,0,0,0,386,536,367,0,0,0,784,823,"Bajoran, Civilian, Veteran, Saboteur, Tactician","nonhuman, male, organic, ds9, shakaar, crew_max_rarity_4","Cell Leader",2, 7, 12, 10, 12, 0, 1, , 1, 3, 1290, 600, , 290, false,"Shakaar",crew_portraits_cm_shakaarresistance_sm.png
"Teenager Nog",8,1, 0,0,0,0,0,0,193,45,123,0,0,0,196,42,124,0,0,0,940,902,942,912,942,899,937,898,940,886,832,879,894,941,881,0,696,0,734,0,723,0,721,0,616,578,594,686,0,593,928,911,"Ferengi, Civilian, Scoundrel, Gambler, Merchant","nonhuman, male, organic, ds9, nog, crew_max_rarity_1","Hack Systems",1, 1, 0, 10, 10, , , , , , 290, , 162, 75, true,"Nog",crew_portraits_cm_nogstimbolt_sm.png
"Cadet Nog",6,2, 0,0,0,0,0,0,320,29,113,154,5,13,262,20,53,0,0,0,927,840,904,880,926,829,878,862,919,723,770,802,790,862,836,0,713,752,806,0,747,531,778,0,625,725,615,752,438,651,891,937,"Ferengi, Starfleet, Gambler, Merchant","nonhuman, male, organic, ds9, nog, crew_max_rarity_2","Enthusiasm",1, 4, 8, 10, 12, , , , 3, 500, 265, , 70, 295, false,"Nog",crew_portraits_cm_nogcadet_sm.png
"Captain Nog",8,5, 1040,244,540,0,0,0,455,110,250,0,0,0,979,144,281,0,0,0,146,102,118,36,86,440,529,261,509,384,117,346,230,470,209,99,61,72,41,65,461,0,433,0,416,185,396,373,0,354,231,116,"Ferengi, Federation, Starfleet, Inspiring","nonhuman, male, organic, ds9, captain, nog, crew_max_rarity_5","Weapons Free",0, 9, 10, 10, 10, , , , , , 500, 250, 100, 300, false,"Nog",crew_portraits_cm_nogcaptain_sm.png
"Tuxedo Nog",6,5, 966,153,284,0,0,0,0,0,0,481,65,198,1098,260,551,0,0,0,221,288,50,26,167,694,317,148,488,387,192,609,29,236,98,394,443,111,35,317,0,383,106,0,518,164,0,22,333,91,192,140,"Ferengi, Costumed, Federation, Starfleet, Inspiring, Hero, Desperate","nonhuman, male, organic, ds9, nog, crew_max_rarity_5","Welcome To Las Vegas",1, 8, 8, 8, 10, 0, 1, , , , 540, 255, 210, 325, false,"Nog",crew_portraits_cm_nog_nines_sm.png
"Safecracker Nog",5,4, 0,0,0,610,57,146,0,0,0,876,132,331,406,57,124,0,0,0,551,795,310,642,762,547,118,354,342,310,660,752,174,179,521,687,0,295,722,0,678,136,479,411,307,752,0,156,182,579,493,670,"Ferengi, Costumed, Federation, Starfleet, Criminal, Resourceful","nonhuman, male, organic, ds9, nog, crew_max_rarity_4","Piece of Cake",2, 7, 6, 8, 10, , , , , , 390, 200, 180, 375, false,"Nog",crew_portraits_cm_nog_safecracker_sm.png
"Reinforcements Stamets",8,4, 0,0,0,853,87,228,614,58,183,0,0,0,0,0,0,0,0,0,494,606,877,882,861,204,339,522,303,531,649,497,857,815,837,536,631,0,0,0,250,336,555,320,541,690,523,0,0,0,741,824,"Human, Starfleet, Federation, Exomycologist, Prodigy","male, organic, dsc, lieutenant, stamets, crew_max_rarity_4","Calling Reinforcements",1, 7, 16, 12, 10, 7, 0, , , , 400, 100, 100, 500, false,"Stamets",crew_portraits_cm_stamets_sm.png
"Mirror Stamets",5,5, 0,0,0,1214,214,465,0,0,0,932,142,314,0,0,0,500,59,173,115,689,205,722,352,105,21,128,30,218,734,339,234,17,372,159,0,307,0,556,151,23,180,56,320,0,534,333,64,525,170,241,"Human, Mirror Universe, Terran Empire, Brutal, Exomycologist","male, organic, dsc, stamets, crew_max_rarity_5","You've Been Wrong About Everything",1, 8, 8, 10, 10, 3, 0, 2, , , 635, 200, 90, 400, false,"Stamets",crew_portraits_cm_dsc_stamets_mirror_sm.png
"Navigator Stamets",6,5, 463,106,224,942,157,335,0,0,0,1240,151,390,0,0,0,0,0,0,62,468,31,489,340,230,22,247,146,98,736,606,99,53,611,88,536,43,574,430,320,36,362,214,242,0,0,255,145,0,173,246,"Human, Explorer, Pilot, Exomycologist","male, organic, dsc, lieutenant, stamets, crew_max_rarity_5","Physics As Biology",1, 8, 12, 6, 10, 2, 0, 2, , , 500, 200, 130, 250, false,"Stamets",crew_portraits_cm_stamets_navigator_sm.png
"Off-Duty Stamets",8,2, 0,0,0,380,46,138,0,0,0,261,34,91,0,0,0,0,0,0,819,928,872,935,929,805,543,808,705,858,932,929,852,808,927,712,0,711,0,0,702,344,700,434,649,0,0,729,417,0,896,920,"Human, Starfleet, Federation, Exomycologist, Romantic","male, organic, dsc, lieutenant, stamets, crew_max_rarity_2","An Entire Universe Of Possibilities",1, 2, 6, 6, 10, 0, 1, , , , 225, 50, 75, 165, false,"Stamets",crew_portraits_cm_dsc_stamets_offduty_sm.png
"CMO Bashir",7,1, 145,21,55,0,0,0,0,0,0,0,0,0,0,0,0,227,32,132,920,917,921,929,828,942,942,945,856,943,946,871,946,849,877,787,746,743,805,548,0,0,0,451,0,0,600,0,396,596,939,933,"Human, Federation, Starfleet, Physician, Engineered, Cyberneticist, Gambler","nonhuman, male, organic, ds9, lieutenant, bashir, crew_max_rarity_1","Frontier Medicine",1, 1, 12, 14, 10, 6, 0, , , , 305, 50, 68, 170, false,"Bashir",crew_portraits_cm_bashirs1_sm.png
"Bashir, Julian Bashir",6,5, 0,0,0,0,0,0,595,194,388,0,0,0,1009,96,199,927,194,394,709,392,670,336,151,333,525,280,145,297,81,17,248,120,22,0,330,0,607,172,229,0,584,163,198,130,10,541,115,79,224,168,"Human, Federation, Starfleet, Physician, Engineered, Costumed, Cyberneticist, Undercover Operative, Gambler","nonhuman, male, organic, ds9, lieutenant, bashir, crew_max_rarity_5","Bashir, Secret Agent",1, 8, 6, 12, 12, , , , , , 1700, 225, 245, 525, false,"Bashir",crew_portraits_cm_bashirbond_sm.png
"Alternate Future Bashir",7,5, 416,47,159,794,115,326,0,0,0,0,0,0,0,0,0,991,277,649,142,545,475,570,17,321,248,342,20,662,763,116,714,84,144,178,666,635,703,9,381,253,413,10,0,0,39,0,16,69,328,114,"Human, Federation, Starfleet, Physician, Engineered, Cyberneticist, Gambler","nonhuman, male, organic, ds9, lieutenant, bashir, crew_max_rarity_5","Healing Touch",2, 8, 12, 12, 20, 2, 0, , 0, 3, 1300, , 300, 1150, false,"Bashir",crew_portraits_cm_bashirfuture_sm.png
"Changeling Bashir",5,4, 0,0,0,0,0,0,569,178,423,250,96,216,0,0,0,648,99,234,830,525,666,842,458,503,509,819,331,298,574,138,682,175,458,0,313,492,0,420,209,339,0,307,52,336,38,519,77,425,630,349,"Changeling, Dominion, Starfleet, Physician, Undercover Operative, Saboteur, Villain","nonhuman, male, organic, ds9, lieutenant, bashir, crew_max_rarity_4","Healing Touch",2, 7, 12, 12, 20, 2, 0, , 0, 3, 865, 265, 120, 875, false,"Changeling",crew_portraits_cm_bashirchangeling_sm.png
"RAF Julian Bashir",3,4, 0,0,0,0,0,0,583,112,241,0,0,0,0,0,0,830,57,144,886,604,883,890,465,609,839,869,338,530,646,196,863,296,463,0,512,0,0,595,470,0,0,414,425,570,195,0,367,559,758,826,"Human, Pilot, Hero, Costumed, Engineered, Physician","nonhuman, male, organic, ds9, bashir, crew_max_rarity_4","Hedge Hopping",1, 7, 3, 8, 12, , , , , , 830, 725, 104, 515, false,"Bashir",crew_portraits_cm_bashirwwii_sm.png
"Racquetball Bashir",1,3, 175,48,144,411,23,77,0,0,0,0,0,0,0,0,0,345,120,414,664,825,820,834,517,751,617,758,329,889,901,635,897,493,637,560,677,647,713,87,775,519,768,136,0,0,215,0,148,265,806,689,"Human, Federation, Starfleet, Athlete, Prodigy, Engineered, Physician","nonhuman, male, organic, ds9, bashir, crew_max_rarity_3","Team Captain",1, 6, 8, 12, 12, , , , 0, 1, 560, 130, 158, 625, false,"Bashir",crew_portraits_cm_bashirracquetball_sm.png
"Mirror Bashir",7,5, 0,0,0,0,0,0,1101,249,531,829,186,403,0,0,0,0,0,0,765,248,296,794,713,187,249,770,625,29,285,146,307,171,710,0,202,173,0,0,96,183,0,0,4,186,77,207,116,0,405,239,"Human, Scoundrel, Engineered, Desperate, Saboteur, Survivalist, Mirror Universe, Terran Rebellion","nonhuman, male, organic, ds9, mirror, bashir, crew_max_rarity_5","I Owed You That",0, 10, 10, 12, 10, , , , , , 415, 55, 345, 675, false,"Bashir",crew_portraits_cm_bashir_mirror_sm.png
"Bell Riots Bashir",6,5, 0,0,0,0,0,0,585,8,18,0,0,0,847,242,487,1195,133,365,710,487,671,310,83,454,530,248,94,395,119,21,214,69,15,0,755,0,245,253,795,0,152,205,682,203,225,101,165,22,235,338,"Human, Starfleet, Federation, Desperate, Costumed, Physician, Engineered","nonhuman, male, organic, ds9, bashir, crew_max_rarity_5","Field Medicine",1, 7, 12, 8, 12, 2, 0, 2, , , 650, 250, 235, 350, false,"Bashir",crew_portraits_cm_bashir_bellriots_sm.png
"Prince Bashir",5,5, 1018,267,646,0,0,0,0,0,0,0,0,0,923,175,328,492,78,193,135,196,111,34,10,700,521,267,273,639,332,348,236,233,46,59,142,37,15,6,0,0,348,348,0,420,496,288,329,109,218,71,"Human, Starfleet, Federation, Royalty, Costumed, Physician, Engineered","nonhuman, male, organic, ds9, bashir, original, crew_max_rarity_5","This Is Where Heroes Are Made",0, 8, 6, 6, 14, 7, 2, , , , 300, 225, 210, 350, false,"Bashir",crew_portraits_cm_bashir_prince_sm.png
"Captive Bashir",1,4, 0,0,0,0,0,0,617,86,224,0,0,0,304,123,237,818,187,466,792,524,772,638,263,501,664,628,204,435,386,44,603,174,149,0,563,0,543,120,524,0,502,125,472,265,32,453,76,53,444,278,"Human, Starfleet, Federation, Desperate, Prisoner, Physician, Engineered, Counselor","nonhuman, male, organic, ds9, bashir, crew_max_rarity_4","Run Like Hell",1, 6, 8, 8, 6, 6, 0, , , , 435, 225, 165, 150, true,"Bashir",crew_portraits_cm_bashir_prisoner_sm.png
"Dress Uniform Bashir",4,4, 0,0,0,654,63,140,0,0,0,0,0,0,350,42,134,761,185,414,539,809,801,680,297,533,364,363,87,773,690,285,635,194,223,688,0,0,729,157,679,432,485,77,0,759,165,677,108,110,534,582,"Human, Starfleet, Federation, Cyberneticist, Physician, Engineered, Gambler","nonhuman, male, organic, ds9, bashir, crew_max_rarity_4","Pleasure to Meet You!",0, 8, 6, 6, 8, , , , , , 215, 230, 93, 425, false,"Bashir",crew_portraits_cm_bashir_dressuniform_sm.png
"Scientist Degra",7,5, 0,0,0,1065,198,526,0,0,0,1138,87,281,0,0,0,0,0,0,197,749,219,786,699,201,31,226,134,225,785,689,251,139,695,135,0,412,0,0,127,28,154,101,406,0,0,445,248,0,374,485,"Xindi, Astrophysicist, Inspiring, Innovator","nonhuman, male, organic, ent, degra, crew_max_rarity_5","Prototype Test",1, 5, 0, 3, 10, 1, 0, , , , 920, 790, 95, 1400, true,"Degra",crew_portraits_cm_degrascientist_sm.png
"Commander Kelby",9,4, 562,81,189,0,0,0,0,0,0,813,65,142,0,0,0,0,0,0,635,628,257,666,551,884,379,884,837,485,891,863,554,313,865,592,604,282,628,509,0,429,0,0,584,0,0,643,363,0,777,850,"Human, Starfleet, Jury Rigger, Explorer","male, organic, ent, commander, kelby, crew_max_rarity_4","Good to Go",2, 5, 1, 12, 20, 2, 0, , , , 365, 200, 134, 650, true,"Kelby",crew_portraits_cm_kelbyent_sm.png
"Captain Lorca",8,5, 1263,232,542,0,0,0,0,0,0,0,0,0,1014,131,260,0,0,0,123,185,101,22,65,732,593,302,580,675,359,674,271,553,241,105,203,77,46,69,0,0,474,0,0,533,0,417,0,385,348,418,"Starfleet, Human, Tactician, Federation, Explorer, Mirror Universe","captain, male, organic, dsc, lorca, mirror, crew_max_rarity_5","We Are A Long Way From Home",1, 9, 12, 3, 12, 4, 1, , , , 650, 75, 140, 240, false,"Lorca",crew_portraits_cm_lorca_sm.png
"Usurper Lorca",8,5, 905,151,424,0,0,0,1199,254,511,0,0,0,381,47,91,0,0,0,232,33,206,178,176,107,537,551,516,92,84,63,524,481,455,249,22,194,256,187,106,0,740,0,102,117,84,714,0,615,251,154,"Terran Empire, Mirror Universe, Human, Brutal, Villain","male, organic, dsc, lorca, crew_max_rarity_5","Fate is Real",0, 8, 13, 10, 20, 8, 4, , , , 225, 280, 172, 175, false,"Lorca",crew_portraits_cm_lorca_mirror_sm.png
"Prison Break Lorca",7,4, 783,179,395,0,0,0,499,188,383,0,0,0,0,0,0,0,0,0,457,225,407,509,380,576,802,849,785,504,621,469,842,790,818,250,62,195,367,188,240,0,0,0,210,366,184,0,0,0,706,433,"Prisoner, Starfleet, Human, Brutal, Desperate, Tactician, Mirror Universe, Federation","male, organic, dsc, lorca, crew_max_rarity_4","Starfleet Didn't Start This War",1, 9, 6, 10, 15, , , 2, , , 200, 100, 175, 450, false,"Lorca",crew_portraits_cm_lorca_prisoner_sm.png
"Alidar Jarok",6,4, 546,254,581,0,0,0,325,170,400,0,0,0,604,64,189,0,0,0,437,260,382,249,353,589,688,560,672,516,375,478,535,661,462,83,16,58,70,53,241,0,626,0,211,158,185,590,0,508,502,81,"Romulan, Veteran, Desperate, Tactician, High Command","nonhuman, male, organic, jarok, ds9, admiral, crew_max_rarity_4","I Am Not A Traitor",2, 7, 10, 10, 16, 6, 0, , , , 200, , 96, 315, false,"Jarok",crew_portraits_cm_jarok_sm.png
"Tosk",10,5, 0,0,0,0,0,0,937,164,351,1158,218,399,0,0,0,0,0,0,759,364,159,789,707,308,165,765,615,24,380,230,184,104,704,0,379,155,0,0,301,160,0,0,16,412,236,184,95,0,392,443,"Desperate, Explorer, Crafty, Athlete, Tosk, Prisoner","nonhuman, male, organic, tosk, ds9, crew_max_rarity_5","I am Tosk",1, 8, 12, 6, 10, 2, 0, 2, , , 600, 225, 285, 200, false,"Tosk",crew_portraits_cm_tosk_sm.png
"Malik",9,4, 334,39,119,0,0,0,735,180,376,0,0,0,661,57,122,0,0,0,686,337,635,435,590,425,734,567,719,376,233,330,546,714,470,738,243,677,567,636,251,0,706,0,222,212,193,673,0,583,591,641,"Human, Augments, Engineered, Brutal, Civilian","male, organic, ent, malik, crew_max_rarity_4","This Is An Act Of Mercy",0, 7, 8, 6, 10, 8, 4, , , , 425, 140, 130, 400, false,"Malik",crew_portraits_cm_malik_sm.png
"Captain Kirk",6,2, 317,71,156,0,0,0,128,24,74,0,0,0,259,39,127,0,0,0,815,742,802,727,782,892,917,832,912,880,808,868,821,915,798,655,543,612,516,565,776,0,722,0,667,663,638,687,0,594,878,848,"Human, Federation, Starfleet, Inspiring, Romantic, Explorer","male, organic, tos, captain, bridge_crew, kirk, crew_max_rarity_2","Boldly Go",0, 3, 6, 10, 10, , , , , , 320, 135, , 215, false,"Kirk",crew_portraits_cm_kirktosyellow_sm.png
"Command Wrap Kirk",7,3, 363,170,345,0,0,0,229,116,330,0,0,0,185,77,190,0,0,0,712,538,674,603,627,750,872,790,859,694,680,690,781,856,739,299,120,237,209,228,376,0,607,0,333,229,308,573,0,494,797,365,"Human, Federation, Starfleet, Inspiring, Romantic, Duelist","male, organic, tos, captain, bridge_crew, kirk, crew_max_rarity_3","Captain's Prerogative",2, 6, 6, 8, 10, , , , 1, 2, 805, 365, , 365, false,"Kirk",crew_portraits_cm_kirkgreenwrap_sm.png
"Nexus Kirk",6,4, 631,206,375,0,0,0,502,97,216,0,0,0,237,210,476,0,0,0,473,276,420,346,392,585,741,627,723,514,421,475,600,719,518,242,149,187,29,183,520,0,175,0,471,79,451,124,0,148,601,110,"Human, Federation, Starfleet, Inspiring, Romantic","male, organic, tos, captain, bridge_crew, kirk, crew_max_rarity_4","Make a Difference",2, 7, 12, 12, 12, , , , , , 965, 450, , 590, false,"Kirk",crew_portraits_cm_kirkgenerations_sm.png
"Mirror Kirk",7,5, 1020,235,494,0,0,0,925,202,390,0,0,0,0,0,0,0,0,0,243,75,212,333,182,304,640,772,627,272,379,228,760,599,712,131,29,98,246,86,219,0,0,0,187,343,170,0,0,0,406,280,"Human, Duelist, Terran Empire, Starfleet, Brutal, Mirror Universe","male, organic, tos, captain, bridge_crew, kirk, mirror, crew_max_rarity_5","Be the Captain",2, 7, 12, 10, 14, 8, 4, , , , 440, 900, 87, 550, false,"Kirk",crew_portraits_cm_mirrorkirk_sm.png
"Kal-if-fee Kirk",8,5, 458,182,323,0,0,0,981,247,483,0,0,0,765,204,444,0,0,0,416,109,360,158,327,170,553,311,534,167,41,129,280,503,247,317,38,255,49,245,124,0,209,0,109,16,94,150,0,170,289,30,"Human, Federation, Starfleet, Romantic, Inspiring, Duelist","male, organic, tos, captain, bridge_crew, kirk, crew_max_rarity_5","Be the Captain",2, 7, 12, 10, 14, 8, 4, , , , 515, 355, 18, 325, false,"Kirk",crew_portraits_cm_kirkamoktime_sm.png
"Romulan Kirk",6,4, 238,124,324,0,0,0,386,165,555,0,0,0,722,129,342,0,0,0,665,405,609,382,571,555,739,490,721,483,260,450,452,717,395,377,56,316,131,309,129,0,382,0,112,39,97,316,0,304,598,87,"Human, Federation, Starfleet, Undercover Operative, Spy, Romulan","male, organic, tos, captain, bridge_crew, kirk, crew_max_rarity_4","Masquerade",2, 8, 6, 6, 10, , , , 3, 800, 300, 200, 43, 390, false,"Kirk",crew_portraits_cm_kirkromulan_sm.png
"Platonian Kirk",6,4, 626,138,268,0,0,0,689,191,390,0,0,0,217,122,265,0,0,0,503,201,447,419,425,443,714,678,703,386,371,351,666,697,576,424,110,360,201,350,230,0,477,0,199,92,175,421,0,389,562,235,"Human, Federation, Starfleet, Inspiring, Romantic, Explorer, Telekinetic","male, organic, tos, captain, bridge_crew, kirk, crew_max_rarity_4","Telekinetic Barrage",2, 9, 6, 12, 14, 5, 0, , , , 150, 735, 10, 425, false,"Kirk",crew_portraits_cm_kirk_platonian_sm.png
"Gangster Kirk",6,5, 1171,177,371,0,0,0,494,151,303,0,0,0,912,138,269,0,0,0,139,87,116,43,82,376,518,294,500,333,113,284,261,460,236,263,104,208,122,200,362,0,454,0,325,139,298,402,0,378,209,207,"Federation, Starfleet, Civilian, Human, Marksman, Crafty, Criminal","male, organic, tos, bridge_crew, captain, kirk, crew_max_rarity_5","Piece of the Action",2, 8, 12, 10, 14, 4, 0, , , , 455, 105, 210, 1405, false,"Kirk",crew_portraits_cm_kirk_gangster_sm.png
"Admiral Kirk",7,5, 814,266,548,0,0,0,0,0,0,0,0,0,1273,148,289,0,0,0,293,351,272,47,234,755,619,203,607,697,262,694,165,580,164,90,191,65,34,58,0,0,418,0,0,485,0,358,0,338,382,342,"Gambler, Maverick, Human, Starfleet, Federation, Inspiring, Hero","admiral, male, organic, tos, kirk, crew_max_rarity_5","Kobayashi Maru",1, 8, 6, 8, 10, 3, 0, 2, , , 325, 505, 255, 315, false,"Kirk",crew_portraits_cm_kirk_admiral_sm.png
"Rura Penthe Kirk",5,5, 0,0,0,0,0,0,1337,197,391,0,0,0,854,230,569,0,0,0,735,187,711,347,676,120,589,293,574,105,10,71,260,546,235,0,321,0,193,0,222,0,111,0,190,13,171,71,0,99,342,225,"Human, Federation, Starfleet, Romantic, Inspiring, Duelist, Desperate, Criminal, Prisoner","male, organic, tos, captain, bridge_crew, kirk, crew_max_rarity_5","Aim for the 'Knee'",2, 7, 6, 6, 12, 1, 2, , , , 550, 230, 50, 625, false,"Kirk",crew_portraits_cm_kirk_rura_penthe_sm.png
"Survivalist Kirk",3,5, 0,0,0,1090,291,706,436,66,171,884,208,426,0,0,0,0,0,0,99,491,182,719,616,29,12,107,65,58,538,363,202,117,607,40,640,140,0,0,15,4,61,37,66,696,529,164,86,0,161,34,"Human, Federation, Starfleet, Inspiring, Desperate, Resourceful, Hero, Survivalist, Crafty","male, organic, tos, captain, bridge_crew, kirk, crew_max_rarity_5","A Most Promising Species",1, 8, 8, 6, 12, 1, 0, 2, , , 225, 200, 148, 250, false,"Kirk",crew_portraits_cm_kirk_survivalist_sm.png
"Incognito Kirk",4,4, 847,104,224,0,0,0,622,114,245,0,0,0,358,46,100,0,0,0,410,197,356,357,321,510,703,663,691,441,409,408,643,682,559,521,258,471,445,433,464,0,735,0,417,419,397,709,0,612,542,683,"Human, Federation, Starfleet, Inspiring, Undercover Operative, Investigator","male, organic, tos, captain, bridge_crew, kirk, crew_max_rarity_4","Plans To The McKinley Rocket Base",1, 7, 8, 8, 12, 4, 1, , , , 440, 100, 108, 300, false,"Kirk",crew_portraits_cm_kirk_incognito_sm.png
"Evil Kirk",7,4, 631,100,231,0,0,0,848,156,338,0,0,0,0,0,0,0,0,0,568,210,516,592,486,435,792,845,778,380,522,340,835,780,813,517,185,465,572,426,316,0,0,0,284,424,253,0,0,0,691,690,"Human, Federation, Starfleet, Brutal, Villain, Survivalist","male, organic, tos, captain, kirk, crew_max_rarity_4","I'm Captain Kirk!",0, 6, 10, 8, 12, 7, 0, , , , 400, 70, 150, 375, false,"Kirk",crew_portraits_cm_kirk_evil_sm.png
"Wrathful Kirk",3,5, 884,147,308,0,0,0,1350,248,499,501,83,183,0,0,0,0,0,0,231,6,49,323,174,55,282,671,424,27,122,26,363,198,570,373,49,102,468,303,111,377,0,0,33,207,87,574,331,0,39,166,"Human, Federation, Starfleet, Inspiring, Desperate, Marksman, Explorer","male, organic, tos, admiral, bridge_crew, kirk, crew_max_rarity_5","KHAAAAAAAAAN!!!",2, 8, 6, 3, 10, 7, 0, , , , 190, 200, 100, 75, false,"Kirk",crew_portraits_cm_kirk_wrathful_sm.png
"Roman Captive Kirk",2,4, 661,90,177,0,0,0,460,60,126,0,0,0,930,163,267,0,0,0,481,327,428,168,399,579,657,355,646,510,219,471,310,619,264,594,429,558,268,511,699,0,430,0,601,322,580,367,0,349,429,646,"Human, Federation, Starfleet, Desperate, Romantic, Prisoner","male, organic, tos, captain, bridge_crew, kirk, crew_max_rarity_4","All Men are Brothers",2, 8, 8, 6, 10, 5, 0, , , , 450, 100, 147, 350, false,"Kirk",crew_portraits_cm_kirk_romancaptive_sm.png
"Laborer Kirk",2,5, 1013,107,294,0,0,0,0,0,0,1292,210,476,496,65,151,0,0,0,186,247,2,129,124,676,81,437,428,68,499,565,21,25,339,432,472,12,336,355,0,131,664,0,128,723,0,46,65,547,50,289,"Human, Federation, Starfleet, Jury Rigger, Resourceful, Romantic, Thief, Desperate","male, organic, tos, captain, bridge_crew, kirk, crew_max_rarity_5","How Are The Stone Knives And Bearskins?",2, 7, 8, 8, 12, 2, 0, , , , 200, 200, 147, 375, false,"Kirk",crew_portraits_cm_kirk_laborer_sm.png
"Dr. Reyga",4,3, 0,0,0,512,39,149,0,0,0,0,0,0,300,34,130,0,0,0,746,921,925,836,918,739,599,617,585,919,837,914,806,909,769,706,0,0,737,0,693,449,514,426,0,765,0,690,0,597,870,903,"Ferengi, Astrophysicist, Innovator, Maverick","nonhuman, male, organic, tng, reyga, crew_max_rarity_3","Metaphasic Shield",2, 3, 6, 3, 10, 3, 0, , , , 425, , 25, 640, true,"Reyga",crew_portraits_cm_reyga_sm.png
"Leucon",3,5, 0,0,0,974,210,435,490,96,200,1268,295,448,0,0,0,0,0,0,152,425,52,679,568,37,1,177,103,31,453,275,44,21,554,180,579,89,0,0,51,6,210,128,26,623,473,94,43,0,5,74,"Civilian, Brunali, Botanist, Desperate, Jury Rigger, Geneticist","male, organic, voy, leucon, crew_max_rarity_5","You Can Make A Difference Here",1, 9, 8, 10, 12, , , , , , 445, 100, 140, 365, false,"Leucon",crew_portraits_cm_leucon_sm.png
"Lt. Jadzia Dax",9,1, 0,0,0,262,12,50,0,0,0,208,24,58,0,0,0,0,0,0,903,942,906,944,944,895,736,896,855,893,944,944,900,867,943,790,0,741,0,0,792,490,780,483,674,0,0,760,432,0,931,952,"Federation, Starfleet, Exobiology, Astrophysicist, Trill, Gambler, Pilot","nonhuman, female, organic, ds9, lieutenant, bridge_crew, dax, crew_max_rarity_1","Trill Memories",0, 1, 6, 10, 10, , , , , , 235, 10, 20, 65, false,"J. Dax",crew_portraits_cm_jadzias1_sm.png
"1701 Jadzia Dax",5,4, 0,0,0,813,61,128,301,60,122,510,38,103,0,0,0,0,0,0,518,720,598,865,838,338,231,546,318,424,756,646,626,358,814,707,685,700,0,0,446,323,692,427,459,753,584,713,408,0,693,839,"Federation, Starfleet, Exobiology, Astrophysicist, Trill, Gambler, Undercover Operative, Pilot","nonhuman, female, organic, ds9, lieutenant, bridge_crew, dax, crew_max_rarity_4","Who You've Been",1, 7, 8, 10, 8, , , , , , 1140, 20, 225, 1390, false,"J. Dax",crew_portraits_cm_jadziadaxtos_sm.png
"Lt. Commander Jadzia Dax",7,5, 0,0,0,1154,196,418,0,0,0,436,123,263,882,152,299,0,0,0,143,707,401,368,636,142,55,26,95,394,357,631,48,238,240,207,0,386,471,0,198,43,41,145,389,466,0,60,233,325,265,179,"Federation, Starfleet, Exobiology, Astrophysicist, Trill, Gambler, Pilot","nonhuman, female, organic, ds9, lieutenant_commander, bridge_crew, dax, crew_max_rarity_5","Know Who You Are",2, 8, 6, 6, 6, , , , , , 1015, 245, 240, 575, true,"J. Dax",crew_portraits_cm_jadziatongo_sm.png
"Festive Jadzia Dax",2,2, 0,0,0,367,32,125,0,0,0,0,0,0,255,28,69,0,0,0,831,932,935,893,935,821,756,723,736,930,883,932,868,930,852,742,0,0,794,0,734,481,623,452,0,804,0,749,0,641,906,928,"Federation, Starfleet, Exobiology, Astrophysicist, Trill, Gambler, Pilot, Romantic","nonhuman, female, organic, ds9, lieutenant, bridge_crew, dax, crew_max_rarity_2","Toruk-DOH!",0, 3, 8, 6, 10, 4, 2, , , , 260, 80, 25, 515, false,"J. Dax",crew_portraits_cm_jadzia_purple_sm.png
"Desert Ezri Dax",10,1, 0,0,0,0,0,0,0,0,0,0,0,0,183,27,67,223,38,114,941,943,943,922,888,941,940,908,852,940,910,870,908,847,774,0,0,0,795,647,0,0,771,454,0,805,613,750,404,514,933,930,"Federation, Starfleet, Trill, Counselor","nonhuman, female, organic, ds9, lieutenant, bridge_crew, dax, crew_max_rarity_1","Unexpected Situation",0, 1, 6, 10, 10, , , , , , 180, 20, 25, 145, false,"E. Dax",crew_portraits_cm_ezridesert_sm.png
"Sniper Ezri Dax",3,3, 0,0,0,0,0,0,351,78,184,0,0,0,227,131,301,391,62,144,904,733,898,788,670,733,869,756,571,676,623,454,748,542,491,0,608,0,484,590,594,0,425,407,519,250,278,364,364,177,791,638,"Federation, Starfleet, Trill, Counselor, Investigator, Marksman","nonhuman, female, organic, ds9, lieutenant, bridge_crew, dax, crew_max_rarity_3","Killer Instinct",2, 4, 6, 8, 10, 4, 1, , , , 355, 100, 150, 215, false,"E. Dax",crew_portraits_cm_ezrisniper_sm.png
"Mirror Ezri Tigan",9,4, 0,0,0,0,0,0,464,222,447,0,0,0,591,191,378,0,0,0,889,597,886,590,873,598,845,579,828,523,347,487,564,828,483,0,268,0,377,0,160,0,277,0,139,32,119,228,0,237,766,355,"Trill, Scoundrel, Smuggler, Mirror Universe","nonhuman, female, organic, ds9, mirror, dax, crew_max_rarity_4","Blackmail",2, 7, 12, 12, 16, 5, 0, , , , 995, 125, 127, 1090, false,"Ezri",crew_portraits_cm_ezrimirror_sm.png
"Blood Oath Jadzia Dax",7,4, 0,0,0,483,160,349,728,140,265,225,153,356,0,0,0,0,0,0,559,497,604,835,795,176,255,575,354,261,548,370,634,362,768,310,471,246,0,0,55,39,342,200,49,521,349,282,159,0,606,196,"Federation, Starfleet, Duelist, Gambler, Tactician, Trill, Pilot","nonhuman, female, organic, ds9, lieutenant, bridge_crew, dax, crew_max_rarity_4","Who You've Been",1, 7, 8, 10, 8, , , , , , 400, 75, 405, 205, false,"J. Dax",crew_portraits_cm_jadziabloodoath_sm.png
"Waitress Ezri",7,4, 0,0,0,0,0,0,287,47,135,0,0,0,652,193,390,450,162,497,829,701,828,517,475,705,754,503,347,643,396,268,468,308,152,0,686,0,359,115,706,0,264,121,609,193,58,218,72,18,626,195,"Trill, Federation, Starfleet, Costumed, Undercover Operative, Counselor, Resourceful","nonhuman, female, organic, ds9, dax, crew_max_rarity_4","Slip Him a Mickey",2, 7, 12, 5, 12, 1, 0, , , , 205, 145, 150, 575, false,"E. Dax",crew_portraits_cm_ezriwaitress_sm.png
"Klingon Bride Jadzia",6,5, 0,0,0,993,128,279,351,137,273,0,0,0,1014,323,585,0,0,0,229,508,677,225,630,64,195,18,158,413,87,378,127,483,117,425,463,0,138,0,83,272,11,260,364,23,342,45,0,74,255,60,"Federation, Starfleet, Exobiology, Astrophysicist, Trill, Gambler, Romantic, Klingon, Pilot","nonhuman, female, organic, ds9, lieutenant, bridge_crew, dax, crew_max_rarity_5","Lead With My Heart",0, 7, 6, 8, 14, 7, 2, , , , 750, 20, 455, 405, false,"J. Dax",crew_portraits_cm_jadzia_dax_bride_sm.png
