"Antaak",7,4, 0,0,0,630,60,159,0,0,0,0,0,0,0,0,0,532,214,753,603,870,875,878,411,607,408,613,137,862,871,393,854,260,430,668,0,0,0,29,646,417,658,17,0,0,31,0,13,59,739,402,"Klingon, Physician, Desperate, Geneticist","nonhuman, male, organic, ent, crew_max_rarity_4","Klingon Mercy",2, 5, 12, 12, 20, 2, 0, , , , 425, 800, 245, , false,"Antaak",crew_portraits_cm_antaakent_sm.png
"Hugh",5,3, 0,0,0,0,0,0,361,128,282,190,56,124,323,62,138,0,0,0,910,724,827,801,900,724,752,779,876,549,619,657,672,736,719,0,461,657,708,0,402,459,682,0,188,327,341,430,386,561,820,714,"Borg, Maverick, Cultural Figure","nonhuman, male, organic, hugh, tng, crew_max_rarity_3","I Will Not",0, 4, 6, 8, 10, 6, 0, , , , 352, 120, 83, 340, false,"Hugh",crew_portraits_cm_hugh_sm.png
"Thot Gor",9,4, 688,178,406,0,0,0,350,114,223,0,0,0,544,83,168,0,0,0,453,313,399,283,373,641,738,593,720,560,434,525,577,716,494,239,137,179,174,176,483,0,629,0,439,347,413,594,0,511,597,413,"Breen, Diplomat, Dominion, Resourceful, Communicator","organic, evsuit, ds9, gor, crew_max_rarity_4","Breen Dominance",0, 9, 10, 20, 10, , , 1, , , 775, 335, 65, 300, false,"Gor",crew_portraits_cm_thot_gor_sm.png
"Frederick La Rouque",10,5, 1010,145,341,0,0,0,0,0,0,0,0,0,1271,222,481,0,0,0,256,316,228,16,196,730,590,149,575,672,198,668,114,548,105,337,399,274,42,267,0,0,164,0,0,238,0,114,0,138,343,399,"Human, Gambler, Scoundrel, Linguist, Civilian","male, organic, tng, larouque, crew_max_rarity_5","A Poker Face Carved In Marble",2, 8, 10, 10, 14, 4, 0, , , , 495, 140, 137, 415, false,"La Rouque",crew_portraits_cm_larouque_sm.png
"Glinn Damar",8,2, 262,37,86,0,0,0,321,48,160,0,0,0,0,0,0,0,0,0,881,723,879,886,865,830,926,930,926,812,845,803,933,929,930,766,533,712,775,665,668,0,0,0,578,735,559,0,0,0,907,913,"Cardassian","nonhuman, male, organic, ds9, bridge_crew, damar, crew_max_rarity_2","Bonds of Loyalty",2, 2, 6, 10, 10, 8, 4, , , , 195, 145, , 220, false,"Damar",crew_portraits_cm_damar_sm.png
"Revolutionary Damar",7,5, 895,336,692,0,0,0,391,124,400,0,0,0,869,133,328,0,0,0,159,106,131,49,95,450,550,306,531,390,134,357,275,499,243,33,6,20,11,22,284,0,396,0,257,86,224,326,0,313,280,18,"Cardassian, Cultural Figure, Inspiring, Hero, Desperate","nonhuman, male, organic, ds9, damar, crew_max_rarity_5","For Cardassia!",2, 7, 12, 10, 14, 7, 0, , , , 450, 395, 100, 465, false,"Damar",crew_portraits_cm_damarrevolution_sm.png
"Ripper",8,5, 0,0,0,852,195,430,1332,182,366,0,0,0,0,0,0,0,0,0,302,206,724,783,692,11,239,324,187,128,218,92,744,571,693,196,351,0,0,0,17,153,226,141,233,383,199,0,0,0,366,414,"Brutal, Desperate, Explorer, Primal, Survivalist","organic, dsc, nonhuman, ripper, crew_max_rarity_5","Mycelial Mastery",1, 9, 10, 12, 12, , , , , , 675, 250, 105, 325, false,"Ripper",crew_portraits_cm_tardigrade_sm.png
"Annorax",6,5, 940,76,208,1204,243,569,386,140,296,0,0,0,0,0,0,0,0,0,13,151,244,362,207,25,99,105,63,391,532,358,684,454,617,26,239,535,616,491,14,93,104,76,339,484,317,0,0,0,200,130,"Krenim, Desperate, Romantic, Theoretical Engineer, Scoundrel, Brutal","male, organic, voy, annorax, crew_max_rarity_5","I'll Make The Time",2, 6, 12, 12, 20, 2, 0, , , , 600, 200, 195, 390, false,"Annorax",crew_portraits_cm_annorax_sm.png
"Beloved Annorax",5,5, 539,36,117,1262,176,389,0,0,0,1024,131,282,0,0,0,0,0,0,37,463,42,487,334,101,8,121,71,178,718,583,180,101,591,137,708,199,749,644,244,48,280,171,360,0,0,390,218,0,109,442,"Krenim, Desperate, Theoretical Engineer, Casual, Survivalist","male, organic, voy, annorax, crew_max_rarity_5","Time Is Patient",2, 7, 10, 5, 12, 7, 0, , , , 300, 100, 100, 315, false,"Annorax",crew_portraits_cm_annorax_beloved_sm.png
"Commander Nevesa",9,4, 660,134,471,0,0,0,0,0,0,0,0,0,586,92,237,0,0,0,522,536,464,318,444,874,834,614,820,868,648,851,593,820,513,214,311,160,127,152,0,0,541,0,0,582,0,490,0,432,752,611,"Crafty, Romantic, Romulan, Resourceful","female, nonhuman, tos, nevesa, commander, crew_max_rarity_4","Hidden in Plain Sight",1, 7, 10, 8, 14, 1, 2, , , , 290, 310, 70, 565, false,"Nevesa",crew_portraits_cm_romulancommander_sm.png
"Ba'ul",3,5, 0,0,0,0,0,0,1302,191,342,1099,37,141,0,0,0,548,53,209,684,164,170,693,289,84,171,677,228,8,163,10,189,13,297,0,359,662,0,519,275,465,0,356,118,399,70,674,200,498,65,585,"Ba'ul, Brutal, Interrogator, Geneticist","nonhuman, organic, baul, dsc, crew_max_rarity_5","The Truth Will Be Contained",0, 8, 8, 6, 12, 1, 2, , , , 295, 30, 234, 150, false,"Ba'ul",crew_portraits_cm_baul_sm.png
"Siranna",8,4, 0,0,0,363,79,183,0,0,0,0,0,0,601,96,197,739,158,348,634,812,804,576,342,643,429,353,165,778,596,332,538,225,129,602,0,0,608,243,593,382,294,86,0,628,242,543,161,98,554,509,"Gardener, Kelpien, Spiritual","nonhuman, female, organic, dsc, siranna, crew_max_rarity_4","Look Down Every Now And Then",2, 5, 12, 12, 20, 2, 0, , , , 375, 50, 168, 150, false,"Siranna",crew_portraits_cm_siranna_sm.png
"Priestess Siranna",7,4, 529,112,242,0,0,0,0,0,0,0,0,0,883,138,286,382,78,211,552,553,498,209,256,790,678,384,381,756,447,500,330,340,163,486,511,426,217,125,0,0,434,337,0,499,478,374,315,129,483,506,"Gardener, Kelpien, Spiritual, Civilian, Ambassador, Cultural Figure","nonhuman, female, organic, dsc, siranna, crew_max_rarity_4","The Truth Has Survived",1, 7, 6, 8, 8, , , , , , 450, 200, 100, 475, false,"Siranna",crew_portraits_cm_siranna_priestess_sm.png
"Ensign Vorik",7,3, 0,0,0,0,0,0,0,0,0,383,120,316,0,0,0,0,0,0,937,938,771,942,940,938,663,938,936,740,941,940,774,629,938,0,0,325,0,0,0,256,0,0,340,0,0,357,203,0,922,871,"Starfleet, Federation, Vulcan, Telepath","nonhuman, male, organic, voy, crew_max_rarity_3","Only Logical",1, 4, 10, 6, 15, 2, 0, , 0, 2, 757, 185, 474, 380, false,"Vorik",crew_portraits_cm_vorik_sm.png
"Ensign Seska",5,2, 0,0,0,0,0,0,217,42,145,319,44,122,0,0,0,0,0,0,934,887,842,940,937,881,781,934,931,677,884,858,828,771,934,0,683,669,0,0,698,476,0,0,423,747,579,685,395,0,916,902,"Bajoran, Cardassian, Starfleet, Obsidian Order, Undercover Operative","nonhuman, female, organic, voy, ensign, seska, crew_max_rarity_2","Subtle Sabotage",1, 2, 0, 10, 14, 4, 0, , , , 115, 155, 43, 270, true,"Seska",crew_portraits_cm_seskastarfleet_sm.png
"Kazon Seska",8,4, 465,73,156,0,0,0,327,113,276,798,47,124,0,0,0,0,0,0,631,455,271,661,546,668,353,830,758,276,694,544,512,278,796,652,299,366,676,562,427,473,0,0,220,535,366,681,393,0,669,716,"Cardassian, Kazon, Obsidian Order, Undercover Operative, Villain","nonhuman, female, organic, voy, ensign, seska, crew_max_rarity_4","Shield Puncture",0, 6, 6, 6, 6, , , , , , 715, 155, 184, 1025, true,"Seska",crew_portraits_cm_seskakazonfurs_sm.png
"Yelgrun",7,4, 572,101,216,405,85,247,0,0,0,0,0,0,638,203,466,0,0,0,314,552,491,248,466,606,407,246,378,768,521,762,425,672,370,177,552,484,113,445,491,322,58,309,0,267,0,133,0,156,523,283,"Dominion, Vorta, Clone, Diplomat, Musician","male, ds9, yelgrun, nonhuman, crew_max_rarity_4","I Was Cloned",1, 5, 3, 6, 6, , , , , , 400, 265, 98, 275, true,"Yelgrun",crew_portraits_cm_yelgrun_sm.png
"Chief Engineer Torres",7,1, 0,0,0,0,0,0,97,40,154,252,21,81,0,0,0,0,0,0,943,914,899,946,946,914,871,944,945,823,915,899,893,853,948,0,674,725,0,0,687,518,0,0,487,744,574,742,426,0,937,922,"Starfleet, Federation, Human, Klingon, Maquis, Innovator, Jury Rigger, Saboteur, Cyberneticist","nonhuman, female, organic, voy, lieutenant, torres, crew_max_rarity_1","Natural Engineer",0, 2, 8, 10, 12, , , , 1, 1, 460, 45, 135, 255, false,"Torres",crew_portraits_cm_torreschiefengineer_sm.png
"Maquis Takeover Torres",3,3, 148,76,204,0,0,0,281,78,212,462,44,148,0,0,0,0,0,0,826,673,568,837,796,774,582,906,875,501,802,716,719,537,890,577,338,287,619,497,558,444,0,0,296,634,479,658,377,0,819,734,"Starfleet, Human, Klingon, Maquis, Jury Rigger, Saboteur","nonhuman, female, organic, voy, lieutenant, torres, crew_max_rarity_3","Repressed Command",2, 3, 6, 4, 10, 1, 1, , , , 740, , 130, 475, false,"Torres",crew_portraits_cm_torresmaquis_sm.png
"Liaison Torres",8,4, 263,115,295,0,0,0,0,0,0,551,83,250,669,128,307,0,0,0,680,657,313,406,583,823,393,532,740,500,571,792,215,323,437,420,462,88,170,345,0,319,424,0,442,489,0,86,272,342,636,406,"Federation, Human, Cyberneticist, Klingon, Civilian, Diplomat","nonhuman, female, organic, voy, torres, crew_max_rarity_4","Career Change",0, 5, 12, 12, 20, 2, 0, , , , , 345, , 750, false,"Torres",crew_portraits_cm_torres25c_sm.png
"Duelist Torres",8,5, 0,0,0,0,0,0,903,165,428,1067,208,464,0,0,0,0,0,0,767,372,204,795,715,312,194,771,626,30,383,233,233,132,711,0,319,120,0,0,216,134,0,0,8,340,168,132,71,0,407,325,"Athlete, Innovator, Jury Rigger, Human, Federation, Klingon, Maquis, Duelist, Cyberneticist","female, organic, voy, nonhuman, torres, crew_max_rarity_5","Empassioned Maneuver",1, 8, 10, 10, 12, 8, 4, , , , 800, 280, 20, 100, false,"Torres",crew_portraits_cm_torresduelist_sm.png
"Assimilated Torres",7,5, 0,0,0,0,0,0,851,124,323,1114,231,477,0,0,0,0,0,0,776,404,178,800,725,339,176,776,638,33,430,250,199,114,718,0,430,110,0,0,370,120,0,0,13,470,306,110,57,0,420,430,"Borg, Jury Rigger, Human, Federation, Klingon, Maquis, Undercover Operative, Cyberneticist","female, organic, voy, nonhuman, torres, crew_max_rarity_5","Modulated Shields",0, 8, 6, 10, 10, 3, 0, 3, , , 680, 125, 260, 400, false,"Torres",crew_portraits_cm_torres_assimilated_sm.png
"Klingon Torres",7,4, 0,0,0,0,0,0,895,81,230,625,75,208,0,0,0,0,0,0,865,493,539,872,848,462,403,852,789,157,543,366,580,333,824,0,562,537,0,0,522,364,0,0,186,606,453,556,319,0,712,810,"Klingon, Civilian, Brutal, Duelist, Desperate, Prisoner","nonhuman, female, organic, voy, torres, crew_max_rarity_4","You Need Me",0, 5, 1, 12, 20, 2, 0, , , , 355, 275, 53, 405, true,"Torres",crew_portraits_cm_torres_klingon_sm.png
"Human Torres",8,5, 0,0,0,0,0,0,0,0,0,992,107,262,1270,182,357,0,0,0,754,752,276,252,702,753,240,190,605,274,249,692,15,160,143,0,0,408,394,0,0,297,309,0,403,390,0,43,245,254,380,636,"Jury Rigger, Human, Federation, Starfleet, Maquis, Prisoner, Cyberneticist","female, organic, voy, torres, crew_max_rarity_5","Brute Force Isn't Going To Do It",2, 10, 12, 10, 10, , , , , , 350, 200, 100, 150, false,"Torres",crew_portraits_cm_torres_human_sm.png
"Delta Flyer Torres",4,5, 554,60,132,0,0,0,1021,79,246,1278,190,397,0,0,0,0,0,0,390,123,24,461,305,211,98,684,443,10,306,159,73,38,584,702,374,75,712,604,505,184,0,0,50,590,431,210,117,0,90,470,"Human, Federation, Starfleet, Romantic, Pilot, Athlete, Klingon","nonhuman, female, organic, voy, torres, crew_max_rarity_5","You Know How Much I Hate To Lose",0, 9, 8, 10, 12, , , , 2, 3, 400, 100, 108, 300, false,"Torres",crew_portraits_cm_torres_deltaflyer_sm.png
"Injured Torres",1,2, 259,48,109,0,0,0,0,0,0,369,62,197,0,0,0,0,0,0,859,858,659,869,843,929,677,925,920,754,928,925,782,651,922,740,703,348,743,638,0,385,0,0,521,0,0,580,334,0,892,880,"Starfleet, Klingon, Human, Maquis, Survivalist, Innovator, Jury Rigger, Cyberneticist, Federation, Desperate","nonhuman, female, voy, torres, lieutenant, crew_max_rarity_2","I'm Going To Get This One",1, 4, 6, 6, 8, 3, 0, , , , 253, 200, 105, 225, false,"Torres",crew_portraits_cm_torre_injured_sm.png
"Section 31 Reed",8,2, 119,20,64,0,0,0,309,51,157,0,0,0,0,0,0,0,0,0,917,799,919,928,913,856,935,939,939,850,869,836,940,939,939,782,583,737,801,690,669,0,0,0,579,736,560,0,0,0,925,924,"Starfleet, Human, Undercover Operative, Marksman, Desperate, Section 31","male, organic, ent, lieutenant, reed, crew_max_rarity_2","Covert Strike",1, 2, 6, 2, 12, 1, 1, , , , 270, 150, 3, 190, false,"Reed",crew_portraits_cm_reedsection31_sm.png
"Sniper Reed",7,3, 331,92,246,0,0,0,401,98,204,0,0,0,0,0,0,0,0,0,775,581,751,799,724,757,907,917,899,699,790,696,920,900,912,506,284,453,564,414,537,0,0,0,480,617,468,0,0,0,856,790,"Starfleet, Human, Tactician, Marksman","male, organic, ent, lieutenant, reed, crew_max_rarity_3","Deception and Surprise",0, 3, 6, 3, 12, 1, 0, , , , 515, 245, 15, 250, false,"Reed",crew_portraits_cm_reedsniper_sm.png
"Suliban Reed",9,5, 925,262,605,0,0,0,452,100,219,0,0,0,897,178,312,0,0,0,179,118,145,53,116,467,561,301,541,402,139,368,269,512,239,71,52,45,21,44,513,0,364,0,462,166,438,300,0,288,299,77,"Starfleet, Human, Suliban, Tactician, Saboteur, Undercover Operative","male, organic, ent, lieutenant, reed, crew_max_rarity_5","Starting to Itch",1, 7, 6, 12, 12, 0, 1, , , , 65, 250, 40, 575, false,"Reed",crew_portraits_cm_reedsuliban_sm.png
"Rura Penthe Reed",7,4, 497,121,372,0,0,0,624,163,548,0,0,0,0,0,0,0,0,0,609,279,551,631,522,509,833,867,817,440,578,407,860,818,842,326,48,267,428,259,134,0,0,0,119,230,101,0,0,0,749,383,"Starfleet, Human, Desperate, Criminal, Undercover Operative, Prisoner","male, organic, ent, reed, crew_max_rarity_4","As You Were",0, 9, 8, 12, 10, , , 2, , , 755, 235, 173, 400, false,"Reed",crew_portraits_cm_reedrurapenthe_sm.png
"Mirror Reed",8,5, 983,151,362,0,0,0,1215,256,560,0,0,0,0,0,0,0,0,0,263,36,238,356,205,124,592,736,579,111,199,76,727,552,678,302,24,239,411,230,82,0,0,0,83,160,64,0,0,0,347,273,"Terran Empire, Human, Brutal, MACO, Marksman, Starfleet, Mirror Universe","male, organic, ent, reed, crew_max_rarity_5","Extreme Punishment",0, 9, 12, 5, 10, 1, 0, 2, , , 555, 210, 147, 350, false,"Reed",crew_portraits_cm_reed_mirror_sm.png
"Tourist Reed",9,4, 732,138,369,0,0,0,239,165,337,0,0,0,719,13,30,0,0,0,439,318,386,244,356,650,713,566,702,562,414,529,545,696,468,313,98,250,389,238,305,0,784,0,276,386,244,768,0,657,565,519,"Starfleet, Human, Romantic, Desperate, Resourceful","male, organic, ent, lieutenant, reed, crew_max_rarity_4","Follow Two Aliens into a Basement",2, 9, 11, 4, 10, , , , , , 190, 292, 120, 450, false,"Reed",crew_portraits_cm_reed_tourist_sm.png
"Abraham Lincoln",9,5, 947,152,276,0,0,0,416,103,203,0,0,0,927,329,639,0,0,0,259,152,229,46,199,483,554,187,535,418,96,382,148,504,140,403,229,334,17,326,530,0,67,0,476,29,459,32,0,60,290,66,"Human, Civilian, President, Resourceful, Inspiring, Diplomat, Cultural Figure","male, organic, crew_max_rarity_5","No Gentle Way",2, 9, 12, 5, 12, 1, 0, , , , 1250, 195, 252, 925, false,"Lincoln",crew_portraits_cm_abrahamlincoln_sm.png
"Gul Madred",9,5, 925,149,298,0,0,0,924,274,608,0,0,0,464,114,222,0,0,0,261,64,235,162,204,166,552,487,533,161,92,121,449,501,392,379,25,318,207,310,67,0,535,0,59,36,47,482,0,423,285,79,"Cardassian, Interrogator, Brutal, Survivalist, Veteran","nonhuman, male, organic, tng, madred, crew_max_rarity_5","Five Lights",1, 7, 14, 6, 10, 1, 0, 2, , , 415, 420, , 300, false,"Madred",crew_portraits_cm_gulmadred_sm.png
"Garth of Izar",5,5, 1214,226,444,0,0,0,989,156,344,0,0,0,487,83,142,0,0,0,110,16,84,94,50,177,482,463,454,175,106,141,424,413,369,162,55,122,144,112,308,0,652,0,278,219,246,622,0,533,114,219,"Prisoner, Desperate, Human, Brutal, Resourceful, Villain, Shapeshifter, Veteran","organic, male, tos, garth_izar, crew_max_rarity_5","I'm Afraid of No One",0, 8, 6, 8, 10, 1, 0, 2, , , 300, 200, 185, 225, false,"Garth",crew_portraits_cm_garth_izar_sm.png
"Nomad",5,5, 0,0,0,1281,182,365,556,91,145,988,115,218,0,0,0,0,0,0,106,435,198,706,601,22,19,118,69,49,470,288,223,128,594,262,638,460,0,0,93,70,300,178,213,695,527,483,273,0,117,456,"Brutal, Telepath, Exobiology, Explorer, Probe, Resourceful","nonhuman, tos, artificial_life, nomad, crew_max_rarity_5","That Which Is Imperfect Must Be Sterilized",0, 8, 8, 10, 10, , , , , , 100, 505, 150, 50, false,"Nomad",crew_portraits_cm_nomad_sm.png
"Mirror 'Smiley' O'Brien",2,3, 373,37,77,0,0,0,180,30,84,545,30,102,0,0,0,0,0,0,772,693,504,796,720,836,560,904,871,545,849,810,704,510,887,768,646,589,777,668,764,500,0,0,535,790,629,719,413,0,813,899,"Human, Resourceful, Jury Rigger, Terran Rebellion, Mirror Universe","male, organic, ds9, mirror, captain, obrien, crew_max_rarity_3","Reroute Subsystems",1, 5, 6, 10, 20, 3, 0, , , , 290, , 74, 1030, false,"O'Brien",crew_portraits_cm_obriensmiley_sm.png
"Chief O'Brien",6,4, 305,12,46,0,0,0,495,63,148,631,153,350,0,0,0,0,0,0,743,533,331,773,684,656,372,853,790,271,685,536,541,299,825,792,605,202,809,699,657,222,0,0,114,729,554,287,162,0,714,724,"Human, Starfleet, Federation, Jury Rigger, Veteran","male, organic, ds9, obrien, crew_max_rarity_4","Power Up Interface",2, 6, 6, 6, 6, , , , , , 1205, 200, 510, 100, true,"O'Brien",crew_portraits_cm_obrienpostfirstcontact_sm.png
"Undercover O'Brien",4,4, 0,0,0,0,0,0,723,145,288,638,114,239,228,13,39,0,0,0,842,512,495,784,820,487,373,754,755,159,448,385,415,302,694,0,448,429,810,0,388,307,781,0,94,433,322,403,258,654,660,676,"Human, Starfleet, Federation, Jury Rigger, Veteran, Undercover Operative","male, organic, ds9, obrien, crew_max_rarity_4","Intelligence Report",1, 7, 6, 12, 12, 5, 0, 2, , , 1200, 355, 412, 565, false,"O'Brien",crew_portraits_cm_obrienundercover_sm.png
"Klingon O'Brien",4,4, 0,0,0,0,0,0,432,28,60,589,104,229,746,167,372,0,0,0,812,629,483,474,779,651,365,431,686,295,341,530,130,291,328,0,741,461,395,0,782,320,310,0,356,308,645,50,274,255,540,595,"Starfleet, Federation, Klingon, Human, Jury Rigger, Undercover Operative, Duelist, Veteran","male, organic, ds9, obrien, crew_max_rarity_4","House of Konjah",2, 8, 6, 4, 10, 3, 0, 2, , , 1380, 240, 110, 690, false,"O'Brien",crew_portraits_cm_obrien_klingon_sm.png
"RAF Miles O'Brien",5,5, 1060,60,137,0,0,0,625,95,205,1121,176,346,0,0,0,0,0,0,230,113,12,322,173,350,136,696,479,37,441,257,138,79,612,694,391,103,709,599,539,220,0,0,79,619,470,273,153,0,178,550,"Human, Pilot, Jury Rigger, Hero, Costumed","male, organic, tng, obrien, ds9, crew_max_rarity_5","Per Ardua Ad Astra",0, 7, 16, 3, 16, 1, 2, , , , 700, , 182, 890, false,"O'Brien",crew_portraits_cm_obrienwwii_sm.png
"Falcon O'Brien",6,5, 913,97,234,0,0,0,1353,80,168,486,89,191,0,0,0,0,0,0,281,58,60,379,226,136,320,708,522,41,211,88,445,239,636,515,331,158,570,423,607,366,0,0,255,683,515,559,321,0,267,663,"Human, Starfleet, Federation, Costumed, Villain, Hologram, Brutal, Scoundrel","male, organic, ds9, obrien, crew_max_rarity_5","I Expect You To Die",0, 9, 10, 14, 12, , , 2, , , , 25, 100, 450, false,"Falcon",crew_portraits_cm_obrien_falcon_sm.png
"Prisoner O'Brien",4,4, 0,0,0,0,0,0,583,83,187,694,244,503,447,11,21,0,0,0,813,556,335,669,780,553,275,650,687,126,425,448,227,191,542,0,603,86,813,0,581,105,786,0,32,618,498,79,42,660,539,523,"Human, Starfleet, Federation, Prisoner, Desperate, Survivalist, Brutal, Jury Rigger","male, organic, ds9, obrien, crew_max_rarity_4","It's Real To Me",0, 7, 4, 14, 16, 5, 0, , , , 400, 80, 85, 525, false,"O'Brien",crew_portraits_cm_obrien_prisoner_sm.png
"Augment Commander O'Brien",6,5, 0,0,0,0,0,0,1139,311,671,965,175,366,0,0,0,0,0,0,738,191,241,768,679,122,213,735,577,17,197,74,264,146,677,0,113,214,0,0,38,211,0,0,1,90,28,254,144,0,346,132,"Human, Augments, Engineered, Tactician, Saboteur, Marksman, Brutal, Innovator","male, organic, obrien, tos, tng, ds9, original, crew_max_rarity_5","Take Aim!",0, 9, 8, 8, 12, 7, 4, , , , 540, 410, 45, 200, false,"O'Brien",crew_portraits_cm_obrien_augment_sm.png
"Keevan",5,3, 486,60,156,0,0,0,0,0,0,0,0,0,303,85,199,0,0,0,744,738,715,609,685,919,909,788,901,912,819,907,776,902,731,673,657,623,424,577,0,0,594,0,0,644,0,555,0,480,860,843,"Vorta, Dominion, Clone, Crafty, Brutal","nonhuman, male, organic, ds9, crew_max_rarity_3","Immoral Diplomacy",1, 7, 8, 12, 12, , , , 0, 2, 415, 185, , 330, false,"Keevan",crew_portraits_cm_keevan_sm.png
"Returning Craft",7,5, 1246,211,449,0,0,0,972,97,212,0,0,0,531,57,172,0,0,0,101,35,80,85,45,260,494,432,469,223,120,197,386,430,330,167,116,127,148,114,527,0,648,0,474,394,455,619,0,530,150,389,"Romantic, Human, Crafty, Resourceful, Pilot, Veteran","male, organic, craft, dsc, crew_max_rarity_5","Then I'll Just Say Goodbye",1, 9, 4, 10, 8, , , , , , 440, 270, 10, 200, false,"Craft",crew_portraits_cm_craft_shuttle_sm.png
"Stranded Craft",5,3, 337,48,130,0,0,0,526,63,171,223,29,79,0,0,0,0,0,0,763,542,625,793,711,699,733,900,862,519,741,615,800,713,883,719,459,532,728,616,630,514,0,0,436,698,530,738,424,0,805,836,"Romantic, Human, Crafty, Resourceful, Pilot, Veteran","male, organic, craft, dsc, crew_max_rarity_3","Anyone Else On This Ship?",2, 5, 4, 8, 12, , , , , , 540, , 40, 150, false,"Craft",crew_portraits_cm_craft_sm.png
"Ishara Yar",4,5, 559,49,125,0,0,0,1311,163,352,1079,66,131,0,0,0,0,0,0,394,83,44,465,313,92,177,685,448,12,170,49,201,116,589,721,253,405,730,620,299,438,0,0,116,411,234,651,371,0,102,643,"Human, Scoundrel, Veteran, Saboteur, Desperate","female, tng, yar_ishara, crew_max_rarity_5","I Did What I Had To",1, 10, 6, 10, 10, , , , , , 410, 200, 45, 215, false,"Ishara",crew_portraits_cm_yar_ishara_sm.png
"Technician Rom",4,2, 0,0,0,0,0,0,0,0,0,383,34,76,187,28,79,0,0,0,935,937,835,910,938,937,768,897,934,822,898,939,750,756,880,0,0,720,785,0,0,512,764,0,658,798,0,633,423,635,920,941,"Ferengi, Bajoran, Civilian, Saboteur, Jury Rigger","nonhuman, male, organic, ds9, rom, crew_max_rarity_2","Jurryrigged Fix",2, 2, 6, 4, 4, 2, 0, 2, , , 230, 50, 100, 225, false,"Rom",crew_portraits_cm_romtechnitian_sm.png
"Grand Nagus Rom",8,5, 583,10,26,0,0,0,0,0,0,869,126,257,951,254,502,0,0,0,491,515,89,146,407,720,244,233,562,281,303,651,22,166,185,795,754,346,202,703,0,286,140,0,393,200,0,17,237,116,326,409,"Ferengi, Bajoran, Diplomat, Saboteur, Cultural Figure","nonhuman, male, organic, ds9, nagus, rom, crew_max_rarity_5","Equal Pay",2, 9, 12, 12, 12, , , , , , 900, , 135, 950, false,"Rom",crew_portraits_cm_romnagus_sm.png
"Niners Rom",3,4, 0,0,0,0,0,0,544,144,297,853,102,239,0,0,0,0,0,0,871,594,429,876,855,595,332,858,802,172,633,483,481,253,832,0,437,448,0,0,380,314,0,0,96,477,312,476,268,0,728,720,"Ferengi, Bajoran, Desperate, Resourceful, Jury Rigger, Athlete, Saboteur, Hero, Costumed","nonhuman, male, organic, ds9, rom, niners, crew_max_rarity_4","Bunt",0, 8, 6, 6, 10, , , , 2, 2, 865, 300, 185, 80, false,"Rom",crew_portraits_cm_rom_niners_sm.png
"Doctor Ann Mulhall",7,5, 1032,76,245,1301,151,322,0,0,0,0,0,0,484,90,186,0,0,0,11,266,181,142,148,106,109,51,74,621,511,596,413,425,356,95,546,480,349,440,342,235,141,222,0,651,0,564,0,486,145,504,"Starfleet, Federation, Exobiology, Explorer, Human","female, organic, tos, ann_mulhall, crew_max_rarity_5","It Is Scientifically Fascinating",2, 7, 10, 10, 14, 6, 0, , , , 425, 100, 98, 200, false,"Mulhall",crew_portraits_cm_mulhall_doctor_sm.png
"Berlinghoff Rasmussen",9,4, 0,0,0,439,146,447,811,58,145,0,0,0,237,154,318,0,0,0,564,509,826,685,801,192,382,369,355,415,378,380,645,732,561,230,668,0,447,0,86,178,40,159,587,259,568,315,0,302,619,322,"Civilian, Human, Scoundrel, Desperate, Crafty, Resourceful","male, organic, tng, rasmussen, crew_max_rarity_4","Question Your Convictions",0, 7, 6, 8, 10, 3, 0, 3, , , 475, 290, 145, 350, false,"Rasmussen",crew_portraits_cm_berlinghoffrasmussen_sm.png
"Koloth",5,3, 437,28,78,0,0,0,236,18,64,0,0,0,412,114,262,0,0,0,741,630,713,555,683,810,875,709,861,785,642,776,698,861,639,773,679,721,437,674,785,0,486,0,673,456,647,433,0,395,803,820,"Klingon, Diplomat, Tactician, Duelist","nonhuman, male, organic, tos, koloth, crew_max_rarity_3","I Am Koloth",0, 4, 8, 8, 10, 2, 2, , , , 525, 140, 243, 150, false,"Koloth",crew_portraits_cm_kolothtos_sm.png
"Dahar Master Koloth",3,5, 421,134,298,0,0,0,1281,247,530,0,0,0,914,180,444,0,0,0,377,73,337,117,295,60,444,200,412,60,2,28,162,366,161,397,45,330,85,321,98,0,229,0,97,10,80,175,0,188,12,42,"Klingon, Brutal, Spiritual, Cultural Figure, Dahar Master, Duelist, Veteran","nonhuman, male, organic, ds9, koloth, crew_max_rarity_5","You Disgrace Yourself",0, 9, 12, 10, 14, 5, 4, , , , 300, 210, 168, 515, false,"Koloth",crew_portraits_cm_koloth_daharmaster_sm.png
"Ardra",2,4, 0,0,0,0,0,0,703,120,243,309,87,191,537,104,183,0,0,0,841,528,657,623,819,504,493,604,753,287,344,405,361,429,504,0,506,544,612,0,453,369,591,0,156,283,388,231,325,477,658,618,"Costumed, Crafty, Villain, Cultural Figure, Thief","female, organic, tng, ardra, crew_max_rarity_4","I Pity You",2, 7, 6, 12, 12, 5, 0, 2, , , 650, 325, 695, 425, false,"Ardra",crew_portraits_cm_arda_sm.png
"Q2",6,5, 0,0,0,0,0,0,826,186,392,0,0,0,1263,281,503,349,150,341,697,307,654,167,368,263,489,88,276,227,6,29,51,235,27,0,334,0,208,261,232,0,120,213,201,19,15,77,169,14,135,38,"Brutal, Interrogator, Q Continuum","nonhuman, male, tng, q2, crew_max_rarity_5","Not Bad",0, 9, 10, 10, 10, , , , , , 490, 200, 118, 475, false,"Q2",crew_portraits_cm_q2_sm.png
"Colonel Q",8,5, 1058,88,199,0,0,0,1278,179,367,0,0,0,526,46,68,0,0,0,207,29,177,151,145,104,497,481,471,89,71,59,442,433,389,566,179,529,508,487,260,0,758,0,237,275,203,732,0,628,160,602,"Brutal, Veteran, Interrogator, Q Continuum","nonhuman, organic, male, voy, colonel_q, crew_max_rarity_5","The Time For Diplomacy Is Past",2, 10, 3, 6, 12, , , 2, , , 350, 270, 58, 125, false,"Colonel Q",crew_portraits_cm_colonel_q_sm.png
"Tora Ziyal",9,5, 0,0,0,0,0,0,0,0,0,0,0,0,1147,197,429,849,192,505,760,758,738,289,239,762,627,225,190,705,292,229,187,162,19,0,0,0,330,104,0,0,227,108,0,309,104,172,63,9,393,277,"Cardassian, Bajoran, Romantic, Civilian, Artist","female, ds9, tora, crew_max_rarity_5","Never Doubt",1, 8, 10, 10, 12, , , , , , 650, 170, 170, 490, false,"Ziyal",crew_portraits_cm_tora_ziyal_sm.png
"Lt. Naomi Wildman",4,2, 0,0,0,0,0,0,0,0,0,332,47,141,238,38,89,0,0,0,933,935,833,900,936,934,765,880,929,815,890,934,723,751,861,0,0,649,771,0,0,448,751,0,599,784,0,514,379,622,912,916,"Human, Ktarian, Starfleet, Federation, Resourceful","female, nonhuman, organic, voy, naomi, crew_max_rarity_2","Make Us Proud",2, 3, 3, 10, 5, 3, 0, 2, , , 380, , 107, 230, false,"Naomi",crew_portraits_cm_wildmanfuture_sm.png
"Ensign Chekov",10,1, 220,45,112,151,27,91,0,0,0,0,0,0,0,0,0,0,0,0,838,898,900,911,889,908,893,910,885,941,945,945,944,944,946,582,704,680,744,639,763,509,757,472,0,0,0,0,0,0,935,925,"Federation, Starfleet, Human","male, organic, tos, ensign, bridge_crew, chekov, crew_max_rarity_1","Russian Invention",0, 2, 3, 10, 5, 3, 0, 2, , , 295, 15, , 445, false,"Chekov",crew_portraits_cm_chekov_sm.png
