crew, tier, rarity, CMD_core, CMD_min, CMD_max, SCI_core, SCI_min, SCI_max, SEC_core, SEC_min, SEC_max, ENG_core, ENG_min, ENG_max, DIP_core, DIP_min, DIP_max, MED_core, MED_min, MED_max, V_CMD_SCI, V_CMD_SEC, V_CMD_ENG, V_CMD_DIP, V_CMD_MED, V_SCI_SEC, V_SCI_ENG, V_SCI_DIP, V_SCI_MED, V_SEC_ENG, V_SEC_DIP, V_SEC_MED, V_ENG_DIP, V_ENG_MED, V_DIP_MED, G_CMD_SCI, G_CMD_SEC, G_CMD_ENG, G_CMD_DIP, G_CMD_MED, G_SCI_SEC, G_SCI_ENG, G_SCI_DIP, G_SCI_MED, G_SEC_ENG, G_SEC_DIP, G_SEC_MED, G_ENG_DIP, G_ENG_MED, G_DIP_MED, voyage_rank, gauntlet_rank, traits, hidden_traits, action_name, action_bonus_type, action_bonus_amount, action_initial_cooldown, action_duration, action_cooldown, bonus_ability, trigger, uses_per_battle, penalty_type, penalty_amount, accuracy, crit_bonus, crit_chance, evasion, charge_phases, short_name, image_name, symbol
"Investigator Odo",8,1, 0,0,0,0,0,0,217,37,171,0,0,0,0,0,0,0,0,0,0,823,0,0,0,873,0,0,0,743,904,715,0,0,0,0,754,0,0,0,762,0,0,0,652,843,638,0,0,0,1075,1069,"Changeling, Cardassian, Investigator, Interrogator","nonhuman, male, organic, ds9, odo, crew_max_rarity_1","Collaboration",2, 1, 20, 14, 10, , , , , , 400, 115, 67, 265, false,"Odo",crew_portraits_cm_odooccupation_sm.png,odo_occupation_crew
"Constable Odo",4,3, 317,107,225,0,0,0,523,27,85,0,0,0,0,0,0,0,0,0,787,495,711,807,675,740,0,0,0,627,798,593,0,0,0,586,493,521,651,490,872,0,0,0,735,910,714,0,0,0,976,986,"Changeling, Bajoran, Constable, Investigator, Interrogator","nonhuman, male, organic, ds9, odo, crew_max_rarity_3","Justice",0, 6, 10, 12, 16, , , , 3, 800, 520, 300, 75, , false,"Odo",crew_portraits_cm_odostandard_sm.png,odo_constable_crew
"Ensign Ro",4,2, 322,46,132,0,0,0,0,0,0,0,0,0,0,0,0,0,0,0,859,808,786,859,746,0,0,0,0,0,0,0,0,0,0,822,782,743,828,705,0,0,0,0,0,0,0,0,0,0,1070,1073,"Starfleet, Bajoran, Resourceful","nonhuman, female, organic, tng, ensign, bridge_crew, ro, crew_max_rarity_2","Separate Ways",0, 4, 3, 10, 5, , , 2, , , 130, 210, 13, 200, false,"Ro",crew_portraits_cm_roensign_sm.png,ro_ensign_crew
"Shinzon",10,5, 819,94,241,0,0,0,938,183,435,0,0,0,546,176,390,0,0,0,470,98,404,198,360,269,0,561,0,231,91,179,510,0,444,583,140,516,160,486,222,0,335,0,193,47,168,263,0,280,381,152,"Human, Clone, Reman, Villain, Romulan","male, organic, tng, shinzon, crew_max_rarity_5","Destiny Complete",0, 7, 14, 3, 14, 1, 2, , , , 1325, 545, 365, 1050, false,"Shinzon",crew_portraits_cm_shinzon_sm.png,shinzon_crew
"Will Riker",10,1, 251,42,110,0,0,0,125,22,74,0,0,0,0,0,0,0,0,0,876,748,809,880,764,900,0,0,0,763,931,740,0,0,0,853,705,773,855,742,885,0,0,0,749,922,724,0,0,0,1062,1054,"Human, Federation, Starfleet, Maverick, Gambler, Romantic","male, organic, nonhuman, tng, commander, bridge_crew, first_officer, riker, crew_max_rarity_1","Poker Face",0, 1, 8, 10, 14, 4, 0, , , , 455, , 425, 340, false,"Riker",crew_portraits_cm_rikers1_sm.png,riker_s1_commander_crew
"Commander Riker",7,2, 279,78,191,0,0,0,124,29,89,0,0,0,290,22,64,0,0,0,857,715,782,655,743,896,0,855,0,760,817,736,835,0,727,673,553,626,626,584,869,0,883,0,734,850,712,865,0,747,1004,971,"Human, Federation, Starfleet, Pilot, Maverick, Gambler, Romantic","male, organic, tng, commander, bridge_crew, first_officer, riker, crew_max_rarity_2","Liase",0, 2, 8, 10, 14, 5, 0, , , , 645, 50, 295, 275, false,"Riker",crew_portraits_cm_rikerpoker_sm.png,riker_s2_commander_crew
"Edith Keeler",9,4, 0,0,0,0,0,0,0,0,0,0,0,0,453,166,339,591,187,590,0,0,0,688,370,0,0,629,293,0,703,367,588,246,91,0,0,0,488,82,0,0,411,96,0,486,95,326,38,14,883,372,"Civilian, Caregiver, Inspiring, Cultural Figure, Romantic, Human","female, organic, tos, keeler, crew_max_rarity_4","A Life Worth Living",1, 7, 8, 10, 8, , , , , , 690, 25, 52, 440, false,"Keeler",crew_portraits_cm_edithkeeler_sm.png,keeler_crew
"Ensign Tuvok",8,1, 0,0,0,181,51,197,0,0,0,0,0,0,138,33,74,0,0,0,892,0,0,916,0,880,593,777,542,0,927,0,874,0,759,721,0,0,893,0,706,466,593,428,0,915,0,843,0,729,1065,1027,"Vulcan, Federation, Starfleet, Telepath","nonhuman, male, organic, voy, ensign, bridge_crew, tuvok, crew_max_rarity_1","Memory",0, 1, 1, 14, 10, , , , , , 103, 60, 135, 375, false,"Tuvok",crew_portraits_cm_tuvokensign_sm.png,tuvok_ensign_crew
"Security Chief Tuvok",5,3, 291,53,161,145,45,149,445,85,201,0,0,0,0,0,0,0,0,0,688,529,794,861,753,512,604,885,552,621,792,587,0,0,0,488,436,711,788,671,387,520,786,490,560,725,549,0,0,0,950,877,"Vulcan, Federation, Starfleet, Telepath, Tactician, Investigator","nonhuman, male, organic, voy, lieutenant_commander, bridge_crew, tuvok, crew_max_rarity_3","Contingency Plan",0, 4, 10, 12, 16, 5, 0, , , , 465, 50, , 300, false,"Tuvok",crew_portraits_cm_tuvokrifle_sm.png,tuvok_rifle_crew
"Major Kira",7,2, 273,37,126,0,0,0,304,60,176,0,0,0,0,0,0,0,0,0,868,589,801,867,755,839,0,0,0,714,881,683,0,0,0,840,541,760,840,725,718,0,0,0,610,793,601,0,0,0,1027,1010,"Bajoran, Veteran, Resourceful","nonhuman, female, organic, ds9, kira, crew_max_rarity_2","Obstinance",0, 2, 0, 10, 14, 6, 0, , , , 295, 150, 5, , true,"Kira",crew_portraits_cm_kirashorthair_sm.png,kira_major_shorthair_crew
"Mirror Intendant Kira",5,5, 512,183,363,0,0,0,1052,272,542,0,0,0,946,67,184,0,0,0,561,97,494,178,457,208,0,469,0,181,44,134,396,0,347,305,26,230,214,224,95,0,721,0,89,65,74,676,0,587,237,106,"Bajoran, Cardassian, Klingon, Villain, Klingon-Cardassian Alliance, Brutal, Mirror Universe","nonhuman, female, organic, ds9, mirror, kira, crew_max_rarity_5","Instability",0, 6, 6, 10, 12, 4, 0, , , , 915, 225, 90, 1525, true,"Kira",crew_portraits_cm_kiraintendant_sm.png,kira_mirror_crew
"Security Chief Worf",2,2, 205,57,144,0,0,0,326,61,145,0,0,0,0,0,0,0,0,0,889,626,817,891,773,830,0,0,0,708,876,676,0,0,0,792,532,722,807,682,767,0,0,0,658,848,643,0,0,0,1035,1005,"Klingon, Federation, Starfleet, Duelist, Investigator","nonhuman, male, organic, tng, lieutenant, bridge_crew, worf, crew_max_rarity_2","They Have No Honor",2, 4, 8, 10, 12, , , , 1, 2, 165, 280, 95, 155, false,"Worf",crew_portraits_cm_worf_sm.png,worf_security_chief_crew
"Defiant Commander Worf",7,4, 364,241,488,0,0,0,609,179,394,0,0,0,0,0,0,0,0,0,612,244,547,662,507,500,0,0,0,441,621,394,0,0,0,147,37,100,271,92,271,0,0,0,230,396,206,0,0,0,893,316,"Klingon, Federation, Starfleet, Duelist, Tactician","nonhuman, male, organic, ds9, lieutenant_commander, bridge_crew, worf, crew_max_rarity_4","Good Day to Die",2, 6, 12, 12, 12, 4, 0, , 1, 2, 690, 645, 325, 205, false,"Worf",crew_portraits_cm_worfdefiant_sm.png,worf_defiant_commander_crew
"Mirror Regent Worf",6,5, 861,294,589,0,0,0,1062,175,357,0,0,0,0,0,0,0,0,0,244,64,198,403,163,247,0,0,0,216,375,164,0,0,0,68,19,44,161,43,313,0,0,0,280,453,247,0,0,0,467,215,"Klingon, Cardassian, Tactician, Villain, Brutal, Klingon-Cardassian Alliance, Mirror Universe","nonhuman, male, organic, ds9, mirror, bridge_crew, worf, crew_max_rarity_5","Position of Strength",0, 9, 8, 8, 10, , , , , , 300, 980, 390, , false,"Worf",crew_portraits_cm_worfmirror_sm.png,worf_mirror_crew
"Yeoman Rand",10,1, 164,15,58,0,0,0,0,0,0,0,0,0,117,19,60,0,0,0,907,850,844,868,799,0,0,895,0,0,933,0,881,0,763,904,848,841,857,794,0,0,886,0,0,928,0,870,0,751,1072,1076,"Federation, Starfleet, Human","female, organic, tos, yeoman, bridge_crew, rand, crew_max_rarity_1","Signature Required",2, 2, 8, 10, 12, , , , 1, 1, 375, , , 180, false,"Rand",crew_portraits_cm_randyeoman_sm.png,rand_yeoman_crew
"The Duras Sisters",7,4, 311,83,205,0,0,0,658,150,385,0,0,0,464,170,341,0,0,0,812,342,742,478,703,488,0,622,0,430,216,383,576,0,493,648,210,600,219,563,310,0,402,0,275,73,245,317,0,317,733,302,"Klingon, Scoundrel, Villain","nonhuman, female, organic, tng, betor, lursa, crew_max_rarity_4","The Power of Two",0, 9, 10, 20, 12, , , 1, , , 350, 110, 190, 500, false,"Duras Sisters",crew_portraits_cm_duras_sisters_sm.png,duras_sisters_crew
"Persis",6,2, 0,0,0,0,0,0,253,94,250,0,0,0,303,39,88,0,0,0,0,802,0,866,0,834,0,846,0,709,643,678,826,0,717,0,592,0,880,0,547,0,853,0,485,505,468,826,0,716,1022,976,"Human, Augments, Engineered, Survivalist, Tactician","nonhuman, female, organic, ent, persis, crew_max_rarity_2","Augmented Strength",0, 2, 6, 10, 6, 7, 0, 2, , , 240, 330, 300, , false,"Persis",crew_portraits_cm_persis_sm.png,persis_crew
"Telek R'Mor",5,2, 0,0,0,347,52,194,119,8,44,0,0,0,263,30,113,0,0,0,807,856,0,879,0,699,541,573,494,764,839,741,833,0,725,726,851,0,866,0,625,467,554,429,762,856,739,812,0,708,1002,994,"Romulan, Astrophysicist","nonhuman, male, organic, voy, captain, bridge_crew, rmor, crew_max_rarity_2","Solitary Survey",1, 3, 10, 12, 10, 0, 2, , , , 405, 50, 3, 180, false,"R'Mor",crew_portraits_cm_telekrmor_sm.png,rmor_voyager_crew
"KDF Gowron",6,4, 375,85,222,0,0,0,296,100,256,0,0,0,641,173,418,0,0,0,757,518,684,361,648,796,0,537,0,681,355,646,480,0,416,619,300,563,167,529,526,0,304,0,465,115,450,232,0,253,796,391,"Klingon, Duelist, Diplomat, Politician","nonhuman, male, organic, tng, gowron, crew_max_rarity_4","What Can Be Done",1, 6, 14, 10, 14, 0, 2, , , , 625, 465, 85, 1000, false,"Gowron",crew_portraits_cm_gowronyoung_sm.png,gowron_kdf_crew
"Third Remata'Klan",9,3, 410,42,84,0,0,0,467,85,185,0,0,0,0,0,0,0,0,0,791,485,718,810,681,715,0,0,0,611,783,578,0,0,0,875,543,798,872,757,661,0,0,0,576,748,563,0,0,0,970,1013,"Jem'hadar, Dominion, Duelist, Tactician","nonhuman, male, organic, ds9, remataklan, crew_max_rarity_3","Victory is Life",0, 3, 0, 6, 8, 4, 4, , , , 690, 395, 597, 600, true,"Remata'Klan",crew_portraits_cm_remataklan_sm.png,remataklan_crew
"Ensign Chapel",10,1, 0,0,0,0,0,0,0,0,0,0,0,0,0,0,0,214,34,152,0,0,0,0,774,0,0,0,541,0,0,720,0,482,734,0,0,0,0,699,0,0,0,496,0,0,662,0,438,663,1081,1072,"Human, Federation, Starfleet, Nurse","female, organic, tos, ensign, chapel, crew_max_rarity_1","Administer Prescription",2, 1, 6, 10, 10, , , , , , 130, , 40, 100, false,"Chapel",crew_portraits_cm_chapelensign_sm.png,chapel_ensign_crew
"Ensign Ogawa",10,1, 0,0,0,0,0,0,0,0,0,0,0,0,0,0,0,213,34,166,0,0,0,0,770,0,0,0,537,0,0,716,0,479,732,0,0,0,0,686,0,0,0,479,0,0,650,0,425,649,1079,1070,"Human, Federation, Starfleet, Nurse","female, organic, tng, ensign, ogawa, crew_max_rarity_1","Report to Sickbay",2, 1, 6, 1, 8, 2, 0, 1, , , 170, , 35, 105, false,"Ogawa",crew_portraits_cm_ogawaensign_sm.png,ogawa_ensign_crew
"Wesley Crusher",10,1, 0,0,0,218,43,149,0,0,0,174,32,78,0,0,0,0,0,0,884,0,839,0,0,874,510,864,538,758,0,0,869,494,0,807,0,814,0,0,790,404,787,491,741,0,0,842,482,0,1057,1046,"Human, Federation, Civilian, Prodigy","male, organic, tng, wesley, crew_max_rarity_1","Study",1, 2, 8, 10, 12, , , , 0, 1, 215, 125, 70, 55, false,"Wesley",crew_portraits_cm_wesleysweater_sm.png,wesley_sweater_crew
"Ensign Crusher",7,3, 176,11,31,426,83,229,0,0,0,347,34,78,0,0,0,0,0,0,573,851,666,914,800,735,341,755,461,725,0,0,822,469,0,570,852,776,920,802,606,303,647,375,738,0,0,839,480,0,954,979,"Human, Federation, Starfleet, Prodigy, Warp Theorist","male, organic, tng, ensign, bridge_crew, wesley, crew_max_rarity_3","Rewire",2, 4, 6, 8, 10, 6, 0, , , , 290, , , 190, false,"Wesley",crew_portraits_cm_wesley_sm.png,wesley_full_ensign_crew
"Acting Ensign Crusher",9,2, 114,29,58,258,56,160,0,0,0,251,53,148,0,0,0,0,0,0,761,855,696,922,804,862,415,847,531,737,0,0,829,473,0,635,839,611,905,785,757,309,758,464,667,0,0,747,427,0,1013,963,"Human, Federation, Starfleet, Prodigy","male, organic, tng, ensign, bridge_crew, wesley, crew_max_rarity_2","Invention",1, 4, 3, 6, 6, , , 2, , , 205, 50, 25, 165, false,"Wesley",crew_portraits_cm_wesleyensign_sm.png,wesley_acting_ensign_crew
"Formal Dress Wesley Crusher",9,4, 0,0,0,662,173,422,0,0,0,270,108,230,481,160,342,0,0,0,488,0,773,674,0,479,196,141,298,703,692,0,320,455,491,275,0,532,489,0,260,59,39,182,504,490,0,69,312,325,726,234,"Human, Federation, Starfleet, Prodigy, Warp Theorist","male, organic, tng, ensign, bridge_crew, wesley, lieutenant, crew_max_rarity_4","Duty to the Truth",1, 9, 4, 10, 12, , , , , , 300, 500, 30, 450, false,"Wesley",crew_portraits_cm_wesleydressuniform_sm.png,wesley_formal_dress_crew
"Wrathful Khan",7,5, 1040,206,421,0,0,0,1145,72,143,376,140,288,0,0,0,0,0,0,235,69,43,395,150,266,494,0,0,60,397,178,711,402,0,222,198,16,363,147,746,302,0,0,184,825,627,419,233,0,326,368,"Human, Augments, Engineered, Villain, Cultural Figure, Tactician, Resourceful, Survivalist, Brutal","nonhuman, male, organic, tos, khan, crew_max_rarity_5","I Stab at Thee",2, 9, 12, 5, 12, 1, 0, , , , 640, 595, 345, 850, false,"Khan",crew_portraits_cm_khan_sm.png,khan_wok_crew
"Tailor Garak",4,3, 0,0,0,0,0,0,502,44,126,161,22,44,395,83,219,0,0,0,0,726,846,779,0,729,611,766,0,474,494,588,565,496,633,0,788,844,690,0,819,613,665,0,616,511,673,502,497,531,934,951,"Cardassian, Undercover Operative, Scoundrel, Interrogator, Civilian","nonhuman, male, organic, ds9, garak, crew_max_rarity_3","Cutting Cloth",1, 5, 8, 12, 12, , , , , , 125, 230, 20, 405, false,"Garak",crew_portraits_cm_garaktailor_sm.png,garak_tailor_crew
"Bartender Quark",9,1, 110,25,77,0,0,0,81,15,57,0,0,0,211,36,150,0,0,0,912,839,848,830,802,902,0,868,0,765,884,742,849,0,738,889,783,820,704,774,896,0,799,0,760,770,737,762,0,668,1049,1024,"Ferengi, Bartender, Civilian, Scoundrel, Gambler, Merchant","nonhuman, male, organic, ds9, quark, crew_max_rarity_1","Hospitality",1, 2, 8, 10, 12, , , , 2, 1, 165, 10, 10, 140, false,"Quark",crew_portraits_cm_quarkbartender_sm.png,quark_s1_bartender_crew
"Richard Castillo",4,3, 487,109,227,286,57,187,0,0,0,0,0,0,0,0,0,0,0,0,434,667,607,703,563,849,580,839,526,0,0,0,0,0,0,284,604,517,647,487,713,473,727,436,0,0,0,0,0,0,972,931,"Human, Hero, Pilot, Starfleet, Federation","bridge_crew, male, organic, castillo, tng, lieutenant, crew_max_rarity_3","Self Sacrifice",0, 5, 12, 12, 10, 7, 0, , 1, 2, 650, 265, 129, 585, false,"Castillo",crew_portraits_cm_richardcastillo_sm.png,castillo_lieutenant_crew
"Writer Jake Sisko",10,3, 0,0,0,0,0,0,0,0,0,0,0,0,451,70,198,0,0,0,0,0,0,772,0,0,0,750,0,0,795,0,712,0,621,0,0,0,727,0,0,0,696,0,0,762,0,649,0,567,1050,1053,"Human, Federation, Civilian, Writer, Gambler, Romantic","male, organic, ds9, jake, crew_max_rarity_3","Construct Story",2, 3, 0, 8, 10, 6, 0, , , , 995, 350, 47, 640, true,"Jake",crew_portraits_cm_jakewriter_sm.png,jake_writer_crew
"CMO Crusher",3,2, 0,0,0,0,0,0,0,0,0,0,0,0,0,0,0,290,52,174,0,0,0,0,752,0,0,0,527,0,0,695,0,465,710,0,0,0,0,656,0,0,0,455,0,0,619,0,410,615,1071,1064,"Human, Starfleet, Federation, Physician, Caregiver, Cyberneticist","female, organic, tng, commander, crusher, crew_max_rarity_2","Doctor's Calluses",2, 3, 6, 10, 10, , , , , , 185, , 35, 155, false,"Crusher",crew_portraits_cm_crusherwithlabcoat_sm.png,crusher_labcoat_crew
"Commando Crusher",1,3, 0,0,0,182,76,200,308,93,193,0,0,0,0,0,0,510,44,132,880,784,0,0,628,550,590,859,306,691,857,323,0,395,600,674,671,0,0,713,287,430,691,275,561,726,326,0,448,677,923,854,"Human, Starfleet, Federation, Physician, Cyberneticist, Undercover Operative","female, organic, tng, commander, crusher, crew_max_rarity_3","Repel Disease",0, 3, 6, 3, 12, 1, 0, , , , 575, , 370, 500, false,"Crusher",crew_portraits_cm_crusherblackcommandouniform_sm.png,crusher_black_commando_uniform_crew
"Dr. Crusher",9,4, 275,38,110,0,0,0,437,90,201,0,0,0,0,0,0,736,123,300,869,544,802,870,167,736,0,0,300,623,796,105,0,257,408,855,499,779,858,215,628,0,0,291,555,718,117,0,230,403,811,759,"Human, Starfleet, Federation, Physician, Cyberneticist","female, organic, tng, commander, crusher, crew_max_rarity_4","Neutralize Disease",1, 7, 12, 12, 12, 4, 4, , , , 740, 250, 370, 500, false,"Crusher",crew_portraits_cm_crusherfromfirstcontact_sm.png,crusher_first_contact_crew
"Holonovel Doctor",6,4, 0,0,0,512,50,137,0,0,0,0,0,0,0,0,0,799,69,244,737,0,0,0,375,713,481,729,101,0,0,373,0,253,405,815,0,0,0,530,799,526,793,237,0,0,520,0,340,510,904,964,"Hologram, Human, Federation, Starfleet, Physician, Musician, Scoundrel","nonhuman, male, artificial_life, voy, emh, crew_max_rarity_4","Suggested Treatment",0, 7, 12, 12, 12, , , , , , 365, 370, 205, 525, false,"Doctor",crew_portraits_cm_doctorgolfclub_sm.png,emh_authorauthor_crew
"Mobile Doctor",5,5, 0,0,0,809,106,209,0,0,0,0,0,0,393,137,435,1191,110,334,485,0,0,701,135,477,346,150,27,0,721,144,608,96,44,620,0,0,432,361,603,391,106,104,0,425,357,256,216,56,384,322,"Hologram, Human, Federation, Starfleet, Musician, Physician","nonhuman, male, artificial_life, voy, emh, crew_max_rarity_5","House Call",2, 9, 12, 12, 12, , , , , , 1825, 600, , 600, false,"Doctor",crew_portraits_cm_emhmobile_sm.png,emh_mobileholoemitter_crew
"Comm Officer Uhura",10,1, 0,0,0,0,0,0,0,0,0,0,0,0,258,28,89,0,0,0,0,0,0,888,0,0,0,862,0,0,907,0,842,0,730,0,0,0,885,0,0,0,861,0,0,908,0,836,0,723,1078,1081,"Federation, Starfleet, Human, Musician, Communicator","female, organic, tos, lieutenant, bridge_crew, uhura, crew_max_rarity_1","Incoming Message",2, 2, 8, 10, 12, , , , 1, 1, 320, , , 495, false,"Uhura",crew_portraits_cm_uhurared_sm.png,uhura_red_crew
"Commander Uhura",10,4, 459,128,299,0,0,0,0,0,0,0,0,0,592,198,429,0,0,0,654,653,595,292,545,0,0,545,0,0,617,0,488,0,421,459,517,380,97,374,0,0,270,0,0,355,0,190,0,214,903,596,"Federation, Starfleet, Human, Musician, Communicator","female, organic, tos, commander, bridge_crew, uhura, crew_max_rarity_4","Hailing Frequencies",0, 8, 12, 26, 12, , , 1, , , 1165, , 75, 790, false,"Uhura",crew_portraits_cm_uhurawrathofkhan_sm.png,uhura_wrathofkhan_crew
"Dancing Uhura",8,5, 1026,84,195,0,0,0,0,0,0,0,0,0,1185,193,393,0,0,0,359,429,303,51,267,0,0,249,0,0,329,0,185,0,192,660,676,613,191,573,0,0,310,0,0,409,0,240,0,258,463,766,"Human, Federation, Starfleet, Communicator, Casual, Musician, Artist","bridge_crew, female, organic, tos, uhura, lieutenant_commander, original, crew_max_rarity_5","Take The Lead",0, 8, 10, 3, 14, 1, 1, , , , 465, 260, 60, 400, false,"Uhura",crew_portraits_cm_uhura_dancing_sm.png,uhura_dancing_crew
"First Maje Culluh",5,3, 466,93,223,0,0,0,307,42,138,0,0,0,0,0,0,0,0,0,710,511,639,731,602,853,0,0,0,726,892,699,0,0,0,611,440,545,663,518,806,0,0,0,685,863,666,0,0,0,987,962,"Kazon, Scoundrel","nonhuman, male, organic, voy, captain, culluh, crew_max_rarity_3","Nistrim Supremacy",2, 3, 6, 10, 10, 8, 4, , , , 665, 325, 133, 390, false,"Culluh",crew_portraits_cm_jalculluh_sm.png,culluh_crew
"KDF Alexander",6,2, 137,19,79,0,0,0,331,64,148,145,16,72,0,0,0,0,0,0,909,700,799,917,801,827,612,0,0,594,868,671,876,497,0,891,639,737,899,777,752,608,0,0,545,830,631,862,491,0,1019,1014,"Human, Klingon","male, organic, ds9, bridge_crew, alexander, nonhuman, crew_max_rarity_2","Beginner's Luck",1, 3, 10, 12, 10, 5, 2, , , , 130, 200, 62, 15, false,"Alexander",crew_portraits_cm_alexanderkdf_sm.png,alexander_kdf_crew
"Commando Shran",9,4, 673,114,239,0,0,0,592,89,182,0,0,0,318,144,282,0,0,0,520,262,449,392,407,596,0,767,0,515,393,478,734,0,636,556,333,479,243,455,660,0,510,0,575,268,562,420,0,407,728,595,"Andorian, Tactician, Inspiring, Imperial Guard","nonhuman, male, organic, ent, captain, shran, crew_max_rarity_4","Debt Owed",0, 8, 6, 8, 10, , , 3, , , 390, 575, 288, 350, false,"Shran",crew_portraits_cm_shrancommando_sm.png,shran_commando_crew
"Ushaan Shran",9,5, 989,83,164,0,0,0,1076,170,348,0,0,0,424,134,288,0,0,0,392,84,344,240,298,243,0,692,0,213,105,162,653,0,561,714,239,661,328,617,333,0,514,0,295,117,264,429,0,411,375,461,"Andorian, Duelist, Romantic, Imperial Guard","nonhuman, male, organic, ent, captain, shran, crew_max_rarity_5","Debt Owed",0, 9, 6, 8, 10, , , 3, , , 1440, 565, 483, 390, false,"Shran",crew_portraits_cm_shrandueling_sm.png,shran_dueling_crew
"Fencing Sulu",10,4, 444,99,249,385,36,92,609,203,448,0,0,0,0,0,0,0,0,0,429,281,645,740,610,228,556,812,509,425,609,379,0,0,0,399,119,492,629,463,109,586,849,540,165,303,146,0,0,0,770,506,"Human, Federation, Starfleet, Pilot, Resourceful, Duelist","male, organic, tos, lieutenant, bridge_crew, sulu, crew_max_rarity_4","Parry Attack",0, 6, 12, 8, 12, 6, 4, , , , 415, , 225, 225, false,"Sulu",crew_portraits_cm_sulufencing_sm.png,sulu_fencing_crew
"Morn",7,3, 0,0,0,0,0,0,359,70,174,0,0,0,418,121,295,0,0,0,0,756,0,750,0,791,0,702,0,672,511,641,668,0,573,0,709,0,578,0,705,0,520,0,601,309,594,436,0,420,964,893,"Lurian, Courier, Duelist, Civilian, Gambler, Smuggler","nonhuman, male, organic, ds9, morn, crew_max_rarity_3","Drinking Spot",0, 3, 0, 8, 8, , , , 1, 2, 150, 285, 57, 655, true,"Morn",crew_portraits_cm_morn_sm.png,morn_crew
"Seven in Blue",3,2, 0,0,0,294,51,209,0,0,0,278,53,130,0,0,0,0,0,0,855,0,800,0,0,838,380,830,519,734,0,0,827,471,0,701,0,746,0,0,689,292,706,417,687,0,0,766,442,0,1023,995,"Human, Borg, Civilian, Federation","nonhuman, female, organic, voy, bridge_crew, seven, crew_max_rarity_2","Ignore Irrelevancies",1, 2, 8, 10, 14, 4, 0, , , , 75, 50, 310, 170, false,"Seven",crew_portraits_cm_seven_of_nine_sm.png,seven_allblue_crew
"Seven of Nine",7,5, 0,0,0,785,247,791,0,0,0,854,225,454,514,89,183,0,0,0,255,0,307,714,0,253,38,88,167,285,739,0,47,164,536,38,0,136,718,0,33,3,11,38,162,756,0,44,72,564,364,21,"Human, Borg, Civilian, Federation","nonhuman, female, organic, voy, bridge_crew, seven, crew_max_rarity_5","New Collective",2, 7, 12, 10, 14, 4, 0, , , , 1750, , 705, 440, false,"Seven",crew_portraits_cm_sevenbluegreyshoulders_sm.png,seven_bluegreyshoulders_crew
"Donik",6,3, 0,0,0,0,0,0,0,0,0,476,79,199,303,31,79,0,0,0,0,0,662,869,0,0,476,849,0,606,897,0,463,391,719,0,0,627,892,0,0,431,866,0,577,914,0,477,373,728,997,1017,"Hirogen, Innovator","nonhuman, male, organic, voy, donik, crew_max_rarity_3","Hunting Program",2, 4, 12, 12, 10, 7, 0, , , , 870, 165, , 340, false,"Donik",crew_portraits_cm_donik_sm.png,donik_crew
"Commander Tucker",8,2, 252,28,82,0,0,0,0,0,0,305,53,185,0,0,0,0,0,0,885,825,551,889,771,0,574,0,0,715,0,0,808,458,0,884,825,509,889,770,0,482,0,0,623,0,0,694,403,0,1037,1030,"Human, Starfleet, Jury Rigger, Pilot, Explorer","male, organic, ent, commander, tucker, crew_max_rarity_2","Warp Engines Online",1, 2, 6, 3, 8, 2, 0, , , , 520, 35, 50, 165, false,"Trip",crew_portraits_cm_tucker_sm.png,tucker_commander_crew
"Counselor Troi",9,1, 0,0,0,0,0,0,0,0,0,0,0,0,261,42,108,147,49,131,0,0,0,878,795,0,0,852,553,0,900,731,832,492,626,0,0,0,859,706,0,0,836,504,0,891,667,803,441,494,1052,1039,"Federation, Starfleet, Human, Betazoid, Empath, Counselor","nonhuman, female, organic, tng, lieutenant_commander, bridge_crew, troi, crew_max_rarity_1","Counselling",2, 1, 6, 10, 10, , , , , , 265, , 80, 345, false,"Troi",crew_portraits_cm_troitng_sm.png,troi_casualgray_crew
"Rakal Troi",8,4, 521,163,354,0,0,0,525,128,331,0,0,0,0,0,0,407,163,440,566,295,499,632,109,572,0,0,378,494,669,128,0,332,495,335,128,260,461,13,403,0,0,173,349,512,18,0,108,227,632,121,"Federation, Starfleet, Human, Betazoid, Romulan, Empath, Undercover Operative, Tal Shiar","nonhuman, female, organic, tng, lieutenant_commander, bridge_crew, troi, crew_max_rarity_4","Romulan Disguise",1, 7, 12, 10, 14, 1, 2, , , , 90, 400, 175, 2825, false,"Troi",crew_portraits_cm_troirakal_sm.png,troi_rakal_crew
"Commander Troi",8,5, 0,0,0,0,0,0,383,203,253,0,0,0,1060,211,421,827,142,281,0,711,0,396,334,703,0,289,274,603,102,48,222,214,27,0,479,0,382,387,407,0,268,292,352,63,58,188,231,45,392,165,"Federation, Starfleet, Human, Betazoid, Empath, Counselor","nonhuman, female, organic, tng, commander, bridge_crew, troi, crew_max_rarity_5","Empathic Sense",1, 8, 6, 6, 6, , , , , , 1375, 475, 135, 725, true,"Troi",crew_portraits_cm_troifirstcontact_sm.png,troi_firstcontact_crew
"Vedek Winn Adami",5,3, 307,97,207,0,0,0,0,0,0,0,0,0,410,92,214,0,0,0,809,771,739,556,700,0,0,762,0,0,802,0,727,0,630,628,647,572,390,538,0,0,661,0,0,710,0,599,0,527,988,924,"Bajoran, Vedek, Cultural Figure, Spiritual","nonhuman, female, organic, ds9, winn, crew_max_rarity_3","Will of the Prophets",1, 4, 8, 10, 10, 4, 0, , , , , 270, 85, 830, false,"Winn",crew_portraits_cm_winnvedek_sm.png,winn_vedek_crew
"Subcommander T'Pol",4,3, 273,71,211,520,21,77,165,35,77,0,0,0,0,0,0,0,0,0,480,685,783,858,744,529,501,761,467,759,924,734,0,0,0,522,547,606,702,569,763,604,876,551,736,911,715,0,0,0,952,966,"Vulcan, High Command, Astrophysicist, Telepath","nonhuman, female, organic, ent, first_officer, bridge_crew, tpol, crew_max_rarity_3","Logic",2, 5, 6, 10, 10, , , , , , 175, 120, 3, 100, false,"T'Pol",crew_portraits_cm_tpol_sm.png,tpol_subcommander_crew
"Commander T'Pol",8,4, 512,112,307,692,56,171,320,91,227,0,0,0,0,0,0,0,0,0,171,405,549,668,511,259,372,572,330,673,840,643,0,0,0,207,253,392,561,386,307,487,744,456,521,678,503,0,0,0,766,676,"Vulcan, Starfleet, Astrophysicist, Telepath","nonhuman, female, organic, ent, first_officer, commander, bridge_crew, tpol, crew_max_rarity_4","Vessel's Information",0, 5, 12, 12, 20, 2, 0, , , , 1400, 200, 70, 1175, false,"T'Pol",crew_portraits_cm_tpolcommander_sm.png,tpol_commander_crew
"Chef Neelix",10,1, 0,0,0,0,0,0,0,0,0,0,0,0,201,51,189,0,0,0,0,0,0,885,0,0,0,860,0,0,905,0,840,0,729,0,0,0,760,0,0,0,734,0,0,804,0,689,0,601,1076,1060,"Talaxian, Mylean, Resourceful, Survivalist, Chef, Civilian, Communicator","nonhuman, male, organic, voy, neelix, crew_max_rarity_1","Soup's On",1, 2, 12, 14, 10, 6, 0, , 2, 1, 305, , , 210, false,"Neelix",crew_portraits_cm_neelix_sm.png,neelix_chef_crew
"CMO 'Bones' McCoy",9,1, 0,0,0,0,0,0,0,0,0,0,0,0,0,0,0,213,48,196,0,0,0,0,761,0,0,0,533,0,0,712,0,475,724,0,0,0,0,627,0,0,0,430,0,0,597,0,396,593,1073,1056,"Human, Federation, Starfleet, Physician, Exobiology","male, organic, tos, lieutenant_commander, mccoy, crew_max_rarity_1","Country Doctor",2, 3, 8, 10, 12, , , , 0, 2, 245, 10, 8, 285, false,"McCoy",crew_portraits_cm_mccoy_sm.png,mccoy_chief_medical_officer_crew
