crew, tier, rarity, CMD_core, CMD_min, CMD_max, SCI_core, SCI_min, SCI_max, SEC_core, SEC_min, SEC_max, ENG_core, ENG_min, ENG_max, DIP_core, DIP_min, DIP_max, MED_core, MED_min, MED_max, V_CMD_SCI, V_CMD_SEC, V_CMD_ENG, V_CMD_DIP, V_CMD_MED, V_SCI_SEC, V_SCI_ENG, V_SCI_DIP, V_SCI_MED, V_SEC_ENG, V_SEC_DIP, V_SEC_MED, V_ENG_DIP, V_ENG_MED, V_DIP_MED, G_CMD_SCI, G_CMD_SEC, G_CMD_ENG, G_CMD_DIP, G_CMD_MED, G_SCI_SEC, G_SCI_ENG, G_SCI_DIP, G_SCI_MED, G_SEC_ENG, G_SEC_DIP, G_SEC_MED, G_ENG_DIP, G_ENG_MED, G_DIP_MED, voyage_rank, gauntlet_rank, traits, hidden_traits, action_name, action_bonus_type, action_bonus_amount, action_initial_cooldown, action_duration, action_cooldown, bonus_ability, trigger, uses_per_battle, penalty_type, penalty_amount, accuracy, crit_bonus, crit_chance, evasion, charge_phases, short_name, image_name, symbol
"Investigator Odo",7,1, 0,0,0,0,0,0,217,37,171,0,0,0,0,0,0,0,0,0,0,1292,0,0,0,1348,0,0,0,1178,1423,1085,0,0,0,0,1202,0,0,0,1206,0,0,0,1078,1343,992,0,0,0,1631,1625,"Changeling, Cardassian, Investigator, Interrogator, Shapeshifter","nonhuman, male, organic, ds9, odo, crew_max_rarity_1","Collaboration",2, 1, 20, 14, 10, , , , , , 400, 115, 67, 265, false,"Odo",crew_portraits_cm_odooccupation_sm.png,odo_occupation_crew
"Constable Odo",5,3, 317,107,225,0,0,0,523,27,85,0,0,0,0,0,0,0,0,0,1242,837,1165,1310,1055,1145,0,0,0,1030,1280,924,0,0,0,927,810,871,1063,761,1348,0,0,0,1170,1430,1083,0,0,0,1521,1539,"Changeling, Bajoran, Constable, Investigator, Interrogator, Shapeshifter","nonhuman, male, organic, ds9, odo, crew_max_rarity_3","Justice",0, 6, 10, 12, 16, , , , 3, 800, 520, 300, 75, , false,"Odo",crew_portraits_cm_odostandard_sm.png,odo_constable_crew
"Ensign Ro",10,2, 322,46,132,0,0,0,0,0,0,0,0,0,0,0,0,0,0,0,1326,1276,1256,1372,1143,0,0,0,0,0,0,0,0,0,0,1289,1250,1216,1339,1102,0,0,0,0,0,0,0,0,0,0,1626,1629,"Starfleet, Bajoran, Resourceful","nonhuman, female, organic, tng, ro, crew_max_rarity_2","Separate Ways",0, 4, 3, 10, 5, , , 2, , , 130, 210, 13, 200, false,"Ro",crew_portraits_cm_roensign_sm.png,ro_ensign_crew
"Shinzon",9,5, 819,94,241,0,0,0,938,183,435,0,0,0,546,176,390,0,0,0,800,190,727,368,599,512,0,915,0,468,168,344,880,0,734,924,205,865,237,757,358,0,530,0,347,59,243,463,0,397,735,205,"Human, Clone, Reman, Villain, Romulan, Brutal, Crafty, Politician, Veteran, Vengeful","male, organic, tng, shinzon, crew_max_rarity_5","Destiny Complete",0, 7, 14, 3, 14, 1, 2, , , , 1325, 545, 365, 1050, false,"Shinzon",crew_portraits_cm_shinzon_sm.png,shinzon_crew
"Will Riker",5,1, 251,42,110,0,0,0,125,22,74,0,0,0,0,0,0,0,0,0,1344,1194,1279,1395,1163,1378,0,0,0,1199,1452,1111,0,0,0,1319,1116,1247,1368,1139,1361,0,0,0,1185,1442,1094,0,0,0,1618,1609,"Human, Federation, Starfleet, Maverick, Gambler, Romantic","male, organic, tng, riker, crew_max_rarity_1","Poker Face",0, 1, 8, 10, 14, 4, 0, , , , 455, , 425, 340, false,"Riker",crew_portraits_cm_rikers1_sm.png,riker_s1_commander_crew
"Commander Riker",1,2, 279,78,191,0,0,0,124,29,89,0,0,0,290,22,64,0,0,0,1325,1150,1253,1084,1141,1374,0,1328,0,1195,1308,1107,1320,0,1138,1060,893,1019,1014,898,1345,0,1360,0,1169,1354,1081,1354,0,1164,1559,1521,"Human, Federation, Starfleet, Pilot, Maverick, Gambler, Romantic, Playful","male, organic, tng, riker, crew_max_rarity_2","Liase",0, 2, 8, 10, 14, 5, 0, , , , 645, 50, 295, 275, false,"Riker",crew_portraits_cm_rikerpoker_sm.png,riker_s2_commander_crew
"Edith Keeler",8,4, 0,0,0,0,0,0,0,0,0,0,0,0,453,166,339,591,187,590,0,0,0,1116,609,0,0,1001,458,0,1161,608,971,412,186,0,0,0,758,115,0,0,632,123,0,761,135,553,58,17,1433,646,"Civilian, Caregiver, Inspiring, Cultural Figure, Romantic, Human","female, organic, tos, keeler, crew_max_rarity_4","A Life Worth Living",1, 7, 8, 10, 8, , , , , , 690, 25, 52, 440, false,"Keeler",crew_portraits_cm_edithkeeler_sm.png,keeler_crew
"Ensign Tuvok",7,1, 0,0,0,181,51,197,0,0,0,0,0,0,138,33,74,0,0,0,1363,0,0,1432,0,1358,1035,1233,864,0,1449,0,1364,0,1177,1142,0,0,1408,0,1108,826,941,681,0,1436,0,1334,0,1146,1620,1581,"Vulcan, Federation, Starfleet, Telepath","nonhuman, male, organic, voy, tuvok, crew_max_rarity_1","Memory",0, 1, 1, 14, 10, , , , , , 103, 60, 135, 375, false,"Tuvok",crew_portraits_cm_tuvokensign_sm.png,tuvok_ensign_crew
"Security Chief Tuvok",4,3, 291,53,161,145,45,149,445,85,201,0,0,0,0,0,0,0,0,0,1112,872,1268,1374,1153,840,1045,1363,874,1026,1279,922,0,0,0,797,698,1165,1283,1046,613,957,1252,806,922,1188,842,0,0,0,1500,1423,"Vulcan, Federation, Starfleet, Telepath, Tactician, Investigator","nonhuman, male, organic, voy, tuvok, crew_max_rarity_3","Contingency Plan",0, 4, 10, 12, 16, 5, 0, , , , 465, 50, , 300, false,"Tuvok",crew_portraits_cm_tuvokrifle_sm.png,tuvok_rifle_crew
"Major Kira",6,2, 273,37,126,0,0,0,304,60,176,0,0,0,0,0,0,0,0,0,1336,974,1271,1382,1154,1308,0,0,0,1145,1399,1051,0,0,0,1304,874,1230,1350,1121,1123,0,0,0,1008,1280,926,0,0,0,1583,1563,"Bajoran, Veteran, Resourceful","nonhuman, female, organic, ds9, kira, crew_max_rarity_2","Obstinance",0, 2, 0, 10, 14, 6, 0, , , , 295, 150, 5, , true,"Kira",crew_portraits_cm_kirashorthair_sm.png,kira_major_shorthair_crew
"Mirror Intendant Kira",7,5, 512,183,363,0,0,0,1052,272,542,0,0,0,946,67,184,0,0,0,925,189,861,333,745,390,0,782,0,367,74,250,730,0,595,504,41,432,337,347,153,0,1124,0,167,94,105,1101,0,937,568,151,"Bajoran, Cardassian, Klingon, Villain, Klingon-Cardassian Alliance, Brutal, Mirror Universe, Crafty","nonhuman, female, organic, ds9, kira, crew_max_rarity_5","Instability",0, 6, 6, 10, 12, 4, 0, , , , 915, 225, 90, 1525, true,"Kira",crew_portraits_cm_kiraintendant_sm.png,kira_mirror_crew
"Security Chief Worf",8,2, 205,57,144,0,0,0,326,61,145,0,0,0,0,0,0,0,0,0,1361,1012,1290,1407,1174,1301,0,0,0,1141,1392,1044,0,0,0,1247,860,1186,1304,1068,1210,0,0,0,1082,1347,995,0,0,0,1590,1557,"Klingon, Federation, Starfleet, Duelist, Investigator","nonhuman, male, organic, tng, worf, crew_max_rarity_2","They Have No Honor",2, 4, 8, 10, 12, , , , 1, 2, 165, 280, 95, 155, false,"Worf",crew_portraits_cm_worf_sm.png,worf_security_chief_crew
"Defiant Commander Worf",8,4, 364,241,488,0,0,0,609,179,394,0,0,0,0,0,0,0,0,0,982,465,920,1106,799,805,0,0,0,743,1029,631,0,0,0,222,55,186,425,128,449,0,0,0,420,653,321,0,0,0,1446,523,"Klingon, Federation, Starfleet, Duelist, Tactician, Veteran","nonhuman, male, organic, ds9, worf, crew_max_rarity_4","Good Day to Die",2, 6, 12, 12, 12, 4, 0, , 1, 2, 690, 645, 325, 205, false,"Worf",crew_portraits_cm_worfdefiant_sm.png,worf_defiant_commander_crew
"Mirror Regent Worf",8,5, 861,294,589,0,0,0,1062,175,357,0,0,0,0,0,0,0,0,0,496,122,436,710,329,439,0,0,0,407,647,295,0,0,0,104,33,82,250,54,510,0,0,0,488,712,380,0,0,0,826,302,"Klingon, Cardassian, Tactician, Villain, Brutal, Klingon-Cardassian Alliance, Mirror Universe","nonhuman, male, organic, ds9, worf, crew_max_rarity_5","Position of Strength",0, 9, 8, 8, 10, , , , , , 300, 980, 390, , false,"Worf",crew_portraits_cm_worfmirror_sm.png,worf_mirror_crew
"Yeoman Rand",9,1, 164,15,58,0,0,0,0,0,0,0,0,0,117,19,60,0,0,0,1378,1319,1316,1380,1199,0,0,1373,0,0,1454,0,1371,0,1180,1375,1316,1313,1369,1194,0,0,1363,0,0,1449,0,1359,0,1168,1628,1632,"Federation, Starfleet, Human","female, organic, tos, rand, crew_max_rarity_1","Signature Required",2, 2, 8, 10, 12, , , , 1, 1, 375, , , 180, false,"Rand",crew_portraits_cm_randyeoman_sm.png,rand_yeoman_crew
"The Duras Sisters",9,4, 311,83,205,0,0,0,658,150,385,0,0,0,464,170,341,0,0,0,1283,582,1212,834,1102,789,0,994,0,728,430,619,960,0,802,1024,322,984,338,864,506,0,621,0,487,111,376,541,0,454,1267,464,"Klingon, Scoundrel, Villain, Vengeful","nonhuman, female, organic, tng, betor, lursa, exclusive_fusion, crew_max_rarity_4","The Power of Two",0, 9, 10, 20, 12, , , 1, , , 350, 110, 190, 500, false,"Duras Sisters",crew_portraits_cm_duras_sisters_sm.png,duras_sisters_crew
"Persis",8,2, 0,0,0,0,0,0,253,94,250,0,0,0,303,39,88,0,0,0,0,1270,0,1378,0,1309,0,1318,0,1146,1091,1052,1311,0,1129,0,954,0,1392,0,864,0,1324,0,815,817,731,1313,0,1129,1577,1523,"Human, Augments, Engineered, Survivalist, Tactician","nonhuman, female, organic, ent, persis, crew_max_rarity_2","Augmented Strength",0, 2, 6, 10, 6, 7, 0, 2, , , 240, 330, 300, , false,"Persis",crew_portraits_cm_persis_sm.png,persis_crew
"Telek R'Mor",7,2, 0,0,0,347,52,194,119,8,44,0,0,0,263,30,113,0,0,0,1266,1325,0,1389,0,1126,959,932,807,1200,1345,1112,1321,0,1139,1146,1320,0,1377,0,984,829,883,683,1198,1367,1110,1298,0,1120,1556,1546,"Romulan, Astrophysicist","nonhuman, male, organic, voy, rmor, crew_max_rarity_2","Solitary Survey",1, 3, 10, 12, 10, 0, 2, , , , 405, 50, 3, 180, false,"R'Mor",crew_portraits_cm_telekrmor_sm.png,rmor_voyager_crew
"KDF Gowron",10,4, 375,85,222,0,0,0,296,100,256,0,0,0,641,173,418,0,0,0,1189,870,1120,613,1010,1262,0,862,0,1104,603,1010,822,0,670,978,468,931,241,820,836,0,495,0,788,171,704,424,0,364,1339,666,"Klingon, Duelist, Diplomat, Politician","nonhuman, male, organic, tng, gowron, crew_max_rarity_4","What Can Be Done",1, 6, 14, 10, 14, 0, 2, , , , 625, 465, 85, 1000, false,"Gowron",crew_portraits_cm_gowronyoung_sm.png,gowron_kdf_crew
"Third Remata'Klan",7,3, 410,42,84,0,0,0,467,85,185,0,0,0,0,0,0,0,0,0,1247,831,1176,1319,1063,1129,0,0,0,1013,1263,904,0,0,0,1342,876,1270,1388,1155,1035,0,0,0,944,1214,865,0,0,0,1519,1565,"Jem'hadar, Dominion, Duelist, Tactician","nonhuman, male, organic, ds9, remataklan, crew_max_rarity_3","Victory is Life",0, 3, 0, 6, 8, 4, 4, , , , 690, 395, 597, 600, true,"Remata'Klan",crew_portraits_cm_remataklan_sm.png,remataklan_crew
"Ensign Chapel",10,1, 0,0,0,0,0,0,0,0,0,0,0,0,0,0,0,214,34,152,0,0,0,0,1176,0,0,0,863,0,0,1092,0,819,1153,0,0,0,0,1096,0,0,0,812,0,0,1030,0,775,1072,1637,1628,"Human, Federation, Starfleet, Nurse","female, organic, tos, chapel, crew_max_rarity_1","Administer Prescription",2, 1, 6, 10, 10, , , , , , 130, , 40, 100, false,"Chapel",crew_portraits_cm_chapelensign_sm.png,chapel_ensign_crew
"Ensign Ogawa",8,1, 0,0,0,0,0,0,0,0,0,0,0,0,0,0,0,213,34,166,0,0,0,0,1170,0,0,0,861,0,0,1089,0,817,1148,0,0,0,0,1085,0,0,0,790,0,0,1018,0,763,1052,1636,1626,"Human, Federation, Starfleet, Nurse","female, organic, tng, ogawa, crew_max_rarity_1","Report to Sickbay",2, 1, 6, 1, 8, 2, 0, 1, , , 170, , 35, 105, false,"Ogawa",crew_portraits_cm_ogawaensign_sm.png,ogawa_ensign_crew
"Wesley Crusher",8,1, 0,0,0,218,43,149,0,0,0,174,32,78,0,0,0,0,0,0,1356,0,1311,0,0,1356,898,1342,859,1193,0,0,1357,832,0,1276,0,1286,0,0,1265,700,1253,809,1173,0,0,1330,820,0,1614,1601,"Human, Federation, Civilian, Prodigy","male, organic, tng, wesley, crew_max_rarity_1","Study",1, 2, 8, 10, 12, , , , 0, 1, 215, 125, 70, 55, false,"Wesley",crew_portraits_cm_wesleysweater_sm.png,wesley_sweater_crew
"Ensign Crusher",10,3, 176,11,31,426,83,229,0,0,0,347,34,78,0,0,0,0,0,0,932,1320,1098,1429,1200,1164,578,1189,734,1160,0,0,1305,802,0,906,1321,1243,1436,1202,949,535,1019,575,1172,0,0,1326,818,0,1505,1529,"Human, Federation, Starfleet, Prodigy, Warp Theorist","male, organic, tng, wesley, crew_max_rarity_3","Rewire",2, 4, 6, 8, 10, 6, 0, , , , 290, , , 190, false,"Wesley",crew_portraits_cm_wesley_sm.png,wesley_full_ensign_crew
"Acting Ensign Crusher",9,2, 114,29,58,258,56,160,0,0,0,251,53,148,0,0,0,0,0,0,1197,1324,1135,1438,1204,1339,699,1321,851,1172,0,0,1316,809,0,1001,1309,987,1423,1187,1199,538,1201,745,1096,0,0,1217,756,0,1567,1511,"Human, Federation, Starfleet, Prodigy, Resourceful","male, organic, tng, wesley, crew_max_rarity_2","Invention",1, 4, 3, 6, 6, , , 2, , , 205, 50, 25, 165, false,"Wesley",crew_portraits_cm_wesleyensign_sm.png,wesley_acting_ensign_crew
"Formal Dress Wesley Crusher",9,4, 0,0,0,662,173,422,0,0,0,270,108,230,481,160,342,0,0,0,816,0,1236,1101,0,785,313,303,461,1142,1145,0,647,789,798,465,0,866,766,0,439,81,56,267,824,768,0,122,499,468,1266,316,"Human, Federation, Starfleet, Prodigy, Warp Theorist","male, organic, tng, wesley, crew_max_rarity_4","Duty to the Truth",1, 9, 4, 10, 12, , , , , , 300, 500, 30, 450, false,"Wesley",crew_portraits_cm_wesleydressuniform_sm.png,wesley_formal_dress_crew
"Wrathful Khan",7,5, 1040,206,421,0,0,0,1145,72,143,376,140,288,0,0,0,0,0,0,424,125,124,662,282,503,877,0,0,151,723,332,1167,700,0,354,303,31,576,222,1174,525,0,0,320,1329,975,736,386,0,673,629,"Human, Augments, Engineered, Villain, Cultural Figure, Tactician, Resourceful, Survivalist, Brutal, Vengeful","nonhuman, male, organic, tos, khan, crew_max_rarity_5","I Stab at Thee",2, 9, 12, 5, 12, 1, 0, , , , 640, 595, 345, 850, false,"Khan",crew_portraits_cm_khan_sm.png,khan_wok_crew
"Tailor Garak",5,3, 0,0,0,0,0,0,502,44,126,161,22,44,395,83,219,0,0,0,0,1151,1318,1260,0,1141,1052,1196,0,800,893,920,945,834,1009,0,1257,1316,1115,0,1292,1054,1038,0,1017,821,1041,848,836,842,1480,1499,"Cardassian, Undercover Operative, Scoundrel, Interrogator, Civilian","nonhuman, male, organic, ds9, garak, crew_max_rarity_3","Cutting Cloth",1, 5, 8, 12, 12, , , , , , 125, 230, 20, 405, false,"Garak",crew_portraits_cm_garaktailor_sm.png,garak_tailor_crew
"Bartender Quark",4,1, 110,25,77,0,0,0,81,15,57,0,0,0,211,36,150,0,0,0,1384,1309,1323,1338,1203,1380,0,1345,0,1201,1402,1113,1338,0,1152,1359,1251,1293,1144,1174,1374,0,1259,0,1195,1242,1108,1243,0,1071,1606,1579,"Ferengi, Bartender, Civilian, Scoundrel, Gambler, Merchant","nonhuman, male, organic, ds9, quark, crew_max_rarity_1","Hospitality",1, 2, 8, 10, 12, , , , 2, 1, 165, 10, 10, 140, false,"Quark",crew_portraits_cm_quarkbartender_sm.png,quark_s1_bartender_crew
"Richard Castillo",8,3, 487,109,227,286,57,187,0,0,0,0,0,0,0,0,0,0,0,0,761,1097,1024,1173,901,1328,1018,1313,844,0,0,0,0,0,0,474,964,861,1056,753,1124,837,1148,692,0,0,0,0,0,0,1528,1483,"Human, Hero, Pilot, Starfleet, Federation, Displaced, Romantic","male, organic, castillo, tng, crew_max_rarity_3","Self Sacrifice",0, 5, 12, 12, 10, 7, 0, , 1, 2, 650, 265, 129, 585, false,"Castillo",crew_portraits_cm_richardcastillo_sm.png,castillo_lieutenant_crew
"Writer Jake Sisko",9,3, 0,0,0,0,0,0,0,0,0,0,0,0,451,70,198,0,0,0,0,0,0,1247,0,0,0,1178,0,0,1284,0,1160,0,993,0,0,0,1173,0,0,0,1089,0,0,1222,0,1060,0,900,1605,1608,"Human, Federation, Civilian, Writer, Gambler, Romantic","male, organic, ds9, jake, crew_max_rarity_3","Construct Story",2, 3, 0, 8, 10, 6, 0, , , , 995, 350, 47, 640, true,"Jake",crew_portraits_cm_jakewriter_sm.png,jake_writer_crew
"CMO Crusher",10,2, 0,0,0,0,0,0,0,0,0,0,0,0,0,0,0,290,52,174,0,0,0,0,1152,0,0,0,845,0,0,1068,0,804,1124,0,0,0,0,1027,0,0,0,724,0,0,959,0,719,997,1627,1621,"Human, Starfleet, Federation, Physician, Caregiver, Cyberneticist","female, organic, tng, crusher, crew_max_rarity_2","Doctor's Calluses",2, 3, 6, 10, 10, , , , , , 185, , 35, 155, false,"Crusher",crew_portraits_cm_crusherwithlabcoat_sm.png,crusher_labcoat_crew
"Commando Crusher",6,3, 0,0,0,182,76,200,308,93,193,0,0,0,0,0,0,510,44,132,1350,1242,0,0,987,896,1030,1339,471,1118,1371,569,0,694,982,1062,1061,0,0,1111,473,748,1085,421,923,1189,513,0,785,1087,1476,1395,"Human, Starfleet, Federation, Physician, Cyberneticist, Undercover Operative","female, organic, tng, crusher, crew_max_rarity_3","Repel Disease",0, 3, 6, 3, 12, 1, 0, , , , 575, , 370, 500, false,"Crusher",crew_portraits_cm_crusherblackcommandouniform_sm.png,crusher_black_commando_uniform_crew
"Dr. Crusher",10,4, 275,38,110,0,0,0,437,90,201,0,0,0,0,0,0,736,123,300,1337,891,1272,1383,336,1148,0,0,464,1031,1282,227,0,421,669,1324,816,1253,1370,338,985,0,0,452,915,1181,165,0,402,657,1360,1290,"Human, Starfleet, Federation, Physician, Cyberneticist","female, organic, tng, crusher, crew_max_rarity_4","Neutralize Disease",1, 7, 12, 12, 12, 4, 4, , , , 740, 250, 370, 500, false,"Crusher",crew_portraits_cm_crusherfromfirstcontact_sm.png,crusher_first_contact_crew
"Holonovel Doctor",9,4, 0,0,0,512,50,137,0,0,0,0,0,0,0,0,0,799,69,244,1162,0,0,0,613,1137,866,1161,181,0,0,613,0,416,666,1282,0,0,0,821,1271,963,1261,337,0,0,798,0,552,815,1454,1518,"Hologram, Human, Federation, Starfleet, Physician, Musician, Scoundrel","nonhuman, male, artificial_life, voy, emh, crew_max_rarity_4","Suggested Treatment",0, 7, 12, 12, 12, , , , , , 365, 370, 205, 525, false,"Doctor",crew_portraits_cm_doctorgolfclub_sm.png,emh_authorauthor_crew
"Mobile Doctor",10,5, 0,0,0,809,106,209,0,0,0,0,0,0,393,137,435,1191,110,334,810,0,0,1158,254,780,581,330,32,0,1191,272,1015,156,74,979,0,0,684,578,945,677,163,136,0,665,587,452,378,73,745,514,"Hologram, Human, Federation, Starfleet, Musician, Physician","nonhuman, male, artificial_life, voy, emh, crew_max_rarity_5","House Call",2, 9, 12, 12, 12, , , , , , 1825, 600, , 600, false,"Doctor",crew_portraits_cm_emhmobile_sm.png,emh_mobileholoemitter_crew
"Comm Officer Uhura",6,1, 0,0,0,0,0,0,0,0,0,0,0,0,258,28,89,0,0,0,0,0,0,1400,0,0,0,1337,0,0,1426,0,1330,0,1144,0,0,0,1400,0,0,0,1334,0,0,1428,0,1323,0,1136,1633,1637,"Federation, Starfleet, Human, Musician, Communicator","female, organic, tos, uhura, crew_max_rarity_1","Incoming Message",2, 2, 8, 10, 12, , , , 1, 1, 320, , , 495, false,"Uhura",crew_portraits_cm_uhurared_sm.png,uhura_red_crew
"Commander Uhura",10,4, 459,128,299,0,0,0,0,0,0,0,0,0,592,198,429,0,0,0,1048,1079,1000,535,875,0,0,872,0,0,1030,0,830,0,676,762,836,678,139,591,0,0,430,0,0,535,0,349,0,293,1451,997,"Federation, Starfleet, Human, Musician, Communicator","female, organic, tos, uhura, crew_max_rarity_4","Hailing Frequencies",0, 8, 12, 26, 12, , , 1, , , 1165, , 75, 790, false,"Uhura",crew_portraits_cm_uhurawrathofkhan_sm.png,uhura_wrathofkhan_crew
"Dancing Uhura",9,5, 1026,84,195,0,0,0,0,0,0,0,0,0,1185,193,393,0,0,0,648,762,591,109,467,0,0,455,0,0,573,0,374,0,322,1040,1069,1004,276,879,0,0,502,0,0,644,0,435,0,371,817,1286,"Human, Federation, Starfleet, Communicator, Casual, Musician, Artist","female, organic, tos, uhura, original, crew_max_rarity_5","Take The Lead",0, 8, 10, 3, 14, 1, 1, , , , 465, 260, 60, 400, false,"Uhura",crew_portraits_cm_uhura_dancing_sm.png,uhura_dancing_crew
"First Maje Culluh",9,3, 466,93,223,0,0,0,307,42,138,0,0,0,0,0,0,0,0,0,1133,861,1071,1220,954,1329,0,0,0,1161,1409,1067,0,0,0,958,700,904,1081,792,1277,0,0,0,1120,1378,1034,0,0,0,1536,1512,"Kazon, Scoundrel, Vengeful","nonhuman, male, organic, voy, culluh, crew_max_rarity_3","Nistrim Supremacy",2, 3, 6, 10, 10, 8, 4, , , , 665, 325, 133, 390, false,"Culluh",crew_portraits_cm_jalculluh_sm.png,culluh_crew
"KDF Alexander",7,2, 137,19,79,0,0,0,331,64,148,145,16,72,0,0,0,0,0,0,1380,1128,1269,1433,1201,1294,1053,0,0,993,1380,1034,1365,836,0,1362,1015,1207,1415,1177,1185,1048,0,0,895,1336,980,1351,830,0,1574,1564,"Human, Klingon","male, organic, ds9, alexander, nonhuman, crew_max_rarity_2","Beginner's Luck",1, 3, 10, 12, 10, 5, 2, , , , 130, 200, 62, 15, false,"Alexander",crew_portraits_cm_alexanderkdf_sm.png,alexander_kdf_crew
"Commando Shran",9,4, 673,114,239,0,0,0,592,89,182,0,0,0,318,144,282,0,0,0,859,491,777,647,656,928,0,1200,0,854,731,749,1190,0,1013,883,528,814,369,706,1033,0,827,0,941,414,864,746,0,645,1261,1003,"Andorian, Tactician, Inspiring, Imperial Guard","nonhuman, male, organic, ent, shran, crew_max_rarity_4","Debt Owed",0, 8, 6, 8, 10, , , 3, , , 390, 575, 288, 350, false,"Shran",crew_portraits_cm_shrancommando_sm.png,shran_commando_crew
"Ushaan Shran",10,5, 989,83,164,0,0,0,1076,170,348,0,0,0,424,134,288,0,0,0,709,145,656,409,517,436,0,1107,0,403,206,289,1096,0,924,1126,374,1081,512,960,532,0,832,0,508,172,404,753,0,650,721,783,"Andorian, Duelist, Romantic, Imperial Guard","nonhuman, male, organic, ent, shran, crew_max_rarity_5","Debt Owed",0, 9, 6, 8, 10, , , 3, , , 1440, 565, 483, 390, false,"Shran",crew_portraits_cm_shrandueling_sm.png,shran_dueling_crew
"Fencing Sulu",9,4, 444,99,249,385,36,92,609,203,448,0,0,0,0,0,0,0,0,0,756,513,1084,1230,967,417,984,1282,825,725,1019,617,0,0,0,643,180,838,1030,727,177,1026,1325,860,301,471,200,0,0,0,1313,855,"Human, Federation, Starfleet, Pilot, Resourceful, Duelist, Athlete, Compromised","male, organic, tos, sulu, crew_max_rarity_4","Parry Attack",0, 6, 12, 8, 12, 6, 4, , , , 415, , 225, 225, false,"Sulu",crew_portraits_cm_sulufencing_sm.png,sulu_fencing_crew
"Morn",9,3, 0,0,0,0,0,0,359,70,174,0,0,0,418,121,295,0,0,0,0,1207,0,1221,0,1249,0,1124,0,1093,920,1001,1111,0,938,0,1123,0,934,0,1099,0,841,0,992,469,913,767,0,661,1513,1438,"Lurian, Courier, Duelist, Civilian, Gambler, Smuggler","nonhuman, male, organic, ds9, morn, crew_max_rarity_3","Drinking Spot",0, 3, 0, 8, 8, , , , 1, 2, 150, 285, 57, 655, true,"Morn",crew_portraits_cm_morn_sm.png,morn_crew
"Seven in Blue",9,2, 0,0,0,294,51,209,0,0,0,278,53,130,0,0,0,0,0,0,1322,0,1270,0,0,1316,654,1302,837,1169,0,0,1313,807,0,1111,0,1208,0,0,1080,513,1116,655,1115,0,0,1244,776,0,1580,1543,"Human, Borg, Civilian, Federation, Astrophysicist","nonhuman, female, organic, voy, seven, crew_max_rarity_2","Ignore Irrelevancies",1, 2, 8, 10, 14, 4, 0, , , , 75, 50, 310, 170, false,"Seven",crew_portraits_cm_seven_of_nine_sm.png,seven_allblue_crew
"Seven of Nine",8,5, 0,0,0,785,247,791,0,0,0,854,225,454,514,89,183,0,0,0,522,0,570,1174,0,505,51,204,297,568,1215,0,160,284,877,64,0,238,1163,0,66,3,14,43,278,1215,0,79,94,897,719,41,"Human, Borg, Civilian, Federation, Astrophysicist","nonhuman, female, organic, voy, seven, crew_max_rarity_5","New Collective",2, 7, 12, 10, 14, 4, 0, , , , 1750, , 705, 440, false,"Seven",crew_portraits_cm_sevenbluegreyshoulders_sm.png,seven_bluegreyshoulders_crew
"Donik",10,3, 0,0,0,0,0,0,0,0,0,476,79,199,303,31,79,0,0,0,0,0,1093,1379,0,0,857,1320,0,1010,1414,0,806,682,1131,0,0,1008,1407,0,0,740,1342,0,936,1434,0,813,611,1143,1551,1569,"Hirogen, Innovator","nonhuman, male, organic, voy, donik, crew_max_rarity_3","Hunting Program",2, 4, 12, 12, 10, 7, 0, , , , 870, 165, , 340, false,"Donik",crew_portraits_cm_donik_sm.png,donik_crew
"Commander Tucker",8,2, 252,28,82,0,0,0,0,0,0,305,53,185,0,0,0,0,0,0,1358,1296,912,1404,1171,0,1010,0,0,1150,0,0,1294,794,0,1354,1294,841,1405,1170,0,838,0,0,1009,0,0,1126,689,0,1592,1582,"Human, Starfleet, Jury Rigger, Pilot, Explorer","male, organic, ent, tucker, crew_max_rarity_2","Warp Engines Online",1, 2, 6, 3, 8, 2, 0, , , , 520, 35, 50, 165, false,"Trip",crew_portraits_cm_tucker_sm.png,tucker_commander_crew
"Counselor Troi",6,1, 0,0,0,0,0,0,0,0,0,0,0,0,261,42,108,147,49,131,0,0,0,1387,1195,0,0,1327,875,0,1418,1103,1319,831,1002,0,0,0,1371,1105,0,0,1305,823,0,1408,1035,1286,781,791,1608,1594,"Federation, Starfleet, Human, Betazoid, Empath, Counselor","nonhuman, female, organic, tng, troi, crew_max_rarity_1","Counselling",2, 1, 6, 10, 10, , , , , , 265, , 80, 345, false,"Troi",crew_portraits_cm_troitng_sm.png,troi_casualgray_crew
"Rakal Troi",6,4, 521,163,354,0,0,0,525,128,331,0,0,0,0,0,0,407,163,440,928,534,865,1065,232,904,0,0,582,832,1116,258,0,560,817,548,191,474,731,16,647,0,0,243,596,842,28,0,161,346,1191,171,"Federation, Starfleet, Human, Betazoid, Romulan, Empath, Undercover Operative, Tal Shiar","nonhuman, female, organic, tng, troi, crew_max_rarity_4","Romulan Disguise",1, 7, 12, 10, 14, 1, 2, , , , 90, 400, 175, 2825, false,"Troi",crew_portraits_cm_troirakal_sm.png,troi_rakal_crew
"Commander Troi",9,5, 0,0,0,0,0,0,383,203,253,0,0,0,1060,211,421,827,142,281,0,1141,0,644,572,1123,0,496,437,1009,202,139,416,381,44,0,768,0,580,610,655,0,423,453,609,86,89,338,403,60,746,218,"Federation, Starfleet, Human, Betazoid, Empath, Counselor, Playful","nonhuman, female, organic, tng, troi, crew_max_rarity_5","Empathic Sense",1, 8, 6, 6, 6, , , , , , 1375, 475, 135, 725, true,"Troi",crew_portraits_cm_troifirstcontact_sm.png,troi_firstcontact_crew
"Vedek Winn Adami",8,3, 307,97,207,0,0,0,0,0,0,0,0,0,410,92,214,0,0,0,1274,1239,1203,937,1094,0,0,1193,0,0,1295,0,1181,0,1004,986,1023,937,607,826,0,0,1026,0,0,1151,0,983,0,826,1538,1470,"Bajoran, Vedek, Cultural Figure, Spiritual","nonhuman, female, organic, ds9, winn, crew_max_rarity_3","Will of the Prophets",1, 4, 8, 10, 10, 4, 0, , , , , 270, 85, 830, false,"Winn",crew_portraits_cm_winnvedek_sm.png,winn_vedek_crew
"Subcommander T'Pol",7,3, 273,71,211,520,21,77,165,35,77,0,0,0,0,0,0,0,0,0,806,1119,1254,1371,1142,863,887,1192,737,1194,1444,1104,0,0,0,837,884,997,1148,875,1207,1044,1352,873,1171,1431,1084,0,0,0,1502,1516,"Vulcan, High Command, Astrophysicist, Telepath, Starfleet","nonhuman, female, organic, ent, tpol, crew_max_rarity_3","Logic",2, 5, 6, 10, 10, , , , , , 175, 120, 3, 100, false,"T'Pol",crew_portraits_cm_tpol_sm.png,tpol_subcommander_crew
"Commander T'Pol",9,4, 512,112,307,692,56,171,320,91,227,0,0,0,0,0,0,0,0,0,348,721,923,1108,803,497,641,931,515,1096,1347,1004,0,0,0,334,399,697,921,604,504,872,1178,725,858,1123,776,0,0,0,1314,1182,"Vulcan, Starfleet, Astrophysicist, Telepath","nonhuman, female, organic, ent, tpol, crew_max_rarity_4","Vessel's Information",0, 5, 12, 12, 20, 2, 0, , , , 1400, 200, 70, 1175, false,"T'Pol",crew_portraits_cm_tpolcommander_sm.png,tpol_commander_crew
"Chef Neelix",1,1, 0,0,0,0,0,0,0,0,0,0,0,0,201,51,189,0,0,0,0,0,0,1399,0,0,0,1334,0,0,1424,0,1328,0,1143,0,0,0,1230,0,0,0,1149,0,0,1281,0,1127,0,964,1632,1614,"Talaxian, Mylean, Resourceful, Survivalist, Chef, Civilian, Communicator","nonhuman, male, organic, voy, neelix, crew_max_rarity_1","Soup's On",1, 2, 12, 14, 10, 6, 0, , 2, 1, 305, , , 210, false,"Neelix",crew_portraits_cm_neelix_sm.png,neelix_chef_crew
"CMO 'Bones' McCoy",8,1, 0,0,0,0,0,0,0,0,0,0,0,0,0,0,0,213,48,196,0,0,0,0,1161,0,0,0,856,0,0,1083,0,812,1141,0,0,0,0,979,0,0,0,684,0,0,918,0,684,958,1630,1613,"Human, Federation, Starfleet, Physician, Exobiology","male, organic, tos, mccoy, crew_max_rarity_1","Country Doctor",2, 3, 8, 10, 12, , , , 0, 2, 245, 10, 8, 285, false,"McCoy",crew_portraits_cm_mccoy_sm.png,mccoy_chief_medical_officer_crew
