"Brigitte Torres",3,4, 297,78,178,0,0,0,634,106,223,0,0,0,949,137,284,0,0,0,994,470,927,351,861,618,0,488,0,563,146,495,409,0,361,826,439,784,379,711,663,0,615,0,605,271,568,531,0,485,667,781,"Human, Costumed, Undercover Operative, Caregiver, Romantic, Civilian, Klingon","nonhuman, female, organic, voy, torres, crew_max_rarity_4","Here's to English Precision",1, 7, 8, 6, 10, , , , , , 465, 50, 118, 350, false,"Torres",crew_portraits_cm_torres_brigitte_sm.png,torres_brigitte_crew
"Lieutenant Georgiou",6,4, 665,81,208,397,48,132,0,0,0,0,0,0,909,50,120,0,0,0,313,689,589,261,523,936,633,304,563,0,715,0,560,0,476,491,791,718,622,657,960,651,710,594,0,1033,0,939,0,822,753,1081,"Human, Federation, Starfleet, Inspiring, Diplomat","female, organic, dsc, georgiou, crew_max_rarity_4","You Caused Quite a Stir",2, 8, 8, 8, 12, , , , , , 300, 55, 40, 250, false,"Georgiou",crew_portraits_cm_georgiou_lt_sm.png,dsc_georgiou_lt_crew
"Ransom Shran",6,4, 624,63,166,0,0,0,387,74,161,0,0,0,905,108,247,0,0,0,721,459,658,246,595,915,0,552,0,791,325,744,490,0,413,880,559,827,492,753,857,0,702,0,740,473,712,631,0,555,714,958,"Andorian, Tactician, Caregiver, Desperate","nonhuman, male, organic, ent, shran, crew_max_rarity_4","You Have To Help Me",0, 7, 10, 8, 10, 4, 2, , , , 500, 175, 210, 475, false,"Shran",crew_portraits_cm_shran_ransom_sm.png,shran_ransom_crew
"Captain Erika Hernandez",10,5, 1204,194,419,0,0,0,0,0,0,993,129,294,0,0,0,0,0,0,235,384,13,417,141,0,306,0,0,365,0,0,386,188,0,293,420,25,460,202,0,366,0,0,493,0,0,537,291,0,563,751,"Starfleet, Human, Resourceful, Romantic, Athlete","female, organic, ent, captain, hernandez, crew_max_rarity_5","Able To Hang In A Firefight A Little Longer",2, 9, 8, 6, 14, 8, 4, , , , 395, 200, 70, 550, false,"Hernandez",crew_portraits_cm_hernandez_captain_sm.png,hernandez_captain_crew
"Prisoner Kim",3,5, 0,0,0,0,0,0,1002,157,336,1261,231,469,0,0,0,556,98,196,0,448,129,0,615,323,177,0,440,8,492,33,162,8,599,0,522,162,0,652,419,166,0,457,14,577,98,175,16,647,51,212,"Federation, Human, Starfleet, Prisoner, Desperate, Survivalist, Caregiver","male, organic, voy, kim, crew_max_rarity_5","He's Dead!",0, 9, 6, 6, 8, , , , , , 530, 150, 250, 350, false,"Kim",crew_portraits_cm_kim_prisoner_sm.png,kim_prisoner_crew
"Reclamation Narissa",7,4, 854,125,297,0,0,0,683,50,111,0,0,0,320,68,172,0,0,0,537,226,467,418,398,654,0,974,0,593,537,527,957,0,838,555,445,484,397,454,986,0,872,0,850,722,811,830,0,718,775,953,"Zhat Vash, Tal Shiar, Romulan, Brutal, Villain, Crafty, Duelist","pic, nonhuman, organic, narissa, female, crew_max_rarity_4","Something Far Worse Is Coming",0, 7, 10, 8, 12, 1, 2, , , , 550, 175, 180, 325, false,"Narissa",crew_portraits_cm_narissa_reclamation_crew_sm.png,narissa_reclamation_crew
"U.S.S. Zheng He Riker",6,5, 1276,199,453,0,0,0,967,183,357,0,0,0,518,90,174,0,0,0,165,23,131,118,72,329,0,791,0,298,174,222,750,0,638,243,74,181,186,161,359,0,832,0,327,224,279,788,0,684,100,226,"Human, Federation, Starfleet, Pilot, Maverick, Gambler","male, organic, pic, riker, crew_max_rarity_5","I Learned From The Best",2, 10, 6, 6, 8, , , , 1, 2, 500, 300, 195, 300, false,"Riker",crew_portraits_cm_riker_zhenghe_sm.png,riker_zhenghe_crew
"Nona",9,5, 521,62,166,0,0,0,0,0,0,0,0,0,964,118,209,1252,172,436,819,829,759,291,15,0,0,518,130,0,616,131,451,73,19,884,868,830,526,70,0,0,746,199,0,811,218,678,122,82,334,593,"Caregiver, Botanist, Spiritual, Neural, Crafty, Civilian, Desperate","nonhuman, organic, female, tos, nona, crew_max_rarity_5","Don't Touch Me!",1, 10, 8, 5, 8, , , , , , 305, 185, 140, 490, false,"Nona",crew_portraits_cm_nona_sm.png,nona_crew
"Camp Nurse Janeway",6,4, 356,59,137,0,0,0,0,0,0,0,0,0,589,118,255,824,162,350,959,928,897,534,121,0,0,693,306,0,789,386,649,251,74,943,911,876,516,138,0,0,679,265,0,760,326,610,200,100,744,692,"Human, Starfleet, Federation, Resourceful, Costumed, Nurse, Civilian","female, organic, voy, janeway, crew_max_rarity_4","You're Bleeding!",2, 5, 14, 10, 16, 2, 0, , , , 500, 270, 125, 250, false,"Janeway",crew_portraits_cm_janeway_civil_war_sm.png,janeway_civil_war_crew
"Kivas Fajo",9,4, 0,0,0,619,77,170,850,139,294,0,0,0,360,66,124,0,0,0,705,591,0,994,0,77,480,448,413,463,386,385,935,0,817,846,602,0,980,0,204,568,587,506,466,419,432,913,0,797,763,915,"Crafty, Scoundrel, Zibelian, Brutal, Criminal, Thief","nonhuman, male, organic, tng, kivas, crew_max_rarity_4","Accept Your Fate",2, 8, 8, 8, 10, , , , , , 433, 135, 93, 417, false,"Kivas",crew_portraits_cm_fajo_kivas_sm.png,fajo_kivas_crew
"Emory Erickson",7,5, 0,0,0,1025,194,451,0,0,0,1144,232,484,474,80,166,0,0,0,287,0,198,911,0,292,11,105,186,227,933,0,51,101,729,259,0,152,893,0,256,7,119,170,177,933,0,53,65,708,191,150,"Human, Civilian, Caregiver, Innovator, Desperate","male, organic, ent, erickson, crew_max_rarity_5","You'll Be Able To Leave The Lights On",0, 8, 6, 10, 10, 4, 0, , , , 300, 50, 130, 450, true,"Emory",crew_portraits_cm_emory_erickson_sm.png,emory_erickson_crew
"Ambassador V'Lar",9,5, 997,138,268,0,0,0,0,0,0,0,0,0,1269,234,439,0,0,0,413,516,359,31,301,0,0,207,0,0,313,0,132,0,140,577,639,506,103,476,0,0,263,0,0,370,0,185,0,198,531,694,"Vulcan, Ambassador, Diplomat, Telepath, Investigator, High Command","female, nonhuman, organic, ent, vlar, crew_max_rarity_5","We've Kept Many Things From Them",2, 8, 6, 8, 12, 5, 0, , , , 390, 195, 153, 475, false,"V'lar",crew_portraits_cm_vlar_ambassador_sm.png,vlar_ambassador_crew
"Altan Inigo Soong",4,4, 484,179,392,993,122,283,0,0,0,409,91,199,0,0,0,0,0,0,77,728,257,784,572,397,124,455,244,778,0,0,879,507,0,58,459,67,507,253,550,163,633,344,687,0,0,758,440,0,613,454,"Human, Civilian, Cyberneticist, Innovator, Federation, Caregiver","male, organic, pic, altan, crew_max_rarity_4","I Suppose That's What Mothers Do",1, 6, 6, 6, 12, 6, 0, , , , 250, 315, 213, 125, false,"Altan",crew_portraits_cm_altan_sm.png,altan_crew
"Dr. Roger Korby",6,5, 493,84,162,1271,230,424,0,0,0,0,0,0,0,0,0,957,181,393,51,848,792,905,30,165,169,225,9,0,0,230,0,148,298,77,839,797,891,74,243,188,281,16,0,0,255,0,155,302,148,223,"Android, Exoarchaeology, Physician, Starfleet, Federation, Undercover Operative","male, nonhuman, artificial_life, tos, korby, crew_max_rarity_5","Now, Strike Him!",0, 10, 8, 6, 8, , , , , , 465, 200, 177, 225, false,"Korby",crew_portraits_cm_korby_roger_sm.png,korby_roger_crew
"Breen Disguise Kira",3,5, 581,106,206,0,0,0,1221,287,685,0,0,0,1064,61,164,0,0,0,724,105,662,197,598,97,0,463,0,114,4,52,382,0,340,725,49,674,539,617,52,0,890,0,52,49,41,859,0,740,19,182,"Bajoran, Breen, Starfleet, Saboteur, Undercover Operative, Resourceful","nonhuman, female, organic, evsuit, ds9, kira, crew_max_rarity_5","Make the Right Choice",1, 7, 8, 4, 10, 1, 1, , , , 450, 100, 40, 400, false,"Kira",crew_portraits_cm_kira_breen_sm.png,kira_breen_crew
"Awaiting Amanda Grayson",7,5, 446,119,259,0,0,0,0,0,0,0,0,0,1286,205,416,859,205,430,822,833,764,121,36,0,0,209,257,0,320,318,138,202,11,615,667,546,146,32,0,0,317,177,0,431,191,242,101,19,220,132,"Human, Federation, Caregiver, Civilian, Communicator, Desperate","female, amanda_grayson, organic, tos, crew_max_rarity_5","Your Duty Is To Your Father",2, 10, 8, 6, 8, , , , , , 400, 125, 150, 525, false,"Amanda",crew_portraits_cm_amanda_grayson_awaiting_sm.png,amanda_grayson_awaiting_crew
"Em/3/Green",9,4, 0,0,0,648,45,157,396,67,153,868,108,262,0,0,0,0,0,0,701,888,475,0,0,322,111,713,412,191,971,743,529,265,0,936,877,576,0,0,533,262,927,565,279,970,739,621,337,0,749,991,"Nasat, Crafty, Federation, Desperate, Resourceful, Jury Rigger","em_three, male, organic, nonhuman, tas, crew_max_rarity_4","I Am Not Afraid, Just Very Tired",1, 6, 8, 10, 20, 2, 0, , , , 325, 200, 163, 225, false,"Em",crew_portraits_cm_em_sm.png,em_three_green_crew
"EV Suit Spock",5,5, 0,0,0,1270,178,365,613,37,101,843,221,514,0,0,0,0,0,0,201,777,360,0,0,36,20,280,136,72,851,598,388,190,0,385,965,139,0,0,211,12,420,243,103,1057,826,148,57,0,194,289,"Vulcan, Human, Telepath, Spiritual, Starfleet, Federation, Explorer, Crafty, Thief, Exobiology","evsuit, nonhuman, male, organic, tos, spock, crew_max_rarity_5","Facilitate A Better View",2, 9, 8, 8, 12, 0, 1, , , , 500, 125, 100, 150, false,"Spock",crew_portraits_cm_spock_evsuit_sm.png,spock_evsuit_crew
"Dignitary Sarek",3,4, 0,0,0,649,84,173,0,0,0,0,0,0,918,146,257,378,55,121,673,0,0,618,807,647,464,112,210,0,618,778,458,538,157,828,0,0,699,835,825,550,276,329,0,730,797,566,552,299,684,948,"Vulcan, Diplomat, Cultural Figure, Communicator, Federation, Telepath, Ambassador","nonhuman, male, organic, sarek, tos, crew_max_rarity_4","Threats Are Illogical",1, 8, 6, 6, 8, , , , , , 455, 145, 195, 415, false,"Sarek",crew_portraits_cm_sarek_dignitary_sm.png,sarek_dignitary_crew
"Captain Solok",8,5, 1004,95,266,1283,199,400,475,88,162,0,0,0,0,0,0,0,0,0,16,254,379,579,316,41,178,240,115,746,929,691,0,0,0,66,418,575,744,528,101,235,347,205,718,922,694,0,0,0,275,524,"Vulcan, Starfleet, Writer, Federation, Telepath","male, nonhuman, organic, ds9, solok, crew_max_rarity_5","Your Welcome Is Acknowledged",1, 6, 10, 10, 14, 2, 0, , , , 400, 170, 155, 365, false,"Solok",crew_portraits_cm_solok_captain_sm.png,solok_captain_crew
"D'Nesh",10,5, 0,0,0,0,0,0,0,0,0,1022,140,310,1247,222,505,0,0,0,0,0,306,337,0,0,271,203,0,320,309,0,9,155,136,0,0,455,334,0,0,352,212,0,467,298,0,15,271,162,524,586,"Romantic, Scoundrel, Orion, Casual, Civilian, Crafty, Saboteur","female, nonhuman, organic, ent, dnesh, crew_max_rarity_5","I Thought You Were Different",1, 7, 6, 8, 8, , , , , , 350, 165, 135, 465, true,"D'Nesh",crew_portraits_cm_dnesh_sm.png,dnesh_crew
"T'Pring",9,5, 0,0,0,0,0,0,1071,74,157,0,0,0,1292,172,285,0,0,0,0,488,0,393,0,388,0,286,0,350,29,279,207,0,208,0,863,0,633,0,870,0,544,0,752,342,723,453,0,421,554,1053,"Vulcan, Telepath, Romantic, Brutal, Civilian","tos, organic, nonhuman, tpring, female, crew_max_rarity_5","Flawlessly Logical",2, 9, 8, 5, 8, , , , , , 390, 200, 213, 650, false,"T'Pring",crew_portraits_cm_tpring_sm.png,tpring_crew
"Boreth Pike",7,4, 873,86,227,385,55,133,0,0,0,0,0,0,591,97,199,0,0,0,233,621,484,292,414,944,637,420,568,0,818,0,680,0,575,444,758,673,467,615,947,640,500,581,0,862,0,737,0,643,800,983,"Starfleet, Human, Federation, Inspiring, Explorer, Tactician, Desperate, Diplomat","male, organic, dsc, pike, crew_max_rarity_4","I'm Not Leaving Here",0, 9, 8, 8, 10, , , , 1, 2, 450, 200, 175, 375, false,"Pike",crew_portraits_cm_pike_boreth_sm.png,dsc_pike_boreth_crew
"Mok'bara Crusher",4,5, 0,0,0,0,0,0,475,88,191,0,0,0,1253,205,458,1079,150,373,0,839,0,349,192,833,0,229,187,729,98,34,150,133,1,0,797,0,399,297,768,0,271,254,685,144,92,192,192,31,46,231,"Human, Starfleet, Federation, Caregiver, Physician, Counselor, Athlete","female, organic, tng, crusher, crew_max_rarity_5","And Then What Happened?",2, 7, 10, 8, 12, 2, 0, , , , 550, 170, 65, 100, false,"Crusher",crew_portraits_cm_crusher_mok_bara_sm.png,crusher_mok_bara_crew
"Leila Kalomi",8,5, 0,0,0,1273,210,375,0,0,0,0,0,0,982,164,354,451,98,210,183,0,0,519,736,197,191,11,42,0,505,694,322,481,75,341,0,0,555,632,317,248,42,76,0,564,624,379,414,112,200,285,"Human, Civilian, Botanist, Romantic, Desperate, Crafty","female, organic, tos, leila_kalomi, crew_max_rarity_5","You Can Belong Again",1, 7, 6, 8, 12, 4, 1, , , , 495, 170, 133, 325, false,"Leila",crew_portraits_cm_leila_kalomi_sm.png,leila_kalomi_crew
"EV Suit McCoy",6,4, 364,45,111,614,49,130,0,0,0,0,0,0,0,0,0,815,137,301,465,941,910,1007,148,724,503,747,82,0,0,414,0,267,452,689,953,920,1010,226,962,653,959,189,0,0,437,0,273,457,856,1000,"Human, Federation, Starfleet, Desperate, Exobiology, Resourceful, Physician","evsuit, male, organic, tos, mccoy, crew_max_rarity_4","He Was A Hero",1, 8, 8, 8, 10, , , , , , 440, 160, 204, 500, false,"McCoy",crew_portraits_cm_mccoy_evsuit_sm.png,mccoy_evsuit_crew
"Fair Haven Harry Kim",7,4, 0,0,0,696,101,222,0,0,0,0,0,0,881,180,354,0,0,0,615,0,0,600,0,599,430,99,361,0,602,0,431,0,375,709,0,0,545,0,693,456,132,420,0,552,0,360,0,342,933,931,"Federation, Human, Starfleet, Costumed, Romantic, Musician","male, organic, voy, kim, crew_max_rarity_4","Late For A Midnight Stroll",2, 7, 6, 8, 10, 3, 0, 2, , , 450, 315, 121, 515, false,"Kim",crew_portraits_cm_kim_fairhaven_sm.png,kim_fairhaven_crew
"Zarabeth",7,4, 0,0,0,0,0,0,0,0,0,0,0,0,869,123,258,612,126,342,0,0,0,651,489,0,0,575,364,0,666,478,512,333,63,0,0,0,723,388,0,0,665,300,0,752,387,593,237,106,972,935,"Sarpeidon, Survivalist, Desperate, Resourceful, Romantic, Crafty, Civilian, Caregiver, Displaced","organic, female, nonhuman, tos, zarabeth, crew_max_rarity_4","You're Safe Here",1, 7, 6, 6, 6, , , , , , 375, 175, 83, 440, false,"Zarabeth",crew_portraits_cm_zarabeth_sm.png,zarabeth_crew
"Facer Rios",8,5, 526,78,141,0,0,0,0,0,0,962,130,280,1259,236,440,0,0,0,817,827,83,120,694,0,339,212,0,404,321,0,16,223,146,902,882,214,204,772,0,380,257,0,508,363,0,30,306,197,249,410,"Human, Civilian, Undercover Operative, Scoundrel, Crafty","male, organic, pic, rios, crew_max_rarity_5","Indulge Me",1, 10, 6, 8, 10, , , , , , 440, 200, 170, 450, false,"Rios",crew_portraits_cm_rios_facer_sm.png,rios_facer_crew
"Kelis",8,5, 1283,243,418,0,0,0,0,0,0,0,0,0,1012,116,244,475,90,188,159,321,123,32,11,0,0,447,517,0,554,682,368,469,87,233,365,173,132,40,0,0,692,472,0,776,662,623,447,229,211,403,"Communicator, Civilian, Resourceful, Writer, Desperate, Maverick","male, nonhuman, organic, voy, kelis, crew_max_rarity_5","You're Not Doing So Well",1, 8, 8, 8, 8, , , , , , 415, 150, 120, 475, true,"Kelis",crew_portraits_cm_kelis_sm.png,kelis_crew
"A.G. Robinson",9,5, 486,46,143,792,212,493,0,0,0,1299,121,295,0,0,0,0,0,0,131,868,49,919,753,460,35,516,275,219,0,0,232,96,0,81,923,241,978,819,191,27,226,141,498,0,0,554,298,0,436,402,"Human, Starfleet, Pilot, Explorer, Inspiring","evsuit, male, organic, ent, robinson_ag, crew_max_rarity_5","You Tried Too Hard",1, 10, 6, 6, 12, 7, 0, , , , 225, 185, 235, 750, true,"A.G.",crew_portraits_cm_robinson_ag_sm.png,robinson_ag_crew
"Cyrano de Barclay",7,4, 845,99,221,0,0,0,0,0,0,371,72,145,582,107,218,0,0,0,566,629,203,299,431,0,646,715,0,824,813,0,346,533,572,714,747,314,425,605,0,603,749,0,790,814,0,354,510,596,824,927,"Starfleet, Costumed, Communicator, Human, Innovator, Federation","male, organic, tng, barclay, crew_max_rarity_4","The Moon...Yes, That Will Be My Home",1, 8, 5, 6, 10, , , , , , 400, 200, 130, 460, false,"Barclay",crew_portraits_cm_cyrano_barclay_sm.png,barclay_cyrano_crew
"Maquis Takeover Seska",7,5, 1300,173,343,0,0,0,523,126,220,967,158,267,0,0,0,0,0,0,202,123,11,384,105,728,324,0,0,77,842,590,419,210,0,415,222,45,554,302,638,365,0,0,143,784,545,536,289,0,218,424,"Bajoran, Cardassian, Maquis, Hologram, Obsidian Order, Crafty, Villain, Undercover Operative","nonhuman, female, organic, voy, seska, crew_max_rarity_5","Authorization Zeta 1",0, 8, 10, 8, 10, 1, 1, , , , 400, 105, 177, 500, false,"Seska",crew_portraits_cm_seska_maquis_sm.png,seska_maquis_crew
"Flustered Jett Reno",7,4, 0,0,0,865,160,319,0,0,0,320,57,181,0,0,0,588,116,284,497,0,917,0,540,496,201,545,60,855,0,514,963,165,550,478,0,821,0,488,461,148,511,82,756,0,486,840,103,519,727,651,"Starfleet, Federation, Human, Jury Rigger, Resourceful, Desperate, Veteran","female, organic, dsc, jett_reno, crew_max_rarity_4","I'm Going, I'm Going",1, 6, 10, 10, 15, 2, 0, , , , 400, 185, 155, 475, false,"Reno",crew_portraits_cm_reno_flustered_sm.png,dsc_jett_reno_flustered_crew
"Maquis Takeover Paris",6,4, 381,65,150,0,0,0,554,80,185,836,122,244,0,0,0,0,0,0,921,521,192,960,791,739,402,0,0,116,849,596,561,281,0,910,544,273,941,779,790,418,0,0,240,898,669,624,340,0,852,937,"Human, Starfleet, Federation, Maquis, Undercover Operative, Costumed","organic, male, voy, paris, crew_max_rarity_4","Remember The Good Old Days",2, 6, 10, 8, 12, 1, 1, , , , 525, 175, 170, 515, false,"Paris",crew_portraits_cm_paris_maquis_sm.png,paris_maquis_crew
"Carlos Data",4,5, 0,0,0,1247,286,455,0,0,0,552,75,151,0,0,0,948,164,420,150,0,730,0,240,149,50,206,7,698,0,234,748,19,301,169,0,843,0,245,169,57,202,12,776,0,243,864,38,293,79,175,"Android, Starfleet, Federation, Investigator, Costumed","nonhuman, male, tng, artificial_life, data, crew_max_rarity_5","Hiya, Doc. What's Cookin'?",2, 10, 4, 6, 10, , , 2, , , 340, 200, 200, 375, false,"Data",crew_portraits_cm_data_carlos_sm.png,data_carlos_crew
"Booker and Grudge",9,5, 1309,147,332,0,0,0,520,82,180,998,96,194,0,0,0,0,0,0,207,132,16,394,114,780,348,0,0,97,872,635,457,231,0,471,301,112,599,370,800,512,0,0,326,905,678,760,441,0,336,748,"Empath, Pilot, Smuggler, Courier, Resourceful, Kwejian","male, nonhuman, organic, dsc, booker, crew_max_rarity_5","She's A Queen",1, 7, 14, 4, 14, 1, 2, , , , 650, 100, 175, 485, false,"Booker",crew_portraits_cm_booker_grudge_sm.png,dsc_booker_grudge_crew
"General Oh",6,5, 1161,293,514,0,0,0,1021,73,262,0,0,0,523,69,145,0,0,0,198,57,158,139,103,386,0,821,0,349,206,278,787,0,673,124,90,90,129,82,655,0,909,0,597,524,562,876,0,761,250,326,"Vulcan, Romulan, Zhat Vash, Tal Shiar, Brutal, Villain","female, nonhuman, organic, pic, oh, crew_max_rarity_5","Our Great Work Is Nearly At An End",0, 10, 8, 6, 12, 1, 0, 2, 1, 2, 590, 400, 90, 250, false,"Oh",crew_portraits_cm_oh_general_sm.png,oh_general_crew
"Linus",8,4, 314,48,120,873,129,327,0,0,0,0,0,0,649,69,145,0,0,0,234,968,951,596,880,500,366,130,295,0,800,0,663,0,558,284,943,909,722,843,497,336,264,313,0,993,0,879,0,763,785,943,"Saurian, Resourceful, Federation, Starfleet, Communicator","male, nonhuman, organic, dsc, linus, crew_max_rarity_4","Apologies!",2, 8, 10, 8, 10, , , , , , 450, 150, 165, 490, false,"Linus",crew_portraits_cm_linus_sm.png,dsc_linus_crew
"Lt. Booker",6,3, 0,0,0,0,0,0,325,62,132,235,29,94,535,64,153,0,0,0,0,951,980,853,0,990,714,795,0,640,662,809,587,592,645,0,910,961,942,0,936,710,900,0,632,710,779,662,585,758,1098,1126,"Federation, Starfleet, Undercover Operative, Courier, Smuggler, Empath, Kwejian","male, nonhuman, organic, dsc, booker, crew_max_rarity_3","I've Never Been to Earth",0, 6, 8, 6, 8, , , , , , 440, 200, 133, 409, false,"Booker",crew_portraits_cm_booker_lt_sm.png,dsc_booker_lt_crew
"Sahil",9,5, 1303,144,328,519,49,119,0,0,0,0,0,0,1039,88,179,0,0,0,63,373,172,55,124,854,580,152,524,0,573,0,389,0,346,261,557,403,322,376,980,668,594,602,0,906,0,781,0,680,340,889,"Human, Starfleet, Federation, Communicator, Ambassador, Desperate","male, organic, dsc, sahil, crew_max_rarity_5","It Would Be My Honor to Assist You",1, 10, 6, 6, 8, , , , , , 400, 140, 150, 450, false,"Sahil",crew_portraits_cm_sahil_sm.png,dsc_sahil_crew
"Courier Burnham",6,5, 1034,141,282,468,95,200,1274,222,438,0,0,0,0,0,0,0,0,0,99,17,303,529,244,35,571,859,515,144,302,82,0,0,0,190,104,482,673,451,61,500,801,459,197,362,163,0,0,0,119,299,"Federation, Starfleet, Courier, Resourceful, Astrophysicist, Xenoanthropology, Human, Displaced","female, organic, dsc, burnham, crew_max_rarity_5","I Found You",1, 7, 6, 6, 6, , , , , , 400, 200, 75, 515, true,"Burnham",crew_portraits_cm_burnham_homecoming_sm.png,dsc_burnham_homecoming_crew
"Laneth",7,4, 0,0,0,0,0,0,878,114,243,656,89,194,0,0,0,0,0,0,0,597,606,0,0,520,456,0,0,80,665,389,648,360,0,0,687,743,0,0,619,518,0,0,228,769,530,768,449,0,995,1080,"Klingon, Saboteur, Villain, Human, Engineered, Veteran","nonhuman, female, organic, ent, laneth, crew_max_rarity_4","We'll Die Together",1, 7, 8, 6, 10, 1, 2, , , , 480, 160, 218, 475, false,"Laneth",crew_portraits_cm_laneth_sm.png,laneth_crew
"Mirror Saru",6,5, 0,0,0,491,105,191,0,0,0,0,0,0,1279,249,492,922,186,398,804,0,0,321,267,809,547,51,67,0,277,266,105,171,5,756,0,0,324,243,748,496,65,80,0,285,241,137,143,12,81,140,"Kelpien, Mirror Universe, Caregiver, Prisoner, Desperate","male, nonhuman, organic, dsc, saru, crew_max_rarity_5","A Slave Has No Name",1, 10, 8, 8, 8, , , , , , 450, 200, 215, 490, false,"Saru",crew_portraits_cm_saru_mirror_sm.png,dsc_saru_mirror_crew
"The Colony Tilly",9,4, 0,0,0,359,34,104,0,0,0,771,135,331,547,137,281,0,0,0,985,0,505,785,0,984,232,468,603,505,804,0,87,293,564,1011,0,426,680,0,1009,239,402,620,442,702,0,72,242,489,862,782,"Human, Explorer, Federation, Starfleet, Undercover Operative, Displaced","female, organic, dsc, tilly, crew_max_rarity_4","My Name Lacks Authority",1, 8, 10, 6, 8, , , , , , 415, 200, 145, 475, false,"Tilly",crew_portraits_cm_tilly_colony_sm.png,dsc_tilly_colony_crew
"EV Suit Worf",6,5, 0,0,0,0,0,0,1273,190,415,1062,111,209,0,0,0,589,29,61,0,324,327,0,685,167,283,0,485,12,333,18,364,24,669,0,416,671,0,911,277,465,0,644,69,435,146,700,302,891,168,763,"Klingon, Tactician, Federation, Starfleet, Marksman","evsuit, nonhuman, male, organic, tng, worf, crew_max_rarity_5","Assimilate This!",2, 10, 8, 8, 10, , , , , , 465, 100, 155, 425, false,"Worf",crew_portraits_cm_worf_evsuit_sm.png,worf_evsuit_crew
"Mirror McCoy",2,4, 0,0,0,0,0,0,562,149,308,313,100,199,0,0,0,755,226,533,0,690,890,0,363,626,662,0,279,299,777,35,945,61,391,0,564,712,0,107,474,498,0,115,146,618,11,741,12,150,679,191,"Terran Empire, Brutal, Human, Physician, Mirror Universe, Starfleet, Exobiology","male, organic, tos, mccoy, crew_max_rarity_4","This Won't Take Long",0, 9, 10, 8, 8, , , , , , 415, 200, 211, 400, false,"McCoy",crew_portraits_cm_mccoy_mirror_sm.png,mccoy_mirror_crew
"EDF Adira",7,5, 979,205,442,0,0,0,0,0,0,476,133,252,1231,214,407,0,0,0,315,441,54,24,209,0,530,270,0,697,375,0,40,434,196,249,380,27,37,167,0,401,319,0,542,433,0,40,325,247,93,127,"Human, Trill, Spiritual, Saboteur, Prodigy","organic, dsc, adira, crew_max_rarity_5","Practically A Museum...",2, 10, 10, 10, 8, , , , , , 400, 125, 70, 400, false,"Adira",crew_portraits_cm_adira_edf_sm.png,dsc_adira_tal_crew
"Mr. Vup",8,4, 627,123,257,0,0,0,905,85,166,0,0,0,351,77,130,0,0,0,644,210,578,511,516,539,0,961,0,477,403,409,937,0,819,613,390,543,489,505,823,0,915,0,716,626,691,887,0,771,741,936,"Beta Annari, Interrogator, Civilian, Brutal, Smuggler, Gambler, Empath","pic, nonhuman, organic, vup, male, crew_max_rarity_4","I Can Smell A Lie",2, 9, 8, 8, 10, , , 2, , , 500, 125, 155, 400, false,"Vup",crew_portraits_cm_vup_sm.png,vup_crew
"Courier Zareh",6,4, 591,151,416,0,0,0,621,244,573,0,0,0,238,35,71,0,0,0,612,193,548,597,476,542,0,1032,0,479,468,413,1016,0,887,355,31,281,382,256,109,0,1029,0,112,147,85,1009,0,878,845,198,"Human, Smuggler, Scoundrel, Brutal, Marksman, Courier, Crafty","male, organic, dsc, zareh, crew_max_rarity_4","All That Matters Now Is Dilithium",0, 9, 8, 6, 6, , , , 1, 3, 450, 240, 138, 500, false,"Zareh",crew_portraits_cm_zareh_sm.png,dsc_zareh_crew
"Socrates",5,5, 982,139,317,542,78,184,0,0,0,0,0,0,1270,284,491,0,0,0,94,499,339,17,284,760,527,46,463,0,274,0,101,0,110,189,578,425,52,402,813,538,64,487,0,255,0,113,0,139,60,208,"Cultural Figure, Hologram, Human, Civilian, Innovator","male, organic, voy, socrates, crew_max_rarity_5","I know one thing, and that is that I know nothing",1, 10, 6, 6, 10, , , , , , 400, 140, 60, 440, false,"Socrates",crew_portraits_cm_socrates_sm.png,socrates_crew
"Klingon K'Ehleyr",6,5, 916,192,396,0,0,0,1151,285,589,0,0,0,465,128,225,0,0,0,402,30,346,235,289,161,0,804,0,160,84,98,771,0,657,330,21,250,177,229,89,0,706,0,90,43,68,638,0,561,163,60,"Klingon, Human, Romantic, Ambassador, Communicator, Federation, Undercover Operative","nonhuman, female, organic, kehleyr, tng, crew_max_rarity_5","No, Nothing Else",0, 9, 8, 6, 10, , , , , , 500, 200, 218, 400, false,"K'Ehleyr",crew_portraits_cm_kehleyr_klingon_sm.png,kehleyr_klingon_crew
"Geskana Tucker",4,4, 349,67,161,0,0,0,647,74,160,0,0,0,896,148,289,0,0,0,949,467,884,355,821,653,0,531,0,592,179,526,465,0,397,883,561,829,394,757,862,0,586,0,744,360,718,505,0,459,697,892,"Human, Starfleet, Athlete, Survivalist, Resourceful","male, organic, ent, tucker, crew_max_rarity_4","I'll Give It A Shot",0, 9, 8, 8, 8, , , , , , 465, 155, 165, 425, false,"Trip",crew_portraits_cm_trip_geskana_sm.png,tucker_geskana_crew
"Luau Paris",6,5, 959,183,357,0,0,0,501,108,204,0,0,0,1266,243,467,0,0,0,369,201,321,22,261,772,0,190,0,687,73,628,117,0,122,382,227,302,45,278,699,0,220,0,631,108,601,158,0,169,80,162,"Casual, Human, Federation, Starfleet, Diplomat, Maverick","male, organic, voy, paris, crew_max_rarity_5","An American Classic!",2, 7, 10, 6, 12, 7, 0, , , , 500, 250, 140, 415, false,"Paris",crew_portraits_cm_paris_luau_sm.png,paris_luau_crew
"Kevin Uxbridge",8,5, 0,0,0,1316,75,175,683,8,18,0,0,0,1058,68,142,0,0,0,253,767,0,574,0,42,225,40,166,645,184,586,400,0,353,838,1008,0,951,0,783,562,539,500,914,953,870,883,0,768,325,1144,"Douwd, Telepath, Civilian, Botanist, Shapeshifter, Romantic","male, organic, tng, nonhuman, uxbridge, crew_max_rarity_5","You don't understand the scope of my crime",0, 9, 6, 8, 8, , , , , , 435, 170, 225, 300, false,"Uxbridge",crew_portraits_cm_uxbridge_kevin_sm.png,uxbridge_kevin_crew
"Gray",8,4, 528,213,412,0,0,0,0,0,0,0,0,0,777,196,398,0,0,0,632,674,564,203,498,0,0,571,0,0,660,0,507,0,428,277,403,204,54,187,0,0,351,0,0,476,0,277,0,277,976,518,"Trill, Starfleet, Federation, Romantic, Musician, Prodigy","male, nonhuman, organic, dsc, gray, crew_max_rarity_4","I Am Perfect",2, 8, 8, 5, 8, , , , , , 375, 200, 158, 450, false,"Gray",crew_portraits_cm_gray_sm.png,dsc_gray_crew
"Polaric Janeway",6,5, 0,0,0,1219,214,485,501,100,255,0,0,0,1092,92,189,0,0,0,182,785,0,523,0,31,190,13,124,661,163,601,325,0,295,209,689,0,850,0,36,155,86,143,564,408,533,762,0,663,88,363,"Starfleet, Federation, Human, Resourceful, Gambler, Undercover Operative, Displaced","female, organic, voy, janeway, crew_max_rarity_5","It's Become Our Problem Now",1, 7, 6, 8, 12, 4, 1, , , , 545, 50, 100, 365, false,"Janeway",crew_portraits_cm_janeway_polaric_sm.png,janeway_polaric_crew
