"Emperor Philippa Georgiou",8,5, 1216,131,385,0,0,0,1019,128,264,0,0,0,371,155,317,0,0,0,237,64,188,163,143,331,0,842,0,296,199,226,806,0,699,395,178,313,147,289,546,0,508,0,491,185,467,418,0,389,326,290,"Terran Empire, Mirror Universe, Human, Brutal, Royalty","female, organic, dsc, georgiou, crew_max_rarity_5","Imperial Majesty",2, 7, 10, 15, 15, 8, 4, , , , 450, 335, 152, 100, false,"Georgiou",crew_portraits_cm_georgiou_empress_sm.png,dsc_georgiou_mirror_crew
"Festive Lwaxana Troi",9,4, 636,83,174,0,0,0,0,0,0,0,0,0,727,182,389,0,0,0,663,703,603,274,553,0,0,596,0,0,684,0,531,0,456,792,800,748,236,683,0,0,372,0,0,493,0,300,0,298,991,922,"Federation, Diplomat, Betazoid, Romantic, Civilian, Telepath, Ambassador","nonhuman, female, organic, ds9, lwaxana, crew_max_rarity_4","Dance With Me",1, 6, 8, 10, 16, 6, 0, , , , 400, 160, 115, 650, false,"Troi",crew_portraits_cm_troi_festivelwaxana_sm.png,troi_lwaxana_festive_crew
"Merry Men Crusher",9,5, 0,0,0,419,69,186,1160,195,257,0,0,0,0,0,0,1122,53,158,856,391,0,0,239,58,591,882,75,237,425,9,0,147,307,806,550,0,0,762,179,539,830,298,421,604,161,0,490,748,427,837,"Human, Starfleet, Federation, Physician, Costumed, Resourceful","female, organic, tng, commander, crusher, crew_max_rarity_5","I've Stopped The Bleed",1, 7, 8, 8, 12, 6, 0, , , , 525, 200, 140, 375, false,"Crusher",crew_portraits_cm_crusher_merrymen_sm.png,crusher_merrymen_crew
"Ahdar Ru'afo",6,5, 757,187,447,506,109,219,0,0,0,1362,69,227,0,0,0,0,0,0,120,581,19,629,372,751,56,763,453,206,0,0,221,87,0,62,374,46,421,166,670,207,733,408,656,0,0,729,419,0,407,456,"Son'a, Brutal, Villain, Survivalist, Resourceful","male, nonhuman, organic, tng, ruafo, crew_max_rarity_5","Not Joining Us For Dinner",0, 6, 10, 5, 14, 7, 0, , , , 585, 125, 160, 450, false,"Ru'afo",crew_portraits_cm_ruafo_sm.png,ruafo_crew
"Irumodic Syndrome Picard",5,4, 310,144,287,886,74,219,0,0,0,0,0,0,684,100,211,0,0,0,189,855,796,459,740,530,379,125,318,0,736,0,596,0,504,176,588,445,306,422,737,486,335,446,0,812,0,694,0,602,631,719,"Human, Civilian, Veteran, Cultural Figure, Federation, Gardener, Displaced","male, tng, picard, organic, crew_max_rarity_4","Not an Invalid",2, 8, 12, 4, 12, , , , , , 230, 125, 145, 450, false,"Picard",crew_portraits_cm_picard_irumodic_sm.png,picard_irumodic_crew
"Diseased Changeling Founder",6,4, 751,148,310,0,0,0,0,0,0,0,0,0,458,239,483,248,88,214,556,617,491,269,177,0,0,662,599,0,748,803,615,550,319,489,554,402,59,100,0,0,212,436,0,297,621,143,409,59,820,208,"Changeling, Dominion, Desperate, Brutal","nonhuman, female, organic, ds9, femalechangeling, crew_max_rarity_4","I Wish You Hadn't Done That",0, 8, 6, 8, 12, , , , , , 300, 255, 140, 600, false,"Founder",crew_portraits_cm_changeling_diseased_sm.png,femalechangeling_diseased_crew
"Alternate Future Jadzia Dax",8,5, 0,0,0,1291,125,313,0,0,0,1002,118,267,419,83,187,0,0,0,223,0,358,893,0,230,28,96,146,358,931,0,83,187,732,520,0,532,831,0,510,108,225,322,523,874,0,205,315,659,396,669,"Federation, Starfleet, Exobiology, Astrophysicist, Trill, Pilot","nonhuman, female, organic, ds9, lieutenant_commander, bridge_crew, dax, crew_max_rarity_5","We're Losing Him!",1, 10, 8, 12, 10, , , , , , 200, 225, 155, 100, false,"J. Dax",crew_portraits_cm_jadzia_alternate_future_sm.png,dax_jadzia_future_crew
"Tourist Jadzia Dax",1,3, 526,86,206,210,29,101,0,0,0,0,0,0,346,55,154,0,0,0,567,766,692,599,626,1013,698,714,621,0,986,0,913,0,801,538,759,683,559,627,990,681,717,611,0,973,0,856,0,749,1057,1054,"Federation, Starfleet, Trill, Casual, Romantic","nonhuman, female, organic, ds9, lieutenant, bridge_crew, dax, crew_max_rarity_3","Take It Easy",1, 6, 8, 4, 10, 1, 1, , , , 350, 220, 160, 190, false,"J. Dax",crew_portraits_cm_jadzia_tourist_sm.png,dax_jadzia_tourist_crew
"Amelia Earhart",3,5, 949,124,313,0,0,0,0,0,0,1327,145,467,351,108,511,0,0,0,427,519,6,244,319,0,152,766,0,154,850,0,33,40,620,510,581,23,111,412,0,221,315,0,258,428,0,11,121,245,169,117,"Human, Pilot, Explorer, Cultural Figure, Inspiring, Undercover Operative, Prisoner, Displaced","female, organic, voy, earhart, crew_max_rarity_5","Take Her Out For a Spin",1, 8, 8, 8, 16, , , , , , 400, 100, 120, 1392, false,"Earhart",crew_portraits_cm_earhart_sm.png,amelia_earhart_crew
"Admiral Ross",8,4, 612,103,258,0,0,0,205,117,252,0,0,0,855,107,222,0,0,0,642,504,579,242,523,982,0,585,0,845,419,804,516,0,441,625,295,550,355,511,573,0,728,0,519,317,494,658,0,582,797,679,"Federation, Starfleet, Human, Communicator, Diplomat, Cultural Figure","male, organic, ds9, admiral, ross, crew_max_rarity_4","You're Dismissed",0, 7, 6, 5, 8, , , , , , 580, 250, 130, 240, true,"Ross",crew_portraits_cm_ross_admiral_sm.png,ross_admiral_crew
"Polywater Yar",8,5, 1134,155,377,0,0,0,381,109,217,0,0,0,955,183,367,0,0,0,262,167,212,74,169,866,0,394,0,747,222,702,317,0,289,376,215,297,96,277,648,0,402,0,588,180,558,328,0,317,423,267,"Human, Federation, Starfleet, Romantic, Desperate, Survivalist","female, organic, tng, bridge_crew, yar, crew_max_rarity_5","You Are Fully Functional, Aren't You?",0, 9, 2, 8, 12, 1, 0, , 1, 2, 335, 100, 70, 550, true,"Yar",crew_portraits_cm_yar_intoxicated_sm.png,yar_intoxicated_crew
"Gary Seven",2,5, 361,187,380,1275,217,685,737,333,712,0,0,0,0,0,0,0,0,0,41,180,720,839,662,1,122,163,82,271,469,205,0,0,0,6,8,261,498,246,1,78,113,72,29,84,21,0,0,0,18,4,"Human, Hero, Resourceful, Undercover Operative","organic, male, tos, gary_seven, crew_max_rarity_5","Interesting Experiences",1, 7, 15, 8, 10, 0, 1, , , , 375, 200, 200, 300, false,"Mr. Seven",crew_portraits_cm_gary_seven_sm.png,gary_seven_crew
"Reverend Phlox",7,5, 984,145,314,0,0,0,0,0,0,0,0,0,598,53,111,1058,236,615,359,474,309,196,6,0,0,740,156,0,830,158,699,97,42,488,552,400,437,4,0,0,948,85,0,1010,78,916,28,62,262,219,"Denobulan, Civilian, Physician, Exobiology","male, organic, ent, phlox, crew_max_rarity_5","Rest In Peace",1, 10, 6, 10, 12, , , , , , 200, 205, 170, 100, false,"Phlox",crew_portraits_cm_phlox_reverend_sm.png,phlox_reverend_crew
"Yelgrun",8,4, 572,101,216,405,85,247,0,0,0,0,0,0,638,203,466,0,0,0,294,728,637,299,579,859,585,276,530,0,705,0,554,0,471,239,724,631,152,586,661,433,75,405,0,363,0,181,0,198,746,376,"Dominion, Vorta, Clone, Diplomat, Musician","male, ds9, yelgrun, nonhuman, crew_max_rarity_4","I Was Cloned",1, 5, 3, 6, 6, , , , , , 400, 265, 98, 275, true,"Yelgrun",crew_portraits_cm_yelgrun_sm.png,yelgrun_crew
"Alternate Future T'Pol",8,5, 1119,260,585,943,153,343,0,0,0,0,0,0,485,92,188,0,0,0,24,357,155,141,114,401,295,145,245,0,882,0,773,0,664,8,225,64,76,59,426,298,175,273,0,859,0,742,0,650,293,132,"Vulcan, Starfleet, Astrophysicist, Telepath","nonhuman, female, organic, ent, first_officer, bridge_crew, tpol, crew_max_rarity_5","You'll Never Fully Recover",1, 7, 10, 6, 12, 6, 0, , , , 600, 105, 120, 175, false,"T'Pol",crew_portraits_cm_tpol_alternate_future_sm.png,tpol_alternate_future_crew
"Ikat'ika",8,4, 656,53,124,0,0,0,758,199,388,0,0,0,0,0,0,0,0,0,681,233,616,773,565,506,0,0,0,444,653,381,0,0,0,938,268,863,960,803,289,0,0,0,254,453,217,0,0,0,979,966,"Jem'hadar, Dominion, Brutal, Veteran","nonhuman, male, organic, ds9, ikatika, crew_max_rarity_4","Victory is Life!",2, 9, 5, 8, 12, 5, 0, , , , 495, 105, 175, 575, false,"Ikat'ika",crew_portraits_cm_ikatika_sm.png,ikatika_crew
"Changeling Martok",6,5, 506,78,158,0,0,0,877,218,453,0,0,0,1062,249,546,0,0,0,806,203,740,159,684,335,0,309,0,300,36,231,238,0,233,839,176,786,124,715,201,0,155,0,182,7,152,97,0,124,314,84,"Klingon, Changeling, Veteran, Undercover Operative, Brutal, Dominion","nonhuman, male, organic, ds9, martok, crew_max_rarity_5","Sohk-vad",0, 9, 6, 6, 12, 7, 2, , , , 650, 15, 220, 250, false,"Martok",crew_portraits_cm_martok_changeling_sm.png,martok_changeling_crew
"Fleet Commander Martok",5,2, 296,64,200,0,0,0,270,38,135,0,0,0,148,29,71,0,0,0,960,681,890,858,828,989,0,1019,0,851,928,809,1001,0,875,778,578,732,715,670,936,0,999,0,804,866,769,979,0,855,1136,1089,"Klingon, Duelist, Veteran","nonhuman, male, organic, ds9, martok, crew_max_rarity_2","Surprise Attack!",0, 3, 8, 8, 12, 0, 2, , , , 340, 140, 70, 125, false,"Martok",crew_portraits_cm_martok_fleet_commander_sm.png,martok_commander_crew
"Mirror Keiko",7,4, 670,212,435,567,92,234,0,0,0,0,0,0,385,76,146,0,0,0,126,613,484,414,419,689,475,408,416,0,952,0,863,0,758,59,362,168,212,157,673,442,408,411,0,946,0,837,0,725,801,532,"Human, Botanist, Saboteur, Undercover Operative, Mirror Universe, Terran Rebellion","female, organic, ds9, mirror, keiko, original, crew_max_rarity_4","Terrible Beauty",2, 7, 10, 10, 10, 4, 2, , , , 450, 230, 275, 125, false,"Keiko",crew_portraits_cm_keiko_mirror_sm.png,keiko_mirror_crew
"Professor Sato",5,5, 950,93,201,431,101,209,0,0,0,0,0,0,1517,61,123,0,0,0,129,562,429,49,359,851,575,69,521,0,275,0,105,0,113,293,756,680,583,625,704,460,482,427,0,993,0,889,0,783,324,959,"Human, Civilian, Starfleet, Prodigy, Communicator, Linguist","female, organic, ensign, bridge_crew, ent, sato, crew_max_rarity_5","Turn It Up",2, 10, 8, 8, 10, , , 2, , , 415, 300, 45, 280, false,"Sato",crew_portraits_cm_sato_professor_sm.png,sato_professor_crew
"EV Suit Burnham",7,5, 1324,89,299,369,115,391,877,169,472,0,0,0,0,0,0,0,0,0,61,57,168,396,129,75,551,835,499,322,527,255,0,0,0,79,116,505,688,477,26,294,468,265,208,379,173,0,0,0,297,166,"Federation, Starfleet, Astrophysicist, Human, Xenoanthropology, Resourceful, Duelist","female, evsuit, organic, dsc, bridge_crew, first_officer, commander, burnham, crew_max_rarity_5","Vulcan Hello",2, 7, 10, 10, 14, 6, 0, , , , 575, , 295, 100, false,"Burnham",crew_portraits_cm_burnham_evsuit_sm.png,dsc_burnham_ev_suit_crew
"Army Chaplain Odo",6,4, 342,69,173,0,0,0,628,77,162,0,0,0,764,172,363,0,0,0,915,459,847,403,788,653,0,580,0,583,220,529,511,0,437,820,521,769,283,700,820,0,424,0,707,247,685,346,0,335,753,736,"Changeling, Spiritual, Bajoran, Communicator, Constable, Undercover Operative","nonhuman, organic, ds9, odo, original, crew_max_rarity_4","Mysterious Ways",1, 6, 8, 8, 8, 3, 0, 3, , , 625, 105, 10, 440, false,"Odo",crew_portraits_cm_odo_chaplain_sm.png,odo_chaplain_crew
"Dr. Leonard McCoy",9,4, 0,0,0,562,96,254,0,0,0,0,0,0,0,0,0,746,141,392,696,0,0,0,405,682,470,711,78,0,0,413,0,269,463,650,0,0,0,283,627,416,700,77,0,0,301,0,178,343,1004,883,"Human, Federation, Starfleet, Physician, Resourceful","male, organic, tos, lieutenant_commander, mccoy, crew_max_rarity_4","He's Dead, Jim",0, 4, 8, 10, 14, 4, 0, , , , 440, 60, 130, 1355, false,"McCoy",crew_portraits_cm_mccoy_leonard_sm.png,mccoy_leonard_crew
"Ensign Picard",8,4, 849,81,201,0,0,0,503,136,328,0,0,0,287,115,231,0,0,0,549,261,482,434,417,670,0,923,0,598,535,544,902,0,790,748,280,702,433,644,448,0,709,0,399,216,364,632,0,560,812,639,"Federation, Starfleet, Human, Desperate, Crafty, Displaced","male, organic, tng, ensign, bridge_crew, picard, crew_max_rarity_4","Life Worth Living",1, 6, 12, 12, 12, 7, 0, , , , 580, 85, 20, 505, false,"Picard",crew_portraits_cm_ensign_picard_sm.png,picard_ensign_crew
"Elizabeth Dehner",10,5, 0,0,0,441,145,345,0,0,0,0,0,0,886,54,106,1152,158,446,736,0,0,665,152,733,504,173,45,0,703,168,551,104,30,449,0,0,974,209,439,306,286,31,0,1013,219,919,120,146,458,467,"Human, Starfleet, Federation, Physician, Telekinetic","female, organic, tos, dehner, crew_max_rarity_5","Almost a God",2, 6, 12, 12, 20, 2, 0, , , , 400, , 110, 350, false,"Dehner",crew_portraits_cm_elizabeth_dehner_sm.png,dehner_elizabeth_crew
"Astrosciences Sulu",9,5, 969,84,207,1014,271,623,0,0,0,0,0,0,423,72,136,0,0,0,32,555,422,314,350,254,216,99,162,0,934,0,852,0,738,17,761,684,563,628,91,79,43,75,0,975,0,857,0,750,463,297,"Human, Federation, Starfleet, Pilot, Resourceful, Astrophysicist","male, organic, tos, lieutenant, bridge_crew, sulu, crew_max_rarity_5","Astrosciences Standing By",0, 7, 12, 12, 12, 4, 0, , , , 490, 80, 100, 340, false,"Sulu",crew_portraits_cm_sulu_astrosciences_sm.png,sulu_astrosciences_crew
"Commanding Officer Sisko",1,3, 433,11,23,0,0,0,487,28,78,0,0,0,234,12,34,0,0,0,931,608,864,790,803,867,0,1007,0,748,749,703,991,0,867,1025,932,967,1042,900,1001,0,1019,0,856,1017,818,1005,0,875,1084,1213,"Human, Federation, Starfleet, Bajoran, Cultural Figure, Inspiring, Chef","male, organic, ds9, captain, bridge_crew, sisko, crew_max_rarity_3","Surprise for the Dominion",2, 5, 3, 8, 11, , , , , , 215, 85, 135, 100, false,"Sisko",crew_portraits_cm_sisko_sm.png,sisko_captain_crew
"Age of Sail Data",7,5, 1171,186,446,0,0,0,0,0,0,844,125,269,527,127,243,0,0,0,232,372,22,130,138,0,380,722,0,464,811,0,80,259,579,254,379,30,136,172,0,383,668,0,513,741,0,127,306,534,408,294,"Android, Federation, Starfleet, Cyberneticist, Costumed, Explorer, Musician","ageofsail, nonhuman, male, tng, lieutenant_commander, bridge_crew, artificial_life, data, crew_max_rarity_5","Fun? Got it!",1, 8, 8, 5, 11, 1, 1, , , , 125, 200, 70, 500, false,"Data",crew_portraits_cm_data_ageofsail_sm.png,data_ageofsail_crew
"Commander Donatra",3,4, 580,238,631,0,0,0,434,191,463,0,0,0,318,60,178,0,0,0,535,246,471,435,403,645,0,945,0,578,533,521,927,0,811,87,14,56,83,51,220,0,848,0,194,163,162,807,0,701,799,67,"Romulan, Veteran, Crafty, Tactician, Resourceful","nonhuman, female, organic, donatra, tng, commander, crew_max_rarity_4","Let's Get To Work",0, 5, 3, 6, 6, , , , , , 450, 200, 143, 450, true,"Donatra",crew_portraits_cm_donatra_commander_sm.png,donatra_commander_crew
"Maid Marian",9,5, 0,0,0,0,0,0,904,152,302,0,0,0,1193,172,338,0,0,0,0,529,0,425,0,432,0,311,0,384,49,324,240,0,235,0,548,0,551,0,469,0,454,0,416,128,381,374,0,353,560,793,"Human, Scoundrel, Costumed, Exoarchaeology, Smuggler, Civilian, Prisoner","female, organic, tng, vash, crew_max_rarity_5","Can't Change Who I Am",0, 7, 6, 8, 14, 7, 2, , , , 350, 305, 88, 705, false,"Vash",crew_portraits_cm_vash_qpid_sm.png,vash_qpid_crew
"Tyler, Son of None",8,5, 489,58,198,0,0,0,1129,218,428,0,0,0,1009,171,229,0,0,0,818,144,757,230,699,240,0,407,0,217,37,156,335,0,303,797,180,750,394,685,227,0,627,0,204,87,169,553,0,504,323,375,"Human, Klingon, Federation, Starfleet, Gambler, Desperate, Tactician, Survivalist","male, organic, dsc, bridge_crew, tyler, voq, crew_max_rarity_5","War Within",1, 7, 12, 10, 14, 8, 4, , , , 500, 25, 128, 690, false,"Tyler",crew_portraits_cm_voq_as_ash_sm.png,dsc_tyler_voq_crew
"The Prophet",8,5, 388,148,324,0,0,0,995,127,251,0,0,0,1230,146,294,0,0,0,811,226,748,160,691,370,0,310,0,332,42,265,239,0,234,469,218,381,182,365,564,0,568,0,508,214,483,485,0,443,346,390,"Vulcan, Mirror Universe, Desperate, Terran Rebellion, Telepath, Interrogator","nonhuman, male, organic, sarek, dsc, crew_max_rarity_5","My Mind to Your Mind",1, 5, 0, 8, 8, , , , , , 375, 255, 68, 675, true,"Sarek",crew_portraits_cm_sarek_mirror_sm.png,dsc_sarek_mirror_crew
"EV Suit Seven of Nine",8,5, 489,108,272,950,307,664,800,149,338,0,0,0,0,0,0,0,0,0,62,258,686,811,614,22,222,327,173,448,658,386,0,0,0,7,206,518,695,485,11,54,88,51,380,570,334,0,0,0,436,57,"Borg, Human, Starfleet, Federation, Hunter, Astrophysicist","evsuit, female, organic, voy, seven, crew_max_rarity_5","This Lesson Is Terminated",2, 10, 10, 10, 12, , , , 1, 1, 565, 200, 195, 100, false,"Seven",crew_portraits_cm_seven_of_nine_ev_sm.png,seven_ev_suit_crew
"Tucker On-The-Ropes",9,5, 363,84,170,0,0,0,962,134,270,1179,197,429,0,0,0,0,0,0,888,274,48,926,759,397,210,0,0,29,559,295,242,98,0,802,346,60,854,690,523,210,0,0,40,687,450,241,109,0,444,422,"Human, Starfleet, Jury Rigger, Athlete, Gambler, Desperate","male, organic, ent, commander, tucker, original, crew_max_rarity_5","Rope-a-Dope",0, 7, 12, 10, 14, 4, 0, , , , 650, 305, 110, 375, false,"Trip",crew_portraits_cm_tucker_ropes_sm.png,tucker_boxing_crew
"Pugilist Q",6,4, 362,96,190,0,0,0,788,139,291,0,0,0,547,97,202,0,0,0,875,363,807,535,746,534,0,730,0,469,244,409,687,0,586,745,307,697,475,641,504,0,770,0,446,282,420,715,0,622,792,729,"Desperate, Crafty, Scoundrel, Athlete, Duelist, Costumed, Q Continuum","nonhuman, male, ds9, q_jdl, crew_max_rarity_4","Wonderfully Barbaric",0, 6, 6, 8, 10, 0, 1, , , , 450, 125, 50, 305, false,"Q",crew_portraits_cm_pugilist_q_sm.png,q_boxing_crew
"Mugato",9,5, 823,189,405,0,0,0,1033,224,688,0,0,0,436,122,226,0,0,0,464,79,420,295,349,223,0,831,0,197,110,142,799,0,690,304,15,224,170,208,69,0,701,0,66,38,52,628,0,557,395,44,"Mugato, Brutal, Hunter, Primal","nonhuman, male, tos, mugato, crew_max_rarity_5","Private Little War",2, 7, 4, 5, 10, 7, 0, , , , 465, 325, 63, 500, true,"Mugato",crew_portraits_cm_mugato_sm.png,mugato_crew
"Gloria",7,5, 879,205,396,0,0,0,0,0,0,0,0,0,1065,278,536,470,99,221,412,512,366,66,33,0,0,302,489,0,402,653,225,438,47,291,412,214,19,42,0,0,142,416,0,225,588,86,380,38,367,75,"Communicator, Civilian, Counselor, Bartender, Empath, Costumed, El-Aurian","nonhuman, female, organic, tng, guinan, crew_max_rarity_5","Gloria From Cleveland",0, 7, 6, 12, 12, 0, 1, , , , 1540, 160, 110, 450, false,"Guinan",crew_portraits_cm_guinan_gloria_sm.png,guinan_gloria_crew
"Minuet",7,5, 911,162,353,0,0,0,0,0,0,0,0,0,952,292,766,0,0,0,429,521,380,69,321,0,0,301,0,0,401,0,222,0,228,399,493,317,10,294,0,0,54,0,0,92,0,32,0,48,552,154,"Hologram, Saboteur, Communicator, Resourceful, Human, Romantic, Desperate, Crafty","female, minuet, tng, crew_max_rarity_5","As Real As You Need",1, 9, 4, 8, 8, 3, 0, , , , 550, 225, 100, 390, true,"Minuet",crew_portraits_cm_minuet_sm.png,minuet_crew
"Lady Beverly",7,4, 350,91,152,0,0,0,0,0,0,0,0,0,787,168,267,595,90,167,904,880,838,416,286,0,0,598,420,0,688,564,535,385,94,823,814,771,365,325,0,0,577,480,0,656,672,493,450,184,807,831,"Human, Caregiver, Hologram, Romantic","female, organic, tng, commander, crusher, crew_max_rarity_4","Manners, Manners!",2, 8, 10, 6, 10, , , , , , 500, 200, 180, 425, false,"Crusher",crew_portraits_cm_lady_beverly_sm.png,crusher_lady_crew
"Tuxedo Nog",6,5, 966,153,284,0,0,0,0,0,0,481,65,198,1098,260,551,0,0,0,402,505,76,60,299,0,561,288,0,723,383,0,44,461,218,511,582,141,46,414,0,528,146,0,689,228,0,30,448,114,345,191,"Ferengi, Costumed, Federation, Starfleet, Inspiring, Hero, Desperate, Veteran","nonhuman, male, organic, ds9, nog, crew_max_rarity_5","Welcome To Las Vegas",1, 8, 8, 8, 10, 0, 1, , , , 540, 255, 210, 325, false,"Nog",crew_portraits_cm_nog_nines_sm.png,nog_tuxedo_crew
"Tarquin",8,4, 420,184,409,377,40,126,0,0,0,0,0,0,823,119,244,0,0,0,423,740,652,294,590,936,635,306,569,0,687,0,534,0,458,150,418,225,164,211,956,649,434,587,0,749,0,602,0,539,822,612,"Telepath, Desperate, Resourceful, Communicator","organic, ent, nonhuman, tarquin, crew_max_rarity_4","Exile",1, 7, 8, 10, 12, 5, 0, , , , 580, 250, 110, 540, false,"Tarquin",crew_portraits_cm_tarquins_species_sm.png,tarquin_crew
"Losira",10,2, 256,23,88,0,0,0,313,68,187,155,11,29,0,0,0,0,0,0,996,706,824,1017,864,942,712,0,0,706,992,763,1008,583,0,997,654,895,1019,866,792,711,0,0,640,886,666,1008,582,0,1148,1148,"Hologram, Kalandan, Brutal","nonhuman, female, tos, losira, crew_max_rarity_2","I Am For You",0, 2, 8, 10, 10, 4, 0, , , , 300, 200, 100, 375, false,"Losira",crew_portraits_cm_losira_sm.png,losira_crew
"Commander Barclay",7,4, 748,130,322,357,65,143,0,0,0,604,82,271,0,0,0,0,0,0,248,619,81,668,429,935,262,930,568,580,0,0,640,362,0,225,562,92,615,391,893,265,890,537,570,0,0,634,349,0,815,761,"Starfleet, Innovator, Communicator, Quantum Mechanics, Human, Federation","male, organic, voy, commander, barclay, crew_max_rarity_4","To The Journey",1, 6, 4, 8, 10, 2, 0, , , , 465, 200, 210, 375, true,"Barclay",crew_portraits_cm_barclay_commander_sm.png,barclay_commander_crew
"Data V",8,5, 0,0,0,976,142,307,0,0,0,1144,195,401,528,77,141,0,0,0,386,0,204,828,0,392,34,137,237,236,865,0,48,113,640,503,0,249,908,0,497,38,269,316,281,957,0,96,136,736,384,470,"Android, Federation, Starfleet, Cyberneticist, Musician, Costumed, Royalty","nonhuman, male, tng, lieutenant_commander, bridge_crew, artificial_life, data, crew_max_rarity_5","He Appears But A Man",1, 7, 6, 6, 6, , , , , , 590, 200, 60, 265, true,"Data",crew_portraits_cm_data_henry_sm.png,data_henry_crew
"Phlox, Au Naturel",7,5, 0,0,0,1173,186,510,0,0,0,454,83,279,0,0,0,884,160,398,218,0,742,0,329,225,60,293,23,703,0,322,792,26,368,204,0,568,0,253,196,37,237,15,557,0,270,618,21,314,366,141,"Denobulan, Civilian, Physician, Exobiology, Resourceful, Casual","male, organic, ent, phlox, crew_max_rarity_5","I'm A Physician, Not An Engineer!",1, 7, 12, 6, 12, 2, 0, 2, , , 515, 195, 140, 450, false,"Phlox",crew_portraits_cm_phlox_natural_sm.png,phlox_natural_crew
"Lt. Commander Jack Crusher",5,3, 486,91,207,335,24,78,0,0,0,0,0,0,0,0,0,0,0,0,528,802,730,847,670,983,677,969,601,0,0,0,0,0,0,570,751,674,797,617,1006,697,1000,621,0,0,0,0,0,0,1130,1156,"Starfleet, Federation, Hologram, Human, Romantic, Inspiring","lieutenant_commander, male, tng, jack, crew_max_rarity_3","Duty and Honor",0, 6, 8, 10, 16, , , , 1, 2, 550, 100, 125, 505, false,"Jack",crew_portraits_cm_jackcrusher_sm.png,jack_crusher_crew
"Wedding Day Quark",6,4, 584,104,246,0,0,0,278,83,181,0,0,0,661,228,469,0,0,0,671,514,608,282,558,971,0,599,0,834,418,790,536,0,459,643,396,571,118,526,771,0,232,0,677,132,653,159,0,181,821,374,"Ferengi, Klingon, Scoundrel, Desperate, Romantic, Gambler","nonhuman, male, organic, ds9, quark, crew_max_rarity_4","Quark, Slayer of Klingons!",0, 7, 12, 10, 14, 4, 2, , , , 150, 75, 70, 575, false,"Quark",crew_portraits_cm_quark_wedding_day_sm.png,quark_wedding_day_crew
"Fennim",8,5, 0,0,0,817,251,462,0,0,0,0,0,0,1125,225,461,406,100,369,431,0,0,417,669,419,313,37,69,0,404,649,227,434,46,193,0,0,359,376,185,142,8,21,0,340,378,169,226,35,370,50,"Communicator, Scoundrel, Prodigy, Innovator, Thief","nonhuman, male, organic, voy, fennim, crew_max_rarity_5","We Are Already Proceeding",1, 7, 8, 8, 12, 6, 0, , , , 400, 100, 120, 415, false,"Fennim",crew_portraits_cm_fennim_sm.png,fennim_crew
"Lucille Davenport",8,5, 991,98,213,448,121,258,0,0,0,0,0,0,1179,219,430,0,0,0,114,539,397,63,334,797,530,84,476,0,381,0,205,0,214,206,734,645,159,595,575,389,65,358,0,388,0,200,0,214,349,357,"Starfleet, Federation, Costumed, Resourceful, Romantic, Human","female, organic, voy, captain, bridge_crew, janeway, crew_max_rarity_5","Walking On Your Grave",1, 10, 8, 10, 10, , , , , , 575, 200, 110, 300, false,"Janeway",crew_portraits_cm_janeway_davenport_sm.png,janeway_davenport_crew
"Captain Silva La Forge",9,5, 1059,259,606,0,0,0,408,149,309,0,0,0,1026,68,156,0,0,0,231,133,182,72,137,777,0,489,0,684,218,640,416,0,363,91,44,59,88,54,462,0,866,0,409,334,375,835,0,723,358,160,"Human, Federation, Starfleet, Explorer, Tactician","female, organic, tng, silva, captain, bridge_crew, crew_max_rarity_5","There's No Time To Explain",0, 8, 10, 8, 14, 8, 4, , , , 335, 100, 128, 450, false,"Silva",crew_portraits_cm_silva_captain_sm.png,silva_captain_crew
"Michael Sullivan",9,4, 0,0,0,0,0,0,0,0,0,0,0,0,505,146,319,743,167,351,0,0,0,774,414,0,0,707,331,0,801,421,666,277,95,0,0,0,596,301,0,0,521,257,0,600,313,431,188,68,1003,788,"Bartender, Hologram, Human, Communicator, Civilian, Romantic","nonhuman, male, sullivan_michael, voy, crew_max_rarity_4","An Optimist Are You?",0, 6, 8, 8, 12, 7, 0, , , , 565, 220, 163, 390, false,"Sullivan",crew_portraits_cm_sullivan_michael_sm.png,sullivan_michael_crew
"Mother Horta",4,4, 0,0,0,0,0,0,697,271,557,0,0,0,561,159,310,0,0,0,0,551,0,731,0,456,0,669,0,411,163,343,623,0,532,0,228,0,594,0,101,0,516,0,105,31,77,427,0,397,937,378,"Caregiver, Primal, Silicon Lifeform, Saboteur, Desperate","nonhuman, organic, tos, horta, crew_max_rarity_4","NO KILL I",0, 7, 8, 5, 14, 1, 0, , , , 670, 200, 100, 300, false,"Horta",crew_portraits_cm_horta_sm.png,horta_crew
"Musketeer Picard",6,5, 485,74,148,0,0,0,1111,248,540,0,0,0,815,231,455,0,0,0,837,135,773,284,716,213,0,479,0,188,40,137,399,0,354,864,123,806,184,741,114,0,242,0,122,6,91,170,0,186,356,87,"Hologram, Human, Duelist, Hero, Inspiring, Tactician","male, nonhuman, tng, picard, crew_max_rarity_5","En Garde",2, 7, 4, 6, 10, 5, 0, , , , 550, 200, 103, 365, true,"Picard",crew_portraits_cm_picard_musketeer_sm.png,picard_musketeer_crew
"Covert Operative Leland",6,5, 369,163,346,0,0,0,1061,279,572,0,0,0,880,209,376,0,0,0,812,134,749,263,692,224,0,462,0,199,41,144,381,0,342,407,35,324,87,300,94,0,355,0,94,11,72,283,0,283,329,28,"Section 31, Undercover Operative, Crafty, Resourceful, Human","male, organic, dsc, leland, crew_max_rarity_5","Welcome To Section 31",0, 8, 8, 5, 12, 1, 0, 2, , , 250, 230, 163, 390, false,"Leland",crew_portraits_cm_dsc_leland_sec31_sm.png,dsc_leland_sec31_crew
"H.M.S. Pinafore Data",8,5, 1022,101,247,440,98,198,0,0,0,1180,172,449,0,0,0,0,0,0,113,495,15,546,283,849,69,869,519,223,0,0,245,101,0,247,681,41,734,534,730,76,780,441,250,0,0,251,115,0,394,464,"Android, Starfleet, Federation, Cyberneticist, Resourceful, Musician","nonhuman, male, tng, lieutenant_commander, bridge_crew, artificial_life, data, crew_max_rarity_5","A British Tar",2, 8, 12, 10, 14, 4, 0, , , , 300, 200, 100, 325, false,"Data",crew_portraits_cm_data_insurrection_sm.png,data_insurrection_crew
"Commodore Robert April",9,5, 1099,233,504,0,0,0,447,125,261,0,0,0,866,185,377,0,0,0,241,139,192,77,148,774,0,488,0,679,215,635,414,0,362,158,91,111,32,102,554,0,384,0,499,136,475,314,0,308,377,96,"Veteran, Human, Starfleet, Maverick, Explorer","male, organic, tos, april_robert, captain, tas, crew_max_rarity_5","Into The Heart Of The Nova",0, 9, 10, 8, 10, , , , 2, 2, 450, 100, 80, 490, false,"April",crew_portraits_cm_april_commodore_sm.png,april_commodore_crew
