"Mirror Jean-Luc Picard",0,5, 1042,243,753,583,21,88,982,198,439,0,0,0,0,0,0,0,0,0,115,90,407,688,269,125,975,1252,766,541,842,381,0,0,0,40,15,67,200,44,236,1232,1517,975,396,562,261,0,0,0,504,109,"Human, Terran Empire, Starfleet, Brutal, Crafty, Maverick, Veteran, Resourceful, Duelist, Mirror Universe","male, organic, tng, picard, crew_max_rarity_5","Power Grab",1, 9, 8, 6, 12, 8, 4, , , , 750, 330, 120, 400, false,"Picard",crew_portraits_cm_picard_mirror_sm.png,picard_mirror_crew, 79.5832, 59.1111, 22.4098, 87.776, 5, 0, 0, 19.2625
"Mirror Jadzia Dax",0,4, 0,0,0,314,67,167,958,137,274,500,118,269,0,0,0,0,0,0,1518,888,1148,0,0,340,616,1471,943,202,1027,558,1166,689,0,1379,1001,917,0,0,358,323,1324,812,228,1153,713,961,526,0,1360,1267,"Trill, Terran Rebellion, Casual, Desperate, Romantic, Mirror Universe","nonhuman, female, organic, ds9, dax, crew_max_rarity_4","It's about time you came back",1, 5, 8, 10, 12, 4, 0, , , , 800, 215, 150, 425, true,"J. Dax",crew_portraits_cm_jadzia_mirror_sm.png,dax_jadzia_mirror_crew, 54.1575, 22, 51.4499, 52.5225, 3, 0, 0, 0
"Mirror Vic Fontaine",0,4, 0,0,0,0,0,0,845,142,312,0,0,0,483,180,379,0,0,0,0,966,0,1258,0,840,0,1088,0,785,298,637,1079,0,898,0,924,0,833,0,772,0,641,0,743,149,615,588,0,470,1598,1330,"Desperate, Human, Survivalist, Artist, Musician, Marksman, Mirror Universe, Terran Rebellion","male, nonhuman, artificial_life, ds9, vicfontaine, crew_max_rarity_4","I'll See You In Hell First!",2, 8, 8, 8, 10, , , , , , 605, 245, 167, 425, false,"Vic",crew_portraits_cm_vicfontaine_mirror_sm.png,vic_mirror_crew, 40.8135, 31.5556, 11.2576, 43.3197, 4, 0, 0, 41.3666
"Mirror Data",0,5, 0,0,0,598,45,121,967,143,292,1141,163,367,0,0,0,0,0,0,1203,852,449,0,0,142,110,1172,684,68,994,514,500,180,0,1514,968,583,0,0,464,241,1464,948,102,1112,684,616,270,0,787,1027,"Mirror Universe, Android, Terran Empire, Starfleet, Resourceful, Saboteur","nonhuman, male, artificial_life, data, crew_max_rarity_5","Explosive Decompression Achieved",0, 8, 10, 10, 12, 5, 0, , , , 555, 100, 171, 400, false,"Data",crew_portraits_cm_data_mirror_sm.png,data_mirror_crew, 82.6087, 45.5556, 80.3832, 77.9439, 4, 0, 0, 39.9783
"Temporal Agent Daniels",0,5, 508,39,117,1238,118,376,0,0,0,947,116,230,0,0,0,0,0,0,125,1339,263,1448,1158,432,53,540,248,751,0,0,841,415,0,404,1463,643,1575,1314,680,148,776,411,951,0,0,1049,595,0,842,1358,"Human, Starfleet, Federation, Temporal Agent, Undercover Operative","male, organic, ent, daniels, crew_max_rarity_5","Protect the Timeline",2, 9, 12, 10, 14, 7, 4, , , , 500, 360, 140, 560, false,"Daniels",crew_portraits_cm_daniels_temporal_sm.png,daniels_temporal_crew, 82.0076, 14.6667, 20.4873, 70.9565, 3, 0, 0, 0
"Jannar",0,4, 0,0,0,743,40,109,0,0,0,372,72,212,799,171,340,0,0,0,1043,0,1324,1084,0,976,408,278,577,1226,1114,0,414,869,725,1534,0,1180,886,0,1502,630,453,955,1072,858,0,207,726,523,1262,1433,"Counselor, Diplomat, Xindi, Investigator","male, nonhuman, organic, ent, jannar, exclusive_voyage, crew_max_rarity_4","Better Their World Than Ours",2, 4, 6, 4, 18, 1, 0, , , , 450, 200, 55, 340, true,"Jannar",crew_portraits_cm_jannar_sm.png,jannar_crew, 58.5855, 16, 46.2507, 50.0319, 2, 0, 1, 39.4143
"The Clown",0,4, 0,0,0,0,0,0,909,58,139,716,27,99,452,59,129,0,0,0,0,997,1022,1460,0,870,771,1348,0,220,613,671,572,598,1154,0,1420,1470,1545,0,1429,1220,1428,0,986,1191,1146,1126,974,1229,1298,1731,"Brutal, Costumed, Desperate, Scoundrel, Villain","male, artificial_life, voy, nonhuman, clown, exclusive_voyage, crew_max_rarity_4","Why Talk, When We Can Dance?",1, 9, 4, 8, 10, 3, 0, 2, , , 400, 200, 130, 355, false,"Clown",crew_portraits_cm_clown_sm.png,clown_crew, 63.6145, 27.3333, 40.4611, 52.807, 3, 0, 0, 58.7636
"Thot Gor",0,4, 688,178,406,0,0,0,350,114,223,0,0,0,544,83,168,0,0,0,946,640,885,594,715,1359,0,1181,0,1221,987,1082,1194,0,991,546,272,501,366,372,1016,0,1287,0,963,741,847,1294,0,1091,1461,973,"Breen, Diplomat, Dominion, Resourceful, Communicator","organic, nonhuman, evsuit, ds9, gor, exclusive_voyage, crew_max_rarity_4","Breen Dominance",0, 9, 10, 20, 10, , , 1, , , 775, 335, 65, 300, false,"Gor",crew_portraits_cm_thot_gor_sm.png,thot_gor_crew, 48.4873, 63.1111, 11.7471, 51.81, 5, 0, 0, 0
"Lucien",0,4, 349,92,224,546,149,314,0,0,0,0,0,0,628,244,491,0,0,0,649,1372,1329,710,1190,1019,779,327,611,0,1163,0,939,0,767,231,1155,1077,176,932,762,556,32,452,0,398,0,280,0,212,1379,243,"Crafty, Cultural Figure, Explorer, Resourceful, Playful","male, organic, tas, nonhuman, lucien, exclusive_voyage, crew_max_rarity_4","Can't You Do Anything Right?",1, 7, 5, 8, 10, , , , , , 450, 285, 114, 590, false,"Lucien",crew_portraits_cm_lucien_sm.png,lucien_crew, 46.6239, 56.4444, 14.6129, 55.8854, 5, 0, 0, 0
"Mirror Beverly Crusher",0,5, 0,0,0,571,47,103,0,0,0,0,0,0,980,70,136,1067,225,603,1274,0,0,1057,284,1226,960,333,63,0,1085,289,856,164,43,1532,0,0,1514,98,1500,1200,1072,64,0,1556,121,1413,48,74,824,976,"Human, Starfleet, Mirror Universe, Terran Empire, Physician, Caregiver, Neurologist, Geneticist","female, organic, tng, crusher, crew_max_rarity_5","Get Back In The Fight",1, 8, 20, 12, 10, 2, 0, 1, , , 300, 115, 242, 500, false,"Crusher",crew_portraits_cm_crusher_mirror_sm.png,crusher_mirror_crew, 80.3446, 25.3333, 33.9812, 75.1053, 3, 0, 0, 19.2625
"Mirror Mayweather",0,4, 416,33,101,0,0,0,853,125,268,656,82,177,0,0,0,0,0,0,1440,621,593,1517,1228,850,768,0,0,208,1118,647,1062,595,0,1542,773,906,1595,1330,897,937,0,0,368,1182,742,1263,791,0,1326,1587,"Human, Starfleet, Mirror Universe, Terran Empire, MACO, Marksman, Brutal","male, organic, ent, mayweather, crew_max_rarity_4","Clean Up This Mess",0, 9, 10, 10, 8, , , , , , 400, 265, 267, 290, false,"Mayweather",crew_portraits_cm_mayweather_mirror_sm.png,mayweather_mirror_crew, 58.7858, 22, 17.4804, 49.6721, 3, 0, 0, 39.9132
"Ripper",0,5, 0,0,0,852,195,430,1332,182,366,0,0,0,0,0,0,0,0,0,812,561,0,0,0,30,580,849,441,353,555,199,0,0,0,466,747,0,0,0,32,326,516,253,556,798,414,0,0,0,946,989,"Brutal, Desperate, Explorer, Primal, Survivalist, Tardigrade","organic, dsc, nonhuman, ripper, crew_max_rarity_5","Mycelial Mastery",1, 9, 10, 12, 12, , , , , , 675, 250, 105, 325, false,"Ripper",crew_portraits_cm_tardigrade_sm.png,dsc_tardigrade_crew, 66.7802, 34.4444, 16.7945, 64.8066, 5, 0, 0, 0
"Satan's Robot",0,5, 0,0,0,571,59,123,852,134,273,1142,176,420,0,0,0,0,0,0,1249,977,441,0,0,174,109,1207,723,72,1113,641,492,177,0,1496,1005,486,0,0,500,189,1441,932,91,1159,717,489,195,0,850,962,"Hologram, Villain, Duelist","nonhuman, male, voy, artificial_life, satans_robot, crew_max_rarity_5","Citizen Of Earth, Surrender!",1, 8, 18, 8, 10, 2, 0, 2, , , 350, 100, 190, 100, false,"Satan's Robot",crew_portraits_cm_satans_robot_sm.png,satans_robot_crew, 78.3009, 5.7778, 52.3483, 71.0678, 1, 0, 1, 62.2993
"Torchbearer Voq",0,4, 484,193,456,0,0,0,502,53,131,0,0,0,831,152,317,0,0,0,1059,671,1004,397,848,1301,0,917,0,1182,482,1040,882,0,716,381,362,353,102,218,1455,0,818,0,1285,525,1158,752,0,614,1184,710,"Klingon, Cultural Figure, Desperate, Inspiring","nonhuman, male, tyler, voq, organic, dsc, crew_max_rarity_4","Demonstration of Faith",2, 7, 12, 5, 12, 1, 0, , , , 935, 150, 214, 190, false,"Voq",crew_portraits_cm_voq_sm.png,dsc_voq_torchbearer_crew, 55.7804, 42.2222, 53.1866, 59.7795, 4, 0, 0, 0
"Florist Q",0,3, 0,0,0,293,71,221,0,0,0,0,0,0,536,88,198,0,0,0,1511,0,0,1337,0,1483,1198,883,940,0,1372,0,1176,0,971,1213,0,0,1349,0,1160,873,610,700,0,1389,0,1207,0,1024,1734,1709,"Crafty, Scoundrel, Costumed, Romantic, Q Continuum, Playful, Cosmic","male, nonhuman, tng, q_jdl, crew_max_rarity_3","Special Delivery",2, 3, 8, 3, 8, 1, 1, , , , 855, 155, 125, 380, false,"Q",crew_portraits_cm_q_florist_sm.png,q_florist_crew, 25.4458, 36.4444, 19.8751, 36.4273, 5, 0, 0, 17.7223
"Prisoner Michael Burnham",0,2, 0,0,0,380,30,142,262,20,53,0,0,0,121,42,104,0,0,0,1472,1493,0,1643,0,1023,1150,1213,920,1352,1541,1221,1564,0,1338,1506,1511,0,1588,0,1278,1181,1145,938,1364,1533,1236,1494,0,1277,1775,1793,"Federation, Starfleet, Prisoner, Xenoanthropology, Duelist, Human","female, organic, dsc, burnham, crew_max_rarity_2","Improvised Assault",2, 3, 6, 10, 10, , , , , , 190, 220, 93, 260, false,"Burnham",crew_portraits_cm_burnham_prisoner_sm.png,dsc_burnham_prisoner_crew, 23.342, 10.4444, 11.8103, 27.1687, 2, 0, 0, 39.9566
"Graduation Michael Burnham",0,4, 0,0,0,884,180,497,0,0,0,694,65,178,0,0,0,0,0,0,712,0,983,0,0,650,122,769,393,917,0,0,1044,567,0,365,0,1290,0,0,322,105,436,211,1159,0,0,1304,829,0,1528,1472,"Federation, Civilian, Astrophysicist, Xenoanthropology, Human, Festive","female, organic, dsc, burnham, crew_max_rarity_4","Lofty Expectations",2, 9, 8, 8, 10, , , 2, , , 500, 100, 280, 200, false,"Burnham",crew_portraits_cm_burnham_vulcan_graduate_sm.png,dsc_burnham_graduation_crew, 48.0665, 12.8889, 7.6208, 41.1745, 2, 0, 0, 39.6312
"Tourist Quark",0,4, 325,45,113,0,0,0,0,0,0,0,0,0,810,168,393,637,109,244,1535,1471,1460,707,488,0,0,898,582,0,1089,775,862,570,112,1517,1458,1433,528,485,0,0,635,586,0,785,824,582,588,114,1337,1154,"Ferengi, Scoundrel, Desperate, Romantic, Gambler, Communicator, Civilian","nonhuman, male, organic, ds9, quark, crew_max_rarity_4","Risan Rituals",0, 6, 12, 8, 20, 2, 0, , , , 400, 100, 165, 665, false,"Quark",crew_portraits_cm_quark_jamaharon_sm.png,quark_risa_crew, 54.418, 34.6667, 63.5923, 58.2406, 3, 0, 0, 17.7223
"Mariachi Q",0,5, 0,0,0,0,0,0,957,170,361,0,0,0,1110,257,537,0,0,0,0,802,0,701,0,636,0,529,0,603,55,440,457,0,371,0,771,0,436,0,583,0,276,0,584,37,445,216,0,180,955,660,"Crafty, Costumed, Scoundrel, Musician, Q Continuum, Playful, Festive, Cosmic","nonhuman, male, tng, q_jdl, crew_max_rarity_5","I Feel Like Celebrating!",1, 8, 8, 10, 10, 3, 0, 2, , , 450, 75, 105, 665, false,"Q",crew_portraits_cm_q_mariachi_sm.png,q_mariachi_crew, 63.5744, 45.3333, 41.9129, 65.2509, 6, 0, 1, 17.7223
"Vengeful L'Rell",0,5, 0,0,0,0,0,0,1047,132,230,0,0,0,1118,190,380,0,0,0,0,793,0,751,0,621,0,566,0,591,73,429,495,0,397,0,1078,0,817,0,949,0,622,0,906,201,787,569,0,457,975,1451,"Klingon, Brutal, Villain, Interrogator, Vengeful","nonhuman, organic, female, dsc, lrell, crew_max_rarity_5","Choose Your Pain",0, 10, 10, 14, 12, , , 2, , , 575, 225, 58, 525, false,"L'Rell",crew_portraits_cm_lrell_sm.png,dsc_lrell_mekleth_crew, 66.5999, 28.2222, 14.0377, 59.5922, 4, 0, 0, 40.6725
"Gladiator McCoy",0,5, 0,0,0,0,0,0,1246,180,362,0,0,0,0,0,0,759,270,675,0,635,0,0,489,408,0,0,387,409,646,13,0,314,579,0,753,0,0,55,566,0,0,75,568,806,8,0,24,104,953,265,"Federation, Starfleet, Human, Physician, Desperate, Duelist, Athlete, Prisoner","male, organic, tos, mccoy, crew_max_rarity_5","Let The Games Begin!",0, 9, 6, 8, 12, , , , , , 615, 140, 100, 530, false,"McCoy",crew_portraits_cm_mccoy_gladiator_sm.png,mccoy_gladiator_crew, 61.4506, 14.4444, 16.5002, 66.7656, 2, 0, 0, 21.3883
"Duelist Yar",0,4, 407,16,37,0,0,0,657,292,603,0,0,0,474,103,336,0,0,0,1507,630,1432,1036,1299,823,0,1149,0,773,326,614,1158,0,956,1585,255,1519,928,1380,132,0,934,0,148,35,96,871,0,743,1417,463,"Human, Starfleet, Duelist, Federation, Tactician, Desperate, Survivalist, Athlete","female, organic, tng, yar, crew_max_rarity_4","Impressive Skill",1, 6, 10, 6, 12, 7, 1, , , , 580, 265, 187, 200, false,"Yar",crew_portraits_cm_yar_glavin_duel_sm.png,yar_glavin_crew, 47.1649, 17.1111, 26.0412, 50.0918, 2, 0, 0, 0
"Tsunkatse Seven",0,4, 679,124,299,282,92,230,850,150,301,0,0,0,0,0,0,0,0,0,572,329,912,1131,739,414,1196,1466,938,783,1100,632,0,0,0,254,318,842,1087,710,218,785,1141,639,766,1050,638,0,0,0,1242,945,"Human, Borg, Brutal, Duelist, Athlete, Federation, Civilian, Prisoner","nonhuman, female, organic, voy, seven, crew_max_rarity_4","Hunt It Down And Kill It",0, 8, 8, 6, 6, , , , , , 400, 200, 110, 525, false,"Seven",crew_portraits_cm_seven_tsunkatse_sm.png,seven_tsunkatse_crew, 55.3396, 24.2222, 16.3575, 54.533, 4, 0, 0, 21.3883
"EV Suit Archer",0,5, 1210,141,431,0,0,0,882,139,296,527,20,53,0,0,0,0,0,0,443,161,120,708,277,814,1057,0,0,271,1082,607,1366,855,0,575,213,359,798,392,843,1246,0,0,614,1111,683,1563,996,0,849,1112,"Human, Starfleet, Pilot, Explorer, Desperate, Jury Rigger, Hero","male, evsuit, organic, ent, archer, crew_max_rarity_5","Now You See Me...",0, 7, 8, 10, 10, , , , , , 575, 225, 189, 290, false,"Archer",crew_portraits_cm_archer_ev_suit_sm.png,archer_ev_suit_crew, 79.9239, 25.5556, 17.7872, 71.4817, 4, 0, 0, 40.8894
"Dr. Gillian Taylor",0,4, 0,0,0,636,236,501,0,0,0,0,0,0,302,71,161,447,187,471,940,0,0,1581,891,885,672,572,118,0,1611,818,1496,609,627,278,0,0,1461,226,258,216,153,9,0,1501,226,1346,118,125,1455,180,"Federation, Starfleet, Human, Physician","female, organic, tos, gillian, crew_max_rarity_4","Sea Shepherd",1, 9, 6, 6, 12, , , 3, , , 650, 230, 95, 500, false,"Dr. Taylor",crew_portraits_cm_taylor_sm.png,gillian_taylor_crew, 42.3963, 8.8889, 6.504, 45.1872, 1, 0, 0, 0
"Protomorphosis Barclay",0,5, 0,0,0,1169,233,453,488,101,203,1125,43,112,0,0,0,0,0,0,441,1292,669,0,0,83,41,532,246,205,1432,993,714,324,0,347,1194,1442,0,0,87,150,420,203,711,1336,916,1479,959,0,699,1022,"Starfleet, Federation, Innovator, Astrophysicist, Desperate, Primal, Human, Compromised","male, organic, tng, barclay, crew_max_rarity_5","Viral Attack",0, 8, 10, 12, 10, , , , , , 575, 300, 70, 225, false,"Barclay",crew_portraits_cm_barclay_protomorphosis_sm.png,barclay_genesis_crew, 84.8327, 17.3333, 18.7449, 77.8685, 3, 0, 0, 21.0629
"Captain Lorian",0,5, 835,157,390,0,0,0,450,136,284,1259,159,399,0,0,0,0,0,0,860,417,39,1050,632,1200,319,0,0,117,1406,962,440,141,0,603,236,30,834,412,861,405,0,0,100,1139,705,576,243,0,756,218,"Vulcan, Human, Jury Rigger, Desperate, Saboteur, Telepath","male, nonhuman, organic, ent, lorian, crew_max_rarity_5","There's Too Much At Stake",1, 10, 18, 6, 6, 4, 0, , , , 600, 245, 60, 300, false,"Lorian",crew_portraits_cm_lorian_sm.png,lorian_captain_crew, 77.5796, 30.2222, 65.8548, 79.2323, 4, 0, 0, 18.3731
"Celebratory Ash Tyler",0,4, 649,99,164,0,0,0,484,23,45,0,0,0,814,155,322,0,0,0,1080,751,1025,417,876,1352,0,930,0,1217,592,1077,892,0,727,1260,1129,1226,501,1074,1558,0,794,0,1366,805,1238,724,0,590,1288,1562,"Human, Federation, Starfleet, Tactician, Marksman, Pilot, Romantic, Klingon, Festive","male, organic, dsc, tyler, voq, crew_max_rarity_4","I'm not going anywhere",0, 7, 10, 10, 10, 4, 2, , , , 450, 50, 123, 540, false,"Tyler",crew_portraits_cm_dsc_tyler_celebration_sm.png,dsc_tyler_celebration_crew, 59.7275, 21.3333, 19.1028, 50.1141, 3, 0, 1, 40.4338
"Dress Uniform Scotty",0,5, 852,199,458,0,0,0,0,0,0,1274,120,336,0,0,0,0,0,0,767,879,37,989,552,0,331,0,0,423,0,0,463,155,0,369,549,27,612,213,0,543,0,0,719,0,0,778,391,0,965,1038,"Human, Starfleet, Federation, Jury Rigger, Communicator, Festive","male, organic, tos, scott, crew_max_rarity_5","Call me Scotty",1, 8, 15, 12, 20, 2, 0, , 2, 2, 425, 330, 315, 415, false,"Scotty",crew_portraits_cm_scott_dress_uniform_sm.png,scott_dress_uniform_crew, 64.7365, 34.4444, 76.8513, 64.2739, 3, 1, 0, 0
"Lieutenant Tarah",0,4, 0,0,0,0,0,0,885,133,310,0,0,0,439,219,445,0,0,0,0,944,0,1254,0,806,0,1082,0,759,281,601,1075,0,893,0,954,0,626,0,827,0,448,0,785,92,667,367,0,275,1587,1084,"Andorian, Imperial Guard, Saboteur, Brutal, Marksman","nonhuman, female, organic, ent, tarah, crew_max_rarity_4","I'll See To It Myself",0, 8, 4, 8, 14, , , , 2, 2, 725, 200, 115, 445, false,"Tarah",crew_portraits_cm_tarah_lieutenant_sm.png,tarah_lieutenant_crew, 40.6732, 25.5556, 13.7625, 42.2562, 4, 0, 0, 20.6508
"Prisoner Katrina Cornwell",0,5, 0,0,0,0,0,0,594,52,118,0,0,0,1049,129,286,1186,163,481,0,1233,0,892,273,1147,0,706,243,1063,248,40,634,151,28,0,1450,0,1113,252,1476,0,973,226,1297,747,130,922,132,63,526,906,"Starfleet, Federation, Counselor, Human, Desperate, Diplomat, Prisoner","female, organic, dsc, cornwell, crew_max_rarity_5","Why Should I Trust You?",2, 9, 8, 5, 14, 8, 4, , , , 525, 230, 165, 425, false,"Cornwell",crew_portraits_cm_dsc_cornwell_prisoner_sm.png,dsc_cornwell_prisoner_crew, 86.9365, 15.7778, 19.7162, 79.652, 2, 0, 0, 41.3449
"Away Team Saru",0,5, 543,30,110,1195,155,397,1087,74,149,0,0,0,0,0,0,0,0,0,122,388,1281,1436,1137,36,338,549,257,615,952,458,0,0,0,334,1066,1460,1589,1326,219,423,663,345,1211,1516,1081,0,0,0,771,1476,"Kelpien, Federation, Starfleet, Exobiology, Explorer, Desperate, Communicator","male, nonhuman, organic, dsc, saru, crew_max_rarity_5","A Moment Without Fear",0, 9, 8, 8, 10, , , , , , 475, , 150, 600, false,"Saru",crew_portraits_cm_saru_away_team_sm.png,dsc_saru_away_team_crew, 86.2352, 40.8889, 19.0199, 75.8843, 4, 0, 0, 0
"Expedition Shran",0,3, 251,17,65,0,0,0,362,97,209,0,0,0,552,87,179,0,0,0,1570,1093,1498,1113,1361,1362,0,1155,0,1223,961,1085,1165,0,961,1575,1030,1507,1225,1371,1089,0,1243,0,1021,768,907,1247,0,1048,1679,1667,"Andorian, Tactician, Survivalist, Explorer, Investigator, Imperial Guard","nonhuman, male, organic, ent, shran, crew_max_rarity_3","Ice Forges Real Strength",0, 4, 8, 8, 8, 4, 1, , , , 420, 240, 80, 470, false,"Shran",crew_portraits_cm_shran_subzero_sm.png,shran_expedition_crew, 35.7844, 31.7778, 23.0489, 36.4475, 5, 0, 0, 19.4577
"Commander Thelin",0,4, 594,102,243,837,96,217,222,135,295,0,0,0,0,0,0,0,0,0,233,837,1040,1252,894,462,670,972,520,1310,1600,1172,0,0,0,380,437,1019,1222,873,244,807,1158,656,803,1122,691,0,0,0,1443,1114,"Andorian, Tactician, Explorer, Starfleet, Federation","nonhuman, male, organic, tas, thelin, crew_max_rarity_4","Target Acquired",2, 7, 10, 8, 12, 7, 0, , , , 500, 145, 70, 475, false,"Thelin",crew_portraits_cm_thelin_sm.png,thelin_crew, 50.3907, 16.6667, 52.3246, 49.5899, 3, 0, 0, 0
"Ambassador Shras",0,4, 638,76,189,0,0,0,372,52,110,0,0,0,929,55,112,0,0,0,1089,801,1034,454,884,1468,0,949,0,1284,670,1153,911,0,745,1249,975,1213,1080,1063,1488,0,1457,0,1306,1286,1181,1466,0,1253,1387,1699,"Andorian, Communicator, Federation, Diplomat, Civilian, Ambassador","nonhuman, male, organic, tos, shras, crew_max_rarity_4","We Are A Violent Race",0, 9, 8, 10, 10, , , , , , 650, 195, 140, 375, false,"Shras",crew_portraits_cm_shras_sm.png,shras_ambassador_crew, 59.5071, 32.6667, 17.0132, 45.6338, 3, 0, 0, 19.9132
"Desert Michael Burnham",0,2, 0,0,0,355,78,204,0,0,0,0,0,0,275,24,77,0,0,0,1430,0,0,1606,0,1415,1101,1055,881,0,1630,0,1527,0,1304,1229,0,0,1626,0,1178,890,1022,714,0,1649,0,1541,0,1314,1796,1795,"Federation, Starfleet, Explorer, Xenoanthropology, Human","female, organic, dsc, burnham, crew_max_rarity_2","A Storm is Coming",1, 4, 10, 10, 12, , , , , , 290, 150, 60, 165, false,"Burnham",crew_portraits_cm_burnham_desert_sm.png,dsc_burnham_desert_crew, 19.3148, 16, 5.5663, 22.3405, 3, 0, 0, 18.5683
"Prospect Michael Burnham",0,4, 0,0,0,839,137,382,0,0,0,661,50,143,334,86,174,0,0,0,877,0,1046,1548,0,828,165,491,481,961,1570,0,686,612,1238,682,0,1403,1404,0,620,237,299,373,1275,1435,0,822,932,1072,1334,1409,"Federation, Civilian, Astrophysicist, Xenoanthropology, Human","female, organic, dsc, burnham, crew_max_rarity_4","Respect Is Earned",1, 5, 8, 8, 10, 8, 4, , , , 500, 130, 150, 350, false,"Burnham",crew_portraits_cm_burnham_prospect_sm.png,dsc_burnham_prospect_crew, 55.9808, 6.8889, 18.4382, 45.6086, 1, 0, 0, 39.6312
"Suus Mahna Sarek",0,5, 0,0,0,389,55,145,1092,246,525,0,0,0,917,155,306,0,0,0,1438,647,0,1013,0,120,1109,407,890,436,74,288,794,0,654,1469,440,0,1009,0,92,1136,455,901,250,54,156,786,0,651,871,379,"Vulcan, Diplomat, Desperate, Brutal, Cultural Figure, Communicator, Federation, Telepath, Ambassador","nonhuman, male, organic, sarek, dsc, crew_max_rarity_5","This Is My Mind",1, 7, 10, 8, 12, 1, 0, 2, , , 475, 255, 170, 250, false,"Sarek",crew_portraits_cm_sarek_suus_mahna_sm.png,dsc_sarek_suus_mahna_crew, 73.6125, 66, 47.6892, 78.6796, 6, 0, 0, 38.2863
"Tora Ziyal",0,5, 0,0,0,0,0,0,0,0,0,0,0,0,1147,197,429,849,192,505,0,0,0,728,527,0,0,546,407,0,680,501,481,344,38,0,0,0,698,194,0,0,505,191,0,599,200,436,98,16,970,697,"Cardassian, Bajoran, Romantic, Civilian, Artist","female, nonhuman, organic, ds9, tora, crew_max_rarity_5","Never Doubt",1, 8, 10, 10, 12, , , , , , 650, 170, 170, 490, false,"Ziyal",crew_portraits_cm_tora_ziyal_sm.png,ziyal_tora_crew, 61.4105, 16, 5.9649, 60.5929, 3, 0, 0, 0
"Commander Ellen Landry",0,4, 534,69,238,347,57,111,600,254,669,0,0,0,0,0,0,0,0,0,849,429,1154,1326,984,436,1199,1470,941,796,1124,654,0,0,0,767,78,1104,1287,956,47,1187,1458,943,132,206,82,0,0,0,1462,433,"Human, Starfleet, Federation, Tactician, Brutal, Marksman","female, organic, dsc, landry, crew_max_rarity_4","Stick to Logic",0, 8, 6, 4, 8, , , , , , 650, 345, 220, 300, false,"Landry",crew_portraits_cm_landry_sm.png,dsc_landry_commander_crew, 45.2214, 14.4444, 15.4138, 47.838, 2, 0, 0, 20.6508
"Lissan",0,5, 876,269,542,0,0,0,0,0,0,0,0,0,1144,267,541,0,0,0,644,766,585,95,428,0,0,497,0,0,627,0,431,0,341,181,387,170,9,99,0,0,261,0,0,328,0,200,0,167,929,174,"Andorian, Aenar, Diplomat, Telepath, Civilian, Communicator","nonhuman, female, organic, ent, lissan, crew_max_rarity_5","You Have An Interesting Mind",1, 7, 10, 12, 8, 6, 2, , , , 590, 225, 65, 540, false,"Lissan",crew_portraits_cm_lissan_sm.png,lissan_crew, 61.9916, 39.5556, 11.9906, 65.7277, 4, 0, 0, 18.3731
"Time Loop Mudd",0,4, 0,0,0,0,0,0,708,31,62,711,158,379,315,125,257,0,0,0,0,1133,887,1490,0,1024,677,1378,0,238,866,821,474,489,1191,0,1499,574,1157,0,1548,425,1017,0,404,942,1227,111,266,825,1405,1320,"Human, Civilian, Scoundrel, Crafty, Smuggler, Resourceful, Survivalist, Federation, Playful","male, evsuit, organic, dsc, mudd, crew_max_rarity_4","All The Time In The World!",2, 6, 12, 10, 10, 4, 0, , , , 450, 185, 100, 475, false,"Mudd",crew_portraits_cm_harry_mudd_takeover_sm.png,dsc_mudd_takeover_crew, 53.0755, 53.7778, 51.3254, 59.1956, 5, 0, 0, 37.0716
"Mirror Shukar",0,5, 0,0,0,439,102,278,1042,269,623,0,0,0,903,184,378,0,0,0,1322,644,0,975,0,89,1014,305,796,431,65,284,750,0,621,1000,301,0,828,0,26,686,172,555,150,14,97,581,0,466,764,94,"Andorian, Desperate, Veteran, Civilian, Mirror Universe","nonhuman, male, organic, dsc, shukar, crew_max_rarity_5","The Will Of Andoria",1, 7, 10, 8, 12, 7, 0, , , , 375, 195, 70, 430, false,"Shukar",crew_portraits_cm_shukar_sm.png,dsc_shukar_mirror_crew, 73.1717, 28.2222, 61.3719, 80.5069, 4, 0, 0, 0
"The Caretaker",0,5, 0,0,0,878,187,495,0,0,0,964,335,817,0,0,0,452,122,378,725,0,409,0,961,655,38,777,97,408,0,895,446,17,948,355,0,19,0,515,313,2,427,26,32,0,503,28,1,551,590,26,"Caregiver, Desperate, Explorer, Musician, Nacene, Cultural Figure, Theoretical Engineer, Cosmic","male, organic, voy, nonhuman, caretaker, gauntlet_jackpot, exclusive_gauntlet, crew_max_rarity_5","A Debt of Honor",1, 7, 6, 8, 14, 6, 0, , , , 425, 200, 113, 455, true,"The Caretaker",crew_portraits_cm_caretaker_sm.png,caretaker_crew, 69.9659, 56.2222, 54.7675, 86.797, 7, 0, 0, 0
"Bajoran Dukat",0,4, 510,208,518,0,0,0,0,0,0,0,0,0,785,202,407,0,0,0,985,1045,923,360,751,0,0,901,0,0,1091,0,865,0,697,268,480,257,35,155,0,0,539,0,0,663,0,473,0,373,1553,574,"Cardassian, Bajoran, Brutal, Desperate, Veteran, Cultural Figure, Villain, Undercover Operative, Inspiring, Communicator, Spiritual, Vengeful","nonhuman, male, organic, ds9, dukat, crew_max_rarity_4","This Is My Destiny",0, 6, 10, 8, 10, 8, 4, , , , 580, 375, 52, 550, false,"Dukat",crew_portraits_cm_dukat_bajoran_sm.png,dukat_bajoran_crew, 39.7516, 88, 19.4635, 61.972, 9, 0, 0, 41.4751
"Surgeon Pulaski",0,5, 0,0,0,837,190,545,0,0,0,0,0,0,0,0,0,1289,171,473,743,0,0,0,189,699,539,802,20,0,0,200,0,106,287,283,0,0,0,253,262,218,347,10,0,0,251,0,133,300,932,507,"Federation, Starfleet, Human, Physician","female, organic, tng, pulaski, crew_max_rarity_5","Emergency Procedure",1, 7, 12, 8, 12, 6, 0, , , , 700, 100, 180, 400, false,"Pulaski",crew_portraits_cm_pulaski_surgeon_sm.png,pulaski_surgeon_crew, 64.997, 8.8889, 33.2602, 64.7082, 1, 0, 0, 0
"Away Team Neelix",0,2, 0,0,0,152,6,26,0,0,0,353,24,80,187,77,240,0,0,0,1586,0,1459,1597,0,1561,1051,1366,991,1326,1626,0,1091,962,1298,1588,0,1490,1277,0,1561,1211,1089,991,1350,1313,0,903,985,939,1787,1760,"Talaxian, Mylean, Resourceful, Survivalist, Chef, Civilian, Communicator, Geologist, Ambassador","nonhuman, male, organic, voy, neelix, crew_max_rarity_2","Genuine Effort",2, 2, 8, 3, 8, 1, 0, , , , 230, 30, 20, 115, false,"Neelix",crew_portraits_cm_neelix_away_team_sm.png,neelix_away_crew, 21.1581, 68.6667, 42.1374, 60.5641, 6, 0, 0, 19.9132
"Resistance Neelix",0,5, 0,0,0,0,0,0,1054,188,381,0,0,0,1154,230,570,0,0,0,0,714,0,663,0,505,0,490,0,495,27,342,425,0,336,0,724,0,426,0,525,0,267,0,525,30,393,206,0,171,914,508,"Civilian, Talaxian, Mylean, Crafty, Saboteur, Smuggler, Undercover Operative, Resourceful, Chef, Ambassador, Courier","nonhuman, male, organic, voy, neelix, crew_max_rarity_5","Vital Information",2, 8, 10, 8, 12, 4, 0, , , , 495, 195, 210, 430, false,"Neelix",crew_portraits_cm_neelix_resistance_sm.png,neelix_resistance_crew, 67.9223, 45.7778, 52.2517, 70.0764, 5, 0, 0, 39.2625
"Victorian Pulaski",0,4, 0,0,0,0,0,0,0,0,0,0,0,0,986,46,111,614,138,321,0,0,0,1068,792,0,0,909,563,0,1097,753,872,550,107,0,0,0,1577,643,0,0,1470,451,0,1610,606,1480,411,355,1567,1694,"Human, Federation, Starfleet, Physician, Costumed, Crafty","female, organic, tng, pulaski, crew_max_rarity_4","I Give You Credit",1, 6, 12, 10, 18, 2, 0, , , , 600, 315, 127, 290, false,"Pulaski",crew_portraits_cm_pulaski_victorian_sm.png,pulaski_victorian_crew, 49.2286, 23.1111, 26.5386, 40.2406, 2, 0, 0, 0
"Captain Beverly Picard",0,5, 924,165,345,0,0,0,0,0,0,0,0,0,473,119,245,926,303,760,764,875,717,421,14,0,0,1217,263,0,1408,307,1235,173,85,660,787,606,313,1,0,0,1044,44,0,1225,33,1010,13,9,781,63,"Human, Starfleet, Federation, Physician, Cyberneticist","female, organic, tng, crusher, exclusive_honorhall, crew_max_rarity_5","Not On My Ship!",1, 6, 4, 6, 4, , , , , , 250, 100, 85, 500, true,"Crusher",crew_portraits_cm_crusher_captain_sm.png,crusher_captain_crew, 71.108, 8.8889, 14.9806, 78.7053, 1, 0, 0, 20.6941
