"Little John Riker",5,5, 1023,128,239,0,0,0,1309,192,354,0,0,0,422,113,245,0,0,0,312,23,273,217,235,128,0,759,0,137,79,82,729,0,632,562,164,491,290,462,301,0,617,0,276,139,235,549,0,492,157,386,"Human, Federation, Starfleet, Costumed, Thief","male, organic, tng, bridge_crew, riker, crew_max_rarity_5","We Need a Diversion",0, 6, 10, 8, 16, 2, 0, , , , 515, 200, 125, 425, false,"Riker",crew_portraits_cm_riker_littlejohn_sm.png,riker_littlejohn_crew
"Transporter Chief Rand",10,4, 0,0,0,0,0,0,0,0,0,859,113,241,628,92,204,0,0,0,0,0,401,668,0,0,334,597,0,407,684,0,55,234,477,0,0,527,726,0,0,374,702,0,513,759,0,181,311,562,877,946,"Human, Federation, Starfleet, Desperate","female, organic, tos, rand, crew_max_rarity_4","Yank Them Back!",1, 8, 8, 8, 10, , , , , , 475, 275, 155, 242, false,"Rand",crew_portraits_cm_rand_transporter_sm.png,rand_transporter_crew
"Betrothed Kamala",2,2, 234,27,86,145,27,81,0,0,0,0,0,0,363,43,105,0,0,0,808,868,862,699,807,925,634,707,569,0,906,0,837,0,726,790,858,845,763,791,910,621,743,559,0,930,0,841,0,731,1046,1058,"Kriosian, Empath, Romantic","organic, tng, female, nonhuman, kamala, crew_max_rarity_2","I Am for You",1, 2, 6, 3, 10, 1, 0, , , , 390, 130, 115, 530, false,"Kamala",crew_portraits_cm_kamala_betrothed_sm.png,kamala_betrothed_crew
"Cadet First Class Locarno",9,5, 1284,180,408,0,0,0,0,0,0,0,0,0,1078,160,296,0,0,0,131,275,108,3,59,0,0,309,0,0,399,0,251,0,236,281,383,208,109,197,0,0,486,0,0,560,0,406,0,386,428,636,"Human, Federation, Starfleet, Maverick, Pilot, Crafty, Desperate","tng, male, nicholas_locarno, organic, crew_max_rarity_5","Everything I Said Was The Truth!",1, 10, 4, 12, 8, , , , 2, 2, 390, 150, 175, 690, false,"Locarno",crew_portraits_cm_nicholas_locarno_sm.png,locarno_nicholas_crew
"Kamala",5,5, 967,131,227,546,92,174,0,0,0,0,0,0,1254,238,483,0,0,0,84,472,351,29,298,661,456,44,409,0,243,0,97,0,113,243,605,500,91,471,709,462,75,423,0,272,0,133,0,151,116,324,"Kriosian, Empath, Romantic, Exoarchaeology","nonhuman, female, organic, tng, kamala, crew_max_rarity_5","Who I Am Today, I Will Be Forever",1, 7, 4, 6, 8, , , , , , 315, 95, 167, 325, true,"Kamala",crew_portraits_cm_kamala_sm.png,kamala_crew
"Priestess Siranna",8,4, 529,112,242,0,0,0,0,0,0,0,0,0,883,138,286,382,78,211,650,665,591,225,203,0,0,459,482,0,545,640,404,440,106,575,609,505,256,145,0,0,534,401,0,606,574,456,380,154,587,611,"Gardener, Kelpien, Spiritual, Civilian, Ambassador, Cultural Figure","nonhuman, female, organic, dsc, siranna, crew_max_rarity_4","The Truth Has Survived",1, 7, 6, 8, 8, , , , , , 450, 200, 100, 475, false,"Siranna",crew_portraits_cm_siranna_priestess_sm.png,dsc_siranna_priestess_crew
"Scrooge Data",4,5, 969,171,330,508,73,173,0,0,0,0,0,0,1267,264,338,0,0,0,81,403,256,21,216,720,488,64,442,0,289,0,138,0,146,141,455,308,76,290,743,494,121,447,0,409,0,235,0,248,132,314,"Android, Starfleet, Federation, Cyberneticist, Costumed, Cultural Figure","nonhuman, male, tng, lieutenant_commander, bridge_crew, artificial_life, data, crew_max_rarity_5","Humbug",1, 9, 6, 8, 6, , , , , , 200, 305, 160, 475, false,"Data",crew_portraits_cm_data_scrooge_sm.png,data_scrooge_crew
"Chancellor Martok",5,5, 943,132,341,0,0,0,543,67,148,0,0,0,1262,161,372,0,0,0,346,185,312,39,268,681,0,226,0,603,81,558,169,0,177,417,300,336,125,326,778,0,393,0,674,244,659,323,0,320,190,444,"Klingon, Duelist, Tactician, Diplomat, Veteran, Politician, Cultural Figure","nonhuman, male, organic, ds9, martok, crew_max_rarity_5","I will fight any battle. Anywhere",0, 9, 8, 8, 10, , , , 2, 2, 400, 125, 184, 450, false,"Martok",crew_portraits_cm_martok_chancellor_sm.png,martok_chancellor_crew
"Admiral Patrick",5,5, 1238,275,538,1023,124,239,0,0,0,0,0,0,495,76,143,0,0,0,4,250,83,91,41,334,255,128,205,0,812,0,722,0,622,16,225,73,112,63,559,364,323,340,0,873,0,758,0,657,97,256,"Human, Engineered, Federation, Civilian, Costumed, Crafty","male, organic, ds9, patrick, crew_max_rarity_5","That's A Stupid Question",1, 9, 8, 10, 10, , , , , , 500, 100, 155, 375, false,"Patrick",crew_portraits_cm_patrick_admiral_sm.png,patrick_admiral_crew
"Christine Chapel",6,4, 0,0,0,559,70,170,0,0,0,0,0,0,349,103,201,790,127,280,682,0,0,831,369,660,455,397,77,0,860,375,776,252,192,764,0,0,717,423,756,499,372,151,0,746,414,634,259,153,738,731,"Federation, Starfleet, Human, Physician, Veteran, Nurse, Romantic","female, organic, tos, chapel, crew_max_rarity_4","Don't You Recognise Me?",1, 7, 8, 12, 12, 5, 0, , , , 1400, 185, 120, 400, false,"Chapel",crew_portraits_cm_chapel_christine_sm.png,chapel_christine_crew
"Brainless Spock",8,2, 0,0,0,223,43,138,0,0,0,360,51,179,0,0,0,0,0,0,915,0,759,0,0,909,396,899,554,716,0,0,795,463,0,854,0,724,0,0,841,329,836,520,664,0,0,740,431,0,1064,1049,"Federation, Starfleet, Exobiology, Astrophysicist, Human, Musician, Vulcan, Telepath","nonhuman, male, organic, tos, bridge_crew, first_officer, spock, spock_tos, crew_max_rarity_2","A Practical Idea",2, 3, 8, 10, 8, , , , , , 460, 150, 163, 390, false,"Spock",crew_portraits_cm_spock_brainless_sm.png,spock_brainless_crew
"Garth of Izar",5,5, 1214,226,444,0,0,0,989,156,344,0,0,0,487,83,142,0,0,0,153,22,123,123,82,279,0,758,0,254,157,188,728,0,631,193,68,139,167,130,362,0,779,0,330,254,284,748,0,646,153,248,"Prisoner, Desperate, Human, Brutal, Resourceful, Villain, Shapeshifter, Veteran","organic, male, tos, garth_izar, crew_max_rarity_5","I'm Afraid of No One",0, 8, 6, 8, 10, 1, 0, 2, , , 300, 200, 185, 225, false,"Garth",crew_portraits_cm_garth_izar_sm.png,garth_izar_crew
"Seeking Spock",4,5, 0,0,0,1257,183,448,0,0,0,0,0,0,430,132,295,931,170,326,167,0,0,751,264,163,163,66,17,0,779,239,672,171,74,246,0,0,596,306,235,179,49,26,0,601,309,450,188,78,184,149,"Vulcan, Human, Telepath, Spiritual, Starfleet, Federation, Resourceful, Explorer","nonhuman, male, organic, tos, spock, spock_tos, crew_max_rarity_5","Recommend We Proceed",1, 9, 10, 12, 12, , , , , , 550, 200, 175, 225, false,"Spock",crew_portraits_cm_spock_seeking_sm.png,spock_seeking_crew
"Compromised Airiam",8,5, 0,0,0,940,178,397,1254,198,420,0,0,0,0,0,0,0,0,0,324,293,0,0,0,4,241,356,199,149,295,101,0,0,0,308,352,0,0,0,19,227,332,196,209,359,173,0,0,0,454,477,"Control, Federation, Starfleet, Brutal, Undercover Operative, Human, Engineered, Astrophysicist","evsuit, female, organic, dsc, bridge_crew, airiam, crew_max_rarity_5","Open The Airlock",0, 9, 8, 8, 10, , , , 2, 2, 555, 125, 285, 400, false,"Airiam",crew_portraits_cm_airiam_compromised_sm.png,dsc_airiam_compromised_crew
"Lt. Uhura",4,3, 384,51,129,0,0,0,0,0,0,0,0,0,539,76,178,0,0,0,815,788,751,523,702,0,0,680,0,0,757,0,647,0,548,848,814,774,579,727,0,0,746,0,0,816,0,705,0,610,997,1037,"Human, Starfleet, Federation, Musician, Communicator","bridge_crew, female, organic, tos, uhura, lieutenant, crew_max_rarity_3","Hailing Frequencies Open",1, 5, 6, 10, 12, , , , , , 300, 50, 71, 190, false,"Uhura",crew_portraits_cm_uhura_lt_yellow_sm.png,uhura_lt_yellow_crew
"Rescue Team Uhura",4,5, 984,179,361,0,0,0,1313,166,410,0,0,0,456,113,208,0,0,0,281,8,234,175,191,114,0,740,0,127,70,69,716,0,613,325,85,254,199,240,272,0,665,0,243,142,205,603,0,531,49,216,"Human, Federation, Starfleet, Communicator, Resourceful, Musician, Marksman","bridge_crew, female, organic, tos, uhura, lieutenant_commander, crew_max_rarity_5","Phasers on Setting One. Fire.",2, 7, 6, 3, 8, 7, 0, , , , 540, 225, 68, 150, false,"Uhura",crew_portraits_cm_uhura_rescue_sm.png,uhura_rescue_crew
"Sulu of the Body",8,4, 612,111,266,0,0,0,0,0,0,0,0,0,910,153,301,0,0,0,564,594,508,154,457,0,0,428,0,0,517,0,372,0,323,546,586,473,213,451,0,0,488,0,0,561,0,409,0,387,829,824,"Human, Federation, Starfleet, Diplomat, Pilot, Archon","male, organic, tos, bridge_crew, sulu, crew_max_rarity_4","Paradise, My Friend, Paradise",1, 6, 8, 8, 12, 6, 0, , , , 615, 270, 168, 475, false,"Sulu",crew_portraits_cm_sulu_archon_sm.png,sulu_archon_crew
"Lenara Kahn",10,5, 0,0,0,1246,187,421,0,0,0,0,0,0,997,144,301,0,0,0,177,0,0,460,0,174,171,16,116,0,439,0,284,0,263,272,0,0,576,0,258,197,51,176,0,577,0,426,0,398,464,642,"Trill, Astrophysicist, Romantic","nonhuman, female, organic, ds9, lenara, crew_max_rarity_5","I'm Not Like You",1, 10, 8, 8, 8, , , , , , 315, 200, 150, 490, false,"Lenara",crew_portraits_cm_lenara_kahn_sm.png,lenara_kahn_crew
"Torpedo Surgeon McCoy",4,5, 0,0,0,893,148,332,0,0,0,593,29,70,0,0,0,1254,142,484,417,0,649,0,63,404,99,447,20,610,0,84,664,10,139,424,0,861,0,167,406,223,445,29,785,0,178,891,52,216,233,483,"Federation, Starfleet, Human, Physician, Exobiology, Desperate, Jury Rigger","male, organic, tos, lieutenant_commander, mccoy, crew_max_rarity_5","Lock and Load",2, 8, 4, 6, 8, 1, 0, , , , 300, 230, 86, 250, true,"McCoy",crew_portraits_cm_mccoy_torpedo_sm.png,mccoy_torpedo_crew
"Scared Scotty",4,4, 0,0,0,0,0,0,381,89,175,871,114,238,639,59,128,0,0,0,0,774,396,697,0,792,331,630,0,151,419,650,57,229,507,0,714,533,860,0,697,381,828,0,222,550,594,314,318,693,624,853,"Human, Starfleet, Federation, Jury Rigger, Desperate","male, organic, tos, scott, crew_max_rarity_4","I Don't Remember",1, 5, 12, 10, 12, 0, 1, , , , 370, 145, 17, 250, false,"Scotty",crew_portraits_cm_scotty_scared_sm.png,scott_scared_crew
"Talas",6,5, 510,73,159,0,0,0,958,151,327,1273,208,375,0,0,0,0,0,0,725,191,35,766,618,319,151,0,0,17,463,232,140,59,0,766,287,83,792,658,392,221,0,0,27,518,317,266,141,0,163,359,"Andorian, Imperial Guard, Saboteur, Romantic, Tactician, Crafty","nonhuman, female, organic, ent, talas, lieutenant, crew_max_rarity_5","It's Not The Weapon, It's The Soldier",2, 6, 10, 10, 18, 2, 0, , , , 1475, 200, 115, 415, false,"Talas",crew_portraits_cm_talas_sm.png,talas_crew
"EV Suit Chekov",7,4, 379,58,169,661,62,141,0,0,0,0,0,0,925,129,248,0,0,0,290,781,737,286,687,592,416,103,364,0,528,0,391,0,334,483,765,722,425,671,813,532,328,493,0,662,0,522,0,474,565,852,"Federation, Starfleet, Human, Resourceful, Tactician","male, evsuit, organic, tos, lieutenant, bridge_crew, chekov, crew_max_rarity_4","We've Got To Get Out Of Here",1, 7, 14, 12, 14, 5, 0, , , , 380, 50, 70, 400, false,"Chekov",crew_portraits_cm_chekov_evsuit_sm.png,chekov_evsuit_crew
"Laborer Kirk",3,5, 1013,107,294,0,0,0,0,0,0,1292,210,476,496,65,151,0,0,0,306,409,3,202,224,0,125,753,0,111,813,0,29,33,625,510,562,15,403,425,0,151,794,0,173,881,0,55,71,663,72,368,"Human, Federation, Starfleet, Jury Rigger, Resourceful, Romantic, Thief, Desperate","male, organic, tos, captain, bridge_crew, kirk, crew_max_rarity_5","How Are The Stone Knives And Bearskins?",2, 7, 8, 8, 12, 2, 0, , , , 200, 200, 147, 375, false,"Kirk",crew_portraits_cm_kirk_laborer_sm.png,kirk_laborer_crew
"Dress Uniform Beverly Crusher",8,4, 0,0,0,0,0,0,0,0,0,0,0,0,611,73,245,810,172,428,0,0,0,673,314,0,0,601,243,0,688,298,567,207,59,0,0,0,700,192,0,0,668,179,0,724,198,607,116,79,848,764,"Human, Starfleet, Federation, Physician, Caregiver, Cyberneticist","female, organic, tng, commander, crusher, crew_max_rarity_4","The Bride and Groom",2, 8, 10, 6, 12, , , , , , 400, 195, 217, 415, false,"Crusher",crew_portraits_cm_crusher_dress_uniform_sm.png,crusher_dress_uniform_crew
"Ishan Chaye Sisko",2,5, 0,0,0,0,0,0,496,93,293,1284,247,490,987,120,226,0,0,0,0,676,85,508,0,641,121,400,0,37,150,518,6,28,300,0,574,119,677,0,506,123,636,0,20,252,432,26,51,504,38,208,"Bajoran, Resourceful, Desperate, Undercover Operative, Civilian, Investigator","male, organic, ds9, captain, bridge_crew, sisko, crew_max_rarity_5","We're Not Who We Seem To Be",1, 9, 6, 10, 10, , , , , , 200, 220, 160, 380, false,"Sisko",crew_portraits_cm_sisko_ishan_chaye_sm.png,sisko_ishan_chaye_crew
"Saowin",10,4, 0,0,0,874,171,371,0,0,0,671,94,219,0,0,0,0,0,0,405,0,487,0,0,396,68,438,240,479,0,0,536,298,0,340,0,599,0,0,330,84,373,217,569,0,0,617,360,0,826,812,"Desperate, Resourceful, Ambassador, Civilian","male, organic, nonhuman, voy, saowin, crew_max_rarity_4","I Have Some Bad News",1, 7, 6, 8, 10, 3, 0, 2, , , 400, 50, 96, 474, false,"Saowin",crew_portraits_cm_saowin_sm.png,saowin_crew
"Dejaren",4,4, 566,157,355,380,54,148,877,159,388,0,0,0,0,0,0,0,0,0,257,143,488,637,436,108,553,817,495,337,503,278,0,0,0,169,99,291,492,271,132,531,810,491,277,450,236,0,0,0,526,388,"Brutal, Hologram, Crafty, Desperate, Saboteur","male, artificial_life, nonhuman, voy, dejaren, crew_max_rarity_4","You're Getting Blood Everywhere",0, 7, 6, 8, 12, 1, 0, , , , 140, 125, 137, 300, false,"Dejaren",crew_portraits_cm_dejaren_sm.png,dejaren_crew
"Dr. 'Bones' McCoy",5,5, 0,0,0,0,0,0,0,0,0,0,0,0,0,0,0,1641,98,360,0,0,0,0,21,0,0,0,50,0,0,32,0,15,57,0,0,0,0,358,0,0,0,272,0,0,354,0,213,373,846,1018,"Federation, Starfleet, Human, Physician, Resourceful, Exobiology","male, organic, tos, lieutenant_commander, mccoy, crew_max_rarity_5","I'm A Doctor!",2, 8, 6, 10, 14, 3, 0, 3, , , 700, 325, 291, 325, false,"McCoy",crew_portraits_cm_mccoy_doctor_sm.png,mccoy_doctor_crew
"Arandis",9,4, 649,82,207,0,0,0,0,0,0,0,0,0,936,85,208,0,0,0,572,601,515,171,468,0,0,469,0,0,555,0,413,0,351,668,695,625,442,580,0,0,707,0,0,766,0,651,0,568,849,972,"Resourceful, Inspiring, Communicator, Civilian, Romantic, Risian","female, nonhuman, organic, ds9, arandis, crew_max_rarity_4","Risa Will Be Waiting",1, 5, 4, 8, 12, 3, 0, 3, , , 405, 50, 33, 440, true,"Arandis",crew_portraits_cm_arandis_sm.png,arandis_crew
"Captain Lucero",7,4, 661,108,235,858,172,324,0,0,0,0,0,0,352,80,162,0,0,0,65,584,482,424,432,430,315,205,259,0,881,0,802,0,694,96,618,529,435,493,387,271,182,247,0,838,0,720,0,625,540,602,"Human, Federation, Starfleet, Tribbled, Survivalist, Explorer, Resourceful","female, organic, dsc, lucero, crew_max_rarity_4","He's an Idiot",2, 8, 6, 8, 10, 5, 0, , , , 525, 200, 110, 390, false,"Lucero",crew_portraits_cm_lucero_captain_sm.png,dsc_lucero_captain_crew
"Admiral Maxwell Forrest",5,5, 1256,220,470,0,0,0,0,0,0,430,102,236,1002,151,312,0,0,0,126,266,33,11,50,0,503,336,0,648,430,0,54,420,257,180,302,27,60,123,0,388,478,0,536,552,0,89,329,376,100,186,"Human, Diplomat, Starfleet, Ambassador","male, organic, ent, forrest, admiral, crew_max_rarity_5","It's Time to Swim",1, 7, 8, 8, 14, 2, 0, , , , 405, 320, 100, 425, false,"Forrest",crew_portraits_cm_forrest_admiral_sm.png,forrest_admiral_crew
"Belle Q",8,5, 982,98,243,452,75,166,0,0,0,0,0,0,1286,210,438,0,0,0,105,466,343,27,291,771,524,70,477,0,248,0,106,0,119,295,622,534,138,496,757,501,108,453,0,355,0,186,0,205,244,446,"Q Continuum, Costumed, Romantic, Resourceful, Crafty","female, organic, tng, nonhuman, miss_q, crew_max_rarity_5","They're Using Our Weapons",0, 9, 8, 8, 10, , , , , , 400, 320, 211, 390, false,"Q",crew_portraits_cm_miss_q_civil_war_sm.png,miss_q_civil_war_crew
"Mycelial Culber",2,5, 449,93,303,869,198,423,0,0,0,0,0,0,0,0,0,1291,237,550,87,703,641,739,6,363,281,407,3,0,0,46,0,25,92,40,569,445,614,7,245,185,279,7,0,0,96,0,37,117,35,54,"Human, Physician, Romantic, Federation, Starfleet, Desperate","male, organic, dsc, culber, crew_max_rarity_5","You Have to Let Me Go",0, 9, 6, 6, 6, , , , 1, 3, 400, 200, 148, 500, false,"Culber",crew_portraits_cm_culber_mycelial_sm.png,dsc_culber_mycelial_crew
"Commander Shelby",10,4, 855,128,259,0,0,0,643,80,169,0,0,0,0,0,0,0,0,0,453,195,392,568,339,567,0,0,0,510,690,461,0,0,0,534,337,459,626,439,722,0,0,0,622,809,613,0,0,0,867,942,"Gambler, Starfleet, Federation, Human, Tactician, Desperate","female, organic, tng, shelby, crew_max_rarity_4","Impossible!",1, 7, 8, 10, 8, , , , , , 475, 200, 153, 325, false,"Shelby",crew_portraits_cm_shelby_commander_sm.png,shelby_commander_crew
"Tourist Worf",3,3, 533,62,160,0,0,0,386,56,160,0,0,0,0,0,0,0,0,0,696,477,644,743,596,801,0,0,0,693,865,656,0,0,0,784,521,727,807,675,774,0,0,0,672,860,656,0,0,0,995,1028,"Federation, Starfleet, Klingon, Saboteur, Romantic","male, nonhuman, organic, ds9, bridge_crew, worf, crew_max_rarity_3","I Didn't Bring A Bathing Suit",1, 4, 10, 8, 10, 1, 2, , , , 25, 100, 173, 90, false,"Worf",crew_portraits_cm_worf_tourist_sm.png,worf_tourist_crew
"Control Leland",3,5, 1254,233,394,0,0,0,1067,103,198,0,0,0,658,49,86,0,0,0,138,26,115,84,66,294,0,633,0,274,120,208,601,0,510,231,158,164,265,155,633,0,878,0,567,570,550,853,0,741,25,598,"Section 31, Undercover Operative, Crafty, Control, Brutal, Human","nonhuman, male, organic, dsc, leland, crew_max_rarity_5","Get Me That Data",0, 8, 6, 8, 10, , , , 2, 3, 265, 210, 153, 475, false,"Leland",crew_portraits_cm_leland_control_sm.png,dsc_leland_control_crew
"Leucon",2,5, 0,0,0,974,210,435,490,96,200,1268,295,448,0,0,0,0,0,0,275,713,91,0,0,50,2,317,172,39,781,575,86,32,0,228,684,116,0,0,61,6,258,156,33,741,561,122,50,0,17,94,"Civilian, Brunali, Botanist, Desperate, Jury Rigger, Geneticist","male, organic, voy, leucon, crew_max_rarity_5","You Can Make A Difference Here",1, 9, 8, 10, 12, , , , , , 445, 100, 140, 365, false,"Leucon",crew_portraits_cm_leucon_sm.png,leucon_crew
"Annika Hansen Seven",5,5, 565,38,88,1021,107,251,0,0,0,1303,161,317,0,0,0,0,0,0,86,722,39,762,614,341,19,386,208,159,0,0,162,65,0,413,853,206,910,782,564,94,612,344,367,0,0,375,205,0,212,723,"Human, Civilian, Federation, Astrophysicist, Romantic","female, organic, voy, bridge_crew, seven, crew_max_rarity_5","I'm Sure You'll Adapt",0, 9, 6, 6, 10, , , , , , 375, 200, 250, 400, false,"Seven",crew_portraits_cm_seven_annika_sm.png,seven_annika_crew
"Twilight T'Pol",4,5, 0,0,0,951,90,222,403,186,378,0,0,0,0,0,0,1034,240,792,431,678,0,0,81,71,314,465,23,572,744,14,0,60,153,649,403,0,0,28,81,412,674,11,259,429,4,0,12,51,242,32,"Vulcan, Astrophysicist, Telepath, Caregiver, Civilian","nonhuman, female, organic, ent, first_officer, bridge_crew, tpol, crew_max_rarity_5","Target Their Engines",2, 10, 12, 10, 10, , , , 0, 2, 225, 125, 120, 250, false,"T'Pol",crew_portraits_cm_tpol_twilight_sm.png,tpol_twilight_crew
"Picard and Number One",2,5, 527,79,177,1328,234,497,0,0,0,0,0,0,967,154,330,0,0,0,34,697,636,179,584,89,115,2,79,0,450,0,293,0,271,50,725,679,287,626,159,124,21,118,0,525,0,368,0,350,24,209,"Human, Astrophysicist, Inspiring, Civilian, Cultural Figure, Federation, Gardener, Veteran","male, organic, pic, admiral, bridge_crew, picard, crew_max_rarity_5","Old Dogs",1, 8, 6, 8, 10, 6, 0, , , , 300, 235, 130, 300, false,"Picard",crew_portraits_cm_picard_numberone_sm.png,picard_numberone_crew
"Doctor Paul Stubbs",9,4, 0,0,0,856,150,370,0,0,0,659,118,275,0,0,0,0,0,0,425,0,474,0,0,423,69,458,254,472,0,0,531,294,0,369,0,467,0,0,358,71,406,231,463,0,0,505,275,0,827,772,"Astrophysicist, Human, Federation, Innovator, Civilian","male, organic, tng, stubbs, crew_max_rarity_4","I Would Rather Die Than Leave",2, 8, 6, 8, 8, , , , 1, 2, 600, 170, 170, 225, false,"Stubbs",crew_portraits_cm_stubbs_sm.png,stubbs_crew
"Mission Specialist Lefler",7,4, 0,0,0,661,96,192,0,0,0,858,86,214,390,73,145,0,0,0,578,0,418,832,0,547,87,311,344,423,861,0,185,250,675,681,0,624,829,0,676,217,419,404,588,876,0,334,377,661,620,857,"Human, Federation, Starfleet, Romantic, Innovator, Resourceful, Tactician","female, organic, tng, lefler, crew_max_rarity_4","Always Watch Your Back",1, 6, 5, 8, 10, 3, 0, 3, , , 200, 50, 141, 325, false,"Lefler",crew_portraits_cm_lefler_robin_sm.png,lefler_robin_crew
"Mirror Burnham",2,4, 355,36,112,0,0,0,642,121,232,0,0,0,892,166,328,0,0,0,869,387,803,310,753,534,0,427,0,482,115,425,370,0,322,887,452,816,384,771,554,0,436,0,493,172,473,359,0,344,546,688,"Mirror Universe, Undercover Operative, Federation, Starfleet, Civilian, Astrophysicist, Xenoanthropology, Human","female, organic, dsc, burnham, crew_max_rarity_4","The Old Michael Burnham is Dead",0, 9, 6, 10, 10, , , , , , 495, 200, 145, 440, false,"Burnham",crew_portraits_cm_burnham_mirror_sm.png,dsc_burnham_mirror_crew
"Lt. Ilia",10,4, 664,106,231,864,156,339,0,0,0,0,0,0,0,0,0,0,0,0,64,583,481,633,431,427,312,462,257,0,0,0,0,0,0,98,631,543,676,505,389,273,429,249,0,0,0,0,0,0,834,823,"Deltan, Federation, Starfleet, Romantic","female, nonhuman, organic, tos, ilia, crew_max_rarity_4","Navigational Deflectors Online",1, 8, 8, 6, 8, , , , , , 475, 200, 191, 415, false,"Ilia",crew_portraits_cm_ilia_lt_sm.png,ilia_lt_crew
"Age of Sail Worf",3,5, 962,139,356,0,0,0,1334,161,358,0,0,0,503,87,189,0,0,0,309,17,268,187,229,118,0,696,0,131,66,74,668,0,569,391,115,314,259,296,335,0,720,0,309,203,267,674,0,586,83,354,"Klingon, Tactician, Federation, Starfleet, Costumed","ageofsail, nonhuman, male, organic, tng, bridge_crew, worf, crew_max_rarity_5","I am Prepared",1, 7, 8, 8, 10, 4, 1, , , , 380, 170, 200, 475, false,"Worf",crew_portraits_cm_worf_ageofsail_sm.png,worf_ageofsail_crew
"Arjin",8,4, 597,101,222,836,177,394,0,0,0,0,0,0,379,65,135,0,0,0,73,628,544,449,505,414,305,189,247,0,877,0,789,0,685,72,648,560,488,525,294,228,162,198,0,891,0,782,0,682,578,588,"Civilian, Pilot, Astrophysicist, Trill","male, organic, ds9, nonhuman, arjin, crew_max_rarity_4","It's... Interesting",2, 9, 8, 6, 8, , , 2, , , 350, 200, 125, 430, false,"Arjin",crew_portraits_cm_arjin_sm.png,arjin_crew
"Lt. Commander Icheb",4,5, 0,0,0,1272,207,433,471,101,151,980,141,310,0,0,0,0,0,0,149,746,284,0,0,33,10,199,97,75,821,609,297,159,0,237,729,387,0,0,80,30,260,159,154,803,607,415,231,0,195,325,"Civilian, Brunali, Borg, Astrophysicist, Prodigy, Innovator, Federation","male, organic, voy, icheb, crew_max_rarity_5","I Never Told",1, 10, 6, 10, 10, , , , , , 500, 150, 138, 415, false,"Icheb",crew_portraits_cm_icheb_lt_commander_sm.png,icheb_lt_commander_crew
"Tau",7,4, 0,0,0,342,72,156,894,130,308,0,0,0,651,109,220,0,0,0,852,490,0,648,0,149,575,321,517,361,126,300,547,0,468,785,519,0,692,0,192,510,357,468,396,224,368,585,0,522,555,685,"Crafty, Saboteur, Criminal, Scoundrel, Resourceful","male, organic, nonhuman, voy, tau, crew_max_rarity_4","I'd Hate to Make Your Life Difficult",0, 6, 8, 10, 10, 4, 1, , , , 315, 200, 90, 300, false,"Tau",crew_portraits_cm_tau_sm.png,tau_crew
"Age of Sail Troi",3,4, 353,76,161,0,0,0,0,0,0,0,0,0,596,150,298,776,208,426,820,792,758,431,69,0,0,584,248,0,667,311,544,212,52,759,751,708,327,51,0,0,501,161,0,574,171,422,93,41,542,346,"Human, Betazoid, Costumed, Empath, Counselor, Starfleet, Federation","ageofsail, nonhuman, female, organic, tng, troi, crew_max_rarity_4","Answer Him!",0, 9, 8, 6, 10, , , , , , 400, 230, 115, 450, false,"Troi",crew_portraits_cm_troi_ageofsail_sm.png,troi_ageofsail_crew
"North Star T'Pol",4,5, 1281,187,412,972,120,248,0,0,0,0,0,0,524,99,196,0,0,0,15,273,107,90,57,385,293,124,235,0,755,0,643,0,544,53,376,194,170,180,547,361,242,336,0,761,0,645,0,564,155,403,"Vulcan, Starfleet, Astrophysicist, Telepath, Costumed","nonhuman, female, organic, ent, first_officer, bridge_crew, tpol, crew_max_rarity_5","I've Confirmed They Are Human",1, 9, 4, 8, 8, , , , , , 465, 100, 90, 470, false,"T'Pol",crew_portraits_cm_tpol_north_star_sm.png,tpol_north_star_crew
"Riker Odan",4,5, 510,88,190,1290,189,408,0,0,0,0,0,0,998,92,252,0,0,0,37,701,638,203,588,151,155,21,99,0,490,0,335,0,293,82,703,639,402,594,268,210,96,183,0,692,0,567,0,507,170,461,"Human, Trill, Federation, Starfleet, Ambassador, Maverick, Gambler, Romantic","male, organic, tng, nonhuman, riker, crew_max_rarity_5","For the Greater Good",2, 10, 10, 8, 10, , , , , , 600, 115, 142, 350, false,"Riker",crew_portraits_cm_riker_odan_sm.png,riker_odan_crew
"Relaxed Number One",7,4, 339,52,129,673,73,166,0,0,0,0,0,0,914,136,356,0,0,0,318,829,802,295,752,559,399,89,348,0,497,0,349,0,304,495,812,772,342,725,760,502,189,454,0,520,0,361,0,345,558,768,"Federation, Starfleet, Human, Resourceful, Explorer, Musician, Casual","female, organic, dsc, bridge_crew, lieutenant, number_one, crew_max_rarity_4","I Am The Very Model Of A Modern Major General",0, 8, 8, 8, 10, , , , , , 450, 175, 150, 450, false,"Number One",crew_portraits_cm_number_one_relaxed_sm.png,dsc_number_one_relaxed_crew
"Claymore Scotty",5,5, 0,0,0,0,0,0,1006,106,234,1307,195,387,516,72,136,0,0,0,0,451,104,781,0,345,138,728,0,12,177,257,32,48,604,0,617,238,841,0,572,225,809,0,63,461,489,96,142,675,160,551,"Human, Starfleet, Federation, Jury Rigger, Duelist","male, organic, tos, scott, crew_max_rarity_5","This is War",0, 9, 8, 6, 8, , , , , , 375, 270, 275, 450, false,"Scotty",crew_portraits_cm_scotty_claymore_sm.png,scott_claymore_crew
"1701 Bashir",3,4, 0,0,0,364,57,135,595,123,240,0,0,0,0,0,0,814,174,316,846,615,0,0,335,286,572,841,119,504,682,33,0,220,366,837,601,0,0,318,297,546,821,137,479,664,68,0,195,339,622,626,"Human, Starfleet, Federation, Undercover Operative, Cyberneticist, Physician, Engineered, Tribbled","nonhuman, male, organic, ds9, bashir, crew_max_rarity_4","I'm a Doctor, Not a Historian",2, 8, 8, 6, 10, , , , , , 400, 100, 160, 475, false,"Bashir",crew_portraits_cm_bashir_1701_sm.png,bashir_1701_crew
"Seamus",10,4, 0,0,0,0,0,0,872,171,395,0,0,0,579,148,299,0,0,0,0,468,0,655,0,365,0,590,0,330,116,274,554,0,470,0,402,0,575,0,287,0,502,0,258,95,220,424,0,395,819,667,"Human, Hologram, Civilian, Romantic, Interrogator","organic, voy, male, seamus, artificial_life, crew_max_rarity_4","Saints Preserve Us",1, 7, 6, 6, 6, , , , 0, 2, 315, 165, 147, 450, false,"Seamus",crew_portraits_cm_seamus_sm.png,seamus_crew
"Mirror Keyla Detmer",7,5, 1029,154,348,0,0,0,1308,222,451,0,0,0,0,0,0,0,0,0,262,4,217,432,179,94,0,0,0,105,228,53,0,0,0,381,67,305,498,287,176,0,0,0,159,292,134,0,0,0,424,481,"Mirror Universe, Human, Terran Empire, Brutal","female, organic, dsc, detmer, crew_max_rarity_5","Terran Law Is Binding",0, 8, 8, 6, 12, 1, 0, 2, , , 400, 240, 105, 525, false,"Detmer",crew_portraits_cm_detmer_mirror_sm.png,dsc_detmer_mirror_crew
"Tee Time Doctor",2,4, 0,0,0,0,0,0,344,74,158,0,0,0,920,186,387,658,67,176,0,804,0,470,477,835,0,357,345,721,221,186,299,318,46,0,757,0,455,645,758,0,337,443,651,206,325,273,417,106,525,637,"Hologram, Federation, Musician, Starfleet, Costumed, Athlete, Physician, Human","nonhuman, male, artificial_life, voy, emh, crew_max_rarity_4","The Back Nine at Gedi Prime?",2, 9, 6, 10, 10, , , , , , 500, 200, 40, 305, false,"Doctor",crew_portraits_cm_emh_caddy_sm.png,emh_caddy_crew
