crew, tier, rarity, CMD_core, CMD_min, CMD_max, SCI_core, SCI_min, SCI_max, SEC_core, SEC_min, SEC_max, ENG_core, ENG_min, ENG_max, DIP_core, DIP_min, DIP_max, MED_core, MED_min, MED_max, V_CMD_SCI, V_CMD_SEC, V_CMD_ENG, V_CMD_DIP, V_CMD_MED, V_SCI_SEC, V_SCI_ENG, V_SCI_DIP, V_SCI_MED, V_SEC_ENG, V_SEC_DIP, V_SEC_MED, V_ENG_DIP, V_ENG_MED, V_DIP_MED, G_CMD_SCI, G_CMD_SEC, G_CMD_ENG, G_CMD_DIP, G_CMD_MED, G_SCI_SEC, G_SCI_ENG, G_SCI_DIP, G_SCI_MED, G_SEC_ENG, G_SEC_DIP, G_SEC_MED, G_ENG_DIP, G_ENG_MED, G_DIP_MED, voyage_rank, gauntlet_rank, traits, hidden_traits, action_name, action_bonus_type, action_bonus_amount, action_initial_cooldown, action_duration, action_cooldown, bonus_ability, trigger, uses_per_battle, penalty_type, penalty_amount, accuracy, crit_bonus, crit_chance, evasion, charge_phases, short_name, image_name, symbol
"Investigator Odo",0,1, 0,0,0,0,0,0,217,37,171,0,0,0,0,0,0,0,0,0,0,1317,0,0,0,1371,0,0,0,1202,1452,1098,0,0,0,0,1227,0,0,0,1230,0,0,0,1103,1373,1005,0,0,0,1661,1655,"Changeling, Cardassian, Investigator, Interrogator, Shapeshifter","nonhuman, male, organic, ds9, odo, crew_max_rarity_1","Collaboration",2, 1, 20, 14, 10, , , , , , 400, 115, 67, 265, false,"Odo",crew_portraits_cm_odooccupation_sm.png,odo_occupation_crew
"Constable Odo",0,3, 317,107,225,0,0,0,523,27,85,0,0,0,0,0,0,0,0,0,1268,855,1193,1337,1075,1170,0,0,0,1053,1308,936,0,0,0,950,826,892,1090,775,1371,0,0,0,1194,1459,1096,0,0,0,1552,1570,"Changeling, Bajoran, Constable, Investigator, Interrogator, Shapeshifter","nonhuman, male, organic, ds9, odo, crew_max_rarity_3","Justice",0, 6, 10, 12, 16, , , , 3, 800, 520, 300, 75, , false,"Odo",crew_portraits_cm_odostandard_sm.png,odo_constable_crew
"Ensign Ro",0,2, 322,46,132,0,0,0,0,0,0,0,0,0,0,0,0,0,0,0,1354,1301,1283,1401,1166,0,0,0,0,0,0,0,0,0,0,1315,1275,1242,1368,1124,0,0,0,0,0,0,0,0,0,0,1656,1659,"Starfleet, Bajoran, Resourceful","nonhuman, female, organic, tng, ro, crew_max_rarity_2","Separate Ways",0, 4, 3, 10, 5, , , 2, , , 130, 210, 13, 200, false,"Ro",crew_portraits_cm_roensign_sm.png,ro_ensign_crew
"Shinzon",0,5, 819,94,241,0,0,0,938,183,435,0,0,0,546,176,390,0,0,0,818,193,746,378,612,527,0,936,0,483,172,354,904,0,754,946,209,887,247,772,365,0,551,0,357,61,246,483,0,412,758,211,"Human, Clone, Reman, Villain, Romulan, Brutal, Crafty, Politician, Veteran, Vengeful","male, organic, tng, shinzon, crew_max_rarity_5","Destiny Complete",0, 7, 14, 3, 14, 1, 2, , , , 1325, 545, 365, 1050, false,"Shinzon",crew_portraits_cm_shinzon_sm.png,shinzon_crew
"Will Riker",0,1, 251,42,110,0,0,0,125,22,74,0,0,0,0,0,0,0,0,0,1371,1218,1307,1422,1185,1401,0,0,0,1223,1481,1124,0,0,0,1346,1142,1273,1397,1162,1385,0,0,0,1209,1471,1107,0,0,0,1648,1640,"Human, Federation, Starfleet, Maverick, Gambler, Romantic","male, organic, tng, riker, crew_max_rarity_1","Poker Face",0, 1, 8, 10, 14, 4, 0, , , , 455, , 425, 340, false,"Riker",crew_portraits_cm_rikers1_sm.png,riker_s1_commander_crew
"Commander Riker",0,2, 279,78,191,0,0,0,124,29,89,0,0,0,290,22,64,0,0,0,1351,1173,1281,1111,1163,1397,0,1354,0,1219,1336,1120,1350,0,1162,1086,909,1043,1042,918,1368,0,1387,0,1193,1382,1094,1384,0,1188,1590,1552,"Human, Federation, Starfleet, Pilot, Maverick, Gambler, Romantic, Playful","male, organic, tng, riker, crew_max_rarity_2","Liase",0, 2, 8, 10, 14, 5, 0, , , , 645, 50, 295, 275, false,"Riker",crew_portraits_cm_rikerpoker_sm.png,riker_s2_commander_crew
"Edith Keeler",0,4, 0,0,0,0,0,0,0,0,0,0,0,0,453,166,339,591,187,590,0,0,0,1145,620,0,0,1024,464,0,1188,619,995,420,196,0,0,0,779,116,0,0,652,126,0,776,135,573,57,17,1462,665,"Civilian, Caregiver, Inspiring, Cultural Figure, Romantic, Human","female, organic, tos, keeler, crew_max_rarity_4","A Life Worth Living",1, 7, 8, 10, 8, , , , , , 690, 25, 52, 440, false,"Keeler",crew_portraits_cm_edithkeeler_sm.png,keeler_crew
"Ensign Tuvok",0,1, 0,0,0,181,51,197,0,0,0,0,0,0,138,33,74,0,0,0,1389,0,0,1461,0,1381,1059,1256,877,0,1477,0,1393,0,1200,1163,0,0,1437,0,1127,846,959,692,0,1465,0,1364,0,1170,1651,1610,"Vulcan, Federation, Starfleet, Telepath","nonhuman, male, organic, voy, tuvok, crew_max_rarity_1","Memory",0, 1, 1, 14, 10, , , , , , 103, 60, 135, 375, false,"Tuvok",crew_portraits_cm_tuvokensign_sm.png,tuvok_ensign_crew
"Security Chief Tuvok",0,3, 291,53,161,145,45,149,445,85,201,0,0,0,0,0,0,0,0,0,1135,892,1295,1403,1175,861,1071,1389,887,1050,1306,935,0,0,0,814,709,1188,1307,1063,625,982,1277,818,942,1215,855,0,0,0,1530,1453,"Vulcan, Federation, Starfleet, Telepath, Tactician, Investigator","nonhuman, male, organic, voy, tuvok, crew_max_rarity_3","Contingency Plan",0, 4, 10, 12, 16, 5, 0, , , , 465, 50, , 300, false,"Tuvok",crew_portraits_cm_tuvokrifle_sm.png,tuvok_rifle_crew
"Major Kira",0,2, 273,37,126,0,0,0,304,60,176,0,0,0,0,0,0,0,0,0,1362,993,1299,1411,1176,1334,0,0,0,1169,1428,1064,0,0,0,1333,893,1258,1381,1144,1153,0,0,0,1033,1316,940,0,0,0,1613,1593,"Bajoran, Veteran, Resourceful","nonhuman, female, organic, ds9, kira, crew_max_rarity_2","Obstinance",0, 2, 0, 10, 14, 6, 0, , , , 295, 150, 5, , true,"Kira",crew_portraits_cm_kirashorthair_sm.png,kira_major_shorthair_crew
"Mirror Intendant Kira",0,5, 512,183,363,0,0,0,1052,272,542,0,0,0,946,67,184,0,0,0,945,192,876,345,762,397,0,805,0,376,78,255,753,0,614,521,42,444,351,353,156,0,1154,0,174,98,108,1133,0,963,599,160,"Bajoran, Cardassian, Klingon, Villain, Klingon-Cardassian Alliance, Brutal, Mirror Universe, Crafty","nonhuman, female, organic, ds9, kira, crew_max_rarity_5","Instability",0, 6, 6, 10, 12, 4, 0, , , , 915, 225, 90, 1525, true,"Kira",crew_portraits_cm_kiraintendant_sm.png,kira_mirror_crew
"Security Chief Worf",0,2, 205,57,144,0,0,0,326,61,145,0,0,0,0,0,0,0,0,0,1386,1031,1317,1434,1196,1325,0,0,0,1164,1421,1057,0,0,0,1275,882,1213,1333,1090,1235,0,0,0,1106,1377,1008,0,0,0,1621,1587,"Klingon, Federation, Starfleet, Duelist, Investigator","nonhuman, male, organic, tng, worf, crew_max_rarity_2","They Have No Honor",2, 4, 8, 10, 12, , , , 1, 2, 165, 280, 95, 155, false,"Worf",crew_portraits_cm_worf_sm.png,worf_security_chief_crew
"Defiant Commander Worf",0,4, 364,241,488,0,0,0,609,179,394,0,0,0,0,0,0,0,0,0,1001,474,938,1130,813,821,0,0,0,762,1053,643,0,0,0,229,56,193,439,129,462,0,0,0,432,674,331,0,0,0,1474,559,"Klingon, Federation, Starfleet, Duelist, Tactician, Veteran","nonhuman, male, organic, ds9, worf, crew_max_rarity_4","Good Day to Die",2, 6, 12, 12, 12, 4, 0, , 1, 2, 690, 645, 325, 205, false,"Worf",crew_portraits_cm_worfdefiant_sm.png,worf_defiant_commander_crew
"Mirror Regent Worf",0,5, 861,294,589,0,0,0,1062,175,357,0,0,0,0,0,0,0,0,0,516,125,451,727,337,450,0,0,0,414,663,301,0,0,0,109,34,86,261,55,523,0,0,0,499,733,388,0,0,0,846,313,"Klingon, Cardassian, Tactician, Villain, Brutal, Klingon-Cardassian Alliance, Mirror Universe","nonhuman, male, organic, ds9, worf, crew_max_rarity_5","Position of Strength",0, 9, 8, 8, 10, , , , , , 300, 980, 390, , false,"Worf",crew_portraits_cm_worfmirror_sm.png,worf_mirror_crew
"Yeoman Rand",0,1, 164,15,58,0,0,0,0,0,0,0,0,0,117,19,60,0,0,0,1404,1344,1344,1409,1221,0,0,1399,0,0,1483,0,1401,0,1204,1401,1342,1342,1398,1216,0,0,1390,0,0,1478,0,1389,0,1192,1658,1662,"Federation, Starfleet, Human","female, organic, tos, rand, crew_max_rarity_1","Signature Required",2, 2, 8, 10, 12, , , , 1, 1, 375, , , 180, false,"Rand",crew_portraits_cm_randyeoman_sm.png,rand_yeoman_crew
"The Duras Sisters",0,4, 311,83,205,0,0,0,658,150,385,0,0,0,464,170,341,0,0,0,1310,593,1238,859,1125,805,0,1016,0,746,447,630,983,0,820,1050,328,1008,353,881,520,0,641,0,498,116,384,562,0,471,1299,488,"Klingon, Scoundrel, Villain, Vengeful","nonhuman, female, organic, tng, betor, lursa, exclusive_fusion, crew_max_rarity_4","The Power of Two",0, 9, 10, 20, 12, , , 1, , , 350, 110, 190, 500, false,"Duras Sisters",crew_portraits_cm_duras_sisters_sm.png,duras_sisters_crew
"Persis",0,2, 0,0,0,0,0,0,253,94,250,0,0,0,303,39,88,0,0,0,0,1296,0,1407,0,1335,0,1344,0,1170,1117,1065,1341,0,1153,0,974,0,1421,0,890,0,1350,0,833,842,743,1343,0,1153,1607,1556,"Human, Augments, Engineered, Survivalist, Tactician","nonhuman, female, organic, ent, persis, crew_max_rarity_2","Augmented Strength",0, 2, 6, 10, 6, 7, 0, 2, , , 240, 330, 300, , false,"Persis",crew_portraits_cm_persis_sm.png,persis_crew
"Telek R'Mor",0,2, 0,0,0,347,52,194,119,8,44,0,0,0,263,30,113,0,0,0,1289,1350,0,1420,0,1147,982,952,821,1224,1373,1125,1351,0,1163,1168,1345,0,1407,0,1004,851,900,696,1222,1398,1123,1328,0,1144,1586,1575,"Romulan, Astrophysicist","nonhuman, male, organic, voy, rmor, crew_max_rarity_2","Solitary Survey",1, 3, 10, 12, 10, 0, 2, , , , 405, 50, 3, 180, false,"R'Mor",crew_portraits_cm_telekrmor_sm.png,rmor_voyager_crew
"KDF Gowron",0,4, 375,85,222,0,0,0,296,100,256,0,0,0,641,173,418,0,0,0,1214,888,1146,631,1028,1289,0,883,0,1127,619,1023,845,0,690,1002,477,952,251,834,864,0,516,0,809,176,720,443,0,377,1371,695,"Klingon, Duelist, Diplomat, Politician","nonhuman, male, organic, tng, gowron, crew_max_rarity_4","What Can Be Done",1, 6, 14, 10, 14, 0, 2, , , , 625, 465, 85, 1000, false,"Gowron",crew_portraits_cm_gowronyoung_sm.png,gowron_kdf_crew
"Third Remata'Klan",0,3, 410,42,84,0,0,0,467,85,185,0,0,0,0,0,0,0,0,0,1274,850,1201,1348,1087,1154,0,0,0,1036,1292,919,0,0,0,1368,899,1297,1416,1176,1060,0,0,0,966,1240,878,0,0,0,1550,1596,"Jem'hadar, Dominion, Duelist, Tactician","nonhuman, male, organic, ds9, remataklan, crew_max_rarity_3","Victory is Life",0, 3, 0, 6, 8, 4, 4, , , , 690, 395, 597, 600, true,"Remata'Klan",crew_portraits_cm_remataklan_sm.png,remataklan_crew
"Ensign Chapel",0,1, 0,0,0,0,0,0,0,0,0,0,0,0,0,0,0,214,34,152,0,0,0,0,1194,0,0,0,876,0,0,1104,0,841,1174,0,0,0,0,1118,0,0,0,830,0,0,1042,0,797,1096,1667,1658,"Human, Federation, Starfleet, Nurse","female, organic, tos, chapel, crew_max_rarity_1","Administer Prescription",2, 1, 6, 10, 10, , , , , , 130, , 40, 100, false,"Chapel",crew_portraits_cm_chapelensign_sm.png,chapel_ensign_crew
"Ensign Ogawa",0,1, 0,0,0,0,0,0,0,0,0,0,0,0,0,0,0,213,34,166,0,0,0,0,1191,0,0,0,872,0,0,1102,0,838,1170,0,0,0,0,1102,0,0,0,802,0,0,1028,0,781,1070,1664,1656,"Human, Federation, Starfleet, Nurse","female, organic, tng, ogawa, crew_max_rarity_1","Report to Sickbay",2, 1, 6, 1, 8, 2, 0, 1, , , 170, , 35, 105, false,"Ogawa",crew_portraits_cm_ogawaensign_sm.png,ogawa_ensign_crew
"Wesley Crusher",0,1, 0,0,0,218,43,149,0,0,0,174,32,78,0,0,0,0,0,0,1381,0,1339,0,0,1379,922,1368,873,1217,0,0,1387,854,0,1302,0,1314,0,0,1287,720,1279,822,1198,0,0,1360,842,0,1644,1631,"Human, Federation, Civilian, Prodigy","male, organic, tng, wesley, crew_max_rarity_1","Study",1, 2, 8, 10, 12, , , , 0, 1, 215, 125, 70, 55, false,"Wesley",crew_portraits_cm_wesleysweater_sm.png,wesley_sweater_crew
"Ensign Crusher",0,3, 176,11,31,426,83,229,0,0,0,347,34,78,0,0,0,0,0,0,950,1345,1125,1458,1222,1187,589,1213,748,1185,0,0,1335,825,0,924,1346,1274,1465,1224,969,548,1042,589,1196,0,0,1357,840,0,1535,1558,"Human, Federation, Starfleet, Prodigy, Warp Theorist","male, organic, tng, wesley, crew_max_rarity_3","Rewire",2, 4, 6, 8, 10, 6, 0, , , , 290, , , 190, false,"Wesley",crew_portraits_cm_wesley_sm.png,wesley_full_ensign_crew
"Acting Ensign Crusher",0,2, 114,29,58,258,56,160,0,0,0,251,53,148,0,0,0,0,0,0,1220,1349,1168,1467,1226,1362,716,1346,864,1197,0,0,1346,831,0,1021,1334,1016,1450,1208,1211,553,1224,757,1120,0,0,1253,778,0,1597,1541,"Human, Federation, Starfleet, Prodigy, Resourceful","male, organic, tng, wesley, crew_max_rarity_2","Invention",1, 4, 3, 6, 6, , , 2, , , 205, 50, 25, 165, false,"Wesley",crew_portraits_cm_wesleyensign_sm.png,wesley_acting_ensign_crew
"Formal Dress Wesley Crusher",0,4, 0,0,0,662,173,422,0,0,0,270,108,230,481,160,342,0,0,0,831,0,1265,1127,0,798,319,315,467,1166,1172,0,669,811,817,472,0,889,788,0,440,83,59,268,843,788,0,130,510,486,1296,316,"Human, Federation, Starfleet, Prodigy, Warp Theorist, Festive","male, organic, tng, wesley, crew_max_rarity_4","Duty to the Truth",1, 9, 4, 10, 12, , , , , , 300, 500, 30, 450, false,"Wesley",crew_portraits_cm_wesleydressuniform_sm.png,wesley_formal_dress_crew
"Wrathful Khan",0,5, 1040,206,421,0,0,0,1145,72,143,376,140,288,0,0,0,0,0,0,438,128,131,675,290,518,906,0,0,155,741,344,1195,721,0,367,307,31,592,225,1205,541,0,0,328,1360,988,766,397,0,698,659,"Human, Augments, Engineered, Villain, Cultural Figure, Tactician, Resourceful, Survivalist, Brutal, Vengeful","nonhuman, male, organic, tos, khan, crew_max_rarity_5","I Stab at Thee",2, 9, 12, 5, 12, 1, 0, , , , 640, 595, 345, 850, false,"Khan",crew_portraits_cm_khan_sm.png,khan_wok_crew
"Tailor Garak",0,3, 0,0,0,0,0,0,502,44,126,161,22,44,395,83,219,0,0,0,0,1174,1346,1287,0,1165,1078,1222,0,819,915,933,970,857,1031,0,1281,1344,1143,0,1316,1080,1062,0,1034,843,1054,872,858,862,1511,1529,"Cardassian, Undercover Operative, Scoundrel, Interrogator, Civilian","nonhuman, male, organic, ds9, garak, crew_max_rarity_3","Cutting Cloth",1, 5, 8, 12, 12, , , , , , 125, 230, 20, 405, false,"Garak",crew_portraits_cm_garaktailor_sm.png,garak_tailor_crew
"Bartender Quark",0,1, 110,25,77,0,0,0,81,15,57,0,0,0,211,36,150,0,0,0,1410,1333,1351,1369,1225,1403,0,1371,0,1225,1431,1126,1368,0,1177,1385,1276,1321,1171,1196,1396,0,1285,0,1218,1267,1119,1272,0,1094,1636,1608,"Ferengi, Bartender, Civilian, Scoundrel, Gambler, Merchant","nonhuman, male, organic, ds9, quark, crew_max_rarity_1","Hospitality",1, 2, 8, 10, 12, , , , 2, 1, 165, 10, 10, 140, false,"Quark",crew_portraits_cm_quarkbartender_sm.png,quark_s1_bartender_crew
"Richard Castillo",0,3, 487,109,227,286,57,187,0,0,0,0,0,0,0,0,0,0,0,0,778,1120,1051,1199,923,1349,1044,1336,857,0,0,0,0,0,0,487,983,882,1083,767,1140,860,1173,703,0,0,0,0,0,0,1557,1512,"Human, Hero, Pilot, Starfleet, Federation, Displaced, Romantic","male, organic, castillo, tng, crew_max_rarity_3","Self Sacrifice",0, 5, 12, 12, 10, 7, 0, , 1, 2, 650, 265, 129, 585, false,"Castillo",crew_portraits_cm_richardcastillo_sm.png,castillo_lieutenant_crew
"Writer Jake Sisko",0,3, 0,0,0,0,0,0,0,0,0,0,0,0,451,70,198,0,0,0,0,0,0,1274,0,0,0,1205,0,0,1313,0,1187,0,1016,0,0,0,1200,0,0,0,1112,0,0,1247,0,1083,0,920,1635,1638,"Human, Federation, Civilian, Writer, Gambler, Romantic","male, organic, ds9, jake, crew_max_rarity_3","Construct Story",2, 3, 0, 8, 10, 6, 0, , , , 995, 350, 47, 640, true,"Jake",crew_portraits_cm_jakewriter_sm.png,jake_writer_crew
"CMO Crusher",0,2, 0,0,0,0,0,0,0,0,0,0,0,0,0,0,0,290,52,174,0,0,0,0,1173,0,0,0,858,0,0,1080,0,822,1145,0,0,0,0,1043,0,0,0,737,0,0,967,0,738,1018,1657,1650,"Human, Starfleet, Federation, Physician, Caregiver, Cyberneticist","female, organic, tng, crusher, crew_max_rarity_2","Doctor's Calluses",2, 3, 6, 10, 10, , , , , , 185, , 35, 155, false,"Crusher",crew_portraits_cm_crusherwithlabcoat_sm.png,crusher_labcoat_crew
"Commando Crusher",0,3, 0,0,0,182,76,200,308,93,193,0,0,0,0,0,0,510,44,132,1375,1268,0,0,1003,917,1056,1364,477,1142,1397,576,0,711,995,1083,1084,0,0,1133,478,769,1107,430,943,1218,520,0,805,1109,1502,1424,"Human, Starfleet, Federation, Physician, Cyberneticist, Undercover Operative","female, organic, tng, crusher, crew_max_rarity_3","Repel Disease",0, 3, 6, 3, 12, 1, 0, , , , 575, , 370, 500, false,"Crusher",crew_portraits_cm_crusherblackcommandouniform_sm.png,crusher_black_commando_uniform_crew
"Dr. Crusher",0,4, 275,38,110,0,0,0,437,90,201,0,0,0,0,0,0,736,123,300,1363,910,1300,1412,336,1173,0,0,470,1054,1309,227,0,427,684,1352,836,1280,1399,342,1018,0,0,459,935,1208,167,0,408,673,1385,1322,"Human, Starfleet, Federation, Physician, Cyberneticist","female, organic, tng, crusher, crew_max_rarity_4","Neutralize Disease",1, 7, 12, 12, 12, 4, 4, , , , 740, 250, 370, 500, false,"Crusher",crew_portraits_cm_crusherfromfirstcontact_sm.png,crusher_first_contact_crew
"Holonovel Doctor",0,4, 0,0,0,512,50,137,0,0,0,0,0,0,0,0,0,799,69,244,1185,0,0,0,621,1159,887,1181,182,0,0,620,0,423,679,1310,0,0,0,835,1295,993,1289,345,0,0,808,0,561,834,1482,1546,"Hologram, Human, Federation, Starfleet, Physician, Musician, Scoundrel","nonhuman, male, artificial_life, voy, emh, crew_max_rarity_4","Suggested Treatment",0, 7, 12, 12, 12, , , , , , 365, 370, 205, 525, false,"Doctor",crew_portraits_cm_doctorgolfclub_sm.png,emh_authorauthor_crew
"Mobile Doctor",0,5, 0,0,0,809,106,209,0,0,0,0,0,0,393,137,435,1191,110,334,827,0,0,1185,254,795,592,344,32,0,1215,273,1039,158,75,996,0,0,703,590,962,689,169,135,0,681,593,472,386,73,761,526,"Hologram, Human, Federation, Starfleet, Musician, Physician","nonhuman, male, artificial_life, voy, emh, crew_max_rarity_5","House Call",2, 9, 12, 12, 12, , , , , , 1825, 600, , 600, false,"Doctor",crew_portraits_cm_emhmobile_sm.png,emh_mobileholoemitter_crew
"Comm Officer Uhura",0,1, 0,0,0,0,0,0,0,0,0,0,0,0,258,28,89,0,0,0,0,0,0,1429,0,0,0,1363,0,0,1455,0,1360,0,1168,0,0,0,1428,0,0,0,1360,0,0,1457,0,1353,0,1160,1663,1667,"Federation, Starfleet, Human, Musician, Communicator","female, organic, tos, uhura, crew_max_rarity_1","Incoming Message",2, 2, 8, 10, 12, , , , 1, 1, 320, , , 495, false,"Uhura",crew_portraits_cm_uhurared_sm.png,uhura_red_crew
"Commander Uhura",0,4, 459,128,299,0,0,0,0,0,0,0,0,0,592,198,429,0,0,0,1075,1101,1027,550,893,0,0,891,0,0,1054,0,853,0,695,781,853,698,144,601,0,0,443,0,0,537,0,359,0,297,1481,1023,"Federation, Starfleet, Human, Musician, Communicator","female, organic, tos, uhura, crew_max_rarity_4","Hailing Frequencies",0, 8, 12, 26, 12, , , 1, , , 1165, , 75, 790, false,"Uhura",crew_portraits_cm_uhurawrathofkhan_sm.png,uhura_wrathofkhan_crew
"Dancing Uhura",0,5, 1026,84,195,0,0,0,0,0,0,0,0,0,1185,193,393,0,0,0,671,779,604,113,481,0,0,474,0,0,589,0,395,0,335,1067,1090,1027,289,898,0,0,520,0,0,660,0,452,0,385,842,1316,"Human, Federation, Starfleet, Communicator, Casual, Musician, Artist","female, organic, tos, uhura, original, crew_max_rarity_5","Take The Lead",0, 8, 10, 3, 14, 1, 1, , , , 465, 260, 60, 400, false,"Uhura",crew_portraits_cm_uhura_dancing_sm.png,uhura_dancing_crew
"First Maje Culluh",0,3, 466,93,223,0,0,0,307,42,138,0,0,0,0,0,0,0,0,0,1160,879,1095,1245,975,1352,0,0,0,1184,1438,1081,0,0,0,984,713,928,1109,810,1303,0,0,0,1145,1410,1047,0,0,0,1567,1543,"Kazon, Scoundrel, Vengeful","nonhuman, male, organic, voy, culluh, crew_max_rarity_3","Nistrim Supremacy",2, 3, 6, 10, 10, 8, 4, , , , 665, 325, 133, 390, false,"Culluh",crew_portraits_cm_jalculluh_sm.png,culluh_crew
"KDF Alexander",0,2, 137,19,79,0,0,0,331,64,148,145,16,72,0,0,0,0,0,0,1406,1151,1297,1462,1223,1319,1079,0,0,1016,1409,1048,1395,858,0,1388,1035,1234,1444,1199,1220,1074,0,0,915,1366,994,1381,852,0,1604,1595,"Human, Klingon","male, organic, ds9, alexander, nonhuman, crew_max_rarity_2","Beginner's Luck",1, 3, 10, 12, 10, 5, 2, , , , 130, 200, 62, 15, false,"Alexander",crew_portraits_cm_alexanderkdf_sm.png,alexander_kdf_crew
"Commando Shran",0,4, 673,114,239,0,0,0,592,89,182,0,0,0,318,144,282,0,0,0,879,500,797,665,669,951,0,1228,0,872,751,763,1216,0,1037,910,535,837,386,725,1056,0,849,0,964,424,876,770,0,663,1293,1029,"Andorian, Tactician, Inspiring, Imperial Guard","nonhuman, male, organic, ent, shran, crew_max_rarity_4","Debt Owed",0, 8, 6, 8, 10, , , 3, , , 390, 575, 288, 350, false,"Shran",crew_portraits_cm_shrancommando_sm.png,shran_commando_crew
"Ushaan Shran",0,5, 989,83,164,0,0,0,1076,170,348,0,0,0,424,134,288,0,0,0,726,148,673,421,529,443,0,1138,0,412,211,298,1123,0,948,1152,381,1108,528,980,545,0,854,0,519,179,410,779,0,669,744,812,"Andorian, Duelist, Romantic, Imperial Guard","nonhuman, male, organic, ent, shran, crew_max_rarity_5","Debt Owed",0, 9, 6, 8, 10, , , 3, , , 1440, 565, 483, 390, false,"Shran",crew_portraits_cm_shrandueling_sm.png,shran_dueling_crew
"Fencing Sulu",0,4, 444,99,249,385,36,92,609,203,448,0,0,0,0,0,0,0,0,0,774,523,1111,1256,988,423,1003,1307,838,742,1043,627,0,0,0,657,184,858,1057,742,180,1053,1352,874,309,482,204,0,0,0,1342,883,"Human, Federation, Starfleet, Pilot, Resourceful, Duelist, Athlete, Compromised","male, organic, tos, sulu, crew_max_rarity_4","Parry Attack",0, 6, 12, 8, 12, 6, 4, , , , 415, , 225, 225, false,"Sulu",crew_portraits_cm_sulufencing_sm.png,sulu_fencing_crew
"Morn",0,3, 0,0,0,0,0,0,359,70,174,0,0,0,418,121,295,0,0,0,0,1232,0,1247,0,1279,0,1151,0,1117,943,1014,1138,0,962,0,1149,0,958,0,1128,0,861,0,1017,475,925,790,0,679,1543,1472,"Lurian, Courier, Duelist, Civilian, Gambler, Smuggler","nonhuman, male, organic, ds9, morn, crew_max_rarity_3","Drinking Spot",0, 3, 0, 8, 8, , , , 1, 2, 150, 285, 57, 655, true,"Morn",crew_portraits_cm_morn_sm.png,morn_crew
"Seven in Blue",0,2, 0,0,0,294,51,209,0,0,0,278,53,130,0,0,0,0,0,0,1348,0,1298,0,0,1339,671,1327,850,1193,0,0,1343,829,0,1136,0,1238,0,0,1098,529,1141,669,1140,0,0,1275,798,0,1610,1573,"Human, Borg, Civilian, Federation, Astrophysicist","nonhuman, female, organic, voy, seven, crew_max_rarity_2","Ignore Irrelevancies",1, 2, 8, 10, 14, 4, 0, , , , 75, 50, 310, 170, false,"Seven",crew_portraits_cm_seven_of_nine_sm.png,seven_allblue_crew
"Seven of Nine",0,5, 0,0,0,785,247,791,0,0,0,854,225,454,514,89,183,0,0,0,530,0,600,1204,0,515,52,211,302,589,1247,0,173,293,907,64,0,254,1190,0,65,3,15,43,286,1241,0,84,94,917,739,43,"Human, Borg, Civilian, Federation, Astrophysicist","nonhuman, female, organic, voy, seven, crew_max_rarity_5","New Collective",2, 7, 12, 10, 14, 4, 0, , , , 1750, , 705, 440, false,"Seven",crew_portraits_cm_sevenbluegreyshoulders_sm.png,seven_bluegreyshoulders_crew
"Donik",0,3, 0,0,0,0,0,0,0,0,0,476,79,199,303,31,79,0,0,0,0,0,1121,1408,0,0,884,1347,0,1038,1443,0,830,705,1155,0,0,1034,1436,0,0,766,1368,0,958,1463,0,839,630,1167,1581,1600,"Hirogen, Innovator","nonhuman, male, organic, voy, donik, crew_max_rarity_3","Hunting Program",2, 4, 12, 12, 10, 7, 0, , , , 870, 165, , 340, false,"Donik",crew_portraits_cm_donik_sm.png,donik_crew
"Commander Tucker",0,2, 252,28,82,0,0,0,0,0,0,305,53,185,0,0,0,0,0,0,1384,1321,935,1432,1193,0,1038,0,0,1174,0,0,1324,816,0,1382,1319,868,1435,1192,0,866,0,0,1035,0,0,1160,709,0,1623,1615,"Human, Starfleet, Jury Rigger, Pilot, Explorer","male, organic, ent, tucker, crew_max_rarity_2","Warp Engines Online",1, 2, 6, 3, 8, 2, 0, , , , 520, 35, 50, 165, false,"Trip",crew_portraits_cm_tucker_sm.png,tucker_commander_crew
"Counselor Troi",0,1, 0,0,0,0,0,0,0,0,0,0,0,0,261,42,108,147,49,131,0,0,0,1418,1217,0,0,1353,888,0,1447,1115,1349,852,1024,0,0,0,1400,1128,0,0,1332,838,0,1437,1048,1316,803,807,1638,1624,"Federation, Starfleet, Human, Betazoid, Empath, Counselor","nonhuman, female, organic, tng, troi, crew_max_rarity_1","Counselling",2, 1, 6, 10, 10, , , , , , 265, , 80, 345, false,"Troi",crew_portraits_cm_troitng_sm.png,troi_casualgray_crew
"Rakal Troi",0,4, 521,163,354,0,0,0,525,128,331,0,0,0,0,0,0,407,163,440,951,543,884,1090,235,929,0,0,589,851,1141,261,0,560,827,561,195,489,751,16,667,0,0,248,613,875,29,0,160,357,1215,177,"Federation, Starfleet, Human, Betazoid, Romulan, Empath, Undercover Operative, Tal Shiar","nonhuman, female, organic, tng, troi, crew_max_rarity_4","Romulan Disguise",1, 7, 12, 10, 14, 1, 2, , , , 90, 400, 175, 2825, false,"Troi",crew_portraits_cm_troirakal_sm.png,troi_rakal_crew
"Commander Troi",0,5, 0,0,0,0,0,0,383,203,253,0,0,0,1060,211,421,827,142,281,0,1165,0,667,580,1149,0,515,443,1033,209,138,436,383,44,0,792,0,596,620,677,0,436,460,625,90,88,355,409,60,768,223,"Federation, Starfleet, Human, Betazoid, Empath, Counselor, Playful, Festive","nonhuman, female, organic, tng, troi, crew_max_rarity_5","Empathic Sense",1, 8, 6, 6, 6, , , , , , 1375, 475, 135, 725, true,"Troi",crew_portraits_cm_troifirstcontact_sm.png,troi_firstcontact_crew
"Vedek Winn Adami",0,3, 307,97,207,0,0,0,0,0,0,0,0,0,410,92,214,0,0,0,1302,1264,1230,961,1117,0,0,1218,0,0,1323,0,1207,0,1026,1009,1042,959,624,840,0,0,1052,0,0,1176,0,1008,0,847,1570,1498,"Bajoran, Vedek, Cultural Figure, Spiritual","nonhuman, female, organic, ds9, winn, crew_max_rarity_3","Will of the Prophets",1, 4, 8, 10, 10, 4, 0, , , , , 270, 85, 830, false,"Winn",crew_portraits_cm_winnvedek_sm.png,winn_vedek_crew
"Subcommander T'Pol",0,3, 273,71,211,520,21,77,165,35,77,0,0,0,0,0,0,0,0,0,821,1143,1282,1400,1164,882,909,1216,750,1218,1473,1117,0,0,0,858,900,1022,1175,892,1229,1070,1378,886,1195,1460,1097,0,0,0,1532,1547,"Vulcan, High Command, Astrophysicist, Telepath, Starfleet","nonhuman, female, organic, ent, tpol, crew_max_rarity_3","Logic",2, 5, 6, 10, 10, , , , , , 175, 120, 3, 100, false,"T'Pol",crew_portraits_cm_tpol_sm.png,tpol_subcommander_crew
"Commander T'Pol",0,4, 512,112,307,692,56,171,320,91,227,0,0,0,0,0,0,0,0,0,360,738,941,1133,815,512,654,950,524,1121,1375,1018,0,0,0,341,407,714,946,615,508,896,1203,738,877,1150,791,0,0,0,1340,1212,"Vulcan, Starfleet, Astrophysicist, Telepath","nonhuman, female, organic, ent, tpol, crew_max_rarity_4","Vessel's Information",0, 5, 12, 12, 20, 2, 0, , , , 1400, 200, 70, 1175, false,"T'Pol",crew_portraits_cm_tpolcommander_sm.png,tpol_commander_crew
"Chef Neelix",0,1, 0,0,0,0,0,0,0,0,0,0,0,0,201,51,189,0,0,0,0,0,0,1428,0,0,0,1361,0,0,1453,0,1358,0,1167,0,0,0,1259,0,0,0,1174,0,0,1306,0,1151,0,986,1662,1644,"Talaxian, Mylean, Resourceful, Survivalist, Chef, Civilian, Communicator","nonhuman, male, organic, voy, neelix, crew_max_rarity_1","Soup's On",1, 2, 12, 14, 10, 6, 0, , 2, 1, 305, , , 210, false,"Neelix",crew_portraits_cm_neelix_sm.png,neelix_chef_crew
"CMO 'Bones' McCoy",0,1, 0,0,0,0,0,0,0,0,0,0,0,0,0,0,0,213,48,196,0,0,0,0,1182,0,0,0,868,0,0,1096,0,834,1165,0,0,0,0,1001,0,0,0,705,0,0,930,0,704,982,1659,1643,"Human, Federation, Starfleet, Physician, Exobiology","male, organic, tos, mccoy, crew_max_rarity_1","Country Doctor",2, 3, 8, 10, 12, , , , 0, 2, 245, 10, 8, 285, false,"McCoy",crew_portraits_cm_mccoy_sm.png,mccoy_chief_medical_officer_crew
