"Mirror T'Pol",8,5, 451,111,369,1018,184,560,0,0,0,0,0,0,704,213,421,0,0,0,65,759,672,297,606,269,230,44,179,0,676,0,522,0,447,11,530,373,81,355,165,128,9,124,0,405,0,218,0,229,464,52,"Vulcan, Terran Empire, Starfleet, Astrophysicist, Duelist, Saboteur, Telepath, Mirror Universe","nonhuman, female, organic, ent, first_officer, mirror, bridge_crew, tpol, crew_max_rarity_5","Pay for Your Arrogance",2, 7, 4, 10, 14, 4, 0, , , , 700, 255, 220, 325, true,"T'Pol",crew_portraits_cm_tpolmirrortos_sm.png,tpol_mirror_crew
"Chancellor Gowron",5,5, 439,149,309,0,0,0,759,220,451,0,0,0,794,287,867,0,0,0,751,247,697,167,632,470,0,345,0,421,58,354,272,0,260,486,87,398,7,380,200,0,26,0,181,2,151,18,0,34,443,13,"Klingon, Cultural Figure, Diplomat, Brutal, Politician","nonhuman, male, organic, tng, gowron, crew_max_rarity_5","It Will Be War!",0, 7, 6, 8, 14, 4, 2, , , , 350, 290, 195, 650, false,"Gowron",crew_portraits_cm_gowronchancellor_sm.png,gowron_chancellor_crew
"Lieutenant Valeris",5,4, 218,136,300,387,172,439,579,203,541,0,0,0,0,0,0,0,0,0,466,397,883,977,821,128,498,751,441,491,707,430,0,0,0,37,73,433,637,415,15,216,330,191,143,260,116,0,0,0,877,61,"Vulcan, Saboteur, Starfleet, Federation, Resourceful, Telepath","nonhuman, female, organic, valeris, tos, lieutenant, crew_max_rarity_4","Conspirator",2, 9, 4, 8, 8, , , 2, , , 225, 200, 150, 415, false,"Valeris",crew_portraits_cm_valeris_sm.png,valeris_lieutenant_crew
"Dr. David Marcus",10,4, 0,0,0,782,152,299,0,0,0,443,168,385,0,0,0,0,0,0,540,0,660,0,0,541,123,609,328,626,0,0,690,391,0,499,0,286,0,0,492,47,552,313,332,0,0,338,167,0,1016,779,"Gambler, Innovator, Jury Rigger, Human, Civilian","male, organic, tos, davidmarcus, crew_max_rarity_4","Experimental Maneuver",0, 7, 10, 14, 12, , , , , , 342, 355, 30, 450, false,"David",crew_portraits_cm_davidmarcus_sm.png,david_marcus_crew
"Undercover Sulu",9,5, 584,31,69,0,0,0,840,159,341,0,0,0,966,222,662,0,0,0,783,256,726,165,664,473,0,326,0,422,56,355,253,0,245,1003,406,941,153,872,401,0,121,0,363,20,316,65,0,96,435,201,"Human, Federation, Starfleet, Pilot, Resourceful, Tactician, Undercover Operative, Maverick, Hero","male, organic, tos, lieutenant, bridge_crew, sulu, crew_max_rarity_5","Don't Call Me Tiny",1, 7, 16, 3, 16, 1, 2, , , , 600, 85, 200, 350, false,"Sulu",crew_portraits_cm_sulusfs_sm.png,sulu_sfs_crew
"North Star Tucker",8,5, 0,0,0,0,0,0,470,93,181,799,181,587,1049,161,315,0,0,0,0,816,387,471,0,815,318,360,0,97,165,660,30,206,269,0,778,108,584,0,754,122,500,0,37,265,642,10,47,387,467,193,"Human, Starfleet, Jury Rigger, Marksman, Costumed, Romantic, Gambler","male, organic, ent, commander, tucker, crew_max_rarity_5","Quick Draw",0, 7, 10, 10, 14, 6, 0, , , , 390, 330, 47, 1450, false,"Trip",crew_portraits_cm_tuckercowboy_sm.png,tucker_cowboy_crew
"Danara Pel",10,4, 0,0,0,618,48,125,0,0,0,0,0,0,0,0,0,646,151,430,720,0,0,0,439,710,487,731,96,0,0,443,0,301,484,943,0,0,0,240,944,640,934,116,0,0,245,0,140,293,1031,984,"Hologram, Physician, Vidiian, Desperate, Geneticist","female, nonhuman, voy, danara, crew_max_rarity_4","Just A Disease",0, 8, 16, 12, 10, , , , , , 750, 210, 175, 340, false,"Danara",crew_portraits_cm_danarapel_sm.png,danara_pel_crew
"Warship Chakotay",7,4, 404,172,414,0,0,0,727,172,350,0,0,0,0,0,0,0,0,0,729,268,669,801,603,539,0,0,0,474,693,412,0,0,0,314,94,235,473,221,371,0,0,0,341,535,293,0,0,0,1019,611,"Human, Starfleet, Federation, Hunter, Veteran, Brutal, Villain, Hologram, Maquis","male, organic, voy, bridge_crew, commander, first_officer, chakotay, crew_max_rarity_4","All Out War",0, 7, 6, 8, 12, , , , , , 640, 195, 60, 500, false,"Chakotay",crew_portraits_cm_chakotaylivingwitness_sm.png,chakotay_warship_crew
"Captain Pike",10,5, 1099,189,388,0,0,0,0,0,0,0,0,0,860,180,405,0,0,0,266,403,217,87,173,0,0,481,0,0,576,0,402,0,356,329,434,247,64,233,0,0,357,0,0,476,0,285,0,285,579,568,"Starfleet, Human, Federation, Romantic, Inspiring, Hero","captain, male, organic, tos, pike, crew_max_rarity_5","Fire All Weapons",0, 10, 4, 8, 8, , , 2, , , 525, 185, 130, 640, false,"Pike",crew_portraits_cm_pike_captain_sm.png,pike_captain_crew
"Will Scarlett",7,5, 0,0,0,0,0,0,983,289,597,0,0,0,850,172,355,0,0,0,0,379,0,598,0,253,0,514,0,228,51,166,450,0,386,0,190,0,535,0,81,0,437,0,83,13,63,360,0,345,573,255,"Klingon, Tactician, Duelist, Costumed, Hero","nonhuman, male, organic, tng, bridge_crew, worf, crew_max_rarity_5","Beg For Mercy",2, 8, 4, 10, 16, 5, 0, , , , 575, 225, 247, 375, false,"Worf",crew_portraits_cm_willscarletworf_sm.png,worf_merry_crew
"Boxer Chakotay",4,3, 272,24,58,0,0,0,558,65,105,0,0,0,332,18,46,0,0,0,994,621,932,807,863,762,0,971,0,672,678,624,954,0,834,1013,802,955,990,888,942,0,1015,0,807,925,774,1003,0,871,1071,1182,"Human, Starfleet, Federation, Hunter, Duelist, Athlete, Costumed, Maquis","male, organic, voy, bridge_crew, commander, first_officer, chakotay, crew_max_rarity_3","The Maquis Mauler",0, 4, 14, 10, 14, 0, 1, , 2, 2, 90, 265, 97, 575, false,"Chakotay",crew_portraits_cm_chakotayboxing_sm.png,chakotay_boxing_crew
"Beowulf Kim",9,5, 388,108,153,0,0,0,985,239,494,951,147,307,0,0,0,0,0,0,864,191,88,909,742,271,316,0,0,37,438,185,415,202,0,783,133,139,839,675,150,335,0,0,13,274,121,473,252,0,474,230,"Federation, Human, Costumed, Brutal, Duelist, Musician","male, organic, voy, kim, crew_max_rarity_5","By Hell-Forged Hands",0, 6, 4, 8, 8, 6, 0, 2, , , 300, 230, 150, 355, false,"Kim",crew_portraits_cm_kimbeowulf_sm.png,kim_beowulf_crew
"Jazz Musician Riker",5,3, 448,114,254,0,0,0,0,0,0,0,0,0,288,67,190,0,0,0,797,807,736,637,677,0,0,957,0,0,1017,0,937,0,821,614,657,539,434,501,0,0,822,0,0,890,0,774,0,678,1121,1055,"Federation, Human, Musician, Starfleet, Pilot, Maverick, Gambler, Romantic","male, organic, tng, bridge_crew, riker, crew_max_rarity_3","Calculated Risk",0, 7, 8, 10, 12, , , , 1, 2, 320, 270, 280, 215, false,"Riker",crew_portraits_cm_rikertrombone_sm.png,riker_trombone_crew
"Klingon Quark",6,4, 363,49,110,0,0,0,369,148,329,0,0,0,637,209,444,0,0,0,942,589,872,445,812,817,0,617,0,711,344,663,557,0,473,956,366,881,246,824,436,0,279,0,388,65,354,194,0,210,899,387,"Ferengi, Klingon, Scoundrel, Duelist, Desperate, Romantic, Gambler","nonhuman, male, organic, ds9, quark, crew_max_rarity_4","House of Quark",0, 8, 6, 6, 10, , , , 2, 2, 100, 435, 75, 640, false,"Quark",crew_portraits_cm_quarkklingon_sm.png,quark_klingon_armor_crew
"Commander Chakotay",8,2, 281,63,183,0,0,0,244,58,137,0,0,0,166,41,87,0,0,0,977,716,908,845,845,991,0,1015,0,854,922,810,997,0,872,815,571,767,706,698,905,0,974,0,782,783,751,951,0,833,1137,1076,"Human, Starfleet, Federation, Hunter, Tactician, Survivalist, Maquis","male, organic, voy, bridge_crew, commander, first_officer, chakotay, crew_max_rarity_2","Ancient Traditions",2, 4, 3, 10, 5, , , 2, , , 180, 115, 177, 115, false,"Chakotay",crew_portraits_cm_chakotaystarfleet_sm.png,chakotay_starfleet_crew
"Captain Kirk",6,2, 317,71,156,0,0,0,128,24,74,0,0,0,259,39,127,0,0,0,954,825,887,747,824,1023,0,976,0,878,936,840,957,0,837,858,711,801,686,734,1007,0,944,0,863,880,822,914,0,803,1141,1108,"Human, Federation, Starfleet, Inspiring, Romantic, Explorer","male, organic, tos, captain, bridge_crew, kirk, crew_max_rarity_2","Boldly Go",0, 3, 6, 10, 10, , , , , , 320, 135, , 215, false,"Kirk",crew_portraits_cm_kirktosyellow_sm.png,kirk_tos_yellow_crew
"Orion Vina",10,5, 0,0,0,866,109,268,0,0,0,0,0,0,1126,218,426,0,0,0,516,0,0,429,0,520,370,42,314,0,412,0,244,0,237,610,0,0,417,0,578,392,67,361,0,395,0,206,0,219,588,744,"Costumed, Orion, Human, Romantic, Desperate","nonhuman, female, tos, vina, crew_max_rarity_5","Distracting Dance",0, 7, 4, 10, 8, 8, 4, 2, , , 605, 165, 255, 515, false,"Vina",crew_portraits_cm_vinaorion_sm.png,vina_orion_crew
"Vic Fontaine",5,4, 0,0,0,0,0,0,0,0,0,0,0,0,681,170,524,576,35,130,0,0,0,650,639,0,0,587,459,0,671,623,518,415,102,0,0,0,353,821,0,0,234,589,0,332,787,161,534,102,1021,898,"Gambler, Romantic, Merchant, Human, Artist, Musician, Hologram, Crafty, Communicator","male, ds9, vicfontaine, crew_max_rarity_4","The Best Is Yet To Come",1, 6, 8, 10, 16, 6, 0, , , , 150, 165, 742, 275, false,"Vic",crew_portraits_cm_vicfontaine_sm.png,vic_fontaine_crew
"Trader Odo",4,4, 0,0,0,0,0,0,636,73,144,0,0,0,868,109,248,0,0,0,0,705,0,634,0,657,0,569,0,586,211,532,499,0,427,0,850,0,722,0,857,0,681,0,744,484,720,610,0,540,972,1075,"Changeling, Costumed, Merchant, Shapeshifter, Tribbled, Displaced","nonhuman, organic, ds9, odo, crew_max_rarity_4","Tribble Trouble",0, 7, 10, 10, 10, 4, 4, , , , 455, 60, 155, 440, false,"Odo",crew_portraits_cm_odo_tos_sm.png,odo_tos_crew
"Obsidian Order Garak",6,5, 421,152,344,0,0,0,1040,174,492,0,0,0,985,144,350,0,0,0,752,149,698,194,633,264,0,392,0,242,45,180,314,0,288,432,78,348,144,324,206,0,478,0,186,57,156,392,0,367,335,108,"Cardassian, Obsidian Order, Crafty, Scoundrel, Interrogator, Resourceful, Undercover Operative, Brutal, Romantic, Saboteur","male, organic, ds9, nonhuman, garak, crew_max_rarity_5","For Cardassia!",0, 9, 8, 10, 12, , , , , , 550, 75, 5, 350, false,"Garak",crew_portraits_cm_garakobsidian_sm.png,garak_obsidian_crew
"Friar Tuck Data",2,4, 0,0,0,0,0,0,798,157,324,290,117,265,607,141,292,0,0,0,0,590,840,713,0,515,625,656,0,191,179,390,284,513,520,0,517,537,643,0,429,394,583,0,98,150,349,91,320,459,667,395,"Android, Federation, Starfleet, Counselor, Costumed, Cyberneticist, Cultural Figure, Duelist, Musician","nonhuman, male, tng, lieutenant_commander, bridge_crew, artificial_life, data, crew_max_rarity_4","Divine Protection",2, 7, 12, 12, 20, 2, 0, , , , 475, 200, 120, 600, false,"Friar Tuck",crew_portraits_cm_data_friartuck_sm.png,data_friar_tuck_crew
"Convergence Day Quark",7,5, 995,182,438,0,0,0,0,0,0,0,0,0,1043,217,498,0,0,0,288,420,244,58,196,0,0,331,0,0,423,0,256,0,248,268,393,193,29,182,0,0,216,0,0,305,0,147,0,162,537,355,"Ferengi, Costumed, Merchant, Romantic, Gambler, Bartender, Communicator, Civilian","nonhuman, male, organic, ds9, quark, original, crew_max_rarity_5","Grand Celebration",1, 9, 10, 10, 10, , , , , , 175, 85, 87, 480, false,"Quark",crew_portraits_cm_quarkfestive_sm.png,quark_convergence_crew
"Human Q",8,4, 0,0,0,546,150,297,0,0,0,816,93,314,294,69,151,0,0,0,665,0,474,989,0,655,108,476,398,476,1020,0,257,270,827,507,0,496,903,0,501,94,268,318,497,951,0,238,297,731,832,689,"Desperate, Crafty, Scoundrel, Astrophysicist, Human","male, tng, q_jdl, crew_max_rarity_4","Q the Ordinary",1, 6, 12, 12, 20, 2, 0, , , , 190, , 30, 80, false,"Q",crew_portraits_cm_qhuman_sm.png,q_human_crew
"C.O.P. Founder Picard",8,5, 1144,84,164,0,0,0,0,0,0,0,0,0,1026,221,460,0,0,0,315,430,258,71,211,0,0,343,0,0,437,0,269,0,259,811,810,762,175,696,0,0,245,0,0,345,0,175,0,191,553,833,"Federation, Starfleet, Human, Inspiring, Cultural Figure, Musician, Communicator","male, organic, tng, ent, pic, captain, bridge_crew, picard, original, crew_max_rarity_5","Starfleet Maneuvers",2, 8, 6, 6, 6, , , , , , 450, , 150, 640, true,"Picard",crew_portraits_cm_picard_formal_sm.png,picard_founder_crew
"Pel",8,4, 638,48,139,0,0,0,0,0,0,0,0,0,840,133,314,0,0,0,698,727,636,261,578,0,0,555,0,0,639,0,491,0,416,924,895,851,426,792,0,0,551,0,0,632,0,458,0,431,983,1051,"Civilian, Ferengi, Costumed, Undercover Operative, Romantic, Gambler","female, organic, ds9, pel, crew_max_rarity_4","Profit in the Wind",2, 9, 6, 12, 14, 5, 0, , , , 240, 100, 165, 350, false,"Pel",crew_portraits_cm_pel_sm.png,pel_crew
"Captain Nog",9,5, 1040,244,540,0,0,0,455,110,250,0,0,0,979,144,281,0,0,0,251,147,201,76,158,779,0,429,0,686,195,641,355,0,321,130,85,95,54,84,593,0,594,0,535,242,508,504,0,469,372,151,"Ferengi, Federation, Starfleet, Inspiring","nonhuman, male, organic, ds9, captain, nog, crew_max_rarity_5","Weapons Free",0, 9, 10, 10, 10, , , , , , 500, 250, 100, 300, false,"Nog",crew_portraits_cm_nogcaptain_sm.png,nog_captain_crew
"The Traveler",9,5, 0,0,0,411,99,279,0,0,0,1176,176,376,874,100,197,0,0,0,838,0,199,648,0,836,70,193,513,233,666,0,29,111,438,608,0,293,799,0,577,69,256,360,335,832,0,81,170,625,472,512,"Explorer, Quantum Mechanics, Warp Theorist, Prodigy, Civilian, Communicator, Inspiring","nonhuman, male, organic, tng, traveler, crew_max_rarity_5","See Past the Numbers",0, 8, 6, 6, 6, , , , , , 355, , 15, 575, true,"The Traveler",crew_portraits_cm_traveler_sm.png,traveler_crew
"Lieutenant Wesley Crusher",9,5, 0,0,0,465,148,378,884,121,254,1084,173,461,0,0,0,0,0,0,707,564,221,0,0,78,65,723,421,39,632,367,271,120,0,391,639,203,0,0,83,19,440,246,47,723,485,236,105,0,425,183,"Human, Federation, Starfleet, Prodigy, Warp Theorist, Tactician","male, organic, tng, lieutenant, bridge_crew, wesley, crew_max_rarity_5","Precise Maneuvers",1, 9, 6, 10, 12, , , , , , 300, 400, , 375, false,"Wesley",crew_portraits_cm_wesleylieutenant_sm.png,wesley_lieutenant_crew
"Captain Q",8,4, 372,189,389,536,69,129,0,0,0,0,0,0,606,181,411,0,0,0,298,780,701,362,641,796,529,278,475,0,722,0,580,0,488,137,433,246,62,231,909,606,159,555,0,463,0,269,0,273,813,313,"Starfleet, Crafty, Scoundrel, Q Continuum","nonhuman, male, tng, q_jdl, crew_max_rarity_4","Judgment",1, 8, 4, 14, 16, , , , , , 90, 555, , 290, false,"Q",crew_portraits_cm_qstarfleet_sm.png,q_starfleet_crew
"Locutus of Borg",1,5, 0,0,0,351,242,610,874,247,492,0,0,0,847,399,783,0,0,0,666,431,0,438,0,52,457,74,399,275,38,207,249,0,239,100,281,0,60,0,7,92,1,86,146,1,118,14,0,31,125,1,"Borg, Human, Diplomat, Cyberneticist, Brutal, Duelist, Cultural Figure","male, organic, tng, picard, gauntlet_jackpot, crew_max_rarity_5","Resistance is Futile",0, 9, 1, 10, 12, , , , , , 325, 100, 5, 490, false,"Locutus",crew_portraits_cm_locutus_sm.png,locutus_crew
"Bestselling Author Jake Sisko",8,4, 0,0,0,648,162,393,0,0,0,0,0,0,682,73,146,0,0,0,575,0,0,729,0,567,408,160,348,0,751,0,620,0,531,354,0,0,905,0,349,264,177,227,0,953,0,841,0,732,1010,972,"Human, Federation, Civilian, Writer, Gambler, Romantic, Cultural Figure, Inspiring","male, organic, ds9, jake, crew_max_rarity_4","You Should Read More",1, 6, 12, 8, 14, 0, 2, , , , 525, 250, 170, 550, false,"Jake",crew_portraits_cm_jake_old_author_sm.png,jake_author_crew
"Prospero Data",4,4, 252,120,263,0,0,0,0,0,0,595,66,127,881,90,172,0,0,0,945,910,416,427,813,0,497,590,0,643,674,0,88,402,446,587,638,256,413,482,0,617,815,0,794,884,0,455,516,672,841,915,"Android, Federation, Starfleet, Cyberneticist, Costumed, Cultural Figure, Musician","nonhuman, male, tng, lieutenant_commander, bridge_crew, artificial_life, data, crew_max_rarity_4","Be Collected",1, 5, 4, 6, 6, , , , , , , 200, 240, 490, true,"Prospero",crew_portraits_cm_data_prospero_sm.png,data_prospero_crew
"Captain Morgan Bateson",10,5, 1074,218,498,0,0,0,986,117,244,0,0,0,447,94,186,0,0,0,249,83,200,170,157,395,0,858,0,345,229,292,819,0,715,179,101,127,140,119,589,0,794,0,529,386,502,741,0,649,415,312,"Federation, Starfleet, Human, Casual, Displaced","male, organic, tng, captain, bridge_crew, bateson, crew_max_rarity_5","Surprise Attack",0, 8, 12, 10, 14, 8, 4, , , , 150, 30, 190, 590, false,"Bateson",crew_portraits_cm_bateson_sm.png,bateson_captain_crew
"Captain John Harriman",10,4, 589,83,188,0,0,0,0,0,0,0,0,0,778,132,255,0,0,0,705,733,640,298,582,0,0,614,0,0,702,0,550,0,469,763,783,718,392,657,0,0,644,0,0,720,0,568,0,513,1014,1034,"Federation, Starfleet, Human, Communicator","male, organic, tng, captain, bridge_crew, harriman, crew_max_rarity_4","Evasive Maneuvers",1, 7, 6, 10, 10, , , , , , 615, 30, 10, 500, false,"Harriman",crew_portraits_cm_harriman_sm.png,harriman_captain_crew
"Captain Sulu",9,4, 738,113,249,0,0,0,330,92,206,0,0,0,502,106,206,0,0,0,576,393,510,346,443,913,0,762,0,784,588,742,722,0,617,622,345,547,372,508,706,0,744,0,631,429,610,687,0,597,881,785,"Human, Federation, Starfleet, Veteran, Tactician, Pilot","male, organic, tos, captain, bridge_crew, sulu, crew_max_rarity_4","Outstanding!",1, 6, 14, 10, 14, 0, 1, , , , 115, , 50, 375, false,"Sulu",crew_portraits_cm_sulucaptain_sm.png,sulu_captain_crew
"Umpire Odo",9,5, 1165,165,351,0,0,0,0,0,0,0,0,0,944,138,302,0,0,0,252,387,203,80,160,0,0,464,0,0,563,0,386,0,344,393,488,311,161,288,0,0,565,0,0,647,0,479,0,439,567,804,"Changeling, Bajoran, Constable, Costumed","nonhuman, male, organic, ds9, odo, niners, crew_max_rarity_5","STRIKE THREE!",0, 8, 6, 8, 10, 3, 0, 2, , , 365, 250, 535, 375, false,"Odo",crew_portraits_cm_odoumpire_sm.png,odo_umpire_crew
"Niners Kira Nerys",4,4, 753,169,365,0,0,0,674,53,90,0,0,0,308,109,227,0,0,0,530,245,464,410,400,654,0,904,0,584,499,530,882,0,775,371,338,292,210,272,973,0,719,0,831,583,797,643,0,570,763,740,"Bajoran, Athlete, Costumed, Veteran","nonhuman, female, organic, ds9, kira, niners, crew_max_rarity_4","Double Play",2, 5, 12, 12, 20, 2, 0, , , , 150, 245, 122, 580, false,"Kira",crew_portraits_cm_kira_niners_sm.png,kira_niners_crew
"Niners Rom",2,4, 0,0,0,0,0,0,544,144,297,853,102,239,0,0,0,0,0,0,0,692,468,0,0,634,386,0,0,95,771,513,540,266,0,0,565,609,0,0,486,429,0,0,135,626,401,648,361,0,990,963,"Ferengi, Bajoran, Desperate, Resourceful, Jury Rigger, Athlete, Saboteur, Hero, Costumed","nonhuman, male, organic, ds9, rom, niners, crew_max_rarity_4","Bunt",0, 8, 6, 6, 10, , , , 2, 2, 865, 300, 185, 80, false,"Rom",crew_portraits_cm_rom_niners_sm.png,rom_niners_crew
"Goddess of Empathy Troi",8,5, 0,0,0,0,0,0,0,0,0,0,0,0,1101,74,155,992,234,676,0,0,0,509,156,0,0,399,171,0,500,173,324,110,21,0,0,0,891,46,0,0,857,68,0,935,65,824,22,39,545,604,"Human, Betazoid, Empath, Cultural Figure, Hologram, Inspiring","female, nonhuman, artificial_life, tng, commander, bridge_crew, troi, crew_max_rarity_5","Discard Your Facades",0, 7, 10, 10, 14, 6, 0, , , , 750, 70, 50, 1125, false,"Troi",crew_portraits_cm_troi_goddess_sm.png,troi_goddess_crew
"Apollo",4,4, 303,96,196,0,0,0,0,0,0,0,0,0,590,74,170,582,236,586,937,901,867,568,159,0,0,720,335,0,809,426,678,283,100,731,758,682,528,15,0,0,841,93,0,909,88,797,34,47,844,334,"Inspiring, Caregiver, Musician, Cultural Figure, Spiritual, Brutal","male, organic, tos, nonhuman, crew_max_rarity_4","I am Apollo!",2, 9, 12, 10, 12, , , , 1, 2, 500, 100, 83, 515, false,"Apollo",crew_portraits_cm_apollo_sm.png,apollo_crew
"Platonian Kirk",5,4, 626,138,268,0,0,0,689,191,390,0,0,0,217,122,265,0,0,0,610,231,542,514,480,545,0,964,0,480,427,420,944,0,824,554,138,479,265,456,296,0,645,0,264,125,223,569,0,514,791,293,"Human, Federation, Starfleet, Inspiring, Romantic, Explorer, Telekinetic","male, organic, tos, captain, bridge_crew, kirk, crew_max_rarity_4","Telekinetic Barrage",2, 9, 6, 12, 14, 5, 0, , , , 150, 735, 10, 425, false,"Kirk",crew_portraits_cm_kirk_platonian_sm.png,kirk_platonian_crew
"Ba'ku Worf",5,4, 547,119,272,0,0,0,902,118,299,0,0,0,0,0,0,0,0,0,686,197,622,776,569,450,0,0,0,403,598,339,0,0,0,576,241,499,685,473,516,0,0,0,462,667,431,0,0,0,957,929,"Klingon, Federation, Starfleet, Tactician, Desperate","nonhuman, male, organic, tng, lieutenant_commander, bridge_crew, worf, crew_max_rarity_4","Aggressive Tendencies",0, 6, 8, 5, 14, 1, 0, , , , 550, 325, 60, 305, false,"Worf",crew_portraits_cm_worf_insurrection_sm.png,worf_insurrection_crew
"Combat Medic Paris",8,4, 330,76,160,0,0,0,590,90,207,0,0,0,0,0,0,843,92,255,938,491,868,970,149,666,0,0,324,592,790,44,0,265,462,841,464,787,874,234,710,0,0,392,633,823,181,0,351,564,805,878,"Human, Starfleet, Federation, Tactician, Costumed","organic, voy, lieutenant, bridge_crew, paris, crew_max_rarity_4","Time's up!",0, 7, 10, 10, 16, 6, 0, , , , 575, 70, 30, 515, false,"Paris",crew_portraits_cm_paris_wwii_sm.png,paris_wwii_crew
"Maquis Ro Laren",7,4, 560,102,264,0,0,0,756,139,372,0,0,0,274,132,241,0,0,0,685,249,621,540,568,529,0,922,0,463,398,404,901,0,789,619,196,545,307,507,385,0,661,0,352,172,307,589,0,529,790,436,"Maquis, Bajoran, Survivalist, Saboteur, Desperate","nonhuman, female, organic, tng, ro, crew_max_rarity_4","Not Sure Where I Stand",1, 6, 12, 12, 16, 5, 0, , , , 280, 95, 20, 515, false,"Ro",crew_portraits_cm_ro_maquis_sm.png,ro_maquis_crew
"Dr. Hippocrates Noah",2,4, 0,0,0,675,155,333,0,0,0,0,0,0,353,82,174,571,104,349,579,0,0,930,518,572,409,338,83,0,965,495,869,344,277,452,0,0,855,404,442,308,199,59,0,894,407,777,242,173,823,543,"Hologram, Human, Villain, Crafty, Communicator, Prodigy, Resourceful","male, ds9, noah, sisko, crew_max_rarity_4","Demolish the House",2, 5, 3, 4, 16, 1, 0, , , , 300, 90, 103, 365, true,"Hippocrates",crew_portraits_cm_sisko_noah_sm.png,sisko_noah_crew
"Agent Janeway",8,5, 0,0,0,441,174,384,1013,63,144,0,0,0,1018,209,489,0,0,0,714,543,0,454,0,71,482,92,427,396,57,336,268,0,258,349,862,0,351,0,143,260,13,224,763,159,736,160,0,182,403,226,"Human, Federation, Starfleet, Costumed, Undercover Operative, Crafty","female, organic, voy, captain, bridge_crew, janeway, crew_max_rarity_5","Let's End This",0, 8, 10, 3, 14, 5, 1, , , , 465, 105, 125, 675, false,"Janeway",crew_portraits_cm_janeway_wwii_sm.png,janeway_wwii_crew
"Revolutionary Damar",7,5, 895,336,692,0,0,0,391,124,400,0,0,0,869,133,328,0,0,0,259,150,209,91,166,757,0,523,0,668,233,618,457,0,392,40,12,24,13,23,370,0,530,0,339,118,290,437,0,407,428,24,"Cardassian, Cultural Figure, Inspiring, Hero, Desperate","nonhuman, male, organic, ds9, damar, crew_max_rarity_5","For Cardassia!",2, 7, 12, 10, 14, 7, 0, , , , 450, 395, 100, 465, false,"Damar",crew_portraits_cm_damarrevolution_sm.png,damar_revolutionary_crew
"Emotion Chip Data",7,5, 0,0,0,518,108,231,0,0,0,819,182,396,1027,224,578,0,0,0,733,0,436,439,0,727,107,87,442,437,415,0,28,235,240,665,0,267,252,0,645,74,30,398,298,236,0,5,154,118,414,95,"Android, Starfleet, Federation, Cyberneticist, Resourceful, Musician","nonhuman, male, tng, lieutenant_commander, bridge_crew, artificial_life, data, crew_max_rarity_5","Humor, I love it!",0, 7, 6, 8, 12, 3, 0, 3, , , 575, 300, 10, 300, true,"Data",crew_portraits_cm_datagenerations_sm.png,data_generations_crew
"Augment Riker",5,4, 332,63,129,0,0,0,566,106,218,579,204,499,0,0,0,0,0,0,958,516,233,980,827,672,410,0,0,126,803,546,579,307,0,916,486,55,940,786,656,157,0,0,43,779,565,168,71,0,878,506,"Human, Augments, Engineered, Gambler, Desperate, Maverick, Jury Rigger, Survivalist","male, organic, tng, ent, pic, riker, original, crew_max_rarity_4","Last Chance",2, 7, 10, 10, 12, , , , , , 375, 305, 217, 330, false,"Riker",crew_portraits_cm_riker_augment_sm.png,riker_augment_crew
"Garak, Elim Garak",7,5, 1000,229,493,0,0,0,565,66,138,0,0,0,937,179,362,0,0,0,276,154,228,82,181,729,0,411,0,646,172,590,340,0,308,173,170,124,38,114,886,0,414,0,769,275,741,335,0,325,386,212,"Cardassian, Crafty, Resourceful, Undercover Operative, Costumed, Romantic, Hero","male, organic, ds9, nonhuman, garak, crew_max_rarity_5","There's Hope For You Yet",1, 7, 12, 12, 12, 6, 2, , , , 650, 200, 20, 700, false,"Garak",crew_portraits_cm_garak_secretagent_sm.png,garak_secretagent_crew
"Stranded Odo",7,4, 722,188,409,0,0,0,539,54,109,0,0,0,402,50,120,0,0,0,529,285,463,398,399,792,0,895,0,694,604,648,865,0,760,294,278,217,288,202,951,0,936,0,815,771,780,906,0,797,847,821,"Changeling, Desperate, Bajoran, Survivalist","nonhuman, organic, ds9, odo, crew_max_rarity_4","Not Without a Fight",0, 6, 8, 10, 10, 4, 2, , , , 275, 70, 130, 465, false,"Odo",crew_portraits_cm_odo_cold_weather_sm.png,odo_cold_weather_crew
"Age of Sail Riker",7,5, 1034,248,518,0,0,0,897,208,400,572,78,158,0,0,0,0,0,0,256,77,45,446,164,350,500,0,0,66,518,246,710,403,0,142,32,34,289,94,265,569,0,0,104,415,200,822,477,0,333,130,"Human, Federation, Starfleet, Explorer, Maverick, Gambler, Costumed","ageofsail, male, organic, tng, bridge_crew, riker, crew_max_rarity_5","Battle Stations!",0, 10, 8, 10, 12, , , , 1, 2, 350, , 195, 415, false,"Riker",crew_portraits_cm_riker_age_of_sail_sm.png,riker_ageofsail_crew
"Laas",8,4, 0,0,0,773,139,332,448,58,124,0,0,0,661,28,55,0,0,0,539,848,0,787,0,198,390,161,327,749,475,704,681,0,581,479,896,0,1041,0,235,315,401,295,796,873,763,996,0,868,750,988,"Explorer, Changeling, Civilian, Prodigy, Hunter, Survivalist","nonhuman, male, organic, ds9, laas, crew_max_rarity_4","A Pale Shadow",2, 8, 8, 8, 10, , , , 0, 2, 580, 200, 242, 300, false,"Laas",crew_portraits_cm_laas_sm.png,laas_crew
"Age of Sail La Forge",7,4, 404,167,367,0,0,0,408,50,102,794,105,262,0,0,0,0,0,0,750,527,96,814,631,902,399,0,0,226,956,735,562,289,0,374,334,53,529,274,962,407,0,0,361,1016,792,608,327,0,856,704,"Human, Starfleet, Federation, Cyberneticist, Explorer, Costumed, Innovator","ageofsail, male, organic, tng, lieutenant_commander, laforge, crew_max_rarity_4","Hard to Port!",1, 8, 10, 10, 12, , , , 0, 2, 1250, 130, 222, 550, false,"La Forge",crew_portraits_cm_laforge_age_of_sail_sm.png,laforge_ageofsail_crew
"Joachim",10,5, 957,117,254,0,0,0,1251,103,225,0,0,0,0,0,0,0,0,0,450,87,407,590,341,255,0,0,0,229,414,167,0,0,0,611,321,536,710,499,644,0,0,0,583,772,553,0,0,0,572,1009,"Human, Augments, Engineered, Villain, Tactician, Pilot","nonhuman, male, organic, tos, joachim, crew_max_rarity_5","For Khan!",0, 6, 6, 10, 10, 8, 4, , , , 565, 505, 150, 350, false,"Joachim",crew_portraits_cm_joachim2_sm.png,joachim_wok_crew
"Durango Troi",7,5, 840,116,391,0,0,0,1349,52,114,0,0,0,381,207,417,0,0,0,488,89,433,276,363,248,0,739,0,224,106,161,698,0,595,417,341,330,75,306,949,0,308,0,812,241,778,230,0,238,390,386,"Empath, Constable, Scoundrel, Costumed, Federation, Starfleet, Betazoid, Human","female, nonhuman, tng, commander, bridge_crew, troi, crew_max_rarity_5","Call Me Durango",2, 10, 12, 12, 12, , , , 0, 2, 525, 375, 20, 725, false,"Troi",crew_portraits_cm_troi_cowboy_sm.png,troi_cowboy_crew
"Sybok",6,4, 0,0,0,670,51,126,0,0,0,0,0,0,827,117,238,215,141,461,672,0,0,658,744,661,459,153,202,0,686,724,533,493,212,940,0,0,726,210,939,634,430,103,0,755,220,615,123,76,737,608,"Vulcan, Inspiring, Spiritual, Explorer, Counselor, Telepath","nonhuman, male, organic, sybok, tos, crew_max_rarity_4","Share Your Pain",1, 7, 6, 8, 10, 3, 0, 3, , , 575, 390, 43, 390, false,"Sybok",crew_portraits_cm_sybok_sm.png,sybok_crew
