"Warship Chakotay",7,4, 404,172,414,0,0,0,727,172,350,0,0,0,0,0,0,0,0,0,756,280,699,831,627,561,0,0,0,499,717,433,0,0,0,334,98,253,488,232,379,0,0,0,353,551,302,0,0,0,1054,634,"Human, Starfleet, Federation, Hunter, Veteran, Brutal, Villain, Hologram, Maquis","male, organic, voy, chakotay, crew_max_rarity_4","All Out War",0, 7, 6, 8, 12, , , , , , 640, 195, 60, 500, false,"Chakotay",crew_portraits_cm_chakotaylivingwitness_sm.png,chakotay_warship_crew
"Captain Pike",10,5, 1099,189,388,0,0,0,0,0,0,0,0,0,860,180,405,0,0,0,278,421,236,90,182,0,0,500,0,0,600,0,428,0,371,344,452,267,67,248,0,0,362,0,0,491,0,296,0,291,603,592,"Starfleet, Human, Federation, Romantic, Inspiring, Hero","male, organic, tos, pike, crew_max_rarity_5","Fire All Weapons",0, 10, 4, 8, 8, , , 2, , , 525, 185, 130, 640, false,"Pike",crew_portraits_cm_pike_captain_sm.png,pike_captain_crew
"Will Scarlett",7,5, 0,0,0,0,0,0,983,289,597,0,0,0,850,172,355,0,0,0,0,396,0,624,0,265,0,534,0,241,53,177,470,0,400,0,198,0,550,0,85,0,443,0,87,13,66,372,0,352,596,264,"Klingon, Tactician, Duelist, Costumed, Hero","nonhuman, male, organic, tng, worf, crew_max_rarity_5","Beg For Mercy",2, 8, 4, 10, 16, 5, 0, , , , 575, 225, 247, 375, false,"Worf",crew_portraits_cm_willscarletworf_sm.png,worf_merry_crew
"Boxer Chakotay",4,3, 272,24,58,0,0,0,558,65,105,0,0,0,332,18,46,0,0,0,1030,644,968,837,895,790,0,1002,0,701,702,645,986,0,860,1046,829,991,1023,919,972,0,1049,0,839,952,799,1037,0,900,1106,1220,"Human, Starfleet, Federation, Hunter, Duelist, Athlete, Costumed, Maquis","male, organic, voy, chakotay, crew_max_rarity_3","The Maquis Mauler",0, 4, 14, 10, 14, 0, 1, , 2, 2, 90, 265, 97, 575, false,"Chakotay",crew_portraits_cm_chakotayboxing_sm.png,chakotay_boxing_crew
"Beowulf Kim",8,5, 388,108,153,0,0,0,985,239,494,951,147,307,0,0,0,0,0,0,898,203,98,941,769,285,329,0,0,38,455,193,422,212,0,810,139,150,869,700,156,346,0,0,13,279,125,483,263,0,499,238,"Federation, Human, Costumed, Brutal, Duelist, Musician","male, organic, voy, kim, crew_max_rarity_5","By Hell-Forged Hands",0, 6, 4, 8, 8, 6, 0, 2, , , 300, 230, 150, 355, false,"Kim",crew_portraits_cm_kimbeowulf_sm.png,kim_beowulf_crew
"Jazz Musician Riker",5,3, 448,114,254,0,0,0,0,0,0,0,0,0,288,67,190,0,0,0,827,836,768,663,704,0,0,990,0,0,1046,0,972,0,847,635,681,564,448,520,0,0,845,0,0,917,0,799,0,695,1157,1088,"Federation, Human, Musician, Starfleet, Pilot, Maverick, Gambler, Romantic","male, organic, tng, riker, crew_max_rarity_3","Calculated Risk",0, 7, 8, 10, 12, , , , 1, 2, 320, 270, 280, 215, false,"Riker",crew_portraits_cm_rikertrombone_sm.png,riker_trombone_crew
"Klingon Quark",7,4, 363,49,110,0,0,0,369,148,329,0,0,0,637,209,444,0,0,0,974,612,909,463,843,845,0,633,0,740,360,686,579,0,487,986,383,916,255,853,450,0,283,0,407,66,364,203,0,214,934,405,"Ferengi, Klingon, Scoundrel, Duelist, Desperate, Romantic, Gambler","nonhuman, male, organic, ds9, quark, crew_max_rarity_4","House of Quark",0, 8, 6, 6, 10, , , , 2, 2, 100, 435, 75, 640, false,"Quark",crew_portraits_cm_quarkklingon_sm.png,quark_klingon_armor_crew
"Commander Chakotay",8,2, 281,63,183,0,0,0,244,58,137,0,0,0,166,41,87,0,0,0,1009,743,945,877,876,1020,0,1048,0,888,949,837,1030,0,899,847,594,798,732,723,934,0,1009,0,813,808,777,986,0,859,1174,1111,"Human, Starfleet, Federation, Hunter, Tactician, Survivalist, Maquis","male, organic, voy, chakotay, crew_max_rarity_2","Ancient Traditions",2, 4, 3, 10, 5, , , 2, , , 180, 115, 177, 115, false,"Chakotay",crew_portraits_cm_chakotaystarfleet_sm.png,chakotay_starfleet_crew
"Captain Kirk",6,2, 317,71,156,0,0,0,128,24,74,0,0,0,259,39,127,0,0,0,987,854,922,776,854,1055,0,1008,0,912,964,867,991,0,865,886,735,833,710,759,1039,0,975,0,896,907,849,945,0,827,1181,1143,"Human, Federation, Starfleet, Inspiring, Romantic, Explorer","male, organic, tos, kirk, crew_max_rarity_2","Boldly Go",0, 3, 6, 10, 10, , , , , , 320, 135, , 215, false,"Kirk",crew_portraits_cm_kirktosyellow_sm.png,kirk_tos_yellow_crew
"Orion Vina",10,5, 0,0,0,866,109,268,0,0,0,0,0,0,1126,218,426,0,0,0,534,0,0,447,0,532,382,42,318,0,428,0,257,0,243,627,0,0,431,0,594,403,68,365,0,407,0,215,0,224,610,767,"Costumed, Orion, Human, Romantic, Desperate","organic, female, tos, vina, crew_max_rarity_5","Distracting Dance",0, 7, 4, 10, 8, 8, 4, 2, , , 605, 165, 255, 515, false,"Vina",crew_portraits_cm_vinaorion_sm.png,vina_orion_crew
"Vic Fontaine",4,4, 0,0,0,0,0,0,0,0,0,0,0,0,681,170,524,576,35,130,0,0,0,676,656,0,0,601,470,0,695,631,538,433,105,0,0,0,366,848,0,0,239,604,0,343,809,170,557,104,1053,929,"Gambler, Romantic, Merchant, Human, Artist, Musician, Hologram, Crafty, Communicator","male, nonhuman, artificial_life, ds9, vicfontaine, crew_max_rarity_4","The Best Is Yet To Come",1, 6, 8, 10, 16, 6, 0, , , , 150, 165, 742, 275, false,"Vic",crew_portraits_cm_vicfontaine_sm.png,vic_fontaine_crew
"Trader Odo",4,4, 0,0,0,0,0,0,636,73,144,0,0,0,868,109,248,0,0,0,0,732,0,660,0,683,0,585,0,611,221,548,521,0,442,0,879,0,748,0,882,0,695,0,773,499,740,628,0,552,1009,1109,"Changeling, Costumed, Merchant, Shapeshifter, Tribbled, Displaced","nonhuman, male, organic, ds9, odo, crew_max_rarity_4","Tribble Trouble",0, 7, 10, 10, 10, 4, 4, , , , 455, 60, 155, 440, false,"Odo",crew_portraits_cm_odo_tos_sm.png,odo_tos_crew
"Obsidian Order Garak",6,5, 421,152,344,0,0,0,1040,174,492,0,0,0,985,144,350,0,0,0,781,158,728,204,660,275,0,406,0,256,47,187,329,0,300,448,81,370,149,338,215,0,485,0,193,58,161,407,0,373,373,116,"Cardassian, Obsidian Order, Crafty, Scoundrel, Interrogator, Resourceful, Undercover Operative, Brutal, Romantic, Saboteur","male, organic, ds9, nonhuman, garak, crew_max_rarity_5","For Cardassia!",0, 9, 8, 10, 12, , , , , , 550, 75, 5, 350, false,"Garak",crew_portraits_cm_garakobsidian_sm.png,garak_obsidian_crew
"Friar Tuck Data",2,4, 0,0,0,0,0,0,798,157,324,290,117,265,607,141,292,0,0,0,0,613,868,741,0,538,648,672,0,204,188,408,298,534,534,0,537,559,666,0,444,405,596,0,99,153,360,91,331,469,708,411,"Android, Federation, Starfleet, Counselor, Costumed, Cyberneticist, Cultural Figure, Duelist, Musician","nonhuman, male, tng, artificial_life, data, crew_max_rarity_4","Divine Protection",2, 7, 12, 12, 20, 2, 0, , , , 475, 200, 120, 600, false,"Friar Tuck",crew_portraits_cm_data_friartuck_sm.png,data_friar_tuck_crew
"Convergence Day Quark",7,5, 995,182,438,0,0,0,0,0,0,0,0,0,1043,217,498,0,0,0,311,439,263,61,208,0,0,343,0,0,439,0,269,0,254,283,410,211,31,193,0,0,218,0,0,311,0,156,0,165,559,369,"Ferengi, Costumed, Merchant, Romantic, Gambler, Bartender, Communicator, Civilian","nonhuman, male, organic, ds9, quark, original, crew_max_rarity_5","Grand Celebration",1, 9, 10, 10, 10, , , , , , 175, 85, 87, 480, false,"Quark",crew_portraits_cm_quarkfestive_sm.png,quark_convergence_crew
"Human Q",8,4, 0,0,0,546,150,297,0,0,0,816,93,314,294,69,151,0,0,0,684,0,496,1022,0,664,116,484,405,498,1049,0,266,283,853,522,0,514,933,0,510,99,268,322,516,978,0,244,308,750,859,709,"Desperate, Crafty, Scoundrel, Astrophysicist, Human","male, tng, q_jdl, crew_max_rarity_4","Q the Ordinary",1, 6, 12, 12, 20, 2, 0, , , , 190, , 30, 80, false,"Q",crew_portraits_cm_qhuman_sm.png,q_human_crew
"C.O.P. Founder Picard",7,5, 1144,84,164,0,0,0,0,0,0,0,0,0,1026,221,460,0,0,0,334,451,278,74,224,0,0,354,0,0,454,0,284,0,266,842,837,795,182,721,0,0,252,0,0,356,0,182,0,194,577,866,"Federation, Starfleet, Human, Inspiring, Cultural Figure, Musician, Communicator","male, organic, tng, ent, pic, picard, original, crew_max_rarity_5","Starfleet Maneuvers",2, 8, 6, 6, 6, , , , , , 450, , 150, 640, true,"Picard",crew_portraits_cm_picard_formal_sm.png,picard_founder_crew
"Pel",8,4, 638,48,139,0,0,0,0,0,0,0,0,0,840,133,314,0,0,0,728,754,667,274,601,0,0,574,0,0,663,0,510,0,430,956,927,888,440,821,0,0,566,0,0,653,0,478,0,440,1018,1086,"Civilian, Ferengi, Costumed, Undercover Operative, Romantic, Gambler","female, organic, nonhuman, ds9, pel, crew_max_rarity_4","Profit in the Wind",2, 9, 6, 12, 14, 5, 0, , , , 240, 100, 165, 350, false,"Pel",crew_portraits_cm_pel_sm.png,pel_crew
"Captain Nog",9,5, 1040,244,540,0,0,0,455,110,250,0,0,0,979,144,281,0,0,0,263,156,221,79,170,806,0,450,0,716,204,662,371,0,334,137,89,103,56,91,611,0,608,0,557,246,525,522,0,480,404,157,"Ferengi, Federation, Starfleet, Inspiring","nonhuman, male, organic, ds9, nog, crew_max_rarity_5","Weapons Free",0, 9, 10, 10, 10, , , , , , 500, 250, 100, 300, false,"Nog",crew_portraits_cm_nogcaptain_sm.png,nog_captain_crew
"The Traveler",9,5, 0,0,0,411,99,279,0,0,0,1176,176,376,874,100,197,0,0,0,862,0,215,674,0,858,74,191,528,244,690,0,31,117,453,623,0,305,827,0,589,70,258,362,345,858,0,84,176,638,492,522,"Explorer, Quantum Mechanics, Warp Theorist, Prodigy, Civilian, Communicator, Inspiring","nonhuman, male, organic, tng, traveler, crew_max_rarity_5","See Past the Numbers",0, 8, 6, 6, 6, , , , , , 355, , 15, 575, true,"The Traveler",crew_portraits_cm_traveler_sm.png,traveler_crew
"Lieutenant Wesley Crusher",9,5, 0,0,0,465,148,378,884,121,254,1084,173,461,0,0,0,0,0,0,729,587,234,0,0,79,69,736,429,40,656,383,279,126,0,402,663,212,0,0,83,20,444,248,49,748,503,237,108,0,442,187,"Human, Federation, Starfleet, Prodigy, Warp Theorist, Tactician","male, organic, tng, wesley, crew_max_rarity_5","Precise Maneuvers",1, 9, 6, 10, 12, , , , , , 300, 400, , 375, false,"Wesley",crew_portraits_cm_wesleylieutenant_sm.png,wesley_lieutenant_crew
"Captain Q",9,4, 372,189,389,536,69,129,0,0,0,0,0,0,606,181,411,0,0,0,316,809,733,379,668,814,548,284,486,0,746,0,600,0,502,142,451,265,65,246,937,627,162,572,0,477,0,280,0,280,847,322,"Starfleet, Crafty, Scoundrel, Q Continuum","nonhuman, male, tng, q_jdl, crew_max_rarity_4","Judgment",1, 8, 4, 14, 16, , , , , , 90, 555, , 290, false,"Q",crew_portraits_cm_qstarfleet_sm.png,q_starfleet_crew
"Locutus of Borg",2,5, 0,0,0,351,242,610,874,247,492,0,0,0,847,399,783,0,0,0,685,452,0,456,0,53,473,75,407,295,40,220,261,0,246,102,295,0,63,0,7,95,1,86,150,1,123,14,0,32,149,1,"Borg, Human, Diplomat, Cyberneticist, Brutal, Duelist, Cultural Figure","male, organic, tng, picard, gauntlet_jackpot, exclusive_gauntlet, crew_max_rarity_5","Resistance is Futile",0, 9, 1, 10, 12, , , , , , 325, 100, 5, 490, false,"Locutus",crew_portraits_cm_locutus_sm.png,locutus_crew
"Bestselling Author Jake Sisko",8,4, 0,0,0,648,162,393,0,0,0,0,0,0,682,73,146,0,0,0,595,0,0,758,0,582,419,161,352,0,775,0,642,0,545,362,0,0,935,0,353,271,178,231,0,980,0,868,0,753,1041,1003,"Human, Federation, Civilian, Writer, Gambler, Romantic, Cultural Figure, Inspiring","male, organic, ds9, jake, crew_max_rarity_4","You Should Read More",1, 6, 12, 8, 14, 0, 2, , , , 525, 250, 170, 550, false,"Jake",crew_portraits_cm_jake_old_author_sm.png,jake_author_crew
"Prospero Data",3,4, 252,120,263,0,0,0,0,0,0,595,66,127,881,90,172,0,0,0,977,942,440,445,844,0,516,605,0,667,698,0,97,421,462,609,662,274,427,500,0,638,837,0,824,911,0,469,539,690,874,947,"Android, Federation, Starfleet, Cyberneticist, Costumed, Cultural Figure, Musician","nonhuman, male, tng, artificial_life, data, crew_max_rarity_4","Be Collected",1, 5, 4, 6, 6, , , , , , , 200, 240, 490, true,"Prospero",crew_portraits_cm_data_prospero_sm.png,data_prospero_crew
"Captain Morgan Bateson",10,5, 1074,218,498,0,0,0,986,117,244,0,0,0,447,94,186,0,0,0,262,91,220,178,168,419,0,885,0,371,239,308,848,0,738,188,106,141,145,127,605,0,816,0,552,397,519,763,0,664,441,325,"Federation, Starfleet, Human, Casual, Displaced","male, organic, tng, bateson, crew_max_rarity_5","Surprise Attack",0, 8, 12, 10, 14, 8, 4, , , , 150, 30, 190, 590, false,"Bateson",crew_portraits_cm_bateson_sm.png,bateson_captain_crew
"Captain John Harriman",10,4, 589,83,188,0,0,0,0,0,0,0,0,0,778,132,255,0,0,0,733,760,673,311,606,0,0,628,0,0,726,0,570,0,482,792,810,749,405,682,0,0,658,0,0,745,0,586,0,524,1050,1067,"Federation, Starfleet, Human, Communicator","male, organic, tng, harriman, crew_max_rarity_4","Evasive Maneuvers",1, 7, 6, 10, 10, , , , , , 615, 30, 10, 500, false,"Harriman",crew_portraits_cm_harriman_sm.png,harriman_captain_crew
"Captain Sulu",9,4, 738,113,249,0,0,0,330,92,206,0,0,0,502,106,206,0,0,0,601,410,536,362,462,942,0,785,0,815,612,767,745,0,632,644,362,573,385,527,729,0,765,0,655,441,626,710,0,612,920,817,"Human, Federation, Starfleet, Veteran, Tactician, Pilot","male, organic, tos, sulu, crew_max_rarity_4","Outstanding!",1, 6, 14, 10, 14, 0, 1, , , , 115, , 50, 375, false,"Sulu",crew_portraits_cm_sulucaptain_sm.png,sulu_captain_crew
"Umpire Odo",9,5, 1165,165,351,0,0,0,0,0,0,0,0,0,944,138,302,0,0,0,265,404,222,83,171,0,0,483,0,0,587,0,407,0,357,412,506,334,167,300,0,0,579,0,0,669,0,497,0,449,591,835,"Changeling, Bajoran, Constable, Costumed","nonhuman, male, organic, ds9, odo, niners, crew_max_rarity_5","STRIKE THREE!",0, 8, 6, 8, 10, 3, 0, 2, , , 365, 250, 535, 375, false,"Odo",crew_portraits_cm_odoumpire_sm.png,odo_umpire_crew
"Niners Kira Nerys",4,4, 753,169,365,0,0,0,674,53,90,0,0,0,308,109,227,0,0,0,555,257,492,428,420,679,0,940,0,609,521,546,914,0,802,388,355,311,217,285,1001,0,734,0,864,604,822,663,0,581,807,770,"Bajoran, Athlete, Costumed, Veteran","nonhuman, female, organic, ds9, kira, niners, crew_max_rarity_4","Double Play",2, 5, 12, 12, 20, 2, 0, , , , 150, 245, 122, 580, false,"Kira",crew_portraits_cm_kira_niners_sm.png,kira_niners_crew
"Niners Rom",2,4, 0,0,0,0,0,0,544,144,297,853,102,239,0,0,0,0,0,0,0,718,489,0,0,660,400,0,0,100,795,532,555,279,0,0,588,631,0,0,502,441,0,0,137,647,418,665,371,0,1024,993,"Ferengi, Bajoran, Desperate, Resourceful, Jury Rigger, Athlete, Saboteur, Hero, Costumed","nonhuman, male, organic, ds9, rom, niners, crew_max_rarity_4","Bunt",0, 8, 6, 6, 10, , , , 2, 2, 865, 300, 185, 80, false,"Rom",crew_portraits_cm_rom_niners_sm.png,rom_niners_crew
"Goddess of Empathy Troi",8,5, 0,0,0,0,0,0,0,0,0,0,0,0,1101,74,155,992,234,676,0,0,0,531,163,0,0,412,173,0,522,175,340,116,21,0,0,0,921,47,0,0,883,68,0,962,64,851,22,38,566,617,"Human, Betazoid, Empath, Cultural Figure, Hologram, Inspiring","female, nonhuman, artificial_life, tng, troi, crew_max_rarity_5","Discard Your Facades",0, 7, 10, 10, 14, 6, 0, , , , 750, 70, 50, 1125, false,"Troi",crew_portraits_cm_troi_goddess_sm.png,troi_goddess_crew
"Apollo",3,4, 303,96,196,0,0,0,0,0,0,0,0,0,590,74,170,582,236,586,970,933,902,592,166,0,0,742,339,0,834,440,699,294,103,759,784,713,543,17,0,0,865,95,0,936,89,821,34,48,873,340,"Inspiring, Caregiver, Musician, Cultural Figure, Spiritual, Brutal","male, organic, tos, nonhuman, apollo, crew_max_rarity_4","I am Apollo!",2, 9, 12, 10, 12, , , , 1, 2, 500, 100, 83, 515, false,"Apollo",crew_portraits_cm_apollo_sm.png,apollo_crew
"Platonian Kirk",5,4, 626,138,268,0,0,0,689,191,390,0,0,0,217,122,265,0,0,0,634,243,569,536,503,564,0,995,0,506,443,438,977,0,851,576,144,505,274,475,309,0,659,0,274,128,232,587,0,526,826,306,"Human, Federation, Starfleet, Inspiring, Romantic, Explorer, Telekinetic","male, organic, tos, kirk, crew_max_rarity_4","Telekinetic Barrage",2, 9, 6, 12, 14, 5, 0, , , , 150, 735, 10, 425, false,"Kirk",crew_portraits_cm_kirk_platonian_sm.png,kirk_platonian_crew
"Ba'ku Worf",6,4, 547,119,272,0,0,0,902,118,299,0,0,0,0,0,0,0,0,0,715,209,654,805,591,474,0,0,0,430,622,356,0,0,0,597,251,524,709,491,532,0,0,0,485,692,450,0,0,0,993,961,"Klingon, Federation, Starfleet, Tactician, Desperate","nonhuman, male, organic, tng, worf, crew_max_rarity_4","Aggressive Tendencies",0, 6, 8, 5, 14, 1, 0, , , , 550, 325, 60, 305, false,"Worf",crew_portraits_cm_worf_insurrection_sm.png,worf_insurrection_crew
"Combat Medic Paris",8,4, 330,76,160,0,0,0,590,90,207,0,0,0,0,0,0,843,92,255,971,513,903,1003,155,687,0,0,327,618,815,46,0,276,470,868,482,819,904,244,731,0,0,397,658,849,184,0,362,569,831,908,"Human, Starfleet, Federation, Tactician, Costumed","organic, male, voy, paris, crew_max_rarity_4","Time's up!",0, 7, 10, 10, 16, 6, 0, , , , 575, 70, 30, 515, false,"Paris",crew_portraits_cm_paris_wwii_sm.png,paris_wwii_crew
"Maquis Ro Laren",7,4, 560,102,264,0,0,0,756,139,372,0,0,0,274,132,241,0,0,0,713,261,652,563,590,547,0,958,0,488,414,422,933,0,815,640,205,569,319,525,396,0,677,0,366,176,317,608,0,540,825,453,"Maquis, Bajoran, Survivalist, Saboteur, Desperate","nonhuman, female, organic, tng, ro, crew_max_rarity_4","Not Sure Where I Stand",1, 6, 12, 12, 16, 5, 0, , , , 280, 95, 20, 515, false,"Ro",crew_portraits_cm_ro_maquis_sm.png,ro_maquis_crew
"Dr. Hippocrates Noah",2,4, 0,0,0,675,155,333,0,0,0,0,0,0,353,82,174,571,104,349,598,0,0,962,529,585,421,345,85,0,993,505,901,355,284,465,0,0,885,415,451,316,201,60,0,921,417,801,254,171,842,553,"Hologram, Human, Villain, Crafty, Communicator, Prodigy, Resourceful","male, artificial_life, nonhuman, ds9, noah, sisko, crew_max_rarity_4","Demolish the House",2, 5, 3, 4, 16, 1, 0, , , , 300, 90, 103, 365, true,"Hippocrates",crew_portraits_cm_sisko_noah_sm.png,sisko_noah_crew
"Agent Janeway",8,5, 0,0,0,441,174,384,1013,63,144,0,0,0,1018,209,489,0,0,0,735,565,0,472,0,72,498,91,436,420,59,351,283,0,265,361,892,0,364,0,144,269,13,229,793,163,759,168,0,185,428,232,"Human, Federation, Starfleet, Costumed, Undercover Operative, Crafty","female, organic, voy, janeway, crew_max_rarity_5","Let's End This",0, 8, 10, 3, 14, 5, 1, , , , 465, 105, 125, 675, false,"Janeway",crew_portraits_cm_janeway_wwii_sm.png,janeway_wwii_crew
"Revolutionary Damar",7,5, 895,336,692,0,0,0,391,124,400,0,0,0,869,133,328,0,0,0,272,159,226,94,175,783,0,543,0,695,243,637,477,0,405,43,13,24,14,26,378,0,541,0,351,121,299,450,0,415,454,27,"Cardassian, Cultural Figure, Inspiring, Hero, Desperate","nonhuman, male, organic, ds9, damar, crew_max_rarity_5","For Cardassia!",2, 7, 12, 10, 14, 7, 0, , , , 450, 395, 100, 465, false,"Damar",crew_portraits_cm_damarrevolution_sm.png,damar_revolutionary_crew
"Emotion Chip Data",7,5, 0,0,0,518,108,231,0,0,0,819,182,396,1027,224,578,0,0,0,757,0,457,457,0,746,114,88,452,457,431,0,30,248,247,686,0,284,261,0,658,76,31,405,306,240,0,5,159,120,433,95,"Android, Starfleet, Federation, Cyberneticist, Resourceful, Musician","nonhuman, male, tng, artificial_life, data, crew_max_rarity_5","Humor, I love it!",0, 7, 6, 8, 12, 3, 0, 3, , , 575, 300, 10, 300, true,"Data",crew_portraits_cm_datagenerations_sm.png,data_generations_crew
"Augment Riker",5,4, 332,63,129,0,0,0,566,106,218,579,204,499,0,0,0,0,0,0,990,538,249,1013,857,694,422,0,0,130,828,564,597,319,0,946,504,58,972,814,677,162,0,0,44,804,581,174,72,0,910,525,"Human, Augments, Engineered, Gambler, Desperate, Maverick, Jury Rigger, Survivalist","male, organic, tng, ent, pic, riker, original, crew_max_rarity_4","Last Chance",2, 7, 10, 10, 12, , , , , , 375, 305, 217, 330, false,"Riker",crew_portraits_cm_riker_augment_sm.png,riker_augment_crew
"Garak, Elim Garak",7,5, 1000,229,493,0,0,0,565,66,138,0,0,0,937,179,362,0,0,0,288,163,245,85,191,756,0,432,0,676,181,613,355,0,321,182,178,137,40,122,916,0,422,0,799,280,764,349,0,331,417,219,"Cardassian, Crafty, Resourceful, Undercover Operative, Costumed, Romantic, Hero","male, organic, ds9, nonhuman, garak, crew_max_rarity_5","There's Hope For You Yet",1, 7, 12, 12, 12, 6, 2, , , , 650, 200, 20, 700, false,"Garak",crew_portraits_cm_garak_secretagent_sm.png,garak_secretagent_crew
"Stranded Odo",7,4, 722,188,409,0,0,0,539,54,109,0,0,0,402,50,120,0,0,0,554,300,491,416,419,827,0,926,0,721,628,668,896,0,786,312,291,234,297,212,981,0,966,0,847,796,806,938,0,821,882,854,"Changeling, Desperate, Bajoran, Survivalist","nonhuman, male, organic, ds9, odo, crew_max_rarity_4","Not Without a Fight",0, 6, 8, 10, 10, 4, 2, , , , 275, 70, 130, 465, false,"Odo",crew_portraits_cm_odo_cold_weather_sm.png,odo_cold_weather_crew
"Age of Sail Riker",7,5, 1034,248,518,0,0,0,897,208,400,572,78,158,0,0,0,0,0,0,268,85,48,464,174,371,519,0,0,69,540,263,727,423,0,151,33,33,298,101,273,587,0,0,106,427,206,843,496,0,366,137,"Human, Federation, Starfleet, Explorer, Maverick, Gambler, Costumed","ageofsail, male, organic, tng, riker, crew_max_rarity_5","Battle Stations!",0, 10, 8, 10, 12, , , , 1, 2, 350, , 195, 415, false,"Riker",crew_portraits_cm_riker_age_of_sail_sm.png,riker_ageofsail_crew
"Laas",8,4, 0,0,0,773,139,332,448,58,124,0,0,0,661,28,55,0,0,0,558,877,0,817,0,204,401,162,333,777,495,725,703,0,595,490,928,0,1076,0,238,324,406,299,828,899,789,1030,0,897,779,1021,"Explorer, Changeling, Civilian, Prodigy, Hunter, Survivalist","nonhuman, male, organic, ds9, laas, crew_max_rarity_4","A Pale Shadow",2, 8, 8, 8, 10, , , , 0, 2, 580, 200, 242, 300, false,"Laas",crew_portraits_cm_laas_sm.png,laas_crew
"Age of Sail La Forge",7,4, 404,167,367,0,0,0,408,50,102,794,105,262,0,0,0,0,0,0,779,549,110,844,658,931,413,0,0,238,984,758,578,302,0,389,350,56,544,286,991,419,0,0,373,1045,818,625,341,0,889,726,"Human, Starfleet, Federation, Cyberneticist, Explorer, Costumed, Innovator","ageofsail, male, organic, tng, laforge, crew_max_rarity_4","Hard to Port!",1, 8, 10, 10, 12, , , , 0, 2, 1250, 130, 222, 550, false,"La Forge",crew_portraits_cm_laforge_age_of_sail_sm.png,laforge_ageofsail_crew
"Joachim",10,5, 957,117,254,0,0,0,1251,103,225,0,0,0,0,0,0,0,0,0,478,95,431,614,359,266,0,0,0,242,430,178,0,0,0,633,337,563,736,519,665,0,0,0,606,797,570,0,0,0,594,1042,"Human, Augments, Engineered, Villain, Tactician, Pilot","nonhuman, male, organic, tos, joachim, crew_max_rarity_5","For Khan!",0, 6, 6, 10, 10, 8, 4, , , , 565, 505, 150, 350, false,"Joachim",crew_portraits_cm_joachim2_sm.png,joachim_wok_crew
"Durango Troi",7,5, 840,116,391,0,0,0,1349,52,114,0,0,0,381,207,417,0,0,0,513,97,461,289,382,260,0,763,0,237,111,170,719,0,609,434,358,349,79,318,977,0,314,0,845,245,803,238,0,244,424,401,"Empath, Constable, Scoundrel, Costumed, Federation, Starfleet, Betazoid, Human","female, nonhuman, organic, tng, troi, crew_max_rarity_5","Call Me Durango",2, 10, 12, 12, 12, , , , 0, 2, 525, 375, 20, 725, false,"Troi",crew_portraits_cm_troi_cowboy_sm.png,troi_cowboy_crew
"Sybok",6,4, 0,0,0,670,51,126,0,0,0,0,0,0,827,117,238,215,141,461,689,0,0,684,770,671,474,156,205,0,710,745,552,513,216,969,0,0,752,215,966,655,437,106,0,780,224,633,128,77,762,623,"Vulcan, Inspiring, Spiritual, Explorer, Counselor, Telepath","nonhuman, male, organic, sybok, tos, crew_max_rarity_4","Share Your Pain",1, 7, 6, 8, 10, 3, 0, 3, , , 575, 390, 43, 390, false,"Sybok",crew_portraits_cm_sybok_sm.png,sybok_crew
"Augment Picard",8,5, 938,115,206,0,0,0,1163,221,447,0,0,0,438,108,184,0,0,0,510,89,455,316,377,232,0,894,0,208,119,147,856,0,746,710,142,656,463,603,212,0,804,0,191,129,158,746,0,649,440,413,"Human, Augments, Engineered, Villain, Brutal, Desperate, Survivalist, Hunter, Duelist","male, organic, tng, tos, picard, original, crew_max_rarity_5","Negotiate Surrender",0, 9, 12, 12, 12, , , , , , 600, 215, 110, 500, false,"Picard",crew_portraits_cm_picard_augment_sm.png,picard_augment_crew
"Luther Sloan",9,4, 230,47,86,0,0,0,492,210,485,0,0,0,696,113,217,0,0,0,1040,560,979,593,908,604,0,657,0,550,260,479,611,0,515,1015,240,947,620,879,187,0,740,0,172,105,143,671,0,590,938,580,"Human, Starfleet, Federation, Undercover Operative, Interrogator, Section 31, Villain","male, organic, ds9, sloan, crew_max_rarity_4","Clandestine Meeting",1, 7, 8, 6, 10, 5, 0, , , , 425, 530, 183, 600, true,"Sloan",crew_portraits_cm_luthersloan_sm.png,sloan_spy_crew
"First Officer Riker",9,5, 969,106,241,0,0,0,1039,254,588,0,0,0,466,111,211,0,0,0,475,88,429,294,357,249,0,832,0,231,118,162,796,0,683,672,73,603,390,555,100,0,751,0,104,57,76,687,0,599,416,181,"Human, Federation, Starfleet, Desperate, Marksman, Gambler","male, organic, tng, riker, crew_max_rarity_5","Can't Get Any Worse",2, 9, 6, 6, 6, , , , , , 400, 200, , 515, true,"Riker",crew_portraits_cm_riker_nemesis_sm.png,riker_nemesis_crew
"First Officer Chekov",10,5, 1104,173,409,884,180,347,403,128,265,0,0,0,0,0,0,0,0,0,36,171,232,469,179,92,341,511,271,748,930,695,0,0,0,30,149,259,493,238,73,294,445,249,512,728,479,0,0,0,465,193,"Federation, Starfleet, Human, Resourceful, Tactician","male, organic, tos, chekov, crew_max_rarity_5","If Shoe Fits, Wear It!",0, 9, 12, 5, 12, 2, 0, , , , 600, 25, 100, 450, false,"Chekov",crew_portraits_cm_commander_chekov2_sm.png,chekov_commander_crew
"Klingon Bride Jadzia",7,5, 0,0,0,993,128,279,351,137,273,0,0,0,1014,323,585,0,0,0,398,875,0,437,0,90,297,35,243,771,132,718,247,0,237,580,621,0,193,0,111,377,11,343,489,30,456,59,0,90,422,80,"Federation, Starfleet, Exobiology, Astrophysicist, Trill, Gambler, Romantic, Klingon, Pilot","nonhuman, female, organic, ds9, dax, crew_max_rarity_5","Lead With My Heart",0, 7, 6, 8, 14, 7, 2, , , , 750, 20, 455, 405, false,"J. Dax",crew_portraits_cm_jadzia_dax_bride_sm.png,dax_jadzia_bride_crew
"Martia",8,4, 0,0,0,0,0,0,632,100,203,0,0,0,719,175,358,0,0,0,0,693,0,688,0,633,0,626,0,574,235,507,567,0,481,0,764,0,546,0,715,0,434,0,645,206,614,362,0,345,1023,941,"Chameloid, Shapeshifter, Crafty, Survivalist, Criminal, Scoundrel, Prisoner","nonhuman, female, organic, martia, tos, crew_max_rarity_4","That Was Not His Knee",1, 6, 14, 10, 14, 7, 1, , , , 475, 325, 235, 529, false,"Martia",crew_portraits_cm_martia_sm.png,martia_crew
"Captain Klaa",10,4, 744,160,341,0,0,0,517,100,251,0,0,0,0,0,0,0,0,0,569,281,506,689,436,731,0,0,0,653,845,593,0,0,0,442,226,359,571,330,630,0,0,0,572,777,539,0,0,0,1055,922,"Klingon, Hunter, Tactician, Duelist","nonhuman, male, organic, tos, klaa, crew_max_rarity_4","Warrior's Mettle",0, 6, 12, 8, 14, 0, 2, , , , 650, 250, 125, 525, false,"Klaa",crew_portraits_cm_klaa_sm.png,klaa_crew
"Mintakan Riker",8,5, 516,39,73,0,0,0,1036,259,543,0,0,0,925,154,314,0,0,0,880,165,819,303,758,261,0,491,0,239,48,172,414,0,365,1029,179,967,502,895,112,0,524,0,119,37,88,438,0,403,444,294,"Human, Federation, Starfleet, Survivalist, Hunter, Costumed, Undercover Operative, Vulcan, Mintakan","male, organic, tng, riker, crew_max_rarity_5","Proto-Vulcan Instincts",2, 7, 10, 10, 14, 7, 0, , , , 530, 230, 250, 415, false,"Riker",crew_portraits_cm_riker_mintakan_sm.png,riker_mintakan_crew
