"Antaak",7,4, 0,0,0,630,60,159,0,0,0,0,0,0,0,0,0,532,214,753,591,854,859,862,402,597,399,597,132,846,855,384,838,251,418,658,0,0,0,28,637,409,644,17,0,0,30,0,13,57,723,394,"Klingon, Physician, Desperate, Geneticist","nonhuman, male, organic, ent, crew_max_rarity_4","Klingon Mercy",2, 5, 12, 12, 20, 2, 0, , , , 425, 800, 245, , false,"Antaak",crew_portraits_cm_antaakent_sm.png
"Hugh",5,3, 0,0,0,0,0,0,361,128,282,190,56,124,323,62,138,0,0,0,894,712,813,786,884,710,737,763,860,541,605,644,658,721,704,0,458,648,695,0,397,450,667,0,186,321,336,420,376,548,804,700,"Borg, Maverick, Cultural Figure","nonhuman, male, organic, hugh, tng, crew_max_rarity_3","I Will Not",0, 4, 6, 8, 10, 6, 0, , , , 352, 120, 83, 340, false,"Hugh",crew_portraits_cm_hugh_sm.png
"Thot Gor",9,4, 688,178,406,0,0,0,350,114,223,0,0,0,544,83,168,0,0,0,444,310,390,274,364,631,723,577,704,552,426,513,563,701,481,236,136,176,171,173,478,0,616,0,434,341,408,581,0,499,583,404,"Breen, Diplomat, Dominion, Resourceful, Communicator","organic, ds9, gor, crew_max_rarity_4","Breen Dominance",0, 9, 10, 20, 10, , , 1, , , 775, 335, 65, 300, false,"Gor",crew_portraits_cm_thot_gor_sm.png
"Frederick La Rouque",10,5, 1010,145,341,0,0,0,0,0,0,0,0,0,1271,222,481,0,0,0,251,313,224,15,192,716,576,141,561,661,193,655,110,535,100,332,396,271,42,263,0,0,161,0,0,235,0,111,0,133,335,391,"Human, Gambler, Scoundrel, Linguist, Civilian","male, organic, tng, larouque, crew_max_rarity_5","A Poker Face Carved In Marble",2, 8, 10, 10, 14, 4, 0, , , , 495, 140, 137, 415, false,"La Rouque",crew_portraits_cm_larouque_sm.png
"Glinn Damar",8,2, 262,37,86,0,0,0,321,48,160,0,0,0,0,0,0,0,0,0,865,711,863,870,849,815,910,914,910,798,829,788,917,913,914,754,529,702,761,654,659,0,0,0,570,721,549,0,0,0,891,897,"Cardassian","nonhuman, male, organic, ds9, bridge_crew, damar, crew_max_rarity_2","Bonds of Loyalty",2, 2, 6, 10, 10, 8, 4, , , , 195, 145, , 220, false,"Damar",crew_portraits_cm_damar_sm.png
"Revolutionary Damar",8,5, 895,336,692,0,0,0,391,124,400,0,0,0,869,133,328,0,0,0,155,105,129,48,92,443,536,294,517,382,131,348,266,486,233,33,6,20,11,22,280,0,386,0,254,85,221,319,0,304,272,18,"Cardassian, Cultural Figure, Inspiring, Hero, Desperate","nonhuman, male, organic, ds9, damar, crew_max_rarity_5","For Cardassia!",2, 7, 12, 10, 14, 7, 0, , , , 450, 395, 100, 465, false,"Damar",crew_portraits_cm_damarrevolution_sm.png
"Ripper",8,5, 0,0,0,852,195,430,1332,182,366,0,0,0,0,0,0,0,0,0,297,203,712,768,679,11,233,312,181,126,212,90,729,558,678,194,348,0,0,0,17,152,220,139,230,377,196,0,0,0,357,405,"Brutal, Desperate, Explorer, Primal, Survivalist","organic, dsc, nonhuman, ripper, crew_max_rarity_5","Mycelial Mastery",1, 9, 10, 12, 12, , , , , , 675, 250, 105, 325, false,"Ripper",crew_portraits_cm_tardigrade_sm.png
"Annorax",6,5, 940,76,208,1204,243,569,386,140,296,0,0,0,0,0,0,0,0,0,12,149,239,352,202,24,98,101,62,383,520,349,669,441,602,26,238,526,603,482,14,92,102,75,335,476,312,0,0,0,192,129,"Krenim, Desperate, Romantic, Theoretical Engineer, Scoundrel, Brutal","male, organic, voy, annorax, crew_max_rarity_5","I'll Make The Time",2, 6, 12, 12, 20, 2, 0, , , , 600, 200, 195, 390, false,"Annorax",crew_portraits_cm_annorax_sm.png
"Beloved Annorax",5,5, 539,36,117,1262,176,389,0,0,0,1024,131,282,0,0,0,0,0,0,36,454,42,475,326,97,8,114,68,176,703,570,173,100,577,136,698,196,735,633,240,47,272,167,356,0,0,382,212,0,102,433,"Krenim, Desperate, Theoretical Engineer, Casual, Survivalist","male, organic, voy, annorax, crew_max_rarity_5","Time Is Patient",2, 7, 10, 5, 12, 7, 0, , , , 300, 100, 100, 315, false,"Annorax",crew_portraits_cm_annorax_beloved_sm.png
"Commander Nevesa",9,4, 660,134,471,0,0,0,0,0,0,0,0,0,586,92,237,0,0,0,512,527,455,308,435,858,818,598,804,852,634,835,579,804,500,212,308,157,125,150,0,0,528,0,0,571,0,478,0,421,736,602,"Crafty, Romantic, Romulan, Resourceful","female, nonhuman, tos, nevesa, commander, crew_max_rarity_4","Hidden in Plain Sight",1, 7, 10, 8, 14, 1, 2, , , , 290, 310, 70, 565, false,"Nevesa",crew_portraits_cm_romulancommander_sm.png
"Ba'ul",3,5, 0,0,0,0,0,0,1302,191,342,1099,37,141,0,0,0,548,53,209,671,161,167,679,283,81,167,661,221,8,158,10,181,13,287,0,356,653,0,510,271,455,0,346,116,393,68,660,195,486,63,576,"Ba'ul, Brutal, Interrogator, Geneticist","nonhuman, organic, baul, dsc, crew_max_rarity_5","The Truth Will Be Contained",0, 8, 8, 6, 12, 1, 2, , , , 295, 30, 234, 150, false,"Ba'ul",crew_portraits_cm_baul_sm.png
"Siranna",6,4, 0,0,0,363,79,183,0,0,0,0,0,0,601,96,197,739,158,348,622,798,790,563,333,633,420,341,159,765,583,324,525,216,122,593,0,0,595,239,586,375,286,85,0,616,239,530,158,94,541,500,"Gardener, Kelpien, Spiritual","nonhuman, female, organic, dsc, siranna, crew_max_rarity_4","Look Down Every Now And Then",2, 5, 12, 12, 20, 2, 0, , , , 375, 50, 168, 150, false,"Siranna",crew_portraits_cm_siranna_sm.png
"Priestess Siranna",5,4, 529,112,242,0,0,0,0,0,0,0,0,0,883,138,286,382,78,211,540,544,489,204,251,775,663,371,370,744,438,490,320,330,155,480,507,419,214,123,0,0,423,328,0,491,472,366,306,124,472,497,"Gardener, Kelpien, Spiritual, Civilian, Ambassador, Cultural Figure","nonhuman, female, organic, dsc, siranna, crew_max_rarity_4","The Truth Has Survived",1, 7, 6, 8, 8, , , , , , 450, 200, 100, 475, false,"Siranna",crew_portraits_cm_siranna_priestess_sm.png
"Ensign Vorik",7,3, 0,0,0,0,0,0,0,0,0,383,120,316,0,0,0,0,0,0,921,922,758,926,924,922,648,922,920,729,925,924,759,615,922,0,0,321,0,0,0,251,0,0,336,0,0,349,197,0,906,855,"Starfleet, Federation, Vulcan, Telepath","nonhuman, male, organic, voy, crew_max_rarity_3","Only Logical",1, 4, 10, 6, 15, 2, 0, , 0, 2, 757, 185, 474, 380, false,"Vorik",crew_portraits_cm_vorik_sm.png
"Ensign Seska",5,2, 0,0,0,0,0,0,217,42,145,319,44,122,0,0,0,0,0,0,918,871,827,924,921,865,766,918,915,666,868,842,812,755,918,0,674,660,0,0,688,466,0,0,418,733,569,671,384,0,900,886,"Bajoran, Cardassian, Starfleet, Obsidian Order, Undercover Operative","nonhuman, female, organic, voy, ensign, seska, crew_max_rarity_2","Subtle Sabotage",1, 2, 0, 10, 14, 4, 0, , , , 115, 155, 43, 270, true,"Seska",crew_portraits_cm_seskastarfleet_sm.png
"Kazon Seska",8,4, 465,73,156,0,0,0,327,113,276,798,47,124,0,0,0,0,0,0,619,446,266,648,535,657,346,814,742,270,679,532,499,269,780,642,297,362,663,553,422,463,0,0,217,526,361,667,382,0,654,702,"Cardassian, Kazon, Obsidian Order, Undercover Operative, Villain","nonhuman, female, organic, voy, ensign, seska, crew_max_rarity_4","Shield Puncture",0, 6, 6, 6, 6, , , , , , 715, 155, 184, 1025, true,"Seska",crew_portraits_cm_seskakazonfurs_sm.png
"Yelgrun",7,4, 572,101,216,405,85,247,0,0,0,0,0,0,638,203,466,0,0,0,309,543,482,241,457,596,398,234,367,756,510,748,413,658,358,175,548,477,111,439,486,316,57,301,0,262,0,130,0,150,511,278,"Dominion, Vorta, Clone, Diplomat, Musician","male, ds9, yelgrun, nonhuman, crew_max_rarity_4","I Was Cloned",1, 5, 3, 6, 6, , , , , , 400, 265, 98, 275, true,"Yelgrun",crew_portraits_cm_yelgrun_sm.png
"Chief Engineer Torres",7,1, 0,0,0,0,0,0,97,40,154,252,21,81,0,0,0,0,0,0,927,898,883,930,930,898,855,928,929,808,899,883,877,837,932,0,665,715,0,0,678,508,0,0,482,730,564,728,415,0,921,906,"Starfleet, Federation, Human, Klingon, Maquis, Innovator, Jury Rigger, Saboteur, Cyberneticist","nonhuman, female, organic, voy, lieutenant, torres, crew_max_rarity_1","Natural Engineer",0, 2, 8, 10, 12, , , , 1, 1, 460, 45, 135, 255, false,"Torres",crew_portraits_cm_torreschiefengineer_sm.png
"Maquis Takeover Torres",3,3, 148,76,204,0,0,0,281,78,212,462,44,148,0,0,0,0,0,0,811,661,559,821,781,759,568,890,859,493,787,702,704,524,874,568,335,284,606,488,552,436,0,0,293,622,473,644,367,0,803,719,"Starfleet, Human, Klingon, Maquis, Jury Rigger, Saboteur","nonhuman, female, organic, voy, lieutenant, torres, crew_max_rarity_3","Repressed Command",2, 3, 6, 4, 10, 1, 1, , , , 740, , 130, 475, false,"Torres",crew_portraits_cm_torresmaquis_sm.png
"Liaison Torres",8,4, 263,115,295,0,0,0,0,0,0,551,83,250,669,128,307,0,0,0,667,646,307,396,572,808,384,518,724,492,558,777,206,313,425,415,459,88,167,340,0,313,413,0,437,481,0,84,264,331,622,398,"Federation, Human, Cyberneticist, Klingon, Civilian, Diplomat","nonhuman, female, organic, voy, torres, crew_max_rarity_4","Career Change",0, 5, 12, 12, 20, 2, 0, , , , , 345, , 750, false,"Torres",crew_portraits_cm_torres25c_sm.png
"Duelist Torres",8,5, 0,0,0,0,0,0,903,165,428,1067,208,464,0,0,0,0,0,0,752,368,200,780,701,307,189,755,610,30,375,229,224,128,696,0,316,119,0,0,213,133,0,0,8,334,165,129,70,0,397,318,"Athlete, Innovator, Jury Rigger, Human, Federation, Klingon, Maquis, Duelist, Cyberneticist","female, organic, voy, nonhuman, torres, crew_max_rarity_5","Empassioned Maneuver",1, 8, 10, 10, 12, 8, 4, , , , 800, 280, 20, 100, false,"Torres",crew_portraits_cm_torresduelist_sm.png
"Assimilated Torres",7,5, 0,0,0,0,0,0,851,124,323,1114,231,477,0,0,0,0,0,0,761,400,175,785,711,333,172,760,622,33,422,246,190,112,703,0,427,109,0,0,366,119,0,0,13,462,302,107,56,0,410,421,"Borg, Jury Rigger, Human, Federation, Klingon, Maquis, Undercover Operative, Cyberneticist","female, organic, voy, nonhuman, torres, crew_max_rarity_5","Modulated Shields",0, 8, 6, 10, 10, 3, 0, 3, , , 680, 125, 260, 400, false,"Torres",crew_portraits_cm_torres_assimilated_sm.png
"Klingon Torres",6,4, 0,0,0,0,0,0,895,81,230,625,75,208,0,0,0,0,0,0,849,484,530,856,832,455,394,836,773,155,530,357,566,323,808,0,557,528,0,0,516,357,0,0,184,595,448,543,310,0,696,794,"Klingon, Civilian, Brutal, Duelist, Desperate, Prisoner","nonhuman, female, organic, voy, torres, crew_max_rarity_4","You Need Me",0, 5, 1, 12, 20, 2, 0, , , , 355, 275, 53, 405, true,"Torres",crew_portraits_cm_torres_klingon_sm.png
"Human Torres",8,5, 0,0,0,0,0,0,0,0,0,992,107,262,1270,182,357,0,0,0,740,739,271,245,689,738,234,181,590,268,243,678,13,155,136,0,0,402,388,0,0,291,300,0,398,384,0,41,237,246,371,627,"Jury Rigger, Human, Federation, Starfleet, Maquis, Prisoner, Cyberneticist","female, organic, voy, torres, crew_max_rarity_5","Brute Force Isn't Going To Do It",2, 10, 12, 10, 10, , , , , , 350, 200, 100, 150, false,"Torres",crew_portraits_cm_torres_human_sm.png
"Delta Flyer Torres",4,5, 554,60,132,0,0,0,1021,79,246,1278,190,397,0,0,0,0,0,0,383,122,24,449,299,207,97,668,430,10,298,157,69,38,570,690,371,75,699,594,500,182,0,0,49,579,426,205,115,0,85,461,"Human, Federation, Starfleet, Romantic, Pilot, Athlete, Klingon","nonhuman, female, organic, voy, torres, crew_max_rarity_5","You Know How Much I Hate To Lose",0, 9, 8, 10, 12, , , , 2, 3, 400, 100, 108, 300, false,"Torres",crew_portraits_cm_torres_deltaflyer_sm.png
"Injured Torres",1,2, 259,48,109,0,0,0,0,0,0,369,62,197,0,0,0,0,0,0,843,842,647,853,827,913,662,909,904,742,912,909,767,637,906,728,694,344,730,627,0,378,0,0,515,0,0,567,324,0,876,864,"Starfleet, Klingon, Human, Maquis, Survivalist, Innovator, Jury Rigger, Cyberneticist, Federation, Desperate","nonhuman, female, voy, torres, lieutenant, crew_max_rarity_2","I'm Going To Get This One",1, 4, 6, 6, 8, 3, 0, , , , 253, 200, 105, 225, false,"Torres",crew_portraits_cm_torre_injured_sm.png
"Section 31 Reed",8,2, 119,20,64,0,0,0,309,51,157,0,0,0,0,0,0,0,0,0,901,785,903,912,897,840,919,923,923,834,853,820,924,923,923,770,578,727,787,679,660,0,0,0,571,722,550,0,0,0,909,908,"Starfleet, Human, Undercover Operative, Marksman, Desperate, Section 31","male, organic, ent, lieutenant, reed, crew_max_rarity_2","Covert Strike",1, 2, 6, 2, 12, 1, 1, , , , 270, 150, 3, 190, false,"Reed",crew_portraits_cm_reedsection31_sm.png
"Sniper Reed",7,3, 331,92,246,0,0,0,401,98,204,0,0,0,0,0,0,0,0,0,760,572,738,784,710,742,891,901,883,688,775,682,904,884,896,500,282,446,551,408,531,0,0,0,475,606,462,0,0,0,840,774,"Starfleet, Human, Tactician, Marksman","male, organic, ent, lieutenant, reed, crew_max_rarity_3","Deception and Surprise",0, 3, 6, 3, 12, 1, 0, , , , 515, 245, 15, 250, false,"Reed",crew_portraits_cm_reedsniper_sm.png
"Suliban Reed",9,5, 925,262,605,0,0,0,452,100,219,0,0,0,897,178,312,0,0,0,175,117,143,52,113,460,547,289,527,394,136,359,260,499,229,70,51,45,21,42,507,0,355,0,457,164,433,293,0,279,291,77,"Starfleet, Human, Suliban, Tactician, Saboteur, Undercover Operative","male, organic, ent, lieutenant, reed, crew_max_rarity_5","Starting to Itch",1, 7, 6, 12, 12, 0, 1, , , , 65, 250, 40, 575, false,"Reed",crew_portraits_cm_reedsuliban_sm.png
"Rura Penthe Reed",7,4, 497,121,372,0,0,0,624,163,548,0,0,0,0,0,0,0,0,0,597,276,542,618,512,501,817,851,801,432,565,398,844,802,826,321,47,264,419,255,132,0,0,0,117,227,99,0,0,0,733,375,"Starfleet, Human, Desperate, Criminal, Undercover Operative, Prisoner","male, organic, ent, reed, crew_max_rarity_4","As You Were",0, 9, 8, 12, 10, , , 2, , , 755, 235, 173, 400, false,"Reed",crew_portraits_cm_reedrurapenthe_sm.png
"Mirror Reed",8,5, 983,151,362,0,0,0,1215,256,560,0,0,0,0,0,0,0,0,0,258,36,233,346,200,120,578,720,565,109,194,74,712,539,663,298,24,236,402,226,80,0,0,0,81,158,63,0,0,0,339,268,"Terran Empire, Human, Brutal, MACO, Marksman, Starfleet, Mirror Universe","male, organic, ent, reed, crew_max_rarity_5","Extreme Punishment",0, 9, 12, 5, 10, 1, 0, 2, , , 555, 210, 147, 350, false,"Reed",crew_portraits_cm_reed_mirror_sm.png
"Tourist Reed",9,4, 732,138,369,0,0,0,239,165,337,0,0,0,719,13,30,0,0,0,430,315,377,237,347,639,698,551,686,554,406,517,531,681,455,309,97,247,383,234,301,0,768,0,273,380,241,754,0,644,552,510,"Starfleet, Human, Romantic, Desperate, Resourceful","male, organic, ent, lieutenant, reed, crew_max_rarity_4","Follow Two Aliens into a Basement",2, 9, 11, 4, 10, , , , , , 190, 292, 120, 450, false,"Reed",crew_portraits_cm_reed_tourist_sm.png
"Abraham Lincoln",9,5, 947,152,276,0,0,0,416,103,203,0,0,0,927,329,639,0,0,0,254,150,225,45,195,476,540,178,521,410,93,373,144,491,133,398,228,330,17,321,524,0,66,0,471,29,453,30,0,58,282,66,"Human, Civilian, President, Resourceful, Inspiring, Diplomat, Cultural Figure","male, organic, crew_max_rarity_5","No Gentle Way",2, 9, 12, 5, 12, 1, 0, , , , 1250, 195, 252, 925, false,"Lincoln",crew_portraits_cm_abrahamlincoln_sm.png
"Gul Madred",9,5, 925,149,298,0,0,0,924,274,608,0,0,0,464,114,222,0,0,0,256,63,230,158,199,162,538,473,519,159,89,119,436,488,380,374,25,314,204,305,66,0,522,0,58,36,46,470,0,412,277,79,"Cardassian, Interrogator, Brutal, Survivalist, Veteran","nonhuman, male, organic, tng, madred, crew_max_rarity_5","Five Lights",1, 7, 14, 6, 10, 1, 0, 2, , , 415, 420, , 300, false,"Madred",crew_portraits_cm_gulmadred_sm.png
"Garth of Izar",5,5, 1214,226,444,0,0,0,989,156,344,0,0,0,487,83,142,0,0,0,106,16,82,91,48,173,468,450,440,173,103,139,412,401,357,161,54,121,142,110,304,0,639,0,275,216,243,609,0,521,107,214,"Prisoner, Desperate, Human, Brutal, Resourceful, Villain, Shapeshifter, Veteran","organic, male, tos, garth_izar, crew_max_rarity_5","I'm Afraid of No One",0, 8, 6, 8, 10, 1, 0, 2, , , 300, 200, 185, 225, false,"Garth",crew_portraits_cm_garth_izar_sm.png
"Nomad",5,5, 0,0,0,1281,182,365,556,91,145,988,115,218,0,0,0,0,0,0,102,430,194,691,589,21,18,111,66,48,459,283,214,124,580,259,632,453,0,0,91,69,292,174,210,682,519,471,265,0,110,447,"Brutal, Telepath, Exobiology, Explorer, Probe, Resourceful","nonhuman, tos, artificial_life, nomad, crew_max_rarity_5","That Which Is Imperfect Must Be Sterilized",0, 8, 8, 10, 10, , , , , , 100, 505, 150, 50, false,"Nomad",crew_portraits_cm_nomad_sm.png
"Mirror 'Smiley' O'Brien",2,3, 373,37,77,0,0,0,180,30,84,545,30,102,0,0,0,0,0,0,757,681,495,781,706,821,546,888,855,537,833,794,689,497,871,756,639,580,763,657,753,490,0,0,528,775,617,705,402,0,797,883,"Human, Resourceful, Jury Rigger, Terran Rebellion, Mirror Universe","male, organic, ds9, mirror, captain, obrien, crew_max_rarity_3","Reroute Subsystems",1, 5, 6, 10, 20, 3, 0, , , , 290, , 74, 1030, false,"O'Brien",crew_portraits_cm_obriensmiley_sm.png
"Chief O'Brien",6,4, 305,12,46,0,0,0,495,63,148,631,153,350,0,0,0,0,0,0,729,524,324,758,671,645,364,837,774,265,670,524,527,290,809,780,599,199,795,688,648,218,0,0,112,715,544,280,159,0,698,710,"Human, Starfleet, Federation, Jury Rigger, Veteran","male, organic, ds9, obrien, crew_max_rarity_4","Power Up Interface",2, 6, 6, 6, 6, , , , , , 1205, 200, 510, 100, true,"O'Brien",crew_portraits_cm_obrienpostfirstcontact_sm.png
"Undercover O'Brien",4,4, 0,0,0,0,0,0,723,145,288,638,114,239,228,13,39,0,0,0,827,503,486,769,805,480,365,738,739,157,439,376,403,293,679,0,445,422,796,0,384,301,765,0,92,425,317,395,250,641,646,665,"Human, Starfleet, Federation, Jury Rigger, Veteran, Undercover Operative","male, organic, ds9, obrien, crew_max_rarity_4","Intelligence Report",1, 7, 6, 12, 12, 5, 0, 2, , , 1200, 355, 412, 565, false,"O'Brien",crew_portraits_cm_obrienundercover_sm.png
"Klingon O'Brien",4,4, 0,0,0,0,0,0,432,28,60,589,104,229,746,167,372,0,0,0,797,619,474,462,764,640,357,418,670,289,333,518,126,282,317,0,730,454,389,0,771,314,301,0,352,303,633,48,266,247,527,586,"Starfleet, Federation, Klingon, Human, Jury Rigger, Undercover Operative, Duelist, Veteran","male, organic, ds9, obrien, crew_max_rarity_4","House of Konjah",2, 8, 6, 4, 10, 3, 0, 2, , , 1380, 240, 110, 690, false,"O'Brien",crew_portraits_cm_obrien_klingon_sm.png
"RAF Miles O'Brien",4,5, 1060,60,137,0,0,0,625,95,205,1121,176,346,0,0,0,0,0,0,226,112,12,312,169,344,132,680,465,37,432,253,134,78,597,682,388,102,696,589,533,216,0,0,77,608,464,267,150,0,170,541,"Human, Pilot, Jury Rigger, Hero, Costumed","male, organic, tng, obrien, ds9, crew_max_rarity_5","Per Ardua Ad Astra",0, 7, 16, 3, 16, 1, 2, , , , 700, , 182, 890, false,"O'Brien",crew_portraits_cm_obrienwwii_sm.png
"Falcon O'Brien",5,5, 913,97,234,0,0,0,1353,80,168,486,89,191,0,0,0,0,0,0,276,57,59,369,221,132,314,692,508,41,205,86,432,230,621,508,328,155,557,417,599,359,0,0,252,670,507,546,312,0,259,654,"Human, Starfleet, Federation, Costumed, Villain, Hologram, Brutal, Scoundrel","male, organic, ds9, obrien, crew_max_rarity_5","I Expect You To Die",0, 9, 10, 14, 12, , , 2, , , , 25, 100, 450, false,"Falcon",crew_portraits_cm_obrien_falcon_sm.png
"Prisoner O'Brien",4,4, 0,0,0,0,0,0,583,83,187,694,244,503,447,11,21,0,0,0,798,547,328,656,765,544,269,634,671,124,417,438,218,185,529,0,597,86,799,0,574,104,770,0,32,607,491,77,42,647,526,514,"Human, Starfleet, Federation, Prisoner, Desperate, Survivalist, Brutal, Jury Rigger","male, organic, ds9, obrien, crew_max_rarity_4","It's Real To Me",0, 7, 4, 14, 16, 5, 0, , , , 400, 80, 85, 525, false,"O'Brien",crew_portraits_cm_obrien_prisoner_sm.png
"Augment Commander O'Brien",5,5, 0,0,0,0,0,0,1139,311,671,965,175,366,0,0,0,0,0,0,725,188,236,753,667,118,207,719,563,17,192,72,255,141,662,0,112,211,0,0,38,207,0,0,1,89,28,249,142,0,338,131,"Human, Augments, Engineered, Tactician, Saboteur, Marksman, Brutal, Innovator","male, organic, obrien, tos, tng, ds9, original, crew_max_rarity_5","Take Aim!",0, 9, 8, 8, 12, 7, 4, , , , 540, 410, 45, 200, false,"O'Brien",crew_portraits_cm_obrien_augment_sm.png
"Keevan",5,3, 486,60,156,0,0,0,0,0,0,0,0,0,303,85,199,0,0,0,730,725,703,596,672,903,893,772,885,896,804,891,761,886,716,662,648,614,415,567,0,0,581,0,0,632,0,542,0,468,844,827,"Vorta, Dominion, Clone, Crafty, Brutal","nonhuman, male, organic, ds9, crew_max_rarity_3","Immoral Diplomacy",1, 7, 8, 12, 12, , , , 0, 2, 415, 185, , 330, false,"Keevan",crew_portraits_cm_keevan_sm.png
"Returning Craft",7,5, 1246,211,449,0,0,0,972,97,212,0,0,0,531,57,172,0,0,0,98,35,78,82,43,256,480,419,455,219,117,194,374,417,319,165,115,125,145,112,521,0,635,0,469,388,450,606,0,518,142,381,"Romantic, Human, Crafty, Resourceful, Pilot, Veteran","male, organic, craft, dsc, crew_max_rarity_5","Then I'll Just Say Goodbye",1, 9, 4, 10, 8, , , , , , 440, 270, 10, 200, false,"Craft",crew_portraits_cm_craft_shuttle_sm.png
"Stranded Craft",5,3, 337,48,130,0,0,0,526,63,171,223,29,79,0,0,0,0,0,0,748,533,614,778,697,685,718,884,846,511,726,602,784,698,867,707,456,523,715,606,622,504,0,0,431,685,522,724,413,0,789,820,"Romantic, Human, Crafty, Resourceful, Pilot, Veteran","male, organic, craft, dsc, crew_max_rarity_3","Anyone Else On This Ship?",2, 5, 4, 8, 12, , , , , , 540, , 40, 150, false,"Craft",crew_portraits_cm_craft_sm.png
"Ishara Yar",4,5, 559,49,125,0,0,0,1311,163,352,1079,66,131,0,0,0,0,0,0,387,82,44,453,306,88,173,669,434,12,165,47,192,114,575,709,252,400,717,609,295,430,0,0,114,403,231,637,361,0,95,634,"Human, Scoundrel, Veteran, Saboteur, Desperate","female, tng, yar_ishara, crew_max_rarity_5","I Did What I Had To",1, 10, 6, 10, 10, , , , , , 410, 200, 45, 215, false,"Ishara",crew_portraits_cm_yar_ishara_sm.png
"Technician Rom",4,2, 0,0,0,0,0,0,0,0,0,383,34,76,187,28,79,0,0,0,919,921,820,894,922,921,753,881,918,807,882,923,735,740,864,0,0,710,771,0,0,502,748,0,650,783,0,619,412,622,904,925,"Ferengi, Bajoran, Civilian, Saboteur, Jury Rigger","nonhuman, male, organic, ds9, rom, crew_max_rarity_2","Jurryrigged Fix",2, 2, 6, 4, 4, 2, 0, 2, , , 230, 50, 100, 225, false,"Rom",crew_portraits_cm_romtechnitian_sm.png
"Grand Nagus Rom",8,5, 583,10,26,0,0,0,0,0,0,869,126,257,951,254,502,0,0,0,482,506,87,142,398,706,238,221,548,275,295,638,20,161,175,783,743,342,199,692,0,280,138,0,388,198,0,16,230,112,318,400,"Ferengi, Bajoran, Diplomat, Saboteur, Cultural Figure","nonhuman, male, organic, ds9, nagus, rom, crew_max_rarity_5","Equal Pay",2, 9, 12, 12, 12, , , , , , 900, , 135, 950, false,"Rom",crew_portraits_cm_romnagus_sm.png
"Niners Rom",3,4, 0,0,0,0,0,0,544,144,297,853,102,239,0,0,0,0,0,0,855,585,420,860,839,585,326,842,786,170,619,473,468,244,816,0,434,441,0,0,376,308,0,0,94,469,308,464,260,0,712,706,"Ferengi, Bajoran, Desperate, Resourceful, Jury Rigger, Athlete, Saboteur, Hero, Costumed","nonhuman, male, organic, ds9, rom, niners, crew_max_rarity_4","Bunt",0, 8, 6, 6, 10, , , , 2, 2, 865, 300, 185, 80, false,"Rom",crew_portraits_cm_rom_niners_sm.png
"Doctor Ann Mulhall",7,5, 1032,76,245,1301,151,322,0,0,0,0,0,0,484,90,186,0,0,0,10,263,178,138,145,102,106,50,71,610,500,583,401,412,344,94,542,473,343,434,338,231,139,216,0,639,0,551,0,474,137,495,"Starfleet, Federation, Exobiology, Explorer, Human","female, organic, tos, ann_mulhall, crew_max_rarity_5","It Is Scientifically Fascinating",2, 7, 10, 10, 14, 6, 0, , , , 425, 100, 98, 200, false,"Mulhall",crew_portraits_cm_mulhall_doctor_sm.png
"Berlinghoff Rasmussen",9,4, 0,0,0,439,146,447,811,58,145,0,0,0,237,154,318,0,0,0,552,500,812,672,786,188,374,356,344,407,370,371,631,717,548,228,659,0,438,0,84,176,39,155,579,255,558,308,0,293,605,315,"Civilian, Human, Scoundrel, Desperate, Crafty, Resourceful","male, organic, tng, rasmussen, crew_max_rarity_4","Question Your Convictions",0, 7, 6, 8, 10, 3, 0, 3, , , 475, 290, 145, 350, false,"Rasmussen",crew_portraits_cm_berlinghoffrasmussen_sm.png
"Koloth",5,3, 437,28,78,0,0,0,236,18,64,0,0,0,412,114,262,0,0,0,727,620,701,542,670,795,859,693,845,772,628,761,683,845,624,761,670,711,428,663,774,0,474,0,665,448,635,423,0,384,787,804,"Klingon, Diplomat, Tactician, Duelist","nonhuman, male, organic, tos, koloth, crew_max_rarity_3","I Am Koloth",0, 4, 8, 8, 10, 2, 2, , , , 525, 140, 243, 150, false,"Koloth",crew_portraits_cm_kolothtos_sm.png
"Dahar Master Koloth",3,5, 421,134,298,0,0,0,1281,247,530,0,0,0,914,180,444,0,0,0,370,72,330,113,289,57,432,190,399,58,1,26,157,354,153,392,44,326,85,316,96,0,223,0,95,10,78,171,0,181,10,42,"Klingon, Brutal, Spiritual, Cultural Figure, Dahar Master, Duelist, Veteran","nonhuman, male, organic, ds9, koloth, crew_max_rarity_5","You Disgrace Yourself",0, 9, 12, 10, 14, 5, 4, , , , 300, 210, 168, 515, false,"Koloth",crew_portraits_cm_koloth_daharmaster_sm.png
"Ardra",2,4, 0,0,0,0,0,0,703,120,243,309,87,191,537,104,183,0,0,0,826,519,645,610,804,496,479,588,737,281,336,396,349,416,491,0,502,535,599,0,448,362,578,0,154,278,383,226,316,465,644,609,"Costumed, Crafty, Villain, Cultural Figure, Thief","female, organic, tng, ardra, crew_max_rarity_4","I Pity You",2, 7, 6, 12, 12, 5, 0, 2, , , 650, 325, 695, 425, false,"Ardra",crew_portraits_cm_arda_sm.png
"Q2",6,5, 0,0,0,0,0,0,826,186,392,0,0,0,1263,281,503,349,150,341,684,304,642,163,359,259,475,87,268,223,5,27,49,226,25,0,331,0,205,257,228,0,118,207,198,19,15,75,166,14,127,38,"Brutal, Interrogator, Q Continuum","nonhuman, male, tng, q2, crew_max_rarity_5","Not Bad",0, 9, 10, 10, 10, , , , , , 490, 200, 118, 475, false,"Q2",crew_portraits_cm_q2_sm.png
"Colonel Q",8,5, 1058,88,199,0,0,0,1278,179,367,0,0,0,526,46,68,0,0,0,203,29,174,147,142,100,483,468,457,87,68,57,430,420,377,557,178,520,497,478,256,0,742,0,234,270,200,718,0,615,152,593,"Brutal, Veteran, Interrogator, Q Continuum","nonhuman, organic, male, voy, colonel_q, crew_max_rarity_5","The Time For Diplomacy Is Past",2, 10, 3, 6, 12, , , 2, , , 350, 270, 58, 125, false,"Colonel Q",crew_portraits_cm_colonel_q_sm.png
"Tora Ziyal",9,5, 0,0,0,0,0,0,0,0,0,0,0,0,1147,197,429,849,192,505,745,745,725,280,234,747,612,214,184,694,285,225,179,157,17,0,0,0,325,102,0,0,221,107,0,304,102,168,62,9,383,272,"Cardassian, Bajoran, Romantic, Civilian, Artist","female, ds9, tora, crew_max_rarity_5","Never Doubt",1, 8, 10, 10, 12, , , , , , 650, 170, 170, 490, false,"Ziyal",crew_portraits_cm_tora_ziyal_sm.png
"Lt. Naomi Wildman",4,2, 0,0,0,0,0,0,0,0,0,332,47,141,238,38,89,0,0,0,917,919,819,884,920,918,750,864,913,801,874,918,708,736,845,0,0,640,757,0,0,440,735,0,591,769,0,502,369,609,896,900,"Human, Ktarian, Starfleet, Federation, Resourceful","female, nonhuman, organic, voy, naomi, crew_max_rarity_2","Make Us Proud",2, 3, 3, 10, 5, 3, 0, 2, , , 380, , 107, 230, false,"Naomi",crew_portraits_cm_wildmanfuture_sm.png
"Ensign Chekov",10,1, 220,45,112,151,27,91,0,0,0,0,0,0,0,0,0,0,0,0,823,882,884,895,873,892,877,894,869,925,929,929,928,928,930,573,695,671,731,628,752,499,741,460,0,0,0,0,0,0,919,909,"Federation, Starfleet, Human","male, organic, tos, ensign, bridge_crew, chekov, crew_max_rarity_1","Russian Invention",0, 2, 3, 10, 5, 3, 0, 2, , , 295, 15, , 445, false,"Chekov",crew_portraits_cm_chekov_sm.png
