"Agent Harris",10,4, 645,161,347,0,0,0,305,111,261,0,0,0,397,186,372,0,0,0,502,338,434,291,386,778,0,654,0,662,469,631,611,0,522,351,175,277,91,263,502,0,345,0,448,124,432,273,0,284,745,212,"Human, Starfleet, Brutal, Undercover Operative, Resourceful, Section 31","male, organic, ent, harris, crew_max_rarity_4","Adjust Your Comfort Level",2, 6, 12, 12, 12, 4, 2, , , , 500, 270, 71, 275, false,"Harris",crew_portraits_cm_harris_sm.png,harris_spy_crew
"Aviator Yar",6,5, 515,95,229,0,0,0,1021,217,543,1095,73,186,0,0,0,0,0,0,649,120,47,694,539,225,230,0,0,24,356,149,267,143,0,603,87,209,660,506,122,455,0,0,30,211,98,664,389,0,266,282,"Human, Pilot, Maverick, Duelist, Hero, Survivalist, Costumed","female, organic, tng, lieutenant, bridge_crew, yar, original, crew_max_rarity_5","Danger Zone",0, 7, 6, 12, 12, 0, 1, , , , 240, , 47, 415, false,"Yar",crew_portraits_cm_yarwwii_sm.png,yar_pilot_crew
"Tuskegee Mayweather",7,4, 589,63,152,0,0,0,0,0,0,828,74,159,0,0,0,0,0,0,638,642,80,683,524,0,348,0,0,423,0,0,476,261,0,773,749,361,784,667,0,485,0,0,629,0,0,702,408,0,892,989,"Human, Pilot, Hero, Costumed","male, organic, ent, mayweather, original, crew_max_rarity_4","Unsung Hero",2, 6, 12, 12, 12, 7, 0, , , , 490, 220, 187, 355, false,"Mayweather",crew_portraits_cm_mayweatherwwii_sm.png,mayweather_tuskegee_crew
"GI Chakotay",8,4, 634,156,367,0,0,0,513,162,325,0,0,0,200,168,326,0,0,0,503,232,435,401,389,568,0,817,0,492,433,452,794,0,692,331,112,256,113,245,367,0,421,0,326,99,294,334,0,329,731,162,"Human, Starfleet, Federation, Hunter, Tactician, Survivalist, Costumed, Maquis","male, organic, voy, bridge_crew, commander, first_officer, chakotay, crew_max_rarity_4","Gung Ho",0, 6, 12, 12, 12, 7, 0, , , , 765, 185, 10, 850, false,"Chakotay",crew_portraits_cm_chakotaywwii_sm.png,chakotay_wwii_crew
"RAF Miles O'Brien",6,5, 1060,60,137,0,0,0,625,95,205,1121,176,346,0,0,0,0,0,0,366,140,17,476,274,547,202,0,0,40,656,438,223,106,0,796,439,118,811,688,612,254,0,0,92,705,533,310,168,0,240,633,"Human, Pilot, Jury Rigger, Hero, Costumed","male, organic, tng, obrien, ds9, crew_max_rarity_5","Per Ardua Ad Astra",0, 7, 16, 3, 16, 1, 2, , , , 700, , 182, 890, false,"O'Brien",crew_portraits_cm_obrienwwii_sm.png,obrien_wwii_crew
"RAF Julian Bashir",3,4, 0,0,0,0,0,0,583,112,241,0,0,0,0,0,0,830,57,144,0,608,0,0,381,565,0,0,302,491,666,43,0,260,413,0,585,0,0,689,533,0,0,480,470,646,226,0,426,650,879,942,"Human, Pilot, Hero, Costumed, Engineered, Physician","nonhuman, male, organic, ds9, bashir, crew_max_rarity_4","Hedge Hopping",1, 7, 3, 8, 12, , , , , , 830, 725, 104, 515, false,"Bashir",crew_portraits_cm_bashirwwii_sm.png,bashir_wwii_crew
"Command Hologram",8,4, 615,62,144,0,0,0,282,29,93,0,0,0,0,0,0,674,94,319,623,490,552,673,47,865,0,0,313,738,899,185,0,274,427,787,614,720,804,162,867,0,0,296,731,904,253,0,239,416,788,852,"Hologram, Human, Federation, Starfleet, Hero, Musician, Tactician","nonhuman, male, artificial_life, voy, ech, emh, crew_max_rarity_4","Activate the Photonic Cannon!",2, 9, 12, 10, 12, , , , 1, 2, 365, 150, 45, 375, false,"Doctor",crew_portraits_cm_ech_sm.png,emh_command_crew
"Hologram Barclay",9,4, 0,0,0,614,52,113,0,0,0,666,169,378,0,0,0,0,0,0,645,0,430,0,0,615,125,632,382,428,0,0,481,264,0,841,0,252,0,0,833,128,820,520,287,0,0,283,153,0,895,878,"Hologram, Human, Starfleet, Federation, Innovator, Astrophysicist","male, nonhuman, artificial_life, voy, barclay, crew_max_rarity_4","Problem Solver",2, 7, 12, 10, 12, , , , , , 590, 100, 135, 415, false,"Barclay",crew_portraits_cm_barclayhologram_sm.png,barclay_hologram_crew
"Antaak",5,4, 0,0,0,630,60,159,0,0,0,0,0,0,0,0,0,532,214,753,613,0,0,0,347,585,404,602,70,0,0,347,0,228,378,776,0,0,0,32,750,492,754,20,0,0,36,0,15,63,859,467,"Klingon, Physician, Desperate, Geneticist","nonhuman, male, organic, ent, crew_max_rarity_4","Klingon Mercy",2, 5, 12, 12, 20, 2, 0, , , , 425, 800, 245, , false,"Antaak",crew_portraits_cm_antaakent_sm.png,antaak_crew
"Koloth",3,3, 437,28,78,0,0,0,236,18,64,0,0,0,412,114,262,0,0,0,778,595,707,522,665,887,0,738,0,752,627,729,698,0,609,887,772,816,505,772,892,0,570,0,755,530,731,492,0,455,925,941,"Klingon, Diplomat, Tribbled, Tactician, Duelist","nonhuman, male, organic, tos, koloth, crew_max_rarity_3","I Am Koloth",0, 4, 8, 8, 10, 2, 2, , , , 525, 140, 243, 150, false,"Koloth",crew_portraits_cm_kolothtos_sm.png,koloth_crew
"Kurak",7,4, 0,0,0,819,66,127,0,0,0,565,74,183,265,127,261,0,0,0,501,0,590,838,0,494,134,290,307,539,853,0,338,347,679,808,0,659,606,0,792,288,317,492,595,622,0,174,393,446,755,795,"Klingon, Innovator, Astrophysicist, Warp Theorist","nonhuman, female, organic, tng, kurak, crew_max_rarity_4","Enough Accusations",2, 6, 6, 6, 6, , , , , , 543, , 93, 125, true,"Kurak",crew_portraits_cm_kuraktng_sm.png,kurak_crew
"23rd Century Martok",6,5, 468,138,283,0,0,0,1040,180,468,0,0,0,868,187,454,0,0,0,648,127,587,172,537,234,0,374,0,208,41,157,296,0,275,470,91,391,93,384,198,0,255,0,169,27,148,178,0,206,314,66,"Klingon, Duelist, Costumed, Veteran, Undercover Operative","nonhuman, male, organic, tos, ds9, martok, original, crew_max_rarity_5","Trapped Sabre Bear",2, 9, 12, 12, 12, , , , , , 350, 260, 340, , false,"Martok",crew_portraits_cm_martok_tos_sm.png,martok_tos_crew
"Mirror K'Ehleyr",4,4, 394,60,160,0,0,0,672,161,354,0,0,0,622,36,109,0,0,0,767,324,693,451,656,486,0,633,0,429,222,381,591,0,503,765,254,703,622,662,334,0,840,0,297,298,266,811,0,707,720,747,"Klingon, Brutal, Tactician, Duelist, Human, Klingon-Cardassian Alliance, Mirror Universe","nonhuman, female, organic, kehleyr, mirror, original, ds9, tng, crew_max_rarity_4","I Do Bite",0, 7, 12, 10, 14, 1, 2, , , , 150, 260, 308, 75, false,"K'Ehleyr",crew_portraits_cm_kehleyrmirror_sm.png,kehleyr_mirror_crew
"EV Suit Tucker",6,4, 444,149,555,0,0,0,0,0,0,708,121,356,0,0,0,0,0,0,551,574,68,625,446,0,349,0,0,424,0,0,477,262,0,167,278,5,286,108,0,270,0,0,345,0,0,352,193,0,863,468,"Human, Starfleet, Jury Rigger, Survivalist, Desperate","male, organic, evsuit, ent, commander, tucker, crew_max_rarity_4","Extravehicular Tactics",2, 7, 6, 8, 10, 3, 0, 3, , , 625, 95, 422, 600, false,"Trip",crew_portraits_cm_tuckerev_sm.png,tucker_evsuit_crew
"Gorn Captain",9,4, 402,139,478,0,0,0,659,223,424,0,0,0,0,0,0,0,0,0,629,225,558,678,518,473,0,0,0,410,597,368,0,0,0,234,40,163,375,156,200,0,0,0,172,310,150,0,0,0,877,358,"Brutal, Duelist, Gorn, Veteran, Desperate","male, organic, tos, captain, crew_max_rarity_4","Merciful and Quick",0, 7, 6, 6, 6, , , , , , 595, 300, 170, 365, true,"Gorn",crew_portraits_cm_gorncaptain_sm.png,gorn_captain_crew
"Young Khan",6,4, 328,77,164,0,0,0,0,0,0,631,42,117,777,87,165,0,0,0,822,779,331,399,712,0,418,544,0,529,616,0,89,338,420,722,711,422,491,620,0,561,723,0,709,785,0,451,458,588,752,903,"Human, Augments, Engineered, Romantic, Cultural Figure, Villain, Brutal, Tactician","nonhuman, male, organic, tos, khan, crew_max_rarity_4","This Grows Tiresome",0, 8, 6, 6, 10, , , , 2, 2, 590, 440, 15, 400, false,"Khan",crew_portraits_cm_khanyoung_sm.png,khan_young_crew
"Pah-wraith Cult Dukat",8,5, 1015,94,157,0,0,0,509,28,58,0,0,0,1069,212,398,0,0,0,383,223,332,70,290,749,0,292,0,634,119,605,224,0,221,707,601,657,192,613,890,0,286,0,754,276,730,209,0,230,380,697,"Cardassian, Bajoran, Inspiring, Communicator, Cultural Figure, Villain, Spiritual","nonhuman, male, organic, ds9, dukat, crew_max_rarity_5","Pah-wraith Vessel",2, 7, 10, 10, 14, 6, 0, , , , 700, 155, 10, 400, false,"Dukat",crew_portraits_cm_dukatcult_sm.png,dukat_cult_crew
"Dr. Tolian Soran",9,4, 0,0,0,717,175,348,0,0,0,544,100,243,0,0,0,0,0,0,483,0,568,0,0,476,108,526,294,528,0,0,582,336,0,347,0,523,0,0,340,78,387,222,499,0,0,537,309,0,884,770,"Civilian, Empath, Quantum Mechanics, Innovator, Desperate, El-Aurian, Villain","male, organic, tng, soran, crew_max_rarity_4","Appointment With Eternity",0, 6, 12, 12, 12, 7, 0, , , , 690, 325, 275, 250, false,"Soran",crew_portraits_cm_soran_sm.png,soran_longcoat_crew
"Romulan Kirk",6,4, 238,124,324,0,0,0,386,165,555,0,0,0,722,129,342,0,0,0,808,399,738,381,697,577,0,533,0,498,194,459,471,0,409,434,64,347,151,347,145,0,448,0,126,43,110,357,0,351,705,98,"Human, Federation, Starfleet, Undercover Operative, Romulan","male, organic, tos, captain, bridge_crew, kirk, crew_max_rarity_4","Masquerade",2, 8, 6, 6, 10, , , , 3, 800, 300, 200, 43, 390, false,"Kirk",crew_portraits_cm_kirkromulan_sm.png,kirk_romulan_crew
"Age of Sail Crusher",7,5, 409,87,309,0,0,0,0,0,0,0,0,0,822,135,456,1005,199,523,727,706,658,249,14,0,0,433,158,0,502,152,363,103,25,499,545,418,128,14,0,0,306,118,0,401,113,234,53,12,372,71,"Human, Starfleet, Federation, Physician, Costumed","ageofsail, female, organic, tng, commander, crusher, crew_max_rarity_5","Something Unexpected",0, 7, 12, 10, 14, 7, 0, , , , 525, 125, 65, 175, false,"Crusher",crew_portraits_cm_crushersail_sm.png,crusher_ageofsail_crew
"Suliban Reed",9,5, 925,262,605,0,0,0,452,100,219,0,0,0,897,178,312,0,0,0,234,134,185,74,149,707,0,413,0,605,184,571,343,0,306,77,60,48,23,47,586,0,425,0,518,189,500,340,0,335,363,85,"Starfleet, Human, Suliban, Tactician, Saboteur, Undercover Operative","male, organic, ent, lieutenant, reed, crew_max_rarity_5","Starting to Itch",1, 7, 6, 12, 12, 0, 1, , , , 65, 250, 40, 575, false,"Reed",crew_portraits_cm_reedsuliban_sm.png,reed_suliban_crew
"Cardassian Kira",8,4, 455,170,321,0,0,0,587,193,459,0,0,0,380,40,118,0,0,0,635,250,564,482,521,495,0,805,0,434,366,386,777,0,676,378,70,301,344,288,193,0,830,0,166,179,147,795,0,694,739,323,"Bajoran, Cardassian, Obsidian Order, Saboteur, Crafty, Prisoner","nonhuman, female, organic, ds9, kira, crew_max_rarity_4","Closest Thing to Family",2, 9, 12, 12, 12, , , , 1, 2, 250, 200, 180, 475, false,"Kira",crew_portraits_cm_kiracardassian_sm.png,kira_cardassian_crew
"Fesek",8,4, 0,0,0,0,0,0,0,0,0,715,115,342,555,80,188,0,0,0,0,0,429,696,0,0,350,642,0,426,712,0,79,263,509,0,0,358,728,0,0,281,697,0,372,763,0,120,209,568,897,871,"Malon, Romantic, Inspiring, Resourceful","nonhuman, male, evsuit, organic, voy, fesek, crew_max_rarity_4","Occupational Hazard",1, 9, 6, 10, 10, , , , 0, 2, 520, 200, 115, 415, false,"Fesek",crew_portraits_cm_fesekvoy_sm.png,fesek_crew
"Grand Proxy Neelix",6,4, 650,195,409,0,0,0,0,0,0,392,180,427,340,51,133,0,0,0,484,538,77,391,374,0,429,825,0,540,873,0,360,348,699,248,354,4,220,169,0,193,802,0,216,864,0,88,115,669,737,254,"Talaxian, Mylean, Ferengi, Crafty, Cultural Figure, Undercover Operative","nonhuman, male, organic, voy, neelix, nagus, crew_max_rarity_4","299th Rule of Acquisition",2, 6, 4, 8, 8, 6, 0, , , , 650, , 90, 50, true,"Neelix",crew_portraits_cm_neelixgrandproxy_sm.png,neelix_grand_proxy_crew
"Commander Kelby",9,4, 562,81,189,0,0,0,0,0,0,813,65,142,0,0,0,0,0,0,639,643,90,684,525,0,355,0,0,437,0,0,486,270,0,676,686,322,715,586,0,507,0,0,664,0,0,740,422,0,898,973,"Human, Starfleet, Jury Rigger, Explorer","male, organic, ent, commander, kelby, crew_max_rarity_4","Good to Go",2, 5, 1, 12, 20, 2, 0, , , , 365, 200, 134, 650, true,"Kelby",crew_portraits_cm_kelbyent_sm.png,kelby_commander_crew
"Orion Slaver",10,4, 240,123,277,0,0,0,677,166,456,0,0,0,528,102,247,0,0,0,833,326,757,498,719,471,0,631,0,408,202,365,589,0,502,491,107,412,261,405,220,0,608,0,189,102,165,527,0,479,722,262,"Orion, Brutal, Duelist, Merchant","male, organic, ent, nonhuman, crew_max_rarity_4","Slaver Tactics",0, 6, 6, 10, 10, 8, 4, , , , 430, 305, 150, 390, false,"Orion Slaver",crew_portraits_cm_orionslaver_sm.png,orion_slaver_crew
"Forra Gegen",10,4, 0,0,0,743,154,275,267,103,203,553,112,213,0,0,0,0,0,0,489,806,569,0,0,229,114,531,299,325,883,686,583,337,0,472,646,549,0,0,142,110,501,289,190,695,522,564,331,0,738,592,"Exoarchaeology, Exobiology, Voth, Resourceful, Maverick","male, organic, voy, crew_max_rarity_4","Hadrosaur Instincts",2, 5, 3, 10, 8, 4, 0, 2, , , 535, 545, 170, 100, false,"Gegen",crew_portraits_cm_forragegen_sm.png,forra_gegen_crew
"Automated Unit 3947",10,4, 0,0,0,607,52,117,263,115,318,717,128,305,0,0,0,0,0,0,646,757,431,0,0,344,129,637,386,198,837,642,482,265,0,838,511,393,0,0,244,199,815,514,74,546,365,412,228,0,735,619,"Automated Unit, Desperate, Quantum Mechanics","nonhuman, artificial_life, voy, crew_max_rarity_4","Terminate the Builders",1, 6, 12, 12, 12, 7, 0, , , , 685, 600, 143, 325, false,"APU 3947",crew_portraits_cm_automatedunit3947_sm.png,automatedunit3947_crew
"Ardra",1,4, 0,0,0,0,0,0,703,120,243,309,87,191,537,104,183,0,0,0,0,553,761,699,0,504,562,649,0,215,278,398,357,451,517,0,576,629,708,0,514,433,683,0,182,318,440,264,375,550,772,717,"Costumed, Crafty, Villain, Cultural Figure, Thief","female, organic, tng, ardra, crew_max_rarity_4","I Pity You",2, 7, 6, 12, 12, 5, 0, 2, , , 650, 325, 695, 425, false,"Ardra",crew_portraits_cm_arda_sm.png,ardra_crew
"Waitress Ezri",5,4, 0,0,0,0,0,0,287,47,135,0,0,0,652,193,390,450,162,497,0,816,0,581,470,859,0,536,341,730,379,259,475,305,87,0,777,0,426,131,802,0,318,142,681,221,68,248,77,21,734,231,"Trill, Federation, Starfleet, Costumed, Undercover Operative, Counselor, Resourceful","nonhuman, female, organic, ds9, dax, crew_max_rarity_4","Slip Him a Mickey",2, 7, 12, 5, 12, 1, 0, , , , 205, 145, 150, 575, false,"E. Dax",crew_portraits_cm_ezriwaitress_sm.png,ezri_waitress_crew
"Jazz Musician Odo",9,5, 0,0,0,0,0,0,754,185,597,0,0,0,1099,195,389,0,0,0,0,457,0,393,0,366,0,285,0,317,43,269,215,0,218,0,226,0,423,0,103,0,315,0,102,18,84,245,0,263,492,271,"Changeling, Bajoran, Constable, Costumed, Romantic, Musician","nonhuman, male, organic, ds9, odo, crew_max_rarity_5","Holosuite Romeo",1, 8, 12, 10, 14, 4, 0, , , , 245, 350, 110, 475, false,"Odo",crew_portraits_cm_odotux_sm.png,odo_tuxedo_crew
"Bridge Officer Troi",8,4, 597,76,197,0,0,0,0,0,0,0,0,0,304,93,195,616,169,514,608,619,539,468,31,0,0,815,296,0,860,374,791,254,211,668,681,617,434,33,0,0,684,132,0,739,132,626,68,64,710,402,"Federation, Starfleet, Human, Betazoid, Empath, Counselor, Caregiver","nonhuman, female, organic, tng, commander, bridge_crew, troi, crew_max_rarity_4","Sensing Anger",1, 6, 6, 8, 12, 3, 0, 3, , , 565, 360, 245, 450, true,"Troi",crew_portraits_cm_troicommander_sm.png,troi_commander_crew
"Lon Suder",10,4, 0,0,0,235,81,261,603,185,434,612,66,215,0,0,0,0,0,0,867,548,540,0,0,248,280,842,528,91,614,387,553,324,0,585,337,622,0,0,49,174,614,351,62,343,167,633,371,0,753,403,"Maquis, Federation, Starfleet, Betazoid, Brutal, Botanist, Saboteur, Telepath","male, organic, voy, nonhuman, crewman, suder, crew_max_rarity_4","Control the Violence",2, 6, 12, 12, 12, 4, 0, , , , 465, 220, 110, 480, false,"Suder",crew_portraits_cm_sudersabotuer_sm.png,suder_crew
"Detective Dixon Hill",7,4, 499,162,314,0,0,0,270,146,290,0,0,0,612,203,401,0,0,0,605,377,536,264,502,782,0,543,0,665,357,635,487,0,419,395,157,314,85,310,438,0,295,0,380,80,359,216,0,236,713,157,"Federation, Starfleet, Human, Costumed, Undercover Operative, Investigator, Romantic","male, organic, tng, captain, bridge_crew, picard, crew_max_rarity_4","Step On It",1, 7, 8, 10, 8, , , , , , 550, 25, 577, 340, false,"Picard",crew_portraits_cm_picarddixonhill_sm.png,picard_dixonhill_crew
"Mirror Spock",7,5, 752,153,361,1032,212,482,0,0,0,0,0,0,386,73,158,0,0,0,31,515,390,330,344,230,200,100,157,0,822,0,740,0,646,11,427,266,262,253,169,135,94,130,0,809,0,704,0,610,407,217,"Terran Empire, Starfleet, Exobiology, Astrophysicist, Human, Vulcan, Telepath, Mirror Universe, Royalty","nonhuman, male, organic, tos, commander, bridge_crew, first_officer, mirror, spock, spock_tos, crew_max_rarity_5","Empire's Logic",2, 9, 1, 10, 12, , , , , , 840, 245, 312, 725, false,"Spock",crew_portraits_cm_spockmirror_sm.png,spock_mirror_crew
"Subcommander T'Rul",6,4, 0,0,0,305,60,158,377,176,559,844,60,97,0,0,0,0,0,0,863,620,433,0,0,355,203,838,525,90,675,460,485,267,0,780,255,774,0,0,51,340,756,462,64,225,104,796,460,0,746,528,"Romulan, Veteran, Resourceful, Tactician","nonhuman, female, organic, trul, tng, commander, crew_max_rarity_4","Not Here To Make Friends",0, 7, 12, 10, 12, 0, 1, , 1, 3, 425, , 223, 340, false,"T'Rul",crew_portraits_cm_trulsubcommander_sm.png,trul_subcommander_crew
"Drone Seven of Nine",4,4, 0,0,0,432,165,349,239,150,308,725,142,339,0,0,0,0,0,0,650,769,422,0,0,359,121,644,392,193,847,650,470,256,0,368,475,332,0,0,47,45,396,232,48,513,328,350,188,0,729,210,"Human, Borg, Brutal","nonhuman, female, organic, voy, seven, crew_max_rarity_4","We Are Borg",0, 4, 1, 10, 10, 8, 4, , , , 475, 200, 170, 365, true,"Seven",crew_portraits_cm_sevenofninedrone_sm.png,seven_drone_crew
"Tash",8,4, 0,0,0,577,236,539,0,0,0,591,96,131,273,74,146,0,0,0,486,0,578,864,0,478,117,298,297,532,894,0,391,341,715,131,0,705,791,0,123,42,70,99,638,833,0,392,412,628,761,445,"Civilian, Innovator, Desperate, Maverick","male, organic, voy, tash, crew_max_rarity_4","Catapult a Vessel",2, 4, 4, 6, 6, 3, 0, 2, , , 290, 200, 60, 450, false,"Tash",crew_portraits_cm_tash_sm.png,tash_crew
"Blood Oath Jadzia Dax",6,4, 0,0,0,483,160,349,728,140,265,225,153,356,0,0,0,0,0,0,618,546,730,0,0,89,235,606,363,199,611,382,759,441,0,372,537,296,0,0,63,41,399,235,57,584,391,319,175,0,719,232,"Federation, Starfleet, Duelist, Gambler, Tactician, Trill, Pilot, Klingon","nonhuman, female, organic, ds9, lieutenant, bridge_crew, dax, crew_max_rarity_4","Who You've Been",1, 7, 8, 10, 8, , , , , , 400, 75, 405, 205, false,"J. Dax",crew_portraits_cm_jadziabloodoath_sm.png,dax_jadzia_blood_oath_crew
"Lily Sloane",8,4, 0,0,0,0,0,0,274,75,183,678,119,334,487,173,340,0,0,0,0,813,440,663,0,851,359,603,0,219,484,696,73,273,481,0,695,363,478,0,683,284,400,0,135,214,576,37,212,316,762,436,"Human, Civilian, Jury Rigger, Desperate, Communicator, Crafty, Resourceful","female, organic, tng, lily, crew_max_rarity_4","Broke Your Little Ships",1, 7, 6, 8, 10, 3, 0, 3, , , 600, 380, 15, 450, false,"Lily",crew_portraits_cm_lilysloane_sm.png,lily_sloane_crew
"Rogue Kai Winn",9,5, 1007,257,510,0,0,0,0,0,0,0,0,0,736,274,575,0,0,0,220,334,172,67,139,0,0,402,0,0,475,0,329,0,296,125,237,86,6,80,0,0,119,0,0,168,0,65,0,95,485,115,"Bajoran, Kai, Cultural Figure, Spiritual, Villain","nonhuman, female, organic, ds9, winn, crew_max_rarity_5","End of One Journey",0, 7, 10, 10, 14, 6, 0, , , , 315, 330, 110, 550, false,"Winn",crew_portraits_cm_winnevil_sm.png,winn_rogue_crew
"Sulan",7,5, 351,100,258,789,161,363,0,0,0,0,0,0,0,0,0,889,244,810,138,736,683,783,17,439,322,484,26,0,0,145,0,97,208,74,581,474,624,2,341,250,388,6,0,0,22,0,9,42,394,24,"Geneticist, Physician, Vidiian, Brutal, Survivalist","nonhuman, male, organic, voy, sulan, crew_max_rarity_5","Most Impressive Species",2, 10, 12, 12, 12, , , 2, , , 490, 25, 140, 190, false,"Sulan",crew_portraits_cm_sulan_sm.png,sulan_crew
"Lore",10,4, 0,0,0,447,32,92,0,0,0,597,202,427,508,99,180,0,0,0,770,0,437,716,0,768,193,399,475,438,741,0,139,271,539,880,0,174,716,0,868,111,537,544,203,749,0,48,94,560,756,637,"Android, Civilian, Villain, Cyberneticist","nonhuman, male, artificial_life, tng, lore, crew_max_rarity_4","Dear Brother",1, 7, 1, 10, 12, , , , , , 800, , 205, 450, false,"Lore",crew_portraits_cm_loreoriginal_sm.png,lore_original_crew
"Interfaced Barclay",7,5, 1047,236,645,541,98,211,0,0,0,981,77,144,0,0,0,0,0,0,42,308,15,338,105,616,90,634,383,360,0,0,387,203,0,13,173,11,164,44,613,248,651,377,644,0,0,721,413,0,278,228,"Innovator, Quantum Mechanics, Prodigy, Human, Federation, Resourceful","male, organic, tng, lieutenant, barclay, crew_max_rarity_5","Trust Me",1, 7, 4, 8, 12, 6, 0, , , , 340, , 20, 455, true,"Barclay",crew_portraits_cm_barclaydictator_sm.png,barclay_interfaced_crew
"Trelane",8,5, 0,0,0,944,247,677,862,183,389,0,0,0,476,35,94,0,0,0,227,455,0,782,0,15,195,89,155,316,203,268,733,0,634,64,379,0,875,0,9,61,49,59,232,251,208,822,0,713,378,111,"Romantic, Desperate, Musician, Scoundrel, Resourceful, Crafty, Costumed","nonhuman, male, organic, tos, trelane, crew_max_rarity_5","My Game, My Rules!",2, 7, 6, 12, 12, 0, 1, , , , 365, 70, 133, 350, false,"Trelane",crew_portraits_cm_trelane_sm.png,trelane_crew
"Enabran Tain",8,5, 919,264,754,0,0,0,905,128,284,0,0,0,378,123,299,0,0,0,204,77,160,138,127,401,0,746,0,343,200,290,708,0,618,37,17,24,16,27,458,0,515,0,400,169,384,430,0,412,355,36,"Cardassian, Obsidian Order, Interrogator, Undercover Operative, Desperate","nonhuman, male, organic, ds9, tain, crew_max_rarity_5","History Be My Judge",0, 7, 12, 10, 14, 8, 4, , , , 308, 235, 43, 475, false,"Tain",crew_portraits_cm_tain_sm.png,enabran_tain_crew
"Ambassador Soval",8,5, 982,112,261,0,0,0,0,0,0,0,0,0,1079,318,636,0,0,0,352,426,298,34,261,0,0,206,0,0,290,0,136,0,149,531,569,455,27,438,0,0,89,0,0,119,0,42,0,70,445,324,"Vulcan, Diplomat, Communicator, Telepath, Ambassador, High Command","nonhuman, male, organic, soval, ent, crew_max_rarity_5","No Stranger to Deception",1, 8, 1, 10, 12, , , , , , 775, 255, 150, 430, false,"Soval",crew_portraits_cm_soval_sm.png,soval_crew
"Temporal Shift Kes",2,3, 0,0,0,267,132,282,0,0,0,0,0,0,0,0,0,461,72,253,801,0,0,0,612,800,538,791,254,0,0,557,0,380,568,487,0,0,0,514,463,312,518,112,0,0,501,0,322,497,965,857,"Ocampa, Civilian, Botanist, Prodigy, Telepath, Nurse","nonhuman, female, organic, voy, kes, crew_max_rarity_3","Your Past, My Future",1, 4, 10, 12, 16, 5, 0, , , , 425, 100, 165, 370, false,"Kes",crew_portraits_cm_kesbotanist_sm.png,kes_longhair_crew
"Duelist Torres",7,5, 0,0,0,0,0,0,903,165,428,1067,208,464,0,0,0,0,0,0,0,417,181,0,0,310,197,0,0,27,435,215,214,100,0,0,362,141,0,0,248,150,0,0,9,376,189,150,76,0,479,380,"Athlete, Innovator, Jury Rigger, Human, Federation, Klingon, Maquis, Duelist, Cyberneticist","female, organic, voy, nonhuman, torres, crew_max_rarity_5","Empassioned Maneuver",1, 8, 10, 10, 12, 8, 4, , , , 800, 280, 20, 100, false,"Torres",crew_portraits_cm_torresduelist_sm.png,torres_duelist_crew
"Deanna Troi",2,3, 127,87,199,0,0,0,0,0,0,0,0,0,298,120,236,412,112,282,901,843,833,658,398,0,0,788,441,0,844,569,760,390,333,651,672,603,361,121,0,0,594,306,0,655,417,518,254,134,926,620,"Federation, Starfleet, Human, Betazoid, Empath, Counselor","nonhuman, female, organic, tng, lieutenant_commander, bridge_crew, troi, crew_max_rarity_3","Face My Other Half",1, 7, 8, 12, 12, , , , 0, 2, 650, 50, 265, 450, false,"Troi",crew_portraits_cm_troicivilian_sm.png,troi_casualblue_crew
"Delta Flyer Paris",6,5, 1013,224,512,0,0,0,0,0,0,897,92,309,0,0,0,508,105,232,226,339,19,389,13,0,306,0,397,357,0,501,381,23,515,141,256,6,263,19,0,321,0,353,429,0,479,462,49,486,346,181,"Gambler, Human, Romantic, Tactician, Federation, Starfleet, Pilot, Maverick, Athlete","male, organic, lieutenant, voy, paris, crew_max_rarity_5","Race Day",1, 10, 6, 12, 12, , , , , , 640, , 85, 480, false,"Paris",crew_portraits_cm_parisdeltaflier_sm.png,paris_delta_crew
"Dr. Richard Daystrom",9,5, 0,0,0,857,259,761,0,0,0,882,134,447,0,0,0,0,0,0,238,0,333,0,0,235,36,295,159,301,0,0,321,177,0,41,0,222,0,0,36,5,60,43,246,0,0,251,136,0,495,128,"Federation, Prodigy, Inspiring, Innovator, Civilian, Human, Cultural Figure","male, organic, tos, daystrom, crew_max_rarity_5","Achieve Greater Things",2, 8, 6, 8, 10, 3, 0, 2, , , 515, 160, 283, 650, false,"Daystrom",crew_portraits_cm_daystrom_sm.png,daystrom_crew
"Rura Penthe Reed",7,4, 497,121,372,0,0,0,624,163,548,0,0,0,0,0,0,0,0,0,597,219,526,652,494,474,0,0,0,411,600,369,0,0,0,376,55,297,482,285,153,0,0,0,128,245,114,0,0,0,867,420,"Starfleet, Human, Desperate, Survivalist, Criminal, Undercover Operative, Prisoner","male, organic, ent, reed, crew_max_rarity_4","As You Were",0, 9, 8, 12, 10, , , 2, , , 755, 235, 173, 400, false,"Reed",crew_portraits_cm_reedrurapenthe_sm.png,reed_rura_penthe_crew
"Ensign Robin Lefler",3,3, 270,81,259,0,0,0,0,0,0,544,88,202,0,0,0,0,0,0,834,787,347,844,720,0,434,0,0,544,0,0,603,353,0,577,598,159,639,479,0,420,0,0,568,0,0,620,363,0,960,912,"Human, Federation, Starfleet, Innovator, Resourceful","female, organic, tng, lefler, crew_max_rarity_3","Rely on Yourself",1, 4, 10, 6, 15, 2, 0, , 2, 2, 505, 260, 150, 415, false,"Lefler",crew_portraits_cm_robinlefler_sm.png,lefler_crew
"Racquetball Bashir",2,3, 175,48,144,411,23,77,0,0,0,0,0,0,0,0,0,345,120,414,615,842,831,902,395,805,544,799,265,0,0,566,0,389,588,644,766,729,815,101,882,603,874,158,0,0,255,0,154,293,928,790,"Human, Federation, Starfleet, Athlete, Prodigy, Engineered, Physician","nonhuman, male, organic, ds9, bashir, crew_max_rarity_3","Team Captain",1, 6, 8, 12, 12, , , , 0, 1, 560, 130, 158, 625, false,"Bashir",crew_portraits_cm_bashirracquetball_sm.png,bashir_racquetball_crew
"Disguised Tuvok",5,4, 293,68,194,691,146,408,419,202,399,0,0,0,0,0,0,0,0,0,228,452,777,854,737,83,347,528,295,517,695,479,0,0,0,106,183,640,721,597,22,234,346,205,207,364,183,0,0,0,727,225,"Vulcan, Human, Federation, Starfleet, Telepath, Resourceful, Costumed, Tactician","nonhuman, male, organic, voy, lieutenant_commander, bridge_crew, tuvok, crew_max_rarity_4","Ethics of Time Travel",0, 6, 12, 12, 16, 5, 0, , , , 565, 255, 90, 225, false,"Tuvok",crew_portraits_cm_tuvok20c_sm.png,tuvok_20c_disguise_crew
"Mirror T'Pol",7,5, 451,111,369,1018,184,560,0,0,0,0,0,0,704,213,421,0,0,0,53,645,575,251,531,226,198,38,156,0,573,0,431,0,381,10,460,313,73,306,139,113,9,111,0,348,0,184,0,211,373,42,"Vulcan, Terran Empire, Starfleet, Astrophysicist, Duelist, Saboteur, Telepath, Mirror Universe","nonhuman, female, organic, ent, first_officer, mirror, bridge_crew, tpol, crew_max_rarity_5","Pay for Your Arrogance",2, 7, 4, 10, 14, 4, 0, , , , 700, 255, 220, 325, true,"T'Pol",crew_portraits_cm_tpolmirrortos_sm.png,tpol_mirror_crew
"Chancellor Gowron",5,5, 439,149,309,0,0,0,759,220,451,0,0,0,794,287,867,0,0,0,660,208,599,137,553,414,0,297,0,353,49,300,228,0,226,424,76,338,7,331,174,0,25,0,149,2,133,15,0,34,362,12,"Klingon, Cultural Figure, Diplomat, Brutal, Politician","nonhuman, male, organic, tng, gowron, crew_max_rarity_5","It Will Be War!",0, 7, 6, 8, 14, 4, 2, , , , 350, 290, 195, 650, false,"Gowron",crew_portraits_cm_gowronchancellor_sm.png,gowron_chancellor_crew
