"Insubordinate Mariner",0,5, 1044,171,283,0,0,0,0,0,0,566,79,184,1328,165,351,0,0,0,552,674,122,65,359,0,752,397,0,927,513,0,78,580,259,719,799,216,209,538,0,797,644,0,990,769,0,184,662,471,296,741,"Federation, Starfleet, Human, Desperate, Maverick, Smuggler, Scoundrel, Playful","female, organic, low, mariner, crew_max_rarity_5","Come On Check It Out",0, 9, 4, 8, 10, , , , 1, 2, 575, 165, 210, 675, false,"Mariner",crew_portraits_cm_insubordinate_mariner_sm.png,insubordinate_mariner_crew
"Cabaret Georgiou",0,5, 1360,177,454,0,0,0,1052,130,319,0,0,0,493,70,168,0,0,0,237,36,215,186,112,509,0,1180,0,470,245,336,1170,0,989,365,128,306,280,216,707,0,1192,0,661,444,566,1177,0,1003,267,521,"Terran Empire, Mirror Universe, Human, Brutal, Desperate, Royalty, Bartender","female, organic, dsc, georgiou, crew_max_rarity_5","Ill Ask Again--What Do You Want?",0, 8, 10, 5, 8, 6, 0, , , , 300, 135, 277, 725, false,"Georgiou",crew_portraits_cm_georgiou_cabaret_sm.png,dsc_georgiou_cabaret_crew
"Data and Spot",0,5, 0,0,0,1065,100,250,0,0,0,1328,171,371,538,54,152,0,0,0,583,0,281,1227,0,543,19,233,320,325,1267,0,81,102,932,943,0,472,1343,0,893,104,583,525,499,1393,0,222,227,1068,396,965,"Android, Starfleet, Federation, Cyberneticist, Caregiver, Writer","nonhuman, male, tng, artificial_life, data, exclusive_collection, crew_max_rarity_5","Oh, Spot, The Complex Levels of Behavior You Display!",2, 10, 8, 8, 12, , , , 1, 2, 650, 200, 165, 675, false,"Data",crew_portraits_cm_data_spot_sm.png,data_spot_crew
"Tendi and The Dog",0,5, 0,0,0,1314,222,424,0,0,0,508,76,146,0,0,0,1000,127,333,270,0,1130,0,399,258,83,352,7,1040,0,376,1169,33,471,361,0,1191,0,558,341,118,427,34,1082,0,551,1217,97,593,371,552,"Orion, Starfleet, Federation, Geneticist, Engineered, Shapeshifter, Playful","female, organic, low, tendi, nonhuman, crew_max_rarity_5","Who Has Malleable Protein Bonds? You Do!",0, 6, 9, 7, 8, 6, 0, , , , 165, 100, 110, 325, false,"Tendi",crew_portraits_cm_tendi_dog_sm.png,tendi_dog_crew
"Ensign Mariner",0,2, 383,80,207,0,0,0,277,58,155,0,0,0,151,29,67,0,0,0,1227,925,1160,1138,1039,1367,0,1407,0,1197,1324,1093,1403,0,1206,1062,716,1023,1008,895,1222,0,1392,0,1098,1180,996,1389,0,1190,1555,1518,"Federation, Starfleet, Human, Casual, Maverick, Playful","female, organic, low, mariner, crew_max_rarity_2","Boim us out of here!",2, 6, 4, 5, 10, 1, 1, , , , 500, 50, 40, 175, false,"Mariner",crew_portraits_cm_mariner_ensign_sm.png,mariner_ensign_crew
"Vindicta Mariner",0,4, 652,85,253,372,64,151,948,145,279,0,0,0,0,0,0,0,0,0,521,266,838,1062,712,231,978,1285,813,595,894,489,0,0,0,522,390,891,1093,774,344,938,1243,767,707,997,618,0,0,0,1002,1196,"Starfleet, Human, Federation, Maverick, Brutal, Criminal, Costumed, Villain, Playful, Vengeful","female, organic, low, mariner, jan2024, crew_max_rarity_4","I Am Vindicta, Vengeance Personified!",0, 7, 10, 6, 8, 1, 0, , , , 400, 325, 170, 475, false,"Vindicta",crew_portraits_cm_mariner_vindicta_sm.png,mariner_vindicta_crew
"EV Suit Mariner",0,5, 1348,133,331,496,78,171,0,0,0,1079,92,236,0,0,0,0,0,0,94,506,18,544,166,1149,143,1165,719,515,0,0,559,246,0,259,774,154,852,509,1132,350,1172,690,863,0,0,970,530,0,445,1064,"Federation, Starfleet, Human, Desperate, Maverick, Resourceful, Playful","female, organic, low, mariner, evsuit, crew_max_rarity_5","Sorry! Uh, New Boots!",0, 9, 8, 6, 14, 8, 4, , , , 525, 95, 170, 475, false,"Mariner",crew_portraits_cm_mariner_evsuit_sm.png,mariner_evsuit_crew
"First Monarch Kaitaama",0,4, 663,92,235,0,0,0,0,0,0,0,0,0,950,121,312,380,67,148,909,965,836,291,321,0,0,730,801,0,901,1014,662,761,203,979,1010,919,414,369,0,0,846,768,0,989,1004,767,768,277,991,1210,"Kriosian, Royalty, Romantic, Ambassador, Desperate, Prisoner","nonhuman, female, organic, ent, kaitaama, crew_max_rarity_4","Is Your Entire Species So Ill Mannered?",1, 9, 3, 8, 9, , , , 2, 2, 100, 170, 120, 150, false,"Kaitaama",crew_portraits_cm_kaitaama_first_monarch_sm.png,kaitaama_crew
"Ensign Tendi",0,2, 0,0,0,258,27,86,0,0,0,154,15,41,0,0,0,403,44,161,1389,0,1359,0,1048,1385,953,1377,515,1229,0,994,1410,585,1059,1392,0,1358,0,1105,1383,1028,1377,579,1230,0,1028,1407,678,1070,1587,1617,"Orion, Starfleet, Federation, Nurse, Resourceful","female, organic, nonhuman, low, tendi, crew_max_rarity_2","Did That Full Molecular Engorgement Feel Amazing?!",2, 2, 6, 6, 8, 6, 0, , , , 215, 100, 175, 25, false,"Tendi",crew_portraits_cm_tendi_ensign_sm.png,tendi_ensign_crew
"Lt. Shaxs",0,5, 834,260,575,0,0,0,956,307,715,0,0,0,475,76,248,0,0,0,576,111,512,337,387,397,0,1139,0,378,168,254,1124,0,947,146,6,117,75,73,66,0,1024,0,65,31,36,979,0,824,572,32,"Bajoran, Federation, Starfleet, Brutal, Veteran, Desperate, Tactician","nonhuman, male, organic, low, shaxs, crew_max_rarity_5","Recommendation: Full Assault",0, 7, 8, 6, 12, 4, 0, , , , 350, 205, 108, 265, false,"Shaxs",crew_portraits_cm_shaxs_lt_sm.png,shaxs_lt_crew
"Captain Carol Freeman",0,4, 881,146,303,0,0,0,410,78,154,0,0,0,670,93,197,0,0,0,750,468,691,319,545,1215,0,952,0,1086,665,969,924,0,770,738,465,656,439,559,1178,0,1104,0,1059,757,960,1062,0,903,1025,1207,"Starfleet, Federation, Human, Diplomat, Resourceful, Communicator","female, organic, low, freeman, crew_max_rarity_4","Warp Me",0, 9, 10, 7, 7, , , , 1, 2, 425, 300, 121, 430, false,"Freeman",crew_portraits_cm_freeman_captain_sm.png,freeman_captain_crew
"Phased Boimler",0,4, 0,0,0,0,0,0,384,50,148,657,95,199,948,142,301,0,0,0,0,1241,878,866,0,1279,668,728,0,474,438,1015,141,503,553,0,1263,1013,933,0,1278,747,820,0,570,519,1036,230,611,636,1028,1266,"Federation, Starfleet, Human, Desperate, Inspiring","male, organic, low, boimler, crew_max_rarity_4","Its Gonna Be Great!",1, 7, 10, 10, 10, 4, 2, , , , 500, 265, 110, 675, false,"Boimler",crew_portraits_cm_phased_boimler_sm.png,phased_boimler_crew
"Ensign Boimler",0,2, 371,63,163,0,0,0,0,0,0,0,0,0,278,46,111,0,0,0,1277,1246,1201,1039,1083,0,0,1360,0,0,1456,0,1357,0,1167,1224,1202,1173,1009,1044,0,0,1337,0,0,1443,0,1323,0,1138,1614,1614,"Federation, Starfleet, Human, Desperate","male, organic, low, boimler, crew_max_rarity_2","Evasive Maneuver Eighty... Eight?",1, 5, 8, 10, 8, , , , , , 450, 150, 115, 315, false,"Boimler",crew_portraits_cm_boimler_ensign_sm.png,boimler_ensign_crew
"All-in Owosekun",0,5, 1072,82,249,0,0,0,1352,112,315,0,0,0,513,83,181,0,0,0,581,68,517,334,390,316,0,1112,0,317,137,201,1103,0,927,968,396,909,676,791,759,0,1132,0,703,440,616,1111,0,940,377,1110,"Human, Federation, Starfleet, Athlete, Duelist, Gambler, Brutal, Crafty, Displaced","female, organic, dsc, owosekun, crew_max_rarity_5","I'm In. All The Way.",0, 10, 6, 8, 12, , , , , , 740, 600, 315, 540, false,"Owosekun",crew_portraits_cm_owosekun_allin_sm.png,dsc_owosekun_allin_crew
"Cowpoke Boimler",0,4, 654,102,206,0,0,0,920,209,356,0,0,0,409,73,112,0,0,0,926,254,857,721,734,576,0,1252,0,538,355,406,1239,0,1062,1009,279,958,803,840,476,0,1302,0,454,349,348,1287,0,1107,931,1020,"Federation, Starfleet, Human, Constable, Marksman, Costumed, Casual","male, organic, low, boimler, original, crew_max_rarity_4","This Holodeck Ain't Big Enough for the Both of Us",1, 5, 12, 9, 10, 4, 0, , , , 75, 100, 35, 75, false,"Boimler",crew_portraits_cm_boimler_cowpoke_sm.png,boimler_cowpoke_crew
"AGIMUS",0,5, 560,150,165,0,0,0,0,0,0,1354,300,356,1110,205,224,0,0,0,1015,1057,47,257,824,0,191,559,0,235,694,0,11,48,405,996,1036,61,436,821,0,258,854,0,315,995,0,44,107,668,85,359,"Sentient Computer, Brutal, Crafty, Desperate, Prisoner, Resourceful, Scoundrel, Villain","nonhuman, artificial_life, low, agimus, crew_max_rarity_5","You Are Too Late, AGIMUS Reigns!",0, 10, 8, 4, 12, 1, 4, , , , 300, 400, 180, 300, false,"AGIMUS",crew_portraits_cm_agimus_sm.png,agimus_crew
"Lt. Commander Ron Docent",0,4, 691,97,246,0,0,0,401,59,204,914,166,297,0,0,0,0,0,0,873,588,104,1015,660,1212,521,0,0,232,1342,967,710,335,0,944,574,144,1080,763,1088,459,0,0,241,1268,900,669,315,0,923,990,"Human, Starfleet, Federation, Desperate, Scoundrel","male, organic, low, docent, crew_max_rarity_4","Do I Need To Remind You Who My Grandmas Neighbor Was?",1, 8, 6, 10, 8, 5, 0, , , , 150, 115, 7, 1050, false,"Ron Docent",crew_portraits_cm_docent_lt_cmdr_sm.png,docent_lt_cmdr_crew
"Bullseye Kyle",0,5, 0,0,0,982,223,488,0,0,0,1310,212,410,0,0,0,567,21,91,478,0,262,0,974,465,7,556,74,304,0,906,295,16,960,275,0,338,0,1203,252,9,336,110,363,0,1105,381,71,1175,288,305,"Federation, Starfleet, Human, Marksman, Innovator, Resourceful","male, organic, tos, kyle, crew_max_rarity_5","Are you kidding?",2, 9, 6, 8, 12, 5, 0, , , , 50, , 218, 25, false,"Kyle",crew_portraits_cm_kyle_bullseye_sm.png,kyle_bullseye_crew
"Acting Captain Arex",0,5, 1337,241,501,571,102,243,1045,203,400,0,0,0,0,0,0,0,0,0,53,4,194,463,86,79,707,999,562,412,654,293,0,0,0,43,46,186,430,123,95,653,998,540,382,597,277,0,0,0,12,122,"Edosian, Starfleet, Federation, Musician, Astrophysicist, Explorer, Communicator, Merchant","male, nonhuman, organic, tas, arex, crew_max_rarity_5","We Didn't Cause This To Happen",2, 10, 6, 8, 12, , , , , , 200, 100, 90, 100, false,"Arex",crew_portraits_cm_arex_acting_captain_sm.png,arex_acting_captain_crew
"Kevin Mulkahey",0,2, 263,30,86,0,0,0,367,33,96,0,0,0,0,0,0,0,0,0,1385,1022,1321,1440,1198,1333,0,0,0,1165,1428,1059,0,0,0,1387,1158,1320,1442,1196,1370,0,0,0,1195,1461,1096,0,0,0,1630,1654,"Human, Brutal, Investigator","male, organic, ds9, weyoun, crew_max_rarity_2","Damn Shame",0, 4, 8, 8, 8, , , , , , 290, 135, 33, 375, false,"Mulkahey",crew_portraits_cm_weyoun_mulkahey_sm.png,weyoun_mulkahey_crew
"Tiron",0,4, 0,0,0,0,0,0,0,0,0,670,79,156,998,170,319,0,0,0,0,0,891,788,0,0,681,627,0,836,778,0,111,516,463,0,0,1165,817,0,0,885,702,0,1055,826,0,239,726,514,1348,1449,"Serilian, Civilian, Merchant, Desperate, Scoundrel","nonhuman, male, ds9, organic, tiron, crew_max_rarity_4","I Will Ruin You",2, 6, 12, 10, 12, 4, 0, , , , 340, 200, 80, 225, false,"Tiron",crew_portraits_cm_tiron_sm.png,tiron_crew
"Judoka Kirk",0,5, 0,0,0,0,0,0,1278,240,510,497,102,211,1059,86,212,0,0,0,0,440,1075,817,0,214,832,659,0,81,28,125,169,669,494,0,399,959,1167,0,205,699,1084,0,47,113,143,402,563,884,327,430,"Human, Federation, Starfleet, Duelist, Brutal, Athlete","male, organic, tos, kirk, crew_max_rarity_5","Lesson's Over For Today",2, 9, 8, 5, 10, , , , 0, 2, 425, 100, 75, 450, false,"Kirk",crew_portraits_cm_kirk_judoka_sm.png,kirk_judoka_crew
"Mourned Morn",0,5, 0,0,0,0,0,0,959,184,263,0,0,0,1353,113,343,562,84,230,0,752,0,547,823,613,0,403,576,561,44,55,314,550,55,0,830,0,901,845,715,0,779,588,667,203,141,695,570,180,347,784,"Lurian, Courier, Civilian, Smuggler, Inspiring, Criminal, Merchant, Crafty","morn, male, organic, ds9, nonhuman, crew_max_rarity_5","Keep It Warm, For Morn",1, 9, 8, 10, 12, 0, 2, , , , 425, 340, 102, 640, false,"Morn",crew_portraits_cm_morn_mourned_sm.png,morn_mourned_crew
"Pathfinder Uhura",0,5, 1294,271,523,533,115,230,0,0,0,0,0,0,1061,222,392,0,0,0,59,418,209,16,101,999,735,171,589,0,650,0,450,0,371,28,355,149,25,99,905,654,141,541,0,582,0,394,0,323,23,93,"Human, Federation, Starfleet, Communicator, Musician, Hero, Inspiring, Cultural Figure","female, organic, tos, uhura, original, evsuit, crew_max_rarity_5","Science Is Everyone's Game",0, 9, 8, 6, 12, 1, 4, , , , 415, 120, 60, 350, false,"Uhura",crew_portraits_cm_uhura_evsuit_sm.png,uhura_evsuit_crew
"Valeo Beta V Hemmer",0,5, 555,75,131,0,0,0,1343,177,315,1057,99,225,0,0,0,0,0,0,1100,190,150,1207,921,291,441,0,0,31,480,177,594,270,0,1272,450,487,1338,1088,597,677,0,0,178,814,460,980,537,0,373,1111,"Aenar, Andorian, Federation, Starfleet, Telepath, Jury Rigger, Hero","nonhuman, organic, male, snw, hemmer, exclusive_honorhall, crew_max_rarity_5","Do Not Weep For Me",0, 10, 7, 7, 7, , , , 1, 6, 200, 50, 205, 50, false,"Hemmer",crew_portraits_cm_hemmer_valeobeta_sm.png,hemmer_valeobeta_crew
"Esteemed Tom Paris",0,5, 1382,204,394,0,0,0,1013,124,349,0,0,0,524,74,146,0,0,0,233,40,211,182,105,526,0,1141,0,483,249,352,1127,0,952,440,136,375,337,284,640,0,1224,0,592,434,494,1223,0,1042,264,608,"Human, Federation, Starfleet, Inspiring, Hero, Cultural Figure, Pilot","male, organic, low, paris, crew_max_rarity_5","This Is How we kick A## In The Delta Quadrant",0, 8, 10, 3, 14, 1, 1, , , , 825, 70, 285, 265, false,"Paris",crew_portraits_cm_paris_esteemed_sm.png,paris_esteemed_crew
"First Officer Data",0,4, 897,144,346,678,89,239,0,0,0,360,62,148,0,0,0,0,0,0,132,819,263,890,520,861,388,926,504,1146,0,0,1290,789,0,164,728,232,804,451,939,386,1023,561,1111,0,0,1248,776,0,1035,1102,"Android, Federation, Starfleet, Cyberneticist, Musician, Tactician","nonhuman, male, artificial_life, data, tng, crew_max_rarity_4","Aye Sir",0, 8, 14, 12, 14, , , , , , 250, 100, 53, 50, false,"Data",crew_portraits_cm_data_first_officer_sm.png,data_first_officer_crew
"EV Suit Hemmer",0,5, 1082,175,236,538,118,200,0,0,0,1345,163,349,0,0,0,0,0,0,130,665,14,741,344,1013,73,1038,596,320,0,0,313,98,0,239,878,75,970,634,963,144,1039,580,539,0,0,570,255,0,280,730,"Aenar, Andorian, Starfleet, Federation, Telepath, Inspiring, Botanist","male, nonhuman, organic, snw, hemmer, evsuit, crew_max_rarity_5","I Commend You To The Cosmos",0, 8, 8, 4, 10, 1, 1, , , , 350, , 90, 450, false,"Hemmer",crew_portraits_cm_hemmer_evsuit_sm.png,hemmer_evsuit_crew
"Fanboy Boimler",0,4, 0,0,0,0,0,0,316,83,131,875,172,253,619,104,213,0,0,0,0,1305,707,1101,0,1341,559,968,0,356,842,1068,171,372,785,0,1232,725,1126,0,1223,549,1033,0,338,745,997,225,407,833,1181,1244,"Human, Kazon, Federation, Starfleet, Resourceful, Survivalist, Desperate, Hunter","male, organic, low, boimler, crew_max_rarity_4","Fine, You Want to Play It That Way?",0, 6, 10, 8, 12, 5, 4, , , , , 30, , , false,"Boimler",crew_portraits_cm_boimler_fanboy_sm.png,boimler_fanboy_crew
"Chancellor Azetbur",0,5, 1023,149,340,0,0,0,0,0,0,0,0,0,1353,212,420,554,82,156,559,677,485,45,39,0,0,328,623,0,425,839,232,605,52,634,730,560,92,138,0,0,442,717,0,533,957,361,724,126,230,438,"Klingon, Cultural Figure, Brutal, Diplomat, Politician, Prodigy","female, organic, tos, azetbur, nonhuman, crew_max_rarity_5","We Are a Proud Race",2, 7, 12, 10, 14, 7, 0, , , , 750, 130, 295, 250, false,"Azetbur",crew_portraits_cm_azetbur_sm.png,azetbur_crew
"EV Suit Boimler",0,5, 1363,203,409,0,0,0,1063,146,319,564,102,201,0,0,0,0,0,0,240,33,48,492,115,491,729,0,0,120,722,325,1002,558,0,401,130,81,622,248,655,721,0,0,211,860,510,1033,588,0,112,384,"Human, Federation, Starfleet, Desperate, Explorer, Resourceful, Survivalist","male, organic, evsuit, low, boimler, crew_max_rarity_5","We're All In This Together",1, 9, 8, 6, 10, 1, 0, 2, 2, 2, 225, 250, 200, 240, false,"Boimler",crew_portraits_cm_boimler_evsuit_sm.png,boimler_evsuit_crew
"Master Surchid Falow",0,5, 1044,131,273,0,0,0,0,0,0,563,88,158,1368,164,314,0,0,0,574,689,137,67,383,0,766,371,0,949,488,0,77,602,236,827,894,288,270,650,0,858,716,0,1026,840,0,240,703,531,312,893,"Wadi, Gambler, Communicator, Ambassador, Diplomat, Playful","male, organic, nonhuman, ds9, falow, crew_max_rarity_5","Double The Peril, Double Your Winnings",2, 10, 10, 6, 8, 4, 0, , , , 425, 150, 113, 100, false,"Falow",crew_portraits_cm_falow_sm.png,falow_crew
"Spy Rumdar",0,5, 0,0,0,0,0,0,889,198,450,433,99,301,1208,348,499,0,0,0,0,709,1110,519,0,562,881,356,0,162,35,387,80,700,219,0,503,766,319,0,317,572,197,0,54,8,209,13,436,135,383,57,"Pakled, Prisoner, Criminal, Desperate, Hero, Undercover Operative","male, organic, low, rumdar, nonhuman, crew_max_rarity_5","Im A Good Spy",0, 9, 8, 10, 12, , , , 3, 800, 100, 150, 730, 50, false,"Rumdar",crew_portraits_cm_rumdar_spy_sm.png,rumdar_spy_crew
"Gathorel Labin",0,5, 1034,216,418,0,0,0,489,133,295,0,0,0,1334,198,505,0,0,0,450,235,400,26,295,991,0,315,0,907,98,797,229,0,190,360,141,301,35,213,760,0,345,0,704,78,617,271,0,226,39,90,"Sikarian, Caregiver, Romantic, Merchant, Politician, Civilian, Festive","male, organic, nonhuman, voy, labin, crew_max_rarity_5","My Pleasure Will Be Greater Than Yours",1, 10, 6, 8, 12, , , , , , 40, 275, 140, 50, false,"Labin",crew_portraits_cm_labin_magistrate_sm.png,labin_magistrate_crew
"Doopler Emissary",0,5, 1079,140,324,535,94,225,0,0,0,0,0,0,1374,234,413,0,0,0,122,648,429,33,325,1017,747,89,601,0,387,0,224,0,181,191,775,605,100,510,959,689,134,574,0,503,0,335,0,274,95,311,"Doopler, Federation, Desperate, Clone, Merchant, Communicator, Diplomat","nonhuman, organic, male, low, doopler_emissary, crew_max_rarity_5","Oh, I'm So Sorry!",1, 10, 6, 2, 10, 7, 0, , , , 490, 75, 140, 415, false,"Doopler",crew_portraits_cm_doopler_sm.png,doopler_crew
"Talosian Keeper",0,4, 344,76,167,0,0,0,0,0,0,0,0,0,663,96,234,859,135,355,1304,1270,1231,742,179,0,0,936,414,0,1111,541,910,359,91,1176,1164,1134,705,139,0,0,1013,367,0,1146,474,963,281,145,1071,1023,"Talosian, Crafty, Telepath, Explorer, Shapeshifter, Interrogator","male, organic, nonhuman, dsc, keeper, crew_max_rarity_4","Material Illusion Is Our Primary Form Of Defense",2, 9, 6, 8, 10, , , , , , 185, 250, 25, 40, false,"The Keeper",crew_portraits_cm_dsc_talosian_keeper_sm.png,dsc_talosian_keeper_crew
"Barclay and Neelix",0,5, 0,0,0,561,97,196,0,0,0,1353,181,402,1055,112,349,0,0,0,1028,0,244,749,0,996,62,195,587,278,745,0,25,73,438,1063,0,424,879,0,1032,113,288,623,427,885,0,63,191,576,224,510,"Human, Starfleet, Federation, Quantum Mechanics, Crafty, Desperate, Innovator","male, voy, organic, barclay, crew_max_rarity_5","Sorry, Hes Not Used To Company",1, 9, 4, 8, 8, 3, 0, , , , 350, 225, 110, 600, true,"Barclay",crew_portraits_cm_barclay_neelix_sm.png,barclay_neelix_crew
"Ensign Hoya",0,4, 0,0,0,0,0,0,941,178,301,535,72,172,667,97,194,0,0,0,0,762,1068,1079,0,631,822,954,0,163,204,464,410,657,772,0,748,1138,1181,0,625,867,1101,0,242,331,484,537,706,900,844,1139,"Benzite, Starfleet, Romantic, Resourceful, Federation","female, organic, nonhuman, ds9, hoya, crew_max_rarity_4","Shields Are Down! Engage Warp",1, 9, 8, 6, 8, , , , 2, 2, 15, , , 175, false,"Hoya",crew_portraits_cm_hoya_ensign_sm.png,hoya_ensign_crew
"Kiley Pike",0,4, 400,72,175,686,69,150,0,0,0,0,0,0,944,84,249,0,0,0,489,1213,1162,515,1040,885,667,225,529,0,946,0,733,0,598,699,1155,1121,697,991,1212,924,587,754,0,1140,0,959,0,812,1042,1398,"Human, Kiley, Federation, Starfleet, Inspiring, Undercover Operative, Desperate","male, organic, snw, pike, crew_max_rarity_4","Take Me To Your Leader",1, 6, 10, 12, 12, 7, 0, , , , 750, 300, 125, 375, false,"Pike",crew_portraits_cm_pike_kiley_sm.png,pike_kiley_crew
"Breakthrough Booker",0,5, 0,0,0,1052,74,190,506,97,221,0,0,0,1358,173,354,0,0,0,651,1114,0,521,0,128,465,48,361,962,120,844,271,0,221,1127,1037,0,758,0,458,803,241,660,885,260,800,551,0,464,368,939,"Kwejian, Federation, Desperate, Empath, Inspiring, Civilian, Communicator","male, nonhuman, organic, dsc, booker, crew_max_rarity_5","That Is The Start of Making Things Right",2, 10, 6, 6, 10, , , , , , 200, , 20, 125, false,"Booker",crew_portraits_cm_booker_breakthrough_sm.png,dsc_booker_breakthrough_crew
"Inspiring Captain Burnham",0,5, 1377,190,454,1060,129,342,0,0,0,0,0,0,682,93,210,0,0,0,11,405,198,140,93,506,393,154,296,0,1105,0,905,0,746,35,504,292,222,203,660,451,264,390,0,1199,0,1034,0,869,7,324,"Federation, Starfleet, Human, Resourceful, Inspiring, Xenoanthropology, Innovator, Displaced","female, organic, dsc, burnham, crew_max_rarity_5","Lets Get To It",2, 9, 10, 10, 6, 4, 0, , , , , , 25, 40, false,"Burnham",crew_portraits_cm_dsc_burnham_inspiring_sm.png,dsc_burnham_inspiring_crew
"Captain Vasso L'Gaelia",0,5, 1151,100,203,537,53,146,0,0,0,0,0,0,1384,100,246,0,0,0,143,654,440,62,332,1120,848,140,687,0,540,0,337,0,280,620,1056,973,573,852,1282,982,599,815,0,1129,0,943,0,797,337,1347,"R'ongovian, Ambassador, Communicator, Diplomat, Empath","nonhuman, male, organic, snw, vasso, crew_max_rarity_5","We Shall Sit and Talk",2, 7, 4, 5, 10, 7, 0, , , , 400, 75, 30, 775, true,"Vasso",crew_portraits_cm_vasso_captain_sm.png,vasso_captain_crew
"Ensign Jennifer Sh'reyan",0,4, 891,188,261,0,0,0,335,86,162,686,121,192,0,0,0,0,0,0,737,518,128,908,537,1311,644,0,0,468,1404,1039,906,472,0,739,449,178,902,560,1124,700,0,0,462,1303,925,1006,564,0,1057,1140,"Federation, Starfleet, Andorian, Athlete, Artist, Resourceful, Playful","female, nonhuman, organic, low, jen, crew_max_rarity_4","Pff...I Don't Think About You At All",0, 5, 1, 12, 15, 2, 0, , , , 500, 380, 180, 340, true,"Jen",crew_portraits_cm_jen_shreyan_sm.png,jen_shreyan_crew
"Captain Clark Terrell",0,4, 883,174,292,396,68,148,621,93,231,0,0,0,0,0,0,0,0,0,285,291,685,909,538,508,946,1251,775,824,1129,709,0,0,0,295,361,597,842,502,522,933,1239,763,867,1155,782,0,0,0,1058,1152,"Federation, Starfleet, Human, Desperate, Hero, Undercover Operative, Compromised","male, organic, tos, terrell, crew_max_rarity_4","What Do You Want With Us?",2, 4, 6, 4, 18, 1, 0, , , , 440, 200, 207, 475, true,"Terrell",crew_portraits_cm_terrell_captain_sm.png,terrell_captain_crew
"Borg Queen Jurati",0,4, 905,93,280,610,81,232,0,0,0,385,60,152,0,0,0,0,0,0,175,851,284,923,555,925,414,976,550,1126,0,0,1255,764,0,292,940,409,1023,695,974,397,1046,589,1107,0,0,1243,772,0,1122,1308,"Human, Federation, Borg, Cultural Figure, Cyberneticist, Resourceful, Survivalist, Displaced","female, organic, pic, jurati, crew_max_rarity_4","We Are Out of Time",0, 8, 8, 8, 12, , , , 2, 1, 200, , , 100, false,"Jurati",crew_portraits_cm_jurati_borg_sm.png,jurati_borg_crew
"Ixtana'Rax",0,5, 1090,102,252,0,0,0,1351,147,349,510,78,181,0,0,0,0,0,0,555,54,142,760,361,284,859,0,0,90,474,170,1131,686,0,915,301,344,1052,730,586,817,0,0,218,798,447,1126,679,0,328,918,"Jem'hadar, Dominion, Brutal, Desperate, Maverick, Tactician, Veteran","nonhuman, male, ixtanarax, organic, ds9, crew_max_rarity_5","Obedience is Victory",0, 10, 8, 9, 12, , , , , , , 95, 47, 275, false,"Ixtana'Rax",crew_portraits_cm_ixtanarax_sm.png,ixtanarax_crew
"Wizard Pollux Spock",0,4, 0,0,0,411,99,229,0,0,0,667,109,251,967,143,312,0,0,0,1214,0,820,835,0,1198,315,278,755,798,864,0,107,470,525,983,0,845,907,0,940,227,254,562,813,921,0,151,481,599,865,881,"Human, Vulcan, Telepath, Costumed, Villain, Undercover Operative","male, nonhuman, organic, snw, spock, crew_max_rarity_4","Please, Point That Elsewhere",1, 9, 4, 6, 8, , , , 0, 3, 425, 400, 43, 225, false,"Spock",crew_portraits_cm_spock_pollux_sm.png,spock_pollux_crew
"Princess Thalia and Runa",0,5, 1349,151,356,0,0,0,0,0,0,0,0,0,1058,102,254,528,53,153,293,488,255,69,16,0,0,630,692,0,782,901,551,682,108,597,702,517,290,151,0,0,964,791,0,1112,1026,912,783,420,369,993,"Human, Costumed, Royalty, Caregiver, Desperate, Musician","female, organic, snw, laan, crew_max_rarity_5","My Princess Runa Applauds You!",1, 10, 4, 6, 12, , , , , , 650, 250, 225, 690, false,"Thalia",crew_portraits_cm_laan_princess_thalia_sm.png,laan_princess_thalia_crew
"Croden",0,4, 0,0,0,385,63,166,916,195,355,0,0,0,659,110,207,0,0,0,1253,742,0,1074,0,166,950,576,782,553,198,434,922,0,769,1225,651,0,1127,0,184,900,600,736,472,238,361,994,0,834,935,961,"Rakhari, Crafty, Desperate, Duelist, Prisoner, Scoundrel, Vengeful","nonhuman, male, organic, croden, ds9, crew_max_rarity_4","Sometimes I Do Tell The Truth",0, 9, 10, 10, 10, , , , , , 475, 295, 105, 240, false,"Croden",crew_portraits_cm_croden_sm.png,croden_crew
"Captain Sonya Gomez",0,5, 1379,98,298,0,0,0,0,0,0,509,80,181,1058,101,252,0,0,0,315,509,67,75,168,0,860,633,0,1022,784,0,166,687,468,843,907,280,426,662,0,804,972,0,993,1120,0,395,665,777,416,1146,"Human, Federation, Starfleet, Tactician, Communicator, Resourceful, Inspiring","female, low, sonya, organic, crew_max_rarity_5","Take Us In, Nice And Slow",1, 8, 8, 8, 10, 3, 0, 3, , , 200, 525, 177, 225, false,"Sonya",crew_portraits_cm_sonya_gomez_captain_sm.png,sonya_gomez_captain_crew
"Spock as T'Pring",0,5, 0,0,0,520,78,266,1009,123,262,0,0,0,1324,219,376,0,0,0,1050,716,0,522,0,121,754,107,607,529,38,394,272,0,222,954,925,0,682,0,234,656,151,544,763,157,676,441,0,373,324,535,"Human, Vulcan, Federation, Starfleet, Telepath, Interrogator, Spiritual","snw, organic, nonhuman, spock, tpring, crew_max_rarity_5","This Is Coming Dangerously Close To Antics",2, 9, 8, 6, 12, 8, 4, , , , 250, 210, 180, 500, false,"Spock",crew_portraits_cm_spock_tpring_sm.png,spock_tpring_crew
"Sela in Shadow",0,5, 1355,227,427,0,0,0,0,0,0,1107,119,311,505,58,206,0,0,0,234,426,8,181,106,0,375,1134,0,457,1274,0,149,204,945,331,487,25,236,191,0,544,1133,0,705,1269,0,282,397,941,207,450,"Romulan, Human, Brutal, Scoundrel, Tactician, Villain, Saboteur","female, organic, tng, sela, crew_max_rarity_5","With Our Cloaking Devices, We Can Slip By You At Will",0, 7, 10, 12, 8, 1, 2, , , , , 100, , , false,"Sela",crew_portraits_cm_sela_shadow_sm.png,sela_shadow_crew
"Melora Pazlar",0,4, 667,121,298,916,173,351,385,73,184,0,0,0,0,0,0,0,0,0,111,591,791,1002,650,171,480,722,374,1094,1350,980,0,0,0,90,468,726,958,623,186,402,639,330,1001,1280,910,0,0,0,887,805,"Elaysian, Starfleet, Federation, Resourceful, Astrophysicist, Inspiring, Romantic, Explorer","nonhuman, female, organic, ds9, melora, crew_max_rarity_4","Im Perfectly Capable",1, 5, 12, 12, 20, 2, 0, , , , 75, 100, 20, 280, false,"Melora",crew_portraits_cm_melora_wheelchair_sm.png,melora_wheelchair_crew
"Tallinn",0,4, 0,0,0,667,90,231,941,147,308,0,0,0,0,0,0,365,62,166,910,776,0,0,1089,99,649,941,289,588,883,134,0,767,1092,998,804,0,0,1050,191,687,1030,306,632,900,183,0,744,1024,983,1168,"Romulan, Caregiver, Linguist, Communicator, Undercover Operative, Civilian","female, nonhuman, organic, pic, tallinn, crew_max_rarity_4","A Leap of Faith? It's Kind Of How I Roll",0, 7, 10, 8, 10, 4, 0, , , , , 135, , 225, false,"Tallin",crew_portraits_cm_tallinn_sm.png,tallinn_crew
