crew, tier, rarity, CMD_core, CMD_min, CMD_max, SCI_core, SCI_min, SCI_max, SEC_core, SEC_min, SEC_max, ENG_core, ENG_min, ENG_max, DIP_core, DIP_min, DIP_max, MED_core, MED_min, MED_max, V_CMD_SCI, V_CMD_SEC, V_CMD_ENG, V_CMD_DIP, V_CMD_MED, V_SCI_SEC, V_SCI_ENG, V_SCI_DIP, V_SCI_MED, V_SEC_ENG, V_SEC_DIP, V_SEC_MED, V_ENG_DIP, V_ENG_MED, V_DIP_MED, G_CMD_SCI, G_CMD_SEC, G_CMD_ENG, G_CMD_DIP, G_CMD_MED, G_SCI_SEC, G_SCI_ENG, G_SCI_DIP, G_SCI_MED, G_SEC_ENG, G_SEC_DIP, G_SEC_MED, G_ENG_DIP, G_ENG_MED, G_DIP_MED, voyage_rank, gauntlet_rank, traits, hidden_traits, action_name, action_bonus_type, action_bonus_amount, action_initial_cooldown, action_duration, action_cooldown, bonus_ability, trigger, uses_per_battle, penalty_type, penalty_amount, accuracy, crit_bonus, crit_chance, evasion, charge_phases, short_name, image_name, symbol
"Investigator Odo",8,1, 0,0,0,0,0,0,217,37,171,0,0,0,0,0,0,0,0,0,0,857,0,0,0,904,0,0,0,778,940,745,0,0,0,0,784,0,0,0,794,0,0,0,685,878,668,0,0,0,1113,1107,"Changeling, Cardassian, Investigator, Interrogator","nonhuman, male, organic, ds9, odo, crew_max_rarity_1","Collaboration",2, 1, 20, 14, 10, , , , , , 400, 115, 67, 265, false,"Odo",crew_portraits_cm_odooccupation_sm.png,odo_occupation_crew
"Constable Odo",4,3, 317,107,225,0,0,0,523,27,85,0,0,0,0,0,0,0,0,0,811,518,745,842,698,757,0,0,0,659,833,619,0,0,0,606,514,546,680,508,904,0,0,0,769,946,744,0,0,0,1012,1023,"Changeling, Bajoran, Constable, Investigator, Interrogator","nonhuman, male, organic, ds9, odo, crew_max_rarity_3","Justice",0, 6, 10, 12, 16, , , , 3, 800, 520, 300, 75, , false,"Odo",crew_portraits_cm_odostandard_sm.png,odo_constable_crew
"Ensign Ro",4,2, 322,46,132,0,0,0,0,0,0,0,0,0,0,0,0,0,0,0,886,841,820,895,771,0,0,0,0,0,0,0,0,0,0,850,815,775,862,728,0,0,0,0,0,0,0,0,0,0,1108,1111,"Starfleet, Bajoran, Resourceful","nonhuman, female, organic, tng, ensign, bridge_crew, ro, crew_max_rarity_2","Separate Ways",0, 4, 3, 10, 5, , , 2, , , 130, 210, 13, 200, false,"Ro",crew_portraits_cm_roensign_sm.png,ro_ensign_crew
"Shinzon",10,5, 819,94,241,0,0,0,938,183,435,0,0,0,546,176,390,0,0,0,486,105,429,213,376,275,0,582,0,250,98,185,540,0,462,602,146,544,171,506,230,0,345,0,207,50,170,281,0,288,405,160,"Human, Clone, Reman, Villain, Romulan","male, organic, tng, shinzon, crew_max_rarity_5","Destiny Complete",0, 7, 14, 3, 14, 1, 2, , , , 1325, 545, 365, 1050, false,"Shinzon",crew_portraits_cm_shinzon_sm.png,shinzon_crew
"Will Riker",10,1, 251,42,110,0,0,0,125,22,74,0,0,0,0,0,0,0,0,0,904,778,842,916,788,932,0,0,0,797,967,770,0,0,0,880,732,806,887,765,917,0,0,0,784,958,754,0,0,0,1100,1092,"Human, Federation, Starfleet, Maverick, Gambler, Romantic","male, organic, nonhuman, tng, commander, bridge_crew, first_officer, riker, crew_max_rarity_1","Poker Face",0, 1, 8, 10, 14, 4, 0, , , , 455, , 425, 340, false,"Riker",crew_portraits_cm_rikers1_sm.png,riker_s1_commander_crew
"Commander Riker",7,2, 279,78,191,0,0,0,124,29,89,0,0,0,290,22,64,0,0,0,883,744,817,684,768,928,0,887,0,794,852,766,869,0,755,698,576,653,654,604,901,0,917,0,768,885,742,901,0,777,1041,1009,"Human, Federation, Starfleet, Pilot, Maverick, Gambler, Romantic","male, organic, tng, commander, bridge_crew, first_officer, riker, crew_max_rarity_2","Liase",0, 2, 8, 10, 14, 5, 0, , , , 645, 50, 295, 275, false,"Riker",crew_portraits_cm_rikerpoker_sm.png,riker_s2_commander_crew
"Edith Keeler",9,4, 0,0,0,0,0,0,0,0,0,0,0,0,453,166,339,591,187,590,0,0,0,714,383,0,0,649,298,0,733,383,616,259,94,0,0,0,513,86,0,0,422,98,0,509,101,346,38,14,920,394,"Civilian, Caregiver, Inspiring, Cultural Figure, Romantic, Human","female, organic, tos, keeler, crew_max_rarity_4","A Life Worth Living",1, 7, 8, 10, 8, , , , , , 690, 25, 52, 440, false,"Keeler",crew_portraits_cm_edithkeeler_sm.png,keeler_crew
"Ensign Tuvok",8,1, 0,0,0,181,51,197,0,0,0,0,0,0,138,33,74,0,0,0,920,0,0,952,0,912,619,807,557,0,964,0,911,0,790,744,0,0,929,0,736,488,618,439,0,951,0,879,0,759,1103,1065,"Vulcan, Federation, Starfleet, Telepath","nonhuman, male, organic, voy, ensign, bridge_crew, tuvok, crew_max_rarity_1","Memory",0, 1, 1, 14, 10, , , , , , 103, 60, 135, 375, false,"Tuvok",crew_portraits_cm_tuvokensign_sm.png,tuvok_ensign_crew
"Security Chief Tuvok",5,3, 291,53,161,145,45,149,445,85,201,0,0,0,0,0,0,0,0,0,711,550,830,897,777,531,629,920,566,652,825,613,0,0,0,505,454,738,820,689,398,543,817,502,589,754,571,0,0,0,988,914,"Vulcan, Federation, Starfleet, Telepath, Tactician, Investigator","nonhuman, male, organic, voy, lieutenant_commander, bridge_crew, tuvok, crew_max_rarity_3","Contingency Plan",0, 4, 10, 12, 16, 5, 0, , , , 465, 50, , 300, false,"Tuvok",crew_portraits_cm_tuvokrifle_sm.png,tuvok_rifle_crew
"Major Kira",7,2, 273,37,126,0,0,0,304,60,176,0,0,0,0,0,0,0,0,0,896,613,834,904,779,866,0,0,0,748,918,713,0,0,0,866,561,792,873,747,745,0,0,0,639,827,628,0,0,0,1065,1047,"Bajoran, Veteran, Resourceful","nonhuman, female, organic, ds9, kira, crew_max_rarity_2","Obstinance",0, 2, 0, 10, 14, 6, 0, , , , 295, 150, 5, , true,"Kira",crew_portraits_cm_kirashorthair_sm.png,kira_major_shorthair_crew
"Mirror Intendant Kira",5,5, 512,183,363,0,0,0,1052,272,542,0,0,0,946,67,184,0,0,0,581,104,521,183,476,210,0,477,0,195,47,138,419,0,359,319,29,249,227,236,97,0,751,0,95,72,77,710,0,614,249,111,"Bajoran, Cardassian, Klingon, Villain, Klingon-Cardassian Alliance, Brutal, Mirror Universe","nonhuman, female, organic, ds9, mirror, kira, crew_max_rarity_5","Instability",0, 6, 6, 10, 12, 4, 0, , , , 915, 225, 90, 1525, true,"Kira",crew_portraits_cm_kiraintendant_sm.png,kira_mirror_crew
"Security Chief Worf",2,2, 205,57,144,0,0,0,326,61,145,0,0,0,0,0,0,0,0,0,916,650,851,928,798,860,0,0,0,742,912,706,0,0,0,819,553,751,839,702,799,0,0,0,691,882,673,0,0,0,1074,1043,"Klingon, Federation, Starfleet, Duelist, Investigator","nonhuman, male, organic, tng, lieutenant, bridge_crew, worf, crew_max_rarity_2","They Have No Honor",2, 4, 8, 10, 12, , , , 1, 2, 165, 280, 95, 155, false,"Worf",crew_portraits_cm_worf_sm.png,worf_security_chief_crew
"Defiant Commander Worf",7,4, 364,241,488,0,0,0,609,179,394,0,0,0,0,0,0,0,0,0,631,261,575,698,527,518,0,0,0,465,649,409,0,0,0,150,40,107,283,96,277,0,0,0,246,413,207,0,0,0,931,334,"Klingon, Federation, Starfleet, Duelist, Tactician","nonhuman, male, organic, ds9, lieutenant_commander, bridge_crew, worf, crew_max_rarity_4","Good Day to Die",2, 6, 12, 12, 12, 4, 0, , 1, 2, 690, 645, 325, 205, false,"Worf",crew_portraits_cm_worfdefiant_sm.png,worf_defiant_commander_crew
"Mirror Regent Worf",6,5, 861,294,589,0,0,0,1062,175,357,0,0,0,0,0,0,0,0,0,255,67,213,425,173,254,0,0,0,232,393,169,0,0,0,70,22,49,172,45,320,0,0,0,294,471,251,0,0,0,490,225,"Klingon, Cardassian, Tactician, Villain, Brutal, Klingon-Cardassian Alliance, Mirror Universe","nonhuman, male, organic, ds9, mirror, bridge_crew, worf, crew_max_rarity_5","Position of Strength",0, 9, 8, 8, 10, , , , , , 300, 980, 390, , false,"Worf",crew_portraits_cm_worfmirror_sm.png,worf_mirror_crew
"Yeoman Rand",10,1, 164,15,58,0,0,0,0,0,0,0,0,0,117,19,60,0,0,0,935,884,878,903,823,0,0,929,0,0,969,0,917,0,793,932,882,875,892,818,0,0,920,0,0,964,0,906,0,781,1110,1114,"Federation, Starfleet, Human","female, organic, tos, yeoman, bridge_crew, rand, crew_max_rarity_1","Signature Required",2, 2, 8, 10, 12, , , , 1, 1, 375, , , 180, false,"Rand",crew_portraits_cm_randyeoman_sm.png,rand_yeoman_crew
"The Duras Sisters",7,4, 311,83,205,0,0,0,658,150,385,0,0,0,464,170,341,0,0,0,836,361,776,499,727,504,0,641,0,454,230,398,605,0,513,669,220,626,231,581,318,0,415,0,292,80,248,338,0,328,767,315,"Klingon, Scoundrel, Villain","nonhuman, female, organic, tng, betor, lursa, crew_max_rarity_4","The Power of Two",0, 9, 10, 20, 12, , , 1, , , 350, 110, 190, 500, false,"Duras Sisters",crew_portraits_cm_duras_sisters_sm.png,duras_sisters_crew
"Persis",6,2, 0,0,0,0,0,0,253,94,250,0,0,0,303,39,88,0,0,0,0,834,0,901,0,862,0,878,0,743,672,708,863,0,746,0,615,0,914,0,569,0,885,0,508,522,483,861,0,745,1059,1011,"Human, Augments, Engineered, Survivalist, Tactician","nonhuman, female, organic, ent, persis, crew_max_rarity_2","Augmented Strength",0, 2, 6, 10, 6, 7, 0, 2, , , 240, 330, 300, , false,"Persis",crew_portraits_cm_persis_sm.png,persis_crew
"Telek R'Mor",5,2, 0,0,0,347,52,194,119,8,44,0,0,0,263,30,113,0,0,0,833,890,0,914,0,734,562,591,505,798,875,771,870,0,756,750,885,0,901,0,651,491,577,442,796,892,769,848,0,738,1040,1032,"Romulan, Astrophysicist","nonhuman, male, organic, voy, captain, bridge_crew, rmor, crew_max_rarity_2","Solitary Survey",1, 3, 10, 12, 10, 0, 2, , , , 405, 50, 3, 180, false,"R'Mor",crew_portraits_cm_telekrmor_sm.png,rmor_voyager_crew
"KDF Gowron",6,4, 375,85,222,0,0,0,296,100,256,0,0,0,641,173,418,0,0,0,782,542,715,382,670,825,0,556,0,715,371,676,510,0,433,640,314,589,178,548,545,0,314,0,489,122,467,250,0,262,831,409,"Klingon, Duelist, Diplomat, Politician","nonhuman, male, organic, tng, gowron, crew_max_rarity_4","What Can Be Done",1, 6, 14, 10, 14, 0, 2, , , , 625, 465, 85, 1000, false,"Gowron",crew_portraits_cm_gowronyoung_sm.png,gowron_kdf_crew
"Third Remata'Klan",9,3, 410,42,84,0,0,0,467,85,185,0,0,0,0,0,0,0,0,0,816,506,753,849,703,735,0,0,0,642,816,605,0,0,0,902,563,832,908,781,687,0,0,0,605,778,586,0,0,0,1008,1050,"Jem'hadar, Dominion, Duelist, Tactician","nonhuman, male, organic, ds9, remataklan, crew_max_rarity_3","Victory is Life",0, 3, 0, 6, 8, 4, 4, , , , 690, 395, 597, 600, true,"Remata'Klan",crew_portraits_cm_remataklan_sm.png,remataklan_crew
"Ensign Chapel",10,1, 0,0,0,0,0,0,0,0,0,0,0,0,0,0,0,214,34,152,0,0,0,0,795,0,0,0,552,0,0,750,0,505,764,0,0,0,0,722,0,0,0,509,0,0,692,0,461,690,1119,1110,"Human, Federation, Starfleet, Nurse","female, organic, tos, ensign, chapel, crew_max_rarity_1","Administer Prescription",2, 1, 6, 10, 10, , , , , , 130, , 40, 100, false,"Chapel",crew_portraits_cm_chapelensign_sm.png,chapel_ensign_crew
"Ensign Ogawa",10,1, 0,0,0,0,0,0,0,0,0,0,0,0,0,0,0,213,34,166,0,0,0,0,791,0,0,0,550,0,0,746,0,502,762,0,0,0,0,708,0,0,0,492,0,0,682,0,447,676,1116,1108,"Human, Federation, Starfleet, Nurse","female, organic, tng, ensign, ogawa, crew_max_rarity_1","Report to Sickbay",2, 1, 6, 1, 8, 2, 0, 1, , , 170, , 35, 105, false,"Ogawa",crew_portraits_cm_ogawaensign_sm.png,ogawa_ensign_crew
"Wesley Crusher",10,1, 0,0,0,218,43,149,0,0,0,174,32,78,0,0,0,0,0,0,913,0,873,0,0,908,531,898,553,792,0,0,905,518,0,835,0,849,0,0,823,422,818,503,778,0,0,878,508,0,1096,1084,"Human, Federation, Civilian, Prodigy","male, organic, tng, wesley, crew_max_rarity_1","Study",1, 2, 8, 10, 12, , , , 0, 1, 215, 125, 70, 55, false,"Wesley",crew_portraits_cm_wesleysweater_sm.png,wesley_sweater_crew
"Ensign Crusher",7,3, 176,11,31,426,83,229,0,0,0,347,34,78,0,0,0,0,0,0,594,885,693,950,824,767,358,786,473,758,0,0,856,491,0,591,886,809,956,826,634,317,673,383,772,0,0,876,504,0,992,1017,"Human, Federation, Starfleet, Prodigy, Warp Theorist","male, organic, tng, ensign, bridge_crew, wesley, crew_max_rarity_3","Rewire",2, 4, 6, 8, 10, 6, 0, , , , 290, , , 190, false,"Wesley",crew_portraits_cm_wesley_sm.png,wesley_full_ensign_crew
"Acting Ensign Crusher",9,2, 114,29,58,258,56,160,0,0,0,251,53,148,0,0,0,0,0,0,786,889,725,958,828,895,435,880,543,771,0,0,865,495,0,656,875,636,943,812,793,323,790,476,702,0,0,781,450,0,1051,1001,"Human, Federation, Starfleet, Prodigy","male, organic, tng, ensign, bridge_crew, wesley, crew_max_rarity_2","Invention",1, 4, 3, 6, 6, , , 2, , , 205, 50, 25, 165, false,"Wesley",crew_portraits_cm_wesleyensign_sm.png,wesley_acting_ensign_crew
"Formal Dress Wesley Crusher",9,4, 0,0,0,662,173,422,0,0,0,270,108,230,481,160,342,0,0,0,509,0,800,701,0,500,207,144,308,737,724,0,343,478,511,289,0,557,514,0,271,62,40,185,535,513,0,75,327,336,764,246,"Human, Federation, Starfleet, Prodigy, Warp Theorist","male, organic, tng, ensign, bridge_crew, wesley, lieutenant, crew_max_rarity_4","Duty to the Truth",1, 9, 4, 10, 12, , , , , , 300, 500, 30, 450, false,"Wesley",crew_portraits_cm_wesleydressuniform_sm.png,wesley_formal_dress_crew
"Wrathful Khan",7,5, 1040,206,421,0,0,0,1145,72,143,376,140,288,0,0,0,0,0,0,245,72,48,418,160,273,510,0,0,66,414,183,743,425,0,232,207,18,381,156,776,316,0,0,201,861,657,449,248,0,350,390,"Human, Augments, Engineered, Villain, Cultural Figure, Tactician, Resourceful, Survivalist, Brutal","nonhuman, male, organic, tos, khan, crew_max_rarity_5","I Stab at Thee",2, 9, 12, 5, 12, 1, 0, , , , 640, 595, 345, 850, false,"Khan",crew_portraits_cm_khan_sm.png,khan_wok_crew
"Tailor Garak",4,3, 0,0,0,0,0,0,502,44,126,161,22,44,395,83,219,0,0,0,0,753,880,815,0,749,636,794,0,501,519,614,593,520,660,0,820,878,720,0,850,638,691,0,648,530,703,534,521,554,969,989,"Cardassian, Undercover Operative, Scoundrel, Interrogator, Civilian","nonhuman, male, organic, ds9, garak, crew_max_rarity_3","Cutting Cloth",1, 5, 8, 12, 12, , , , , , 125, 230, 20, 405, false,"Garak",crew_portraits_cm_garaktailor_sm.png,garak_tailor_crew
"Bartender Quark",9,1, 110,25,77,0,0,0,81,15,57,0,0,0,211,36,150,0,0,0,940,872,883,867,826,934,0,902,0,799,921,772,888,0,769,917,816,854,735,798,928,0,831,0,794,805,767,797,0,696,1088,1062,"Ferengi, Bartender, Civilian, Scoundrel, Gambler, Merchant","nonhuman, male, organic, ds9, quark, crew_max_rarity_1","Hospitality",1, 2, 8, 10, 12, , , , 2, 1, 165, 10, 10, 140, false,"Quark",crew_portraits_cm_quarkbartender_sm.png,quark_s1_bartender_crew
"Richard Castillo",4,3, 487,109,227,286,57,187,0,0,0,0,0,0,0,0,0,0,0,0,448,696,635,733,583,884,605,874,538,0,0,0,0,0,0,298,629,539,674,502,746,496,757,448,0,0,0,0,0,0,1014,969,"Human, Hero, Pilot, Starfleet, Federation","bridge_crew, male, organic, castillo, tng, lieutenant, crew_max_rarity_3","Self Sacrifice",0, 5, 12, 12, 10, 7, 0, , 1, 2, 650, 265, 129, 585, false,"Castillo",crew_portraits_cm_richardcastillo_sm.png,castillo_lieutenant_crew
"Writer Jake Sisko",10,3, 0,0,0,0,0,0,0,0,0,0,0,0,451,70,198,0,0,0,0,0,0,803,0,0,0,778,0,0,830,0,748,0,648,0,0,0,758,0,0,0,724,0,0,796,0,682,0,591,1087,1091,"Human, Federation, Civilian, Writer, Gambler, Romantic","male, organic, ds9, jake, crew_max_rarity_3","Construct Story",2, 3, 0, 8, 10, 6, 0, , , , 995, 350, 47, 640, true,"Jake",crew_portraits_cm_jakewriter_sm.png,jake_writer_crew
"CMO Crusher",3,2, 0,0,0,0,0,0,0,0,0,0,0,0,0,0,0,290,52,174,0,0,0,0,773,0,0,0,537,0,0,725,0,489,738,0,0,0,0,676,0,0,0,466,0,0,653,0,432,641,1109,1102,"Human, Starfleet, Federation, Physician, Caregiver, Cyberneticist","female, organic, tng, commander, crusher, crew_max_rarity_2","Doctor's Calluses",2, 3, 6, 10, 10, , , , , , 185, , 35, 155, false,"Crusher",crew_portraits_cm_crusherwithlabcoat_sm.png,crusher_labcoat_crew
"Commando Crusher",1,3, 0,0,0,182,76,200,308,93,193,0,0,0,0,0,0,510,44,132,909,811,0,0,646,570,614,897,312,725,893,338,0,416,624,699,696,0,0,734,293,451,718,281,590,758,337,0,470,704,961,889,"Human, Starfleet, Federation, Physician, Cyberneticist, Undercover Operative","female, organic, tng, commander, crusher, crew_max_rarity_3","Repel Disease",0, 3, 6, 3, 12, 1, 0, , , , 575, , 370, 500, false,"Crusher",crew_portraits_cm_crusherblackcommandouniform_sm.png,crusher_black_commando_uniform_crew
"Dr. Crusher",9,4, 275,38,110,0,0,0,437,90,201,0,0,0,0,0,0,736,123,300,897,566,835,906,174,753,0,0,304,656,831,108,0,269,425,885,518,815,893,226,652,0,0,296,583,749,121,0,244,422,847,793,"Human, Starfleet, Federation, Physician, Cyberneticist","female, organic, tng, commander, crusher, crew_max_rarity_4","Neutralize Disease",1, 7, 12, 12, 12, 4, 4, , , , 740, 250, 370, 500, false,"Crusher",crew_portraits_cm_crusherfromfirstcontact_sm.png,crusher_first_contact_crew
"Holonovel Doctor",6,4, 0,0,0,512,50,137,0,0,0,0,0,0,0,0,0,799,69,244,762,0,0,0,387,742,505,765,98,0,0,388,0,265,422,844,0,0,0,549,831,550,824,241,0,0,544,0,355,532,942,1002,"Hologram, Human, Federation, Starfleet, Physician, Musician, Scoundrel","nonhuman, male, artificial_life, voy, emh, crew_max_rarity_4","Suggested Treatment",0, 7, 12, 12, 12, , , , , , 365, 370, 205, 525, false,"Doctor",crew_portraits_cm_doctorgolfclub_sm.png,emh_authorauthor_crew
"Mobile Doctor",5,5, 0,0,0,809,106,209,0,0,0,0,0,0,393,137,435,1191,110,334,504,0,0,731,140,497,360,159,27,0,754,148,640,101,45,641,0,0,454,377,629,407,109,105,0,444,376,272,229,57,410,342,"Hologram, Human, Federation, Starfleet, Musician, Physician","nonhuman, male, artificial_life, voy, emh, crew_max_rarity_5","House Call",2, 9, 12, 12, 12, , , , , , 1825, 600, , 600, false,"Doctor",crew_portraits_cm_emhmobile_sm.png,emh_mobileholoemitter_crew
"Comm Officer Uhura",10,1, 0,0,0,0,0,0,0,0,0,0,0,0,258,28,89,0,0,0,0,0,0,922,0,0,0,894,0,0,943,0,879,0,760,0,0,0,922,0,0,0,894,0,0,945,0,872,0,753,1115,1119,"Federation, Starfleet, Human, Musician, Communicator","female, organic, tos, lieutenant, bridge_crew, uhura, crew_max_rarity_1","Incoming Message",2, 2, 8, 10, 12, , , , 1, 1, 320, , , 495, false,"Uhura",crew_portraits_cm_uhurared_sm.png,uhura_red_crew
"Commander Uhura",10,4, 459,128,299,0,0,0,0,0,0,0,0,0,592,198,429,0,0,0,673,685,624,307,568,0,0,564,0,0,648,0,517,0,438,478,539,405,104,391,0,0,278,0,0,374,0,205,0,220,940,628,"Federation, Starfleet, Human, Musician, Communicator","female, organic, tos, commander, bridge_crew, uhura, crew_max_rarity_4","Hailing Frequencies",0, 8, 12, 26, 12, , , 1, , , 1165, , 75, 790, false,"Uhura",crew_portraits_cm_uhurawrathofkhan_sm.png,uhura_wrathofkhan_crew
"Dancing Uhura",8,5, 1026,84,195,0,0,0,0,0,0,0,0,0,1185,193,393,0,0,0,368,458,332,53,281,0,0,256,0,0,345,0,202,0,199,684,704,640,202,595,0,0,321,0,0,433,0,259,0,267,485,801,"Human, Federation, Starfleet, Communicator, Casual, Musician, Artist","bridge_crew, female, organic, tos, uhura, lieutenant_commander, original, crew_max_rarity_5","Take The Lead",0, 8, 10, 3, 14, 1, 1, , , , 465, 260, 60, 400, false,"Uhura",crew_portraits_cm_uhura_dancing_sm.png,uhura_dancing_crew
"First Maje Culluh",5,3, 466,93,223,0,0,0,307,42,138,0,0,0,0,0,0,0,0,0,730,536,669,771,622,885,0,0,0,760,928,729,0,0,0,631,457,572,695,536,837,0,0,0,718,898,696,0,0,0,1025,1000,"Kazon, Scoundrel","nonhuman, male, organic, voy, captain, culluh, crew_max_rarity_3","Nistrim Supremacy",2, 3, 6, 10, 10, 8, 4, , , , 665, 325, 133, 390, false,"Culluh",crew_portraits_cm_jalculluh_sm.png,culluh_crew
"KDF Alexander",6,2, 137,19,79,0,0,0,331,64,148,145,16,72,0,0,0,0,0,0,937,729,832,953,825,853,637,0,0,624,905,700,912,521,0,919,665,769,935,801,784,633,0,0,573,867,661,898,515,0,1056,1051,"Human, Klingon","male, organic, ds9, bridge_crew, alexander, nonhuman, crew_max_rarity_2","Beginner's Luck",1, 3, 10, 12, 10, 5, 2, , , , 130, 200, 62, 15, false,"Alexander",crew_portraits_cm_alexanderkdf_sm.png,alexander_kdf_crew
"Commando Shran",9,4, 673,114,239,0,0,0,592,89,182,0,0,0,318,144,282,0,0,0,539,280,472,413,423,611,0,796,0,542,411,499,768,0,663,578,347,507,255,474,686,0,530,0,604,282,585,451,0,426,761,623,"Andorian, Tactician, Inspiring, Imperial Guard","nonhuman, male, organic, ent, captain, shran, crew_max_rarity_4","Debt Owed",0, 8, 6, 8, 10, , , 3, , , 390, 575, 288, 350, false,"Shran",crew_portraits_cm_shrancommando_sm.png,shran_commando_crew
"Ushaan Shran",9,5, 989,83,164,0,0,0,1076,170,348,0,0,0,424,134,288,0,0,0,407,88,367,253,311,251,0,708,0,229,112,167,688,0,584,734,250,686,344,633,337,0,535,0,312,124,268,457,0,429,395,486,"Andorian, Duelist, Romantic, Imperial Guard","nonhuman, male, organic, ent, captain, shran, crew_max_rarity_5","Debt Owed",0, 9, 6, 8, 10, , , 3, , , 1440, 565, 483, 390, false,"Shran",crew_portraits_cm_shrandueling_sm.png,shran_dueling_crew
"Fencing Sulu",10,4, 444,99,249,385,36,92,609,203,448,0,0,0,0,0,0,0,0,0,444,299,679,777,632,235,582,847,520,449,637,394,0,0,0,416,124,520,660,485,112,611,882,553,179,317,150,0,0,0,808,529,"Human, Federation, Starfleet, Pilot, Resourceful, Duelist","male, organic, tos, lieutenant, bridge_crew, sulu, crew_max_rarity_4","Parry Attack",0, 6, 12, 8, 12, 6, 4, , , , 415, , 225, 225, false,"Sulu",crew_portraits_cm_sulufencing_sm.png,sulu_fencing_crew
"Morn",7,3, 0,0,0,0,0,0,359,70,174,0,0,0,418,121,295,0,0,0,0,786,0,775,0,819,0,723,0,706,537,670,701,0,597,0,736,0,605,0,731,0,543,0,629,327,619,469,0,440,1001,929,"Lurian, Courier, Duelist, Civilian, Gambler, Smuggler","nonhuman, male, organic, ds9, morn, crew_max_rarity_3","Drinking Spot",0, 3, 0, 8, 8, , , , 1, 2, 150, 285, 57, 655, true,"Morn",crew_portraits_cm_morn_sm.png,morn_crew
"Seven in Blue",3,2, 0,0,0,294,51,209,0,0,0,278,53,130,0,0,0,0,0,0,884,0,833,0,0,873,394,864,531,768,0,0,862,494,0,726,0,779,0,0,718,306,734,429,721,0,0,801,464,0,1062,1033,"Human, Borg, Civilian, Federation","nonhuman, female, organic, voy, bridge_crew, seven, crew_max_rarity_2","Ignore Irrelevancies",1, 2, 8, 10, 14, 4, 0, , , , 75, 50, 310, 170, false,"Seven",crew_portraits_cm_seven_of_nine_sm.png,seven_allblue_crew
"Seven of Nine",7,5, 0,0,0,785,247,791,0,0,0,854,225,454,514,89,183,0,0,0,269,0,310,742,0,263,40,90,170,304,770,0,53,172,559,39,0,146,749,0,34,3,11,39,178,790,0,47,73,588,385,25,"Human, Borg, Civilian, Federation","nonhuman, female, organic, voy, bridge_crew, seven, crew_max_rarity_5","New Collective",2, 7, 12, 10, 14, 4, 0, , , , 1750, , 705, 440, false,"Seven",crew_portraits_cm_sevenbluegreyshoulders_sm.png,seven_bluegreyshoulders_crew
"Donik",6,3, 0,0,0,0,0,0,0,0,0,476,79,199,303,31,79,0,0,0,0,0,689,902,0,0,492,881,0,633,933,0,490,409,748,0,0,654,928,0,0,452,899,0,607,950,0,509,393,758,1035,1055,"Hirogen, Innovator","nonhuman, male, organic, voy, donik, crew_max_rarity_3","Hunting Program",2, 4, 12, 12, 10, 7, 0, , , , 870, 165, , 340, false,"Donik",crew_portraits_cm_donik_sm.png,donik_crew
"Commander Tucker",8,2, 252,28,82,0,0,0,0,0,0,305,53,185,0,0,0,0,0,0,912,861,574,925,796,0,593,0,0,749,0,0,845,482,0,912,859,530,925,794,0,504,0,0,656,0,0,726,424,0,1075,1067,"Human, Starfleet, Jury Rigger, Pilot, Explorer","male, organic, ent, commander, tucker, crew_max_rarity_2","Warp Engines Online",1, 2, 6, 3, 8, 2, 0, , , , 520, 35, 50, 165, false,"Trip",crew_portraits_cm_tucker_sm.png,tucker_commander_crew
"Counselor Troi",9,1, 0,0,0,0,0,0,0,0,0,0,0,0,261,42,108,147,49,131,0,0,0,912,819,0,0,886,565,0,936,761,868,516,653,0,0,0,894,732,0,0,869,519,0,927,697,838,465,516,1090,1077,"Federation, Starfleet, Human, Betazoid, Empath, Counselor","nonhuman, female, organic, tng, lieutenant_commander, bridge_crew, troi, crew_max_rarity_1","Counselling",2, 1, 6, 10, 10, , , , , , 265, , 80, 345, false,"Troi",crew_portraits_cm_troitng_sm.png,troi_casualgray_crew
"Rakal Troi",8,4, 521,163,354,0,0,0,525,128,331,0,0,0,0,0,0,407,163,440,585,313,525,663,116,587,0,0,383,522,697,134,0,358,514,352,133,278,486,13,415,0,0,178,369,533,18,0,114,237,663,126,"Federation, Starfleet, Human, Betazoid, Romulan, Empath, Undercover Operative, Tal Shiar","nonhuman, female, organic, tng, lieutenant_commander, bridge_crew, troi, crew_max_rarity_4","Romulan Disguise",1, 7, 12, 10, 14, 1, 2, , , , 90, 400, 175, 2825, false,"Troi",crew_portraits_cm_troirakal_sm.png,troi_rakal_crew
"Commander Troi",8,5, 0,0,0,0,0,0,383,203,253,0,0,0,1060,211,421,827,142,281,0,737,0,414,344,725,0,296,277,634,109,51,238,228,28,0,498,0,401,404,422,0,275,297,374,69,63,203,245,47,414,170,"Federation, Starfleet, Human, Betazoid, Empath, Counselor","nonhuman, female, organic, tng, commander, bridge_crew, troi, crew_max_rarity_5","Empathic Sense",1, 8, 6, 6, 6, , , , , , 1375, 475, 135, 725, true,"Troi",crew_portraits_cm_troifirstcontact_sm.png,troi_firstcontact_crew
"Vedek Winn Adami",5,3, 307,97,207,0,0,0,0,0,0,0,0,0,410,92,214,0,0,0,834,803,771,585,723,0,0,790,0,0,839,0,762,0,656,648,675,597,411,556,0,0,688,0,0,742,0,631,0,549,1026,962,"Bajoran, Vedek, Cultural Figure, Spiritual","nonhuman, female, organic, ds9, winn, crew_max_rarity_3","Will of the Prophets",1, 4, 8, 10, 10, 4, 0, , , , , 270, 85, 830, false,"Winn",crew_portraits_cm_winnvedek_sm.png,winn_vedek_crew
"Subcommander T'Pol",4,3, 273,71,211,520,21,77,165,35,77,0,0,0,0,0,0,0,0,0,499,717,816,893,766,555,526,791,479,793,960,764,0,0,0,544,570,637,736,589,795,628,909,563,770,947,745,0,0,0,990,1003,"Vulcan, High Command, Astrophysicist, Telepath","nonhuman, female, organic, ent, first_officer, bridge_crew, tpol, crew_max_rarity_3","Logic",2, 5, 6, 10, 10, , , , , , 175, 120, 3, 100, false,"T'Pol",crew_portraits_cm_tpol_sm.png,tpol_subcommander_crew
"Commander T'Pol",8,4, 512,112,307,692,56,171,320,91,227,0,0,0,0,0,0,0,0,0,181,423,578,702,529,267,389,595,341,711,874,673,0,0,0,215,266,418,587,403,313,509,774,467,544,707,524,0,0,0,809,707,"Vulcan, Starfleet, Astrophysicist, Telepath","nonhuman, female, organic, ent, first_officer, commander, bridge_crew, tpol, crew_max_rarity_4","Vessel's Information",0, 5, 12, 12, 20, 2, 0, , , , 1400, 200, 70, 1175, false,"T'Pol",crew_portraits_cm_tpolcommander_sm.png,tpol_commander_crew
"Chef Neelix",10,1, 0,0,0,0,0,0,0,0,0,0,0,0,201,51,189,0,0,0,0,0,0,921,0,0,0,892,0,0,941,0,876,0,759,0,0,0,790,0,0,0,762,0,0,840,0,722,0,627,1114,1098,"Talaxian, Mylean, Resourceful, Survivalist, Chef, Civilian, Communicator","nonhuman, male, organic, voy, neelix, crew_max_rarity_1","Soup's On",1, 2, 12, 14, 10, 6, 0, , 2, 1, 305, , , 210, false,"Neelix",crew_portraits_cm_neelix_sm.png,neelix_chef_crew
"CMO 'Bones' McCoy",9,1, 0,0,0,0,0,0,0,0,0,0,0,0,0,0,0,213,48,196,0,0,0,0,783,0,0,0,546,0,0,743,0,498,754,0,0,0,0,646,0,0,0,444,0,0,624,0,418,620,1111,1095,"Human, Federation, Starfleet, Physician, Exobiology","male, organic, tos, lieutenant_commander, mccoy, crew_max_rarity_1","Country Doctor",2, 3, 8, 10, 12, , , , 0, 2, 245, 10, 8, 285, false,"McCoy",crew_portraits_cm_mccoy_sm.png,mccoy_chief_medical_officer_crew
