"Transporter Chief Rand",10,4, 0,0,0,0,0,0,0,0,0,859,113,241,628,92,204,0,0,0,0,0,377,630,0,0,314,562,0,380,645,0,48,221,447,0,0,490,682,0,0,349,658,0,476,711,0,164,289,528,823,886,"Human, Federation, Starfleet, Desperate","female, organic, tos, rand, crew_max_rarity_4","Yank Them Back!",1, 8, 8, 8, 10, , , , , , 475, 275, 155, 242, false,"Rand",crew_portraits_cm_rand_transporter_sm.png,rand_transporter_crew
"Betrothed Kamala",2,2, 234,27,86,145,27,81,0,0,0,0,0,0,363,43,105,0,0,0,764,818,812,658,766,872,593,667,541,0,851,0,786,0,681,750,807,795,718,750,856,581,697,532,0,874,0,790,0,686,986,998,"Kriosian, Empath, Romantic","organic, tng, female, nonhuman, kamala, crew_max_rarity_2","I Am for You",1, 2, 6, 3, 10, 1, 0, , , , 390, 130, 115, 530, false,"Kamala",crew_portraits_cm_kamala_betrothed_sm.png,kamala_betrothed_crew
"Cadet First Class Locarno",9,5, 1284,180,408,0,0,0,0,0,0,0,0,0,1078,160,296,0,0,0,123,249,94,2,53,0,0,290,0,0,376,0,231,0,223,262,359,189,99,185,0,0,454,0,0,524,0,369,0,360,394,591,"Human, Federation, Starfleet, Maverick, Pilot, Crafty, Desperate","tng, male, nicholas_locarno, organic, crew_max_rarity_5","Everything I Said Was The Truth!",1, 10, 4, 12, 8, , , , 2, 2, 390, 150, 175, 690, false,"Locarno",crew_portraits_cm_nicholas_locarno_sm.png,locarno_nicholas_crew
"Kamala",5,5, 967,131,227,546,92,174,0,0,0,0,0,0,1254,238,483,0,0,0,79,438,321,26,276,614,423,44,385,0,223,0,85,0,106,228,570,468,86,443,655,427,74,396,0,245,0,118,0,143,94,299,"Kriosian, Empath, Romantic, Exoarchaeology","nonhuman, female, organic, tng, kamala, crew_max_rarity_5","Who I Am Today, I Will Be Forever",1, 7, 4, 6, 8, , , , , , 315, 95, 167, 325, true,"Kamala",crew_portraits_cm_kamala_sm.png,kamala_crew
"Priestess Siranna",8,4, 529,112,242,0,0,0,0,0,0,0,0,0,883,138,286,382,78,211,613,623,548,208,184,0,0,434,457,0,509,600,371,411,100,541,573,472,237,134,0,0,494,380,0,566,539,413,354,146,542,564,"Gardener, Kelpien, Spiritual, Civilian, Ambassador, Cultural Figure","nonhuman, female, organic, dsc, siranna, crew_max_rarity_4","The Truth Has Survived",1, 7, 6, 8, 8, , , , , , 450, 200, 100, 475, false,"Siranna",crew_portraits_cm_siranna_priestess_sm.png,dsc_siranna_priestess_crew
"Scrooge Data",4,5, 969,171,330,508,73,173,0,0,0,0,0,0,1267,264,338,0,0,0,75,365,231,18,193,669,453,63,417,0,275,0,120,0,136,132,427,286,71,274,692,458,112,420,0,380,0,214,0,233,115,291,"Android, Starfleet, Federation, Cyberneticist, Costumed, Cultural Figure","nonhuman, male, tng, lieutenant_commander, bridge_crew, artificial_life, data, crew_max_rarity_5","Humbug",1, 9, 6, 8, 6, , , , , , 200, 305, 160, 475, false,"Data",crew_portraits_cm_data_scrooge_sm.png,data_scrooge_crew
"Chancellor Martok",5,5, 943,132,341,0,0,0,543,67,148,0,0,0,1262,161,372,0,0,0,328,164,279,34,245,638,0,219,0,558,73,521,152,0,165,389,279,313,115,305,728,0,365,0,631,227,616,297,0,301,181,420,"Klingon, Duelist, Tactician, Diplomat, Veteran, Politician, Cultural Figure","nonhuman, male, organic, ds9, martok, crew_max_rarity_5","I will fight any battle. Anywhere",0, 9, 8, 8, 10, , , , 2, 2, 400, 125, 184, 450, false,"Martok",crew_portraits_cm_martok_chancellor_sm.png,martok_chancellor_crew
"Admiral Patrick",5,5, 1238,275,538,1023,124,239,0,0,0,0,0,0,495,76,143,0,0,0,2,224,75,83,37,297,233,119,193,0,767,0,680,0,589,16,213,67,102,62,515,340,301,322,0,815,0,710,0,615,64,241,"Human, Engineered, Federation, Civilian, Costumed, Crafty","male, organic, ds9, patrick, crew_max_rarity_5","That's A Stupid Question",1, 9, 8, 10, 10, , , , , , 500, 100, 155, 375, false,"Patrick",crew_portraits_cm_patrick_admiral_sm.png,patrick_admiral_crew
"Christine Chapel",6,4, 0,0,0,559,70,170,0,0,0,0,0,0,349,103,201,790,127,280,641,0,0,780,346,613,422,366,75,0,806,352,726,234,175,718,0,0,673,394,702,465,347,144,0,697,388,591,240,145,681,676,"Federation, Starfleet, Human, Physician, Veteran, Nurse, Romantic","female, organic, tos, chapel, crew_max_rarity_4","Don't You Recognise Me?",1, 7, 8, 12, 12, 5, 0, , , , 1400, 185, 120, 400, false,"Chapel",crew_portraits_cm_chapel_christine_sm.png,chapel_christine_crew
"Brainless Spock",8,2, 0,0,0,223,43,138,0,0,0,360,51,179,0,0,0,0,0,0,865,0,716,0,0,855,370,845,524,669,0,0,747,435,0,806,0,683,0,0,788,306,785,494,619,0,0,697,403,0,1003,988,"Federation, Starfleet, Exobiology, Astrophysicist, Human, Musician, Vulcan, Telepath","nonhuman, male, organic, tos, bridge_crew, first_officer, spock, spock_tos, crew_max_rarity_2","A Practical Idea",2, 3, 8, 10, 8, , , , , , 460, 150, 163, 390, false,"Spock",crew_portraits_cm_spock_brainless_sm.png,spock_brainless_crew
"Garth of Izar",5,5, 1214,226,444,0,0,0,989,156,344,0,0,0,487,83,142,0,0,0,141,21,108,111,71,264,0,716,0,236,141,180,685,0,595,181,62,126,155,120,345,0,733,0,307,236,275,705,0,610,138,237,"Prisoner, Desperate, Human, Brutal, Resourceful, Villain, Shapeshifter, Veteran","organic, male, tos, garth_izar, crew_max_rarity_5","I'm Afraid of No One",0, 8, 6, 8, 10, 1, 0, 2, , , 300, 200, 185, 225, false,"Garth",crew_portraits_cm_garth_izar_sm.png,garth_izar_crew
"Seeking Spock",4,5, 0,0,0,1257,183,448,0,0,0,0,0,0,430,132,295,931,170,326,143,0,0,707,249,144,149,58,16,0,735,225,630,158,69,226,0,0,556,284,216,166,48,26,0,565,284,412,177,75,147,137,"Vulcan, Human, Telepath, Spiritual, Starfleet, Federation, Resourceful, Explorer","nonhuman, male, organic, tos, spock, spock_tos, crew_max_rarity_5","Recommend We Proceed",1, 9, 10, 12, 12, , , , , , 550, 200, 175, 225, false,"Spock",crew_portraits_cm_spock_seeking_sm.png,spock_seeking_crew
"Compromised Airiam",8,5, 0,0,0,940,178,397,1254,198,420,0,0,0,0,0,0,0,0,0,294,272,0,0,0,4,223,321,186,136,270,97,0,0,0,286,333,0,0,0,19,212,310,187,193,342,168,0,0,0,418,450,"Control, Federation, Starfleet, Brutal, Undercover Operative, Human, Engineered, Astrophysicist","evsuit, female, organic, dsc, bridge_crew, airiam, crew_max_rarity_5","Open The Airlock",0, 9, 8, 8, 10, , , , 2, 2, 555, 125, 285, 400, false,"Airiam",crew_portraits_cm_airiam_compromised_sm.png,dsc_airiam_compromised_crew
"Lt. Uhura",4,3, 384,51,129,0,0,0,0,0,0,0,0,0,539,76,178,0,0,0,770,742,703,486,664,0,0,643,0,0,713,0,608,0,517,802,765,728,541,688,0,0,699,0,0,768,0,662,0,573,938,977,"Human, Starfleet, Federation, Musician, Communicator","bridge_crew, female, organic, tos, uhura, lieutenant, crew_max_rarity_3","Hailing Frequencies Open",1, 5, 6, 10, 12, , , , , , 300, 50, 71, 190, false,"Uhura",crew_portraits_cm_uhura_lt_yellow_sm.png,uhura_lt_yellow_crew
"Rescue Team Uhura",4,5, 984,179,361,0,0,0,1313,166,410,0,0,0,456,113,208,0,0,0,259,8,208,157,172,111,0,699,0,116,61,68,672,0,576,303,79,234,184,226,264,0,620,0,225,131,202,558,0,496,46,209,"Human, Federation, Starfleet, Communicator, Resourceful, Musician, Marksman","bridge_crew, female, organic, tos, uhura, lieutenant_commander, crew_max_rarity_5","Phasers on Setting One. Fire.",2, 7, 6, 3, 8, 7, 0, , , , 540, 225, 68, 150, false,"Uhura",crew_portraits_cm_uhura_rescue_sm.png,uhura_rescue_crew
"Sulu of the Body",8,4, 612,111,266,0,0,0,0,0,0,0,0,0,910,153,301,0,0,0,530,558,470,140,428,0,0,402,0,0,484,0,344,0,300,509,552,439,196,421,0,0,459,0,0,528,0,374,0,362,774,773,"Human, Federation, Starfleet, Diplomat, Pilot, Archon","male, organic, tos, bridge_crew, sulu, crew_max_rarity_4","Paradise, My Friend, Paradise",1, 6, 8, 8, 12, 6, 0, , , , 615, 270, 168, 475, false,"Sulu",crew_portraits_cm_sulu_archon_sm.png,sulu_archon_crew
"Lenara Kahn",10,5, 0,0,0,1246,187,421,0,0,0,0,0,0,997,144,301,0,0,0,161,0,0,431,0,161,157,15,107,0,415,0,264,0,250,248,0,0,538,0,240,183,50,168,0,539,0,388,0,368,425,588,"Trill, Astrophysicist, Romantic","nonhuman, female, organic, ds9, lenara, crew_max_rarity_5","I'm Not Like You",1, 10, 8, 8, 8, , , , , , 315, 200, 150, 490, false,"Lenara",crew_portraits_cm_lenara_kahn_sm.png,lenara_kahn_crew
"Torpedo Surgeon McCoy",4,5, 0,0,0,893,148,332,0,0,0,593,29,70,0,0,0,1254,142,484,381,0,616,0,60,368,92,405,19,568,0,79,624,10,123,391,0,811,0,151,379,207,417,29,735,0,164,836,51,203,199,442,"Federation, Starfleet, Human, Physician, Exobiology, Desperate, Jury Rigger","male, organic, tos, lieutenant_commander, mccoy, crew_max_rarity_5","Lock and Load",2, 8, 4, 6, 8, 1, 0, , , , 300, 230, 86, 250, true,"McCoy",crew_portraits_cm_mccoy_torpedo_sm.png,mccoy_torpedo_crew
"Scared Scotty",4,4, 0,0,0,0,0,0,381,89,175,871,114,238,639,59,128,0,0,0,0,730,373,657,0,745,312,596,0,140,392,610,50,216,477,0,675,496,808,0,653,355,778,0,203,520,560,288,296,651,588,797,"Human, Starfleet, Federation, Jury Rigger, Desperate","male, organic, tos, scott, crew_max_rarity_4","I Don't Remember",1, 5, 12, 10, 12, 0, 1, , , , 370, 145, 17, 250, false,"Scotty",crew_portraits_cm_scotty_scared_sm.png,scott_scared_crew
"Talas",6,5, 510,73,159,0,0,0,958,151,327,1273,208,375,0,0,0,0,0,0,687,174,32,713,582,303,155,0,0,15,430,220,125,56,0,723,271,74,745,624,374,208,0,0,23,490,302,243,134,0,158,340,"Andorian, Imperial Guard, Saboteur, Romantic, Tactician, Crafty","nonhuman, female, organic, ent, talas, lieutenant, crew_max_rarity_5","It's Not The Weapon, It's The Soldier",2, 6, 10, 10, 18, 2, 0, , , , 1475, 200, 115, 415, false,"Talas",crew_portraits_cm_talas_sm.png,talas_crew
"EV Suit Chekov",7,4, 379,58,169,661,62,141,0,0,0,0,0,0,925,129,248,0,0,0,266,736,691,266,649,546,383,97,341,0,498,0,363,0,310,447,720,679,391,636,757,496,306,467,0,623,0,481,0,442,527,796,"Federation, Starfleet, Human, Resourceful, Tactician","male, evsuit, organic, tos, lieutenant, bridge_crew, chekov, crew_max_rarity_4","We've Got To Get Out Of Here",1, 7, 14, 12, 14, 5, 0, , , , 380, 50, 70, 400, false,"Chekov",crew_portraits_cm_chekov_evsuit_sm.png,chekov_evsuit_crew
"Laborer Kirk",3,5, 1013,107,294,0,0,0,0,0,0,1292,210,476,496,65,151,0,0,0,284,375,2,185,201,0,122,712,0,101,769,0,26,34,591,478,529,12,376,397,0,141,745,0,153,825,0,51,70,621,74,339,"Human, Federation, Starfleet, Jury Rigger, Resourceful, Romantic, Thief, Desperate","male, organic, tos, captain, bridge_crew, kirk, crew_max_rarity_5","How Are The Stone Knives And Bearskins?",2, 7, 8, 8, 12, 2, 0, , , , 200, 200, 147, 375, false,"Kirk",crew_portraits_cm_kirk_laborer_sm.png,kirk_laborer_crew
"Dress Uniform Beverly Crusher",8,4, 0,0,0,0,0,0,0,0,0,0,0,0,611,73,245,810,172,428,0,0,0,631,294,0,0,566,227,0,650,281,529,189,56,0,0,0,656,176,0,0,624,171,0,680,187,566,113,76,791,706,"Human, Starfleet, Federation, Physician, Caregiver, Cyberneticist","female, organic, tng, commander, crusher, crew_max_rarity_4","The Bride and Groom",2, 8, 10, 6, 12, , , , , , 400, 195, 217, 415, false,"Crusher",crew_portraits_cm_crusher_dress_uniform_sm.png,crusher_dress_uniform_crew
"Ishan Chaye Sisko",2,5, 0,0,0,0,0,0,496,93,293,1284,247,490,987,120,226,0,0,0,0,638,81,482,0,605,118,380,0,35,136,488,5,29,281,0,544,108,630,0,479,116,593,0,19,233,412,23,52,471,43,197,"Bajoran, Resourceful, Desperate, Undercover Operative, Civilian, Investigator","male, organic, ds9, captain, bridge_crew, sisko, crew_max_rarity_5","We're Not Who We Seem To Be",1, 9, 6, 10, 10, , , , , , 200, 220, 160, 380, false,"Sisko",crew_portraits_cm_sisko_ishan_chaye_sm.png,sisko_ishan_chaye_crew
"Saowin",10,4, 0,0,0,874,171,371,0,0,0,671,94,219,0,0,0,0,0,0,376,0,458,0,0,358,63,393,223,448,0,0,500,279,0,314,0,560,0,0,306,78,348,206,527,0,0,575,336,0,762,753,"Desperate, Resourceful, Ambassador, Civilian","male, organic, nonhuman, voy, saowin, crew_max_rarity_4","I Have Some Bad News",1, 7, 6, 8, 10, 3, 0, 2, , , 400, 50, 96, 474, false,"Saowin",crew_portraits_cm_saowin_sm.png,saowin_crew
"Dejaren",4,4, 566,157,355,380,54,148,877,159,388,0,0,0,0,0,0,0,0,0,237,132,452,593,409,100,515,763,470,311,471,263,0,0,0,159,92,269,459,255,125,495,760,465,256,427,226,0,0,0,489,370,"Brutal, Hologram, Crafty, Desperate, Saboteur","male, artificial_life, nonhuman, voy, dejaren, crew_max_rarity_4","You're Getting Blood Everywhere",0, 7, 6, 8, 12, 1, 0, , , , 140, 125, 137, 300, false,"Dejaren",crew_portraits_cm_dejaren_sm.png,dejaren_crew
"Dr. 'Bones' McCoy",5,5, 0,0,0,0,0,0,0,0,0,0,0,0,0,0,0,1641,98,360,0,0,0,0,19,0,0,0,49,0,0,31,0,15,55,0,0,0,0,336,0,0,0,259,0,0,329,0,199,349,790,959,"Federation, Starfleet, Human, Physician, Resourceful, Exobiology","male, organic, tos, lieutenant_commander, mccoy, crew_max_rarity_5","I'm A Doctor!",2, 8, 6, 10, 14, 3, 0, 3, , , 700, 325, 291, 325, false,"McCoy",crew_portraits_cm_mccoy_doctor_sm.png,mccoy_doctor_crew
"Arandis",9,4, 649,82,207,0,0,0,0,0,0,0,0,0,936,85,208,0,0,0,538,562,478,159,438,0,0,441,0,0,519,0,382,0,327,630,656,588,408,550,0,0,662,0,0,719,0,609,0,533,793,912,"Resourceful, Inspiring, Communicator, Civilian, Romantic, Risian","female, nonhuman, organic, ds9, arandis, crew_max_rarity_4","Risa Will Be Waiting",1, 5, 4, 8, 12, 3, 0, 3, , , 405, 50, 33, 440, true,"Arandis",crew_portraits_cm_arandis_sm.png,arandis_crew
"Captain Lucero",7,4, 661,108,235,858,172,324,0,0,0,0,0,0,352,80,162,0,0,0,60,548,447,396,405,395,292,182,240,0,828,0,751,0,651,90,581,497,403,465,358,253,169,234,0,784,0,675,0,587,499,555,"Human, Federation, Starfleet, Survivalist, Explorer, Resourceful","female, organic, dsc, lucero, crew_max_rarity_4","He's an Idiot",2, 8, 6, 8, 10, 5, 0, , , , 525, 200, 110, 390, false,"Lucero",crew_portraits_cm_lucero_captain_sm.png,dsc_lucero_captain_crew
"Admiral Maxwell Forrest",5,5, 1256,220,470,0,0,0,0,0,0,430,102,236,1002,151,312,0,0,0,119,243,29,9,45,0,474,318,0,604,405,0,47,394,242,167,278,23,56,114,0,360,446,0,492,514,0,80,307,352,93,172,"Human, Diplomat, Starfleet, Ambassador","male, organic, ent, forrest, admiral, crew_max_rarity_5","It's Time to Swim",1, 7, 8, 8, 14, 2, 0, , , , 405, 320, 100, 425, false,"Forrest",crew_portraits_cm_forrest_admiral_sm.png,forrest_admiral_crew
"Belle Q",8,5, 982,98,243,452,75,166,0,0,0,0,0,0,1286,210,438,0,0,0,99,431,312,24,269,720,488,67,452,0,234,0,92,0,113,276,583,500,126,467,699,464,102,427,0,326,0,168,0,195,215,417,"Q Continuum, Costumed, Romantic, Resourceful, Crafty","female, organic, tng, nonhuman, miss_q, crew_max_rarity_5","They're Using Our Weapons",0, 9, 8, 8, 10, , , , , , 400, 320, 211, 390, false,"Q",crew_portraits_cm_miss_q_civil_war_sm.png,miss_q_civil_war_crew
"Mycelial Culber",2,5, 449,93,303,869,198,423,0,0,0,0,0,0,0,0,0,1291,237,550,81,660,598,692,5,332,254,365,3,0,0,42,0,25,87,37,535,414,574,7,225,171,261,7,0,0,87,0,37,109,21,48,"Human, Physician, Romantic, Federation, Starfleet, Desperate","male, organic, dsc, culber, crew_max_rarity_5","You Have to Let Me Go",0, 9, 6, 6, 6, , , , 1, 3, 400, 200, 148, 500, false,"Culber",crew_portraits_cm_culber_mycelial_sm.png,dsc_culber_mycelial_crew
"Commander Shelby",10,4, 855,128,259,0,0,0,643,80,169,0,0,0,0,0,0,0,0,0,422,175,361,528,316,536,0,0,0,476,649,436,0,0,0,499,316,425,584,410,678,0,0,0,585,766,576,0,0,0,808,884,"Gambler, Starfleet, Federation, Human, Tactician, Desperate","female, organic, tng, shelby, crew_max_rarity_4","Impossible!",1, 7, 8, 10, 8, , , , , , 475, 200, 153, 325, false,"Shelby",crew_portraits_cm_shelby_commander_sm.png,shelby_commander_crew
"Tourist Worf",3,3, 533,62,160,0,0,0,386,56,160,0,0,0,0,0,0,0,0,0,656,444,601,694,560,753,0,0,0,645,810,616,0,0,0,742,491,685,762,641,726,0,0,0,630,808,614,0,0,0,936,969,"Federation, Starfleet, Klingon, Saboteur, Romantic","male, nonhuman, organic, ds9, bridge_crew, worf, crew_max_rarity_3","I Didn't Bring A Bathing Suit",1, 4, 10, 8, 10, 1, 2, , , , 25, 100, 173, 90, false,"Worf",crew_portraits_cm_worf_tourist_sm.png,worf_tourist_crew
"Control Leland",3,5, 1254,233,394,0,0,0,1067,103,198,0,0,0,658,49,86,0,0,0,127,24,101,77,58,285,0,599,0,253,109,200,563,0,480,217,148,149,249,143,595,0,825,0,531,541,521,802,0,695,23,559,"Section 31, Undercover Operative, Crafty, Control, Brutal, Human","nonhuman, male, organic, dsc, leland, crew_max_rarity_5","Get Me That Data",0, 8, 6, 8, 10, , , , 2, 3, 265, 210, 153, 475, false,"Leland",crew_portraits_cm_leland_control_sm.png,dsc_leland_control_crew
"Leucon",2,5, 0,0,0,974,210,435,490,96,200,1268,295,448,0,0,0,0,0,0,249,675,84,0,0,49,1,293,164,36,736,535,74,31,0,212,645,105,0,0,57,6,241,149,29,699,528,108,50,0,12,88,"Civilian, Brunali, Botanist, Desperate, Jury Rigger, Geneticist","male, organic, voy, leucon, crew_max_rarity_5","You Can Make A Difference Here",1, 9, 8, 10, 12, , , , , , 445, 100, 140, 365, false,"Leucon",crew_portraits_cm_leucon_sm.png,leucon_crew
"Annika Hansen Seven",5,5, 565,38,88,1021,107,251,0,0,0,1303,161,317,0,0,0,0,0,0,80,678,33,710,579,304,18,347,196,146,0,0,145,60,0,384,802,186,857,741,521,88,569,324,337,0,0,344,190,0,177,671,"Human, Civilian, Federation, Astrophysicist, Romantic","female, organic, voy, bridge_crew, seven, crew_max_rarity_5","I'm Sure You'll Adapt",0, 9, 6, 6, 10, , , , , , 375, 200, 250, 400, false,"Seven",crew_portraits_cm_seven_annika_sm.png,seven_annika_crew
"Twilight T'Pol",4,5, 0,0,0,951,90,222,403,186,378,0,0,0,0,0,0,1034,240,792,399,639,0,0,76,66,291,426,22,533,702,13,0,53,134,609,379,0,0,25,79,383,630,11,241,411,4,0,12,49,198,26,"Vulcan, Astrophysicist, Telepath, Caregiver, Civilian","nonhuman, female, organic, ent, first_officer, bridge_crew, tpol, crew_max_rarity_5","Target Their Engines",2, 10, 12, 10, 10, , , , 0, 2, 225, 125, 120, 250, false,"T'Pol",crew_portraits_cm_tpol_twilight_sm.png,tpol_twilight_crew
"Picard and Number One",2,5, 527,79,177,1328,234,497,0,0,0,0,0,0,967,154,330,0,0,0,30,654,594,168,551,80,104,2,74,0,422,0,273,0,255,44,685,640,269,593,145,117,21,112,0,493,0,338,0,328,13,193,"Human, Astrophysicist, Inspiring, Civilian, Cultural Figure, Federation, Gardener, Veteran","male, organic, pic, admiral, bridge_crew, picard, crew_max_rarity_5","Old Dogs",1, 8, 6, 8, 10, 6, 0, , , , 300, 235, 130, 300, false,"Picard",crew_portraits_cm_picard_numberone_sm.png,picard_numberone_crew
"Doctor Paul Stubbs",9,4, 0,0,0,856,150,370,0,0,0,659,118,275,0,0,0,0,0,0,394,0,443,0,0,385,64,416,234,441,0,0,493,277,0,337,0,430,0,0,337,65,378,220,430,0,0,464,255,0,763,714,"Astrophysicist, Human, Federation, Innovator, Civilian","male, organic, tng, stubbs, crew_max_rarity_4","I Would Rather Die Than Leave",2, 8, 6, 8, 8, , , , 1, 2, 600, 170, 170, 225, false,"Stubbs",crew_portraits_cm_stubbs_sm.png,stubbs_crew
"Mission Specialist Lefler",7,4, 0,0,0,661,96,192,0,0,0,858,86,214,390,73,145,0,0,0,541,0,394,783,0,505,82,291,322,396,808,0,165,236,633,639,0,577,777,0,630,204,393,382,544,820,0,307,349,618,578,799,"Human, Federation, Starfleet, Romantic, Innovator, Resourceful, Tactician","female, organic, tng, lefler, crew_max_rarity_4","Always Watch Your Back",1, 6, 5, 8, 10, 3, 0, 3, , , 200, 50, 141, 325, false,"Lefler",crew_portraits_cm_lefler_robin_sm.png,lefler_robin_crew
"Mirror Burnham",2,4, 355,36,112,0,0,0,642,121,232,0,0,0,892,166,328,0,0,0,824,360,756,291,713,500,0,401,0,449,106,403,343,0,299,840,426,767,357,730,523,0,408,0,465,159,447,330,0,322,514,642,"Mirror Universe, Undercover Operative, Federation, Starfleet, Civilian, Astrophysicist, Xenoanthropology, Human","female, organic, dsc, burnham, crew_max_rarity_4","The Old Michael Burnham is Dead",0, 9, 6, 10, 10, , , , , , 495, 200, 145, 440, false,"Burnham",crew_portraits_cm_burnham_mirror_sm.png,dsc_burnham_mirror_crew
"Lt. Ilia",10,4, 664,106,231,864,156,339,0,0,0,0,0,0,0,0,0,0,0,0,59,547,446,592,404,391,289,423,237,0,0,0,0,0,0,91,592,508,636,476,362,254,401,236,0,0,0,0,0,0,772,768,"Deltan, Federation, Starfleet, Romantic","female, nonhuman, organic, tos, ilia, crew_max_rarity_4","Navigational Deflectors Online",1, 8, 8, 6, 8, , , , , , 475, 200, 191, 415, false,"Ilia",crew_portraits_cm_ilia_lt_sm.png,ilia_lt_crew
"Age of Sail Worf",3,5, 962,139,356,0,0,0,1334,161,358,0,0,0,503,87,189,0,0,0,287,16,240,170,207,115,0,659,0,120,58,72,631,0,538,364,107,293,241,279,321,0,675,0,289,191,258,632,0,550,76,335,"Klingon, Tactician, Federation, Starfleet, Costumed","ageofsail, nonhuman, male, organic, tng, bridge_crew, worf, crew_max_rarity_5","I am Prepared",1, 7, 8, 8, 10, 4, 1, , , , 380, 170, 200, 475, false,"Worf",crew_portraits_cm_worf_ageofsail_sm.png,worf_ageofsail_crew
"Arjin",8,4, 597,101,222,836,177,394,0,0,0,0,0,0,379,65,135,0,0,0,68,588,506,416,474,377,282,165,229,0,824,0,739,0,642,65,608,526,454,496,275,214,151,189,0,837,0,733,0,640,531,541,"Civilian, Pilot, Astrophysicist, Trill","male, organic, ds9, nonhuman, arjin, crew_max_rarity_4","It's... Interesting",2, 9, 8, 6, 8, , , 2, , , 350, 200, 125, 430, false,"Arjin",crew_portraits_cm_arjin_sm.png,arjin_crew
"Lt. Commander Icheb",4,5, 0,0,0,1272,207,433,471,101,151,980,141,310,0,0,0,0,0,0,128,704,271,0,0,31,8,171,87,68,773,571,276,151,0,216,689,358,0,0,73,29,243,153,140,760,573,378,214,0,163,302,"Civilian, Brunali, Borg, Astrophysicist, Prodigy, Innovator, Federation","male, organic, voy, icheb, crew_max_rarity_5","I Never Told",1, 10, 6, 10, 10, , , , , , 500, 150, 138, 415, false,"Icheb",crew_portraits_cm_icheb_lt_commander_sm.png,icheb_lt_commander_crew
"Tau",7,4, 0,0,0,342,72,156,894,130,308,0,0,0,651,109,220,0,0,0,803,458,0,607,0,143,538,301,491,336,114,283,509,0,439,740,494,0,648,0,185,475,334,443,375,206,350,543,0,486,520,641,"Crafty, Saboteur, Criminal, Scoundrel, Resourceful","male, organic, nonhuman, voy, tau, crew_max_rarity_4","I'd Hate to Make Your Life Difficult",0, 6, 8, 10, 10, 4, 1, , , , 315, 200, 90, 300, false,"Tau",crew_portraits_cm_tau_sm.png,tau_crew
"Age of Sail Troi",3,4, 353,76,161,0,0,0,0,0,0,0,0,0,596,150,298,776,208,426,775,744,710,401,62,0,0,549,238,0,627,292,506,193,49,714,703,665,305,47,0,0,465,152,0,533,162,382,88,39,507,319,"Human, Betazoid, Costumed, Empath, Counselor, Starfleet, Federation","ageofsail, nonhuman, female, organic, tng, troi, crew_max_rarity_4","Answer Him!",0, 9, 8, 6, 10, , , , , , 400, 230, 115, 450, false,"Troi",crew_portraits_cm_troi_ageofsail_sm.png,troi_ageofsail_crew
"North Star T'Pol",4,5, 1281,187,412,972,120,248,0,0,0,0,0,0,524,99,196,0,0,0,12,248,92,82,52,350,268,113,216,0,712,0,604,0,512,48,351,177,158,167,506,335,224,317,0,713,0,603,0,530,119,375,"Vulcan, Starfleet, Astrophysicist, Telepath, Costumed","nonhuman, female, organic, ent, first_officer, bridge_crew, tpol, crew_max_rarity_5","I've Confirmed They Are Human",1, 9, 4, 8, 8, , , , , , 465, 100, 90, 470, false,"T'Pol",crew_portraits_cm_tpol_north_star_sm.png,tpol_north_star_crew
"Riker Odan",4,5, 510,88,190,1290,189,408,0,0,0,0,0,0,998,92,252,0,0,0,32,658,597,192,555,126,140,20,89,0,459,0,312,0,275,76,663,600,374,562,246,196,91,175,0,650,0,526,0,474,133,428,"Human, Trill, Federation, Starfleet, Ambassador, Maverick, Gambler, Romantic","male, organic, tng, nonhuman, riker, crew_max_rarity_5","For the Greater Good",2, 10, 10, 8, 10, , , , , , 600, 115, 142, 350, false,"Riker",crew_portraits_cm_riker_odan_sm.png,riker_odan_crew
"Relaxed Number One",7,4, 339,52,129,673,73,166,0,0,0,0,0,0,914,136,356,0,0,0,291,779,755,274,712,514,367,85,325,0,467,0,319,0,283,461,764,727,319,687,705,467,175,429,0,489,0,332,0,323,521,715,"Federation, Starfleet, Human, Resourceful, Explorer, Musician, Casual","female, organic, dsc, bridge_crew, lieutenant, number_one, crew_max_rarity_4","I Am The Very Model Of A Modern Major General",0, 8, 8, 8, 10, , , , , , 450, 175, 150, 450, false,"Number One",crew_portraits_cm_number_one_relaxed_sm.png,dsc_number_one_relaxed_crew
"Claymore Scotty",5,5, 0,0,0,0,0,0,1006,106,234,1307,195,387,516,72,136,0,0,0,0,428,98,738,0,333,136,690,0,11,160,246,28,47,569,0,587,215,790,0,537,211,757,0,54,434,462,86,135,632,162,510,"Human, Starfleet, Federation, Jury Rigger, Duelist","male, organic, tos, scott, crew_max_rarity_5","This is War",0, 9, 8, 6, 8, , , , , , 375, 270, 275, 450, false,"Scotty",crew_portraits_cm_scotty_claymore_sm.png,scott_claymore_crew
"1701 Bashir",3,4, 0,0,0,364,57,135,595,123,240,0,0,0,0,0,0,814,174,316,797,582,0,0,313,268,535,784,113,470,642,32,0,204,334,790,568,0,0,292,284,509,771,131,450,628,62,0,182,317,576,585,"Human, Starfleet, Federation, Undercover Operative, Cyberneticist, Physician, Engineered","nonhuman, male, organic, ds9, bashir, crew_max_rarity_4","I'm a Doctor, Not a Historian",2, 8, 8, 6, 10, , , , , , 400, 100, 160, 475, false,"Bashir",crew_portraits_cm_bashir_1701_sm.png,bashir_1701_crew
"Seamus",10,4, 0,0,0,0,0,0,872,171,395,0,0,0,579,148,299,0,0,0,0,439,0,614,0,349,0,557,0,304,105,259,516,0,440,0,378,0,536,0,273,0,468,0,240,86,214,387,0,367,770,622,"Human, Hologram, Civilian, Romantic, Interrogator","organic, voy, male, seamus, artificial_life, crew_max_rarity_4","Saints Preserve Us",1, 7, 6, 6, 6, , , , 0, 2, 315, 165, 147, 450, false,"Seamus",crew_portraits_cm_seamus_sm.png,seamus_crew
"Mirror Keyla Detmer",7,5, 1029,154,348,0,0,0,1308,222,451,0,0,0,0,0,0,0,0,0,243,4,196,399,162,91,0,0,0,95,207,51,0,0,0,358,61,284,466,270,169,0,0,0,147,276,130,0,0,0,390,456,"Mirror Universe, Human, Terran Empire, Brutal","female, organic, dsc, detmer, crew_max_rarity_5","Terran Law Is Binding",0, 8, 8, 6, 12, 1, 0, 2, , , 400, 240, 105, 525, false,"Detmer",crew_portraits_cm_detmer_mirror_sm.png,dsc_detmer_mirror_crew
"Tee Time Doctor",2,4, 0,0,0,0,0,0,344,74,158,0,0,0,920,186,387,658,67,176,0,758,0,444,451,784,0,342,326,674,202,176,275,296,44,0,714,0,421,612,711,0,314,423,611,187,306,249,389,99,491,589,"Hologram, Federation, Musician, Starfleet, Costumed, Athlete, Physician, Human","nonhuman, male, artificial_life, voy, emh, crew_max_rarity_4","The Back Nine at Gedi Prime?",2, 9, 6, 10, 10, , , , , , 500, 200, 40, 305, false,"Doctor",crew_portraits_cm_emh_caddy_sm.png,emh_caddy_crew
"Logician Solok",8,4, 903,88,202,646,87,180,0,0,0,0,0,0,0,0,0,0,0,0,78,486,362,529,317,526,375,561,333,0,0,0,0,0,0,291,653,583,680,545,657,428,681,397,0,0,0,0,0,0,806,921,"Vulcan, Starfleet, Athlete, Costumed, Federation, Telepath","male, organic, ds9, solok, crew_max_rarity_4","I Fail to See Why You Are Celebrating",1, 9, 10, 10, 10, , , , , , 430, 215, 77, 440, false,"Solok",crew_portraits_cm_solok_logician_sm.png,solok_logician_crew
