"Groom Worf",0,4, 0,0,0,0,0,0,650,84,139,0,0,0,942,97,151,0,0,0,0,1131,0,1072,0,1024,0,916,0,958,293,818,879,0,710,0,1368,0,1427,0,1332,0,1297,0,1215,953,1082,1303,0,1100,1600,1754,"Klingon, Romantic, Federation, Starfleet, Festive","nonhuman, male, organic, worf, ds9, crew_max_rarity_4","How Comforting",0, 9, 8, 5, 8, , , , , , 375, 135, 216, 415, false,"Worf",crew_portraits_cm_worf_groom_sm.png,worf_groom_crew, 49.0082, 14.4444, 14.5518, 35.2653, 2, 0, 1, 0
"Dr. Edward La Forge",0,5, 481,80,181,1279,214,439,0,0,0,0,0,0,0,0,0,994,150,319,108,1325,1290,1442,62,340,289,454,18,0,0,432,0,306,553,115,1271,1235,1386,164,355,296,474,35,0,0,570,0,363,617,573,481,"Human, Starfleet, Federation, Exobiology","male, organic, tng, elaforge, crew_max_rarity_5","She's Gone",1, 10, 8, 8, 10, , , , , , 495, 200, 125, 425, false,"E. La Forge",crew_portraits_cm_elaforge_sm.png,elaforge_crew, 84.0713, 7.5556, 18.4955, 77.7793, 1, 0, 0, 0
"Nepenthe Troi",0,5, 473,72,228,0,0,0,0,0,0,0,0,0,1008,99,230,1106,310,572,1326,1317,1271,450,30,0,0,813,232,0,1002,262,758,140,32,1170,1197,1133,684,11,0,0,1131,98,0,1293,104,1096,33,32,708,243,"Human, Starfleet, Federation, Civilian, Caregiver, Inspiring, Empath, Counselor, Betazoid","female, organic, nonhuman, pic, troi, crew_max_rarity_5","We'll Find A Way Forward",2, 7, 6, 5, 10, 7, 2, , , , 400, 70, 15, 325, false,"Troi",crew_portraits_cm_troi_nepenthe_sm.png,troi_nepenthe_crew, 79.4029, 31.5556, 17.9254, 79.5014, 4, 0, 0, 41.645
"Edward Larkin",0,4, 0,0,0,866,152,339,0,0,0,0,0,0,158,6,12,644,127,300,866,0,0,1652,775,813,630,703,83,0,1666,746,1575,537,748,749,0,0,1655,720,684,489,733,83,0,1668,700,1577,489,726,1482,1461,"Human, Starfleet, Federation, Geneticist, Exobiology, Maverick, Tribbled, Crafty","male, organic, dsc, larkin, crew_max_rarity_4","I'm Not The Dumb One!",1, 6, 8, 8, 12, 4, 4, , , , 280, 200, 65, 450, false,"Larkin",crew_portraits_cm_larkin_sm.png,dsc_larkin_crew, 50.9717, 26.8889, 15.5589, 45.0403, 4, 0, 0, 0
"Technician Fisher",0,5, 500,75,163,1271,212,416,0,0,0,1002,121,277,0,0,0,0,0,0,111,1319,219,1430,1131,364,30,478,208,635,0,0,731,333,0,151,1325,379,1440,1159,406,62,514,252,843,0,0,946,518,0,634,834,"Geologist, Starfleet, Federation, Resourceful, Explorer, Human","male, organic, tos, fisher, crew_max_rarity_5","Rock Solid",1, 8, 10, 10, 10, 5, 0, , , , 485, 265, 135, 400, false,"Fisher",crew_portraits_cm_fisher_technician_sm.png,fisher_technician_crew, 84.452, 29.7778, 68.2996, 79.619, 2, 0, 0, 0
"Fisticuffs Sisko",0,5, 982,108,303,0,0,0,1304,162,375,0,0,0,499,61,133,0,0,0,748,119,699,464,532,361,0,1320,0,382,168,239,1335,0,1126,931,251,868,728,728,576,0,1423,0,579,398,437,1438,0,1224,667,1015,"Human, Federation, Starfleet, Bajoran, Duelist, Brutal, Athlete","male, organic, ds9, sisko, crew_max_rarity_5","I Am Not Picard",2, 8, 8, 6, 12, 1, 0, , , , 475, 145, 100, 400, false,"Sisko",crew_portraits_cm_sisko_fisticuffs_sm.png,sisko_fisticuffs_crew, 85.2735, 20, 64.7073, 75.3244, 3, 0, 0, 0
"Nanoprobe Phlox",0,5, 0,0,0,411,157,377,0,0,0,1314,120,260,0,0,0,982,126,405,1245,0,414,0,457,1185,101,1205,94,421,0,417,463,5,533,644,0,936,0,449,591,109,695,45,879,0,452,972,29,507,600,351,"Denobulan, Civilian, Physician, Romantic, Exobiology, Borg, Compromised","male, organic, nonhuman, ent, phlox, exclusive_honorhall, crew_max_rarity_5","A Cure of Sorts",2, 10, 15, 8, 5, 4, 0, , , , 200, 245, 137, 100, false,"Phlox",crew_portraits_cm_phlox_nanoprobe_sm.png,phlox_nanoprobe_crew, 82.6287, 35.7778, 57.4787, 81.6646, 5, 0, 0, 0
"EV Suit T'Pol",0,5, 1257,242,442,514,54,154,1032,84,137,0,0,0,0,0,0,0,0,0,106,127,357,630,206,162,1027,1297,804,709,1041,567,0,0,0,120,281,312,573,193,859,1119,1392,878,1221,1524,1087,0,0,0,675,1047,"Vulcan, Starfleet, Astrophysicist, Telepath, High Command","nonhuman, female, organic, evsuit, ent, tpol, crew_max_rarity_5","You Can't Deny Your Nature",0, 9, 6, 6, 10, , , , , , 500, 225, 120, 250, false,"T'Pol",crew_portraits_cm_tpol_ev_suit_sm.png,tpol_ev_suit_crew, 85.574, 21.3333, 19.1312, 75.5123, 3, 0, 0, 39.4965
"Marine Q",0,5, 1011,104,227,0,0,0,559,66,133,0,0,0,1272,216,422,0,0,0,764,373,716,110,549,1191,0,449,0,1110,138,953,381,0,295,1102,766,1051,231,904,1427,0,487,0,1272,285,1142,413,0,311,565,985,"Crafty, Costumed, Brutal, Q Continuum, Cosmic","nonhuman, male, tng, q_jdl, crew_max_rarity_5","All It Takes Are A Few Good Men!",0, 10, 8, 8, 10, , , , , , 490, 110, 205, 450, false,"Q",crew_portraits_cm_q_marine_sm.png,q_marine_crew, 87.1769, 34.2222, 20.2657, 76.8911, 4, 0, 0, 0
"Restless Trip Tucker",0,3, 0,0,0,0,0,0,0,0,0,342,36,108,487,73,177,0,0,0,0,0,1455,1437,0,0,1213,1298,0,1325,1462,0,911,961,1105,0,0,1463,1425,0,0,1208,1294,0,1324,1464,0,960,968,1097,1762,1794,"Human, Starfleet, Romantic, Resourceful, Jury Rigger","male, organic, ent, tucker, crew_max_rarity_3","Reluctant Patient",1, 6, 6, 8, 14, , , , 0, 1, 185, 20, 55, 325, false,"Trip",crew_portraits_cm_tucker_offduty_sm.png,tucker_offduty_crew, 25.4458, 42.8889, 9.5166, 30.5006, 4, 0, 0, 0
"EV Suit Phlox",0,4, 347,62,170,918,94,206,0,0,0,0,0,0,0,0,0,705,76,259,429,1430,1401,1557,374,845,649,928,89,0,0,732,0,524,809,639,1340,1322,1453,404,1127,852,1197,246,0,0,853,0,615,917,1246,1516,"Denobulan, Civilian, Physician, Exobiology, Resourceful","male, evsuit, organic, nonhuman, ent, phlox, crew_max_rarity_4","Try Not To Sneeze",1, 8, 8, 4, 12, , , , , , 500, 230, 87, 250, false,"Phlox",crew_portraits_cm_phlox_ev_suit_sm.png,phlox_ev_suit_crew, 60.1282, 53.7778, 13.5284, 56.9085, 5, 0, 0, 0
"Humanoid Figure",0,5, 984,95,285,526,64,128,0,0,0,0,0,0,1273,206,415,0,0,0,222,881,726,114,555,1277,1021,164,800,0,576,0,389,0,301,581,1037,929,211,781,1449,1159,257,921,0,611,0,451,0,340,645,960,"Hologram, Temporal Agent, Villain, Tactician, Geneticist, Cosmic","male, ent, humanoid_figure, crew_max_rarity_5","You Have No Choice",0, 7, 6, 6, 10, 4, 2, , , , 465, 200, 90, 300, false,"Figure",crew_portraits_cm_humanoid_figure_sm.png,humanoid_figure_crew, 85.2735, 16.6667, 21.2871, 74.5925, 3, 0, 0, 41.5799
"Alicia Travers",0,5, 0,0,0,0,0,0,514,91,195,0,0,0,1008,121,240,1199,220,496,0,1273,0,963,239,1197,0,787,224,1114,287,38,733,136,31,0,1236,0,1197,177,1166,0,1054,183,1077,538,51,1019,91,57,610,531,"Human, Saboteur, Resourceful, Caregiver, Civilian","female, organic, ent, travers, crew_max_rarity_5","I'm Not Leaving",1, 10, 6, 6, 10, , , , , , 550, 70, 135, 400, false,"Travers",crew_portraits_cm_travers_sm.png,travers_crew, 83.5905, 48.2222, 16.3803, 79.8724, 4, 0, 0, 0
"B.G. Robinson",0,4, 0,0,0,873,148,345,0,0,0,600,105,261,355,68,164,0,0,0,856,0,1030,1537,0,804,155,468,465,943,1571,0,648,603,1235,745,0,958,1463,0,681,137,353,412,899,1506,0,495,553,1134,1287,1120,"Human, Starfleet, Federation, Romantic, Casual, Playful","organic, female, tng, robinson_bg, crew_max_rarity_4","Hello There",2, 9, 10, 8, 12, , , , , , 375, 70, 100, 450, false,"Robinson",crew_portraits_cm_robinson_bg_sm.png,robinson_bg_crew, 55.8205, 13.7778, 11.377, 44.9977, 2, 0, 0, 0
"Jhamel",0,5, 0,0,0,0,0,0,0,0,0,0,0,0,1276,220,454,1004,116,306,0,0,0,617,486,0,0,427,387,0,538,446,358,315,24,0,0,0,608,727,0,0,434,528,0,497,706,353,496,51,929,1116,"Andorian, Aenar, Telepath, Communicator, Desperate, Civilian, Inspiring, Romantic","nonhuman, female, organic, ent, jhamel, crew_max_rarity_5","I Won't Abandon My Brother",1, 10, 6, 8, 10, , , , , , 1345, 200, 175, 330, false,"Jhamel",crew_portraits_cm_jhamel_sm.png,jhamel_crew, 70.1463, 44.2222, 7.672, 65.9217, 4, 0, 0, 18.4028
"Brigitte Torres",0,4, 297,78,178,0,0,0,634,106,223,0,0,0,949,137,284,0,0,0,1525,803,1450,638,1315,986,0,833,0,926,238,782,783,0,643,1295,704,1260,597,1112,1035,0,970,0,977,381,858,912,0,777,1260,1339,"Human, Costumed, Undercover Operative, Caregiver, Romantic, Civilian, Klingon","nonhuman, female, organic, voy, torres, crew_max_rarity_4","Here's to English Precision",1, 7, 8, 6, 10, , , , , , 465, 50, 118, 350, false,"Torres",crew_portraits_cm_torres_brigitte_sm.png,torres_brigitte_crew, 57.7439, 41.7778, 13.9433, 54.3741, 5, 0, 0, 0
"Lieutenant Georgiou",0,4, 665,81,208,397,48,132,0,0,0,0,0,0,909,50,120,0,0,0,622,1094,998,436,841,1429,1115,536,895,0,1159,0,934,0,762,785,1228,1169,993,1016,1467,1176,1094,938,0,1604,0,1468,0,1254,1349,1683,"Human, Federation, Starfleet, Inspiring, Diplomat","female, organic, dsc, georgiou, crew_max_rarity_4","You Caused Quite a Stir",2, 8, 8, 8, 12, , , , , , 300, 55, 40, 250, false,"Georgiou",crew_portraits_cm_georgiou_lt_sm.png,dsc_georgiou_lt_crew, 60.3887, 29.3333, 12.6003, 45.0821, 3, 0, 0, 0
"Ransom Shran",0,4, 624,63,166,0,0,0,387,74,161,0,0,0,905,108,247,0,0,0,1122,786,1070,423,916,1381,0,902,0,1233,573,1098,867,0,697,1376,872,1326,793,1180,1305,0,1077,0,1186,735,1058,1040,0,873,1313,1561,"Andorian, Tactician, Caregiver, Desperate","nonhuman, male, organic, ent, shran, crew_max_rarity_4","You Have To Help Me",0, 7, 10, 8, 10, 4, 2, , , , 500, 175, 210, 475, false,"Shran",crew_portraits_cm_shran_ransom_sm.png,shran_ransom_crew, 58.7858, 18.6667, 19.1453, 44.3388, 3, 0, 0, 0
"Captain Erika Hernandez",0,5, 1204,194,419,0,0,0,0,0,0,993,129,294,0,0,0,0,0,0,438,637,32,702,272,0,520,0,0,627,0,0,723,329,0,457,628,54,701,285,0,641,0,0,815,0,0,896,487,0,962,1211,"Starfleet, Human, Resourceful, Romantic, Athlete","female, organic, ent, captain, hernandez, crew_max_rarity_5","Able To Hang In A Firefight A Little Longer",2, 9, 8, 6, 14, 8, 4, , , , 395, 200, 70, 550, false,"Hernandez",crew_portraits_cm_hernandez_captain_sm.png,hernandez_captain_crew, 66.9004, 36.6667, 20.013, 62.7697, 3, 0, 0, 0
"Prisoner Kim",0,5, 0,0,0,0,0,0,1002,157,336,1261,231,469,0,0,0,556,98,196,0,781,341,0,953,611,286,0,653,37,881,60,373,12,941,0,827,299,0,1017,659,239,0,695,26,912,145,313,21,1009,407,253,"Federation, Human, Starfleet, Prisoner, Desperate, Survivalist, Caregiver","male, organic, voy, kim, crew_max_rarity_5","He's Dead!",0, 9, 6, 6, 8, , , , , , 530, 150, 250, 350, false,"Kim",crew_portraits_cm_kim_prisoner_sm.png,kim_prisoner_crew, 86.1751, 26, 19.0131, 84.9466, 3, 0, 0, 21.3976
"Reclamation Narissa",0,4, 854,125,297,0,0,0,683,50,111,0,0,0,320,68,172,0,0,0,897,379,836,704,662,1020,0,1463,0,955,952,814,1486,0,1269,917,705,846,614,711,1494,0,1315,0,1314,1176,1185,1323,0,1118,1372,1552,"Zhat Vash, Tal Shiar, Romulan, Brutal, Villain, Crafty, Duelist, Vengeful","pic, nonhuman, organic, narissa, female, crew_max_rarity_4","Something Far Worse Is Coming",0, 7, 10, 8, 12, 1, 2, , , , 550, 175, 180, 325, false,"Narissa",crew_portraits_cm_narissa_reclamation_crew_sm.png,narissa_reclamation_crew, 56.8223, 17.3333, 19.1797, 45.6652, 3, 0, 0, 42.0356
"U.S.S. Zheng He Riker",0,5, 1276,199,453,0,0,0,967,183,357,0,0,0,518,90,174,0,0,0,362,87,350,231,197,618,0,1222,0,592,269,426,1241,0,1028,380,91,353,269,217,573,0,1253,0,576,328,434,1258,0,1058,478,282,"Human, Federation, Starfleet, Pilot, Maverick, Gambler","male, organic, pic, riker, crew_max_rarity_5","I Learned From The Best",2, 10, 6, 6, 8, , , , 1, 2, 500, 300, 195, 300, false,"Riker",crew_portraits_cm_riker_zhenghe_sm.png,riker_zhenghe_crew, 84.5121, 18.4444, 14.6344, 76.7901, 2, 0, 0, 41.4931
"Nona",0,5, 521,62,166,0,0,0,0,0,0,0,0,0,964,118,209,1252,172,436,1298,1301,1246,476,28,0,0,864,220,0,1054,259,823,135,35,1382,1348,1329,834,92,0,0,1135,270,0,1302,327,1106,190,107,722,998,"Caregiver, Botanist, Spiritual, Neural, Crafty, Civilian, Desperate","nonhuman, organic, female, tos, nona, crew_max_rarity_5","Don't Touch Me!",1, 10, 8, 5, 8, , , , , , 305, 185, 140, 490, false,"Nona",crew_portraits_cm_nona_sm.png,nona_crew, 84.0112, 11.7778, 16.5098, 75.0359, 2, 0, 0, 21.1372
"Camp Nurse Janeway",0,4, 356,59,137,0,0,0,0,0,0,0,0,0,589,118,255,824,162,350,1489,1438,1413,929,269,0,0,1077,489,0,1279,631,1068,440,124,1468,1419,1398,816,182,0,0,1038,375,0,1213,477,997,293,128,1342,1133,"Human, Starfleet, Federation, Resourceful, Costumed, Nurse, Civilian","female, organic, voy, janeway, crew_max_rarity_4","You're Bleeding!",2, 5, 14, 10, 16, 2, 0, , , , 500, 270, 125, 250, false,"Janeway",crew_portraits_cm_janeway_civil_war_sm.png,janeway_civil_war_crew, 54.2777, 44, 68.3238, 60.3637, 3, 0, 0, 0
"Kivas Fajo",0,4, 0,0,0,619,77,170,850,139,294,0,0,0,360,66,124,0,0,0,1119,969,0,1560,0,151,796,792,625,791,642,638,1456,0,1246,1344,973,0,1546,0,304,1009,946,788,801,600,689,1443,0,1230,1377,1515,"Crafty, Scoundrel, Zibelian, Brutal, Criminal, Thief, Civilian, Explorer, Merchant, Saboteur","nonhuman, male, organic, tng, kivas, crew_max_rarity_4","Accept Your Fate",2, 8, 8, 8, 10, , , , , , 433, 135, 93, 417, false,"Kivas",crew_portraits_cm_fajo_kivas_sm.png,fajo_kivas_crew, 56.0208, 31.7778, 12.4045, 50.7729, 5, 0, 0, 37.3915
"Emory Erickson",0,5, 0,0,0,1025,194,451,0,0,0,1144,232,484,474,80,166,0,0,0,560,0,420,1446,0,512,27,253,298,429,1474,0,115,159,1129,427,0,278,1432,0,380,11,197,229,293,1471,0,97,82,1105,577,184,"Human, Civilian, Caregiver, Innovator, Desperate","male, organic, ent, erickson, crew_max_rarity_5","You'll Be Able To Leave The Lights On",0, 8, 6, 10, 10, 4, 0, , , , 300, 50, 130, 450, true,"Emory",crew_portraits_cm_emory_erickson_sm.png,emory_erickson_crew, 80.6852, 23.3333, 75.4846, 80.9641, 3, 0, 0, 0
"Ambassador V'Lar",0,5, 997,138,268,0,0,0,0,0,0,0,0,0,1269,234,439,0,0,0,731,829,684,99,520,0,0,435,0,0,551,0,366,0,284,938,994,879,135,741,0,0,435,0,0,498,0,354,0,263,932,1128,"Vulcan, Ambassador, Diplomat, Telepath, Investigator, High Command","female, nonhuman, organic, ent, vlar, crew_max_rarity_5","We've Kept Many Things From Them",2, 8, 6, 8, 12, 5, 0, , , , 390, 195, 153, 475, false,"V'lar",crew_portraits_cm_vlar_ambassador_sm.png,vlar_ambassador_crew, 69.5051, 24, 57.3161, 62.2853, 3, 0, 0, 57.7474
"Altan Inigo Soong",0,4, 484,179,392,993,122,283,0,0,0,409,91,199,0,0,0,0,0,0,171,1134,545,1255,896,697,191,802,410,1206,0,0,1373,865,0,87,715,135,805,395,886,247,995,539,1068,0,0,1192,722,0,1124,819,"Human, Civilian, Cyberneticist, Innovator, Federation, Caregiver","male, organic, pic, altan, crew_max_rarity_4","I Suppose That's What Mothers Do",1, 6, 6, 6, 12, 6, 0, , , , 250, 315, 213, 125, false,"Altan",crew_portraits_cm_altan_sm.png,altan_crew, 57.4434, 16.4444, 54.7941, 57.3587, 2, 0, 0, 42.4045
"Dr. Roger Korby",0,5, 493,84,162,1271,230,424,0,0,0,0,0,0,0,0,0,957,181,393,109,1322,1284,1438,61,346,294,461,16,0,0,421,0,297,540,124,1307,1284,1423,103,354,294,470,19,0,0,391,0,238,453,552,281,"Android, Exoarchaeology, Physician, Starfleet, Federation, Undercover Operative","male, nonhuman, artificial_life, tos, korby, crew_max_rarity_5","Now, Strike Him!",0, 10, 8, 6, 8, , , , , , 465, 200, 177, 225, false,"Korby",crew_portraits_cm_korby_roger_sm.png,korby_roger_crew, 83.0495, 19.3333, 19.8137, 80.3707, 3, 0, 0, 20.7465
"Breen Disguise Kira",0,5, 581,106,206,0,0,0,1221,287,685,0,0,0,1064,61,164,0,0,0,1124,178,1074,373,919,179,0,799,0,245,28,83,746,0,618,1140,66,1091,851,947,91,0,1345,0,101,61,63,1372,0,1156,322,239,"Bajoran, Breen, Starfleet, Saboteur, Undercover Operative, Resourceful, Veteran","nonhuman, female, organic, evsuit, ds9, kira, crew_max_rarity_5","Make the Right Choice",1, 7, 8, 4, 10, 1, 1, , , , 450, 100, 40, 400, false,"Kira",crew_portraits_cm_kira_breen_sm.png,kira_breen_crew, 87.9583, 61.3333, 33.1358, 87.0937, 6, 0, 0, 0
"Awaiting Amanda Grayson",0,5, 446,119,259,0,0,0,0,0,0,0,0,0,1286,205,416,859,205,430,1309,1307,1254,237,69,0,0,441,427,0,562,553,374,361,27,989,1042,937,212,42,0,0,515,238,0,612,266,452,145,23,614,171,"Human, Federation, Caregiver, Civilian, Communicator, Desperate","female, amanda_grayson, organic, tos, crew_max_rarity_5","Your Duty Is To Your Father",2, 10, 8, 6, 8, , , , , , 400, 125, 150, 525, false,"Amanda",crew_portraits_cm_amanda_grayson_awaiting_sm.png,amanda_grayson_awaiting_crew, 79.5832, 29.7778, 14.3313, 81.1835, 2, 0, 0, 0
"Em/3/Green",0,4, 0,0,0,648,45,157,396,67,153,868,108,262,0,0,0,0,0,0,1111,1371,843,0,0,607,177,1102,623,395,1526,1094,901,454,0,1469,1378,950,0,0,864,399,1408,898,489,1526,1094,992,546,0,1345,1587,"Nasat, Crafty, Federation, Desperate, Resourceful, Jury Rigger","em_three, male, organic, nonhuman, tas, crew_max_rarity_4","I Am Not Afraid, Just Very Tired",1, 6, 8, 10, 20, 2, 0, , , , 325, 200, 163, 225, false,"Em",crew_portraits_cm_em_sm.png,em_three_green_crew, 58.3049, 39.3333, 65.6366, 56.2155, 3, 0, 0, 0
"EV Suit Spock",0,5, 0,0,0,1270,178,365,613,37,101,843,221,514,0,0,0,0,0,0,422,1228,682,0,0,72,37,517,234,191,1371,914,726,331,0,633,1478,254,0,0,313,16,683,355,158,1629,1198,272,74,0,594,402,"Vulcan, Human, Telepath, Spiritual, Starfleet, Federation, Explorer, Crafty, Thief, Exobiology","evsuit, nonhuman, male, organic, tos, spock, crew_max_rarity_5","Facilitate A Better View",2, 9, 8, 8, 12, 0, 1, , , , 500, 125, 100, 150, false,"Spock",crew_portraits_cm_spock_evsuit_sm.png,spock_evsuit_crew, 83.1296, 32.4444, 30.2945, 83.5029, 5, 0, 0, 39.5399
"Dignitary Sarek",0,4, 0,0,0,649,84,173,0,0,0,0,0,0,918,146,257,378,55,121,1088,0,0,1040,1264,1013,779,267,372,0,1062,1143,834,907,300,1312,0,0,1129,1293,1250,974,460,520,0,1173,1167,947,951,450,1283,1550,"Vulcan, Diplomat, Cultural Figure, Communicator, Federation, Telepath, Ambassador","nonhuman, male, organic, sarek, tos, crew_max_rarity_4","Threats Are Illogical",1, 8, 6, 6, 8, , , , , , 455, 145, 195, 415, false,"Sarek",crew_portraits_cm_sarek_dignitary_sm.png,sarek_dignitary_crew, 59.6674, 51.5556, 8.6503, 55.137, 4, 0, 0, 38.303
"Captain Solok",0,5, 1004,95,266,1283,199,400,475,88,162,0,0,0,0,0,0,0,0,0,35,410,703,980,535,81,302,480,209,1183,1473,1037,0,0,0,96,640,964,1185,820,166,379,585,302,1148,1456,1025,0,0,0,681,931,"Vulcan, Starfleet, Writer, Federation, Telepath","male, nonhuman, organic, ds9, solok, crew_max_rarity_5","Your Welcome Is Acknowledged",1, 6, 10, 10, 14, 2, 0, , , , 400, 170, 155, 365, false,"Solok",crew_portraits_cm_solok_captain_sm.png,solok_captain_crew, 84.2116, 11.1111, 86.859, 78.558, 2, 0, 0, 18.4028
"D'Nesh",0,5, 0,0,0,0,0,0,0,0,0,1022,140,310,1247,222,505,0,0,0,0,0,625,620,0,0,494,433,0,584,543,0,45,294,280,0,0,800,525,0,0,575,350,0,752,404,0,25,429,216,925,977,"Romantic, Scoundrel, Orion, Casual, Civilian, Crafty, Saboteur","female, nonhuman, organic, ent, dnesh, crew_max_rarity_5","I Thought You Were Different",1, 7, 6, 8, 8, , , , , , 350, 165, 135, 465, true,"D'Nesh",crew_portraits_cm_dnesh_sm.png,dnesh_crew, 69.5853, 26.8889, 12.6951, 65.1608, 4, 0, 0, 17.73
"T'Pring",0,5, 0,0,0,0,0,0,1071,74,157,0,0,0,1292,172,285,0,0,0,0,836,0,686,0,680,0,516,0,643,56,488,443,0,356,0,1349,0,1039,0,1320,0,872,0,1197,476,1067,811,0,673,958,1659,"Vulcan, Telepath, Romantic, Brutal, Civilian","tos, organic, nonhuman, tpring, female, crew_max_rarity_5","Flawlessly Logical",2, 9, 8, 5, 8, , , , , , 390, 200, 213, 650, false,"T'Pring",crew_portraits_cm_tpring_sm.png,tpring_crew, 72.7109, 15.7778, 12.9176, 58.8793, 2, 0, 0, 18.4028
"Boreth Pike",0,4, 873,86,227,385,55,133,0,0,0,0,0,0,591,97,199,0,0,0,439,990,854,475,681,1444,1127,751,901,0,1307,0,1099,0,912,715,1165,1087,724,943,1455,1163,788,926,0,1369,0,1187,0,1004,1395,1582,"Starfleet, Human, Federation, Inspiring, Explorer, Tactician, Desperate, Diplomat","male, organic, dsc, pike, crew_max_rarity_4","I'm Not Leaving Here",0, 9, 8, 8, 10, , , , 1, 2, 450, 200, 175, 375, false,"Pike",crew_portraits_cm_pike_boreth_sm.png,dsc_pike_boreth_crew, 56.5418, 34.8889, 17.1777, 49.9531, 4, 0, 0, 0
"Mok'bara Crusher",0,5, 0,0,0,0,0,0,475,88,191,0,0,0,1253,205,458,1079,150,373,0,1323,0,637,370,1283,0,457,292,1168,157,59,390,214,14,0,1248,0,627,464,1181,0,452,364,1089,199,136,369,284,36,420,292,"Human, Starfleet, Federation, Caregiver, Physician, Counselor, Athlete","female, organic, tng, crusher, crew_max_rarity_5","And Then What Happened?",2, 7, 10, 8, 12, 2, 0, , , , 550, 170, 65, 100, false,"Crusher",crew_portraits_cm_crusher_mok_bara_sm.png,crusher_mok_bara_crew, 86.3154, 23.3333, 84.73, 84.8175, 3, 0, 0, 19.9436
"Leila Kalomi",0,5, 0,0,0,1273,210,375,0,0,0,0,0,0,982,164,354,451,98,210,403,0,0,910,1152,385,310,66,58,0,887,1030,656,839,125,579,0,0,876,973,515,394,70,95,0,848,909,651,671,156,617,439,"Human, Civilian, Botanist, Romantic, Desperate, Crafty, Compromised","female, organic, tos, leila_kalomi, crew_max_rarity_5","You Can Belong Again",1, 7, 6, 8, 12, 4, 1, , , , 495, 170, 133, 325, false,"Leila",crew_portraits_cm_leila_kalomi_sm.png,leila_kalomi_crew, 82.8892, 9.7778, 28.5721, 78.4423, 2, 0, 0, 0
"EV Suit McCoy",0,4, 364,45,111,614,49,130,0,0,0,0,0,0,0,0,0,815,137,301,822,1448,1430,1570,282,1105,835,1141,120,0,0,664,0,464,739,1107,1466,1444,1578,370,1468,1177,1450,259,0,0,683,0,473,744,1458,1602,"Human, Federation, Starfleet, Desperate, Exobiology, Resourceful, Physician","evsuit, male, organic, tos, mccoy, crew_max_rarity_4","He Was A Hero",1, 8, 8, 8, 10, , , , , , 440, 160, 204, 500, false,"McCoy",crew_portraits_cm_mccoy_evsuit_sm.png,mccoy_evsuit_crew, 54.7586, 46.8889, 14.6444, 52.3098, 4, 0, 0, 0
"Fair Haven Harry Kim",0,4, 0,0,0,696,101,222,0,0,0,0,0,0,881,180,354,0,0,0,1012,0,0,1018,0,956,722,230,560,0,1042,0,802,0,659,1132,0,0,861,0,1064,785,223,639,0,827,0,628,0,505,1537,1528,"Federation, Human, Starfleet, Costumed, Romantic, Musician","male, organic, voy, kim, crew_max_rarity_4","Late For A Midnight Stroll",2, 7, 6, 8, 10, 3, 0, 2, , , 450, 315, 121, 515, false,"Kim",crew_portraits_cm_kim_fairhaven_sm.png,kim_fairhaven_crew, 48.3871, 27.3333, 18.4703, 44.2944, 3, 0, 0, 0
"Zarabeth",0,4, 0,0,0,0,0,0,0,0,0,0,0,0,869,123,258,612,126,342,0,0,0,1079,791,0,0,925,563,0,1111,753,890,550,110,0,0,0,1162,597,0,0,1024,440,0,1201,575,981,365,146,1574,1534,"Sarpeidon, Survivalist, Desperate, Resourceful, Romantic, Crafty, Civilian, Caregiver, Displaced, Chef","organic, female, nonhuman, tos, zarabeth, crew_max_rarity_4","You're Safe Here",1, 7, 6, 6, 6, , , , , , 375, 175, 83, 440, false,"Zarabeth",crew_portraits_cm_zarabeth_sm.png,zarabeth_crew, 45.562, 55.1111, 5.1579, 46.5664, 5, 0, 0, 0
"Facer Rios",0,5, 526,78,141,0,0,0,0,0,0,962,130,280,1259,236,440,0,0,0,1295,1299,226,236,1098,0,573,442,0,695,566,0,52,367,290,1409,1371,394,300,1213,0,649,431,0,830,494,0,55,502,262,620,717,"Human, Civilian, Undercover Operative, Scoundrel, Crafty, Costumed, Playful","male, organic, pic, rios, crew_max_rarity_5","Indulge Me",1, 10, 6, 8, 10, , , , , , 440, 200, 170, 450, false,"Rios",crew_portraits_cm_rios_facer_sm.png,rios_facer_crew, 84.1715, 24, 18.0878, 79.2717, 3, 0, 0, 39.4314
"Kelis",0,5, 1283,243,418,0,0,0,0,0,0,0,0,0,1012,116,244,475,90,188,353,561,339,98,26,0,0,782,806,0,961,1022,724,831,137,360,546,345,191,53,0,0,1057,718,0,1237,976,1023,746,312,586,726,"Communicator, Civilian, Resourceful, Writer, Desperate, Maverick, Costumed","male, nonhuman, organic, voy, kelis, crew_max_rarity_5","You're Not Doing So Well",1, 8, 8, 8, 8, , , , , , 415, 150, 120, 475, true,"Kelis",crew_portraits_cm_kelis_sm.png,kelis_crew, 84.8527, 76.6667, 14.9492, 82.9354, 6, 0, 0, 0
"A.G. Robinson",0,5, 486,46,143,792,212,493,0,0,0,1299,121,295,0,0,0,0,0,0,270,1343,113,1454,1166,786,49,872,457,419,0,0,461,151,0,134,1432,452,1544,1273,284,34,397,190,823,0,0,913,497,0,825,718,"Human, Starfleet, Pilot, Explorer, Inspiring, Maverick","evsuit, male, organic, ent, robinson_ag, crew_max_rarity_5","You Tried Too Hard",1, 10, 6, 6, 12, 7, 0, , , , 225, 185, 235, 750, true,"A.G.",crew_portraits_cm_robinson_ag_sm.png,robinson_ag_crew, 78.4813, 41.1111, 65.5098, 76.9545, 5, 0, 0, 19.7917
"Cyrano de Barclay",0,4, 845,99,221,0,0,0,0,0,0,371,72,145,582,107,218,0,0,0,928,1000,425,483,694,0,1124,1103,0,1265,1306,0,685,893,909,1122,1150,572,660,924,0,1079,1138,0,1228,1305,0,609,895,932,1413,1512,"Starfleet, Costumed, Communicator, Human, Innovator, Federation","male, organic, tng, barclay, crew_max_rarity_4","The Moon...Yes, That Will Be My Home",1, 8, 5, 6, 10, , , , , , 400, 200, 130, 460, false,"Barclay",crew_portraits_cm_cyrano_barclay_sm.png,barclay_cyrano_crew, 54.979, 42.6667, 14.9016, 50.2966, 3, 0, 0, 0
"Maquis Takeover Seska",0,5, 1300,173,343,0,0,0,523,126,220,967,158,267,0,0,0,0,0,0,401,230,30,662,235,1119,558,0,0,197,1348,896,770,355,0,653,331,85,865,455,999,637,0,0,247,1270,836,889,480,0,578,748,"Bajoran, Cardassian, Maquis, Hologram, Obsidian Order, Crafty, Villain, Undercover Operative, Vengeful","nonhuman, female, organic, voy, seska, crew_max_rarity_5","Authorization Zeta 1",0, 8, 10, 8, 10, 1, 1, , , , 400, 105, 177, 500, false,"Seska",crew_portraits_cm_seska_maquis_sm.png,seska_maquis_crew, 85.0731, 27.1111, 41.7443, 80.3374, 5, 0, 0, 60.5469
"Flustered Jett Reno",0,4, 0,0,0,865,160,319,0,0,0,320,57,181,0,0,0,588,116,284,873,0,1435,0,870,822,324,899,98,1306,0,795,1491,310,884,778,0,1314,0,766,707,229,802,103,1172,0,733,1318,139,808,1333,1069,"Starfleet, Federation, Human, Jury Rigger, Resourceful, Desperate, Veteran, Playful","female, organic, dsc, jett_reno, crew_max_rarity_4","I'm Going, I'm Going",1, 6, 10, 10, 15, 2, 0, , , , 400, 185, 155, 475, false,"Reno",crew_portraits_cm_reno_flustered_sm.png,dsc_jett_reno_flustered_crew, 54.1174, 53.7778, 58.6593, 61.4081, 5, 0, 0, 0
"Maquis Takeover Paris",0,4, 381,65,150,0,0,0,554,80,185,836,122,244,0,0,0,0,0,0,1438,879,415,1513,1224,1140,665,0,0,244,1370,911,924,471,0,1421,839,515,1496,1226,1209,700,0,0,405,1421,995,1000,554,0,1443,1523,"Human, Starfleet, Federation, Maquis, Undercover Operative, Costumed, Pilot","organic, male, voy, paris, crew_max_rarity_4","Remember The Good Old Days",2, 6, 10, 8, 12, 1, 1, , , , 525, 175, 170, 515, false,"Paris",crew_portraits_cm_paris_maquis_sm.png,paris_maquis_crew, 54.0573, 24.6667, 26.9237, 49.0663, 3, 0, 0, 38.7587
