crew, tier, rarity, CMD_core, CMD_min, CMD_max, SCI_core, SCI_min, SCI_max, SEC_core, SEC_min, SEC_max, ENG_core, ENG_min, ENG_max, DIP_core, DIP_min, DIP_max, MED_core, MED_min, MED_max, V_CMD_SCI, V_CMD_SEC, V_CMD_ENG, V_CMD_DIP, V_CMD_MED, V_SCI_SEC, V_SCI_ENG, V_SCI_DIP, V_SCI_MED, V_SEC_ENG, V_SEC_DIP, V_SEC_MED, V_ENG_DIP, V_ENG_MED, V_DIP_MED, G_CMD_SCI, G_CMD_SEC, G_CMD_ENG, G_CMD_DIP, G_CMD_MED, G_SCI_SEC, G_SCI_ENG, G_SCI_DIP, G_SCI_MED, G_SEC_ENG, G_SEC_DIP, G_SEC_MED, G_ENG_DIP, G_ENG_MED, G_DIP_MED, voyage_rank, gauntlet_rank, traits, hidden_traits, action_name, action_bonus_type, action_bonus_amount, action_initial_cooldown, action_duration, action_cooldown, bonus_ability, trigger, uses_per_battle, penalty_type, penalty_amount, accuracy, crit_bonus, crit_chance, evasion, charge_phases, short_name, image_name, symbol
"Investigator Odo",8,1, 0,0,0,0,0,0,217,37,171,0,0,0,0,0,0,0,0,0,0,942,0,0,0,996,0,0,0,859,1034,815,0,0,0,0,860,0,0,0,876,0,0,0,756,965,733,0,0,0,1217,1210,"Changeling, Cardassian, Investigator, Interrogator","nonhuman, male, organic, ds9, odo, crew_max_rarity_1","Collaboration",2, 1, 20, 14, 10, , , , , , 400, 115, 67, 265, false,"Odo",crew_portraits_cm_odooccupation_sm.png,odo_occupation_crew
"Constable Odo",4,3, 317,107,225,0,0,0,523,27,85,0,0,0,0,0,0,0,0,0,895,578,826,936,767,840,0,0,0,731,915,685,0,0,0,666,566,605,754,557,997,0,0,0,851,1041,814,0,0,0,1113,1127,"Changeling, Bajoran, Constable, Investigator, Interrogator","nonhuman, male, organic, ds9, odo, crew_max_rarity_3","Justice",0, 6, 10, 12, 16, , , , 3, 800, 520, 300, 75, , false,"Odo",crew_portraits_cm_odostandard_sm.png,odo_constable_crew
"Ensign Ro",4,2, 322,46,132,0,0,0,0,0,0,0,0,0,0,0,0,0,0,0,974,929,904,988,841,0,0,0,0,0,0,0,0,0,0,934,902,860,956,800,0,0,0,0,0,0,0,0,0,0,1212,1215,"Starfleet, Bajoran, Resourceful","nonhuman, female, organic, tng, ensign, bridge_crew, ro, crew_max_rarity_2","Separate Ways",0, 4, 3, 10, 5, , , 2, , , 130, 210, 13, 200, false,"Ro",crew_portraits_cm_roensign_sm.png,ro_ensign_crew
"Shinzon",10,5, 819,94,241,0,0,0,938,183,435,0,0,0,546,176,390,0,0,0,551,116,486,252,421,308,0,654,0,272,114,206,606,0,516,662,152,600,189,553,255,0,378,0,228,53,188,309,0,305,465,172,"Human, Clone, Reman, Villain, Romulan","male, organic, tng, shinzon, crew_max_rarity_5","Destiny Complete",0, 7, 14, 3, 14, 1, 2, , , , 1325, 545, 365, 1050, false,"Shinzon",crew_portraits_cm_shinzon_sm.png,shinzon_crew
"Will Riker",10,1, 251,42,110,0,0,0,125,22,74,0,0,0,0,0,0,0,0,0,989,862,927,1011,860,1025,0,0,0,879,1062,841,0,0,0,965,808,892,984,838,1010,0,0,0,865,1053,825,0,0,0,1204,1197,"Human, Federation, Starfleet, Maverick, Gambler, Romantic","male, organic, nonhuman, tng, commander, bridge_crew, first_officer, riker, crew_max_rarity_1","Poker Face",0, 1, 8, 10, 14, 4, 0, , , , 455, , 425, 340, false,"Riker",crew_portraits_cm_rikers1_sm.png,riker_s1_commander_crew
"Commander Riker",7,2, 279,78,191,0,0,0,124,29,89,0,0,0,290,22,64,0,0,0,971,832,902,766,839,1021,0,979,0,876,937,837,961,0,841,767,635,721,723,660,994,0,1010,0,849,974,812,992,0,864,1147,1112,"Human, Federation, Starfleet, Pilot, Maverick, Gambler, Romantic","male, organic, tng, commander, bridge_crew, first_officer, riker, crew_max_rarity_2","Liase",0, 2, 8, 10, 14, 5, 0, , , , 645, 50, 295, 275, false,"Riker",crew_portraits_cm_rikerpoker_sm.png,riker_s2_commander_crew
"Edith Keeler",7,4, 0,0,0,0,0,0,0,0,0,0,0,0,453,166,339,591,187,590,0,0,0,792,430,0,0,728,337,0,815,428,685,287,107,0,0,0,557,96,0,0,462,106,0,556,112,383,42,15,1023,428,"Civilian, Caregiver, Inspiring, Cultural Figure, Romantic, Human","female, organic, tos, keeler, crew_max_rarity_4","A Life Worth Living",1, 7, 8, 10, 8, , , , , , 690, 25, 52, 440, false,"Keeler",crew_portraits_cm_edithkeeler_sm.png,keeler_crew
"Ensign Tuvok",8,1, 0,0,0,181,51,197,0,0,0,0,0,0,138,33,74,0,0,0,1005,0,0,1046,0,1005,689,896,614,0,1058,0,1003,0,877,819,0,0,1023,0,818,548,691,490,0,1046,0,971,0,847,1206,1168,"Vulcan, Federation, Starfleet, Telepath","nonhuman, male, organic, voy, ensign, bridge_crew, tuvok, crew_max_rarity_1","Memory",0, 1, 1, 14, 10, , , , , , 103, 60, 135, 375, false,"Tuvok",crew_portraits_cm_tuvokensign_sm.png,tuvok_ensign_crew
"Security Chief Tuvok",5,3, 291,53,161,145,45,149,445,85,201,0,0,0,0,0,0,0,0,0,780,610,913,990,849,589,701,1013,624,727,911,681,0,0,0,551,500,818,914,756,441,610,906,557,650,841,627,0,0,0,1091,1014,"Vulcan, Federation, Starfleet, Telepath, Tactician, Investigator","nonhuman, male, organic, voy, lieutenant_commander, bridge_crew, tuvok, crew_max_rarity_3","Contingency Plan",0, 4, 10, 12, 16, 5, 0, , , , 465, 50, , 300, false,"Tuvok",crew_portraits_cm_tuvokrifle_sm.png,tuvok_rifle_crew
"Major Kira",7,2, 273,37,126,0,0,0,304,60,176,0,0,0,0,0,0,0,0,0,981,687,919,998,851,958,0,0,0,827,1011,782,0,0,0,953,617,877,969,820,829,0,0,0,711,916,692,0,0,0,1168,1152,"Bajoran, Veteran, Resourceful","nonhuman, female, organic, ds9, kira, crew_max_rarity_2","Obstinance",0, 2, 0, 10, 14, 6, 0, , , , 295, 150, 5, , true,"Kira",crew_portraits_cm_kirashorthair_sm.png,kira_major_shorthair_crew
"Mirror Intendant Kira",6,5, 512,183,363,0,0,0,1052,272,542,0,0,0,946,67,184,0,0,0,649,113,583,215,530,237,0,543,0,213,52,153,477,0,407,353,34,276,254,257,108,0,835,0,111,78,84,790,0,686,284,127,"Bajoran, Cardassian, Klingon, Villain, Klingon-Cardassian Alliance, Brutal, Mirror Universe","nonhuman, female, organic, ds9, mirror, kira, crew_max_rarity_5","Instability",0, 6, 6, 10, 12, 4, 0, , , , 915, 225, 90, 1525, true,"Kira",crew_portraits_cm_kiraintendant_sm.png,kira_mirror_crew
"Security Chief Worf",2,2, 205,57,144,0,0,0,326,61,145,0,0,0,0,0,0,0,0,0,1002,719,936,1023,869,951,0,0,0,820,1005,776,0,0,0,902,608,833,929,770,883,0,0,0,765,971,738,0,0,0,1176,1146,"Klingon, Federation, Starfleet, Duelist, Investigator","nonhuman, male, organic, tng, lieutenant, bridge_crew, worf, crew_max_rarity_2","They Have No Honor",2, 4, 8, 10, 12, , , , 1, 2, 165, 280, 95, 155, false,"Worf",crew_portraits_cm_worf_sm.png,worf_security_chief_crew
"Defiant Commander Worf",7,4, 364,241,488,0,0,0,609,179,394,0,0,0,0,0,0,0,0,0,706,297,643,784,585,574,0,0,0,514,721,450,0,0,0,166,46,116,316,107,308,0,0,0,271,471,230,0,0,0,1030,371,"Klingon, Federation, Starfleet, Duelist, Tactician","nonhuman, male, organic, ds9, lieutenant_commander, bridge_crew, worf, crew_max_rarity_4","Good Day to Die",2, 6, 12, 12, 12, 4, 0, , 1, 2, 690, 645, 325, 205, false,"Worf",crew_portraits_cm_worfdefiant_sm.png,worf_defiant_commander_crew
"Mirror Regent Worf",7,5, 861,294,589,0,0,0,1062,175,357,0,0,0,0,0,0,0,0,0,293,74,245,478,199,281,0,0,0,253,444,191,0,0,0,81,27,54,201,48,356,0,0,0,326,527,277,0,0,0,554,254,"Klingon, Cardassian, Tactician, Villain, Brutal, Klingon-Cardassian Alliance, Mirror Universe","nonhuman, male, organic, ds9, mirror, bridge_crew, worf, crew_max_rarity_5","Position of Strength",0, 9, 8, 8, 10, , , , , , 300, 980, 390, , false,"Worf",crew_portraits_cm_worfmirror_sm.png,worf_mirror_crew
"Yeoman Rand",10,1, 164,15,58,0,0,0,0,0,0,0,0,0,117,19,60,0,0,0,1020,971,963,997,895,0,0,1022,0,0,1064,0,1010,0,881,1017,970,960,985,890,0,0,1013,0,0,1059,0,999,0,869,1214,1218,"Federation, Starfleet, Human","female, organic, tos, yeoman, bridge_crew, rand, crew_max_rarity_1","Signature Required",2, 2, 8, 10, 12, , , , 1, 1, 375, , , 180, false,"Rand",crew_portraits_cm_randyeoman_sm.png,rand_yeoman_crew
"The Duras Sisters",8,4, 311,83,205,0,0,0,658,150,385,0,0,0,464,170,341,0,0,0,926,398,858,564,799,558,0,719,0,497,266,439,677,0,578,737,235,692,255,636,354,0,451,0,324,89,276,373,0,351,859,340,"Klingon, Scoundrel, Villain","nonhuman, female, organic, tng, betor, lursa, crew_max_rarity_4","The Power of Two",0, 9, 10, 20, 12, , , 1, , , 350, 110, 190, 500, false,"Duras Sisters",crew_portraits_cm_duras_sisters_sm.png,duras_sisters_crew
"Persis",6,2, 0,0,0,0,0,0,253,94,250,0,0,0,303,39,88,0,0,0,0,918,0,994,0,957,0,970,0,826,754,781,953,0,833,0,677,0,1004,0,625,0,978,0,560,588,532,955,0,835,1163,1111,"Human, Augments, Engineered, Survivalist, Tactician","nonhuman, female, organic, ent, persis, crew_max_rarity_2","Augmented Strength",0, 2, 6, 10, 6, 7, 0, 2, , , 240, 330, 300, , false,"Persis",crew_portraits_cm_persis_sm.png,persis_crew
"Telek R'Mor",5,2, 0,0,0,347,52,194,119,8,44,0,0,0,263,30,113,0,0,0,911,977,0,1003,0,819,629,665,563,880,962,842,962,0,842,822,972,0,993,0,719,551,643,492,878,984,840,940,0,825,1142,1133,"Romulan, Astrophysicist","nonhuman, male, organic, voy, captain, bridge_crew, rmor, crew_max_rarity_2","Solitary Survey",1, 3, 10, 12, 10, 0, 2, , , , 405, 50, 3, 180, false,"R'Mor",crew_portraits_cm_telekrmor_sm.png,rmor_voyager_crew
"KDF Gowron",9,4, 375,85,222,0,0,0,296,100,256,0,0,0,641,173,418,0,0,0,860,604,794,426,738,917,0,624,0,788,421,747,569,0,480,708,344,657,190,605,598,0,349,0,539,138,512,271,0,275,926,437,"Klingon, Duelist, Diplomat, Politician","nonhuman, male, organic, tng, gowron, crew_max_rarity_4","What Can Be Done",1, 6, 14, 10, 14, 0, 2, , , , 625, 465, 85, 1000, false,"Gowron",crew_portraits_cm_gowronyoung_sm.png,gowron_kdf_crew
"Third Remata'Klan",9,3, 410,42,84,0,0,0,467,85,185,0,0,0,0,0,0,0,0,0,900,569,835,946,774,820,0,0,0,712,898,664,0,0,0,988,618,917,1005,853,760,0,0,0,671,865,646,0,0,0,1109,1153,"Jem'hadar, Dominion, Duelist, Tactician","nonhuman, male, organic, ds9, remataklan, crew_max_rarity_3","Victory is Life",0, 3, 0, 6, 8, 4, 4, , , , 690, 395, 597, 600, true,"Remata'Klan",crew_portraits_cm_remataklan_sm.png,remataklan_crew
"Ensign Chapel",10,1, 0,0,0,0,0,0,0,0,0,0,0,0,0,0,0,214,34,152,0,0,0,0,870,0,0,0,613,0,0,822,0,564,857,0,0,0,0,793,0,0,0,568,0,0,765,0,517,781,1223,1214,"Human, Federation, Starfleet, Nurse","female, organic, tos, ensign, chapel, crew_max_rarity_1","Administer Prescription",2, 1, 6, 10, 10, , , , , , 130, , 40, 100, false,"Chapel",crew_portraits_cm_chapelensign_sm.png,chapel_ensign_crew
"Ensign Ogawa",10,1, 0,0,0,0,0,0,0,0,0,0,0,0,0,0,0,213,34,166,0,0,0,0,865,0,0,0,611,0,0,819,0,561,851,0,0,0,0,782,0,0,0,552,0,0,754,0,503,765,1220,1212,"Human, Federation, Starfleet, Nurse","female, organic, tng, ensign, ogawa, crew_max_rarity_1","Report to Sickbay",2, 1, 6, 1, 8, 2, 0, 1, , , 170, , 35, 105, false,"Ogawa",crew_portraits_cm_ogawaensign_sm.png,ogawa_ensign_crew
"Wesley Crusher",10,1, 0,0,0,218,43,149,0,0,0,174,32,78,0,0,0,0,0,0,995,0,958,0,0,1002,593,991,609,874,0,0,998,577,0,919,0,933,0,0,913,472,909,558,858,0,0,972,565,0,1200,1189,"Human, Federation, Civilian, Prodigy","male, organic, tng, wesley, crew_max_rarity_1","Study",1, 2, 8, 10, 12, , , , 0, 1, 215, 125, 70, 55, false,"Wesley",crew_portraits_cm_wesleysweater_sm.png,wesley_sweater_crew
"Ensign Crusher",7,3, 176,11,31,426,83,229,0,0,0,347,34,78,0,0,0,0,0,0,655,972,772,1044,896,855,396,873,523,843,0,0,948,548,0,642,973,893,1050,898,699,352,749,425,855,0,0,969,563,0,1096,1120,"Human, Federation, Starfleet, Prodigy, Warp Theorist","male, organic, tng, ensign, bridge_crew, wesley, crew_max_rarity_3","Rewire",2, 4, 6, 8, 10, 6, 0, , , , 290, , , 190, false,"Wesley",crew_portraits_cm_wesley_sm.png,wesley_full_ensign_crew
"Acting Ensign Crusher",9,2, 114,29,58,258,56,160,0,0,0,251,53,148,0,0,0,0,0,0,862,976,809,1052,900,988,484,973,602,855,0,0,958,554,0,718,962,705,1036,882,878,359,882,528,783,0,0,873,506,0,1157,1104,"Human, Federation, Starfleet, Prodigy","male, organic, tng, ensign, bridge_crew, wesley, crew_max_rarity_2","Invention",1, 4, 3, 6, 6, , , 2, , , 205, 50, 25, 165, false,"Wesley",crew_portraits_cm_wesleyensign_sm.png,wesley_acting_ensign_crew
"Formal Dress Wesley Crusher",8,4, 0,0,0,662,173,422,0,0,0,270,108,230,481,160,342,0,0,0,565,0,885,778,0,556,229,165,341,828,805,0,404,534,574,315,0,616,560,0,300,66,44,203,591,562,0,84,362,360,860,265,"Human, Federation, Starfleet, Prodigy, Warp Theorist","male, organic, tng, ensign, bridge_crew, wesley, lieutenant, crew_max_rarity_4","Duty to the Truth",1, 9, 4, 10, 12, , , , , , 300, 500, 30, 450, false,"Wesley",crew_portraits_cm_wesleydressuniform_sm.png,wesley_formal_dress_crew
"Wrathful Khan",7,5, 1040,206,421,0,0,0,1145,72,143,376,140,288,0,0,0,0,0,0,279,78,53,464,183,302,578,0,0,77,465,201,836,473,0,259,224,20,429,175,861,353,0,0,224,949,723,518,277,0,418,432,"Human, Augments, Engineered, Villain, Cultural Figure, Tactician, Resourceful, Survivalist, Brutal","nonhuman, male, organic, tos, khan, crew_max_rarity_5","I Stab at Thee",2, 9, 12, 5, 12, 1, 0, , , , 640, 595, 345, 850, false,"Khan",crew_portraits_cm_khan_sm.png,khan_wok_crew
"Tailor Garak",4,3, 0,0,0,0,0,0,502,44,126,161,22,44,395,83,219,0,0,0,0,831,965,898,0,834,708,881,0,555,589,680,665,580,736,0,907,963,792,0,941,710,764,0,721,590,773,598,581,618,1070,1090,"Cardassian, Undercover Operative, Scoundrel, Interrogator, Civilian","nonhuman, male, organic, ds9, garak, crew_max_rarity_3","Cutting Cloth",1, 5, 8, 12, 12, , , , , , 125, 230, 20, 405, false,"Garak",crew_portraits_cm_garaktailor_sm.png,garak_tailor_crew
"Bartender Quark",9,1, 110,25,77,0,0,0,81,15,57,0,0,0,211,36,150,0,0,0,1025,961,968,955,898,1027,0,995,0,881,1014,843,979,0,854,1002,903,939,811,870,1021,0,915,0,876,885,838,887,0,779,1192,1165,"Ferengi, Bartender, Civilian, Scoundrel, Gambler, Merchant","nonhuman, male, organic, ds9, quark, crew_max_rarity_1","Hospitality",1, 2, 8, 10, 12, , , , 2, 1, 165, 10, 10, 140, false,"Quark",crew_portraits_cm_quarkbartender_sm.png,quark_s1_bartender_crew
"Richard Castillo",4,3, 487,109,227,286,57,187,0,0,0,0,0,0,0,0,0,0,0,0,513,783,708,823,647,978,674,966,595,0,0,0,0,0,0,328,695,601,750,554,826,557,842,497,0,0,0,0,0,0,1119,1073,"Human, Hero, Pilot, Starfleet, Federation, Displaced","bridge_crew, male, organic, castillo, tng, lieutenant, crew_max_rarity_3","Self Sacrifice",0, 5, 12, 12, 10, 7, 0, , 1, 2, 650, 265, 129, 585, false,"Castillo",crew_portraits_cm_richardcastillo_sm.png,castillo_lieutenant_crew
"Writer Jake Sisko",10,3, 0,0,0,0,0,0,0,0,0,0,0,0,451,70,198,0,0,0,0,0,0,883,0,0,0,862,0,0,916,0,822,0,720,0,0,0,832,0,0,0,803,0,0,875,0,755,0,660,1190,1194,"Human, Federation, Civilian, Writer, Gambler, Romantic","male, organic, ds9, jake, crew_max_rarity_3","Construct Story",2, 3, 0, 8, 10, 6, 0, , , , 995, 350, 47, 640, true,"Jake",crew_portraits_cm_jakewriter_sm.png,jake_writer_crew
"CMO Crusher",3,2, 0,0,0,0,0,0,0,0,0,0,0,0,0,0,0,290,52,174,0,0,0,0,848,0,0,0,597,0,0,799,0,547,828,0,0,0,0,739,0,0,0,519,0,0,719,0,483,722,1213,1207,"Human, Starfleet, Federation, Physician, Caregiver, Cyberneticist","female, organic, tng, commander, crusher, crew_max_rarity_2","Doctor's Calluses",2, 3, 6, 10, 10, , , , , , 185, , 35, 155, false,"Crusher",crew_portraits_cm_crusherwithlabcoat_sm.png,crusher_labcoat_crew
"Commando Crusher",1,3, 0,0,0,182,76,200,308,93,193,0,0,0,0,0,0,510,44,132,993,892,0,0,715,638,686,990,350,803,985,391,0,464,713,764,760,0,0,806,324,502,798,314,651,843,377,0,525,793,1065,986,"Human, Starfleet, Federation, Physician, Cyberneticist, Undercover Operative","female, organic, tng, commander, crusher, crew_max_rarity_3","Repel Disease",0, 3, 6, 3, 12, 1, 0, , , , 575, , 370, 500, false,"Crusher",crew_portraits_cm_crusherblackcommandouniform_sm.png,crusher_black_commando_uniform_crew
"Dr. Crusher",10,4, 275,38,110,0,0,0,437,90,201,0,0,0,0,0,0,736,123,300,982,629,920,999,201,838,0,0,343,729,914,134,0,296,481,971,570,900,987,248,720,0,0,328,645,833,135,0,272,476,951,887,"Human, Starfleet, Federation, Physician, Cyberneticist","female, organic, tng, commander, crusher, crew_max_rarity_4","Neutralize Disease",1, 7, 12, 12, 12, 4, 4, , , , 740, 250, 370, 500, false,"Crusher",crew_portraits_cm_crusherfromfirstcontact_sm.png,crusher_first_contact_crew
"Holonovel Doctor",9,4, 0,0,0,512,50,137,0,0,0,0,0,0,0,0,0,799,69,244,832,0,0,0,434,828,559,851,124,0,0,434,0,292,478,927,0,0,0,599,921,619,916,269,0,0,600,0,392,601,1043,1106,"Hologram, Human, Federation, Starfleet, Physician, Musician, Scoundrel","nonhuman, male, artificial_life, voy, emh, crew_max_rarity_4","Suggested Treatment",0, 7, 12, 12, 12, , , , , , 365, 370, 205, 525, false,"Doctor",crew_portraits_cm_doctorgolfclub_sm.png,emh_authorauthor_crew
"Mobile Doctor",10,5, 0,0,0,809,106,209,0,0,0,0,0,0,393,137,435,1191,110,334,560,0,0,809,165,551,400,185,28,0,836,176,711,115,49,700,0,0,497,413,691,452,120,112,0,491,419,299,256,60,476,368,"Hologram, Human, Federation, Starfleet, Musician, Physician","nonhuman, male, artificial_life, voy, emh, crew_max_rarity_5","House Call",2, 9, 12, 12, 12, , , , , , 1825, 600, , 600, false,"Doctor",crew_portraits_cm_emhmobile_sm.png,emh_mobileholoemitter_crew
"Comm Officer Uhura",10,1, 0,0,0,0,0,0,0,0,0,0,0,0,258,28,89,0,0,0,0,0,0,1015,0,0,0,987,0,0,1037,0,970,0,847,0,0,0,1015,0,0,0,986,0,0,1039,0,965,0,841,1219,1223,"Federation, Starfleet, Human, Musician, Communicator","female, organic, tos, lieutenant, bridge_crew, uhura, crew_max_rarity_1","Incoming Message",2, 2, 8, 10, 12, , , , 1, 1, 320, , , 495, false,"Uhura",crew_portraits_cm_uhurared_sm.png,uhura_red_crew
"Commander Uhura",9,4, 459,128,299,0,0,0,0,0,0,0,0,0,592,198,429,0,0,0,746,768,693,350,627,0,0,632,0,0,719,0,578,0,487,527,593,450,114,428,0,0,304,0,0,411,0,224,0,233,1042,695,"Federation, Starfleet, Human, Musician, Communicator","female, organic, tos, commander, bridge_crew, uhura, crew_max_rarity_4","Hailing Frequencies",0, 8, 12, 26, 12, , , 1, , , 1165, , 75, 790, false,"Uhura",crew_portraits_cm_uhurawrathofkhan_sm.png,uhura_wrathofkhan_crew
"Dancing Uhura",9,5, 1026,84,195,0,0,0,0,0,0,0,0,0,1185,193,393,0,0,0,428,520,379,65,320,0,0,298,0,0,394,0,217,0,222,750,774,706,216,647,0,0,353,0,0,472,0,278,0,280,547,888,"Human, Federation, Starfleet, Communicator, Casual, Musician, Artist","bridge_crew, female, organic, tos, uhura, lieutenant_commander, original, crew_max_rarity_5","Take The Lead",0, 8, 10, 3, 14, 1, 1, , , , 465, 260, 60, 400, false,"Uhura",crew_portraits_cm_uhura_dancing_sm.png,uhura_dancing_crew
"First Maje Culluh",5,3, 466,93,223,0,0,0,307,42,138,0,0,0,0,0,0,0,0,0,809,599,745,865,690,979,0,0,0,841,1021,798,0,0,0,694,507,632,770,587,927,0,0,0,798,991,766,0,0,0,1126,1102,"Kazon, Scoundrel","nonhuman, male, organic, voy, captain, culluh, crew_max_rarity_3","Nistrim Supremacy",2, 3, 6, 10, 10, 8, 4, , , , 665, 325, 133, 390, false,"Culluh",crew_portraits_cm_jalculluh_sm.png,culluh_crew
"KDF Alexander",6,2, 137,19,79,0,0,0,331,64,148,145,16,72,0,0,0,0,0,0,1022,806,917,1047,897,946,709,0,0,697,995,768,1005,581,0,1004,731,854,1031,873,868,705,0,0,636,960,726,993,575,0,1161,1155,"Human, Klingon","male, organic, ds9, bridge_crew, alexander, nonhuman, crew_max_rarity_2","Beginner's Luck",1, 3, 10, 12, 10, 5, 2, , , , 130, 200, 62, 15, false,"Alexander",crew_portraits_cm_alexanderkdf_sm.png,alexander_kdf_crew
"Commando Shran",9,4, 673,114,239,0,0,0,592,89,182,0,0,0,318,144,282,0,0,0,600,325,531,455,468,673,0,883,0,599,470,547,853,0,739,634,382,561,278,518,758,0,591,0,669,321,645,501,0,465,857,692,"Andorian, Tactician, Inspiring, Imperial Guard","nonhuman, male, organic, ent, captain, shran, crew_max_rarity_4","Debt Owed",0, 8, 6, 8, 10, , , 3, , , 390, 575, 288, 350, false,"Shran",crew_portraits_cm_shrancommando_sm.png,shran_commando_crew
"Ushaan Shran",10,5, 989,83,164,0,0,0,1076,170,348,0,0,0,424,134,288,0,0,0,469,96,423,288,351,278,0,791,0,251,136,188,762,0,652,810,269,761,378,695,375,0,598,0,345,140,297,510,0,471,453,525,"Andorian, Duelist, Romantic, Imperial Guard","nonhuman, male, organic, ent, captain, shran, crew_max_rarity_5","Debt Owed",0, 9, 6, 8, 10, , , 3, , , 1440, 565, 483, 390, false,"Shran",crew_portraits_cm_shrandueling_sm.png,shran_dueling_crew
"Fencing Sulu",9,4, 444,99,249,385,36,92,609,203,448,0,0,0,0,0,0,0,0,0,508,338,756,871,698,265,645,938,577,494,710,435,0,0,0,459,131,576,733,532,124,684,980,613,198,365,165,0,0,0,906,590,"Human, Federation, Starfleet, Pilot, Resourceful, Duelist","male, organic, tos, lieutenant, bridge_crew, sulu, crew_max_rarity_4","Parry Attack",0, 6, 12, 8, 12, 6, 4, , , , 415, , 225, 225, false,"Sulu",crew_portraits_cm_sulufencing_sm.png,sulu_fencing_crew
"Morn",7,3, 0,0,0,0,0,0,359,70,174,0,0,0,418,121,295,0,0,0,0,869,0,848,0,909,0,807,0,779,611,740,775,0,667,0,809,0,662,0,812,0,605,0,701,367,682,520,0,480,1102,1030,"Lurian, Courier, Duelist, Civilian, Gambler, Smuggler","nonhuman, male, organic, ds9, morn, crew_max_rarity_3","Drinking Spot",0, 3, 0, 8, 8, , , , 1, 2, 150, 285, 57, 655, true,"Morn",crew_portraits_cm_morn_sm.png,morn_crew
"Seven in Blue",3,2, 0,0,0,294,51,209,0,0,0,278,53,130,0,0,0,0,0,0,967,0,918,0,0,966,443,958,588,852,0,0,955,552,0,796,0,864,0,0,799,343,823,478,802,0,0,897,521,0,1169,1136,"Human, Borg, Civilian, Federation","nonhuman, female, organic, voy, bridge_crew, seven, crew_max_rarity_2","Ignore Irrelevancies",1, 2, 8, 10, 14, 4, 0, , , , 75, 50, 310, 170, false,"Seven",crew_portraits_cm_seven_of_nine_sm.png,seven_allblue_crew
"Seven of Nine",7,5, 0,0,0,785,247,791,0,0,0,854,225,454,514,89,183,0,0,0,300,0,372,817,0,301,42,103,195,369,852,0,69,192,623,42,0,160,827,0,39,3,12,38,203,870,0,52,79,657,450,29,"Human, Borg, Civilian, Federation","nonhuman, female, organic, voy, bridge_crew, seven, crew_max_rarity_5","New Collective",2, 7, 12, 10, 14, 4, 0, , , , 1750, , 705, 440, false,"Seven",crew_portraits_cm_sevenbluegreyshoulders_sm.png,seven_bluegreyshoulders_crew
"Donik",6,3, 0,0,0,0,0,0,0,0,0,476,79,199,303,31,79,0,0,0,0,0,768,995,0,0,557,972,0,721,1026,0,558,457,835,0,0,722,1021,0,0,506,992,0,674,1045,0,574,435,846,1139,1159,"Hirogen, Innovator","nonhuman, male, organic, voy, donik, crew_max_rarity_3","Hunting Program",2, 4, 12, 12, 10, 7, 0, , , , 870, 165, , 340, false,"Donik",crew_portraits_cm_donik_sm.png,donik_crew
"Commander Tucker",8,2, 252,28,82,0,0,0,0,0,0,305,53,185,0,0,0,0,0,0,1000,948,642,1020,867,0,668,0,0,835,0,0,941,539,0,999,946,593,1022,867,0,567,0,0,729,0,0,815,473,0,1181,1174,"Human, Starfleet, Jury Rigger, Pilot, Explorer","male, organic, ent, commander, tucker, crew_max_rarity_2","Warp Engines Online",1, 2, 6, 3, 8, 2, 0, , , , 520, 35, 50, 165, false,"Trip",crew_portraits_cm_tucker_sm.png,tucker_commander_crew
"Counselor Troi",9,1, 0,0,0,0,0,0,0,0,0,0,0,0,261,42,108,147,49,131,0,0,0,1002,891,0,0,978,625,0,1029,833,960,575,730,0,0,0,986,804,0,0,959,576,0,1020,767,928,522,579,1194,1181,"Federation, Starfleet, Human, Betazoid, Empath, Counselor","nonhuman, female, organic, tng, lieutenant_commander, bridge_crew, troi, crew_max_rarity_1","Counselling",2, 1, 6, 10, 10, , , , , , 265, , 80, 345, false,"Troi",crew_portraits_cm_troitng_sm.png,troi_casualgray_crew
"Rakal Troi",5,4, 521,163,354,0,0,0,525,128,331,0,0,0,0,0,0,407,163,440,654,353,591,746,141,651,0,0,431,581,778,162,0,395,591,392,141,310,537,13,457,0,0,196,406,593,23,0,122,268,783,145,"Federation, Starfleet, Human, Betazoid, Romulan, Empath, Undercover Operative, Tal Shiar","nonhuman, female, organic, tng, lieutenant_commander, bridge_crew, troi, crew_max_rarity_4","Romulan Disguise",1, 7, 12, 10, 14, 1, 2, , , , 90, 400, 175, 2825, false,"Troi",crew_portraits_cm_troirakal_sm.png,troi_rakal_crew
"Commander Troi",10,5, 0,0,0,0,0,0,383,203,253,0,0,0,1060,211,421,827,142,281,0,815,0,450,390,812,0,339,316,707,133,65,260,256,31,0,546,0,430,441,464,0,300,329,412,73,70,222,273,51,477,186,"Federation, Starfleet, Human, Betazoid, Empath, Counselor","nonhuman, female, organic, tng, commander, bridge_crew, troi, crew_max_rarity_5","Empathic Sense",1, 8, 6, 6, 6, , , , , , 1375, 475, 135, 725, true,"Troi",crew_portraits_cm_troifirstcontact_sm.png,troi_firstcontact_crew
"Vedek Winn Adami",5,3, 307,97,207,0,0,0,0,0,0,0,0,0,410,92,214,0,0,0,922,893,855,655,795,0,0,877,0,0,925,0,843,0,731,712,742,662,454,609,0,0,759,0,0,819,0,702,0,608,1127,1062,"Bajoran, Vedek, Cultural Figure, Spiritual","nonhuman, female, organic, ds9, winn, crew_max_rarity_3","Will of the Prophets",1, 4, 8, 10, 10, 4, 0, , , , , 270, 85, 830, false,"Winn",crew_portraits_cm_winnvedek_sm.png,winn_vedek_crew
"Subcommander T'Pol",4,3, 273,71,211,520,21,77,165,35,77,0,0,0,0,0,0,0,0,0,554,797,903,987,840,616,583,878,529,875,1055,834,0,0,0,594,627,700,818,643,881,700,1002,623,852,1042,815,0,0,0,1093,1107,"Vulcan, High Command, Astrophysicist, Telepath","nonhuman, female, organic, ent, first_officer, bridge_crew, tpol, crew_max_rarity_3","Logic",2, 5, 6, 10, 10, , , , , , 175, 120, 3, 100, false,"T'Pol",crew_portraits_cm_tpol_sm.png,tpol_subcommander_crew
"Commander T'Pol",9,4, 512,112,307,692,56,171,320,91,227,0,0,0,0,0,0,0,0,0,215,484,646,788,587,298,431,667,374,785,964,743,0,0,0,240,290,463,653,440,350,573,864,518,598,788,574,0,0,0,907,795,"Vulcan, Starfleet, Astrophysicist, Telepath","nonhuman, female, organic, ent, first_officer, commander, bridge_crew, tpol, crew_max_rarity_4","Vessel's Information",0, 5, 12, 12, 20, 2, 0, , , , 1400, 200, 70, 1175, false,"T'Pol",crew_portraits_cm_tpolcommander_sm.png,tpol_commander_crew
"Chef Neelix",10,1, 0,0,0,0,0,0,0,0,0,0,0,0,201,51,189,0,0,0,0,0,0,1013,0,0,0,985,0,0,1035,0,968,0,846,0,0,0,871,0,0,0,846,0,0,920,0,802,0,699,1218,1200,"Talaxian, Mylean, Resourceful, Survivalist, Chef, Civilian, Communicator","nonhuman, male, organic, voy, neelix, crew_max_rarity_1","Soup's On",1, 2, 12, 14, 10, 6, 0, , 2, 1, 305, , , 210, false,"Neelix",crew_portraits_cm_neelix_sm.png,neelix_chef_crew
"CMO 'Bones' McCoy",9,1, 0,0,0,0,0,0,0,0,0,0,0,0,0,0,0,213,48,196,0,0,0,0,857,0,0,0,607,0,0,813,0,557,844,0,0,0,0,707,0,0,0,498,0,0,689,0,465,695,1216,1199,"Human, Federation, Starfleet, Physician, Exobiology","male, organic, tos, lieutenant_commander, mccoy, crew_max_rarity_1","Country Doctor",2, 3, 8, 10, 12, , , , 0, 2, 245, 10, 8, 285, false,"McCoy",crew_portraits_cm_mccoy_sm.png,mccoy_chief_medical_officer_crew
