"Pining Vina",9,5, 0,0,0,483,106,216,0,0,0,0,0,0,1287,225,456,831,183,413,1073,0,0,477,510,1060,783,109,101,0,431,512,236,337,25,943,0,0,490,300,909,644,103,68,0,435,304,267,174,17,479,166,"Human, Civilian, Romantic, Desperate, Diplomat","organic, female, dsc, vina, crew_max_rarity_5","Who Are You?",2, 7, 10, 5, 10, 7, 0, , , , 350, 210, 158, 425, false,"Vina",crew_portraits_cm_vina_sm.png,dsc_vina_crew
"Flotter",7,4, 0,0,0,848,177,367,0,0,0,0,0,0,619,121,261,302,82,220,693,0,0,1022,1090,681,505,201,174,0,1060,1009,872,759,422,515,0,0,958,832,504,362,143,98,0,1009,812,809,574,234,1023,730,"Hologram, Caregiver, Cultural Figure","voy, nonhuman, artificial_life, flotter, male, crew_max_rarity_4","No More Lying",2, 8, 8, 6, 10, , , , , , 375, 255, 125, 450, false,"Flotter",crew_portraits_cm_flotter_sm.png,flotter_crew
"Trevis",7,4, 0,0,0,319,70,201,861,157,318,0,0,0,582,138,273,0,0,0,1260,790,0,1037,0,321,953,593,802,630,236,511,885,0,741,1051,714,0,924,0,199,738,347,621,557,209,469,765,0,661,1044,813,"Hologram, Caregiver, Cultural Figure, Gardener","voy, nonhuman, artificial_life, trevis, male, crew_max_rarity_4","I'm Not A Monster!",0, 8, 8, 8, 10, , , , , , 540, 200, 112, 125, false,"Trevis",crew_portraits_cm_trevis_sm.png,trevis_crew
"Desert Archer",8,5, 852,149,341,567,69,177,0,0,0,0,0,0,1218,245,474,0,0,0,178,799,653,103,522,974,708,111,579,0,496,0,292,0,242,219,693,521,61,428,1088,805,121,666,0,368,0,231,0,199,507,266,"Human, Starfleet, Explorer, Telepath, Resourceful, Survivalist","male, organic, ent, archer, crew_max_rarity_5","You're Lying!",2, 10, 8, 8, 10, , , , , , 500, 100, 140, 365, false,"Archer",crew_portraits_cm_archer_desert_sm.png,archer_desert_crew
"Dark Empath Troi",8,5, 937,143,322,0,0,0,1300,178,445,0,0,0,0,0,0,473,101,246,639,75,578,822,51,243,0,0,649,257,434,23,0,637,899,645,118,564,796,92,342,0,0,511,335,516,51,0,486,757,403,281,"Starfleet, Federation, Human, Betazoid, Empath, Counselor, Brutal","nonhuman, female, organic, tng, troi, crew_max_rarity_5","Take Me With You!",0, 9, 8, 8, 8, , , , 1, 3, 450, 230, 100, 430, false,"Troi",crew_portraits_cm_troi_darkempath_sm.png,troi_darkempath_crew
"Torchbearer Tyler",7,4, 0,0,0,0,0,0,873,121,206,0,0,0,576,108,214,0,0,0,0,827,0,1070,0,730,0,954,0,663,291,552,925,0,775,0,957,0,1058,0,871,0,976,0,816,474,737,930,0,785,1363,1417,"Human, Federation, Starfleet, Cultural Figure, Tactician, Klingon","male, organic, dsc, tyler, voq, crew_max_rarity_4","That's a Torchbearer's Job",0, 9, 8, 10, 8, , , , , , 365, 250, 183, 425, false,"Tyler",crew_portraits_cm_tyler_torchbearer_sm.png,dsc_tyler_torchbearer_crew
"Safecracker Nog",8,4, 0,0,0,610,57,146,0,0,0,876,132,331,406,57,124,0,0,0,969,0,643,1259,0,937,145,625,556,633,1300,0,272,339,1015,1230,0,572,1316,0,1212,236,871,761,576,1357,0,302,296,1059,1078,1275,"Ferengi, Costumed, Federation, Starfleet, Criminal, Resourceful","nonhuman, male, organic, ds9, nog, crew_max_rarity_4","Piece of Cake",2, 7, 6, 8, 10, , , , , , 390, 200, 180, 375, false,"Nog",crew_portraits_cm_nog_safecracker_sm.png,nog_safecracker_crew
"Dress Uniform Bashir",8,4, 0,0,0,654,63,140,0,0,0,0,0,0,350,42,134,761,185,414,924,0,0,1329,551,895,651,651,93,0,1354,559,1253,365,315,1231,0,0,1319,294,1213,905,879,113,0,1360,300,1233,168,174,1153,1155,"Human, Starfleet, Federation, Cyberneticist, Physician, Engineered, Gambler, Undercover Operative","nonhuman, male, organic, ds9, bashir, crew_max_rarity_4","Pleasure to Meet You!",0, 8, 6, 6, 8, , , , , , 215, 230, 93, 425, false,"Bashir",crew_portraits_cm_bashir_dressuniform_sm.png,bashir_dress_uniform_crew
"Little John Riker",7,5, 1023,128,239,0,0,0,1309,192,354,0,0,0,422,113,245,0,0,0,579,68,515,366,404,278,0,1141,0,283,141,170,1120,0,957,836,229,773,424,670,476,0,904,0,460,188,355,849,0,720,438,614,"Human, Federation, Starfleet, Costumed, Thief, Maverick","male, organic, tng, riker, crew_max_rarity_5","We Need a Diversion",0, 6, 10, 8, 16, 2, 0, , , , 515, 200, 125, 425, false,"Riker",crew_portraits_cm_riker_littlejohn_sm.png,riker_littlejohn_crew
"Transporter Chief Rand",10,4, 0,0,0,0,0,0,0,0,0,859,113,241,628,92,204,0,0,0,0,0,678,1043,0,0,543,919,0,670,1077,0,159,368,744,0,0,797,1113,0,0,580,1035,0,777,1155,0,295,460,845,1352,1414,"Human, Federation, Starfleet, Desperate","female, organic, tos, rand, crew_max_rarity_4","Yank Them Back!",1, 8, 8, 8, 10, , , , , , 475, 275, 155, 242, false,"Rand",crew_portraits_cm_rand_transporter_sm.png,rand_transporter_crew
"Betrothed Kamala",3,2, 234,27,86,145,27,81,0,0,0,0,0,0,363,43,105,0,0,0,1210,1277,1274,1080,1162,1343,1020,1082,858,0,1355,0,1254,0,1080,1177,1266,1257,1163,1146,1328,1011,1097,848,0,1383,0,1263,0,1091,1531,1545,"Kriosian, Empath, Romantic","organic, tng, female, nonhuman, kamala, crew_max_rarity_2","I Am for You",1, 2, 6, 3, 10, 1, 0, , , , 390, 130, 115, 530, false,"Kamala",crew_portraits_cm_kamala_betrothed_sm.png,kamala_betrothed_crew
"Cadet First Class Locarno",10,5, 1284,180,408,0,0,0,0,0,0,0,0,0,1078,160,296,0,0,0,288,491,258,45,153,0,0,536,0,0,678,0,454,0,389,427,581,369,148,290,0,0,729,0,0,867,0,659,0,557,742,991,"Human, Federation, Starfleet, Maverick, Pilot, Crafty, Desperate","tng, male, nicholas_locarno, organic, crew_max_rarity_5","Everything I Said Was The Truth!",1, 10, 4, 12, 8, , , , 2, 2, 390, 150, 175, 690, false,"Locarno",crew_portraits_cm_nicholas_locarno_sm.png,locarno_nicholas_crew
"Kamala",10,5, 967,131,227,546,92,174,0,0,0,0,0,0,1254,238,483,0,0,0,169,765,606,85,481,988,721,100,588,0,449,0,251,0,203,365,912,793,120,688,1042,756,113,626,0,365,0,227,0,197,389,453,"Kriosian, Empath, Romantic, Exoarchaeology","nonhuman, female, organic, tng, kamala, crew_max_rarity_5","Who I Am Today, I Will Be Forever",1, 7, 4, 6, 8, , , , , , 315, 95, 167, 325, true,"Kamala",crew_portraits_cm_kamala_sm.png,kamala_crew
"Priestess Siranna",7,4, 529,112,242,0,0,0,0,0,0,0,0,0,883,138,286,382,78,211,977,1015,921,367,382,0,0,753,731,0,904,942,696,704,208,859,915,798,368,204,0,0,812,599,0,949,832,733,589,203,1074,958,"Gardener, Kelpien, Spiritual, Civilian, Ambassador, Cultural Figure","nonhuman, female, organic, dsc, siranna, crew_max_rarity_4","The Truth Has Survived",1, 7, 6, 8, 8, , , , , , 450, 200, 100, 475, false,"Siranna",crew_portraits_cm_siranna_priestess_sm.png,dsc_siranna_priestess_crew
"Scrooge Data",6,5, 969,171,330,508,73,173,0,0,0,0,0,0,1267,264,338,0,0,0,163,673,496,75,384,1082,811,128,665,0,502,0,298,0,246,204,679,500,99,411,1089,806,184,667,0,597,0,391,0,332,422,442,"Android, Starfleet, Federation, Cyberneticist, Costumed, Cultural Figure, Artist, Resourceful","nonhuman, male, tng, artificial_life, data, crew_max_rarity_5","Humbug",1, 9, 6, 8, 6, , , , , , 200, 305, 160, 475, false,"Data",crew_portraits_cm_data_scrooge_sm.png,data_scrooge_crew
"Chancellor Martok",8,5, 943,132,341,0,0,0,543,67,148,0,0,0,1262,161,372,0,0,0,623,314,561,95,446,1015,0,417,0,936,144,823,335,0,285,626,440,545,168,463,1150,0,577,0,1039,336,955,503,0,429,487,703,"Klingon, Duelist, Tactician, Diplomat, Veteran, Politician, Cultural Figure","nonhuman, male, organic, ds9, martok, crew_max_rarity_5","I will fight any battle. Anywhere",0, 9, 8, 8, 10, , , , 2, 2, 400, 125, 184, 450, false,"Martok",crew_portraits_cm_martok_chancellor_sm.png,martok_chancellor_crew
"Admiral Patrick",9,5, 1238,275,538,1023,124,239,0,0,0,0,0,0,495,76,143,0,0,0,19,442,212,178,112,567,413,240,318,0,1239,0,1113,0,946,19,324,120,152,81,830,583,497,489,0,1299,0,1159,0,992,372,347,"Human, Engineered, Federation, Civilian, Costumed, Crafty","male, organic, ds9, patrick, crew_max_rarity_5","That's A Stupid Question",1, 9, 8, 10, 10, , , , , , 500, 100, 155, 375, false,"Patrick",crew_portraits_cm_patrick_admiral_sm.png,patrick_admiral_crew
"Christine Chapel",9,4, 0,0,0,559,70,170,0,0,0,0,0,0,349,103,201,790,127,280,1009,0,0,1258,589,987,717,677,116,0,1298,589,1176,394,317,1143,0,0,1086,627,1111,822,561,198,0,1136,624,972,415,211,1212,1181,"Federation, Starfleet, Human, Physician, Veteran, Nurse, Romantic","female, organic, tos, chapel, crew_max_rarity_4","Don't You Recognise Me?",1, 7, 8, 12, 12, 5, 0, , , , 1400, 185, 120, 400, false,"Chapel",crew_portraits_cm_chapel_christine_sm.png,chapel_christine_crew
"Brainless Spock",7,2, 0,0,0,223,43,138,0,0,0,360,51,179,0,0,0,0,0,0,1329,0,1153,0,0,1329,637,1317,839,1086,0,0,1211,734,0,1266,0,1103,0,0,1253,521,1247,804,1009,0,0,1124,690,0,1551,1528,"Federation, Starfleet, Exobiology, Astrophysicist, Human, Musician, Vulcan, Telepath","nonhuman, male, organic, tos, spock, crew_max_rarity_2","A Practical Idea",2, 3, 8, 10, 8, , , , , , 460, 150, 163, 390, false,"Spock",crew_portraits_cm_spock_brainless_sm.png,spock_brainless_crew
"Garth of Izar",6,5, 1214,226,444,0,0,0,989,156,344,0,0,0,487,83,142,0,0,0,317,76,278,214,181,501,0,1137,0,458,257,334,1117,0,953,280,84,242,236,176,552,0,1150,0,521,352,422,1143,0,973,454,334,"Prisoner, Desperate, Human, Brutal, Resourceful, Villain, Shapeshifter, Veteran, Explorer, Innovator, Federation","organic, male, tos, garth_izar, crew_max_rarity_5","I'm Afraid of No One",0, 8, 6, 8, 10, 1, 0, 2, , , 300, 200, 185, 225, false,"Garth",crew_portraits_cm_garth_izar_sm.png,garth_izar_crew
"Seeking Spock",8,5, 0,0,0,1257,183,448,0,0,0,0,0,0,430,132,295,931,170,326,294,0,0,1168,464,318,256,127,22,0,1205,471,1050,295,122,370,0,0,900,441,355,274,77,28,0,946,453,729,265,101,492,195,"Vulcan, Human, Telepath, Spiritual, Starfleet, Federation, Resourceful, Explorer","nonhuman, male, organic, tos, spock, crew_max_rarity_5","Recommend We Proceed",1, 9, 10, 12, 12, , , , , , 550, 200, 175, 225, false,"Spock",crew_portraits_cm_spock_seeking_sm.png,spock_seeking_crew
"Compromised Airiam",9,5, 0,0,0,940,178,397,1254,198,420,0,0,0,0,0,0,0,0,0,557,482,0,0,0,20,404,608,308,303,495,195,0,0,0,474,530,0,0,0,24,335,512,276,343,527,239,0,0,0,760,771,"Control, Federation, Starfleet, Brutal, Undercover Operative, Human, Engineered, Astrophysicist","evsuit, female, organic, dsc, airiam, crew_max_rarity_5","Open The Airlock",0, 9, 8, 8, 10, , , , 2, 2, 555, 125, 285, 400, false,"Airiam",crew_portraits_cm_airiam_compromised_sm.png,dsc_airiam_compromised_crew
"Lt. Uhura",6,3, 384,51,129,0,0,0,0,0,0,0,0,0,539,76,178,0,0,0,1223,1191,1154,838,1043,0,0,1025,0,0,1169,0,1002,0,838,1260,1221,1187,884,1079,0,0,1100,0,0,1227,0,1074,0,917,1477,1517,"Human, Starfleet, Federation, Musician, Communicator","female, organic, tos, uhura, crew_max_rarity_3","Hailing Frequencies Open",1, 5, 6, 10, 12, , , , , , 300, 50, 71, 190, false,"Uhura",crew_portraits_cm_uhura_lt_yellow_sm.png,uhura_lt_yellow_crew
"Rescue Team Uhura",7,5, 984,179,361,0,0,0,1313,166,410,0,0,0,456,113,208,0,0,0,531,52,465,321,354,264,0,1115,0,271,126,155,1101,0,932,498,106,429,272,347,434,0,977,0,407,196,311,931,0,786,307,272,"Human, Federation, Starfleet, Communicator, Resourceful, Musician, Marksman","female, organic, tos, tas, uhura, crew_max_rarity_5","Phasers on Setting One. Fire.",2, 7, 6, 3, 8, 7, 0, , , , 540, 225, 68, 150, false,"Uhura",crew_portraits_cm_uhura_rescue_sm.png,uhura_rescue_crew
"Sulu of the Body",9,4, 612,111,266,0,0,0,0,0,0,0,0,0,910,153,301,0,0,0,884,930,825,286,709,0,0,718,0,0,875,0,657,0,545,816,881,755,306,654,0,0,736,0,0,877,0,667,0,566,1304,1287,"Human, Federation, Starfleet, Diplomat, Pilot, Archon","male, organic, tos, sulu, crew_max_rarity_4","Paradise, My Friend, Paradise",1, 6, 8, 8, 12, 6, 0, , , , 615, 270, 168, 475, false,"Sulu",crew_portraits_cm_sulu_archon_sm.png,sulu_archon_crew
"Lenara Kahn",10,5, 0,0,0,1246,187,421,0,0,0,0,0,0,997,144,301,0,0,0,315,0,0,760,0,335,266,51,184,0,757,0,531,0,447,422,0,0,876,0,401,301,80,238,0,909,0,692,0,598,770,1008,"Trill, Astrophysicist, Romantic","nonhuman, female, organic, ds9, lenara, crew_max_rarity_5","I'm Not Like You",1, 10, 8, 8, 8, , , , , , 315, 200, 150, 490, false,"Lenara",crew_portraits_cm_lenara_kahn_sm.png,lenara_kahn_crew
"Torpedo Surgeon McCoy",9,5, 0,0,0,893,148,332,0,0,0,593,29,70,0,0,0,1254,142,484,679,0,1015,0,178,665,157,730,25,963,0,211,1046,20,282,646,0,1272,0,239,615,332,683,31,1162,0,247,1316,70,298,559,770,"Federation, Starfleet, Human, Physician, Exobiology, Desperate, Jury Rigger","male, organic, tos, mccoy, crew_max_rarity_5","Lock and Load",2, 8, 4, 6, 8, 1, 0, , , , 300, 230, 86, 250, true,"McCoy",crew_portraits_cm_mccoy_torpedo_sm.png,mccoy_torpedo_crew
"Scared Scotty",9,4, 0,0,0,0,0,0,381,89,175,871,114,238,639,59,128,0,0,0,0,1155,674,1071,0,1170,538,955,0,309,724,941,161,363,776,0,1061,808,1307,0,1026,585,1231,0,344,871,860,487,466,1048,1088,1311,"Human, Starfleet, Federation, Jury Rigger, Desperate","male, organic, tos, scott, crew_max_rarity_4","I Don't Remember",1, 5, 12, 10, 12, 0, 1, , , , 370, 145, 17, 250, false,"Scotty",crew_portraits_cm_scotty_scared_sm.png,scott_scared_crew
"Talas",9,5, 510,73,159,0,0,0,958,151,327,1273,208,375,0,0,0,0,0,0,1107,313,67,1192,930,548,260,0,0,38,778,387,317,104,0,1144,420,118,1214,978,594,311,0,0,42,788,463,414,175,0,463,538,"Andorian, Imperial Guard, Saboteur, Romantic, Tactician, Crafty","nonhuman, female, organic, ent, talas, crew_max_rarity_5","It's Not The Weapon, It's The Soldier",2, 6, 10, 10, 18, 2, 0, , , , 1475, 200, 115, 415, false,"Talas",crew_portraits_cm_talas_sm.png,talas_crew
"EV Suit Chekov",7,4, 379,58,169,661,62,141,0,0,0,0,0,0,925,129,248,0,0,0,526,1175,1129,491,1017,881,648,212,523,0,888,0,678,0,557,744,1138,1110,613,993,1214,906,498,762,0,1018,0,818,0,701,1019,1317,"Federation, Starfleet, Human, Resourceful, Tactician","male, evsuit, organic, tos, chekov, crew_max_rarity_4","We've Got To Get Out Of Here",1, 7, 14, 12, 14, 5, 0, , , , 380, 50, 70, 400, false,"Chekov",crew_portraits_cm_chekov_evsuit_sm.png,chekov_evsuit_crew
"Laborer Kirk",6,5, 1013,107,294,0,0,0,0,0,0,1292,210,476,496,65,151,0,0,0,567,679,12,351,391,0,217,1133,0,262,1240,0,71,67,947,779,850,22,584,622,0,205,1171,0,257,1310,0,90,85,998,376,516,"Human, Federation, Starfleet, Jury Rigger, Resourceful, Romantic, Thief, Desperate","male, organic, tos, kirk, crew_max_rarity_5","How Are The Stone Knives And Bearskins?",2, 7, 8, 8, 12, 2, 0, , , , 200, 200, 147, 375, false,"Kirk",crew_portraits_cm_kirk_laborer_sm.png,kirk_laborer_crew
"Dress Uniform Beverly Crusher",10,4, 0,0,0,0,0,0,0,0,0,0,0,0,611,73,245,810,172,428,0,0,0,1046,524,0,0,925,402,0,1085,523,895,343,102,0,0,0,1065,295,0,0,979,243,0,1110,301,937,169,102,1335,1224,"Human, Starfleet, Federation, Physician, Caregiver, Cyberneticist","female, organic, tng, crusher, crew_max_rarity_4","The Bride and Groom",2, 8, 10, 6, 12, , , , , , 400, 195, 217, 415, false,"Crusher",crew_portraits_cm_crusher_dress_uniform_sm.png,crusher_dress_uniform_crew
"Ishan Chaye Sisko",7,5, 0,0,0,0,0,0,496,93,293,1284,247,490,987,120,226,0,0,0,0,1020,203,816,0,963,197,689,0,73,252,776,29,56,520,0,871,174,1024,0,768,170,935,0,29,347,644,37,61,753,292,238,"Bajoran, Resourceful, Desperate, Undercover Operative, Civilian, Investigator","male, organic, ds9, sisko, crew_max_rarity_5","We're Not Who We Seem To Be",1, 9, 6, 10, 10, , , , , , 200, 220, 160, 380, false,"Sisko",crew_portraits_cm_sisko_ishan_chaye_sm.png,sisko_ishan_chaye_crew
"Saowin",10,4, 0,0,0,874,171,371,0,0,0,671,94,219,0,0,0,0,0,0,670,0,785,0,0,657,119,720,373,762,0,0,862,450,0,519,0,896,0,0,509,120,578,303,850,0,0,938,530,0,1296,1272,"Desperate, Resourceful, Ambassador, Civilian","male, organic, nonhuman, voy, saowin, crew_max_rarity_4","I Have Some Bad News",1, 7, 6, 8, 10, 3, 0, 2, , , 400, 50, 96, 474, false,"Saowin",crew_portraits_cm_saowin_sm.png,saowin_crew
"Dejaren",5,4, 566,157,355,380,54,148,877,159,388,0,0,0,0,0,0,0,0,0,482,257,797,1018,680,236,914,1221,770,577,857,468,0,0,0,241,139,471,722,389,197,910,1208,765,456,675,350,0,0,0,956,631,"Brutal, Hologram, Crafty, Desperate, Saboteur","male, artificial_life, nonhuman, voy, dejaren, crew_max_rarity_4","You're Getting Blood Everywhere",0, 7, 6, 8, 12, 1, 0, , , , 140, 125, 137, 300, false,"Dejaren",crew_portraits_cm_dejaren_sm.png,dejaren_crew
"Dr. 'Bones' McCoy",7,5, 0,0,0,0,0,0,0,0,0,0,0,0,0,0,0,1641,98,360,0,0,0,0,45,0,0,0,85,0,0,56,0,30,105,0,0,0,0,535,0,0,0,391,0,0,540,0,348,562,1339,1506,"Federation, Starfleet, Human, Physician, Resourceful, Exobiology","male, organic, tos, mccoy, crew_max_rarity_5","I'm A Doctor!",2, 8, 6, 10, 14, 3, 0, 3, , , 700, 325, 291, 325, false,"McCoy",crew_portraits_cm_mccoy_doctor_sm.png,mccoy_doctor_crew
"Arandis",9,4, 649,82,207,0,0,0,0,0,0,0,0,0,936,85,208,0,0,0,891,936,831,312,715,0,0,757,0,0,912,0,702,0,575,1000,1034,964,649,847,0,0,1043,0,0,1163,0,998,0,852,1328,1450,"Resourceful, Inspiring, Communicator, Civilian, Romantic, Risian, Playful","female, nonhuman, organic, ds9, arandis, crew_max_rarity_4","Risa Will Be Waiting",1, 5, 4, 8, 12, 3, 0, 3, , , 405, 50, 33, 440, true,"Arandis",crew_portraits_cm_arandis_sm.png,arandis_crew
"Captain Lucero",7,4, 661,108,235,858,172,324,0,0,0,0,0,0,352,80,162,0,0,0,134,905,779,687,661,693,513,382,393,0,1325,0,1209,0,1047,141,932,833,644,724,586,398,280,343,0,1252,0,1100,0,942,989,936,"Human, Federation, Starfleet, Tribbled, Survivalist, Explorer, Resourceful","female, organic, dsc, lucero, crew_max_rarity_4","He's an Idiot",2, 8, 6, 8, 10, 5, 0, , , , 525, 200, 110, 390, false,"Lucero",crew_portraits_cm_lucero_captain_sm.png,dsc_lucero_captain_crew
"Admiral Maxwell Forrest",9,5, 1256,220,470,0,0,0,0,0,0,430,102,236,1002,151,312,0,0,0,269,468,65,62,132,0,847,590,0,1006,741,0,157,678,435,258,436,39,77,160,0,609,709,0,806,837,0,148,489,537,413,220,"Human, Diplomat, Starfleet, Ambassador","male, organic, ent, forrest, crew_max_rarity_5","It's Time to Swim",1, 7, 8, 8, 14, 2, 0, , , , 405, 320, 100, 425, false,"Forrest",crew_portraits_cm_forrest_admiral_sm.png,forrest_admiral_crew
"Belle Q",9,5, 982,98,243,452,75,166,0,0,0,0,0,0,1286,210,438,0,0,0,194,758,595,83,474,1141,861,131,718,0,455,0,257,0,211,457,938,837,190,730,1108,818,158,678,0,488,0,313,0,265,543,704,"Q Continuum, Costumed, Romantic, Resourceful, Crafty","female, organic, tng, nonhuman, miss_q, crew_max_rarity_5","They're Using Our Weapons",0, 9, 8, 8, 10, , , , , , 400, 320, 211, 390, false,"Q",crew_portraits_cm_miss_q_civil_war_sm.png,miss_q_civil_war_crew
"Mycelial Culber",7,5, 449,93,303,869,198,423,0,0,0,0,0,0,0,0,0,1291,237,550,170,1086,1017,1165,11,624,461,687,10,0,0,125,0,50,181,64,856,719,932,9,375,282,439,7,0,0,123,0,52,164,335,78,"Human, Physician, Romantic, Federation, Starfleet, Desperate, Displaced","male, organic, dsc, culber, crew_max_rarity_5","You Have to Let Me Go",0, 9, 6, 6, 6, , , , 1, 3, 400, 200, 148, 500, false,"Culber",crew_portraits_cm_culber_mycelial_sm.png,dsc_culber_mycelial_crew
"Commander Shelby",9,4, 855,128,259,0,0,0,643,80,169,0,0,0,0,0,0,0,0,0,747,324,672,902,547,860,0,0,0,795,1078,687,0,0,0,806,502,739,947,641,1061,0,0,0,962,1228,884,0,0,0,1347,1424,"Gambler, Starfleet, Federation, Human, Tactician, Desperate, Maverick, Resourceful, Saboteur","female, organic, tng, shelby, crew_max_rarity_4","Impossible!",1, 7, 8, 10, 8, , , , , , 475, 200, 153, 325, false,"Shelby",crew_portraits_cm_shelby_commander_sm.png,shelby_commander_crew
"Tourist Worf",3,3, 533,62,160,0,0,0,386,56,160,0,0,0,0,0,0,0,0,0,1070,769,1018,1166,899,1196,0,0,0,1053,1299,964,0,0,0,1167,796,1120,1234,1004,1142,0,0,0,1035,1300,951,0,0,0,1476,1511,"Federation, Starfleet, Klingon, Saboteur, Romantic","male, nonhuman, organic, ds9, worf, crew_max_rarity_3","I Didn't Bring A Bathing Suit",1, 4, 10, 8, 10, 1, 2, , , , 25, 100, 173, 90, false,"Worf",crew_portraits_cm_worf_tourist_sm.png,worf_tourist_crew
"Control Leland",8,5, 1254,233,394,0,0,0,1067,103,198,0,0,0,658,49,86,0,0,0,301,73,266,165,163,515,0,962,0,474,207,348,932,0,782,348,220,295,380,222,937,0,1292,0,870,921,795,1277,0,1103,275,938,"Section 31, Undercover Operative, Crafty, Control, Brutal, Human, Federation, Starfleet","nonhuman, male, organic, dsc, leland, crew_max_rarity_5","Get Me That Data",0, 8, 6, 8, 10, , , , 2, 3, 265, 210, 153, 475, false,"Leland",crew_portraits_cm_leland_control_sm.png,dsc_leland_control_crew
"Leucon",8,5, 0,0,0,974,210,435,490,96,200,1268,295,448,0,0,0,0,0,0,493,1083,217,0,0,106,11,561,282,82,1199,846,239,65,0,349,1020,170,0,0,94,7,408,201,52,1144,813,204,60,0,237,123,"Civilian, Brunali, Botanist, Desperate, Jury Rigger, Geneticist","male, nonhuman, organic, voy, leucon, crew_max_rarity_5","You Can Make A Difference Here",1, 9, 8, 10, 12, , , , , , 445, 100, 140, 365, false,"Leucon",crew_portraits_cm_leucon_sm.png,leucon_crew
"Annika Hansen Seven",9,5, 565,38,88,1021,107,251,0,0,0,1303,161,317,0,0,0,0,0,0,166,1100,70,1185,921,576,29,644,325,320,0,0,334,110,0,622,1262,332,1363,1137,840,127,917,495,551,0,0,579,273,0,499,1160,"Human, Civilian, Federation, Astrophysicist, Romantic","female, organic, voy, seven, apr2023, crew_max_rarity_5","I'm Sure You'll Adapt",0, 9, 6, 6, 10, , , , , , 375, 200, 250, 400, false,"Seven",crew_portraits_cm_seven_annika_sm.png,seven_annika_crew
"Twilight T'Pol",7,5, 0,0,0,951,90,222,403,186,378,0,0,0,0,0,0,1034,240,792,701,1029,0,0,204,136,508,747,28,893,1155,31,0,119,296,963,608,0,0,34,120,666,1005,11,430,654,6,0,18,69,565,51,"Vulcan, Astrophysicist, Telepath, Caregiver, Civilian","nonhuman, female, organic, ent, tpol, crew_max_rarity_5","Target Their Engines",2, 10, 12, 10, 10, , , , 0, 2, 225, 125, 120, 250, false,"T'Pol",crew_portraits_cm_tpol_twilight_sm.png,tpol_twilight_crew
"Picard and Number One",6,5, 527,79,177,1328,234,497,0,0,0,0,0,0,967,154,330,0,0,0,65,1074,1002,319,882,171,171,32,109,0,773,0,547,0,463,75,1080,1044,415,926,228,187,24,156,0,789,0,581,0,489,248,261,"Human, Astrophysicist, Inspiring, Civilian, Cultural Figure, Federation, Gardener, Veteran","male, organic, pic, picard, crew_max_rarity_5","Old Dogs",1, 8, 6, 8, 10, 6, 0, , , , 300, 235, 130, 300, false,"Picard",crew_portraits_cm_picard_numberone_sm.png,picard_numberone_crew
"Doctor Paul Stubbs",10,4, 0,0,0,856,150,370,0,0,0,659,118,275,0,0,0,0,0,0,697,0,758,0,0,684,120,746,389,745,0,0,841,435,0,566,0,727,0,0,546,91,604,321,711,0,0,789,421,0,1297,1226,"Astrophysicist, Human, Federation, Innovator, Civilian, Prodigy","male, organic, tng, stubbs, crew_max_rarity_4","I Would Rather Die Than Leave",2, 8, 6, 8, 8, , , , 1, 2, 600, 170, 170, 225, false,"Stubbs",crew_portraits_cm_stubbs_sm.png,stubbs_crew
"Mission Specialist Lefler",9,4, 0,0,0,661,96,192,0,0,0,858,86,214,390,73,145,0,0,0,878,0,695,1257,0,836,146,546,498,686,1297,0,355,382,1014,1018,0,937,1252,0,998,319,624,601,879,1303,0,520,562,995,1086,1320,"Human, Federation, Starfleet, Romantic, Innovator, Resourceful, Tactician","female, organic, tng, lefler, crew_max_rarity_4","Always Watch Your Back",1, 6, 5, 8, 10, 3, 0, 3, , , 200, 50, 141, 325, false,"Lefler",crew_portraits_cm_lefler_robin_sm.png,lefler_robin_crew
"Mirror Burnham",4,4, 355,36,112,0,0,0,642,121,232,0,0,0,892,166,328,0,0,0,1284,639,1213,519,1106,824,0,717,0,759,208,648,656,0,544,1299,680,1228,555,1124,831,0,646,0,785,238,700,565,0,479,996,1105,"Mirror Universe, Undercover Operative, Federation, Starfleet, Civilian, Astrophysicist, Xenoanthropology, Human","female, organic, dsc, burnham, crew_max_rarity_4","The Old Michael Burnham is Dead",0, 9, 6, 10, 10, , , , , , 495, 200, 145, 440, false,"Burnham",crew_portraits_cm_burnham_mirror_sm.png,dsc_burnham_mirror_crew
"Lt. Ilia",10,4, 664,106,231,864,156,339,0,0,0,0,0,0,0,0,0,0,0,0,132,906,780,1000,662,689,511,749,392,0,0,0,0,0,0,145,942,844,1034,737,587,399,656,344,0,0,0,0,0,0,1306,1297,"Deltan, Federation, Starfleet, Romantic","female, nonhuman, organic, tos, ilia, crew_max_rarity_4","Navigational Deflectors Online",1, 8, 8, 6, 8, , , , , , 475, 200, 191, 415, false,"Ilia",crew_portraits_cm_ilia_lt_sm.png,ilia_lt_crew
"Age of Sail Worf",7,5, 962,139,356,0,0,0,1334,161,358,0,0,0,503,87,189,0,0,0,577,66,512,331,399,269,0,1060,0,274,120,160,1044,0,877,581,167,513,373,421,519,0,1062,0,496,293,396,1025,0,878,346,563,"Klingon, Tactician, Federation, Starfleet, Costumed","ageofsail, nonhuman, male, organic, tng, worf, crew_max_rarity_5","I am Prepared",1, 7, 8, 8, 10, 4, 1, , , , 380, 170, 200, 475, false,"Worf",crew_portraits_cm_worf_ageofsail_sm.png,worf_ageofsail_crew
"Arjin",9,4, 597,101,222,836,177,394,0,0,0,0,0,0,379,65,135,0,0,0,153,970,865,745,760,678,504,357,386,0,1321,0,1195,0,1035,106,965,874,713,766,460,342,255,278,0,1334,0,1200,0,1028,1045,923,"Civilian, Pilot, Astrophysicist, Trill","male, organic, ds9, nonhuman, arjin, feb2023, crew_max_rarity_4","It's... Interesting",2, 9, 8, 6, 8, , , 2, , , 350, 200, 125, 430, false,"Arjin",crew_portraits_cm_arjin_sm.png,arjin_crew
"Lt. Commander Icheb",8,5, 0,0,0,1272,207,433,471,101,151,980,141,310,0,0,0,0,0,0,282,1121,525,0,0,64,21,367,161,158,1245,892,565,251,0,358,1086,616,0,0,113,35,411,207,240,1225,879,650,333,0,469,462,"Civilian, Brunali, Borg, Astrophysicist, Prodigy, Innovator, Federation, Starfleet","male, nonhuman, organic, voy, icheb, crew_max_rarity_5","I Never Told",1, 10, 6, 10, 10, , , , , , 500, 150, 138, 415, false,"Icheb",crew_portraits_cm_icheb_lt_commander_sm.png,icheb_lt_commander_crew
"Tau",7,4, 0,0,0,342,72,156,894,130,308,0,0,0,651,109,220,0,0,0,1255,782,0,1011,0,307,950,572,800,616,218,498,867,0,728,1170,797,0,1051,0,280,845,535,704,647,315,564,913,0,777,995,1111,"Crafty, Saboteur, Criminal, Scoundrel, Resourceful","male, organic, nonhuman, voy, tau, crew_max_rarity_4","I'd Hate to Make Your Life Difficult",0, 6, 8, 10, 10, 4, 1, , , , 315, 200, 90, 300, false,"Tau",crew_portraits_cm_tau_sm.png,tau_crew
"Age of Sail Troi",6,4, 353,76,161,0,0,0,0,0,0,0,0,0,596,150,298,776,208,426,1228,1194,1160,700,182,0,0,901,412,0,1058,532,865,347,95,1135,1123,1093,482,65,0,0,760,208,0,900,234,682,128,50,1033,526,"Human, Betazoid, Costumed, Empath, Counselor, Starfleet, Federation","ageofsail, nonhuman, female, organic, tng, troi, crew_max_rarity_4","Answer Him!",0, 9, 8, 6, 10, , , , , , 400, 230, 115, 450, false,"Troi",crew_portraits_cm_troi_ageofsail_sm.png,troi_ageofsail_crew
