"Mirror Jean-Luc Picard",0,5, 1042,243,753,583,21,88,982,198,439,0,0,0,0,0,0,0,0,0,115,90,408,689,268,125,979,1255,768,543,843,381,0,0,0,40,15,67,200,44,236,1236,1521,977,397,562,261,0,0,0,506,109,"Human, Terran Empire, Starfleet, Brutal, Crafty, Maverick, Veteran, Resourceful, Duelist, Mirror Universe","male, organic, tng, picard, crew_max_rarity_5","Power Grab",1, 9, 8, 6, 12, 8, 4, , , , 750, 330, 120, 400, false,"Picard",crew_portraits_cm_picard_mirror_sm.png,picard_mirror_crew, 79.5832, 59.1111, 22.4792, 87.2311, 5, 0, 0, 19.2491
"Mirror Jadzia Dax",0,4, 0,0,0,314,67,167,958,137,274,500,118,269,0,0,0,0,0,0,1520,887,1152,0,0,341,619,1474,944,202,1029,558,1168,692,0,1381,1001,919,0,0,357,323,1327,814,228,1154,713,964,528,0,1364,1270,"Trill, Terran Rebellion, Casual, Desperate, Romantic, Mirror Universe","nonhuman, female, organic, ds9, dax, crew_max_rarity_4","It's about time you came back",1, 5, 8, 10, 12, 4, 0, , , , 800, 215, 150, 425, true,"J. Dax",crew_portraits_cm_jadzia_mirror_sm.png,dax_jadzia_mirror_crew, 54.1575, 22, 51.6161, 52.2633, 3, 0, 0, 0
"Mirror Vic Fontaine",0,4, 0,0,0,0,0,0,845,142,312,0,0,0,483,180,379,0,0,0,0,966,0,1260,0,842,0,1091,0,788,298,637,1082,0,899,0,924,0,835,0,774,0,643,0,748,149,616,591,0,471,1602,1334,"Desperate, Human, Survivalist, Artist, Musician, Marksman, Mirror Universe, Terran Rebellion","male, nonhuman, artificial_life, ds9, vicfontaine, crew_max_rarity_4","I'll See You In Hell First!",2, 8, 8, 8, 10, , , , , , 605, 245, 167, 425, false,"Vic",crew_portraits_cm_vicfontaine_mirror_sm.png,vic_mirror_crew, 40.8135, 31.5556, 11.2725, 43.0785, 4, 0, 0, 41.4063
"Mirror Data",0,5, 0,0,0,598,45,121,967,143,292,1141,163,367,0,0,0,0,0,0,1206,851,450,0,0,142,111,1175,686,68,996,513,502,181,0,1517,967,584,0,0,463,241,1466,949,102,1109,680,618,271,0,789,1028,"Mirror Universe, Android, Terran Empire, Starfleet, Resourceful, Saboteur","nonhuman, male, artificial_life, data, crew_max_rarity_5","Explosive Decompression Achieved",0, 8, 10, 10, 12, 5, 0, , , , 555, 100, 171, 400, false,"Data",crew_portraits_cm_data_mirror_sm.png,data_mirror_crew, 82.6087, 45.5556, 81.4168, 77.5392, 4, 0, 0, 39.9957
"Temporal Agent Daniels",0,5, 508,39,117,1238,118,376,0,0,0,947,116,230,0,0,0,0,0,0,125,1342,264,1451,1160,433,54,542,249,754,0,0,844,417,0,405,1464,643,1576,1313,679,148,778,410,953,0,0,1050,595,0,844,1361,"Human, Starfleet, Federation, Temporal Agent, Undercover Operative","male, organic, ent, daniels, crew_max_rarity_5","Protect the Timeline",2, 9, 12, 10, 14, 7, 4, , , , 500, 360, 140, 560, false,"Daniels",crew_portraits_cm_daniels_temporal_sm.png,daniels_temporal_crew, 82.0076, 14.6667, 20.5066, 70.5533, 3, 0, 0, 0
"Jannar",0,4, 0,0,0,743,40,109,0,0,0,372,72,212,799,171,340,0,0,0,1045,0,1328,1086,0,979,410,279,579,1229,1116,0,416,872,726,1538,0,1185,888,0,1504,633,455,956,1076,859,0,211,730,523,1265,1437,"Counselor, Diplomat, Xindi, Investigator","male, nonhuman, organic, ent, jannar, exclusive_voyage, crew_max_rarity_4","Better Their World Than Ours",2, 4, 6, 4, 18, 1, 0, , , , 450, 200, 55, 340, true,"Jannar",crew_portraits_cm_jannar_sm.png,jannar_crew, 58.5855, 16, 46.364, 50.26, 2, 0, 1, 39.388
"The Clown",0,4, 0,0,0,0,0,0,909,58,139,716,27,99,452,59,129,0,0,0,0,997,1026,1463,0,872,775,1351,0,222,613,671,575,601,1156,0,1423,1476,1548,0,1432,1226,1432,0,989,1195,1147,1129,978,1232,1302,1736,"Brutal, Costumed, Desperate, Scoundrel, Villain","male, artificial_life, voy, nonhuman, clown, exclusive_voyage, crew_max_rarity_4","Why Talk, When We Can Dance?",1, 9, 4, 8, 10, 3, 0, 2, , , 400, 200, 130, 355, false,"Clown",crew_portraits_cm_clown_sm.png,clown_crew, 63.6145, 27.3333, 41.0724, 52.946, 3, 0, 0, 58.8108
"Thot Gor",0,4, 688,178,406,0,0,0,350,114,223,0,0,0,544,83,168,0,0,0,948,640,888,595,715,1361,0,1184,0,1224,989,1083,1196,0,992,548,272,502,366,371,1018,0,1290,0,966,740,847,1296,0,1093,1465,974,"Breen, Diplomat, Dominion, Resourceful, Communicator","organic, nonhuman, evsuit, ds9, gor, exclusive_voyage, crew_max_rarity_4","Breen Dominance",0, 9, 10, 20, 10, , , 1, , , 775, 335, 65, 300, false,"Gor",crew_portraits_cm_thot_gor_sm.png,thot_gor_crew, 48.4873, 63.1111, 11.8105, 52.0674, 5, 0, 0, 0
"Lucien",0,4, 349,92,224,546,149,314,0,0,0,0,0,0,628,244,491,0,0,0,651,1375,1333,711,1192,1021,783,328,613,0,1165,0,942,0,768,232,1155,1080,176,932,763,558,32,452,0,396,0,281,0,212,1382,242,"Crafty, Cultural Figure, Explorer, Resourceful, Playful","male, organic, tas, nonhuman, lucien, exclusive_voyage, crew_max_rarity_4","Can't You Do Anything Right?",1, 7, 5, 8, 10, , , , , , 450, 285, 114, 590, false,"Lucien",crew_portraits_cm_lucien_sm.png,lucien_crew, 46.6239, 56.4444, 14.7807, 56.1293, 5, 0, 0, 0
"Mirror Beverly Crusher",0,5, 0,0,0,571,47,103,0,0,0,0,0,0,980,70,136,1067,225,603,1277,0,0,1059,284,1229,964,334,63,0,1087,289,859,165,43,1535,0,0,1517,99,1503,1204,1076,64,0,1560,121,1417,48,74,826,978,"Human, Starfleet, Mirror Universe, Terran Empire, Physician, Caregiver, Neurologist, Geneticist","female, organic, tng, crusher, crew_max_rarity_5","Get Back In The Fight",1, 8, 20, 12, 10, 2, 0, 1, , , 300, 115, 242, 500, false,"Crusher",crew_portraits_cm_crusher_mirror_sm.png,crusher_mirror_crew, 80.3446, 25.3333, 34.15, 74.6811, 3, 0, 0, 19.2491
"Mirror Mayweather",0,4, 416,33,101,0,0,0,853,125,268,656,82,177,0,0,0,0,0,0,1443,621,595,1520,1230,852,772,0,0,209,1120,647,1065,598,0,1545,773,909,1598,1333,898,939,0,0,368,1184,741,1265,793,0,1330,1590,"Human, Starfleet, Mirror Universe, Terran Empire, MACO, Marksman, Brutal","male, organic, ent, mayweather, crew_max_rarity_4","Clean Up This Mess",0, 9, 10, 10, 8, , , , , , 400, 265, 267, 290, false,"Mayweather",crew_portraits_cm_mayweather_mirror_sm.png,mayweather_mirror_crew, 58.7858, 22, 17.7498, 49.4131, 3, 0, 0, 39.9089
"Ripper",0,5, 0,0,0,852,195,430,1332,182,366,0,0,0,0,0,0,0,0,0,813,560,0,0,0,30,582,852,442,355,555,199,0,0,0,468,747,0,0,0,32,327,518,254,558,795,414,0,0,0,948,989,"Brutal, Desperate, Explorer, Primal, Survivalist, Tardigrade","organic, dsc, nonhuman, ripper, crew_max_rarity_5","Mycelial Mastery",1, 9, 10, 12, 12, , , , , , 675, 250, 105, 325, false,"Ripper",crew_portraits_cm_tardigrade_sm.png,dsc_tardigrade_crew, 66.7802, 34.4444, 17.4104, 64.4749, 5, 0, 0, 0
"Satan's Robot",0,5, 0,0,0,571,59,123,852,134,273,1142,176,420,0,0,0,0,0,0,1252,977,442,0,0,174,110,1210,725,72,1115,641,494,178,0,1497,1005,486,0,0,499,190,1444,933,91,1158,715,491,196,0,852,964,"Hologram, Villain, Duelist","nonhuman, male, voy, artificial_life, satans_robot, crew_max_rarity_5","Citizen Of Earth, Surrender!",1, 8, 18, 8, 10, 2, 0, 2, , , 350, 100, 190, 100, false,"Satan's Robot",crew_portraits_cm_satans_robot_sm.png,satans_robot_crew, 78.3009, 5.7778, 52.8339, 70.7186, 1, 0, 1, 62.3264
"Torchbearer Voq",0,4, 484,193,456,0,0,0,502,53,131,0,0,0,831,152,317,0,0,0,1059,671,1007,398,848,1304,0,921,0,1185,482,1041,885,0,717,382,362,354,102,218,1457,0,821,0,1288,524,1159,756,0,615,1187,712,"Klingon, Cultural Figure, Desperate, Inspiring","nonhuman, male, tyler, voq, organic, dsc, crew_max_rarity_4","Demonstration of Faith",2, 7, 12, 5, 12, 1, 0, , , , 935, 150, 214, 190, false,"Voq",crew_portraits_cm_voq_sm.png,dsc_voq_torchbearer_crew, 55.7804, 42.2222, 53.2562, 59.4645, 4, 0, 0, 0
"Florist Q",0,3, 0,0,0,293,71,221,0,0,0,0,0,0,536,88,198,0,0,0,1514,0,0,1340,0,1486,1202,886,942,0,1375,0,1179,0,973,1214,0,0,1350,0,1161,876,612,702,0,1391,0,1210,0,1025,1738,1713,"Crafty, Scoundrel, Costumed, Romantic, Q Continuum, Playful, Cosmic","male, nonhuman, tng, q_jdl, crew_max_rarity_3","Special Delivery",2, 3, 8, 3, 8, 1, 1, , , , 855, 155, 125, 380, false,"Q",crew_portraits_cm_q_florist_sm.png,q_florist_crew, 25.4458, 36.4444, 19.9526, 36.2463, 5, 0, 0, 17.73
"Prisoner Michael Burnham",0,2, 0,0,0,380,30,142,262,20,53,0,0,0,121,42,104,0,0,0,1475,1496,0,1647,0,1026,1154,1216,922,1355,1545,1222,1568,0,1342,1509,1514,0,1590,0,1279,1185,1148,940,1367,1535,1237,1498,0,1280,1779,1797,"Federation, Starfleet, Prisoner, Xenoanthropology, Duelist, Human","female, organic, dsc, burnham, crew_max_rarity_2","Improvised Assault",2, 3, 6, 10, 10, , , , , , 190, 220, 93, 260, false,"Burnham",crew_portraits_cm_burnham_prisoner_sm.png,dsc_burnham_prisoner_crew, 23.342, 10.4444, 11.8193, 27.0084, 2, 0, 0, 39.9523
"Graduation Michael Burnham",0,4, 0,0,0,884,180,497,0,0,0,694,65,178,0,0,0,0,0,0,713,0,987,0,0,650,123,771,393,920,0,0,1047,570,0,365,0,1291,0,0,320,106,437,210,1161,0,0,1306,831,0,1532,1474,"Federation, Civilian, Astrophysicist, Xenoanthropology, Human, Festive","female, organic, dsc, burnham, crew_max_rarity_4","Lofty Expectations",2, 9, 8, 8, 10, , , 2, , , 500, 100, 280, 200, false,"Burnham",crew_portraits_cm_burnham_vulcan_graduate_sm.png,dsc_burnham_graduation_crew, 48.0665, 12.8889, 7.6088, 40.9448, 2, 0, 0, 39.6484
"Tourist Quark",0,4, 325,45,113,0,0,0,0,0,0,0,0,0,810,168,393,637,109,244,1538,1474,1464,708,488,0,0,901,584,0,1091,776,865,573,112,1520,1461,1437,529,484,0,0,638,588,0,785,823,583,590,113,1341,1156,"Ferengi, Scoundrel, Desperate, Romantic, Gambler, Communicator, Civilian","nonhuman, male, organic, ds9, quark, crew_max_rarity_4","Risan Rituals",0, 6, 12, 8, 20, 2, 0, , , , 400, 100, 165, 665, false,"Quark",crew_portraits_cm_quark_jamaharon_sm.png,quark_risa_crew, 54.418, 34.6667, 64.266, 57.9696, 3, 0, 0, 17.73
"Mariachi Q",0,5, 0,0,0,0,0,0,957,170,361,0,0,0,1110,257,537,0,0,0,0,802,0,701,0,637,0,530,0,606,55,440,459,0,371,0,770,0,436,0,584,0,277,0,585,37,444,216,0,180,957,662,"Crafty, Costumed, Scoundrel, Musician, Q Continuum, Playful, Festive, Cosmic","nonhuman, male, tng, q_jdl, crew_max_rarity_5","I Feel Like Celebrating!",1, 8, 8, 10, 10, 3, 0, 2, , , 450, 75, 105, 665, false,"Q",crew_portraits_cm_q_mariachi_sm.png,q_mariachi_crew, 63.5744, 45.3333, 42.2939, 64.9085, 6, 0, 1, 17.73
"Vengeful L'Rell",0,5, 0,0,0,0,0,0,1047,132,230,0,0,0,1118,190,380,0,0,0,0,793,0,752,0,622,0,568,0,594,73,429,497,0,397,0,1079,0,821,0,951,0,624,0,909,201,787,573,0,460,977,1455,"Klingon, Brutal, Villain, Interrogator, Vengeful","nonhuman, organic, female, dsc, lrell, crew_max_rarity_5","Choose Your Pain",0, 10, 10, 14, 12, , , 2, , , 575, 225, 58, 525, false,"L'Rell",crew_portraits_cm_lrell_sm.png,dsc_lrell_mekleth_crew, 66.5999, 28.2222, 14.1024, 59.2764, 4, 0, 0, 40.6901
"Gladiator McCoy",0,5, 0,0,0,0,0,0,1246,180,362,0,0,0,0,0,0,759,270,675,0,635,0,0,489,409,0,0,388,411,647,13,0,316,580,0,754,0,0,55,568,0,0,75,570,806,8,0,24,104,955,265,"Federation, Starfleet, Human, Physician, Desperate, Duelist, Athlete, Prisoner","male, organic, tos, mccoy, crew_max_rarity_5","Let The Games Begin!",0, 9, 6, 8, 12, , , , , , 615, 140, 100, 530, false,"McCoy",crew_portraits_cm_mccoy_gladiator_sm.png,mccoy_gladiator_crew, 61.4506, 14.4444, 16.7563, 66.3966, 2, 0, 0, 21.3976
"Duelist Yar",0,4, 407,16,37,0,0,0,657,292,603,0,0,0,474,103,336,0,0,0,1510,629,1436,1038,1301,825,0,1152,0,776,326,614,1161,0,957,1588,255,1523,931,1382,132,0,937,0,148,35,96,873,0,742,1421,461,"Human, Starfleet, Duelist, Federation, Tactician, Desperate, Survivalist, Athlete","female, organic, tng, yar, crew_max_rarity_4","Impressive Skill",1, 6, 10, 6, 12, 7, 1, , , , 580, 265, 187, 200, false,"Yar",crew_portraits_cm_yar_glavin_duel_sm.png,yar_glavin_crew, 47.1649, 17.1111, 26.2604, 49.7928, 2, 0, 0, 0
"Tsunkatse Seven",0,4, 679,124,299,282,92,230,850,150,301,0,0,0,0,0,0,0,0,0,574,329,915,1133,739,414,1200,1469,940,786,1102,632,0,0,0,256,318,845,1090,710,218,789,1144,640,768,1050,638,0,0,0,1245,947,"Human, Borg, Brutal, Duelist, Athlete, Federation, Civilian, Prisoner","nonhuman, female, organic, voy, seven, crew_max_rarity_4","Hunt It Down And Kill It",0, 8, 8, 6, 6, , , , , , 400, 200, 110, 525, false,"Seven",crew_portraits_cm_seven_tsunkatse_sm.png,seven_tsunkatse_crew, 55.3396, 24.2222, 16.4624, 54.2337, 4, 0, 0, 21.3976
"EV Suit Archer",0,5, 1210,141,431,0,0,0,882,139,296,527,20,53,0,0,0,0,0,0,445,161,121,709,277,815,1061,0,0,272,1082,606,1369,859,0,577,213,359,800,390,846,1250,0,0,616,1110,681,1567,999,0,851,1113,"Human, Starfleet, Pilot, Explorer, Desperate, Jury Rigger, Hero","male, evsuit, organic, ent, archer, crew_max_rarity_5","Now You See Me...",0, 7, 8, 10, 10, , , , , , 575, 225, 189, 290, false,"Archer",crew_portraits_cm_archer_ev_suit_sm.png,archer_ev_suit_crew, 79.9239, 25.5556, 17.9604, 71.0336, 4, 0, 0, 40.8854
"Dr. Gillian Taylor",0,4, 0,0,0,636,236,501,0,0,0,0,0,0,302,71,161,447,187,471,942,0,0,1584,892,887,676,574,118,0,1615,819,1500,612,628,279,0,0,1462,226,258,217,153,9,0,1505,226,1351,118,125,1459,180,"Federation, Starfleet, Human, Physician","female, organic, tos, gillian, crew_max_rarity_4","Sea Shepherd",1, 9, 6, 6, 12, , , 3, , , 650, 230, 95, 500, false,"Dr. Taylor",crew_portraits_cm_taylor_sm.png,gillian_taylor_crew, 42.3963, 8.8889, 6.533, 44.9285, 1, 0, 0, 0
"Protomorphosis Barclay",0,5, 0,0,0,1169,233,453,488,101,203,1125,43,112,0,0,0,0,0,0,443,1295,669,0,0,83,42,534,247,206,1435,994,717,326,0,349,1195,1446,0,0,87,151,422,204,711,1338,917,1483,962,0,701,1024,"Starfleet, Federation, Innovator, Astrophysicist, Desperate, Primal, Human, Compromised","male, organic, tng, barclay, crew_max_rarity_5","Viral Attack",0, 8, 10, 12, 10, , , , , , 575, 300, 70, 225, false,"Barclay",crew_portraits_cm_barclay_protomorphosis_sm.png,barclay_genesis_crew, 84.8327, 17.3333, 18.9981, 77.4136, 3, 0, 0, 21.0938
"Captain Lorian",0,5, 835,157,390,0,0,0,450,136,284,1259,159,399,0,0,0,0,0,0,862,417,39,1052,631,1203,321,0,0,117,1409,963,441,142,0,605,236,30,836,412,863,408,0,0,100,1142,705,578,244,0,758,218,"Vulcan, Human, Jury Rigger, Desperate, Saboteur, Telepath","male, nonhuman, organic, ent, lorian, crew_max_rarity_5","There's Too Much At Stake",1, 10, 18, 6, 6, 4, 0, , , , 600, 245, 60, 300, false,"Lorian",crew_portraits_cm_lorian_sm.png,lorian_captain_crew, 77.5796, 30.2222, 64.6442, 78.7446, 4, 0, 0, 18.4028
"Celebratory Ash Tyler",0,4, 649,99,164,0,0,0,484,23,45,0,0,0,814,155,322,0,0,0,1081,751,1028,418,875,1355,0,933,0,1220,592,1078,895,0,728,1263,1130,1229,501,1075,1561,0,796,0,1369,807,1239,727,0,590,1291,1566,"Human, Federation, Starfleet, Tactician, Marksman, Pilot, Romantic, Klingon, Festive","male, organic, dsc, tyler, voq, crew_max_rarity_4","I'm not going anywhere",0, 7, 10, 10, 10, 4, 2, , , , 450, 50, 123, 540, false,"Tyler",crew_portraits_cm_dsc_tyler_celebration_sm.png,dsc_tyler_celebration_crew, 59.7275, 21.3333, 19.4072, 49.8402, 3, 0, 1, 40.4514
"Dress Uniform Scotty",0,5, 852,199,458,0,0,0,0,0,0,1274,120,336,0,0,0,0,0,0,768,877,37,991,552,0,333,0,0,424,0,0,465,156,0,369,549,27,612,212,0,545,0,0,721,0,0,781,392,0,967,1040,"Human, Starfleet, Federation, Jury Rigger, Communicator, Festive","male, organic, tos, scott, crew_max_rarity_5","Call me Scotty",1, 8, 15, 12, 20, 2, 0, , 2, 2, 425, 330, 315, 415, false,"Scotty",crew_portraits_cm_scott_dress_uniform_sm.png,scott_dress_uniform_crew, 64.7365, 34.4444, 79.7019, 63.9761, 3, 1, 0, 0
"Lieutenant Tarah",0,4, 0,0,0,0,0,0,885,133,310,0,0,0,439,219,445,0,0,0,0,944,0,1256,0,808,0,1085,0,762,281,601,1078,0,894,0,954,0,626,0,827,0,450,0,788,92,667,368,0,275,1591,1086,"Andorian, Imperial Guard, Saboteur, Brutal, Marksman","nonhuman, female, organic, ent, tarah, crew_max_rarity_4","I'll See To It Myself",0, 8, 4, 8, 14, , , , 2, 2, 725, 200, 115, 445, false,"Tarah",crew_portraits_cm_tarah_lieutenant_sm.png,tarah_lieutenant_crew, 40.6732, 25.5556, 14.0584, 42.0687, 4, 0, 0, 20.6597
"Prisoner Katrina Cornwell",0,5, 0,0,0,0,0,0,594,52,118,0,0,0,1049,129,286,1186,163,481,0,1236,0,894,273,1150,0,709,244,1066,248,40,637,152,28,0,1452,0,1114,252,1479,0,976,226,1300,747,130,924,132,63,527,909,"Starfleet, Federation, Counselor, Human, Desperate, Diplomat, Prisoner","female, organic, dsc, cornwell, crew_max_rarity_5","Why Should I Trust You?",2, 9, 8, 5, 14, 8, 4, , , , 525, 230, 165, 425, false,"Cornwell",crew_portraits_cm_dsc_cornwell_prisoner_sm.png,dsc_cornwell_prisoner_crew, 86.9365, 15.7778, 19.7412, 79.1848, 2, 0, 0, 41.3411
"Away Team Saru",0,5, 543,30,110,1195,155,397,1087,74,149,0,0,0,0,0,0,0,0,0,122,388,1287,1440,1141,36,340,551,258,618,954,458,0,0,0,335,1066,1465,1593,1328,220,425,665,346,1214,1519,1081,0,0,0,773,1479,"Kelpien, Federation, Starfleet, Exobiology, Explorer, Desperate, Communicator","male, nonhuman, organic, dsc, saru, crew_max_rarity_5","A Moment Without Fear",0, 9, 8, 8, 10, , , , , , 475, , 150, 600, false,"Saru",crew_portraits_cm_saru_away_team_sm.png,dsc_saru_away_team_crew, 86.2352, 40.8889, 19.4421, 75.4626, 4, 0, 0, 0
"Expedition Shran",0,3, 251,17,65,0,0,0,362,97,209,0,0,0,552,87,179,0,0,0,1573,1095,1502,1115,1363,1365,0,1159,0,1226,963,1086,1169,0,962,1579,1030,1513,1227,1374,1092,0,1247,0,1025,768,908,1251,0,1051,1683,1671,"Andorian, Tactician, Survivalist, Explorer, Investigator, Imperial Guard","nonhuman, male, organic, ent, shran, crew_max_rarity_3","Ice Forges Real Strength",0, 4, 8, 8, 8, 4, 1, , , , 420, 240, 80, 470, false,"Shran",crew_portraits_cm_shran_subzero_sm.png,shran_expedition_crew, 35.7844, 31.7778, 23.2229, 36.2759, 5, 0, 0, 19.4444
"Commander Thelin",0,4, 594,102,243,837,96,217,222,135,295,0,0,0,0,0,0,0,0,0,234,837,1042,1253,893,463,674,975,522,1313,1604,1173,0,0,0,381,437,1022,1224,873,244,810,1160,658,805,1122,690,0,0,0,1447,1114,"Andorian, Tactician, Explorer, Starfleet, Federation","nonhuman, male, organic, tas, thelin, crew_max_rarity_4","Target Acquired",2, 7, 10, 8, 12, 7, 0, , , , 500, 145, 70, 475, false,"Thelin",crew_portraits_cm_thelin_sm.png,thelin_crew, 50.3907, 16.6667, 52.434, 49.323, 3, 0, 0, 0
"Ambassador Shras",0,4, 638,76,189,0,0,0,372,52,110,0,0,0,929,55,112,0,0,0,1091,801,1038,455,885,1471,0,952,0,1287,670,1154,914,0,746,1250,975,1216,1082,1063,1491,0,1460,0,1310,1290,1182,1470,0,1256,1391,1704,"Andorian, Communicator, Federation, Diplomat, Civilian, Ambassador","nonhuman, male, organic, tos, shras, crew_max_rarity_4","We Are A Violent Race",0, 9, 8, 10, 10, , , , , , 650, 195, 140, 375, false,"Shras",crew_portraits_cm_shras_sm.png,shras_ambassador_crew, 59.5071, 32.6667, 17.2872, 45.4041, 3, 0, 0, 19.9002
"Desert Michael Burnham",0,2, 0,0,0,355,78,204,0,0,0,0,0,0,275,24,77,0,0,0,1433,0,0,1609,0,1418,1105,1057,883,0,1634,0,1531,0,1307,1231,0,0,1630,0,1179,894,1023,716,0,1653,0,1544,0,1318,1800,1799,"Federation, Starfleet, Explorer, Xenoanthropology, Human","female, organic, dsc, burnham, crew_max_rarity_2","A Storm is Coming",1, 4, 10, 10, 12, , , , , , 290, 150, 60, 165, false,"Burnham",crew_portraits_cm_burnham_desert_sm.png,dsc_burnham_desert_crew, 19.3148, 16, 5.5714, 22.2229, 3, 0, 0, 18.5547
"Prospect Michael Burnham",0,4, 0,0,0,839,137,382,0,0,0,661,50,143,334,86,174,0,0,0,879,0,1050,1551,0,830,166,493,483,964,1574,0,689,615,1241,684,0,1407,1405,0,620,238,300,374,1279,1436,0,824,936,1073,1338,1412,"Federation, Civilian, Astrophysicist, Xenoanthropology, Human","female, organic, dsc, burnham, crew_max_rarity_4","Respect Is Earned",1, 5, 8, 8, 10, 8, 4, , , , 500, 130, 150, 350, false,"Burnham",crew_portraits_cm_burnham_prospect_sm.png,dsc_burnham_prospect_crew, 55.9808, 6.8889, 18.5074, 45.3522, 1, 0, 0, 39.6484
"Suus Mahna Sarek",0,5, 0,0,0,389,55,145,1092,246,525,0,0,0,917,155,306,0,0,0,1441,647,0,1015,0,120,1113,409,892,438,74,288,797,0,655,1472,440,0,1010,0,92,1138,456,902,250,54,156,788,0,652,873,379,"Vulcan, Diplomat, Desperate, Brutal, Cultural Figure, Communicator, Federation, Telepath, Ambassador","nonhuman, male, organic, sarek, dsc, crew_max_rarity_5","This Is My Mind",1, 7, 10, 8, 12, 1, 0, 2, , , 475, 255, 170, 250, false,"Sarek",crew_portraits_cm_sarek_suus_mahna_sm.png,dsc_sarek_suus_mahna_crew, 73.6125, 66, 47.4626, 78.1899, 6, 0, 0, 38.303
"Tora Ziyal",0,5, 0,0,0,0,0,0,0,0,0,0,0,0,1147,197,429,849,192,505,0,0,0,729,527,0,0,548,408,0,680,501,483,345,38,0,0,0,699,194,0,0,507,191,0,598,199,438,98,16,972,698,"Cardassian, Bajoran, Romantic, Civilian, Artist","female, nonhuman, organic, ds9, tora, crew_max_rarity_5","Never Doubt",1, 8, 10, 10, 12, , , , , , 650, 170, 170, 490, false,"Ziyal",crew_portraits_cm_tora_ziyal_sm.png,ziyal_tora_crew, 61.4105, 16, 6.1213, 60.2726, 3, 0, 0, 0
"Commander Ellen Landry",0,4, 534,69,238,347,57,111,600,254,669,0,0,0,0,0,0,0,0,0,851,429,1158,1329,986,437,1203,1473,943,797,1124,652,0,0,0,768,78,1106,1287,956,47,1190,1461,944,132,205,82,0,0,0,1466,431,"Human, Starfleet, Federation, Tactician, Brutal, Marksman","female, organic, dsc, landry, crew_max_rarity_4","Stick to Logic",0, 8, 6, 4, 8, , , , , , 650, 345, 220, 300, false,"Landry",crew_portraits_cm_landry_sm.png,dsc_landry_commander_crew, 45.2214, 14.4444, 15.5818, 47.5676, 2, 0, 0, 20.6597
"Lissan",0,5, 876,269,542,0,0,0,0,0,0,0,0,0,1144,267,541,0,0,0,646,766,587,95,428,0,0,498,0,0,626,0,431,0,341,182,387,171,9,100,0,0,261,0,0,326,0,199,0,165,931,173,"Andorian, Aenar, Diplomat, Telepath, Civilian, Communicator","nonhuman, female, organic, ent, lissan, crew_max_rarity_5","You Have An Interesting Mind",1, 7, 10, 12, 8, 6, 2, , , , 590, 225, 65, 540, false,"Lissan",crew_portraits_cm_lissan_sm.png,lissan_crew, 61.9916, 39.5556, 11.9486, 65.3687, 4, 0, 0, 18.4028
"Time Loop Mudd",0,4, 0,0,0,0,0,0,708,31,62,711,158,379,315,125,257,0,0,0,0,1135,890,1493,0,1027,681,1381,0,239,868,822,476,492,1194,0,1502,575,1157,0,1551,426,1020,0,404,942,1228,112,267,826,1409,1323,"Human, Civilian, Scoundrel, Crafty, Smuggler, Resourceful, Survivalist, Federation, Playful","male, evsuit, organic, dsc, mudd, crew_max_rarity_4","All The Time In The World!",2, 6, 12, 10, 10, 4, 0, , , , 450, 185, 100, 475, false,"Mudd",crew_portraits_cm_harry_mudd_takeover_sm.png,dsc_mudd_takeover_crew, 53.0755, 53.7778, 51.4123, 58.752, 5, 0, 0, 37.0877
"Mirror Shukar",0,5, 0,0,0,439,102,278,1042,269,623,0,0,0,903,184,378,0,0,0,1325,644,0,977,0,89,1018,306,798,433,65,284,753,0,622,1003,301,0,831,0,26,690,172,557,150,14,97,584,0,466,768,94,"Andorian, Desperate, Veteran, Civilian, Mirror Universe","nonhuman, male, organic, dsc, shukar, crew_max_rarity_5","The Will Of Andoria",1, 7, 10, 8, 12, 7, 0, , , , 375, 195, 70, 430, false,"Shukar",crew_portraits_cm_shukar_sm.png,dsc_shukar_mirror_crew, 73.1717, 28.2222, 61.6077, 80.0762, 4, 0, 0, 0
"The Caretaker",0,5, 0,0,0,878,187,495,0,0,0,964,335,817,0,0,0,452,122,378,726,0,410,0,962,655,39,779,97,410,0,895,448,17,949,356,0,19,0,515,310,2,428,25,32,0,503,28,1,551,592,26,"Caregiver, Desperate, Explorer, Musician, Nacene, Cultural Figure, Theoretical Engineer, Cosmic","male, organic, voy, nonhuman, caretaker, gauntlet_jackpot, exclusive_gauntlet, crew_max_rarity_5","A Debt of Honor",1, 7, 6, 8, 14, 6, 0, , , , 425, 200, 113, 455, true,"The Caretaker",crew_portraits_cm_caretaker_sm.png,caretaker_crew, 69.9659, 56.2222, 55.0065, 86.3605, 7, 0, 0, 0
"Bajoran Dukat",0,4, 510,208,518,0,0,0,0,0,0,0,0,0,785,202,407,0,0,0,987,1046,926,361,751,0,0,904,0,0,1093,0,868,0,698,269,480,258,35,155,0,0,540,0,0,662,0,475,0,373,1557,574,"Cardassian, Bajoran, Brutal, Desperate, Veteran, Cultural Figure, Villain, Undercover Operative, Inspiring, Communicator, Spiritual, Vengeful","nonhuman, male, organic, ds9, dukat, crew_max_rarity_4","This Is My Destiny",0, 6, 10, 8, 10, 8, 4, , , , 580, 375, 52, 550, false,"Dukat",crew_portraits_cm_dukat_bajoran_sm.png,dukat_bajoran_crew, 39.7516, 88, 19.8551, 61.6471, 9, 0, 0, 41.4714
"Surgeon Pulaski",0,5, 0,0,0,837,190,545,0,0,0,0,0,0,0,0,0,1289,171,473,745,0,0,0,189,699,540,805,20,0,0,200,0,107,287,283,0,0,0,253,261,219,346,10,0,0,251,0,133,300,934,504,"Federation, Starfleet, Human, Physician","female, organic, tng, pulaski, crew_max_rarity_5","Emergency Procedure",1, 7, 12, 8, 12, 6, 0, , , , 700, 100, 180, 400, false,"Pulaski",crew_portraits_cm_pulaski_surgeon_sm.png,pulaski_surgeon_crew, 64.997, 8.8889, 33.2637, 64.3544, 1, 0, 0, 0
"Away Team Neelix",0,2, 0,0,0,152,6,26,0,0,0,353,24,80,187,77,240,0,0,0,1589,0,1463,1599,0,1564,1055,1369,993,1330,1630,0,1094,965,1301,1591,0,1494,1280,0,1564,1216,1093,993,1353,1316,0,907,988,941,1791,1764,"Talaxian, Mylean, Resourceful, Survivalist, Chef, Civilian, Communicator, Geologist, Ambassador","nonhuman, male, organic, voy, neelix, crew_max_rarity_2","Genuine Effort",2, 2, 8, 3, 8, 1, 0, , , , 230, 30, 20, 115, false,"Neelix",crew_portraits_cm_neelix_away_team_sm.png,neelix_away_crew, 21.1581, 68.6667, 42.1443, 60.264, 6, 0, 0, 19.9002
"Resistance Neelix",0,5, 0,0,0,0,0,0,1054,188,381,0,0,0,1154,230,570,0,0,0,0,714,0,664,0,506,0,492,0,498,27,342,427,0,336,0,724,0,426,0,526,0,268,0,527,30,393,207,0,171,916,510,"Civilian, Talaxian, Mylean, Crafty, Saboteur, Smuggler, Undercover Operative, Resourceful, Chef, Ambassador, Courier","nonhuman, male, organic, voy, neelix, crew_max_rarity_5","Vital Information",2, 8, 10, 8, 12, 4, 0, , , , 495, 195, 210, 430, false,"Neelix",crew_portraits_cm_neelix_resistance_sm.png,neelix_resistance_crew, 67.9223, 45.7778, 52.3042, 69.6943, 5, 0, 0, 39.2578
"Victorian Pulaski",0,4, 0,0,0,0,0,0,0,0,0,0,0,0,986,46,111,614,138,321,0,0,0,1070,793,0,0,912,565,0,1099,754,875,553,107,0,0,0,1579,642,0,0,1472,453,0,1614,606,1484,414,354,1571,1697,"Human, Federation, Starfleet, Physician, Costumed, Crafty","female, organic, tng, pulaski, crew_max_rarity_4","I Give You Credit",1, 6, 12, 10, 18, 2, 0, , , , 600, 315, 127, 290, false,"Pulaski",crew_portraits_cm_pulaski_victorian_sm.png,pulaski_victorian_crew, 49.2286, 23.1111, 26.8928, 40.036, 2, 0, 0, 0
"Captain Beverly Picard",0,5, 924,165,345,0,0,0,0,0,0,0,0,0,473,119,245,926,303,760,766,875,719,422,14,0,0,1220,264,0,1411,307,1238,174,85,662,787,607,313,1,0,0,1048,44,0,1228,34,1014,13,9,783,63,"Human, Starfleet, Federation, Physician, Cyberneticist","female, organic, tng, crusher, exclusive_honorhall, crew_max_rarity_5","Not On My Ship!",1, 6, 4, 6, 4, , , , , , 250, 100, 85, 500, true,"Crusher",crew_portraits_cm_crusher_captain_sm.png,crusher_captain_crew, 71.108, 8.8889, 14.0958, 78.1898, 1, 0, 0, 20.7031
