"Data and Spot",8,5, 0,0,0,1065,100,250,0,0,0,1328,171,371,538,54,152,0,0,0,564,0,261,1187,0,535,18,223,312,305,1226,0,72,93,895,918,0,443,1301,0,875,99,560,526,484,1352,0,208,218,1034,357,934,"Android, Starfleet, Federation, Cyberneticist, Caregiver, Writer","nonhuman, male, tng, artificial_life, data, exclusive_collection, crew_max_rarity_5","Oh, Spot, The Complex Levels of Behavior You Display!",2, 10, 8, 8, 12, , , , 1, 2, 650, 200, 165, 675, false,"Data",crew_portraits_cm_data_spot_sm.png,data_spot_crew
"Tendi and The Dog",8,5, 0,0,0,1314,222,424,0,0,0,508,76,146,0,0,0,1000,127,333,255,0,1090,0,394,264,79,337,7,1008,0,378,1129,34,467,352,0,1150,0,536,344,115,419,33,1046,0,540,1173,98,563,376,541,"Orion, Starfleet, Federation, Geneticist, Engineered, Shapeshifter, Playful","female, organic, low, tendi, nonhuman, crew_max_rarity_5","Who Has Malleable Protein Bonds? You Do!",0, 6, 9, 7, 8, 6, 0, , , , 165, 100, 110, 325, false,"Tendi",crew_portraits_cm_tendi_dog_sm.png,tendi_dog_crew
"Ensign Mariner",1,2, 383,80,207,0,0,0,277,58,155,0,0,0,151,29,67,0,0,0,1190,898,1122,1103,1011,1333,0,1369,0,1164,1285,1074,1360,0,1172,1032,699,992,972,871,1182,0,1355,0,1065,1142,977,1346,0,1156,1512,1475,"Federation, Starfleet, Human, Casual, Maverick, Playful","female, organic, low, mariner, crew_max_rarity_2","Boim us out of here!",2, 6, 4, 5, 10, 1, 1, , , , 500, 50, 40, 175, false,"Mariner",crew_portraits_cm_mariner_ensign_sm.png,mariner_ensign_crew
"Vindicta Mariner",1,4, 652,85,253,372,64,151,948,145,279,0,0,0,0,0,0,0,0,0,499,259,810,1029,691,226,946,1251,794,576,865,473,0,0,0,507,380,860,1055,752,338,902,1204,747,687,962,606,0,0,0,966,1157,"Starfleet, Human, Federation, Maverick, Brutal, Criminal, Costumed, Villain, Playful, Vengeful","female, organic, low, mariner, jan2024, crew_max_rarity_4","I Am Vindicta, Vengeance Personified!",0, 7, 10, 6, 8, 1, 0, , , , 400, 325, 170, 475, false,"Vindicta",crew_portraits_cm_mariner_vindicta_sm.png,mariner_vindicta_crew
"EV Suit Mariner",8,5, 1348,133,331,496,78,171,0,0,0,1079,92,236,0,0,0,0,0,0,90,495,15,523,155,1121,136,1142,703,486,0,0,528,232,0,250,754,145,819,496,1106,338,1141,677,841,0,0,932,514,0,416,1022,"Federation, Starfleet, Human, Desperate, Maverick, Resourceful, Playful","female, organic, low, mariner, evsuit, crew_max_rarity_5","Sorry! Uh, New Boots!",0, 9, 8, 6, 14, 8, 4, , , , 525, 95, 170, 475, false,"Mariner",crew_portraits_cm_mariner_evsuit_sm.png,mariner_evsuit_crew
"First Monarch Kaitaama",7,4, 663,92,235,0,0,0,0,0,0,0,0,0,950,121,312,380,67,148,879,936,807,274,314,0,0,698,785,0,867,1003,630,738,193,946,984,887,394,361,0,0,818,744,0,956,987,735,740,269,951,1173,"Kriosian, Royalty, Romantic, Ambassador, Desperate, Prisoner","nonhuman, female, organic, ent, kaitaama, crew_max_rarity_4","Is Your Entire Species So Ill Mannered?",1, 9, 3, 8, 9, , , , 2, 2, 100, 170, 120, 150, false,"Kaitaama",crew_portraits_cm_kaitaama_first_monarch_sm.png,kaitaama_crew
"Ensign Tendi",7,2, 0,0,0,258,27,86,0,0,0,154,15,41,0,0,0,403,44,161,1353,0,1320,0,1028,1354,918,1340,505,1196,0,985,1367,576,1034,1356,0,1319,0,1072,1351,990,1341,562,1197,0,1010,1364,656,1036,1545,1573,"Orion, Starfleet, Federation, Nurse, Resourceful","female, organic, nonhuman, low, tendi, crew_max_rarity_2","Did That Full Molecular Engorgement Feel Amazing?!",2, 2, 6, 6, 8, 6, 0, , , , 215, 100, 175, 25, false,"Tendi",crew_portraits_cm_tendi_ensign_sm.png,tendi_ensign_crew
"Lt. Shaxs",7,5, 834,260,575,0,0,0,956,307,715,0,0,0,475,76,248,0,0,0,553,106,486,321,369,386,0,1100,0,365,162,248,1086,0,915,139,5,113,74,72,65,0,993,0,62,29,35,946,0,796,538,29,"Bajoran, Federation, Starfleet, Brutal, Veteran, Desperate, Tactician","nonhuman, male, organic, low, shaxs, crew_max_rarity_5","Recommendation: Full Assault",0, 7, 8, 6, 12, 4, 0, , , , 350, 205, 108, 265, false,"Shaxs",crew_portraits_cm_shaxs_lt_sm.png,shaxs_lt_crew
"Captain Carol Freeman",7,4, 881,146,303,0,0,0,410,78,154,0,0,0,670,93,197,0,0,0,720,454,662,302,527,1183,0,920,0,1054,641,951,887,0,742,706,455,633,418,544,1141,0,1068,0,1025,734,941,1023,0,873,983,1164,"Starfleet, Federation, Human, Diplomat, Resourceful, Communicator","female, organic, low, freeman, crew_max_rarity_4","Warp Me",0, 9, 10, 7, 7, , , , 1, 2, 425, 300, 121, 430, false,"Freeman",crew_portraits_cm_freeman_captain_sm.png,freeman_captain_crew
"Phased Boimler",7,4, 0,0,0,0,0,0,384,50,148,657,95,199,948,142,301,0,0,0,0,1205,844,829,0,1242,643,695,0,453,419,997,127,485,526,0,1223,975,899,0,1244,710,789,0,552,507,1016,217,592,610,977,1220,"Federation, Starfleet, Human, Desperate, Inspiring","male, organic, low, boimler, crew_max_rarity_4","Its Gonna Be Great!",1, 7, 10, 10, 10, 4, 2, , , , 500, 265, 110, 675, false,"Boimler",crew_portraits_cm_phased_boimler_sm.png,phased_boimler_crew
"Ensign Boimler",6,2, 371,63,163,0,0,0,0,0,0,0,0,0,278,46,111,0,0,0,1241,1210,1163,1004,1052,0,0,1323,0,0,1415,0,1314,0,1133,1187,1166,1134,973,1014,0,0,1300,0,0,1402,0,1280,0,1104,1571,1571,"Federation, Starfleet, Human, Desperate","male, organic, low, boimler, crew_max_rarity_2","Evasive Maneuver Eighty... Eight?",1, 5, 8, 10, 8, , , , , , 450, 150, 115, 315, false,"Boimler",crew_portraits_cm_boimler_ensign_sm.png,boimler_ensign_crew
"All-in Owosekun",8,5, 1072,82,249,0,0,0,1352,112,315,0,0,0,513,83,181,0,0,0,556,65,492,316,374,305,0,1074,0,308,132,193,1063,0,890,935,386,880,650,770,735,0,1099,0,682,425,603,1072,0,911,346,1060,"Human, Federation, Starfleet, Athlete, Duelist, Gambler, Brutal, Crafty, Displaced","female, organic, dsc, owosekun, crew_max_rarity_5","I'm In. All The Way.",0, 10, 6, 8, 12, , , , , , 740, 600, 315, 540, false,"Owosekun",crew_portraits_cm_owosekun_allin_sm.png,dsc_owosekun_allin_crew
"Cowpoke Boimler",4,4, 654,102,206,0,0,0,920,209,356,0,0,0,409,73,112,0,0,0,897,247,832,691,709,555,0,1214,0,517,346,391,1199,0,1029,977,273,930,772,818,463,0,1264,0,439,335,338,1246,0,1073,892,979,"Federation, Starfleet, Human, Constable, Marksman, Costumed, Casual","male, organic, low, boimler, original, crew_max_rarity_4","This Holodeck Ain't Big Enough for the Both of Us",1, 5, 12, 9, 10, 4, 0, , , , 75, 100, 35, 75, false,"Boimler",crew_portraits_cm_boimler_cowpoke_sm.png,boimler_cowpoke_crew
"AGIMUS",3,5, 560,150,165,0,0,0,0,0,0,1354,300,356,1110,205,224,0,0,0,985,1027,41,242,804,0,179,529,0,223,665,0,9,45,382,964,1007,57,415,799,0,248,823,0,304,963,0,39,106,641,47,342,"Sentient Computer, Brutal, Crafty, Desperate, Prisoner, Resourceful, Scoundrel, Villain","nonhuman, artificial_life, low, agimus, crew_max_rarity_5","You Are Too Late, AGIMUS Reigns!",0, 10, 8, 4, 12, 1, 4, , , , 300, 400, 180, 300, false,"AGIMUS",crew_portraits_cm_agimus_sm.png,agimus_crew
"Lt. Commander Ron Docent",6,4, 691,97,246,0,0,0,401,59,204,914,166,297,0,0,0,0,0,0,846,574,94,981,643,1181,499,0,0,217,1302,949,676,319,0,909,554,135,1042,741,1050,443,0,0,231,1226,880,632,307,0,881,956,"Human, Starfleet, Federation, Desperate, Scoundrel","male, organic, low, docent, crew_max_rarity_4","Do I Need To Remind You Who My Grandmas Neighbor Was?",1, 8, 6, 10, 8, 5, 0, , , , 150, 115, 7, 1050, false,"Ron Docent",crew_portraits_cm_docent_lt_cmdr_sm.png,docent_lt_cmdr_crew
"Bullseye Kyle",7,5, 0,0,0,982,223,488,0,0,0,1310,212,410,0,0,0,567,21,91,461,0,240,0,956,456,6,542,74,289,0,892,270,16,946,268,0,313,0,1171,253,9,331,110,350,0,1086,351,69,1142,269,298,"Federation, Starfleet, Human, Marksman, Innovator, Resourceful","male, organic, tos, kyle, crew_max_rarity_5","Are you kidding?",2, 9, 6, 8, 12, 5, 0, , , , 50, , 218, 25, false,"Kyle",crew_portraits_cm_kyle_bullseye_sm.png,kyle_bullseye_crew
"Acting Captain Arex",3,5, 1337,241,501,571,102,243,1045,203,400,0,0,0,0,0,0,0,0,0,53,3,180,444,80,78,683,981,552,399,633,285,0,0,0,43,45,175,408,122,95,632,970,531,369,575,269,0,0,0,12,114,"Edosian, Starfleet, Federation, Musician, Astrophysicist, Explorer, Communicator, Merchant","male, nonhuman, organic, tas, arex, crew_max_rarity_5","We Didn't Cause This To Happen",2, 10, 6, 8, 12, , , , , , 200, 100, 90, 100, false,"Arex",crew_portraits_cm_arex_acting_captain_sm.png,arex_acting_captain_crew
"Kevin Mulkahey",8,2, 263,30,86,0,0,0,367,33,96,0,0,0,0,0,0,0,0,0,1348,991,1283,1398,1166,1299,0,0,0,1134,1388,1040,0,0,0,1350,1122,1281,1399,1164,1337,0,0,0,1162,1420,1077,0,0,0,1587,1611,"Human, Brutal, Investigator","male, organic, ds9, weyoun, crew_max_rarity_2","Damn Shame",0, 4, 8, 8, 8, , , , , , 290, 135, 33, 375, false,"Mulkahey",crew_portraits_cm_weyoun_mulkahey_sm.png,weyoun_mulkahey_crew
"Tiron",10,4, 0,0,0,0,0,0,0,0,0,670,79,156,998,170,319,0,0,0,0,0,857,754,0,0,653,600,0,811,746,0,101,495,438,0,0,1122,786,0,0,847,670,0,1023,801,0,225,698,492,1300,1406,"Serilian, Civilian, Merchant, Desperate, Scoundrel","nonhuman, male, ds9, organic, tiron, crew_max_rarity_4","I Will Ruin You",2, 6, 12, 10, 12, 4, 0, , , , 340, 200, 80, 225, false,"Tiron",crew_portraits_cm_tiron_sm.png,tiron_crew
"Judoka Kirk",7,5, 0,0,0,0,0,0,1278,240,510,497,102,211,1059,86,212,0,0,0,0,427,1034,780,0,204,786,625,0,79,24,118,153,632,469,0,390,921,1129,0,197,667,1051,0,44,106,139,376,546,856,290,396,"Human, Federation, Starfleet, Duelist, Brutal, Athlete","male, organic, tos, kirk, crew_max_rarity_5","Lesson's Over For Today",2, 9, 8, 5, 10, , , , 0, 2, 425, 100, 75, 450, false,"Kirk",crew_portraits_cm_kirk_judoka_sm.png,kirk_judoka_crew
"Mourned Morn",8,5, 0,0,0,0,0,0,959,184,263,0,0,0,1353,113,343,562,84,230,0,727,0,517,807,588,0,367,569,541,40,53,291,538,53,0,805,0,869,819,692,0,749,572,651,196,138,667,551,177,317,750,"Lurian, Courier, Civilian, Smuggler, Inspiring, Criminal, Merchant, Crafty","morn, male, organic, ds9, nonhuman, crew_max_rarity_5","Keep It Warm, For Morn",1, 9, 8, 10, 12, 0, 2, , , , 425, 340, 102, 640, false,"Morn",crew_portraits_cm_morn_mourned_sm.png,morn_mourned_crew
"Pathfinder Uhura",2,5, 1294,271,523,533,115,230,0,0,0,0,0,0,1061,222,392,0,0,0,59,408,195,12,94,978,717,158,579,0,627,0,425,0,356,28,348,141,24,98,883,633,134,532,0,572,0,377,0,312,19,90,"Human, Federation, Starfleet, Communicator, Musician, Hero, Inspiring, Cultural Figure","female, organic, tos, uhura, original, evsuit, crew_max_rarity_5","Science Is Everyone's Game",0, 9, 8, 6, 12, 1, 4, , , , 415, 120, 60, 350, false,"Uhura",crew_portraits_cm_uhura_evsuit_sm.png,uhura_evsuit_crew
"Valeo Beta V Hemmer",9,5, 555,75,131,0,0,0,1343,177,315,1057,99,225,0,0,0,0,0,0,1063,186,138,1169,892,279,423,0,0,29,472,172,561,249,0,1233,439,461,1296,1056,579,648,0,0,169,780,445,939,519,0,327,1058,"Aenar, Andorian, Federation, Starfleet, Telepath, Jury Rigger, Hero","nonhuman, organic, male, snw, hemmer, exclusive_honorhall, crew_max_rarity_5","Do Not Weep For Me",0, 10, 7, 7, 7, , , , 1, 6, 200, 50, 205, 50, false,"Hemmer",crew_portraits_cm_hemmer_valeobeta_sm.png,hemmer_valeobeta_crew
"Esteemed Tom Paris",6,5, 1382,204,394,0,0,0,1013,124,349,0,0,0,524,74,146,0,0,0,221,39,198,169,96,508,0,1097,0,464,241,340,1084,0,913,416,133,359,318,277,619,0,1188,0,572,420,482,1186,0,1012,236,569,"Human, Federation, Starfleet, Inspiring, Hero, Cultural Figure, Pilot","male, organic, low, paris, crew_max_rarity_5","This Is How we kick A## In The Delta Quadrant",0, 8, 10, 3, 14, 1, 1, , , , 825, 70, 285, 265, false,"Paris",crew_portraits_cm_paris_esteemed_sm.png,paris_esteemed_crew
"First Officer Data",3,4, 897,144,346,678,89,239,0,0,0,360,62,148,0,0,0,0,0,0,125,793,245,858,501,837,372,904,493,1115,0,0,1248,761,0,158,709,221,775,440,919,374,994,550,1081,0,0,1203,745,0,995,1067,"Android, Federation, Starfleet, Cyberneticist, Musician, Tactician","nonhuman, male, artificial_life, data, tng, crew_max_rarity_4","Aye Sir",0, 8, 14, 12, 14, , , , , , 250, 100, 53, 50, false,"Data",crew_portraits_cm_data_first_officer_sm.png,data_first_officer_crew
"EV Suit Hemmer",7,5, 1082,175,236,538,118,200,0,0,0,1345,163,349,0,0,0,0,0,0,123,643,11,716,331,989,69,1013,586,302,0,0,288,91,0,231,852,69,935,616,941,137,1008,566,524,0,0,539,248,0,249,702,"Aenar, Andorian, Starfleet, Federation, Telepath, Inspiring, Botanist","male, nonhuman, organic, snw, hemmer, evsuit, crew_max_rarity_5","I Commend You To The Cosmos",0, 8, 8, 4, 10, 1, 1, , , , 350, , 90, 450, false,"Hemmer",crew_portraits_cm_hemmer_evsuit_sm.png,hemmer_evsuit_crew
"Fanboy Boimler",8,4, 0,0,0,0,0,0,316,83,131,875,172,253,619,104,213,0,0,0,0,1267,678,1062,0,1306,537,938,0,343,808,1049,155,356,757,0,1194,689,1088,0,1183,528,1002,0,326,724,978,212,391,807,1135,1195,"Human, Kazon, Federation, Starfleet, Resourceful, Survivalist, Desperate, Hunter","male, organic, low, boimler, crew_max_rarity_4","Fine, You Want to Play It That Way?",0, 6, 10, 8, 12, 5, 4, , , , , 30, , , false,"Boimler",crew_portraits_cm_boimler_fanboy_sm.png,boimler_fanboy_crew
"Chancellor Azetbur",6,5, 1023,149,340,0,0,0,0,0,0,0,0,0,1353,212,420,554,82,156,535,654,461,38,40,0,0,299,613,0,405,831,212,598,51,609,710,535,90,137,0,0,425,699,0,524,939,340,699,123,204,421,"Klingon, Cultural Figure, Brutal, Diplomat, Politician, Prodigy","female, organic, tos, azetbur, nonhuman, crew_max_rarity_5","We Are a Proud Race",2, 7, 12, 10, 14, 7, 0, , , , 750, 130, 295, 250, false,"Azetbur",crew_portraits_cm_azetbur_sm.png,azetbur_crew
"EV Suit Boimler",5,5, 1363,203,409,0,0,0,1063,146,319,564,102,201,0,0,0,0,0,0,227,32,43,470,106,469,697,0,0,114,698,314,963,540,0,382,127,76,597,244,634,692,0,0,201,829,495,989,567,0,87,364,"Human, Federation, Starfleet, Desperate, Explorer, Resourceful, Survivalist","male, organic, evsuit, low, boimler, crew_max_rarity_5","We're All In This Together",1, 9, 8, 6, 10, 1, 0, 2, 2, 2, 225, 250, 200, 240, false,"Boimler",crew_portraits_cm_boimler_evsuit_sm.png,boimler_evsuit_crew
"Master Surchid Falow",8,5, 1044,131,273,0,0,0,0,0,0,563,88,158,1368,164,314,0,0,0,550,666,125,59,365,0,734,342,0,918,462,0,68,575,215,796,870,270,255,632,0,819,690,0,994,814,0,226,677,511,271,865,"Wadi, Gambler, Communicator, Ambassador, Diplomat, Playful","male, organic, nonhuman, ds9, falow, crew_max_rarity_5","Double The Peril, Double Your Winnings",2, 10, 10, 6, 8, 4, 0, , , , 425, 150, 113, 100, false,"Falow",crew_portraits_cm_falow_sm.png,falow_crew
"Spy Rumdar",7,5, 0,0,0,0,0,0,889,198,450,433,99,301,1208,348,499,0,0,0,0,685,1065,493,0,542,838,328,0,152,31,374,71,669,201,0,489,737,302,0,309,549,186,0,52,7,204,13,423,132,340,52,"Pakled, Prisoner, Criminal, Desperate, Hero, Undercover Operative","male, organic, low, rumdar, nonhuman, crew_max_rarity_5","Im A Good Spy",0, 9, 8, 10, 12, , , , 3, 800, 100, 150, 730, 50, false,"Rumdar",crew_portraits_cm_rumdar_spy_sm.png,rumdar_spy_crew
"Gathorel Labin",6,5, 1034,216,418,0,0,0,489,133,295,0,0,0,1334,198,505,0,0,0,426,230,382,19,284,960,0,292,0,885,94,780,209,0,172,345,140,288,34,211,732,0,324,0,678,76,600,253,0,221,25,85,"Sikarian, Caregiver, Romantic, Merchant, Politician, Civilian","male, organic, nonhuman, voy, labin, crew_max_rarity_5","My Pleasure Will Be Greater Than Yours",1, 10, 6, 8, 12, , , , , , 40, 275, 140, 50, false,"Labin",crew_portraits_cm_labin_magistrate_sm.png,labin_magistrate_crew
"Doopler Emissary",6,5, 1079,140,324,535,94,225,0,0,0,0,0,0,1374,234,413,0,0,0,115,625,415,26,311,992,728,81,591,0,361,0,204,0,167,187,755,580,98,497,942,673,124,567,0,499,0,320,0,270,73,308,"Doopler, Federation, Desperate, Clone, Merchant, Communicator, Diplomat","nonhuman, organic, male, low, doopler_emissary, crew_max_rarity_5","Oh, I'm So Sorry!",1, 10, 6, 2, 10, 7, 0, , , , 490, 75, 140, 415, false,"Doopler",crew_portraits_cm_doopler_sm.png,doopler_crew
"Talosian Keeper",8,4, 344,76,167,0,0,0,0,0,0,0,0,0,663,96,234,859,135,355,1264,1233,1194,711,179,0,0,907,408,0,1073,536,873,352,89,1133,1125,1090,681,138,0,0,986,360,0,1114,470,933,276,142,1033,992,"Talosian, Crafty, Telepath, Explorer, Shapeshifter, Interrogator","male, organic, nonhuman, dsc, keeper, crew_max_rarity_4","Material Illusion Is Our Primary Form Of Defense",2, 9, 6, 8, 10, , , , , , 185, 250, 25, 40, false,"The Keeper",crew_portraits_cm_dsc_talosian_keeper_sm.png,dsc_talosian_keeper_crew
"Barclay and Neelix",6,5, 0,0,0,561,97,196,0,0,0,1353,181,402,1055,112,349,0,0,0,1001,0,222,715,0,975,58,181,577,258,715,0,22,64,416,1033,0,396,848,0,1010,106,277,611,413,861,0,55,183,553,186,485,"Human, Starfleet, Federation, Quantum Mechanics, Crafty, Desperate, Innovator","male, voy, organic, barclay, crew_max_rarity_5","Sorry, Hes Not Used To Company",1, 9, 4, 8, 8, 3, 0, , , , 350, 225, 110, 600, true,"Barclay",crew_portraits_cm_barclay_neelix_sm.png,barclay_neelix_crew
"Ensign Hoya",6,4, 0,0,0,0,0,0,941,178,301,535,72,172,667,97,194,0,0,0,0,737,1027,1041,0,602,776,923,0,154,196,444,385,623,745,0,728,1097,1143,0,606,823,1069,0,233,319,471,506,678,874,814,1087,"Benzite, Starfleet, Romantic, Resourceful, Federation","female, organic, nonhuman, ds9, hoya, crew_max_rarity_4","Shields Are Down! Engage Warp",1, 9, 8, 6, 8, , , , 2, 2, 15, , , 175, false,"Hoya",crew_portraits_cm_hoya_ensign_sm.png,hoya_ensign_crew
"Kiley Pike",7,4, 400,72,175,686,69,150,0,0,0,0,0,0,944,84,249,0,0,0,469,1178,1124,489,1013,866,645,213,519,0,910,0,700,0,573,679,1121,1084,670,962,1192,895,565,740,0,1104,0,922,0,784,998,1358,"Human, Kiley, Federation, Starfleet, Inspiring, Undercover Operative, Desperate","male, organic, snw, pike, crew_max_rarity_4","Take Me To Your Leader",1, 6, 10, 12, 12, 7, 0, , , , 750, 300, 125, 375, false,"Pike",crew_portraits_cm_pike_kiley_sm.png,pike_kiley_crew
"Breakthrough Booker",8,5, 0,0,0,1052,74,190,506,97,221,0,0,0,1358,173,354,0,0,0,638,1076,0,495,0,128,459,41,353,933,115,823,247,0,203,1102,997,0,730,0,448,783,231,647,859,248,778,527,0,447,336,910,"Kwejian, Federation, Desperate, Empath, Inspiring, Civilian, Communicator","male, nonhuman, organic, dsc, booker, crew_max_rarity_5","That Is The Start of Making Things Right",2, 10, 6, 6, 10, , , , , , 200, , 20, 125, false,"Booker",crew_portraits_cm_booker_breakthrough_sm.png,dsc_booker_breakthrough_crew
"Inspiring Captain Burnham",2,5, 1377,190,454,1060,129,342,0,0,0,0,0,0,682,93,210,0,0,0,11,396,187,133,85,495,383,145,288,0,1068,0,869,0,719,36,499,276,211,202,654,445,256,384,0,1163,0,995,0,838,6,328,"Federation, Starfleet, Human, Resourceful, Inspiring, Xenoanthropology, Innovator, Displaced","female, organic, dsc, burnham, crew_max_rarity_5","Lets Get To It",2, 9, 10, 10, 6, 4, 0, , , , , , 25, 40, false,"Burnham",crew_portraits_cm_dsc_burnham_inspiring_sm.png,dsc_burnham_inspiring_crew
"Captain Vasso L'Gaelia",9,5, 1151,100,203,537,53,146,0,0,0,0,0,0,1384,100,246,0,0,0,137,631,426,55,317,1093,822,129,671,0,521,0,313,0,259,595,1028,942,550,829,1253,944,574,795,0,1094,0,906,0,769,306,1306,"R'ongovian, Ambassador, Communicator, Diplomat, Empath","nonhuman, male, organic, snw, vasso, crew_max_rarity_5","We Shall Sit and Talk",2, 7, 4, 5, 10, 7, 0, , , , 400, 75, 30, 775, true,"Vasso",crew_portraits_cm_vasso_captain_sm.png,vasso_captain_crew
"Ensign Jennifer Sh'reyan",5,4, 891,188,261,0,0,0,335,86,162,686,121,192,0,0,0,0,0,0,711,505,116,876,518,1276,615,0,0,446,1364,1018,868,454,0,707,441,167,870,545,1093,668,0,0,445,1259,907,964,547,0,1007,1088,"Federation, Starfleet, Andorian, Athlete, Artist, Resourceful, Playful","female, nonhuman, organic, low, jen, crew_max_rarity_4","Pff...I Don't Think About You At All",0, 5, 1, 12, 15, 2, 0, , , , 500, 380, 180, 340, true,"Jen",crew_portraits_cm_jen_shreyan_sm.png,jen_shreyan_crew
"Captain Clark Terrell",8,4, 883,174,292,396,68,148,621,93,231,0,0,0,0,0,0,0,0,0,267,284,657,877,519,493,912,1218,759,799,1093,690,0,0,0,284,354,573,812,490,509,903,1205,748,844,1117,768,0,0,0,1016,1111,"Federation, Starfleet, Human, Desperate, Hero, Undercover Operative, Compromised","male, organic, tos, terrell, crew_max_rarity_4","What Do You Want With Us?",2, 4, 6, 4, 18, 1, 0, , , , 440, 200, 207, 475, true,"Terrell",crew_portraits_cm_terrell_captain_sm.png,terrell_captain_crew
"Borg Queen Jurati",5,4, 905,93,280,610,81,232,0,0,0,385,60,152,0,0,0,0,0,0,169,824,267,891,537,906,402,951,539,1090,0,0,1213,735,0,285,913,387,986,677,956,384,1024,579,1073,0,0,1198,741,0,1081,1267,"Human, Federation, Borg, Cultural Figure, Cyberneticist, Resourceful, Survivalist, Displaced","female, organic, pic, jurati, crew_max_rarity_4","We Are Out of Time",0, 8, 8, 8, 12, , , , 2, 1, 200, , , 100, false,"Jurati",crew_portraits_cm_jurati_borg_sm.png,jurati_borg_crew
"Ixtana'Rax",8,5, 1090,102,252,0,0,0,1351,147,349,510,78,181,0,0,0,0,0,0,528,51,130,736,348,262,812,0,0,87,458,163,1090,653,0,889,294,325,1015,712,569,777,0,0,207,765,434,1079,650,0,296,879,"Jem'hadar, Dominion, Brutal, Desperate, Maverick, Tactician, Veteran","nonhuman, male, ixtanarax, organic, ds9, crew_max_rarity_5","Obedience is Victory",0, 10, 8, 9, 12, , , , , , , 95, 47, 275, false,"Ixtana'Rax",crew_portraits_cm_ixtanarax_sm.png,ixtanarax_crew
"Wizard Pollux Spock",2,4, 0,0,0,411,99,229,0,0,0,667,109,251,967,143,312,0,0,0,1181,0,786,800,0,1168,306,266,739,771,826,0,97,451,500,956,0,810,875,0,920,219,245,551,787,895,0,141,464,575,835,854,"Human, Vulcan, Telepath, Costumed, Villain, Undercover Operative","male, nonhuman, organic, snw, spock, crew_max_rarity_4","Please, Point That Elsewhere",1, 9, 4, 6, 8, , , , 0, 3, 425, 400, 43, 225, false,"Spock",crew_portraits_cm_spock_pollux_sm.png,spock_pollux_crew
"Princess Thalia and Runa",7,5, 1349,151,356,0,0,0,0,0,0,0,0,0,1058,102,254,528,53,153,274,475,243,62,16,0,0,603,684,0,751,887,522,666,103,576,689,497,274,149,0,0,931,770,0,1076,1008,875,754,403,347,965,"Human, Costumed, Royalty, Caregiver, Desperate, Musician","female, organic, snw, laan, crew_max_rarity_5","My Princess Runa Applauds You!",1, 10, 4, 6, 12, , , , , , 650, 250, 225, 690, false,"Thalia",crew_portraits_cm_laan_princess_thalia_sm.png,laan_princess_thalia_crew
"Croden",6,4, 0,0,0,385,63,166,916,195,355,0,0,0,659,110,207,0,0,0,1221,717,0,1033,0,166,919,546,765,532,190,418,885,0,740,1197,635,0,1089,0,179,870,575,722,461,229,354,960,0,808,901,925,"Rakhari, Crafty, Desperate, Duelist, Prisoner, Scoundrel, Vengeful","nonhuman, male, organic, croden, ds9, crew_max_rarity_4","Sometimes I Do Tell The Truth",0, 9, 10, 10, 10, , , , , , 475, 295, 105, 240, false,"Croden",crew_portraits_cm_croden_sm.png,croden_crew
"Captain Sonya Gomez",8,5, 1379,98,298,0,0,0,0,0,0,509,80,181,1058,101,252,0,0,0,295,497,63,68,158,0,813,605,0,989,755,0,150,654,442,812,881,264,405,644,0,770,939,0,965,1083,0,375,642,747,367,1101,"Human, Federation, Starfleet, Tactician, Communicator, Resourceful, Inspiring","female, low, sonya, organic, crew_max_rarity_5","Take Us In, Nice And Slow",1, 8, 8, 8, 10, 3, 0, 3, , , 200, 525, 177, 225, false,"Sonya",crew_portraits_cm_sonya_gomez_captain_sm.png,sonya_gomez_captain_crew
"Spock as T'Pring",7,5, 0,0,0,520,78,266,1009,123,262,0,0,0,1324,219,376,0,0,0,1022,691,0,496,0,119,735,96,596,508,34,384,249,0,205,926,897,0,656,0,228,634,142,534,740,150,662,415,0,357,295,515,"Human, Vulcan, Federation, Starfleet, Telepath, Interrogator, Spiritual","snw, organic, nonhuman, spock, tpring, crew_max_rarity_5","This Is Coming Dangerously Close To Antics",2, 9, 8, 6, 12, 8, 4, , , , 250, 210, 180, 500, false,"Spock",crew_portraits_cm_spock_tpring_sm.png,spock_tpring_crew
"Sela in Shadow",6,5, 1355,227,427,0,0,0,0,0,0,1107,119,311,505,58,206,0,0,0,222,415,6,168,97,0,349,1091,0,431,1234,0,134,194,910,316,480,25,224,190,0,524,1100,0,683,1232,0,261,385,912,176,430,"Romulan, Human, Brutal, Scoundrel, Tactician, Villain, Saboteur","female, organic, tng, sela, crew_max_rarity_5","With Our Cloaking Devices, We Can Slip By You At Will",0, 7, 10, 12, 8, 1, 2, , , , , 100, , , false,"Sela",crew_portraits_cm_sela_shadow_sm.png,sela_shadow_crew
"Melora Pazlar",6,4, 667,121,298,916,173,351,385,73,184,0,0,0,0,0,0,0,0,0,107,575,762,968,632,179,479,707,365,1062,1310,961,0,0,0,90,458,698,923,606,187,389,614,320,972,1239,892,0,0,0,860,777,"Elaysian, Starfleet, Federation, Resourceful, Astrophysicist, Inspiring, Romantic, Explorer","nonhuman, female, organic, ds9, melora, crew_max_rarity_4","Im Perfectly Capable",1, 5, 12, 12, 20, 2, 0, , , , 75, 100, 20, 280, false,"Melora",crew_portraits_cm_melora_wheelchair_sm.png,melora_wheelchair_crew
"Tallinn",6,4, 0,0,0,667,90,231,941,147,308,0,0,0,0,0,0,365,62,166,885,752,0,0,1066,98,626,919,281,567,853,130,0,748,1068,971,775,0,0,1019,188,665,1003,302,615,862,179,0,716,987,960,1130,"Romulan, Caregiver, Linguist, Communicator, Undercover Operative, Civilian","female, nonhuman, organic, pic, tallinn, crew_max_rarity_4","A Leap of Faith? It's Kind Of How I Roll",0, 7, 10, 8, 10, 4, 0, , , , , 135, , 225, false,"Tallin",crew_portraits_cm_tallinn_sm.png,tallinn_crew
"Adult Rukiya",9,5, 0,0,0,511,87,175,0,0,0,0,0,0,1057,128,302,1337,175,365,1108,0,0,726,151,1086,814,212,44,0,721,185,493,90,14,1105,0,0,918,376,1073,789,347,116,0,964,389,742,230,88,309,741,"Human, Federation, Civilian, Explorer, Writer, Spiritual","organic, snw, female, rukiya, crew_max_rarity_5","I'm Happy, I'm Safe",2, 9, 8, 10, 12, 3, 0, , , , , , 25, , false,"Rukiya",crew_portraits_cm_rukiya_adult_sm.png,rukiya_adult_crew
"Dread Pirate Q",4,5, 1080,150,350,518,106,213,1349,219,411,0,0,0,0,0,0,0,0,0,114,20,394,681,296,46,752,1041,611,204,388,93,0,0,0,159,104,516,756,424,94,674,1009,568,332,512,227,0,0,0,102,269,"Q Continuum, Scoundrel, Costumed, Crafty, Brutal, Smuggler","male, nonhuman, pic, voy, q_jdl, original, crew_max_rarity_5","Dead Men Tell No Tales",0, 10, 6, 6, 10, 1, 4, , , , 525, 700, 143, 465, false,"Q",crew_portraits_cm_q_dread_pirate_sm.png,q_dread_pirate_crew
