"Pining Vina",9,5, 0,0,0,483,106,216,0,0,0,0,0,0,1287,225,456,831,183,413,1104,0,0,491,522,1083,807,111,102,0,442,516,245,342,25,969,0,0,499,306,930,661,104,71,0,443,312,271,175,18,498,169,"Human, Civilian, Romantic, Desperate, Diplomat","organic, female, dsc, vina, crew_max_rarity_5","Who Are You?",2, 7, 10, 5, 10, 7, 0, , , , 350, 210, 158, 425, false,"Vina",crew_portraits_cm_vina_sm.png,dsc_vina_crew
"Flotter",8,4, 0,0,0,848,177,367,0,0,0,0,0,0,619,121,261,302,82,220,721,0,0,1043,1111,699,522,210,179,0,1081,1029,891,775,433,529,0,0,976,850,516,371,145,100,0,1028,828,824,586,237,1058,752,"Hologram, Caregiver, Cultural Figure","voy, nonhuman, artificial_life, flotter, male, crew_max_rarity_4","No More Lying",2, 8, 8, 6, 10, , , , , , 375, 255, 125, 450, false,"Flotter",crew_portraits_cm_flotter_sm.png,flotter_crew
"Trevis",7,4, 0,0,0,319,70,201,861,157,318,0,0,0,582,138,273,0,0,0,1291,813,0,1058,0,329,981,609,822,646,242,524,904,0,754,1074,731,0,943,0,208,757,359,634,569,215,478,782,0,672,1074,834,"Hologram, Caregiver, Cultural Figure, Gardener","voy, nonhuman, artificial_life, trevis, male, crew_max_rarity_4","I'm Not A Monster!",0, 8, 8, 8, 10, , , , , , 540, 200, 112, 125, false,"Trevis",crew_portraits_cm_trevis_sm.png,trevis_crew
"Desert Archer",8,5, 852,149,341,567,69,177,0,0,0,0,0,0,1218,245,474,0,0,0,186,822,671,106,535,996,731,115,594,0,507,0,300,0,250,223,707,531,61,438,1113,831,123,686,0,376,0,233,0,199,527,270,"Human, Starfleet, Explorer, Telepath, Resourceful, Survivalist","male, organic, ent, archer, crew_max_rarity_5","You're Lying!",2, 10, 8, 8, 10, , , , , , 500, 100, 140, 365, false,"Archer",crew_portraits_cm_archer_desert_sm.png,archer_desert_crew
"Dark Empath Troi",8,5, 937,143,322,0,0,0,1300,178,445,0,0,0,0,0,0,473,101,246,648,77,591,831,52,250,0,0,656,265,443,23,0,647,910,664,121,577,813,93,346,0,0,520,342,523,52,0,495,770,408,285,"Starfleet, Federation, Human, Betazoid, Empath, Counselor, Brutal","nonhuman, female, organic, tng, troi, crew_max_rarity_5","Take Me With You!",0, 9, 8, 8, 8, , , , 1, 3, 450, 230, 100, 430, false,"Troi",crew_portraits_cm_troi_darkempath_sm.png,troi_darkempath_crew
"Torchbearer Tyler",7,4, 0,0,0,0,0,0,873,121,206,0,0,0,576,108,214,0,0,0,0,851,0,1092,0,743,0,972,0,679,297,566,944,0,788,0,979,0,1079,0,890,0,995,0,834,483,754,947,0,797,1393,1443,"Human, Federation, Starfleet, Cultural Figure, Tactician, Klingon","male, organic, dsc, tyler, voq, crew_max_rarity_4","That's a Torchbearer's Job",0, 9, 8, 10, 8, , , , , , 365, 250, 183, 425, false,"Tyler",crew_portraits_cm_tyler_torchbearer_sm.png,dsc_tyler_torchbearer_crew
"Safecracker Nog",8,4, 0,0,0,610,57,146,0,0,0,876,132,331,406,57,124,0,0,0,990,0,668,1286,0,960,147,642,571,651,1326,0,280,347,1035,1255,0,593,1342,0,1240,243,891,781,596,1384,0,318,305,1079,1109,1308,"Ferengi, Costumed, Federation, Starfleet, Criminal, Resourceful","nonhuman, male, organic, ds9, nog, crew_max_rarity_4","Piece of Cake",2, 7, 6, 8, 10, , , , , , 390, 200, 180, 375, false,"Nog",crew_portraits_cm_nog_safecracker_sm.png,nog_safecracker_crew
"Dress Uniform Bashir",8,4, 0,0,0,654,63,140,0,0,0,0,0,0,350,42,134,761,185,414,948,0,0,1356,564,914,674,669,94,0,1382,570,1279,371,320,1256,0,0,1346,303,1241,932,898,115,0,1387,309,1257,170,175,1181,1182,"Human, Starfleet, Federation, Cyberneticist, Physician, Engineered, Gambler, Undercover Operative","nonhuman, male, organic, ds9, bashir, crew_max_rarity_4","Pleasure to Meet You!",0, 8, 6, 6, 8, , , , , , 215, 230, 93, 425, false,"Bashir",crew_portraits_cm_bashir_dressuniform_sm.png,bashir_dress_uniform_crew
"Little John Riker",7,5, 1023,128,239,0,0,0,1309,192,354,0,0,0,422,113,245,0,0,0,586,69,527,372,410,286,0,1162,0,292,146,175,1144,0,975,861,232,789,431,686,482,0,921,0,465,192,358,863,0,731,450,628,"Human, Federation, Starfleet, Costumed, Thief, Maverick","male, organic, tng, riker, crew_max_rarity_5","We Need a Diversion",0, 6, 10, 8, 16, 2, 0, , , , 515, 200, 125, 425, false,"Riker",crew_portraits_cm_riker_littlejohn_sm.png,riker_littlejohn_crew
"Transporter Chief Rand",10,4, 0,0,0,0,0,0,0,0,0,859,113,241,628,92,204,0,0,0,0,0,698,1062,0,0,558,938,0,686,1098,0,163,379,757,0,0,818,1132,0,0,599,1052,0,799,1174,0,302,470,858,1384,1446,"Human, Federation, Starfleet, Desperate","female, organic, tos, rand, crew_max_rarity_4","Yank Them Back!",1, 8, 8, 8, 10, , , , , , 475, 275, 155, 242, false,"Rand",crew_portraits_cm_rand_transporter_sm.png,rand_transporter_crew
"Betrothed Kamala",3,2, 234,27,86,145,27,81,0,0,0,0,0,0,363,43,105,0,0,0,1234,1302,1298,1098,1182,1369,1048,1099,877,0,1381,0,1278,0,1102,1202,1291,1281,1183,1165,1353,1037,1118,866,0,1408,0,1286,0,1109,1560,1573,"Kriosian, Empath, Romantic","organic, tng, female, nonhuman, kamala, crew_max_rarity_2","I Am for You",1, 2, 6, 3, 10, 1, 0, , , , 390, 130, 115, 530, false,"Kamala",crew_portraits_cm_kamala_betrothed_sm.png,kamala_betrothed_crew
"Cadet First Class Locarno",10,5, 1284,180,408,0,0,0,0,0,0,0,0,0,1078,160,296,0,0,0,296,501,267,48,160,0,0,548,0,0,695,0,464,0,399,443,594,375,151,299,0,0,746,0,0,885,0,664,0,567,761,1011,"Human, Federation, Starfleet, Maverick, Pilot, Crafty, Desperate","tng, male, nicholas_locarno, organic, crew_max_rarity_5","Everything I Said Was The Truth!",1, 10, 4, 12, 8, , , , 2, 2, 390, 150, 175, 690, false,"Locarno",crew_portraits_cm_nicholas_locarno_sm.png,locarno_nicholas_crew
"Kamala",10,5, 967,131,227,546,92,174,0,0,0,0,0,0,1254,238,483,0,0,0,176,785,618,88,493,1011,744,103,607,0,459,0,258,0,212,372,933,806,119,703,1062,769,115,641,0,372,0,232,0,198,411,464,"Kriosian, Empath, Romantic, Exoarchaeology","nonhuman, female, organic, tng, kamala, crew_max_rarity_5","Who I Am Today, I Will Be Forever",1, 7, 4, 6, 8, , , , , , 315, 95, 167, 325, true,"Kamala",crew_portraits_cm_kamala_sm.png,kamala_crew
"Priestess Siranna",7,4, 529,112,242,0,0,0,0,0,0,0,0,0,883,138,286,382,78,211,992,1034,931,374,391,0,0,767,747,0,922,958,711,718,210,884,939,815,374,207,0,0,830,613,0,969,849,750,602,204,1096,975,"Gardener, Kelpien, Spiritual, Civilian, Ambassador, Cultural Figure","nonhuman, female, organic, dsc, siranna, crew_max_rarity_4","The Truth Has Survived",1, 7, 6, 8, 8, , , , , , 450, 200, 100, 475, false,"Siranna",crew_portraits_cm_siranna_priestess_sm.png,dsc_siranna_priestess_crew
"Scrooge Data",6,5, 969,171,330,508,73,173,0,0,0,0,0,0,1267,264,338,0,0,0,170,687,509,78,393,1106,839,131,687,0,515,0,307,0,254,211,696,513,99,423,1114,832,190,687,0,611,0,397,0,337,442,447,"Android, Starfleet, Federation, Cyberneticist, Costumed, Cultural Figure, Artist, Resourceful","nonhuman, male, tng, artificial_life, data, crew_max_rarity_5","Humbug",1, 9, 6, 8, 6, , , , , , 200, 305, 160, 475, false,"Data",crew_portraits_cm_data_scrooge_sm.png,data_scrooge_crew
"Chancellor Martok",8,5, 943,132,341,0,0,0,543,67,148,0,0,0,1262,161,372,0,0,0,633,320,572,98,455,1035,0,426,0,955,149,841,342,0,294,638,447,553,171,469,1174,0,594,0,1059,345,975,514,0,438,503,720,"Klingon, Duelist, Tactician, Diplomat, Veteran, Politician, Cultural Figure","nonhuman, male, organic, ds9, martok, crew_max_rarity_5","I will fight any battle. Anywhere",0, 9, 8, 8, 10, , , , 2, 2, 400, 125, 184, 450, false,"Martok",crew_portraits_cm_martok_chancellor_sm.png,martok_chancellor_crew
"Admiral Patrick",9,5, 1238,275,538,1023,124,239,0,0,0,0,0,0,495,76,143,0,0,0,22,451,215,184,118,591,430,251,334,0,1265,0,1138,0,965,20,330,121,155,81,849,600,513,503,0,1323,0,1182,0,1008,393,352,"Human, Engineered, Federation, Civilian, Costumed, Crafty","male, organic, ds9, patrick, crew_max_rarity_5","That's A Stupid Question",1, 9, 8, 10, 10, , , , , , 500, 100, 155, 375, false,"Patrick",crew_portraits_cm_patrick_admiral_sm.png,patrick_admiral_crew
"Christine Chapel",9,4, 0,0,0,559,70,170,0,0,0,0,0,0,349,103,201,790,127,280,1039,0,0,1285,601,1009,742,696,116,0,1325,601,1200,402,321,1167,0,0,1105,642,1130,842,578,201,0,1157,636,989,420,208,1240,1208,"Federation, Starfleet, Human, Physician, Veteran, Nurse, Romantic","female, organic, tos, chapel, crew_max_rarity_4","Don't You Recognise Me?",1, 7, 8, 12, 12, 5, 0, , , , 1400, 185, 120, 400, false,"Chapel",crew_portraits_cm_chapel_christine_sm.png,chapel_christine_crew
"Brainless Spock",6,2, 0,0,0,223,43,138,0,0,0,360,51,179,0,0,0,0,0,0,1355,0,1182,0,0,1355,655,1341,858,1107,0,0,1236,750,0,1290,0,1128,0,0,1279,540,1269,822,1032,0,0,1154,705,0,1580,1558,"Federation, Starfleet, Exobiology, Astrophysicist, Human, Musician, Vulcan, Telepath, Compromised","nonhuman, male, organic, tos, spock, crew_max_rarity_2","A Practical Idea",2, 3, 8, 10, 8, , , , , , 460, 150, 163, 390, false,"Spock",crew_portraits_cm_spock_brainless_sm.png,spock_brainless_crew
"Garth of Izar",6,5, 1214,226,444,0,0,0,989,156,344,0,0,0,487,83,142,0,0,0,326,76,286,219,188,515,0,1157,0,471,263,344,1142,0,973,288,86,245,239,179,564,0,1173,0,534,361,430,1167,0,990,463,339,"Prisoner, Desperate, Human, Brutal, Resourceful, Villain, Shapeshifter, Veteran, Explorer, Innovator, Federation","organic, male, tos, garth_izar, crew_max_rarity_5","I'm Afraid of No One",0, 8, 6, 8, 10, 1, 0, 2, , , 300, 200, 185, 225, false,"Garth",crew_portraits_cm_garth_izar_sm.png,garth_izar_crew
"Seeking Spock",8,5, 0,0,0,1257,183,448,0,0,0,0,0,0,430,132,295,931,170,326,319,0,0,1191,472,330,262,132,22,0,1228,476,1074,297,121,378,0,0,919,449,364,274,79,29,0,964,460,743,268,101,518,196,"Vulcan, Human, Telepath, Spiritual, Starfleet, Federation, Resourceful, Explorer","nonhuman, male, organic, tos, spock, crew_max_rarity_5","Recommend We Proceed",1, 9, 10, 12, 12, , , , , , 550, 200, 175, 225, false,"Spock",crew_portraits_cm_spock_seeking_sm.png,spock_seeking_crew
"Compromised Airiam",8,5, 0,0,0,940,178,397,1254,198,420,0,0,0,0,0,0,0,0,0,581,500,0,0,0,24,423,632,321,313,506,204,0,0,0,488,538,0,0,0,25,344,527,282,348,536,244,0,0,0,781,791,"Control, Federation, Starfleet, Brutal, Undercover Operative, Human, Engineered, Astrophysicist, Compromised","evsuit, female, organic, dsc, airiam, crew_max_rarity_5","Open The Airlock",0, 9, 8, 8, 10, , , , 2, 2, 555, 125, 285, 400, false,"Airiam",crew_portraits_cm_airiam_compromised_sm.png,dsc_airiam_compromised_crew
"Lt. Uhura",6,3, 384,51,129,0,0,0,0,0,0,0,0,0,539,76,178,0,0,0,1246,1215,1175,854,1064,0,0,1042,0,0,1192,0,1023,0,857,1284,1246,1210,903,1099,0,0,1117,0,0,1249,0,1094,0,933,1506,1545,"Human, Starfleet, Federation, Musician, Communicator","female, organic, tos, uhura, crew_max_rarity_3","Hailing Frequencies Open",1, 5, 6, 10, 12, , , , , , 300, 50, 71, 190, false,"Uhura",crew_portraits_cm_uhura_lt_yellow_sm.png,uhura_lt_yellow_crew
"Rescue Team Uhura",7,5, 984,179,361,0,0,0,1313,166,410,0,0,0,456,113,208,0,0,0,543,53,478,325,361,260,0,1135,0,280,131,162,1124,0,951,516,109,438,277,358,442,0,996,0,414,201,317,949,0,799,321,276,"Human, Federation, Starfleet, Communicator, Resourceful, Musician, Marksman","female, organic, tos, tas, uhura, crew_max_rarity_5","Phasers on Setting One. Fire.",2, 7, 6, 3, 8, 7, 0, , , , 540, 225, 68, 150, false,"Uhura",crew_portraits_cm_uhura_rescue_sm.png,uhura_rescue_crew
"Sulu of the Body",8,4, 612,111,266,0,0,0,0,0,0,0,0,0,910,153,301,0,0,0,903,951,841,293,723,0,0,733,0,0,893,0,671,0,557,841,904,774,312,670,0,0,751,0,0,889,0,670,0,569,1332,1314,"Human, Federation, Starfleet, Diplomat, Pilot, Archon, Compromised","male, organic, tos, sulu, crew_max_rarity_4","Paradise, My Friend, Paradise",1, 6, 8, 8, 12, 6, 0, , , , 615, 270, 168, 475, false,"Sulu",crew_portraits_cm_sulu_archon_sm.png,sulu_archon_crew
"Lenara Kahn",10,5, 0,0,0,1246,187,421,0,0,0,0,0,0,997,144,301,0,0,0,342,0,0,774,0,348,272,55,191,0,774,0,544,0,459,436,0,0,894,0,412,308,83,243,0,926,0,705,0,605,792,1031,"Trill, Astrophysicist, Romantic","nonhuman, female, organic, ds9, lenara, crew_max_rarity_5","I'm Not Like You",1, 10, 8, 8, 8, , , , , , 315, 200, 150, 490, false,"Lenara",crew_portraits_cm_lenara_kahn_sm.png,lenara_kahn_crew
"Torpedo Surgeon McCoy",9,5, 0,0,0,893,148,332,0,0,0,593,29,70,0,0,0,1254,142,484,704,0,1041,0,185,684,159,747,25,983,0,214,1072,19,278,659,0,1295,0,242,627,339,695,32,1182,0,251,1340,73,302,579,789,"Federation, Starfleet, Human, Physician, Exobiology, Desperate, Jury Rigger","male, organic, tos, mccoy, crew_max_rarity_5","Lock and Load",2, 8, 4, 6, 8, 1, 0, , , , 300, 230, 86, 250, true,"McCoy",crew_portraits_cm_mccoy_torpedo_sm.png,mccoy_torpedo_crew
"Scared Scotty",9,4, 0,0,0,0,0,0,381,89,175,871,114,238,639,59,128,0,0,0,0,1181,692,1093,0,1192,555,973,0,319,741,961,166,374,789,0,1085,834,1333,0,1045,604,1255,0,356,890,877,500,476,1067,1121,1345,"Human, Starfleet, Federation, Jury Rigger, Desperate","male, organic, tos, scott, crew_max_rarity_4","I Don't Remember",1, 5, 12, 10, 12, 0, 1, , , , 370, 145, 17, 250, false,"Scotty",crew_portraits_cm_scotty_scared_sm.png,scott_scared_crew
"Talas",9,5, 510,73,159,0,0,0,958,151,327,1273,208,375,0,0,0,0,0,0,1126,322,68,1214,947,560,261,0,0,41,793,396,326,107,0,1169,429,125,1238,998,606,325,0,0,45,804,472,431,179,0,479,560,"Andorian, Imperial Guard, Saboteur, Romantic, Tactician, Crafty","nonhuman, female, organic, ent, talas, crew_max_rarity_5","It's Not The Weapon, It's The Soldier",2, 6, 10, 10, 18, 2, 0, , , , 1475, 200, 115, 415, false,"Talas",crew_portraits_cm_talas_sm.png,talas_crew
"EV Suit Chekov",7,4, 379,58,169,661,62,141,0,0,0,0,0,0,925,129,248,0,0,0,548,1200,1153,503,1038,906,667,221,539,0,905,0,692,0,568,768,1164,1131,624,1011,1239,930,510,780,0,1037,0,831,0,711,1050,1346,"Federation, Starfleet, Human, Resourceful, Tactician","male, evsuit, organic, tos, chekov, crew_max_rarity_4","We've Got To Get Out Of Here",1, 7, 14, 12, 14, 5, 0, , , , 380, 50, 70, 400, false,"Chekov",crew_portraits_cm_chekov_evsuit_sm.png,chekov_evsuit_crew
"Laborer Kirk",7,5, 1013,107,294,0,0,0,0,0,0,1292,210,476,496,65,151,0,0,0,576,693,13,354,399,0,212,1152,0,274,1266,0,73,71,967,802,872,24,594,637,0,213,1191,0,267,1331,0,92,90,1017,387,548,"Human, Federation, Starfleet, Jury Rigger, Resourceful, Romantic, Thief, Desperate","male, organic, tos, kirk, crew_max_rarity_5","How Are The Stone Knives And Bearskins?",2, 7, 8, 8, 12, 2, 0, , , , 200, 200, 147, 375, false,"Kirk",crew_portraits_cm_kirk_laborer_sm.png,kirk_laborer_crew
"Dress Uniform Beverly Crusher",10,4, 0,0,0,0,0,0,0,0,0,0,0,0,611,73,245,810,172,428,0,0,0,1067,536,0,0,943,405,0,1106,532,914,350,104,0,0,0,1084,301,0,0,997,248,0,1127,307,952,169,103,1362,1249,"Human, Starfleet, Federation, Physician, Caregiver, Cyberneticist","female, organic, tng, crusher, crew_max_rarity_4","The Bride and Groom",2, 8, 10, 6, 12, , , , , , 400, 195, 217, 415, false,"Crusher",crew_portraits_cm_crusher_dress_uniform_sm.png,crusher_dress_uniform_crew
"Ishan Chaye Sisko",7,5, 0,0,0,0,0,0,496,93,293,1284,247,490,987,120,226,0,0,0,0,1046,217,835,0,981,199,702,0,76,258,794,30,60,531,0,893,183,1045,0,784,174,956,0,31,356,657,41,65,765,313,246,"Bajoran, Resourceful, Desperate, Undercover Operative, Civilian, Investigator","male, organic, ds9, sisko, crew_max_rarity_5","We're Not Who We Seem To Be",1, 9, 6, 10, 10, , , , , , 200, 220, 160, 380, false,"Sisko",crew_portraits_cm_sisko_ishan_chaye_sm.png,sisko_ishan_chaye_crew
"Saowin",10,4, 0,0,0,874,171,371,0,0,0,671,94,219,0,0,0,0,0,0,696,0,808,0,0,673,121,742,387,780,0,0,881,461,0,532,0,916,0,0,518,119,591,309,869,0,0,960,541,0,1325,1303,"Desperate, Resourceful, Ambassador, Civilian","male, organic, nonhuman, voy, saowin, crew_max_rarity_4","I Have Some Bad News",1, 7, 6, 8, 10, 3, 0, 2, , , 400, 50, 96, 474, false,"Saowin",crew_portraits_cm_saowin_sm.png,saowin_crew
"Dejaren",5,4, 566,157,355,380,54,148,877,159,388,0,0,0,0,0,0,0,0,0,499,264,813,1034,694,238,939,1244,788,589,874,482,0,0,0,247,142,482,735,398,204,935,1230,783,466,688,359,0,0,0,982,650,"Brutal, Hologram, Crafty, Desperate, Saboteur","male, artificial_life, nonhuman, voy, dejaren, crew_max_rarity_4","You're Getting Blood Everywhere",0, 7, 6, 8, 12, 1, 0, , , , 140, 125, 137, 300, false,"Dejaren",crew_portraits_cm_dejaren_sm.png,dejaren_crew
"Dr. 'Bones' McCoy",7,5, 0,0,0,0,0,0,0,0,0,0,0,0,0,0,0,1641,98,360,0,0,0,0,46,0,0,0,86,0,0,57,0,29,107,0,0,0,0,548,0,0,0,398,0,0,552,0,343,570,1367,1532,"Federation, Starfleet, Human, Physician, Resourceful, Exobiology","male, organic, tos, mccoy, crew_max_rarity_5","I'm A Doctor!",2, 8, 6, 10, 14, 3, 0, 3, , , 700, 325, 291, 325, false,"McCoy",crew_portraits_cm_mccoy_doctor_sm.png,mccoy_doctor_crew
"Arandis",9,4, 649,82,207,0,0,0,0,0,0,0,0,0,936,85,208,0,0,0,912,956,848,319,730,0,0,772,0,0,930,0,717,0,586,1021,1057,981,663,862,0,0,1059,0,0,1183,0,1013,0,866,1354,1479,"Resourceful, Inspiring, Communicator, Civilian, Romantic, Risian, Playful","female, nonhuman, organic, ds9, arandis, crew_max_rarity_4","Risa Will Be Waiting",1, 5, 4, 8, 12, 3, 0, 3, , , 405, 50, 33, 440, true,"Arandis",crew_portraits_cm_arandis_sm.png,arandis_crew
"Captain Lucero",7,4, 661,108,235,858,172,324,0,0,0,0,0,0,352,80,162,0,0,0,142,927,796,701,674,711,530,399,406,0,1352,0,1233,0,1069,146,954,850,658,740,595,407,287,348,0,1276,0,1122,0,960,1020,957,"Human, Federation, Starfleet, Tribbled, Survivalist, Explorer, Resourceful","female, organic, dsc, lucero, crew_max_rarity_4","He's an Idiot",2, 8, 6, 8, 10, 5, 0, , , , 525, 200, 110, 390, false,"Lucero",crew_portraits_cm_lucero_captain_sm.png,dsc_lucero_captain_crew
"Admiral Maxwell Forrest",9,5, 1256,220,470,0,0,0,0,0,0,430,102,236,1002,151,312,0,0,0,278,478,67,65,139,0,870,605,0,1027,758,0,161,695,445,266,444,43,77,162,0,628,729,0,826,856,0,151,499,548,422,225,"Human, Diplomat, Starfleet, Ambassador","male, organic, ent, forrest, crew_max_rarity_5","It's Time to Swim",1, 7, 8, 8, 14, 2, 0, , , , 405, 320, 100, 425, false,"Forrest",crew_portraits_cm_forrest_admiral_sm.png,forrest_admiral_crew
"Belle Q",9,5, 982,98,243,452,75,166,0,0,0,0,0,0,1286,210,438,0,0,0,201,776,606,86,484,1165,886,135,736,0,465,0,265,0,221,472,959,854,192,746,1135,844,160,696,0,495,0,313,0,267,561,726,"Q Continuum, Costumed, Romantic, Resourceful, Crafty","female, organic, tng, nonhuman, miss_q, crew_max_rarity_5","They're Using Our Weapons",0, 9, 8, 8, 10, , , , , , 400, 320, 211, 390, false,"Q",crew_portraits_cm_miss_q_civil_war_sm.png,miss_q_civil_war_crew
"Mycelial Culber",7,5, 449,93,303,869,198,423,0,0,0,0,0,0,0,0,0,1291,237,550,177,1108,1038,1187,12,642,479,709,9,0,0,123,0,46,182,66,878,734,951,9,384,286,451,7,0,0,126,0,56,165,349,81,"Human, Physician, Romantic, Federation, Starfleet, Desperate, Displaced","male, organic, dsc, culber, crew_max_rarity_5","You Have to Let Me Go",0, 9, 6, 6, 6, , , , 1, 3, 400, 200, 148, 500, false,"Culber",crew_portraits_cm_culber_mycelial_sm.png,dsc_culber_mycelial_crew
"Commander Shelby",9,4, 855,128,259,0,0,0,643,80,169,0,0,0,0,0,0,0,0,0,763,330,688,918,560,878,0,0,0,813,1099,703,0,0,0,829,510,753,966,656,1083,0,0,0,982,1252,902,0,0,0,1374,1453,"Gambler, Starfleet, Federation, Human, Tactician, Desperate, Maverick, Resourceful, Saboteur","female, organic, tng, shelby, crew_max_rarity_4","Impossible!",1, 7, 8, 10, 8, , , , , , 475, 200, 153, 325, false,"Shelby",crew_portraits_cm_shelby_commander_sm.png,shelby_commander_crew
"Tourist Worf",3,3, 533,62,160,0,0,0,386,56,160,0,0,0,0,0,0,0,0,0,1084,788,1037,1185,916,1220,0,0,0,1074,1324,985,0,0,0,1190,818,1142,1258,1021,1167,0,0,0,1055,1319,971,0,0,0,1505,1539,"Federation, Starfleet, Klingon, Saboteur, Romantic","male, nonhuman, organic, ds9, worf, crew_max_rarity_3","I Didn't Bring A Bathing Suit",1, 4, 10, 8, 10, 1, 2, , , , 25, 100, 173, 90, false,"Worf",crew_portraits_cm_worf_tourist_sm.png,worf_tourist_crew
"Control Leland",8,5, 1254,233,394,0,0,0,1067,103,198,0,0,0,658,49,86,0,0,0,307,74,276,171,170,528,0,981,0,487,213,359,950,0,796,354,224,298,387,222,958,0,1314,0,892,938,815,1302,0,1123,283,959,"Section 31, Undercover Operative, Crafty, Control, Brutal, Human, Federation, Starfleet, Compromised","nonhuman, male, organic, dsc, leland, crew_max_rarity_5","Get Me That Data",0, 8, 6, 8, 10, , , , 2, 3, 265, 210, 153, 475, false,"Leland",crew_portraits_cm_leland_control_sm.png,dsc_leland_control_crew
"Leucon",8,5, 0,0,0,974,210,435,490,96,200,1268,295,448,0,0,0,0,0,0,517,1109,233,0,0,112,11,577,292,85,1225,867,252,69,0,359,1042,178,0,0,99,7,419,205,56,1164,823,210,64,0,267,127,"Civilian, Brunali, Botanist, Desperate, Jury Rigger, Geneticist","male, nonhuman, organic, voy, leucon, crew_max_rarity_5","You Can Make A Difference Here",1, 9, 8, 10, 12, , , , , , 445, 100, 140, 365, false,"Leucon",crew_portraits_cm_leucon_sm.png,leucon_crew
"Annika Hansen Seven",9,5, 565,38,88,1021,107,251,0,0,0,1303,161,317,0,0,0,0,0,0,175,1123,73,1205,939,612,27,668,340,331,0,0,343,114,0,639,1286,343,1388,1155,856,130,936,507,568,0,0,596,280,0,533,1192,"Human, Civilian, Federation, Astrophysicist, Romantic","female, organic, voy, seven, apr2023, crew_max_rarity_5","I'm Sure You'll Adapt",0, 9, 6, 6, 10, , , , , , 375, 200, 250, 400, false,"Seven",crew_portraits_cm_seven_annika_sm.png,seven_annika_crew
"Twilight T'Pol",7,5, 0,0,0,951,90,222,403,186,378,0,0,0,0,0,0,1034,240,792,726,1056,0,0,211,143,526,765,28,911,1177,30,0,119,300,986,622,0,0,35,127,679,1020,11,439,666,6,0,18,70,589,53,"Vulcan, Astrophysicist, Telepath, Caregiver, Civilian","nonhuman, female, organic, ent, tpol, crew_max_rarity_5","Target Their Engines",2, 10, 12, 10, 10, , , , 0, 2, 225, 125, 120, 250, false,"T'Pol",crew_portraits_cm_tpol_twilight_sm.png,tpol_twilight_crew
"Picard and Number One",6,5, 527,79,177,1328,234,497,0,0,0,0,0,0,967,154,330,0,0,0,71,1094,1021,327,898,199,175,34,111,0,790,0,561,0,476,77,1104,1059,422,940,237,189,24,157,0,806,0,592,0,499,278,266,"Human, Astrophysicist, Inspiring, Civilian, Cultural Figure, Federation, Gardener, Veteran","male, organic, pic, picard, crew_max_rarity_5","Old Dogs",1, 8, 6, 8, 10, 6, 0, , , , 300, 235, 130, 300, false,"Picard",crew_portraits_cm_picard_numberone_sm.png,picard_numberone_crew
"Doctor Paul Stubbs",10,4, 0,0,0,856,150,370,0,0,0,659,118,275,0,0,0,0,0,0,723,0,779,0,0,702,122,763,401,762,0,0,859,445,0,576,0,746,0,0,556,94,618,326,728,0,0,806,429,0,1328,1258,"Astrophysicist, Human, Federation, Innovator, Civilian, Prodigy","male, organic, tng, stubbs, crew_max_rarity_4","I Would Rather Die Than Leave",2, 8, 6, 8, 8, , , , 1, 2, 600, 170, 170, 225, false,"Stubbs",crew_portraits_cm_stubbs_sm.png,stubbs_crew
"Mission Specialist Lefler",9,4, 0,0,0,661,96,192,0,0,0,858,86,214,390,73,145,0,0,0,906,0,716,1284,0,856,148,565,516,702,1323,0,363,392,1034,1043,0,961,1280,0,1021,330,638,616,899,1328,0,532,576,1013,1117,1351,"Human, Federation, Starfleet, Romantic, Innovator, Resourceful, Tactician","female, organic, tng, lefler, crew_max_rarity_4","Always Watch Your Back",1, 6, 5, 8, 10, 3, 0, 3, , , 200, 50, 141, 325, false,"Lefler",crew_portraits_cm_lefler_robin_sm.png,lefler_robin_crew
"Mirror Burnham",4,4, 355,36,112,0,0,0,642,121,232,0,0,0,892,166,328,0,0,0,1307,658,1237,532,1126,841,0,731,0,777,214,663,667,0,556,1324,695,1252,564,1144,845,0,663,0,795,246,713,578,0,488,1019,1131,"Mirror Universe, Undercover Operative, Federation, Starfleet, Civilian, Astrophysicist, Xenoanthropology, Human","female, organic, dsc, burnham, crew_max_rarity_4","The Old Michael Burnham is Dead",0, 9, 6, 10, 10, , , , , , 495, 200, 145, 440, false,"Burnham",crew_portraits_cm_burnham_mirror_sm.png,dsc_burnham_mirror_crew
"Lt. Ilia",10,4, 664,106,231,864,156,339,0,0,0,0,0,0,0,0,0,0,0,0,140,926,795,1014,673,706,528,768,404,0,0,0,0,0,0,150,966,863,1057,756,598,409,673,352,0,0,0,0,0,0,1339,1323,"Deltan, Federation, Starfleet, Romantic","female, nonhuman, organic, tos, ilia, crew_max_rarity_4","Navigational Deflectors Online",1, 8, 8, 6, 8, , , , , , 475, 200, 191, 415, false,"Ilia",crew_portraits_cm_ilia_lt_sm.png,ilia_lt_crew
"Age of Sail Worf",7,5, 962,139,356,0,0,0,1334,161,358,0,0,0,503,87,189,0,0,0,584,67,525,338,408,275,0,1079,0,284,125,169,1068,0,897,598,171,523,383,430,527,0,1082,0,504,301,402,1043,0,892,354,572,"Klingon, Tactician, Federation, Starfleet, Costumed","ageofsail, nonhuman, male, organic, tng, worf, crew_max_rarity_5","I am Prepared",1, 7, 8, 8, 10, 4, 1, , , , 380, 170, 200, 475, false,"Worf",crew_portraits_cm_worf_ageofsail_sm.png,worf_ageofsail_crew
"Arjin",9,4, 597,101,222,836,177,394,0,0,0,0,0,0,379,65,135,0,0,0,161,991,882,760,774,696,521,372,399,0,1348,0,1217,0,1056,108,988,888,727,782,469,347,262,284,0,1360,0,1224,0,1046,1073,943,"Civilian, Pilot, Astrophysicist, Trill","male, organic, ds9, nonhuman, arjin, feb2023, crew_max_rarity_4","It's... Interesting",2, 9, 8, 6, 8, , , 2, , , 350, 200, 125, 430, false,"Arjin",crew_portraits_cm_arjin_sm.png,arjin_crew
"Lt. Commander Icheb",8,5, 0,0,0,1272,207,433,471,101,151,980,141,310,0,0,0,0,0,0,300,1147,543,0,0,68,21,385,164,166,1270,911,583,263,0,368,1111,637,0,0,120,35,426,210,247,1247,898,673,344,0,500,474,"Civilian, Brunali, Borg, Astrophysicist, Prodigy, Innovator, Federation, Starfleet","male, nonhuman, organic, voy, icheb, crew_max_rarity_5","I Never Told",1, 10, 6, 10, 10, , , , , , 500, 150, 138, 415, false,"Icheb",crew_portraits_cm_icheb_lt_commander_sm.png,icheb_lt_commander_crew
"Tau",8,4, 0,0,0,342,72,156,894,130,308,0,0,0,651,109,220,0,0,0,1286,805,0,1035,0,316,978,586,820,630,224,509,886,0,742,1191,819,0,1071,0,289,866,551,718,662,323,577,924,0,786,1026,1136,"Crafty, Saboteur, Criminal, Scoundrel, Resourceful","male, organic, nonhuman, voy, tau, crew_max_rarity_4","I'd Hate to Make Your Life Difficult",0, 6, 8, 10, 10, 4, 1, , , , 315, 200, 90, 300, false,"Tau",crew_portraits_cm_tau_sm.png,tau_crew
