"Ushaan Archer",9,5, 0,0,0,0,0,0,958,283,659,485,43,93,862,161,311,0,0,0,706,224,433,373,636,152,338,303,532,44,34,113,81,258,238,0,130,691,439,0,48,488,371,0,20,9,34,184,400,294,303,119,"Human, Starfleet, Pilot, Explorer, Duelist","male, organic, ent, captain, bridge_crew, archer, crew_max_rarity_5","Right of Substitution",2, 7, 6, 12, 12, 0, 1, , , , 905, 1400, 755, 225, false,"Archer",crew_portraits_cm_archerdueling_sm.png
"EV Suit Archer",7,5, 1210,141,431,0,0,0,882,139,296,527,20,53,0,0,0,0,0,0,133,56,34,215,77,284,328,694,514,77,354,214,469,245,625,248,101,133,363,186,383,517,0,0,269,482,314,750,424,0,268,486,"Human, Starfleet, Pilot, Explorer, Desperate, Jury Rigger, Hero","male, organic, ent, captain, bridge_crew, archer, crew_max_rarity_5","Now You See Me...",0, 7, 8, 10, 10, , , , , , 575, 225, 189, 290, false,"Archer",crew_portraits_cm_archer_ev_suit_sm.png
"North Star Archer",4,4, 634,122,253,0,0,0,835,106,237,316,66,134,0,0,0,0,0,0,493,190,293,534,414,405,440,787,674,243,487,310,638,361,738,460,240,190,522,373,473,427,0,0,237,564,405,635,359,0,528,621,"Human, Starfleet, Tactician, Duelist, Costumed, Hero, Explorer","male, organic, ent, captain, archer, crew_max_rarity_4","High Noon",2, 8, 12, 5, 12, 2, 0, , , , 670, 45, 42, 315, false,"Archer",crew_portraits_cm_archer_cowboy_sm.png
"C.O.P. Founder Archer",9,4, 653,52,100,0,0,0,0,0,0,0,0,0,790,161,309,0,0,0,595,598,541,284,511,849,811,501,793,844,548,825,474,796,409,733,699,677,327,635,0,0,374,0,0,439,0,310,0,296,720,783,"Federation, Starfleet, Human, Inspiring, Cultural Figure, Communicator","male, organic, ent, captain, bridge_crew, archer, crew_max_rarity_4","To Boldly Go",2, 6, 12, 12, 12, 7, 0, , , , 315, 200, 145, 630, false,"Archer",crew_portraits_cm_archer_founder_sm.png
"Xindi 'Prisoner' Archer",8,4, 406,161,344,0,0,0,367,79,157,0,0,0,842,112,229,0,0,0,577,414,529,267,498,646,725,447,706,560,342,525,408,703,351,312,220,251,168,240,620,0,517,0,541,352,520,465,0,408,586,484,"Human, Starfleet, Desperate, Crafty, Costumed, Hero, Explorer, Pilot, Interrogator","male, organic, ent, captain, archer, crew_max_rarity_4","Thanks For Your Help",2, 7, 10, 7, 10, 7, 0, , , , 550, 200, 100, 590, false,"Archer",crew_portraits_cm_archer_xindi_prisoner_sm.png
"Humbled Archer",2,5, 376,172,452,0,0,0,0,0,0,0,0,0,1291,162,330,839,227,532,364,419,321,79,11,666,456,109,123,588,171,143,79,101,5,197,294,144,59,3,0,0,352,87,0,419,84,290,39,16,64,31,"Human, Starfleet, Pilot, Explorer, Communicator, Desperate","male, organic, ent, captain, bridge_crew, archer, crew_max_rarity_5","I Was A Perfect Gentleman!",2, 8, 6, 6, 6, , , , , , 455, 195, 200, 280, true,"Archer",crew_portraits_cm_archer_apology_sm.png
"Test Pilot Archer",4,4, 0,0,0,882,67,176,0,0,0,588,97,221,415,66,122,0,0,0,404,793,476,633,760,402,130,252,242,457,649,750,291,283,511,621,0,478,705,0,609,195,416,359,461,732,0,279,286,559,519,723,"Human, Starfleet, Pilot, Explorer, Inspiring","male, organic, ent, archer, crew_max_rarity_4","Luck Had Nothing To Do With It",1, 5, 6, 8, 6, , , , , , 415, 75, 100, 405, true,"Archer",crew_portraits_cm_archer_testpilot_sm.png
"Imprinted Archer",7,5, 0,0,0,511,71,181,0,0,0,939,127,289,0,0,0,1126,117,340,449,699,231,725,109,446,73,470,36,231,738,121,254,4,152,607,0,345,0,296,596,134,612,105,355,0,289,377,22,307,280,443,"Human, Starfleet, Explorer, Desperate, Caregiver","male, organic, ent, archer, crew_max_rarity_5","We Can't Abandon Them",2, 7, 10, 6, 16, 2, 0, , , , 200, 100, 100, 515, false,"Archer",crew_portraits_cm_archer_imprinted_sm.png
"Desert Archer",6,5, 852,149,341,567,55,157,0,0,0,0,0,0,1218,245,474,0,0,0,63,312,223,24,191,382,277,37,228,613,167,589,73,419,69,145,393,267,40,258,649,415,75,389,0,220,0,102,0,121,147,194,"Human, Starfleet, Explorer, Telepath, Resourceful","male, organic, ent, archer, crew_max_rarity_5","You're Lying!",2, 10, 8, 8, 10, , , , , , 500, 100, 140, 365, false,"Archer",crew_portraits_cm_archer_desert_sm.png
"Ambassador Soval",10,5, 982,112,261,0,0,0,0,0,0,0,0,0,1079,318,636,0,0,0,300,361,275,44,237,737,604,176,589,684,238,677,143,566,130,462,495,399,24,376,0,0,70,0,0,99,0,35,0,62,370,269,"Vulcan, Diplomat, Communicator, Telepath, Ambassador","nonhuman, male, organic, soval, ent, crew_max_rarity_5","No Stranger to Deception",1, 8, 1, 10, 12, , , , , , 775, 255, 150, 430, false,"Soval",crew_portraits_cm_soval_sm.png
"Riley Frazier",8,4, 430,38,79,489,147,312,0,0,0,0,0,0,671,177,361,0,0,0,340,628,591,367,553,554,377,204,347,784,532,767,447,707,393,243,713,704,295,656,348,237,59,226,0,389,0,254,0,249,590,448,"Civilian, Human, Borg, Desperate, Romantic, Resourceful, Federation, Starfleet, Communicator","female, organic, voy, riley, crew_max_rarity_4","For The Cooperative!",0, 5, 10, 10, 20, 2, 0, , , , 550, 200, 172, 550, false,"Riley",crew_portraits_cm_riley_frazier_sm.png
"Dr. Richard Daystrom",9,5, 0,0,0,857,259,761,0,0,0,882,134,447,0,0,0,0,0,0,253,754,286,787,713,270,38,283,162,279,788,705,290,165,705,35,0,183,0,0,30,5,54,35,194,0,0,214,121,0,413,102,"Federation, Prodigy, Inspiring, Innovator, Civilian, Human, Cultural Figure","male, organic, tos, daystrom, crew_max_rarity_5","Achieve Greater Things",2, 8, 6, 8, 10, 3, 0, 2, , , 515, 160, 283, 650, false,"Daystrom",crew_portraits_cm_daystrom_sm.png
"Prisoner Katrina Cornwell",2,5, 0,0,0,0,0,0,594,52,118,0,0,0,1049,129,286,1186,163,481,670,420,619,260,54,361,454,189,72,323,85,13,156,47,4,0,685,0,489,125,710,0,431,130,607,348,65,380,78,37,57,354,"Starfleet, Federation, Counselor, Human, Desperate, Diplomat, Prisoner","female, organic, dsc, admiral, cornwell, crew_max_rarity_5","Why Should I Trust You?",2, 9, 8, 5, 14, 8, 4, , , , 525, 230, 165, 425, false,"Cornwell",crew_portraits_cm_dsc_cornwell_prisoner_sm.png
"Changeling Founder",9,5, 933,222,466,0,0,0,0,0,0,0,0,0,900,320,644,0,0,0,268,329,249,50,210,748,613,258,600,695,326,687,230,574,206,154,256,113,2,104,0,0,67,0,0,93,0,32,0,59,384,85,"Changeling, Dominion, Diplomat, Brutal","nonhuman, female, organic, ds9, femalechangeling, crew_max_rarity_5","Great Link",1, 9, 6, 10, 10, 3, 0, , , , 1175, 375, 135, 1225, true,"Founder",crew_portraits_cm_femalechangeling_sm.png
"Diseased Changeling Founder",6,4, 751,148,310,0,0,0,0,0,0,0,0,0,458,239,483,248,88,214,439,471,384,224,232,796,712,525,441,776,567,572,500,402,261,367,419,303,44,74,0,0,153,320,0,218,463,101,298,48,569,151,"Changeling, Dominion, Desperate, Brutal","nonhuman, female, organic, ds9, femalechangeling, crew_max_rarity_4","I Wish You Hadn't Done That",0, 8, 6, 8, 12, , , , , , 300, 255, 140, 600, false,"Founder",crew_portraits_cm_changeling_diseased_sm.png
"Mugato",10,5, 823,189,405,0,0,0,1033,224,688,0,0,0,436,122,226,0,0,0,259,51,235,159,201,127,525,471,504,116,73,79,435,471,379,230,8,169,122,166,56,0,510,0,50,31,40,456,0,403,248,37,"Mugato, Brutal, Hunter, Primal","nonhuman, male, tos, mugato, crew_max_rarity_5","Private Little War",2, 7, 4, 5, 10, 7, 0, , , , 465, 325, 63, 500, true,"Mugato",crew_portraits_cm_mugato_sm.png
"Elizabeth Dehner",9,5, 0,0,0,441,145,345,0,0,0,0,0,0,886,54,106,1152,158,446,434,702,672,405,89,432,308,108,32,639,394,105,294,77,22,328,0,0,727,151,320,225,202,26,0,754,158,678,102,108,292,330,"Human, Starfleet, Federation, Physician, Telekinetic","female, organic, tos, dehner, crew_max_rarity_5","Almost a God",2, 6, 12, 12, 20, 2, 0, , , , 400, , 110, 350, false,"Dehner",crew_portraits_cm_elizabeth_dehner_sm.png
"Ensign Robin Lefler",2,3, 270,81,259,0,0,0,0,0,0,544,88,202,0,0,0,0,0,0,772,763,475,794,724,893,526,895,870,636,897,879,680,474,886,496,517,141,549,405,0,353,0,0,490,0,0,534,307,0,821,781,"Human, Federation, Starfleet, Innovator, Resourceful","female, organic, tng, lefler, crew_max_rarity_3","Rely on Yourself",1, 4, 10, 6, 15, 2, 0, , 2, 2, 505, 260, 150, 415, false,"Lefler",crew_portraits_cm_robinlefler_sm.png
"Mission Specialist Lefler",7,4, 0,0,0,661,96,192,0,0,0,858,86,214,390,73,145,0,0,0,491,783,340,627,750,491,117,313,300,342,644,740,219,197,507,559,0,502,672,0,558,180,337,330,477,705,0,269,299,532,486,693,"Human, Federation, Starfleet, Romantic, Innovator, Resourceful, Tactician","female, organic, tng, lefler, crew_max_rarity_4","Always Watch Your Back",1, 6, 5, 8, 10, 3, 0, 3, , , 200, 50, 141, 325, false,"Lefler",crew_portraits_cm_lefler_robin_sm.png
"Vosk",7,4, 806,215,462,0,0,0,324,119,237,679,38,123,0,0,0,0,0,0,338,225,73,414,256,604,340,770,635,273,638,489,493,263,712,159,88,56,277,107,462,468,0,0,263,556,394,679,387,0,431,387,"Villain, Tactician, Temporal Agent, Na'kuhl, Brutal","nonhuman, male, organic, ent, vosk, crew_max_rarity_4","History Will Belong To Us",2, 6, 12, 10, 14, 4, 0, , , , 475, 100, 95, 400, false,"Vosk",crew_portraits_cm_vosk_sm.png
"Lissan",9,5, 876,269,542,0,0,0,0,0,0,0,0,0,1144,267,541,0,0,0,249,309,221,27,189,721,582,166,567,668,228,663,135,542,120,90,191,67,3,58,0,0,105,0,0,167,0,64,0,89,343,95,"Andorian, Aenar, Diplomat, Telepath, Civilian, Communicator","nonhuman, female, organic, ent, lissan, crew_max_rarity_5","You Have An Interesting Mind",1, 7, 10, 12, 8, 6, 2, , , , 590, 225, 65, 540, false,"Lissan",crew_portraits_cm_lissan_sm.png
"Away Team Number One",5,5, 737,272,643,963,284,772,0,0,0,0,0,0,422,143,301,0,0,0,13,272,189,135,156,115,114,52,82,616,491,594,390,428,335,2,138,36,20,35,28,32,5,31,0,466,0,342,0,320,168,6,"Federation, Starfleet, Human, Resourceful, Explorer","female, organic, tos, lieutenant, bridge_crew, number_one, crew_max_rarity_5","There's Still Something Out There",0, 7, 6, 12, 12, 0, 1, , , , 450, 180, 136, 225, false,"Number One",crew_portraits_cm_majel_numberone_sm.png
"Bridge Officer Number One",3,5, 587,22,64,0,0,0,0,0,0,954,188,384,1255,240,476,0,0,0,378,436,35,71,296,663,146,88,408,161,139,543,2,89,47,769,731,127,185,678,0,190,154,0,205,223,0,5,127,122,27,229,"Federation, Starfleet, Human, Resourceful, Explorer","female, organic, dsc, bridge_crew, lieutenant, number_one, crew_max_rarity_5","Something Isn't Adding Up",0, 7, 12, 10, 14, 4, 0, , , , 425, 75, 133, 425, false,"Number One",crew_portraits_cm_dsc_numberone_sm.png
"Prophet Sarah Sisko",3,5, 461,148,322,965,203,411,0,0,0,0,0,0,1249,202,414,0,0,0,44,411,310,67,270,155,141,3,106,568,153,535,62,355,59,27,411,286,71,278,194,160,20,141,0,315,0,178,0,185,11,67,"Human, Bajoran, Prophet, Cultural Figure, Inspiring","female, organic, ds9, sisko_sarah, crew_max_rarity_5","Don't Be Afraid",0, 8, 8, 8, 12, 4, 2, , , , 450, 330, 180, 400, false,"Sarah",crew_portraits_cm_sarah_sisko_sm.png
"Acting Nagus Brunt",6,3, 211,14,42,0,0,0,271,8,26,0,0,0,421,119,287,0,0,0,841,737,838,645,825,817,873,703,866,800,640,790,693,867,638,781,727,739,448,689,782,0,442,0,673,474,645,393,0,366,817,830,"Ferengi, Diplomat, Crafty, Cultural Figure","nonhuman, male, organic, ds9, nagus, brunt, crew_max_rarity_3","Liquidation",2, 5, 12, 12, 10, 7, 0, , 1, 2, 240, , 125, 800, false,"Brunt",crew_portraits_cm_grandnagusbrunt_sm.png
"Crell Moset",6,5, 0,0,0,426,89,245,0,0,0,0,0,0,792,107,348,1001,267,675,475,705,674,394,87,473,327,129,33,643,384,100,284,75,18,506,0,0,457,31,485,315,115,12,0,449,35,324,15,5,302,58,"Cardassian, Hologram, Physician, Brutal, Exobiology","nonhuman, male, organic, voy, moset, crew_max_rarity_5","Arbitrary Ethics",2, 8, 8, 10, 12, 5, 0, , , , 600, 800, 213, 450, false,"Moset",crew_portraits_cm_crell_sm.png
"Commander Kruge",7,3, 308,99,232,0,0,0,433,116,264,0,0,0,0,0,0,0,0,0,765,550,742,788,716,711,881,897,873,655,750,645,897,873,888,509,244,457,558,419,430,0,0,0,390,535,368,0,0,0,826,744,"Klingon, Lord, Marksman, Brutal, Villain","nonhuman, male, organic, tos, commander, kruge, crew_max_rarity_3","Capture Technology",0, 3, 6, 10, 10, 8, 4, , , , 515, 385, 240, 100, false,"Kruge",crew_portraits_cm_commanderkruge_sm.png
"Harcourt Fenton Mudd",8,5, 0,0,0,1065,81,189,0,0,0,0,0,0,1264,179,391,0,0,0,290,734,717,238,684,293,224,24,177,682,235,673,141,562,126,582,0,0,368,0,575,367,96,341,0,358,0,220,0,225,363,664,"Human, Civilian, Scoundrel, Crafty, Smuggler, Resourceful, Survivalist","male, organic, dsc, mudd, crew_max_rarity_5","Choose Wisely",0, 10, 6, 6, 6, , , 2, , , 415, 340, 50, 500, false,"Mudd",crew_portraits_cm_harry_mudd_sm.png
"Time Loop Mudd",6,4, 0,0,0,0,0,0,708,31,62,711,158,379,315,125,257,0,0,0,799,539,375,640,766,525,304,620,678,143,392,421,248,220,515,0,725,213,514,0,770,208,470,0,164,434,631,39,144,381,536,549,"Human, Civilian, Scoundrel, Crafty, Smuggler, Resourceful, Survivalist","male, organic, dsc, mudd, crew_max_rarity_4","All The Time In The World!",2, 6, 12, 10, 10, 4, 0, , , , 450, 185, 100, 475, false,"Mudd",crew_portraits_cm_harry_mudd_takeover_sm.png
"Bounty Hunter Mudd",4,5, 0,0,0,486,88,176,1300,174,348,1039,92,178,0,0,0,0,0,0,416,171,191,699,598,25,65,441,252,15,173,54,204,120,588,589,369,546,0,0,90,211,597,344,89,400,225,555,320,0,134,506,"Human, Civilian, Costumed, Courier, Cyberneticist, Scoundrel, Smuggler, Thief","male, organic, dsc, mudd, crew_max_rarity_5","How Dare You!",0, 7, 8, 8, 10, 4, 2, , , , 325, 200, 179, 442, false,"Mudd",crew_portraits_cm_mudd_bounty_sm.png
"Kortar",8,5, 921,186,430,0,0,0,1209,157,301,0,0,0,404,121,255,0,0,0,204,41,176,145,144,139,512,474,492,128,80,92,437,454,381,202,79,151,106,143,352,0,476,0,314,151,290,424,0,385,221,175,"Klingon, Cultural Figure, Brutal, Duelist, Hero, Cursed, Veteran","nonhuman, male, organic, voy, kortar, crew_max_rarity_5","Gre'thor Awaits You",2, 7, 6, 8, 14, 7, 2, , , , 425, 300, 45, 315, false,"Kortar",crew_portraits_cm_kortar_sm.png
"Lt. Commander Airiam",6,4, 586,102,207,738,168,356,0,0,0,0,0,0,399,37,71,0,0,0,151,546,493,419,467,425,300,287,259,777,676,763,623,691,543,84,560,493,486,450,281,214,216,183,0,781,0,725,0,620,566,597,"Federation, Starfleet, Astrophysicist, Resourceful, Prodigy, Human, Engineered","female, organic, dsc, bridge_crew, lieutenant_commander, airiam, crew_max_rarity_4","Engaging Spore Drive",0, 8, 4, 8, 14, , , , 1, 2, 525, 105, 125, 490, false,"Airiam",crew_portraits_cm_dsc_airiam_ltcmdr_sm.png
"Compromised Airiam",8,5, 0,0,0,940,178,397,1254,198,420,0,0,0,0,0,0,0,0,0,271,216,708,764,674,8,215,292,172,138,226,102,722,549,671,245,299,0,0,0,16,189,263,164,171,313,145,0,0,0,348,388,"Control, Federation, Starfleet, Brutal, Undercover Operative, Human, Engineered, Astrophysicist","female, organic, dsc, bridge_crew, airiam, crew_max_rarity_5","Open The Airlock",0, 9, 8, 8, 10, , , , 2, 2, 555, 125, 285, 400, false,"Airiam",crew_portraits_cm_airiam_compromised_sm.png
"Temporal Agent Daniels",8,5, 508,39,117,1238,118,376,0,0,0,947,116,230,0,0,0,0,0,0,45,486,58,502,379,129,29,152,87,235,732,619,256,143,620,173,696,257,732,630,311,84,349,203,427,0,0,458,257,0,258,561,"Human, Starfleet, Federation, Temporal Agent, Undercover Operative","male, organic, ent, daniels, crew_max_rarity_5","Protect the Timeline",2, 9, 12, 10, 14, 7, 4, , , , 500, 360, 140, 560, false,"Daniels",crew_portraits_cm_daniels_temporal_sm.png
"Dr. Carol Marcus",7,3, 306,70,149,450,85,209,0,0,0,0,0,0,0,0,0,0,0,0,585,794,785,811,761,728,590,729,573,902,909,897,909,890,900,299,646,612,673,565,542,347,570,324,0,0,0,0,0,0,851,822,"Federation, Exobiology, Human, Civilian, Innovator","female, organic, tng, crew_max_rarity_3","Master Chef",2, 5, 8, 12, 12, , , , , , 163, 225, 465, 150, false,"Marcus",crew_portraits_cm_carolmarcus_sm.png
"Commander Barak",8,4, 899,69,187,0,0,0,627,85,190,0,0,0,0,0,0,0,0,0,471,237,418,511,389,583,801,841,784,512,617,471,835,787,815,603,362,570,634,520,566,0,0,0,504,640,485,0,0,0,709,817,"Klingon, Brutal, Warrior","nonhuman, male, organic, tos, barak, crew_max_rarity_4","Honor and Glory",0, 6, 10, 10, 20, 2, 0, , , , 600, 30, 105, 400, false,"Barak",crew_portraits_cm_barak_commander_sm.png
"Jett Reno",6,5, 0,0,0,907,245,544,0,0,0,1301,158,341,0,0,0,0,0,0,239,723,119,757,669,254,22,265,156,134,764,662,128,72,667,95,0,260,0,0,89,10,116,78,276,0,0,285,161,0,341,300,"Starfleet, Federation, Human, Jury Rigger, Resourceful, Veteran","female, organic, dsc, jett_reno, crew_max_rarity_5","I Can Fix Stuff With Duct Tape",0, 10, 4, 8, 16, 5, 0, , , , 170, 100, 225, 25, false,"Reno",crew_portraits_cm_jett_reno_sm.png
"Enabran Tain",8,5, 919,264,754,0,0,0,905,128,284,0,0,0,378,123,299,0,0,0,152,60,127,110,90,285,545,495,526,245,151,215,463,496,404,36,13,24,14,25,394,0,426,0,358,152,333,370,0,347,288,39,"Cardassian, Obsidian Order, Interrogator, Undercover Operative, Desperate","nonhuman, male, organic, ds9, tain, crew_max_rarity_5","History Be My Judge",0, 7, 12, 10, 14, 8, 4, , , , 308, 235, 43, 475, false,"Tain",crew_portraits_cm_tain_sm.png
"Lwaxana Troi",5,3, 334,62,161,0,0,0,0,0,0,0,0,0,410,125,298,0,0,0,776,768,757,585,730,900,888,713,879,892,753,886,706,879,650,653,643,609,304,563,0,0,427,0,0,494,0,371,0,348,835,772,"Federation, Diplomat, Betazoid, Romantic, Civilian, Telepath, Ambassador","nonhuman, female, organic, tng, lwaxana, crew_max_rarity_3","I Adore Diplomacy",2, 4, 10, 12, 16, 5, 0, , , , 175, 155, 64, 490, false,"Troi",crew_portraits_cm_lwaxanatroi_sm.png
"Ambassador Troi",9,5, 830,135,285,0,0,0,0,0,0,0,0,0,932,345,711,0,0,0,352,410,308,83,268,767,641,240,629,718,314,714,209,603,189,405,454,340,12,331,0,0,45,0,0,60,0,22,0,41,418,153,"Federation, Diplomat, Betazoid, Romantic, Civilian, Telepath, Communicator, Ambassador","nonhuman, female, organic, ds9, lwaxana, crew_max_rarity_5","A Crime of Passion",0, 8, 6, 8, 10, , , , , , 400, 30, 237, 250, false,"Troi",crew_portraits_cm_troiambassador_sm.png
"Festive Lwaxana Troi",9,4, 636,83,174,0,0,0,0,0,0,0,0,0,727,182,389,0,0,0,583,587,535,276,503,846,805,504,788,841,551,823,480,790,414,599,609,564,175,516,0,0,268,0,0,359,0,221,0,226,714,675,"Federation, Diplomat, Betazoid, Romantic, Civilian, Telepath, Ambassador","nonhuman, female, organic, ds9, lwaxana, crew_max_rarity_4","Dance With Me",1, 6, 8, 10, 16, 6, 0, , , , 400, 160, 115, 650, false,"Troi",crew_portraits_cm_troi_festivelwaxana_sm.png
"Grateful Lwaxana Troi",5,5, 1244,182,415,0,0,0,1006,89,206,0,0,0,640,70,143,0,0,0,99,32,79,66,44,220,455,364,421,197,86,170,316,381,269,221,150,164,181,161,543,0,653,0,486,407,470,622,0,537,58,460,"Diplomat, Betazoid, Federation, Civilian, Telepath, Romantic, Ambassador","nonhuman, female, organic, ds9, lwaxana, crew_max_rarity_5","Alone At Last",2, 7, 10, 10, 14, 8, 4, , , , 390, 225, 150, 515, false,"Troi",crew_portraits_cm_lwaxana_grateful_sm.png
"Mirror Jennifer Sisko",7,4, 0,0,0,663,122,339,0,0,0,536,62,132,474,178,403,0,0,0,456,787,518,551,753,457,184,183,282,497,574,744,263,316,442,361,0,634,356,0,345,140,49,225,585,350,0,81,363,219,498,349,"Human, Astrophysicist, Civilian, Terran Rebellion, Mirror Universe","female, organic, ds9, mirror, crew_max_rarity_4","Exploit Weakness",2, 5, 6, 10, 12, 4, 0, , , , 925, 100, 135, 1000, true,"Jennifer",crew_portraits_cm_jennifersiskomirror_sm.png
"Senator Cretak",5,3, 0,0,0,0,0,0,280,62,192,0,0,0,432,92,235,0,0,0,907,799,908,765,901,788,898,734,891,768,626,757,725,892,674,0,612,0,566,0,595,0,531,0,521,351,504,484,0,423,852,797,"Romulan, Diplomat","nonhuman, female, organic, ds9, cretak, crew_max_rarity_3","Romulan Expansion",1, 3, 0, 6, 8, 7, 0, , , , , , 136, 1040, true,"Cretak",crew_portraits_cm_kimaracretak_sm.png
"Icheb",7,4, 0,0,0,596,84,191,0,0,0,735,140,413,0,0,0,0,0,0,596,856,430,867,846,602,171,605,369,421,858,828,483,253,822,574,0,202,0,0,567,87,587,334,222,0,0,239,134,0,727,676,"Civilian, Brunali, Borg, Astrophysicist, Prodigy, Innovator","male, organic, voy, icheb, crew_max_rarity_4","In Position!",2, 6, 10, 8, 12, 1, 1, , , , 290, 225, 145, 505, false,"Icheb",crew_portraits_cm_icheb_sm.png
"Lt. Commander Icheb",4,5, 0,0,0,1272,207,433,471,101,151,980,141,310,0,0,0,0,0,0,89,463,168,688,585,22,4,97,57,50,509,329,182,106,576,183,614,309,0,0,63,26,208,131,120,665,505,334,192,0,98,259,"Civilian, Brunali, Borg, Astrophysicist, Prodigy, Innovator, Federation","male, organic, voy, icheb, crew_max_rarity_5","I Never Told",1, 10, 6, 10, 10, , , , , , 500, 150, 138, 415, false,"Icheb",crew_portraits_cm_icheb_lt_commander_sm.png
"Tactical Michael Burnham",4,4, 669,62,171,0,0,0,756,196,397,338,47,131,0,0,0,0,0,0,505,185,296,545,428,372,431,785,668,224,457,281,628,353,735,638,183,349,658,546,215,456,0,0,97,335,166,661,379,0,516,556,"Federation, Starfleet, Astrophysicist, Xenoanthropology, Human, Innovator, Resourceful","female, organic, dsc, bridge_crew, burnham, crew_max_rarity_4","I Am Trying To Save You",0, 8, 6, 10, 8, , , 2, , , 675, 100, 185, 490, false,"Burnham",crew_portraits_cm_burnham_tactical_sm.png
"Graduation Michael Burnham",4,4, 0,0,0,884,180,497,0,0,0,694,65,178,0,0,0,0,0,0,345,824,480,833,800,341,93,362,202,460,827,785,523,286,770,160,0,584,0,0,150,58,179,118,531,0,0,586,334,0,639,617,"Federation, Civilian, Astrophysicist, Xenoanthropology, Human","female, organic, dsc, burnham, crew_max_rarity_4","Lofty Expectations",2, 9, 8, 8, 10, , , 2, , , 500, 100, 280, 200, false,"Burnham",crew_portraits_cm_burnham_vulcan_graduate_sm.png
"Prisoner Michael Burnham",8,2, 0,0,0,380,30,142,262,20,53,0,0,0,121,42,104,0,0,0,784,840,911,889,905,688,658,711,642,827,796,812,868,896,856,712,738,0,743,0,604,461,539,430,669,706,640,694,0,598,859,875,"Federation, Starfleet, Prisoner, Xenoanthropology, Duelist, Human","female, organic, dsc, burnham, crew_max_rarity_2","Improvised Assault",2, 3, 6, 10, 10, , , , , , 190, 220, 93, 260, false,"Burnham",crew_portraits_cm_burnham_prisoner_sm.png
"First Officer Burnham",1,5, 1359,88,294,944,207,478,667,50,101,0,0,0,0,0,0,0,0,0,1,71,61,169,26,28,135,170,101,296,416,243,619,349,540,29,359,387,515,364,76,129,171,112,624,759,601,0,0,0,3,370,"Federation, Starfleet, Astrophysicist, Human, Xenoanthropology, Resourceful","female, organic, dsc, bridge_crew, first_officer, commander, burnham, crew_max_rarity_5","We Need To Strike First!",1, 8, 12, 5, 10, 1, 0, 2, , , 475, 70, 85, 740, false,"Burnham",crew_portraits_cm_dsc_burnham_first_officer_sm.png
"Prospect Michael Burnham",4,4, 0,0,0,839,137,382,0,0,0,661,50,143,334,86,174,0,0,0,353,780,454,652,747,347,110,216,210,443,660,736,297,272,518,287,0,635,628,0,291,117,120,187,586,655,0,331,364,490,480,578,"Federation, Civilian, Astrophysicist, Xenoanthropology, Human","female, organic, dsc, burnham, crew_max_rarity_4","Respect Is Earned",1, 5, 8, 8, 10, 8, 4, , , , 500, 130, 150, 350, false,"Burnham",crew_portraits_cm_burnham_prospect_sm.png
"Desert Michael Burnham",8,2, 0,0,0,355,78,204,0,0,0,0,0,0,275,24,77,0,0,0,789,910,913,857,911,778,672,687,655,909,854,910,831,906,812,564,0,0,775,0,562,358,467,333,0,786,0,729,0,625,877,877,"Federation, Starfleet, Explorer, Xenoanthropology, Human","female, organic, dsc, burnham, bridge_crew, first_officer, commander, crew_max_rarity_2","A Storm is Coming",1, 4, 10, 10, 12, , , , , , 290, 150, 60, 165, false,"Burnham",crew_portraits_cm_burnham_desert_sm.png
"EV Suit Burnham",4,5, 1324,89,299,369,115,391,877,169,472,0,0,0,0,0,0,0,0,0,39,34,95,190,60,44,298,446,256,194,304,168,665,422,594,61,90,376,507,358,21,217,338,195,156,292,135,0,0,0,156,125,"Federation, Starfleet, Astrophysicist, Human, Xenoanthropology, Resourceful, Duelist","female, organic, dsc, bridge_crew, first_officer, commander, burnham, crew_max_rarity_5","Vulcan Hello",2, 7, 10, 10, 14, 6, 0, , , , 575, , 295, 100, false,"Burnham",crew_portraits_cm_burnham_evsuit_sm.png
"Away Team Michael Burnham",3,5, 0,0,0,783,238,532,1037,277,712,464,100,282,0,0,0,0,0,0,218,180,344,701,601,5,63,245,147,36,178,62,368,203,591,107,108,388,0,0,4,18,130,84,3,83,26,418,232,0,146,15,"Federation, Prisoner, Astrophysicist, Human, Xenoanthropology, Resourceful, Survivalist","female, organic, dsc, burnham, crew_max_rarity_5","I'm Not Staying To Make Friends",1, 8, 8, 6, 12, 1, 1, , , , 400, 125, 210, 200, false,"Burnham",crew_portraits_cm_burnham_away_sm.png
"Fugitive Burnham",3,4, 0,0,0,0,0,0,654,81,161,0,0,0,928,129,269,421,29,101,781,513,761,420,518,493,651,352,373,426,166,231,310,336,148,0,624,0,498,647,613,0,454,452,533,294,377,404,403,259,436,714,"Federation, Starfleet, Astrophysicist, Xenoanthropology, Human, Resourceful, Desperate","female, organic, dsc, burnham, bridge_crew, crew_max_rarity_4","Are You Real?",0, 6, 4, 5, 8, , , , , , 265, 225, 80, 300, true,"Burnham",crew_portraits_cm_burnham_fugitive_sm.png
"Mirror Burnham",2,4, 355,36,112,0,0,0,642,121,232,0,0,0,892,166,328,0,0,0,628,376,581,277,544,477,652,351,637,411,149,374,309,620,262,739,384,682,309,639,464,0,350,0,419,144,397,289,0,276,439,562,"Mirror Universe, Undercover Operative, Federation, Starfleet, Civilian, Astrophysicist, Xenoanthropology, Human","female, organic, dsc, burnham, crew_max_rarity_4","The Old Michael Burnham is Dead",0, 9, 6, 10, 10, , , , , , 495, 200, 145, 440, false,"Burnham",crew_portraits_cm_burnham_mirror_sm.png
"Fungal Entity May",8,5, 0,0,0,1005,134,261,1286,175,391,0,0,0,0,0,0,0,0,0,287,215,710,767,677,10,222,302,175,137,225,101,728,556,677,434,339,0,0,0,43,273,456,257,212,363,185,0,0,0,354,587,"jahSepp, Desperate, Survivalist, Mirror Universe, Resourceful","female, nonhuman, organic, dsc, may_fungus, crew_max_rarity_5","What A Team We Are!",2, 6, 8, 6, 16, 2, 0, , , , 150, 100, 185, 25, false,"May",crew_portraits_cm_may_fungus_sm.png
"Mirror K'Ehleyr",8,4, 394,60,160,0,0,0,672,161,354,0,0,0,622,36,109,0,0,0,635,338,586,422,550,464,733,572,714,402,291,365,558,711,479,656,225,610,527,564,296,0,720,0,265,271,232,696,0,600,597,643,"Klingon, Brutal, Tactician, Duelist, Human, Klingon-Cardassian Alliance, Mirror Universe","nonhuman, female, organic, kehleyr, mirror, original, ds9, tng, crew_max_rarity_4","I Do Bite",0, 7, 12, 10, 14, 1, 2, , , , 150, 260, 308, 75, false,"K'Ehleyr",crew_portraits_cm_kehleyrmirror_sm.png
