crew, tier, rarity, CMD_core, CMD_min, CMD_max, SCI_core, SCI_min, SCI_max, SEC_core, SEC_min, SEC_max, ENG_core, ENG_min, ENG_max, DIP_core, DIP_min, DIP_max, MED_core, MED_min, MED_max, V_CMD_SCI, V_CMD_SEC, V_CMD_ENG, V_CMD_DIP, V_CMD_MED, V_SCI_SEC, V_SCI_ENG, V_SCI_DIP, V_SCI_MED, V_SEC_ENG, V_SEC_DIP, V_SEC_MED, V_ENG_DIP, V_ENG_MED, V_DIP_MED, G_CMD_SCI, G_CMD_SEC, G_CMD_ENG, G_CMD_DIP, G_CMD_MED, G_SCI_SEC, G_SCI_ENG, G_SCI_DIP, G_SCI_MED, G_SEC_ENG, G_SEC_DIP, G_SEC_MED, G_ENG_DIP, G_ENG_MED, G_DIP_MED, voyage_rank, gauntlet_rank, traits, hidden_traits, action_name, action_bonus_type, action_bonus_amount, action_initial_cooldown, action_duration, action_cooldown, bonus_ability, trigger, uses_per_battle, penalty_type, penalty_amount, accuracy, crit_bonus, crit_chance, evasion, charge_phases, short_name, image_name, symbol
"Investigator Odo",8,1, 0,0,0,0,0,0,217,37,171,0,0,0,0,0,0,0,0,0,0,1142,0,0,0,1195,0,0,0,1036,1254,972,0,0,0,0,1057,0,0,0,1057,0,0,0,931,1174,880,0,0,0,1453,1445,"Changeling, Cardassian, Investigator, Interrogator","nonhuman, male, organic, ds9, odo, crew_max_rarity_1","Collaboration",2, 1, 20, 14, 10, , , , , , 400, 115, 67, 265, false,"Odo",crew_portraits_cm_odooccupation_sm.png,odo_occupation_crew
"Constable Odo",6,3, 317,107,225,0,0,0,523,27,85,0,0,0,0,0,0,0,0,0,1091,723,1012,1147,934,1024,0,0,0,897,1124,824,0,0,0,812,690,754,930,684,1194,0,0,0,1028,1258,970,0,0,0,1345,1352,"Changeling, Bajoran, Constable, Investigator, Interrogator","nonhuman, male, organic, ds9, odo, crew_max_rarity_3","Justice",0, 6, 10, 12, 16, , , , 3, 800, 520, 300, 75, , false,"Odo",crew_portraits_cm_odostandard_sm.png,odo_constable_crew
"Ensign Ro",9,2, 322,46,132,0,0,0,0,0,0,0,0,0,0,0,0,0,0,0,1174,1126,1098,1208,1019,0,0,0,0,0,0,0,0,0,0,1132,1097,1056,1175,977,0,0,0,0,0,0,0,0,0,0,1446,1448,"Starfleet, Bajoran, Resourceful","nonhuman, female, organic, tng, ro, crew_max_rarity_2","Separate Ways",0, 4, 3, 10, 5, , , 2, , , 130, 210, 13, 200, false,"Ro",crew_portraits_cm_roensign_sm.png,ro_ensign_crew
"Shinzon",10,5, 819,94,241,0,0,0,938,183,435,0,0,0,546,176,390,0,0,0,701,161,617,322,532,425,0,797,0,372,146,277,749,0,639,809,186,750,225,680,309,0,457,0,285,58,213,385,0,356,613,189,"Human, Clone, Reman, Villain, Romulan","male, organic, tng, shinzon, crew_max_rarity_5","Destiny Complete",0, 7, 14, 3, 14, 1, 2, , , , 1325, 545, 365, 1050, false,"Shinzon",crew_portraits_cm_shinzon_sm.png,shinzon_crew
"Will Riker",6,1, 251,42,110,0,0,0,125,22,74,0,0,0,0,0,0,0,0,0,1191,1048,1123,1231,1038,1224,0,0,0,1057,1280,998,0,0,0,1165,979,1086,1201,1014,1209,0,0,0,1044,1270,982,0,0,0,1438,1429,"Human, Federation, Starfleet, Maverick, Gambler, Romantic","male, organic, tng, riker, crew_max_rarity_1","Poker Face",0, 1, 8, 10, 14, 4, 0, , , , 455, , 425, 340, false,"Riker",crew_portraits_cm_rikers1_sm.png,riker_s1_commander_crew
"Commander Riker",1,2, 279,78,191,0,0,0,124,29,89,0,0,0,290,22,64,0,0,0,1172,1011,1097,954,1018,1220,0,1178,0,1053,1144,994,1158,0,1005,940,772,890,887,814,1191,0,1211,0,1027,1182,968,1191,0,1031,1378,1340,"Human, Federation, Starfleet, Pilot, Maverick, Gambler, Romantic","male, organic, tng, riker, crew_max_rarity_2","Liase",0, 2, 8, 10, 14, 5, 0, , , , 645, 50, 295, 275, false,"Riker",crew_portraits_cm_rikerpoker_sm.png,riker_s2_commander_crew
"Edith Keeler",8,4, 0,0,0,0,0,0,0,0,0,0,0,0,453,166,339,591,187,590,0,0,0,986,553,0,0,883,405,0,1004,527,837,351,160,0,0,0,675,111,0,0,554,118,0,663,120,468,48,16,1255,538,"Civilian, Caregiver, Inspiring, Cultural Figure, Romantic, Human","female, organic, tos, keeler, crew_max_rarity_4","A Life Worth Living",1, 7, 8, 10, 8, , , , , , 690, 25, 52, 440, false,"Keeler",crew_portraits_cm_edithkeeler_sm.png,keeler_crew
"Ensign Tuvok",7,1, 0,0,0,181,51,197,0,0,0,0,0,0,138,33,74,0,0,0,1209,0,0,1268,0,1204,877,1086,755,0,1276,0,1202,0,1045,1005,0,0,1244,0,973,685,823,591,0,1263,0,1169,0,1012,1439,1402,"Vulcan, Federation, Starfleet, Telepath","nonhuman, male, organic, voy, tuvok, crew_max_rarity_1","Memory",0, 1, 1, 14, 10, , , , , , 103, 60, 135, 375, false,"Tuvok",crew_portraits_cm_tuvokensign_sm.png,tuvok_ensign_crew
"Security Chief Tuvok",4,3, 291,53,161,145,45,149,445,85,201,0,0,0,0,0,0,0,0,0,968,759,1107,1210,1026,726,889,1213,767,890,1120,819,0,0,0,697,608,1006,1113,924,534,799,1100,699,796,1034,747,0,0,0,1320,1242,"Vulcan, Federation, Starfleet, Telepath, Tactician, Investigator","nonhuman, male, organic, voy, tuvok, crew_max_rarity_3","Contingency Plan",0, 4, 10, 12, 16, 5, 0, , , , 465, 50, , 300, false,"Tuvok",crew_portraits_cm_tuvokrifle_sm.png,tuvok_rifle_crew
"Major Kira",5,2, 273,37,126,0,0,0,304,60,176,0,0,0,0,0,0,0,0,0,1182,847,1115,1218,1030,1162,0,0,0,1004,1229,939,0,0,0,1151,763,1073,1187,997,990,0,0,0,873,1121,825,0,0,0,1402,1384,"Bajoran, Veteran, Resourceful","nonhuman, female, organic, ds9, kira, crew_max_rarity_2","Obstinance",0, 2, 0, 10, 14, 6, 0, , , , 295, 150, 5, , true,"Kira",crew_portraits_cm_kirashorthair_sm.png,kira_major_shorthair_crew
"Mirror Intendant Kira",6,5, 512,183,363,0,0,0,1052,272,542,0,0,0,946,67,184,0,0,0,813,160,738,284,666,325,0,680,0,292,64,204,608,0,516,433,37,350,298,306,125,0,1001,0,131,86,92,963,0,830,445,144,"Bajoran, Cardassian, Klingon, Villain, Klingon-Cardassian Alliance, Brutal, Mirror Universe","nonhuman, female, organic, ds9, kira, crew_max_rarity_5","Instability",0, 6, 6, 10, 12, 4, 0, , , , 915, 225, 90, 1525, true,"Kira",crew_portraits_cm_kiraintendant_sm.png,kira_mirror_crew
"Security Chief Worf",7,2, 205,57,144,0,0,0,326,61,145,0,0,0,0,0,0,0,0,0,1206,890,1132,1243,1048,1151,0,0,0,999,1222,931,0,0,0,1091,746,1028,1137,944,1065,0,0,0,942,1178,886,0,0,0,1410,1377,"Klingon, Federation, Starfleet, Duelist, Investigator","nonhuman, male, organic, tng, worf, crew_max_rarity_2","They Have No Honor",2, 4, 8, 10, 12, , , , 1, 2, 165, 280, 95, 155, false,"Worf",crew_portraits_cm_worf_sm.png,worf_security_chief_crew
"Defiant Commander Worf",8,4, 364,241,488,0,0,0,609,179,394,0,0,0,0,0,0,0,0,0,868,384,797,972,724,699,0,0,0,632,897,549,0,0,0,196,51,149,372,119,379,0,0,0,342,562,272,0,0,0,1262,426,"Klingon, Federation, Starfleet, Duelist, Tactician","nonhuman, male, organic, ds9, worf, crew_max_rarity_4","Good Day to Die",2, 6, 12, 12, 12, 4, 0, , 1, 2, 690, 645, 325, 205, false,"Worf",crew_portraits_cm_worfdefiant_sm.png,worf_defiant_commander_crew
"Mirror Regent Worf",7,5, 861,294,589,0,0,0,1062,175,357,0,0,0,0,0,0,0,0,0,410,109,343,606,271,374,0,0,0,328,565,246,0,0,0,90,29,68,218,50,438,0,0,0,408,621,331,0,0,0,704,264,"Klingon, Cardassian, Tactician, Villain, Brutal, Klingon-Cardassian Alliance, Mirror Universe","nonhuman, male, organic, ds9, worf, crew_max_rarity_5","Position of Strength",0, 9, 8, 8, 10, , , , , , 300, 980, 390, , false,"Worf",crew_portraits_cm_worfmirror_sm.png,worf_mirror_crew
"Yeoman Rand",9,1, 164,15,58,0,0,0,0,0,0,0,0,0,117,19,60,0,0,0,1224,1169,1160,1216,1075,0,0,1223,0,0,1282,0,1209,0,1048,1221,1166,1157,1205,1070,0,0,1213,0,0,1277,0,1197,0,1036,1448,1452,"Federation, Starfleet, Human","female, organic, tos, rand, crew_max_rarity_1","Signature Required",2, 2, 8, 10, 12, , , , 1, 1, 375, , , 180, false,"Rand",crew_portraits_cm_randyeoman_sm.png,rand_yeoman_crew
"The Duras Sisters",9,4, 311,83,205,0,0,0,658,150,385,0,0,0,464,170,341,0,0,0,1126,503,1051,721,973,687,0,875,0,617,353,538,827,0,706,900,286,856,304,781,433,0,543,0,405,99,327,459,0,410,1088,410,"Klingon, Scoundrel, Villain","nonhuman, female, organic, tng, betor, lursa, exclusive_fusion, crew_max_rarity_4","The Power of Two",0, 9, 10, 20, 12, , , 1, , , 350, 110, 190, 500, false,"Duras Sisters",crew_portraits_cm_duras_sisters_sm.png,duras_sisters_crew
"Persis",7,2, 0,0,0,0,0,0,253,94,250,0,0,0,303,39,88,0,0,0,0,1120,0,1214,0,1158,0,1168,0,1003,938,936,1149,0,997,0,836,0,1229,0,752,0,1173,0,696,709,640,1150,0,996,1397,1346,"Human, Augments, Engineered, Survivalist, Tactician","nonhuman, female, organic, ent, persis, crew_max_rarity_2","Augmented Strength",0, 2, 6, 10, 6, 7, 0, 2, , , 240, 330, 300, , false,"Persis",crew_portraits_cm_persis_sm.png,persis_crew
"Telek R'Mor",7,2, 0,0,0,347,52,194,119,8,44,0,0,0,263,30,113,0,0,0,1109,1175,0,1225,0,980,806,812,703,1058,1176,999,1159,0,1006,1017,1170,0,1214,0,862,691,772,595,1056,1197,997,1136,0,988,1375,1365,"Romulan, Astrophysicist","nonhuman, male, organic, voy, rmor, crew_max_rarity_2","Solitary Survey",1, 3, 10, 12, 10, 0, 2, , , , 405, 50, 3, 180, false,"R'Mor",crew_portraits_cm_telekrmor_sm.png,rmor_voyager_crew
"KDF Gowron",9,4, 375,85,222,0,0,0,296,100,256,0,0,0,641,173,418,0,0,0,1048,750,978,537,902,1115,0,758,0,959,518,899,700,0,589,863,423,809,230,741,731,0,425,0,672,153,621,345,0,324,1158,547,"Klingon, Duelist, Diplomat, Politician","nonhuman, male, organic, tng, gowron, crew_max_rarity_4","What Can Be Done",1, 6, 14, 10, 14, 0, 2, , , , 625, 465, 85, 1000, false,"Gowron",crew_portraits_cm_gowronyoung_sm.png,gowron_kdf_crew
"Third Remata'Klan",7,3, 410,42,84,0,0,0,467,85,185,0,0,0,0,0,0,0,0,0,1096,712,1021,1159,943,999,0,0,0,877,1106,804,0,0,0,1188,767,1113,1222,1030,910,0,0,0,817,1060,769,0,0,0,1339,1385,"Jem'hadar, Dominion, Duelist, Tactician","nonhuman, male, organic, ds9, remataklan, crew_max_rarity_3","Victory is Life",0, 3, 0, 6, 8, 4, 4, , , , 690, 395, 597, 600, true,"Remata'Klan",crew_portraits_cm_remataklan_sm.png,remataklan_crew
"Ensign Chapel",10,1, 0,0,0,0,0,0,0,0,0,0,0,0,0,0,0,214,34,152,0,0,0,0,1054,0,0,0,757,0,0,978,0,698,1024,0,0,0,0,980,0,0,0,710,0,0,920,0,654,942,1457,1449,"Human, Federation, Starfleet, Nurse","female, organic, tos, chapel, crew_max_rarity_1","Administer Prescription",2, 1, 6, 10, 10, , , , , , 130, , 40, 100, false,"Chapel",crew_portraits_cm_chapelensign_sm.png,chapel_ensign_crew
"Ensign Ogawa",7,1, 0,0,0,0,0,0,0,0,0,0,0,0,0,0,0,213,34,166,0,0,0,0,1051,0,0,0,754,0,0,976,0,696,1020,0,0,0,0,966,0,0,0,688,0,0,905,0,642,923,1456,1446,"Human, Federation, Starfleet, Nurse","female, organic, tng, ogawa, crew_max_rarity_1","Report to Sickbay",2, 1, 6, 1, 8, 2, 0, 1, , , 170, , 35, 105, false,"Ogawa",crew_portraits_cm_ogawaensign_sm.png,ogawa_ensign_crew
"Wesley Crusher",8,1, 0,0,0,218,43,149,0,0,0,174,32,78,0,0,0,0,0,0,1201,0,1156,0,0,1199,756,1192,752,1051,0,0,1195,711,0,1125,0,1129,0,0,1111,583,1104,702,1032,0,0,1167,698,0,1434,1421,"Human, Federation, Civilian, Prodigy","male, organic, tng, wesley, crew_max_rarity_1","Study",1, 2, 8, 10, 12, , , , 0, 1, 215, 125, 70, 55, false,"Wesley",crew_portraits_cm_wesleysweater_sm.png,wesley_sweater_crew
"Ensign Crusher",9,3, 176,11,31,426,83,229,0,0,0,347,34,78,0,0,0,0,0,0,820,1170,960,1266,1076,1020,479,1050,641,1019,0,0,1145,681,0,798,1171,1090,1272,1078,833,434,900,509,1030,0,0,1165,697,0,1323,1348,"Human, Federation, Starfleet, Prodigy, Warp Theorist","male, organic, tng, wesley, crew_max_rarity_3","Rewire",2, 4, 6, 8, 10, 6, 0, , , , 290, , , 190, false,"Wesley",crew_portraits_cm_wesley_sm.png,wesley_full_ensign_crew
"Acting Ensign Crusher",9,2, 114,29,58,258,56,160,0,0,0,251,53,148,0,0,0,0,0,0,1055,1174,997,1274,1080,1184,591,1170,744,1030,0,0,1156,688,0,886,1158,873,1256,1059,1045,439,1056,647,957,0,0,1062,635,0,1387,1333,"Human, Federation, Starfleet, Prodigy","male, organic, tng, wesley, crew_max_rarity_2","Invention",1, 4, 3, 6, 6, , , 2, , , 205, 50, 25, 165, false,"Wesley",crew_portraits_cm_wesleyensign_sm.png,wesley_acting_ensign_crew
"Formal Dress Wesley Crusher",9,4, 0,0,0,662,173,422,0,0,0,270,108,230,481,160,342,0,0,0,715,0,1087,971,0,674,265,235,403,1000,987,0,527,668,702,409,0,769,678,0,365,75,50,234,708,667,0,100,429,420,1083,300,"Human, Federation, Starfleet, Prodigy, Warp Theorist","male, organic, tng, wesley, crew_max_rarity_4","Duty to the Truth",1, 9, 4, 10, 12, , , , , , 300, 500, 30, 450, false,"Wesley",crew_portraits_cm_wesleydressuniform_sm.png,wesley_formal_dress_crew
"Wrathful Khan",7,5, 1040,206,421,0,0,0,1145,72,143,376,140,288,0,0,0,0,0,0,361,112,86,575,240,415,740,0,0,110,619,268,1015,593,0,310,265,25,502,201,1034,426,0,0,263,1160,864,621,324,0,564,504,"Human, Augments, Engineered, Villain, Cultural Figure, Tactician, Resourceful, Survivalist, Brutal","nonhuman, male, organic, tos, khan, crew_max_rarity_5","I Stab at Thee",2, 9, 12, 5, 12, 1, 0, , , , 640, 595, 345, 850, false,"Khan",crew_portraits_cm_khan_sm.png,khan_wok_crew
"Tailor Garak",5,3, 0,0,0,0,0,0,502,44,126,161,22,44,395,83,219,0,0,0,0,1018,1162,1107,0,1015,896,1058,0,685,760,818,817,713,887,0,1108,1160,989,0,1137,898,917,0,874,713,928,725,715,745,1301,1321,"Cardassian, Undercover Operative, Scoundrel, Interrogator, Civilian","nonhuman, male, organic, ds9, garak, crew_max_rarity_3","Cutting Cloth",1, 5, 8, 12, 12, , , , , , 125, 230, 20, 405, false,"Garak",crew_portraits_cm_garaktailor_sm.png,garak_tailor_crew
"Bartender Quark",3,1, 110,25,77,0,0,0,81,15,57,0,0,0,211,36,150,0,0,0,1229,1157,1165,1173,1078,1226,0,1195,0,1059,1226,1000,1175,0,1018,1205,1102,1136,1007,1050,1220,0,1113,0,1053,1086,995,1081,0,940,1426,1397,"Ferengi, Bartender, Civilian, Scoundrel, Gambler, Merchant","nonhuman, male, organic, ds9, quark, crew_max_rarity_1","Hospitality",1, 2, 8, 10, 12, , , , 2, 1, 165, 10, 10, 140, false,"Quark",crew_portraits_cm_quarkbartender_sm.png,quark_s1_bartender_crew
"Richard Castillo",8,3, 487,109,227,286,57,187,0,0,0,0,0,0,0,0,0,0,0,0,662,952,879,1024,800,1169,860,1164,736,0,0,0,0,0,0,408,837,747,922,677,983,697,1011,600,0,0,0,0,0,0,1344,1300,"Human, Hero, Pilot, Starfleet, Federation, Displaced","male, organic, castillo, tng, crew_max_rarity_3","Self Sacrifice",0, 5, 12, 12, 10, 7, 0, , 1, 2, 650, 265, 129, 585, false,"Castillo",crew_portraits_cm_richardcastillo_sm.png,castillo_lieutenant_crew
"Writer Jake Sisko",10,3, 0,0,0,0,0,0,0,0,0,0,0,0,451,70,198,0,0,0,0,0,0,1093,0,0,0,1040,0,0,1115,0,1002,0,869,0,0,0,1038,0,0,0,965,0,0,1068,0,922,0,798,1424,1428,"Human, Federation, Civilian, Writer, Gambler, Romantic","male, organic, ds9, jake, crew_max_rarity_3","Construct Story",2, 3, 0, 8, 10, 6, 0, , , , 995, 350, 47, 640, true,"Jake",crew_portraits_cm_jakewriter_sm.png,jake_writer_crew
"CMO Crusher",10,2, 0,0,0,0,0,0,0,0,0,0,0,0,0,0,0,290,52,174,0,0,0,0,1029,0,0,0,740,0,0,955,0,683,992,0,0,0,0,917,0,0,0,632,0,0,853,0,605,873,1447,1442,"Human, Starfleet, Federation, Physician, Caregiver, Cyberneticist","female, organic, tng, crusher, crew_max_rarity_2","Doctor's Calluses",2, 3, 6, 10, 10, , , , , , 185, , 35, 155, false,"Crusher",crew_portraits_cm_crusherwithlabcoat_sm.png,crusher_labcoat_crew
"Commando Crusher",6,3, 0,0,0,182,76,200,308,93,193,0,0,0,0,0,0,510,44,132,1195,1099,0,0,890,776,874,1189,416,976,1203,488,0,587,876,947,935,0,0,989,397,625,960,370,797,1035,447,0,664,956,1296,1215,"Human, Starfleet, Federation, Physician, Cyberneticist, Undercover Operative","female, organic, tng, crusher, crew_max_rarity_3","Repel Disease",0, 3, 6, 3, 12, 1, 0, , , , 575, , 370, 500, false,"Crusher",crew_portraits_cm_crusherblackcommandouniform_sm.png,crusher_black_commando_uniform_crew
"Dr. Crusher",10,4, 275,38,110,0,0,0,437,90,201,0,0,0,0,0,0,736,123,300,1183,775,1116,1219,299,1021,0,0,411,893,1123,184,0,359,591,1170,705,1095,1206,298,866,0,0,391,790,1023,149,0,338,576,1188,1113,"Human, Starfleet, Federation, Physician, Cyberneticist","female, organic, tng, crusher, crew_max_rarity_4","Neutralize Disease",1, 7, 12, 12, 12, 4, 4, , , , 740, 250, 370, 500, false,"Crusher",crew_portraits_cm_crusherfromfirstcontact_sm.png,crusher_first_contact_crew
"Holonovel Doctor",9,4, 0,0,0,512,50,137,0,0,0,0,0,0,0,0,0,799,69,244,1018,0,0,0,558,986,713,1020,163,0,0,532,0,355,590,1133,0,0,0,758,1120,810,1114,306,0,0,705,0,478,721,1274,1338,"Hologram, Human, Federation, Starfleet, Physician, Musician, Scoundrel","nonhuman, male, artificial_life, voy, emh, crew_max_rarity_4","Suggested Treatment",0, 7, 12, 12, 12, , , , , , 365, 370, 205, 525, false,"Doctor",crew_portraits_cm_doctorgolfclub_sm.png,emh_authorauthor_crew
"Mobile Doctor",10,5, 0,0,0,809,106,209,0,0,0,0,0,0,393,137,435,1191,110,334,710,0,0,1013,235,672,480,261,33,0,1028,227,870,140,68,873,0,0,603,528,826,561,142,126,0,577,509,376,315,68,622,445,"Hologram, Human, Federation, Starfleet, Musician, Physician","nonhuman, male, artificial_life, voy, emh, crew_max_rarity_5","House Call",2, 9, 12, 12, 12, , , , , , 1825, 600, , 600, false,"Doctor",crew_portraits_cm_emhmobile_sm.png,emh_mobileholoemitter_crew
"Comm Officer Uhura",6,1, 0,0,0,0,0,0,0,0,0,0,0,0,258,28,89,0,0,0,0,0,0,1236,0,0,0,1187,0,0,1253,0,1167,0,1012,0,0,0,1238,0,0,0,1184,0,0,1256,0,1161,0,1004,1452,1457,"Federation, Starfleet, Human, Musician, Communicator","female, organic, tos, uhura, crew_max_rarity_1","Incoming Message",2, 2, 8, 10, 12, , , , 1, 1, 320, , , 495, false,"Uhura",crew_portraits_cm_uhurared_sm.png,uhura_red_crew
"Commander Uhura",10,4, 459,128,299,0,0,0,0,0,0,0,0,0,592,198,429,0,0,0,922,934,861,457,773,0,0,767,0,0,889,0,708,0,597,653,714,569,128,523,0,0,373,0,0,474,0,284,0,274,1270,841,"Federation, Starfleet, Human, Musician, Communicator","female, organic, tos, uhura, crew_max_rarity_4","Hailing Frequencies",0, 8, 12, 26, 12, , , 1, , , 1165, , 75, 790, false,"Uhura",crew_portraits_cm_uhurawrathofkhan_sm.png,uhura_wrathofkhan_crew
"Dancing Uhura",9,5, 1026,84,195,0,0,0,0,0,0,0,0,0,1185,193,393,0,0,0,569,646,492,94,412,0,0,386,0,0,484,0,297,0,283,918,938,875,260,799,0,0,429,0,0,555,0,357,0,331,692,1105,"Human, Federation, Starfleet, Communicator, Casual, Musician, Artist","female, organic, tos, uhura, original, crew_max_rarity_5","Take The Lead",0, 8, 10, 3, 14, 1, 1, , , , 465, 260, 60, 400, false,"Uhura",crew_portraits_cm_uhura_dancing_sm.png,uhura_dancing_crew
"First Maje Culluh",9,3, 466,93,223,0,0,0,307,42,138,0,0,0,0,0,0,0,0,0,994,743,923,1066,845,1174,0,0,0,1017,1237,953,0,0,0,844,611,785,947,717,1124,0,0,0,977,1208,921,0,0,0,1357,1331,"Kazon, Scoundrel","nonhuman, male, organic, voy, culluh, crew_max_rarity_3","Nistrim Supremacy",2, 3, 6, 10, 10, 8, 4, , , , 665, 325, 133, 390, false,"Culluh",crew_portraits_cm_jalculluh_sm.png,culluh_crew
"KDF Alexander",7,2, 137,19,79,0,0,0,331,64,148,145,16,72,0,0,0,0,0,0,1226,994,1113,1269,1077,1144,897,0,0,856,1214,922,1203,715,0,1208,893,1050,1250,1053,1046,892,0,0,771,1167,869,1189,709,0,1394,1386,"Human, Klingon","male, organic, ds9, alexander, nonhuman, crew_max_rarity_2","Beginner's Luck",1, 3, 10, 12, 10, 5, 2, , , , 130, 200, 62, 15, false,"Alexander",crew_portraits_cm_alexanderkdf_sm.png,alexander_kdf_crew
"Commando Shran",9,4, 673,114,239,0,0,0,592,89,182,0,0,0,318,144,282,0,0,0,753,411,670,568,591,819,0,1063,0,736,610,657,1034,0,892,771,468,697,334,633,908,0,720,0,815,369,767,625,0,563,1085,847,"Andorian, Tactician, Inspiring, Imperial Guard","nonhuman, male, organic, ent, shran, crew_max_rarity_4","Debt Owed",0, 8, 6, 8, 10, , , 3, , , 390, 575, 288, 350, false,"Shran",crew_portraits_cm_shrancommando_sm.png,shran_commando_crew
"Ushaan Shran",10,5, 989,83,164,0,0,0,1076,170,348,0,0,0,424,134,288,0,0,0,615,131,541,361,458,369,0,971,0,326,178,242,934,0,798,985,333,937,457,854,459,0,727,0,425,154,354,635,0,570,606,660,"Andorian, Duelist, Romantic, Imperial Guard","nonhuman, male, organic, ent, shran, crew_max_rarity_5","Debt Owed",0, 9, 6, 8, 10, , , 3, , , 1440, 565, 483, 390, false,"Shran",crew_portraits_cm_shrandueling_sm.png,shran_dueling_crew
"Fencing Sulu",9,4, 444,99,249,385,36,92,609,203,448,0,0,0,0,0,0,0,0,0,657,440,929,1075,854,345,825,1133,717,613,883,535,0,0,0,568,160,718,895,652,147,870,1174,753,247,422,182,0,0,0,1133,726,"Human, Federation, Starfleet, Pilot, Resourceful, Duelist","male, organic, tos, sulu, crew_max_rarity_4","Parry Attack",0, 6, 12, 8, 12, 6, 4, , , , 415, , 225, 225, false,"Sulu",crew_portraits_cm_sulufencing_sm.png,sulu_fencing_crew
"Morn",9,3, 0,0,0,0,0,0,359,70,174,0,0,0,418,121,295,0,0,0,0,1064,0,1067,0,1106,0,987,0,951,785,890,949,0,814,0,992,0,822,0,971,0,733,0,856,420,813,645,0,579,1333,1260,"Lurian, Courier, Duelist, Civilian, Gambler, Smuggler","nonhuman, male, organic, ds9, morn, crew_max_rarity_3","Drinking Spot",0, 3, 0, 8, 8, , , , 1, 2, 150, 285, 57, 655, true,"Morn",crew_portraits_cm_morn_sm.png,morn_crew
"Seven in Blue",9,2, 0,0,0,294,51,209,0,0,0,278,53,130,0,0,0,0,0,0,1168,0,1114,0,0,1155,545,1153,730,1027,0,0,1151,686,0,979,0,1060,0,0,953,416,987,576,978,0,0,1086,655,0,1401,1366,"Human, Borg, Civilian, Federation","nonhuman, female, organic, voy, seven, crew_max_rarity_2","Ignore Irrelevancies",1, 2, 8, 10, 14, 4, 0, , , , 75, 50, 310, 170, false,"Seven",crew_portraits_cm_seven_of_nine_sm.png,seven_allblue_crew
"Seven of Nine",8,5, 0,0,0,785,247,791,0,0,0,854,225,454,514,89,183,0,0,0,429,0,504,1025,0,398,49,152,245,467,1045,0,117,237,760,57,0,208,1026,0,46,3,13,42,230,1061,0,66,83,794,595,35,"Human, Borg, Civilian, Federation","nonhuman, female, organic, voy, seven, crew_max_rarity_5","New Collective",2, 7, 12, 10, 14, 4, 0, , , , 1750, , 705, 440, false,"Seven",crew_portraits_cm_sevenbluegreyshoulders_sm.png,seven_bluegreyshoulders_crew
"Donik",10,3, 0,0,0,0,0,0,0,0,0,476,79,199,303,31,79,0,0,0,0,0,955,1215,0,0,723,1171,0,878,1241,0,689,575,999,0,0,891,1242,0,0,622,1192,0,811,1261,0,692,525,1009,1371,1391,"Hirogen, Innovator","nonhuman, male, organic, voy, donik, crew_max_rarity_3","Hunting Program",2, 4, 12, 12, 10, 7, 0, , , , 870, 165, , 340, false,"Donik",crew_portraits_cm_donik_sm.png,donik_crew
"Commander Tucker",8,2, 252,28,82,0,0,0,0,0,0,305,53,185,0,0,0,0,0,0,1204,1145,806,1240,1046,0,859,0,0,1008,0,0,1137,673,0,1200,1144,740,1241,1046,0,701,0,0,878,0,0,981,584,0,1413,1403,"Human, Starfleet, Jury Rigger, Pilot, Explorer","male, organic, ent, tucker, crew_max_rarity_2","Warp Engines Online",1, 2, 6, 3, 8, 2, 0, , , , 520, 35, 50, 165, false,"Trip",crew_portraits_cm_tucker_sm.png,tucker_commander_crew
"Counselor Troi",6,1, 0,0,0,0,0,0,0,0,0,0,0,0,261,42,108,147,49,131,0,0,0,1224,1071,0,0,1177,768,0,1246,990,1157,709,882,0,0,0,1207,986,0,0,1155,718,0,1236,922,1124,660,694,1428,1414,"Federation, Starfleet, Human, Betazoid, Empath, Counselor","nonhuman, female, organic, tng, troi, crew_max_rarity_1","Counselling",2, 1, 6, 10, 10, , , , , , 265, , 80, 345, false,"Troi",crew_portraits_cm_troitng_sm.png,troi_casualgray_crew
"Rakal Troi",6,4, 521,163,354,0,0,0,525,128,331,0,0,0,0,0,0,407,163,440,818,449,744,934,198,795,0,0,527,713,973,210,0,479,729,475,169,393,640,16,562,0,0,221,500,724,23,0,143,316,1014,161,"Federation, Starfleet, Human, Betazoid, Romulan, Empath, Undercover Operative, Tal Shiar","nonhuman, female, organic, tng, troi, crew_max_rarity_4","Romulan Disguise",1, 7, 12, 10, 14, 1, 2, , , , 90, 400, 175, 2825, false,"Troi",crew_portraits_cm_troirakal_sm.png,troi_rakal_crew
"Commander Troi",10,5, 0,0,0,0,0,0,383,203,253,0,0,0,1060,211,421,827,142,281,0,1006,0,567,520,993,0,428,387,872,169,97,343,319,38,0,678,0,529,561,567,0,367,392,507,79,77,280,339,55,625,212,"Federation, Starfleet, Human, Betazoid, Empath, Counselor","nonhuman, female, organic, tng, troi, crew_max_rarity_5","Empathic Sense",1, 8, 6, 6, 6, , , , , , 1375, 475, 135, 725, true,"Troi",crew_portraits_cm_troifirstcontact_sm.png,troi_firstcontact_crew
"Vedek Winn Adami",8,3, 307,97,207,0,0,0,0,0,0,0,0,0,410,92,214,0,0,0,1122,1087,1048,822,971,0,0,1055,0,0,1130,0,1022,0,883,869,894,815,541,747,0,0,907,0,0,1002,0,853,0,732,1355,1288,"Bajoran, Vedek, Cultural Figure, Spiritual","nonhuman, female, organic, ds9, winn, crew_max_rarity_3","Will of the Prophets",1, 4, 8, 10, 10, 4, 0, , , , , 270, 85, 830, false,"Winn",crew_portraits_cm_winnvedek_sm.png,winn_vedek_crew
"Subcommander T'Pol",7,3, 273,71,211,520,21,77,165,35,77,0,0,0,0,0,0,0,0,0,703,979,1094,1207,1016,740,739,1053,643,1052,1273,991,0,0,0,738,766,868,1008,791,1058,888,1202,766,1029,1259,971,0,0,0,1322,1334,"Vulcan, High Command, Astrophysicist, Telepath","nonhuman, female, organic, ent, tpol, crew_max_rarity_3","Logic",2, 5, 6, 10, 10, , , , , , 175, 120, 3, 100, false,"T'Pol",crew_portraits_cm_tpol_sm.png,tpol_subcommander_crew
"Commander T'Pol",9,4, 512,112,307,692,56,171,320,91,227,0,0,0,0,0,0,0,0,0,292,604,803,975,728,401,522,809,441,956,1182,894,0,0,0,295,358,587,793,538,428,726,1037,631,735,973,684,0,0,0,1129,994,"Vulcan, Starfleet, Astrophysicist, Telepath","nonhuman, female, organic, ent, tpol, crew_max_rarity_4","Vessel's Information",0, 5, 12, 12, 20, 2, 0, , , , 1400, 200, 70, 1175, false,"T'Pol",crew_portraits_cm_tpolcommander_sm.png,tpol_commander_crew
"Chef Neelix",1,1, 0,0,0,0,0,0,0,0,0,0,0,0,201,51,189,0,0,0,0,0,0,1235,0,0,0,1185,0,0,1251,0,1165,0,1011,0,0,0,1078,0,0,0,1012,0,0,1117,0,975,0,842,1451,1435,"Talaxian, Mylean, Resourceful, Survivalist, Chef, Civilian, Communicator","nonhuman, male, organic, voy, neelix, crew_max_rarity_1","Soup's On",1, 2, 12, 14, 10, 6, 0, , 2, 1, 305, , , 210, false,"Neelix",crew_portraits_cm_neelix_sm.png,neelix_chef_crew
"CMO 'Bones' McCoy",8,1, 0,0,0,0,0,0,0,0,0,0,0,0,0,0,0,213,48,196,0,0,0,0,1041,0,0,0,749,0,0,970,0,691,1010,0,0,0,0,879,0,0,0,601,0,0,818,0,580,840,1450,1433,"Human, Federation, Starfleet, Physician, Exobiology","male, organic, tos, mccoy, crew_max_rarity_1","Country Doctor",2, 3, 8, 10, 12, , , , 0, 2, 245, 10, 8, 285, false,"McCoy",crew_portraits_cm_mccoy_sm.png,mccoy_chief_medical_officer_crew
"Prisoner 'Bones' McCoy",7,3, 0,0,0,0,0,0,0,0,0,0,0,0,271,112,252,444,90,278,0,0,0,1189,867,0,0,1134,618,0,1200,791,1107,565,534,0,0,0,891,639,0,0,804,435,0,916,610,730,394,185,1347,1225,"Federation, Starfleet, Physician, Survivalist, Human, Desperate, Prisoner","male, organic, tos, mccoy, crew_max_rarity_3","Field Medicine",1, 5, 4, 4, 8, 3, 0, 2, , , 235, , 48, 517, false,"McCoy",crew_portraits_cm_mccoyrura_sm.png,mccoy_rura_pethe_prisoner_crew
