crew, tier, rarity, CMD_core, CMD_min, CMD_max, SCI_core, SCI_min, SCI_max, SEC_core, SEC_min, SEC_max, ENG_core, ENG_min, ENG_max, DIP_core, DIP_min, DIP_max, MED_core, MED_min, MED_max, V_CMD_SCI, V_CMD_SEC, V_CMD_ENG, V_CMD_DIP, V_CMD_MED, V_SCI_SEC, V_SCI_ENG, V_SCI_DIP, V_SCI_MED, V_SEC_ENG, V_SEC_DIP, V_SEC_MED, V_ENG_DIP, V_ENG_MED, V_DIP_MED, G_CMD_SCI, G_CMD_SEC, G_CMD_ENG, G_CMD_DIP, G_CMD_MED, G_SCI_SEC, G_SCI_ENG, G_SCI_DIP, G_SCI_MED, G_SEC_ENG, G_SEC_DIP, G_SEC_MED, G_ENG_DIP, G_ENG_MED, G_DIP_MED, voyage_rank, gauntlet_rank, traits, hidden_traits, action_name, action_bonus_type, action_bonus_amount, action_initial_cooldown, action_duration, action_cooldown, bonus_ability, trigger, uses_per_battle, penalty_type, penalty_amount, accuracy, crit_bonus, crit_chance, evasion, charge_phases, short_name, image_name, symbol
"Investigator Odo",0,1, 0,0,0,0,0,0,217,37,171,0,0,0,0,0,0,0,0,0,0,1329,0,0,0,1381,0,0,0,1211,1464,1104,0,0,0,0,1239,0,0,0,1240,0,0,0,1112,1385,1011,0,0,0,1674,1668,"Changeling, Cardassian, Investigator, Interrogator, Shapeshifter","nonhuman, male, organic, ds9, odo, crew_max_rarity_1","Collaboration",2, 1, 20, 14, 10, , , , , , 400, 115, 67, 265, false,"Odo",crew_portraits_cm_odooccupation_sm.png,odo_occupation_crew
"Constable Odo",0,3, 317,107,225,0,0,0,523,27,85,0,0,0,0,0,0,0,0,0,1279,864,1204,1350,1085,1178,0,0,0,1061,1320,942,0,0,0,959,834,902,1101,783,1381,0,0,0,1203,1471,1102,0,0,0,1565,1583,"Changeling, Bajoran, Constable, Investigator, Interrogator, Shapeshifter","nonhuman, male, organic, ds9, odo, crew_max_rarity_3","Justice",0, 6, 10, 12, 16, , , , 3, 800, 520, 300, 75, , false,"Odo",crew_portraits_cm_odostandard_sm.png,odo_constable_crew
"Ensign Ro",0,2, 322,46,132,0,0,0,0,0,0,0,0,0,0,0,0,0,0,0,1364,1313,1294,1414,1176,0,0,0,0,0,0,0,0,0,0,1326,1287,1253,1381,1134,0,0,0,0,0,0,0,0,0,0,1669,1672,"Starfleet, Bajoran, Resourceful","nonhuman, female, organic, tng, ro, crew_max_rarity_2","Separate Ways",0, 4, 3, 10, 5, , , 2, , , 130, 210, 13, 200, false,"Ro",crew_portraits_cm_roensign_sm.png,ro_ensign_crew
"Shinzon",0,5, 819,94,241,0,0,0,938,183,435,0,0,0,546,176,390,0,0,0,826,194,755,384,618,530,0,944,0,487,174,355,917,0,762,955,209,897,251,780,368,0,557,0,361,62,247,489,0,414,765,213,"Human, Clone, Reman, Villain, Romulan, Brutal, Crafty, Politician, Veteran, Vengeful","male, organic, tng, shinzon, crew_max_rarity_5","Destiny Complete",0, 7, 14, 3, 14, 1, 2, , , , 1325, 545, 365, 1050, false,"Shinzon",crew_portraits_cm_shinzon_sm.png,shinzon_crew
"Will Riker",0,1, 251,42,110,0,0,0,125,22,74,0,0,0,0,0,0,0,0,0,1382,1230,1318,1435,1195,1411,0,0,0,1232,1493,1130,0,0,0,1357,1154,1284,1410,1172,1395,0,0,0,1218,1483,1113,0,0,0,1661,1653,"Human, Federation, Starfleet, Maverick, Gambler, Romantic","male, organic, tng, riker, crew_max_rarity_1","Poker Face",0, 1, 8, 10, 14, 4, 0, , , , 455, , 425, 340, false,"Riker",crew_portraits_cm_rikers1_sm.png,riker_s1_commander_crew
"Commander Riker",0,2, 279,78,191,0,0,0,124,29,89,0,0,0,290,22,64,0,0,0,1362,1185,1292,1121,1173,1407,0,1365,0,1228,1348,1126,1363,0,1172,1095,918,1053,1053,926,1378,0,1398,0,1202,1394,1100,1397,0,1198,1603,1565,"Human, Federation, Starfleet, Pilot, Maverick, Gambler, Romantic, Playful","male, organic, tng, riker, crew_max_rarity_2","Liase",0, 2, 8, 10, 14, 5, 0, , , , 645, 50, 295, 275, false,"Riker",crew_portraits_cm_rikerpoker_sm.png,riker_s2_commander_crew
"Edith Keeler",0,4, 0,0,0,0,0,0,0,0,0,0,0,0,453,166,339,591,187,590,0,0,0,1155,626,0,0,1032,466,0,1199,622,1008,422,198,0,0,0,787,116,0,0,658,127,0,781,136,578,58,18,1475,672,"Civilian, Caregiver, Inspiring, Cultural Figure, Romantic, Human","female, organic, tos, keeler, crew_max_rarity_4","A Life Worth Living",1, 7, 8, 10, 8, , , , , , 690, 25, 52, 440, false,"Keeler",crew_portraits_cm_edithkeeler_sm.png,keeler_crew
"Ensign Tuvok",0,1, 0,0,0,181,51,197,0,0,0,0,0,0,138,33,74,0,0,0,1400,0,0,1474,0,1391,1072,1267,883,0,1489,0,1406,0,1210,1172,0,0,1450,0,1135,856,967,695,0,1477,0,1377,0,1180,1664,1623,"Vulcan, Federation, Starfleet, Telepath","nonhuman, male, organic, voy, tuvok, crew_max_rarity_1","Memory",0, 1, 1, 14, 10, , , , , , 103, 60, 135, 375, false,"Tuvok",crew_portraits_cm_tuvokensign_sm.png,tuvok_ensign_crew
"Security Chief Tuvok",0,3, 291,53,161,145,45,149,445,85,201,0,0,0,0,0,0,0,0,0,1144,901,1306,1416,1185,867,1084,1400,893,1058,1318,941,0,0,0,822,714,1199,1320,1073,630,995,1288,824,948,1226,860,0,0,0,1543,1466,"Vulcan, Federation, Starfleet, Telepath, Tactician, Investigator","nonhuman, male, organic, voy, tuvok, crew_max_rarity_3","Contingency Plan",0, 4, 10, 12, 16, 5, 0, , , , 465, 50, , 300, false,"Tuvok",crew_portraits_cm_tuvokrifle_sm.png,tuvok_rifle_crew
"Major Kira",0,2, 273,37,126,0,0,0,304,60,176,0,0,0,0,0,0,0,0,0,1373,1004,1310,1424,1186,1344,0,0,0,1178,1440,1070,0,0,0,1344,902,1269,1394,1154,1161,0,0,0,1041,1328,946,0,0,0,1626,1606,"Bajoran, Veteran, Resourceful","nonhuman, female, organic, ds9, kira, crew_max_rarity_2","Obstinance",0, 2, 0, 10, 14, 6, 0, , , , 295, 150, 5, , true,"Kira",crew_portraits_cm_kirashorthair_sm.png,kira_major_shorthair_crew
"Mirror Intendant Kira",0,5, 512,183,363,0,0,0,1052,272,542,0,0,0,946,67,184,0,0,0,954,193,886,351,769,398,0,813,0,379,78,255,763,0,621,528,42,452,357,357,157,0,1163,0,177,100,109,1146,0,972,605,161,"Bajoran, Cardassian, Klingon, Villain, Klingon-Cardassian Alliance, Brutal, Mirror Universe, Crafty","nonhuman, female, organic, ds9, kira, crew_max_rarity_5","Instability",0, 6, 6, 10, 12, 4, 0, , , , 915, 225, 90, 1525, true,"Kira",crew_portraits_cm_kiraintendant_sm.png,kira_mirror_crew
"Security Chief Worf",0,2, 205,57,144,0,0,0,326,61,145,0,0,0,0,0,0,0,0,0,1396,1042,1327,1447,1205,1335,0,0,0,1173,1433,1063,0,0,0,1286,891,1224,1346,1100,1245,0,0,0,1115,1389,1014,0,0,0,1634,1600,"Klingon, Federation, Starfleet, Duelist, Investigator","nonhuman, male, organic, tng, worf, crew_max_rarity_2","They Have No Honor",2, 4, 8, 10, 12, , , , 1, 2, 165, 280, 95, 155, false,"Worf",crew_portraits_cm_worf_sm.png,worf_security_chief_crew
"Defiant Commander Worf",0,4, 364,241,488,0,0,0,609,179,394,0,0,0,0,0,0,0,0,0,1010,478,948,1140,820,827,0,0,0,766,1063,645,0,0,0,232,56,197,446,129,465,0,0,0,436,679,332,0,0,0,1487,565,"Klingon, Federation, Starfleet, Duelist, Tactician, Veteran","nonhuman, male, organic, ds9, worf, crew_max_rarity_4","Good Day to Die",2, 6, 12, 12, 12, 4, 0, , 1, 2, 690, 645, 325, 205, false,"Worf",crew_portraits_cm_worfdefiant_sm.png,worf_defiant_commander_crew
"Mirror Regent Worf",0,5, 861,294,589,0,0,0,1062,175,357,0,0,0,0,0,0,0,0,0,523,125,458,735,341,453,0,0,0,418,669,302,0,0,0,109,34,87,265,55,527,0,0,0,503,738,390,0,0,0,853,315,"Klingon, Cardassian, Tactician, Villain, Brutal, Klingon-Cardassian Alliance, Mirror Universe","nonhuman, male, organic, ds9, worf, crew_max_rarity_5","Position of Strength",0, 9, 8, 8, 10, , , , , , 300, 980, 390, , false,"Worf",crew_portraits_cm_worfmirror_sm.png,worf_mirror_crew
"Yeoman Rand",0,1, 164,15,58,0,0,0,0,0,0,0,0,0,117,19,60,0,0,0,1415,1356,1355,1422,1231,0,0,1410,0,0,1495,0,1414,0,1214,1412,1353,1352,1411,1226,0,0,1400,0,0,1490,0,1402,0,1202,1671,1675,"Federation, Starfleet, Human","female, organic, tos, rand, crew_max_rarity_1","Signature Required",2, 2, 8, 10, 12, , , , 1, 1, 375, , , 180, false,"Rand",crew_portraits_cm_randyeoman_sm.png,rand_yeoman_crew
"The Duras Sisters",0,4, 311,83,205,0,0,0,658,150,385,0,0,0,464,170,341,0,0,0,1321,598,1249,868,1135,811,0,1024,0,750,451,633,996,0,828,1059,330,1018,358,889,524,0,647,0,502,117,386,568,0,473,1312,492,"Klingon, Scoundrel, Villain, Vengeful","nonhuman, female, organic, tng, betor, lursa, exclusive_fusion, crew_max_rarity_4","The Power of Two",0, 9, 10, 20, 12, , , 1, , , 350, 110, 190, 500, false,"Duras Sisters",crew_portraits_cm_duras_sisters_sm.png,duras_sisters_crew
"Persis",0,2, 0,0,0,0,0,0,253,94,250,0,0,0,303,39,88,0,0,0,0,1308,0,1420,0,1345,0,1355,0,1179,1128,1071,1354,0,1163,0,985,0,1434,0,896,0,1361,0,839,847,748,1356,0,1163,1620,1568,"Human, Augments, Engineered, Survivalist, Tactician","nonhuman, female, organic, ent, persis, crew_max_rarity_2","Augmented Strength",0, 2, 6, 10, 6, 7, 0, 2, , , 240, 330, 300, , false,"Persis",crew_portraits_cm_persis_sm.png,persis_crew
"Telek R'Mor",0,2, 0,0,0,347,52,194,119,8,44,0,0,0,263,30,113,0,0,0,1300,1362,0,1432,0,1155,994,960,827,1233,1385,1131,1364,0,1173,1178,1357,0,1419,0,1010,860,909,698,1231,1410,1129,1341,0,1154,1599,1588,"Romulan, Astrophysicist","nonhuman, male, organic, voy, rmor, crew_max_rarity_2","Solitary Survey",1, 3, 10, 12, 10, 0, 2, , , , 405, 50, 3, 180, false,"R'Mor",crew_portraits_cm_telekrmor_sm.png,rmor_voyager_crew
"KDF Gowron",0,4, 375,85,222,0,0,0,296,100,256,0,0,0,641,173,418,0,0,0,1223,897,1157,638,1037,1299,0,891,0,1135,624,1029,855,0,697,1010,480,961,255,841,869,0,521,0,814,178,723,448,0,379,1384,702,"Klingon, Duelist, Diplomat, Politician","nonhuman, male, organic, tng, gowron, crew_max_rarity_4","What Can Be Done",1, 6, 14, 10, 14, 0, 2, , , , 625, 465, 85, 1000, false,"Gowron",crew_portraits_cm_gowronyoung_sm.png,gowron_kdf_crew
"Third Remata'Klan",0,3, 410,42,84,0,0,0,467,85,185,0,0,0,0,0,0,0,0,0,1285,859,1212,1361,1097,1162,0,0,0,1044,1304,925,0,0,0,1379,908,1308,1429,1186,1066,0,0,0,972,1251,883,0,0,0,1563,1609,"Jem'hadar, Dominion, Duelist, Tactician","nonhuman, male, organic, ds9, remataklan, crew_max_rarity_3","Victory is Life",0, 3, 0, 6, 8, 4, 4, , , , 690, 395, 597, 600, true,"Remata'Klan",crew_portraits_cm_remataklan_sm.png,remataklan_crew
"Ensign Chapel",0,1, 0,0,0,0,0,0,0,0,0,0,0,0,0,0,0,214,34,152,0,0,0,0,1204,0,0,0,882,0,0,1110,0,850,1184,0,0,0,0,1128,0,0,0,836,0,0,1048,0,806,1106,1680,1671,"Human, Federation, Starfleet, Nurse","female, organic, tos, chapel, crew_max_rarity_1","Administer Prescription",2, 1, 6, 10, 10, , , , , , 130, , 40, 100, false,"Chapel",crew_portraits_cm_chapelensign_sm.png,chapel_ensign_crew
"Ensign Ogawa",0,1, 0,0,0,0,0,0,0,0,0,0,0,0,0,0,0,213,34,166,0,0,0,0,1201,0,0,0,878,0,0,1108,0,847,1180,0,0,0,0,1112,0,0,0,808,0,0,1034,0,790,1080,1677,1669,"Human, Federation, Starfleet, Nurse","female, organic, tng, ogawa, crew_max_rarity_1","Report to Sickbay",2, 1, 6, 1, 8, 2, 0, 1, , , 170, , 35, 105, false,"Ogawa",crew_portraits_cm_ogawaensign_sm.png,ogawa_ensign_crew
"Wesley Crusher",0,1, 0,0,0,218,43,149,0,0,0,174,32,78,0,0,0,0,0,0,1392,0,1350,0,0,1389,932,1379,879,1226,0,0,1400,863,0,1313,0,1325,0,0,1297,727,1290,828,1207,0,0,1373,851,0,1657,1644,"Human, Federation, Civilian, Prodigy","male, organic, tng, wesley, crew_max_rarity_1","Study",1, 2, 8, 10, 12, , , , 0, 1, 215, 125, 70, 55, false,"Wesley",crew_portraits_cm_wesleysweater_sm.png,wesley_sweater_crew
"Ensign Crusher",0,3, 176,11,31,426,83,229,0,0,0,347,34,78,0,0,0,0,0,0,958,1357,1136,1471,1232,1195,594,1221,750,1194,0,0,1348,834,0,932,1358,1285,1478,1234,975,553,1051,591,1205,0,0,1370,849,0,1548,1571,"Human, Federation, Starfleet, Prodigy, Warp Theorist","male, organic, tng, wesley, crew_max_rarity_3","Rewire",2, 4, 6, 8, 10, 6, 0, , , , 290, , , 190, false,"Wesley",crew_portraits_cm_wesley_sm.png,wesley_full_ensign_crew
"Acting Ensign Crusher",0,2, 114,29,58,258,56,160,0,0,0,251,53,148,0,0,0,0,0,0,1229,1361,1179,1480,1236,1372,723,1357,870,1206,0,0,1359,840,0,1030,1345,1026,1463,1216,1219,558,1234,760,1129,0,0,1266,787,0,1610,1554,"Human, Federation, Starfleet, Prodigy, Resourceful","male, organic, tng, wesley, crew_max_rarity_2","Invention",1, 4, 3, 6, 6, , , 2, , , 205, 50, 25, 165, false,"Wesley",crew_portraits_cm_wesleyensign_sm.png,wesley_acting_ensign_crew
"Formal Dress Wesley Crusher",0,4, 0,0,0,662,173,422,0,0,0,270,108,230,481,160,342,0,0,0,839,0,1276,1137,0,804,320,320,469,1175,1183,0,679,820,825,479,0,899,796,0,442,83,61,270,849,792,0,133,516,487,1309,318,"Human, Federation, Starfleet, Prodigy, Warp Theorist, Festive","male, organic, tng, wesley, crew_max_rarity_4","Duty to the Truth",1, 9, 4, 10, 12, , , , , , 300, 500, 30, 450, false,"Wesley",crew_portraits_cm_wesleydressuniform_sm.png,wesley_formal_dress_crew
"Wrathful Khan",0,5, 1040,206,421,0,0,0,1145,72,143,376,140,288,0,0,0,0,0,0,444,128,135,683,293,521,915,0,0,159,749,345,1208,729,0,371,309,32,598,224,1214,545,0,0,332,1372,994,776,400,0,705,665,"Human, Augments, Engineered, Villain, Cultural Figure, Tactician, Resourceful, Survivalist, Brutal, Vengeful","nonhuman, male, organic, tos, khan, crew_max_rarity_5","I Stab at Thee",2, 9, 12, 5, 12, 1, 0, , , , 640, 595, 345, 850, false,"Khan",crew_portraits_cm_khan_sm.png,khan_wok_crew
"Tailor Garak",0,3, 0,0,0,0,0,0,502,44,126,161,22,44,395,83,219,0,0,0,0,1186,1357,1298,0,1173,1091,1231,0,825,925,939,983,866,1040,0,1293,1355,1154,0,1326,1093,1070,0,1042,848,1060,883,867,871,1524,1542,"Cardassian, Undercover Operative, Scoundrel, Interrogator, Civilian","nonhuman, male, organic, ds9, garak, crew_max_rarity_3","Cutting Cloth",1, 5, 8, 12, 12, , , , , , 125, 230, 20, 405, false,"Garak",crew_portraits_cm_garaktailor_sm.png,garak_tailor_crew
"Bartender Quark",0,1, 110,25,77,0,0,0,81,15,57,0,0,0,211,36,150,0,0,0,1421,1345,1362,1380,1235,1413,0,1382,0,1234,1443,1132,1381,0,1187,1396,1288,1332,1182,1206,1406,0,1296,0,1227,1279,1125,1285,0,1104,1649,1621,"Ferengi, Bartender, Civilian, Scoundrel, Gambler, Merchant","nonhuman, male, organic, ds9, quark, crew_max_rarity_1","Hospitality",1, 2, 8, 10, 12, , , , 2, 1, 165, 10, 10, 140, false,"Quark",crew_portraits_cm_quarkbartender_sm.png,quark_s1_bartender_crew
"Richard Castillo",0,3, 487,109,227,286,57,187,0,0,0,0,0,0,0,0,0,0,0,0,786,1132,1062,1210,932,1359,1057,1347,863,0,0,0,0,0,0,494,994,892,1094,775,1148,870,1182,706,0,0,0,0,0,0,1570,1525,"Human, Hero, Pilot, Starfleet, Federation, Displaced, Romantic","male, organic, castillo, tng, crew_max_rarity_3","Self Sacrifice",0, 5, 12, 12, 10, 7, 0, , 1, 2, 650, 265, 129, 585, false,"Castillo",crew_portraits_cm_richardcastillo_sm.png,castillo_lieutenant_crew
"Writer Jake Sisko",0,3, 0,0,0,0,0,0,0,0,0,0,0,0,451,70,198,0,0,0,0,0,0,1285,0,0,0,1214,0,0,1325,0,1200,0,1025,0,0,0,1211,0,0,0,1121,0,0,1258,0,1096,0,929,1648,1651,"Human, Federation, Civilian, Writer, Gambler, Romantic","male, organic, ds9, jake, crew_max_rarity_3","Construct Story",2, 3, 0, 8, 10, 6, 0, , , , 995, 350, 47, 640, true,"Jake",crew_portraits_cm_jakewriter_sm.png,jake_writer_crew
"CMO Crusher",0,2, 0,0,0,0,0,0,0,0,0,0,0,0,0,0,0,290,52,174,0,0,0,0,1183,0,0,0,864,0,0,1085,0,831,1155,0,0,0,0,1051,0,0,0,740,0,0,970,0,745,1026,1670,1663,"Human, Starfleet, Federation, Physician, Caregiver, Cyberneticist","female, organic, tng, crusher, crew_max_rarity_2","Doctor's Calluses",2, 3, 6, 10, 10, , , , , , 185, , 35, 155, false,"Crusher",crew_portraits_cm_crusherwithlabcoat_sm.png,crusher_labcoat_crew
"Commando Crusher",0,3, 0,0,0,182,76,200,308,93,193,0,0,0,0,0,0,510,44,132,1386,1280,0,0,1012,923,1069,1375,479,1150,1409,579,0,719,1004,1091,1095,0,0,1142,481,776,1116,432,949,1227,523,0,814,1119,1515,1437,"Human, Starfleet, Federation, Physician, Cyberneticist, Undercover Operative","female, organic, tng, crusher, crew_max_rarity_3","Repel Disease",0, 3, 6, 3, 12, 1, 0, , , , 575, , 370, 500, false,"Crusher",crew_portraits_cm_crusherblackcommandouniform_sm.png,crusher_black_commando_uniform_crew
"Dr. Crusher",0,4, 275,38,110,0,0,0,437,90,201,0,0,0,0,0,0,736,123,300,1374,919,1311,1425,340,1181,0,0,472,1062,1321,228,0,429,691,1363,843,1291,1412,346,1024,0,0,461,941,1219,168,0,411,681,1398,1335,"Human, Starfleet, Federation, Physician, Cyberneticist","female, organic, tng, crusher, crew_max_rarity_4","Neutralize Disease",1, 7, 12, 12, 12, 4, 4, , , , 740, 250, 370, 500, false,"Crusher",crew_portraits_cm_crusherfromfirstcontact_sm.png,crusher_first_contact_crew
"Holonovel Doctor",0,4, 0,0,0,512,50,137,0,0,0,0,0,0,0,0,0,799,69,244,1194,0,0,0,627,1167,897,1190,184,0,0,623,0,425,686,1321,0,0,0,842,1305,1006,1300,347,0,0,813,0,566,841,1495,1559,"Hologram, Human, Federation, Starfleet, Physician, Musician, Scoundrel","nonhuman, male, artificial_life, voy, emh, crew_max_rarity_4","Suggested Treatment",0, 7, 12, 12, 12, , , , , , 365, 370, 205, 525, false,"Doctor",crew_portraits_cm_doctorgolfclub_sm.png,emh_authorauthor_crew
"Mobile Doctor",0,5, 0,0,0,809,106,209,0,0,0,0,0,0,393,137,435,1191,110,334,835,0,0,1196,257,801,597,349,32,0,1227,274,1052,158,76,1004,0,0,711,597,967,696,171,136,0,686,597,477,389,74,768,532,"Hologram, Human, Federation, Starfleet, Musician, Physician","nonhuman, male, artificial_life, voy, emh, crew_max_rarity_5","House Call",2, 9, 12, 12, 12, , , , , , 1825, 600, , 600, false,"Doctor",crew_portraits_cm_emhmobile_sm.png,emh_mobileholoemitter_crew
"Comm Officer Uhura",0,1, 0,0,0,0,0,0,0,0,0,0,0,0,258,28,89,0,0,0,0,0,0,1442,0,0,0,1374,0,0,1467,0,1373,0,1178,0,0,0,1441,0,0,0,1371,0,0,1469,0,1366,0,1170,1676,1680,"Federation, Starfleet, Human, Musician, Communicator","female, organic, tos, uhura, crew_max_rarity_1","Incoming Message",2, 2, 8, 10, 12, , , , 1, 1, 320, , , 495, false,"Uhura",crew_portraits_cm_uhurared_sm.png,uhura_red_crew
"Commander Uhura",0,4, 459,128,299,0,0,0,0,0,0,0,0,0,592,198,429,0,0,0,1084,1113,1038,557,902,0,0,899,0,0,1064,0,863,0,702,789,862,706,147,607,0,0,447,0,0,541,0,364,0,298,1494,1031,"Federation, Starfleet, Human, Musician, Communicator","female, organic, tos, uhura, crew_max_rarity_4","Hailing Frequencies",0, 8, 12, 26, 12, , , 1, , , 1165, , 75, 790, false,"Uhura",crew_portraits_cm_uhurawrathofkhan_sm.png,uhura_wrathofkhan_crew
"Dancing Uhura",0,5, 1026,84,195,0,0,0,0,0,0,0,0,0,1185,193,393,0,0,0,678,786,612,116,485,0,0,479,0,0,594,0,400,0,337,1076,1101,1037,293,906,0,0,525,0,0,665,0,458,0,387,849,1329,"Human, Federation, Starfleet, Communicator, Casual, Musician, Artist","female, organic, tos, uhura, original, crew_max_rarity_5","Take The Lead",0, 8, 10, 3, 14, 1, 1, , , , 465, 260, 60, 400, false,"Uhura",crew_portraits_cm_uhura_dancing_sm.png,uhura_dancing_crew
"First Maje Culluh",0,3, 466,93,223,0,0,0,307,42,138,0,0,0,0,0,0,0,0,0,1168,888,1106,1256,984,1362,0,0,0,1193,1450,1087,0,0,0,993,718,937,1120,818,1313,0,0,0,1154,1422,1053,0,0,0,1580,1556,"Kazon, Scoundrel, Vengeful","nonhuman, male, organic, voy, culluh, crew_max_rarity_3","Nistrim Supremacy",2, 3, 6, 10, 10, 8, 4, , , , 665, 325, 133, 390, false,"Culluh",crew_portraits_cm_jalculluh_sm.png,culluh_crew
"KDF Alexander",0,2, 137,19,79,0,0,0,331,64,148,145,16,72,0,0,0,0,0,0,1417,1163,1308,1475,1233,1329,1092,0,0,1024,1421,1054,1408,867,0,1399,1045,1245,1457,1209,1228,1087,0,0,921,1377,999,1394,861,0,1617,1608,"Human, Klingon","male, organic, ds9, alexander, nonhuman, crew_max_rarity_2","Beginner's Luck",1, 3, 10, 12, 10, 5, 2, , , , 130, 200, 62, 15, false,"Alexander",crew_portraits_cm_alexanderkdf_sm.png,alexander_kdf_crew
"Commando Shran",0,4, 673,114,239,0,0,0,592,89,182,0,0,0,318,144,282,0,0,0,888,505,806,673,676,957,0,1237,0,878,759,767,1229,0,1046,917,538,846,391,731,1062,0,856,0,969,426,881,780,0,669,1306,1036,"Andorian, Tactician, Inspiring, Imperial Guard","nonhuman, male, organic, ent, shran, crew_max_rarity_4","Debt Owed",0, 8, 6, 8, 10, , , 3, , , 390, 575, 288, 350, false,"Shran",crew_portraits_cm_shrancommando_sm.png,shran_commando_crew
"Ushaan Shran",0,5, 989,83,164,0,0,0,1076,170,348,0,0,0,424,134,288,0,0,0,734,148,682,427,535,446,0,1146,0,416,213,299,1136,0,957,1162,383,1119,535,990,549,0,863,0,523,180,412,789,0,677,751,819,"Andorian, Duelist, Romantic, Imperial Guard","nonhuman, male, organic, ent, shran, crew_max_rarity_5","Debt Owed",0, 9, 6, 8, 10, , , 3, , , 1440, 565, 483, 390, false,"Shran",crew_portraits_cm_shrandueling_sm.png,shran_dueling_crew
"Fencing Sulu",0,4, 444,99,249,385,36,92,609,203,448,0,0,0,0,0,0,0,0,0,782,528,1121,1266,997,425,1015,1318,844,746,1053,630,0,0,0,663,184,866,1068,749,181,1066,1362,880,312,486,204,0,0,0,1355,890,"Human, Federation, Starfleet, Pilot, Resourceful, Duelist, Athlete, Compromised","male, organic, tos, sulu, crew_max_rarity_4","Parry Attack",0, 6, 12, 8, 12, 6, 4, , , , 415, , 225, 225, false,"Sulu",crew_portraits_cm_sulufencing_sm.png,sulu_fencing_crew
"Morn",0,3, 0,0,0,0,0,0,359,70,174,0,0,0,418,121,295,0,0,0,0,1244,0,1258,0,1289,0,1159,0,1124,953,1020,1151,0,971,0,1160,0,969,0,1136,0,870,0,1024,479,931,799,0,687,1556,1482,"Lurian, Courier, Duelist, Civilian, Gambler, Smuggler","nonhuman, male, organic, ds9, morn, crew_max_rarity_3","Drinking Spot",0, 3, 0, 8, 8, , , , 1, 2, 150, 285, 57, 655, true,"Morn",crew_portraits_cm_morn_sm.png,morn_crew
"Seven in Blue",0,2, 0,0,0,294,51,209,0,0,0,278,53,130,0,0,0,0,0,0,1359,0,1309,0,0,1349,678,1338,856,1202,0,0,1356,838,0,1143,0,1249,0,0,1105,533,1149,670,1148,0,0,1288,807,0,1623,1586,"Human, Borg, Civilian, Federation, Astrophysicist","nonhuman, female, organic, voy, seven, crew_max_rarity_2","Ignore Irrelevancies",1, 2, 8, 10, 14, 4, 0, , , , 75, 50, 310, 170, false,"Seven",crew_portraits_cm_seven_of_nine_sm.png,seven_allblue_crew
"Seven of Nine",0,5, 0,0,0,785,247,791,0,0,0,854,225,454,514,89,183,0,0,0,537,0,608,1215,0,518,52,213,304,593,1258,0,176,295,915,64,0,259,1201,0,65,3,16,44,290,1252,0,86,95,926,746,45,"Human, Borg, Civilian, Federation, Astrophysicist","nonhuman, female, organic, voy, seven, crew_max_rarity_5","New Collective",2, 7, 12, 10, 14, 4, 0, , , , 1750, , 705, 440, false,"Seven",crew_portraits_cm_sevenbluegreyshoulders_sm.png,seven_bluegreyshoulders_crew
"Donik",0,3, 0,0,0,0,0,0,0,0,0,476,79,199,303,31,79,0,0,0,0,0,1132,1421,0,0,894,1358,0,1045,1455,0,840,713,1165,0,0,1044,1449,0,0,773,1379,0,964,1475,0,849,636,1177,1594,1613,"Hirogen, Innovator","nonhuman, male, organic, voy, donik, crew_max_rarity_3","Hunting Program",2, 4, 12, 12, 10, 7, 0, , , , 870, 165, , 340, false,"Donik",crew_portraits_cm_donik_sm.png,donik_crew
"Commander Tucker",0,2, 252,28,82,0,0,0,0,0,0,305,53,185,0,0,0,0,0,0,1395,1333,945,1445,1203,0,1051,0,0,1183,0,0,1337,825,0,1393,1331,877,1447,1202,0,876,0,0,1043,0,0,1173,717,0,1636,1627,"Human, Starfleet, Jury Rigger, Pilot, Explorer","male, organic, ent, tucker, crew_max_rarity_2","Warp Engines Online",1, 2, 6, 3, 8, 2, 0, , , , 520, 35, 50, 165, false,"Trip",crew_portraits_cm_tucker_sm.png,tucker_commander_crew
"Counselor Troi",0,1, 0,0,0,0,0,0,0,0,0,0,0,0,261,42,108,147,49,131,0,0,0,1431,1227,0,0,1364,894,0,1459,1121,1362,861,1033,0,0,0,1413,1138,0,0,1343,844,0,1449,1054,1329,812,816,1651,1637,"Federation, Starfleet, Human, Betazoid, Empath, Counselor","nonhuman, female, organic, tng, troi, crew_max_rarity_1","Counselling",2, 1, 6, 10, 10, , , , , , 265, , 80, 345, false,"Troi",crew_portraits_cm_troitng_sm.png,troi_casualgray_crew
"Rakal Troi",0,4, 521,163,354,0,0,0,525,128,331,0,0,0,0,0,0,407,163,440,959,548,893,1099,238,935,0,0,591,857,1152,262,0,565,835,568,195,497,759,16,672,0,0,250,617,882,29,0,161,359,1228,178,"Federation, Starfleet, Human, Betazoid, Romulan, Empath, Undercover Operative, Tal Shiar","nonhuman, female, organic, tng, troi, crew_max_rarity_4","Romulan Disguise",1, 7, 12, 10, 14, 1, 2, , , , 90, 400, 175, 2825, false,"Troi",crew_portraits_cm_troirakal_sm.png,troi_rakal_crew
"Commander Troi",0,5, 0,0,0,0,0,0,383,203,253,0,0,0,1060,211,421,827,142,281,0,1177,0,675,586,1157,0,520,445,1041,211,138,441,385,44,0,800,0,603,626,683,0,440,462,629,92,89,360,412,61,775,225,"Federation, Starfleet, Human, Betazoid, Empath, Counselor, Playful, Festive","nonhuman, female, organic, tng, troi, crew_max_rarity_5","Empathic Sense",1, 8, 6, 6, 6, , , , , , 1375, 475, 135, 725, true,"Troi",crew_portraits_cm_troifirstcontact_sm.png,troi_firstcontact_crew
"Vedek Winn Adami",0,3, 307,97,207,0,0,0,0,0,0,0,0,0,410,92,214,0,0,0,1313,1276,1241,971,1127,0,0,1227,0,0,1335,0,1220,0,1035,1018,1052,968,632,848,0,0,1061,0,0,1185,0,1021,0,856,1583,1511,"Bajoran, Vedek, Cultural Figure, Spiritual","nonhuman, female, organic, ds9, winn, crew_max_rarity_3","Will of the Prophets",1, 4, 8, 10, 10, 4, 0, , , , , 270, 85, 830, false,"Winn",crew_portraits_cm_winnvedek_sm.png,winn_vedek_crew
"Subcommander T'Pol",0,3, 273,71,211,520,21,77,165,35,77,0,0,0,0,0,0,0,0,0,829,1154,1293,1413,1174,888,919,1225,753,1227,1485,1123,0,0,0,865,909,1032,1186,900,1239,1083,1389,892,1204,1472,1103,0,0,0,1545,1560,"Vulcan, High Command, Astrophysicist, Telepath, Starfleet","nonhuman, female, organic, ent, tpol, crew_max_rarity_3","Logic",2, 5, 6, 10, 10, , , , , , 175, 120, 3, 100, false,"T'Pol",crew_portraits_cm_tpol_sm.png,tpol_subcommander_crew
"Commander T'Pol",0,4, 512,112,307,692,56,171,320,91,227,0,0,0,0,0,0,0,0,0,366,745,951,1143,822,515,661,958,525,1129,1387,1024,0,0,0,346,409,723,956,622,512,906,1212,741,883,1160,795,0,0,0,1353,1225,"Vulcan, Starfleet, Astrophysicist, Telepath","nonhuman, female, organic, ent, tpol, crew_max_rarity_4","Vessel's Information",0, 5, 12, 12, 20, 2, 0, , , , 1400, 200, 70, 1175, false,"T'Pol",crew_portraits_cm_tpolcommander_sm.png,tpol_commander_crew
"Chef Neelix",0,1, 0,0,0,0,0,0,0,0,0,0,0,0,201,51,189,0,0,0,0,0,0,1441,0,0,0,1372,0,0,1465,0,1371,0,1177,0,0,0,1270,0,0,0,1183,0,0,1317,0,1163,0,994,1675,1657,"Talaxian, Mylean, Resourceful, Survivalist, Chef, Civilian, Communicator","nonhuman, male, organic, voy, neelix, crew_max_rarity_1","Soup's On",1, 2, 12, 14, 10, 6, 0, , 2, 1, 305, , , 210, false,"Neelix",crew_portraits_cm_neelix_sm.png,neelix_chef_crew
"CMO 'Bones' McCoy",0,1, 0,0,0,0,0,0,0,0,0,0,0,0,0,0,0,213,48,196,0,0,0,0,1192,0,0,0,874,0,0,1102,0,843,1175,0,0,0,0,1010,0,0,0,707,0,0,936,0,711,991,1672,1656,"Human, Federation, Starfleet, Physician, Exobiology","male, organic, tos, mccoy, crew_max_rarity_1","Country Doctor",2, 3, 8, 10, 12, , , , 0, 2, 245, 10, 8, 285, false,"McCoy",crew_portraits_cm_mccoy_sm.png,mccoy_chief_medical_officer_crew
