"Mirror Vic Fontaine",8,4, 0,0,0,0,0,0,845,142,312,0,0,0,483,180,379,0,0,0,861,488,857,617,846,456,803,600,786,396,250,360,581,791,499,0,424,0,384,0,359,0,288,0,322,77,295,238,0,242,708,554,"Desperate, Human, Survivalist, Artist, Musician, Marksman, Mirror Universe, Terran Rebellion","male, ds9, vicfontaine, mirror, crew_max_rarity_4","I'll See You In Hell First!",2, 8, 8, 8, 10, , , , , , 605, 245, 167, 425, false,"Vic",crew_portraits_cm_vicfontaine_mirror_sm.png
"Miral Torres",10,4, 0,0,0,0,0,0,598,129,264,0,0,0,761,127,286,0,0,0,876,587,873,554,859,581,825,536,807,513,291,473,510,810,444,0,478,0,500,0,417,0,443,0,376,170,356,389,0,367,734,703,"Klingon, Civilian, Desperate","nonhuman, female, organic, voy, miral, crew_max_rarity_4","You Dishonor Me!",1, 7, 14, 12, 14, 5, 0, , , , 440, 275, 58, 625, false,"Miral",crew_portraits_cm_miral_sm.png
"Juliana Tainer",2,5, 0,0,0,1256,272,575,0,0,0,0,0,0,435,127,276,812,240,554,71,645,615,456,121,58,71,30,1,577,465,136,354,96,41,80,0,0,506,63,76,81,16,4,0,522,71,404,32,24,15,17,"Android, Musician, Caregiver, Civilian, Cyberneticist, Federation","female, nonhuman, artificial_life, tng, juliana, crew_max_rarity_5","Do You Know Who I Am?",1, 7, 10, 6, 12, 6, 0, , , , 525, 200, 20, 465, false,"Juliana",crew_portraits_cm_tainer_juliana_sm.png
"General Martok",7,4, 489,129,294,0,0,0,721,123,334,0,0,0,0,0,0,0,0,0,627,321,582,655,542,538,848,876,830,467,594,432,870,830,854,405,153,337,489,329,353,0,0,0,314,454,288,0,0,0,768,650,"Klingon, Duelist, Tactician, Diplomat, Veteran","nonhuman, male, organic, ds9, martok, crew_max_rarity_4","Trial of Blood",0, 6, 14, 10, 14, 0, 1, , , , 840, 555, 25, , false,"Martok",crew_portraits_cm_martokgeneral_sm.png
"23rd Century Martok",7,5, 468,138,283,0,0,0,1040,180,468,0,0,0,868,187,454,0,0,0,418,104,364,138,331,160,536,271,515,154,31,117,240,478,218,408,81,340,80,334,177,0,211,0,150,26,128,157,0,176,248,63,"Klingon, Duelist, Costumed, Veteran, Undercover Operative","nonhuman, male, organic, tos, ds9, martok, original, crew_max_rarity_5","Trapped Sabre Bear",2, 9, 12, 12, 12, , , , , , 350, 260, 340, , false,"Martok",crew_portraits_cm_martok_tos_sm.png
"Changeling Martok",7,5, 506,78,158,0,0,0,877,218,453,0,0,0,1062,249,546,0,0,0,440,131,387,103,358,220,513,157,493,195,18,169,118,452,107,640,144,602,94,552,158,0,113,0,137,4,117,73,0,101,202,65,"Klingon, Changeling, Veteran, Undercover Operative, Brutal, Dominion","nonhuman, male, organic, ds9, martok, crew_max_rarity_5","Sohk-vad",0, 9, 6, 6, 12, 7, 2, , , , 650, 15, 220, 250, false,"Martok",crew_portraits_cm_martok_changeling_sm.png
"Fleet Commander Martok",8,2, 296,64,200,0,0,0,270,38,135,0,0,0,148,29,71,0,0,0,809,687,795,770,771,827,915,889,908,810,795,797,881,910,870,595,442,560,541,512,717,0,767,0,612,653,590,744,0,639,872,830,"Klingon, Duelist, Veteran","nonhuman, male, organic, ds9, martok, crew_max_rarity_2","Surprise Attack!",0, 3, 8, 8, 12, 0, 2, , , , 340, 140, 70, 125, false,"Martok",crew_portraits_cm_martok_fleet_commander_sm.png
"Chancellor Martok",6,5, 943,132,341,0,0,0,543,67,148,0,0,0,1262,161,372,0,0,0,214,129,192,18,159,399,487,133,460,354,65,303,92,422,85,350,255,284,100,277,653,0,318,0,570,206,550,265,0,263,134,373,"Klingon, Duelist, Tactician, Diplomat, Veteran, Chancellor, Cultural Figure","nonhuman, male, organic, ds9, martok, crew_max_rarity_5","I will fight any battle. Anywhere",0, 9, 8, 8, 10, , , , 2, 2, 400, 125, 184, 450, false,"Martok",crew_portraits_cm_martok_chancellor_sm.png
"Commander Maddox",5,3, 0,0,0,478,56,166,0,0,0,343,40,110,190,26,60,0,0,0,726,908,759,861,904,719,390,639,560,730,856,890,694,618,807,660,0,688,800,0,640,295,563,389,633,808,0,610,405,647,826,857,"Federation, Starfleet, Human, Cyberneticist","male, organic, tng, crew_max_rarity_3","Facing the Opposition",0, 4, 3, 6, 6, 2, 0, 2, , , 90, , 70, 165, false,"Maddox",crew_portraits_cm_brucemaddox_sm.png
"Captain Pike",9,5, 1099,189,388,0,0,0,0,0,0,0,0,0,860,180,405,0,0,0,250,308,223,79,190,777,650,348,640,722,403,718,304,612,263,245,332,189,47,184,0,0,260,0,0,353,0,212,0,221,421,420,"Starfleet, Human, Federation, Romantic, Inspiring, Hero","captain, male, organic, tos, pike, crew_max_rarity_5","Fire All Weapons",0, 10, 4, 8, 8, , , 2, , , 525, 185, 130, 640, false,"Pike",crew_portraits_cm_pike_captain_sm.png
"Christopher Pike",6,5, 1229,166,450,0,0,0,947,154,340,0,0,0,541,50,113,0,0,0,116,31,93,92,57,218,492,450,466,194,112,166,410,428,354,203,72,153,213,144,312,0,724,0,282,277,250,688,0,595,147,318,"Starfleet, Human, Federation, Inspiring, Explorer, Tactician","male, organic, dsc, bridge_crew, captain, pike, crew_max_rarity_5","Nobody Gets Left Behind",0, 7, 6, 10, 14, 4, 0, , , , 290, 100, 133, 375, true,"Pike",crew_portraits_cm_pike_christopher_sm.png
"Tribunal Pike",5,3, 355,54,138,0,0,0,0,0,0,0,0,0,521,71,159,0,0,0,786,774,761,586,735,912,899,721,891,905,758,898,710,891,654,701,676,645,490,603,0,0,646,0,0,703,0,616,0,529,845,878,"Starfleet, Human, Federation, Inspiring, Explorer, Desperate","captain, male, organic, tos, pike, crew_max_rarity_3","This Isn't The Only Life Available",2, 5, 6, 10, 10, , , , , , 205, 100, 70, 265, false,"Pike",crew_portraits_cm_pike_disfigured_sm.png
"New Eden Pike",3,5, 978,126,282,504,113,236,0,0,0,0,0,0,1277,216,433,0,0,0,52,257,169,7,138,366,272,34,226,587,149,560,58,385,55,115,465,357,83,347,473,309,59,293,0,285,0,148,0,168,44,209,"Starfleet, Human, Federation, Resourceful, Explorer, Tactician","male, organic, dsc, bridge_crew, captain, pike, crew_max_rarity_5","You Were Right About Us",0, 8, 6, 8, 8, , , , , , 290, 100, 77, 540, false,"Pike",crew_portraits_cm_pike_neweden_sm.png
"Acting Captain Pike",2,3, 499,86,266,0,0,0,197,56,126,0,0,0,323,53,141,0,0,0,689,572,643,553,595,801,873,766,860,775,698,767,756,857,706,493,358,433,392,399,704,0,686,0,606,548,582,655,0,566,799,749,"Starfleet, Human, Federation, Inspiring, Explorer, Tactician","captain, male, organic, dsc, pike, crew_max_rarity_3","Intercept Course",1, 6, 10, 12, 10, , , , 2, 3, 500, 100, 140, 405, false,"Pike",crew_portraits_cm_pike_acting_sm.png
"Seven in Blue",3,2, 0,0,0,294,51,209,0,0,0,278,53,130,0,0,0,0,0,0,832,927,846,934,928,826,546,821,743,833,931,928,831,776,926,606,0,652,0,0,595,252,613,357,602,0,0,664,382,0,897,866,"Human, Borg, Civilian, Federation","nonhuman, female, organic, voy, bridge_crew, seven, crew_max_rarity_2","Ignore Irrelevancies",1, 2, 8, 10, 14, 4, 0, , , , 75, 50, 310, 170, false,"Seven",crew_portraits_cm_seven_of_nine_sm.png
"Temporal Agent Seven",8,4, 0,0,0,599,166,327,586,31,72,512,35,76,0,0,0,0,0,0,523,602,581,846,812,282,238,549,321,308,644,494,613,354,784,325,729,719,0,0,213,169,360,210,572,800,636,736,421,0,650,760,"Human, Borg, Civilian, Federation, Undercover Operative, Temporal Agent","nonhuman, female, organic, voy, bridge_crew, seven, crew_max_rarity_4","Scientific Investigation",2, 7, 12, 12, 12, , , , , , 815, , 125, 850, false,"Seven",crew_portraits_cm_seventemporalagent_sm.png
"Seven of Nine",7,5, 0,0,0,785,247,791,0,0,0,854,225,454,514,89,183,0,0,0,195,710,220,504,641,199,34,66,133,226,534,637,38,140,388,31,0,116,624,0,29,3,12,32,132,654,0,39,67,487,286,19,"Human, Borg, Civilian, Federation","nonhuman, female, organic, voy, bridge_crew, seven, crew_max_rarity_5","New Collective",2, 7, 12, 10, 14, 4, 0, , , , 1750, , 705, 440, false,"Seven",crew_portraits_cm_sevenbluegreyshoulders_sm.png
"Mademoiselle de Neuf",8,5, 0,0,0,777,166,441,954,254,516,441,182,358,0,0,0,0,0,0,294,241,365,741,642,16,76,316,182,42,274,137,399,218,648,212,205,213,0,0,11,20,242,150,5,189,81,252,142,0,294,25,"Human, Borg, Civilian, Federation, Costumed, Saboteur, Musician","nonhuman, female, organic, voy, bridge_crew, seven, crew_max_rarity_5","Discontinue Activity",2, 8, 4, 14, 16, 5, 0, , , , , 485, 405, 890, false,"Seven",crew_portraits_cm_sevenwwii_sm.png
"Drone Seven of Nine",4,4, 0,0,0,432,165,349,239,150,308,725,142,339,0,0,0,0,0,0,582,647,412,838,800,358,163,592,365,254,696,549,453,243,773,296,420,279,0,0,39,44,334,195,42,455,289,309,173,0,618,176,"Human, Borg, Brutal","nonhuman, female, organic, voy, seven, crew_max_rarity_4","We Are Borg",0, 4, 1, 10, 10, 8, 4, , , , 475, 200, 170, 365, true,"Seven",crew_portraits_cm_sevenofninedrone_sm.png
"Tsunkatse Seven",3,4, 679,124,299,282,92,230,850,150,301,0,0,0,0,0,0,0,0,0,286,155,402,507,375,212,427,637,392,311,443,258,771,626,726,120,158,338,491,330,101,331,548,315,329,464,304,0,0,0,438,391,"Human, Borg, Brutal, Duelist, Athlete, Federation, Civilian, Prisoner","nonhuman, female, organic, voy, seven, crew_max_rarity_4","Hunt It Down And Kill It",0, 8, 8, 6, 6, , , , , , 400, 200, 110, 525, false,"Seven",crew_portraits_cm_seven_tsunkatse_sm.png
"EV Suit Seven of Nine",6,5, 489,108,272,950,307,664,800,149,338,0,0,0,0,0,0,0,0,0,42,153,378,492,347,14,137,178,104,269,377,226,699,498,642,6,160,394,528,370,9,49,65,41,290,431,260,0,0,0,281,40,"Borg, Human, Starfleet, Federation, Hunter, Astrophysicist","evsuit, female, organic, voy, seven, crew_max_rarity_5","This Lesson Is Terminated",2, 10, 10, 10, 12, , , , 1, 1, 565, 200, 195, 100, false,"Seven",crew_portraits_cm_seven_of_nine_ev_sm.png
"Seven in Silver",7,5, 0,0,0,1031,150,365,0,0,0,1249,230,480,0,0,0,0,0,0,242,731,108,762,672,256,17,275,161,113,772,662,115,61,670,297,0,107,0,0,298,13,335,196,117,0,0,108,56,0,337,368,"Human, Borg, Civilian, Federation, Astrophysicist","nonhuman, female, organic, voy, bridge_crew, seven, crew_max_rarity_5","Think Quickly",1, 10, 10, 8, 8, , , , , , 275, 200, 140, 175, false,"Seven",crew_portraits_cm_seven_silver_sm.png
"Indulgent Seven",1,5, 0,0,0,986,151,300,0,0,0,434,176,357,0,0,0,1311,157,329,185,658,318,690,40,180,59,218,8,320,702,46,335,7,68,375,0,222,0,266,367,47,404,49,249,0,263,266,11,292,41,163,"Human, Borg, Civilian, Federation, Astrophysicist, Physician, Starfleet, Prisoner","nonhuman, female, organic, voy, bridge_crew, seven, male, artificial_life, emh, crew_max_rarity_5","To Shared Experiences",0, 7, 6, 8, 14, 7, 2, , , , 480, 125, 120, 500, false,"Seven",crew_portraits_cm_sevencheesecake_sm.png
"Indignant Seven",2,4, 0,0,0,835,126,322,0,0,0,657,205,418,0,0,0,0,0,0,427,839,418,850,817,426,104,456,262,408,844,801,467,250,790,376,0,148,0,0,368,31,407,240,167,0,0,176,92,0,657,503,"Human, Borg, Civilian, Federation, Astrophysicist","nonhuman, female, organic, voy, bridge_crew, seven, crew_max_rarity_4","There Won't Be A Next Time",2, 8, 8, 8, 10, , , , , , 375, 200, 250, 475, false,"Seven",crew_portraits_cm_seven_indignant_sm.png
"Annika Hansen Seven",4,5, 565,38,88,1021,107,251,0,0,0,1303,161,317,0,0,0,0,0,0,57,461,29,480,329,208,16,232,141,88,722,589,87,41,596,341,722,159,769,661,462,86,506,289,298,0,0,310,174,0,122,594,"Human, Civilian, Federation, Astrophysicist","female, organic, voy, bridge_crew, seven, crew_max_rarity_5","I'm Sure You'll Adapt",0, 9, 6, 6, 10, , , , , , 375, 200, 250, 400, false,"Seven",crew_portraits_cm_seven_annika_sm.png
"Amanda Grayson",10,4, 0,0,0,0,0,0,0,0,0,0,0,0,692,213,446,597,92,283,867,864,862,525,503,858,811,512,367,852,558,470,480,329,159,0,0,0,294,375,0,0,199,279,0,274,378,141,241,48,721,538,"Human, Caregiver, Civilian, Communicator","female, organic, amanda_grayson, tos, crew_max_rarity_4","How do you feel?",2, 8, 8, 8, 8, 3, 0, 3, , , 525, 165, 95, 600, false,"Amanda",crew_portraits_cm_amanda_greyson_sm.png
"Lt. Ash Tyler",6,4, 652,119,218,0,0,0,829,165,342,0,0,0,0,0,0,0,0,0,557,204,506,582,480,442,786,841,774,385,526,350,830,775,810,504,175,452,563,413,304,0,0,0,275,417,240,0,0,0,688,672,"Human, Federation, Starfleet, Survivalist, Tactician, Marksman, Pilot, Klingon","male, organic, dsc, bridge_crew, tyler, voq, crew_max_rarity_4","Full Scale Attack",2, 7, 10, 10, 12, , , , , , 575, 225, 153, 450, false,"Tyler",crew_portraits_cm_tyler_sm.png
"Celebratory Ash Tyler",6,4, 649,99,164,0,0,0,484,23,45,0,0,0,814,155,322,0,0,0,504,362,449,198,427,613,674,391,659,535,289,498,341,644,290,601,532,566,238,518,791,0,375,0,679,385,654,311,0,299,468,702,"Human, Federation, Starfleet, Tactician, Marksman, Pilot, Romantic, Klingon","male, organic, dsc, bridge_crew, tyler, voq, crew_max_rarity_4","I'm not going anywhere",0, 7, 10, 10, 10, 4, 2, , , , 450, 50, 123, 540, false,"Tyler",crew_portraits_cm_dsc_tyler_celebration_sm.png
"Tyler, Son of None",8,5, 489,58,198,0,0,0,1129,218,428,0,0,0,1009,171,229,0,0,0,449,100,395,147,370,134,517,242,498,121,19,86,210,459,195,612,146,576,298,527,179,0,462,0,154,65,131,408,0,381,213,292,"Human, Klingon, Federation, Starfleet, Gambler, Desperate, Tactician, Survivalist","male, organic, dsc, bridge_crew, tyler, voq, crew_max_rarity_5","War Within",1, 7, 12, 10, 14, 8, 4, , , , 500, 25, 128, 690, false,"Tyler",crew_portraits_cm_voq_as_ash_sm.png
"Torchbearer Tyler",6,4, 0,0,0,0,0,0,873,121,206,0,0,0,576,108,214,0,0,0,873,507,870,627,857,476,820,611,803,412,280,377,592,805,510,0,539,0,581,0,497,0,549,0,449,286,424,503,0,438,731,786,"Human, Federation, Starfleet, Torchbearer, Tactician, Klingon","male, organic, dsc, tyler, voq, crew_max_rarity_4","That's a Torchbearer's Job",0, 9, 8, 10, 8, , , , , , 365, 250, 183, 425, false,"Tyler",crew_portraits_cm_tyler_torchbearer_sm.png
"B-4",8,4, 0,0,0,733,211,452,0,0,0,302,135,276,593,160,323,0,0,0,362,780,555,520,743,357,158,108,218,533,553,736,279,338,413,164,0,352,436,0,165,30,26,120,361,437,0,48,219,294,443,118,"Android, Federation, Casual, Civilian","nonhuman, male, tng, artificial_life, b4, crew_max_rarity_4","I Do Not Understand",1, 6, 12, 12, 20, 2, 0, , , , 565, 200, 205, 425, false,"B-4",crew_portraits_cm_b4_sm.png
"Silik",10,4, 752,105,270,0,0,0,630,99,214,0,0,0,0,0,0,0,0,0,535,270,474,569,453,594,832,864,815,521,632,482,858,817,841,465,256,401,530,376,519,0,0,0,469,604,450,0,0,0,747,769,"Suliban, Shapeshifter, Temporal Agent, Saboteur","male, organic, ent, nonhuman, crew_max_rarity_4","Enhanced Reactions",2, 7, 12, 10, 12, , , , , , 875, 400, 325, 715, false,"Silik",crew_portraits_cm_silik_sm.png
"Laas",9,4, 0,0,0,773,139,332,448,58,124,0,0,0,661,28,55,0,0,0,412,612,800,583,777,229,292,183,247,538,405,501,555,678,476,354,684,0,802,0,173,236,293,224,607,662,583,759,0,649,535,746,"Explorer, Changeling, Civilian, Prodigy, Hunter, Survivalist","nonhuman, male, organic, ds9, laas, crew_max_rarity_4","A Pale Shadow",2, 8, 8, 8, 10, , , , 0, 2, 580, 200, 242, 300, false,"Laas",crew_portraits_cm_laas_sm.png
"Captain Braxton",2,5, 1228,271,584,0,0,0,541,131,275,950,191,433,0,0,0,0,0,0,68,59,1,153,23,334,138,647,402,39,417,246,140,80,539,76,35,1,166,47,403,154,0,0,28,516,345,173,90,0,1,29,"Saboteur, Human, Pilot, Federation, Starfleet, Crafty, Temporal Agent","captain, male, organic, voy, braxton, crew_max_rarity_5","Temporal Transport In Progress",0, 6, 10, 5, 12, 7, 0, , , , 500, 270, 190, 350, false,"Braxton",crew_portraits_cm_braxton_captain_sm.png
"Lt. Commander Jack Crusher",5,3, 486,91,207,335,24,78,0,0,0,0,0,0,0,0,0,0,0,0,592,730,704,758,667,812,729,812,716,915,923,910,924,904,915,436,576,515,601,473,774,517,766,476,0,0,0,0,0,0,864,887,"Starfleet, Federation, Hologram, Romantic, Inspiring","lieutenant_commander, male, tng, jack, crew_max_rarity_3","Duty and Honor",0, 6, 8, 10, 16, , , , 1, 2, 550, 100, 125, 505, false,"Jack",crew_portraits_cm_jackcrusher_sm.png
"Donik",6,3, 0,0,0,0,0,0,0,0,0,476,79,199,303,31,79,0,0,0,924,922,716,847,919,926,597,824,911,680,841,916,599,556,785,0,0,543,781,0,0,367,761,0,506,794,0,418,323,631,874,892,"Hirogen, Innovator","nonhuman, male, organic, voy, donik, crew_max_rarity_3","Hunting Program",2, 4, 12, 12, 10, 7, 0, , , , 870, 165, , 340, false,"Donik",crew_portraits_cm_donik_sm.png
"Commander Tucker",8,2, 252,28,82,0,0,0,0,0,0,305,53,185,0,0,0,0,0,0,891,885,705,894,874,932,766,932,928,819,936,933,817,753,932,771,727,443,782,672,0,406,0,0,544,0,0,606,348,0,911,905,"Human, Starfleet, Jury Rigger, Pilot, Explorer","male, organic, ent, commander, tucker, crew_max_rarity_2","Warp Engines Online",1, 2, 6, 3, 8, 2, 0, , , , 520, 35, 50, 165, false,"Trip",crew_portraits_cm_tucker_sm.png
"Rescuer Tucker",7,3, 197,28,60,0,0,0,400,42,88,424,72,226,0,0,0,0,0,0,843,674,585,853,823,760,580,902,869,482,794,700,711,532,885,779,653,383,798,687,753,352,0,0,348,782,623,536,311,0,815,837,"Human, Starfleet, Jury Rigger, Tactician, Explorer","male, organic, ent, commander, tucker, crew_max_rarity_3","Bank's Closed",1, 3, 6, 10, 10, 8, 4, , , , 315, 160, , 75, false,"Trip",crew_portraits_cm_tuckerunderpants_sm.png
"Mirror Tucker",7,4, 0,0,0,0,0,0,555,106,211,698,125,292,0,0,0,0,0,0,896,623,510,902,882,630,381,882,835,249,669,518,558,316,863,0,549,347,0,0,515,266,0,0,107,593,441,384,216,0,775,747,"Human, Starfleet, Terran Empire, Jury Rigger, Brutal, Explorer, Mirror Universe","male, organic, ent, commander, tucker, mirror, crew_max_rarity_4","Bank's Closed",1, 4, 6, 10, 10, 8, 4, , , , 165, 100, 386, 500, false,"Trip",crew_portraits_cm_tuckermirror_sm.png
"EV Suit Tucker",7,4, 444,149,555,0,0,0,0,0,0,708,121,356,0,0,0,0,0,0,590,591,176,616,509,868,358,863,813,452,875,845,523,285,839,145,248,5,261,101,0,233,0,0,300,0,0,312,175,0,744,405,"Human, Starfleet, Jury Rigger, Survivalist, Desperate","male, organic, evsuit, ent, commander, tucker, crew_max_rarity_4","Extravehicular Tactics",2, 7, 6, 8, 10, 3, 0, 3, , , 625, 95, 422, 600, false,"Trip",crew_portraits_cm_tuckerev_sm.png
"North Star Tucker",7,5, 0,0,0,0,0,0,470,93,181,799,181,587,1049,161,315,0,0,0,721,505,231,305,651,473,209,239,547,62,116,376,19,142,190,0,598,80,443,0,577,99,377,0,25,204,493,6,38,300,313,135,"Human, Starfleet, Jury Rigger, Marksman, Costumed, Romantic, Gambler","male, organic, ent, commander, tucker, crew_max_rarity_5","Quick Draw",0, 7, 10, 10, 14, 6, 0, , , , 390, 330, 47, 1450, false,"Trip",crew_portraits_cm_tuckercowboy_sm.png
"Tucker On-The-Ropes",7,5, 363,84,170,0,0,0,962,134,270,1179,197,429,0,0,0,0,0,0,517,167,36,559,439,272,129,712,532,20,351,206,124,67,644,616,273,42,648,531,407,152,0,0,29,519,347,170,89,0,283,310,"Human, Starfleet, Jury Rigger, Athlete, Gambler, Desperate","male, organic, ent, commander, tucker, original, crew_max_rarity_5","Rope-a-Dope",0, 7, 12, 10, 14, 4, 0, , , , 650, 305, 110, 375, false,"Trip",crew_portraits_cm_tucker_ropes_sm.png
"Tourist Tucker",9,5, 0,0,0,0,0,0,0,0,0,1019,118,269,1230,203,410,0,0,0,750,748,268,250,698,748,226,186,599,258,246,688,13,155,139,0,0,384,338,0,0,284,234,0,388,323,0,30,232,195,373,566,"Human, Starfleet, Romantic, Resourceful, Casual","male, organic, ent, commander, tucker, crew_max_rarity_5","Another Round Please!",2, 10, 8, 10, 10, , , , 1, 2, 410, 75, 85, 325, false,"Trip",crew_portraits_cm_tucker_tourist_sm.png
"Counselor Troi",9,1, 0,0,0,0,0,0,0,0,0,0,0,0,261,42,108,147,49,131,939,940,941,903,899,940,936,887,870,938,892,884,879,868,748,0,0,0,752,612,0,0,732,438,0,774,586,702,385,428,926,914,"Federation, Starfleet, Human, Betazoid, Empath, Counselor","nonhuman, female, organic, tng, lieutenant_commander, bridge_crew, troi, crew_max_rarity_1","Counselling",2, 1, 6, 10, 10, , , , , , 265, , 80, 345, false,"Troi",crew_portraits_cm_troitng_sm.png
"Rakal Troi",6,4, 521,163,354,0,0,0,525,128,331,0,0,0,0,0,0,407,163,440,529,292,470,565,192,536,706,804,353,466,593,208,791,315,478,292,114,231,406,11,351,0,0,151,310,453,17,0,105,204,550,108,"Federation, Starfleet, Human, Betazoid, Romulan, Empath, Undercover Operative, Tal Shiar","nonhuman, female, organic, tng, lieutenant_commander, bridge_crew, troi, crew_max_rarity_4","Romulan Disguise",1, 7, 12, 10, 14, 1, 2, , , , 90, 400, 175, 2825, false,"Troi",crew_portraits_cm_troirakal_sm.png
"Commander Troi",8,5, 0,0,0,0,0,0,383,203,253,0,0,0,1060,211,421,827,142,281,724,510,694,277,251,481,577,211,195,416,102,62,171,168,25,0,423,0,322,331,357,0,221,253,318,56,49,165,211,41,324,139,"Federation, Starfleet, Human, Betazoid, Empath, Counselor","nonhuman, female, organic, tng, commander, bridge_crew, troi, crew_max_rarity_5","Empathic Sense",1, 8, 6, 6, 6, , , , , , 1375, 475, 135, 725, true,"Troi",crew_portraits_cm_troifirstcontact_sm.png
"Bridge Officer Troi",7,4, 597,76,197,0,0,0,0,0,0,0,0,0,304,93,195,616,169,514,562,562,511,434,113,816,745,670,287,800,700,364,655,244,251,584,599,548,382,30,0,0,590,116,0,637,109,549,66,58,607,350,"Federation, Starfleet, Human, Betazoid, Empath, Counselor, Caregiver","nonhuman, female, organic, tng, commander, bridge_crew, troi, crew_max_rarity_4","Sensing Anger",1, 6, 6, 8, 12, 3, 0, 3, , , 565, 360, 245, 450, true,"Troi",crew_portraits_cm_troicommander_sm.png
"Deanna Troi",2,3, 127,87,199,0,0,0,0,0,0,0,0,0,298,120,236,412,112,282,825,824,819,677,516,900,876,752,525,888,782,633,741,490,450,569,590,531,313,108,0,0,510,266,0,566,357,458,229,117,804,535,"Federation, Starfleet, Human, Betazoid, Empath, Counselor","nonhuman, female, organic, tng, lieutenant_commander, bridge_crew, troi, crew_max_rarity_3","Face My Other Half",1, 7, 8, 12, 12, , , , 0, 2, 650, 50, 265, 450, false,"Troi",crew_portraits_cm_troicivilian_sm.png
"Goddess of Empathy Troi",7,5, 0,0,0,0,0,0,0,0,0,0,0,0,1101,74,155,992,234,676,758,757,737,389,141,761,626,321,138,704,374,155,287,111,18,0,0,0,675,38,0,0,647,55,0,704,42,617,18,32,391,437,"Empath, Cultural Figure, Hologram, Inspiring","female, nonhuman, artificial_life, tng, commander, bridge_crew, troi, crew_max_rarity_5","Discard Your Facades",0, 7, 10, 10, 14, 6, 0, , , , 750, 70, 50, 1125, false,"Troi",crew_portraits_cm_troi_goddess_sm.png
"Durango Troi",6,5, 840,116,391,0,0,0,1349,52,114,0,0,0,381,207,417,0,0,0,270,60,250,156,212,146,538,430,517,135,73,99,384,482,327,312,266,249,56,237,725,0,228,0,618,180,597,174,0,187,254,297,"Empath, Constable, Scoundrel, Costumed, Federation, Starfleet, Betazoid, Human","female, nonhuman, tng, commander, bridge_crew, troi, crew_max_rarity_5","Call Me Durango",2, 10, 12, 12, 12, , , , 0, 2, 525, 375, 20, 725, false,"Troi",crew_portraits_cm_troi_cowboy_sm.png
"Mirror Inquisitor Troi",5,5, 0,0,0,0,0,0,376,178,392,0,0,0,819,248,489,1035,248,600,704,457,665,314,75,406,508,255,89,357,111,15,221,63,14,0,337,0,241,48,237,0,145,70,209,24,6,96,24,2,190,14,"Starfleet, Human, Betazoid, Empath, Interrogator, Mirror Universe, Terran Empire","nonhuman, female, organic, tng, bridge_crew, troi, mirror, crew_max_rarity_5","Don't Get Too Comfortable",0, 9, 12, 3, 12, 5, 1, , , , 550, 305, 165, 440, false,"Troi",crew_portraits_cm_troi_mirror_sm.png
"Mintakan Troi",1,4, 0,0,0,307,69,219,0,0,0,0,0,0,947,159,328,604,101,249,622,779,765,417,414,626,423,189,196,736,404,396,305,264,50,565,0,0,431,403,563,362,127,133,0,432,405,301,260,87,436,451,"Federation, Starfleet, Human, Betazoid, Empath, Counselor, Caregiver, Undercover Operative, Prisoner, Merchant, Mintakan, Vulcan, Costumed","nonhuman, female, organic, tng, commander, bridge_crew, troi, crew_max_rarity_4","You Don't Want This",1, 7, 10, 10, 10, , , , , , 725, 100, 80, 500, false,"Troi",crew_portraits_cm_troi_mintakan_sm.png
"Assimilated Troi",1,4, 0,0,0,369,77,207,637,131,290,0,0,0,0,0,0,771,175,413,605,494,766,812,275,284,410,616,123,400,544,42,769,181,283,571,456,0,0,171,136,363,593,66,354,503,23,0,114,217,435,301,"Human, Betazoid, Borg, Brutal, Empath, Counselor","nonhuman, female, organic, tng, troi, original, crew_max_rarity_4","I Sense Resistance",2, 7, 6, 8, 10, 3, 0, 3, , , 450, 100, 175, 525, false,"Troi",crew_portraits_cm_troi_assimilated_sm.png
"Merry Men Troi",2,5, 556,37,109,0,0,0,0,0,0,0,0,0,1277,254,505,971,141,332,383,438,340,65,14,671,451,82,124,580,130,140,46,100,2,752,710,693,139,142,0,0,136,221,0,199,275,91,176,19,24,232,"Starfleet, Federation, Human, Betazoid, Empath, Counselor, Costumed","nonhuman, female, organic, tng, bridge_crew, troi, crew_max_rarity_5","Right On Target!",0, 6, 8, 6, 10, 4, 0, , , , 200, 130, 145, 390, false,"Troi",crew_portraits_cm_troi_merrymen_sm.png
"Dark Empath Troi",4,5, 937,143,322,0,0,0,1300,178,445,0,0,0,0,0,0,473,101,246,209,10,180,306,18,74,471,679,236,74,150,9,667,199,314,363,76,294,453,59,190,0,0,297,168,310,30,0,262,412,74,191,"Starfleet, Federation, Human, Betazoid, Empath, Counselor, Brutal","nonhuman, female, organic, tng, bridge_crew, troi, crew_max_rarity_5","Take Me With You!",0, 9, 8, 8, 8, , , , 1, 3, 450, 230, 100, 430, false,"Troi",crew_portraits_cm_troi_darkempath_sm.png
"Age of Sail Troi",3,4, 353,76,161,0,0,0,0,0,0,0,0,0,596,150,298,776,208,426,617,618,570,394,129,789,668,513,213,744,559,255,484,178,72,641,636,603,275,42,0,0,408,135,0,468,140,344,85,36,455,281,"Human, Betazoid, Costumed, Empath, Counselor, Starfleet, Federation","ageofsail, nonhuman, female, organic, tng, troi, crew_max_rarity_4","Answer Him!",0, 9, 8, 6, 10, , , , , , 400, 230, 115, 450, false,"Troi",crew_portraits_cm_troi_ageofsail_sm.png
"Xindi Insectoid Councilor",3,5, 0,0,0,1169,64,147,541,111,235,0,0,0,1252,162,332,0,0,0,161,411,620,189,579,36,146,9,112,312,54,259,88,372,80,679,516,0,426,0,248,421,163,398,431,149,408,294,0,283,25,522,"Xindi, Brutal, Diplomat, Desperate","nonhuman, organic, ent, insectoid, crew_max_rarity_5","The Guardians Have Never Lied!",0, 9, 10, 10, 10, , , , 2, 2, 450, 200, 110, 625, false,"Insectoid",crew_portraits_cm_xindi_insectoid_sm.png
"Vedek Winn Adami",7,3, 307,97,207,0,0,0,0,0,0,0,0,0,410,92,214,0,0,0,793,782,773,621,745,923,912,760,905,916,789,911,751,905,699,550,570,507,342,466,0,0,570,0,0,610,0,528,0,454,866,803,"Bajoran, Vedek, Cultural Figure, Spiritual","nonhuman, female, organic, ds9, winn, crew_max_rarity_3","Will of the Prophets",1, 4, 8, 10, 10, 4, 0, , , , , 270, 85, 830, false,"Winn",crew_portraits_cm_winnvedek_sm.png
"Rogue Kai Winn",9,5, 1007,257,510,0,0,0,0,0,0,0,0,0,736,274,575,0,0,0,249,306,222,74,189,773,648,344,636,720,401,715,301,610,262,109,209,81,4,72,0,0,94,0,0,142,0,54,0,81,418,97,"Bajoran, Kai, Cultural Figure, Spiritual, Villain","nonhuman, female, organic, ds9, winn, crew_max_rarity_5","End of One Journey",0, 7, 10, 10, 14, 6, 0, , , , 315, 330, 110, 550, false,"Winn",crew_portraits_cm_winnevil_sm.png
