"Ahdar Ru'afo",6,5, 757,187,447,506,109,219,0,0,0,1362,69,227,0,0,0,0,0,0,101,503,17,553,327,674,49,683,415,169,0,0,177,73,0,55,338,42,372,146,611,183,651,371,590,0,0,644,378,0,321,404,"Son'a, Brutal, Villain, Survivalist, Resourceful","male, nonhuman, organic, tng, ruafo, crew_max_rarity_5","Not Joining Us For Dinner",0, 6, 10, 5, 14, 7, 0, , , , 585, 125, 160, 450, false,"Ru'afo",crew_portraits_cm_ruafo_sm.png,ruafo_crew
"Irumodic Syndrome Picard",3,4, 310,144,287,886,74,219,0,0,0,0,0,0,684,100,211,0,0,0,169,769,715,414,670,472,340,110,287,0,660,0,531,0,453,157,534,399,277,384,667,434,304,399,0,737,0,623,0,542,548,649,"Human, Civilian, Veteran, Cultural Figure, Federation, Gardener","male, tng, picard, organic, crew_max_rarity_4","Not an Invalid",2, 8, 12, 4, 12, , , , , , 230, 125, 145, 450, false,"Picard",crew_portraits_cm_picard_irumodic_sm.png,picard_irumodic_crew
"Diseased Changeling Founder",6,4, 751,148,310,0,0,0,0,0,0,0,0,0,458,239,483,248,88,214,492,549,431,228,152,0,0,588,539,0,667,727,549,492,267,443,502,362,54,90,0,0,195,390,0,270,558,131,369,56,712,192,"Changeling, Dominion, Desperate, Brutal","nonhuman, female, organic, ds9, femalechangeling, crew_max_rarity_4","I Wish You Hadn't Done That",0, 8, 6, 8, 12, , , , , , 300, 255, 140, 600, false,"Founder",crew_portraits_cm_changeling_diseased_sm.png,femalechangeling_diseased_crew
"Alternate Future Jadzia Dax",5,5, 0,0,0,1291,125,313,0,0,0,1002,118,267,419,83,187,0,0,0,199,0,294,809,0,199,26,85,132,297,843,0,64,167,655,478,0,479,752,0,464,98,200,292,469,793,0,176,282,589,329,599,"Federation, Starfleet, Exobiology, Astrophysicist, Trill, Pilot","nonhuman, female, organic, ds9, lieutenant_commander, bridge_crew, dax, crew_max_rarity_5","We're Losing Him!",1, 10, 8, 12, 10, , , , , , 200, 225, 155, 100, false,"J. Dax",crew_portraits_cm_jadzia_alternate_future_sm.png,dax_jadzia_future_crew
"Tourist Jadzia Dax",1,3, 526,86,206,210,29,101,0,0,0,0,0,0,346,55,154,0,0,0,503,684,623,529,567,919,626,638,562,0,893,0,824,0,715,490,687,615,505,570,896,608,642,552,0,884,0,771,0,670,952,949,"Federation, Starfleet, Trill, Casual, Romantic","nonhuman, female, organic, ds9, lieutenant, bridge_crew, dax, crew_max_rarity_3","Take It Easy",1, 6, 8, 4, 10, 1, 1, , , , 350, 220, 160, 190, false,"J. Dax",crew_portraits_cm_jadzia_tourist_sm.png,dax_jadzia_tourist_crew
"Amelia Earhart",3,5, 949,124,313,0,0,0,0,0,0,1327,145,467,351,108,511,0,0,0,363,454,4,198,278,0,126,686,0,112,765,0,28,34,552,459,524,20,98,374,0,198,287,0,228,388,0,9,113,231,66,102,"Human, Pilot, Explorer, Cultural Figure, Inspiring, Undercover Operative, Prisoner","female, organic, voy, earhart, crew_max_rarity_5","Take Her Out For a Spin",1, 8, 8, 8, 16, , , , , , 400, 100, 120, 1392, false,"Earhart",crew_portraits_cm_earhart_sm.png,amelia_earhart_crew
"Admiral Ross",8,4, 612,103,258,0,0,0,205,117,252,0,0,0,855,107,222,0,0,0,571,440,515,210,467,887,0,518,0,760,369,732,456,0,395,570,272,496,316,468,519,0,655,0,470,278,447,586,0,523,706,606,"Federation, Starfleet, Human, Communicator, Diplomat, Cultural Figure","male, organic, ds9, admiral, ross, crew_max_rarity_4","You're Dismissed",0, 7, 6, 5, 8, , , , , , 580, 250, 130, 240, true,"Ross",crew_portraits_cm_ross_admiral_sm.png,ross_admiral_crew
"Polywater Yar",8,5, 1134,155,377,0,0,0,381,109,217,0,0,0,955,183,367,0,0,0,226,146,182,58,144,778,0,340,0,668,187,633,275,0,259,334,198,264,86,249,592,0,368,0,532,161,511,301,0,299,357,245,"Human, Federation, Starfleet, Romantic, Desperate, Survivalist","female, organic, tng, bridge_crew, yar, crew_max_rarity_5","You Are Fully Functional, Aren't You?",0, 9, 2, 8, 12, 1, 0, , 1, 2, 335, 100, 70, 550, true,"Yar",crew_portraits_cm_yar_intoxicated_sm.png,yar_intoxicated_crew
"Gary Seven",1,5, 361,187,380,1275,217,685,737,333,712,0,0,0,0,0,0,0,0,0,33,156,645,743,596,1,108,142,76,243,408,176,0,0,0,5,5,233,443,223,1,72,101,70,25,74,20,0,0,0,6,4,"Human, Hero, Resourceful, Undercover Operative","organic, male, tos, gary_seven, crew_max_rarity_5","Interesting Experiences",1, 7, 15, 8, 10, 0, 1, , , , 375, 200, 200, 300, false,"Mr. Seven",crew_portraits_cm_gary_seven_sm.png,gary_seven_crew
"Reverend Phlox",4,5, 984,145,314,0,0,0,0,0,0,0,0,0,598,53,111,1058,236,615,303,406,261,161,3,0,0,665,128,0,748,119,631,83,38,439,497,358,393,4,0,0,858,81,0,915,69,822,26,55,157,188,"Denobulan, Civilian, Physician, Exobiology","male, organic, ent, phlox, crew_max_rarity_5","Rest In Peace",1, 10, 6, 10, 12, , , , , , 200, 205, 170, 100, false,"Phlox",crew_portraits_cm_phlox_reverend_sm.png,phlox_reverend_crew
"Yelgrun",7,4, 572,101,216,405,85,247,0,0,0,0,0,0,638,203,466,0,0,0,257,650,569,261,522,771,524,230,478,0,632,0,493,0,421,215,656,567,138,533,604,389,70,370,0,328,0,164,0,188,648,350,"Dominion, Vorta, Clone, Diplomat, Musician","male, ds9, yelgrun, nonhuman, crew_max_rarity_4","I Was Cloned",1, 5, 3, 6, 6, , , , , , 400, 265, 98, 275, true,"Yelgrun",crew_portraits_cm_yelgrun_sm.png,yelgrun_crew
"Alternate Future T'Pol",6,5, 1119,260,585,943,153,343,0,0,0,0,0,0,485,92,188,0,0,0,17,301,130,115,90,353,276,127,217,0,797,0,698,0,595,7,207,58,67,54,384,269,155,246,0,779,0,664,0,579,227,115,"Vulcan, Starfleet, Astrophysicist, Telepath","nonhuman, female, organic, ent, first_officer, bridge_crew, tpol, crew_max_rarity_5","You'll Never Fully Recover",1, 7, 10, 6, 12, 6, 0, , , , 600, 105, 120, 175, false,"T'Pol",crew_portraits_cm_tpol_alternate_future_sm.png,tpol_alternate_future_crew
"Ikat'ika",8,4, 656,53,124,0,0,0,758,199,388,0,0,0,0,0,0,0,0,0,610,207,551,683,509,449,0,0,0,397,578,340,0,0,0,851,248,776,863,729,259,0,0,0,231,398,196,0,0,0,878,867,"Jem'hadar, Dominion, Brutal, Veteran","nonhuman, male, organic, ds9, ikatika, crew_max_rarity_4","Victory is Life!",2, 9, 5, 8, 12, 5, 0, , , , 495, 105, 175, 575, false,"Ikat'ika",crew_portraits_cm_ikatika_sm.png,ikatika_crew
"Changeling Martok",7,5, 506,78,158,0,0,0,877,218,453,0,0,0,1062,249,546,0,0,0,729,178,668,134,621,297,0,266,0,275,31,211,212,0,207,756,167,705,117,650,179,0,144,0,161,6,136,92,0,121,281,74,"Klingon, Changeling, Veteran, Undercover Operative, Brutal, Dominion","nonhuman, male, organic, ds9, martok, crew_max_rarity_5","Sohk-vad",0, 9, 6, 6, 12, 7, 2, , , , 650, 15, 220, 250, false,"Martok",crew_portraits_cm_martok_changeling_sm.png,martok_changeling_crew
"Fleet Commander Martok",5,2, 296,64,200,0,0,0,270,38,135,0,0,0,148,29,71,0,0,0,870,606,803,770,754,895,0,924,0,768,841,738,906,0,785,705,521,661,646,610,841,0,905,0,721,778,697,885,0,765,1029,985,"Klingon, Duelist, Veteran","nonhuman, male, organic, ds9, martok, crew_max_rarity_2","Surprise Attack!",0, 3, 8, 8, 12, 0, 2, , , , 340, 140, 70, 125, false,"Martok",crew_portraits_cm_martok_fleet_commander_sm.png,martok_commander_crew
"Mirror Keiko",7,4, 670,212,435,567,92,234,0,0,0,0,0,0,385,76,146,0,0,0,108,543,422,365,370,621,430,349,380,0,862,0,776,0,677,52,327,152,189,139,613,394,366,373,0,861,0,751,0,649,703,483,"Human, Botanist, Saboteur, Undercover Operative, Mirror Universe, Terran Rebellion","female, organic, ds9, mirror, keiko, original, crew_max_rarity_4","Terrible Beauty",2, 7, 10, 10, 10, 4, 2, , , , 450, 230, 275, 125, false,"Keiko",crew_portraits_cm_keiko_mirror_sm.png,keiko_mirror_crew
"Professor Sato",3,5, 950,93,201,431,101,209,0,0,0,0,0,0,1517,61,123,0,0,0,111,496,376,36,318,762,515,63,469,0,239,0,93,0,110,265,685,612,526,568,636,412,432,384,0,899,0,797,0,696,282,864,"Human, Civilian, Starfleet, Prodigy, Communicator, Linguist","female, organic, ensign, bridge_crew, ent, sato, crew_max_rarity_5","Turn It Up",2, 10, 8, 8, 10, , , 2, , , 415, 300, 45, 280, false,"Sato",crew_portraits_cm_sato_professor_sm.png,sato_professor_crew
"EV Suit Burnham",5,5, 1324,89,299,369,115,391,877,169,472,0,0,0,0,0,0,0,0,0,48,50,146,345,105,64,495,744,448,293,459,229,0,0,0,71,107,455,620,435,23,265,417,240,190,332,157,0,0,0,234,146,"Federation, Starfleet, Astrophysicist, Human, Xenoanthropology, Resourceful, Duelist","female, evsuit, organic, dsc, bridge_crew, first_officer, commander, burnham, crew_max_rarity_5","Vulcan Hello",2, 7, 10, 10, 14, 6, 0, , , , 575, , 295, 100, false,"Burnham",crew_portraits_cm_burnham_evsuit_sm.png,dsc_burnham_ev_suit_crew
"Army Chaplain Odo",7,4, 342,69,173,0,0,0,628,77,162,0,0,0,764,172,363,0,0,0,824,412,764,363,715,592,0,514,0,523,183,478,448,0,390,740,472,692,259,636,736,0,385,0,633,224,621,316,0,314,673,666,"Changeling, Spiritual, Bajoran, Communicator, Constable, Undercover Operative","nonhuman, organic, ds9, odo, original, crew_max_rarity_4","Mysterious Ways",1, 6, 8, 8, 8, 3, 0, 3, , , 625, 105, 10, 440, false,"Odo",crew_portraits_cm_odo_chaplain_sm.png,odo_chaplain_crew
"Dr. Leonard McCoy",8,4, 0,0,0,562,96,254,0,0,0,0,0,0,0,0,0,746,141,392,636,0,0,0,354,615,426,635,70,0,0,360,0,239,396,593,0,0,0,254,574,376,625,75,0,0,264,0,162,303,898,786,"Human, Federation, Starfleet, Physician, Resourceful","male, organic, tos, lieutenant_commander, mccoy, crew_max_rarity_4","He's Dead, Jim",0, 4, 8, 10, 14, 4, 0, , , , 440, 60, 130, 1355, false,"McCoy",crew_portraits_cm_mccoy_leonard_sm.png,mccoy_leonard_crew
"Ensign Picard",7,4, 849,81,201,0,0,0,503,136,328,0,0,0,287,115,231,0,0,0,481,230,424,388,372,606,0,830,0,535,469,490,813,0,704,678,258,636,394,588,407,0,636,0,360,193,327,562,0,504,716,574,"Federation, Starfleet, Human, Desperate, Crafty","male, organic, tng, ensign, bridge_crew, picard, crew_max_rarity_4","Life Worth Living",1, 6, 12, 12, 12, 7, 0, , , , 580, 85, 20, 505, false,"Picard",crew_portraits_cm_ensign_picard_sm.png,picard_ensign_crew
"Elizabeth Dehner",9,5, 0,0,0,441,145,345,0,0,0,0,0,0,886,54,106,1152,158,446,675,0,0,597,127,655,453,149,37,0,631,132,491,90,27,408,0,0,882,186,399,275,254,32,0,918,193,826,112,132,385,422,"Human, Starfleet, Federation, Physician, Telekinetic","female, organic, tos, dehner, crew_max_rarity_5","Almost a God",2, 6, 12, 12, 20, 2, 0, , , , 400, , 110, 350, false,"Dehner",crew_portraits_cm_elizabeth_dehner_sm.png,dehner_elizabeth_crew
"Astrosciences Sulu",8,5, 969,84,207,1014,271,623,0,0,0,0,0,0,423,72,136,0,0,0,26,485,364,274,308,221,193,88,147,0,846,0,767,0,662,17,689,616,507,571,81,74,38,72,0,885,0,772,0,671,395,270,"Human, Federation, Starfleet, Pilot, Resourceful, Astrophysicist","male, organic, tos, lieutenant, bridge_crew, sulu, crew_max_rarity_5","Astrosciences Standing By",0, 7, 12, 12, 12, 4, 0, , , , 490, 80, 100, 340, false,"Sulu",crew_portraits_cm_sulu_astrosciences_sm.png,sulu_astrosciences_crew
"Commanding Officer Sisko",1,3, 433,11,23,0,0,0,487,28,78,0,0,0,234,12,34,0,0,0,841,546,778,708,731,779,0,912,0,669,670,634,896,0,777,938,843,880,947,826,907,0,924,0,772,923,747,910,0,785,982,1107,"Human, Federation, Starfleet, Bajoran, Cultural Figure, Inspiring, Chef","male, organic, ds9, captain, bridge_crew, sisko, crew_max_rarity_3","Surprise for the Dominion",2, 5, 3, 8, 11, , , , , , 215, 85, 135, 100, false,"Sisko",crew_portraits_cm_sisko_sm.png,sisko_captain_crew
"Age of Sail Data",6,5, 1171,186,446,0,0,0,0,0,0,844,125,269,527,127,243,0,0,0,193,324,20,105,113,0,332,647,0,404,729,0,63,231,516,225,342,27,125,152,0,340,601,0,460,671,0,109,273,483,322,265,"Android, Federation, Starfleet, Cyberneticist, Costumed, Explorer, Musician","ageofsail, nonhuman, male, tng, lieutenant_commander, bridge_crew, artificial_life, data, crew_max_rarity_5","Fun? Got it!",1, 8, 8, 5, 11, 1, 1, , , , 125, 200, 70, 500, false,"Data",crew_portraits_cm_data_ageofsail_sm.png,data_ageofsail_crew
"Commander Donatra",5,4, 580,238,631,0,0,0,434,191,463,0,0,0,318,60,178,0,0,0,467,215,412,387,355,578,0,851,0,513,461,467,838,0,725,77,10,51,74,48,197,0,762,0,175,142,147,725,0,627,698,55,"Romulan, Veteran, Crafty, Tactician, Resourceful","nonhuman, female, organic, donatra, tng, commander, crew_max_rarity_4","Let's Get To Work",0, 5, 3, 6, 6, , , , , , 450, 200, 143, 450, true,"Donatra",crew_portraits_cm_donatra_commander_sm.png,donatra_commander_crew
"Maid Marian",9,5, 0,0,0,0,0,0,904,152,302,0,0,0,1193,172,338,0,0,0,0,481,0,389,0,387,0,271,0,349,43,290,216,0,211,0,501,0,504,0,427,0,416,0,375,116,347,338,0,330,502,715,"Human, Scoundrel, Costumed, Exoarchaeology, Smuggler, Civilian, Prisoner","female, organic, tng, vash, crew_max_rarity_5","Can't Change Who I Am",0, 7, 6, 8, 14, 7, 2, , , , 350, 305, 88, 705, false,"Vash",crew_portraits_cm_vash_qpid_sm.png,vash_qpid_crew
"Tyler, Son of None",8,5, 489,58,198,0,0,0,1129,218,428,0,0,0,1009,171,229,0,0,0,738,131,679,196,632,214,0,351,0,197,32,141,289,0,269,718,169,675,358,622,207,0,563,0,185,78,154,491,0,458,290,343,"Human, Klingon, Federation, Starfleet, Gambler, Desperate, Tactician, Survivalist","male, organic, dsc, bridge_crew, tyler, voq, crew_max_rarity_5","War Within",1, 7, 12, 10, 14, 8, 4, , , , 500, 25, 128, 690, false,"Tyler",crew_portraits_cm_voq_as_ash_sm.png,dsc_tyler_voq_crew
"The Prophet",6,5, 388,148,324,0,0,0,995,127,251,0,0,0,1230,146,294,0,0,0,732,203,671,135,624,331,0,268,0,309,36,246,214,0,209,420,201,340,163,329,511,0,506,0,459,190,436,429,0,401,311,360,"Vulcan, Mirror Universe, Desperate, Terran Rebellion, Telepath, Interrogator","nonhuman, male, organic, sarek, dsc, crew_max_rarity_5","My Mind to Your Mind",1, 5, 0, 8, 8, , , , , , 375, 255, 68, 675, true,"Sarek",crew_portraits_cm_sarek_mirror_sm.png,dsc_sarek_mirror_crew
"EV Suit Seven of Nine",7,5, 489,108,272,950,307,664,800,149,338,0,0,0,0,0,0,0,0,0,51,234,617,723,560,18,198,281,154,402,587,348,0,0,0,6,190,466,629,443,10,52,80,50,344,506,302,0,0,0,376,47,"Borg, Human, Starfleet, Federation, Hunter, Astrophysicist","evsuit, female, organic, voy, seven, crew_max_rarity_5","This Lesson Is Terminated",2, 10, 10, 10, 12, , , , 1, 1, 565, 200, 195, 100, false,"Seven",crew_portraits_cm_seven_of_nine_ev_sm.png,seven_ev_suit_crew
"Tucker On-The-Ropes",7,5, 363,84,170,0,0,0,962,134,270,1179,197,429,0,0,0,0,0,0,800,246,45,835,687,357,183,0,0,25,490,266,195,86,0,725,316,54,763,627,476,184,0,0,35,612,406,206,101,0,370,379,"Human, Starfleet, Jury Rigger, Athlete, Gambler, Desperate","male, organic, ent, commander, tucker, original, crew_max_rarity_5","Rope-a-Dope",0, 7, 12, 10, 14, 4, 0, , , , 650, 305, 110, 375, false,"Trip",crew_portraits_cm_tucker_ropes_sm.png,tucker_boxing_crew
"Pugilist Q",6,4, 362,96,190,0,0,0,788,139,291,0,0,0,547,97,202,0,0,0,788,320,724,471,675,478,0,652,0,424,209,372,619,0,524,671,282,628,434,582,459,0,694,0,407,252,378,639,0,557,707,657,"Desperate, Crafty, Scoundrel, Athlete, Duelist, Costumed, Q Continuum","nonhuman, male, ds9, q_jdl, crew_max_rarity_4","Wonderfully Barbaric",0, 6, 6, 8, 10, 0, 1, , , , 450, 125, 50, 305, false,"Q",crew_portraits_cm_pugilist_q_sm.png,q_boxing_crew
"Mugato",10,5, 823,189,405,0,0,0,1033,224,688,0,0,0,436,122,226,0,0,0,402,69,363,256,307,195,0,747,0,182,90,121,719,0,619,269,11,199,150,185,62,0,634,0,56,33,48,560,0,502,334,37,"Mugato, Brutal, Hunter, Primal","nonhuman, male, tos, mugato, crew_max_rarity_5","Private Little War",2, 7, 4, 5, 10, 7, 0, , , , 465, 325, 63, 500, true,"Mugato",crew_portraits_cm_mugato_sm.png,mugato_crew
"Gloria",7,5, 879,205,396,0,0,0,0,0,0,0,0,0,1065,278,536,470,99,221,346,443,311,52,29,0,0,260,424,0,351,578,204,393,44,257,371,191,19,41,0,0,133,374,0,204,530,82,340,37,287,66,"Communicator, Civilian, Counselor, Bartender, Empath, Costumed, El-Aurian","nonhuman, female, organic, tng, guinan, crew_max_rarity_5","Gloria From Cleveland",0, 7, 6, 12, 12, 0, 1, , , , 1540, 160, 110, 450, false,"Guinan",crew_portraits_cm_guinan_gloria_sm.png,guinan_gloria_crew
"Minuet",9,5, 911,162,353,0,0,0,0,0,0,0,0,0,952,292,766,0,0,0,361,450,328,55,276,0,0,259,0,0,347,0,203,0,201,354,441,280,10,263,0,0,52,0,0,85,0,28,0,48,486,142,"Hologram, Saboteur, Communicator, Resourceful, Human, Romantic, Desperate, Crafty","female, minuet, tng, crew_max_rarity_5","As Real As You Need",1, 9, 4, 8, 8, 3, 0, , , , 550, 225, 100, 390, true,"Minuet",crew_portraits_cm_minuet_sm.png,minuet_crew
"Lady Beverly",9,4, 350,91,152,0,0,0,0,0,0,0,0,0,787,168,267,595,90,167,817,789,755,375,243,0,0,531,370,0,615,495,476,348,88,744,736,694,332,293,0,0,518,431,0,593,607,439,406,173,705,741,"Human, Caregiver, Hologram, Romantic","female, organic, tng, commander, crusher, crew_max_rarity_4","Manners, Manners!",2, 8, 10, 6, 10, , , , , , 500, 200, 180, 425, false,"Crusher",crew_portraits_cm_lady_beverly_sm.png,crusher_lady_crew
"Tuxedo Nog",6,5, 966,153,284,0,0,0,0,0,0,481,65,198,1098,260,551,0,0,0,336,435,69,45,257,0,493,248,0,634,335,0,38,412,195,461,528,129,43,376,0,470,135,0,616,209,0,27,404,107,277,179,"Ferengi, Costumed, Federation, Starfleet, Inspiring, Hero, Desperate, Veteran","nonhuman, male, organic, ds9, nog, crew_max_rarity_5","Welcome To Las Vegas",1, 8, 8, 8, 10, 0, 1, , , , 540, 255, 210, 325, false,"Nog",crew_portraits_cm_nog_nines_sm.png,nog_tuxedo_crew
"Tarquin",10,4, 420,184,409,377,40,126,0,0,0,0,0,0,823,119,244,0,0,0,370,656,581,257,530,843,570,265,513,0,614,0,474,0,410,135,377,200,142,189,866,578,397,531,0,679,0,541,0,487,732,552,"Telepath, Desperate, Resourceful, Communicator","organic, ent, nonhuman, tarquin, crew_max_rarity_4","Exile",1, 7, 8, 10, 12, 5, 0, , , , 580, 250, 110, 540, false,"Tarquin",crew_portraits_cm_tarquins_species_sm.png,tarquin_crew
"Losira",10,2, 256,23,88,0,0,0,313,68,187,155,11,29,0,0,0,0,0,0,908,633,741,921,791,851,638,0,0,627,899,696,912,522,0,911,593,809,924,793,710,638,0,0,576,799,601,913,521,0,1043,1042,"Hologram, Kalandan, Brutal","nonhuman, female, tos, losira, crew_max_rarity_2","I Am For You",0, 2, 8, 10, 10, 4, 0, , , , 300, 200, 100, 375, false,"Losira",crew_portraits_cm_losira_sm.png,losira_crew
"Commander Barclay",5,4, 748,130,322,357,65,143,0,0,0,604,82,271,0,0,0,0,0,0,216,554,72,595,382,841,228,834,511,501,0,0,561,326,0,204,507,84,549,354,806,237,800,485,512,0,0,553,314,0,702,673,"Starfleet, Innovator, Communicator, Quantum Mechanics, Human, Federation","male, organic, voy, commander, barclay, crew_max_rarity_4","To The Journey",1, 6, 4, 8, 10, 2, 0, , , , 465, 200, 210, 375, true,"Barclay",crew_portraits_cm_barclay_commander_sm.png,barclay_commander_crew
"Data V",6,5, 0,0,0,976,142,307,0,0,0,1144,195,401,528,77,141,0,0,0,357,0,172,751,0,343,31,120,211,200,782,0,41,99,576,458,0,222,828,0,453,36,239,285,248,875,0,83,127,660,320,423,"Android, Federation, Starfleet, Cyberneticist, Musician, Costumed, Royalty","nonhuman, male, tng, lieutenant_commander, bridge_crew, artificial_life, data, crew_max_rarity_5","He Appears But A Man",1, 7, 6, 6, 6, , , , , , 590, 200, 60, 265, true,"Data",crew_portraits_cm_data_henry_sm.png,data_henry_crew
"Phlox, Au Naturel",6,5, 0,0,0,1173,186,510,0,0,0,454,83,279,0,0,0,884,160,398,195,0,663,0,280,193,55,251,22,619,0,262,684,21,292,185,0,514,0,230,174,34,209,15,501,0,239,539,19,287,280,124,"Denobulan, Civilian, Physician, Exobiology, Resourceful, Casual","male, organic, ent, phlox, crew_max_rarity_5","I'm A Physician, Not An Engineer!",1, 7, 12, 6, 12, 2, 0, 2, , , 515, 195, 140, 450, false,"Phlox",crew_portraits_cm_phlox_natural_sm.png,phlox_natural_crew
"Lt. Commander Jack Crusher",5,3, 486,91,207,335,24,78,0,0,0,0,0,0,0,0,0,0,0,0,468,709,652,750,604,889,605,875,542,0,0,0,0,0,0,513,681,608,712,562,912,624,903,562,0,0,0,0,0,0,1025,1050,"Starfleet, Federation, Hologram, Human, Romantic, Inspiring","lieutenant_commander, male, tng, jack, crew_max_rarity_3","Duty and Honor",0, 6, 8, 10, 16, , , , 1, 2, 550, 100, 125, 505, false,"Jack",crew_portraits_cm_jackcrusher_sm.png,jack_crusher_crew
"Wedding Day Quark",7,4, 584,104,246,0,0,0,278,83,181,0,0,0,661,228,469,0,0,0,600,455,541,245,502,876,0,530,0,752,366,721,475,0,411,583,356,511,110,478,695,0,212,0,607,118,592,149,0,171,729,345,"Ferengi, Klingon, Scoundrel, Desperate, Romantic, Gambler","nonhuman, male, organic, ds9, quark, crew_max_rarity_4","Quark, Slayer of Klingons!",0, 7, 12, 10, 14, 4, 2, , , , 150, 75, 70, 575, false,"Quark",crew_portraits_cm_quark_wedding_day_sm.png,quark_wedding_day_crew
"Fennim",7,5, 0,0,0,817,251,462,0,0,0,0,0,0,1125,225,461,406,100,369,389,0,0,378,598,371,283,32,63,0,353,566,206,390,43,177,0,0,331,339,166,128,8,21,0,303,335,153,203,33,319,44,"Communicator, Scoundrel, Prodigy, Innovator, Thief","nonhuman, male, organic, voy, fennim, crew_max_rarity_5","We Are Already Proceeding",1, 7, 8, 8, 12, 6, 0, , , , 400, 100, 120, 415, false,"Fennim",crew_portraits_cm_fennim_sm.png,fennim_crew
"Lucille Davenport",6,5, 991,98,213,448,121,258,0,0,0,0,0,0,1179,219,430,0,0,0,96,468,348,50,295,710,478,76,432,0,333,0,188,0,190,181,665,583,147,542,521,349,60,323,0,351,0,183,0,203,293,331,"Starfleet, Federation, Costumed, Resourceful, Romantic, Human","female, organic, voy, captain, bridge_crew, janeway, crew_max_rarity_5","Walking On Your Grave",1, 10, 8, 10, 10, , , , , , 575, 200, 110, 300, false,"Janeway",crew_portraits_cm_janeway_davenport_sm.png,janeway_davenport_crew
"Captain Silva La Forge",10,5, 1059,259,606,0,0,0,408,149,309,0,0,0,1026,68,156,0,0,0,192,116,153,56,112,696,0,423,0,615,181,573,365,0,317,81,37,53,78,50,416,0,779,0,368,293,338,750,0,648,295,138,"Human, Federation, Starfleet, Explorer, Tactician","female, organic, tng, silva, captain, bridge_crew, crew_max_rarity_5","There's No Time To Explain",0, 8, 10, 8, 14, 8, 4, , , , 335, 100, 128, 450, false,"Silva",crew_portraits_cm_silva_captain_sm.png,silva_captain_crew
"Michael Sullivan",10,4, 0,0,0,0,0,0,0,0,0,0,0,0,505,146,319,743,167,351,0,0,0,694,364,0,0,629,288,0,717,369,597,248,87,0,0,0,551,272,0,0,473,230,0,543,279,390,172,64,896,707,"Bartender, Hologram, Human, Communicator, Civilian, Romantic","nonhuman, male, sullivan_michael, voy, crew_max_rarity_4","An Optimist Are You?",0, 6, 8, 8, 12, 7, 0, , , , 565, 220, 163, 390, false,"Sullivan",crew_portraits_cm_sullivan_michael_sm.png,sullivan_michael_crew
"Mother Horta",8,4, 0,0,0,0,0,0,697,271,557,0,0,0,561,159,310,0,0,0,0,490,0,656,0,401,0,594,0,361,129,300,556,0,473,0,213,0,548,0,90,0,466,0,88,28,70,385,0,367,840,351,"Caregiver, Primal, Silicon Lifeform, Saboteur, Desperate","nonhuman, organic, tos, horta, crew_max_rarity_4","NO KILL I",0, 7, 8, 5, 14, 1, 0, , , , 670, 200, 100, 300, false,"Horta",crew_portraits_cm_horta_sm.png,horta_crew
"Musketeer Picard",6,5, 485,74,148,0,0,0,1111,248,540,0,0,0,815,231,455,0,0,0,754,124,692,250,646,185,0,411,0,174,34,116,353,0,308,784,115,726,167,676,104,0,222,0,106,5,86,154,0,177,317,76,"Hologram, Human, Duelist, Hero, Inspiring, Tactician","male, nonhuman, tng, picard, crew_max_rarity_5","En Garde",2, 7, 4, 6, 10, 5, 0, , , , 550, 200, 103, 365, true,"Picard",crew_portraits_cm_picard_musketeer_sm.png,picard_musketeer_crew
"Covert Operative Leland",7,5, 369,163,346,0,0,0,1061,279,572,0,0,0,880,209,376,0,0,0,733,123,672,229,625,196,0,395,0,184,35,125,338,0,295,363,29,291,80,271,83,0,320,0,80,9,64,257,0,266,289,23,"Section 31, Undercover Operative, Crafty, Resourceful, Human","male, organic, dsc, leland, crew_max_rarity_5","Welcome To Section 31",0, 8, 8, 5, 12, 1, 0, 2, , , 250, 230, 163, 390, false,"Leland",crew_portraits_cm_dsc_leland_sec31_sm.png,dsc_leland_sec31_crew
"H.M.S. Pinafore Data",6,5, 1022,101,247,440,98,198,0,0,0,1180,172,449,0,0,0,0,0,0,95,423,13,470,245,761,61,779,468,185,0,0,197,87,0,223,612,37,659,486,661,69,696,397,224,0,0,217,107,0,306,411,"Android, Starfleet, Federation, Cyberneticist, Resourceful, Musician","nonhuman, male, tng, lieutenant_commander, bridge_crew, artificial_life, data, crew_max_rarity_5","A British Tar",2, 8, 12, 10, 14, 4, 0, , , , 300, 200, 100, 325, false,"Data",crew_portraits_cm_data_insurrection_sm.png,data_insurrection_crew
"Commodore Robert April",10,5, 1099,233,504,0,0,0,447,125,261,0,0,0,866,185,377,0,0,0,205,122,163,62,125,691,0,420,0,610,179,567,363,0,316,143,83,102,29,92,504,0,350,0,450,119,430,286,0,290,314,83,"Veteran, Human, Starfleet, Maverick, Explorer","male, organic, tos, april_robert, captain, crew_max_rarity_5","Into The Heart Of The Nova",0, 9, 10, 8, 10, , , , 2, 2, 450, 100, 80, 490, false,"April",crew_portraits_cm_april_commodore_sm.png,april_commodore_crew
"Lt. Commander Airiam",8,4, 586,102,207,738,168,356,0,0,0,0,0,0,399,37,71,0,0,0,104,640,557,475,513,491,352,275,299,0,888,0,815,0,707,99,668,585,595,544,350,259,272,226,0,952,0,880,0,760,723,734,"Federation, Starfleet, Astrophysicist, Resourceful, Prodigy, Human, Engineered","female, organic, dsc, bridge_crew, lieutenant_commander, airiam, crew_max_rarity_4","Engaging Spore Drive",0, 8, 4, 8, 14, , , , 1, 2, 525, 105, 125, 490, false,"Airiam",crew_portraits_cm_dsc_airiam_ltcmdr_sm.png,dsc_airiam_ltcmdr_crew
"Joseph Sisko",10,5, 0,0,0,988,133,272,0,0,0,0,0,0,1006,317,644,0,0,0,374,0,0,374,0,352,275,28,216,0,343,0,199,0,198,516,0,0,152,0,489,331,10,309,0,122,0,43,0,71,485,308,"Human, Resourceful, Caregiver, Chef, Federation, Civilian, Communicator","male, organic, ds9, joseph, crew_max_rarity_5","Life Is Full Of Choices",1, 8, 8, 8, 8, 3, 0, 3, , , 425, 280, 118, 215, false,"Joseph",crew_portraits_cm_joseph_chef_sm.png,joseph_chef_crew
"Prince Bashir",6,5, 1018,267,646,0,0,0,0,0,0,0,0,0,923,175,328,492,78,193,203,330,161,51,14,0,0,393,425,0,487,579,333,395,80,63,166,44,18,6,0,0,426,417,0,514,591,350,396,128,285,84,"Human, Starfleet, Federation, Royalty, Costumed, Physician, Engineered","nonhuman, male, organic, ds9, bashir, original, crew_max_rarity_5","This Is Where Heroes Are Made",0, 8, 6, 6, 14, 7, 2, , , , 300, 225, 210, 350, false,"Bashir",crew_portraits_cm_bashir_prince_sm.png,bashir_prince_crew
"Captain Spock",6,5, 1058,253,578,1025,101,226,0,0,0,0,0,0,479,103,211,0,0,0,23,331,162,131,122,355,277,125,218,0,786,0,680,0,579,18,216,66,61,59,612,393,261,372,0,732,0,614,0,536,291,191,"Starfleet, Federation, Exobiology, Musician, Astrophysicist, Human, Vulcan, Telepath","nonhuman, male, organic, tos, spock, captain, spock_tos, crew_max_rarity_5","Logic Is The Beginning Of Wisdom",1, 7, 8, 10, 12, 0, 1, , , , 415, 150, 127, 300, false,"Spock",crew_portraits_cm_spock_captain_sm.png,spock_captain_crew
