"Lieutenant Valeris",5,4, 218,136,300,387,172,439,579,203,541,0,0,0,0,0,0,0,0,0,411,354,795,882,745,101,450,669,403,441,634,389,0,0,0,35,65,386,570,377,13,195,290,174,127,233,104,0,0,0,778,52,"Vulcan, Saboteur, Starfleet, Federation, Resourceful, Telepath","nonhuman, female, organic, valeris, tos, lieutenant, crew_max_rarity_4","Conspirator",2, 9, 4, 8, 8, , , 2, , , 225, 200, 150, 415, false,"Valeris",crew_portraits_cm_valeris_sm.png,valeris_lieutenant_crew
"Dr. David Marcus",8,4, 0,0,0,782,152,299,0,0,0,443,168,385,0,0,0,0,0,0,489,0,585,0,0,486,107,540,296,551,0,0,606,353,0,455,0,258,0,0,447,45,487,282,295,0,0,296,154,0,908,690,"Gambler, Innovator, Jury Rigger, Human, Civilian","male, organic, tos, davidmarcus, crew_max_rarity_4","Experimental Maneuver",0, 7, 10, 14, 12, , , , , , 342, 355, 30, 450, false,"David",crew_portraits_cm_davidmarcus_sm.png,david_marcus_crew
"Undercover Sulu",8,5, 584,31,69,0,0,0,840,159,341,0,0,0,966,222,662,0,0,0,707,232,655,139,605,425,0,286,0,379,50,315,226,0,222,916,369,854,139,797,360,0,111,0,328,18,281,62,0,92,378,187,"Human, Federation, Starfleet, Pilot, Resourceful, Tactician, Undercover Operative, Maverick, Hero","male, organic, tos, lieutenant, bridge_crew, sulu, crew_max_rarity_5","Don't Call Me Tiny",1, 7, 16, 3, 16, 1, 2, , , , 600, 85, 200, 350, false,"Sulu",crew_portraits_cm_sulusfs_sm.png,sulu_sfs_crew
"North Star Tucker",7,5, 0,0,0,0,0,0,470,93,181,799,181,587,1049,161,315,0,0,0,0,739,325,431,0,732,269,312,0,83,133,600,25,182,238,0,703,100,537,0,680,110,456,0,31,241,580,8,43,359,400,172,"Human, Starfleet, Jury Rigger, Marksman, Costumed, Romantic, Gambler","male, organic, ent, commander, tucker, crew_max_rarity_5","Quick Draw",0, 7, 10, 10, 14, 6, 0, , , , 390, 330, 47, 1450, false,"Trip",crew_portraits_cm_tuckercowboy_sm.png,tucker_cowboy_crew
"Danara Pel",10,4, 0,0,0,618,48,125,0,0,0,0,0,0,0,0,0,646,151,430,660,0,0,0,390,637,441,653,82,0,0,391,0,272,428,858,0,0,0,217,853,569,843,107,0,0,216,0,132,261,927,883,"Hologram, Physician, Vidiian, Desperate, Geneticist","female, nonhuman, voy, danara, crew_max_rarity_4","Just A Disease",0, 8, 16, 12, 10, , , , , , 750, 210, 175, 340, false,"Danara",crew_portraits_cm_danarapel_sm.png,danara_pel_crew
"Warship Chakotay",9,4, 404,172,414,0,0,0,727,172,350,0,0,0,0,0,0,0,0,0,657,241,599,715,544,485,0,0,0,430,621,380,0,0,0,281,86,208,426,198,333,0,0,0,307,477,261,0,0,0,916,544,"Human, Starfleet, Federation, Hunter, Veteran, Brutal, Villain, Hologram, Maquis","male, organic, voy, bridge_crew, commander, first_officer, chakotay, crew_max_rarity_4","All Out War",0, 7, 6, 8, 12, , , , , , 640, 195, 60, 500, false,"Chakotay",crew_portraits_cm_chakotaylivingwitness_sm.png,chakotay_warship_crew
"Captain Pike",9,5, 1099,189,388,0,0,0,0,0,0,0,0,0,860,180,405,0,0,0,230,351,189,72,148,0,0,413,0,0,504,0,355,0,310,292,393,220,58,210,0,0,322,0,0,433,0,259,0,268,507,514,"Starfleet, Human, Federation, Romantic, Inspiring, Hero","captain, male, organic, tos, pike, crew_max_rarity_5","Fire All Weapons",0, 10, 4, 8, 8, , , 2, , , 525, 185, 130, 640, false,"Pike",crew_portraits_cm_pike_captain_sm.png,pike_captain_crew
"Will Scarlett",6,5, 0,0,0,0,0,0,983,289,597,0,0,0,850,172,355,0,0,0,0,343,0,536,0,224,0,448,0,206,45,146,393,0,336,0,178,0,491,0,72,0,401,0,71,11,57,328,0,324,508,238,"Klingon, Tactician, Duelist, Costumed, Hero","nonhuman, male, organic, tng, bridge_crew, worf, crew_max_rarity_5","Beg For Mercy",2, 8, 4, 10, 16, 5, 0, , , , 575, 225, 247, 375, false,"Worf",crew_portraits_cm_willscarletworf_sm.png,worf_merry_crew
"Boxer Chakotay",4,3, 272,24,58,0,0,0,558,65,105,0,0,0,332,18,46,0,0,0,906,559,845,724,790,687,0,877,0,609,609,564,862,0,745,927,726,868,893,815,850,0,920,0,724,839,703,908,0,781,968,1076,"Human, Starfleet, Federation, Hunter, Duelist, Athlete, Costumed, Maquis","male, organic, voy, bridge_crew, commander, first_officer, chakotay, crew_max_rarity_3","The Maquis Mauler",0, 4, 14, 10, 14, 0, 1, , 2, 2, 90, 265, 97, 575, false,"Chakotay",crew_portraits_cm_chakotayboxing_sm.png,chakotay_boxing_crew
"Beowulf Kim",9,5, 388,108,153,0,0,0,985,239,494,951,147,307,0,0,0,0,0,0,782,168,78,820,671,242,265,0,0,33,386,162,328,179,0,710,125,127,754,615,136,297,0,0,12,236,108,410,226,0,407,205,"Federation, Human, Costumed, Brutal, Duelist, Musician","male, organic, voy, kim, crew_max_rarity_5","By Hell-Forged Hands",0, 6, 4, 8, 8, 6, 0, 2, , , 300, 230, 150, 355, false,"Kim",crew_portraits_cm_kimbeowulf_sm.png,kim_beowulf_crew
"Jazz Musician Riker",5,3, 448,114,254,0,0,0,0,0,0,0,0,0,288,67,190,0,0,0,712,717,657,572,607,0,0,864,0,0,922,0,848,0,734,556,592,485,391,457,0,0,738,0,0,808,0,698,0,606,1016,952,"Federation, Human, Musician, Starfleet, Pilot, Maverick, Gambler, Romantic","male, organic, tng, bridge_crew, riker, crew_max_rarity_3","Calculated Risk",0, 7, 8, 10, 12, , , , 1, 2, 320, 270, 280, 215, false,"Riker",crew_portraits_cm_rikertrombone_sm.png,riker_trombone_crew
"Klingon Quark",7,4, 363,49,110,0,0,0,369,148,329,0,0,0,637,209,444,0,0,0,853,521,787,403,738,730,0,550,0,636,289,598,497,0,424,871,333,794,223,751,393,0,256,0,350,62,317,178,0,200,800,369,"Ferengi, Klingon, Scoundrel, Duelist, Desperate, Romantic, Gambler","nonhuman, male, organic, ds9, quark, crew_max_rarity_4","House of Quark",0, 8, 6, 6, 10, , , , 2, 2, 100, 435, 75, 640, false,"Quark",crew_portraits_cm_quarkklingon_sm.png,quark_klingon_armor_crew
"Commander Chakotay",8,2, 281,63,183,0,0,0,244,58,137,0,0,0,166,41,87,0,0,0,890,636,823,753,772,897,0,920,0,772,834,740,902,0,782,736,515,689,639,634,815,0,885,0,699,707,682,861,0,744,1031,971,"Human, Starfleet, Federation, Hunter, Tactician, Survivalist, Maquis","male, organic, voy, bridge_crew, commander, first_officer, chakotay, crew_max_rarity_2","Ancient Traditions",2, 4, 3, 10, 5, , , 2, , , 180, 115, 177, 115, false,"Chakotay",crew_portraits_cm_chakotaystarfleet_sm.png,chakotay_starfleet_crew
"Captain Kirk",6,2, 317,71,156,0,0,0,128,24,74,0,0,0,259,39,127,0,0,0,866,738,799,668,749,929,0,882,0,794,848,768,864,0,750,777,644,721,621,670,913,0,856,0,779,798,751,821,0,715,1034,1003,"Human, Federation, Starfleet, Inspiring, Romantic, Explorer","male, organic, tos, captain, bridge_crew, kirk, crew_max_rarity_2","Boldly Go",0, 3, 6, 10, 10, , , , , , 320, 135, , 215, false,"Kirk",crew_portraits_cm_kirktosyellow_sm.png,kirk_tos_yellow_crew
"Orion Vina",10,5, 0,0,0,866,109,268,0,0,0,0,0,0,1126,218,426,0,0,0,462,0,0,391,0,464,335,37,281,0,361,0,217,0,212,558,0,0,384,0,523,352,64,326,0,356,0,189,0,208,520,677,"Costumed, Orion, Human, Romantic, Desperate","nonhuman, female, tos, vina, crew_max_rarity_5","Distracting Dance",0, 7, 4, 10, 8, 8, 4, 2, , , 605, 165, 255, 515, false,"Vina",crew_portraits_cm_vinaorion_sm.png,vina_orion_crew
"Vic Fontaine",9,4, 0,0,0,0,0,0,0,0,0,0,0,0,681,170,524,576,35,130,0,0,0,584,573,0,0,517,410,0,598,537,455,374,93,0,0,0,323,747,0,0,215,530,0,298,715,152,475,95,917,806,"Gambler, Romantic, Merchant, Human, Artist, Musician, Hologram, Crafty, Communicator","male, ds9, vicfontaine, crew_max_rarity_4","The Best Is Yet To Come",1, 6, 8, 10, 16, 6, 0, , , , 150, 165, 742, 275, false,"Vic",crew_portraits_cm_vicfontaine_sm.png,vic_fontaine_crew
"Trader Odo",7,4, 0,0,0,0,0,0,636,73,144,0,0,0,868,109,248,0,0,0,0,638,0,573,0,598,0,502,0,529,177,483,441,0,380,0,770,0,660,0,772,0,615,0,668,438,654,546,0,490,882,972,"Changeling, Costumed, Merchant, Shapeshifter, Tribbled","nonhuman, organic, ds9, odo, crew_max_rarity_4","Tribble Trouble",0, 7, 10, 10, 10, 4, 4, , , , 455, 60, 155, 440, false,"Odo",crew_portraits_cm_odo_tos_sm.png,odo_tos_crew
"Obsidian Order Garak",7,5, 421,152,344,0,0,0,1040,174,492,0,0,0,985,144,350,0,0,0,676,136,624,160,570,235,0,338,0,218,39,157,271,0,258,385,70,308,133,292,183,0,434,0,166,53,139,355,0,340,297,95,"Cardassian, Obsidian Order, Crafty, Scoundrel, Interrogator, Resourceful, Undercover Operative, Brutal, Romantic, Saboteur","male, organic, ds9, nonhuman, garak, crew_max_rarity_5","For Cardassia!",0, 9, 8, 10, 12, , , , , , 550, 75, 5, 350, false,"Garak",crew_portraits_cm_garakobsidian_sm.png,garak_obsidian_crew
"Friar Tuck Data",3,4, 0,0,0,0,0,0,798,157,324,290,117,265,607,141,292,0,0,0,0,527,750,643,0,459,550,583,0,168,146,350,251,460,466,0,471,484,588,0,387,351,524,0,83,134,313,81,286,420,579,367,"Android, Federation, Starfleet, Counselor, Costumed, Cyberneticist, Cultural Figure, Duelist, Musician","nonhuman, male, tng, lieutenant_commander, bridge_crew, artificial_life, data, crew_max_rarity_4","Divine Protection",2, 7, 12, 12, 20, 2, 0, , , , 475, 200, 120, 600, false,"Friar Tuck",crew_portraits_cm_data_friartuck_sm.png,data_friar_tuck_crew
"Convergence Day Quark",8,5, 995,182,438,0,0,0,0,0,0,0,0,0,1043,217,498,0,0,0,252,371,211,41,170,0,0,291,0,0,373,0,230,0,224,238,353,171,27,160,0,0,196,0,0,276,0,135,0,155,473,328,"Ferengi, Costumed, Merchant, Romantic, Gambler, Bartender, Communicator, Civilian","nonhuman, male, organic, ds9, quark, original, crew_max_rarity_5","Grand Celebration",1, 9, 10, 10, 10, , , , , , 175, 85, 87, 480, false,"Quark",crew_portraits_cm_quarkfestive_sm.png,quark_convergence_crew
"Human Q",7,4, 0,0,0,546,150,297,0,0,0,816,93,314,294,69,151,0,0,0,606,0,410,894,0,589,94,405,362,414,925,0,221,241,739,460,0,446,822,0,455,86,238,286,446,873,0,205,266,657,730,616,"Desperate, Crafty, Scoundrel, Astrophysicist, Human","male, tng, q_jdl, crew_max_rarity_4","Q the Ordinary",1, 6, 12, 12, 20, 2, 0, , , , 190, , 30, 80, false,"Q",crew_portraits_cm_qhuman_sm.png,q_human_crew
"C.O.P. Founder Picard",7,5, 1144,84,164,0,0,0,0,0,0,0,0,0,1026,221,460,0,0,0,269,380,218,57,181,0,0,300,0,0,385,0,242,0,232,734,732,685,159,632,0,0,228,0,0,312,0,157,0,181,487,752,"Federation, Starfleet, Human, Inspiring, Cultural Figure, Musician, Communicator","male, organic, tng, ent, pic, captain, bridge_crew, picard, original, crew_max_rarity_5","Starfleet Maneuvers",2, 8, 6, 6, 6, , , , , , 450, , 150, 640, true,"Picard",crew_portraits_cm_picard_formal_sm.png,picard_founder_crew
"Pel",6,4, 638,48,139,0,0,0,0,0,0,0,0,0,840,133,314,0,0,0,626,649,568,225,521,0,0,487,0,0,569,0,429,0,368,837,806,764,386,718,0,0,498,0,0,570,0,417,0,393,879,950,"Civilian, Ferengi, Costumed, Undercover Operative, Romantic, Gambler","female, organic, ds9, pel, crew_max_rarity_4","Profit in the Wind",2, 9, 6, 12, 14, 5, 0, , , , 240, 100, 165, 350, false,"Pel",crew_portraits_cm_pel_sm.png,pel_crew
"Captain Nog",8,5, 1040,244,540,0,0,0,455,110,250,0,0,0,979,144,281,0,0,0,211,130,174,59,134,698,0,370,0,617,162,577,311,0,281,116,76,87,49,75,538,0,530,0,483,217,461,451,0,426,307,133,"Ferengi, Federation, Starfleet, Inspiring","nonhuman, male, organic, ds9, captain, nog, crew_max_rarity_5","Weapons Free",0, 9, 10, 10, 10, , , , , , 500, 250, 100, 300, false,"Nog",crew_portraits_cm_nogcaptain_sm.png,nog_captain_crew
"The Traveler",9,5, 0,0,0,411,99,279,0,0,0,1176,176,376,874,100,197,0,0,0,762,0,170,582,0,746,63,164,460,198,594,0,24,97,392,557,0,259,722,0,522,63,231,324,296,755,0,71,155,559,404,464,"Explorer, Quantum Mechanics, Warp Theorist, Prodigy, Civilian, Communicator, Inspiring","nonhuman, male, organic, tng, traveler, crew_max_rarity_5","See Past the Numbers",0, 8, 6, 6, 6, , , , , , 355, , 15, 575, true,"The Traveler",crew_portraits_cm_traveler_sm.png,traveler_crew
"Lieutenant Wesley Crusher",8,5, 0,0,0,465,148,378,884,121,254,1084,173,461,0,0,0,0,0,0,643,510,187,0,0,67,58,643,381,35,560,330,228,106,0,357,582,181,0,0,74,18,395,223,41,647,440,198,97,0,356,160,"Human, Federation, Starfleet, Prodigy, Warp Theorist, Tactician","male, organic, tng, lieutenant, bridge_crew, wesley, crew_max_rarity_5","Precise Maneuvers",1, 9, 6, 10, 12, , , , , , 300, 400, , 375, false,"Wesley",crew_portraits_cm_wesleylieutenant_sm.png,wesley_lieutenant_crew
"Captain Q",8,4, 372,189,389,536,69,129,0,0,0,0,0,0,606,181,411,0,0,0,261,692,628,317,576,715,481,237,435,0,649,0,517,0,439,124,391,219,56,208,819,538,150,500,0,420,0,246,0,259,720,289,"Starfleet, Crafty, Scoundrel, Q Continuum","nonhuman, male, tng, q_jdl, crew_max_rarity_4","Judgment",1, 8, 4, 14, 16, , , , , , 90, 555, , 290, false,"Q",crew_portraits_cm_qstarfleet_sm.png,q_starfleet_crew
"Locutus of Borg",1,5, 0,0,0,351,242,610,874,247,492,0,0,0,847,399,783,0,0,0,601,388,0,397,0,42,411,65,360,251,29,186,220,0,214,92,260,0,57,0,7,85,1,84,129,1,106,12,0,31,115,1,"Borg, Human, Diplomat, Cyberneticist, Brutal, Duelist, Cultural Figure","male, organic, tng, picard, gauntlet_jackpot, crew_max_rarity_5","Resistance is Futile",0, 9, 1, 10, 12, , , , , , 325, 100, 5, 490, false,"Locutus",crew_portraits_cm_locutus_sm.png,locutus_crew
"Bestselling Author Jake Sisko",9,4, 0,0,0,648,162,393,0,0,0,0,0,0,682,73,146,0,0,0,516,0,0,655,0,510,366,139,316,0,672,0,555,0,472,321,0,0,820,0,315,243,157,209,0,869,0,755,0,653,910,878,"Human, Federation, Civilian, Writer, Gambler, Romantic, Cultural Figure, Inspiring","male, organic, ds9, jake, crew_max_rarity_4","You Should Read More",1, 6, 12, 8, 14, 0, 2, , , , 525, 250, 170, 550, false,"Jake",crew_portraits_cm_jake_old_author_sm.png,jake_author_crew
"Prospero Data",5,4, 252,120,263,0,0,0,0,0,0,595,66,127,881,90,172,0,0,0,854,815,357,384,739,0,440,523,0,565,607,0,71,363,405,535,578,229,370,440,0,547,733,0,709,802,0,406,458,601,743,817,"Android, Federation, Starfleet, Cyberneticist, Costumed, Cultural Figure, Musician","nonhuman, male, tng, lieutenant_commander, bridge_crew, artificial_life, data, crew_max_rarity_4","Be Collected",1, 5, 4, 6, 6, , , , , , , 200, 240, 490, true,"Prospero",crew_portraits_cm_data_prospero_sm.png,data_prospero_crew
"Captain Morgan Bateson",10,5, 1074,218,498,0,0,0,986,117,244,0,0,0,447,94,186,0,0,0,210,73,173,142,133,354,0,771,0,321,195,264,740,0,642,159,93,116,127,106,536,0,715,0,479,343,457,663,0,578,350,281,"Federation, Starfleet, Human, Casual","male, organic, tng, captain, bridge_crew, bateson, crew_max_rarity_5","Surprise Attack",0, 8, 12, 10, 14, 8, 4, , , , 150, 30, 190, 590, false,"Bateson",crew_portraits_cm_bateson_sm.png,bateson_captain_crew
"Captain John Harriman",10,4, 589,83,188,0,0,0,0,0,0,0,0,0,778,132,255,0,0,0,630,654,574,262,526,0,0,546,0,0,630,0,490,0,419,691,706,646,352,597,0,0,578,0,0,651,0,506,0,465,911,931,"Federation, Starfleet, Human, Communicator","male, organic, tng, captain, bridge_crew, harriman, crew_max_rarity_4","Evasive Maneuvers",1, 7, 6, 10, 10, , , , , , 615, 30, 10, 500, false,"Harriman",crew_portraits_cm_harriman_sm.png,harriman_captain_crew
"Captain Sulu",9,4, 738,113,249,0,0,0,330,92,206,0,0,0,502,106,206,0,0,0,513,348,452,302,396,819,0,684,0,708,515,671,649,0,550,566,314,493,333,465,637,0,674,0,569,381,554,618,0,539,786,702,"Human, Federation, Starfleet, Veteran, Tactician, Pilot","male, organic, tos, captain, bridge_crew, sulu, crew_max_rarity_4","Outstanding!",1, 6, 14, 10, 14, 0, 1, , , , 115, , 50, 375, false,"Sulu",crew_portraits_cm_sulucaptain_sm.png,sulu_captain_crew
"Umpire Odo",8,5, 1165,165,351,0,0,0,0,0,0,0,0,0,944,138,302,0,0,0,215,338,177,65,137,0,0,399,0,0,493,0,341,0,299,351,440,277,143,259,0,0,508,0,0,584,0,430,0,403,497,719,"Changeling, Bajoran, Constable, Costumed","nonhuman, male, organic, ds9, odo, niners, crew_max_rarity_5","STRIKE THREE!",0, 8, 6, 8, 10, 3, 0, 2, , , 365, 250, 535, 375, false,"Odo",crew_portraits_cm_odoumpire_sm.png,odo_umpire_crew
"Niners Kira Nerys",4,4, 753,169,365,0,0,0,674,53,90,0,0,0,308,109,227,0,0,0,465,218,406,359,353,596,0,813,0,526,443,482,794,0,688,327,307,257,192,244,879,0,646,0,748,523,726,574,0,513,669,661,"Bajoran, Athlete, Costumed, Veteran","nonhuman, female, organic, ds9, kira, niners, crew_max_rarity_4","Double Play",2, 5, 12, 12, 20, 2, 0, , , , 150, 245, 122, 580, false,"Kira",crew_portraits_cm_kira_niners_sm.png,kira_niners_crew
"Niners Rom",3,4, 0,0,0,0,0,0,544,144,297,853,102,239,0,0,0,0,0,0,0,625,408,0,0,568,337,0,0,81,690,462,452,238,0,0,514,550,0,0,442,382,0,0,118,556,363,568,325,0,883,862,"Ferengi, Bajoran, Desperate, Resourceful, Jury Rigger, Athlete, Saboteur, Hero, Costumed","nonhuman, male, organic, ds9, rom, niners, crew_max_rarity_4","Bunt",0, 8, 6, 6, 10, , , , 2, 2, 865, 300, 185, 80, false,"Rom",crew_portraits_cm_rom_niners_sm.png,rom_niners_crew
"Goddess of Empathy Troi",7,5, 0,0,0,0,0,0,0,0,0,0,0,0,1101,74,155,992,234,676,0,0,0,459,130,0,0,345,140,0,439,140,284,96,18,0,0,0,806,44,0,0,771,63,0,852,55,740,20,35,478,540,"Human, Betazoid, Empath, Cultural Figure, Hologram, Inspiring","female, nonhuman, artificial_life, tng, commander, bridge_crew, troi, crew_max_rarity_5","Discard Your Facades",0, 7, 10, 10, 14, 6, 0, , , , 750, 70, 50, 1125, false,"Troi",crew_portraits_cm_troi_goddess_sm.png,troi_goddess_crew
"Apollo",7,4, 303,96,196,0,0,0,0,0,0,0,0,0,590,74,170,582,236,586,846,811,780,503,132,0,0,644,292,0,727,377,608,255,91,661,686,614,477,15,0,0,756,88,0,829,80,714,31,43,740,296,"Inspiring, Caregiver, Musician, Cultural Figure, Spiritual, Brutal","male, organic, tos, nonhuman, crew_max_rarity_4","I am Apollo!",2, 9, 12, 10, 12, , , , 1, 2, 500, 100, 83, 515, false,"Apollo",crew_portraits_cm_apollo_sm.png,apollo_crew
"Platonian Kirk",6,4, 626,138,268,0,0,0,689,191,390,0,0,0,217,122,265,0,0,0,543,202,483,449,431,492,0,869,0,435,377,384,852,0,737,501,129,430,232,416,265,0,579,0,239,110,202,508,0,466,695,269,"Human, Federation, Starfleet, Inspiring, Romantic, Explorer, Telekinetic","male, organic, tos, captain, bridge_crew, kirk, crew_max_rarity_4","Telekinetic Barrage",2, 9, 6, 12, 14, 5, 0, , , , 150, 735, 10, 425, false,"Kirk",crew_portraits_cm_kirk_platonian_sm.png,kirk_platonian_crew
"Ba'ku Worf",4,4, 547,119,272,0,0,0,902,118,299,0,0,0,0,0,0,0,0,0,613,171,553,685,511,402,0,0,0,362,529,301,0,0,0,523,226,450,616,432,470,0,0,0,418,591,392,0,0,0,855,828,"Klingon, Federation, Starfleet, Tactician, Desperate","nonhuman, male, organic, tng, lieutenant_commander, bridge_crew, worf, crew_max_rarity_4","Aggressive Tendencies",0, 6, 8, 5, 14, 1, 0, , , , 550, 325, 60, 305, false,"Worf",crew_portraits_cm_worf_insurrection_sm.png,worf_insurrection_crew
"Combat Medic Paris",4,4, 330,76,160,0,0,0,590,90,207,0,0,0,0,0,0,843,92,255,847,436,781,874,124,605,0,0,285,533,709,36,0,237,391,761,423,708,786,211,642,0,0,355,572,738,160,0,316,497,699,780,"Human, Starfleet, Federation, Tactician, Costumed","organic, voy, lieutenant, bridge_crew, paris, crew_max_rarity_4","Time's up!",0, 7, 10, 10, 16, 6, 0, , , , 575, 70, 30, 515, false,"Paris",crew_portraits_cm_paris_wwii_sm.png,paris_wwii_crew
"Maquis Ro Laren",9,4, 560,102,264,0,0,0,756,139,372,0,0,0,274,132,241,0,0,0,612,221,552,467,510,474,0,829,0,419,348,366,812,0,703,562,183,491,283,464,347,0,597,0,316,151,275,525,0,479,697,402,"Maquis, Bajoran, Survivalist, Saboteur, Desperate","nonhuman, female, organic, tng, ro, crew_max_rarity_4","Not Sure Where I Stand",1, 6, 12, 12, 16, 5, 0, , , , 280, 95, 20, 515, false,"Ro",crew_portraits_cm_ro_maquis_sm.png,ro_maquis_crew
"Dr. Hippocrates Noah",4,4, 0,0,0,675,155,333,0,0,0,0,0,0,353,82,174,571,104,349,518,0,0,845,460,513,370,295,75,0,874,430,786,310,239,409,0,0,772,365,400,276,180,57,0,813,361,701,217,156,719,489,"Hologram, Human, Villain, Crafty, Communicator, Prodigy, Resourceful","male, ds9, noah, sisko, crew_max_rarity_4","Demolish the House",2, 5, 3, 4, 16, 1, 0, , , , 300, 90, 103, 365, true,"Hippocrates",crew_portraits_cm_sisko_noah_sm.png,sisko_noah_crew
"Agent Janeway",8,5, 0,0,0,441,174,384,1013,63,144,0,0,0,1018,209,489,0,0,0,650,486,0,415,0,60,435,82,385,357,51,298,241,0,231,319,783,0,321,0,129,238,13,205,684,146,668,150,0,172,355,217,"Human, Federation, Starfleet, Costumed, Undercover Operative, Crafty","female, organic, voy, captain, bridge_crew, janeway, crew_max_rarity_5","Let's End This",0, 8, 10, 3, 14, 5, 1, , , , 465, 105, 125, 675, false,"Janeway",crew_portraits_cm_janeway_wwii_sm.png,janeway_wwii_crew
"Revolutionary Damar",7,5, 895,336,692,0,0,0,391,124,400,0,0,0,869,133,328,0,0,0,223,132,179,76,141,676,0,456,0,596,196,552,399,0,343,36,8,21,13,23,330,0,480,0,305,105,259,396,0,380,362,19,"Cardassian, Cultural Figure, Inspiring, Hero, Desperate","nonhuman, male, organic, ds9, damar, crew_max_rarity_5","For Cardassia!",2, 7, 12, 10, 14, 7, 0, , , , 450, 395, 100, 465, false,"Damar",crew_portraits_cm_damarrevolution_sm.png,damar_revolutionary_crew
"Emotion Chip Data",7,5, 0,0,0,518,108,231,0,0,0,819,182,396,1027,224,578,0,0,0,673,0,373,398,0,653,92,80,406,370,364,0,23,209,215,610,0,238,236,0,584,68,31,362,268,215,0,4,144,114,344,85,"Android, Starfleet, Federation, Cyberneticist, Resourceful, Musician","nonhuman, male, tng, lieutenant_commander, bridge_crew, artificial_life, data, crew_max_rarity_5","Humor, I love it!",0, 7, 6, 8, 12, 3, 0, 3, , , 575, 300, 10, 300, true,"Data",crew_portraits_cm_datagenerations_sm.png,data_generations_crew
"Augment Riker",5,4, 332,63,129,0,0,0,566,106,218,579,204,499,0,0,0,0,0,0,868,463,202,884,752,609,364,0,0,104,722,497,511,279,0,830,438,49,847,713,596,137,0,0,37,700,513,144,66,0,771,449,"Human, Augments, Engineered, Gambler, Desperate, Maverick, Jury Rigger, Survivalist","male, organic, tng, ent, pic, riker, original, crew_max_rarity_4","Last Chance",2, 7, 10, 10, 12, , , , , , 375, 305, 217, 330, false,"Riker",crew_portraits_cm_riker_augment_sm.png,riker_augment_crew
"Garak, Elim Garak",7,5, 1000,229,493,0,0,0,565,66,138,0,0,0,937,179,362,0,0,0,241,138,197,67,155,658,0,355,0,580,142,535,294,0,272,154,159,114,34,102,800,0,376,0,691,248,674,306,0,306,323,194,"Cardassian, Crafty, Resourceful, Undercover Operative, Costumed, Romantic, Hero","male, organic, ds9, nonhuman, garak, crew_max_rarity_5","There's Hope For You Yet",1, 7, 12, 12, 12, 6, 2, , , , 650, 200, 20, 700, false,"Garak",crew_portraits_cm_garak_secretagent_sm.png,garak_secretagent_crew
"Stranded Odo",9,4, 722,188,409,0,0,0,539,54,109,0,0,0,402,50,120,0,0,0,464,254,405,352,352,718,0,806,0,626,533,588,780,0,679,261,254,193,255,179,860,0,844,0,732,696,710,812,0,708,749,732,"Changeling, Desperate, Bajoran, Survivalist","nonhuman, organic, ds9, odo, crew_max_rarity_4","Not Without a Fight",0, 6, 8, 10, 10, 4, 2, , , , 275, 70, 130, 465, false,"Odo",crew_portraits_cm_odo_cold_weather_sm.png,odo_cold_weather_crew
"Age of Sail Riker",6,5, 1034,248,518,0,0,0,897,208,400,572,78,158,0,0,0,0,0,0,219,67,42,396,140,309,445,0,0,55,451,221,623,366,0,128,26,30,252,84,239,504,0,0,87,368,183,728,426,0,254,111,"Human, Federation, Starfleet, Explorer, Maverick, Gambler, Costumed","ageofsail, male, organic, tng, bridge_crew, riker, crew_max_rarity_5","Battle Stations!",0, 10, 8, 10, 12, , , , 1, 2, 350, , 195, 415, false,"Riker",crew_portraits_cm_riker_age_of_sail_sm.png,riker_ageofsail_crew
"Laas",9,4, 0,0,0,773,139,332,448,58,124,0,0,0,661,28,55,0,0,0,488,764,0,709,0,170,349,141,295,670,420,635,612,0,518,437,807,0,945,0,211,282,359,265,714,790,693,902,0,778,678,891,"Explorer, Changeling, Civilian, Prodigy, Hunter, Survivalist","nonhuman, male, organic, ds9, laas, crew_max_rarity_4","A Pale Shadow",2, 8, 8, 8, 10, , , , 0, 2, 580, 200, 242, 300, false,"Laas",crew_portraits_cm_laas_sm.png,laas_crew
"Age of Sail La Forge",4,4, 404,167,367,0,0,0,408,50,102,794,105,262,0,0,0,0,0,0,674,465,83,728,569,815,354,0,0,195,868,667,488,261,0,329,300,47,473,246,871,362,0,0,324,920,722,533,293,0,747,617,"Human, Starfleet, Federation, Cyberneticist, Explorer, Costumed, Innovator","ageofsail, male, organic, tng, lieutenant_commander, laforge, crew_max_rarity_4","Hard to Port!",1, 8, 10, 10, 12, , , , 0, 2, 1250, 130, 222, 550, false,"La Forge",crew_portraits_cm_laforge_age_of_sail_sm.png,laforge_ageofsail_crew
"Joachim",8,5, 957,117,254,0,0,0,1251,103,225,0,0,0,0,0,0,0,0,0,393,77,352,516,301,228,0,0,0,209,365,150,0,0,0,553,291,481,637,456,589,0,0,0,528,695,505,0,0,0,503,906,"Human, Augments, Engineered, Villain, Tactician, Pilot","nonhuman, male, organic, tos, joachim, crew_max_rarity_5","For Khan!",0, 6, 6, 10, 10, 8, 4, , , , 565, 505, 150, 350, false,"Joachim",crew_portraits_cm_joachim2_sm.png,joachim_wok_crew
"Durango Troi",6,5, 840,116,391,0,0,0,1349,52,114,0,0,0,381,207,417,0,0,0,420,82,378,236,320,222,0,659,0,205,88,144,627,0,529,368,309,294,68,275,858,0,282,0,730,219,707,211,0,224,337,358,"Empath, Constable, Scoundrel, Costumed, Federation, Starfleet, Betazoid, Human","female, nonhuman, tng, commander, bridge_crew, troi, crew_max_rarity_5","Call Me Durango",2, 10, 12, 12, 12, , , , 0, 2, 525, 375, 20, 725, false,"Troi",crew_portraits_cm_troi_cowboy_sm.png,troi_cowboy_crew
"Sybok",6,4, 0,0,0,670,51,126,0,0,0,0,0,0,827,117,238,215,141,461,615,0,0,591,672,600,416,136,178,0,613,648,473,443,183,854,0,0,662,188,846,564,390,97,0,686,194,550,115,68,647,546,"Vulcan, Inspiring, Spiritual, Explorer, Counselor, Telepath","nonhuman, male, organic, sybok, tos, crew_max_rarity_4","Share Your Pain",1, 7, 6, 8, 10, 3, 0, 3, , , 575, 390, 43, 390, false,"Sybok",crew_portraits_cm_sybok_sm.png,sybok_crew
"Augment Picard",7,5, 938,115,206,0,0,0,1163,221,447,0,0,0,438,108,184,0,0,0,419,75,372,265,316,188,0,777,0,179,94,117,747,0,647,623,128,563,406,527,182,0,705,0,165,113,138,648,0,566,354,363,"Human, Augments, Engineered, Villain, Brutal, Desperate, Survivalist, Hunter, Duelist","male, organic, tng, tos, picard, original, crew_max_rarity_5","Negotiate Surrender",0, 9, 12, 12, 12, , , , , , 600, 215, 110, 500, false,"Picard",crew_portraits_cm_picard_augment_sm.png,picard_augment_crew
"Luther Sloan",10,4, 230,47,86,0,0,0,492,210,485,0,0,0,696,113,217,0,0,0,919,477,856,508,803,526,0,573,0,474,207,418,528,0,451,897,215,825,550,776,164,0,652,0,147,88,122,580,0,520,804,506,"Human, Starfleet, Federation, Undercover Operative, Interrogator, Section 31, Villain","male, organic, ds9, sloan, crew_max_rarity_4","Clandestine Meeting",1, 7, 8, 6, 10, 5, 0, , , , 425, 530, 183, 600, true,"Sloan",crew_portraits_cm_luthersloan_sm.png,sloan_spy_crew
