"Pining Vina",9,5, 0,0,0,483,106,216,0,0,0,0,0,0,1287,225,456,831,183,413,1059,0,0,471,516,1042,769,104,102,0,423,512,234,341,25,929,0,0,489,304,896,633,100,71,0,431,303,263,178,18,485,169,"Human, Civilian, Romantic, Desperate, Diplomat","organic, female, dsc, vina, crew_max_rarity_5","Who Are You?",2, 7, 10, 5, 10, 7, 0, , , , 350, 210, 158, 425, false,"Vina",crew_portraits_cm_vina_sm.png,dsc_vina_crew
"Flotter",7,4, 0,0,0,848,177,367,0,0,0,0,0,0,619,121,261,302,82,220,680,0,0,1011,1084,664,494,192,172,0,1046,1005,864,757,416,504,0,0,949,833,494,355,140,96,0,998,809,801,568,233,1008,721,"Hologram, Caregiver, Cultural Figure","voy, nonhuman, artificial_life, flotter, male, crew_max_rarity_4","No More Lying",2, 8, 8, 6, 10, , , , , , 375, 255, 125, 450, false,"Flotter",crew_portraits_cm_flotter_sm.png,flotter_crew
"Trevis",7,4, 0,0,0,319,70,201,861,157,318,0,0,0,582,138,273,0,0,0,1243,781,0,1027,0,319,939,580,790,626,234,505,878,0,731,1037,712,0,912,0,196,726,342,609,555,209,465,758,0,653,1036,802,"Hologram, Caregiver, Cultural Figure, Gardener","voy, nonhuman, artificial_life, trevis, male, crew_max_rarity_4","I'm Not A Monster!",0, 8, 8, 8, 10, , , , , , 540, 200, 112, 125, false,"Trevis",crew_portraits_cm_trevis_sm.png,trevis_crew
"Desert Archer",8,5, 852,149,341,567,69,177,0,0,0,0,0,0,1218,245,474,0,0,0,175,785,644,101,513,957,696,107,567,0,486,0,287,0,239,215,680,513,60,419,1074,790,121,654,0,366,0,228,0,197,483,263,"Human, Starfleet, Explorer, Telepath, Resourceful, Survivalist","male, organic, ent, archer, crew_max_rarity_5","You're Lying!",2, 10, 8, 8, 10, , , , , , 500, 100, 140, 365, false,"Archer",crew_portraits_cm_archer_desert_sm.png,archer_desert_crew
"Dark Empath Troi",8,5, 937,143,322,0,0,0,1300,178,445,0,0,0,0,0,0,473,101,246,627,78,571,805,49,255,0,0,657,261,431,23,0,637,898,632,118,555,781,88,337,0,0,502,336,511,51,0,485,749,412,282,"Starfleet, Federation, Human, Betazoid, Empath, Counselor, Brutal","nonhuman, female, organic, tng, troi, crew_max_rarity_5","Take Me With You!",0, 9, 8, 8, 8, , , , 1, 3, 450, 230, 100, 430, false,"Troi",crew_portraits_cm_troi_darkempath_sm.png,troi_darkempath_crew
"Torchbearer Tyler",7,4, 0,0,0,0,0,0,873,121,206,0,0,0,576,108,214,0,0,0,0,817,0,1060,0,723,0,940,0,659,291,548,914,0,764,0,947,0,1048,0,864,0,962,0,813,470,731,920,0,775,1347,1401,"Human, Federation, Starfleet, Cultural Figure, Tactician, Klingon","male, organic, dsc, tyler, voq, crew_max_rarity_4","That's a Torchbearer's Job",0, 9, 8, 10, 8, , , , , , 365, 250, 183, 425, false,"Tyler",crew_portraits_cm_tyler_torchbearer_sm.png,dsc_tyler_torchbearer_crew
"Safecracker Nog",8,4, 0,0,0,610,57,146,0,0,0,876,132,331,406,57,124,0,0,0,955,0,634,1245,0,921,141,610,543,619,1282,0,262,335,1002,1213,0,563,1299,0,1197,231,855,749,567,1336,0,292,293,1043,1055,1256,"Ferengi, Costumed, Federation, Starfleet, Criminal, Resourceful","nonhuman, male, organic, ds9, nog, crew_max_rarity_4","Piece of Cake",2, 7, 6, 8, 10, , , , , , 390, 200, 180, 375, false,"Nog",crew_portraits_cm_nog_safecracker_sm.png,nog_safecracker_crew
"Dress Uniform Bashir",8,4, 0,0,0,654,63,140,0,0,0,0,0,0,350,42,134,761,185,414,910,0,0,1313,549,872,640,632,93,0,1335,555,1237,367,320,1214,0,0,1303,299,1198,890,865,112,0,1343,298,1217,174,173,1143,1143,"Human, Starfleet, Federation, Cyberneticist, Physician, Engineered, Gambler, Undercover Operative","nonhuman, male, organic, ds9, bashir, crew_max_rarity_4","Pleasure to Meet You!",0, 8, 6, 6, 8, , , , , , 215, 230, 93, 425, false,"Bashir",crew_portraits_cm_bashir_dressuniform_sm.png,bashir_dress_uniform_crew
"Little John Riker",7,5, 1023,128,239,0,0,0,1309,192,354,0,0,0,422,113,245,0,0,0,567,67,508,361,392,276,0,1129,0,284,142,162,1106,0,941,822,229,763,418,662,471,0,891,0,455,188,351,840,0,712,441,602,"Human, Federation, Starfleet, Costumed, Thief, Maverick","male, organic, tng, riker, crew_max_rarity_5","We Need a Diversion",0, 6, 10, 8, 16, 2, 0, , , , 515, 200, 125, 425, false,"Riker",crew_portraits_cm_riker_littlejohn_sm.png,riker_littlejohn_crew
"Transporter Chief Rand",10,4, 0,0,0,0,0,0,0,0,0,859,113,241,628,92,204,0,0,0,0,0,669,1031,0,0,532,907,0,664,1063,0,152,362,734,0,0,787,1098,0,0,569,1019,0,766,1139,0,286,457,832,1334,1397,"Human, Federation, Starfleet, Desperate","female, organic, tos, rand, crew_max_rarity_4","Yank Them Back!",1, 8, 8, 8, 10, , , , , , 475, 275, 155, 242, false,"Rand",crew_portraits_cm_rand_transporter_sm.png,rand_transporter_crew
"Betrothed Kamala",3,2, 234,27,86,145,27,81,0,0,0,0,0,0,363,43,105,0,0,0,1194,1263,1258,1066,1149,1330,1005,1066,847,0,1338,0,1240,0,1067,1161,1253,1241,1147,1135,1315,996,1084,837,0,1366,0,1247,0,1078,1514,1526,"Kriosian, Empath, Romantic","organic, tng, female, nonhuman, kamala, crew_max_rarity_2","I Am for You",1, 2, 6, 3, 10, 1, 0, , , , 390, 130, 115, 530, false,"Kamala",crew_portraits_cm_kamala_betrothed_sm.png,kamala_betrothed_crew
"Cadet First Class Locarno",10,5, 1284,180,408,0,0,0,0,0,0,0,0,0,1078,160,296,0,0,0,278,474,253,43,143,0,0,527,0,0,662,0,451,0,382,417,571,362,145,280,0,0,718,0,0,855,0,651,0,547,731,974,"Human, Federation, Starfleet, Maverick, Pilot, Crafty, Desperate","tng, male, nicholas_locarno, organic, crew_max_rarity_5","Everything I Said Was The Truth!",1, 10, 4, 12, 8, , , , 2, 2, 390, 150, 175, 690, false,"Locarno",crew_portraits_cm_nicholas_locarno_sm.png,locarno_nicholas_crew
"Kamala",10,5, 967,131,227,546,92,174,0,0,0,0,0,0,1254,238,483,0,0,0,166,749,598,83,471,969,709,95,577,0,436,0,247,0,202,357,899,783,117,680,1028,744,111,615,0,362,0,223,0,196,364,450,"Kriosian, Empath, Romantic, Exoarchaeology","nonhuman, female, organic, tng, kamala, crew_max_rarity_5","Who I Am Today, I Will Be Forever",1, 7, 4, 6, 8, , , , , , 315, 95, 167, 325, true,"Kamala",crew_portraits_cm_kamala_sm.png,kamala_crew
"Priestess Siranna",7,4, 529,112,242,0,0,0,0,0,0,0,0,0,883,138,286,382,78,211,963,1000,911,363,380,0,0,742,725,0,894,939,688,696,215,845,901,788,362,204,0,0,799,592,0,937,827,727,589,205,1064,952,"Gardener, Kelpien, Spiritual, Civilian, Ambassador, Cultural Figure","nonhuman, female, organic, dsc, siranna, crew_max_rarity_4","The Truth Has Survived",1, 7, 6, 8, 8, , , , , , 450, 200, 100, 475, false,"Siranna",crew_portraits_cm_siranna_priestess_sm.png,dsc_siranna_priestess_crew
"Scrooge Data",6,5, 969,171,330,508,73,173,0,0,0,0,0,0,1267,264,338,0,0,0,160,656,489,73,372,1067,797,123,649,0,493,0,294,0,243,200,669,492,97,402,1075,791,177,655,0,590,0,386,0,327,399,432,"Android, Starfleet, Federation, Cyberneticist, Costumed, Cultural Figure, Artist, Resourceful","nonhuman, male, tng, artificial_life, data, crew_max_rarity_5","Humbug",1, 9, 6, 8, 6, , , , , , 200, 305, 160, 475, false,"Data",crew_portraits_cm_data_scrooge_sm.png,data_scrooge_crew
"Chancellor Martok",8,5, 943,132,341,0,0,0,543,67,148,0,0,0,1262,161,372,0,0,0,611,310,554,93,430,1010,0,411,0,929,143,816,330,0,282,614,435,537,165,451,1139,0,571,0,1028,334,948,503,0,427,479,700,"Klingon, Duelist, Tactician, Diplomat, Veteran, Politician, Cultural Figure","nonhuman, male, organic, ds9, martok, crew_max_rarity_5","I will fight any battle. Anywhere",0, 9, 8, 8, 10, , , , 2, 2, 400, 125, 184, 450, false,"Martok",crew_portraits_cm_martok_chancellor_sm.png,martok_chancellor_crew
"Admiral Patrick",9,5, 1238,275,538,1023,124,239,0,0,0,0,0,0,495,76,143,0,0,0,17,425,208,174,103,531,404,233,306,0,1221,0,1098,0,931,19,318,117,149,76,815,572,489,479,0,1285,0,1149,0,981,340,339,"Human, Engineered, Federation, Civilian, Costumed, Crafty","male, organic, ds9, patrick, crew_max_rarity_5","That's A Stupid Question",1, 9, 8, 10, 10, , , , , , 500, 100, 155, 375, false,"Patrick",crew_portraits_cm_patrick_admiral_sm.png,patrick_admiral_crew
"Christine Chapel",10,4, 0,0,0,559,70,170,0,0,0,0,0,0,349,103,201,790,127,280,995,0,0,1243,586,967,705,660,124,0,1281,585,1160,398,321,1128,0,0,1077,626,1097,807,552,198,0,1125,623,967,418,211,1197,1170,"Federation, Starfleet, Human, Physician, Veteran, Nurse, Romantic","female, organic, tos, chapel, crew_max_rarity_4","Don't You Recognise Me?",1, 7, 8, 12, 12, 5, 0, , , , 1400, 185, 120, 400, false,"Chapel",crew_portraits_cm_chapel_christine_sm.png,chapel_christine_crew
"Brainless Spock",7,2, 0,0,0,223,43,138,0,0,0,360,51,179,0,0,0,0,0,0,1312,0,1137,0,0,1314,626,1302,828,1072,0,0,1188,721,0,1249,0,1088,0,0,1240,510,1231,792,994,0,0,1108,678,0,1533,1509,"Federation, Starfleet, Exobiology, Astrophysicist, Human, Musician, Vulcan, Telepath","nonhuman, male, organic, tos, spock, crew_max_rarity_2","A Practical Idea",2, 3, 8, 10, 8, , , , , , 460, 150, 163, 390, false,"Spock",crew_portraits_cm_spock_brainless_sm.png,spock_brainless_crew
"Garth of Izar",6,5, 1214,226,444,0,0,0,989,156,344,0,0,0,487,83,142,0,0,0,307,73,272,210,169,494,0,1124,0,459,255,327,1103,0,937,274,84,237,229,172,548,0,1139,0,521,349,418,1133,0,962,447,331,"Prisoner, Desperate, Human, Brutal, Resourceful, Villain, Shapeshifter, Veteran, Explorer, Innovator, Federation","organic, male, tos, garth_izar, crew_max_rarity_5","I'm Afraid of No One",0, 8, 6, 8, 10, 1, 0, 2, , , 300, 200, 185, 225, false,"Garth",crew_portraits_cm_garth_izar_sm.png,garth_izar_crew
"Seeking Spock",8,5, 0,0,0,1257,183,448,0,0,0,0,0,0,430,132,295,931,170,326,284,0,0,1155,478,301,249,119,22,0,1189,469,1040,309,124,362,0,0,890,442,344,269,75,28,0,935,453,720,266,100,501,192,"Vulcan, Human, Telepath, Spiritual, Starfleet, Federation, Resourceful, Explorer","nonhuman, male, organic, tos, spock, crew_max_rarity_5","Recommend We Proceed",1, 9, 10, 12, 12, , , , , , 550, 200, 175, 225, false,"Spock",crew_portraits_cm_spock_seeking_sm.png,spock_seeking_crew
"Compromised Airiam",9,5, 0,0,0,940,178,397,1254,198,420,0,0,0,0,0,0,0,0,0,545,484,0,0,0,17,395,590,298,300,496,190,0,0,0,463,528,0,0,0,25,328,499,268,340,522,236,0,0,0,749,756,"Control, Federation, Starfleet, Brutal, Undercover Operative, Human, Engineered, Astrophysicist","evsuit, female, organic, dsc, airiam, crew_max_rarity_5","Open The Airlock",0, 9, 8, 8, 10, , , , 2, 2, 555, 125, 285, 400, false,"Airiam",crew_portraits_cm_airiam_compromised_sm.png,dsc_airiam_compromised_crew
"Lt. Uhura",6,3, 384,51,129,0,0,0,0,0,0,0,0,0,539,76,178,0,0,0,1207,1177,1138,827,1030,0,0,1013,0,0,1152,0,989,0,820,1243,1208,1171,873,1067,0,0,1087,0,0,1212,0,1061,0,905,1459,1502,"Human, Starfleet, Federation, Musician, Communicator","female, organic, tos, uhura, crew_max_rarity_3","Hailing Frequencies Open",1, 5, 6, 10, 12, , , , , , 300, 50, 71, 190, false,"Uhura",crew_portraits_cm_uhura_lt_yellow_sm.png,uhura_lt_yellow_crew
"Rescue Team Uhura",7,5, 984,179,361,0,0,0,1313,166,410,0,0,0,456,113,208,0,0,0,519,51,458,314,346,263,0,1105,0,272,126,148,1089,0,917,487,106,422,269,339,429,0,963,0,404,196,307,921,0,776,301,268,"Human, Federation, Starfleet, Communicator, Resourceful, Musician, Marksman","female, organic, tos, tas, uhura, crew_max_rarity_5","Phasers on Setting One. Fire.",2, 7, 6, 3, 8, 7, 0, , , , 540, 225, 68, 150, false,"Uhura",crew_portraits_cm_uhura_rescue_sm.png,uhura_rescue_crew
"Sulu of the Body",9,4, 612,111,266,0,0,0,0,0,0,0,0,0,910,153,301,0,0,0,870,915,816,282,695,0,0,707,0,0,863,0,654,0,535,802,868,745,302,647,0,0,727,0,0,867,0,658,0,554,1286,1270,"Human, Federation, Starfleet, Diplomat, Pilot, Archon","male, organic, tos, sulu, crew_max_rarity_4","Paradise, My Friend, Paradise",1, 6, 8, 8, 12, 6, 0, , , , 615, 270, 168, 475, false,"Sulu",crew_portraits_cm_sulu_archon_sm.png,sulu_archon_crew
"Lenara Kahn",10,5, 0,0,0,1246,187,421,0,0,0,0,0,0,997,144,301,0,0,0,305,0,0,748,0,322,259,48,174,0,742,0,527,0,439,412,0,0,866,0,392,295,79,230,0,897,0,683,0,589,757,993,"Trill, Astrophysicist, Romantic","nonhuman, female, organic, ds9, lenara, crew_max_rarity_5","I'm Not Like You",1, 10, 8, 8, 8, , , , , , 315, 200, 150, 490, false,"Lenara",crew_portraits_cm_lenara_kahn_sm.png,lenara_kahn_crew
"Torpedo Surgeon McCoy",9,5, 0,0,0,893,148,332,0,0,0,593,29,70,0,0,0,1254,142,484,666,0,1001,0,199,651,153,714,25,945,0,210,1026,20,290,633,0,1256,0,247,604,325,666,32,1148,0,256,1298,77,301,569,762,"Federation, Starfleet, Human, Physician, Exobiology, Desperate, Jury Rigger","male, organic, tos, mccoy, crew_max_rarity_5","Lock and Load",2, 8, 4, 6, 8, 1, 0, , , , 300, 230, 86, 250, true,"McCoy",crew_portraits_cm_mccoy_torpedo_sm.png,mccoy_torpedo_crew
"Scared Scotty",9,4, 0,0,0,0,0,0,381,89,175,871,114,238,639,59,128,0,0,0,0,1144,665,1061,0,1160,527,942,0,302,712,934,155,357,766,0,1049,798,1292,0,1013,574,1217,0,341,860,849,476,462,1035,1072,1294,"Human, Starfleet, Federation, Jury Rigger, Desperate","male, organic, tos, scott, crew_max_rarity_4","I Don't Remember",1, 5, 12, 10, 12, 0, 1, , , , 370, 145, 17, 250, false,"Scotty",crew_portraits_cm_scotty_scared_sm.png,scott_scared_crew
"Talas",9,5, 510,73,159,0,0,0,958,151,327,1273,208,375,0,0,0,0,0,0,1093,314,65,1176,915,550,253,0,0,36,778,381,304,96,0,1129,417,115,1196,967,592,305,0,0,41,780,461,396,163,0,448,520,"Andorian, Imperial Guard, Saboteur, Romantic, Tactician, Crafty","nonhuman, female, organic, ent, talas, crew_max_rarity_5","It's Not The Weapon, It's The Soldier",2, 6, 10, 10, 18, 2, 0, , , , 1475, 200, 115, 415, false,"Talas",crew_portraits_cm_talas_sm.png,talas_crew
"EV Suit Chekov",7,4, 379,58,169,661,62,141,0,0,0,0,0,0,925,129,248,0,0,0,514,1163,1114,483,1007,862,637,207,509,0,875,0,672,0,549,730,1126,1095,606,980,1199,891,490,750,0,1008,0,810,0,694,997,1301,"Federation, Starfleet, Human, Resourceful, Tactician","male, evsuit, organic, tos, chekov, crew_max_rarity_4","We've Got To Get Out Of Here",1, 7, 14, 12, 14, 5, 0, , , , 380, 50, 70, 400, false,"Chekov",crew_portraits_cm_chekov_evsuit_sm.png,chekov_evsuit_crew
"Laborer Kirk",6,5, 1013,107,294,0,0,0,0,0,0,1292,210,476,496,65,151,0,0,0,555,661,12,342,379,0,211,1121,0,244,1222,0,71,62,932,765,837,21,575,613,0,201,1158,0,251,1292,0,86,83,985,343,494,"Human, Federation, Starfleet, Jury Rigger, Resourceful, Romantic, Thief, Desperate","male, organic, tos, kirk, crew_max_rarity_5","How Are The Stone Knives And Bearskins?",2, 7, 8, 8, 12, 2, 0, , , , 200, 200, 147, 375, false,"Kirk",crew_portraits_cm_kirk_laborer_sm.png,kirk_laborer_crew
"Dress Uniform Beverly Crusher",10,4, 0,0,0,0,0,0,0,0,0,0,0,0,611,73,245,810,172,428,0,0,0,1036,526,0,0,911,403,0,1070,525,885,344,103,0,0,0,1051,300,0,0,965,253,0,1095,299,931,175,103,1323,1213,"Human, Starfleet, Federation, Physician, Caregiver, Cyberneticist","female, organic, tng, crusher, crew_max_rarity_4","The Bride and Groom",2, 8, 10, 6, 12, , , , , , 400, 195, 217, 415, false,"Crusher",crew_portraits_cm_crusher_dress_uniform_sm.png,crusher_dress_uniform_crew
"Ishan Chaye Sisko",7,5, 0,0,0,0,0,0,496,93,293,1284,247,490,987,120,226,0,0,0,0,1012,199,808,0,959,193,678,0,68,249,767,29,55,512,0,860,171,1016,0,760,166,930,0,28,345,640,36,60,744,278,233,"Bajoran, Resourceful, Desperate, Undercover Operative, Civilian, Investigator","male, organic, ds9, sisko, crew_max_rarity_5","We're Not Who We Seem To Be",1, 9, 6, 10, 10, , , , , , 200, 220, 160, 380, false,"Sisko",crew_portraits_cm_sisko_ishan_chaye_sm.png,sisko_ishan_chaye_crew
"Saowin",10,4, 0,0,0,874,171,371,0,0,0,671,94,219,0,0,0,0,0,0,657,0,776,0,0,634,115,704,361,752,0,0,846,444,0,508,0,886,0,0,497,117,563,296,840,0,0,925,522,0,1276,1252,"Desperate, Resourceful, Ambassador, Civilian","male, organic, nonhuman, voy, saowin, crew_max_rarity_4","I Have Some Bad News",1, 7, 6, 8, 10, 3, 0, 2, , , 400, 50, 96, 474, false,"Saowin",crew_portraits_cm_saowin_sm.png,saowin_crew
"Dejaren",5,4, 566,157,355,380,54,148,877,159,388,0,0,0,0,0,0,0,0,0,470,255,788,1002,669,236,900,1202,756,575,848,462,0,0,0,237,139,463,710,380,193,895,1192,751,452,668,348,0,0,0,941,618,"Brutal, Hologram, Crafty, Desperate, Saboteur","male, artificial_life, nonhuman, voy, dejaren, crew_max_rarity_4","You're Getting Blood Everywhere",0, 7, 6, 8, 12, 1, 0, , , , 140, 125, 137, 300, false,"Dejaren",crew_portraits_cm_dejaren_sm.png,dejaren_crew
"Dr. 'Bones' McCoy",7,5, 0,0,0,0,0,0,0,0,0,0,0,0,0,0,0,1641,98,360,0,0,0,0,45,0,0,0,87,0,0,56,0,32,108,0,0,0,0,539,0,0,0,397,0,0,546,0,348,569,1329,1491,"Federation, Starfleet, Human, Physician, Resourceful, Exobiology","male, organic, tos, mccoy, crew_max_rarity_5","I'm A Doctor!",2, 8, 6, 10, 14, 3, 0, 3, , , 700, 325, 291, 325, false,"McCoy",crew_portraits_cm_mccoy_doctor_sm.png,mccoy_doctor_crew
"Arandis",9,4, 649,82,207,0,0,0,0,0,0,0,0,0,936,85,208,0,0,0,877,919,822,307,701,0,0,745,0,0,901,0,695,0,568,986,1021,952,640,839,0,0,1030,0,0,1148,0,986,0,841,1309,1432,"Resourceful, Inspiring, Communicator, Civilian, Romantic, Risian, Playful","female, nonhuman, organic, ds9, arandis, crew_max_rarity_4","Risa Will Be Waiting",1, 5, 4, 8, 12, 3, 0, 3, , , 405, 50, 33, 440, true,"Arandis",crew_portraits_cm_arandis_sm.png,arandis_crew
"Captain Lucero",6,4, 661,108,235,858,172,324,0,0,0,0,0,0,352,80,162,0,0,0,131,891,770,675,650,676,502,370,383,0,1309,0,1196,0,1033,137,918,823,638,713,575,391,274,334,0,1234,0,1088,0,928,965,923,"Human, Federation, Starfleet, Tribbled, Survivalist, Explorer, Resourceful","female, organic, dsc, lucero, crew_max_rarity_4","He's an Idiot",2, 8, 6, 8, 10, 5, 0, , , , 525, 200, 110, 390, false,"Lucero",crew_portraits_cm_lucero_captain_sm.png,dsc_lucero_captain_crew
"Admiral Maxwell Forrest",9,5, 1256,220,470,0,0,0,0,0,0,430,102,236,1002,151,312,0,0,0,259,454,63,60,122,0,833,581,0,992,729,0,151,662,427,252,432,38,76,154,0,598,702,0,796,830,0,144,481,532,378,214,"Human, Diplomat, Starfleet, Ambassador","male, organic, ent, forrest, crew_max_rarity_5","It's Time to Swim",1, 7, 8, 8, 14, 2, 0, , , , 405, 320, 100, 425, false,"Forrest",crew_portraits_cm_forrest_admiral_sm.png,forrest_admiral_crew
"Belle Q",9,5, 982,98,243,452,75,166,0,0,0,0,0,0,1286,210,438,0,0,0,190,742,587,81,464,1128,847,128,707,0,444,0,254,0,209,446,923,827,187,719,1091,803,155,665,0,482,0,309,0,262,527,697,"Q Continuum, Costumed, Romantic, Resourceful, Crafty","female, organic, tng, nonhuman, miss_q, crew_max_rarity_5","They're Using Our Weapons",0, 9, 8, 8, 10, , , , , , 400, 320, 211, 390, false,"Q",crew_portraits_cm_miss_q_civil_war_sm.png,miss_q_civil_war_crew
"Mycelial Culber",7,5, 449,93,303,869,198,423,0,0,0,0,0,0,0,0,0,1291,237,550,167,1069,1003,1147,11,607,451,668,11,0,0,126,0,64,189,62,843,709,917,10,365,277,427,7,0,0,127,0,53,166,350,77,"Human, Physician, Romantic, Federation, Starfleet, Desperate, Displaced","male, organic, dsc, culber, crew_max_rarity_5","You Have to Let Me Go",0, 9, 6, 6, 6, , , , 1, 3, 400, 200, 148, 500, false,"Culber",crew_portraits_cm_culber_mycelial_sm.png,dsc_culber_mycelial_crew
"Commander Shelby",9,4, 855,128,259,0,0,0,643,80,169,0,0,0,0,0,0,0,0,0,733,320,663,890,538,854,0,0,0,790,1066,677,0,0,0,792,496,729,935,633,1056,0,0,0,951,1219,878,0,0,0,1330,1406,"Gambler, Starfleet, Federation, Human, Tactician, Desperate, Maverick, Resourceful, Saboteur","female, organic, tng, shelby, crew_max_rarity_4","Impossible!",1, 7, 8, 10, 8, , , , , , 475, 200, 153, 325, false,"Shelby",crew_portraits_cm_shelby_commander_sm.png,shelby_commander_crew
"Tourist Worf",3,3, 533,62,160,0,0,0,386,56,160,0,0,0,0,0,0,0,0,0,1056,757,1004,1148,885,1189,0,0,0,1046,1285,957,0,0,0,1152,785,1104,1216,993,1134,0,0,0,1023,1281,944,0,0,0,1460,1494,"Federation, Starfleet, Klingon, Saboteur, Romantic","male, nonhuman, organic, ds9, worf, crew_max_rarity_3","I Didn't Bring A Bathing Suit",1, 4, 10, 8, 10, 1, 2, , , , 25, 100, 173, 90, false,"Worf",crew_portraits_cm_worf_tourist_sm.png,worf_tourist_crew
"Control Leland",8,5, 1254,233,394,0,0,0,1067,103,198,0,0,0,658,49,86,0,0,0,291,72,261,161,150,514,0,952,0,477,206,343,922,0,772,340,219,290,374,215,933,0,1277,0,870,910,794,1263,0,1090,258,925,"Section 31, Undercover Operative, Crafty, Control, Brutal, Human, Federation, Starfleet","nonhuman, male, organic, dsc, leland, crew_max_rarity_5","Get Me That Data",0, 8, 6, 8, 10, , , , 2, 3, 265, 210, 153, 475, false,"Leland",crew_portraits_cm_leland_control_sm.png,dsc_leland_control_crew
"Leucon",7,5, 0,0,0,974,210,435,490,96,200,1268,295,448,0,0,0,0,0,0,481,1075,213,0,0,103,11,545,270,78,1186,839,229,60,0,341,1009,167,0,0,91,6,395,196,51,1130,799,196,58,0,218,121,"Civilian, Brunali, Botanist, Desperate, Jury Rigger, Geneticist","male, nonhuman, organic, voy, leucon, crew_max_rarity_5","You Can Make A Difference Here",1, 9, 8, 10, 12, , , , , , 445, 100, 140, 365, false,"Leucon",crew_portraits_cm_leucon_sm.png,leucon_crew
"Annika Hansen Seven",9,5, 565,38,88,1021,107,251,0,0,0,1303,161,317,0,0,0,0,0,0,163,1087,68,1166,906,541,29,622,313,311,0,0,325,105,0,610,1249,326,1347,1126,828,124,899,485,545,0,0,568,267,0,464,1139,"Human, Civilian, Federation, Astrophysicist, Romantic","female, organic, voy, seven, apr2023, crew_max_rarity_5","I'm Sure You'll Adapt",0, 9, 6, 6, 10, , , , , , 375, 200, 250, 400, false,"Seven",crew_portraits_cm_seven_annika_sm.png,seven_annika_crew
"Twilight T'Pol",7,5, 0,0,0,951,90,222,403,186,378,0,0,0,0,0,0,1034,240,792,688,1026,0,0,207,130,497,733,28,884,1140,31,0,127,307,949,600,0,0,35,118,654,990,11,425,644,6,0,19,71,579,53,"Vulcan, Astrophysicist, Telepath, Caregiver, Civilian","nonhuman, female, organic, ent, tpol, crew_max_rarity_5","Target Their Engines",2, 10, 12, 10, 10, , , , 0, 2, 225, 125, 120, 250, false,"T'Pol",crew_portraits_cm_tpol_twilight_sm.png,tpol_twilight_crew
"Picard and Number One",6,5, 527,79,177,1328,234,497,0,0,0,0,0,0,967,154,330,0,0,0,63,1057,988,316,872,153,167,29,108,0,757,0,541,0,451,73,1068,1030,409,915,223,183,23,152,0,781,0,575,0,484,228,255,"Human, Astrophysicist, Inspiring, Civilian, Cultural Figure, Federation, Gardener, Veteran","male, organic, pic, picard, crew_max_rarity_5","Old Dogs",1, 8, 6, 8, 10, 6, 0, , , , 300, 235, 130, 300, false,"Picard",crew_portraits_cm_picard_numberone_sm.png,picard_numberone_crew
"Doctor Paul Stubbs",10,4, 0,0,0,856,150,370,0,0,0,659,118,275,0,0,0,0,0,0,684,0,749,0,0,667,116,730,377,736,0,0,831,431,0,555,0,717,0,0,536,89,592,314,697,0,0,774,416,0,1277,1204,"Astrophysicist, Human, Federation, Innovator, Civilian, Prodigy","male, organic, tng, stubbs, crew_max_rarity_4","I Would Rather Die Than Leave",2, 8, 6, 8, 8, , , , 1, 2, 600, 170, 170, 225, false,"Stubbs",crew_portraits_cm_stubbs_sm.png,stubbs_crew
"Mission Specialist Lefler",9,4, 0,0,0,661,96,192,0,0,0,858,86,214,390,73,145,0,0,0,864,0,686,1242,0,818,142,530,485,676,1280,0,346,375,1001,1004,0,926,1239,0,986,313,614,590,863,1286,0,513,553,982,1060,1302,"Human, Federation, Starfleet, Romantic, Innovator, Resourceful, Tactician","female, organic, tng, lefler, crew_max_rarity_4","Always Watch Your Back",1, 6, 5, 8, 10, 3, 0, 3, , , 200, 50, 141, 325, false,"Lefler",crew_portraits_cm_lefler_robin_sm.png,lefler_robin_crew
"Mirror Burnham",4,4, 355,36,112,0,0,0,642,121,232,0,0,0,892,166,328,0,0,0,1267,633,1197,513,1094,814,0,706,0,754,205,640,651,0,534,1282,673,1212,548,1112,821,0,638,0,777,238,694,560,0,474,983,1093,"Mirror Universe, Undercover Operative, Federation, Starfleet, Civilian, Astrophysicist, Xenoanthropology, Human","female, organic, dsc, burnham, crew_max_rarity_4","The Old Michael Burnham is Dead",0, 9, 6, 10, 10, , , , , , 495, 200, 145, 440, false,"Burnham",crew_portraits_cm_burnham_mirror_sm.png,dsc_burnham_mirror_crew
"Lt. Ilia",10,4, 664,106,231,864,156,339,0,0,0,0,0,0,0,0,0,0,0,0,129,892,771,983,651,672,500,736,380,0,0,0,0,0,0,141,927,834,1021,729,576,392,642,335,0,0,0,0,0,0,1284,1276,"Deltan, Federation, Starfleet, Romantic","female, nonhuman, organic, tos, ilia, crew_max_rarity_4","Navigational Deflectors Online",1, 8, 8, 6, 8, , , , , , 475, 200, 191, 415, false,"Ilia",crew_portraits_cm_ilia_lt_sm.png,ilia_lt_crew
"Age of Sail Worf",7,5, 962,139,356,0,0,0,1334,161,358,0,0,0,503,87,189,0,0,0,565,66,505,326,389,268,0,1051,0,277,121,154,1030,0,861,570,166,505,368,412,513,0,1049,0,490,291,387,1016,0,868,347,551,"Klingon, Tactician, Federation, Starfleet, Costumed","ageofsail, nonhuman, male, organic, tng, worf, crew_max_rarity_5","I am Prepared",1, 7, 8, 8, 10, 4, 1, , , , 380, 170, 200, 475, false,"Worf",crew_portraits_cm_worf_ageofsail_sm.png,worf_ageofsail_crew
"Arjin",9,4, 597,101,222,836,177,394,0,0,0,0,0,0,379,65,135,0,0,0,150,955,856,734,746,660,493,346,375,0,1302,0,1181,0,1022,104,951,864,704,756,448,335,247,271,0,1317,0,1185,0,1013,1018,909,"Civilian, Pilot, Astrophysicist, Trill","male, organic, ds9, nonhuman, arjin, feb2023, crew_max_rarity_4","It's... Interesting",2, 9, 8, 6, 8, , , 2, , , 350, 200, 125, 430, false,"Arjin",crew_portraits_cm_arjin_sm.png,arjin_crew
"Lt. Commander Icheb",8,5, 0,0,0,1272,207,433,471,101,151,980,141,310,0,0,0,0,0,0,272,1112,518,0,0,60,21,352,152,153,1230,883,548,243,0,350,1076,607,0,0,110,34,401,202,237,1211,872,637,329,0,442,446,"Civilian, Brunali, Borg, Astrophysicist, Prodigy, Innovator, Federation, Starfleet","male, nonhuman, organic, voy, icheb, crew_max_rarity_5","I Never Told",1, 10, 6, 10, 10, , , , , , 500, 150, 138, 415, false,"Icheb",crew_portraits_cm_icheb_lt_commander_sm.png,icheb_lt_commander_crew
"Tau",8,4, 0,0,0,342,72,156,894,130,308,0,0,0,651,109,220,0,0,0,1238,772,0,1006,0,302,936,558,787,612,216,494,860,0,718,1155,790,0,1041,0,278,830,528,693,641,313,558,908,0,767,985,1100,"Crafty, Saboteur, Criminal, Scoundrel, Resourceful","male, organic, nonhuman, voy, tau, crew_max_rarity_4","I'd Hate to Make Your Life Difficult",0, 6, 8, 10, 10, 4, 1, , , , 315, 200, 90, 300, false,"Tau",crew_portraits_cm_tau_sm.png,tau_crew
"Age of Sail Troi",6,4, 353,76,161,0,0,0,0,0,0,0,0,0,596,150,298,776,208,426,1211,1179,1144,692,195,0,0,889,409,0,1044,533,858,351,96,1121,1106,1079,475,66,0,0,749,212,0,889,240,672,135,50,1030,528,"Human, Betazoid, Costumed, Empath, Counselor, Starfleet, Federation","ageofsail, nonhuman, female, organic, tng, troi, crew_max_rarity_4","Answer Him!",0, 9, 8, 6, 10, , , , , , 400, 230, 115, 450, false,"Troi",crew_portraits_cm_troi_ageofsail_sm.png,troi_ageofsail_crew
