crew, tier, rarity, CMD_core, CMD_min, CMD_max, SCI_core, SCI_min, SCI_max, SEC_core, SEC_min, SEC_max, ENG_core, ENG_min, ENG_max, DIP_core, DIP_min, DIP_max, MED_core, MED_min, MED_max, V_CMD_SCI, V_CMD_SEC, V_CMD_ENG, V_CMD_DIP, V_CMD_MED, V_SCI_SEC, V_SCI_ENG, V_SCI_DIP, V_SCI_MED, V_SEC_ENG, V_SEC_DIP, V_SEC_MED, V_ENG_DIP, V_ENG_MED, V_DIP_MED, G_CMD_SCI, G_CMD_SEC, G_CMD_ENG, G_CMD_DIP, G_CMD_MED, G_SCI_SEC, G_SCI_ENG, G_SCI_DIP, G_SCI_MED, G_SEC_ENG, G_SEC_DIP, G_SEC_MED, G_ENG_DIP, G_ENG_MED, G_DIP_MED, voyage_rank, gauntlet_rank, traits, hidden_traits, action_name, action_bonus_type, action_bonus_amount, action_initial_cooldown, action_duration, action_cooldown, bonus_ability, trigger, uses_per_battle, penalty_type, penalty_amount, accuracy, crit_bonus, crit_chance, evasion, charge_phases, short_name, image_name, symbol
"Investigator Odo",8,1, 0,0,0,0,0,0,217,37,171,0,0,0,0,0,0,0,0,0,0,855,0,0,0,903,0,0,0,776,938,744,0,0,0,0,782,0,0,0,793,0,0,0,683,876,667,0,0,0,1111,1105,"Changeling, Cardassian, Investigator, Interrogator","nonhuman, male, organic, ds9, odo, crew_max_rarity_1","Collaboration",2, 1, 20, 14, 10, , , , , , 400, 115, 67, 265, false,"Odo",crew_portraits_cm_odooccupation_sm.png,odo_occupation_crew
"Constable Odo",4,3, 317,107,225,0,0,0,523,27,85,0,0,0,0,0,0,0,0,0,809,516,743,840,696,756,0,0,0,657,831,618,0,0,0,604,512,544,678,506,903,0,0,0,767,944,743,0,0,0,1010,1021,"Changeling, Bajoran, Constable, Investigator, Interrogator","nonhuman, male, organic, ds9, odo, crew_max_rarity_3","Justice",0, 6, 10, 12, 16, , , , 3, 800, 520, 300, 75, , false,"Odo",crew_portraits_cm_odostandard_sm.png,odo_constable_crew
"Ensign Ro",4,2, 322,46,132,0,0,0,0,0,0,0,0,0,0,0,0,0,0,0,884,839,818,893,769,0,0,0,0,0,0,0,0,0,0,848,813,773,860,726,0,0,0,0,0,0,0,0,0,0,1106,1109,"Starfleet, Bajoran, Resourceful","nonhuman, female, organic, tng, ensign, bridge_crew, ro, crew_max_rarity_2","Separate Ways",0, 4, 3, 10, 5, , , 2, , , 130, 210, 13, 200, false,"Ro",crew_portraits_cm_roensign_sm.png,ro_ensign_crew
"Shinzon",10,5, 819,94,241,0,0,0,938,183,435,0,0,0,546,176,390,0,0,0,484,104,427,211,374,274,0,582,0,249,97,184,539,0,462,600,145,542,169,504,229,0,345,0,206,49,169,280,0,288,403,159,"Human, Clone, Reman, Villain, Romulan","male, organic, tng, shinzon, crew_max_rarity_5","Destiny Complete",0, 7, 14, 3, 14, 1, 2, , , , 1325, 545, 365, 1050, false,"Shinzon",crew_portraits_cm_shinzon_sm.png,shinzon_crew
"Will Riker",10,1, 251,42,110,0,0,0,125,22,74,0,0,0,0,0,0,0,0,0,902,776,840,914,786,931,0,0,0,795,965,769,0,0,0,878,730,804,885,763,916,0,0,0,782,956,753,0,0,0,1098,1090,"Human, Federation, Starfleet, Maverick, Gambler, Romantic","male, organic, nonhuman, tng, commander, bridge_crew, first_officer, riker, crew_max_rarity_1","Poker Face",0, 1, 8, 10, 14, 4, 0, , , , 455, , 425, 340, false,"Riker",crew_portraits_cm_rikers1_sm.png,riker_s1_commander_crew
"Commander Riker",7,2, 279,78,191,0,0,0,124,29,89,0,0,0,290,22,64,0,0,0,881,742,815,682,766,927,0,885,0,792,850,765,867,0,753,696,574,651,652,602,900,0,915,0,766,883,741,899,0,775,1039,1007,"Human, Federation, Starfleet, Pilot, Maverick, Gambler, Romantic","male, organic, tng, commander, bridge_crew, first_officer, riker, crew_max_rarity_2","Liase",0, 2, 8, 10, 14, 5, 0, , , , 645, 50, 295, 275, false,"Riker",crew_portraits_cm_rikerpoker_sm.png,riker_s2_commander_crew
"Edith Keeler",9,4, 0,0,0,0,0,0,0,0,0,0,0,0,453,166,339,591,187,590,0,0,0,712,381,0,0,649,298,0,732,382,615,258,94,0,0,0,511,86,0,0,422,98,0,508,100,345,38,14,918,392,"Civilian, Caregiver, Inspiring, Cultural Figure, Romantic, Human","female, organic, tos, keeler, crew_max_rarity_4","A Life Worth Living",1, 7, 8, 10, 8, , , , , , 690, 25, 52, 440, false,"Keeler",crew_portraits_cm_edithkeeler_sm.png,keeler_crew
"Ensign Tuvok",8,1, 0,0,0,181,51,197,0,0,0,0,0,0,138,33,74,0,0,0,918,0,0,950,0,911,618,805,557,0,962,0,909,0,788,742,0,0,927,0,735,487,617,439,0,949,0,877,0,757,1101,1063,"Vulcan, Federation, Starfleet, Telepath","nonhuman, male, organic, voy, ensign, bridge_crew, tuvok, crew_max_rarity_1","Memory",0, 1, 1, 14, 10, , , , , , 103, 60, 135, 375, false,"Tuvok",crew_portraits_cm_tuvokensign_sm.png,tuvok_ensign_crew
"Security Chief Tuvok",5,3, 291,53,161,145,45,149,445,85,201,0,0,0,0,0,0,0,0,0,709,548,828,895,775,530,628,918,566,650,824,612,0,0,0,503,452,736,818,687,397,542,815,502,587,753,570,0,0,0,986,912,"Vulcan, Federation, Starfleet, Telepath, Tactician, Investigator","nonhuman, male, organic, voy, lieutenant_commander, bridge_crew, tuvok, crew_max_rarity_3","Contingency Plan",0, 4, 10, 12, 16, 5, 0, , , , 465, 50, , 300, false,"Tuvok",crew_portraits_cm_tuvokrifle_sm.png,tuvok_rifle_crew
"Major Kira",7,2, 273,37,126,0,0,0,304,60,176,0,0,0,0,0,0,0,0,0,894,611,832,902,777,865,0,0,0,746,916,712,0,0,0,864,559,790,871,745,744,0,0,0,637,825,627,0,0,0,1063,1045,"Bajoran, Veteran, Resourceful","nonhuman, female, organic, ds9, kira, crew_max_rarity_2","Obstinance",0, 2, 0, 10, 14, 6, 0, , , , 295, 150, 5, , true,"Kira",crew_portraits_cm_kirashorthair_sm.png,kira_major_shorthair_crew
"Mirror Intendant Kira",5,5, 512,183,363,0,0,0,1052,272,542,0,0,0,946,67,184,0,0,0,579,103,519,181,474,209,0,477,0,194,47,137,418,0,359,317,28,247,225,234,96,0,749,0,94,71,76,708,0,612,247,110,"Bajoran, Cardassian, Klingon, Villain, Klingon-Cardassian Alliance, Brutal, Mirror Universe","nonhuman, female, organic, ds9, mirror, kira, crew_max_rarity_5","Instability",0, 6, 6, 10, 12, 4, 0, , , , 915, 225, 90, 1525, true,"Kira",crew_portraits_cm_kiraintendant_sm.png,kira_mirror_crew
"Security Chief Worf",2,2, 205,57,144,0,0,0,326,61,145,0,0,0,0,0,0,0,0,0,914,648,849,926,796,859,0,0,0,740,910,705,0,0,0,817,551,749,837,700,798,0,0,0,689,880,672,0,0,0,1072,1041,"Klingon, Federation, Starfleet, Duelist, Investigator","nonhuman, male, organic, tng, lieutenant, bridge_crew, worf, crew_max_rarity_2","They Have No Honor",2, 4, 8, 10, 12, , , , 1, 2, 165, 280, 95, 155, false,"Worf",crew_portraits_cm_worf_sm.png,worf_security_chief_crew
"Defiant Commander Worf",7,4, 364,241,488,0,0,0,609,179,394,0,0,0,0,0,0,0,0,0,629,259,573,696,525,517,0,0,0,463,648,408,0,0,0,150,39,106,281,96,276,0,0,0,245,412,206,0,0,0,929,332,"Klingon, Federation, Starfleet, Duelist, Tactician","nonhuman, male, organic, ds9, lieutenant_commander, bridge_crew, worf, crew_max_rarity_4","Good Day to Die",2, 6, 12, 12, 12, 4, 0, , 1, 2, 690, 645, 325, 205, false,"Worf",crew_portraits_cm_worfdefiant_sm.png,worf_defiant_commander_crew
"Mirror Regent Worf",6,5, 861,294,589,0,0,0,1062,175,357,0,0,0,0,0,0,0,0,0,254,66,212,423,172,253,0,0,0,231,392,168,0,0,0,70,21,48,170,45,319,0,0,0,293,470,250,0,0,0,488,223,"Klingon, Cardassian, Tactician, Villain, Brutal, Klingon-Cardassian Alliance, Mirror Universe","nonhuman, male, organic, ds9, mirror, bridge_crew, worf, crew_max_rarity_5","Position of Strength",0, 9, 8, 8, 10, , , , , , 300, 980, 390, , false,"Worf",crew_portraits_cm_worfmirror_sm.png,worf_mirror_crew
"Yeoman Rand",10,1, 164,15,58,0,0,0,0,0,0,0,0,0,117,19,60,0,0,0,933,882,876,901,821,0,0,927,0,0,967,0,915,0,791,930,880,873,890,816,0,0,918,0,0,962,0,904,0,779,1108,1112,"Federation, Starfleet, Human","female, organic, tos, yeoman, bridge_crew, rand, crew_max_rarity_1","Signature Required",2, 2, 8, 10, 12, , , , 1, 1, 375, , , 180, false,"Rand",crew_portraits_cm_randyeoman_sm.png,rand_yeoman_crew
"The Duras Sisters",7,4, 311,83,205,0,0,0,658,150,385,0,0,0,464,170,341,0,0,0,834,359,774,497,725,503,0,641,0,452,229,397,604,0,513,667,219,624,229,579,317,0,415,0,291,79,247,337,0,328,765,313,"Klingon, Scoundrel, Villain","nonhuman, female, organic, tng, betor, lursa, crew_max_rarity_4","The Power of Two",0, 9, 10, 20, 12, , , 1, , , 350, 110, 190, 500, false,"Duras Sisters",crew_portraits_cm_duras_sisters_sm.png,duras_sisters_crew
"Persis",6,2, 0,0,0,0,0,0,253,94,250,0,0,0,303,39,88,0,0,0,0,832,0,899,0,861,0,876,0,741,671,707,861,0,744,0,613,0,912,0,568,0,883,0,506,521,482,859,0,743,1057,1009,"Human, Augments, Engineered, Survivalist, Tactician","nonhuman, female, organic, ent, persis, crew_max_rarity_2","Augmented Strength",0, 2, 6, 10, 6, 7, 0, 2, , , 240, 330, 300, , false,"Persis",crew_portraits_cm_persis_sm.png,persis_crew
"Telek R'Mor",5,2, 0,0,0,347,52,194,119,8,44,0,0,0,263,30,113,0,0,0,831,888,0,912,0,733,561,591,505,796,873,770,868,0,754,748,883,0,899,0,650,490,576,442,794,890,768,846,0,736,1038,1030,"Romulan, Astrophysicist","nonhuman, male, organic, voy, captain, bridge_crew, rmor, crew_max_rarity_2","Solitary Survey",1, 3, 10, 12, 10, 0, 2, , , , 405, 50, 3, 180, false,"R'Mor",crew_portraits_cm_telekrmor_sm.png,rmor_voyager_crew
"KDF Gowron",6,4, 375,85,222,0,0,0,296,100,256,0,0,0,641,173,418,0,0,0,780,540,713,380,668,824,0,556,0,713,370,675,509,0,433,638,312,587,176,546,544,0,314,0,487,121,466,249,0,262,829,407,"Klingon, Duelist, Diplomat, Politician","nonhuman, male, organic, tng, gowron, crew_max_rarity_4","What Can Be Done",1, 6, 14, 10, 14, 0, 2, , , , 625, 465, 85, 1000, false,"Gowron",crew_portraits_cm_gowronyoung_sm.png,gowron_kdf_crew
"Third Remata'Klan",9,3, 410,42,84,0,0,0,467,85,185,0,0,0,0,0,0,0,0,0,814,504,751,847,701,734,0,0,0,640,815,604,0,0,0,900,561,830,906,779,686,0,0,0,603,777,585,0,0,0,1006,1048,"Jem'hadar, Dominion, Duelist, Tactician","nonhuman, male, organic, ds9, remataklan, crew_max_rarity_3","Victory is Life",0, 3, 0, 6, 8, 4, 4, , , , 690, 395, 597, 600, true,"Remata'Klan",crew_portraits_cm_remataklan_sm.png,remataklan_crew
"Ensign Chapel",10,1, 0,0,0,0,0,0,0,0,0,0,0,0,0,0,0,214,34,152,0,0,0,0,793,0,0,0,552,0,0,749,0,504,762,0,0,0,0,720,0,0,0,509,0,0,691,0,460,688,1117,1108,"Human, Federation, Starfleet, Nurse","female, organic, tos, ensign, chapel, crew_max_rarity_1","Administer Prescription",2, 1, 6, 10, 10, , , , , , 130, , 40, 100, false,"Chapel",crew_portraits_cm_chapelensign_sm.png,chapel_ensign_crew
"Ensign Ogawa",10,1, 0,0,0,0,0,0,0,0,0,0,0,0,0,0,0,213,34,166,0,0,0,0,789,0,0,0,550,0,0,745,0,501,760,0,0,0,0,706,0,0,0,492,0,0,681,0,446,674,1114,1106,"Human, Federation, Starfleet, Nurse","female, organic, tng, ensign, ogawa, crew_max_rarity_1","Report to Sickbay",2, 1, 6, 1, 8, 2, 0, 1, , , 170, , 35, 105, false,"Ogawa",crew_portraits_cm_ogawaensign_sm.png,ogawa_ensign_crew
"Wesley Crusher",10,1, 0,0,0,218,43,149,0,0,0,174,32,78,0,0,0,0,0,0,911,0,871,0,0,907,530,896,553,790,0,0,903,517,0,833,0,847,0,0,822,421,816,503,776,0,0,876,507,0,1094,1082,"Human, Federation, Civilian, Prodigy","male, organic, tng, wesley, crew_max_rarity_1","Study",1, 2, 8, 10, 12, , , , 0, 1, 215, 125, 70, 55, false,"Wesley",crew_portraits_cm_wesleysweater_sm.png,wesley_sweater_crew
"Ensign Crusher",7,3, 176,11,31,426,83,229,0,0,0,347,34,78,0,0,0,0,0,0,592,883,691,948,822,766,357,784,473,756,0,0,854,490,0,589,884,807,954,824,633,316,672,383,770,0,0,874,503,0,990,1015,"Human, Federation, Starfleet, Prodigy, Warp Theorist","male, organic, tng, ensign, bridge_crew, wesley, crew_max_rarity_3","Rewire",2, 4, 6, 8, 10, 6, 0, , , , 290, , , 190, false,"Wesley",crew_portraits_cm_wesley_sm.png,wesley_full_ensign_crew
"Acting Ensign Crusher",9,2, 114,29,58,258,56,160,0,0,0,251,53,148,0,0,0,0,0,0,784,887,723,956,826,894,434,878,543,769,0,0,863,494,0,654,873,634,941,810,792,322,788,476,700,0,0,779,449,0,1049,999,"Human, Federation, Starfleet, Prodigy","male, organic, tng, ensign, bridge_crew, wesley, crew_max_rarity_2","Invention",1, 4, 3, 6, 6, , , 2, , , 205, 50, 25, 165, false,"Wesley",crew_portraits_cm_wesleyensign_sm.png,wesley_acting_ensign_crew
"Formal Dress Wesley Crusher",9,4, 0,0,0,662,173,422,0,0,0,270,108,230,481,160,342,0,0,0,507,0,798,699,0,499,207,144,308,735,723,0,342,477,511,287,0,555,512,0,270,62,40,185,533,512,0,75,326,336,762,244,"Human, Federation, Starfleet, Prodigy, Warp Theorist","male, organic, tng, ensign, bridge_crew, wesley, lieutenant, crew_max_rarity_4","Duty to the Truth",1, 9, 4, 10, 12, , , , , , 300, 500, 30, 450, false,"Wesley",crew_portraits_cm_wesleydressuniform_sm.png,wesley_formal_dress_crew
"Wrathful Khan",7,5, 1040,206,421,0,0,0,1145,72,143,376,140,288,0,0,0,0,0,0,244,71,47,416,159,272,509,0,0,66,413,182,741,424,0,230,206,17,379,154,775,315,0,0,200,859,656,447,247,0,348,388,"Human, Augments, Engineered, Villain, Cultural Figure, Tactician, Resourceful, Survivalist, Brutal","nonhuman, male, organic, tos, khan, crew_max_rarity_5","I Stab at Thee",2, 9, 12, 5, 12, 1, 0, , , , 640, 595, 345, 850, false,"Khan",crew_portraits_cm_khan_sm.png,khan_wok_crew
"Tailor Garak",4,3, 0,0,0,0,0,0,502,44,126,161,22,44,395,83,219,0,0,0,0,751,878,813,0,748,635,792,0,499,518,613,592,519,658,0,818,876,718,0,849,637,690,0,646,529,702,532,520,553,967,987,"Cardassian, Undercover Operative, Scoundrel, Interrogator, Civilian","nonhuman, male, organic, ds9, garak, crew_max_rarity_3","Cutting Cloth",1, 5, 8, 12, 12, , , , , , 125, 230, 20, 405, false,"Garak",crew_portraits_cm_garaktailor_sm.png,garak_tailor_crew
"Bartender Quark",9,1, 110,25,77,0,0,0,81,15,57,0,0,0,211,36,150,0,0,0,938,870,881,865,824,933,0,900,0,797,919,771,886,0,767,915,814,852,733,796,927,0,829,0,792,803,766,795,0,694,1086,1060,"Ferengi, Bartender, Civilian, Scoundrel, Gambler, Merchant","nonhuman, male, organic, ds9, quark, crew_max_rarity_1","Hospitality",1, 2, 8, 10, 12, , , , 2, 1, 165, 10, 10, 140, false,"Quark",crew_portraits_cm_quarkbartender_sm.png,quark_s1_bartender_crew
"Richard Castillo",4,3, 487,109,227,286,57,187,0,0,0,0,0,0,0,0,0,0,0,0,446,694,633,731,581,883,604,872,538,0,0,0,0,0,0,296,627,537,672,500,745,495,755,448,0,0,0,0,0,0,1012,967,"Human, Hero, Pilot, Starfleet, Federation","bridge_crew, male, organic, castillo, tng, lieutenant, crew_max_rarity_3","Self Sacrifice",0, 5, 12, 12, 10, 7, 0, , 1, 2, 650, 265, 129, 585, false,"Castillo",crew_portraits_cm_richardcastillo_sm.png,castillo_lieutenant_crew
"Writer Jake Sisko",10,3, 0,0,0,0,0,0,0,0,0,0,0,0,451,70,198,0,0,0,0,0,0,801,0,0,0,776,0,0,828,0,746,0,646,0,0,0,756,0,0,0,723,0,0,795,0,680,0,590,1085,1089,"Human, Federation, Civilian, Writer, Gambler, Romantic","male, organic, ds9, jake, crew_max_rarity_3","Construct Story",2, 3, 0, 8, 10, 6, 0, , , , 995, 350, 47, 640, true,"Jake",crew_portraits_cm_jakewriter_sm.png,jake_writer_crew
"CMO Crusher",3,2, 0,0,0,0,0,0,0,0,0,0,0,0,0,0,0,290,52,174,0,0,0,0,771,0,0,0,537,0,0,724,0,488,736,0,0,0,0,674,0,0,0,466,0,0,652,0,431,639,1107,1100,"Human, Starfleet, Federation, Physician, Caregiver, Cyberneticist","female, organic, tng, commander, crusher, crew_max_rarity_2","Doctor's Calluses",2, 3, 6, 10, 10, , , , , , 185, , 35, 155, false,"Crusher",crew_portraits_cm_crusherwithlabcoat_sm.png,crusher_labcoat_crew
"Commando Crusher",1,3, 0,0,0,182,76,200,308,93,193,0,0,0,0,0,0,510,44,132,907,809,0,0,644,569,613,895,312,723,891,337,0,415,623,697,694,0,0,732,292,450,717,281,588,757,336,0,469,702,959,887,"Human, Starfleet, Federation, Physician, Cyberneticist, Undercover Operative","female, organic, tng, commander, crusher, crew_max_rarity_3","Repel Disease",0, 3, 6, 3, 12, 1, 0, , , , 575, , 370, 500, false,"Crusher",crew_portraits_cm_crusherblackcommandouniform_sm.png,crusher_black_commando_uniform_crew
"Dr. Crusher",9,4, 275,38,110,0,0,0,437,90,201,0,0,0,0,0,0,736,123,300,895,564,833,904,173,752,0,0,304,654,829,108,0,268,425,883,516,813,891,224,651,0,0,296,581,748,120,0,243,421,845,791,"Human, Starfleet, Federation, Physician, Cyberneticist","female, organic, tng, commander, crusher, crew_max_rarity_4","Neutralize Disease",1, 7, 12, 12, 12, 4, 4, , , , 740, 250, 370, 500, false,"Crusher",crew_portraits_cm_crusherfromfirstcontact_sm.png,crusher_first_contact_crew
"Holonovel Doctor",6,4, 0,0,0,512,50,137,0,0,0,0,0,0,0,0,0,799,69,244,760,0,0,0,385,741,504,764,98,0,0,387,0,264,422,842,0,0,0,547,830,549,822,241,0,0,543,0,354,531,940,1000,"Hologram, Human, Federation, Starfleet, Physician, Musician, Scoundrel","nonhuman, male, artificial_life, voy, emh, crew_max_rarity_4","Suggested Treatment",0, 7, 12, 12, 12, , , , , , 365, 370, 205, 525, false,"Doctor",crew_portraits_cm_doctorgolfclub_sm.png,emh_authorauthor_crew
"Mobile Doctor",5,5, 0,0,0,809,106,209,0,0,0,0,0,0,393,137,435,1191,110,334,502,0,0,729,139,496,359,159,27,0,753,147,638,101,45,639,0,0,452,375,628,406,109,105,0,443,375,271,228,57,408,340,"Hologram, Human, Federation, Starfleet, Musician, Physician","nonhuman, male, artificial_life, voy, emh, crew_max_rarity_5","House Call",2, 9, 12, 12, 12, , , , , , 1825, 600, , 600, false,"Doctor",crew_portraits_cm_emhmobile_sm.png,emh_mobileholoemitter_crew
"Comm Officer Uhura",10,1, 0,0,0,0,0,0,0,0,0,0,0,0,258,28,89,0,0,0,0,0,0,920,0,0,0,892,0,0,941,0,877,0,758,0,0,0,920,0,0,0,892,0,0,943,0,870,0,751,1113,1117,"Federation, Starfleet, Human, Musician, Communicator","female, organic, tos, lieutenant, bridge_crew, uhura, crew_max_rarity_1","Incoming Message",2, 2, 8, 10, 12, , , , 1, 1, 320, , , 495, false,"Uhura",crew_portraits_cm_uhurared_sm.png,uhura_red_crew
"Commander Uhura",10,4, 459,128,299,0,0,0,0,0,0,0,0,0,592,198,429,0,0,0,671,683,622,305,566,0,0,564,0,0,647,0,516,0,438,476,537,403,103,389,0,0,278,0,0,373,0,204,0,220,938,626,"Federation, Starfleet, Human, Musician, Communicator","female, organic, tos, commander, bridge_crew, uhura, crew_max_rarity_4","Hailing Frequencies",0, 8, 12, 26, 12, , , 1, , , 1165, , 75, 790, false,"Uhura",crew_portraits_cm_uhurawrathofkhan_sm.png,uhura_wrathofkhan_crew
"Dancing Uhura",8,5, 1026,84,195,0,0,0,0,0,0,0,0,0,1185,193,393,0,0,0,366,456,330,53,279,0,0,256,0,0,344,0,201,0,199,682,702,638,200,593,0,0,321,0,0,432,0,258,0,267,483,799,"Human, Federation, Starfleet, Communicator, Casual, Musician, Artist","bridge_crew, female, organic, tos, uhura, lieutenant_commander, original, crew_max_rarity_5","Take The Lead",0, 8, 10, 3, 14, 1, 1, , , , 465, 260, 60, 400, false,"Uhura",crew_portraits_cm_uhura_dancing_sm.png,uhura_dancing_crew
"First Maje Culluh",5,3, 466,93,223,0,0,0,307,42,138,0,0,0,0,0,0,0,0,0,728,534,667,769,620,884,0,0,0,758,926,728,0,0,0,629,455,570,693,534,836,0,0,0,716,896,695,0,0,0,1023,998,"Kazon, Scoundrel","nonhuman, male, organic, voy, captain, culluh, crew_max_rarity_3","Nistrim Supremacy",2, 3, 6, 10, 10, 8, 4, , , , 665, 325, 133, 390, false,"Culluh",crew_portraits_cm_jalculluh_sm.png,culluh_crew
"KDF Alexander",6,2, 137,19,79,0,0,0,331,64,148,145,16,72,0,0,0,0,0,0,935,727,830,951,823,852,636,0,0,622,903,699,910,520,0,917,663,767,933,799,783,632,0,0,571,865,660,896,514,0,1054,1049,"Human, Klingon","male, organic, ds9, bridge_crew, alexander, nonhuman, crew_max_rarity_2","Beginner's Luck",1, 3, 10, 12, 10, 5, 2, , , , 130, 200, 62, 15, false,"Alexander",crew_portraits_cm_alexanderkdf_sm.png,alexander_kdf_crew
"Commando Shran",9,4, 673,114,239,0,0,0,592,89,182,0,0,0,318,144,282,0,0,0,537,278,470,411,421,610,0,794,0,540,410,498,766,0,661,576,345,505,253,472,685,0,529,0,602,281,584,449,0,425,759,621,"Andorian, Tactician, Inspiring, Imperial Guard","nonhuman, male, organic, ent, captain, shran, crew_max_rarity_4","Debt Owed",0, 8, 6, 8, 10, , , 3, , , 390, 575, 288, 350, false,"Shran",crew_portraits_cm_shrancommando_sm.png,shran_commando_crew
"Ushaan Shran",9,5, 989,83,164,0,0,0,1076,170,348,0,0,0,424,134,288,0,0,0,405,87,365,251,309,250,0,707,0,228,111,166,686,0,583,732,249,684,342,631,336,0,534,0,311,123,267,455,0,428,393,484,"Andorian, Duelist, Romantic, Imperial Guard","nonhuman, male, organic, ent, captain, shran, crew_max_rarity_5","Debt Owed",0, 9, 6, 8, 10, , , 3, , , 1440, 565, 483, 390, false,"Shran",crew_portraits_cm_shrandueling_sm.png,shran_dueling_crew
"Fencing Sulu",10,4, 444,99,249,385,36,92,609,203,448,0,0,0,0,0,0,0,0,0,442,297,677,775,630,234,581,845,520,447,636,393,0,0,0,414,124,518,658,483,112,610,880,553,178,316,149,0,0,0,806,527,"Human, Federation, Starfleet, Pilot, Resourceful, Duelist","male, organic, tos, lieutenant, bridge_crew, sulu, crew_max_rarity_4","Parry Attack",0, 6, 12, 8, 12, 6, 4, , , , 415, , 225, 225, false,"Sulu",crew_portraits_cm_sulufencing_sm.png,sulu_fencing_crew
"Morn",7,3, 0,0,0,0,0,0,359,70,174,0,0,0,418,121,295,0,0,0,0,784,0,773,0,818,0,722,0,704,536,669,699,0,596,0,734,0,603,0,730,0,542,0,627,326,618,467,0,439,999,927,"Lurian, Courier, Duelist, Civilian, Gambler, Smuggler","nonhuman, male, organic, ds9, morn, crew_max_rarity_3","Drinking Spot",0, 3, 0, 8, 8, , , , 1, 2, 150, 285, 57, 655, true,"Morn",crew_portraits_cm_morn_sm.png,morn_crew
"Seven in Blue",3,2, 0,0,0,294,51,209,0,0,0,278,53,130,0,0,0,0,0,0,882,0,831,0,0,872,393,862,531,766,0,0,860,493,0,724,0,777,0,0,717,305,732,429,719,0,0,799,463,0,1060,1031,"Human, Borg, Civilian, Federation","nonhuman, female, organic, voy, bridge_crew, seven, crew_max_rarity_2","Ignore Irrelevancies",1, 2, 8, 10, 14, 4, 0, , , , 75, 50, 310, 170, false,"Seven",crew_portraits_cm_seven_of_nine_sm.png,seven_allblue_crew
"Seven of Nine",7,5, 0,0,0,785,247,791,0,0,0,854,225,454,514,89,183,0,0,0,267,0,308,740,0,262,40,90,170,302,769,0,53,171,558,39,0,145,747,0,34,3,11,39,177,789,0,47,73,587,383,24,"Human, Borg, Civilian, Federation","nonhuman, female, organic, voy, bridge_crew, seven, crew_max_rarity_5","New Collective",2, 7, 12, 10, 14, 4, 0, , , , 1750, , 705, 440, false,"Seven",crew_portraits_cm_sevenbluegreyshoulders_sm.png,seven_bluegreyshoulders_crew
"Donik",6,3, 0,0,0,0,0,0,0,0,0,476,79,199,303,31,79,0,0,0,0,0,687,900,0,0,491,879,0,631,931,0,489,408,746,0,0,652,926,0,0,451,897,0,605,948,0,507,392,756,1033,1053,"Hirogen, Innovator","nonhuman, male, organic, voy, donik, crew_max_rarity_3","Hunting Program",2, 4, 12, 12, 10, 7, 0, , , , 870, 165, , 340, false,"Donik",crew_portraits_cm_donik_sm.png,donik_crew
"Commander Tucker",8,2, 252,28,82,0,0,0,0,0,0,305,53,185,0,0,0,0,0,0,910,859,572,923,794,0,592,0,0,747,0,0,843,481,0,910,857,528,923,792,0,503,0,0,654,0,0,724,423,0,1073,1065,"Human, Starfleet, Jury Rigger, Pilot, Explorer","male, organic, ent, commander, tucker, crew_max_rarity_2","Warp Engines Online",1, 2, 6, 3, 8, 2, 0, , , , 520, 35, 50, 165, false,"Trip",crew_portraits_cm_tucker_sm.png,tucker_commander_crew
"Counselor Troi",9,1, 0,0,0,0,0,0,0,0,0,0,0,0,261,42,108,147,49,131,0,0,0,910,817,0,0,884,565,0,934,760,866,515,651,0,0,0,892,730,0,0,867,519,0,925,696,836,464,515,1088,1075,"Federation, Starfleet, Human, Betazoid, Empath, Counselor","nonhuman, female, organic, tng, lieutenant_commander, bridge_crew, troi, crew_max_rarity_1","Counselling",2, 1, 6, 10, 10, , , , , , 265, , 80, 345, false,"Troi",crew_portraits_cm_troitng_sm.png,troi_casualgray_crew
"Rakal Troi",8,4, 521,163,354,0,0,0,525,128,331,0,0,0,0,0,0,407,163,440,583,311,523,661,115,586,0,0,383,520,696,133,0,357,514,350,133,276,484,13,414,0,0,178,367,532,18,0,114,237,661,125,"Federation, Starfleet, Human, Betazoid, Romulan, Empath, Undercover Operative, Tal Shiar","nonhuman, female, organic, tng, lieutenant_commander, bridge_crew, troi, crew_max_rarity_4","Romulan Disguise",1, 7, 12, 10, 14, 1, 2, , , , 90, 400, 175, 2825, false,"Troi",crew_portraits_cm_troirakal_sm.png,troi_rakal_crew
"Commander Troi",8,5, 0,0,0,0,0,0,383,203,253,0,0,0,1060,211,421,827,142,281,0,735,0,412,342,724,0,296,277,632,108,51,237,227,28,0,496,0,399,402,421,0,275,297,372,68,62,202,244,47,412,169,"Federation, Starfleet, Human, Betazoid, Empath, Counselor","nonhuman, female, organic, tng, commander, bridge_crew, troi, crew_max_rarity_5","Empathic Sense",1, 8, 6, 6, 6, , , , , , 1375, 475, 135, 725, true,"Troi",crew_portraits_cm_troifirstcontact_sm.png,troi_firstcontact_crew
"Vedek Winn Adami",5,3, 307,97,207,0,0,0,0,0,0,0,0,0,410,92,214,0,0,0,832,801,769,583,721,0,0,788,0,0,837,0,760,0,654,646,673,595,409,554,0,0,687,0,0,741,0,629,0,548,1024,960,"Bajoran, Vedek, Cultural Figure, Spiritual","nonhuman, female, organic, ds9, winn, crew_max_rarity_3","Will of the Prophets",1, 4, 8, 10, 10, 4, 0, , , , , 270, 85, 830, false,"Winn",crew_portraits_cm_winnvedek_sm.png,winn_vedek_crew
"Subcommander T'Pol",4,3, 273,71,211,520,21,77,165,35,77,0,0,0,0,0,0,0,0,0,497,715,814,891,764,554,525,789,479,791,958,763,0,0,0,542,568,635,734,587,794,627,907,563,768,945,744,0,0,0,988,1001,"Vulcan, High Command, Astrophysicist, Telepath","nonhuman, female, organic, ent, first_officer, bridge_crew, tpol, crew_max_rarity_3","Logic",2, 5, 6, 10, 10, , , , , , 175, 120, 3, 100, false,"T'Pol",crew_portraits_cm_tpol_sm.png,tpol_subcommander_crew
"Commander T'Pol",8,4, 512,112,307,692,56,171,320,91,227,0,0,0,0,0,0,0,0,0,180,421,576,700,527,266,388,595,341,709,872,672,0,0,0,214,265,416,585,401,312,508,772,467,542,706,523,0,0,0,807,705,"Vulcan, Starfleet, Astrophysicist, Telepath","nonhuman, female, organic, ent, first_officer, commander, bridge_crew, tpol, crew_max_rarity_4","Vessel's Information",0, 5, 12, 12, 20, 2, 0, , , , 1400, 200, 70, 1175, false,"T'Pol",crew_portraits_cm_tpolcommander_sm.png,tpol_commander_crew
"Chef Neelix",10,1, 0,0,0,0,0,0,0,0,0,0,0,0,201,51,189,0,0,0,0,0,0,919,0,0,0,890,0,0,939,0,874,0,757,0,0,0,788,0,0,0,760,0,0,838,0,720,0,625,1112,1096,"Talaxian, Mylean, Resourceful, Survivalist, Chef, Civilian, Communicator","nonhuman, male, organic, voy, neelix, crew_max_rarity_1","Soup's On",1, 2, 12, 14, 10, 6, 0, , 2, 1, 305, , , 210, false,"Neelix",crew_portraits_cm_neelix_sm.png,neelix_chef_crew
"CMO 'Bones' McCoy",9,1, 0,0,0,0,0,0,0,0,0,0,0,0,0,0,0,213,48,196,0,0,0,0,781,0,0,0,546,0,0,742,0,497,752,0,0,0,0,644,0,0,0,444,0,0,623,0,417,618,1109,1093,"Human, Federation, Starfleet, Physician, Exobiology","male, organic, tos, lieutenant_commander, mccoy, crew_max_rarity_1","Country Doctor",2, 3, 8, 10, 12, , , , 0, 2, 245, 10, 8, 285, false,"McCoy",crew_portraits_cm_mccoy_sm.png,mccoy_chief_medical_officer_crew
