"Orion Captain",7,5, 1094,242,564,0,0,0,716,296,605,0,0,0,420,121,264,0,0,0,319,106,265,210,192,555,0,1041,0,491,279,407,1003,0,858,143,8,110,61,84,86,0,795,0,93,36,62,724,0,636,525,27,"Orion, Criminal, Duelist, Scoundrel, Tactician, Thief","organic, nonhuman, male, tas, orion_captain, crew_max_rarity_5","Surrender Your Cargo Or Be Destroyed",0, 10, 12, 8, 10, 1, 0, 2, , , 250, 125, 228, 50, false,"Orion Captain",crew_portraits_cm_orion_captain_sm.png,orion_captain_crew
"Dahj On The Run",7,5, 0,0,0,0,0,0,528,58,147,1062,147,250,1342,156,354,0,0,0,0,1014,421,452,0,991,331,304,0,104,110,793,14,181,199,0,1089,662,692,0,1091,466,563,0,325,348,906,76,373,421,231,792,"Survivalist, Android, Brutal, Desperate, Botanist, Civilian, Human","female, nonhuman, artificial_life, pic, dahj, crew_max_rarity_5","I Don't Want the Game to End",0, 10, 8, 6, 10, , , , 1, 2, 240, 480, 172, 1150, false,"Dahj",crew_portraits_cm_dahj_runaway_sm.png,dahj_on_the_run_crew
"Graduation Amanda Grayson",7,5, 1038,151,281,0,0,0,516,53,147,0,0,0,1312,193,355,0,0,0,472,261,399,55,320,1002,0,322,0,881,121,803,226,0,207,663,466,582,187,529,1109,0,507,0,974,320,915,426,0,381,242,692,"Human, Civilian, Caregiver, Vulcan, Linguist, Federation, Communicator","female, organic, dsc, amanda_grayson, crew_max_rarity_5","You Have to Do Something",0, 8, 8, 8, 15, 7, 2, , , , 515, 370, 155, 805, false,"Amanda Grayson",crew_portraits_cm_amanda_grayson_graduation_sm.png,dsc_amanda_grayson_graduation_crew
"Angel Gabrielle Burnham",6,5, 0,0,0,531,68,158,1345,153,358,1074,143,311,0,0,0,0,0,0,976,412,381,0,0,40,100,967,571,9,411,118,413,173,0,1077,618,557,0,0,188,196,1062,643,66,661,369,576,292,0,186,685,"Human, Federation, Section 31, Undercover Operative, Astrophysicist, Innovator, Resourceful","evsuit, female, organic, dsc, gburnham, crew_max_rarity_5","Time Is Not On Our Side",2, 9, 8, 8, 8, 7, 1, , , , 125, , 141, 75, false,"Burnham",crew_portraits_cm_gburnham_angel_sm.png,dsc_gburnham_angel_crew
"Prisoner Spock",2,4, 0,0,0,667,98,198,933,122,268,0,0,0,375,47,161,0,0,0,803,704,0,1181,0,85,530,489,444,522,399,434,1089,0,952,931,797,0,1166,0,232,616,575,540,632,535,583,1076,0,928,850,1119,"Vulcan, Desperate, Resourceful, Telepath, Human, Prisoner, Federation","male, nonhuman, organic, dsc, spock, crew_max_rarity_4","Now Do You See?",0, 8, 4, 8, 12, , , , 1, 3, 375, 200, 80, 600, false,"Spock",crew_portraits_cm_spock_prisoner_sm.png,dsc_spock_prisoner_crew
"Liana",7,5, 0,0,0,0,0,0,486,93,252,1224,204,409,1110,161,321,0,0,0,0,981,264,593,0,932,242,452,0,68,170,752,13,105,333,0,857,303,729,0,766,245,617,0,73,246,653,31,124,463,196,279,"Kantare, Civilian, Survivalist, Romantic, Casual","female, nonhuman, organic, ent, liana, crew_max_rarity_5","They Do What I Ask Them To",1, 5, 6, 8, 10, 6, 0, , , , 175, 75, 50, 165, false,"Liana",crew_portraits_cm_liana_sm.png,liana_crew
"Security Laris",6,5, 546,79,178,0,0,0,1346,246,396,0,0,0,1046,51,201,0,0,0,936,144,878,301,784,158,0,602,0,160,21,69,520,0,455,985,228,946,679,861,284,0,1023,0,266,186,190,985,0,847,187,723,"Romulan, Caregiver, Resourceful, Brutal, Civilian, Tal Shiar, Veteran","female, nonhuman, organic, pic, laris, crew_max_rarity_5","Alright? Alright.",0, 10, 8, 10, 12, , , , 2, 2, 625, 200, 245, 550, false,"Laris",crew_portraits_cm_laris_security_sm.png,laris_security_crew
"Mournful Elnor",7,4, 0,0,0,0,0,0,684,90,193,0,0,0,961,101,301,0,0,0,0,837,0,748,0,742,0,622,0,672,176,586,539,0,468,0,968,0,866,0,907,0,774,0,820,399,769,702,0,620,1165,1282,"Romulan, Duelist, Spiritual, Qowat Milat, Casual, Desperate","nonhuman, male, organic, pic, elnor, crew_max_rarity_4","Grievous Loss",1, 9, 6, 6, 8, , , , 0, 3, 350, 350, 115, 325, false,"Elnor",crew_portraits_cm_elnor_mournful_sm.png,elnor_mournful_crew
"Resistance Rhys",8,5, 0,0,0,491,92,212,1294,180,385,983,154,275,0,0,0,0,0,0,983,432,505,0,0,46,122,975,580,22,442,142,529,229,0,909,552,607,0,0,108,157,936,523,60,589,292,638,332,0,368,491,"Human, Starfleet, Federation, Desperate, Jury Rigger, Veteran, Displaced","male, organic, dsc, rhys, crew_max_rarity_5","Keep Tapping",0, 10, 6, 6, 8, , , , , , 460, 150, 140, 425, false,"Rhys",crew_portraits_cm_rhys_resistance_sm.png,dsc_rhys_resistance_crew
"Zhaban",8,4, 0,0,0,0,0,0,623,74,206,0,0,0,955,180,282,0,0,0,0,884,0,725,0,797,0,592,0,719,192,633,507,0,442,0,971,0,773,0,913,0,659,0,823,323,773,563,0,498,1178,1242,"Romulan, Caregiver, Civilian, Resourceful, Veteran, Tal Shiar","male, nonhuman, organic, pic, zhaban, crew_max_rarity_4","You Cant Do it Alone",1, 8, 6, 10, 10, , , 3, , , 475, 200, 165, 475, false,"Zhaban",crew_portraits_cm_zhaban_sm.png,zhaban_crew
"Sanctuary Booker",6,5, 1064,98,249,0,0,0,1335,198,349,0,0,0,543,96,251,0,0,0,487,44,420,253,333,220,0,893,0,209,92,110,850,0,724,809,230,742,430,671,420,0,861,0,394,189,317,797,0,688,147,581,"Desperate, Brutal, Caregiver, Courier, Resourceful, Kwejian, Empath","male, nonhuman, organic, dsc, booker, crew_max_rarity_5","Welcome to the Sanctuary",0, 8, 10, 6, 12, 1, 2, , , , 900, 115, 122, 440, false,"Booker",crew_portraits_cm_booker_sanctuary_sm.png,dsc_booker_sanctuary_crew
"Confidant Culber",8,5, 0,0,0,521,83,184,0,0,0,0,0,0,1063,149,254,1321,172,370,962,0,0,652,174,921,656,167,43,0,621,169,417,90,16,986,0,0,867,349,954,657,329,108,0,895,346,703,209,93,243,681,"Starfleet, Federation, Counselor, Human, Romantic, Physician, Displaced","male, organic, dsc, culber, crew_max_rarity_5","Go! Get inspired!",2, 10, 12, 12, 12, , , , 1, 2, 490, 140, 165, 400, false,"Culber",crew_portraits_cm_s4_culber_sm.png,dsc_culber_confidant_crew
"Reunion Raffi",9,4, 0,0,0,0,0,0,0,0,0,0,0,0,910,185,386,592,148,350,0,0,0,714,651,0,0,583,449,0,700,592,498,403,72,0,0,0,625,424,0,0,465,321,0,597,413,394,242,51,1158,881,"Human, Civilian, Federation, Desperate, Casual, Caregiver","female, organic, pic, raffi, crew_max_rarity_4","Making A Start",2, 9, 4, 10, 10, , , , 1, 3, 390, 100, 173, 425, false,"Raffi",crew_portraits_cm_raffi_reunion_sm.png,raffi_reunion_crew
"Platonian Chapel",8,5, 0,0,0,1057,104,247,548,51,154,0,0,0,0,0,0,1290,152,404,490,991,0,0,185,97,329,526,17,843,1077,25,0,96,271,824,1090,0,0,335,417,523,851,76,963,1204,129,0,195,378,344,807,"Starfleet, Federation, Human, Romantic, Nurse, Prisoner, Physician","female, organic, tos, chapel, crew_max_rarity_5","Please, Please Make Them Stop.",1, 7, 12, 6, 12, 2, 0, 2, , , , 225, 125, 450, false,"Chapel",crew_portraits_cm_chapel_platonian_sm.png,chapel_platonian_crew
"Twilight Archer",7,5, 516,48,151,0,0,0,1043,52,251,0,0,0,1367,101,282,0,0,0,1029,298,961,186,876,500,0,343,0,439,35,341,258,0,227,1121,623,1059,607,971,854,0,801,0,778,398,732,728,0,640,380,1122,"Human, Survivalist, Civilian, Veteran, Casual, Hero","male, organic, ent, archer, crew_max_rarity_5","What the Hell's Going On?",2, 9, 12, 12, 12, , , , , , 500, 245, 207, 420, false,"Archer",crew_portraits_cm_archer_twilight_sm.png,archer_twilight_crew
"Kal'Hyah Worf",6,5, 1237,202,470,0,0,0,1018,89,182,0,0,0,0,0,0,541,51,126,263,89,215,470,17,556,0,0,631,492,764,52,0,580,859,260,193,199,448,68,926,0,0,738,831,1082,501,0,680,979,443,751,"Klingon, Federation, Starfleet, Spiritual, Brutal, Desperate, Romantic, Musician","nonhuman, male, organic, ds9, worf, exclusive_honorhall, crew_max_rarity_5","We Must Make The Best Of It",2, 10, 10, 10, 10, , , , , , 465, 130, 206, 400, false,"Worf",crew_portraits_cm_worf_kalhyah_sm.png,worf_kalhyah_crew
"Keyla Terrana",5,4, 0,0,0,0,0,0,673,152,303,0,0,0,952,155,366,347,71,186,0,805,0,698,991,709,0,554,730,643,141,240,467,660,151,0,701,0,674,875,586,0,550,594,530,139,147,466,584,162,746,623,"Tandaran, Undercover Operative, Civilian, Casual, Romantic, Desperate, Crafty","female, nonhuman, organic, ent, keyla_terrana, crew_max_rarity_4","I Can't Have You Interfering",1, 6, 10, 8, 14, 4, 0, , , , 415, 25, 237, 500, false,"Keyla",crew_portraits_cm_keyla_terrana_sm.png,keyla_terrana_crew
"Princess Tonia Barrows",8,5, 0,0,0,0,0,0,1041,137,258,0,0,0,1291,231,418,376,149,339,0,590,0,439,894,442,0,286,644,391,19,47,198,593,57,0,791,0,521,447,676,0,358,332,620,107,77,264,253,39,274,200,"Human, Federation, Starfleet, Costumed, Romantic, Royalty","female, organic, tos, barrows, crew_max_rarity_5","A Princess of the Blood Royale",2, 10, 4, 6, 8, , , , 1, 2, 300, 25, 85, 340, false,"Barrows",crew_portraits_cm_barrows_princess_sm.png,barrows_princess_crew
"Ensign Taurik",8,4, 0,0,0,0,0,0,400,44,147,894,104,208,687,104,194,0,0,0,0,1083,610,903,0,1105,471,806,0,261,568,891,110,317,641,0,1117,845,1019,0,1131,578,948,0,462,708,929,324,488,771,901,1206,"Vulcan, Starfleet, Federation, Innovator, Warp Theorist, Telepath","male, organic, nonhuman, tng, taurik, crew_max_rarity_4","I'm A Little Puzzled",1, 5, 6, 6, 10, 3, 0, 3, , , 155, 25, 100, 225, true,"Taurik",crew_portraits_cm_taurik_ensign_sm.png,taurik_ensign_crew
"25th Century Q",8,5, 1056,101,201,1297,152,351,0,0,0,0,0,0,533,51,151,0,0,0,26,611,454,305,367,272,223,109,157,0,1094,0,951,0,808,157,926,846,682,768,509,346,284,307,0,1213,0,1086,0,937,339,972,"Q Continuum, Crafty, Tactician, Scoundrel, Resourceful","nonhuman, male, pic, q_jdl, crew_max_rarity_5","Time is Broken",2, 10, 12, 8, 10, , , , 0, 2, 200, 510, 168, 515, false,"Q",crew_portraits_cm_q_25th_century_sm.png,q_25th_century_crew
"Camping Archer and Porthos",4,5, 1312,219,416,515,127,266,0,0,0,0,0,0,1033,225,449,0,0,0,60,385,169,21,97,855,599,127,512,0,551,0,367,0,326,56,458,239,36,194,698,475,59,419,0,422,0,233,0,230,22,102,"Human, Starfleet, Pilot, Explorer, Communicator, Survivalist","male, organic, ent, archer, crew_max_rarity_5","Going Where No Dog Has Gone Before",1, 10, 4, 12, 6, , , , 0, 2, 115, 225, 105, 225, false,"Archer",crew_portraits_cm_archer_camping_sm.png,archer_camping_crew
"Ensign Marie Kaplan",10,4, 0,0,0,0,0,0,918,105,252,0,0,0,649,99,250,0,0,0,0,727,0,920,0,620,0,817,0,551,204,458,773,0,656,0,842,0,947,0,744,0,859,0,684,360,634,793,0,686,1191,1268,"Desperate, Human, Starfleet, Federation, Resourceful, Hero","female, voy, marie_kaplan, organic, crew_max_rarity_4","Shall I Respond, Sir?",2, 9, 8, 5, 10, , , , 0, 2, 390, 200, 238, 575, false,"Marie Kaplan",crew_portraits_cm_marie_kaplan_ensign_sm.png,marie_kaplan_ensign_crew
"Esteemed Curzon Dax",6,5, 1029,101,253,0,0,0,566,53,148,0,0,0,1347,148,294,0,0,0,525,260,456,73,369,909,0,336,0,815,109,733,247,0,217,793,555,719,316,651,1103,0,707,0,972,460,913,618,0,550,264,976,"Diplomat, Veteran, Resourceful, Spiritual, Trill, Federation, Romantic","nonhuman, male, organic, original, ds9, dax, crew_max_rarity_5","Aren't You Happy To See Me?",2, 8, 12, 10, 14, 4, 0, , , , 450, 280, 115, 295, false,"C. Dax",crew_portraits_cm_dax_curzon_esteemed_sm.png,dax_curzon_esteemed_crew
"Julius Eaton",9,5, 1276,217,429,1036,105,223,0,0,0,0,0,0,528,56,122,0,0,0,20,408,194,174,110,472,350,203,284,0,1116,0,989,0,843,69,441,229,288,187,815,548,572,488,0,1242,0,1122,0,975,296,722,"Human, Civilian, Writer, Crafty, Communicator","nonhuman, male, organic, ds9, bashir, crew_max_rarity_5","What An Appalling Concept",1, 9, 8, 8, 10, , , , , , 500, 200, 150, 562, false,"Bashir",crew_portraits_cm_bashir_eaton_sm.png,bashir_eaton_crew
"Yedrin Dax",3,4, 666,81,221,0,0,0,936,149,253,383,49,153,0,0,0,0,0,0,797,231,367,928,637,576,824,0,0,202,781,425,1096,643,0,892,392,447,993,769,664,799,0,0,316,883,566,1080,650,0,847,1093,"Desperate, Crafty, Scoundrel, Resourceful, Tactician, Trill, Civilian, Human","nonhuman, male, organic, ds9, dax, feb2023, crew_max_rarity_4","What are you going to do about it?",0, 8, 6, 6, 10, , , , 2, 2, 400, 110, 120, 390, false,"Y. Dax",crew_portraits_cm_dax_yedrin_sm.png,dax_yedrin_crew
"Second Chance Laris",5,5, 0,0,0,0,0,0,0,0,0,431,111,250,955,354,754,804,234,546,0,0,979,530,448,0,748,394,330,900,497,411,67,33,29,0,0,728,106,112,0,506,46,118,687,79,121,4,6,2,545,21,"Romulan, Resourceful, Civilian, Caregiver, Romantic, Tal Shiar, Veteran","nonhuman, organic, female, pic, laris, crew_max_rarity_5","We Love Deeply, And Then We Honor That Love By Loving Again",1, 10, 6, 6, 10, , , , , , 275, 245, 108, 200, false,"Laris",crew_portraits_cm_laris_second_chance_sm.png,laris_second_chance_crew
"Second Chance Gray",7,5, 0,0,0,1305,158,365,0,0,0,515,60,152,1056,113,267,0,0,0,268,0,972,665,0,250,70,24,147,884,628,0,112,579,377,523,0,1046,896,0,482,158,134,294,954,923,0,360,636,645,291,801,"Trill, Federation, Starfleet, Android, Musician, Prodigy, Romantic","male, nonhuman, dsc, gray, crew_max_rarity_5","Its Everything Ive Imagined",2, 10, 10, 8, 12, , , , 1, 2, 475, 200, 120, 400, false,"Gray",crew_portraits_cm_s4_gray_sm.png,dsc_gray_synthetic_crew
"Disguised Janeway",6,5, 1081,101,250,1277,251,501,0,0,0,0,0,0,503,70,184,0,0,0,10,573,397,280,318,164,165,85,112,0,1103,0,964,0,821,39,843,729,564,660,184,151,88,133,0,1123,0,980,0,843,160,391,"Human, Starfleet, Federation, Displaced, Resourceful, Costumed, Undercover Operative","female, organic, voy, janeway, crew_max_rarity_5","Right Place, Wrong Time",2, 10, 8, 6, 12, 0, 1, 2, , , 550, 200, 85, 325, false,"Janeway",crew_portraits_cm_janeway_disguised_sm.png,janeway_disguised_crew
"Leader Pav",2,2, 372,47,148,0,0,0,0,0,0,0,0,0,266,33,98,144,21,80,1129,1101,1056,942,811,0,0,1209,790,0,1273,1011,1187,731,916,1132,1103,1066,967,791,0,0,1200,781,0,1274,998,1174,723,879,1394,1401,"Trill, Politician, Cultural Figure, Resourceful","female, nonhuman, dsc, organic, pav, crew_max_rarity_2","My Decision is Final",1, 5, 6, 8, 8, , , , , , 325, 200, 70, 400, false,"Pav",crew_portraits_cm_pav_leader_sm.png,dsc_pav_leader_crew
"Mestral",4,5, 0,0,0,1301,201,400,957,248,453,532,83,181,0,0,0,0,0,0,238,555,907,0,0,6,63,302,131,95,601,257,922,525,0,410,397,947,0,0,18,103,424,227,65,352,151,956,557,0,155,175,"Vulcan, Hero, Civilian, Romantic, Explorer, Telepath, Survivalist, Resourceful","male, nonhuman, organic, ent, mestral, crew_max_rarity_5","I'm Willing To Take the Risk.",0, 8, 10, 6, 12, 4, 2, , , , 775, 150, 40, 200, false,"Mestral",crew_portraits_cm_mestral_sm.png,mestral_crew
"Hippie Kira",3,4, 644,79,201,360,83,181,0,0,0,0,0,0,960,153,302,0,0,0,457,862,757,249,676,1109,803,246,693,0,709,0,506,0,440,468,964,896,396,817,959,665,263,577,0,787,0,583,0,512,811,986,"Bajoran, Federation, Resourceful, Tactician, Displaced, Costumed, Human","female, nonhuman, organic, ds9, kira, crew_max_rarity_4","I Broke My Nose",0, 7, 8, 10, 8, 6, 2, , , , , 75, , , false,"Kira",crew_portraits_cm_kira_hippie_sm.png,kira_hippie_crew
"2024 Picard",5,5, 0,0,0,1295,189,403,610,105,189,0,0,0,1006,153,400,0,0,0,249,893,0,641,0,31,198,20,136,725,157,643,408,0,365,426,957,0,647,0,104,282,32,243,804,224,755,422,0,376,78,292,"Human, Android, Federation, Displaced, Desperate, Civilian, Inspiring, Veteran","male, pic, picard, crew_max_rarity_5","I'm Too Old For This",0, 10, 6, 6, 10, , , , 1, 3, 100, , 55, 165, false,"Picard",crew_portraits_cm_picard_2025_sm.png,picard_2024_crew
"Carpenter Street Archer",6,5, 1057,103,252,0,0,0,1355,150,352,491,51,201,0,0,0,0,0,0,489,45,110,678,335,222,741,0,0,65,403,111,1010,587,0,787,260,293,908,647,492,697,0,0,178,674,378,981,587,0,277,769,"Human, Resourceful, Tactician, Displaced, Interrogator, Starfleet, Costumed, Undercover Operative","male, organic, ent, archer, crew_max_rarity_5","Try to Stay Out of Trouble",0, 10, 6, 10, 12, , , , 1, 2, 600, 300, 165, 680, false,"Archer",crew_portraits_cm_archer_carpenter_street_sm.png,archer_carpenter_street_crew
"Jaglom Shrek",9,5, 1052,102,252,0,0,0,0,0,0,491,79,181,1314,148,351,0,0,0,493,588,112,68,341,0,738,342,0,887,439,0,62,581,226,794,840,276,274,652,0,672,589,0,855,701,0,159,565,436,326,779,"Yridian, Civilian, Crafty, Communicator, Merchant, Scoundrel","nonhuman, male, organic, tng, jaglom_shrek, crew_max_rarity_5","I Have Other Business",1, 9, 10, 8, 8, , , , 2, 2, 615, 130, 140, 355, false,"Shrek",crew_portraits_cm_jaglom_shrek_sm.png,jaglom_shrek_crew
"Wonderland Taylor",7,5, 0,0,0,1050,154,304,1316,156,398,0,0,0,0,0,0,568,61,159,452,417,0,0,818,7,312,500,65,224,419,17,0,518,774,644,563,0,0,950,50,403,668,178,383,602,116,0,631,914,180,622,"Human, Physician, Civilian, Casual, Desperate, Displaced","female, organic, tos, gillian, crew_max_rarity_5","Is This Real?",1, 9, 8, 10, 12, 0, 2, , , , 430, 250, 205, 550, false,"Dr. Taylor",crew_portraits_cm_taylor_wonderland_sm.png,taylor_wonderland_crew
"2024 Raffi",6,4, 0,0,0,0,0,0,923,105,302,649,87,250,387,54,139,0,0,0,0,706,744,1169,0,588,537,1121,0,98,396,438,406,409,946,0,775,786,1192,0,657,534,1130,0,185,527,558,454,440,956,861,1067,"Human, Starfleet, Desperate, Displaced, Resourceful, Undercover Operative","female, organic, pic, raffi, crew_max_rarity_4","We Won't Let It Happen",2, 7, 4, 4, 12, 1, 0, , , , 325, 100, 245, 315, false,"Raffi",crew_portraits_cm_raffi_2024_sm.png,raffi_2024_crew
"Solkar",7,5, 548,51,151,1039,150,251,0,0,0,0,0,0,1296,148,351,0,0,0,131,985,904,180,823,432,327,32,261,0,463,0,274,0,242,389,1091,1051,426,962,682,467,137,413,0,702,0,498,0,437,269,813,"Vulcan, Diplomat, Telepath, Cultural Figure, Inspiring, Ambassador","male, organic, tng, nonhuman, solkar, crew_max_rarity_5","Live Long, and Prosper",0, 8, 6, 8, 14, 4, 2, , , , 600, 350, 250, 675, false,"Solkar",crew_portraits_cm_semel_captain_sm.png,semel_captain_crew
"Rumpelstiltskin",6,4, 365,49,152,0,0,0,0,0,0,659,100,251,947,149,301,0,0,0,1135,1106,377,428,979,0,531,612,0,674,735,0,80,398,459,1119,1096,369,507,968,0,519,693,0,710,800,0,123,421,534,821,979,"Scoundrel, Cultural Figure, Resourceful, Civilian, Explorer","nonhuman, male, organic, ds9, rumpelstiltskin, crew_max_rarity_4","So Where's The Straw?",1, 5, 12, 12, 20, 2, 0, , , , 175, 110, 65, 275, false,"Rumpelstiltskin",crew_portraits_cm_rumpelstiltskin_sm.png,rumpelstiltskin_crew
"Carpenter Street T'Pol",2,4, 659,76,212,387,43,145,940,147,307,0,0,0,0,0,0,0,0,0,447,226,735,941,655,172,814,1123,700,484,753,400,0,0,0,592,358,883,1020,803,294,833,1139,725,531,753,471,0,0,0,830,1063,"Vulcan, Civilian, Resourceful, Tactician, Telepath, Astrophysicist, Displaced, Costumed, Undercover Operative","female, organic, ent, nonhuman, tpol, crew_max_rarity_4","Engage The Engine",0, 7, 6, 6, 12, 0, 1, , , , 250, 225, 100, 190, false,"T'Pol",crew_portraits_cm_tpol_carpenter_street_sm.png,tpol_carpenter_street_crew
"Disguised Tom Paris",7,5, 526,57,159,1035,133,265,0,0,0,0,0,0,1303,178,369,0,0,0,141,1002,932,176,842,436,330,26,265,0,424,0,238,0,212,370,1071,1029,364,943,688,471,123,416,0,630,0,427,0,382,256,731,"Human, Federation, Starfleet, Displaced, Costumed, Undercover Operative, Communicator","male, organic, voy, paris, crew_max_rarity_5","Is It So Unusual To Care About Something More?",0, 7, 12, 8, 12, 7, 0, , , , 300, 200, 20, 100, false,"Paris",crew_portraits_cm_paris_disguised_sm.png,paris_disguised_crew
"Federation President Rillak",6,5, 1367,101,302,0,0,0,548,50,153,0,0,0,1055,52,252,0,0,0,264,165,218,71,130,946,0,548,0,845,227,764,463,0,403,707,497,631,417,577,1099,0,937,0,970,675,911,886,0,757,287,1092,"Politician, Cardassian, Bajoran, Human, Inspiring, Cultural Figure, Federation, Diplomat","female, nonhuman, organic, dsc, rillak, crew_max_rarity_5","Its A Lot to Live Up To. No Pressure",0, 8, 8, 10, 10, 8, 4, , , , 600, 200, 248, 525, false,"Rillak",crew_portraits_cm_rillak_president_sm.png,rillak_president_crew
"Botanist Sulu",4,4, 0,0,0,873,144,350,502,96,206,0,0,0,646,121,261,0,0,0,629,989,0,904,0,121,428,155,343,840,501,760,761,0,642,569,938,0,890,0,142,355,149,322,780,400,734,729,0,641,730,710,"Human, Federation, Starfleet, Pilot, Botanist, Casual","male, organic, sulu, tos, crew_max_rarity_4","Plants Can Be Very Sensitive",2, 7, 6, 6, 12, 0, 1, , , , 240, 95, 70, 100, false,"Sulu",crew_portraits_cm_sulu_botanist_sm.png,sulu_botanist_crew
"Hippie O'Brien",3,4, 654,81,198,0,0,0,0,0,0,340,66,146,950,152,353,0,0,0,821,851,425,242,668,0,866,569,0,1002,690,0,184,675,423,942,969,472,344,820,0,777,576,0,955,686,0,191,637,427,841,990,"Human, Starfleet, Federation, Resourceful, Communicator, Displaced, Costumed","male, organic, ds9, obrien, crew_max_rarity_4","I Think I Know What Happened",1, 5, 8, 10, 16, 2, 0, , , , 500, 200, 141, 325, false,"O'Brien",crew_portraits_cm_obrien_hippie_sm.png,obrien_hippie_crew
"Dr. T'Ana",7,5, 1026,154,303,510,81,180,0,0,0,0,0,0,0,0,0,1318,258,308,130,574,400,661,3,958,688,981,44,0,0,166,0,85,246,225,684,517,742,32,968,681,1007,101,0,0,314,0,186,368,271,531,"Federation, Starfleet, Caitian, Physician, Brutal, Exobiology","female, nonhuman, organic, low, tana, crew_max_rarity_5","Nobody's Authorized to Pass Out!",1, 7, 2, 15, 30, , , , , , 300, 200, 155, 50, false,"T'Ana",crew_portraits_cm_dr_tana_sm.png,dr_tana_crew
"EV Suit Reed",6,5, 1057,100,250,526,80,181,0,0,0,1324,199,372,0,0,0,0,0,0,132,585,10,679,336,917,67,954,556,230,0,0,244,68,0,366,847,67,916,665,969,120,1008,586,373,0,0,386,175,0,226,694,"Starfleet, Human, Artist, Explorer, Resourceful, Hero","male, organic, ent, evsuit, reed, crew_max_rarity_5","Charges Are Set",0, 7, 6, 8, 14, 7, 2, , , , 200, 275, 40, 300, false,"Reed",crew_portraits_cm_reed_ev_suit_sm.png,reed_ev_suit_crew
"Badgey",4,3, 0,0,0,479,93,220,0,0,0,346,70,168,202,41,102,0,0,0,1000,0,1078,1279,0,978,448,784,595,993,1290,0,846,663,1054,893,0,1001,1243,0,845,312,674,510,899,1269,0,730,601,1013,1322,1280,"Hologram, Federation, Starfleet, Resourceful, Communicator","male, nonhuman, artificial_life, low, badgey, crew_max_rarity_3","Hi, Can I Teach You A Lesson?",2, 6, 4, 8, 10, , , , , , 115, 85, 30, 100, false,"Badgey",crew_portraits_cm_badgey_sm.png,badgey_crew
"USS Titan Bradward Boimler",7,4, 873,150,252,0,0,0,683,100,202,325,50,150,0,0,0,0,0,0,667,243,268,811,499,736,880,0,0,380,946,582,1160,689,0,710,390,299,843,580,858,807,0,0,459,1025,735,1090,655,0,938,1095,"Federation, Starfleet, Human, Desperate, Resourceful, Pilot","male, organic, low, boimler, crew_max_rarity_4","I Dont Have To Write That Down",2, 9, 8, 8, 8, , , , 1, 2, 475, 265, 360, 425, false,"Boimler",crew_portraits_cm_boimler_uss_titan_sm.png,boimler_uss_titan_crew
"Bat'leth Mariner",1,4, 552,250,451,0,0,0,693,298,600,0,0,0,0,0,0,294,50,152,749,204,667,869,299,582,0,0,759,514,784,180,0,702,1020,237,13,182,412,49,88,0,0,699,95,176,16,0,656,941,856,67,"Federation, Starfleet, Human, Maverick, Resourceful, Brutal, Scoundrel, Duelist","female, organic, low, mariner, crew_max_rarity_4","I Demand Honor",0, 7, 8, 6, 10, 1, 1, , , , 425, 365, 170, 425, false,"Mariner",crew_portraits_cm_mariner_batleth_sm.png,mariner_batleth_crew
"Roy Ritterhouse",7,4, 0,0,0,920,101,250,0,0,0,659,80,180,381,47,152,0,0,0,649,0,770,1175,0,612,106,331,359,703,1200,0,428,429,950,825,0,951,1185,0,771,252,504,457,856,1218,0,568,566,945,908,1200,"Human, Civilian, Artist, Inspiring, Scoundrel","male, organic, ds9, martok, crew_max_rarity_4","Okay, Friends and Neighbours",0, 5, 8, 6, 8, 5, 2, , , , 390, 75, 25, 340, false,"Ritterhouse",crew_portraits_cm_martok_ritterhouse_sm.png,martok_ritterhouse_crew
"Mok'bara Worf",6,5, 0,0,0,516,50,158,1351,155,368,0,0,0,1046,76,276,0,0,0,1023,405,0,684,0,43,722,192,614,203,23,108,450,0,394,1120,600,0,935,0,197,791,486,682,431,205,350,782,0,678,259,834,"Klingon, Federation, Starfleet, Brutal, Duelist, Athlete, Spiritual","male, nonhuman, organic, tng, worf, crew_max_rarity_5","Defend Yourself",0, 10, 6, 4, 8, , , , , , 375, 200, 300, 425, false,"Worf",crew_portraits_cm_worf_mokbara_sm.png,worf_mokbara_crew
"Admiral Vance",6,5, 1424,151,302,528,53,153,0,0,0,0,0,0,1058,102,249,0,0,0,66,363,160,38,86,982,703,187,599,0,649,0,441,0,387,291,688,524,307,473,1104,794,493,684,0,964,0,784,0,680,171,955,"Federation, Starfleet, Human, Cultural Figure, Inspiring, Brutal, Desperate, Ambassador","male, organic, dsc, vance, crew_max_rarity_5","The Past Is The Only Light With Which We Can See The Future.",2, 10, 8, 10, 12, , , , 1, 2, 500, 215, 252, 740, false,"Vance",crew_portraits_cm_vance_admiral_sm.png,dsc_vance_admiral_crew
"Mok'bara Sito Jaxa",5,4, 0,0,0,0,0,0,953,135,311,318,94,194,668,89,209,0,0,0,0,673,1085,931,0,541,851,822,0,184,174,390,418,664,663,0,716,897,1021,0,608,625,949,0,191,317,493,370,525,772,838,920,"Bajoran, Federation, Starfleet, Duelist, Athlete, Pilot, Desperate, Prodigy, Maverick","nonhuman, female, organic, sito, tng, crew_max_rarity_4","It's Not A Fair Test",1, 7, 8, 10, 10, 0, 2, , , , 575, 160, 185, 140, false,"Sito",crew_portraits_cm_sito_jaxa_mokbara_sm.png,sito_jaxa_mokbara_crew
"Orbital Skydiving Torres",6,5, 0,0,0,0,0,0,1316,165,424,1107,107,266,0,0,0,480,100,215,0,410,388,0,884,218,319,0,625,8,400,20,419,23,852,0,529,703,0,772,358,491,0,515,68,545,67,740,83,738,215,540,"Klingon, Human, Maquis, Federation, Starfleet, Desperate, Athlete","evsuit, nonhuman, female, organic, voy, torres, crew_max_rarity_5","Disengage Safety Protocols",1, 8, 8, 10, 8, 0, 1, , , , 490, 100, 125, 200, false,"Torres",crew_portraits_cm_torres_orbital_sm.png,torres_orbital_crew
"Qalankhkai Elnor",6,5, 503,92,240,0,0,0,1010,186,416,0,0,0,1273,262,521,0,0,0,945,225,888,146,796,400,0,258,0,348,5,256,169,0,155,834,202,778,96,707,336,0,206,0,314,21,238,138,0,156,71,92,"Romulan, Duelist, Qowat Milat, Spiritual, Hero, Desperate","nonhuman, organic, male, pic, elnor, crew_max_rarity_5","I Have Bound Myself",2, 8, 8, 8, 12, 1, 1, , , , 450, 270, 140, 525, false,"Elnor",crew_portraits_cm_elnor_qalankhkai_sm.png,elnor_qalankhkai_crew
"Shroomies",1,4, 0,0,0,841,219,543,508,208,502,308,150,304,0,0,0,0,0,0,517,817,1009,0,0,65,142,549,277,325,935,575,1062,624,0,197,391,558,0,0,12,15,230,126,16,342,145,577,293,0,736,42,"Brutal, Crafty, Hunter, Innovator, Resourceful, Saboteur, Tactician, Villain","nonhuman, organic, ent, shroomies, crew_max_rarity_4","You Are Defenseless",0, 9, 8, 6, 14, 1, 0, , , , 325, 200, 48, 150, false,"Shroomies",crew_portraits_cm_shroomies_sm.png,shroomies_crew
