crew, tier, rarity, CMD_core, CMD_min, CMD_max, SCI_core, SCI_min, SCI_max, SEC_core, SEC_min, SEC_max, ENG_core, ENG_min, ENG_max, DIP_core, DIP_min, DIP_max, MED_core, MED_min, MED_max, V_CMD_SCI, V_CMD_SEC, V_CMD_ENG, V_CMD_DIP, V_CMD_MED, V_SCI_SEC, V_SCI_ENG, V_SCI_DIP, V_SCI_MED, V_SEC_ENG, V_SEC_DIP, V_SEC_MED, V_ENG_DIP, V_ENG_MED, V_DIP_MED, G_CMD_SCI, G_CMD_SEC, G_CMD_ENG, G_CMD_DIP, G_CMD_MED, G_SCI_SEC, G_SCI_ENG, G_SCI_DIP, G_SCI_MED, G_SEC_ENG, G_SEC_DIP, G_SEC_MED, G_ENG_DIP, G_ENG_MED, G_DIP_MED, voyage_rank, gauntlet_rank, traits, hidden_traits, action_name, action_bonus_type, action_bonus_amount, action_initial_cooldown, action_duration, action_cooldown, bonus_ability, trigger, uses_per_battle, penalty_type, penalty_amount, accuracy, crit_bonus, crit_chance, evasion, charge_phases, short_name, image_name, symbol
"Investigator Odo",8,1, 0,0,0,0,0,0,217,37,171,0,0,0,0,0,0,0,0,0,0,974,0,0,0,1026,0,0,0,892,1064,842,0,0,0,0,890,0,0,0,905,0,0,0,787,992,756,0,0,0,1256,1250,"Changeling, Cardassian, Investigator, Interrogator","nonhuman, male, organic, ds9, odo, crew_max_rarity_1","Collaboration",2, 1, 20, 14, 10, , , , , , 400, 115, 67, 265, false,"Odo",crew_portraits_cm_odooccupation_sm.png,odo_occupation_crew
"Constable Odo",4,3, 317,107,225,0,0,0,523,27,85,0,0,0,0,0,0,0,0,0,925,601,861,968,797,867,0,0,0,759,941,705,0,0,0,692,589,632,782,577,1026,0,0,0,884,1071,840,0,0,0,1149,1163,"Changeling, Bajoran, Constable, Investigator, Interrogator","nonhuman, male, organic, ds9, odo, crew_max_rarity_3","Justice",0, 6, 10, 12, 16, , , , 3, 800, 520, 300, 75, , false,"Odo",crew_portraits_cm_odostandard_sm.png,odo_constable_crew
"Ensign Ro",4,2, 322,46,132,0,0,0,0,0,0,0,0,0,0,0,0,0,0,0,1004,961,940,1021,873,0,0,0,0,0,0,0,0,0,0,966,934,896,989,829,0,0,0,0,0,0,0,0,0,0,1251,1254,"Starfleet, Bajoran, Resourceful","nonhuman, female, organic, tng, ro, crew_max_rarity_2","Separate Ways",0, 4, 3, 10, 5, , , 2, , , 130, 210, 13, 200, false,"Ro",crew_portraits_cm_roensign_sm.png,ro_ensign_crew
"Shinzon",10,5, 819,94,241,0,0,0,938,183,435,0,0,0,546,176,390,0,0,0,574,125,512,265,442,325,0,670,0,291,120,219,625,0,530,687,159,626,196,573,262,0,384,0,236,54,194,319,0,310,490,180,"Human, Clone, Reman, Villain, Romulan","male, organic, tng, shinzon, crew_max_rarity_5","Destiny Complete",0, 7, 14, 3, 14, 1, 2, , , , 1325, 545, 365, 1050, false,"Shinzon",crew_portraits_cm_shinzon_sm.png,shinzon_crew
"Will Riker",10,1, 251,42,110,0,0,0,125,22,74,0,0,0,0,0,0,0,0,0,1020,891,962,1044,890,1056,0,0,0,913,1093,868,0,0,0,995,835,927,1017,867,1041,0,0,0,899,1083,852,0,0,0,1243,1235,"Human, Federation, Starfleet, Maverick, Gambler, Romantic","male, organic, tng, riker, crew_max_rarity_1","Poker Face",0, 1, 8, 10, 14, 4, 0, , , , 455, , 425, 340, false,"Riker",crew_portraits_cm_rikers1_sm.png,riker_s1_commander_crew
"Commander Riker",7,2, 279,78,191,0,0,0,124,29,89,0,0,0,290,22,64,0,0,0,1003,861,937,795,871,1052,0,1011,0,909,965,864,994,0,868,794,659,754,749,685,1023,0,1044,0,883,1001,838,1026,0,893,1184,1147,"Human, Federation, Starfleet, Pilot, Maverick, Gambler, Romantic","male, organic, tng, riker, crew_max_rarity_2","Liase",0, 2, 8, 10, 14, 5, 0, , , , 645, 50, 295, 275, false,"Riker",crew_portraits_cm_rikerpoker_sm.png,riker_s2_commander_crew
"Edith Keeler",7,4, 0,0,0,0,0,0,0,0,0,0,0,0,453,166,339,591,187,590,0,0,0,822,445,0,0,749,341,0,840,443,706,298,107,0,0,0,572,97,0,0,470,108,0,575,114,394,42,16,1058,439,"Civilian, Caregiver, Inspiring, Cultural Figure, Romantic, Human","female, organic, tos, keeler, crew_max_rarity_4","A Life Worth Living",1, 7, 8, 10, 8, , , , , , 690, 25, 52, 440, false,"Keeler",crew_portraits_cm_edithkeeler_sm.png,keeler_crew
"Ensign Tuvok",8,1, 0,0,0,181,51,197,0,0,0,0,0,0,138,33,74,0,0,0,1034,0,0,1081,0,1036,711,925,632,0,1089,0,1037,0,906,845,0,0,1057,0,841,567,700,505,0,1076,0,1005,0,874,1244,1205,"Vulcan, Federation, Starfleet, Telepath","nonhuman, male, organic, voy, tuvok, crew_max_rarity_1","Memory",0, 1, 1, 14, 10, , , , , , 103, 60, 135, 375, false,"Tuvok",crew_portraits_cm_tuvokensign_sm.png,tuvok_ensign_crew
"Security Chief Tuvok",5,3, 291,53,161,145,45,149,445,85,201,0,0,0,0,0,0,0,0,0,808,633,950,1023,879,609,723,1046,642,756,937,703,0,0,0,572,518,852,944,782,452,631,932,574,675,867,644,0,0,0,1125,1046,"Vulcan, Federation, Starfleet, Telepath, Tactician, Investigator","nonhuman, male, organic, voy, tuvok, crew_max_rarity_3","Contingency Plan",0, 4, 10, 12, 16, 5, 0, , , , 465, 50, , 300, false,"Tuvok",crew_portraits_cm_tuvokrifle_sm.png,tuvok_rifle_crew
"Major Kira",7,2, 273,37,126,0,0,0,304,60,176,0,0,0,0,0,0,0,0,0,1011,713,954,1031,881,989,0,0,0,860,1040,808,0,0,0,984,641,912,1002,850,855,0,0,0,739,943,711,0,0,0,1209,1188,"Bajoran, Veteran, Resourceful","nonhuman, female, organic, ds9, kira, crew_max_rarity_2","Obstinance",0, 2, 0, 10, 14, 6, 0, , , , 295, 150, 5, , true,"Kira",crew_portraits_cm_kirashorthair_sm.png,kira_major_shorthair_crew
"Mirror Intendant Kira",6,5, 512,183,363,0,0,0,1052,272,542,0,0,0,946,67,184,0,0,0,677,122,617,228,556,250,0,561,0,232,54,163,496,0,420,370,35,295,263,269,110,0,858,0,113,80,86,814,0,703,329,134,"Bajoran, Cardassian, Klingon, Villain, Klingon-Cardassian Alliance, Brutal, Mirror Universe","nonhuman, female, organic, ds9, kira, crew_max_rarity_5","Instability",0, 6, 6, 10, 12, 4, 0, , , , 915, 225, 90, 1525, true,"Kira",crew_portraits_cm_kiraintendant_sm.png,kira_mirror_crew
"Security Chief Worf",2,2, 205,57,144,0,0,0,326,61,145,0,0,0,0,0,0,0,0,0,1036,746,972,1057,901,981,0,0,0,853,1034,802,0,0,0,932,631,868,961,798,910,0,0,0,796,998,761,0,0,0,1216,1181,"Klingon, Federation, Starfleet, Duelist, Investigator","nonhuman, male, organic, tng, worf, crew_max_rarity_2","They Have No Honor",2, 4, 8, 10, 12, , , , 1, 2, 165, 280, 95, 155, false,"Worf",crew_portraits_cm_worf_sm.png,worf_security_chief_crew
"Defiant Commander Worf",8,4, 364,241,488,0,0,0,609,179,394,0,0,0,0,0,0,0,0,0,734,313,675,814,608,592,0,0,0,538,745,466,0,0,0,176,48,130,329,116,316,0,0,0,281,486,237,0,0,0,1069,386,"Klingon, Federation, Starfleet, Duelist, Tactician","nonhuman, male, organic, ds9, worf, crew_max_rarity_4","Good Day to Die",2, 6, 12, 12, 12, 4, 0, , 1, 2, 690, 645, 325, 205, false,"Worf",crew_portraits_cm_worfdefiant_sm.png,worf_defiant_commander_crew
"Mirror Regent Worf",7,5, 861,294,589,0,0,0,1062,175,357,0,0,0,0,0,0,0,0,0,317,82,265,498,210,293,0,0,0,267,463,201,0,0,0,85,28,57,208,51,366,0,0,0,337,543,288,0,0,0,578,263,"Klingon, Cardassian, Tactician, Villain, Brutal, Klingon-Cardassian Alliance, Mirror Universe","nonhuman, male, organic, ds9, worf, crew_max_rarity_5","Position of Strength",0, 9, 8, 8, 10, , , , , , 300, 980, 390, , false,"Worf",crew_portraits_cm_worfmirror_sm.png,worf_mirror_crew
"Yeoman Rand",10,1, 164,15,58,0,0,0,0,0,0,0,0,0,117,19,60,0,0,0,1054,1003,999,1030,926,0,0,1056,0,0,1095,0,1045,0,910,1050,1002,997,1018,921,0,0,1047,0,0,1090,0,1033,0,898,1253,1257,"Federation, Starfleet, Human","female, organic, tos, rand, crew_max_rarity_1","Signature Required",2, 2, 8, 10, 12, , , , 1, 1, 375, , , 180, false,"Rand",crew_portraits_cm_randyeoman_sm.png,rand_yeoman_crew
"The Duras Sisters",8,4, 311,83,205,0,0,0,658,150,385,0,0,0,464,170,341,0,0,0,958,416,896,588,831,577,0,741,0,521,279,454,698,0,592,767,245,721,264,660,363,0,462,0,335,92,284,387,0,357,895,354,"Klingon, Scoundrel, Villain","nonhuman, female, organic, tng, betor, lursa, exclusive_fusion, crew_max_rarity_4","The Power of Two",0, 9, 10, 20, 12, , , 1, , , 350, 110, 190, 500, false,"Duras Sisters",crew_portraits_cm_duras_sisters_sm.png,duras_sisters_crew
"Persis",6,2, 0,0,0,0,0,0,253,94,250,0,0,0,303,39,88,0,0,0,0,950,0,1027,0,987,0,1001,0,859,778,807,985,0,859,0,701,0,1037,0,641,0,1012,0,583,609,548,988,0,861,1201,1145,"Human, Augments, Engineered, Survivalist, Tactician","nonhuman, female, organic, ent, persis, crew_max_rarity_2","Augmented Strength",0, 2, 6, 10, 6, 7, 0, 2, , , 240, 330, 300, , false,"Persis",crew_portraits_cm_persis_sm.png,persis_crew
"Telek R'Mor",5,2, 0,0,0,347,52,194,119,8,44,0,0,0,263,30,113,0,0,0,933,1009,0,1036,0,840,650,684,581,914,990,869,995,0,869,848,1004,0,1026,0,740,570,656,507,912,1012,867,973,0,851,1178,1167,"Romulan, Astrophysicist","nonhuman, male, organic, voy, rmor, crew_max_rarity_2","Solitary Survey",1, 3, 10, 12, 10, 0, 2, , , , 405, 50, 3, 180, false,"R'Mor",crew_portraits_cm_telekrmor_sm.png,rmor_voyager_crew
"KDF Gowron",9,4, 375,85,222,0,0,0,296,100,256,0,0,0,641,173,418,0,0,0,889,627,826,444,764,946,0,639,0,818,437,772,588,0,494,736,361,685,197,629,616,0,353,0,562,141,529,283,0,282,963,455,"Klingon, Duelist, Diplomat, Politician","nonhuman, male, organic, tng, gowron, crew_max_rarity_4","What Can Be Done",1, 6, 14, 10, 14, 0, 2, , , , 625, 465, 85, 1000, false,"Gowron",crew_portraits_cm_gowronyoung_sm.png,gowron_kdf_crew
"Third Remata'Klan",9,3, 410,42,84,0,0,0,467,85,185,0,0,0,0,0,0,0,0,0,934,592,871,978,804,847,0,0,0,742,924,687,0,0,0,1019,642,952,1038,882,782,0,0,0,696,891,664,0,0,0,1145,1189,"Jem'hadar, Dominion, Duelist, Tactician","nonhuman, male, organic, ds9, remataklan, crew_max_rarity_3","Victory is Life",0, 3, 0, 6, 8, 4, 4, , , , 690, 395, 597, 600, true,"Remata'Klan",crew_portraits_cm_remataklan_sm.png,remataklan_crew
"Ensign Chapel",10,1, 0,0,0,0,0,0,0,0,0,0,0,0,0,0,0,214,34,152,0,0,0,0,898,0,0,0,631,0,0,848,0,587,882,0,0,0,0,822,0,0,0,585,0,0,787,0,540,802,1262,1253,"Human, Federation, Starfleet, Nurse","female, organic, tos, chapel, crew_max_rarity_1","Administer Prescription",2, 1, 6, 10, 10, , , , , , 130, , 40, 100, false,"Chapel",crew_portraits_cm_chapelensign_sm.png,chapel_ensign_crew
"Ensign Ogawa",10,1, 0,0,0,0,0,0,0,0,0,0,0,0,0,0,0,213,34,166,0,0,0,0,894,0,0,0,629,0,0,846,0,584,876,0,0,0,0,803,0,0,0,567,0,0,776,0,524,784,1259,1251,"Human, Federation, Starfleet, Nurse","female, organic, tng, ogawa, crew_max_rarity_1","Report to Sickbay",2, 1, 6, 1, 8, 2, 0, 1, , , 170, , 35, 105, false,"Ogawa",crew_portraits_cm_ogawaensign_sm.png,ogawa_ensign_crew
"Wesley Crusher",10,1, 0,0,0,218,43,149,0,0,0,174,32,78,0,0,0,0,0,0,1027,0,994,0,0,1032,613,1024,627,907,0,0,1031,600,0,947,0,968,0,0,940,487,935,575,889,0,0,1003,587,0,1239,1226,"Human, Federation, Civilian, Prodigy","male, organic, tng, wesley, crew_max_rarity_1","Study",1, 2, 8, 10, 12, , , , 0, 1, 215, 125, 70, 55, false,"Wesley",crew_portraits_cm_wesleysweater_sm.png,wesley_sweater_crew
"Ensign Crusher",7,3, 176,11,31,426,83,229,0,0,0,347,34,78,0,0,0,0,0,0,675,1004,803,1079,927,879,408,899,538,875,0,0,980,571,0,659,1005,928,1085,929,714,363,764,437,887,0,0,1002,586,0,1130,1153,"Human, Federation, Starfleet, Prodigy, Warp Theorist","male, organic, tng, wesley, crew_max_rarity_3","Rewire",2, 4, 6, 8, 10, 6, 0, , , , 290, , , 190, false,"Wesley",crew_portraits_cm_wesley_sm.png,wesley_full_ensign_crew
"Acting Ensign Crusher",9,2, 114,29,58,258,56,160,0,0,0,251,53,148,0,0,0,0,0,0,890,1008,839,1087,931,1017,499,1003,619,887,0,0,990,577,0,741,994,732,1071,913,901,370,903,543,814,0,0,902,528,0,1192,1138,"Human, Federation, Starfleet, Prodigy","male, organic, tng, wesley, crew_max_rarity_2","Invention",1, 4, 3, 6, 6, , , 2, , , 205, 50, 25, 165, false,"Wesley",crew_portraits_cm_wesleyensign_sm.png,wesley_acting_ensign_crew
"Formal Dress Wesley Crusher",8,4, 0,0,0,662,173,422,0,0,0,270,108,230,481,160,342,0,0,0,585,0,919,807,0,570,237,167,345,858,830,0,424,557,588,324,0,635,575,0,305,67,45,207,612,582,0,87,373,366,887,268,"Human, Federation, Starfleet, Prodigy, Warp Theorist","male, organic, tng, wesley, crew_max_rarity_4","Duty to the Truth",1, 9, 4, 10, 12, , , , , , 300, 500, 30, 450, false,"Wesley",crew_portraits_cm_wesleydressuniform_sm.png,wesley_formal_dress_crew
"Wrathful Khan",7,5, 1040,206,421,0,0,0,1145,72,143,376,140,288,0,0,0,0,0,0,290,86,59,482,194,317,597,0,0,81,485,213,864,494,0,273,234,20,443,184,888,364,0,0,230,976,743,528,286,0,443,446,"Human, Augments, Engineered, Villain, Cultural Figure, Tactician, Resourceful, Survivalist, Brutal","nonhuman, male, organic, tos, khan, crew_max_rarity_5","I Stab at Thee",2, 9, 12, 5, 12, 1, 0, , , , 640, 595, 345, 850, false,"Khan",crew_portraits_cm_khan_sm.png,khan_wok_crew
"Tailor Garak",4,3, 0,0,0,0,0,0,502,44,126,161,22,44,395,83,219,0,0,0,0,860,1001,930,0,861,730,907,0,578,613,702,686,603,758,0,939,999,820,0,970,732,784,0,743,611,798,615,604,631,1105,1124,"Cardassian, Undercover Operative, Scoundrel, Interrogator, Civilian","nonhuman, male, organic, ds9, garak, crew_max_rarity_3","Cutting Cloth",1, 5, 8, 12, 12, , , , , , 125, 230, 20, 405, false,"Garak",crew_portraits_cm_garaktailor_sm.png,garak_tailor_crew
"Bartender Quark",9,1, 110,25,77,0,0,0,81,15,57,0,0,0,211,36,150,0,0,0,1058,993,1005,988,929,1058,0,1028,0,915,1043,870,1012,0,883,1035,935,975,840,901,1052,0,946,0,909,912,865,917,0,803,1231,1203,"Ferengi, Bartender, Civilian, Scoundrel, Gambler, Merchant","nonhuman, male, organic, ds9, quark, crew_max_rarity_1","Hospitality",1, 2, 8, 10, 12, , , , 2, 1, 165, 10, 10, 140, false,"Quark",crew_portraits_cm_quarkbartender_sm.png,quark_s1_bartender_crew
"Richard Castillo",4,3, 487,109,227,286,57,187,0,0,0,0,0,0,0,0,0,0,0,0,536,812,738,854,673,1003,696,996,612,0,0,0,0,0,0,343,719,627,778,574,848,575,864,511,0,0,0,0,0,0,1153,1108,"Human, Hero, Pilot, Starfleet, Federation, Displaced","male, organic, castillo, tng, crew_max_rarity_3","Self Sacrifice",0, 5, 12, 12, 10, 7, 0, , 1, 2, 650, 265, 129, 585, false,"Castillo",crew_portraits_cm_richardcastillo_sm.png,castillo_lieutenant_crew
"Writer Jake Sisko",10,3, 0,0,0,0,0,0,0,0,0,0,0,0,451,70,198,0,0,0,0,0,0,915,0,0,0,889,0,0,942,0,851,0,742,0,0,0,862,0,0,0,824,0,0,902,0,779,0,676,1229,1232,"Human, Federation, Civilian, Writer, Gambler, Romantic","male, organic, ds9, jake, crew_max_rarity_3","Construct Story",2, 3, 0, 8, 10, 6, 0, , , , 995, 350, 47, 640, true,"Jake",crew_portraits_cm_jakewriter_sm.png,jake_writer_crew
"CMO Crusher",3,2, 0,0,0,0,0,0,0,0,0,0,0,0,0,0,0,290,52,174,0,0,0,0,875,0,0,0,613,0,0,823,0,568,854,0,0,0,0,761,0,0,0,533,0,0,732,0,501,735,1252,1245,"Human, Starfleet, Federation, Physician, Caregiver, Cyberneticist","female, organic, tng, crusher, crew_max_rarity_2","Doctor's Calluses",2, 3, 6, 10, 10, , , , , , 185, , 35, 155, false,"Crusher",crew_portraits_cm_crusherwithlabcoat_sm.png,crusher_labcoat_crew
"Commando Crusher",1,3, 0,0,0,182,76,200,308,93,193,0,0,0,0,0,0,510,44,132,1024,924,0,0,739,659,708,1021,354,835,1013,403,0,483,730,786,786,0,0,834,334,519,819,316,676,869,384,0,548,816,1097,1018,"Human, Starfleet, Federation, Physician, Cyberneticist, Undercover Operative","female, organic, tng, crusher, crew_max_rarity_3","Repel Disease",0, 3, 6, 3, 12, 1, 0, , , , 575, , 370, 500, false,"Crusher",crew_portraits_cm_crusherblackcommandouniform_sm.png,crusher_black_commando_uniform_crew
"Dr. Crusher",10,4, 275,38,110,0,0,0,437,90,201,0,0,0,0,0,0,736,123,300,1012,652,955,1032,207,865,0,0,347,757,940,139,0,308,491,1003,593,935,1020,255,742,0,0,332,669,859,139,0,283,481,985,919,"Human, Starfleet, Federation, Physician, Cyberneticist","female, organic, tng, crusher, crew_max_rarity_4","Neutralize Disease",1, 7, 12, 12, 12, 4, 4, , , , 740, 250, 370, 500, false,"Crusher",crew_portraits_cm_crusherfromfirstcontact_sm.png,crusher_first_contact_crew
"Holonovel Doctor",9,4, 0,0,0,512,50,137,0,0,0,0,0,0,0,0,0,799,69,244,858,0,0,0,450,852,577,869,126,0,0,446,0,304,489,958,0,0,0,618,952,643,947,273,0,0,610,0,405,608,1077,1139,"Hologram, Human, Federation, Starfleet, Physician, Musician, Scoundrel","nonhuman, male, artificial_life, voy, emh, crew_max_rarity_4","Suggested Treatment",0, 7, 12, 12, 12, , , , , , 365, 370, 205, 525, false,"Doctor",crew_portraits_cm_doctorgolfclub_sm.png,emh_authorauthor_crew
"Mobile Doctor",10,5, 0,0,0,809,106,209,0,0,0,0,0,0,393,137,435,1191,110,334,580,0,0,839,167,567,410,185,29,0,861,181,734,121,52,723,0,0,512,427,708,466,122,114,0,506,429,312,267,62,491,378,"Hologram, Human, Federation, Starfleet, Musician, Physician","nonhuman, male, artificial_life, voy, emh, crew_max_rarity_5","House Call",2, 9, 12, 12, 12, , , , , , 1825, 600, , 600, false,"Doctor",crew_portraits_cm_emhmobile_sm.png,emh_mobileholoemitter_crew
"Comm Officer Uhura",10,1, 0,0,0,0,0,0,0,0,0,0,0,0,258,28,89,0,0,0,0,0,0,1048,0,0,0,1020,0,0,1067,0,1003,0,874,0,0,0,1048,0,0,0,1019,0,0,1069,0,998,0,867,1258,1262,"Federation, Starfleet, Human, Musician, Communicator","female, organic, tos, uhura, crew_max_rarity_1","Incoming Message",2, 2, 8, 10, 12, , , , 1, 1, 320, , , 495, false,"Uhura",crew_portraits_cm_uhurared_sm.png,uhura_red_crew
"Commander Uhura",9,4, 459,128,299,0,0,0,0,0,0,0,0,0,592,198,429,0,0,0,775,797,723,366,652,0,0,648,0,0,743,0,599,0,501,549,616,475,118,446,0,0,309,0,0,423,0,232,0,238,1076,721,"Federation, Starfleet, Human, Musician, Communicator","female, organic, tos, uhura, crew_max_rarity_4","Hailing Frequencies",0, 8, 12, 26, 12, , , 1, , , 1165, , 75, 790, false,"Uhura",crew_portraits_cm_uhurawrathofkhan_sm.png,uhura_wrathofkhan_crew
"Dancing Uhura",9,5, 1026,84,195,0,0,0,0,0,0,0,0,0,1185,193,393,0,0,0,452,542,408,68,338,0,0,307,0,0,410,0,233,0,230,780,800,738,224,673,0,0,358,0,0,487,0,290,0,286,571,921,"Human, Federation, Starfleet, Communicator, Casual, Musician, Artist","female, organic, tos, uhura, original, crew_max_rarity_5","Take The Lead",0, 8, 10, 3, 14, 1, 1, , , , 465, 260, 60, 400, false,"Uhura",crew_portraits_cm_uhura_dancing_sm.png,uhura_dancing_crew
"First Maje Culluh",5,3, 466,93,223,0,0,0,307,42,138,0,0,0,0,0,0,0,0,0,840,622,778,897,717,1007,0,0,0,873,1050,825,0,0,0,719,526,663,798,609,956,0,0,0,831,1019,791,0,0,0,1163,1136,"Kazon, Scoundrel","nonhuman, male, organic, voy, culluh, crew_max_rarity_3","Nistrim Supremacy",2, 3, 6, 10, 10, 8, 4, , , , 665, 325, 133, 390, false,"Culluh",crew_portraits_cm_jalculluh_sm.png,culluh_crew
"KDF Alexander",6,2, 137,19,79,0,0,0,331,64,148,145,16,72,0,0,0,0,0,0,1055,835,952,1082,928,975,731,0,0,724,1023,793,1039,604,0,1037,757,889,1065,904,896,727,0,0,657,987,747,1027,598,0,1199,1190,"Human, Klingon","male, organic, ds9, alexander, nonhuman, crew_max_rarity_2","Beginner's Luck",1, 3, 10, 12, 10, 5, 2, , , , 130, 200, 62, 15, false,"Alexander",crew_portraits_cm_alexanderkdf_sm.png,alexander_kdf_crew
"Commando Shran",9,4, 673,114,239,0,0,0,592,89,182,0,0,0,318,144,282,0,0,0,626,341,558,473,490,695,0,909,0,624,490,565,881,0,762,655,399,587,287,537,780,0,607,0,694,329,663,520,0,479,892,718,"Andorian, Tactician, Inspiring, Imperial Guard","nonhuman, male, organic, ent, shran, crew_max_rarity_4","Debt Owed",0, 8, 6, 8, 10, , , 3, , , 390, 575, 288, 350, false,"Shran",crew_portraits_cm_shrancommando_sm.png,shran_commando_crew
"Ushaan Shran",10,5, 989,83,164,0,0,0,1076,170,348,0,0,0,424,134,288,0,0,0,498,104,447,301,370,290,0,822,0,266,142,199,788,0,674,841,280,793,391,720,387,0,613,0,358,143,308,529,0,483,483,550,"Andorian, Duelist, Romantic, Imperial Guard","nonhuman, male, organic, ent, shran, crew_max_rarity_5","Debt Owed",0, 9, 6, 8, 10, , , 3, , , 1440, 565, 483, 390, false,"Shran",crew_portraits_cm_shrandueling_sm.png,shran_dueling_crew
"Fencing Sulu",9,4, 444,99,249,385,36,92,609,203,448,0,0,0,0,0,0,0,0,0,529,355,788,903,728,272,667,967,594,518,734,451,0,0,0,476,137,601,759,552,128,704,1007,628,205,376,170,0,0,0,940,614,"Human, Federation, Starfleet, Pilot, Resourceful, Duelist","male, organic, tos, sulu, crew_max_rarity_4","Parry Attack",0, 6, 12, 8, 12, 6, 4, , , , 415, , 225, 225, false,"Sulu",crew_portraits_cm_sulufencing_sm.png,sulu_fencing_crew
"Morn",7,3, 0,0,0,0,0,0,359,70,174,0,0,0,418,121,295,0,0,0,0,899,0,880,0,940,0,836,0,811,635,765,802,0,688,0,836,0,685,0,838,0,619,0,727,378,701,540,0,492,1137,1064,"Lurian, Courier, Duelist, Civilian, Gambler, Smuggler","nonhuman, male, organic, ds9, morn, crew_max_rarity_3","Drinking Spot",0, 3, 0, 8, 8, , , , 1, 2, 150, 285, 57, 655, true,"Morn",crew_portraits_cm_morn_sm.png,morn_crew
"Seven in Blue",3,2, 0,0,0,294,51,209,0,0,0,278,53,130,0,0,0,0,0,0,992,0,953,0,0,994,457,986,605,884,0,0,987,575,0,818,0,897,0,0,816,354,839,490,834,0,0,925,544,0,1206,1170,"Human, Borg, Civilian, Federation","nonhuman, female, organic, voy, seven, crew_max_rarity_2","Ignore Irrelevancies",1, 2, 8, 10, 14, 4, 0, , , , 75, 50, 310, 170, false,"Seven",crew_portraits_cm_seven_of_nine_sm.png,seven_allblue_crew
"Seven of Nine",7,5, 0,0,0,785,247,791,0,0,0,854,225,454,514,89,183,0,0,0,307,0,383,847,0,308,44,104,199,382,877,0,77,203,639,42,0,171,857,0,40,3,12,39,204,896,0,55,81,673,472,30,"Human, Borg, Civilian, Federation","nonhuman, female, organic, voy, seven, crew_max_rarity_5","New Collective",2, 7, 12, 10, 14, 4, 0, , , , 1750, , 705, 440, false,"Seven",crew_portraits_cm_sevenbluegreyshoulders_sm.png,seven_bluegreyshoulders_crew
"Donik",6,3, 0,0,0,0,0,0,0,0,0,476,79,199,303,31,79,0,0,0,0,0,798,1028,0,0,578,1004,0,747,1055,0,577,479,861,0,0,750,1055,0,0,523,1025,0,699,1075,0,590,452,873,1176,1196,"Hirogen, Innovator","nonhuman, male, organic, voy, donik, crew_max_rarity_3","Hunting Program",2, 4, 12, 12, 10, 7, 0, , , , 870, 165, , 340, false,"Donik",crew_portraits_cm_donik_sm.png,donik_crew
"Commander Tucker",8,2, 252,28,82,0,0,0,0,0,0,305,53,185,0,0,0,0,0,0,1033,980,671,1054,899,0,691,0,0,865,0,0,973,562,0,1031,978,616,1056,898,0,585,0,0,755,0,0,839,492,0,1220,1211,"Human, Starfleet, Jury Rigger, Pilot, Explorer","male, organic, ent, tucker, crew_max_rarity_2","Warp Engines Online",1, 2, 6, 3, 8, 2, 0, , , , 520, 35, 50, 165, false,"Trip",crew_portraits_cm_tucker_sm.png,tucker_commander_crew
"Counselor Troi",9,1, 0,0,0,0,0,0,0,0,0,0,0,0,261,42,108,147,49,131,0,0,0,1035,922,0,0,1010,643,0,1059,859,993,598,751,0,0,0,1019,830,0,0,991,593,0,1049,792,961,545,589,1233,1219,"Federation, Starfleet, Human, Betazoid, Empath, Counselor","nonhuman, female, organic, tng, troi, crew_max_rarity_1","Counselling",2, 1, 6, 10, 10, , , , , , 265, , 80, 345, false,"Troi",crew_portraits_cm_troitng_sm.png,troi_casualgray_crew
"Rakal Troi",5,4, 521,163,354,0,0,0,525,128,331,0,0,0,0,0,0,407,163,440,681,370,623,775,150,673,0,0,441,606,803,168,0,409,602,410,147,330,552,15,471,0,0,200,423,614,21,0,127,267,814,151,"Federation, Starfleet, Human, Betazoid, Romulan, Empath, Undercover Operative, Tal Shiar","nonhuman, female, organic, tng, troi, crew_max_rarity_4","Romulan Disguise",1, 7, 12, 10, 14, 1, 2, , , , 90, 400, 175, 2825, false,"Troi",crew_portraits_cm_troirakal_sm.png,troi_rakal_crew
"Commander Troi",10,5, 0,0,0,0,0,0,383,203,253,0,0,0,1060,211,421,827,142,281,0,844,0,468,404,841,0,348,320,736,139,65,274,264,31,0,566,0,444,455,478,0,306,333,429,75,72,229,284,51,498,190,"Federation, Starfleet, Human, Betazoid, Empath, Counselor","nonhuman, female, organic, tng, troi, crew_max_rarity_5","Empathic Sense",1, 8, 6, 6, 6, , , , , , 1375, 475, 135, 725, true,"Troi",crew_portraits_cm_troifirstcontact_sm.png,troi_firstcontact_crew
"Vedek Winn Adami",5,3, 307,97,207,0,0,0,0,0,0,0,0,0,410,92,214,0,0,0,954,925,892,681,827,0,0,904,0,0,952,0,871,0,753,740,768,693,468,633,0,0,778,0,0,845,0,724,0,621,1164,1096,"Bajoran, Vedek, Cultural Figure, Spiritual","nonhuman, female, organic, ds9, winn, crew_max_rarity_3","Will of the Prophets",1, 4, 8, 10, 10, 4, 0, , , , , 270, 85, 830, false,"Winn",crew_portraits_cm_winnvedek_sm.png,winn_vedek_crew
"Subcommander T'Pol",4,3, 273,71,211,520,21,77,165,35,77,0,0,0,0,0,0,0,0,0,571,826,939,1020,872,628,602,902,543,908,1085,861,0,0,0,612,651,733,847,668,908,722,1035,641,885,1072,841,0,0,0,1127,1140,"Vulcan, High Command, Astrophysicist, Telepath","nonhuman, female, organic, ent, tpol, crew_max_rarity_3","Logic",2, 5, 6, 10, 10, , , , , , 175, 120, 3, 100, false,"T'Pol",crew_portraits_cm_tpol_sm.png,tpol_subcommander_crew
"Commander T'Pol",9,4, 512,112,307,692,56,171,320,91,227,0,0,0,0,0,0,0,0,0,222,506,678,818,610,312,441,682,381,816,992,768,0,0,0,254,304,487,676,458,360,593,887,534,622,813,591,0,0,0,939,827,"Vulcan, Starfleet, Astrophysicist, Telepath","nonhuman, female, organic, ent, tpol, crew_max_rarity_4","Vessel's Information",0, 5, 12, 12, 20, 2, 0, , , , 1400, 200, 70, 1175, false,"T'Pol",crew_portraits_cm_tpolcommander_sm.png,tpol_commander_crew
"Chef Neelix",10,1, 0,0,0,0,0,0,0,0,0,0,0,0,201,51,189,0,0,0,0,0,0,1046,0,0,0,1018,0,0,1065,0,1001,0,873,0,0,0,901,0,0,0,870,0,0,947,0,828,0,717,1257,1240,"Talaxian, Mylean, Resourceful, Survivalist, Chef, Civilian, Communicator","nonhuman, male, organic, voy, neelix, crew_max_rarity_1","Soup's On",1, 2, 12, 14, 10, 6, 0, , 2, 1, 305, , , 210, false,"Neelix",crew_portraits_cm_neelix_sm.png,neelix_chef_crew
"CMO 'Bones' McCoy",9,1, 0,0,0,0,0,0,0,0,0,0,0,0,0,0,0,213,48,196,0,0,0,0,885,0,0,0,624,0,0,840,0,580,871,0,0,0,0,727,0,0,0,512,0,0,705,0,484,711,1255,1238,"Human, Federation, Starfleet, Physician, Exobiology","male, organic, tos, mccoy, crew_max_rarity_1","Country Doctor",2, 3, 8, 10, 12, , , , 0, 2, 245, 10, 8, 285, false,"McCoy",crew_portraits_cm_mccoy_sm.png,mccoy_chief_medical_officer_crew
"Prisoner 'Bones' McCoy",5,3, 0,0,0,0,0,0,0,0,0,0,0,0,271,112,252,444,90,278,0,0,0,999,700,0,0,966,505,0,1015,673,948,460,427,0,0,0,743,526,0,0,690,376,0,773,524,619,334,161,1146,1027,"Federation, Starfleet, Physician, Survivalist, Human, Desperate, Prisoner","male, organic, tos, mccoy, crew_max_rarity_3","Field Medicine",1, 5, 4, 4, 8, 3, 0, 2, , , 235, , 48, 517, false,"McCoy",crew_portraits_cm_mccoyrura_sm.png,mccoy_rura_pethe_prisoner_crew
"Feezal Phlox",10,4, 0,0,0,736,121,286,0,0,0,524,86,167,367,87,175,0,0,0,590,0,745,948,0,575,180,329,349,713,978,0,446,450,781,579,0,794,872,0,548,187,266,342,728,910,0,388,482,688,903,883,"Denobulan, Quantum Mechanics, Civilian, Romantic","nonhuman, female, organic, ent, feezal, crew_max_rarity_4","Quantum Optics",2, 6, 12, 12, 12, 4, 0, , , , 940, , 250, , false,"Feezal",crew_portraits_cm_feezalphlox_sm.png,feezalphlox_crew
