"Polywater Yar",9,5, 1134,155,377,0,0,0,381,109,217,0,0,0,955,183,367,0,0,0,275,178,229,77,178,890,0,408,0,775,232,723,333,0,302,391,225,316,100,288,671,0,409,0,610,184,576,339,0,323,449,277,"Human, Federation, Starfleet, Romantic, Desperate, Survivalist","female, organic, tng, yar, crew_max_rarity_5","You Are Fully Functional, Aren't You?",0, 9, 2, 8, 12, 1, 0, , 1, 2, 335, 100, 70, 550, true,"Yar",crew_portraits_cm_yar_intoxicated_sm.png,yar_intoxicated_crew
"Gary Seven",2,5, 361,187,380,1275,217,685,737,333,712,0,0,0,0,0,0,0,0,0,43,191,753,871,690,1,129,160,84,288,489,216,0,0,0,6,9,282,513,257,1,79,112,73,30,86,23,0,0,0,23,5,"Human, Hero, Resourceful, Undercover Operative","organic, male, tos, gary_seven, crew_max_rarity_5","Interesting Experiences",1, 7, 15, 8, 10, 0, 1, , , , 375, 200, 200, 300, false,"Mr. Seven",crew_portraits_cm_gary_seven_sm.png,gary_seven_crew
"Reverend Phlox",7,5, 984,145,314,0,0,0,0,0,0,0,0,0,598,53,111,1058,236,615,392,495,334,207,7,0,0,764,158,0,855,159,720,99,44,505,573,420,451,6,0,0,980,87,0,1038,79,947,28,63,274,221,"Denobulan, Civilian, Physician, Exobiology","male, organic, nonhuman, ent, phlox, crew_max_rarity_5","Rest In Peace",1, 10, 6, 10, 12, , , , , , 200, 205, 170, 100, false,"Phlox",crew_portraits_cm_phlox_reverend_sm.png,phlox_reverend_crew
"Yelgrun",8,4, 572,101,216,405,85,247,0,0,0,0,0,0,638,203,466,0,0,0,309,755,668,312,603,883,604,283,544,0,729,0,574,0,484,251,749,660,157,607,679,448,77,413,0,374,0,188,0,204,780,392,"Dominion, Vorta, Clone, Diplomat, Musician","male, organic, ds9, yelgrun, nonhuman, crew_max_rarity_4","I Was Cloned",1, 5, 3, 6, 6, , , , , , 400, 265, 98, 275, true,"Yelgrun",crew_portraits_cm_yelgrun_sm.png,yelgrun_crew
"Alternate Future T'Pol",8,5, 1119,260,585,943,153,343,0,0,0,0,0,0,485,92,188,0,0,0,24,374,176,148,127,407,304,146,249,0,908,0,799,0,685,8,235,68,80,63,435,306,176,277,0,885,0,764,0,665,313,135,"Vulcan, Starfleet, Astrophysicist, Telepath","nonhuman, female, organic, ent, tpol, crew_max_rarity_5","You'll Never Fully Recover",1, 7, 10, 6, 12, 6, 0, , , , 600, 105, 120, 175, false,"T'Pol",crew_portraits_cm_tpol_alternate_future_sm.png,tpol_alternate_future_crew
"Ikat'ika",8,4, 656,53,124,0,0,0,758,199,388,0,0,0,0,0,0,0,0,0,709,245,648,802,587,526,0,0,0,467,677,398,0,0,0,968,279,899,993,833,297,0,0,0,265,467,226,0,0,0,1016,997,"Jem'hadar, Dominion, Brutal, Veteran","nonhuman, male, organic, ds9, ikatika, crew_max_rarity_4","Victory is Life!",2, 9, 5, 8, 12, 5, 0, , , , 495, 105, 175, 575, false,"Ikat'ika",crew_portraits_cm_ikatika_sm.png,ikatika_crew
"Changeling Martok",7,5, 506,78,158,0,0,0,877,218,453,0,0,0,1062,249,546,0,0,0,835,215,774,166,712,358,0,320,0,323,38,248,253,0,239,866,184,818,128,741,208,0,157,0,188,7,157,102,0,129,349,91,"Klingon, Changeling, Veteran, Undercover Operative, Brutal, Dominion","nonhuman, male, organic, ds9, martok, crew_max_rarity_5","Sohk-vad",0, 9, 6, 6, 12, 7, 2, , , , 650, 15, 220, 250, false,"Martok",crew_portraits_cm_martok_changeling_sm.png,martok_changeling_crew
"Fleet Commander Martok",5,2, 296,64,200,0,0,0,270,38,135,0,0,0,148,29,71,0,0,0,991,707,925,890,858,1018,0,1054,0,885,955,836,1035,0,903,807,601,763,741,695,965,0,1033,0,836,892,794,1012,0,882,1173,1123,"Klingon, Duelist, Veteran","nonhuman, male, organic, ds9, martok, crew_max_rarity_2","Surprise Attack!",0, 3, 8, 8, 12, 0, 2, , , , 340, 140, 70, 125, false,"Martok",crew_portraits_cm_martok_fleet_commander_sm.png,martok_commander_crew
"Mirror Keiko",7,4, 670,212,435,567,92,234,0,0,0,0,0,0,385,76,146,0,0,0,133,636,510,432,439,705,490,415,424,0,980,0,894,0,784,61,379,184,219,166,689,455,412,419,0,973,0,863,0,744,829,551,"Human, Botanist, Saboteur, Undercover Operative, Mirror Universe, Terran Rebellion","female, organic, ds9, keiko, original, crew_max_rarity_4","Terrible Beauty",2, 7, 10, 10, 10, 4, 2, , , , 450, 230, 275, 125, false,"Keiko",crew_portraits_cm_keiko_mirror_sm.png,keiko_mirror_crew
"Professor Sato",5,5, 950,93,201,431,101,209,0,0,0,0,0,0,1517,61,123,0,0,0,137,585,458,52,378,874,594,72,535,0,288,0,114,0,119,307,782,710,602,650,718,473,487,438,0,1021,0,919,0,806,351,990,"Human, Civilian, Starfleet, Prodigy, Communicator, Linguist","female, organic, ent, sato, crew_max_rarity_5","Turn It Up",2, 10, 8, 8, 10, , , 2, , , 415, 300, 45, 280, false,"Sato",crew_portraits_cm_sato_professor_sm.png,sato_professor_crew
"EV Suit Burnham",7,5, 1324,89,299,369,115,391,877,169,472,0,0,0,0,0,0,0,0,0,64,64,189,414,140,76,569,853,513,346,549,275,0,0,0,80,122,531,712,495,26,302,472,269,216,390,178,0,0,0,330,170,"Federation, Starfleet, Astrophysicist, Human, Xenoanthropology, Resourceful, Duelist","female, evsuit, organic, dsc, burnham, crew_max_rarity_5","Vulcan Hello",2, 7, 10, 10, 14, 6, 0, , , , 575, , 295, 100, false,"Burnham",crew_portraits_cm_burnham_evsuit_sm.png,dsc_burnham_ev_suit_crew
"Army Chaplain Odo",6,4, 342,69,173,0,0,0,628,77,162,0,0,0,764,172,363,0,0,0,947,480,883,421,819,678,0,596,0,608,230,545,531,0,451,850,541,801,292,725,847,0,430,0,734,251,704,358,0,340,793,764,"Changeling, Spiritual, Bajoran, Communicator, Constable, Undercover Operative","nonhuman, male, organic, ds9, odo, original, crew_max_rarity_4","Mysterious Ways",1, 6, 8, 8, 8, 3, 0, 3, , , 625, 105, 10, 440, false,"Odo",crew_portraits_cm_odo_chaplain_sm.png,odo_chaplain_crew
"Dr. Leonard McCoy",9,4, 0,0,0,562,96,254,0,0,0,0,0,0,0,0,0,746,141,392,712,0,0,0,418,696,486,729,80,0,0,426,0,278,473,667,0,0,0,291,642,427,709,78,0,0,305,0,184,347,1032,912,"Human, Federation, Starfleet, Physician, Resourceful","male, organic, tos, mccoy, exclusive_voyage, crew_max_rarity_4","He's Dead, Jim",0, 4, 8, 10, 14, 4, 0, , , , 440, 60, 130, 1355, false,"McCoy",crew_portraits_cm_mccoy_leonard_sm.png,mccoy_leonard_crew
"Ensign Picard",7,4, 849,81,201,0,0,0,503,136,328,0,0,0,287,115,231,0,0,0,572,273,508,452,438,691,0,959,0,623,557,561,934,0,816,776,294,734,447,670,464,0,723,0,416,220,375,651,0,573,853,663,"Federation, Starfleet, Human, Desperate, Crafty, Displaced","male, organic, tng, picard, exclusive_voyage, crew_max_rarity_4","Life Worth Living",1, 6, 12, 12, 12, 7, 0, , , , 580, 85, 20, 505, false,"Picard",crew_portraits_cm_ensign_picard_sm.png,picard_ensign_crew
"Elizabeth Dehner",10,5, 0,0,0,441,145,345,0,0,0,0,0,0,886,54,106,1152,158,446,760,0,0,691,159,750,518,176,46,0,727,171,571,109,30,463,0,0,1007,211,449,315,287,32,0,1041,223,950,125,146,473,474,"Human, Starfleet, Federation, Physician, Telekinetic","female, organic, tos, dehner, crew_max_rarity_5","Almost a God",2, 6, 12, 12, 20, 2, 0, , , , 400, , 110, 350, false,"Dehner",crew_portraits_cm_elizabeth_dehner_sm.png,dehner_elizabeth_crew
"Astrosciences Sulu",9,5, 969,84,207,1014,271,623,0,0,0,0,0,0,423,72,136,0,0,0,32,578,446,329,369,259,224,100,164,0,962,0,880,0,760,17,787,715,578,654,88,80,43,75,0,1002,0,886,0,770,481,301,"Human, Federation, Starfleet, Pilot, Resourceful, Astrophysicist","male, organic, tos, sulu, crew_max_rarity_5","Astrosciences Standing By",0, 7, 12, 12, 12, 4, 0, , , , 490, 80, 100, 340, false,"Sulu",crew_portraits_cm_sulu_astrosciences_sm.png,sulu_astrosciences_crew
"Commanding Officer Sisko",1,3, 433,11,23,0,0,0,487,28,78,0,0,0,234,12,34,0,0,0,963,631,899,820,835,891,0,1040,0,776,773,724,1024,0,894,1058,964,1004,1077,931,1031,0,1053,0,890,1046,845,1040,0,904,1120,1252,"Human, Federation, Starfleet, Bajoran, Cultural Figure, Inspiring, Chef","male, organic, ds9, sisko, exclusive_achievement, crew_max_rarity_3","Surprise for the Dominion",2, 5, 3, 8, 11, , , , , , 215, 85, 135, 100, false,"Sisko",crew_portraits_cm_sisko_sm.png,sisko_captain_crew
"Age of Sail Data",7,5, 1171,186,446,0,0,0,0,0,0,844,125,269,527,127,243,0,0,0,246,389,24,137,149,0,393,744,0,484,836,0,88,273,593,268,396,30,141,180,0,394,683,0,533,766,0,129,317,545,432,303,"Android, Federation, Starfleet, Cyberneticist, Costumed, Explorer, Musician","ageofsail, nonhuman, male, tng, artificial_life, data, crew_max_rarity_5","Fun? Got it!",1, 8, 8, 5, 11, 1, 1, , , , 125, 200, 70, 500, false,"Data",crew_portraits_cm_data_ageofsail_sm.png,data_ageofsail_crew
"Commander Donatra",4,4, 580,238,631,0,0,0,434,191,463,0,0,0,318,60,178,0,0,0,564,258,498,453,429,668,0,978,0,604,555,540,960,0,839,91,15,59,87,53,225,0,873,0,202,167,168,833,0,719,838,70,"Romulan, Veteran, Crafty, Tactician, Resourceful","nonhuman, female, organic, donatra, tng, crew_max_rarity_4","Let's Get To Work",0, 5, 3, 6, 6, , , , , , 450, 200, 143, 450, true,"Donatra",crew_portraits_cm_donatra_commander_sm.png,donatra_commander_crew
"Maid Marian",9,5, 0,0,0,0,0,0,904,152,302,0,0,0,1193,172,338,0,0,0,0,551,0,443,0,455,0,322,0,410,51,341,255,0,241,0,569,0,566,0,481,0,463,0,432,131,394,389,0,359,586,828,"Human, Scoundrel, Costumed, Exoarchaeology, Smuggler, Civilian, Prisoner","female, organic, tng, vash, crew_max_rarity_5","Can't Change Who I Am",0, 7, 6, 8, 14, 7, 2, , , , 350, 305, 88, 705, false,"Vash",crew_portraits_cm_vash_qpid_sm.png,vash_qpid_crew
"Tyler, Son of None",9,5, 489,58,198,0,0,0,1129,218,428,0,0,0,1009,171,229,0,0,0,851,153,789,243,729,252,0,426,0,234,39,165,350,0,317,825,188,783,407,710,234,0,643,0,211,90,174,570,0,515,359,389,"Human, Klingon, Federation, Starfleet, Gambler, Desperate, Tactician, Survivalist","male, organic, dsc, tyler, voq, crew_max_rarity_5","War Within",1, 7, 12, 10, 14, 8, 4, , , , 500, 25, 128, 690, false,"Tyler",crew_portraits_cm_voq_as_ash_sm.png,dsc_tyler_voq_crew
"The Prophet",8,5, 388,148,324,0,0,0,995,127,251,0,0,0,1230,146,294,0,0,0,844,238,781,167,719,395,0,321,0,353,44,287,254,0,240,486,228,404,189,378,581,0,582,0,532,218,499,502,0,453,384,407,"Vulcan, Mirror Universe, Desperate, Terran Rebellion, Telepath, Interrogator","nonhuman, male, organic, sarek, dsc, crew_max_rarity_5","My Mind to Your Mind",1, 5, 0, 8, 8, , , , , , 375, 255, 68, 675, true,"Sarek",crew_portraits_cm_sarek_mirror_sm.png,dsc_sarek_mirror_crew
"EV Suit Seven of Nine",8,5, 489,108,272,950,307,664,800,149,338,0,0,0,0,0,0,0,0,0,65,270,716,841,643,22,230,331,176,473,682,404,0,0,0,7,216,542,721,504,11,55,88,52,396,590,347,0,0,0,452,59,"Borg, Human, Starfleet, Federation, Hunter, Astrophysicist","evsuit, female, nonhuman, organic, voy, seven, crew_max_rarity_5","This Lesson Is Terminated",2, 10, 10, 10, 12, , , , 1, 1, 565, 200, 195, 100, false,"Seven",crew_portraits_cm_seven_of_nine_ev_sm.png,seven_ev_suit_crew
"Tucker On-The-Ropes",9,5, 363,84,170,0,0,0,962,134,270,1179,197,429,0,0,0,0,0,0,919,289,52,958,788,422,221,0,0,30,581,313,248,106,0,833,363,62,884,716,540,216,0,0,42,712,466,247,112,0,464,435,"Human, Starfleet, Jury Rigger, Athlete, Gambler, Desperate","male, organic, ent, tucker, original, crew_max_rarity_5","Rope-a-Dope",0, 7, 12, 10, 14, 4, 0, , , , 650, 305, 110, 375, false,"Trip",crew_portraits_cm_tucker_ropes_sm.png,tucker_boxing_crew
"Pugilist Q",5,4, 362,96,190,0,0,0,788,139,291,0,0,0,547,97,202,0,0,0,905,380,841,558,774,553,0,751,0,493,255,425,711,0,603,773,322,729,490,666,519,0,789,0,469,287,434,736,0,635,827,758,"Desperate, Crafty, Scoundrel, Athlete, Duelist, Costumed, Q Continuum","nonhuman, male, ds9, q_jdl, crew_max_rarity_4","Wonderfully Barbaric",0, 6, 6, 8, 10, 0, 1, , , , 450, 125, 50, 305, false,"Q",crew_portraits_cm_pugilist_q_sm.png,q_boxing_crew
"Mugato",9,5, 823,189,405,0,0,0,1033,224,688,0,0,0,436,122,226,0,0,0,494,87,445,308,368,234,0,865,0,210,116,149,827,0,715,321,16,244,176,222,71,0,719,0,70,39,55,648,0,570,429,47,"Mugato, Brutal, Hunter, Primal","nonhuman, organic, male, tos, mugato, crew_max_rarity_5","Private Little War",2, 7, 4, 5, 10, 7, 0, , , , 465, 325, 63, 500, true,"Mugato",crew_portraits_cm_mugato_sm.png,mugato_crew
"Gloria",6,5, 879,205,396,0,0,0,0,0,0,0,0,0,1065,278,536,470,99,221,441,534,393,69,37,0,0,311,502,0,418,669,243,457,50,306,430,231,20,44,0,0,146,424,0,229,598,90,391,40,388,79,"Communicator, Civilian, Counselor, Bartender, Empath, Costumed, El-Aurian","nonhuman, female, organic, tng, guinan, crew_max_rarity_5","Gloria From Cleveland",0, 7, 6, 12, 12, 0, 1, , , , 1540, 160, 110, 450, false,"Guinan",crew_portraits_cm_guinan_gloria_sm.png,guinan_gloria_crew
"Minuet",8,5, 911,162,353,0,0,0,0,0,0,0,0,0,952,292,766,0,0,0,453,543,409,72,339,0,0,310,0,0,417,0,240,0,234,417,511,338,11,307,0,0,56,0,0,95,0,34,0,50,575,160,"Hologram, Saboteur, Communicator, Resourceful, Human, Romantic, Desperate, Crafty","female, nonhuman, artificial_life, minuet, tng, crew_max_rarity_5","As Real As You Need",1, 9, 4, 8, 8, 3, 0, , , , 550, 225, 100, 390, true,"Minuet",crew_portraits_cm_minuet_sm.png,minuet_crew
"Lady Beverly",7,4, 350,91,152,0,0,0,0,0,0,0,0,0,787,168,267,595,90,167,938,911,875,434,300,0,0,616,428,0,712,574,554,398,98,852,842,803,378,333,0,0,591,493,0,678,690,509,469,187,837,861,"Human, Caregiver, Hologram, Romantic","female, organic, tng, crusher, crew_max_rarity_4","Manners, Manners!",2, 8, 10, 6, 10, , , , , , 500, 200, 180, 425, false,"Crusher",crew_portraits_cm_lady_beverly_sm.png,crusher_lady_crew
"Tuxedo Nog",6,5, 966,153,284,0,0,0,0,0,0,481,65,198,1098,260,551,0,0,0,429,527,85,63,319,0,581,300,0,749,399,0,48,482,225,534,605,155,48,430,0,545,150,0,713,232,0,33,467,116,377,200,"Ferengi, Costumed, Federation, Starfleet, Inspiring, Hero, Desperate, Veteran","nonhuman, male, organic, ds9, nog, crew_max_rarity_5","Welcome To Las Vegas",1, 8, 8, 8, 10, 0, 1, , , , 540, 255, 210, 325, false,"Nog",crew_portraits_cm_nog_nines_sm.png,nog_tuxedo_crew
"Tarquin",9,4, 420,184,409,377,40,126,0,0,0,0,0,0,823,119,244,0,0,0,440,768,682,307,614,961,657,312,586,0,711,0,553,0,472,156,436,247,170,224,985,671,442,606,0,774,0,620,0,550,854,631,"Telepath, Desperate, Resourceful, Communicator","organic, male, ent, nonhuman, tarquin, crew_max_rarity_4","Exile",1, 7, 8, 10, 12, 5, 0, , , , 580, 250, 110, 540, false,"Tarquin",crew_portraits_cm_tarquins_species_sm.png,tarquin_crew
"Losira",10,2, 256,23,88,0,0,0,313,68,187,155,11,29,0,0,0,0,0,0,1031,733,857,1051,896,973,734,0,0,732,1020,789,1043,606,0,1030,678,931,1053,896,817,733,0,0,663,913,686,1043,605,0,1186,1184,"Hologram, Kalandan, Brutal","nonhuman, artificial_life, female, tos, losira, crew_max_rarity_2","I Am For You",0, 2, 8, 10, 10, 4, 0, , , , 300, 200, 100, 375, false,"Losira",crew_portraits_cm_losira_sm.png,losira_crew
"Commander Barclay",8,4, 748,130,322,357,65,143,0,0,0,604,82,271,0,0,0,0,0,0,259,642,88,694,449,960,272,955,585,599,0,0,657,378,0,236,585,98,636,411,918,272,916,554,590,0,0,646,359,0,843,785,"Starfleet, Innovator, Communicator, Quantum Mechanics, Human, Federation","male, organic, voy, commander, barclay, crew_max_rarity_4","To The Journey",1, 6, 4, 8, 10, 2, 0, , , , 465, 200, 210, 375, true,"Barclay",crew_portraits_cm_barclay_commander_sm.png,barclay_commander_crew
"Data V",7,5, 0,0,0,976,142,307,0,0,0,1144,195,401,528,77,141,0,0,0,391,0,218,860,0,392,36,139,241,248,891,0,52,119,659,520,0,264,938,0,508,39,269,320,284,984,0,96,141,757,400,477,"Android, Federation, Starfleet, Cyberneticist, Musician, Costumed, Royalty","nonhuman, male, tng, artificial_life, data, crew_max_rarity_5","He Appears But A Man",1, 7, 6, 6, 6, , , , , , 590, 200, 60, 265, true,"Data",crew_portraits_cm_data_henry_sm.png,data_henry_crew
"Phlox, Au Naturel",7,5, 0,0,0,1173,186,510,0,0,0,454,83,279,0,0,0,884,160,398,224,0,770,0,332,223,64,294,24,727,0,327,812,29,368,211,0,589,0,262,198,38,238,15,578,0,276,634,21,317,350,143,"Denobulan, Civilian, Physician, Exobiology, Resourceful, Casual","male, organic, nonhuman, ent, phlox, crew_max_rarity_5","I'm A Physician, Not An Engineer!",1, 7, 12, 6, 12, 2, 0, 2, , , 515, 195, 140, 450, false,"Phlox",crew_portraits_cm_phlox_natural_sm.png,phlox_natural_crew
"Lt. Commander Jack Crusher",5,3, 486,91,207,335,24,78,0,0,0,0,0,0,0,0,0,0,0,0,551,831,761,879,696,1011,699,1000,618,0,0,0,0,0,0,589,777,703,825,642,1037,719,1031,639,0,0,0,0,0,0,1165,1191,"Starfleet, Federation, Hologram, Human, Romantic, Inspiring","male, organic, tng, jack, crew_max_rarity_3","Duty and Honor",0, 6, 8, 10, 16, , , , 1, 2, 550, 100, 125, 505, false,"Jack",crew_portraits_cm_jackcrusher_sm.png,jack_crusher_crew
"Wedding Day Quark",6,4, 584,104,246,0,0,0,278,83,181,0,0,0,661,228,469,0,0,0,702,536,640,295,582,1000,0,617,0,867,434,817,557,0,474,663,413,596,122,546,794,0,236,0,702,135,673,167,0,184,863,388,"Ferengi, Klingon, Scoundrel, Desperate, Romantic, Gambler","nonhuman, male, organic, ds9, quark, crew_max_rarity_4","Quark, Slayer of Klingons!",0, 7, 12, 10, 14, 4, 2, , , , 150, 75, 70, 575, false,"Quark",crew_portraits_cm_quark_wedding_day_sm.png,quark_wedding_day_crew
"Fennim",8,5, 0,0,0,817,251,462,0,0,0,0,0,0,1125,225,461,406,100,369,434,0,0,435,689,430,317,37,71,0,420,665,245,454,49,200,0,0,372,387,185,147,8,21,0,351,383,177,235,35,382,51,"Communicator, Scoundrel, Prodigy, Innovator, Thief","nonhuman, male, organic, voy, fennim, crew_max_rarity_5","We Are Already Proceeding",1, 7, 8, 8, 12, 6, 0, , , , 400, 100, 120, 415, false,"Fennim",crew_portraits_cm_fennim_sm.png,fennim_crew
"Lucille Davenport",8,5, 991,98,213,448,121,258,0,0,0,0,0,0,1179,219,430,0,0,0,120,561,425,66,353,817,550,85,490,0,397,0,222,0,220,216,760,675,165,619,590,400,66,363,0,399,0,207,0,218,376,365,"Starfleet, Federation, Costumed, Resourceful, Romantic, Human","female, organic, voy, janeway, exclusive_collection, crew_max_rarity_5","Walking On Your Grave",1, 10, 8, 10, 10, , , , , , 575, 200, 110, 300, false,"Janeway",crew_portraits_cm_janeway_davenport_sm.png,janeway_davenport_crew
"Captain Silva La Forge",10,5, 1059,259,606,0,0,0,408,149,309,0,0,0,1026,68,156,0,0,0,245,142,201,75,147,805,0,506,0,715,228,661,436,0,378,94,46,63,92,57,476,0,892,0,427,345,389,861,0,742,395,167,"Human, Federation, Starfleet, Explorer, Tactician","female, organic, tng, silva, crew_max_rarity_5","There's No Time To Explain",0, 8, 10, 8, 14, 8, 4, , , , 335, 100, 128, 450, false,"Silva",crew_portraits_cm_silva_captain_sm.png,silva_captain_crew
"Michael Sullivan",9,4, 0,0,0,0,0,0,0,0,0,0,0,0,505,146,319,743,167,351,0,0,0,803,427,0,0,727,335,0,826,432,688,287,97,0,0,0,616,304,0,0,531,260,0,621,320,444,194,70,1036,814,"Bartender, Hologram, Human, Communicator, Civilian, Romantic","nonhuman, artificial_life, male, sullivan_michael, voy, crew_max_rarity_4","An Optimist Are You?",0, 6, 8, 8, 12, 7, 0, , , , 565, 220, 163, 390, false,"Sullivan",crew_portraits_cm_sullivan_michael_sm.png,sullivan_michael_crew
"Mother Horta",6,4, 0,0,0,0,0,0,697,271,557,0,0,0,561,159,310,0,0,0,0,574,0,760,0,482,0,686,0,435,170,360,644,0,546,0,238,0,613,0,104,0,527,0,107,32,80,441,0,405,971,393,"Caregiver, Primal, Silicon Lifeform, Saboteur, Desperate","nonhuman, organic, tos, horta, crew_max_rarity_4","NO KILL I",0, 7, 8, 5, 14, 1, 0, , , , 670, 200, 100, 300, false,"Horta",crew_portraits_cm_horta_sm.png,horta_crew
"Musketeer Picard",7,5, 485,74,148,0,0,0,1111,248,540,0,0,0,815,231,455,0,0,0,867,144,805,297,742,224,0,498,0,203,42,143,425,0,369,894,129,840,191,767,117,0,247,0,125,6,95,178,0,189,390,92,"Hologram, Human, Duelist, Hero, Inspiring, Tactician","male, nonhuman, artificial_life, tng, picard, crew_max_rarity_5","En Garde",2, 7, 4, 6, 10, 5, 0, , , , 550, 200, 103, 365, true,"Picard",crew_portraits_cm_picard_musketeer_sm.png,picard_musketeer_crew
"Covert Operative Leland",6,5, 369,163,346,0,0,0,1061,279,572,0,0,0,880,209,376,0,0,0,845,143,782,276,721,235,0,478,0,212,43,151,401,0,355,424,36,343,91,312,96,0,360,0,97,11,74,294,0,289,368,31,"Section 31, Undercover Operative, Crafty, Resourceful, Human","male, organic, dsc, leland, crew_max_rarity_5","Welcome To Section 31",0, 8, 8, 5, 12, 1, 0, 2, , , 250, 230, 163, 390, false,"Leland",crew_portraits_cm_dsc_leland_sec31_sm.png,dsc_leland_sec31_crew
"H.M.S. Pinafore Data",8,5, 1022,101,247,440,98,198,0,0,0,1180,172,449,0,0,0,0,0,0,119,517,17,569,303,871,73,891,533,235,0,0,250,107,0,257,705,42,760,554,750,77,798,455,257,0,0,256,119,0,413,469,"Android, Starfleet, Federation, Cyberneticist, Resourceful, Musician","nonhuman, male, tng, artificial_life, data, crew_max_rarity_5","A British Tar",2, 8, 12, 10, 14, 4, 0, , , , 300, 200, 100, 325, false,"Data",crew_portraits_cm_data_insurrection_sm.png,data_insurrection_crew
"Commodore Robert April",9,5, 1099,233,504,0,0,0,447,125,261,0,0,0,866,185,377,0,0,0,252,148,209,80,161,800,0,505,0,708,225,655,435,0,377,166,95,121,34,109,571,0,390,0,521,139,492,325,0,314,407,104,"Veteran, Human, Starfleet, Maverick, Explorer","male, organic, april_robert, tas, crew_max_rarity_5","Into The Heart Of The Nova",0, 9, 10, 8, 10, , , , 2, 2, 450, 100, 80, 490, false,"April",crew_portraits_cm_april_commodore_sm.png,april_commodore_crew
"Lt. Commander Airiam",8,4, 586,102,207,738,168,356,0,0,0,0,0,0,399,37,71,0,0,0,125,747,656,565,593,559,405,324,336,0,1008,0,936,0,818,112,763,678,678,622,399,296,307,256,0,1078,0,1007,0,877,848,849,"Federation, Starfleet, Astrophysicist, Resourceful, Prodigy, Human, Engineered","female, organic, dsc, airiam, crew_max_rarity_4","Engaging Spore Drive",0, 8, 4, 8, 14, , , , 1, 2, 525, 105, 125, 490, false,"Airiam",crew_portraits_cm_dsc_airiam_ltcmdr_sm.png,dsc_airiam_ltcmdr_crew
"Joseph Sisko",9,5, 0,0,0,988,133,272,0,0,0,0,0,0,1006,317,644,0,0,0,408,0,0,425,0,403,302,33,246,0,411,0,234,0,231,581,0,0,168,0,551,378,10,345,0,138,0,49,0,76,564,331,"Human, Resourceful, Caregiver, Chef, Federation, Civilian, Communicator","male, organic, ds9, joseph, crew_max_rarity_5","Life Is Full Of Choices",1, 8, 8, 8, 8, 3, 0, 3, , , 425, 280, 118, 215, false,"Joseph",crew_portraits_cm_joseph_chef_sm.png,joseph_chef_crew
"Prince Bashir",6,5, 1018,267,646,0,0,0,0,0,0,0,0,0,923,175,328,492,78,193,251,394,208,71,19,0,0,474,503,0,578,671,396,458,89,75,189,50,19,8,0,0,478,477,0,584,671,398,456,142,399,106,"Human, Starfleet, Federation, Royalty, Costumed, Physician, Engineered","nonhuman, male, organic, ds9, bashir, original, crew_max_rarity_5","This Is Where Heroes Are Made",0, 8, 6, 6, 14, 7, 2, , , , 300, 225, 210, 350, false,"Bashir",crew_portraits_cm_bashir_prince_sm.png,bashir_prince_crew
"Captain Spock",7,5, 1058,253,578,1025,101,226,0,0,0,0,0,0,479,103,211,0,0,0,29,393,207,163,158,404,303,142,247,0,896,0,781,0,666,19,246,78,73,69,688,454,294,418,0,831,0,707,0,609,370,220,"Starfleet, Federation, Exobiology, Musician, Astrophysicist, Human, Vulcan, Telepath","nonhuman, male, organic, tos, spock, crew_max_rarity_5","Logic Is The Beginning Of Wisdom",1, 7, 8, 10, 12, 0, 1, , , , 415, 150, 127, 300, false,"Spock",crew_portraits_cm_spock_captain_sm.png,spock_captain_crew
"Weyoun Clone 6",5,3, 373,47,115,0,0,0,0,0,0,0,0,0,471,79,201,0,0,0,961,929,898,652,834,0,0,860,0,0,920,0,824,0,710,985,948,914,656,851,0,0,817,0,0,886,0,765,0,666,1150,1168,"Vorta, Dominion, Diplomat, Clone, Communicator, Tactician","nonhuman, male, organic, ds9, weyoun, crew_max_rarity_3","I'm Not Defective!",0, 4, 8, 8, 10, 2, 2, , , , 265, 75, 102, 275, false,"Weyoun",crew_portraits_cm_weyoun_six_sm.png,weyoun_six_crew
"Penk",7,4, 282,122,256,0,0,0,559,128,263,805,119,243,0,0,0,0,0,0,942,471,213,987,812,672,409,0,0,111,802,543,573,297,0,617,278,126,725,508,564,423,0,0,149,734,484,635,344,0,840,622,"Scoundrel, Crafty, Resourceful, Villain, Brutal","male, organic, voy, penk, nonhuman, crew_max_rarity_4","Tsunkat!",0, 6, 10, 5, 12, 1, 0, , , , 255, 150, 140, 465, false,"Penk",crew_portraits_cm_penk_sm.png,penk_crew
"Weyoun Clone 5",9,5, 489,77,145,0,0,0,1156,202,439,0,0,0,941,163,325,0,0,0,864,151,804,280,741,239,0,461,0,216,41,154,379,0,338,895,218,841,344,768,239,0,499,0,214,65,177,420,0,384,383,329,"Vorta, Dominion, Diplomat, Clone, Tactician, Inspiring","nonhuman, male, organic, ds9, weyoun, crew_max_rarity_5","Peaceful Coexistence",2, 9, 8, 8, 10, 5, 1, , , , 625, 185, 200, 330, false,"Weyoun",crew_portraits_cm_weyoun_five_sm.png,weyoun_five_crew
"Survivalist Kirk",5,5, 0,0,0,1090,291,706,436,66,171,884,208,426,0,0,0,0,0,0,169,874,368,0,0,44,17,244,117,110,954,715,399,196,0,53,848,213,0,0,21,4,80,48,101,941,710,240,109,0,337,53,"Human, Federation, Starfleet, Inspiring, Desperate, Resourceful, Hero, Survivalist, Crafty","male, organic, tos, kirk, crew_max_rarity_5","A Most Promising Species",1, 8, 8, 6, 12, 1, 0, 2, , , 225, 200, 148, 250, false,"Kirk",crew_portraits_cm_kirk_survivalist_sm.png,kirk_survivalist_crew
"Douglas Pabst",7,4, 761,166,371,365,63,184,0,0,0,0,0,0,594,99,204,0,0,0,232,623,486,290,416,935,632,407,562,0,812,0,675,0,570,139,483,306,239,281,840,566,411,504,0,851,0,732,0,630,788,681,"Writer, Human, Civilian, Communicator, Resourceful","male, organic, ds9, odo, crew_max_rarity_4","Anybody Got Any Ideas?",2, 8, 8, 10, 10, , , , 1, 1, 500, 205, 70, 440, false,"Douglas",crew_portraits_cm_odo_pabst_sm.png,odo_pabst_crew
"Mirror Sulu",9,5, 975,116,236,0,0,0,1281,167,327,0,0,0,0,0,0,0,0,0,467,73,421,608,351,208,0,0,0,192,380,134,0,0,0,660,229,592,754,540,416,0,0,0,380,576,331,0,0,0,561,926,"Brutal, Terran Empire, Starfleet, Mirror Universe, Human, Duelist, Veteran","male, organic, tos, sulu, crew_max_rarity_5","Live Dangerously",2, 6, 4, 12, 12, 7, 0, , , , 280, 95, 193, 215, true,"Sulu",crew_portraits_cm_sulu_mirror_sm.png,sulu_mirror_crew
"Armus",4,5, 734,256,578,908,321,821,406,162,331,0,0,0,0,0,0,0,0,0,31,250,428,613,356,47,222,317,162,696,874,638,0,0,0,1,44,73,240,66,6,22,30,25,383,578,335,0,0,0,402,7,"Villain, Desperate, Survivalist, Brutal, Telekinetic","male, nonhuman, organic, tng, armus, gauntlet_jackpot, exclusive_gauntlet, crew_max_rarity_5","Entertain Me",2, 8, 10, 8, 10, 7, 4, , , , 125, 70, 220, 100, false,"Armus",crew_portraits_cm_armus_sm.png,armus_crew
"Layna",9,5, 404,103,342,915,170,314,0,0,0,0,0,0,1172,241,454,0,0,0,118,841,775,152,713,440,334,32,265,0,390,0,211,0,213,71,590,440,75,421,454,317,24,289,0,344,0,171,0,186,352,136,"Artist, Inspiring, Civilian, Desperate, Romantic, Communicator","nonhuman, organic, female, voy, layna, crew_max_rarity_5","You're An Eternal!",0, 6, 10, 6, 14, 7, 0, , , , 425, 200, 20, 475, false,"Layna",crew_portraits_cm_layna_sm.png,layna_crew
