crew, tier, rarity, CMD_core, CMD_min, CMD_max, SCI_core, SCI_min, SCI_max, SEC_core, SEC_min, SEC_max, ENG_core, ENG_min, ENG_max, DIP_core, DIP_min, DIP_max, MED_core, MED_min, MED_max, V_CMD_SCI, V_CMD_SEC, V_CMD_ENG, V_CMD_DIP, V_CMD_MED, V_SCI_SEC, V_SCI_ENG, V_SCI_DIP, V_SCI_MED, V_SEC_ENG, V_SEC_DIP, V_SEC_MED, V_ENG_DIP, V_ENG_MED, V_DIP_MED, G_CMD_SCI, G_CMD_SEC, G_CMD_ENG, G_CMD_DIP, G_CMD_MED, G_SCI_SEC, G_SCI_ENG, G_SCI_DIP, G_SCI_MED, G_SEC_ENG, G_SEC_DIP, G_SEC_MED, G_ENG_DIP, G_ENG_MED, G_DIP_MED, voyage_rank, gauntlet_rank, traits, hidden_traits, action_name, action_bonus_type, action_bonus_amount, action_initial_cooldown, action_duration, action_cooldown, bonus_ability, trigger, uses_per_battle, penalty_type, penalty_amount, accuracy, crit_bonus, crit_chance, evasion, charge_phases, short_name, image_name, symbol
"Investigator Odo",8,1, 0,0,0,0,0,0,217,37,171,0,0,0,0,0,0,0,0,0,0,807,0,0,0,851,0,0,0,730,884,700,0,0,0,0,738,0,0,0,742,0,0,0,641,827,624,0,0,0,1053,1047,"Changeling, Cardassian, Investigator, Interrogator","nonhuman, male, organic, ds9, odo, crew_max_rarity_1","Collaboration",2, 1, 20, 14, 10, , , , , , 400, 115, 67, 265, false,"Odo",crew_portraits_cm_odooccupation_sm.png,odo_occupation_crew
"Constable Odo",4,3, 317,107,225,0,0,0,523,27,85,0,0,0,0,0,0,0,0,0,767,483,697,790,660,718,0,0,0,614,784,581,0,0,0,572,483,513,640,479,851,0,0,0,721,889,699,0,0,0,955,966,"Changeling, Bajoran, Constable, Investigator, Interrogator","nonhuman, male, organic, ds9, odo, crew_max_rarity_3","Justice",0, 6, 10, 12, 16, , , , 3, 800, 520, 300, 75, , false,"Odo",crew_portraits_cm_odostandard_sm.png,odo_constable_crew
"Ensign Ro",4,2, 322,46,132,0,0,0,0,0,0,0,0,0,0,0,0,0,0,0,839,792,771,841,730,0,0,0,0,0,0,0,0,0,0,804,766,730,811,690,0,0,0,0,0,0,0,0,0,0,1048,1051,"Starfleet, Bajoran, Resourceful","nonhuman, female, organic, tng, ensign, bridge_crew, ro, crew_max_rarity_2","Separate Ways",0, 4, 3, 10, 5, , , 2, , , 130, 210, 13, 200, false,"Ro",crew_portraits_cm_roensign_sm.png,ro_ensign_crew
"Shinzon",10,5, 819,94,241,0,0,0,938,183,435,0,0,0,546,176,390,0,0,0,456,97,396,191,353,262,0,543,0,230,87,177,499,0,432,568,137,509,156,477,218,0,322,0,191,45,167,257,0,271,371,152,"Human, Clone, Reman, Villain, Romulan","male, organic, tng, shinzon, crew_max_rarity_5","Destiny Complete",0, 7, 14, 3, 14, 1, 2, , , , 1325, 545, 365, 1050, false,"Shinzon",crew_portraits_cm_shinzon_sm.png,shinzon_crew
"Will Riker",10,1, 251,42,110,0,0,0,125,22,74,0,0,0,0,0,0,0,0,0,856,734,794,862,747,879,0,0,0,749,910,725,0,0,0,833,691,759,839,725,863,0,0,0,734,901,708,0,0,0,1040,1032,"Human, Federation, Starfleet, Maverick, Gambler, Romantic","male, organic, nonhuman, tng, commander, bridge_crew, first_officer, riker, crew_max_rarity_1","Poker Face",0, 1, 8, 10, 14, 4, 0, , , , 455, , 425, 340, false,"Riker",crew_portraits_cm_rikers1_sm.png,riker_s1_commander_crew
"Commander Riker",7,2, 279,78,191,0,0,0,124,29,89,0,0,0,290,22,64,0,0,0,837,701,768,642,726,875,0,835,0,746,800,721,818,0,711,658,542,616,614,573,848,0,862,0,720,833,697,847,0,731,982,952,"Human, Federation, Starfleet, Pilot, Maverick, Gambler, Romantic","male, organic, tng, commander, bridge_crew, first_officer, riker, crew_max_rarity_2","Liase",0, 2, 8, 10, 14, 5, 0, , , , 645, 50, 295, 275, false,"Riker",crew_portraits_cm_rikerpoker_sm.png,riker_s2_commander_crew
"Edith Keeler",9,4, 0,0,0,0,0,0,0,0,0,0,0,0,453,166,339,591,187,590,0,0,0,674,359,0,0,612,282,0,691,361,578,242,88,0,0,0,477,76,0,0,396,93,0,475,91,319,38,14,861,360,"Civilian, Caregiver, Inspiring, Cultural Figure, Romantic, Human","female, organic, tos, keeler, crew_max_rarity_4","A Life Worth Living",1, 7, 8, 10, 8, , , , , , 690, 25, 52, 440, false,"Keeler",crew_portraits_cm_edithkeeler_sm.png,keeler_crew
"Ensign Tuvok",8,1, 0,0,0,181,51,197,0,0,0,0,0,0,138,33,74,0,0,0,872,0,0,898,0,859,578,758,527,0,906,0,856,0,743,701,0,0,875,0,685,453,576,414,0,894,0,825,0,713,1043,1005,"Vulcan, Federation, Starfleet, Telepath","nonhuman, male, organic, voy, ensign, bridge_crew, tuvok, crew_max_rarity_1","Memory",0, 1, 1, 14, 10, , , , , , 103, 60, 135, 375, false,"Tuvok",crew_portraits_cm_tuvokensign_sm.png,tuvok_ensign_crew
"Security Chief Tuvok",5,3, 291,53,161,145,45,149,445,85,201,0,0,0,0,0,0,0,0,0,669,517,779,843,736,498,589,865,537,608,778,575,0,0,0,473,428,697,772,655,375,506,767,476,549,714,537,0,0,0,929,857,"Vulcan, Federation, Starfleet, Telepath, Tactician, Investigator","nonhuman, male, organic, voy, lieutenant_commander, bridge_crew, tuvok, crew_max_rarity_3","Contingency Plan",0, 4, 10, 12, 16, 5, 0, , , , 465, 50, , 300, false,"Tuvok",crew_portraits_cm_tuvokrifle_sm.png,tuvok_rifle_crew
"Major Kira",7,2, 273,37,126,0,0,0,304,60,176,0,0,0,0,0,0,0,0,0,848,577,786,849,738,817,0,0,0,701,862,669,0,0,0,821,530,746,823,710,701,0,0,0,601,782,589,0,0,0,1004,989,"Bajoran, Veteran, Resourceful","nonhuman, female, organic, ds9, kira, crew_max_rarity_2","Obstinance",0, 2, 0, 10, 14, 6, 0, , , , 295, 150, 5, , true,"Kira",crew_portraits_cm_kirashorthair_sm.png,kira_major_shorthair_crew
"Mirror Intendant Kira",5,5, 512,183,363,0,0,0,1052,272,542,0,0,0,946,67,184,0,0,0,545,96,482,173,445,203,0,452,0,180,43,134,388,0,337,298,25,230,209,220,94,0,702,0,89,63,75,664,0,575,231,108,"Bajoran, Cardassian, Klingon, Villain, Klingon-Cardassian Alliance, Brutal, Mirror Universe","nonhuman, female, organic, ds9, mirror, kira, crew_max_rarity_5","Instability",0, 6, 6, 10, 12, 4, 0, , , , 915, 225, 90, 1525, true,"Kira",crew_portraits_cm_kiraintendant_sm.png,kira_mirror_crew
"Security Chief Worf",2,2, 205,57,144,0,0,0,326,61,145,0,0,0,0,0,0,0,0,0,869,613,802,873,757,808,0,0,0,695,856,661,0,0,0,775,521,709,791,666,746,0,0,0,646,831,629,0,0,0,1014,984,"Klingon, Federation, Starfleet, Duelist, Investigator","nonhuman, male, organic, tng, lieutenant, bridge_crew, worf, crew_max_rarity_2","They Have No Honor",2, 4, 8, 10, 12, , , , 1, 2, 165, 280, 95, 155, false,"Worf",crew_portraits_cm_worf_sm.png,worf_security_chief_crew
"Defiant Commander Worf",7,4, 364,241,488,0,0,0,609,179,394,0,0,0,0,0,0,0,0,0,596,238,534,649,494,486,0,0,0,435,609,388,0,0,0,141,36,100,266,92,266,0,0,0,228,395,204,0,0,0,872,321,"Klingon, Federation, Starfleet, Duelist, Tactician","nonhuman, male, organic, ds9, lieutenant_commander, bridge_crew, worf, crew_max_rarity_4","Good Day to Die",2, 6, 12, 12, 12, 4, 0, , 1, 2, 690, 645, 325, 205, false,"Worf",crew_portraits_cm_worfdefiant_sm.png,worf_defiant_commander_crew
"Mirror Regent Worf",6,5, 861,294,589,0,0,0,1062,175,357,0,0,0,0,0,0,0,0,0,235,64,193,393,157,241,0,0,0,214,367,162,0,0,0,67,18,43,161,42,308,0,0,0,277,446,241,0,0,0,455,219,"Klingon, Cardassian, Tactician, Villain, Brutal, Klingon-Cardassian Alliance, Mirror Universe","nonhuman, male, organic, ds9, mirror, bridge_crew, worf, crew_max_rarity_5","Position of Strength",0, 9, 8, 8, 10, , , , , , 300, 980, 390, , false,"Worf",crew_portraits_cm_worfmirror_sm.png,worf_mirror_crew
"Yeoman Rand",10,1, 164,15,58,0,0,0,0,0,0,0,0,0,117,19,60,0,0,0,887,833,828,850,782,0,0,874,0,0,912,0,863,0,747,883,831,825,840,777,0,0,865,0,0,907,0,852,0,735,1050,1054,"Federation, Starfleet, Human","female, organic, tos, yeoman, bridge_crew, rand, crew_max_rarity_1","Signature Required",2, 2, 8, 10, 12, , , , 1, 1, 375, , , 180, false,"Rand",crew_portraits_cm_randyeoman_sm.png,rand_yeoman_crew
"The Duras Sisters",7,4, 311,83,205,0,0,0,658,150,385,0,0,0,464,170,341,0,0,0,792,333,727,467,687,473,0,603,0,424,208,377,566,0,481,627,207,584,213,546,304,0,388,0,275,71,240,311,0,307,714,301,"Klingon, Scoundrel, Villain","nonhuman, female, organic, tng, betor, lursa, crew_max_rarity_4","The Power of Two",0, 9, 10, 20, 12, , , 1, , , 350, 110, 190, 500, false,"Duras Sisters",crew_portraits_cm_duras_sisters_sm.png,duras_sisters_crew
"Persis",6,2, 0,0,0,0,0,0,253,94,250,0,0,0,303,39,88,0,0,0,0,786,0,848,0,812,0,826,0,696,632,663,810,0,701,0,580,0,862,0,532,0,834,0,477,497,459,810,0,701,1000,954,"Human, Augments, Engineered, Survivalist, Tactician","nonhuman, female, organic, ent, persis, crew_max_rarity_2","Augmented Strength",0, 2, 6, 10, 6, 7, 0, 2, , , 240, 330, 300, , false,"Persis",crew_portraits_cm_persis_sm.png,persis_crew
"Telek R'Mor",5,2, 0,0,0,347,52,194,119,8,44,0,0,0,263,30,113,0,0,0,786,839,0,861,0,681,528,556,481,750,822,726,816,0,709,704,834,0,849,0,608,455,537,416,748,839,724,797,0,693,980,972,"Romulan, Astrophysicist","nonhuman, male, organic, voy, captain, bridge_crew, rmor, crew_max_rarity_2","Solitary Survey",1, 3, 10, 12, 10, 0, 2, , , , 405, 50, 3, 180, false,"R'Mor",crew_portraits_cm_telekrmor_sm.png,rmor_voyager_crew
"KDF Gowron",6,4, 375,85,222,0,0,0,296,100,256,0,0,0,641,173,418,0,0,0,738,506,670,350,633,775,0,520,0,668,347,634,472,0,405,608,294,557,162,522,514,0,292,0,460,113,442,228,0,247,775,386,"Klingon, Duelist, Diplomat, Politician","nonhuman, male, organic, tng, gowron, crew_max_rarity_4","What Can Be Done",1, 6, 14, 10, 14, 0, 2, , , , 625, 465, 85, 1000, false,"Gowron",crew_portraits_cm_gowronyoung_sm.png,gowron_kdf_crew
"Third Remata'Klan",9,3, 410,42,84,0,0,0,467,85,185,0,0,0,0,0,0,0,0,0,771,472,704,795,665,693,0,0,0,598,766,567,0,0,0,855,533,783,855,740,642,0,0,0,565,737,551,0,0,0,949,991,"Jem'hadar, Dominion, Duelist, Tactician","nonhuman, male, organic, ds9, remataklan, crew_max_rarity_3","Victory is Life",0, 3, 0, 6, 8, 4, 4, , , , 690, 395, 597, 600, true,"Remata'Klan",crew_portraits_cm_remataklan_sm.png,remataklan_crew
"Ensign Chapel",10,1, 0,0,0,0,0,0,0,0,0,0,0,0,0,0,0,214,34,152,0,0,0,0,756,0,0,0,526,0,0,705,0,473,718,0,0,0,0,682,0,0,0,483,0,0,647,0,430,648,1059,1049,"Human, Federation, Starfleet, Nurse","female, organic, tos, ensign, chapel, crew_max_rarity_1","Administer Prescription",2, 1, 6, 10, 10, , , , , , 130, , 40, 100, false,"Chapel",crew_portraits_cm_chapelensign_sm.png,chapel_ensign_crew
"Ensign Ogawa",10,1, 0,0,0,0,0,0,0,0,0,0,0,0,0,0,0,213,34,166,0,0,0,0,751,0,0,0,522,0,0,701,0,470,714,0,0,0,0,670,0,0,0,466,0,0,635,0,417,634,1055,1048,"Human, Federation, Starfleet, Nurse","female, organic, tng, ensign, ogawa, crew_max_rarity_1","Report to Sickbay",2, 1, 6, 1, 8, 2, 0, 1, , , 170, , 35, 105, false,"Ogawa",crew_portraits_cm_ogawaensign_sm.png,ogawa_ensign_crew
"Wesley Crusher",10,1, 0,0,0,218,43,149,0,0,0,174,32,78,0,0,0,0,0,0,864,0,823,0,0,854,497,844,523,744,0,0,851,485,0,788,0,798,0,0,769,393,768,477,726,0,0,824,473,0,1035,1024,"Human, Federation, Civilian, Prodigy","male, organic, tng, wesley, crew_max_rarity_1","Study",1, 2, 8, 10, 12, , , , 0, 1, 215, 125, 70, 55, false,"Wesley",crew_portraits_cm_wesleysweater_sm.png,wesley_sweater_crew
"Ensign Crusher",7,3, 176,11,31,426,83,229,0,0,0,347,34,78,0,0,0,0,0,0,557,834,651,896,783,717,330,736,447,712,0,0,804,461,0,552,835,760,902,785,586,295,629,363,723,0,0,822,471,0,933,958,"Human, Federation, Starfleet, Prodigy, Warp Theorist","male, organic, tng, ensign, bridge_crew, wesley, crew_max_rarity_3","Rewire",2, 4, 6, 8, 10, 6, 0, , , , 290, , , 190, false,"Wesley",crew_portraits_cm_wesley_sm.png,wesley_full_ensign_crew
"Acting Ensign Crusher",9,2, 114,29,58,258,56,160,0,0,0,251,53,148,0,0,0,0,0,0,741,838,682,904,787,841,401,827,516,724,0,0,812,465,0,616,824,593,889,771,734,301,740,451,655,0,0,732,419,0,991,942,"Human, Federation, Starfleet, Prodigy","male, organic, tng, ensign, bridge_crew, wesley, crew_max_rarity_2","Invention",1, 4, 3, 6, 6, , , 2, , , 205, 50, 25, 165, false,"Wesley",crew_portraits_cm_wesleyensign_sm.png,wesley_acting_ensign_crew
"Formal Dress Wesley Crusher",9,4, 0,0,0,662,173,422,0,0,0,270,108,230,481,160,342,0,0,0,472,0,754,660,0,465,192,134,288,690,682,0,314,447,479,264,0,519,479,0,251,58,39,177,490,476,0,66,305,314,705,223,"Human, Federation, Starfleet, Prodigy, Warp Theorist","male, organic, tng, ensign, bridge_crew, wesley, lieutenant, crew_max_rarity_4","Duty to the Truth",1, 9, 4, 10, 12, , , , , , 300, 500, 30, 450, false,"Wesley",crew_portraits_cm_wesleydressuniform_sm.png,wesley_formal_dress_crew
"Wrathful Khan",7,5, 1040,206,421,0,0,0,1145,72,143,376,140,288,0,0,0,0,0,0,226,69,43,385,144,260,479,0,0,60,388,175,695,396,0,218,195,15,359,144,727,294,0,0,181,810,615,410,230,0,314,368,"Human, Augments, Engineered, Villain, Cultural Figure, Tactician, Resourceful, Survivalist, Brutal","nonhuman, male, organic, tos, khan, crew_max_rarity_5","I Stab at Thee",2, 9, 12, 5, 12, 1, 0, , , , 640, 595, 345, 850, false,"Khan",crew_portraits_cm_khan_sm.png,khan_wok_crew
"Tailor Garak",4,3, 0,0,0,0,0,0,502,44,126,161,22,44,395,83,219,0,0,0,0,711,830,763,0,704,596,747,0,467,485,576,554,487,618,0,772,828,676,0,799,598,647,0,605,499,658,492,488,520,912,930,"Cardassian, Undercover Operative, Scoundrel, Interrogator, Civilian","nonhuman, male, organic, ds9, garak, crew_max_rarity_3","Cutting Cloth",1, 5, 8, 12, 12, , , , , , 125, 230, 20, 405, false,"Garak",crew_portraits_cm_garaktailor_sm.png,garak_tailor_crew
"Bartender Quark",9,1, 110,25,77,0,0,0,81,15,57,0,0,0,211,36,150,0,0,0,892,823,833,814,786,881,0,848,0,751,865,727,833,0,723,869,767,804,688,757,875,0,780,0,746,757,722,747,0,653,1027,1001,"Ferengi, Bartender, Civilian, Scoundrel, Gambler, Merchant","nonhuman, male, organic, ds9, quark, crew_max_rarity_1","Hospitality",1, 2, 8, 10, 12, , , , 2, 1, 165, 10, 10, 140, false,"Quark",crew_portraits_cm_quarkbartender_sm.png,quark_s1_bartender_crew
"Richard Castillo",4,3, 487,109,227,286,57,187,0,0,0,0,0,0,0,0,0,0,0,0,420,653,593,689,550,829,565,819,512,0,0,0,0,0,0,277,589,505,634,473,693,460,708,422,0,0,0,0,0,0,951,910,"Human, Hero, Pilot, Starfleet, Federation","bridge_crew, male, organic, castillo, tng, lieutenant, crew_max_rarity_3","Self Sacrifice",0, 5, 12, 12, 10, 7, 0, , 1, 2, 650, 265, 129, 585, false,"Castillo",crew_portraits_cm_richardcastillo_sm.png,castillo_lieutenant_crew
"Writer Jake Sisko",10,3, 0,0,0,0,0,0,0,0,0,0,0,0,451,70,198,0,0,0,0,0,0,756,0,0,0,730,0,0,782,0,701,0,607,0,0,0,710,0,0,0,678,0,0,747,0,639,0,555,1028,1031,"Human, Federation, Civilian, Writer, Gambler, Romantic","male, organic, ds9, jake, crew_max_rarity_3","Construct Story",2, 3, 0, 8, 10, 6, 0, , , , 995, 350, 47, 640, true,"Jake",crew_portraits_cm_jakewriter_sm.png,jake_writer_crew
"CMO Crusher",3,2, 0,0,0,0,0,0,0,0,0,0,0,0,0,0,0,290,52,174,0,0,0,0,735,0,0,0,511,0,0,679,0,457,692,0,0,0,0,639,0,0,0,441,0,0,604,0,402,602,1049,1042,"Human, Starfleet, Federation, Physician, Caregiver, Cyberneticist","female, organic, tng, commander, crusher, crew_max_rarity_2","Doctor's Calluses",2, 3, 6, 10, 10, , , , , , 185, , 35, 155, false,"Crusher",crew_portraits_cm_crusherwithlabcoat_sm.png,crusher_labcoat_crew
"Commando Crusher",1,3, 0,0,0,182,76,200,308,93,193,0,0,0,0,0,0,510,44,132,860,767,0,0,611,534,575,839,294,678,837,317,0,388,586,652,657,0,0,694,278,417,673,266,550,715,319,0,440,662,901,835,"Human, Starfleet, Federation, Physician, Cyberneticist, Undercover Operative","female, organic, tng, commander, crusher, crew_max_rarity_3","Repel Disease",0, 3, 6, 3, 12, 1, 0, , , , 575, , 370, 500, false,"Crusher",crew_portraits_cm_crusherblackcommandouniform_sm.png,crusher_black_commando_uniform_crew
"Dr. Crusher",9,4, 275,38,110,0,0,0,437,90,201,0,0,0,0,0,0,736,123,300,849,532,787,852,159,711,0,0,287,610,781,103,0,253,395,838,489,766,841,209,610,0,0,282,545,705,116,0,227,392,789,740,"Human, Starfleet, Federation, Physician, Cyberneticist","female, organic, tng, commander, crusher, crew_max_rarity_4","Neutralize Disease",1, 7, 12, 12, 12, 4, 4, , , , 740, 250, 370, 500, false,"Crusher",crew_portraits_cm_crusherfromfirstcontact_sm.png,crusher_first_contact_crew
"Holonovel Doctor",6,4, 0,0,0,512,50,137,0,0,0,0,0,0,0,0,0,799,69,244,717,0,0,0,364,692,468,710,99,0,0,367,0,249,391,796,0,0,0,514,776,513,774,229,0,0,509,0,333,498,883,943,"Hologram, Human, Federation, Starfleet, Physician, Musician, Scoundrel","nonhuman, male, artificial_life, voy, emh, crew_max_rarity_4","Suggested Treatment",0, 7, 12, 12, 12, , , , , , 365, 370, 205, 525, false,"Doctor",crew_portraits_cm_doctorgolfclub_sm.png,emh_authorauthor_crew
"Mobile Doctor",5,5, 0,0,0,809,106,209,0,0,0,0,0,0,393,137,435,1191,110,334,469,0,0,687,128,463,336,143,26,0,709,139,598,95,42,600,0,0,423,352,583,380,103,101,0,414,346,250,213,56,372,313,"Hologram, Human, Federation, Starfleet, Musician, Physician","nonhuman, male, artificial_life, voy, emh, crew_max_rarity_5","House Call",2, 9, 12, 12, 12, , , , , , 1825, 600, , 600, false,"Doctor",crew_portraits_cm_emhmobile_sm.png,emh_mobileholoemitter_crew
"Comm Officer Uhura",10,1, 0,0,0,0,0,0,0,0,0,0,0,0,258,28,89,0,0,0,0,0,0,869,0,0,0,843,0,0,887,0,826,0,716,0,0,0,867,0,0,0,841,0,0,887,0,818,0,707,1056,1059,"Federation, Starfleet, Human, Musician, Communicator","female, organic, tos, lieutenant, bridge_crew, uhura, crew_max_rarity_1","Incoming Message",2, 2, 8, 10, 12, , , , 1, 1, 320, , , 495, false,"Uhura",crew_portraits_cm_uhurared_sm.png,uhura_red_crew
"Commander Uhura",10,4, 459,128,299,0,0,0,0,0,0,0,0,0,592,198,429,0,0,0,637,641,582,281,534,0,0,528,0,0,608,0,480,0,410,445,506,372,96,365,0,0,260,0,0,346,0,187,0,208,882,581,"Federation, Starfleet, Human, Musician, Communicator","female, organic, tos, commander, bridge_crew, uhura, crew_max_rarity_4","Hailing Frequencies",0, 8, 12, 26, 12, , , 1, , , 1165, , 75, 790, false,"Uhura",crew_portraits_cm_uhurawrathofkhan_sm.png,uhura_wrathofkhan_crew
"Dancing Uhura",8,5, 1026,84,195,0,0,0,0,0,0,0,0,0,1185,193,393,0,0,0,347,421,301,49,260,0,0,239,0,0,323,0,182,0,185,643,665,601,186,563,0,0,299,0,0,400,0,237,0,252,454,746,"Human, Federation, Starfleet, Communicator, Casual, Musician, Artist","bridge_crew, female, organic, tos, uhura, lieutenant_commander, original, crew_max_rarity_5","Take The Lead",0, 8, 10, 3, 14, 1, 1, , , , 465, 260, 60, 400, false,"Uhura",crew_portraits_cm_uhura_dancing_sm.png,uhura_dancing_crew
"First Maje Culluh",5,3, 466,93,223,0,0,0,307,42,138,0,0,0,0,0,0,0,0,0,690,501,625,716,588,832,0,0,0,713,872,684,0,0,0,594,429,536,652,506,786,0,0,0,673,846,652,0,0,0,965,941,"Kazon, Scoundrel","nonhuman, male, organic, voy, captain, culluh, crew_max_rarity_3","Nistrim Supremacy",2, 3, 6, 10, 10, 8, 4, , , , 665, 325, 133, 390, false,"Culluh",crew_portraits_cm_jalculluh_sm.png,culluh_crew
"KDF Alexander",6,2, 137,19,79,0,0,0,331,64,148,145,16,72,0,0,0,0,0,0,888,686,784,899,784,804,597,0,0,581,848,657,858,488,0,871,627,723,881,760,735,593,0,0,534,818,618,844,482,0,997,992,"Human, Klingon","male, organic, ds9, bridge_crew, alexander, nonhuman, crew_max_rarity_2","Beginner's Luck",1, 3, 10, 12, 10, 5, 2, , , , 130, 200, 62, 15, false,"Alexander",crew_portraits_cm_alexanderkdf_sm.png,alexander_kdf_crew
"Commando Shran",9,4, 673,114,239,0,0,0,592,89,182,0,0,0,318,144,282,0,0,0,505,255,440,382,398,579,0,748,0,506,384,470,719,0,622,544,327,474,236,445,643,0,493,0,566,263,552,411,0,396,708,582,"Andorian, Tactician, Inspiring, Imperial Guard","nonhuman, male, organic, ent, captain, shran, crew_max_rarity_4","Debt Owed",0, 8, 6, 8, 10, , , 3, , , 390, 575, 288, 350, false,"Shran",crew_portraits_cm_shrancommando_sm.png,shran_commando_crew
"Ushaan Shran",9,5, 989,83,164,0,0,0,1076,170,348,0,0,0,424,134,288,0,0,0,383,84,337,233,289,238,0,674,0,211,102,160,645,0,549,695,235,649,321,602,322,0,497,0,290,114,259,420,0,400,364,454,"Andorian, Duelist, Romantic, Imperial Guard","nonhuman, male, organic, ent, captain, shran, crew_max_rarity_5","Debt Owed",0, 9, 6, 8, 10, , , 3, , , 1440, 565, 483, 390, false,"Shran",crew_portraits_cm_shrandueling_sm.png,shran_dueling_crew
"Fencing Sulu",10,4, 444,99,249,385,36,92,609,203,448,0,0,0,0,0,0,0,0,0,417,273,634,726,596,223,542,793,494,420,597,373,0,0,0,388,116,484,620,456,107,571,829,525,166,302,146,0,0,0,751,498,"Human, Federation, Starfleet, Pilot, Resourceful, Duelist","male, organic, tos, lieutenant, bridge_crew, sulu, crew_max_rarity_4","Parry Attack",0, 6, 12, 8, 12, 6, 4, , , , 415, , 225, 225, false,"Sulu",crew_portraits_cm_sulufencing_sm.png,sulu_fencing_crew
"Morn",7,3, 0,0,0,0,0,0,359,70,174,0,0,0,418,121,295,0,0,0,0,740,0,734,0,770,0,683,0,659,501,628,657,0,561,0,696,0,565,0,686,0,503,0,590,303,582,428,0,408,942,873,"Lurian, Courier, Duelist, Civilian, Gambler, Smuggler","nonhuman, male, organic, ds9, morn, crew_max_rarity_3","Drinking Spot",0, 3, 0, 8, 8, , , , 1, 2, 150, 285, 57, 655, true,"Morn",crew_portraits_cm_morn_sm.png,morn_crew
"Seven in Blue",3,2, 0,0,0,294,51,209,0,0,0,278,53,130,0,0,0,0,0,0,835,0,785,0,0,818,366,810,505,721,0,0,809,463,0,679,0,732,0,0,668,284,688,404,675,0,0,751,434,0,1001,973,"Human, Borg, Civilian, Federation","nonhuman, female, organic, voy, bridge_crew, seven, crew_max_rarity_2","Ignore Irrelevancies",1, 2, 8, 10, 14, 4, 0, , , , 75, 50, 310, 170, false,"Seven",crew_portraits_cm_seven_of_nine_sm.png,seven_allblue_crew
"Seven of Nine",7,5, 0,0,0,785,247,791,0,0,0,854,225,454,514,89,183,0,0,0,244,0,292,699,0,247,38,84,162,280,727,0,46,161,526,35,0,130,703,0,33,3,11,37,157,742,0,44,72,552,352,20,"Human, Borg, Civilian, Federation","nonhuman, female, organic, voy, bridge_crew, seven, crew_max_rarity_5","New Collective",2, 7, 12, 10, 14, 4, 0, , , , 1750, , 705, 440, false,"Seven",crew_portraits_cm_sevenbluegreyshoulders_sm.png,seven_bluegreyshoulders_crew
"Donik",6,3, 0,0,0,0,0,0,0,0,0,476,79,199,303,31,79,0,0,0,0,0,647,851,0,0,463,829,0,590,877,0,453,385,703,0,0,610,874,0,0,418,846,0,564,893,0,468,366,712,976,995,"Hirogen, Innovator","nonhuman, male, organic, voy, donik, crew_max_rarity_3","Hunting Program",2, 4, 12, 12, 10, 7, 0, , , , 870, 165, , 340, false,"Donik",crew_portraits_cm_donik_sm.png,donik_crew
"Commander Tucker",8,2, 252,28,82,0,0,0,0,0,0,305,53,185,0,0,0,0,0,0,867,810,536,871,754,0,558,0,0,702,0,0,791,450,0,866,808,498,872,754,0,469,0,0,612,0,0,681,395,0,1015,1007,"Human, Starfleet, Jury Rigger, Pilot, Explorer","male, organic, ent, commander, tucker, crew_max_rarity_2","Warp Engines Online",1, 2, 6, 3, 8, 2, 0, , , , 520, 35, 50, 165, false,"Trip",crew_portraits_cm_tucker_sm.png,tucker_commander_crew
"Counselor Troi",9,1, 0,0,0,0,0,0,0,0,0,0,0,0,261,42,108,147,49,131,0,0,0,860,778,0,0,833,538,0,880,716,815,483,611,0,0,0,842,689,0,0,816,490,0,872,653,788,433,482,1030,1017,"Federation, Starfleet, Human, Betazoid, Empath, Counselor","nonhuman, female, organic, tng, lieutenant_commander, bridge_crew, troi, crew_max_rarity_1","Counselling",2, 1, 6, 10, 10, , , , , , 265, , 80, 345, false,"Troi",crew_portraits_cm_troitng_sm.png,troi_casualgray_crew
"Rakal Troi",8,4, 521,163,354,0,0,0,525,128,331,0,0,0,0,0,0,407,163,440,550,288,487,620,103,555,0,0,363,486,655,128,0,325,482,327,125,259,455,12,391,0,0,170,344,503,17,0,109,223,610,118,"Federation, Starfleet, Human, Betazoid, Romulan, Empath, Undercover Operative, Tal Shiar","nonhuman, female, organic, tng, lieutenant_commander, bridge_crew, troi, crew_max_rarity_4","Romulan Disguise",1, 7, 12, 10, 14, 1, 2, , , , 90, 400, 175, 2825, false,"Troi",crew_portraits_cm_troirakal_sm.png,troi_rakal_crew
"Commander Troi",8,5, 0,0,0,0,0,0,383,203,253,0,0,0,1060,211,421,827,142,281,0,697,0,386,322,682,0,278,262,591,99,48,219,211,27,0,472,0,373,377,398,0,258,283,350,61,56,185,228,45,381,160,"Federation, Starfleet, Human, Betazoid, Empath, Counselor","nonhuman, female, organic, tng, commander, bridge_crew, troi, crew_max_rarity_5","Empathic Sense",1, 8, 6, 6, 6, , , , , , 1375, 475, 135, 725, true,"Troi",crew_portraits_cm_troifirstcontact_sm.png,troi_firstcontact_crew
"Vedek Winn Adami",5,3, 307,97,207,0,0,0,0,0,0,0,0,0,410,92,214,0,0,0,789,757,725,543,684,0,0,743,0,0,787,0,714,0,615,611,635,563,383,526,0,0,644,0,0,696,0,589,0,515,967,902,"Bajoran, Vedek, Cultural Figure, Spiritual","nonhuman, female, organic, ds9, winn, crew_max_rarity_3","Will of the Prophets",1, 4, 8, 10, 10, 4, 0, , , , , 270, 85, 830, false,"Winn",crew_portraits_cm_winnvedek_sm.png,winn_vedek_crew
"Subcommander T'Pol",4,3, 273,71,211,520,21,77,165,35,77,0,0,0,0,0,0,0,0,0,465,672,769,840,727,515,491,742,454,745,903,719,0,0,0,511,536,598,691,557,741,589,856,536,722,890,700,0,0,0,931,945,"Vulcan, High Command, Astrophysicist, Telepath","nonhuman, female, organic, ent, first_officer, bridge_crew, tpol, crew_max_rarity_3","Logic",2, 5, 6, 10, 10, , , , , , 175, 120, 3, 100, false,"T'Pol",crew_portraits_cm_tpol_sm.png,tpol_subcommander_crew
"Commander T'Pol",8,4, 512,112,307,692,56,171,320,91,227,0,0,0,0,0,0,0,0,0,165,392,537,655,497,253,362,555,320,662,821,631,0,0,0,201,248,385,551,378,297,474,727,442,509,667,493,0,0,0,749,661,"Vulcan, Starfleet, Astrophysicist, Telepath","nonhuman, female, organic, ent, first_officer, commander, bridge_crew, tpol, crew_max_rarity_4","Vessel's Information",0, 5, 12, 12, 20, 2, 0, , , , 1400, 200, 70, 1175, false,"T'Pol",crew_portraits_cm_tpolcommander_sm.png,tpol_commander_crew
"Chef Neelix",10,1, 0,0,0,0,0,0,0,0,0,0,0,0,201,51,189,0,0,0,0,0,0,867,0,0,0,840,0,0,885,0,823,0,713,0,0,0,743,0,0,0,715,0,0,785,0,676,0,588,1054,1038,"Talaxian, Mylean, Resourceful, Survivalist, Chef, Civilian, Communicator","nonhuman, male, organic, voy, neelix, crew_max_rarity_1","Soup's On",1, 2, 12, 14, 10, 6, 0, , 2, 1, 305, , , 210, false,"Neelix",crew_portraits_cm_neelix_sm.png,neelix_chef_crew
"CMO 'Bones' McCoy",9,1, 0,0,0,0,0,0,0,0,0,0,0,0,0,0,0,213,48,196,0,0,0,0,743,0,0,0,518,0,0,697,0,467,707,0,0,0,0,606,0,0,0,417,0,0,583,0,388,582,1051,1034,"Human, Federation, Starfleet, Physician, Exobiology","male, organic, tos, lieutenant_commander, mccoy, crew_max_rarity_1","Country Doctor",2, 3, 8, 10, 12, , , , 0, 2, 245, 10, 8, 285, false,"McCoy",crew_portraits_cm_mccoy_sm.png,mccoy_chief_medical_officer_crew
