"Botanist Sulu",5,4, 0,0,0,873,144,350,502,96,206,0,0,0,646,121,261,0,0,0,675,1059,0,976,0,135,492,181,373,928,552,815,838,0,694,597,999,0,951,0,157,394,163,341,864,424,788,804,0,688,803,778,"Human, Federation, Starfleet, Pilot, Botanist, Casual","male, organic, sulu, tos, crew_max_rarity_4","Plants Can Be Very Sensitive",2, 7, 6, 6, 12, 0, 1, , , , 240, 95, 70, 100, false,"Sulu",crew_portraits_cm_sulu_botanist_sm.png,sulu_botanist_crew
"Hippie O'Brien",3,4, 654,81,198,0,0,0,0,0,0,340,66,146,950,152,353,0,0,0,879,920,476,261,702,0,949,626,0,1090,774,0,219,747,468,1006,1036,511,352,859,0,853,611,0,1032,741,0,224,710,452,949,1085,"Human, Starfleet, Federation, Resourceful, Communicator, Displaced, Costumed","male, organic, ds9, obrien, crew_max_rarity_4","I Think I Know What Happened",1, 5, 8, 10, 16, 2, 0, , , , 500, 200, 141, 325, false,"O'Brien",crew_portraits_cm_obrien_hippie_sm.png,obrien_hippie_crew
"Dr. T'Ana",8,5, 1026,154,303,510,81,180,0,0,0,0,0,0,0,0,0,1318,258,308,141,629,455,718,3,1045,774,1057,47,0,0,198,0,101,259,236,737,584,802,33,1038,756,1076,104,0,0,340,0,207,397,352,609,"Federation, Starfleet, Caitian, Physician, Brutal, Exobiology","female, nonhuman, organic, low, tana, crew_max_rarity_5","Nobody's Authorized to Pass Out!",1, 7, 2, 15, 30, , , , , , 300, 200, 155, 50, false,"T'Ana",crew_portraits_cm_dr_tana_sm.png,dr_tana_crew
"EV Suit Reed",7,5, 1057,100,250,526,80,181,0,0,0,1324,199,372,0,0,0,0,0,0,143,644,13,737,362,1008,72,1029,603,269,0,0,256,74,0,377,909,65,986,697,1039,125,1077,626,406,0,0,427,183,0,281,753,"Starfleet, Human, Artist, Explorer, Resourceful, Hero","male, organic, ent, evsuit, reed, crew_max_rarity_5","Charges Are Set",0, 7, 6, 8, 14, 7, 2, , , , 200, 275, 40, 300, false,"Reed",crew_portraits_cm_reed_ev_suit_sm.png,reed_ev_suit_crew
"Badgey",4,3, 0,0,0,479,93,220,0,0,0,346,70,168,202,41,102,0,0,0,1081,0,1155,1372,0,1063,506,841,645,1078,1390,0,917,730,1128,948,0,1068,1335,0,915,342,730,548,970,1368,0,795,660,1087,1425,1382,"Hologram, Federation, Starfleet, Resourceful, Communicator, Playful","male, nonhuman, artificial_life, low, badgey, crew_max_rarity_3","Hi, Can I Teach You A Lesson?",2, 6, 4, 8, 10, , , , , , 115, 85, 30, 100, false,"Badgey",crew_portraits_cm_badgey_sm.png,badgey_crew
"USS Titan Bradward Boimler",7,4, 873,150,252,0,0,0,683,100,202,325,50,150,0,0,0,0,0,0,717,271,303,874,525,803,965,0,0,441,1032,634,1249,763,0,763,424,332,913,611,928,887,0,0,511,1120,789,1176,727,0,1039,1199,"Federation, Starfleet, Human, Desperate, Resourceful, Pilot","male, organic, low, boimler, crew_max_rarity_4","I Dont Have To Write That Down",2, 9, 8, 8, 8, , , , 1, 2, 475, 265, 360, 425, false,"Boimler",crew_portraits_cm_boimler_uss_titan_sm.png,boimler_uss_titan_crew
"Bat'leth Mariner",1,4, 552,250,451,0,0,0,693,298,600,0,0,0,0,0,0,294,50,152,798,232,729,931,321,644,0,0,818,595,865,212,0,776,1093,247,14,209,438,49,98,0,0,757,109,189,20,0,734,1014,961,70,"Federation, Starfleet, Human, Maverick, Resourceful, Brutal, Scoundrel, Duelist, Playful","female, organic, low, mariner, crew_max_rarity_4","I Demand Honor",0, 7, 8, 6, 10, 1, 1, , , , 425, 365, 170, 425, false,"Mariner",crew_portraits_cm_mariner_batleth_sm.png,mariner_batleth_crew
"Roy Ritterhouse",7,4, 0,0,0,920,101,250,0,0,0,659,80,180,381,47,152,0,0,0,698,0,826,1267,0,685,124,367,388,774,1300,0,482,469,1021,877,0,1013,1274,0,838,283,545,489,934,1318,0,621,624,1015,1004,1299,"Human, Civilian, Artist, Inspiring, Scoundrel","male, organic, ds9, martok, crew_max_rarity_4","Okay, Friends and Neighbours",0, 5, 8, 6, 8, 5, 2, , , , 390, 75, 25, 340, false,"Ritterhouse",crew_portraits_cm_martok_ritterhouse_sm.png,martok_ritterhouse_crew
"Mok'bara Worf",7,5, 0,0,0,516,50,158,1351,155,368,0,0,0,1046,76,276,0,0,0,1101,441,0,744,0,50,812,218,663,258,29,135,519,0,434,1201,647,0,1001,0,209,880,525,736,487,218,386,859,0,729,310,918,"Klingon, Federation, Starfleet, Brutal, Duelist, Athlete, Spiritual","male, nonhuman, organic, tng, worf, crew_max_rarity_5","Defend Yourself",0, 10, 6, 4, 8, , , , , , 375, 200, 300, 425, false,"Worf",crew_portraits_cm_worf_mokbara_sm.png,worf_mokbara_crew
"Admiral Vance",6,5, 1424,151,302,528,53,153,0,0,0,0,0,0,1058,102,249,0,0,0,74,414,197,41,97,1066,794,213,648,0,725,0,507,0,425,303,750,596,321,505,1190,882,532,738,0,1051,0,862,0,730,259,1064,"Federation, Starfleet, Human, Cultural Figure, Inspiring, Brutal, Desperate, Ambassador","male, organic, dsc, vance, crew_max_rarity_5","The Past Is The Only Light With Which We Can See The Future.",2, 10, 8, 10, 12, , , , 1, 2, 500, 215, 252, 740, false,"Vance",crew_portraits_cm_vance_admiral_sm.png,dsc_vance_admiral_crew
"Mok'bara Sito Jaxa",6,4, 0,0,0,0,0,0,953,135,311,318,94,194,668,89,209,0,0,0,0,719,1162,999,0,602,930,888,0,235,188,434,475,732,715,0,775,955,1095,0,671,687,1017,0,212,336,543,410,575,829,933,1004,"Bajoran, Federation, Starfleet, Duelist, Athlete, Pilot, Desperate, Prodigy, Maverick","nonhuman, female, organic, sito, tng, crew_max_rarity_4","It's Not A Fair Test",1, 7, 8, 10, 10, 0, 2, , , , 575, 160, 185, 140, false,"Sito",crew_portraits_cm_sito_jaxa_mokbara_sm.png,sito_jaxa_mokbara_crew
"Orbital Skydiving Torres",6,5, 0,0,0,0,0,0,1316,165,424,1107,107,266,0,0,0,480,100,215,0,442,419,0,931,256,359,0,667,16,432,25,466,25,915,0,573,752,0,802,401,542,0,549,79,605,72,805,89,794,250,599,"Klingon, Human, Maquis, Federation, Starfleet, Desperate, Athlete","evsuit, nonhuman, female, organic, voy, torres, crew_max_rarity_5","Disengage Safety Protocols",1, 8, 8, 10, 8, 0, 1, , , , 490, 100, 125, 200, false,"Torres",crew_portraits_cm_torres_orbital_sm.png,torres_orbital_crew
"Qalankhkai Elnor",6,5, 503,92,240,0,0,0,1010,186,416,0,0,0,1273,262,521,0,0,0,1018,252,967,156,846,445,0,291,0,414,9,290,208,0,174,895,217,851,95,744,373,0,224,0,370,21,264,164,0,161,129,94,"Romulan, Duelist, Qowat Milat, Spiritual, Hero, Desperate","nonhuman, organic, male, pic, elnor, crew_max_rarity_5","I Have Bound Myself",2, 8, 8, 8, 12, 1, 1, , , , 450, 270, 140, 525, false,"Elnor",crew_portraits_cm_elnor_qalankhkai_sm.png,elnor_qalankhkai_crew
"Shroomies",1,4, 0,0,0,841,219,543,508,208,502,308,150,304,0,0,0,0,0,0,562,877,1082,0,0,76,160,611,305,374,1026,628,1146,692,0,201,421,594,0,0,12,15,259,130,20,364,154,628,319,0,806,44,"Brutal, Crafty, Hunter, Innovator, Resourceful, Saboteur, Tactician, Villain","nonhuman, organic, ent, shroomies, crew_max_rarity_4","You Are Defenseless",0, 9, 8, 6, 14, 1, 0, , , , 325, 200, 48, 150, false,"Shroomies",crew_portraits_cm_shroomies_sm.png,shroomies_crew
"Tribbled Koloth and Korax",3,5, 817,279,609,0,0,0,931,302,752,441,142,381,0,0,0,0,0,0,517,105,112,719,344,377,685,0,0,89,574,244,946,538,0,95,1,5,234,51,47,360,0,0,4,97,26,498,227,0,429,12,"Klingon, Duelist, Tribbled, Tactician, Brutal, Desperate, Diplomat","nonhuman, male, organic, tas, koloth, korax, gauntlet_jackpot, exclusive_gauntlet, crew_max_rarity_5","Dont Do That Again!",0, 10, 8, 6, 10, 1, 0, 2, 1, 4, 425, 435, 88, 150, false,"Koloth and Korax",crew_portraits_cm_koloth_korax_tribbled_sm.png,koloth_korax_tribbled_crew
"Captain Robert DeSoto",6,5, 1344,136,370,1063,142,336,0,0,0,0,0,0,661,62,151,0,0,0,13,457,237,151,123,457,352,147,262,0,1069,0,884,0,737,70,665,481,420,394,610,413,332,357,0,1297,0,1162,0,991,94,746,"Human, Federation, Starfleet, Exobiology, Courier, Resourceful","male, organic, tng, desoto, crew_max_rarity_5","This Is Top Priority",2, 9, 6, 8, 12, 5, 0, , , , 450, 230, 35, 250, false,"DeSoto",crew_portraits_cm_desoto_captain_sm.png,desoto_captain_crew
"Professor Data",4,5, 1096,146,269,1325,244,462,0,0,0,0,0,0,0,0,0,560,97,195,9,604,408,674,26,166,175,282,32,0,0,772,0,552,796,36,812,677,896,151,239,202,317,53,0,0,825,0,583,853,101,336,"Android, Starfleet, Federation, Cyberneticist, Casual, Civilian","nonhuman, male, tng, artificial_life, data, crew_max_rarity_5","We Will Get To The Bottom Of This",2, 8, 4, 8, 10, 2, 0, , , , 650, 200, 165, 675, true,"Data",crew_portraits_cm_data_professor_sm.png,data_professor_crew
"Meditative T'Pol",5,4, 0,0,0,405,53,197,0,0,0,0,0,0,654,151,303,827,100,399,1152,0,0,937,541,1149,863,465,163,0,1007,547,812,360,87,1097,0,0,849,438,1065,782,314,143,0,869,448,660,262,93,942,764,"Vulcan, Starfleet, Romantic, Telepath, Counselor, Casual","nonhuman, female, organic, ent, tpol, crew_max_rarity_4","The Risk of Paralysis is Minimal",2, 9, 8, 6, 8, , , , , , 950, 145, 95, 150, false,"T'Pol",crew_portraits_cm_tpol_meditative_sm.png,tpol_meditative_crew
"Enterprise Pike",6,5, 1069,173,311,0,0,0,520,128,258,0,0,0,1362,246,444,0,0,0,453,237,400,21,296,923,0,268,0,850,86,747,186,0,152,592,268,523,67,431,761,0,327,0,719,92,641,254,0,226,28,176,"Starfleet, Federation, Human, Inspiring, Explorer, Tactician","male, organic, snw, pike, crew_max_rarity_5","The Future Is What We Make It",2, 7, 6, 8, 12, 4, 1, , , , 550, 80, 100, 475, false,"Pike",crew_portraits_cm_pike_snw_sm.png,pike_snw_crew
"Lt. Commander Spock",2,5, 1332,248,480,575,103,210,0,0,0,0,0,0,1049,229,422,0,0,0,50,379,177,9,78,903,658,141,532,0,604,0,407,0,344,53,400,181,25,126,916,652,123,550,0,475,0,299,0,257,10,114,"Human, Starfleet, Federation, Vulcan, Telepath, Astrophysicist, Exobiology","male, nonhuman, organic, snw, spock, crew_max_rarity_5","Hypotheticals Are Irrelevant",2, 9, 6, 8, 14, 1, 0, 2, , , 265, 225, 25, 75, false,"Spock",crew_portraits_cm_spock_lt_cmdr_sm.png,spock_lt_cmdr_crew
"Lt. Commander MacDougal",6,4, 369,73,147,0,0,0,689,110,217,913,192,349,0,0,0,0,0,0,1201,582,195,1273,1024,794,439,0,0,98,1028,630,591,270,0,1160,619,160,1223,998,866,347,0,0,127,1073,732,472,214,0,865,879,"Human, Federation, Starfleet, Desperate, Jury Rigger, Resourceful","female, organic, tng, macdougal, crew_max_rarity_4","This Is The Wrong Chip",2, 8, 6, 10, 12, 5, 0, , , , 865, 225, 280, 465, false,"MacDougal",crew_portraits_cm_macdougal_lt_sm.png,macdougal_lt_crew
"Infected Tryla Scott",7,5, 1235,248,550,0,0,0,934,205,437,0,0,0,429,136,304,0,0,0,240,48,215,167,106,486,0,1045,0,447,227,321,1028,0,857,160,26,131,52,91,307,0,769,0,311,90,205,695,0,599,249,50,"Human, Federation, Starfleet, Prodigy, Resourceful, Desperate, Inspiring, Undercover Operative","organic, female, tng, tryla_scott, crew_max_rarity_5","Keep Your Eyes Open",2, 10, 6, 6, 10, , , , , , 400, 205, 120, 300, false,"Tryla",crew_portraits_cm_tryla_scott_infected_sm.png,tryla_scott_infected_crew
"Ruon Tarka",7,5, 592,42,148,1295,192,393,0,0,0,1049,157,257,0,0,0,0,0,0,75,1015,115,1099,807,280,16,358,154,446,0,0,489,211,0,190,1196,327,1282,1059,434,58,488,264,674,0,0,733,388,0,247,758,"Risian, Federation, Civilian, Thief, Desperate, Innovator, Prodigy, Scoundrel, Quantum Mechanics","male, nonhuman, organic, dsc, ruon, crew_max_rarity_5","Let's Get Our Hands Dirty",1, 8, 7, 5, 10, 4, 2, , , , 335, 200, 60, 340, false,"Ruon",crew_portraits_cm_ruon_tarka_sm.png,dsc_ruon_tarka_crew
"Lt. JG Picard",6,4, 0,0,0,914,98,212,0,0,0,605,98,224,408,50,152,0,0,0,719,0,849,1235,0,703,137,366,405,798,1274,0,479,490,993,954,0,872,1267,0,925,256,603,556,824,1311,0,505,510,1007,1025,1272,"Human, Starfleet, Federation, Astrophysicist, Desperate","organic, male, tng, picard, crew_max_rarity_4","I Believe That I Can Do More",2, 7, 8, 3, 8, 1, 0, , , , 690, 170, 200, 450, true,"Picard",crew_portraits_cm_picard_ltjg_sm.png,picard_ltjg_crew
"Willie Hawkins",2,4, 412,67,151,0,0,0,911,191,385,0,0,0,656,145,289,0,0,0,1157,362,1089,616,988,551,0,848,0,509,163,383,816,0,669,1163,341,1113,529,1002,430,0,782,0,405,133,308,709,0,613,810,681,"Human, Civilian, Athlete, Romantic, Casual, Inspiring","nonhuman, male, organic, worf, ds9, crew_max_rarity_4","Suit Yourself",0, 8, 8, 6, 8, , , , , , 325, 170, 98, 315, false,"Worf",crew_portraits_cm_hawkins_sm.png,worf_hawkins_crew
"Surata IV La Forge",5,4, 0,0,0,384,82,179,0,0,0,900,155,343,0,0,0,647,107,252,1163,0,595,0,691,1163,184,1171,255,580,0,651,635,24,723,1069,0,501,0,709,1040,157,1078,222,516,0,701,535,37,724,929,858,"Human, Starfleet, Federation, Cyberneticist, Gambler, Maverick, Exobiology","male, organic, tng, laforge, crew_max_rarity_4","Let's Try Something",1, 6, 4, 8, 12, 6, 0, , , , 240, 200, 175, 300, false,"La Forge",crew_portraits_cm_laforge_surata_sm.png,laforge_surata_crew
"Hollow Data",6,5, 0,0,0,1316,245,451,0,0,0,1047,126,258,578,102,206,0,0,0,217,0,471,1065,0,193,13,76,113,464,1105,0,120,219,771,271,0,733,1069,0,251,38,103,169,720,1115,0,247,427,801,143,369,"Android, Federation, Starfleet, Cyberneticist, Musician, Spiritual, Exobiology","nonhuman, male, artificial_life, data, tng, crew_max_rarity_5","This Is Where I Belong",2, 9, 6, 6, 10, 5, 0, , , , 900, 200, 240, 200, true,"Data",crew_portraits_cm_data_hollow_sm.png,data_hollow_crew
"Temporarily Detained Jett Reno",6,5, 0,0,0,538,108,216,0,0,0,1314,183,406,1027,149,311,0,0,0,969,0,228,716,0,942,63,179,556,274,702,0,24,76,411,925,0,361,834,0,894,86,228,531,383,843,0,49,155,543,220,376,"Starfleet, Federation, Human, Jury Rigger, Resourceful, Veteran, Crafty, Tactician, Prisoner, Displaced","female, organic, dsc, jett_reno, crew_max_rarity_5","I Have Something That Can Help",2, 8, 4, 8, 12, 2, 4, , , , 450, 255, 260, 555, true,"Reno",crew_portraits_cm_dsc_reno_detained_sm.png,dsc_jett_reno_detained_crew
"Brunt, F.C.A.",7,5, 1334,172,347,0,0,0,578,77,196,0,0,0,1073,132,307,0,0,0,268,169,245,42,133,917,0,536,0,841,184,740,465,0,392,518,339,452,196,368,998,0,772,0,911,373,837,699,0,603,175,677,"Ferengi, Civilian, Crafty, Interrogator, Cultural Figure, Constable","nonhuman, male, organic, ds9, brunt, crew_max_rarity_5","Brunt, F.C.A.",1, 7, 4, 8, 14, 4, 1, , , , 300, 75, 50, 225, false,"Brunt",crew_portraits_cm_brunt_fca_sm.png,brunt_fca_crew
"Disorderly Icheb",7,4, 888,80,178,653,48,101,0,0,0,0,0,0,0,0,0,0,0,0,183,826,678,905,552,901,657,951,531,0,0,0,0,0,0,764,1061,1018,1149,905,1280,965,1266,815,0,0,0,0,0,0,1358,1513,"Civilian, Brunali, Federation, Borg, Desperate, Maverick, Engineered, Astrophysicist, Prodigy","male, nonhuman, organic, voy, icheb, crew_max_rarity_4","No, I Wont",0, 7, 10, 10, 10, , , , , , 415, 325, 393, 800, false,"Icheb",crew_portraits_cm_icheb_disorderly_sm.png,icheb_disorderly_crew
"Ryn",3,5, 0,0,0,0,0,0,584,69,170,1332,254,452,1042,150,302,0,0,0,0,997,184,704,0,930,171,557,0,60,196,749,18,42,404,0,1110,206,855,0,1083,187,736,0,84,416,895,23,74,564,107,333,"Andorian, Civilian, Communicator, Inspiring, Hero, Desperate, Prisoner, Survivalist","male, organic, nonhuman, dsc, ryn, crew_max_rarity_5","Who's Ready To Get Out Of Here?",2, 9, 5, 8, 8, , , , , , 575, 300, 160, 625, false,"Ryn",crew_portraits_cm_ryn_sm.png,dsc_ryn_crew
"Paul Mayweather",8,4, 814,197,350,0,0,0,0,0,0,639,153,299,342,51,146,0,0,0,706,791,114,551,520,0,573,1244,0,733,1333,0,455,428,1063,478,613,46,395,333,0,440,1202,0,596,1323,0,284,323,1021,984,724,"Human, Civilian, Courier, Desperate, Resourceful, Jury Rigger","male, organic, ent, paul, crew_max_rarity_4","You Do Remember How To Fly This Ship?",1, 9, 4, 8, 7, , , , 2, 2, 325, 170, 155, 300, false,"Paul",crew_portraits_cm_mayweather_paul_sm.png,mayweather_paul_crew
"Barge of the Dead Torres",4,5, 0,0,0,0,0,0,1350,217,398,1069,154,304,588,99,203,0,0,0,0,404,416,1057,0,189,355,938,0,13,89,104,93,199,762,0,532,579,1086,0,347,424,1009,0,38,181,241,181,301,820,54,363,"Klingon, Human, Federation, Starfleet, Survivalist, Spiritual, Desperate","nonhuman, female, organic, voy, torres, crew_max_rarity_5","This Should Be Interesting",2, 10, 6, 8, 12, 1, 0, 2, 1, 3, 325, 200, 141, 175, false,"Torres",crew_portraits_cm_torres_bargeofdead_sm.png,torres_bargeofdead_crew
"Civilian Exchange Chapel",8,5, 0,0,0,538,50,102,0,0,0,1010,173,327,0,0,0,1319,233,393,1108,0,452,0,136,1081,128,1102,46,444,0,169,487,3,233,1283,0,497,0,248,1276,239,1265,122,512,0,257,527,10,302,332,619,"Federation, Human, Civilian, Resourceful, Nurse, Geneticist","female, organic, snw, chapel, crew_max_rarity_5","Maybe I Wasn't Clear",2, 10, 5, 5, 8, , , , 0, 3, 300, 150, 230, 365, false,"Chapel",crew_portraits_cm_chapel_civilian_exchange_sm.png,chapel_civilian_exchange_crew
"O'Brien at the Conn",4,4, 890,109,303,0,0,0,0,0,0,331,76,155,676,99,200,0,0,0,701,786,279,289,514,0,948,881,0,1089,1039,0,481,746,706,748,813,268,432,589,0,811,1014,0,991,1132,0,499,675,826,1005,1157,"Human, Federation, Starfleet, Resourceful, Pilot, Tactician, Veteran","male, tng, obrien, organic, crew_max_rarity_4","All Forward Motion Stopped, Sir",2, 8, 8, 12, 12, 5, 0, , , , 415, 225, 73, 225, false,"O'Brien",crew_portraits_cm_obrien_conn_sm.png,obrien_conn_crew
"Doctor M'Benga",9,5, 1056,87,280,523,86,188,0,0,0,0,0,0,0,0,0,1323,161,298,139,639,470,730,4,998,735,1022,49,0,0,218,0,119,296,328,884,764,960,82,1008,722,1054,154,0,0,544,0,346,565,417,903,"Human, Starfleet, Federation, Physician, Caregiver, Desperate, Jury Rigger","male, organic, snw, mbenga, crew_max_rarity_5","Somewhere Out There is the Discovery I Need",2, 6, 8, 6, 10, 6, 0, , , , 325, 400, 243, 415, false,"M'Benga",crew_portraits_cm_mbenga_doctor_sm.png,mbenga_doctor_crew
"Pirate Tendi",6,4, 390,52,187,0,0,0,685,113,203,0,0,0,0,0,0,939,147,309,1166,570,1095,1236,104,796,0,0,368,740,1030,42,0,323,538,1109,607,1064,1183,164,895,0,0,400,838,1093,129,0,351,574,901,1073,"Orion, Federation, Starfleet, Costumed, Criminal","female, organic, nonhuman, low, tendi, crew_max_rarity_4","Nice Shot Da Vinci!",0, 7, 8, 6, 10, 8, 4, , , , 415, 120, 267, 450, false,"Tendi",crew_portraits_cm_tendi_pirate_sm.png,tendi_pirate_crew
"Chief Engineer Hemmer",8,4, 679,71,154,401,52,102,0,0,0,906,123,204,0,0,0,0,0,0,502,922,133,1020,703,1219,260,1204,759,646,0,0,713,345,0,808,1129,409,1212,984,1274,398,1262,811,805,0,0,891,496,0,1031,1365,"Aenar, Andorian, Starfleet, Federation, Telepath, Resourceful","male, nonhuman, organic, snw, hemmer, crew_max_rarity_4","Pacifism Is Not Passivity",1, 5, 10, 12, 19, 2, 0, , , , 615, 200, 250, 625, false,"Hemmer",crew_portraits_cm_hemmer_chief_sm.png,hemmer_chief_crew
"First Officer Una",6,5, 1288,250,399,0,0,0,0,0,0,522,99,175,1051,202,300,0,0,0,252,447,56,36,115,0,738,533,0,922,669,0,123,588,385,309,470,63,77,186,0,712,620,0,907,746,0,168,591,456,209,288,"Federation, Starfleet, Human, Resourceful, Explorer, Inspiring, Pilot, Engineered, Illyrian","female, nonhuman, organic, snw, number_one, crew_max_rarity_5","Can You Not Jinx It?",2, 10, 6, 6, 10, 1, 0, 3, , , 465, 200, 222, 215, false,"Una",crew_portraits_cm_una_firstofficer_sm.png,number_one_una_firstofficer_crew
"Puppy-Placated Janeway",7,5, 0,0,0,0,0,0,0,0,0,503,74,176,1116,110,237,1311,111,435,0,0,1029,680,181,0,804,537,178,960,681,202,135,19,15,0,0,1039,1017,362,0,768,932,297,949,1057,373,387,50,113,323,829,"Starfleet, Federation, Human, Resourceful, Gambler, Counselor","female, organic, voy, janeway, crew_max_rarity_5","I'm Not Buying It",1, 9, 6, 10, 10, 3, 0, 3, , , 500, 115, 110, 457, false,"Janeway",crew_portraits_cm_janeway_puppy_sm.png,janeway_puppy_crew
"Outpost Vina",7,4, 0,0,0,449,61,167,666,76,192,0,0,0,973,77,196,0,0,0,1145,909,0,846,0,406,852,280,712,762,221,648,675,0,552,1156,1048,0,1126,0,564,831,626,694,919,687,844,1021,0,869,906,1332,"Human, Civilian, Desperate, Prisoner, Romantic","female, organic, tos, vina, crew_max_rarity_4","A Prime Specimen",2, 9, 4, 10, 10, , , , , , 455, 280, 130, 275, false,"Vina",crew_portraits_cm_vina_outpost_sm.png,vina_outpost_crew
"Frantic McCoy",1,5, 906,243,651,0,0,0,0,0,0,0,0,0,1015,364,777,356,154,455,412,573,365,35,28,0,0,374,640,0,490,849,292,623,62,94,242,75,1,2,0,0,33,235,0,72,286,30,157,3,232,6,"Human, Federation, Starfleet, Physician, Exobiology, Resourceful, Desperate, Maverick","male, organic, tos, mccoy, exclusive_bridge, crew_max_rarity_5","Spock, Do Something!",0, 7, 8, 10, 10, 0, 1, , , , 800, 270, 532, 500, false,"McCoy",crew_portraits_cm_mccoy_frantic_sm.png,mccoy_frantic_crew
"Demo Man Scotty",6,5, 0,0,0,0,0,0,0,0,0,1647,100,365,0,0,0,0,0,0,0,0,130,0,0,0,127,0,0,130,0,0,140,26,0,0,0,558,0,0,0,411,0,0,565,0,0,589,290,0,1307,1479,"Federation, Starfleet, Human, Resourceful, Jury Rigger","male, organic, tos, scott, exclusive_bridge, crew_max_rarity_5","Once It's Activated, There's No Way To Stop It",0, 10, 6, 10, 12, 5, 0, , , , 790, 575, 240, 640, false,"Scotty",crew_portraits_cm_scott_demo_man_sm.png,scott_demo_man_crew
"Lt. Commander Ortegas",7,4, 830,230,456,0,0,0,579,102,184,0,0,0,393,92,149,0,0,0,629,279,573,446,447,911,0,1170,0,835,726,734,1154,0,989,258,188,222,214,160,978,0,1113,0,897,708,820,1093,0,934,967,705,"Human, Federation, Starfleet, Pilot, Resourceful, Maverick","female, organic, snw, bridge_crew, ortegas, crew_max_rarity_4","Evasive Maneuvers",1, 8, 10, 10, 15, 0, 1, , , , 1030, 275, 198, 630, false,"Ortegas",crew_portraits_cm_ortegas_lt_sm.png,ortegas_lt_crew
"Vedala Elder",3,5, 1325,235,502,0,0,0,0,0,0,0,0,0,544,148,294,1061,208,405,204,381,180,138,1,0,0,916,246,0,1075,284,890,182,70,204,388,173,64,5,0,0,764,231,0,906,281,689,153,61,13,75,"Vedala, Ambassador, Diplomat, Cultural Figure, Resourceful, Tactician","nonhuman, female, organic, tas, vedala_elder, crew_max_rarity_5","We Give You Thanks",2, 9, 6, 10, 10, 3, 0, 3, , , 325, 205, 110, 280, false,"Vedala",crew_portraits_cm_vedala_elder_sm.png,vedala_elder_crew
"Bionic 5 Rutherford",8,5, 0,0,0,0,0,0,579,73,139,1000,126,365,1250,145,350,0,0,0,0,1013,465,565,0,960,380,427,0,124,140,768,38,216,303,0,1158,512,751,0,1152,384,635,0,238,384,954,66,253,470,370,737,"Human, Engineered, Starfleet, Federation, Criminal, Costumed","male, organic, low, rutherford, crew_max_rarity_5","Tremble At The Sight Of The Great Vindicta!",0, 8, 10, 10, 16, 8, 4, , , , 375, 300, 60, 175, false,"Rutherford",crew_portraits_cm_rutherford_pirate_sm.png,rutherford_pirate_crew
"Commander Ransom",8,5, 1313,354,502,0,0,0,1060,149,285,0,0,0,446,47,99,0,0,0,186,11,157,169,56,475,0,1167,0,432,277,309,1150,0,982,117,54,92,163,65,699,0,1270,0,647,626,569,1252,0,1083,239,267,"Human, Starfleet, Federation, Duelist, Brutal, Hero","male, organic, low, ransom, crew_max_rarity_5","Here We Go, Showtime",0, 7, 15, 8, 5, 4, 0, , , , 765, 125, 320, 1475, false,"Ransom",crew_portraits_cm_ransom_commander_sm.png,ransom_commander_crew
"Lt. JG Kayshon",9,5, 1067,137,301,0,0,0,1342,165,348,0,0,0,507,68,139,0,0,0,486,44,426,296,317,265,0,1111,0,275,130,151,1093,0,922,697,202,633,531,543,529,0,1180,0,503,353,400,1172,0,1000,277,783,"Tamarian, Federation, Communicator, Starfleet, Resourceful","nonhuman, male, organic, kayshon, low, crew_max_rarity_5","Bazminti When He Pulled Back The Veil Vibes",0, 10, 7, 6, 11, , , , , , 300, 140, 93, 90, false,"Kayshon",crew_portraits_cm_kayshon_ltjg_sm.png,kayshon_ltjg_crew
"Corrupted Badgey",5,5, 1080,150,303,0,0,0,1349,239,451,0,0,0,0,0,0,511,105,208,462,16,404,671,29,150,0,0,617,180,348,15,0,607,852,662,96,597,820,111,240,0,0,557,252,405,39,0,546,802,116,256,"Hologram, Federation, Starfleet, Communicator, Duelist, Brutal, Saboteur, Playful","male, nonhuman, artificial_life, low, badgey, crew_max_rarity_5","Can I Teach You A Lesson?",1, 9, 10, 6, 8, 1, 0, 2, , , 600, 500, 200, 680, false,"Badgey",crew_portraits_cm_badgey_corrupted_sm.png,badgey_corrupted_crew
"Ensign Rutherford",5,2, 0,0,0,262,21,83,0,0,0,377,55,145,153,22,67,0,0,0,1306,0,1133,1386,0,1310,620,1172,826,1070,1400,0,972,719,1140,1316,0,1149,1379,0,1317,659,1211,838,1062,1399,0,987,728,1128,1498,1520,"Human, Engineered, Starfleet, Federation, Resourceful, Romantic","male, organic, low, rutherford, crew_max_rarity_2","Okeydokey!",2, 2, 5, 3, 8, 2, 0, , , , 205, 270, 60, 90, false,"Rutherford",crew_portraits_cm_rutherford_ensign_sm.png,rutherford_ensign_crew
"EV Suit Rutherford",5,4, 375,46,146,689,102,197,0,0,0,891,194,366,0,0,0,0,0,0,456,1180,211,1282,1037,802,107,869,472,560,0,0,612,289,0,594,1193,162,1278,1057,955,110,1021,573,427,0,0,438,193,0,913,958,"Human, Engineered, Starfleet, Federation, Romantic, Resourceful","male, organic, low, rutherford, evsuit, apr2023, crew_max_rarity_4","Run Training Beta 2.5",2, 7, 8, 8, 8, 3, 0, 2, , , 550, 75, 215, 450, false,"Rutherford",crew_portraits_cm_rutherford_ev_sm.png,rutherford_ev_crew
"Insubordinate Mariner",7,5, 1044,171,283,0,0,0,0,0,0,566,79,184,1328,165,351,0,0,0,505,623,105,52,328,0,686,353,0,865,468,0,67,539,227,661,747,192,194,501,0,728,593,0,925,726,0,163,616,440,223,667,"Federation, Starfleet, Human, Desperate, Maverick, Smuggler, Scoundrel, Playful","female, organic, low, mariner, crew_max_rarity_5","Come On Check It Out",0, 9, 4, 8, 10, , , , 1, 2, 575, 165, 210, 675, false,"Mariner",crew_portraits_cm_insubordinate_mariner_sm.png,insubordinate_mariner_crew
"Cabaret Georgiou",6,5, 1360,177,454,0,0,0,1052,130,319,0,0,0,493,70,168,0,0,0,210,33,188,164,90,476,0,1110,0,433,231,310,1092,0,920,332,122,282,258,207,656,0,1118,0,628,418,527,1102,0,938,215,472,"Terran Empire, Mirror Universe, Human, Brutal, Desperate, Royalty, Bartender","female, organic, dsc, georgiou, crew_max_rarity_5","Ill Ask Again--What Do You Want?",0, 8, 10, 5, 8, 6, 0, , , , 300, 135, 277, 725, false,"Georgiou",crew_portraits_cm_georgiou_cabaret_sm.png,dsc_georgiou_cabaret_crew
"Data and Spot",7,5, 0,0,0,1065,100,250,0,0,0,1328,171,371,538,54,152,0,0,0,526,0,236,1149,0,493,17,203,287,281,1181,0,70,81,859,878,0,418,1259,0,839,95,535,490,458,1307,0,197,209,1001,290,884,"Android, Starfleet, Federation, Cyberneticist, Caregiver, Writer","nonhuman, male, tng, artificial_life, data, exclusive_collection, crew_max_rarity_5","Oh, Spot, The Complex Levels of Behavior You Display!",2, 10, 8, 8, 12, , , , 1, 2, 650, 200, 165, 675, false,"Data",crew_portraits_cm_data_spot_sm.png,data_spot_crew
